kind,etag,id,snippet,replies,authorChannelId,publishedAt,textOriginal,nextPageToken,extraction_date
youtube#commentThread,RAMdsl__2r9goh0C04kowE_ljGg,UgzAc3gf32juFvaTk7R4AaABAg,"{'videoId': 'P-4EgU_-ffU', 'topLevelComment': {'kind': 'youtube#comment', 'etag': 'qfCauYZkalyMQz78gqMEKhNi32o', 'id': 'UgzAc3gf32juFvaTk7R4AaABAg', 'snippet': {'videoId': 'P-4EgU_-ffU', 'textDisplay': 'Se Bolsonaro ganhar Lula some e acaba a polarização. Aí vem Zema candidato, alguma poste do Mito, algum do PT e  algum do centro esquerda falando que o PT não é capaz de derrotar o Bolsonarismo, por isso eu voto 22.', 'textOriginal': 'Se Bolsonaro ganhar Lula some e acaba a polarização. Aí vem Zema candidato, alguma poste do Mito, algum do PT e  algum do centro esquerda falando que o PT não é capaz de derrotar o Bolsonarismo, por isso eu voto 22.', 'authorDisplayName': 'Cleiton Santos', 'authorProfileImageUrl': 'https://yt3.ggpht.com/ytc/AGIKgqPPnTDI5wa5lX7PIaA_pk3giJp6bkOijWm3vw=s48-c-k-c0x00ffffff-no-rj', 'authorChannelUrl': 'http://www.youtube.com/channel/UCTgoNXw1dqDn8q8mc1sKWCQ', 'authorChannelId': {'value': 'UCTgoNXw1dqDn8q8mc1sKWCQ'}, 'canRate': True, 'viewerRating': 'none', 'likeCount': 3, 'publishedAt': '2022-10-19T02:44:07Z', 'updatedAt': '2022-10-19T02:44:07Z'}}, 'canReply': True, 'totalReplyCount': 9, 'isPublic': True}","{'comments': [{'kind': 'youtube#comment', 'etag': 'VriRBAFU-q_0dZfJW-6Re5ggGno', 'id': 'UgzAc3gf32juFvaTk7R4AaABAg.9hLl9q0P4cm9hM3M51YFIo', 'snippet': {'videoId': 'P-4EgU_-ffU', 'textDisplay': '@Fellzin. tá bom cara valeu! 👍', 'textOriginal': '@Fellzin. tá bom cara valeu! 👍', 'parentId': 'UgzAc3gf32juFvaTk7R4AaABAg', 'authorDisplayName': 'Pablo Padrinho', 'authorProfileImageUrl': 'https://yt3.ggpht.com/ytc/AGIKgqNlR7sNisUqJqsJxt7vnURnWvTUhfg97NE6NA=s48-c-k-c0x00ffffff-no-rj', 'authorChannelUrl': 'http://www.youtube.com/channel/UCXwPn5WkgcNLJ-AzfKwu-pQ', 'authorChannelId': {'value': 'UCXwPn5WkgcNLJ-AzfKwu-pQ'}, 'canRate': True, 'viewerRating': 'none', 'likeCount': 0, 'publishedAt': '2022-10-19T05:31:49Z', 'updatedAt': '2022-10-19T05:31:49Z'}}, {'kind': 'youtube#comment', 'etag': 'zeSrRLj_XkAVULj3lsDpcReHVGM', 'id': 'UgzAc3gf32juFvaTk7R4AaABAg.9hLl9q0P4cm9hM3-H_i8c3', 'snippet': {'videoId': 'P-4EgU_-ffU', 'textDisplay': '@Pablo Padrinho meu sonho realizado? Não é meu sonho ver o Mbl no poder meu sonho é ver o país menos fodido o que não é alcançado com bolsonaro ou lula diferente de você que tá dizendo que Bolsonaro é menos pior e argumenta que o nordeste tá mal e tá assim por causa de gente que nem Lula e Bolsonaro 🤷🏾\\u200d♂️ como eu disse antes os pedidos para criação de núcleos do mbl em certos estados vieram de pessoas desses estados mesmo sendo a exceção existe quem se importe nesses estados se o discurso tiver aderência lá ou não ai é outra história até pq como eu disse também antes o mbl tem mais chance de realmente resolver algo que o bolsonaro que prometeu e traiu tudo', 'textOriginal': '@Pablo Padrinho meu sonho realizado? Não é meu sonho ver o Mbl no poder meu sonho é ver o país menos fodido o que não é alcançado com bolsonaro ou lula diferente de você que tá dizendo que Bolsonaro é menos pior e argumenta que o nordeste tá mal e tá assim por causa de gente que nem Lula e Bolsonaro 🤷🏾\\u200d♂️ como eu disse antes os pedidos para criação de núcleos do mbl em certos estados vieram de pessoas desses estados mesmo sendo a exceção existe quem se importe nesses estados se o discurso tiver aderência lá ou não ai é outra história até pq como eu disse também antes o mbl tem mais chance de realmente resolver algo que o bolsonaro que prometeu e traiu tudo', 'parentId': 'UgzAc3gf32juFvaTk7R4AaABAg', 'authorDisplayName': 'Fellzin.', 'authorProfileImageUrl': 'https://yt3.ggpht.com/b_vH3A0JYkOervyln74W68vckl9RHQ2npNVAuNLavHcaN8YWaK_yneiis3hB9suBb3X7PU4z=s48-c-k-c0x00ffffff-no-rj', 'authorChannelUrl': 'http://www.youtube.com/channel/UCRl4IADfI01aiC3JP5kLuRQ', 'authorChannelId': {'value': 'UCRl4IADfI01aiC3JP5kLuRQ'}, 'canRate': True, 'viewerRating': 'none', 'likeCount': 0, 'publishedAt': '2022-10-19T05:28:42Z', 'updatedAt': '2022-10-19T05:29:27Z'}}, {'kind': 'youtube#comment', 'etag': 'RTi0AuGsbNAL5LgfBRRWylpAd0g', 'id': 'UgzAc3gf32juFvaTk7R4AaABAg.9hLl9q0P4cm9hM22vRjwP1', 'snippet': {'videoId': 'P-4EgU_-ffU', 'textDisplay': '@Fellzin. em 2026 eu quero muito ver esse teu sonho ser realizado vendo o MBL com Danilo Gentile indo em Santana do Agreste em um sol de 50 graus de sapatenis indo conversar com os moradores desses locais que só tomam água por causa de um caminhão pipa se não morrem de sede. Tomara que dê certo cara se der Show de bola vou ficar na torcida! 👍', 'textOriginal': '@Fellzin. em 2026 eu quero muito ver esse teu sonho ser realizado vendo o MBL com Danilo Gentile indo em Santana do Agreste em um sol de 50 graus de sapatenis indo conversar com os moradores desses locais que só tomam água por causa de um caminhão pipa se não morrem de sede. Tomara que dê certo cara se der Show de bola vou ficar na torcida! 👍', 'parentId': 'UgzAc3gf32juFvaTk7R4AaABAg', 'authorDisplayName': 'Pablo Padrinho', 'authorProfileImageUrl': 'https://yt3.ggpht.com/ytc/AGIKgqNlR7sNisUqJqsJxt7vnURnWvTUhfg97NE6NA=s48-c-k-c0x00ffffff-no-rj', 'authorChannelUrl': 'http://www.youtube.com/channel/UCXwPn5WkgcNLJ-AzfKwu-pQ', 'authorChannelId': {'value': 'UCXwPn5WkgcNLJ-AzfKwu-pQ'}, 'canRate': True, 'viewerRating': 'none', 'likeCount': 0, 'publishedAt': '2022-10-19T05:20:27Z', 'updatedAt': '2022-10-19T05:20:27Z'}}, {'kind': 'youtube#comment', 'etag': 'SUex2F8E7U87zTcUPTaOnXz4oAU', 'id': 'UgzAc3gf32juFvaTk7R4AaABAg.9hLl9q0P4cm9hM0xwZM2LK', 'snippet': {'videoId': 'P-4EgU_-ffU', 'textDisplay': '@Pablo Padrinho e por isso o Bolsonaro é válido? Cara que fudeu a economia? Plantou a porra de uma bomba fiscal no país? E tu acha ele menos pior? Lula fez exatamente isso e entregou nas mãos da Dilma e vimos a merda quer dizer que ele é menos pior? São idênticos em nível de estrago com o Brasil. O liberalismo não é nem mais o foco principal do Mbl o foco é ter um PROJETO FUNCIONAL de Brasil para apresentar e tentar botar em prática, se você acha que o bolsonaro é uma opção boa sinceramente caia na realidade é mais fácil o Mbl chegar ao poder e talvez fazer algo bom do que o bolsonaro que ficou no poder em 4 anos e desfez o combate a corrupção, aparelhou a pf e ainda plantou uma bomba econômica no país 🤷🏾\\u200d♂️ sonhe que o bolsonaro é uma boa opção, para mim nunca será<br>Aliás tem bastante gente que acompanha o Mbl do nordeste e pede a criação de um núcleo do mbl lá 🤔 ué, por isso o Renan e o Arthur vão lá criar um núcleo para o Mbl já ter força por lá quando precisarem na eleição por exemplo  é um PROJETO que já existe então não é impossível só importar ele para outros estados como tu tá dizendo lol, o bolsonaro não conseguiu vencer lá pq fez populismo com sem um boom das commodities como o Lula teve a sorte de poder fazer mas tu diz que o bolsonaro é melhor opção quando ele fez reviveu a porra do PT', 'textOriginal': '@Pablo Padrinho e por isso o Bolsonaro é válido? Cara que fudeu a economia? Plantou a porra de uma bomba fiscal no país? E tu acha ele menos pior? Lula fez exatamente isso e entregou nas mãos da Dilma e vimos a merda quer dizer que ele é menos pior? São idênticos em nível de estrago com o Brasil. O liberalismo não é nem mais o foco principal do Mbl o foco é ter um PROJETO FUNCIONAL de Brasil para apresentar e tentar botar em prática, se você acha que o bolsonaro é uma opção boa sinceramente caia na realidade é mais fácil o Mbl chegar ao poder e talvez fazer algo bom do que o bolsonaro que ficou no poder em 4 anos e desfez o combate a corrupção, aparelhou a pf e ainda plantou uma bomba econômica no país 🤷🏾\\u200d♂️ sonhe que o bolsonaro é uma boa opção, para mim nunca será\\nAliás tem bastante gente que acompanha o Mbl do nordeste e pede a criação de um núcleo do mbl lá 🤔 ué, por isso o Renan e o Arthur vão lá criar um núcleo para o Mbl já ter força por lá quando precisarem na eleição por exemplo  é um PROJETO que já existe então não é impossível só importar ele para outros estados como tu tá dizendo lol, o bolsonaro não conseguiu vencer lá pq fez populismo com sem um boom das commodities como o Lula teve a sorte de poder fazer mas tu diz que o bolsonaro é melhor opção quando ele fez reviveu a porra do PT', 'parentId': 'UgzAc3gf32juFvaTk7R4AaABAg', 'authorDisplayName': 'Fellzin.', 'authorProfileImageUrl': 'https://yt3.ggpht.com/b_vH3A0JYkOervyln74W68vckl9RHQ2npNVAuNLavHcaN8YWaK_yneiis3hB9suBb3X7PU4z=s48-c-k-c0x00ffffff-no-rj', 'authorChannelUrl': 'http://www.youtube.com/channel/UCRl4IADfI01aiC3JP5kLuRQ', 'authorChannelId': {'value': 'UCRl4IADfI01aiC3JP5kLuRQ'}, 'canRate': True, 'viewerRating': 'none', 'likeCount': 0, 'publishedAt': '2022-10-19T05:10:54Z', 'updatedAt': '2022-10-19T05:22:39Z'}}, {'kind': 'youtube#comment', 'etag': 'YrMnbB0pUJyvlp2Zw4Ja7YG6PK4', 'id': 'UgzAc3gf32juFvaTk7R4AaABAg.9hLl9q0P4cm9hM00d4OJAo', 'snippet': {'videoId': 'P-4EgU_-ffU', 'textDisplay': '@Fellzin. Se você enxerga a realidade você deveria saber que o projeto como esse não tem chance alguma em um país como o Brasil. Você acha que Danilo Gentile tem alguma chance em 2026!? Nem em 2050 cara O Bolsonaro sendo tão populista como o Lula foi massacrado no Nordeste metendo 600 reais no bolso daquela gente imagina essa galera do MBL Mamãe falei Renan e Danilo Gentile entrando no sertão nordestino aonde as pessoas não tem nem o que comer indo falar em liberalismo! Ou você acha que em uma eleição nacional tem alguma chance de alguém ganhar sem o Nordeste!? Sem eles não dá não amigão podem por Jesus Cristo de candidato que eles vão votar no Lula e se não for no Lula vai ser em qualquer poste que ele colocar do PT no lugar.', 'textOriginal': '@Fellzin. Se você enxerga a realidade você deveria saber que o projeto como esse não tem chance alguma em um país como o Brasil. Você acha que Danilo Gentile tem alguma chance em 2026!? Nem em 2050 cara O Bolsonaro sendo tão populista como o Lula foi massacrado no Nordeste metendo 600 reais no bolso daquela gente imagina essa galera do MBL Mamãe falei Renan e Danilo Gentile entrando no sertão nordestino aonde as pessoas não tem nem o que comer indo falar em liberalismo! Ou você acha que em uma eleição nacional tem alguma chance de alguém ganhar sem o Nordeste!? Sem eles não dá não amigão podem por Jesus Cristo de candidato que eles vão votar no Lula e se não for no Lula vai ser em qualquer poste que ele colocar do PT no lugar.', 'parentId': 'UgzAc3gf32juFvaTk7R4AaABAg', 'authorDisplayName': 'Pablo Padrinho', 'authorProfileImageUrl': 'https://yt3.ggpht.com/ytc/AGIKgqNlR7sNisUqJqsJxt7vnURnWvTUhfg97NE6NA=s48-c-k-c0x00ffffff-no-rj', 'authorChannelUrl': 'http://www.youtube.com/channel/UCXwPn5WkgcNLJ-AzfKwu-pQ', 'authorChannelId': {'value': 'UCXwPn5WkgcNLJ-AzfKwu-pQ'}, 'canRate': True, 'viewerRating': 'none', 'likeCount': 0, 'publishedAt': '2022-10-19T05:02:40Z', 'updatedAt': '2022-10-19T05:02:40Z'}}]}",UCTgoNXw1dqDn8q8mc1sKWCQ,2022-10-19T02:44:07Z,"Se Bolsonaro ganhar Lula some e acaba a polarização. Aí vem Zema candidato, alguma poste do Mito, algum do PT e  algum do centro esquerda falando que o PT não é capaz de derrotar o Bolsonarismo, por isso eu voto 22.",,2023-06-09 04:21:01.321226
youtube#commentThread,OO9l9_JaDBoxDsvfmzC2l2GHaj0,UgzecAFUS817UuXJ6yt4AaABAg,"{'videoId': 'P-4EgU_-ffU', 'topLevelComment': {'kind': 'youtube#comment', 'etag': 'wAUVad_EHs-xLNErDTWoPoaR0nE', 'id': 'UgzecAFUS817UuXJ6yt4AaABAg', 'snippet': {'videoId': 'P-4EgU_-ffU', 'textDisplay': 'top', 'textOriginal': 'top', 'authorDisplayName': 'murilo gomes', 'authorProfileImageUrl': 'https://yt3.ggpht.com/ytc/AGIKgqPuCSXjxWXn_VTs3GkOH2BhZztwJuiSHuAW-w=s48-c-k-c0x00ffffff-no-rj', 'authorChannelUrl': 'http://www.youtube.com/channel/UCei3qB45Tn3GPWpeCcoMmsg', 'authorChannelId': {'value': 'UCei3qB45Tn3GPWpeCcoMmsg'}, 'canRate': True, 'viewerRating': 'none', 'likeCount': 0, 'publishedAt': '2022-10-19T02:37:26Z', 'updatedAt': '2022-10-19T02:37:26Z'}}, 'canReply': True, 'totalReplyCount': 0, 'isPublic': True}",,UCei3qB45Tn3GPWpeCcoMmsg,2022-10-19T02:37:26Z,top,,2023-06-09 04:21:01.321226
youtube#commentThread,nxfZuRKdhHAIZ4insXBk3x2VftI,UgxRjBlM_iL1NrU9IRB4AaABAg,"{'videoId': 'P-4EgU_-ffU', 'topLevelComment': {'kind': 'youtube#comment', 'etag': 'GcA16pzAh4EVZtNTaCG0t_hw68A', 'id': 'UgxRjBlM_iL1NrU9IRB4AaABAg', 'snippet': {'videoId': 'P-4EgU_-ffU', 'textDisplay': 'Vcs acreditam q Moro quer assumir a direita q vai ficar órfã com a perda de eleição de Bolsonaro. o bolsonarista vai ficar órfã e esse apoio dele seria para um interesse no futuro para 2026 como presidente e abraçando esse bolsonarista q vai ficar órfã. pois ele tem cargo de segurança como senador pode concorrer em 2 pleito importante 2024 prefeito SP ou PR ou até msm 2026 presidente Governador SP ou PR tbm se ele perder esses pleito ele ainda tem o cargo de senador.', 'textOriginal': 'Vcs acreditam q Moro quer assumir a direita q vai ficar órfã com a perda de eleição de Bolsonaro. o bolsonarista vai ficar órfã e esse apoio dele seria para um interesse no futuro para 2026 como presidente e abraçando esse bolsonarista q vai ficar órfã. pois ele tem cargo de segurança como senador pode concorrer em 2 pleito importante 2024 prefeito SP ou PR ou até msm 2026 presidente Governador SP ou PR tbm se ele perder esses pleito ele ainda tem o cargo de senador.', 'authorDisplayName': 'SHARLES FLA', 'authorProfileImageUrl': 'https://yt3.ggpht.com/ytc/AGIKgqO9KOEJMBWjdzARxWAa527oIPvL4toriTlr9joXFcM=s48-c-k-c0x00ffffff-no-rj', 'authorChannelUrl': 'http://www.youtube.com/channel/UCwq2PT6doEsaYUaau29XW5A', 'authorChannelId': {'value': 'UCwq2PT6doEsaYUaau29XW5A'}, 'canRate': True, 'viewerRating': 'none', 'likeCount': 0, 'publishedAt': '2022-10-19T02:32:36Z', 'updatedAt': '2022-10-19T02:32:36Z'}}, 'canReply': True, 'totalReplyCount': 3, 'isPublic': True}","{'comments': [{'kind': 'youtube#comment', 'etag': '6Js95Q-sMx0YtQO5EWyHXpsoN0s', 'id': 'UgxRjBlM_iL1NrU9IRB4AaABAg.9hLjqSTVtyG9hMWGtj9t0x', 'snippet': {'videoId': 'P-4EgU_-ffU', 'textDisplay': '@Cleiton Santos Infelizmente amigo eu acredito q Bolsonaro e seus familiares vão está preso ou com várias investigação em andamento explodindo na mídia .Então alguém vai ter q herda esse vazio do bolsonarista Acredito q esse e o PLANO de Moro.', 'textOriginal': '@Cleiton Santos Infelizmente amigo eu acredito q Bolsonaro e seus familiares vão está preso ou com várias investigação em andamento explodindo na mídia .Então alguém vai ter q herda esse vazio do bolsonarista Acredito q esse e o PLANO de Moro.', 'parentId': 'UgxRjBlM_iL1NrU9IRB4AaABAg', 'authorDisplayName': 'SHARLES FLA', 'authorProfileImageUrl': 'https://yt3.ggpht.com/ytc/AGIKgqO9KOEJMBWjdzARxWAa527oIPvL4toriTlr9joXFcM=s48-c-k-c0x00ffffff-no-rj', 'authorChannelUrl': 'http://www.youtube.com/channel/UCwq2PT6doEsaYUaau29XW5A', 'authorChannelId': {'value': 'UCwq2PT6doEsaYUaau29XW5A'}, 'canRate': True, 'viewerRating': 'none', 'likeCount': 0, 'publishedAt': '2022-10-19T09:44:31Z', 'updatedAt': '2022-10-19T09:44:31Z'}}, {'kind': 'youtube#comment', 'etag': 'wEKy2nKis-D2fL6PNLpg-JlJYWM', 'id': 'UgxRjBlM_iL1NrU9IRB4AaABAg.9hLjqSTVtyG9hME3V8gEos', 'snippet': {'videoId': 'P-4EgU_-ffU', 'textDisplay': 'Se o Bolsonaro perder, a esquerda não sai mais do poder. Não importa quem vai herdar o lugar vazio do Bolsonaro, pois ele muito dificilmente terá espaço. Já existe uma perseguição aos canais de direita com Bolsonaro na presidência, imagina com o Lula lá. Eles vão classificar tudo como fake news e usar isto para fechar, intimidar, os canais que não são aliados ideologicamente.', 'textOriginal': 'Se o Bolsonaro perder, a esquerda não sai mais do poder. Não importa quem vai herdar o lugar vazio do Bolsonaro, pois ele muito dificilmente terá espaço. Já existe uma perseguição aos canais de direita com Bolsonaro na presidência, imagina com o Lula lá. Eles vão classificar tudo como fake news e usar isto para fechar, intimidar, os canais que não são aliados ideologicamente.', 'parentId': 'UgxRjBlM_iL1NrU9IRB4AaABAg', 'authorDisplayName': 'Diogo Gauss ™', 'authorProfileImageUrl': 'https://yt3.ggpht.com/z_LtOdHwk46QLVxhL9VVI-sdSFgDLKAOWdWJY9oHflt_joB2GhDZKe94lhM8cg0Dg45yN1NJRQ=s48-c-k-c0x00ffffff-no-rj', 'authorChannelUrl': 'http://www.youtube.com/channel/UC7x1QDYRBFsy5hKA5LKtgMQ', 'authorChannelId': {'value': 'UC7x1QDYRBFsy5hKA5LKtgMQ'}, 'canRate': True, 'viewerRating': 'none', 'likeCount': 0, 'publishedAt': '2022-10-19T07:05:24Z', 'updatedAt': '2022-10-19T07:06:08Z'}}, {'kind': 'youtube#comment', 'etag': 'LkumZ7I9zL2tqDdzbuX49SYC2tg', 'id': 'UgxRjBlM_iL1NrU9IRB4AaABAg.9hLjqSTVtyG9hLlRFzdxjJ', 'snippet': {'videoId': 'P-4EgU_-ffU', 'textDisplay': 'Moro é fraco, se o Lula fizer um mal governo, o Bolsonaro vai fazer muito barulho.', 'textOriginal': 'Moro é fraco, se o Lula fizer um mal governo, o Bolsonaro vai fazer muito barulho.', 'parentId': 'UgxRjBlM_iL1NrU9IRB4AaABAg', 'authorDisplayName': 'Cleiton Santos', 'authorProfileImageUrl': 'https://yt3.ggpht.com/ytc/AGIKgqPPnTDI5wa5lX7PIaA_pk3giJp6bkOijWm3vw=s48-c-k-c0x00ffffff-no-rj', 'authorChannelUrl': 'http://www.youtube.com/channel/UCTgoNXw1dqDn8q8mc1sKWCQ', 'authorChannelId': {'value': 'UCTgoNXw1dqDn8q8mc1sKWCQ'}, 'canRate': True, 'viewerRating': 'none', 'likeCount': 0, 'publishedAt': '2022-10-19T02:46:30Z', 'updatedAt': '2022-10-19T02:46:30Z'}}]}",UCwq2PT6doEsaYUaau29XW5A,2022-10-19T02:32:36Z,Vcs acreditam q Moro quer assumir a direita q vai ficar órfã com a perda de eleição de Bolsonaro. o bolsonarista vai ficar órfã e esse apoio dele seria para um interesse no futuro para 2026 como presidente e abraçando esse bolsonarista q vai ficar órfã. pois ele tem cargo de segurança como senador pode concorrer em 2 pleito importante 2024 prefeito SP ou PR ou até msm 2026 presidente Governador SP ou PR tbm se ele perder esses pleito ele ainda tem o cargo de senador.,,2023-06-09 04:21:01.321226
youtube#commentThread,Aw-MLQGdE7jFxuuIQp6EbnPm9YU,UgzDvrTR-vucf3dx9Pt4AaABAg,"{'videoId': 'P-4EgU_-ffU', 'topLevelComment': {'kind': 'youtube#comment', 'etag': 'ck9U-xVJx20y1YJyp7N9FmQkS2Y', 'id': 'UgzDvrTR-vucf3dx9Pt4AaABAg', 'snippet': {'videoId': 'P-4EgU_-ffU', 'textDisplay': 'Renan. Eles estão na zona da mata essa semana que foi bem Lula-Zema. Não foi no centro ou no sul de Minas.', 'textOriginal': 'Renan. Eles estão na zona da mata essa semana que foi bem Lula-Zema. Não foi no centro ou no sul de Minas.', 'authorDisplayName': 'Tomás', 'authorProfileImageUrl': 'https://yt3.ggpht.com/vvICeASKEsj7Y2xvh3r1BFcw2EY-xsd0HWjIjy4z2XaVlg04r9tVNcGyBpppFzqcxwzh1KSHBg=s48-c-k-c0x00ffffff-no-rj', 'authorChannelUrl': 'http://www.youtube.com/channel/UCiFFV8RAbNEH_zoHwEalNYw', 'authorChannelId': {'value': 'UCiFFV8RAbNEH_zoHwEalNYw'}, 'canRate': True, 'viewerRating': 'none', 'likeCount': 2, 'publishedAt': '2022-10-19T02:19:56Z', 'updatedAt': '2022-10-19T02:19:56Z'}}, 'canReply': True, 'totalReplyCount': 0, 'isPublic': True}",,UCiFFV8RAbNEH_zoHwEalNYw,2022-10-19T02:19:56Z,Renan. Eles estão na zona da mata essa semana que foi bem Lula-Zema. Não foi no centro ou no sul de Minas.,,2023-06-09 04:21:01.321226
youtube#commentThread,RjAKKBmh9lJedQcvvlQ0nWTyrgk,UgyeTT3GXtObDrwZ8514AaABAg,"{'videoId': 'P-4EgU_-ffU', 'topLevelComment': {'kind': 'youtube#comment', 'etag': '6OGl7hiX8DNx0wzGGbmxtrDkkkQ', 'id': 'UgyeTT3GXtObDrwZ8514AaABAg', 'snippet': {'videoId': 'P-4EgU_-ffU', 'textDisplay': 'Renan Santos e Beraldo, repitam mais essa combinação, funciona muito bem!', 'textOriginal': 'Renan Santos e Beraldo, repitam mais essa combinação, funciona muito bem!', 'authorDisplayName': 'Elian Gomes', 'authorProfileImageUrl': 'https://yt3.ggpht.com/ytc/AGIKgqOXbhZLNetGvCmDJDdwJsIsse4L27LLDU4NZg=s48-c-k-c0x00ffffff-no-rj', 'authorChannelUrl': 'http://www.youtube.com/channel/UCveJPJeXGxF4I7lnqzMV-nw', 'authorChannelId': {'value': 'UCveJPJeXGxF4I7lnqzMV-nw'}, 'canRate': True, 'viewerRating': 'none', 'likeCount': 45, 'publishedAt': '2022-10-19T01:34:17Z', 'updatedAt': '2022-10-19T01:34:17Z'}}, 'canReply': True, 'totalReplyCount': 1, 'isPublic': True}","{'comments': [{'kind': 'youtube#comment', 'etag': '6u_C78zx1JZz36AsRP5UPnHHpkY', 'id': 'UgyeTT3GXtObDrwZ8514AaABAg.9hLdAKOeQ6V9hN0pcG3QyZ', 'snippet': {'videoId': 'P-4EgU_-ffU', 'textDisplay': 'Só o creme', 'textOriginal': 'Só o creme', 'parentId': 'UgyeTT3GXtObDrwZ8514AaABAg', 'authorDisplayName': 'SELFISH', 'authorProfileImageUrl': 'https://yt3.ggpht.com/sc2F0ascsQxcAVdtZiSjtpZouRnZteCxKFHZl1VO8_sHZ9NsbZQBLVmQgvGlD3c7tq0Y1BBZxIg=s48-c-k-c0x00ffffff-no-rj', 'authorChannelUrl': 'http://www.youtube.com/channel/UCivVlPV0EBT_flAraPJ8EGw', 'authorChannelId': {'value': 'UCivVlPV0EBT_flAraPJ8EGw'}, 'canRate': True, 'viewerRating': 'none', 'likeCount': 0, 'publishedAt': '2022-10-19T14:29:00Z', 'updatedAt': '2022-10-19T14:29:00Z'}}]}",UCveJPJeXGxF4I7lnqzMV-nw,2022-10-19T01:34:17Z,"Renan Santos e Beraldo, repitam mais essa combinação, funciona muito bem!",,2023-06-09 04:21:01.321226
youtube#commentThread,PZcv4gHgNu_sqkqMDVX-fmjqNWU,UgxuAY0hM5WRMSCTzwR4AaABAg,"{'videoId': 'P-4EgU_-ffU', 'topLevelComment': {'kind': 'youtube#comment', 'etag': 'KSf9sUo1DkZZk8WYdkxgnCa2iLs', 'id': 'UgxuAY0hM5WRMSCTzwR4AaABAg', 'snippet': {'videoId': 'P-4EgU_-ffU', 'textDisplay': '-- 😏 Talvez Somos A 1ª Banda Espirita De Pop-Metal Ou Rock Desse Mundo...\\r<br>-&gt; Mas Nao Reparem Muito No Nosso Ingles Neanderthal, kkk ❤ kkk', 'textOriginal': '-- 😏 Talvez Somos A 1ª Banda Espirita De Pop-Metal Ou Rock Desse Mundo...\\r\\n-> Mas Nao Reparem Muito No Nosso Ingles Neanderthal, kkk ❤ kkk', 'authorDisplayName': 'KARYTTAH - Rock Band', 'authorProfileImageUrl': 'https://yt3.ggpht.com/ysKl8fRhPKWN83qPjepTmWN9hAsNoCzIyUQTPacZ64ZaUXUFKQeErCa8Kh71QeqiIQOghO-b69g=s48-c-k-c0x00ffffff-no-rj', 'authorChannelUrl': 'http://www.youtube.com/channel/UCgfYQr8NopXkieU51TpeBBQ', 'authorChannelId': {'value': 'UCgfYQr8NopXkieU51TpeBBQ'}, 'canRate': True, 'viewerRating': 'none', 'likeCount': 1, 'publishedAt': '2022-10-19T01:26:52Z', 'updatedAt': '2022-10-19T01:26:52Z'}}, 'canReply': True, 'totalReplyCount': 0, 'isPublic': True}",,UCgfYQr8NopXkieU51TpeBBQ,2022-10-19T01:26:52Z,"-- 😏 Talvez Somos A 1ª Banda Espirita De Pop-Metal Ou Rock Desse Mundo...
-> Mas Nao Reparem Muito No Nosso Ingles Neanderthal, kkk ❤ kkk",,2023-06-09 04:21:01.321226
