kind,etag,id,snippet,replies,authorChannelId,publishedAt,textOriginal,nextPageToken,extraction_date
youtube#commentThread,iekZtiSJNnHNKI1eWEZrjJv_8jA,Ugwb1q9l1M110WjQLGZ4AaABAg,"{'videoId': 'P-4EgU_-ffU', 'topLevelComment': {'kind': 'youtube#comment', 'etag': 'SRUs2hS46UM6mmUg8eY5qn-me7k', 'id': 'Ugwb1q9l1M110WjQLGZ4AaABAg', 'snippet': {'videoId': 'P-4EgU_-ffU', 'textDisplay': 'Não Beraldo, admiro sua inteligência, mas equivaler o voto por correio nos EUA com o subsidio de transporte no Brasil é burrice. O voto por correio abre uma margem inigualável para fraude, o subsidio pra ir votar não.', 'textOriginal': 'Não Beraldo, admiro sua inteligência, mas equivaler o voto por correio nos EUA com o subsidio de transporte no Brasil é burrice. O voto por correio abre uma margem inigualável para fraude, o subsidio pra ir votar não.', 'authorDisplayName': 'Cristiano s', 'authorProfileImageUrl': 'https://yt3.ggpht.com/ytc/AGIKgqOT72WCN6vTN02b1BTEE6fpjOyrYOZlCtfAKA=s48-c-k-c0x00ffffff-no-rj', 'authorChannelUrl': 'http://www.youtube.com/channel/UCWhcm53P_qovA8NRIBII1BQ', 'authorChannelId': {'value': 'UCWhcm53P_qovA8NRIBII1BQ'}, 'canRate': True, 'viewerRating': 'none', 'likeCount': 2, 'publishedAt': '2022-10-19T01:23:43Z', 'updatedAt': '2022-10-19T01:23:43Z'}}, 'canReply': True, 'totalReplyCount': 2, 'isPublic': True}","{'comments': [{'kind': 'youtube#comment', 'etag': 'RGnDyz69fR5K55_UK3R4di3po8A', 'id': 'Ugwb1q9l1M110WjQLGZ4AaABAg.9hLbxzVWuKj9hLwiImkdyr', 'snippet': {'videoId': 'P-4EgU_-ffU', 'textDisplay': '@Matheus Valadão Lopes se for em um estado deficitário provável que um estado que gere mais acabe pagando essa porra ai kkkkkk', 'textOriginal': '@Matheus Valadão Lopes se for em um estado deficitário provável que um estado que gere mais acabe pagando essa porra ai kkkkkk', 'parentId': 'Ugwb1q9l1M110WjQLGZ4AaABAg', 'authorDisplayName': 'Fellzin.', 'authorProfileImageUrl': 'https://yt3.ggpht.com/b_vH3A0JYkOervyln74W68vckl9RHQ2npNVAuNLavHcaN8YWaK_yneiis3hB9suBb3X7PU4z=s48-c-k-c0x00ffffff-no-rj', 'authorChannelUrl': 'http://www.youtube.com/channel/UCRl4IADfI01aiC3JP5kLuRQ', 'authorChannelId': {'value': 'UCRl4IADfI01aiC3JP5kLuRQ'}, 'canRate': True, 'viewerRating': 'none', 'likeCount': 1, 'publishedAt': '2022-10-19T04:25:05Z', 'updatedAt': '2022-10-19T04:25:05Z'}}, {'kind': 'youtube#comment', 'etag': 'if541isIl3zjrWe9zrOhQdW5g_0', 'id': 'Ugwb1q9l1M110WjQLGZ4AaABAg.9hLbxzVWuKj9hLlDS_x3uS', 'snippet': {'videoId': 'P-4EgU_-ffU', 'textDisplay': 'Depende. Em cidade pequena coronelista....na pratica dá para fazer transporte de eleitores sem nem o proprio coronel pagar.', 'textOriginal': 'Depende. Em cidade pequena coronelista....na pratica dá para fazer transporte de eleitores sem nem o proprio coronel pagar.', 'parentId': 'Ugwb1q9l1M110WjQLGZ4AaABAg', 'authorDisplayName': 'Matheus Valadão Lopes', 'authorProfileImageUrl': 'https://yt3.ggpht.com/ytc/AGIKgqO8eV9qFGByXaP7Gmeo7Gysy4NFPUBYLJv8g1hXAA=s48-c-k-c0x00ffffff-no-rj', 'authorChannelUrl': 'http://www.youtube.com/channel/UCEs8hEYNIBAa-GoNT2tDssg', 'authorChannelId': {'value': 'UCEs8hEYNIBAa-GoNT2tDssg'}, 'canRate': True, 'viewerRating': 'none', 'likeCount': 4, 'publishedAt': '2022-10-19T02:44:37Z', 'updatedAt': '2022-10-19T02:44:37Z'}}]}",UCWhcm53P_qovA8NRIBII1BQ,2022-10-19T01:23:43Z,"Não Beraldo, admiro sua inteligência, mas equivaler o voto por correio nos EUA com o subsidio de transporte no Brasil é burrice. O voto por correio abre uma margem inigualável para fraude, o subsidio pra ir votar não.",,2023-06-09 04:21:01.321226
youtube#commentThread,AEVJ2S6OiB5GeiDUtkF7LYQwYQc,Ugxhxa65zlSx99NUA-p4AaABAg,"{'videoId': 'P-4EgU_-ffU', 'topLevelComment': {'kind': 'youtube#comment', 'etag': 'HuI6ZOMkw36e1P5rCsHgXQUeN-Q', 'id': 'Ugxhxa65zlSx99NUA-p4AaABAg', 'snippet': {'videoId': 'P-4EgU_-ffU', 'textDisplay': 'Olha, orgulho de dizer que eu faço parte da população que não vota em FDP, 00 e confirma', 'textOriginal': 'Olha, orgulho de dizer que eu faço parte da população que não vota em FDP, 00 e confirma', 'authorDisplayName': 'Adriano Possato', 'authorProfileImageUrl': 'https://yt3.ggpht.com/ytc/AGIKgqO92CBLkVH4N9gPS7SejIBqMZAoSBlzjVVCuw=s48-c-k-c0x00ffffff-no-rj', 'authorChannelUrl': 'http://www.youtube.com/channel/UC1FItqyPtnZwhR0_UTKae6g', 'authorChannelId': {'value': 'UC1FItqyPtnZwhR0_UTKae6g'}, 'canRate': True, 'viewerRating': 'none', 'likeCount': 1, 'publishedAt': '2022-10-19T01:22:50Z', 'updatedAt': '2022-10-19T01:22:50Z'}}, 'canReply': True, 'totalReplyCount': 1, 'isPublic': True}","{'comments': [{'kind': 'youtube#comment', 'etag': '8RT0YI2gsoooO08jeCYfBazfviI', 'id': 'Ugxhxa65zlSx99NUA-p4AaABAg.9hLbrYEU1Jq9hLzh6VduTK', 'snippet': {'videoId': 'P-4EgU_-ffU', 'textDisplay': 'Fique os próximos 4 anos sem dar um piu quando o imposto do sindicato que não servem pra nada  brotar no contra cheque no fim do mês!', 'textOriginal': 'Fique os próximos 4 anos sem dar um piu quando o imposto do sindicato que não servem pra nada  brotar no contra cheque no fim do mês!', 'parentId': 'Ugxhxa65zlSx99NUA-p4AaABAg', 'authorDisplayName': 'Pablo Padrinho', 'authorProfileImageUrl': 'https://yt3.ggpht.com/ytc/AGIKgqNlR7sNisUqJqsJxt7vnURnWvTUhfg97NE6NA=s48-c-k-c0x00ffffff-no-rj', 'authorChannelUrl': 'http://www.youtube.com/channel/UCXwPn5WkgcNLJ-AzfKwu-pQ', 'authorChannelId': {'value': 'UCXwPn5WkgcNLJ-AzfKwu-pQ'}, 'canRate': True, 'viewerRating': 'none', 'likeCount': 0, 'publishedAt': '2022-10-19T04:51:08Z', 'updatedAt': '2022-10-19T04:51:08Z'}}]}",UC1FItqyPtnZwhR0_UTKae6g,2022-10-19T01:22:50Z,"Olha, orgulho de dizer que eu faço parte da população que não vota em FDP, 00 e confirma",,2023-06-09 04:21:01.321226
youtube#commentThread,MIt01sbsD3fqjfTQ2bz-tqCpqiA,UgxvruBHQVzVIxbqAjN4AaABAg,"{'videoId': 'P-4EgU_-ffU', 'topLevelComment': {'kind': 'youtube#comment', 'etag': 'QxQ__MBLoj2vSK_3vAK1jGJ7uuw', 'id': 'UgxvruBHQVzVIxbqAjN4AaABAg', 'snippet': {'videoId': 'P-4EgU_-ffU', 'textDisplay': 'Lula sempre foi um grande mentiroso, isso sim!', 'textOriginal': 'Lula sempre foi um grande mentiroso, isso sim!', 'authorDisplayName': 'Arnaldo', 'authorProfileImageUrl': 'https://yt3.ggpht.com/ytc/AGIKgqP-zOHIT96Cvi8cHG7yF7pt36iGfKqEOrEIkg=s48-c-k-c0x00ffffff-no-rj', 'authorChannelUrl': 'http://www.youtube.com/channel/UCpRPoBYQcRd_3Epj10_FRAw', 'authorChannelId': {'value': 'UCpRPoBYQcRd_3Epj10_FRAw'}, 'canRate': True, 'viewerRating': 'none', 'likeCount': 0, 'publishedAt': '2022-10-19T01:06:15Z', 'updatedAt': '2022-10-19T01:06:15Z'}}, 'canReply': True, 'totalReplyCount': 0, 'isPublic': True}",,UCpRPoBYQcRd_3Epj10_FRAw,2022-10-19T01:06:15Z,"Lula sempre foi um grande mentiroso, isso sim!",,2023-06-09 04:21:01.321226
youtube#commentThread,SB5FitqcnloPM3bG6zV4xaU19Nk,UgzIzEuptmWKJN8c_NB4AaABAg,"{'videoId': 'P-4EgU_-ffU', 'topLevelComment': {'kind': 'youtube#comment', 'etag': '2Zuy4XtGOcavmaRE5c5GM1UiP6A', 'id': 'UgzIzEuptmWKJN8c_NB4AaABAg', 'snippet': {'videoId': 'P-4EgU_-ffU', 'textDisplay': 'Renan, vocês têm que criar um partido para concorrerem em 2026!', 'textOriginal': 'Renan, vocês têm que criar um partido para concorrerem em 2026!', 'authorDisplayName': 'Arnaldo', 'authorProfileImageUrl': 'https://yt3.ggpht.com/ytc/AGIKgqP-zOHIT96Cvi8cHG7yF7pt36iGfKqEOrEIkg=s48-c-k-c0x00ffffff-no-rj', 'authorChannelUrl': 'http://www.youtube.com/channel/UCpRPoBYQcRd_3Epj10_FRAw', 'authorChannelId': {'value': 'UCpRPoBYQcRd_3Epj10_FRAw'}, 'canRate': True, 'viewerRating': 'none', 'likeCount': 28, 'publishedAt': '2022-10-19T00:42:24Z', 'updatedAt': '2022-10-19T00:42:24Z'}}, 'canReply': True, 'totalReplyCount': 0, 'isPublic': True}",,UCpRPoBYQcRd_3Epj10_FRAw,2022-10-19T00:42:24Z,"Renan, vocês têm que criar um partido para concorrerem em 2026!",,2023-06-09 04:21:01.321226
youtube#commentThread,gZD779euXiQ50WUfjA0MKqVsmRw,UgxTnD35WBoO4icUG3V4AaABAg,"{'videoId': 'P-4EgU_-ffU', 'topLevelComment': {'kind': 'youtube#comment', 'etag': 'v682jXg2b25JXZwrQxPrjn7Hm8A', 'id': 'UgxTnD35WBoO4icUG3V4AaABAg', 'snippet': {'videoId': 'P-4EgU_-ffU', 'textDisplay': 'O pior não foi o Amoêdo que votei nele no primeiro turno de 2018,  agora apoiando o Lula e também o Marco Antônio Villa, que já admirei no passado, dizia que Lula era o ladrão mor do Brasil e agora o apoia com a maior cara de pau! Tudo farinha do mesmo saco!', 'textOriginal': 'O pior não foi o Amoêdo que votei nele no primeiro turno de 2018,  agora apoiando o Lula e também o Marco Antônio Villa, que já admirei no passado, dizia que Lula era o ladrão mor do Brasil e agora o apoia com a maior cara de pau! Tudo farinha do mesmo saco!', 'authorDisplayName': 'Arnaldo', 'authorProfileImageUrl': 'https://yt3.ggpht.com/ytc/AGIKgqP-zOHIT96Cvi8cHG7yF7pt36iGfKqEOrEIkg=s48-c-k-c0x00ffffff-no-rj', 'authorChannelUrl': 'http://www.youtube.com/channel/UCpRPoBYQcRd_3Epj10_FRAw', 'authorChannelId': {'value': 'UCpRPoBYQcRd_3Epj10_FRAw'}, 'canRate': True, 'viewerRating': 'none', 'likeCount': 0, 'publishedAt': '2022-10-19T00:32:29Z', 'updatedAt': '2022-10-19T00:32:29Z'}}, 'canReply': True, 'totalReplyCount': 0, 'isPublic': True}",,UCpRPoBYQcRd_3Epj10_FRAw,2022-10-19T00:32:29Z,"O pior não foi o Amoêdo que votei nele no primeiro turno de 2018,  agora apoiando o Lula e também o Marco Antônio Villa, que já admirei no passado, dizia que Lula era o ladrão mor do Brasil e agora o apoia com a maior cara de pau! Tudo farinha do mesmo saco!",,2023-06-09 04:21:01.321226
youtube#commentThread,uFEhBHKpCHp7dhxmmD_HxXH719U,UgzA93TvTOznH_N0me14AaABAg,"{'videoId': 'P-4EgU_-ffU', 'topLevelComment': {'kind': 'youtube#comment', 'etag': 'jxDDQNNqxWfRQVggqgF-8BIbDVA', 'id': 'UgzA93TvTOznH_N0me14AaABAg', 'snippet': {'videoId': 'P-4EgU_-ffU', 'textDisplay': 'Tomara que você tenha razão, também acho que Bolsonaro vai ganhar!', 'textOriginal': 'Tomara que você tenha razão, também acho que Bolsonaro vai ganhar!', 'authorDisplayName': 'Arnaldo', 'authorProfileImageUrl': 'https://yt3.ggpht.com/ytc/AGIKgqP-zOHIT96Cvi8cHG7yF7pt36iGfKqEOrEIkg=s48-c-k-c0x00ffffff-no-rj', 'authorChannelUrl': 'http://www.youtube.com/channel/UCpRPoBYQcRd_3Epj10_FRAw', 'authorChannelId': {'value': 'UCpRPoBYQcRd_3Epj10_FRAw'}, 'canRate': True, 'viewerRating': 'none', 'likeCount': 4, 'publishedAt': '2022-10-19T00:27:08Z', 'updatedAt': '2022-10-19T00:27:08Z'}}, 'canReply': True, 'totalReplyCount': 3, 'isPublic': True}","{'comments': [{'kind': 'youtube#comment', 'etag': 'gbTYIOLKb0K7jSTwE2_CoGJqyrw', 'id': 'UgzA93TvTOznH_N0me14AaABAg.9hLWUaPi8D99hNg0EY5eas', 'snippet': {'videoId': 'P-4EgU_-ffU', 'textDisplay': '@Gediane Maele Não preciso sua P...', 'textOriginal': '@Gediane Maele Não preciso sua P...', 'parentId': 'UgzA93TvTOznH_N0me14AaABAg', 'authorDisplayName': 'Jair Bozonaro - O Encantador de Imbecis', 'authorProfileImageUrl': 'https://yt3.ggpht.com/ytc/AGIKgqOKO20oh0ew7pKZ1EoyzZsIob6yVVWXhWgi81zHzw=s48-c-k-c0x00ffffff-no-rj', 'authorChannelUrl': 'http://www.youtube.com/channel/UC0cB_4yZSIsEX3zso8wsOUA', 'authorChannelId': {'value': 'UC0cB_4yZSIsEX3zso8wsOUA'}, 'canRate': True, 'viewerRating': 'none', 'likeCount': 0, 'publishedAt': '2022-10-19T20:37:36Z', 'updatedAt': '2022-10-19T20:37:36Z'}}, {'kind': 'youtube#comment', 'etag': 'Q-EjTQMnEvZpz3GicymLSYmGDRM', 'id': 'UgzA93TvTOznH_N0me14AaABAg.9hLWUaPi8D99hN-DGONeeV', 'snippet': {'videoId': 'P-4EgU_-ffU', 'textDisplay': '@Jair Bozonaro - O Encantador de Imbecis e vá p cuba seu alienado.', 'textOriginal': '@Jair Bozonaro - O Encantador de Imbecis e vá p cuba seu alienado.', 'parentId': 'UgzA93TvTOznH_N0me14AaABAg', 'authorDisplayName': 'Gediane Maele', 'authorProfileImageUrl': 'https://yt3.ggpht.com/ytc/AGIKgqORkGifCXMtbOzP_ec-ucmTANOmUYTZgovK98_IsQ=s48-c-k-c0x00ffffff-no-rj', 'authorChannelUrl': 'http://www.youtube.com/channel/UC4lGxrwOrKpjuKTwhG8ha3Q', 'authorChannelId': {'value': 'UC4lGxrwOrKpjuKTwhG8ha3Q'}, 'canRate': True, 'viewerRating': 'none', 'likeCount': 0, 'publishedAt': '2022-10-19T14:14:54Z', 'updatedAt': '2022-10-19T14:14:54Z'}}, {'kind': 'youtube#comment', 'etag': 'XAFjxKMkj5p8dHJBqhMhz8WA3vc', 'id': 'UgzA93TvTOznH_N0me14AaABAg.9hLWUaPi8D99hLXIOz4z2n', 'snippet': {'videoId': 'P-4EgU_-ffU', 'textDisplay': 'Vou de Lula', 'textOriginal': 'Vou de Lula', 'parentId': 'UgzA93TvTOznH_N0me14AaABAg', 'authorDisplayName': 'Jair Bozonaro - O Encantador de Imbecis', 'authorProfileImageUrl': 'https://yt3.ggpht.com/ytc/AGIKgqOKO20oh0ew7pKZ1EoyzZsIob6yVVWXhWgi81zHzw=s48-c-k-c0x00ffffff-no-rj', 'authorChannelUrl': 'http://www.youtube.com/channel/UC0cB_4yZSIsEX3zso8wsOUA', 'authorChannelId': {'value': 'UC0cB_4yZSIsEX3zso8wsOUA'}, 'canRate': True, 'viewerRating': 'none', 'likeCount': 3, 'publishedAt': '2022-10-19T00:34:13Z', 'updatedAt': '2022-10-19T00:34:13Z'}}]}",UCpRPoBYQcRd_3Epj10_FRAw,2022-10-19T00:27:08Z,"Tomara que você tenha razão, também acho que Bolsonaro vai ganhar!",,2023-06-09 04:21:01.321226
youtube#commentThread,PgtD2GaX96XGxmm91MGacyJbkMM,UgzsYI6CRhG2oKxpRVd4AaABAg,"{'videoId': 'P-4EgU_-ffU', 'topLevelComment': {'kind': 'youtube#comment', 'etag': 'SY3qPpLzoMmH9odKrHszX8RH_7s', 'id': 'UgzsYI6CRhG2oKxpRVd4AaABAg', 'snippet': {'videoId': 'P-4EgU_-ffU', 'textDisplay': 'RENAN OS PRODUTO ARTÍSTICO MUSICAL DO AGRONEGOCIO QUE USOU CANAL DO MBL PRA SABER MINHA POSIÇÃO JÁ PEDI AO MATEMÁTICO DO 🇺🇸PRA TOMAR X 💰DO CANTOR 🎤🎶PORQUE NÃO SOU VITRINE DE VAMPIROS 🎤🎶', 'textOriginal': 'RENAN OS PRODUTO ARTÍSTICO MUSICAL DO AGRONEGOCIO QUE USOU CANAL DO MBL PRA SABER MINHA POSIÇÃO JÁ PEDI AO MATEMÁTICO DO 🇺🇸PRA TOMAR X 💰DO CANTOR 🎤🎶PORQUE NÃO SOU VITRINE DE VAMPIROS 🎤🎶', 'authorDisplayName': 'Mel Silva', 'authorProfileImageUrl': 'https://yt3.ggpht.com/ytc/AGIKgqOcvXuP074gge4NGHQpwZ46tOHOWfUPTNyTTw=s48-c-k-c0x00ffffff-no-rj', 'authorChannelUrl': 'http://www.youtube.com/channel/UCjgjX6K63gelIDQhuk6PA2A', 'authorChannelId': {'value': 'UCjgjX6K63gelIDQhuk6PA2A'}, 'canRate': True, 'viewerRating': 'none', 'likeCount': 1, 'publishedAt': '2022-10-19T00:14:58Z', 'updatedAt': '2022-10-19T00:14:58Z'}}, 'canReply': True, 'totalReplyCount': 0, 'isPublic': True}",,UCjgjX6K63gelIDQhuk6PA2A,2022-10-19T00:14:58Z,RENAN OS PRODUTO ARTÍSTICO MUSICAL DO AGRONEGOCIO QUE USOU CANAL DO MBL PRA SABER MINHA POSIÇÃO JÁ PEDI AO MATEMÁTICO DO 🇺🇸PRA TOMAR X 💰DO CANTOR 🎤🎶PORQUE NÃO SOU VITRINE DE VAMPIROS 🎤🎶,,2023-06-09 04:21:01.321226
youtube#commentThread,CkYR5gDGtgj8VFTwY64FHEFkz_U,UgzlV5sHRTDJ2x2Awj54AaABAg,"{'videoId': 'P-4EgU_-ffU', 'topLevelComment': {'kind': 'youtube#comment', 'etag': 'CqqJk1HJY7KEA8ILaPEWtDD-wII', 'id': 'UgzlV5sHRTDJ2x2Awj54AaABAg', 'snippet': {'videoId': 'P-4EgU_-ffU', 'textDisplay': 'O Arthur teve 10 vezes mais votos do que diziam as pesquisas. PAREM DE PASSAR PANO PRA ESSAS MERDAS', 'textOriginal': 'O Arthur teve 10 vezes mais votos do que diziam as pesquisas. PAREM DE PASSAR PANO PRA ESSAS MERDAS', 'authorDisplayName': 'Alexandre Rezende', 'authorProfileImageUrl': 'https://yt3.ggpht.com/ytc/AGIKgqPQAIudm3iLMsqHzmqNQf31COk_ikSjsXwRTw=s48-c-k-c0x00ffffff-no-rj', 'authorChannelUrl': 'http://www.youtube.com/channel/UC5VcErpbM5n8TUdgjG8B5-w', 'authorChannelId': {'value': 'UC5VcErpbM5n8TUdgjG8B5-w'}, 'canRate': True, 'viewerRating': 'none', 'likeCount': 1, 'publishedAt': '2022-10-19T00:12:54Z', 'updatedAt': '2022-10-19T00:12:54Z'}}, 'canReply': True, 'totalReplyCount': 0, 'isPublic': True}",,UC5VcErpbM5n8TUdgjG8B5-w,2022-10-19T00:12:54Z,O Arthur teve 10 vezes mais votos do que diziam as pesquisas. PAREM DE PASSAR PANO PRA ESSAS MERDAS,,2023-06-09 04:21:01.321226
youtube#commentThread,nHLbJHt-31zvpf48WYTcPQeWJRE,Ugw9XNpT02v7Qli3LWF4AaABAg,"{'videoId': 'P-4EgU_-ffU', 'topLevelComment': {'kind': 'youtube#comment', 'etag': 'VA_9siEUYdBlastuSAsqPjSVxl0', 'id': 'Ugw9XNpT02v7Qli3LWF4AaABAg', 'snippet': {'videoId': 'P-4EgU_-ffU', 'textDisplay': 'Votarei nulo mas ainda acho q o lula leva.', 'textOriginal': 'Votarei nulo mas ainda acho q o lula leva.', 'authorDisplayName': 'Agson Alexandre', 'authorProfileImageUrl': 'https://yt3.ggpht.com/ytc/AGIKgqMJQBipZEPtcw1u8ojSyfhkYdQyy2y8ywPyURnjOQ=s48-c-k-c0x00ffffff-no-rj', 'authorChannelUrl': 'http://www.youtube.com/channel/UC96UdmdKUKAxqiCSlncjIxg', 'authorChannelId': {'value': 'UC96UdmdKUKAxqiCSlncjIxg'}, 'canRate': True, 'viewerRating': 'none', 'likeCount': 10, 'publishedAt': '2022-10-19T00:09:43Z', 'updatedAt': '2022-10-19T00:09:43Z'}}, 'canReply': True, 'totalReplyCount': 7, 'isPublic': True}","{'comments': [{'kind': 'youtube#comment', 'etag': 'BsSpYLPsQ6nfhKEI2VcaHH_KXE0', 'id': 'Ugw9XNpT02v7Qli3LWF4AaABAg.9hLUUx9_LTx9hMB_UjbOQl', 'snippet': {'videoId': 'P-4EgU_-ffU', 'textDisplay': '@Fellzin. , votar em branco, anular, não ir votar, tudo isso ajuda quem está em primeiro lugar, logo o maior beneficiário é o Lula.', 'textOriginal': '@Fellzin. , votar em branco, anular, não ir votar, tudo isso ajuda quem está em primeiro lugar, logo o maior beneficiário é o Lula.', 'parentId': 'Ugw9XNpT02v7Qli3LWF4AaABAg', 'authorDisplayName': 'Diogo Gauss ™', 'authorProfileImageUrl': 'https://yt3.ggpht.com/z_LtOdHwk46QLVxhL9VVI-sdSFgDLKAOWdWJY9oHflt_joB2GhDZKe94lhM8cg0Dg45yN1NJRQ=s48-c-k-c0x00ffffff-no-rj', 'authorChannelUrl': 'http://www.youtube.com/channel/UC7x1QDYRBFsy5hKA5LKtgMQ', 'authorChannelId': {'value': 'UC7x1QDYRBFsy5hKA5LKtgMQ'}, 'canRate': True, 'viewerRating': 'none', 'likeCount': 1, 'publishedAt': '2022-10-19T06:43:41Z', 'updatedAt': '2022-10-19T06:43:41Z'}}, {'kind': 'youtube#comment', 'etag': '6WRFIOZJyZ0M7hXvMvUCCrmBTrg', 'id': 'Ugw9XNpT02v7Qli3LWF4AaABAg.9hLUUx9_LTx9hLxG4sT2XH', 'snippet': {'videoId': 'P-4EgU_-ffU', 'textDisplay': '@Diogo Gauss ™ voto nulo não vai para ninguém vai para contagem de &quot;não escolheu&quot; praticamente, esse teu papinho é usado pelo outro lado também, coisa idiota quer votar em bandido vota mas não cobra quem não quer votar em bandido seja de direita ou de esquerda. Bota o Bolsonaro lá ou o Lula lá e o PT agradece ambos fortalecem o PT 🤷🏾\\u200d♂️', 'textOriginal': '@Diogo Gauss ™ voto nulo não vai para ninguém vai para contagem de ""não escolheu"" praticamente, esse teu papinho é usado pelo outro lado também, coisa idiota quer votar em bandido vota mas não cobra quem não quer votar em bandido seja de direita ou de esquerda. Bota o Bolsonaro lá ou o Lula lá e o PT agradece ambos fortalecem o PT 🤷🏾\\u200d♂️', 'parentId': 'Ugw9XNpT02v7Qli3LWF4AaABAg', 'authorDisplayName': 'Fellzin.', 'authorProfileImageUrl': 'https://yt3.ggpht.com/b_vH3A0JYkOervyln74W68vckl9RHQ2npNVAuNLavHcaN8YWaK_yneiis3hB9suBb3X7PU4z=s48-c-k-c0x00ffffff-no-rj', 'authorChannelUrl': 'http://www.youtube.com/channel/UCRl4IADfI01aiC3JP5kLuRQ', 'authorChannelId': {'value': 'UCRl4IADfI01aiC3JP5kLuRQ'}, 'canRate': True, 'viewerRating': 'none', 'likeCount': 2, 'publishedAt': '2022-10-19T04:29:50Z', 'updatedAt': '2022-10-19T04:30:49Z'}}, {'kind': 'youtube#comment', 'etag': 'HSv3Tk227V-7Jz0aTLv5JGRbMcY', 'id': 'Ugw9XNpT02v7Qli3LWF4AaABAg.9hLUUx9_LTx9hLtKR7Qyqn', 'snippet': {'videoId': 'P-4EgU_-ffU', 'textDisplay': '\\u200b@Diogo Gauss ™ &quot;Se eu errar o PT volta&quot; <br>&quot;E se tiver que votar para absolver o Lula, que vote&quot;<br>- Jair Bolsonaro.<br><br>O PT agradece.', 'textOriginal': '\\u200b@Diogo Gauss ™ ""Se eu errar o PT volta"" \\n""E se tiver que votar para absolver o Lula, que vote""\\n- Jair Bolsonaro.\\n\\nO PT agradece.', 'parentId': 'Ugw9XNpT02v7Qli3LWF4AaABAg', 'authorDisplayName': 'Keltke GK', 'authorProfileImageUrl': 'https://yt3.ggpht.com/ytc/AGIKgqMJ3vOF-gEc_q91ebk7wahc6MtPR3KRWozk58wYmQ=s48-c-k-c0x00ffffff-no-rj', 'authorChannelUrl': 'http://www.youtube.com/channel/UCGc0q0ta72c3cg56L1HXxOQ', 'authorChannelId': {'value': 'UCGc0q0ta72c3cg56L1HXxOQ'}, 'canRate': True, 'viewerRating': 'none', 'likeCount': 3, 'publishedAt': '2022-10-19T03:55:28Z', 'updatedAt': '2022-10-19T03:55:28Z'}}, {'kind': 'youtube#comment', 'etag': 'ZugyjEjk7NzhXgVDZkM6PA7DVnc', 'id': 'Ugw9XNpT02v7Qli3LWF4AaABAg.9hLUUx9_LTx9hLrkLyVbuS', 'snippet': {'videoId': 'P-4EgU_-ffU', 'textDisplay': '@Jair Bozonaro - O Encantador de Imbecis sai fora, malucão', 'textOriginal': '@Jair Bozonaro - O Encantador de Imbecis sai fora, malucão', 'parentId': 'Ugw9XNpT02v7Qli3LWF4AaABAg', 'authorDisplayName': 'Matheus Lorran', 'authorProfileImageUrl': 'https://yt3.ggpht.com/pouvIW4dgUD3oNSBJnWY4DS5nbwsQLv2CZxgDjhlYLdhfbGcO_7LRl3K5dkSh1r_Kz_otV2gRhg=s48-c-k-c0x00ffffff-no-rj', 'authorChannelUrl': 'http://www.youtube.com/channel/UC5wJVHLfd6Ar7NW6swf-K1w', 'authorChannelId': {'value': 'UC5wJVHLfd6Ar7NW6swf-K1w'}, 'canRate': True, 'viewerRating': 'none', 'likeCount': 0, 'publishedAt': '2022-10-19T03:41:40Z', 'updatedAt': '2022-10-19T03:41:40Z'}}, {'kind': 'youtube#comment', 'etag': 'fg-JFI9Ik11cwI6NrhMM4IGZDKs', 'id': 'Ugw9XNpT02v7Qli3LWF4AaABAg.9hLUUx9_LTx9hLbzLlys1X', 'snippet': {'videoId': 'P-4EgU_-ffU', 'textDisplay': '\\u200b@Diogo Gauss ™ fodasse ?', 'textOriginal': '\\u200b@Diogo Gauss ™ fodasse ?', 'parentId': 'Ugw9XNpT02v7Qli3LWF4AaABAg', 'authorDisplayName': 'Fostva', 'authorProfileImageUrl': 'https://yt3.ggpht.com/ewi-j1qWc3I-J8VHoV22qpVzqG_WFEkMVY8a6HtzzaUmFMuD5lGEKsW9rZXouaZndSquxOuqPA=s48-c-k-c0x00ffffff-no-rj', 'authorChannelUrl': 'http://www.youtube.com/channel/UCgAl5mpv7jDtIiY9o6hSO0g', 'authorChannelId': {'value': 'UCgAl5mpv7jDtIiY9o6hSO0g'}, 'canRate': True, 'viewerRating': 'none', 'likeCount': 4, 'publishedAt': '2022-10-19T01:23:54Z', 'updatedAt': '2022-10-19T01:23:54Z'}}]}",UC96UdmdKUKAxqiCSlncjIxg,2022-10-19T00:09:43Z,Votarei nulo mas ainda acho q o lula leva.,,2023-06-09 04:21:01.321226
youtube#commentThread,SMdzIsVmr7yspLFp6unqu2c0KVI,Ugy9JFQEC1tCYoqnv_B4AaABAg,"{'videoId': 'P-4EgU_-ffU', 'topLevelComment': {'kind': 'youtube#comment', 'etag': '96DgzaVeK21SfLuUVooAOM3g6rU', 'id': 'Ugy9JFQEC1tCYoqnv_B4AaABAg', 'snippet': {'videoId': 'P-4EgU_-ffU', 'textDisplay': 'Amoedo é banqueiro irmãos do MBL , ele está visando isso aqui ó $$$', 'textOriginal': 'Amoedo é banqueiro irmãos do MBL , ele está visando isso aqui ó $$$', 'authorDisplayName': 'GeryDerek', 'authorProfileImageUrl': 'https://yt3.ggpht.com/ytc/AGIKgqP4J4gDFDPDgmd2likJlE3eeyMOfOohbGHUlg=s48-c-k-c0x00ffffff-no-rj', 'authorChannelUrl': 'http://www.youtube.com/channel/UCMzBLlMmUbOVuWXmZbZYNeA', 'authorChannelId': {'value': 'UCMzBLlMmUbOVuWXmZbZYNeA'}, 'canRate': True, 'viewerRating': 'none', 'likeCount': 0, 'publishedAt': '2022-10-19T00:04:58Z', 'updatedAt': '2022-10-19T00:04:58Z'}}, 'canReply': True, 'totalReplyCount': 0, 'isPublic': True}",,UCMzBLlMmUbOVuWXmZbZYNeA,2022-10-19T00:04:58Z,"Amoedo é banqueiro irmãos do MBL , ele está visando isso aqui ó $$$",,2023-06-09 04:21:01.321226
