kind,etag,id,snippet,replies,authorChannelId,publishedAt,textOriginal,nextPageToken,extraction_date
youtube#commentThread,Xsi0E2T0c0wXYpBQf0HjB0Np3jQ,UgwjDGcWg88hi_8PMO54AaABAg,"{'videoId': 'P-4EgU_-ffU', 'topLevelComment': {'kind': 'youtube#comment', 'etag': 'y7qwr4yDC4l6U5tjP_P5CLVq8R0', 'id': 'UgwjDGcWg88hi_8PMO54AaABAg', 'snippet': {'videoId': 'P-4EgU_-ffU', 'textDisplay': 'SE o Lula ganhar em 2026 podemos ter polarização? Pq Lula vai querer se releger e Bolsonaro vai querer voltar, o que vcs acham?', 'textOriginal': 'SE o Lula ganhar em 2026 podemos ter polarização? Pq Lula vai querer se releger e Bolsonaro vai querer voltar, o que vcs acham?', 'authorDisplayName': 'Guilherme Mação', 'authorProfileImageUrl': 'https://yt3.ggpht.com/ytc/AGIKgqORaFJGld7d1zfxW5N-hSkxg6GKJyg8RtZX3g=s48-c-k-c0x00ffffff-no-rj', 'authorChannelUrl': 'http://www.youtube.com/channel/UCFIDgxyx-Ca0Dy8kvNA2TGQ', 'authorChannelId': {'value': 'UCFIDgxyx-Ca0Dy8kvNA2TGQ'}, 'canRate': True, 'viewerRating': 'none', 'likeCount': 0, 'publishedAt': '2022-10-19T03:14:58Z', 'updatedAt': '2022-10-19T03:14:58Z'}}, 'canReply': True, 'totalReplyCount': 4, 'isPublic': True}","{'comments': [{'kind': 'youtube#comment', 'etag': 'ZnkDqK8lCiNd3tWcGD1iYRubPvA', 'id': 'UgwjDGcWg88hi_8PMO54AaABAg.9hLogjwNcIN9h_jwFhzLqD', 'snippet': {'videoId': 'P-4EgU_-ffU', 'textDisplay': '@nouzer lula vai ta velho, da conta n', 'textOriginal': '@nouzer lula vai ta velho, da conta n', 'parentId': 'UgwjDGcWg88hi_8PMO54AaABAg', 'authorDisplayName': 'Italo santos', 'authorProfileImageUrl': 'https://yt3.ggpht.com/ytc/AGIKgqM2x4L3aKnCy6QgOa6cbZNM4AWJ9q8ZDIFVmA=s48-c-k-c0x00ffffff-no-rj', 'authorChannelUrl': 'http://www.youtube.com/channel/UCSMYUr441rB2tKxt1DMjU1A', 'authorChannelId': {'value': 'UCSMYUr441rB2tKxt1DMjU1A'}, 'canRate': True, 'viewerRating': 'none', 'likeCount': 0, 'publishedAt': '2022-10-24T22:22:00Z', 'updatedAt': '2022-10-24T22:22:00Z'}}, {'kind': 'youtube#comment', 'etag': 'PdSdhOuzU1r-1j-MSapWzBK_Jik', 'id': 'UgwjDGcWg88hi_8PMO54AaABAg.9hLogjwNcIN9hNlvU7OCLB', 'snippet': {'videoId': 'P-4EgU_-ffU', 'textDisplay': 'Boa pergunta', 'textOriginal': 'Boa pergunta', 'parentId': 'UgwjDGcWg88hi_8PMO54AaABAg', 'authorDisplayName': 'nouzer', 'authorProfileImageUrl': 'https://yt3.ggpht.com/pm1JXkhiUFVldH-FACKLAKX3-iEMiVhoy4TFrqfzW3t8msFCNIyPpwm5AtLmFI860ZQO6HQweJ8=s48-c-k-c0x00ffffff-no-rj', 'authorChannelUrl': 'http://www.youtube.com/channel/UCyjwnRJAMAnniVaUILOUO4A', 'authorChannelId': {'value': 'UCyjwnRJAMAnniVaUILOUO4A'}, 'canRate': True, 'viewerRating': 'none', 'likeCount': 0, 'publishedAt': '2022-10-19T21:29:14Z', 'updatedAt': '2022-10-19T21:29:14Z'}}, {'kind': 'youtube#comment', 'etag': 'Bct8wikLd72XmlzlBLDvDcZMqnI', 'id': 'UgwjDGcWg88hi_8PMO54AaABAg.9hLogjwNcIN9hMEQCwG1gB', 'snippet': {'videoId': 'P-4EgU_-ffU', 'textDisplay': 'Nenhum dos dois! O Lula não vai tentar reeleição, colocará o Boulos, por exemplo, pois está muito velho. O Bolsonaro já disse que, se perder, encerra sua vida política. O mais provável é que tenhamos o Zema, Tarcísio, como grandes concorrentes, mas sem chance alguma de ganhar, já que a esquerda não permitirá de jeito nenhum.', 'textOriginal': 'Nenhum dos dois! O Lula não vai tentar reeleição, colocará o Boulos, por exemplo, pois está muito velho. O Bolsonaro já disse que, se perder, encerra sua vida política. O mais provável é que tenhamos o Zema, Tarcísio, como grandes concorrentes, mas sem chance alguma de ganhar, já que a esquerda não permitirá de jeito nenhum.', 'parentId': 'UgwjDGcWg88hi_8PMO54AaABAg', 'authorDisplayName': 'Diogo Gauss ™', 'authorProfileImageUrl': 'https://yt3.ggpht.com/z_LtOdHwk46QLVxhL9VVI-sdSFgDLKAOWdWJY9oHflt_joB2GhDZKe94lhM8cg0Dg45yN1NJRQ=s48-c-k-c0x00ffffff-no-rj', 'authorChannelUrl': 'http://www.youtube.com/channel/UC7x1QDYRBFsy5hKA5LKtgMQ', 'authorChannelId': {'value': 'UC7x1QDYRBFsy5hKA5LKtgMQ'}, 'canRate': True, 'viewerRating': 'none', 'likeCount': 0, 'publishedAt': '2022-10-19T07:08:30Z', 'updatedAt': '2022-10-19T07:11:02Z'}}, {'kind': 'youtube#comment', 'etag': 'JF6lpFbTOENe_yrBr274H6Cc50g', 'id': 'UgwjDGcWg88hi_8PMO54AaABAg.9hLogjwNcIN9hLxxQ6rimh', 'snippet': {'videoId': 'P-4EgU_-ffU', 'textDisplay': 'Bolsonaro acho que vai preso num governo Lula já que ele promete muito tirar as blindagens que o mito fez nele mesmo, então vem um Zema herdando o governo e o bolsonarismo perde muitas forças Lula vai ter tido um governo merda graças as medidas do Bolsonaro nesse mesmo governo atual ele vai tentar se reeleger culpando os problemas pela herança do bolsonaro como ele fez com FHC sendo que ele pegou uma herança boa naquela época e falava mal dela essa vai ser um lixo e ele vai falar tanto mal que talvez se reeleja se não nascer uma nova direita até lá não ligada ao Bolsonaro diretamente', 'textOriginal': 'Bolsonaro acho que vai preso num governo Lula já que ele promete muito tirar as blindagens que o mito fez nele mesmo, então vem um Zema herdando o governo e o bolsonarismo perde muitas forças Lula vai ter tido um governo merda graças as medidas do Bolsonaro nesse mesmo governo atual ele vai tentar se reeleger culpando os problemas pela herança do bolsonaro como ele fez com FHC sendo que ele pegou uma herança boa naquela época e falava mal dela essa vai ser um lixo e ele vai falar tanto mal que talvez se reeleja se não nascer uma nova direita até lá não ligada ao Bolsonaro diretamente', 'parentId': 'UgwjDGcWg88hi_8PMO54AaABAg', 'authorDisplayName': 'Fellzin.', 'authorProfileImageUrl': 'https://yt3.ggpht.com/b_vH3A0JYkOervyln74W68vckl9RHQ2npNVAuNLavHcaN8YWaK_yneiis3hB9suBb3X7PU4z=s48-c-k-c0x00ffffff-no-rj', 'authorChannelUrl': 'http://www.youtube.com/channel/UCRl4IADfI01aiC3JP5kLuRQ', 'authorChannelId': {'value': 'UCRl4IADfI01aiC3JP5kLuRQ'}, 'canRate': True, 'viewerRating': 'none', 'likeCount': 1, 'publishedAt': '2022-10-19T04:35:53Z', 'updatedAt': '2022-10-19T04:36:49Z'}}]}",UCFIDgxyx-Ca0Dy8kvNA2TGQ,2022-10-19T03:14:58Z,"SE o Lula ganhar em 2026 podemos ter polarização? Pq Lula vai querer se releger e Bolsonaro vai querer voltar, o que vcs acham?",,2023-06-09 04:21:01.321226
youtube#commentThread,-4QFvTPYddgmKcAe7ew7O0jO_2Y,Ugy8JSP2eQKXJN5KF6R4AaABAg,"{'videoId': 'P-4EgU_-ffU', 'topLevelComment': {'kind': 'youtube#comment', 'etag': 'R8Ie_rTsG7ZYlR3jFk0W6o3VMNU', 'id': 'Ugy8JSP2eQKXJN5KF6R4AaABAg', 'snippet': {'videoId': 'P-4EgU_-ffU', 'textDisplay': 'No rock in rio cabem 100 mil pessoas.\\r<br>É um mar de gente.\\r<br>Pro Bols0naro EMPATAR com o Lulla, ele precisa de 61 rock in rios LOTADOS, e mais um\\r<br>Estádio do Maracanã LOTADO com TODOS os vot0s pra ele, pra só daí então ele começar a\\r<br>ganhar votos pra ganhar do Lulla.\\r<br>E a maioria dos votos da Simone e do Cir0 vão pro Molusc0.\\r<br>\\r<br>\\r<br>Difícil ele ganhar. Acho eu.', 'textOriginal': 'No rock in rio cabem 100 mil pessoas.\\r\\nÉ um mar de gente.\\r\\nPro Bols0naro EMPATAR com o Lulla, ele precisa de 61 rock in rios LOTADOS, e mais um\\r\\nEstádio do Maracanã LOTADO com TODOS os vot0s pra ele, pra só daí então ele começar a\\r\\nganhar votos pra ganhar do Lulla.\\r\\nE a maioria dos votos da Simone e do Cir0 vão pro Molusc0.\\r\\n\\r\\n\\r\\nDifícil ele ganhar. Acho eu.', 'authorDisplayName': 'Lord Supremo', 'authorProfileImageUrl': 'https://yt3.ggpht.com/xm2gdsMsSf41m85mlrWTT8pVYuBzeoIW4RDYr4wKTQocs0saalCfiSPOmgFktU8HiRi5u0Ck=s48-c-k-c0x00ffffff-no-rj', 'authorChannelUrl': 'http://www.youtube.com/channel/UCqfJc2eS1ht05uIKR7jxUzQ', 'authorChannelId': {'value': 'UCqfJc2eS1ht05uIKR7jxUzQ'}, 'canRate': True, 'viewerRating': 'none', 'likeCount': 2, 'publishedAt': '2022-10-19T03:13:32Z', 'updatedAt': '2022-10-19T03:13:32Z'}}, 'canReply': True, 'totalReplyCount': 0, 'isPublic': True}",,UCqfJc2eS1ht05uIKR7jxUzQ,2022-10-19T03:13:32Z,"No rock in rio cabem 100 mil pessoas.
É um mar de gente.
Pro Bols0naro EMPATAR com o Lulla, ele precisa de 61 rock in rios LOTADOS, e mais um
Estádio do Maracanã LOTADO com TODOS os vot0s pra ele, pra só daí então ele começar a
ganhar votos pra ganhar do Lulla.
E a maioria dos votos da Simone e do Cir0 vão pro Molusc0.


Difícil ele ganhar. Acho eu.",,2023-06-09 04:21:01.321226
youtube#commentThread,NLJgAnOnrCYM-555sZjFF3hPcB8,UgzjjPfkFCXUXy_9PwN4AaABAg,"{'videoId': 'P-4EgU_-ffU', 'topLevelComment': {'kind': 'youtube#comment', 'etag': 'd47wV8QSBlh-pkwOROcZdTkRYe4', 'id': 'UgzjjPfkFCXUXy_9PwN4AaABAg', 'snippet': {'videoId': 'P-4EgU_-ffU', 'textDisplay': '!!', 'textOriginal': '!!', 'authorDisplayName': 'Iago Borges', 'authorProfileImageUrl': 'https://yt3.ggpht.com/ytc/AGIKgqPcVYORQ5FId-VtHIGSepBuZJtBK2Wz_YiOJgTIiA=s48-c-k-c0x00ffffff-no-rj', 'authorChannelUrl': 'http://www.youtube.com/channel/UCVkuUyX4eLY4LqAEy1k9baQ', 'authorChannelId': {'value': 'UCVkuUyX4eLY4LqAEy1k9baQ'}, 'canRate': True, 'viewerRating': 'none', 'likeCount': 0, 'publishedAt': '2022-10-19T03:12:50Z', 'updatedAt': '2022-10-19T03:12:50Z'}}, 'canReply': True, 'totalReplyCount': 0, 'isPublic': True}",,UCVkuUyX4eLY4LqAEy1k9baQ,2022-10-19T03:12:50Z,!!,,2023-06-09 04:21:01.321226
youtube#commentThread,0qzPNr1Mq_r2fhs9CDxEcCmullM,Ugx8opoG0c-lBNtIVld4AaABAg,"{'videoId': 'P-4EgU_-ffU', 'topLevelComment': {'kind': 'youtube#comment', 'etag': 'dL96zGfgZEQZJHNC8mI9cbPvf2g', 'id': 'Ugx8opoG0c-lBNtIVld4AaABAg', 'snippet': {'videoId': 'P-4EgU_-ffU', 'textDisplay': 'Como Beraldo é ingênuo! (Ou fingido.) Ele acha que a candidatura Bolsonaro foi construída a partir de <b>DOIS MIL E DEZOITO</b> 🤦 e que seu grande artífice foi Carlos Bolsonaro. 🙄😆😆😆<br>Como é tolinho! Dá até pena. (Ou raiva.)<br><br>Esse aí precisa ler Piero Leirner. Se é que ele já não sabe.', 'textOriginal': 'Como Beraldo é ingênuo! (Ou fingido.) Ele acha que a candidatura Bolsonaro foi construída a partir de *DOIS MIL E DEZOITO* 🤦 e que seu grande artífice foi Carlos Bolsonaro. 🙄😆😆😆\\nComo é tolinho! Dá até pena. (Ou raiva.)\\n\\nEsse aí precisa ler Piero Leirner. Se é que ele já não sabe.', 'authorDisplayName': 'Hudson Moraes', 'authorProfileImageUrl': 'https://yt3.ggpht.com/ytc/AGIKgqOGUmpCKSewtunxehPD9A2aX_LMtbuxM5aQ0A=s48-c-k-c0x00ffffff-no-rj', 'authorChannelUrl': 'http://www.youtube.com/channel/UCYsZx-vUFbmzktfIh_hLAPA', 'authorChannelId': {'value': 'UCYsZx-vUFbmzktfIh_hLAPA'}, 'canRate': True, 'viewerRating': 'none', 'likeCount': 0, 'publishedAt': '2022-10-19T02:59:49Z', 'updatedAt': '2022-10-19T02:59:49Z'}}, 'canReply': True, 'totalReplyCount': 2, 'isPublic': True}","{'comments': [{'kind': 'youtube#comment', 'etag': 'VXtdZIgGN9c8NnytC90X-ua6CrM', 'id': 'Ugx8opoG0c-lBNtIVld4AaABAg.9hLmxlwZWKV9hLtztSYBBq', 'snippet': {'videoId': 'P-4EgU_-ffU', 'textDisplay': 'O apoio dos militares à candidatura Bolsonaro NÃO FOI um improviso.<br>Estou com preguiça de explicar o resto.', 'textOriginal': 'O apoio dos militares à candidatura Bolsonaro NÃO FOI um improviso.\\nEstou com preguiça de explicar o resto.', 'parentId': 'Ugx8opoG0c-lBNtIVld4AaABAg', 'authorDisplayName': 'Hudson Moraes', 'authorProfileImageUrl': 'https://yt3.ggpht.com/ytc/AGIKgqOGUmpCKSewtunxehPD9A2aX_LMtbuxM5aQ0A=s48-c-k-c0x00ffffff-no-rj', 'authorChannelUrl': 'http://www.youtube.com/channel/UCYsZx-vUFbmzktfIh_hLAPA', 'authorChannelId': {'value': 'UCYsZx-vUFbmzktfIh_hLAPA'}, 'canRate': True, 'viewerRating': 'none', 'likeCount': 0, 'publishedAt': '2022-10-19T04:01:16Z', 'updatedAt': '2022-10-19T04:01:16Z'}}, {'kind': 'youtube#comment', 'etag': '0lpvxi2kRPltU899ZBNOhj_Wv9o', 'id': 'Ugx8opoG0c-lBNtIVld4AaABAg.9hLmxlwZWKV9hLtU6Bm0pD', 'snippet': {'videoId': 'P-4EgU_-ffU', 'textDisplay': 'E cadê o erro?', 'textOriginal': 'E cadê o erro?', 'parentId': 'Ugx8opoG0c-lBNtIVld4AaABAg', 'authorDisplayName': 'Keltke GK', 'authorProfileImageUrl': 'https://yt3.ggpht.com/ytc/AGIKgqMJ3vOF-gEc_q91ebk7wahc6MtPR3KRWozk58wYmQ=s48-c-k-c0x00ffffff-no-rj', 'authorChannelUrl': 'http://www.youtube.com/channel/UCGc0q0ta72c3cg56L1HXxOQ', 'authorChannelId': {'value': 'UCGc0q0ta72c3cg56L1HXxOQ'}, 'canRate': True, 'viewerRating': 'none', 'likeCount': 0, 'publishedAt': '2022-10-19T03:56:47Z', 'updatedAt': '2022-10-19T03:56:47Z'}}]}",UCYsZx-vUFbmzktfIh_hLAPA,2022-10-19T02:59:49Z,"Como Beraldo é ingênuo! (Ou fingido.) Ele acha que a candidatura Bolsonaro foi construída a partir de *DOIS MIL E DEZOITO* 🤦 e que seu grande artífice foi Carlos Bolsonaro. 🙄😆😆😆
Como é tolinho! Dá até pena. (Ou raiva.)

Esse aí precisa ler Piero Leirner. Se é que ele já não sabe.",,2023-06-09 04:21:01.321226
youtube#commentThread,9KpPuxvm3ks3aUu0fZ_dh9J_xhk,UgysfUJBW4Z2-mwW72B4AaABAg,"{'videoId': 'P-4EgU_-ffU', 'topLevelComment': {'kind': 'youtube#comment', 'etag': 'gAdKh1mBBXYl4mUrlDkakIfrQaM', 'id': 'UgysfUJBW4Z2-mwW72B4AaABAg', 'snippet': {'videoId': 'P-4EgU_-ffU', 'textDisplay': 'Posso estar errado, mas acho que Bolsonaro leva. E, ele levando, em 2026, fica um espaço muito amplo para o Gentilli ganhar. Bolsonaro vai botar um poste, Lula não vem e o PT vai colocar um poste também, aí vem o Zema e os outros postes.', 'textOriginal': 'Posso estar errado, mas acho que Bolsonaro leva. E, ele levando, em 2026, fica um espaço muito amplo para o Gentilli ganhar. Bolsonaro vai botar um poste, Lula não vem e o PT vai colocar um poste também, aí vem o Zema e os outros postes.', 'authorDisplayName': 'Pedro Thaylon Souza', 'authorProfileImageUrl': 'https://yt3.ggpht.com/ytc/AGIKgqOApv4acggK2Tit4FVC8_0YMiI804NYpfAgOimKDgE=s48-c-k-c0x00ffffff-no-rj', 'authorChannelUrl': 'http://www.youtube.com/channel/UCVoaSWE0S8177Wcyj7PW92A', 'authorChannelId': {'value': 'UCVoaSWE0S8177Wcyj7PW92A'}, 'canRate': True, 'viewerRating': 'none', 'likeCount': 0, 'publishedAt': '2022-10-19T02:54:50Z', 'updatedAt': '2022-10-19T02:54:50Z'}}, 'canReply': True, 'totalReplyCount': 0, 'isPublic': True}",,UCVoaSWE0S8177Wcyj7PW92A,2022-10-19T02:54:50Z,"Posso estar errado, mas acho que Bolsonaro leva. E, ele levando, em 2026, fica um espaço muito amplo para o Gentilli ganhar. Bolsonaro vai botar um poste, Lula não vem e o PT vai colocar um poste também, aí vem o Zema e os outros postes.",,2023-06-09 04:21:01.321226
youtube#commentThread,cH7qg7qAVwMW_aDZ4KHIkrE-1ss,UgyXRDzWsvfthhbIeZZ4AaABAg,"{'videoId': 'P-4EgU_-ffU', 'topLevelComment': {'kind': 'youtube#comment', 'etag': 'hmZNaQT_ynL27wyhTDnmRJDXfOw', 'id': 'UgyXRDzWsvfthhbIeZZ4AaABAg', 'snippet': {'videoId': 'P-4EgU_-ffU', 'textDisplay': 'Façam trio com Renan Beraldo Ricardo', 'textOriginal': 'Façam trio com Renan Beraldo Ricardo', 'authorDisplayName': 'Samuel', 'authorProfileImageUrl': 'https://yt3.ggpht.com/ytc/AGIKgqNnB39PWEcfT1HrUyEyymIBVOsU0VpsRk0D1QQ0=s48-c-k-c0x00ffffff-no-rj', 'authorChannelUrl': 'http://www.youtube.com/channel/UCfKLX4Bwy4q8MbV9vK9f1CA', 'authorChannelId': {'value': 'UCfKLX4Bwy4q8MbV9vK9f1CA'}, 'canRate': True, 'viewerRating': 'none', 'likeCount': 14, 'publishedAt': '2022-10-19T02:51:18Z', 'updatedAt': '2022-10-19T02:51:18Z'}}, 'canReply': True, 'totalReplyCount': 1, 'isPublic': True}","{'comments': [{'kind': 'youtube#comment', 'etag': 'Gd0PQYxyHjEd4yAHuf6crP4ofJk', 'id': 'UgyXRDzWsvfthhbIeZZ4AaABAg.9hLlzPBeqgy9hMVKFNK7-R', 'snippet': {'videoId': 'P-4EgU_-ffU', 'textDisplay': 'É o melhor trio pro News.. Arthur e Kim são muito bons nos seus canais, mas quando estão no News, eles parecem que fazem de mal vontade.', 'textOriginal': 'É o melhor trio pro News.. Arthur e Kim são muito bons nos seus canais, mas quando estão no News, eles parecem que fazem de mal vontade.', 'parentId': 'UgyXRDzWsvfthhbIeZZ4AaABAg', 'authorDisplayName': 'Artur Almeida', 'authorProfileImageUrl': 'https://yt3.ggpht.com/ytc/AGIKgqOw4foazDYqrJmvjKH4mR9n6TijevVmW35VdQ=s48-c-k-c0x00ffffff-no-rj', 'authorChannelUrl': 'http://www.youtube.com/channel/UCT4lUWP8XJh2YMEqmCnhGyg', 'authorChannelId': {'value': 'UCT4lUWP8XJh2YMEqmCnhGyg'}, 'canRate': True, 'viewerRating': 'none', 'likeCount': 1, 'publishedAt': '2022-10-19T09:36:14Z', 'updatedAt': '2022-10-19T09:36:14Z'}}]}",UCfKLX4Bwy4q8MbV9vK9f1CA,2022-10-19T02:51:18Z,Façam trio com Renan Beraldo Ricardo,,2023-06-09 04:21:01.321226
