kind,etag,id,snippet,replies,authorChannelId,publishedAt,textOriginal,nextPageToken,extraction_date
youtube#commentThread,ETvzVQicZxs0JOT2CCGfAL7euq0,UgwEeyD9oxh8qEX9kZ14AaABAg,"{'videoId': 'FXaLx1FVD1g', 'topLevelComment': {'kind': 'youtube#comment', 'etag': 'odt-MaqEVzBWbWzb-AZPnNC8Y1E', 'id': 'UgwEeyD9oxh8qEX9kZ14AaABAg', 'snippet': {'videoId': 'FXaLx1FVD1g', 'textDisplay': 'PARABÉNS  E MUITAS BÊNÇÃOS AOS GUERREIROS CAMINHONEIROS !!!!<br>BRASIL  PRECISA DAR UM FORA TOTAL NESSA FORMAÇÃO VERGONHOSA DO STF/STE .Que votem em quem quiserem, mas proteção  a candidato x de partido X , isso está  errado!!!!', 'textOriginal': 'PARABÉNS  E MUITAS BÊNÇÃOS AOS GUERREIROS CAMINHONEIROS !!!!\\\\nBRASIL  PRECISA DAR UM FORA TOTAL NESSA FORMAÇÃO VERGONHOSA DO STF/STE .Que votem em quem quiserem, mas proteção  a candidato x de partido X , isso está  errado!!!!', 'authorDisplayName': 'Helida Aparecida Vieira', 'authorProfileImageUrl': 'https://yt3.ggpht.com/ytc/AGIKgqPd2vkp7JtFxxlXf6T-sgn2WkjrShvUlRrTSQ=s48-c-k-c0x00ffffff-no-rj', 'authorChannelUrl': 'http://www.youtube.com/channel/UCaA_Rxczg58uGdEfpJpmBHw', 'authorChannelId': {'value': 'UCaA_Rxczg58uGdEfpJpmBHw'}, 'canRate': True, 'viewerRating': 'none', 'likeCount': 41, 'publishedAt': '2022-10-22T14:19:02Z', 'updatedAt': '2022-10-22T14:21:59Z'}}, 'canReply': True, 'totalReplyCount': 0, 'isPublic': True}",,UCaA_Rxczg58uGdEfpJpmBHw,2022-10-22T14:19:02Z,"PARABÉNS  E MUITAS BÊNÇÃOS AOS GUERREIROS CAMINHONEIROS !!!!
BRASIL  PRECISA DAR UM FORA TOTAL NESSA FORMAÇÃO VERGONHOSA DO STF/STE .Que votem em quem quiserem, mas proteção  a candidato x de partido X , isso está  errado!!!!",QURTSl9pM2hHNTZYRVloLXlmY1Bsdlc5RFVtcHF3a05GZ2p1XzVzQktlNnp2NFo4aVJhM0s2MnNld2lqS2J4LWozUUZDODV0QmRxX2ZjQQ==,2023-06-08 15:06:54.612144
youtube#commentThread,ujaD1-bAdShbT9ESEgfm6KtZ5WU,Ugw2Q34T44tC68RceQN4AaABAg,"{'videoId': 'UgguCZQgW8E', 'topLevelComment': {'kind': 'youtube#comment', 'etag': 'xDjMyiOgvC8NuUeD-Hiy003ll78', 'id': 'Ugw2Q34T44tC68RceQN4AaABAg', 'snippet': {'videoId': 'UgguCZQgW8E', 'textDisplay': 'Pesquisas manipuladas para ganhar votos dos que não  buscam informações  e dizem que não  votam pra perder!!! Foi por isso que o PT ACABOU COM A QUALIDADE DO ENSINO PÚBLICO NO BRASIL!!! PT GOSTA DE DOUTRINAR E NÃO  DE  ENSINAR!!!', 'textOriginal': 'Pesquisas manipuladas para ganhar votos dos que não  buscam informações  e dizem que não  votam pra perder!!! Foi por isso que o PT ACABOU COM A QUALIDADE DO ENSINO PÚBLICO NO BRASIL!!! PT GOSTA DE DOUTRINAR E NÃO  DE  ENSINAR!!!', 'authorDisplayName': 'Helida Aparecida Vieira', 'authorProfileImageUrl': 'https://yt3.ggpht.com/ytc/AGIKgqPd2vkp7JtFxxlXf6T-sgn2WkjrShvUlRrTSQ=s48-c-k-c0x00ffffff-no-rj', 'authorChannelUrl': 'http://www.youtube.com/channel/UCaA_Rxczg58uGdEfpJpmBHw', 'authorChannelId': {'value': 'UCaA_Rxczg58uGdEfpJpmBHw'}, 'canRate': True, 'viewerRating': 'none', 'likeCount': 1, 'publishedAt': '2022-10-22T14:11:59Z', 'updatedAt': '2022-10-22T14:11:59Z'}}, 'canReply': True, 'totalReplyCount': 0, 'isPublic': True}",,UCaA_Rxczg58uGdEfpJpmBHw,2022-10-22T14:11:59Z,Pesquisas manipuladas para ganhar votos dos que não  buscam informações  e dizem que não  votam pra perder!!! Foi por isso que o PT ACABOU COM A QUALIDADE DO ENSINO PÚBLICO NO BRASIL!!! PT GOSTA DE DOUTRINAR E NÃO  DE  ENSINAR!!!,QURTSl9pMk56aEwwY3JTTGNrMVluVUZxczNhdFAteUVQdVM3eWVYWGJNTEp0LUNTTzNhbGljOC1ITUJMbkltX3ZSR1Y1UkFyNzRFR3Q1QQ==,2023-06-08 15:07:12.080089
youtube#commentThread,_9WubhdXL16pK1fGJAP3N1oAoGw,UgwNVGWZIg5Ar89xOoF4AaABAg,"{'videoId': 'b7AwRnLQkF0', 'topLevelComment': {'kind': 'youtube#comment', 'etag': 'cAI_hSpRj0hgMcYUzNMJ_45bjnc', 'id': 'UgwNVGWZIg5Ar89xOoF4AaABAg', 'snippet': {'videoId': 'b7AwRnLQkF0', 'textDisplay': 'Não é politicamente correto, mas o Roberto Jefferson,  fez o que o Brasil gostaria de fazer:::: ESSE SUPREMO TÁ  UM VERDADEIRA ABERRAÇÃO!!!', 'textOriginal': 'Não é politicamente correto, mas o Roberto Jefferson,  fez o que o Brasil gostaria de fazer:::: ESSE SUPREMO TÁ  UM VERDADEIRA ABERRAÇÃO!!!', 'authorDisplayName': 'Helida Aparecida Vieira', 'authorProfileImageUrl': 'https://yt3.ggpht.com/ytc/AGIKgqPd2vkp7JtFxxlXf6T-sgn2WkjrShvUlRrTSQ=s48-c-k-c0x00ffffff-no-rj', 'authorChannelUrl': 'http://www.youtube.com/channel/UCaA_Rxczg58uGdEfpJpmBHw', 'authorChannelId': {'value': 'UCaA_Rxczg58uGdEfpJpmBHw'}, 'canRate': True, 'viewerRating': 'none', 'likeCount': 2, 'publishedAt': '2022-10-22T13:44:30Z', 'updatedAt': '2022-10-22T13:44:30Z'}}, 'canReply': True, 'totalReplyCount': 0, 'isPublic': True}",,UCaA_Rxczg58uGdEfpJpmBHw,2022-10-22T13:44:30Z,"Não é politicamente correto, mas o Roberto Jefferson,  fez o que o Brasil gostaria de fazer:::: ESSE SUPREMO TÁ  UM VERDADEIRA ABERRAÇÃO!!!",QURTSl9pM28wd3FMV2U2VENDR3VnZS1wNXU0WUNwWS04QnpiX1FYRHpJQV91cE1KN09YU0g5QTlFeDd6Z2swQVFSSEt0a1ZLWEdHdW90bw==,2023-06-08 15:07:48.329667
youtube#commentThread,ocqw_OALYxYfEoGNnkDN9n_NyUg,UgyrKb6sy84HJdbl4nl4AaABAg,"{'videoId': 'a2bDTWfMOCU', 'topLevelComment': {'kind': 'youtube#comment', 'etag': 'lH7QkfKubBIF2uHs8aCr9lXFtIg', 'id': 'UgyrKb6sy84HJdbl4nl4AaABAg', 'snippet': {'videoId': 'a2bDTWfMOCU', 'textDisplay': 'ALKIMIN ESTÁ APOSTANDO  NA VITÓRIA E  NA POSSÍVEL MORTE DE LULA, PARA CHEGAR À PRESIDÊNCIA DO BRASIL   JÁ  QUE POR CONTA PRÓPRIA ESSE INERGUMENE NÃO  CHEGA A LUGAR NENHUM!!!', 'textOriginal': 'ALKIMIN ESTÁ APOSTANDO  NA VITÓRIA E  NA POSSÍVEL MORTE DE LULA, PARA CHEGAR À PRESIDÊNCIA DO BRASIL   JÁ  QUE POR CONTA PRÓPRIA ESSE INERGUMENE NÃO  CHEGA A LUGAR NENHUM!!!', 'authorDisplayName': 'Helida Aparecida Vieira', 'authorProfileImageUrl': 'https://yt3.ggpht.com/ytc/AGIKgqPd2vkp7JtFxxlXf6T-sgn2WkjrShvUlRrTSQ=s48-c-k-c0x00ffffff-no-rj', 'authorChannelUrl': 'http://www.youtube.com/channel/UCaA_Rxczg58uGdEfpJpmBHw', 'authorChannelId': {'value': 'UCaA_Rxczg58uGdEfpJpmBHw'}, 'canRate': True, 'viewerRating': 'none', 'likeCount': 0, 'publishedAt': '2022-10-22T13:56:54Z', 'updatedAt': '2022-10-22T13:56:54Z'}}, 'canReply': True, 'totalReplyCount': 0, 'isPublic': True}",,UCaA_Rxczg58uGdEfpJpmBHw,2022-10-22T13:56:54Z,"ALKIMIN ESTÁ APOSTANDO  NA VITÓRIA E  NA POSSÍVEL MORTE DE LULA, PARA CHEGAR À PRESIDÊNCIA DO BRASIL   JÁ  QUE POR CONTA PRÓPRIA ESSE INERGUMENE NÃO  CHEGA A LUGAR NENHUM!!!",QURTSl9pMzkyWVlBY0JEcUYyeWt5U1J2N2NLX2VRcS10UlNIQmlyTFJMNXdpR2VReVd0Nno2YS1Ocnk1c3Bpcm9taExBdVQ1RkZ1ZXpZVQ==,2023-06-08 15:08:00.519835
youtube#commentThread,TEPXmsFCG0oozmqZANQON1kBMdg,UgxkySHTtvm2_HJBE_94AaABAg,"{'videoId': 'gfi8oLYbstE', 'topLevelComment': {'kind': 'youtube#comment', 'etag': 'BYmFFcY5yEXcWAB6ACdgVrdDU9Q', 'id': 'UgxkySHTtvm2_HJBE_94AaABAg', 'snippet': {'videoId': 'gfi8oLYbstE', 'textDisplay': 'Minas Gerais!!!! Ainda  dá tempo de  ACORDAR!!!! ESSA TEBET E ESSE ALKIMIN, NÃO  VALEM O FEIJÃO  QUE COMEM !!!!!  OLHA, OUÇAM  E AVALIEM  O QUE ESSES DOIS JÁ  FALARAM DO LULALADRÂO!!!', 'textOriginal': 'Minas Gerais!!!! Ainda  dá tempo de  ACORDAR!!!! ESSA TEBET E ESSE ALKIMIN, NÃO  VALEM O FEIJÃO  QUE COMEM !!!!!  OLHA, OUÇAM  E AVALIEM  O QUE ESSES DOIS JÁ  FALARAM DO LULALADRÂO!!!', 'authorDisplayName': 'Helida Aparecida Vieira', 'authorProfileImageUrl': 'https://yt3.ggpht.com/ytc/AGIKgqPd2vkp7JtFxxlXf6T-sgn2WkjrShvUlRrTSQ=s48-c-k-c0x00ffffff-no-rj', 'authorChannelUrl': 'http://www.youtube.com/channel/UCaA_Rxczg58uGdEfpJpmBHw', 'authorChannelId': {'value': 'UCaA_Rxczg58uGdEfpJpmBHw'}, 'canRate': True, 'viewerRating': 'none', 'likeCount': 1, 'publishedAt': '2022-10-22T14:37:55Z', 'updatedAt': '2022-10-22T14:37:55Z'}}, 'canReply': True, 'totalReplyCount': 0, 'isPublic': True}",,UCaA_Rxczg58uGdEfpJpmBHw,2022-10-22T14:37:55Z,"Minas Gerais!!!! Ainda  dá tempo de  ACORDAR!!!! ESSA TEBET E ESSE ALKIMIN, NÃO  VALEM O FEIJÃO  QUE COMEM !!!!!  OLHA, OUÇAM  E AVALIEM  O QUE ESSES DOIS JÁ  FALARAM DO LULALADRÂO!!!",QURTSl9pMWpHNHVYTWNOWnBGaWRFNmtYX2NEcURZV21zM0VEb0lHQnJGV0hDWVJPQmVRZFhzZGtHLWJTemlITDVqVWdlZjNFZ1paakNjRQ==,2023-06-08 15:08:19.787862
youtube#commentThread,f-5nTXPmChjMzZ5dUzGNfIqpb_s,UgyeK56iWU5-5VTYWOx4AaABAg,"{'videoId': 'ss6uQNvSsLI', 'topLevelComment': {'kind': 'youtube#comment', 'etag': 'fLJy811_A77iYiZ1Ey9qNXZX1Rk', 'id': 'UgyeK56iWU5-5VTYWOx4AaABAg', 'snippet': {'videoId': 'ss6uQNvSsLI', 'textDisplay': 'Tenho fé no brasileiro.... BOLSONARO SIM !!!!   LULA NUNCA MAIS!!!!!', 'textOriginal': 'Tenho fé no brasileiro.... BOLSONARO SIM !!!!   LULA NUNCA MAIS!!!!!', 'authorDisplayName': 'Helida Aparecida Vieira', 'authorProfileImageUrl': 'https://yt3.ggpht.com/ytc/AGIKgqPd2vkp7JtFxxlXf6T-sgn2WkjrShvUlRrTSQ=s48-c-k-c0x00ffffff-no-rj', 'authorChannelUrl': 'http://www.youtube.com/channel/UCaA_Rxczg58uGdEfpJpmBHw', 'authorChannelId': {'value': 'UCaA_Rxczg58uGdEfpJpmBHw'}, 'canRate': True, 'viewerRating': 'none', 'likeCount': 6, 'publishedAt': '2022-10-22T12:55:50Z', 'updatedAt': '2022-10-22T12:55:50Z'}}, 'canReply': True, 'totalReplyCount': 0, 'isPublic': True}",,UCaA_Rxczg58uGdEfpJpmBHw,2022-10-22T12:55:50Z,Tenho fé no brasileiro.... BOLSONARO SIM !!!!   LULA NUNCA MAIS!!!!!,QURTSl9pM0tPZ196Z3JWTDcydmsxbFpFVjlNYWRlYmNLM21MNXdUUi01WDBLQ21WY0FwMm1sYWphZGl0YlRGZ0VmQ0V5emY0YWhDOTZKWQ==,2023-06-08 15:08:42.030303
youtube#commentThread,WP3jtbkufiJ1EVHKD3_K0zHnY2I,UgxuYAmztNcaZgy9lNd4AaABAg,"{'videoId': 'bXgW41LAhuY', 'topLevelComment': {'kind': 'youtube#comment', 'etag': '3QDHwcequOHJoiAxHuE660lhcrI', 'id': 'UgxuYAmztNcaZgy9lNd4AaABAg', 'snippet': {'videoId': 'bXgW41LAhuY', 'textDisplay': 'Lula é um Covarde e tá morrendo de medo!!!! Só  vota em Lula as pessoas que ainda hoje desconhecem o mal caráter  desse indivíduo!!!!', 'textOriginal': 'Lula é um Covarde e tá morrendo de medo!!!! Só  vota em Lula as pessoas que ainda hoje desconhecem o mal caráter  desse indivíduo!!!!', 'authorDisplayName': 'Helida Aparecida Vieira', 'authorProfileImageUrl': 'https://yt3.ggpht.com/ytc/AGIKgqPd2vkp7JtFxxlXf6T-sgn2WkjrShvUlRrTSQ=s48-c-k-c0x00ffffff-no-rj', 'authorChannelUrl': 'http://www.youtube.com/channel/UCaA_Rxczg58uGdEfpJpmBHw', 'authorChannelId': {'value': 'UCaA_Rxczg58uGdEfpJpmBHw'}, 'canRate': True, 'viewerRating': 'none', 'likeCount': 0, 'publishedAt': '2022-10-22T12:50:26Z', 'updatedAt': '2022-10-22T12:50:26Z'}}, 'canReply': True, 'totalReplyCount': 0, 'isPublic': True}",,UCaA_Rxczg58uGdEfpJpmBHw,2022-10-22T12:50:26Z,Lula é um Covarde e tá morrendo de medo!!!! Só  vota em Lula as pessoas que ainda hoje desconhecem o mal caráter  desse indivíduo!!!!,QURTSl9pMDl3dS10OEU4MUpOMjBjclYxdmdJdjFCaThwSFc5YjdZNWNsVGVYQk1GR0U1b3ZJeGlCYW1kZUN4UERfT1picDBEbEN3MjJnNA==,2023-06-08 15:09:13.719836
youtube#commentThread,Zy5K7U8BkKr0XraE6jBl7EsxRD4,Ugws33WIyntUZ4iWl954AaABAg,"{'videoId': 'gARaO0Plt3U', 'topLevelComment': {'kind': 'youtube#comment', 'etag': 'HaY5TJeWA-AJRUKqTr9Hv4XOAj4', 'id': 'Ugws33WIyntUZ4iWl954AaABAg', 'snippet': {'videoId': 'gARaO0Plt3U', 'textDisplay': 'INCONSTITUCIONAL, ARBITRÁRIA e  PARTIDÁRIA !!! SÓ OS PILANTRAS PODEM FALAR, DEITAR E ROLAR!!!', 'textOriginal': 'INCONSTITUCIONAL, ARBITRÁRIA e  PARTIDÁRIA !!! SÓ OS PILANTRAS PODEM FALAR, DEITAR E ROLAR!!!', 'authorDisplayName': 'Helida Aparecida Vieira', 'authorProfileImageUrl': 'https://yt3.ggpht.com/ytc/AGIKgqPd2vkp7JtFxxlXf6T-sgn2WkjrShvUlRrTSQ=s48-c-k-c0x00ffffff-no-rj', 'authorChannelUrl': 'http://www.youtube.com/channel/UCaA_Rxczg58uGdEfpJpmBHw', 'authorChannelId': {'value': 'UCaA_Rxczg58uGdEfpJpmBHw'}, 'canRate': True, 'viewerRating': 'none', 'likeCount': 1, 'publishedAt': '2022-10-22T00:17:43Z', 'updatedAt': '2022-10-22T00:17:43Z'}}, 'canReply': True, 'totalReplyCount': 0, 'isPublic': True}",,UCaA_Rxczg58uGdEfpJpmBHw,2022-10-22T00:17:43Z,"INCONSTITUCIONAL, ARBITRÁRIA e  PARTIDÁRIA !!! SÓ OS PILANTRAS PODEM FALAR, DEITAR E ROLAR!!!",QURTSl9pMU01QURBWEpHNnBHV2FBdVdFVzRoMmVacldyb05ONUFULW11M2JvZlpLSkVrS09YcDA1RnBqLTdaWXVsdnBNQTdlWjh4UkVqQQ==,2023-06-08 15:09:35.101217
youtube#commentThread,7Or4lqAQZ77ZTezMk1qwIuvkeLk,UgwxqXBjaF25BZe1O6B4AaABAg,"{'videoId': 'lJ1CB6lLx-I', 'topLevelComment': {'kind': 'youtube#comment', 'etag': 'w_KolWBqQgDKvg1LxRw11Yopd2o', 'id': 'UgwxqXBjaF25BZe1O6B4AaABAg', 'snippet': {'videoId': 'lJ1CB6lLx-I', 'textDisplay': 'ENFIM...O BRASIL ESTÁ  PERDIDO!!!!', 'textOriginal': 'ENFIM...O BRASIL ESTÁ  PERDIDO!!!!', 'authorDisplayName': 'Helida Aparecida Vieira', 'authorProfileImageUrl': 'https://yt3.ggpht.com/ytc/AGIKgqPd2vkp7JtFxxlXf6T-sgn2WkjrShvUlRrTSQ=s48-c-k-c0x00ffffff-no-rj', 'authorChannelUrl': 'http://www.youtube.com/channel/UCaA_Rxczg58uGdEfpJpmBHw', 'authorChannelId': {'value': 'UCaA_Rxczg58uGdEfpJpmBHw'}, 'canRate': True, 'viewerRating': 'none', 'likeCount': 4, 'publishedAt': '2022-10-31T02:32:38Z', 'updatedAt': '2022-10-31T02:32:38Z'}}, 'canReply': True, 'totalReplyCount': 0, 'isPublic': True}",,UCaA_Rxczg58uGdEfpJpmBHw,2022-10-31T02:32:38Z,ENFIM...O BRASIL ESTÁ  PERDIDO!!!!,QURTSl9pMGhlVVNPYV9QX2ItbGlYVm92UXY5NW1NWHhBX081Q2t6YXFqTUZMazZzeEpfWFB2My05YTQzQUNlMTNmcjg4dl9XOFBCZkpGYw==,2023-06-08 14:06:32.579725
youtube#commentThread,1J58O5sMDOUoei37Jf9ZoBCX3k4,UgxVTgWImm5eSYGk7RZ4AaABAg,"{'videoId': 'Ugzshhgf7Lw', 'topLevelComment': {'kind': 'youtube#comment', 'etag': 'j3uwIDFDsLZmCgNqpY3xsDD5JXc', 'id': 'UgxVTgWImm5eSYGk7RZ4AaABAg', 'snippet': {'videoId': 'Ugzshhgf7Lw', 'textDisplay': 'O nine jamais terá  o amor da população', 'textOriginal': 'O nine jamais terá  o amor da população', 'authorDisplayName': 'Helida Aparecida Vieira', 'authorProfileImageUrl': 'https://yt3.ggpht.com/ytc/AGIKgqPd2vkp7JtFxxlXf6T-sgn2WkjrShvUlRrTSQ=s48-c-k-c0x00ffffff-no-rj', 'authorChannelUrl': 'http://www.youtube.com/channel/UCaA_Rxczg58uGdEfpJpmBHw', 'authorChannelId': {'value': 'UCaA_Rxczg58uGdEfpJpmBHw'}, 'canRate': True, 'viewerRating': 'none', 'likeCount': 0, 'publishedAt': '2022-10-31T01:38:40Z', 'updatedAt': '2022-10-31T01:38:40Z'}}, 'canReply': True, 'totalReplyCount': 0, 'isPublic': True}",,UCaA_Rxczg58uGdEfpJpmBHw,2022-10-31T01:38:40Z,O nine jamais terá  o amor da população,QURTSl9pMWozSXp5TzF0WENtdUpyQVZXeG5yWFVFYUUzREFyaFRUZUUwUzJQUnR5cURDOTJYUEdpNS1Va0lLLVNvWmRJY3BYbG5vQXNQNA==,2023-06-08 14:07:24.190868
youtube#commentThread,rzq_pi72P6ywrYifGc8Y0jbNZvw,UgxS9rRKyx3vg8wy4BV4AaABAg,"{'videoId': 'Ugzshhgf7Lw', 'topLevelComment': {'kind': 'youtube#comment', 'etag': 'SFp-0sycIYvGmH-oXW0imlh3P2Y', 'id': 'UgxS9rRKyx3vg8wy4BV4AaABAg', 'snippet': {'videoId': 'Ugzshhgf7Lw', 'textDisplay': 'Parabéns  Tarcísio,  Bolsonaro  sempre será  o &quot;nosso presidente&quot; !!!', 'textOriginal': 'Parabéns  Tarcísio,  Bolsonaro  sempre será  o ""nosso presidente"" !!!', 'authorDisplayName': 'Helida Aparecida Vieira', 'authorProfileImageUrl': 'https://yt3.ggpht.com/ytc/AGIKgqPd2vkp7JtFxxlXf6T-sgn2WkjrShvUlRrTSQ=s48-c-k-c0x00ffffff-no-rj', 'authorChannelUrl': 'http://www.youtube.com/channel/UCaA_Rxczg58uGdEfpJpmBHw', 'authorChannelId': {'value': 'UCaA_Rxczg58uGdEfpJpmBHw'}, 'canRate': True, 'viewerRating': 'none', 'likeCount': 1, 'publishedAt': '2022-10-31T01:37:04Z', 'updatedAt': '2022-10-31T01:37:04Z'}}, 'canReply': True, 'totalReplyCount': 0, 'isPublic': True}",,UCaA_Rxczg58uGdEfpJpmBHw,2022-10-31T01:37:04Z,"Parabéns  Tarcísio,  Bolsonaro  sempre será  o ""nosso presidente"" !!!",QURTSl9pMWozSXp5TzF0WENtdUpyQVZXeG5yWFVFYUUzREFyaFRUZUUwUzJQUnR5cURDOTJYUEdpNS1Va0lLLVNvWmRJY3BYbG5vQXNQNA==,2023-06-08 14:07:24.190868
youtube#commentThread,-iziTzGqz_0FFl6o-SjQns4dxzU,Ugxb86UemGWAn7LQ6hd4AaABAg,"{'videoId': 'WU88jJw4nJU', 'topLevelComment': {'kind': 'youtube#comment', 'etag': 'ys7xmI8ZTd1j11nIHugJJYXiS80', 'id': 'Ugxb86UemGWAn7LQ6hd4AaABAg', 'snippet': {'videoId': 'WU88jJw4nJU', 'textDisplay': 'STF  VERGONHA DO BRASIL!!!!', 'textOriginal': 'STF  VERGONHA DO BRASIL!!!!', 'authorDisplayName': 'Helida Aparecida Vieira', 'authorProfileImageUrl': 'https://yt3.ggpht.com/ytc/AGIKgqPd2vkp7JtFxxlXf6T-sgn2WkjrShvUlRrTSQ=s48-c-k-c0x00ffffff-no-rj', 'authorChannelUrl': 'http://www.youtube.com/channel/UCaA_Rxczg58uGdEfpJpmBHw', 'authorChannelId': {'value': 'UCaA_Rxczg58uGdEfpJpmBHw'}, 'canRate': True, 'viewerRating': 'none', 'likeCount': 178, 'publishedAt': '2022-10-31T00:50:56Z', 'updatedAt': '2022-10-31T00:50:56Z'}}, 'canReply': True, 'totalReplyCount': 10, 'isPublic': True}","{'comments': [{'kind': 'youtube#comment', 'etag': '5EzCIoHd7lFlEQWZnGv95OqGdIc', 'id': 'Ugxb86UemGWAn7LQ6hd4AaABAg.9hpSkLaboWM9kFhhpWxRED', 'snippet': {'videoId': 'WU88jJw4nJU', 'textDisplay': '@Eduardo Santuche Só Se For Chefe Da Sua Mãe', 'textOriginal': '@Eduardo Santuche Só Se For Chefe Da Sua Mãe', 'parentId': 'Ugxb86UemGWAn7LQ6hd4AaABAg', 'authorDisplayName': 'Ice Cube', 'authorProfileImageUrl': 'https://yt3.ggpht.com/HrUEB8DXM9m5LR5c5g4YZPc9VIc3XMQCKi-DF6k9puyyd-2oAdJc2Q6IegpW-JuQOwkXK5D8=s48-c-k-c0x00ffffff-no-rj', 'authorChannelUrl': 'http://www.youtube.com/channel/UCeekhNgwA6n77EkGNVkqeIw', 'authorChannelId': {'value': 'UCeekhNgwA6n77EkGNVkqeIw'}, 'canRate': True, 'viewerRating': 'none', 'likeCount': 1, 'publishedAt': '2022-12-30T07:52:41Z', 'updatedAt': '2022-12-30T07:52:41Z'}}, {'kind': 'youtube#comment', 'etag': 'jK5azrlAJgtEb8SaNk_Mdof1v6E', 'id': 'Ugxb86UemGWAn7LQ6hd4AaABAg.9hpSkLaboWM9hpech7av6n', 'snippet': {'videoId': 'WU88jJw4nJU', 'textDisplay': 'LULA CHEFE SUPREMO DAS FORÇAS ARMADAS!!! O CHORO É LIVRE KKKKKKKKKKKKKKKKKKKKKKKKKKKKKKKKKKKKKKKKKKKKKKKKKKKKKKKKKKKKKKKKKKKK\\\\r<br>\\\\r!!!!!!!!!!!!', 'textOriginal': 'LULA CHEFE SUPREMO DAS FORÇAS ARMADAS!!! O CHORO É LIVRE KKKKKKKKKKKKKKKKKKKKKKKKKKKKKKKKKKKKKKKKKKKKKKKKKKKKKKKKKKKKKKKKKKKK\\\\r\\\\n\\\\r!!!!!!!!!!!!', 'parentId': 'Ugxb86UemGWAn7LQ6hd4AaABAg', 'authorDisplayName': 'Eduardo Santuche', 'authorProfileImageUrl': 'https://yt3.ggpht.com/ytc/AGIKgqMaYTJxLBVfm3T_EnfCUPwK3CWWKqUxkk7eSj1L4vokoLfQhyvjThwZRavpMAFY=s48-c-k-c0x00ffffff-no-rj', 'authorChannelUrl': 'http://www.youtube.com/channel/UCGoHApQxiPwcWEfP62U7KNQ', 'authorChannelId': {'value': 'UCGoHApQxiPwcWEfP62U7KNQ'}, 'canRate': True, 'viewerRating': 'none', 'likeCount': 0, 'publishedAt': '2022-10-31T02:43:29Z', 'updatedAt': '2022-10-31T02:43:29Z'}}, {'kind': 'youtube#comment', 'etag': 'Slll0uiu_VXAPlkTBR9fniwzHhA', 'id': 'Ugxb86UemGWAn7LQ6hd4AaABAg.9hpSkLaboWM9hp_4o86kX9', 'snippet': {'videoId': 'WU88jJw4nJU', 'textDisplay': 'TODOS OS BRASILEIROS SAO UMA VERGONHA... <br>NINGUEM REAGE NESSA POHHA!!!', 'textOriginal': 'TODOS OS BRASILEIROS SAO UMA VERGONHA... \\\\nNINGUEM REAGE NESSA POHHA!!!', 'parentId': 'Ugxb86UemGWAn7LQ6hd4AaABAg', 'authorDisplayName': 'ASMR (On Hold / Em construção)', 'authorProfileImageUrl': 'https://yt3.ggpht.com/YarR6CbyMKGLSPFaQ_szZxbc6yjMJ-nXdC4k7moumFWS6wVDOlNwYRXrMYyZFQP__zpp_NZgEA=s48-c-k-c0x00ffffff-no-rj', 'authorChannelUrl': 'http://www.youtube.com/channel/UC95oajCpyl5YIkam7Z0oL1w', 'authorChannelId': {'value': 'UC95oajCpyl5YIkam7Z0oL1w'}, 'canRate': True, 'viewerRating': 'none', 'likeCount': 0, 'publishedAt': '2022-10-31T01:55:02Z', 'updatedAt': '2022-10-31T01:55:02Z'}}, {'kind': 'youtube#comment', 'etag': 'OUhB_C8fmaPu-0g1knBdv8Xy90c', 'id': 'Ugxb86UemGWAn7LQ6hd4AaABAg.9hpSkLaboWM9hpZQkU5qeQ', 'snippet': {'videoId': 'WU88jJw4nJU', 'textDisplay': 'Vergonha são vcs Bolsonaristas', 'textOriginal': 'Vergonha são vcs Bolsonaristas', 'parentId': 'Ugxb86UemGWAn7LQ6hd4AaABAg', 'authorDisplayName': 'Fr Antonio Freitas', 'authorProfileImageUrl': 'https://yt3.ggpht.com/iJFHEgboYgRFUeC8XcLVJhlr3AbnJLNq1RX9bwaodqkMoIlM35pIlkTWpGlxhseD7rP_7hs9eOY=s48-c-k-c0x00ffffff-no-rj', 'authorChannelUrl': 'http://www.youtube.com/channel/UC7Kj3dP6ZQd-njXfj9QbQbA', 'authorChannelId': {'value': 'UC7Kj3dP6ZQd-njXfj9QbQbA'}, 'canRate': True, 'viewerRating': 'none', 'likeCount': 0, 'publishedAt': '2022-10-31T01:49:17Z', 'updatedAt': '2022-10-31T01:49:17Z'}}, {'kind': 'youtube#comment', 'etag': 'xxCh-eQuaASwzdzx9vHggoeGGJY', 'id': 'Ugxb86UemGWAn7LQ6hd4AaABAg.9hpSkLaboWM9hpVjNSoqXP', 'snippet': {'videoId': 'WU88jJw4nJU', 'textDisplay': 'Imagine o tipo de Corte Suprema tem o país que fez de tudo para eleger ao cargo mais alto do nosso país um ex-presidiário. Que belo exemplo lá fora hein? <br>Diante desse resultado é só esperar que no ano que vem o país ainda vai indenizar essa pessoa pela parte do dinheiro devolvido a Nação.', 'textOriginal': 'Imagine o tipo de Corte Suprema tem o país que fez de tudo para eleger ao cargo mais alto do nosso país um ex-presidiário. Que belo exemplo lá fora hein? \\\\nDiante desse resultado é só esperar que no ano que vem o país ainda vai indenizar essa pessoa pela parte do dinheiro devolvido a Nação.', 'parentId': 'Ugxb86UemGWAn7LQ6hd4AaABAg', 'authorDisplayName': 'lourdes marques', 'authorProfileImageUrl': 'https://yt3.ggpht.com/ytc/AGIKgqPdL3nLbLzkt0bovyc4evq71WqRQOOPUL1-gw=s48-c-k-c0x00ffffff-no-rj', 'authorChannelUrl': 'http://www.youtube.com/channel/UCM4ssKt-lcAZNSM-L5ZHHtg', 'authorChannelId': {'value': 'UCM4ssKt-lcAZNSM-L5ZHHtg'}, 'canRate': True, 'viewerRating': 'none', 'likeCount': 0, 'publishedAt': '2022-10-31T01:17:01Z', 'updatedAt': '2022-10-31T01:17:01Z'}}]}",UCaA_Rxczg58uGdEfpJpmBHw,2022-10-31T00:50:56Z,STF  VERGONHA DO BRASIL!!!!,,2023-06-08 14:08:25.419945
