kind,etag,id,snippet,replies,authorChannelId,publishedAt,textOriginal,nextPageToken,extraction_date
youtube#commentThread,dVmGo8eCxtoRuuUULDW3C2BOc2Q,Ugyc4MADaVPPULsHLi14AaABAg,"{'videoId': 'JfauouYUBTg', 'topLevelComment': {'kind': 'youtube#comment', 'etag': 'BeaL2Cwi8xL8L3evA8ho7bmqsyc', 'id': 'Ugyc4MADaVPPULsHLi14AaABAg', 'snippet': {'videoId': 'JfauouYUBTg', 'textDisplay': 'DORIA FICA EM CASA! Melhor para o partido, mas o pior governador para o povo trabalhador de São Paulo....', 'textOriginal': 'DORIA FICA EM CASA! Melhor para o partido, mas o pior governador para o povo trabalhador de São Paulo....', 'authorDisplayName': 'lucinei silva', 'authorProfileImageUrl': 'https://yt3.ggpht.com/ytc/AGIKgqONWr2IE-IbtHV8TlpSWXTNDRVmErDl7eMxQBaKiV8Swy_w-djzlxbQBT77Xn6m=s48-c-k-c0x00ffffff-no-rj', 'authorChannelUrl': 'http://www.youtube.com/channel/UCErhwB87UtLfpaYxLy_iVhw', 'authorChannelId': {'value': 'UCErhwB87UtLfpaYxLy_iVhw'}, 'canRate': True, 'viewerRating': 'none', 'likeCount': 0, 'publishedAt': '2022-10-20T11:45:53Z', 'updatedAt': '2022-10-20T11:47:43Z'}}, 'canReply': True, 'totalReplyCount': 0, 'isPublic': True}",,UCErhwB87UtLfpaYxLy_iVhw,2022-10-20T11:45:53Z,"DORIA FICA EM CASA! Melhor para o partido, mas o pior governador para o povo trabalhador de São Paulo....",QURTSl9pMzhkY3daRVdMSzA0OU5PYnJ1TlVqTDd3Z19CM1c1bVVNaXBpRXp4OGhMTzhsVkpxQlpZdmNxdXlYMFpkTnB2c3lCY0xHM0NVSQ==,2023-06-08 15:26:32.984226
youtube#commentThread,6KNvo20rnnEERYg4QAkXeurqKZs,UgxUm9r1NRvzKo87ZeB4AaABAg,"{'videoId': 'PMQLFm7QW9s', 'topLevelComment': {'kind': 'youtube#comment', 'etag': 'DIBLYapDIesbg7IqqWuWDgs7yAA', 'id': 'UgxUm9r1NRvzKo87ZeB4AaABAg', 'snippet': {'videoId': 'PMQLFm7QW9s', 'textDisplay': 'TODO PREFEITO DEVERIA SER CONTRA AS DROGAS! PARABÉNS RODRIGO MANGA! DEUS O ABENÇOE 🙏', 'textOriginal': 'TODO PREFEITO DEVERIA SER CONTRA AS DROGAS! PARABÉNS RODRIGO MANGA! DEUS O ABENÇOE 🙏', 'authorDisplayName': 'lucinei silva', 'authorProfileImageUrl': 'https://yt3.ggpht.com/ytc/AGIKgqONWr2IE-IbtHV8TlpSWXTNDRVmErDl7eMxQBaKiV8Swy_w-djzlxbQBT77Xn6m=s48-c-k-c0x00ffffff-no-rj', 'authorChannelUrl': 'http://www.youtube.com/channel/UCErhwB87UtLfpaYxLy_iVhw', 'authorChannelId': {'value': 'UCErhwB87UtLfpaYxLy_iVhw'}, 'canRate': True, 'viewerRating': 'none', 'likeCount': 2, 'publishedAt': '2022-10-20T11:41:53Z', 'updatedAt': '2022-10-20T11:41:53Z'}}, 'canReply': True, 'totalReplyCount': 0, 'isPublic': True}",,UCErhwB87UtLfpaYxLy_iVhw,2022-10-20T11:41:53Z,TODO PREFEITO DEVERIA SER CONTRA AS DROGAS! PARABÉNS RODRIGO MANGA! DEUS O ABENÇOE 🙏,QURTSl9pMmRnYkJrZVBSRDdWa2VIUFVmZk9iSVRpOGpQS203N1B4YWZWeUdtQUVVN3VNeFdzV0hGV1g0a3M2ZGdseGZLX0hSeEU3aTBGNA==,2023-06-08 15:26:56.274341
youtube#commentThread,mltPrftGGqvyG5g8KV7Z7X5IU-Y,UgxCqhqiL1LoPOaAqDF4AaABAg,"{'videoId': '7ekUtgMfteo', 'topLevelComment': {'kind': 'youtube#comment', 'etag': 'XBIlr5Ie729MRJ5nLG6FHgPzS74', 'id': 'UgxCqhqiL1LoPOaAqDF4AaABAg', 'snippet': {'videoId': '7ekUtgMfteo', 'textDisplay': 'ESTA TEIA DE ARANHA QUE O PT TECEU NESTES 20 ANOS DE GOVERNO ANTERIORES, É DE RESPONSABILIDADE DOS ELEITORES QUE O ELEGERAM. ELES TIVERAM TEMPO PARA DEIXAR TUDO DO JEITO QUE ESTÁ. MAS TUDO PODE PIORAR OU MELHORAR CONFORME NOSSAS ESCOLHAS. POR ISSO ESSAS ELEIÇÕES SAO TAO IMPORTANTES PARA LIVRAR OS BRASILEIROS DESTAS DITADURAS ESCONDIDAS POR TRAS DESTE SOCIALISMO AUTORITARIO E  CORRUPTO, DESTRUIDOR DE POVOS E NAÇÕES. POR FAVOR NESSAS ELEIÇÕES NÃO VAMOS PENSAR SOMENTE EM NÓS, EM COMER CARNE TODO DIA, PENSEMOS BEM EM NOSSOS FILHOS E NA NOSSA PROPRIA LIBERDADE.!', 'textOriginal': 'ESTA TEIA DE ARANHA QUE O PT TECEU NESTES 20 ANOS DE GOVERNO ANTERIORES, É DE RESPONSABILIDADE DOS ELEITORES QUE O ELEGERAM. ELES TIVERAM TEMPO PARA DEIXAR TUDO DO JEITO QUE ESTÁ. MAS TUDO PODE PIORAR OU MELHORAR CONFORME NOSSAS ESCOLHAS. POR ISSO ESSAS ELEIÇÕES SAO TAO IMPORTANTES PARA LIVRAR OS BRASILEIROS DESTAS DITADURAS ESCONDIDAS POR TRAS DESTE SOCIALISMO AUTORITARIO E  CORRUPTO, DESTRUIDOR DE POVOS E NAÇÕES. POR FAVOR NESSAS ELEIÇÕES NÃO VAMOS PENSAR SOMENTE EM NÓS, EM COMER CARNE TODO DIA, PENSEMOS BEM EM NOSSOS FILHOS E NA NOSSA PROPRIA LIBERDADE.!', 'authorDisplayName': 'lucinei silva', 'authorProfileImageUrl': 'https://yt3.ggpht.com/ytc/AGIKgqONWr2IE-IbtHV8TlpSWXTNDRVmErDl7eMxQBaKiV8Swy_w-djzlxbQBT77Xn6m=s48-c-k-c0x00ffffff-no-rj', 'authorChannelUrl': 'http://www.youtube.com/channel/UCErhwB87UtLfpaYxLy_iVhw', 'authorChannelId': {'value': 'UCErhwB87UtLfpaYxLy_iVhw'}, 'canRate': True, 'viewerRating': 'none', 'likeCount': 0, 'publishedAt': '2022-10-18T22:04:52Z', 'updatedAt': '2022-10-18T22:04:52Z'}}, 'canReply': True, 'totalReplyCount': 0, 'isPublic': True}",,UCErhwB87UtLfpaYxLy_iVhw,2022-10-18T22:04:52Z,"ESTA TEIA DE ARANHA QUE O PT TECEU NESTES 20 ANOS DE GOVERNO ANTERIORES, É DE RESPONSABILIDADE DOS ELEITORES QUE O ELEGERAM. ELES TIVERAM TEMPO PARA DEIXAR TUDO DO JEITO QUE ESTÁ. MAS TUDO PODE PIORAR OU MELHORAR CONFORME NOSSAS ESCOLHAS. POR ISSO ESSAS ELEIÇÕES SAO TAO IMPORTANTES PARA LIVRAR OS BRASILEIROS DESTAS DITADURAS ESCONDIDAS POR TRAS DESTE SOCIALISMO AUTORITARIO E  CORRUPTO, DESTRUIDOR DE POVOS E NAÇÕES. POR FAVOR NESSAS ELEIÇÕES NÃO VAMOS PENSAR SOMENTE EM NÓS, EM COMER CARNE TODO DIA, PENSEMOS BEM EM NOSSOS FILHOS E NA NOSSA PROPRIA LIBERDADE.!",QURTSl9pMnJ0dmd2T0pQUlV5OG5uYUcwcjNSTGhLUVBkWHRWWlpZc1E5SXR3OW91X0I0dG1QYVpmR1JZVnRWTjZVM0FMUjJWN05DT242MA==,2023-06-08 15:40:26.763486
youtube#commentThread,suWpmmg0mgeX6nosYFp2NFpBebI,UgwRaIWFI_7tAPWPWbt4AaABAg,"{'videoId': 'C73l3fA1Ca4', 'topLevelComment': {'kind': 'youtube#comment', 'etag': 'ZEPfazSV1fb8XfpANy9lE6mr7VM', 'id': 'UgwRaIWFI_7tAPWPWbt4AaABAg', 'snippet': {'videoId': 'C73l3fA1Ca4', 'textDisplay': 'Bandeira símbolo do nosso Brasil!...', 'textOriginal': 'Bandeira símbolo do nosso Brasil!...', 'authorDisplayName': 'lucinei silva', 'authorProfileImageUrl': 'https://yt3.ggpht.com/ytc/AGIKgqONWr2IE-IbtHV8TlpSWXTNDRVmErDl7eMxQBaKiV8Swy_w-djzlxbQBT77Xn6m=s48-c-k-c0x00ffffff-no-rj', 'authorChannelUrl': 'http://www.youtube.com/channel/UCErhwB87UtLfpaYxLy_iVhw', 'authorChannelId': {'value': 'UCErhwB87UtLfpaYxLy_iVhw'}, 'canRate': True, 'viewerRating': 'none', 'likeCount': 0, 'publishedAt': '2022-10-16T22:40:50Z', 'updatedAt': '2022-10-16T22:40:50Z'}}, 'canReply': True, 'totalReplyCount': 0, 'isPublic': True}",,UCErhwB87UtLfpaYxLy_iVhw,2022-10-16T22:40:50Z,Bandeira símbolo do nosso Brasil!...,QURTSl9pM3cwZUl3NEdkcEQ2SXFUa0tPaWFkelQ0bkQ3U3MzNHE4SzB4Q1RkbmJmNGtUbWRJMGJDZktRYWpkZDBOUmp1SVVJemVGVFp1Yw==,2023-06-08 15:50:01.618866
youtube#commentThread,hZw0GYRTob_RTQHzukR9d6ObAzM,Ugy7SCDDDW2OJZtxYbR4AaABAg,"{'videoId': '2TKesNByqAk', 'topLevelComment': {'kind': 'youtube#comment', 'etag': 's6sU8zazd1XRzs8osWWW4_nZRdA', 'id': 'Ugy7SCDDDW2OJZtxYbR4AaABAg', 'snippet': {'videoId': '2TKesNByqAk', 'textDisplay': 'Amoedo também fez o teatro das tesouras!', 'textOriginal': 'Amoedo também fez o teatro das tesouras!', 'authorDisplayName': 'lucinei silva', 'authorProfileImageUrl': 'https://yt3.ggpht.com/ytc/AGIKgqONWr2IE-IbtHV8TlpSWXTNDRVmErDl7eMxQBaKiV8Swy_w-djzlxbQBT77Xn6m=s48-c-k-c0x00ffffff-no-rj', 'authorChannelUrl': 'http://www.youtube.com/channel/UCErhwB87UtLfpaYxLy_iVhw', 'authorChannelId': {'value': 'UCErhwB87UtLfpaYxLy_iVhw'}, 'canRate': True, 'viewerRating': 'none', 'likeCount': 0, 'publishedAt': '2022-10-16T19:08:33Z', 'updatedAt': '2022-10-16T19:08:33Z'}}, 'canReply': True, 'totalReplyCount': 0, 'isPublic': True}",,UCErhwB87UtLfpaYxLy_iVhw,2022-10-16T19:08:33Z,Amoedo também fez o teatro das tesouras!,QURTSl9pMU0yVS1BME9oekJDRnhZR1A4ZHNGYzFjT182Q0Jac1d6LVRhVUtSVENXSzN3V1VrTUFzSElqOG5heExoUElGT2NUNG9Jd3VsOA==,2023-06-08 15:50:50.928220
youtube#commentThread,B_khMM_r1XtK-OSKEE4pXE8OuTo,UgwosH6bpdk1-408gzZ4AaABAg,"{'videoId': 'uXl-n6Xuuu0', 'topLevelComment': {'kind': 'youtube#comment', 'etag': '6PaYKPU1OcDFmdr0NRPTrFhP930', 'id': 'UgwosH6bpdk1-408gzZ4AaABAg', 'snippet': {'videoId': 'uXl-n6Xuuu0', 'textDisplay': 'O Bolsonaro fala somente a verdade!', 'textOriginal': 'O Bolsonaro fala somente a verdade!', 'authorDisplayName': 'lucinei silva', 'authorProfileImageUrl': 'https://yt3.ggpht.com/ytc/AGIKgqONWr2IE-IbtHV8TlpSWXTNDRVmErDl7eMxQBaKiV8Swy_w-djzlxbQBT77Xn6m=s48-c-k-c0x00ffffff-no-rj', 'authorChannelUrl': 'http://www.youtube.com/channel/UCErhwB87UtLfpaYxLy_iVhw', 'authorChannelId': {'value': 'UCErhwB87UtLfpaYxLy_iVhw'}, 'canRate': True, 'viewerRating': 'none', 'likeCount': 0, 'publishedAt': '2022-10-16T19:07:07Z', 'updatedAt': '2022-10-16T19:07:07Z'}}, 'canReply': True, 'totalReplyCount': 0, 'isPublic': True}",,UCErhwB87UtLfpaYxLy_iVhw,2022-10-16T19:07:07Z,O Bolsonaro fala somente a verdade!,QURTSl9pMGl6dHpvUkVER0RGVDJRazFPZDhzdGw5MGkxZW5XZHh3d1lqaWJLcTFuV0I4eG9qdnp1QmpXelRGYUJaTV91QmlmRi1KT05xVQ==,2023-06-08 15:50:55.297741
youtube#commentThread,RQu85sR2jQUjtfd3cTW_U4_nUsw,UgwoZvIXCSrNgqpbPYJ4AaABAg,"{'videoId': '0NkoY9huHws', 'topLevelComment': {'kind': 'youtube#comment', 'etag': 'wF8izHl5FA8Tg6vDZWzVubdcTeU', 'id': 'UgwoZvIXCSrNgqpbPYJ4AaABAg', 'snippet': {'videoId': '0NkoY9huHws', 'textDisplay': 'Esse Putin não está bem não! Ele está com sérios problemas psicológicos....', 'textOriginal': 'Esse Putin não está bem não! Ele está com sérios problemas psicológicos....', 'authorDisplayName': 'lucinei silva', 'authorProfileImageUrl': 'https://yt3.ggpht.com/ytc/AGIKgqONWr2IE-IbtHV8TlpSWXTNDRVmErDl7eMxQBaKiV8Swy_w-djzlxbQBT77Xn6m=s48-c-k-c0x00ffffff-no-rj', 'authorChannelUrl': 'http://www.youtube.com/channel/UCErhwB87UtLfpaYxLy_iVhw', 'authorChannelId': {'value': 'UCErhwB87UtLfpaYxLy_iVhw'}, 'canRate': True, 'viewerRating': 'none', 'likeCount': 0, 'publishedAt': '2022-10-16T19:23:49Z', 'updatedAt': '2022-10-16T19:23:49Z'}}, 'canReply': True, 'totalReplyCount': 0, 'isPublic': True}",,UCErhwB87UtLfpaYxLy_iVhw,2022-10-16T19:23:49Z,Esse Putin não está bem não! Ele está com sérios problemas psicológicos....,QURTSl9pMm1UOUotcE1KckVLNXRrLUV0bnZDUXhPVFVzbU9BRGExWGh2TnZJeGlzWjZmbktVUWVsX2RaSUdrUExGS19mdUhRQ0FsQUdvQQ==,2023-06-08 15:51:13.635143
youtube#commentThread,1_RO9SK33fCssdw1ESymkGd3r2Y,UgwNbt-WZmWKAF2WtQh4AaABAg,"{'videoId': 'tBShq64LX8U', 'topLevelComment': {'kind': 'youtube#comment', 'etag': 'NTQgofROlqw8St6mcTwdkyEXgH4', 'id': 'UgwNbt-WZmWKAF2WtQh4AaABAg', 'snippet': {'videoId': 'tBShq64LX8U', 'textDisplay': 'Essa bandeira vai revelar quem ODEIA o nosso país e o nosso povo!', 'textOriginal': 'Essa bandeira vai revelar quem ODEIA o nosso país e o nosso povo!', 'authorDisplayName': 'lucinei silva', 'authorProfileImageUrl': 'https://yt3.ggpht.com/ytc/AGIKgqONWr2IE-IbtHV8TlpSWXTNDRVmErDl7eMxQBaKiV8Swy_w-djzlxbQBT77Xn6m=s48-c-k-c0x00ffffff-no-rj', 'authorChannelUrl': 'http://www.youtube.com/channel/UCErhwB87UtLfpaYxLy_iVhw', 'authorChannelId': {'value': 'UCErhwB87UtLfpaYxLy_iVhw'}, 'canRate': True, 'viewerRating': 'none', 'likeCount': 0, 'publishedAt': '2022-10-15T16:24:45Z', 'updatedAt': '2022-10-15T16:24:45Z'}}, 'canReply': True, 'totalReplyCount': 0, 'isPublic': True}",,UCErhwB87UtLfpaYxLy_iVhw,2022-10-15T16:24:45Z,Essa bandeira vai revelar quem ODEIA o nosso país e o nosso povo!,QURTSl9pMnJXYW1mdi1JQ0xkYkk4TEhXdnhkUWk3Xzk3cFNnSkc4ZDZ2R29yVzd2bkdFTEcwdGNJTWNrS1hIYm40TktKeDBTVEM0aTJtYw==,2023-06-08 18:01:19.775561
youtube#commentThread,bAHqEJH6S4brJO_cAlDkkq9ncow,Ugx0cY6oSoxJxPH5A-p4AaABAg,"{'videoId': 'tBShq64LX8U', 'topLevelComment': {'kind': 'youtube#comment', 'etag': 'rzycNYfZpt1yZe8m-6oi7TrjyKY', 'id': 'Ugx0cY6oSoxJxPH5A-p4AaABAg', 'snippet': {'videoId': 'tBShq64LX8U', 'textDisplay': 'Esse pt é anti nacional! Bolsonaro ama o Brasil e me representa!', 'textOriginal': 'Esse pt é anti nacional! Bolsonaro ama o Brasil e me representa!', 'authorDisplayName': 'lucinei silva', 'authorProfileImageUrl': 'https://yt3.ggpht.com/ytc/AGIKgqONWr2IE-IbtHV8TlpSWXTNDRVmErDl7eMxQBaKiV8Swy_w-djzlxbQBT77Xn6m=s48-c-k-c0x00ffffff-no-rj', 'authorChannelUrl': 'http://www.youtube.com/channel/UCErhwB87UtLfpaYxLy_iVhw', 'authorChannelId': {'value': 'UCErhwB87UtLfpaYxLy_iVhw'}, 'canRate': True, 'viewerRating': 'none', 'likeCount': 0, 'publishedAt': '2022-10-15T16:22:11Z', 'updatedAt': '2022-10-15T16:22:11Z'}}, 'canReply': True, 'totalReplyCount': 0, 'isPublic': True}",,UCErhwB87UtLfpaYxLy_iVhw,2022-10-15T16:22:11Z,Esse pt é anti nacional! Bolsonaro ama o Brasil e me representa!,QURTSl9pMnJXYW1mdi1JQ0xkYkk4TEhXdnhkUWk3Xzk3cFNnSkc4ZDZ2R29yVzd2bkdFTEcwdGNJTWNrS1hIYm40TktKeDBTVEM0aTJtYw==,2023-06-08 18:01:19.775561
youtube#commentThread,0fbadWJZdPJKyO7QnaYpMVNkmCU,UgyksUopEcm3D4av_Up4AaABAg,"{'videoId': 'Hm_Bm4KbF54', 'topLevelComment': {'kind': 'youtube#comment', 'etag': 'NzMj5lg5MbDZE6PS06hiyKpxj9g', 'id': 'UgyksUopEcm3D4av_Up4AaABAg', 'snippet': {'videoId': 'Hm_Bm4KbF54', 'textDisplay': 'P R F me representa ❤️', 'textOriginal': 'P R F me representa ❤️', 'authorDisplayName': 'lucinei silva', 'authorProfileImageUrl': 'https://yt3.ggpht.com/ytc/AGIKgqONWr2IE-IbtHV8TlpSWXTNDRVmErDl7eMxQBaKiV8Swy_w-djzlxbQBT77Xn6m=s48-c-k-c0x00ffffff-no-rj', 'authorChannelUrl': 'http://www.youtube.com/channel/UCErhwB87UtLfpaYxLy_iVhw', 'authorChannelId': {'value': 'UCErhwB87UtLfpaYxLy_iVhw'}, 'canRate': True, 'viewerRating': 'none', 'likeCount': 0, 'publishedAt': '2022-10-30T19:18:29Z', 'updatedAt': '2022-10-30T19:18:29Z'}}, 'canReply': True, 'totalReplyCount': 0, 'isPublic': True}",,UCErhwB87UtLfpaYxLy_iVhw,2022-10-30T19:18:29Z,P R F me representa ❤️,QURTSl9pMElBTjhWZzdEVms0eFdzbUJ6N3Y1WEwwMUhNa1lqWkM1d2tqOWpsVzhpTmdrcUZsUEFKRFZJMXRTU3h3ZVB1VnJ1b0dGOEQwNA==,2023-06-08 14:11:55.926313
youtube#commentThread,lyhxJeaAnU44GZ8NdM-CKSoMFH8,UgwrlHywJZA7St8Y2wd4AaABAg,"{'videoId': 'erb28H6jVFo', 'topLevelComment': {'kind': 'youtube#comment', 'etag': '6C9h7AiIzxwMw-qmguInys4CvT8', 'id': 'UgwrlHywJZA7St8Y2wd4AaABAg', 'snippet': {'videoId': 'erb28H6jVFo', 'textDisplay': 'Isso é roubo secreto do congresso! Enquanto isso o povo perece!', 'textOriginal': 'Isso é roubo secreto do congresso! Enquanto isso o povo perece!', 'authorDisplayName': 'lucinei silva', 'authorProfileImageUrl': 'https://yt3.ggpht.com/ytc/AGIKgqONWr2IE-IbtHV8TlpSWXTNDRVmErDl7eMxQBaKiV8Swy_w-djzlxbQBT77Xn6m=s48-c-k-c0x00ffffff-no-rj', 'authorChannelUrl': 'http://www.youtube.com/channel/UCErhwB87UtLfpaYxLy_iVhw', 'authorChannelId': {'value': 'UCErhwB87UtLfpaYxLy_iVhw'}, 'canRate': True, 'viewerRating': 'none', 'likeCount': 0, 'publishedAt': '2022-10-16T18:46:25Z', 'updatedAt': '2022-10-16T18:48:19Z'}}, 'canReply': True, 'totalReplyCount': 0, 'isPublic': True}",,UCErhwB87UtLfpaYxLy_iVhw,2022-10-16T18:46:25Z,Isso é roubo secreto do congresso! Enquanto isso o povo perece!,QURTSl9pMW5QSTZQLS16TDluZ2RGRlVFbmhTLXoyTzM0Nl9JSGg5am5PeWNucU0wUnhPSHk3b0tTcUg1TFM0Y090NlBsRlROOTNUS3BfZw==,2023-06-08 18:03:30.120211
youtube#commentThread,Tv1xyQ_pGHfIVsnOrPQEigljGuw,Ugx-rSXlu7RYo4vxj3l4AaABAg,"{'videoId': 'hXoJWBjx5b8', 'topLevelComment': {'kind': 'youtube#comment', 'etag': 'SrKQxydGyaW2LNZ0hy4WuyACizI', 'id': 'Ugx-rSXlu7RYo4vxj3l4AaABAg', 'snippet': {'videoId': 'hXoJWBjx5b8', 'textDisplay': 'Já estão tentando impedir a Damares de trabalhar? Estão com medo dela descobrir o quê? Neste mato tem coelho 🤔', 'textOriginal': 'Já estão tentando impedir a Damares de trabalhar? Estão com medo dela descobrir o quê? Neste mato tem coelho 🤔', 'authorDisplayName': 'lucinei silva', 'authorProfileImageUrl': 'https://yt3.ggpht.com/ytc/AGIKgqONWr2IE-IbtHV8TlpSWXTNDRVmErDl7eMxQBaKiV8Swy_w-djzlxbQBT77Xn6m=s48-c-k-c0x00ffffff-no-rj', 'authorChannelUrl': 'http://www.youtube.com/channel/UCErhwB87UtLfpaYxLy_iVhw', 'authorChannelId': {'value': 'UCErhwB87UtLfpaYxLy_iVhw'}, 'canRate': True, 'viewerRating': 'none', 'likeCount': 0, 'publishedAt': '2022-10-15T17:22:39Z', 'updatedAt': '2022-10-15T17:22:39Z'}}, 'canReply': True, 'totalReplyCount': 0, 'isPublic': True}",,UCErhwB87UtLfpaYxLy_iVhw,2022-10-15T17:22:39Z,Já estão tentando impedir a Damares de trabalhar? Estão com medo dela descobrir o quê? Neste mato tem coelho 🤔,QURTSl9pM1dlWnhYeFhmSC0wbkd1QUdBUlA3ZC1FODVHVnIybTZXRHRmWndZb0plN2JWanNxdmZjeG9jUGlnbWw1RXBtV21wa1pjdEc1VQ==,2023-06-08 18:04:23.231235
youtube#commentThread,Pnnp4ghVReJSVFQkeg1-eKdcrN4,Ugz6Ahetd8Rf4sKdRGl4AaABAg,"{'videoId': 'wR7KfP-N7iI', 'topLevelComment': {'kind': 'youtube#comment', 'etag': 'J-thPWAdE-uMiU3-v3BbfAhRems', 'id': 'Ugz6Ahetd8Rf4sKdRGl4AaABAg', 'snippet': {'videoId': 'wR7KfP-N7iI', 'textDisplay': 'Graças a Deus, a polícia está se impondo a favor do povo...', 'textOriginal': 'Graças a Deus, a polícia está se impondo a favor do povo...', 'authorDisplayName': 'lucinei silva', 'authorProfileImageUrl': 'https://yt3.ggpht.com/ytc/AGIKgqONWr2IE-IbtHV8TlpSWXTNDRVmErDl7eMxQBaKiV8Swy_w-djzlxbQBT77Xn6m=s48-c-k-c0x00ffffff-no-rj', 'authorChannelUrl': 'http://www.youtube.com/channel/UCErhwB87UtLfpaYxLy_iVhw', 'authorChannelId': {'value': 'UCErhwB87UtLfpaYxLy_iVhw'}, 'canRate': True, 'viewerRating': 'none', 'likeCount': 0, 'publishedAt': '2022-10-30T18:35:18Z', 'updatedAt': '2022-10-30T18:35:18Z'}}, 'canReply': True, 'totalReplyCount': 0, 'isPublic': True}",,UCErhwB87UtLfpaYxLy_iVhw,2022-10-30T18:35:18Z,"Graças a Deus, a polícia está se impondo a favor do povo...",QURTSl9pMjFiWUY5U3VoVmhOMTNMMXQzWUNkYTFocGNJV1hMUDctRU9VNHJueGl6a3ZLQ2k3clNjLU9YMXJIakVHNjNVTUxsT25VRTNCbw==,2023-06-08 14:12:16.792426
youtube#commentThread,56l79MeC8C3KRmYykYZXPC4-o3Q,UgwfiwOVAeYi2eukkgR4AaABAg,"{'videoId': 'llJ2IHaetMI', 'topLevelComment': {'kind': 'youtube#comment', 'etag': 'bUpX3Fk2GClR_Ldh-DGZXQkxw2E', 'id': 'UgwfiwOVAeYi2eukkgR4AaABAg', 'snippet': {'videoId': 'llJ2IHaetMI', 'textDisplay': 'O povo escolhendo a vida e um representante da alta curia da igreja escolhe  Barrabás! Senhor Jesus tende misericórdia de nós!', 'textOriginal': 'O povo escolhendo a vida e um representante da alta curia da igreja escolhe  Barrabás! Senhor Jesus tende misericórdia de nós!', 'authorDisplayName': 'lucinei silva', 'authorProfileImageUrl': 'https://yt3.ggpht.com/ytc/AGIKgqONWr2IE-IbtHV8TlpSWXTNDRVmErDl7eMxQBaKiV8Swy_w-djzlxbQBT77Xn6m=s48-c-k-c0x00ffffff-no-rj', 'authorChannelUrl': 'http://www.youtube.com/channel/UCErhwB87UtLfpaYxLy_iVhw', 'authorChannelId': {'value': 'UCErhwB87UtLfpaYxLy_iVhw'}, 'canRate': True, 'viewerRating': 'none', 'likeCount': 0, 'publishedAt': '2022-10-16T18:54:33Z', 'updatedAt': '2022-10-16T18:54:33Z'}}, 'canReply': True, 'totalReplyCount': 0, 'isPublic': True}",,UCErhwB87UtLfpaYxLy_iVhw,2022-10-16T18:54:33Z,O povo escolhendo a vida e um representante da alta curia da igreja escolhe  Barrabás! Senhor Jesus tende misericórdia de nós!,QURTSl9pMmtnLXIzYjlSNlRkXzFXTVhIYnZzSXdjXzdyN3ZjLXZKNGFLWkJteEctd0dqeE91Vk5BMWhBZmN3VHhCYm15b2wzVzBZbTNtVQ==,2023-06-08 18:12:17.927622
youtube#commentThread,rULmOPh_lTpp3Th1kO2z_6xbbzY,UgykV7lEhweqOCoQ5h14AaABAg,"{'videoId': 'e8URF37eWro', 'topLevelComment': {'kind': 'youtube#comment', 'etag': '65FnBLxR4rKMk6TMi3nIfFv4JBw', 'id': 'UgykV7lEhweqOCoQ5h14AaABAg', 'snippet': {'videoId': 'e8URF37eWro', 'textDisplay': 'Onde o Pacheco vai atuar ano que vem? Ele não representa os mineiros mais 🙏', 'textOriginal': 'Onde o Pacheco vai atuar ano que vem? Ele não representa os mineiros mais 🙏', 'authorDisplayName': 'lucinei silva', 'authorProfileImageUrl': 'https://yt3.ggpht.com/ytc/AGIKgqONWr2IE-IbtHV8TlpSWXTNDRVmErDl7eMxQBaKiV8Swy_w-djzlxbQBT77Xn6m=s48-c-k-c0x00ffffff-no-rj', 'authorChannelUrl': 'http://www.youtube.com/channel/UCErhwB87UtLfpaYxLy_iVhw', 'authorChannelId': {'value': 'UCErhwB87UtLfpaYxLy_iVhw'}, 'canRate': True, 'viewerRating': 'none', 'likeCount': 0, 'publishedAt': '2022-10-14T13:58:33Z', 'updatedAt': '2022-10-14T13:58:33Z'}}, 'canReply': True, 'totalReplyCount': 0, 'isPublic': True}",,UCErhwB87UtLfpaYxLy_iVhw,2022-10-14T13:58:33Z,Onde o Pacheco vai atuar ano que vem? Ele não representa os mineiros mais 🙏,QURTSl9pMmN4U2xNaDZPWnFsTUJYQmFZb3V6NWtpQ1FWakhtSlRROW1mUnlaZWpTdU1EUGVOZXNxZnRmMnVvZjlQZFhtSklxSUx2bmFVOA==,2023-06-08 18:15:07.839233
youtube#commentThread,vFVnyqUMxBQc1quXSAyVwYQ9ibk,UgyVRyvk09uaOvNPstp4AaABAg,"{'videoId': 'tr1lNhf80io', 'topLevelComment': {'kind': 'youtube#comment', 'etag': 'niGpzU9SdSBq_0qJ9TEUDXD0GMk', 'id': 'UgyVRyvk09uaOvNPstp4AaABAg', 'snippet': {'videoId': 'tr1lNhf80io', 'textDisplay': 'Olha quem está falando está ameaçando  coagindo e tirando a liberdade do povo brasileiro restringindo o uso do celular... Este homem não me representa jamais...', 'textOriginal': 'Olha quem está falando está ameaçando  coagindo e tirando a liberdade do povo brasileiro restringindo o uso do celular... Este homem não me representa jamais...', 'authorDisplayName': 'lucinei silva', 'authorProfileImageUrl': 'https://yt3.ggpht.com/ytc/AGIKgqONWr2IE-IbtHV8TlpSWXTNDRVmErDl7eMxQBaKiV8Swy_w-djzlxbQBT77Xn6m=s48-c-k-c0x00ffffff-no-rj', 'authorChannelUrl': 'http://www.youtube.com/channel/UCErhwB87UtLfpaYxLy_iVhw', 'authorChannelId': {'value': 'UCErhwB87UtLfpaYxLy_iVhw'}, 'canRate': True, 'viewerRating': 'none', 'likeCount': 0, 'publishedAt': '2022-10-30T00:23:32Z', 'updatedAt': '2022-10-30T00:23:32Z'}}, 'canReply': True, 'totalReplyCount': 0, 'isPublic': True}",,UCErhwB87UtLfpaYxLy_iVhw,2022-10-30T00:23:32Z,Olha quem está falando está ameaçando  coagindo e tirando a liberdade do povo brasileiro restringindo o uso do celular... Este homem não me representa jamais...,QURTSl9pMlctSkFscy1xenZyWk5yRnk1OWtULVdLSDF1Tlc4N1ZhU3JaeVdjdGtlbGR2bVcxbm95YXFteENyeW56RmF3VmhzeERycml5NA==,2023-06-08 14:14:26.840970
youtube#commentThread,1zr_wabhbRkg3XteMb8eD_VwE-w,UgxjNuuGS9EMdbFHGjR4AaABAg,"{'videoId': '5ycYUpKxMFg', 'topLevelComment': {'kind': 'youtube#comment', 'etag': 'TV4aGeXlZnwxRJ1ZocGiyvw_eJ8', 'id': 'UgxjNuuGS9EMdbFHGjR4AaABAg', 'snippet': {'videoId': '5ycYUpKxMFg', 'textDisplay': 'Todos juntos com Tarcísio!', 'textOriginal': 'Todos juntos com Tarcísio!', 'authorDisplayName': 'lucinei silva', 'authorProfileImageUrl': 'https://yt3.ggpht.com/ytc/AGIKgqONWr2IE-IbtHV8TlpSWXTNDRVmErDl7eMxQBaKiV8Swy_w-djzlxbQBT77Xn6m=s48-c-k-c0x00ffffff-no-rj', 'authorChannelUrl': 'http://www.youtube.com/channel/UCErhwB87UtLfpaYxLy_iVhw', 'authorChannelId': {'value': 'UCErhwB87UtLfpaYxLy_iVhw'}, 'canRate': True, 'viewerRating': 'none', 'likeCount': 0, 'publishedAt': '2022-10-10T18:20:51Z', 'updatedAt': '2022-10-10T18:20:51Z'}}, 'canReply': True, 'totalReplyCount': 1, 'isPublic': True}","{'comments': [{'kind': 'youtube#comment', 'etag': 'Gc2pwhGKRF2fJAF9NbonXI8JOSo', 'id': 'UgxjNuuGS9EMdbFHGjR4AaABAg.9h0GCkiS-9l9h0OdYSQUuK', 'snippet': {'videoId': '5ycYUpKxMFg', 'textDisplay': 'Tarcísio e Bolsonaro 🙏🙏🇧🇷🇧🇷💯💯', 'textOriginal': 'Tarcísio e Bolsonaro 🙏🙏🇧🇷🇧🇷💯💯', 'parentId': 'UgxjNuuGS9EMdbFHGjR4AaABAg', 'authorDisplayName': 'Cleusa Elena', 'authorProfileImageUrl': 'https://yt3.ggpht.com/ytc/AGIKgqNuQiG7P-xzCfoBtj47-2k6D8YJn3d2HeiJZjhfmrNwbFPfNx0_z3H7xEij25DB=s48-c-k-c0x00ffffff-no-rj', 'authorChannelUrl': 'http://www.youtube.com/channel/UCzKzjxhcdPgrorQcGcXBKHw', 'authorChannelId': {'value': 'UCzKzjxhcdPgrorQcGcXBKHw'}, 'canRate': True, 'viewerRating': 'none', 'likeCount': 1, 'publishedAt': '2022-10-10T19:34:33Z', 'updatedAt': '2022-10-10T19:34:33Z'}}]}",UCErhwB87UtLfpaYxLy_iVhw,2022-10-10T18:20:51Z,Todos juntos com Tarcísio!,,2023-06-08 18:22:36.944930
youtube#commentThread,jvmntLtM0q2_k-bYj4frNRcvDlk,UgwmDioFB_aW4F3N5lh4AaABAg,"{'videoId': 'g4_mZCD_mHI', 'topLevelComment': {'kind': 'youtube#comment', 'etag': '_bSE710cKeAUL7XzoiBCfnHx2pg', 'id': 'UgwmDioFB_aW4F3N5lh4AaABAg', 'snippet': {'videoId': 'g4_mZCD_mHI', 'textDisplay': 'Deus abençoe o Tarcísio 🙏', 'textOriginal': 'Deus abençoe o Tarcísio 🙏', 'authorDisplayName': 'lucinei silva', 'authorProfileImageUrl': 'https://yt3.ggpht.com/ytc/AGIKgqONWr2IE-IbtHV8TlpSWXTNDRVmErDl7eMxQBaKiV8Swy_w-djzlxbQBT77Xn6m=s48-c-k-c0x00ffffff-no-rj', 'authorChannelUrl': 'http://www.youtube.com/channel/UCErhwB87UtLfpaYxLy_iVhw', 'authorChannelId': {'value': 'UCErhwB87UtLfpaYxLy_iVhw'}, 'canRate': True, 'viewerRating': 'none', 'likeCount': 2, 'publishedAt': '2022-10-09T15:43:23Z', 'updatedAt': '2022-10-09T15:43:23Z'}}, 'canReply': True, 'totalReplyCount': 0, 'isPublic': True}",,UCErhwB87UtLfpaYxLy_iVhw,2022-10-09T15:43:23Z,Deus abençoe o Tarcísio 🙏,QURTSl9pMDFrTnlNTEJlQ1p3bjNKUDRNYlItbmNTQ2ZKYXQ2Y0dPZnJaRjNSSl9JVnFHenV3b0dpQnVSaFFPWThWTDIwdVBaS1l2UmZBdw==,2023-06-08 18:24:39.765912
youtube#commentThread,hKcgHFUwV20sFuJsLPoZX7GtGxg,UgyE5QqSrOJAtBkAYdB4AaABAg,"{'videoId': 'LHAsv1dyXRE', 'topLevelComment': {'kind': 'youtube#comment', 'etag': 'ZywSdB9aa6_65xyN_nCjbpe4_L8', 'id': 'UgyE5QqSrOJAtBkAYdB4AaABAg', 'snippet': {'videoId': 'LHAsv1dyXRE', 'textDisplay': 'Não estão fazendo nada a favor do Bolsonaro. Estão é livrando Lula de um possível processo  judicial e danos morais...', 'textOriginal': 'Não estão fazendo nada a favor do Bolsonaro. Estão é livrando Lula de um possível processo  judicial e danos morais...', 'authorDisplayName': 'lucinei silva', 'authorProfileImageUrl': 'https://yt3.ggpht.com/ytc/AGIKgqONWr2IE-IbtHV8TlpSWXTNDRVmErDl7eMxQBaKiV8Swy_w-djzlxbQBT77Xn6m=s48-c-k-c0x00ffffff-no-rj', 'authorChannelUrl': 'http://www.youtube.com/channel/UCErhwB87UtLfpaYxLy_iVhw', 'authorChannelId': {'value': 'UCErhwB87UtLfpaYxLy_iVhw'}, 'canRate': True, 'viewerRating': 'none', 'likeCount': 0, 'publishedAt': '2022-10-08T20:57:12Z', 'updatedAt': '2022-10-08T20:57:35Z'}}, 'canReply': True, 'totalReplyCount': 0, 'isPublic': True}",,UCErhwB87UtLfpaYxLy_iVhw,2022-10-08T20:57:12Z,Não estão fazendo nada a favor do Bolsonaro. Estão é livrando Lula de um possível processo  judicial e danos morais...,QURTSl9pMTVSa01vbXNNQ3VfVkJyV01WSEcxVGNhY204bVRoTjNscDhXTFA5TEQ1NzNDRm1obzdYd2JnU1k5RVh6WVB4aXk4UVowX3psQQ==,2023-06-08 18:28:03.140432
