kind,etag,id,snippet,replies,authorChannelId,publishedAt,textOriginal,nextPageToken,extraction_date
youtube#commentThread,wdL7pigFkvdTXxmAFtNf6YKDQwk,UgyQ4jBRxL663Z8LYjd4AaABAg,"{'videoId': '8pBTAz_Bi2w', 'topLevelComment': {'kind': 'youtube#comment', 'etag': 'soQ5Yr4tow7uC8fS2bi7Ymipvd0', 'id': 'UgyQ4jBRxL663Z8LYjd4AaABAg', 'snippet': {'videoId': '8pBTAz_Bi2w', 'textDisplay': 'Eu vote duas vezes no Lula foi enganado glasas a Deus apareceu Bolsonaro com outras ideias de família como só ligado a minha família pelo ideologia de gêneros cheio a repias pela minha famílias jamais sou lula fico com Bolsonaro pela família', 'textOriginal': 'Eu vote duas vezes no Lula foi enganado glasas a Deus apareceu Bolsonaro com outras ideias de família como só ligado a minha família pelo ideologia de gêneros cheio a repias pela minha famílias jamais sou lula fico com Bolsonaro pela família', 'authorDisplayName': 'Elias Gabriel Almeida', 'authorProfileImageUrl': 'https://yt3.ggpht.com/ytc/AGIKgqMQlFU_-aob5YqnYMebsqXWUa79bgOqO40aqw=s48-c-k-c0x00ffffff-no-rj', 'authorChannelUrl': 'http://www.youtube.com/channel/UCltP15-Ab2lAUbKhsIWj2lg', 'authorChannelId': {'value': 'UCltP15-Ab2lAUbKhsIWj2lg'}, 'canRate': True, 'viewerRating': 'none', 'likeCount': 13, 'publishedAt': '2022-10-24T11:46:14Z', 'updatedAt': '2022-10-24T11:46:14Z'}}, 'canReply': True, 'totalReplyCount': 0, 'isPublic': True}",,UCltP15-Ab2lAUbKhsIWj2lg,2022-10-24T11:46:14Z,Eu vote duas vezes no Lula foi enganado glasas a Deus apareceu Bolsonaro com outras ideias de família como só ligado a minha família pelo ideologia de gêneros cheio a repias pela minha famílias jamais sou lula fico com Bolsonaro pela família,QURTSl9pMUxEUUt0WW9kQlJCS0V4MHdSUURBdFhESFBDUDdmaDlBWWMzcnpFVlc3ZEVGQVdWTjYxZmstdE9ZNXM5Znl3TFhxbFFGYWdGQQ==,2023-06-08 14:50:06.460046
youtube#commentThread,imjlbsBQa8j9FWG98PSKnfnYtLk,Ugx0EHwXkqCxRBYj2JN4AaABAg,"{'videoId': 'CSKETrq-_s8', 'topLevelComment': {'kind': 'youtube#comment', 'etag': 'pSwpw6dGlh9TarCa_NOdbVyqh-U', 'id': 'Ugx0EHwXkqCxRBYj2JN4AaABAg', 'snippet': {'videoId': 'CSKETrq-_s8', 'textDisplay': 'Olha povo brasileiros o Lula ganhando da esquerda o Brasil já e um país comunista essa e a verdade e isso que a maioria do povo brasileiro não sabe se vocês vota no Lula tá votando no comunismo esse e a verdade', 'textOriginal': 'Olha povo brasileiros o Lula ganhando da esquerda o Brasil já e um país comunista essa e a verdade e isso que a maioria do povo brasileiro não sabe se vocês vota no Lula tá votando no comunismo esse e a verdade', 'authorDisplayName': 'Elias Gabriel Almeida', 'authorProfileImageUrl': 'https://yt3.ggpht.com/ytc/AGIKgqMQlFU_-aob5YqnYMebsqXWUa79bgOqO40aqw=s48-c-k-c0x00ffffff-no-rj', 'authorChannelUrl': 'http://www.youtube.com/channel/UCltP15-Ab2lAUbKhsIWj2lg', 'authorChannelId': {'value': 'UCltP15-Ab2lAUbKhsIWj2lg'}, 'canRate': True, 'viewerRating': 'none', 'likeCount': 0, 'publishedAt': '2022-10-24T12:33:43Z', 'updatedAt': '2022-10-24T12:33:43Z'}}, 'canReply': True, 'totalReplyCount': 0, 'isPublic': True}",,UCltP15-Ab2lAUbKhsIWj2lg,2022-10-24T12:33:43Z,Olha povo brasileiros o Lula ganhando da esquerda o Brasil já e um país comunista essa e a verdade e isso que a maioria do povo brasileiro não sabe se vocês vota no Lula tá votando no comunismo esse e a verdade,QURTSl9pMEtDY3pZTWR4R2tSZEs5RTgzQUFmX2p5bF90NnhvdjY1YUZLY056UUtIUUdvNHZXTnRhN004SkFkaVFmdXB1OHlpclA0RjhGVQ==,2023-06-08 14:51:03.227333
youtube#commentThread,8SmK3w2qZv9lStLBkrpZb2A742c,UgxfC9-DlrpdC0YhnrR4AaABAg,"{'videoId': 'DGn_Zrnk5oI', 'topLevelComment': {'kind': 'youtube#comment', 'etag': 'jDgf90yl-fuUx85RFAv1Re4Nj2A', 'id': 'UgxfC9-DlrpdC0YhnrR4AaABAg', 'snippet': {'videoId': 'DGn_Zrnk5oI', 'textDisplay': 'Somos nós brasileiros e que vai desedir não adianta a esquerda querer atrapalhar nós vamos vencer nas urnas com os nossos votos e Bolsonaro na cabeça e pronto acabou', 'textOriginal': 'Somos nós brasileiros e que vai desedir não adianta a esquerda querer atrapalhar nós vamos vencer nas urnas com os nossos votos e Bolsonaro na cabeça e pronto acabou', 'authorDisplayName': 'Elias Gabriel Almeida', 'authorProfileImageUrl': 'https://yt3.ggpht.com/ytc/AGIKgqMQlFU_-aob5YqnYMebsqXWUa79bgOqO40aqw=s48-c-k-c0x00ffffff-no-rj', 'authorChannelUrl': 'http://www.youtube.com/channel/UCltP15-Ab2lAUbKhsIWj2lg', 'authorChannelId': {'value': 'UCltP15-Ab2lAUbKhsIWj2lg'}, 'canRate': True, 'viewerRating': 'none', 'likeCount': 0, 'publishedAt': '2022-10-22T13:15:52Z', 'updatedAt': '2022-10-22T13:15:52Z'}}, 'canReply': True, 'totalReplyCount': 0, 'isPublic': True}",,UCltP15-Ab2lAUbKhsIWj2lg,2022-10-22T13:15:52Z,Somos nós brasileiros e que vai desedir não adianta a esquerda querer atrapalhar nós vamos vencer nas urnas com os nossos votos e Bolsonaro na cabeça e pronto acabou,QURTSl9pMmtPc0JyMGkydDE5bGkwTjBKaFdRTDV1S1BFUU5tNEE5MENVV2JSNllOakl4c0tYWlZvb1FrRXp4c0gwNjRwTW5pd2ZYcVZhQQ==,2023-06-08 15:08:10.387378
youtube#commentThread,mtIQ3YLEWfT4teinOUMg3QPxH3Y,UgzHNFNnTvsV5BW_qAJ4AaABAg,"{'videoId': 'DGn_Zrnk5oI', 'topLevelComment': {'kind': 'youtube#comment', 'etag': 'AgqV5e1i9-P6JXQezPyHPO9RKA4', 'id': 'UgzHNFNnTvsV5BW_qAJ4AaABAg', 'snippet': {'videoId': 'DGn_Zrnk5oI', 'textDisplay': 'Tavendo povo brasileiros essa esquerda descarado tá fazendo de tudo pra minar o Bolsonaro mais eles estam enganados que vai desider se p', 'textOriginal': 'Tavendo povo brasileiros essa esquerda descarado tá fazendo de tudo pra minar o Bolsonaro mais eles estam enganados que vai desider se p', 'authorDisplayName': 'Elias Gabriel Almeida', 'authorProfileImageUrl': 'https://yt3.ggpht.com/ytc/AGIKgqMQlFU_-aob5YqnYMebsqXWUa79bgOqO40aqw=s48-c-k-c0x00ffffff-no-rj', 'authorChannelUrl': 'http://www.youtube.com/channel/UCltP15-Ab2lAUbKhsIWj2lg', 'authorChannelId': {'value': 'UCltP15-Ab2lAUbKhsIWj2lg'}, 'canRate': True, 'viewerRating': 'none', 'likeCount': 0, 'publishedAt': '2022-10-22T13:13:28Z', 'updatedAt': '2022-10-22T13:13:28Z'}}, 'canReply': True, 'totalReplyCount': 0, 'isPublic': True}",,UCltP15-Ab2lAUbKhsIWj2lg,2022-10-22T13:13:28Z,Tavendo povo brasileiros essa esquerda descarado tá fazendo de tudo pra minar o Bolsonaro mais eles estam enganados que vai desider se p,QURTSl9pMmtPc0JyMGkydDE5bGkwTjBKaFdRTDV1S1BFUU5tNEE5MENVV2JSNllOakl4c0tYWlZvb1FrRXp4c0gwNjRwTW5pd2ZYcVZhQQ==,2023-06-08 15:08:10.387378
youtube#commentThread,x-t6jICz-a6IkdhQFJXRrUnLDRU,Ugxdn0xnjOZa1mUpgOF4AaABAg,"{'videoId': 'gfi8oLYbstE', 'topLevelComment': {'kind': 'youtube#comment', 'etag': 'SSYivCcq22Yq0DUe5yuM4V7gV90', 'id': 'Ugxdn0xnjOZa1mUpgOF4AaABAg', 'snippet': {'videoId': 'gfi8oLYbstE', 'textDisplay': 'Por isso Zema e capar de administra minas porque ele e sábio e mais uma prova da capacidade do Zema ele gosta da justiça e de onestodade por isso ele escolher com muita sabedoria o Bolsonaro porquer Bolsonaro e o melhor pra minas', 'textOriginal': 'Por isso Zema e capar de administra minas porque ele e sábio e mais uma prova da capacidade do Zema ele gosta da justiça e de onestodade por isso ele escolher com muita sabedoria o Bolsonaro porquer Bolsonaro e o melhor pra minas', 'authorDisplayName': 'Elias Gabriel Almeida', 'authorProfileImageUrl': 'https://yt3.ggpht.com/ytc/AGIKgqMQlFU_-aob5YqnYMebsqXWUa79bgOqO40aqw=s48-c-k-c0x00ffffff-no-rj', 'authorChannelUrl': 'http://www.youtube.com/channel/UCltP15-Ab2lAUbKhsIWj2lg', 'authorChannelId': {'value': 'UCltP15-Ab2lAUbKhsIWj2lg'}, 'canRate': True, 'viewerRating': 'none', 'likeCount': 0, 'publishedAt': '2022-10-22T13:24:58Z', 'updatedAt': '2022-10-22T13:24:58Z'}}, 'canReply': True, 'totalReplyCount': 0, 'isPublic': True}",,UCltP15-Ab2lAUbKhsIWj2lg,2022-10-22T13:24:58Z,Por isso Zema e capar de administra minas porque ele e sábio e mais uma prova da capacidade do Zema ele gosta da justiça e de onestodade por isso ele escolher com muita sabedoria o Bolsonaro porquer Bolsonaro e o melhor pra minas,QURTSl9pM1pmaHotcWVqU2VEdWcteFlGYmdJQ1Iwd0ktQXpaM25HemlwTmYwXzIwR3U0RVpXQXpPRnBvUVVqUmFuVU5rOEZzenRhMUVNaw==,2023-06-08 15:08:23.035920
youtube#commentThread,rGAiBEF8JH1VssigxV0x4d9Q9lo,Ugx-E968lrbiwwZxGMl4AaABAg,"{'videoId': 'gfi8oLYbstE', 'topLevelComment': {'kind': 'youtube#comment', 'etag': 'lxZ6wHKpqCLlfRCb-QqGfZpIeE4', 'id': 'Ugx-E968lrbiwwZxGMl4AaABAg', 'snippet': {'videoId': 'gfi8oLYbstE', 'textDisplay': 'Só Bolsonaro que vai impedir de tomar nossa amazônia com ele o buraco e mais em baixo quem entende não vota na esquerda nem apau somente os engenios vai no papo do pt', 'textOriginal': 'Só Bolsonaro que vai impedir de tomar nossa amazônia com ele o buraco e mais em baixo quem entende não vota na esquerda nem apau somente os engenios vai no papo do pt', 'authorDisplayName': 'Elias Gabriel Almeida', 'authorProfileImageUrl': 'https://yt3.ggpht.com/ytc/AGIKgqMQlFU_-aob5YqnYMebsqXWUa79bgOqO40aqw=s48-c-k-c0x00ffffff-no-rj', 'authorChannelUrl': 'http://www.youtube.com/channel/UCltP15-Ab2lAUbKhsIWj2lg', 'authorChannelId': {'value': 'UCltP15-Ab2lAUbKhsIWj2lg'}, 'canRate': True, 'viewerRating': 'none', 'likeCount': 0, 'publishedAt': '2022-10-22T13:20:25Z', 'updatedAt': '2022-10-22T13:20:25Z'}}, 'canReply': True, 'totalReplyCount': 0, 'isPublic': True}",,UCltP15-Ab2lAUbKhsIWj2lg,2022-10-22T13:20:25Z,Só Bolsonaro que vai impedir de tomar nossa amazônia com ele o buraco e mais em baixo quem entende não vota na esquerda nem apau somente os engenios vai no papo do pt,QURTSl9pM1pmaHotcWVqU2VEdWcteFlGYmdJQ1Iwd0ktQXpaM25HemlwTmYwXzIwR3U0RVpXQXpPRnBvUVVqUmFuVU5rOEZzenRhMUVNaw==,2023-06-08 15:08:23.035920
youtube#commentThread,L-TvygGzDwgKe5lsRNCDRwo5_T4,UgzGgA5Klme26ZVCk7F4AaABAg,"{'videoId': 'MjE_oaNkVrc', 'topLevelComment': {'kind': 'youtube#comment', 'etag': 'v0VRlfI6vNGQ6YmRKfCPyygZBBc', 'id': 'UgzGgA5Klme26ZVCk7F4AaABAg', 'snippet': {'videoId': 'MjE_oaNkVrc', 'textDisplay': 'Os paulistá quiz fazer o que se tivesse dado 30 porcento pro Bolsonaro hoje Bolsonaro tá eleito sem dúvida agora vai ficar mais difícil pro tarciso que vai perder e justamente os paulista e o preço a pagar seria difícil segurar são Paulo a dupla tarciso e Bolsonaro', 'textOriginal': 'Os paulistá quiz fazer o que se tivesse dado 30 porcento pro Bolsonaro hoje Bolsonaro tá eleito sem dúvida agora vai ficar mais difícil pro tarciso que vai perder e justamente os paulista e o preço a pagar seria difícil segurar são Paulo a dupla tarciso e Bolsonaro', 'authorDisplayName': 'Elias Gabriel Almeida', 'authorProfileImageUrl': 'https://yt3.ggpht.com/ytc/AGIKgqMQlFU_-aob5YqnYMebsqXWUa79bgOqO40aqw=s48-c-k-c0x00ffffff-no-rj', 'authorChannelUrl': 'http://www.youtube.com/channel/UCltP15-Ab2lAUbKhsIWj2lg', 'authorChannelId': {'value': 'UCltP15-Ab2lAUbKhsIWj2lg'}, 'canRate': True, 'viewerRating': 'none', 'likeCount': 0, 'publishedAt': '2022-11-04T14:31:44Z', 'updatedAt': '2022-11-04T14:31:44Z'}}, 'canReply': True, 'totalReplyCount': 0, 'isPublic': True}",,UCltP15-Ab2lAUbKhsIWj2lg,2022-11-04T14:31:44Z,Os paulistá quiz fazer o que se tivesse dado 30 porcento pro Bolsonaro hoje Bolsonaro tá eleito sem dúvida agora vai ficar mais difícil pro tarciso que vai perder e justamente os paulista e o preço a pagar seria difícil segurar são Paulo a dupla tarciso e Bolsonaro,QURTSl9pMU0xYndwWDRiRExEVzFQVFh6TUduM2pZM1ZHbEdKenJaUVBFejByUVNXazNRU3UtQXRHTWJGUW9Pc2c0YXNNVjNtNkZndnZMMA==,2023-06-08 14:07:04.152568
youtube#commentThread,UgynlU9w4LO_g9NUxbXkenHKVgk,UgypNOC_SBp2vVdVNHp4AaABAg,"{'videoId': 'eO8tBiJDr9Y', 'topLevelComment': {'kind': 'youtube#comment', 'etag': 'C4HF913eD3_6vdzSwWWLvwldV84', 'id': 'UgypNOC_SBp2vVdVNHp4AaABAg', 'snippet': {'videoId': 'eO8tBiJDr9Y', 'textDisplay': 'Vou falar uma coisa se o paulista não votar em massa no Bolsonaro o Lula vai papa essa aí seu mano paulista Bolsonaro vai dança depende de vocês paulista se quizer ver Bolsonaro eleitos mexe paulista que vai dar Bolsonaro já pensou tarciso e Bolsonaro vai ser difícil de segurar são Paulo só depende dos paulistas', 'textOriginal': 'Vou falar uma coisa se o paulista não votar em massa no Bolsonaro o Lula vai papa essa aí seu mano paulista Bolsonaro vai dança depende de vocês paulista se quizer ver Bolsonaro eleitos mexe paulista que vai dar Bolsonaro já pensou tarciso e Bolsonaro vai ser difícil de segurar são Paulo só depende dos paulistas', 'authorDisplayName': 'Elias Gabriel Almeida', 'authorProfileImageUrl': 'https://yt3.ggpht.com/ytc/AGIKgqMQlFU_-aob5YqnYMebsqXWUa79bgOqO40aqw=s48-c-k-c0x00ffffff-no-rj', 'authorChannelUrl': 'http://www.youtube.com/channel/UCltP15-Ab2lAUbKhsIWj2lg', 'authorChannelId': {'value': 'UCltP15-Ab2lAUbKhsIWj2lg'}, 'canRate': True, 'viewerRating': 'none', 'likeCount': 0, 'publishedAt': '2022-10-21T11:55:49Z', 'updatedAt': '2022-10-21T11:55:49Z'}}, 'canReply': True, 'totalReplyCount': 0, 'isPublic': True}",,UCltP15-Ab2lAUbKhsIWj2lg,2022-10-21T11:55:49Z,Vou falar uma coisa se o paulista não votar em massa no Bolsonaro o Lula vai papa essa aí seu mano paulista Bolsonaro vai dança depende de vocês paulista se quizer ver Bolsonaro eleitos mexe paulista que vai dar Bolsonaro já pensou tarciso e Bolsonaro vai ser difícil de segurar são Paulo só depende dos paulistas,QURTSl9pMXZfeGxVdFBsN2h2X05oX0E5bkZaVlo3enBNMnVqeE5PX2xaa2xlR3N1VzJtOUdkLTBDMVVSd0VuSndVUWFKbkNPQkVCUDNXYw==,2023-06-08 15:18:30.087258
