kind,etag,id,snippet,replies,authorChannelId,publishedAt,textOriginal,nextPageToken,extraction_date
youtube#commentThread,qR0eoES8uDxlPH6kA5JlRaQMk9s,Ugxtx1Ud2JM0KkHQXmt4AaABAg,"{'videoId': '-A4ZGZuGaf0', 'topLevelComment': {'kind': 'youtube#comment', 'etag': 'qvF_a7D85WRU0SlM3N5fZLmnLmA', 'id': 'Ugxtx1Ud2JM0KkHQXmt4AaABAg', 'snippet': {'videoId': '-A4ZGZuGaf0', 'textDisplay': 'Lição de auto-humilhação e de como levar leitada do Queiroz na biografia.', 'textOriginal': 'Lição de auto-humilhação e de como levar leitada do Queiroz na biografia.', 'authorDisplayName': 'Al', 'authorProfileImageUrl': 'https://yt3.ggpht.com/ytc/AGIKgqN19LDMmVNIXLV7HitZpAqGCPwBLwlFV4Pi9vVDJtFc-Wp7rsX_Ybbk88bx74sk4w=s48-c-k-c0x00ffffff-no-rj', 'authorChannelUrl': 'http://www.youtube.com/channel/UCNzBkKhM9lBgCke0rymWo2g', 'authorChannelId': {'value': 'UCNzBkKhM9lBgCke0rymWo2g'}, 'canRate': True, 'viewerRating': 'none', 'likeCount': 4, 'publishedAt': '2022-10-20T14:04:05Z', 'updatedAt': '2022-10-20T14:07:02Z'}}, 'canReply': True, 'totalReplyCount': 0, 'isPublic': True}",,UCNzBkKhM9lBgCke0rymWo2g,2022-10-20T14:04:05Z,Lição de auto-humilhação e de como levar leitada do Queiroz na biografia.,,2023-06-08 15:24:47.391244
youtube#commentThread,soZAa1j3iLRlBO2ZKL_T93JXFo4,UgzZ4rnm18QGPqdJKVh4AaABAg,"{'videoId': 'ZvqKbJ22svY', 'topLevelComment': {'kind': 'youtube#comment', 'etag': 'gx3Yr3Iv_dYO5hvWEur7aFhD6H8', 'id': 'UgzZ4rnm18QGPqdJKVh4AaABAg', 'snippet': {'videoId': 'ZvqKbJ22svY', 'textDisplay': 'Primeiro deveriam aprender a não chamar de prostitutas as crianças &quot;arrumadinhas&quot; que encontrarem pelo caminho.', 'textOriginal': 'Primeiro deveriam aprender a não chamar de prostitutas as crianças ""arrumadinhas"" que encontrarem pelo caminho.', 'authorDisplayName': 'Al', 'authorProfileImageUrl': 'https://yt3.ggpht.com/ytc/AGIKgqN19LDMmVNIXLV7HitZpAqGCPwBLwlFV4Pi9vVDJtFc-Wp7rsX_Ybbk88bx74sk4w=s48-c-k-c0x00ffffff-no-rj', 'authorChannelUrl': 'http://www.youtube.com/channel/UCNzBkKhM9lBgCke0rymWo2g', 'authorChannelId': {'value': 'UCNzBkKhM9lBgCke0rymWo2g'}, 'canRate': True, 'viewerRating': 'none', 'likeCount': 1, 'publishedAt': '2022-10-19T15:34:48Z', 'updatedAt': '2022-10-19T15:34:48Z'}}, 'canReply': True, 'totalReplyCount': 2, 'isPublic': True}","{'comments': [{'kind': 'youtube#comment', 'etag': '80i2rUMLma8WlCF4MHq4hvFlM-w', 'id': 'UgzZ4rnm18QGPqdJKVh4AaABAg.9hN8MRfmiP09hNGDe5F3Mt', 'snippet': {'videoId': 'ZvqKbJ22svY', 'textDisplay': '@Dilma Da Silva Oliveira Você quer dizer que as meninas são prostitutas, ou sabe que o incapaz mentiu?', 'textOriginal': '@Dilma Da Silva Oliveira Você quer dizer que as meninas são prostitutas, ou sabe que o incapaz mentiu?', 'parentId': 'UgzZ4rnm18QGPqdJKVh4AaABAg', 'authorDisplayName': 'Al', 'authorProfileImageUrl': 'https://yt3.ggpht.com/ytc/AGIKgqN19LDMmVNIXLV7HitZpAqGCPwBLwlFV4Pi9vVDJtFc-Wp7rsX_Ybbk88bx74sk4w=s48-c-k-c0x00ffffff-no-rj', 'authorChannelUrl': 'http://www.youtube.com/channel/UCNzBkKhM9lBgCke0rymWo2g', 'authorChannelId': {'value': 'UCNzBkKhM9lBgCke0rymWo2g'}, 'canRate': True, 'viewerRating': 'none', 'likeCount': 0, 'publishedAt': '2022-10-19T16:43:30Z', 'updatedAt': '2022-10-19T16:43:30Z'}}, {'kind': 'youtube#comment', 'etag': 'RMoio0sM0nNBBJMUCraVKrK2-bQ', 'id': 'UgzZ4rnm18QGPqdJKVh4AaABAg.9hN8MRfmiP09hNB2ugBkjI', 'snippet': {'videoId': 'ZvqKbJ22svY', 'textDisplay': '...Estão achando que vão levar...Na base da mentira né? Não vão não!!!', 'textOriginal': '...Estão achando que vão levar...Na base da mentira né? Não vão não!!!', 'parentId': 'UgzZ4rnm18QGPqdJKVh4AaABAg', 'authorDisplayName': 'Dilma Da Silva Oliveira', 'authorProfileImageUrl': 'https://yt3.ggpht.com/ytc/AGIKgqOKSWlhSvBbbbpiOrTXZjuVms8M4MLmp_jdQA=s48-c-k-c0x00ffffff-no-rj', 'authorChannelUrl': 'http://www.youtube.com/channel/UCJINlN3rCqrzNXY3YqRCofw', 'authorChannelId': {'value': 'UCJINlN3rCqrzNXY3YqRCofw'}, 'canRate': True, 'viewerRating': 'none', 'likeCount': 0, 'publishedAt': '2022-10-19T15:58:20Z', 'updatedAt': '2022-10-19T15:58:20Z'}}]}",UCNzBkKhM9lBgCke0rymWo2g,2022-10-19T15:34:48Z,"Primeiro deveriam aprender a não chamar de prostitutas as crianças ""arrumadinhas"" que encontrarem pelo caminho.",,2023-06-08 15:37:31.695556
youtube#commentThread,aa0UD4grCOXDqO-KZBLsz_-4mBk,UgxUsF56ZYLfQcXHNrJ4AaABAg,"{'videoId': 's0DNFOnmigo', 'topLevelComment': {'kind': 'youtube#comment', 'etag': 'nuU5AHH3bDv6plqDk0c6A3uGk1A', 'id': 'UgxUsF56ZYLfQcXHNrJ4AaABAg', 'snippet': {'videoId': 's0DNFOnmigo', 'textDisplay': 'O Mito tá no banho ainda?', 'textOriginal': 'O Mito tá no banho ainda?', 'authorDisplayName': 'Al', 'authorProfileImageUrl': 'https://yt3.ggpht.com/ytc/AGIKgqN19LDMmVNIXLV7HitZpAqGCPwBLwlFV4Pi9vVDJtFc-Wp7rsX_Ybbk88bx74sk4w=s48-c-k-c0x00ffffff-no-rj', 'authorChannelUrl': 'http://www.youtube.com/channel/UCNzBkKhM9lBgCke0rymWo2g', 'authorChannelId': {'value': 'UCNzBkKhM9lBgCke0rymWo2g'}, 'canRate': True, 'viewerRating': 'none', 'likeCount': 0, 'publishedAt': '2022-10-31T20:45:04Z', 'updatedAt': '2022-10-31T20:45:04Z'}}, 'canReply': True, 'totalReplyCount': 0, 'isPublic': True}",,UCNzBkKhM9lBgCke0rymWo2g,2022-10-31T20:45:04Z,O Mito tá no banho ainda?,,2023-06-08 13:56:49.996365
youtube#commentThread,2rx2DTsgexC2TTHSaMXiPMsGMOM,UgwJHViG-VXL0cyL5xh4AaABAg,"{'videoId': '2h3enl7qDEw', 'topLevelComment': {'kind': 'youtube#comment', 'etag': 'T58zknMxvCqMzjTU-0jbY7aXclw', 'id': 'UgwJHViG-VXL0cyL5xh4AaABAg', 'snippet': {'videoId': '2h3enl7qDEw', 'textDisplay': '&quot;Se algum comunista distorceu o que falei e entendeu que não fui ajudar as meninas, foi mal aí, taokey?&quot;', 'textOriginal': '""Se algum comunista distorceu o que falei e entendeu que não fui ajudar as meninas, foi mal aí, taokey?""', 'authorDisplayName': 'Al', 'authorProfileImageUrl': 'https://yt3.ggpht.com/ytc/AGIKgqN19LDMmVNIXLV7HitZpAqGCPwBLwlFV4Pi9vVDJtFc-Wp7rsX_Ybbk88bx74sk4w=s48-c-k-c0x00ffffff-no-rj', 'authorChannelUrl': 'http://www.youtube.com/channel/UCNzBkKhM9lBgCke0rymWo2g', 'authorChannelId': {'value': 'UCNzBkKhM9lBgCke0rymWo2g'}, 'canRate': True, 'viewerRating': 'none', 'likeCount': 1, 'publishedAt': '2022-10-19T10:41:20Z', 'updatedAt': '2022-10-19T10:41:20Z'}}, 'canReply': True, 'totalReplyCount': 0, 'isPublic': True}",,UCNzBkKhM9lBgCke0rymWo2g,2022-10-19T10:41:20Z,"""Se algum comunista distorceu o que falei e entendeu que não fui ajudar as meninas, foi mal aí, taokey?""",QURTSl9pMWpEWTdOVEhSa29KamdybUwzdHZWRlFfUFJ0ckx2X3pDckppT3JKUjhHZVl4WXJIZzRtY3dFQS02MjZXU0NsLVlJTEl6d0c0Zw==,2023-06-08 15:38:59.525986
youtube#commentThread,5VgruYRYsETa32b6m16Ucyg-Im0,Ugy4gSMN8b8fnSDu5Ph4AaABAg,"{'videoId': 'rRZInYSCowY', 'topLevelComment': {'kind': 'youtube#comment', 'etag': '4y4LC9FAAa2J0GS1I3ZtUu7u110', 'id': 'Ugy4gSMN8b8fnSDu5Ph4AaABAg', 'snippet': {'videoId': 'rRZInYSCowY', 'textDisplay': 'Parabéns à polícia de SP, que nos livrou da cascata criada pelos dramaturgos da SECOM.', 'textOriginal': 'Parabéns à polícia de SP, que nos livrou da cascata criada pelos dramaturgos da SECOM.', 'authorDisplayName': 'Al', 'authorProfileImageUrl': 'https://yt3.ggpht.com/ytc/AGIKgqN19LDMmVNIXLV7HitZpAqGCPwBLwlFV4Pi9vVDJtFc-Wp7rsX_Ybbk88bx74sk4w=s48-c-k-c0x00ffffff-no-rj', 'authorChannelUrl': 'http://www.youtube.com/channel/UCNzBkKhM9lBgCke0rymWo2g', 'authorChannelId': {'value': 'UCNzBkKhM9lBgCke0rymWo2g'}, 'canRate': True, 'viewerRating': 'none', 'likeCount': 2, 'publishedAt': '2022-10-18T17:45:33Z', 'updatedAt': '2022-10-18T17:45:33Z'}}, 'canReply': True, 'totalReplyCount': 0, 'isPublic': True}",,UCNzBkKhM9lBgCke0rymWo2g,2022-10-18T17:45:33Z,"Parabéns à polícia de SP, que nos livrou da cascata criada pelos dramaturgos da SECOM.",,2023-06-08 15:43:28.129061
youtube#commentThread,NzvThdM45X3LqhNJ-FlpB98qI2A,UgxgQLpJ4IP3Xmwz0Y14AaABAg,"{'videoId': 'Sr6RZ0dE1gA', 'topLevelComment': {'kind': 'youtube#comment', 'etag': 'hSBVh7kx1FAbTPp3V-97nGX9Psk', 'id': 'UgxgQLpJ4IP3Xmwz0Y14AaABAg', 'snippet': {'videoId': 'Sr6RZ0dE1gA', 'textDisplay': 'Os dramaturgos da SECOM não deixariam de explorar o que é um dia como outro qualquer na Paraisópolis.   😅', 'textOriginal': 'Os dramaturgos da SECOM não deixariam de explorar o que é um dia como outro qualquer na Paraisópolis.   😅', 'authorDisplayName': 'Al', 'authorProfileImageUrl': 'https://yt3.ggpht.com/ytc/AGIKgqN19LDMmVNIXLV7HitZpAqGCPwBLwlFV4Pi9vVDJtFc-Wp7rsX_Ybbk88bx74sk4w=s48-c-k-c0x00ffffff-no-rj', 'authorChannelUrl': 'http://www.youtube.com/channel/UCNzBkKhM9lBgCke0rymWo2g', 'authorChannelId': {'value': 'UCNzBkKhM9lBgCke0rymWo2g'}, 'canRate': True, 'viewerRating': 'none', 'likeCount': 5, 'publishedAt': '2022-10-18T09:48:14Z', 'updatedAt': '2022-10-18T09:48:14Z'}}, 'canReply': True, 'totalReplyCount': 0, 'isPublic': True}",,UCNzBkKhM9lBgCke0rymWo2g,2022-10-18T09:48:14Z,Os dramaturgos da SECOM não deixariam de explorar o que é um dia como outro qualquer na Paraisópolis.   😅,,2023-06-08 15:45:29.028383
youtube#commentThread,Zqqf7X9SgkChkKtP7uUwibB4MuY,UgzspPNYRb_hsaptqjN4AaABAg,"{'videoId': 'x35cyO4jLKs', 'topLevelComment': {'kind': 'youtube#comment', 'etag': 'NZA8i9GBxMMRr5mQ3T5qG5zZpKE', 'id': 'UgzspPNYRb_hsaptqjN4AaABAg', 'snippet': {'videoId': 'x35cyO4jLKs', 'textDisplay': 'Fontes: Minalba 😅', 'textOriginal': 'Fontes: Minalba 😅', 'authorDisplayName': 'Al', 'authorProfileImageUrl': 'https://yt3.ggpht.com/ytc/AGIKgqN19LDMmVNIXLV7HitZpAqGCPwBLwlFV4Pi9vVDJtFc-Wp7rsX_Ybbk88bx74sk4w=s48-c-k-c0x00ffffff-no-rj', 'authorChannelUrl': 'http://www.youtube.com/channel/UCNzBkKhM9lBgCke0rymWo2g', 'authorChannelId': {'value': 'UCNzBkKhM9lBgCke0rymWo2g'}, 'canRate': True, 'viewerRating': 'none', 'likeCount': 0, 'publishedAt': '2022-10-18T10:07:20Z', 'updatedAt': '2022-10-18T10:07:20Z'}}, 'canReply': True, 'totalReplyCount': 0, 'isPublic': True}",,UCNzBkKhM9lBgCke0rymWo2g,2022-10-18T10:07:20Z,Fontes: Minalba 😅,QURTSl9pMEZzVWFXeEhrWV9RTnlGLWUtcHc2OTFCMEF6QWpncW91MWV5bjRwQk4wVDlMengtQVBFUXlDNFc5cVBpUGhic0M1MEVlUlJYQQ==,2023-06-08 15:45:38.414653
youtube#commentThread,rbvS6XJcriX-e4JiIrQkXMf3pe8,Ugy-dPqTJvfkFGnxqi54AaABAg,"{'videoId': 'SpTbf4v5654', 'topLevelComment': {'kind': 'youtube#comment', 'etag': 'JNL_uQYQjKo_F7i9Dh4ob2GoYFU', 'id': 'Ugy-dPqTJvfkFGnxqi54AaABAg', 'snippet': {'videoId': 'SpTbf4v5654', 'textDisplay': 'Só assistiria a um embate de vigaristas se fosse um duelo ao estilo Velho Oeste.<br>Agora, ao ver o Trindade falando em empate, impossível concluir que o ladrão de 9 dedos não venceu o de 10.', 'textOriginal': 'Só assistiria a um embate de vigaristas se fosse um duelo ao estilo Velho Oeste.\\\\nAgora, ao ver o Trindade falando em empate, impossível concluir que o ladrão de 9 dedos não venceu o de 10.', 'authorDisplayName': 'Al', 'authorProfileImageUrl': 'https://yt3.ggpht.com/ytc/AGIKgqN19LDMmVNIXLV7HitZpAqGCPwBLwlFV4Pi9vVDJtFc-Wp7rsX_Ybbk88bx74sk4w=s48-c-k-c0x00ffffff-no-rj', 'authorChannelUrl': 'http://www.youtube.com/channel/UCNzBkKhM9lBgCke0rymWo2g', 'authorChannelId': {'value': 'UCNzBkKhM9lBgCke0rymWo2g'}, 'canRate': True, 'viewerRating': 'none', 'likeCount': 6, 'publishedAt': '2022-10-17T21:06:54Z', 'updatedAt': '2022-10-17T21:08:10Z'}}, 'canReply': True, 'totalReplyCount': 1, 'isPublic': True}","{'comments': [{'kind': 'youtube#comment', 'etag': 'JrEyVGdNWfDv-bNxQuQSRro9F_0', 'id': 'Ugy-dPqTJvfkFGnxqi54AaABAg.9hI_m9Rrc6U9hIh-1Q_o6e', 'snippet': {'videoId': 'SpTbf4v5654', 'textDisplay': 'Dez, desmiolado', 'textOriginal': 'Dez, desmiolado', 'parentId': 'Ugy-dPqTJvfkFGnxqi54AaABAg', 'authorDisplayName': 'Marcelo C Oliveira', 'authorProfileImageUrl': 'https://yt3.ggpht.com/ytc/AGIKgqONiwVhgcuZ_es4LzUsfDzXc35Yh8LY0m9IQA=s48-c-k-c0x00ffffff-no-rj', 'authorChannelUrl': 'http://www.youtube.com/channel/UCUyCIMUQOvv3EVZPTCn4-tQ', 'authorChannelId': {'value': 'UCUyCIMUQOvv3EVZPTCn4-tQ'}, 'canRate': True, 'viewerRating': 'none', 'likeCount': 0, 'publishedAt': '2022-10-17T22:09:58Z', 'updatedAt': '2022-10-17T22:09:58Z'}}]}",UCNzBkKhM9lBgCke0rymWo2g,2022-10-17T21:06:54Z,"Só assistiria a um embate de vigaristas se fosse um duelo ao estilo Velho Oeste.
Agora, ao ver o Trindade falando em empate, impossível concluir que o ladrão de 9 dedos não venceu o de 10.",,2023-06-08 15:46:36.790107
youtube#commentThread,kklAOfwNzi5okMSZT87dUR8-Sj8,UgzR5dlMxPKkWBCJXft4AaABAg,"{'videoId': 'p7LIgvFBMuI', 'topLevelComment': {'kind': 'youtube#comment', 'etag': 'CYZ8FRNYXsjz5oBbQk_FzxcG0YM', 'id': 'UgzR5dlMxPKkWBCJXft4AaABAg', 'snippet': {'videoId': 'p7LIgvFBMuI', 'textDisplay': 'Escutaram tiros na Paraisópolis (algo muito raro mesmo 😅), como não transformar em atentado e tentar colher frutos em cima disso?', 'textOriginal': 'Escutaram tiros na Paraisópolis (algo muito raro mesmo 😅), como não transformar em atentado e tentar colher frutos em cima disso?', 'authorDisplayName': 'Al', 'authorProfileImageUrl': 'https://yt3.ggpht.com/ytc/AGIKgqN19LDMmVNIXLV7HitZpAqGCPwBLwlFV4Pi9vVDJtFc-Wp7rsX_Ybbk88bx74sk4w=s48-c-k-c0x00ffffff-no-rj', 'authorChannelUrl': 'http://www.youtube.com/channel/UCNzBkKhM9lBgCke0rymWo2g', 'authorChannelId': {'value': 'UCNzBkKhM9lBgCke0rymWo2g'}, 'canRate': True, 'viewerRating': 'none', 'likeCount': 0, 'publishedAt': '2022-10-17T19:01:05Z', 'updatedAt': '2022-10-17T19:01:05Z'}}, 'canReply': True, 'totalReplyCount': 2, 'isPublic': True}","{'comments': [{'kind': 'youtube#comment', 'etag': '-eivYEeQq-EvLOLR3-IaWUst4To', 'id': 'UgzR5dlMxPKkWBCJXft4AaABAg.9hIMNZiKecR9hIPLrgaVdh', 'snippet': {'videoId': 'p7LIgvFBMuI', 'textDisplay': 'Infelizmente, Só bandidagem estão apoiando esses partidos de esquerda, será porque?', 'textOriginal': 'Infelizmente, Só bandidagem estão apoiando esses partidos de esquerda, será porque?', 'parentId': 'UgzR5dlMxPKkWBCJXft4AaABAg', 'authorDisplayName': 'Rosi Souza', 'authorProfileImageUrl': 'https://yt3.ggpht.com/ytc/AGIKgqNoA0ndeh_eRzi4otRj5GYrHlgeFgqggiaH1g=s48-c-k-c0x00ffffff-no-rj', 'authorChannelUrl': 'http://www.youtube.com/channel/UCoKjGgV4Q1hVvzjzUKO8NiQ', 'authorChannelId': {'value': 'UCoKjGgV4Q1hVvzjzUKO8NiQ'}, 'canRate': True, 'viewerRating': 'none', 'likeCount': 0, 'publishedAt': '2022-10-17T19:27:04Z', 'updatedAt': '2022-10-17T19:27:04Z'}}, {'kind': 'youtube#comment', 'etag': 'bqOM6c7vgzwMGP7RYGECAhF3AXI', 'id': 'UgzR5dlMxPKkWBCJXft4AaABAg.9hIMNZiKecR9hIN-B3_8Vy', 'snippet': {'videoId': 'p7LIgvFBMuI', 'textDisplay': 'Como vcs são podres!!! Pra proteger um bandido da facção PTCC vcs se fingem de besta ?!', 'textOriginal': 'Como vcs são podres!!! Pra proteger um bandido da facção PTCC vcs se fingem de besta ?!', 'parentId': 'UgzR5dlMxPKkWBCJXft4AaABAg', 'authorDisplayName': 'maria claudia tosi silva pinto mendonça de almeida', 'authorProfileImageUrl': 'https://yt3.ggpht.com/ytc/AGIKgqORn-D7Ei1HnC0hkcd4XFBOiRxNGcoqg-aBCxKKBQ=s48-c-k-c0x00ffffff-no-rj', 'authorChannelUrl': 'http://www.youtube.com/channel/UCUVYW_u8VIalJBScqf7DYxQ', 'authorChannelId': {'value': 'UCUVYW_u8VIalJBScqf7DYxQ'}, 'canRate': True, 'viewerRating': 'none', 'likeCount': 0, 'publishedAt': '2022-10-17T19:06:29Z', 'updatedAt': '2022-10-17T19:06:29Z'}}]}",UCNzBkKhM9lBgCke0rymWo2g,2022-10-17T19:01:05Z,"Escutaram tiros na Paraisópolis (algo muito raro mesmo 😅), como não transformar em atentado e tentar colher frutos em cima disso?",QURTSl9pMDNwOXpfcDBtdzFZYnNzbjNhZGVwVFYwOFB4WlR4U3NzRFNQMkp6ZzhHb3gyTHQ4emJ6TzF5QjhVb1g0VllZWHpRTEczMV91aw==,2023-06-08 15:47:16.850186
youtube#commentThread,5A7DGZZVET6QyYPObEVcdpbQD74,Ugz1qAe9gi8MtLKeQT94AaABAg,"{'videoId': '9XemMEVLRJ4', 'topLevelComment': {'kind': 'youtube#comment', 'etag': 'mwJRDo_Dmph8343qjU8DSF7djOQ', 'id': 'Ugz1qAe9gi8MtLKeQT94AaABAg', 'snippet': {'videoId': '9XemMEVLRJ4', 'textDisplay': 'Precisamos de leis, principalmente desfazer o estrago causado pelas sanções do incapaz.', 'textOriginal': 'Precisamos de leis, principalmente desfazer o estrago causado pelas sanções do incapaz.', 'authorDisplayName': 'Al', 'authorProfileImageUrl': 'https://yt3.ggpht.com/ytc/AGIKgqN19LDMmVNIXLV7HitZpAqGCPwBLwlFV4Pi9vVDJtFc-Wp7rsX_Ybbk88bx74sk4w=s48-c-k-c0x00ffffff-no-rj', 'authorChannelUrl': 'http://www.youtube.com/channel/UCNzBkKhM9lBgCke0rymWo2g', 'authorChannelId': {'value': 'UCNzBkKhM9lBgCke0rymWo2g'}, 'canRate': True, 'viewerRating': 'none', 'likeCount': 5, 'publishedAt': '2022-10-17T18:34:05Z', 'updatedAt': '2022-10-17T18:34:05Z'}}, 'canReply': True, 'totalReplyCount': 1, 'isPublic': True}","{'comments': [{'kind': 'youtube#comment', 'etag': 'XOBVWjuj1BzKRdl8J8AXt2RfFtM', 'id': 'Ugz1qAe9gi8MtLKeQT94AaABAg.9hIJHnPR_xN9hILxKbYo41', 'snippet': {'videoId': '9XemMEVLRJ4', 'textDisplay': '<a href=""https://youtu.be/nhsy2ZKbLQg"">https://youtu.be/nhsy2ZKbLQg</a>', 'textOriginal': 'https://youtu.be/nhsy2ZKbLQg', 'parentId': 'Ugz1qAe9gi8MtLKeQT94AaABAg', 'authorDisplayName': 'LÉO VICENCCI', 'authorProfileImageUrl': 'https://yt3.ggpht.com/Li3FoCNnts8K2nq4UdW7tarrfTW5VjLSvg5I4ztCLBUXfVeYysS-AQ09kq0aDnDwVAz4Ul2k=s48-c-k-c0x00ffffff-no-rj', 'authorChannelUrl': 'http://www.youtube.com/channel/UC2AUWUBOOf7kjgCHwdD64SQ', 'authorChannelId': {'value': 'UC2AUWUBOOf7kjgCHwdD64SQ'}, 'canRate': True, 'viewerRating': 'none', 'likeCount': 0, 'publishedAt': '2022-10-17T18:57:22Z', 'updatedAt': '2022-10-17T18:57:22Z'}}]}",UCNzBkKhM9lBgCke0rymWo2g,2022-10-17T18:34:05Z,"Precisamos de leis, principalmente desfazer o estrago causado pelas sanções do incapaz.",,2023-06-08 15:47:19.231314
youtube#commentThread,Kf1QGr_LA89L8Nm5he75-3HP7Cs,UgyrUMwhT72XtAaCU1V4AaABAg,"{'videoId': 'EHmteQXLLtI', 'topLevelComment': {'kind': 'youtube#comment', 'etag': 'Q81SHm0IemEZJHRgHvDmR60HvJU', 'id': 'UgyrUMwhT72XtAaCU1V4AaABAg', 'snippet': {'videoId': 'EHmteQXLLtI', 'textDisplay': 'Aos poucos ele vai conhecendo São Paulo. Primeiro contato com a favela Paraisópolis.<br>Mais uns 20 anos e ele se ambienta fora da sua terra.', 'textOriginal': 'Aos poucos ele vai conhecendo São Paulo. Primeiro contato com a favela Paraisópolis.\\\\nMais uns 20 anos e ele se ambienta fora da sua terra.', 'authorDisplayName': 'Al', 'authorProfileImageUrl': 'https://yt3.ggpht.com/ytc/AGIKgqN19LDMmVNIXLV7HitZpAqGCPwBLwlFV4Pi9vVDJtFc-Wp7rsX_Ybbk88bx74sk4w=s48-c-k-c0x00ffffff-no-rj', 'authorChannelUrl': 'http://www.youtube.com/channel/UCNzBkKhM9lBgCke0rymWo2g', 'authorChannelId': {'value': 'UCNzBkKhM9lBgCke0rymWo2g'}, 'canRate': True, 'viewerRating': 'none', 'likeCount': 0, 'publishedAt': '2022-10-17T15:30:08Z', 'updatedAt': '2022-10-17T15:30:08Z'}}, 'canReply': True, 'totalReplyCount': 0, 'isPublic': True}",,UCNzBkKhM9lBgCke0rymWo2g,2022-10-17T15:30:08Z,"Aos poucos ele vai conhecendo São Paulo. Primeiro contato com a favela Paraisópolis.
Mais uns 20 anos e ele se ambienta fora da sua terra.",QURTSl9pM21MUWtJbWF1OWFTak5kZE1TS3pnZFF1LXJ1YVhDdGNsUm5hWVN0RnpKck84RENGRDQxOWNMQ0JmNGJlcmRBLWlEa2U3RzR1RQ==,2023-06-08 15:48:53.534674
youtube#commentThread,tckuy9YHO5BSALC0Y4eCZucTzEo,UgzfWM7-opIfc39d_1d4AaABAg,"{'videoId': 'Ejvn8uM4a2I', 'topLevelComment': {'kind': 'youtube#comment', 'etag': 'sguGirAbCh20hfcLbGmOYw1E4t4', 'id': 'UgzfWM7-opIfc39d_1d4AaABAg', 'snippet': {'videoId': 'Ejvn8uM4a2I', 'textDisplay': 'Impressão de dinheiro, pedaladas, cheques pré-datados para compra de votos. Em novembro a gasolina volta a subir e em 2023 serão descontados os cheques sem fundo.', 'textOriginal': 'Impressão de dinheiro, pedaladas, cheques pré-datados para compra de votos. Em novembro a gasolina volta a subir e em 2023 serão descontados os cheques sem fundo.', 'authorDisplayName': 'Al', 'authorProfileImageUrl': 'https://yt3.ggpht.com/ytc/AGIKgqN19LDMmVNIXLV7HitZpAqGCPwBLwlFV4Pi9vVDJtFc-Wp7rsX_Ybbk88bx74sk4w=s48-c-k-c0x00ffffff-no-rj', 'authorChannelUrl': 'http://www.youtube.com/channel/UCNzBkKhM9lBgCke0rymWo2g', 'authorChannelId': {'value': 'UCNzBkKhM9lBgCke0rymWo2g'}, 'canRate': True, 'viewerRating': 'none', 'likeCount': 0, 'publishedAt': '2022-10-17T16:22:39Z', 'updatedAt': '2022-10-17T16:22:39Z'}}, 'canReply': True, 'totalReplyCount': 0, 'isPublic': True}",,UCNzBkKhM9lBgCke0rymWo2g,2022-10-17T16:22:39Z,"Impressão de dinheiro, pedaladas, cheques pré-datados para compra de votos. Em novembro a gasolina volta a subir e em 2023 serão descontados os cheques sem fundo.",,2023-06-08 15:48:54.881142
youtube#commentThread,3OEGvCE8wTEw9EhuTzgjStAtFoo,Ugw01kQNYb1QvwrUATp4AaABAg,"{'videoId': 'QYzlGWp-0Jg', 'topLevelComment': {'kind': 'youtube#comment', 'etag': 'XuL7u_VrCNDg6DC0u-ew8jAyBRg', 'id': 'Ugw01kQNYb1QvwrUATp4AaABAg', 'snippet': {'videoId': 'QYzlGWp-0Jg', 'textDisplay': 'O único impedimento à polícia TRABALHAR foi quando impediram o tratamento correto ao Herói da JP Bob Jeff.<br>Neste caso é só impedimento que a polícia seja usada para favorecer um candidato.', 'textOriginal': 'O único impedimento à polícia TRABALHAR foi quando impediram o tratamento correto ao Herói da JP Bob Jeff.\\\\nNeste caso é só impedimento que a polícia seja usada para favorecer um candidato.', 'authorDisplayName': 'Al', 'authorProfileImageUrl': 'https://yt3.ggpht.com/ytc/AGIKgqN19LDMmVNIXLV7HitZpAqGCPwBLwlFV4Pi9vVDJtFc-Wp7rsX_Ybbk88bx74sk4w=s48-c-k-c0x00ffffff-no-rj', 'authorChannelUrl': 'http://www.youtube.com/channel/UCNzBkKhM9lBgCke0rymWo2g', 'authorChannelId': {'value': 'UCNzBkKhM9lBgCke0rymWo2g'}, 'canRate': True, 'viewerRating': 'none', 'likeCount': 0, 'publishedAt': '2022-10-30T21:23:48Z', 'updatedAt': '2022-10-30T21:23:48Z'}}, 'canReply': True, 'totalReplyCount': 0, 'isPublic': True}",,UCNzBkKhM9lBgCke0rymWo2g,2022-10-30T21:23:48Z,"O único impedimento à polícia TRABALHAR foi quando impediram o tratamento correto ao Herói da JP Bob Jeff.
Neste caso é só impedimento que a polícia seja usada para favorecer um candidato.",QURTSl9pM3RRYjZrV2JueUFYZjdWcU5URkhRVEZ1d1RtVXhET1FqbWVwM1RhOHFhQ1dEeFM2VjJobGloS1JxZ2QtdDg5TzhSdmJrcXlNTQ==,2023-06-08 14:11:08.191189
youtube#commentThread,WxM0nXmeDarRU7QonM44lL_IawA,UgyrbgeEpToeZM0W_bN4AaABAg,"{'videoId': '9GvCpWl7tB8', 'topLevelComment': {'kind': 'youtube#comment', 'etag': '-4CUiHTYfGpciYI-yVwWpwcluwg', 'id': 'UgyrbgeEpToeZM0W_bN4AaABAg', 'snippet': {'videoId': '9GvCpWl7tB8', 'textDisplay': 'Motta foi selecionado para representar o Brasil nas próximas Olimpíadas. <br>Faz questão de ignorar que a maluca INVENTOU o crime. Ela já afirmou que &quot;escutou de alguém&quot;, e já se sabe que há 30 anos NÃO CHEGOU AO CONHECIMENTO NENHUM caso semelhante. Ele sabe que fala apenas para o gado.', 'textOriginal': 'Motta foi selecionado para representar o Brasil nas próximas Olimpíadas. \\\\nFaz questão de ignorar que a maluca INVENTOU o crime. Ela já afirmou que ""escutou de alguém"", e já se sabe que há 30 anos NÃO CHEGOU AO CONHECIMENTO NENHUM caso semelhante. Ele sabe que fala apenas para o gado.', 'authorDisplayName': 'Al', 'authorProfileImageUrl': 'https://yt3.ggpht.com/ytc/AGIKgqN19LDMmVNIXLV7HitZpAqGCPwBLwlFV4Pi9vVDJtFc-Wp7rsX_Ybbk88bx74sk4w=s48-c-k-c0x00ffffff-no-rj', 'authorChannelUrl': 'http://www.youtube.com/channel/UCNzBkKhM9lBgCke0rymWo2g', 'authorChannelId': {'value': 'UCNzBkKhM9lBgCke0rymWo2g'}, 'canRate': True, 'viewerRating': 'none', 'likeCount': 0, 'publishedAt': '2022-10-14T20:25:55Z', 'updatedAt': '2022-10-14T20:25:55Z'}}, 'canReply': True, 'totalReplyCount': 0, 'isPublic': True}",,UCNzBkKhM9lBgCke0rymWo2g,2022-10-14T20:25:55Z,"Motta foi selecionado para representar o Brasil nas próximas Olimpíadas. 
Faz questão de ignorar que a maluca INVENTOU o crime. Ela já afirmou que ""escutou de alguém"", e já se sabe que há 30 anos NÃO CHEGOU AO CONHECIMENTO NENHUM caso semelhante. Ele sabe que fala apenas para o gado.",QURTSl9pMFpUN2lGdElKblVvWERDVS0tb2wxUTctVlZwMDM3UmkxQTZ4bklFMVN2WGUtT0dxcEtVNDNOXzNRVENiT2lqdlh2UUZNMHJfOA==,2023-06-08 18:06:03.719368
