kind,etag,id,snippet,replies,authorChannelId,publishedAt,textOriginal,nextPageToken,extraction_date
youtube#commentThread,ZKur5SIi-rnhrve5de2gUUG4zXg,UgyzmL5R8PBxtrZi5DF4AaABAg,"{'videoId': '9GvCpWl7tB8', 'topLevelComment': {'kind': 'youtube#comment', 'etag': 'Z4j5VKkeuOKky0v5JkI3eI6ov1E', 'id': 'UgyzmL5R8PBxtrZi5DF4AaABAg', 'snippet': {'videoId': '9GvCpWl7tB8', 'textDisplay': 'Vai feder.ou vai aparecer os bois.kkkk', 'textOriginal': 'Vai feder.ou vai aparecer os bois.kkkk', 'authorDisplayName': 'Noel Roviller', 'authorProfileImageUrl': 'https://yt3.ggpht.com/ytc/AGIKgqPs3lKIwFFQdq56py8reF88P1cD3mnfxdAYDnazMpr_vUZ2jm2ozy2-6dZ4CxAJ=s48-c-k-c0x00ffffff-no-rj', 'authorChannelUrl': 'http://www.youtube.com/channel/UCSfTt3-squrnNKt0pInNCfw', 'authorChannelId': {'value': 'UCSfTt3-squrnNKt0pInNCfw'}, 'canRate': True, 'viewerRating': 'none', 'likeCount': 0, 'publishedAt': '2022-10-14T15:26:06Z', 'updatedAt': '2022-10-14T15:26:06Z'}}, 'canReply': True, 'totalReplyCount': 0, 'isPublic': True}",,UCSfTt3-squrnNKt0pInNCfw,2022-10-14T15:26:06Z,Vai feder.ou vai aparecer os bois.kkkk,QURTSl9pMmIzOFQ3STNYWkZSZWpJOEplZDFjVWtDTjRUaHc1WmV0Z2h6UWVXX1QzNU5oMVQ4REkxWnA2aHJLMHRoWEtQdkROSGZDZGJqNA==,2023-06-08 18:06:06.200670
youtube#commentThread,soQMoHOdaSzJRVVA1JsScO_He8I,UgxzSc2cW1mO5nI3ZVt4AaABAg,"{'videoId': 'UfBNeVw20AE', 'topLevelComment': {'kind': 'youtube#comment', 'etag': 'jmYxtJFdbHSI6tA6SOVcza4eeL8', 'id': 'UgxzSc2cW1mO5nI3ZVt4AaABAg', 'snippet': {'videoId': 'UfBNeVw20AE', 'textDisplay': 'Imagina nos outros municípios.  De uma olhada no município de Campinas grande do sul do Paraná. .kkkkkkkkkkkkk  e nos demais.  Vai ter muito dinheiro desviado', 'textOriginal': 'Imagina nos outros municípios.  De uma olhada no município de Campinas grande do sul do Paraná. .kkkkkkkkkkkkk  e nos demais.  Vai ter muito dinheiro desviado', 'authorDisplayName': 'Noel Roviller', 'authorProfileImageUrl': 'https://yt3.ggpht.com/ytc/AGIKgqPs3lKIwFFQdq56py8reF88P1cD3mnfxdAYDnazMpr_vUZ2jm2ozy2-6dZ4CxAJ=s48-c-k-c0x00ffffff-no-rj', 'authorChannelUrl': 'http://www.youtube.com/channel/UCSfTt3-squrnNKt0pInNCfw', 'authorChannelId': {'value': 'UCSfTt3-squrnNKt0pInNCfw'}, 'canRate': True, 'viewerRating': 'none', 'likeCount': 1, 'publishedAt': '2022-10-14T14:52:24Z', 'updatedAt': '2022-10-14T14:52:24Z'}}, 'canReply': True, 'totalReplyCount': 0, 'isPublic': True}",,UCSfTt3-squrnNKt0pInNCfw,2022-10-14T14:52:24Z,Imagina nos outros municípios.  De uma olhada no município de Campinas grande do sul do Paraná. .kkkkkkkkkkkkk  e nos demais.  Vai ter muito dinheiro desviado,QURTSl9pMjl3bGhxX3ppTzg3ZnliTUhPcWFSdndBaFU2dVpVVDhWN3psSW9aa1lLaVV1cmV3MDlNQ3BUTm43S0RibnNKWG9ZU0tOM1p4aw==,2023-06-08 18:06:11.416276
youtube#commentThread,mUtQZQPRqVzvNToF4goiEpLimu0,Ugxmmktutbhe7gs0DyJ4AaABAg,"{'videoId': 'd6RYIkiuTR4', 'topLevelComment': {'kind': 'youtube#comment', 'etag': 'SkmN9A4YMoJbIt6pBtmaRBCLk84', 'id': 'Ugxmmktutbhe7gs0DyJ4AaABAg', 'snippet': {'videoId': 'd6RYIkiuTR4', 'textDisplay': 'Eles podem usupar', 'textOriginal': 'Eles podem usupar', 'authorDisplayName': 'Noel Roviller', 'authorProfileImageUrl': 'https://yt3.ggpht.com/ytc/AGIKgqPs3lKIwFFQdq56py8reF88P1cD3mnfxdAYDnazMpr_vUZ2jm2ozy2-6dZ4CxAJ=s48-c-k-c0x00ffffff-no-rj', 'authorChannelUrl': 'http://www.youtube.com/channel/UCSfTt3-squrnNKt0pInNCfw', 'authorChannelId': {'value': 'UCSfTt3-squrnNKt0pInNCfw'}, 'canRate': True, 'viewerRating': 'none', 'likeCount': 0, 'publishedAt': '2022-10-14T15:24:48Z', 'updatedAt': '2022-10-14T15:24:48Z'}}, 'canReply': True, 'totalReplyCount': 0, 'isPublic': True}",,UCSfTt3-squrnNKt0pInNCfw,2022-10-14T15:24:48Z,Eles podem usupar,QURTSl9pMU9jZVlUWEJBckFneVlPbXBET2pSdWVEcVhnTFAtZlZLekZfWHY1d0pMVzJSM245RVpMWlNIaGIwbG9ZQWFaRk9oSTAwc2s4VQ==,2023-06-08 18:07:37.056559
youtube#commentThread,UkjeQNr1hoOb3dzjbz5-mpC0HBk,UgxO8MKAGgYVxQloNzt4AaABAg,"{'videoId': 'd6RYIkiuTR4', 'topLevelComment': {'kind': 'youtube#comment', 'etag': 'X3VWkcg3hpgcMzGDShLoJVYm3Kw', 'id': 'UgxO8MKAGgYVxQloNzt4AaABAg', 'snippet': {'videoId': 'd6RYIkiuTR4', 'textDisplay': 'Viu só.   Kkkkkkkkk', 'textOriginal': 'Viu só.   Kkkkkkkkk', 'authorDisplayName': 'Noel Roviller', 'authorProfileImageUrl': 'https://yt3.ggpht.com/ytc/AGIKgqPs3lKIwFFQdq56py8reF88P1cD3mnfxdAYDnazMpr_vUZ2jm2ozy2-6dZ4CxAJ=s48-c-k-c0x00ffffff-no-rj', 'authorChannelUrl': 'http://www.youtube.com/channel/UCSfTt3-squrnNKt0pInNCfw', 'authorChannelId': {'value': 'UCSfTt3-squrnNKt0pInNCfw'}, 'canRate': True, 'viewerRating': 'none', 'likeCount': 0, 'publishedAt': '2022-10-14T15:22:41Z', 'updatedAt': '2022-10-14T15:22:41Z'}}, 'canReply': True, 'totalReplyCount': 0, 'isPublic': True}",,UCSfTt3-squrnNKt0pInNCfw,2022-10-14T15:22:41Z,Viu só.   Kkkkkkkkk,QURTSl9pMU9jZVlUWEJBckFneVlPbXBET2pSdWVEcVhnTFAtZlZLekZfWHY1d0pMVzJSM245RVpMWlNIaGIwbG9ZQWFaRk9oSTAwc2s4VQ==,2023-06-08 18:07:37.056559
youtube#commentThread,IowjUEou-MzMk2rSG3PvAOxj874,Ugyb3eux0mIvol1sNJ14AaABAg,"{'videoId': 'D3-Tfeh8iBU', 'topLevelComment': {'kind': 'youtube#comment', 'etag': 'wSJzZqXwj1AUbpk-sFusJnwT5VQ', 'id': 'Ugyb3eux0mIvol1sNJ14AaABAg', 'snippet': {'videoId': 'D3-Tfeh8iBU', 'textDisplay': 'Também sou contra. Há muitos padres e pastores e líderes religiosos que são políticos.  Na surdina são políticos.   Qual é a identidade católica?', 'textOriginal': 'Também sou contra. Há muitos padres e pastores e líderes religiosos que são políticos.  Na surdina são políticos.   Qual é a identidade católica?', 'authorDisplayName': 'Noel Roviller', 'authorProfileImageUrl': 'https://yt3.ggpht.com/ytc/AGIKgqPs3lKIwFFQdq56py8reF88P1cD3mnfxdAYDnazMpr_vUZ2jm2ozy2-6dZ4CxAJ=s48-c-k-c0x00ffffff-no-rj', 'authorChannelUrl': 'http://www.youtube.com/channel/UCSfTt3-squrnNKt0pInNCfw', 'authorChannelId': {'value': 'UCSfTt3-squrnNKt0pInNCfw'}, 'canRate': True, 'viewerRating': 'none', 'likeCount': 0, 'publishedAt': '2022-10-12T22:32:05Z', 'updatedAt': '2022-10-12T22:32:05Z'}}, 'canReply': True, 'totalReplyCount': 0, 'isPublic': True}",,UCSfTt3-squrnNKt0pInNCfw,2022-10-12T22:32:05Z,Também sou contra. Há muitos padres e pastores e líderes religiosos que são políticos.  Na surdina são políticos.   Qual é a identidade católica?,QURTSl9pMXR3WmpjSWxTaGZtZ0JkNWVNbmktdDVaVVlLZnVSNkZKR3hoRTlONzNSS3VMZ2kzb1BJRGthRk9vbDZjWXotNU9nOEpFM0x3dw==,2023-06-08 18:13:18.703824
youtube#commentThread,g7La2PkONJjGsCCewEZidGHfwrk,UgxGX5CqACSl-yD3nrN4AaABAg,"{'videoId': 'HEh_BNhxWG0', 'topLevelComment': {'kind': 'youtube#comment', 'etag': '6_3Kfx2rC0yIF4QAdbSfn9ERzc8', 'id': 'UgxGX5CqACSl-yD3nrN4AaABAg', 'snippet': {'videoId': 'HEh_BNhxWG0', 'textDisplay': 'Imóveis.  Muitos dragões.  Mas vamos vencer em nome do Senhor Jesus Cristo.  Dragões representam diabos demônios. Identidade religiosa tem q ser cristão.  Em Jesus Cristo. Não pertencer a um sistema religioso que é guiado por homens', 'textOriginal': 'Imóveis.  Muitos dragões.  Mas vamos vencer em nome do Senhor Jesus Cristo.  Dragões representam diabos demônios. Identidade religiosa tem q ser cristão.  Em Jesus Cristo. Não pertencer a um sistema religioso que é guiado por homens', 'authorDisplayName': 'Noel Roviller', 'authorProfileImageUrl': 'https://yt3.ggpht.com/ytc/AGIKgqPs3lKIwFFQdq56py8reF88P1cD3mnfxdAYDnazMpr_vUZ2jm2ozy2-6dZ4CxAJ=s48-c-k-c0x00ffffff-no-rj', 'authorChannelUrl': 'http://www.youtube.com/channel/UCSfTt3-squrnNKt0pInNCfw', 'authorChannelId': {'value': 'UCSfTt3-squrnNKt0pInNCfw'}, 'canRate': True, 'viewerRating': 'none', 'likeCount': 0, 'publishedAt': '2022-10-12T19:27:34Z', 'updatedAt': '2022-10-12T19:27:34Z'}}, 'canReply': True, 'totalReplyCount': 0, 'isPublic': True}",,UCSfTt3-squrnNKt0pInNCfw,2022-10-12T19:27:34Z,Imóveis.  Muitos dragões.  Mas vamos vencer em nome do Senhor Jesus Cristo.  Dragões representam diabos demônios. Identidade religiosa tem q ser cristão.  Em Jesus Cristo. Não pertencer a um sistema religioso que é guiado por homens,QURTSl9pMWZfLUMzU2JUcmxraHFEZVhSdWt1YTV1Q0ZqQkYyWmZTc1hJcUJNcS04S1BHQklTdlY2a2tfM01WclNRcFRoaFNzWU5yRkMwVQ==,2023-06-08 18:13:34.577235
youtube#commentThread,DEXprCYuC9psHNjbPYfcjG49tzU,UgwTmw4rInBotO_gxCB4AaABAg,"{'videoId': 'gwgufZVqLU4', 'topLevelComment': {'kind': 'youtube#comment', 'etag': 'UvoAGsxOjs6PLfZG5bO_sgiTXNQ', 'id': 'UgwTmw4rInBotO_gxCB4AaABAg', 'snippet': {'videoId': 'gwgufZVqLU4', 'textDisplay': 'Não sei porque essa data. Nada haver. Já estou careca de saber q e uma hestoria inventada pelos pescadores.   Só Deus na causa.', 'textOriginal': 'Não sei porque essa data. Nada haver. Já estou careca de saber q e uma hestoria inventada pelos pescadores.   Só Deus na causa.', 'authorDisplayName': 'Noel Roviller', 'authorProfileImageUrl': 'https://yt3.ggpht.com/ytc/AGIKgqPs3lKIwFFQdq56py8reF88P1cD3mnfxdAYDnazMpr_vUZ2jm2ozy2-6dZ4CxAJ=s48-c-k-c0x00ffffff-no-rj', 'authorChannelUrl': 'http://www.youtube.com/channel/UCSfTt3-squrnNKt0pInNCfw', 'authorChannelId': {'value': 'UCSfTt3-squrnNKt0pInNCfw'}, 'canRate': True, 'viewerRating': 'none', 'likeCount': 0, 'publishedAt': '2022-10-12T18:54:18Z', 'updatedAt': '2022-10-12T18:54:18Z'}}, 'canReply': True, 'totalReplyCount': 0, 'isPublic': True}",,UCSfTt3-squrnNKt0pInNCfw,2022-10-12T18:54:18Z,Não sei porque essa data. Nada haver. Já estou careca de saber q e uma hestoria inventada pelos pescadores.   Só Deus na causa.,,2023-06-08 18:13:55.767766
youtube#commentThread,zePWP7iGupgQ0c7Sp1pJILEEtXM,UgwYOOe82NYUDhxgFCl4AaABAg,"{'videoId': 'opzzOvvebkQ', 'topLevelComment': {'kind': 'youtube#comment', 'etag': 'J180vnEws4SVcYbfZAsumsbL0GE', 'id': 'UgwYOOe82NYUDhxgFCl4AaABAg', 'snippet': {'videoId': 'opzzOvvebkQ', 'textDisplay': 'Eu acho que isso vai feder', 'textOriginal': 'Eu acho que isso vai feder', 'authorDisplayName': 'Noel Roviller', 'authorProfileImageUrl': 'https://yt3.ggpht.com/ytc/AGIKgqPs3lKIwFFQdq56py8reF88P1cD3mnfxdAYDnazMpr_vUZ2jm2ozy2-6dZ4CxAJ=s48-c-k-c0x00ffffff-no-rj', 'authorChannelUrl': 'http://www.youtube.com/channel/UCSfTt3-squrnNKt0pInNCfw', 'authorChannelId': {'value': 'UCSfTt3-squrnNKt0pInNCfw'}, 'canRate': True, 'viewerRating': 'none', 'likeCount': 0, 'publishedAt': '2022-10-12T13:32:27Z', 'updatedAt': '2022-10-12T13:32:27Z'}}, 'canReply': True, 'totalReplyCount': 0, 'isPublic': True}",,UCSfTt3-squrnNKt0pInNCfw,2022-10-12T13:32:27Z,Eu acho que isso vai feder,QURTSl9pMFBtTlVaaVZudG9NT0pLRm5hSGhDSjNWXzA4SlZ4TXFYLU1nejJseEJTNS1qYjhXeVh6elpYeGJkR2JjWXFudVNsQUdnT3FuYw==,2023-06-08 18:14:28.403062
youtube#commentThread,4yOLkbz3CCnAu98tj2zsUuBthcw,UgxB2-1ljDFD49A-lzF4AaABAg,"{'videoId': 'fcAMNIrOLFM', 'topLevelComment': {'kind': 'youtube#comment', 'etag': 'unlABGfTck22vOojvs7V5nH5Puk', 'id': 'UgxB2-1ljDFD49A-lzF4AaABAg', 'snippet': {'videoId': 'fcAMNIrOLFM', 'textDisplay': 'Por isso que figo q o exército marinha e aeronáutica tem q se unir e acabar com isso. Pronto. E que os políticos não querem acabar', 'textOriginal': 'Por isso que figo q o exército marinha e aeronáutica tem q se unir e acabar com isso. Pronto. E que os políticos não querem acabar', 'authorDisplayName': 'Noel Roviller', 'authorProfileImageUrl': 'https://yt3.ggpht.com/ytc/AGIKgqPs3lKIwFFQdq56py8reF88P1cD3mnfxdAYDnazMpr_vUZ2jm2ozy2-6dZ4CxAJ=s48-c-k-c0x00ffffff-no-rj', 'authorChannelUrl': 'http://www.youtube.com/channel/UCSfTt3-squrnNKt0pInNCfw', 'authorChannelId': {'value': 'UCSfTt3-squrnNKt0pInNCfw'}, 'canRate': True, 'viewerRating': 'none', 'likeCount': 0, 'publishedAt': '2022-10-12T13:34:41Z', 'updatedAt': '2022-10-12T13:34:41Z'}}, 'canReply': True, 'totalReplyCount': 1, 'isPublic': True}","{'comments': [{'kind': 'youtube#comment', 'etag': 'DHWD9aj4Epmnx3v2Advu_dNhkpM', 'id': 'UgxB2-1ljDFD49A-lzF4AaABAg.9h4u2Y5tLg79h4uaM_8H_Y', 'snippet': {'videoId': 'fcAMNIrOLFM', 'textDisplay': 'TEMOS QUE ACABAR COM ISTO É NO VOTO, MOSTRE AO OUTRO INDECISO QUE BOLSONARO TEM RAZÃO', 'textOriginal': 'TEMOS QUE ACABAR COM ISTO É NO VOTO, MOSTRE AO OUTRO INDECISO QUE BOLSONARO TEM RAZÃO', 'parentId': 'UgxB2-1ljDFD49A-lzF4AaABAg', 'authorDisplayName': 'Raul Lima', 'authorProfileImageUrl': 'https://yt3.ggpht.com/ytc/AGIKgqP3jmSqSfAmtJE5Ybf2nGzeb5R6wuqHGkoWstEn45z1nK8oKzX0tY6S38ylkMag=s48-c-k-c0x00ffffff-no-rj', 'authorChannelUrl': 'http://www.youtube.com/channel/UCrRZnuVSrSLNLDfPFTcTbQQ', 'authorChannelId': {'value': 'UCrRZnuVSrSLNLDfPFTcTbQQ'}, 'canRate': True, 'viewerRating': 'none', 'likeCount': 2, 'publishedAt': '2022-10-12T13:39:26Z', 'updatedAt': '2022-10-12T13:39:26Z'}}]}",UCSfTt3-squrnNKt0pInNCfw,2022-10-12T13:34:41Z,Por isso que figo q o exército marinha e aeronáutica tem q se unir e acabar com isso. Pronto. E que os políticos não querem acabar,QURTSl9pMC04V1pDVE5tQkwweVBUbGNkemZKTkg1bGZsNEFSaDZOTHYxeExIWXBISWZoTzREZGxiYTI1S01KLXAtQjFkSS1mNlctLWd3aw==,2023-06-08 18:14:49.234443
youtube#commentThread,7kUwcqHNl9-i6ZWTp8Gvg4yc_wQ,UgyPbJHef63SK1N_85h4AaABAg,"{'videoId': 'qzZEM-MKY20', 'topLevelComment': {'kind': 'youtube#comment', 'etag': '48NXMnpVrONngyfrl2e0QQLSZwI', 'id': 'UgyPbJHef63SK1N_85h4AaABAg', 'snippet': {'videoId': 'qzZEM-MKY20', 'textDisplay': 'Será que assim mesmo. Eles não iam arriscar tufo. Como certeza foi combinado.', 'textOriginal': 'Será que assim mesmo. Eles não iam arriscar tufo. Como certeza foi combinado.', 'authorDisplayName': 'Noel Roviller', 'authorProfileImageUrl': 'https://yt3.ggpht.com/ytc/AGIKgqPs3lKIwFFQdq56py8reF88P1cD3mnfxdAYDnazMpr_vUZ2jm2ozy2-6dZ4CxAJ=s48-c-k-c0x00ffffff-no-rj', 'authorChannelUrl': 'http://www.youtube.com/channel/UCSfTt3-squrnNKt0pInNCfw', 'authorChannelId': {'value': 'UCSfTt3-squrnNKt0pInNCfw'}, 'canRate': True, 'viewerRating': 'none', 'likeCount': 3, 'publishedAt': '2022-10-11T17:10:46Z', 'updatedAt': '2022-10-11T17:10:46Z'}}, 'canReply': True, 'totalReplyCount': 1, 'isPublic': True}","{'comments': [{'kind': 'youtube#comment', 'etag': 'xSa6gc4K9WZI6-Ajrjq04uz2MAo', 'id': 'UgyPbJHef63SK1N_85h4AaABAg.9h2hzQ1zyUl9h2rNPFoOFj', 'snippet': {'videoId': 'qzZEM-MKY20', 'textDisplay': 'Que sirva de exemplo para outros homens a mulherada se junta com cara famoso que tem vida boa quando se vê rejeitada ou abandonada elas se vinga mesmo conheço mulheres que arrumou a vida fazendo isso porque tem muito homem babaca por aí.', 'textOriginal': 'Que sirva de exemplo para outros homens a mulherada se junta com cara famoso que tem vida boa quando se vê rejeitada ou abandonada elas se vinga mesmo conheço mulheres que arrumou a vida fazendo isso porque tem muito homem babaca por aí.', 'parentId': 'UgyPbJHef63SK1N_85h4AaABAg', 'authorDisplayName': 'Marta Lessa', 'authorProfileImageUrl': 'https://yt3.ggpht.com/ytc/AGIKgqOslmW251I-_SQt41bw9Jpy03a5RasqmotKGAtO-w=s48-c-k-c0x00ffffff-no-rj', 'authorChannelUrl': 'http://www.youtube.com/channel/UCC32fqc_TDZ7BER9DshDSWA', 'authorChannelId': {'value': 'UCC32fqc_TDZ7BER9DshDSWA'}, 'canRate': True, 'viewerRating': 'none', 'likeCount': 0, 'publishedAt': '2022-10-11T18:32:50Z', 'updatedAt': '2022-10-11T18:32:50Z'}}]}",UCSfTt3-squrnNKt0pInNCfw,2022-10-11T17:10:46Z,Será que assim mesmo. Eles não iam arriscar tufo. Como certeza foi combinado.,,2023-06-08 18:17:09.935596
youtube#commentThread,BcnwS3Xdd_BOFTuxWyj44viXiPg,UgyIeqf2TVEycactDAR4AaABAg,"{'videoId': 'qzZEM-MKY20', 'topLevelComment': {'kind': 'youtube#comment', 'etag': '3jLHlI2iwlY4UPkV-iS17LxFSxc', 'id': 'UgyIeqf2TVEycactDAR4AaABAg', 'snippet': {'videoId': 'qzZEM-MKY20', 'textDisplay': 'Estranho.', 'textOriginal': 'Estranho.', 'authorDisplayName': 'Noel Roviller', 'authorProfileImageUrl': 'https://yt3.ggpht.com/ytc/AGIKgqPs3lKIwFFQdq56py8reF88P1cD3mnfxdAYDnazMpr_vUZ2jm2ozy2-6dZ4CxAJ=s48-c-k-c0x00ffffff-no-rj', 'authorChannelUrl': 'http://www.youtube.com/channel/UCSfTt3-squrnNKt0pInNCfw', 'authorChannelId': {'value': 'UCSfTt3-squrnNKt0pInNCfw'}, 'canRate': True, 'viewerRating': 'none', 'likeCount': 4, 'publishedAt': '2022-10-11T17:09:42Z', 'updatedAt': '2022-10-11T17:09:42Z'}}, 'canReply': True, 'totalReplyCount': 0, 'isPublic': True}",,UCSfTt3-squrnNKt0pInNCfw,2022-10-11T17:09:42Z,Estranho.,,2023-06-08 18:17:09.935596
youtube#commentThread,PkBZrlWWyJ1j3wvSpTAAxTvgvSQ,UgwHpSYwqSSY50JJzSd4AaABAg,"{'videoId': 'rgM_b8t_5gM', 'topLevelComment': {'kind': 'youtube#comment', 'etag': 'i2jr56ipsj8DgbozEtPb2Y7iCow', 'id': 'UgwHpSYwqSSY50JJzSd4AaABAg', 'snippet': {'videoId': 'rgM_b8t_5gM', 'textDisplay': 'Então volta para o Brasil.', 'textOriginal': 'Então volta para o Brasil.', 'authorDisplayName': 'Noel Roviller', 'authorProfileImageUrl': 'https://yt3.ggpht.com/ytc/AGIKgqPs3lKIwFFQdq56py8reF88P1cD3mnfxdAYDnazMpr_vUZ2jm2ozy2-6dZ4CxAJ=s48-c-k-c0x00ffffff-no-rj', 'authorChannelUrl': 'http://www.youtube.com/channel/UCSfTt3-squrnNKt0pInNCfw', 'authorChannelId': {'value': 'UCSfTt3-squrnNKt0pInNCfw'}, 'canRate': True, 'viewerRating': 'none', 'likeCount': 0, 'publishedAt': '2022-10-11T12:14:21Z', 'updatedAt': '2022-10-11T12:14:21Z'}}, 'canReply': True, 'totalReplyCount': 0, 'isPublic': True}",,UCSfTt3-squrnNKt0pInNCfw,2022-10-11T12:14:21Z,Então volta para o Brasil.,,2023-06-08 18:18:21.413792
youtube#commentThread,WLg1dyLkFaThKQV4XRLnD6nCZXU,Ugz27tXAm-l0uuqV0114AaABAg,"{'videoId': 'T7l3PWm8NH4', 'topLevelComment': {'kind': 'youtube#comment', 'etag': 'LJbGLNPE2dQuLxNHiCTdMA-Xw2I', 'id': 'Ugz27tXAm-l0uuqV0114AaABAg', 'snippet': {'videoId': 'T7l3PWm8NH4', 'textDisplay': 'Já ouviram aquela música do Eduardo Costa. Cuidado. Cuidado', 'textOriginal': 'Já ouviram aquela música do Eduardo Costa. Cuidado. Cuidado', 'authorDisplayName': 'Noel Roviller', 'authorProfileImageUrl': 'https://yt3.ggpht.com/ytc/AGIKgqPs3lKIwFFQdq56py8reF88P1cD3mnfxdAYDnazMpr_vUZ2jm2ozy2-6dZ4CxAJ=s48-c-k-c0x00ffffff-no-rj', 'authorChannelUrl': 'http://www.youtube.com/channel/UCSfTt3-squrnNKt0pInNCfw', 'authorChannelId': {'value': 'UCSfTt3-squrnNKt0pInNCfw'}, 'canRate': True, 'viewerRating': 'none', 'likeCount': 0, 'publishedAt': '2022-10-11T12:02:04Z', 'updatedAt': '2022-10-11T12:02:04Z'}}, 'canReply': True, 'totalReplyCount': 0, 'isPublic': True}",,UCSfTt3-squrnNKt0pInNCfw,2022-10-11T12:02:04Z,Já ouviram aquela música do Eduardo Costa. Cuidado. Cuidado,QURTSl9pM2VHUnRlaGs1VDhxQWZ2MGhIdWNLVnFGbkp0RGRKbG1DdDhDbC1QV3ZKT0xWUnI2YmRGSjNBOGJFVW5uVVNXdlJtQmtHRjlmZw==,2023-06-08 18:18:24.464087
youtube#commentThread,mu_DGypV_J7UkW56ZiICDWN-Cq8,Ugw5mtjByQMAavDJ59F4AaABAg,"{'videoId': 'T7l3PWm8NH4', 'topLevelComment': {'kind': 'youtube#comment', 'etag': 'QqlyWbKDesUidPropjscWd13NYM', 'id': 'Ugw5mtjByQMAavDJ59F4AaABAg', 'snippet': {'videoId': 'T7l3PWm8NH4', 'textDisplay': 'Picanha eu como a hora que quiser. Aquilo é um exemplo de melhora', 'textOriginal': 'Picanha eu como a hora que quiser. Aquilo é um exemplo de melhora', 'authorDisplayName': 'Noel Roviller', 'authorProfileImageUrl': 'https://yt3.ggpht.com/ytc/AGIKgqPs3lKIwFFQdq56py8reF88P1cD3mnfxdAYDnazMpr_vUZ2jm2ozy2-6dZ4CxAJ=s48-c-k-c0x00ffffff-no-rj', 'authorChannelUrl': 'http://www.youtube.com/channel/UCSfTt3-squrnNKt0pInNCfw', 'authorChannelId': {'value': 'UCSfTt3-squrnNKt0pInNCfw'}, 'canRate': True, 'viewerRating': 'none', 'likeCount': 0, 'publishedAt': '2022-10-11T12:01:14Z', 'updatedAt': '2022-10-11T12:01:14Z'}}, 'canReply': True, 'totalReplyCount': 0, 'isPublic': True}",,UCSfTt3-squrnNKt0pInNCfw,2022-10-11T12:01:14Z,Picanha eu como a hora que quiser. Aquilo é um exemplo de melhora,QURTSl9pM2VHUnRlaGs1VDhxQWZ2MGhIdWNLVnFGbkp0RGRKbG1DdDhDbC1QV3ZKT0xWUnI2YmRGSjNBOGJFVW5uVVNXdlJtQmtHRjlmZw==,2023-06-08 18:18:24.464087
youtube#commentThread,R0pSWwk_Xw1zAR5_7OPjbOlErUU,UgwubwkhB_2KKs_jSnl4AaABAg,"{'videoId': 'yAzVM23ntIQ', 'topLevelComment': {'kind': 'youtube#comment', 'etag': 'BNDRPazI-W3s8Orm0N0Y_wqmtBE', 'id': 'UgwubwkhB_2KKs_jSnl4AaABAg', 'snippet': {'videoId': 'yAzVM23ntIQ', 'textDisplay': 'Tem q explicar mesmo. Tudo. O lugar que escolheu para falar não era a hora..  eu acho que ela assistiu muito filme.e muita informações contadas.  Isso mesmo MPF.. concordo. Porque não denunciou qd estava lá?', 'textOriginal': 'Tem q explicar mesmo. Tudo. O lugar que escolheu para falar não era a hora..  eu acho que ela assistiu muito filme.e muita informações contadas.  Isso mesmo MPF.. concordo. Porque não denunciou qd estava lá?', 'authorDisplayName': 'Noel Roviller', 'authorProfileImageUrl': 'https://yt3.ggpht.com/ytc/AGIKgqPs3lKIwFFQdq56py8reF88P1cD3mnfxdAYDnazMpr_vUZ2jm2ozy2-6dZ4CxAJ=s48-c-k-c0x00ffffff-no-rj', 'authorChannelUrl': 'http://www.youtube.com/channel/UCSfTt3-squrnNKt0pInNCfw', 'authorChannelId': {'value': 'UCSfTt3-squrnNKt0pInNCfw'}, 'canRate': True, 'viewerRating': 'none', 'likeCount': 0, 'publishedAt': '2022-10-11T12:05:33Z', 'updatedAt': '2022-10-11T12:05:33Z'}}, 'canReply': True, 'totalReplyCount': 0, 'isPublic': True}",,UCSfTt3-squrnNKt0pInNCfw,2022-10-11T12:05:33Z,Tem q explicar mesmo. Tudo. O lugar que escolheu para falar não era a hora..  eu acho que ela assistiu muito filme.e muita informações contadas.  Isso mesmo MPF.. concordo. Porque não denunciou qd estava lá?,QURTSl9pMUlWSDg3NHFNU3hXNF9QeGRkT0UycXJGeW9wUUZ2bWFXM04tT01xTlVmUENROFVxNkZNMEstNVRkdm9SMGhRZWZGaW1STXNvYw==,2023-06-08 18:18:30.283828
youtube#commentThread,-f8Igx2z_GkVjkBvtuj_hLP_O0w,UgzsBlzN0sP8PhG_cpZ4AaABAg,"{'videoId': 'n-SU6WxLxAQ', 'topLevelComment': {'kind': 'youtube#comment', 'etag': 'q2ptxiukZ2qwOx7mqB1V4ejxrsc', 'id': 'UgzsBlzN0sP8PhG_cpZ4AaABAg', 'snippet': {'videoId': 'n-SU6WxLxAQ', 'textDisplay': 'E uma jogada de mestre. Pode ter certeza.', 'textOriginal': 'E uma jogada de mestre. Pode ter certeza.', 'authorDisplayName': 'Noel Roviller', 'authorProfileImageUrl': 'https://yt3.ggpht.com/ytc/AGIKgqPs3lKIwFFQdq56py8reF88P1cD3mnfxdAYDnazMpr_vUZ2jm2ozy2-6dZ4CxAJ=s48-c-k-c0x00ffffff-no-rj', 'authorChannelUrl': 'http://www.youtube.com/channel/UCSfTt3-squrnNKt0pInNCfw', 'authorChannelId': {'value': 'UCSfTt3-squrnNKt0pInNCfw'}, 'canRate': True, 'viewerRating': 'none', 'likeCount': 1, 'publishedAt': '2022-10-11T17:30:38Z', 'updatedAt': '2022-10-11T17:30:38Z'}}, 'canReply': True, 'totalReplyCount': 0, 'isPublic': True}",,UCSfTt3-squrnNKt0pInNCfw,2022-10-11T17:30:38Z,E uma jogada de mestre. Pode ter certeza.,QURTSl9pMXBKblhlUUxYRXI2MG9SQ1JWSlR4MXhUV2NsSjRObjZJT3czd29lTXZwX0c4dlpoQXpGX1VFTUZkSU5sY1Y3VUo0R2hOYndKTQ==,2023-06-08 18:18:39.674367
youtube#commentThread,vXiWso2EbInbAOywujc2Aj59udc,UgwkLNPltaPtC4ypImN4AaABAg,"{'videoId': '39VGTB529jc', 'topLevelComment': {'kind': 'youtube#comment', 'etag': 't2L7nSLRZE4TK2WUtSmlFROuY0Y', 'id': 'UgwkLNPltaPtC4ypImN4AaABAg', 'snippet': {'videoId': '39VGTB529jc', 'textDisplay': 'E crime ou não é? ??? Não entendi a moça falou que é uma situação de saude', 'textOriginal': 'E crime ou não é? ??? Não entendi a moça falou que é uma situação de saude', 'authorDisplayName': 'Noel Roviller', 'authorProfileImageUrl': 'https://yt3.ggpht.com/ytc/AGIKgqPs3lKIwFFQdq56py8reF88P1cD3mnfxdAYDnazMpr_vUZ2jm2ozy2-6dZ4CxAJ=s48-c-k-c0x00ffffff-no-rj', 'authorChannelUrl': 'http://www.youtube.com/channel/UCSfTt3-squrnNKt0pInNCfw', 'authorChannelId': {'value': 'UCSfTt3-squrnNKt0pInNCfw'}, 'canRate': True, 'viewerRating': 'none', 'likeCount': 11, 'publishedAt': '2022-10-10T23:53:30Z', 'updatedAt': '2022-10-10T23:53:30Z'}}, 'canReply': True, 'totalReplyCount': 3, 'isPublic': True}","{'comments': [{'kind': 'youtube#comment', 'etag': 'WJ5E-Pm_OPmPY5HfFawjyZdmqgY', 'id': 'UgwkLNPltaPtC4ypImN4AaABAg.9h0rHARBj1U9h0uIvKiDxy', 'snippet': {'videoId': '39VGTB529jc', 'textDisplay': 'Faz parte da agenda da esquerda amenizar os termos pra depois naturalizá-los. Veja q essa semana a Colômbia acabou de aprovar como legal a relação entre um adulto e um menor de 14 anos.', 'textOriginal': 'Faz parte da agenda da esquerda amenizar os termos pra depois naturalizá-los. Veja q essa semana a Colômbia acabou de aprovar como legal a relação entre um adulto e um menor de 14 anos.', 'parentId': 'UgwkLNPltaPtC4ypImN4AaABAg', 'authorDisplayName': 'Lu RT', 'authorProfileImageUrl': 'https://yt3.ggpht.com/8dUYNzMlncA-c1tFftluGg-NYlZ3h0Y5WDaHxg7RQ58Tmv8sL88CsDEgEKBI26Nvs31jj3hD1EU=s48-c-k-c0x00ffffff-no-rj', 'authorChannelUrl': 'http://www.youtube.com/channel/UCi9uxDWCV8anidLkJtUz6Jg', 'authorChannelId': {'value': 'UCi9uxDWCV8anidLkJtUz6Jg'}, 'canRate': True, 'viewerRating': 'none', 'likeCount': 0, 'publishedAt': '2022-10-11T00:19:57Z', 'updatedAt': '2022-10-11T00:20:21Z'}}, {'kind': 'youtube#comment', 'etag': 'DIpdDoWvKWjCWQKMvG-16JEEeNY', 'id': 'UgwkLNPltaPtC4ypImN4AaABAg.9h0rHARBj1U9h0tLsKWT6G', 'snippet': {'videoId': '39VGTB529jc', 'textDisplay': 'Sempre assim... Um Cid prá apaziguar um crime.', 'textOriginal': 'Sempre assim... Um Cid prá apaziguar um crime.', 'parentId': 'UgwkLNPltaPtC4ypImN4AaABAg', 'authorDisplayName': 'Milena Coelho', 'authorProfileImageUrl': 'https://yt3.ggpht.com/9S5bEeRCwws9h1QJdf-jglZWV5MDsiXcnEWZ7knAHB96VKOw7K5AFN2JIzz_exEgz7L-yo_X6w=s48-c-k-c0x00ffffff-no-rj', 'authorChannelUrl': 'http://www.youtube.com/channel/UCi-wl7JHprRpbdkSvtm4JjA', 'authorChannelId': {'value': 'UCi-wl7JHprRpbdkSvtm4JjA'}, 'canRate': True, 'viewerRating': 'none', 'likeCount': 0, 'publishedAt': '2022-10-11T00:11:37Z', 'updatedAt': '2022-10-11T00:11:37Z'}}, {'kind': 'youtube#comment', 'etag': 'Ziy6HZIs5KnanDC7MvMU6g_vvrQ', 'id': 'UgwkLNPltaPtC4ypImN4AaABAg.9h0rHARBj1U9h0tKrNsTWE', 'snippet': {'videoId': '39VGTB529jc', 'textDisplay': 'Sempre assim... Um Cid prá apaziguar um crime.', 'textOriginal': 'Sempre assim... Um Cid prá apaziguar um crime.', 'parentId': 'UgwkLNPltaPtC4ypImN4AaABAg', 'authorDisplayName': 'Milena Coelho', 'authorProfileImageUrl': 'https://yt3.ggpht.com/9S5bEeRCwws9h1QJdf-jglZWV5MDsiXcnEWZ7knAHB96VKOw7K5AFN2JIzz_exEgz7L-yo_X6w=s48-c-k-c0x00ffffff-no-rj', 'authorChannelUrl': 'http://www.youtube.com/channel/UCi-wl7JHprRpbdkSvtm4JjA', 'authorChannelId': {'value': 'UCi-wl7JHprRpbdkSvtm4JjA'}, 'canRate': True, 'viewerRating': 'none', 'likeCount': 0, 'publishedAt': '2022-10-11T00:11:25Z', 'updatedAt': '2022-10-11T00:11:25Z'}}]}",UCSfTt3-squrnNKt0pInNCfw,2022-10-10T23:53:30Z,E crime ou não é? ??? Não entendi a moça falou que é uma situação de saude,,2023-06-08 18:18:59.708154
