kind,etag,id,snippet,replies,authorChannelId,publishedAt,textOriginal,nextPageToken,extraction_date
youtube#commentThread,7r4tCcNjFH7YCEGhajrdJTnzk_0,Ugwj_lR85MDSAJmgC454AaABAg,"{'videoId': 'E0jMnYphxIs', 'topLevelComment': {'kind': 'youtube#comment', 'etag': '-aKoc7UbWt2gJDkjubV-EpDqhHs', 'id': 'Ugwj_lR85MDSAJmgC454AaABAg', 'snippet': {'videoId': 'E0jMnYphxIs', 'textDisplay': 'Se são Paulo quizer dar um salto de qualidade precisa do tarciso o astronauta e principalmente Bolsonaro aí sim pode ter certeza que são Paulo vai recuperar o tempo perdido mais os paulista tem de votar em massa no Bolsonaro são Paulo só tenha a ganhar', 'textOriginal': 'Se são Paulo quizer dar um salto de qualidade precisa do tarciso o astronauta e principalmente Bolsonaro aí sim pode ter certeza que são Paulo vai recuperar o tempo perdido mais os paulista tem de votar em massa no Bolsonaro são Paulo só tenha a ganhar', 'authorDisplayName': 'Elias Gabriel Almeida', 'authorProfileImageUrl': 'https://yt3.ggpht.com/ytc/AGIKgqMQlFU_-aob5YqnYMebsqXWUa79bgOqO40aqw=s48-c-k-c0x00ffffff-no-rj', 'authorChannelUrl': 'http://www.youtube.com/channel/UCltP15-Ab2lAUbKhsIWj2lg', 'authorChannelId': {'value': 'UCltP15-Ab2lAUbKhsIWj2lg'}, 'canRate': True, 'viewerRating': 'none', 'likeCount': 8, 'publishedAt': '2022-10-13T12:55:02Z', 'updatedAt': '2022-10-13T12:55:02Z'}}, 'canReply': True, 'totalReplyCount': 0, 'isPublic': True}",,UCltP15-Ab2lAUbKhsIWj2lg,2022-10-13T12:55:02Z,Se são Paulo quizer dar um salto de qualidade precisa do tarciso o astronauta e principalmente Bolsonaro aí sim pode ter certeza que são Paulo vai recuperar o tempo perdido mais os paulista tem de votar em massa no Bolsonaro são Paulo só tenha a ganhar,QURTSl9pM3RwZnpNYm1lVVhybVFXMWVOeG1BdXBqVGd2VlJkRWFhRGpycEo3ZkxGMGN3bDZsTExXLWstRlc0dVAzZlRVcDEzdjRKZE1vSQ==,2023-06-08 18:10:58.394497
youtube#commentThread,vEeVcTlxoaYinVG6CD1q3Vh5JRU,Ugz7qNVr6Hs7gsj63Jd4AaABAg,"{'videoId': 'E0jMnYphxIs', 'topLevelComment': {'kind': 'youtube#comment', 'etag': '2LDSldAt99EfJxPt7RTYYEajsWc', 'id': 'Ugz7qNVr6Hs7gsj63Jd4AaABAg', 'snippet': {'videoId': 'E0jMnYphxIs', 'textDisplay': 'Se são Paulo tem que votar em massa em Bolsonaro não sei porque que os paulista não vota em massa porque o Bolsonaro representa a raça paulista pouca frente não vá reverte a vantagem de lula agora pra o Bolsonaro vender tem os paulista votar em massa se o paulista quer ver seu irmão Bolsonaro vender', 'textOriginal': 'Se são Paulo tem que votar em massa em Bolsonaro não sei porque que os paulista não vota em massa porque o Bolsonaro representa a raça paulista pouca frente não vá reverte a vantagem de lula agora pra o Bolsonaro vender tem os paulista votar em massa se o paulista quer ver seu irmão Bolsonaro vender', 'authorDisplayName': 'Elias Gabriel Almeida', 'authorProfileImageUrl': 'https://yt3.ggpht.com/ytc/AGIKgqMQlFU_-aob5YqnYMebsqXWUa79bgOqO40aqw=s48-c-k-c0x00ffffff-no-rj', 'authorChannelUrl': 'http://www.youtube.com/channel/UCltP15-Ab2lAUbKhsIWj2lg', 'authorChannelId': {'value': 'UCltP15-Ab2lAUbKhsIWj2lg'}, 'canRate': True, 'viewerRating': 'none', 'likeCount': 0, 'publishedAt': '2022-10-13T12:47:02Z', 'updatedAt': '2022-10-13T12:47:02Z'}}, 'canReply': True, 'totalReplyCount': 0, 'isPublic': True}",,UCltP15-Ab2lAUbKhsIWj2lg,2022-10-13T12:47:02Z,Se são Paulo tem que votar em massa em Bolsonaro não sei porque que os paulista não vota em massa porque o Bolsonaro representa a raça paulista pouca frente não vá reverte a vantagem de lula agora pra o Bolsonaro vender tem os paulista votar em massa se o paulista quer ver seu irmão Bolsonaro vender,QURTSl9pM3RwZnpNYm1lVVhybVFXMWVOeG1BdXBqVGd2VlJkRWFhRGpycEo3ZkxGMGN3bDZsTExXLWstRlc0dVAzZlRVcDEzdjRKZE1vSQ==,2023-06-08 18:10:58.394497
youtube#commentThread,8wgmnIMgDn0VBvBR6J2YyNmPL0Q,UgyDaP7ujjR_npkWyBR4AaABAg,"{'videoId': 'rtUdDSvwRZA', 'topLevelComment': {'kind': 'youtube#comment', 'etag': 'ABt_UvbMGb8Ek8wnKE9g1GaOy7Y', 'id': 'UgyDaP7ujjR_npkWyBR4AaABAg', 'snippet': {'videoId': 'rtUdDSvwRZA', 'textDisplay': 'Aí tá povo brasileiro esse Marco Aurélio entende o fundo do STF o STF resucito o Lula foi o primeiro erro do STF prova que esse estf tá dominando a política o STF for formado pra fazer justiça e não pra governar só por esse motivo já e prova pra ser fechado e todos do STF ia pra cadeia a', 'textOriginal': 'Aí tá povo brasileiro esse Marco Aurélio entende o fundo do STF o STF resucito o Lula foi o primeiro erro do STF prova que esse estf tá dominando a política o STF for formado pra fazer justiça e não pra governar só por esse motivo já e prova pra ser fechado e todos do STF ia pra cadeia a', 'authorDisplayName': 'Elias Gabriel Almeida', 'authorProfileImageUrl': 'https://yt3.ggpht.com/ytc/AGIKgqMQlFU_-aob5YqnYMebsqXWUa79bgOqO40aqw=s48-c-k-c0x00ffffff-no-rj', 'authorChannelUrl': 'http://www.youtube.com/channel/UCltP15-Ab2lAUbKhsIWj2lg', 'authorChannelId': {'value': 'UCltP15-Ab2lAUbKhsIWj2lg'}, 'canRate': True, 'viewerRating': 'none', 'likeCount': 0, 'publishedAt': '2022-10-16T02:16:13Z', 'updatedAt': '2022-10-16T02:16:13Z'}}, 'canReply': True, 'totalReplyCount': 0, 'isPublic': True}",,UCltP15-Ab2lAUbKhsIWj2lg,2022-10-16T02:16:13Z,Aí tá povo brasileiro esse Marco Aurélio entende o fundo do STF o STF resucito o Lula foi o primeiro erro do STF prova que esse estf tá dominando a política o STF for formado pra fazer justiça e não pra governar só por esse motivo já e prova pra ser fechado e todos do STF ia pra cadeia a,QURTSl9pMEx1eV9sS1JuNTZUZDMwcGl4Nm9kTmhaWjFiRXB5NUlULWNuOHBXbDlCZy1OOUJrTWNzcU5PUXViUGlsdkVzNE5JTEtZd2ZROA==,2023-06-08 18:16:31.545708
youtube#commentThread,q-0UfzOkWzdzJPGy8EtdS8MAm00,UgwJkBdFGrschJKk6XJ4AaABAg,"{'videoId': 'QxDZZT3rpNA', 'topLevelComment': {'kind': 'youtube#comment', 'etag': 'VLjd17WHeG5cYIR4HpVlbPXgXtY', 'id': 'UgwJkBdFGrschJKk6XJ4AaABAg', 'snippet': {'videoId': 'QxDZZT3rpNA', 'textDisplay': 'Ele escolhe melhor seus companheiros com Bolsonaro o buraco e mais embaixo então só muito mais o Bolsonaro pro de de nossos filhos e netos tem que ser Bolsonaro', 'textOriginal': 'Ele escolhe melhor seus companheiros com Bolsonaro o buraco e mais embaixo então só muito mais o Bolsonaro pro de de nossos filhos e netos tem que ser Bolsonaro', 'authorDisplayName': 'Elias Gabriel Almeida', 'authorProfileImageUrl': 'https://yt3.ggpht.com/ytc/AGIKgqMQlFU_-aob5YqnYMebsqXWUa79bgOqO40aqw=s48-c-k-c0x00ffffff-no-rj', 'authorChannelUrl': 'http://www.youtube.com/channel/UCltP15-Ab2lAUbKhsIWj2lg', 'authorChannelId': {'value': 'UCltP15-Ab2lAUbKhsIWj2lg'}, 'canRate': True, 'viewerRating': 'none', 'likeCount': 2, 'publishedAt': '2022-10-11T19:25:16Z', 'updatedAt': '2022-10-11T19:25:16Z'}}, 'canReply': True, 'totalReplyCount': 0, 'isPublic': True}",,UCltP15-Ab2lAUbKhsIWj2lg,2022-10-11T19:25:16Z,Ele escolhe melhor seus companheiros com Bolsonaro o buraco e mais embaixo então só muito mais o Bolsonaro pro de de nossos filhos e netos tem que ser Bolsonaro,QURTSl9pMnJqQVNUT1JSSjlad2hseUxYNHNJMEc1Zm0yMXVhdHRPc2F2NEFvOV81dWVHS0Nld3FTQ0piWG96ZkpoSGxYUVNMTy12LURaTQ==,2023-06-08 18:16:52.698465
youtube#commentThread,SqJ4RlJsmkgh0esILLlplkksrwA,UgySpMU1ydrp1mq8b1l4AaABAg,"{'videoId': 'QxDZZT3rpNA', 'topLevelComment': {'kind': 'youtube#comment', 'etag': 'AmHYL8SkpwZfEOqGVYbcEHVUwOY', 'id': 'UgySpMU1ydrp1mq8b1l4AaABAg', 'snippet': {'videoId': 'QxDZZT3rpNA', 'textDisplay': 'Por isso que lula erra cara acaba de criticar o Lula ele aceita como companheiro o que vem fácil sai fácil  aí comesa a robanlheiras e joga tudo nas costa do Lula aí o Lula diz eu não vi nada não se de nada aí ele não dá conta de administra e leva a fama por isso ele não pode ser presidente do Brasil aí Bolsonaro leva vantagem', 'textOriginal': 'Por isso que lula erra cara acaba de criticar o Lula ele aceita como companheiro o que vem fácil sai fácil  aí comesa a robanlheiras e joga tudo nas costa do Lula aí o Lula diz eu não vi nada não se de nada aí ele não dá conta de administra e leva a fama por isso ele não pode ser presidente do Brasil aí Bolsonaro leva vantagem', 'authorDisplayName': 'Elias Gabriel Almeida', 'authorProfileImageUrl': 'https://yt3.ggpht.com/ytc/AGIKgqMQlFU_-aob5YqnYMebsqXWUa79bgOqO40aqw=s48-c-k-c0x00ffffff-no-rj', 'authorChannelUrl': 'http://www.youtube.com/channel/UCltP15-Ab2lAUbKhsIWj2lg', 'authorChannelId': {'value': 'UCltP15-Ab2lAUbKhsIWj2lg'}, 'canRate': True, 'viewerRating': 'none', 'likeCount': 0, 'publishedAt': '2022-10-11T19:23:35Z', 'updatedAt': '2022-10-11T19:23:35Z'}}, 'canReply': True, 'totalReplyCount': 0, 'isPublic': True}",,UCltP15-Ab2lAUbKhsIWj2lg,2022-10-11T19:23:35Z,Por isso que lula erra cara acaba de criticar o Lula ele aceita como companheiro o que vem fácil sai fácil  aí comesa a robanlheiras e joga tudo nas costa do Lula aí o Lula diz eu não vi nada não se de nada aí ele não dá conta de administra e leva a fama por isso ele não pode ser presidente do Brasil aí Bolsonaro leva vantagem,QURTSl9pMnJqQVNUT1JSSjlad2hseUxYNHNJMEc1Zm0yMXVhdHRPc2F2NEFvOV81dWVHS0Nld3FTQ0piWG96ZkpoSGxYUVNMTy12LURaTQ==,2023-06-08 18:16:52.698465
youtube#commentThread,zLXZffF7tRq0wA3ou_Vq5JZrNVY,UgyMiSkDyK3rvS75dZ94AaABAg,"{'videoId': '9LvBQ6fuIm4', 'topLevelComment': {'kind': 'youtube#comment', 'etag': '0Yk4lN7UGwXqsMJh16eSpS5BRvs', 'id': 'UgyMiSkDyK3rvS75dZ94AaABAg', 'snippet': {'videoId': '9LvBQ6fuIm4', 'textDisplay': 'Os paulista tem um irmão Bolsonaro paulista aretado dez vezes melhor que o Lula o que tá faltando pro paulistas ser fiel com Bolsonaro vocês paulista tem de votar e massa no Bolsonaro', 'textOriginal': 'Os paulista tem um irmão Bolsonaro paulista aretado dez vezes melhor que o Lula o que tá faltando pro paulistas ser fiel com Bolsonaro vocês paulista tem de votar e massa no Bolsonaro', 'authorDisplayName': 'Elias Gabriel Almeida', 'authorProfileImageUrl': 'https://yt3.ggpht.com/ytc/AGIKgqMQlFU_-aob5YqnYMebsqXWUa79bgOqO40aqw=s48-c-k-c0x00ffffff-no-rj', 'authorChannelUrl': 'http://www.youtube.com/channel/UCltP15-Ab2lAUbKhsIWj2lg', 'authorChannelId': {'value': 'UCltP15-Ab2lAUbKhsIWj2lg'}, 'canRate': True, 'viewerRating': 'none', 'likeCount': 0, 'publishedAt': '2022-10-11T16:41:22Z', 'updatedAt': '2022-10-11T16:41:22Z'}}, 'canReply': True, 'totalReplyCount': 0, 'isPublic': True}",,UCltP15-Ab2lAUbKhsIWj2lg,2022-10-11T16:41:22Z,Os paulista tem um irmão Bolsonaro paulista aretado dez vezes melhor que o Lula o que tá faltando pro paulistas ser fiel com Bolsonaro vocês paulista tem de votar e massa no Bolsonaro,QURTSl9pMFE5ZGM3c3ZSSkl3RHpwYmlzbkhOMjB6QU9PV0VvVXNfQU95WWJpMURMdTdtV3JiQ2RNU2dyN3hxazJPWUZ2bjI1Zm5lQjZEZw==,2023-06-08 18:17:20.274438
youtube#commentThread,jdD0oLruwaLSwQRojsU4Dw7i--E,UgxmODbeGjFF--Dov7N4AaABAg,"{'videoId': '9LvBQ6fuIm4', 'topLevelComment': {'kind': 'youtube#comment', 'etag': 'mRA5WGzLwM4VYwL5VPLaWyr4J5Y', 'id': 'UgxmODbeGjFF--Dov7N4AaABAg', 'snippet': {'videoId': '9LvBQ6fuIm4', 'textDisplay': 'Os gaúcho não pode tar cegos a Argentina colada no rio grande do sul a infrasao tá 70 por centos e a infrasao no Brasil tá 6 por cento menor que os estados unidos eu pergunto o que tá errados votar na esquerda do Lula só se tiver lelé da cuca', 'textOriginal': 'Os gaúcho não pode tar cegos a Argentina colada no rio grande do sul a infrasao tá 70 por centos e a infrasao no Brasil tá 6 por cento menor que os estados unidos eu pergunto o que tá errados votar na esquerda do Lula só se tiver lelé da cuca', 'authorDisplayName': 'Elias Gabriel Almeida', 'authorProfileImageUrl': 'https://yt3.ggpht.com/ytc/AGIKgqMQlFU_-aob5YqnYMebsqXWUa79bgOqO40aqw=s48-c-k-c0x00ffffff-no-rj', 'authorChannelUrl': 'http://www.youtube.com/channel/UCltP15-Ab2lAUbKhsIWj2lg', 'authorChannelId': {'value': 'UCltP15-Ab2lAUbKhsIWj2lg'}, 'canRate': True, 'viewerRating': 'none', 'likeCount': 1, 'publishedAt': '2022-10-11T16:38:52Z', 'updatedAt': '2022-10-11T16:38:52Z'}}, 'canReply': True, 'totalReplyCount': 0, 'isPublic': True}",,UCltP15-Ab2lAUbKhsIWj2lg,2022-10-11T16:38:52Z,Os gaúcho não pode tar cegos a Argentina colada no rio grande do sul a infrasao tá 70 por centos e a infrasao no Brasil tá 6 por cento menor que os estados unidos eu pergunto o que tá errados votar na esquerda do Lula só se tiver lelé da cuca,QURTSl9pMFE5ZGM3c3ZSSkl3RHpwYmlzbkhOMjB6QU9PV0VvVXNfQU95WWJpMURMdTdtV3JiQ2RNU2dyN3hxazJPWUZ2bjI1Zm5lQjZEZw==,2023-06-08 18:17:20.274438
youtube#commentThread,RdnLUd2x0tx_olD9bJH2GC2IClM,Ugyy_iReggBYAnADUBt4AaABAg,"{'videoId': 'nhq5olMUyQM', 'topLevelComment': {'kind': 'youtube#comment', 'etag': 'uf3UaY40QlF-qt8K7wyjhRPEXrY', 'id': 'Ugyy_iReggBYAnADUBt4AaABAg', 'snippet': {'videoId': 'nhq5olMUyQM', 'textDisplay': 'Os brasileiros principalmente os nordestinos não tem nosso  do que e a esquerda e fria todos venuelano tá no buraco por isso digo quem entende jamais vota na esquerda nem apau', 'textOriginal': 'Os brasileiros principalmente os nordestinos não tem nosso  do que e a esquerda e fria todos venuelano tá no buraco por isso digo quem entende jamais vota na esquerda nem apau', 'authorDisplayName': 'Elias Gabriel Almeida', 'authorProfileImageUrl': 'https://yt3.ggpht.com/ytc/AGIKgqMQlFU_-aob5YqnYMebsqXWUa79bgOqO40aqw=s48-c-k-c0x00ffffff-no-rj', 'authorChannelUrl': 'http://www.youtube.com/channel/UCltP15-Ab2lAUbKhsIWj2lg', 'authorChannelId': {'value': 'UCltP15-Ab2lAUbKhsIWj2lg'}, 'canRate': True, 'viewerRating': 'none', 'likeCount': 0, 'publishedAt': '2022-10-11T08:18:21Z', 'updatedAt': '2022-10-11T08:18:21Z'}}, 'canReply': True, 'totalReplyCount': 0, 'isPublic': True}",,UCltP15-Ab2lAUbKhsIWj2lg,2022-10-11T08:18:21Z,Os brasileiros principalmente os nordestinos não tem nosso  do que e a esquerda e fria todos venuelano tá no buraco por isso digo quem entende jamais vota na esquerda nem apau,QURTSl9pMjJoNlpzdXk4Wk1pLURHXzBnSWdpQ1BJN1V4Zmk2Y0FmbWtJUEpzc05lYnlsOFdzcTNBS0ZZR0UxUmZHQXVRU2JoTTZnSV8xSQ==,2023-06-08 18:20:48.176734
youtube#commentThread,dtCQCryM4QhcVwVFvwWHgLtQdXI,Ugw42iRy-THW5MgRtZh4AaABAg,"{'videoId': 'qJcl4HrHFJg', 'topLevelComment': {'kind': 'youtube#comment', 'etag': 'q5DX8iMM2EsC7ghlFTy1HFB68Tw', 'id': 'Ugw42iRy-THW5MgRtZh4AaABAg', 'snippet': {'videoId': 'qJcl4HrHFJg', 'textDisplay': 'Amanda e esperta aprendeu com o pt defender os pobres e mais fazer comvenselos do que um brasileiros esclarecidos', 'textOriginal': 'Amanda e esperta aprendeu com o pt defender os pobres e mais fazer comvenselos do que um brasileiros esclarecidos', 'authorDisplayName': 'Elias Gabriel Almeida', 'authorProfileImageUrl': 'https://yt3.ggpht.com/ytc/AGIKgqMQlFU_-aob5YqnYMebsqXWUa79bgOqO40aqw=s48-c-k-c0x00ffffff-no-rj', 'authorChannelUrl': 'http://www.youtube.com/channel/UCltP15-Ab2lAUbKhsIWj2lg', 'authorChannelId': {'value': 'UCltP15-Ab2lAUbKhsIWj2lg'}, 'canRate': True, 'viewerRating': 'none', 'likeCount': 0, 'publishedAt': '2022-10-07T11:50:53Z', 'updatedAt': '2022-10-07T11:50:53Z'}}, 'canReply': True, 'totalReplyCount': 0, 'isPublic': True}",,UCltP15-Ab2lAUbKhsIWj2lg,2022-10-07T11:50:53Z,Amanda e esperta aprendeu com o pt defender os pobres e mais fazer comvenselos do que um brasileiros esclarecidos,,2023-06-08 18:32:55.734680
youtube#commentThread,SSoqmfdz6gvObISel9euBEGqy_Y,UgwoOWlQhGHcbWi0Y8l4AaABAg,"{'videoId': 'qJcl4HrHFJg', 'topLevelComment': {'kind': 'youtube#comment', 'etag': 'rFzvuDwnYzb-ULJxd12M5R47ZDA', 'id': 'UgwoOWlQhGHcbWi0Y8l4AaABAg', 'snippet': {'videoId': 'qJcl4HrHFJg', 'textDisplay': 'Tem alnafabetos porque o pt ficou 16 anos no governo porque não radicou o analfabetos falar até papagaio fala esse o o problema do pt só fal a trasnordestina e trasposisao ficou 12 anos travado por corupisao e não terminou Bolsonaro não fala ele faz então fica com lula só promete e não faz', 'textOriginal': 'Tem alnafabetos porque o pt ficou 16 anos no governo porque não radicou o analfabetos falar até papagaio fala esse o o problema do pt só fal a trasnordestina e trasposisao ficou 12 anos travado por corupisao e não terminou Bolsonaro não fala ele faz então fica com lula só promete e não faz', 'authorDisplayName': 'Elias Gabriel Almeida', 'authorProfileImageUrl': 'https://yt3.ggpht.com/ytc/AGIKgqMQlFU_-aob5YqnYMebsqXWUa79bgOqO40aqw=s48-c-k-c0x00ffffff-no-rj', 'authorChannelUrl': 'http://www.youtube.com/channel/UCltP15-Ab2lAUbKhsIWj2lg', 'authorChannelId': {'value': 'UCltP15-Ab2lAUbKhsIWj2lg'}, 'canRate': True, 'viewerRating': 'none', 'likeCount': 0, 'publishedAt': '2022-10-07T11:47:27Z', 'updatedAt': '2022-10-07T11:47:27Z'}}, 'canReply': True, 'totalReplyCount': 0, 'isPublic': True}",,UCltP15-Ab2lAUbKhsIWj2lg,2022-10-07T11:47:27Z,Tem alnafabetos porque o pt ficou 16 anos no governo porque não radicou o analfabetos falar até papagaio fala esse o o problema do pt só fal a trasnordestina e trasposisao ficou 12 anos travado por corupisao e não terminou Bolsonaro não fala ele faz então fica com lula só promete e não faz,,2023-06-08 18:32:55.734680
youtube#commentThread,p2rLIGHW2E59RJIPy70LPGvyPjs,UgwFHwQLMI2wuGKpK914AaABAg,"{'videoId': '4mX9FwGAy-I', 'topLevelComment': {'kind': 'youtube#comment', 'etag': 'grxqBDBQzqy3icTCElO9wa8A874', 'id': 'UgwFHwQLMI2wuGKpK914AaABAg', 'snippet': {'videoId': '4mX9FwGAy-I', 'textDisplay': 'Porque o tcu travou as obras da trasposisao a trasnordestina 12 anos por roubalheiras e o Bolsonaro destravou e terminou a trasposisao e botou a trasnordestina pra ferver vê se nenhuma obras do Bolsonaro vê se tem uma rôbalheira os nordestino sabe disto eu procuro as nordestino vocês ainda quer votar na esquerda do Lula', 'textOriginal': 'Porque o tcu travou as obras da trasposisao a trasnordestina 12 anos por roubalheiras e o Bolsonaro destravou e terminou a trasposisao e botou a trasnordestina pra ferver vê se nenhuma obras do Bolsonaro vê se tem uma rôbalheira os nordestino sabe disto eu procuro as nordestino vocês ainda quer votar na esquerda do Lula', 'authorDisplayName': 'Elias Gabriel Almeida', 'authorProfileImageUrl': 'https://yt3.ggpht.com/ytc/AGIKgqMQlFU_-aob5YqnYMebsqXWUa79bgOqO40aqw=s48-c-k-c0x00ffffff-no-rj', 'authorChannelUrl': 'http://www.youtube.com/channel/UCltP15-Ab2lAUbKhsIWj2lg', 'authorChannelId': {'value': 'UCltP15-Ab2lAUbKhsIWj2lg'}, 'canRate': True, 'viewerRating': 'none', 'likeCount': 0, 'publishedAt': '2022-10-08T12:59:46Z', 'updatedAt': '2022-10-08T12:59:46Z'}}, 'canReply': True, 'totalReplyCount': 0, 'isPublic': True}",,UCltP15-Ab2lAUbKhsIWj2lg,2022-10-08T12:59:46Z,Porque o tcu travou as obras da trasposisao a trasnordestina 12 anos por roubalheiras e o Bolsonaro destravou e terminou a trasposisao e botou a trasnordestina pra ferver vê se nenhuma obras do Bolsonaro vê se tem uma rôbalheira os nordestino sabe disto eu procuro as nordestino vocês ainda quer votar na esquerda do Lula,QURTSl9pMEdxc2E4SDZLZ3pjeVk4TGFBRjA0WjFLbjc2TllaSEtiX3VoSVItMjR1M3FwVm5pYlFGLVA2Mjd4NlRyTi1WNlhlV1RYUFpKRQ==,2023-06-08 18:33:50.570138
youtube#commentThread,tI3d04gaYfaSolhwaL0qWDarBYo,UgxVAPXKxCall_o__0J4AaABAg,"{'videoId': '4mX9FwGAy-I', 'topLevelComment': {'kind': 'youtube#comment', 'etag': 'qQlniPhYwcioYwiFn0f_S4ZNYNU', 'id': 'UgxVAPXKxCall_o__0J4AaABAg', 'snippet': {'videoId': '4mX9FwGAy-I', 'textDisplay': 'O Lula ganhou no nordeste não foi o alfabetismo e falta de conhecimentos  porque tem pesou de estudo que vota no pt mesmo com cultura não tem conhecimento na realidade do Brasil o que falta no nordestino e conhecimentos porque que entende não vota na esquerda nem apau', 'textOriginal': 'O Lula ganhou no nordeste não foi o alfabetismo e falta de conhecimentos  porque tem pesou de estudo que vota no pt mesmo com cultura não tem conhecimento na realidade do Brasil o que falta no nordestino e conhecimentos porque que entende não vota na esquerda nem apau', 'authorDisplayName': 'Elias Gabriel Almeida', 'authorProfileImageUrl': 'https://yt3.ggpht.com/ytc/AGIKgqMQlFU_-aob5YqnYMebsqXWUa79bgOqO40aqw=s48-c-k-c0x00ffffff-no-rj', 'authorChannelUrl': 'http://www.youtube.com/channel/UCltP15-Ab2lAUbKhsIWj2lg', 'authorChannelId': {'value': 'UCltP15-Ab2lAUbKhsIWj2lg'}, 'canRate': True, 'viewerRating': 'none', 'likeCount': 0, 'publishedAt': '2022-10-08T12:56:22Z', 'updatedAt': '2022-10-08T12:56:22Z'}}, 'canReply': True, 'totalReplyCount': 0, 'isPublic': True}",,UCltP15-Ab2lAUbKhsIWj2lg,2022-10-08T12:56:22Z,O Lula ganhou no nordeste não foi o alfabetismo e falta de conhecimentos  porque tem pesou de estudo que vota no pt mesmo com cultura não tem conhecimento na realidade do Brasil o que falta no nordestino e conhecimentos porque que entende não vota na esquerda nem apau,QURTSl9pMEdxc2E4SDZLZ3pjeVk4TGFBRjA0WjFLbjc2TllaSEtiX3VoSVItMjR1M3FwVm5pYlFGLVA2Mjd4NlRyTi1WNlhlV1RYUFpKRQ==,2023-06-08 18:33:50.570138
youtube#commentThread,E8WZYahX59Hj4dkqXUc-VDOJSlQ,UgwtD9FEvl1pDDApBe94AaABAg,"{'videoId': 'Tn7x1xgwEZg', 'topLevelComment': {'kind': 'youtube#comment', 'etag': 'dnA_bTJGzUgCf1p3eWiknAqsKAU', 'id': 'UgwtD9FEvl1pDDApBe94AaABAg', 'snippet': {'videoId': 'Tn7x1xgwEZg', 'textDisplay': 'Quem quizer votar na esquerda do pt tudo bem mais fiquei sabendo que o tcu travou as obras da trasposisao e a trasnordestina 12 anos por roubalheiras e no Bolsonaro não tem nenhuma pra contar o caso que tivesse roubalheiras  e vocês ainda quer votar no pt da esquerda tá de brincadeira', 'textOriginal': 'Quem quizer votar na esquerda do pt tudo bem mais fiquei sabendo que o tcu travou as obras da trasposisao e a trasnordestina 12 anos por roubalheiras e no Bolsonaro não tem nenhuma pra contar o caso que tivesse roubalheiras  e vocês ainda quer votar no pt da esquerda tá de brincadeira', 'authorDisplayName': 'Elias Gabriel Almeida', 'authorProfileImageUrl': 'https://yt3.ggpht.com/ytc/AGIKgqMQlFU_-aob5YqnYMebsqXWUa79bgOqO40aqw=s48-c-k-c0x00ffffff-no-rj', 'authorChannelUrl': 'http://www.youtube.com/channel/UCltP15-Ab2lAUbKhsIWj2lg', 'authorChannelId': {'value': 'UCltP15-Ab2lAUbKhsIWj2lg'}, 'canRate': True, 'viewerRating': 'none', 'likeCount': 0, 'publishedAt': '2022-10-08T19:23:17Z', 'updatedAt': '2022-10-08T19:23:17Z'}}, 'canReply': True, 'totalReplyCount': 0, 'isPublic': True}",,UCltP15-Ab2lAUbKhsIWj2lg,2022-10-08T19:23:17Z,Quem quizer votar na esquerda do pt tudo bem mais fiquei sabendo que o tcu travou as obras da trasposisao e a trasnordestina 12 anos por roubalheiras e no Bolsonaro não tem nenhuma pra contar o caso que tivesse roubalheiras  e vocês ainda quer votar no pt da esquerda tá de brincadeira,QURTSl9pMnRWR3BEQmlzcFNLYjk1emlRM1pRWlBGRFdjYzdDWVJkaXR0V2xZSjdMdW5kOUM5U1RINnhmWXhnWUNjaXlPbzJqZTAxX3dNZw==,2023-06-08 18:34:47.584245
youtube#commentThread,iG9L0Wd7Zxn7URMBSOUtnicEGns,UgwSzFDdaqcIB8EHhYx4AaABAg,"{'videoId': 'coTcRIrGw34', 'topLevelComment': {'kind': 'youtube#comment', 'etag': 'ldx6ZzGPiHvqmOo7wKV3qq2S6jA', 'id': 'UgwSzFDdaqcIB8EHhYx4AaABAg', 'snippet': {'videoId': 'coTcRIrGw34', 'textDisplay': 'Por isso tarciso tá aí pra virar as fábricas abaixando imposto mais e fundamental pra São Paulo o Bolsonaro por isso os paulistas tinha que votar no Bolsonaro em massa rapaz o trio dos treis mosqueteiros o astronauta o tarciso e lógico Bolsonaro  há vai ser duro segurar são Paulo', 'textOriginal': 'Por isso tarciso tá aí pra virar as fábricas abaixando imposto mais e fundamental pra São Paulo o Bolsonaro por isso os paulistas tinha que votar no Bolsonaro em massa rapaz o trio dos treis mosqueteiros o astronauta o tarciso e lógico Bolsonaro  há vai ser duro segurar são Paulo', 'authorDisplayName': 'Elias Gabriel Almeida', 'authorProfileImageUrl': 'https://yt3.ggpht.com/ytc/AGIKgqMQlFU_-aob5YqnYMebsqXWUa79bgOqO40aqw=s48-c-k-c0x00ffffff-no-rj', 'authorChannelUrl': 'http://www.youtube.com/channel/UCltP15-Ab2lAUbKhsIWj2lg', 'authorChannelId': {'value': 'UCltP15-Ab2lAUbKhsIWj2lg'}, 'canRate': True, 'viewerRating': 'none', 'likeCount': 0, 'publishedAt': '2022-10-07T00:42:31Z', 'updatedAt': '2022-10-07T00:42:31Z'}}, 'canReply': True, 'totalReplyCount': 0, 'isPublic': True}",,UCltP15-Ab2lAUbKhsIWj2lg,2022-10-07T00:42:31Z,Por isso tarciso tá aí pra virar as fábricas abaixando imposto mais e fundamental pra São Paulo o Bolsonaro por isso os paulistas tinha que votar no Bolsonaro em massa rapaz o trio dos treis mosqueteiros o astronauta o tarciso e lógico Bolsonaro  há vai ser duro segurar são Paulo,QURTSl9pMkNyVVRhWngyNFgwaWxnVXVjSkZGQTVCaDRvbEtaOE9xa0xyeGNaRy00djRjak9fZmlMczZXa2dSeV82WC1QYmEwQXNCaTdSYw==,2023-06-08 18:36:16.830059
