kind,etag,id,snippet,replies,authorChannelId,publishedAt,textOriginal,nextPageToken,extraction_date
youtube#commentThread,VZBo-4IHRHeO7tWN490ScABI9ms,UgxtL7bFf2KfVD2PD4h4AaABAg,"{'videoId': '2ewj4UEG34A', 'topLevelComment': {'kind': 'youtube#comment', 'etag': 'wBLYbmyFdnUVlb6AYYZgg3kam3o', 'id': 'UgxtL7bFf2KfVD2PD4h4AaABAg', 'snippet': {'videoId': '2ewj4UEG34A', 'textDisplay': 'Sim, ele humildemente falou que deixará de agir como psicopata, que adquirirá cultura e caráter em uma semana. Passou muita credibilidade, agora não tem como dar errado.', 'textOriginal': 'Sim, ele humildemente falou que deixará de agir como psicopata, que adquirirá cultura e caráter em uma semana. Passou muita credibilidade, agora não tem como dar errado.', 'authorDisplayName': 'Al', 'authorProfileImageUrl': 'https://yt3.ggpht.com/ytc/AGIKgqN19LDMmVNIXLV7HitZpAqGCPwBLwlFV4Pi9vVDJtFc-Wp7rsX_Ybbk88bx74sk4w=s48-c-k-c0x00ffffff-no-rj', 'authorChannelUrl': 'http://www.youtube.com/channel/UCNzBkKhM9lBgCke0rymWo2g', 'authorChannelId': {'value': 'UCNzBkKhM9lBgCke0rymWo2g'}, 'canRate': True, 'viewerRating': 'none', 'likeCount': 12, 'publishedAt': '2022-10-14T11:27:34Z', 'updatedAt': '2022-10-14T11:27:34Z'}}, 'canReply': True, 'totalReplyCount': 3, 'isPublic': True}","{'comments': [{'kind': 'youtube#comment', 'etag': 'r65cEhWMLKRRjtW53r4-kGZWDWY', 'id': 'UgxtL7bFf2KfVD2PD4h4AaABAg.9h9p5G3eLqD9h9tJ1I-XUo', 'snippet': {'videoId': '2ewj4UEG34A', 'textDisplay': '@Junior Oliveira Obrigado por complementar o que ambos fazem. Mas apenas um deles fez EXATAMENTE o contrário do que prometeu.', 'textOriginal': '@Junior Oliveira Obrigado por complementar o que ambos fazem. Mas apenas um deles fez EXATAMENTE o contrário do que prometeu.', 'parentId': 'UgxtL7bFf2KfVD2PD4h4AaABAg', 'authorDisplayName': 'Al', 'authorProfileImageUrl': 'https://yt3.ggpht.com/ytc/AGIKgqN19LDMmVNIXLV7HitZpAqGCPwBLwlFV4Pi9vVDJtFc-Wp7rsX_Ybbk88bx74sk4w=s48-c-k-c0x00ffffff-no-rj', 'authorChannelUrl': 'http://www.youtube.com/channel/UCNzBkKhM9lBgCke0rymWo2g', 'authorChannelId': {'value': 'UCNzBkKhM9lBgCke0rymWo2g'}, 'canRate': True, 'viewerRating': 'none', 'likeCount': 1, 'publishedAt': '2022-10-14T12:04:23Z', 'updatedAt': '2022-10-14T12:04:23Z'}}, {'kind': 'youtube#comment', 'etag': 'o5TkecvUmvSM4CYH68NW9nYU1j4', 'id': 'UgxtL7bFf2KfVD2PD4h4AaABAg.9h9p5G3eLqD9h9qwNVB2IO', 'snippet': {'videoId': '2ewj4UEG34A', 'textDisplay': 'Descreveu o Lula, só não foi tão assertivo pq o Lula ao mesmo tempo que diz que vai mudar, diz que vai fazer tudo que sempre fez.', 'textOriginal': 'Descreveu o Lula, só não foi tão assertivo pq o Lula ao mesmo tempo que diz que vai mudar, diz que vai fazer tudo que sempre fez.', 'parentId': 'UgxtL7bFf2KfVD2PD4h4AaABAg', 'authorDisplayName': 'Junior Oliveira', 'authorProfileImageUrl': 'https://yt3.ggpht.com/ytc/AGIKgqPFkKXni_gYrEY_teMkg4E1SMAXbgCT6atvym-FK3w=s48-c-k-c0x00ffffff-no-rj', 'authorChannelUrl': 'http://www.youtube.com/channel/UCnZtBDjGFkrefwDEiY68keQ', 'authorChannelId': {'value': 'UCnZtBDjGFkrefwDEiY68keQ'}, 'canRate': True, 'viewerRating': 'none', 'likeCount': 5, 'publishedAt': '2022-10-14T11:43:41Z', 'updatedAt': '2022-10-14T11:43:41Z'}}, {'kind': 'youtube#comment', 'etag': 'gx2ysio3EoYSgz-m4n9c1MJEcvU', 'id': 'UgxtL7bFf2KfVD2PD4h4AaABAg.9h9p5G3eLqD9h9qVKDAMhy', 'snippet': {'videoId': '2ewj4UEG34A', 'textDisplay': 'descreveu o Lula', 'textOriginal': 'descreveu o Lula', 'parentId': 'UgxtL7bFf2KfVD2PD4h4AaABAg', 'authorDisplayName': 'demon rider', 'authorProfileImageUrl': 'https://yt3.ggpht.com/ytc/AGIKgqOPp7vu6DqJXCf_9WxSeaI2wPKurJlJ_oJ3tzdW=s48-c-k-c0x00ffffff-no-rj', 'authorChannelUrl': 'http://www.youtube.com/channel/UCDwZ2T4iLvcQ2GXUhD59_dQ', 'authorChannelId': {'value': 'UCDwZ2T4iLvcQ2GXUhD59_dQ'}, 'canRate': True, 'viewerRating': 'none', 'likeCount': 10, 'publishedAt': '2022-10-14T11:39:51Z', 'updatedAt': '2022-10-14T11:39:51Z'}}]}",UCNzBkKhM9lBgCke0rymWo2g,2022-10-14T11:27:34Z,"Sim, ele humildemente falou que deixará de agir como psicopata, que adquirirá cultura e caráter em uma semana. Passou muita credibilidade, agora não tem como dar errado.",QURTSl9pMzdPOG04M0tlal8zS0xzTzMzOVQyalVYWnoyS2pUckVKVVZRR2p0LU9jQ01qb1dkOWg0SUVfdWMxeTRmMHhVLXZ3aEhjaDYwNA==,2023-06-08 18:07:14.669953
youtube#commentThread,AZnmDEnlY5bO_WdIc67fjFdnQ4s,UgwpbGMbqOs_f94Jq6N4AaABAg,"{'videoId': 'SS9EMN8uZTw', 'topLevelComment': {'kind': 'youtube#comment', 'etag': 'FnuquBb-JvY7T1u-6tXpJHXKx2A', 'id': 'UgwpbGMbqOs_f94Jq6N4AaABAg', 'snippet': {'videoId': 'SS9EMN8uZTw', 'textDisplay': '&quot;Muito honesto&quot;. Depois de 4 anos de mentiras diárias, pode confiar.', 'textOriginal': '""Muito honesto"". Depois de 4 anos de mentiras diárias, pode confiar.', 'authorDisplayName': 'Al', 'authorProfileImageUrl': 'https://yt3.ggpht.com/ytc/AGIKgqN19LDMmVNIXLV7HitZpAqGCPwBLwlFV4Pi9vVDJtFc-Wp7rsX_Ybbk88bx74sk4w=s48-c-k-c0x00ffffff-no-rj', 'authorChannelUrl': 'http://www.youtube.com/channel/UCNzBkKhM9lBgCke0rymWo2g', 'authorChannelId': {'value': 'UCNzBkKhM9lBgCke0rymWo2g'}, 'canRate': True, 'viewerRating': 'none', 'likeCount': 0, 'publishedAt': '2022-10-13T22:37:30Z', 'updatedAt': '2022-10-13T22:37:30Z'}}, 'canReply': True, 'totalReplyCount': 0, 'isPublic': True}",,UCNzBkKhM9lBgCke0rymWo2g,2022-10-13T22:37:30Z,"""Muito honesto"". Depois de 4 anos de mentiras diárias, pode confiar.",QURTSl9pMjFyUFV5bjY3VnJnUEpTdkRxSUxIQXUyOHI1MnhmQktVQzltRy05NkZXUmNIQzh0LTI5Y29qcXI5MnBOZGlMaGJ2R1haSVZaQQ==,2023-06-08 18:09:56.767487
youtube#commentThread,RYoAev_IQi8FLb8m8hbOmXpfDgc,Ugx_RDKfknnWas6t1NB4AaABAg,"{'videoId': 'd3j6uFun3PM', 'topLevelComment': {'kind': 'youtube#comment', 'etag': 'Nnls2aw6leVicKmQ9q074L-rPhA', 'id': 'Ugx_RDKfknnWas6t1NB4AaABAg', 'snippet': {'videoId': 'd3j6uFun3PM', 'textDisplay': 'Essa é aquela que &quot;votou contra&quot; o fundão, mas votou a favor?', 'textOriginal': 'Essa é aquela que ""votou contra"" o fundão, mas votou a favor?', 'authorDisplayName': 'Al', 'authorProfileImageUrl': 'https://yt3.ggpht.com/ytc/AGIKgqN19LDMmVNIXLV7HitZpAqGCPwBLwlFV4Pi9vVDJtFc-Wp7rsX_Ybbk88bx74sk4w=s48-c-k-c0x00ffffff-no-rj', 'authorChannelUrl': 'http://www.youtube.com/channel/UCNzBkKhM9lBgCke0rymWo2g', 'authorChannelId': {'value': 'UCNzBkKhM9lBgCke0rymWo2g'}, 'canRate': True, 'viewerRating': 'none', 'likeCount': 0, 'publishedAt': '2022-10-13T16:01:29Z', 'updatedAt': '2022-10-13T16:01:29Z'}}, 'canReply': True, 'totalReplyCount': 0, 'isPublic': True}",,UCNzBkKhM9lBgCke0rymWo2g,2022-10-13T16:01:29Z,"Essa é aquela que ""votou contra"" o fundão, mas votou a favor?",QURTSl9pMUoyQmVyWVdpcDZSTUhhUHNLZ1JBR2lnV2Z3b1lhWi1IdlpQbzVqRG1yMjhJTy1jdzVHOVRzWnpWV01acnU5UE9ub19Sa0dxNA==,2023-06-08 18:10:43.762090
youtube#commentThread,PXi6i-hJ58p1egnYZw3FoxBHrwc,UgyPq8WMqeHXRJim_Ll4AaABAg,"{'videoId': 'M4Vmpq5oNOo', 'topLevelComment': {'kind': 'youtube#comment', 'etag': 'I4luvhR2x8zEV4E2-vdLSs2XHaU', 'id': 'UgyPq8WMqeHXRJim_Ll4AaABAg', 'snippet': {'videoId': 'M4Vmpq5oNOo', 'textDisplay': 'Opa!  Corre pra maquiar melhor o GLP, Mito! É só até o final do mês.', 'textOriginal': 'Opa!  Corre pra maquiar melhor o GLP, Mito! É só até o final do mês.', 'authorDisplayName': 'Al', 'authorProfileImageUrl': 'https://yt3.ggpht.com/ytc/AGIKgqN19LDMmVNIXLV7HitZpAqGCPwBLwlFV4Pi9vVDJtFc-Wp7rsX_Ybbk88bx74sk4w=s48-c-k-c0x00ffffff-no-rj', 'authorChannelUrl': 'http://www.youtube.com/channel/UCNzBkKhM9lBgCke0rymWo2g', 'authorChannelId': {'value': 'UCNzBkKhM9lBgCke0rymWo2g'}, 'canRate': True, 'viewerRating': 'none', 'likeCount': 2, 'publishedAt': '2022-10-13T11:18:18Z', 'updatedAt': '2022-10-13T11:18:18Z'}}, 'canReply': True, 'totalReplyCount': 0, 'isPublic': True}",,UCNzBkKhM9lBgCke0rymWo2g,2022-10-13T11:18:18Z,"Opa!  Corre pra maquiar melhor o GLP, Mito! É só até o final do mês.",,2023-06-08 18:11:15.336966
youtube#commentThread,kZRVBdK4NKd2oEBg3yG8HkqFncg,UgzsWvUpLkrNeLa96CZ4AaABAg,"{'videoId': '77dEDStQUcg', 'topLevelComment': {'kind': 'youtube#comment', 'etag': '3bVTLwNueJVVRaysM6bOzjVjDTI', 'id': 'UgzsWvUpLkrNeLa96CZ4AaABAg', 'snippet': {'videoId': '77dEDStQUcg', 'textDisplay': 'Repugnante a promiscuidade entre religião e política, sempre inspiradoa por interesses pessoais. Era repugnante ver padres queimando o filme da Igreja Católica com posições de esquerda. Foram superados de longe pelos maiores exploradores da fé sendo beneficiados no governo atual.<br>Igrejas Evangélicas se tornaram comitês eleitorais baseados em terror psicológico tirando proveito de suas crenças', 'textOriginal': 'Repugnante a promiscuidade entre religião e política, sempre inspiradoa por interesses pessoais. Era repugnante ver padres queimando o filme da Igreja Católica com posições de esquerda. Foram superados de longe pelos maiores exploradores da fé sendo beneficiados no governo atual.\\\\nIgrejas Evangélicas se tornaram comitês eleitorais baseados em terror psicológico tirando proveito de suas crenças', 'authorDisplayName': 'Al', 'authorProfileImageUrl': 'https://yt3.ggpht.com/ytc/AGIKgqN19LDMmVNIXLV7HitZpAqGCPwBLwlFV4Pi9vVDJtFc-Wp7rsX_Ybbk88bx74sk4w=s48-c-k-c0x00ffffff-no-rj', 'authorChannelUrl': 'http://www.youtube.com/channel/UCNzBkKhM9lBgCke0rymWo2g', 'authorChannelId': {'value': 'UCNzBkKhM9lBgCke0rymWo2g'}, 'canRate': True, 'viewerRating': 'none', 'likeCount': 0, 'publishedAt': '2022-10-12T12:23:59Z', 'updatedAt': '2022-10-12T12:27:15Z'}}, 'canReply': True, 'totalReplyCount': 0, 'isPublic': True}",,UCNzBkKhM9lBgCke0rymWo2g,2022-10-12T12:23:59Z,"Repugnante a promiscuidade entre religião e política, sempre inspiradoa por interesses pessoais. Era repugnante ver padres queimando o filme da Igreja Católica com posições de esquerda. Foram superados de longe pelos maiores exploradores da fé sendo beneficiados no governo atual.
Igrejas Evangélicas se tornaram comitês eleitorais baseados em terror psicológico tirando proveito de suas crenças",QURTSl9pM3BDRTE2U1pKcVluNUE1N2NxaHNpSTByWFpxSUhWZDVaWU5Hc2E5R1MtZHNsQ05wcDZtNDFsOTIydXBiQXNyZTJoMlp5S0YyNA==,2023-06-08 18:14:34.290048
youtube#commentThread,gl1hfu83-p28sh2-CCK3Fgn9jLI,UgzgkAQvkRKipVNt6n14AaABAg,"{'videoId': '_cRKmhX6Z6Q', 'topLevelComment': {'kind': 'youtube#comment', 'etag': 'Wbm7FKAqq9QxXUVXvs9kVptaKSI', 'id': 'UgzgkAQvkRKipVNt6n14AaABAg', 'snippet': {'videoId': '_cRKmhX6Z6Q', 'textDisplay': 'O gado esperava que a economista pintasse de ouro a maquiagem eleitoreira do Paulo Guedes.<br>Virou comunista.', 'textOriginal': 'O gado esperava que a economista pintasse de ouro a maquiagem eleitoreira do Paulo Guedes.\\\\nVirou comunista.', 'authorDisplayName': 'Al', 'authorProfileImageUrl': 'https://yt3.ggpht.com/ytc/AGIKgqN19LDMmVNIXLV7HitZpAqGCPwBLwlFV4Pi9vVDJtFc-Wp7rsX_Ybbk88bx74sk4w=s48-c-k-c0x00ffffff-no-rj', 'authorChannelUrl': 'http://www.youtube.com/channel/UCNzBkKhM9lBgCke0rymWo2g', 'authorChannelId': {'value': 'UCNzBkKhM9lBgCke0rymWo2g'}, 'canRate': True, 'viewerRating': 'none', 'likeCount': 1, 'publishedAt': '2022-10-12T10:40:55Z', 'updatedAt': '2022-10-12T10:40:55Z'}}, 'canReply': True, 'totalReplyCount': 2, 'isPublic': True}","{'comments': [{'kind': 'youtube#comment', 'etag': 'l4Kx2r8JV9MGzZt1jwjFLhsFmdY', 'id': 'UgzgkAQvkRKipVNt6n14AaABAg.9h4a9spjh4p9h72mSEwyB1', 'snippet': {'videoId': '_cRKmhX6Z6Q', 'textDisplay': '@Percio Rosa Martins Eu não sou tucano, nem petista, nem qualquer outro ista que o gado curte rotular.<br>Não é questão de posição política, qualquer pessoa que tenha a menor noção do mercado previu a tragédia cambial que seria provocada pela taxa de juros a 2%. Graças a ela tivemos a 4a maior desvalorização da moeda e a 3a maior inflação no período.<br>Além disso pagaremos a conta do populismo e maquiagem eleitoral no ano que vem. <br>Ridicularizei a fixação do gado em tentar desqualificar opiniões profissionais que não estejam em sintonia com o Universo Paralelo em que vivem.<br>Amigão, não há solução para vocês. Apenas aguarde o aumento de impostos que virá para cobrir os desatinos eleitoreiros do vigarista Paulo Guedes.', 'textOriginal': '@Percio Rosa Martins Eu não sou tucano, nem petista, nem qualquer outro ista que o gado curte rotular.\\\\nNão é questão de posição política, qualquer pessoa que tenha a menor noção do mercado previu a tragédia cambial que seria provocada pela taxa de juros a 2%. Graças a ela tivemos a 4a maior desvalorização da moeda e a 3a maior inflação no período.\\\\nAlém disso pagaremos a conta do populismo e maquiagem eleitoral no ano que vem. \\\\nRidicularizei a fixação do gado em tentar desqualificar opiniões profissionais que não estejam em sintonia com o Universo Paralelo em que vivem.\\\\nAmigão, não há solução para vocês. Apenas aguarde o aumento de impostos que virá para cobrir os desatinos eleitoreiros do vigarista Paulo Guedes.', 'parentId': 'UgzgkAQvkRKipVNt6n14AaABAg', 'authorDisplayName': 'Al', 'authorProfileImageUrl': 'https://yt3.ggpht.com/ytc/AGIKgqN19LDMmVNIXLV7HitZpAqGCPwBLwlFV4Pi9vVDJtFc-Wp7rsX_Ybbk88bx74sk4w=s48-c-k-c0x00ffffff-no-rj', 'authorChannelUrl': 'http://www.youtube.com/channel/UCNzBkKhM9lBgCke0rymWo2g', 'authorChannelId': {'value': 'UCNzBkKhM9lBgCke0rymWo2g'}, 'canRate': True, 'viewerRating': 'none', 'likeCount': 0, 'publishedAt': '2022-10-13T09:38:12Z', 'updatedAt': '2022-10-13T09:38:12Z'}}, {'kind': 'youtube#comment', 'etag': '4KV3wp7ejWdv43tmVUBUJusDFpM', 'id': 'UgzgkAQvkRKipVNt6n14AaABAg.9h4a9spjh4p9h6QHmDUvuD', 'snippet': {'videoId': '_cRKmhX6Z6Q', 'textDisplay': 'Ela é tucana, pode pesquisar,  quem acompanha política mais de perto conhece ela!!!', 'textOriginal': 'Ela é tucana, pode pesquisar,  quem acompanha política mais de perto conhece ela!!!', 'parentId': 'UgzgkAQvkRKipVNt6n14AaABAg', 'authorDisplayName': 'Percio Rosa Martins', 'authorProfileImageUrl': 'https://yt3.ggpht.com/ytc/AGIKgqN3KAzVzo7Xn7g9mP4pJ_R-OAwTfV_Yj-VCfR1Ekw=s48-c-k-c0x00ffffff-no-rj', 'authorChannelUrl': 'http://www.youtube.com/channel/UCsqQWFVSC9IhHtpY-ar16-A', 'authorChannelId': {'value': 'UCsqQWFVSC9IhHtpY-ar16-A'}, 'canRate': True, 'viewerRating': 'none', 'likeCount': 0, 'publishedAt': '2022-10-13T03:44:21Z', 'updatedAt': '2022-10-13T03:44:21Z'}}]}",UCNzBkKhM9lBgCke0rymWo2g,2022-10-12T10:40:55Z,"O gado esperava que a economista pintasse de ouro a maquiagem eleitoreira do Paulo Guedes.
Virou comunista.",,2023-06-08 18:15:14.001184
youtube#commentThread,qNVHZXlkhgdsoe9kMt5FGsN5oO4,Ugy1_tcKsnPkWN_8mmx4AaABAg,"{'videoId': 'la0VYvEQH5M', 'topLevelComment': {'kind': 'youtube#comment', 'etag': '9makzZySpQDi1jEnSgXHyaZ4AgQ', 'id': 'Ugy1_tcKsnPkWN_8mmx4AaABAg', 'snippet': {'videoId': 'la0VYvEQH5M', 'textDisplay': 'Os habitantes de Ratanabá desistiram de vacinas temendo doenças diversas.<br>Retrocedemos à Idade Média por influência do incapaz.', 'textOriginal': 'Os habitantes de Ratanabá desistiram de vacinas temendo doenças diversas.\\\\nRetrocedemos à Idade Média por influência do incapaz.', 'authorDisplayName': 'Al', 'authorProfileImageUrl': 'https://yt3.ggpht.com/ytc/AGIKgqN19LDMmVNIXLV7HitZpAqGCPwBLwlFV4Pi9vVDJtFc-Wp7rsX_Ybbk88bx74sk4w=s48-c-k-c0x00ffffff-no-rj', 'authorChannelUrl': 'http://www.youtube.com/channel/UCNzBkKhM9lBgCke0rymWo2g', 'authorChannelId': {'value': 'UCNzBkKhM9lBgCke0rymWo2g'}, 'canRate': True, 'viewerRating': 'none', 'likeCount': 0, 'publishedAt': '2022-10-10T15:22:58Z', 'updatedAt': '2022-10-10T15:22:58Z'}}, 'canReply': True, 'totalReplyCount': 0, 'isPublic': True}",,UCNzBkKhM9lBgCke0rymWo2g,2022-10-10T15:22:58Z,"Os habitantes de Ratanabá desistiram de vacinas temendo doenças diversas.
Retrocedemos à Idade Média por influência do incapaz.",,2023-06-08 18:22:33.769084
youtube#commentThread,QET_vdKAzzb-fhIFcOizAi5fODo,Ugx8Extbv48GdPjYwaR4AaABAg,"{'videoId': '1-32wkl8rMg', 'topLevelComment': {'kind': 'youtube#comment', 'etag': 'HYVZnbAyGzinCUB1IPpFzdtFw1M', 'id': 'Ugx8Extbv48GdPjYwaR4AaABAg', 'snippet': {'videoId': '1-32wkl8rMg', 'textDisplay': 'O Zé Carioca é um mago, fez toda a sua fortuna em governos petistas. Teve BNDES ajudando?', 'textOriginal': 'O Zé Carioca é um mago, fez toda a sua fortuna em governos petistas. Teve BNDES ajudando?', 'authorDisplayName': 'Al', 'authorProfileImageUrl': 'https://yt3.ggpht.com/ytc/AGIKgqN19LDMmVNIXLV7HitZpAqGCPwBLwlFV4Pi9vVDJtFc-Wp7rsX_Ybbk88bx74sk4w=s48-c-k-c0x00ffffff-no-rj', 'authorChannelUrl': 'http://www.youtube.com/channel/UCNzBkKhM9lBgCke0rymWo2g', 'authorChannelId': {'value': 'UCNzBkKhM9lBgCke0rymWo2g'}, 'canRate': True, 'viewerRating': 'none', 'likeCount': 0, 'publishedAt': '2022-10-08T21:12:33Z', 'updatedAt': '2022-10-08T21:12:33Z'}}, 'canReply': True, 'totalReplyCount': 0, 'isPublic': True}",,UCNzBkKhM9lBgCke0rymWo2g,2022-10-08T21:12:33Z,"O Zé Carioca é um mago, fez toda a sua fortuna em governos petistas. Teve BNDES ajudando?",,2023-06-08 18:25:54.920543
youtube#commentThread,YDAezMTYGpq_MqcndKPxNqzGm7Q,UgyRxIt_I8fahIC70154AaABAg,"{'videoId': 'nYSoLqYNnc8', 'topLevelComment': {'kind': 'youtube#comment', 'etag': 'jk0MUSpe7sEcyY6GbIGj6Q7_OzM', 'id': 'UgyRxIt_I8fahIC70154AaABAg', 'snippet': {'videoId': 'nYSoLqYNnc8', 'textDisplay': 'Todos os recursos federais voltados para o populismo eleitoral.', 'textOriginal': 'Todos os recursos federais voltados para o populismo eleitoral.', 'authorDisplayName': 'Al', 'authorProfileImageUrl': 'https://yt3.ggpht.com/ytc/AGIKgqN19LDMmVNIXLV7HitZpAqGCPwBLwlFV4Pi9vVDJtFc-Wp7rsX_Ybbk88bx74sk4w=s48-c-k-c0x00ffffff-no-rj', 'authorChannelUrl': 'http://www.youtube.com/channel/UCNzBkKhM9lBgCke0rymWo2g', 'authorChannelId': {'value': 'UCNzBkKhM9lBgCke0rymWo2g'}, 'canRate': True, 'viewerRating': 'none', 'likeCount': 0, 'publishedAt': '2022-10-07T11:21:39Z', 'updatedAt': '2022-10-07T11:21:39Z'}}, 'canReply': True, 'totalReplyCount': 0, 'isPublic': True}",,UCNzBkKhM9lBgCke0rymWo2g,2022-10-07T11:21:39Z,Todos os recursos federais voltados para o populismo eleitoral.,QURTSl9pMkpKenEzNkdTNDNmN2lzUkVMd0pGb3d5ZlVoejhUMTNhNWJabk4xRnowYlpwTGwxWGRUaDdvZDFqS2tQUkY2d3p1XzBnLTVwRQ==,2023-06-08 18:33:08.373876
youtube#commentThread,XQT7j1Wfwq2Xmm2qR87DTX8S7Y4,UgxgJHTktpImZl-GSVp4AaABAg,"{'videoId': 'FrjJ7uYzmXI', 'topLevelComment': {'kind': 'youtube#comment', 'etag': 'gmXFFmS3yeu4WeNxT9pu7McSqpA', 'id': 'UgxgJHTktpImZl-GSVp4AaABAg', 'snippet': {'videoId': 'FrjJ7uYzmXI', 'textDisplay': 'A cara do Motta engolindo seco, tentando bolar a cascata enquanto escuta a Amanda falando o óbvio diz muito.<br>&quot;Narrativas&quot; : o melhor argumento do passapanista.', 'textOriginal': 'A cara do Motta engolindo seco, tentando bolar a cascata enquanto escuta a Amanda falando o óbvio diz muito.\\\\n""Narrativas"" : o melhor argumento do passapanista.', 'authorDisplayName': 'Al', 'authorProfileImageUrl': 'https://yt3.ggpht.com/ytc/AGIKgqN19LDMmVNIXLV7HitZpAqGCPwBLwlFV4Pi9vVDJtFc-Wp7rsX_Ybbk88bx74sk4w=s48-c-k-c0x00ffffff-no-rj', 'authorChannelUrl': 'http://www.youtube.com/channel/UCNzBkKhM9lBgCke0rymWo2g', 'authorChannelId': {'value': 'UCNzBkKhM9lBgCke0rymWo2g'}, 'canRate': True, 'viewerRating': 'none', 'likeCount': 2, 'publishedAt': '2022-10-07T11:28:03Z', 'updatedAt': '2022-10-07T11:28:03Z'}}, 'canReply': True, 'totalReplyCount': 0, 'isPublic': True}",,UCNzBkKhM9lBgCke0rymWo2g,2022-10-07T11:28:03Z,"A cara do Motta engolindo seco, tentando bolar a cascata enquanto escuta a Amanda falando o óbvio diz muito.
""Narrativas"" : o melhor argumento do passapanista.",QURTSl9pM21nMFVUYk41UDRyVTg1dWV1T0VieVdRZlBqNXhNeVVCNWpWZTdFYXdrVVZ6YkdtM0h0QzI0ZTFIdjlqRzI5bFhodktxbDhJUQ==,2023-06-08 18:33:14.744320
youtube#commentThread,_ZGlo1YE_GuTCTePaOSXXQKD0VU,UgxqhsfOtogGYnyWKZ14AaABAg,"{'videoId': 'eniDJl4E54s', 'topLevelComment': {'kind': 'youtube#comment', 'etag': 'HESZ9MHGd8s3KcnQ2BxrfMEmhc0', 'id': 'UgxqhsfOtogGYnyWKZ14AaABAg', 'snippet': {'videoId': 'eniDJl4E54s', 'textDisplay': 'Assédio nas empresas e nas igrejas pode. Mas se a família souber que alguém distribuiu santinhos onde não é permitido....Ainnn! Fui prejudicado! Precisamos postergar as eleições!', 'textOriginal': 'Assédio nas empresas e nas igrejas pode. Mas se a família souber que alguém distribuiu santinhos onde não é permitido....Ainnn! Fui prejudicado! Precisamos postergar as eleições!', 'authorDisplayName': 'Al', 'authorProfileImageUrl': 'https://yt3.ggpht.com/ytc/AGIKgqN19LDMmVNIXLV7HitZpAqGCPwBLwlFV4Pi9vVDJtFc-Wp7rsX_Ybbk88bx74sk4w=s48-c-k-c0x00ffffff-no-rj', 'authorChannelUrl': 'http://www.youtube.com/channel/UCNzBkKhM9lBgCke0rymWo2g', 'authorChannelId': {'value': 'UCNzBkKhM9lBgCke0rymWo2g'}, 'canRate': True, 'viewerRating': 'none', 'likeCount': 0, 'publishedAt': '2022-10-29T16:07:30Z', 'updatedAt': '2022-10-29T16:07:30Z'}}, 'canReply': True, 'totalReplyCount': 0, 'isPublic': True}",,UCNzBkKhM9lBgCke0rymWo2g,2022-10-29T16:07:30Z,Assédio nas empresas e nas igrejas pode. Mas se a família souber que alguém distribuiu santinhos onde não é permitido....Ainnn! Fui prejudicado! Precisamos postergar as eleições!,QURTSl9pMlpFa3U3am9yNS1QRWVRLVE2elBGU3ZqazBFTGVjcGVBSG5YOFlBcVFILUliRElJRThKRWFTQnpOck5pbURfMmNSMmpMR3Q4NA==,2023-06-08 14:16:24.276837
youtube#commentThread,K7mI6Lt1GD98nfiB-O4hXRkZ8tk,UgyHh4b5qUwANJ1AcK14AaABAg,"{'videoId': 'YWRxk9KTtJo', 'topLevelComment': {'kind': 'youtube#comment', 'etag': 'Fd4JAeVGXwKldE_ywyUIaUF_XjU', 'id': 'UgyHh4b5qUwANJ1AcK14AaABAg', 'snippet': {'videoId': 'YWRxk9KTtJo', 'textDisplay': 'Mas a finalidade da fanfic não era exatamente essa? Ele esqueceu de combinar com o Bananinha.', 'textOriginal': 'Mas a finalidade da fanfic não era exatamente essa? Ele esqueceu de combinar com o Bananinha.', 'authorDisplayName': 'Al', 'authorProfileImageUrl': 'https://yt3.ggpht.com/ytc/AGIKgqN19LDMmVNIXLV7HitZpAqGCPwBLwlFV4Pi9vVDJtFc-Wp7rsX_Ybbk88bx74sk4w=s48-c-k-c0x00ffffff-no-rj', 'authorChannelUrl': 'http://www.youtube.com/channel/UCNzBkKhM9lBgCke0rymWo2g', 'authorChannelId': {'value': 'UCNzBkKhM9lBgCke0rymWo2g'}, 'canRate': True, 'viewerRating': 'none', 'likeCount': 4, 'publishedAt': '2022-10-29T12:25:05Z', 'updatedAt': '2022-10-29T12:25:05Z'}}, 'canReply': True, 'totalReplyCount': 0, 'isPublic': True}",,UCNzBkKhM9lBgCke0rymWo2g,2022-10-29T12:25:05Z,Mas a finalidade da fanfic não era exatamente essa? Ele esqueceu de combinar com o Bananinha.,,2023-06-08 14:17:08.527204
youtube#commentThread,52dmHsIYcOrqD9GpPc6vuRkEGEI,UgwUqk3uX2PglQ7q7UF4AaABAg,"{'videoId': 'pFvLZ1O8C9M', 'topLevelComment': {'kind': 'youtube#comment', 'etag': 'm6oT85VHgr08nUkyJHFJBpJ--Js', 'id': 'UgwUqk3uX2PglQ7q7UF4AaABAg', 'snippet': {'videoId': 'pFvLZ1O8C9M', 'textDisplay': 'Quem disse que o Mito não queria comprar vacinas?<br>Por ele cada brasileiro teria à sua disposição pelo menos 8 doses de Covaxin.', 'textOriginal': 'Quem disse que o Mito não queria comprar vacinas?\\\\nPor ele cada brasileiro teria à sua disposição pelo menos 8 doses de Covaxin.', 'authorDisplayName': 'Al', 'authorProfileImageUrl': 'https://yt3.ggpht.com/ytc/AGIKgqN19LDMmVNIXLV7HitZpAqGCPwBLwlFV4Pi9vVDJtFc-Wp7rsX_Ybbk88bx74sk4w=s48-c-k-c0x00ffffff-no-rj', 'authorChannelUrl': 'http://www.youtube.com/channel/UCNzBkKhM9lBgCke0rymWo2g', 'authorChannelId': {'value': 'UCNzBkKhM9lBgCke0rymWo2g'}, 'canRate': True, 'viewerRating': 'none', 'likeCount': 0, 'publishedAt': '2022-10-29T09:05:33Z', 'updatedAt': '2022-10-29T09:05:33Z'}}, 'canReply': True, 'totalReplyCount': 0, 'isPublic': True}",,UCNzBkKhM9lBgCke0rymWo2g,2022-10-29T09:05:33Z,"Quem disse que o Mito não queria comprar vacinas?
Por ele cada brasileiro teria à sua disposição pelo menos 8 doses de Covaxin.",QURTSl9pMXBndnBUMWEwOGNnSDlXZlB0emZaM25GdHBFU254TTFndGxJbVUwTXRoZXhhdGFteWp5Rkl4QnVuNjhTM2JqVDJDelZ5WXRPWQ==,2023-06-08 14:17:43.993706
youtube#commentThread,k3YivthyNofWMaxEdHTENHxxN2A,Ugxw5BqSnRjmQgbobI54AaABAg,"{'videoId': 'lAIw2sObDQ0', 'topLevelComment': {'kind': 'youtube#comment', 'etag': 'KM1KtzSPXrKdistPsP0RAgrDmrA', 'id': 'Ugxw5BqSnRjmQgbobI54AaABAg', 'snippet': {'videoId': 'lAIw2sObDQ0', 'textDisplay': 'Condiz com o Estatuto. O que não condiz com o novo foi se ter adotado as mais repugnantes práticas da política e se tornar bate pau do Centrão.', 'textOriginal': 'Condiz com o Estatuto. O que não condiz com o novo foi se ter adotado as mais repugnantes práticas da política e se tornar bate pau do Centrão.', 'authorDisplayName': 'Al', 'authorProfileImageUrl': 'https://yt3.ggpht.com/ytc/AGIKgqN19LDMmVNIXLV7HitZpAqGCPwBLwlFV4Pi9vVDJtFc-Wp7rsX_Ybbk88bx74sk4w=s48-c-k-c0x00ffffff-no-rj', 'authorChannelUrl': 'http://www.youtube.com/channel/UCNzBkKhM9lBgCke0rymWo2g', 'authorChannelId': {'value': 'UCNzBkKhM9lBgCke0rymWo2g'}, 'canRate': True, 'viewerRating': 'none', 'likeCount': 2, 'publishedAt': '2022-10-27T13:16:00Z', 'updatedAt': '2022-10-27T13:16:00Z'}}, 'canReply': True, 'totalReplyCount': 0, 'isPublic': True}",,UCNzBkKhM9lBgCke0rymWo2g,2022-10-27T13:16:00Z,Condiz com o Estatuto. O que não condiz com o novo foi se ter adotado as mais repugnantes práticas da política e se tornar bate pau do Centrão.,,2023-06-08 14:29:01.714538
