kind,etag,id,snippet,replies,authorChannelId,publishedAt,textOriginal,nextPageToken,extraction_date
youtube#commentThread,seeTXVqRspcRsKufw8fVhGamUY8,Ugx6Bpkt6e_ij2VZbZd4AaABAg,"{'videoId': 'tuMtg57V1k4', 'topLevelComment': {'kind': 'youtube#comment', 'etag': 'ZsbVXbPA5XNUEGr668u_YZIT0HY', 'id': 'Ugx6Bpkt6e_ij2VZbZd4AaABAg', 'snippet': {'videoId': 'tuMtg57V1k4', 'textDisplay': 'PROVAS são as respostas das rádios desmascarando a armação. Tem que investigar os fraudadores sim.', 'textOriginal': 'PROVAS são as respostas das rádios desmascarando a armação. Tem que investigar os fraudadores sim.', 'authorDisplayName': 'Al', 'authorProfileImageUrl': 'https://yt3.ggpht.com/ytc/AGIKgqN19LDMmVNIXLV7HitZpAqGCPwBLwlFV4Pi9vVDJtFc-Wp7rsX_Ybbk88bx74sk4w=s48-c-k-c0x00ffffff-no-rj', 'authorChannelUrl': 'http://www.youtube.com/channel/UCNzBkKhM9lBgCke0rymWo2g', 'authorChannelId': {'value': 'UCNzBkKhM9lBgCke0rymWo2g'}, 'canRate': True, 'viewerRating': 'none', 'likeCount': 2, 'publishedAt': '2022-10-27T10:38:06Z', 'updatedAt': '2022-10-27T10:38:06Z'}}, 'canReply': True, 'totalReplyCount': 0, 'isPublic': True}",,UCNzBkKhM9lBgCke0rymWo2g,2022-10-27T10:38:06Z,PROVAS são as respostas das rádios desmascarando a armação. Tem que investigar os fraudadores sim.,QURTSl9pMlJXdFBUdFFuYWpXTzBjb2stZms0czBPbmlmaEYzT2VZVUNNNGhSazVHSEJ3QnR2dDZiSndVQVdnaUJXWDJld0lyRkY0VTN5aw==,2023-06-08 14:30:14.573571
youtube#commentThread,yfSzj7KEMdp4XS4g57Khhb4FVfI,UgysWczln-SfkhY2dzx4AaABAg,"{'videoId': 'tuMtg57V1k4', 'topLevelComment': {'kind': 'youtube#comment', 'etag': 'Fav12mtpCBoreYLBmRd6FjKz2uI', 'id': 'UgysWczln-SfkhY2dzx4AaABAg', 'snippet': {'videoId': 'tuMtg57V1k4', 'textDisplay': '&quot;Nosso pessoal&quot; virou a noite 😅.<br>Mas quem tinha que elaborar as &quot;provas&quot; era a empresa ou o &quot;pessoal dele&quot;? 😅😅😅', 'textOriginal': '""Nosso pessoal"" virou a noite 😅.\\\\nMas quem tinha que elaborar as ""provas"" era a empresa ou o ""pessoal dele""? 😅😅😅', 'authorDisplayName': 'Al', 'authorProfileImageUrl': 'https://yt3.ggpht.com/ytc/AGIKgqN19LDMmVNIXLV7HitZpAqGCPwBLwlFV4Pi9vVDJtFc-Wp7rsX_Ybbk88bx74sk4w=s48-c-k-c0x00ffffff-no-rj', 'authorChannelUrl': 'http://www.youtube.com/channel/UCNzBkKhM9lBgCke0rymWo2g', 'authorChannelId': {'value': 'UCNzBkKhM9lBgCke0rymWo2g'}, 'canRate': True, 'viewerRating': 'none', 'likeCount': 1, 'publishedAt': '2022-10-27T10:33:25Z', 'updatedAt': '2022-10-27T10:33:25Z'}}, 'canReply': True, 'totalReplyCount': 2, 'isPublic': True}","{'comments': [{'kind': 'youtube#comment', 'etag': 'Fmy8QqahpTHlh3AWpvdNUs7YfyE', 'id': 'UgysWczln-SfkhY2dzx4AaABAg.9hgCE6GH_wK9hgDHfaoNRW', 'snippet': {'videoId': 'tuMtg57V1k4', 'textDisplay': '@Vitória Costa Laudos e relatórios não são assuntos jurídicos, são técnicos. <br>As provas das rádios surgem rapidamente sem equipes ajudando, e deixam clara a armação. Essas não podem ser consideradas?', 'textOriginal': '@Vitória Costa Laudos e relatórios não são assuntos jurídicos, são técnicos. \\\\nAs provas das rádios surgem rapidamente sem equipes ajudando, e deixam clara a armação. Essas não podem ser consideradas?', 'parentId': 'UgysWczln-SfkhY2dzx4AaABAg', 'authorDisplayName': 'Al', 'authorProfileImageUrl': 'https://yt3.ggpht.com/ytc/AGIKgqN19LDMmVNIXLV7HitZpAqGCPwBLwlFV4Pi9vVDJtFc-Wp7rsX_Ybbk88bx74sk4w=s48-c-k-c0x00ffffff-no-rj', 'authorChannelUrl': 'http://www.youtube.com/channel/UCNzBkKhM9lBgCke0rymWo2g', 'authorChannelId': {'value': 'UCNzBkKhM9lBgCke0rymWo2g'}, 'canRate': True, 'viewerRating': 'none', 'likeCount': 0, 'publishedAt': '2022-10-27T10:42:39Z', 'updatedAt': '2022-10-27T10:42:39Z'}}, {'kind': 'youtube#comment', 'etag': 'UY-w5GPjgrIjB4Yk6VknoKtgr_0', 'id': 'UgysWczln-SfkhY2dzx4AaABAg.9hgCE6GH_wK9hgD3FhAaHE', 'snippet': {'videoId': 'tuMtg57V1k4', 'textDisplay': 'Se refere aos advogados dele , que trabalham o caso, tente estudar um pouco de interpretação.😗😉', 'textOriginal': 'Se refere aos advogados dele , que trabalham o caso, tente estudar um pouco de interpretação.😗😉', 'parentId': 'UgysWczln-SfkhY2dzx4AaABAg', 'authorDisplayName': 'Vitória Costa', 'authorProfileImageUrl': 'https://yt3.ggpht.com/ytc/AGIKgqMqzTnKUxsARJXzSbua3RUg954sr3DI6kv9hFVlwg=s48-c-k-c0x00ffffff-no-rj', 'authorChannelUrl': 'http://www.youtube.com/channel/UC42atcAPXiMZ1wsw32X14lg', 'authorChannelId': {'value': 'UC42atcAPXiMZ1wsw32X14lg'}, 'canRate': True, 'viewerRating': 'none', 'likeCount': 0, 'publishedAt': '2022-10-27T10:40:40Z', 'updatedAt': '2022-10-27T10:40:40Z'}}]}",UCNzBkKhM9lBgCke0rymWo2g,2022-10-27T10:33:25Z,"""Nosso pessoal"" virou a noite 😅.
Mas quem tinha que elaborar as ""provas"" era a empresa ou o ""pessoal dele""? 😅😅😅",,2023-06-08 14:30:15.495875
youtube#commentThread,Z-RtKmlHQhL0sCl_HGusLltLamw,Ugw4ccOVHDx4jC65eIZ4AaABAg,"{'videoId': 'tuMtg57V1k4', 'topLevelComment': {'kind': 'youtube#comment', 'etag': 'D-qZ5HzPYCV8tCAANpPo5P52fX0', 'id': 'Ugw4ccOVHDx4jC65eIZ4AaABAg', 'snippet': {'videoId': 'tuMtg57V1k4', 'textDisplay': 'Campanha  do Bolsonaro se inspira no Coiote do Papa Léguas.', 'textOriginal': 'Campanha  do Bolsonaro se inspira no Coiote do Papa Léguas.', 'authorDisplayName': 'Al', 'authorProfileImageUrl': 'https://yt3.ggpht.com/ytc/AGIKgqN19LDMmVNIXLV7HitZpAqGCPwBLwlFV4Pi9vVDJtFc-Wp7rsX_Ybbk88bx74sk4w=s48-c-k-c0x00ffffff-no-rj', 'authorChannelUrl': 'http://www.youtube.com/channel/UCNzBkKhM9lBgCke0rymWo2g', 'authorChannelId': {'value': 'UCNzBkKhM9lBgCke0rymWo2g'}, 'canRate': True, 'viewerRating': 'none', 'likeCount': 0, 'publishedAt': '2022-10-27T10:29:54Z', 'updatedAt': '2022-10-27T10:29:54Z'}}, 'canReply': True, 'totalReplyCount': 0, 'isPublic': True}",,UCNzBkKhM9lBgCke0rymWo2g,2022-10-27T10:29:54Z,Campanha  do Bolsonaro se inspira no Coiote do Papa Léguas.,,2023-06-08 14:30:15.495875
youtube#commentThread,x-AgD9UcKNtk18GlSoxrBR5sxek,UgypXRV5_GN3Z2BXJK14AaABAg,"{'videoId': '2a1ZKlB7qqE', 'topLevelComment': {'kind': 'youtube#comment', 'etag': '6jdV3XM-VUkkqbbpFBlELSPB8dg', 'id': 'UgypXRV5_GN3Z2BXJK14AaABAg', 'snippet': {'videoId': '2a1ZKlB7qqE', 'textDisplay': 'Iniciativa boa mesmo foi quebrar fundos de pensão e implodir o Real com taxa de juros a 2%.<br>Tirando a incompetência primária, Paulo Guedes é um ótimo prego para o martelo rachador, transformou Almoço Grátis na base do liberalismo.', 'textOriginal': 'Iniciativa boa mesmo foi quebrar fundos de pensão e implodir o Real com taxa de juros a 2%.\\\\nTirando a incompetência primária, Paulo Guedes é um ótimo prego para o martelo rachador, transformou Almoço Grátis na base do liberalismo.', 'authorDisplayName': 'Al', 'authorProfileImageUrl': 'https://yt3.ggpht.com/ytc/AGIKgqN19LDMmVNIXLV7HitZpAqGCPwBLwlFV4Pi9vVDJtFc-Wp7rsX_Ybbk88bx74sk4w=s48-c-k-c0x00ffffff-no-rj', 'authorChannelUrl': 'http://www.youtube.com/channel/UCNzBkKhM9lBgCke0rymWo2g', 'authorChannelId': {'value': 'UCNzBkKhM9lBgCke0rymWo2g'}, 'canRate': True, 'viewerRating': 'none', 'likeCount': 0, 'publishedAt': '2022-10-27T10:18:49Z', 'updatedAt': '2022-10-27T10:18:49Z'}}, 'canReply': True, 'totalReplyCount': 0, 'isPublic': True}",,UCNzBkKhM9lBgCke0rymWo2g,2022-10-27T10:18:49Z,"Iniciativa boa mesmo foi quebrar fundos de pensão e implodir o Real com taxa de juros a 2%.
Tirando a incompetência primária, Paulo Guedes é um ótimo prego para o martelo rachador, transformou Almoço Grátis na base do liberalismo.",,2023-06-08 14:30:17.221572
youtube#commentThread,kM6FzbGSFNiaNytzHrXKA0vr84Y,Ugw82ewT2GBhNkmtPmB4AaABAg,"{'videoId': '63mQK6Nh2R0', 'topLevelComment': {'kind': 'youtube#comment', 'etag': 'G3pg0BOP-s4AK2yVTx7DQVMwHZg', 'id': 'Ugw82ewT2GBhNkmtPmB4AaABAg', 'snippet': {'videoId': '63mQK6Nh2R0', 'textDisplay': 'Um foi Presidente mundial do Bank Boston, o outro quebrou fundos de pensão e foi o pior Ministro da Economia da história. <br>Economista &quot;liberal&quot; que faz papel de prego do incapaz, adota &quot;Almoço grátis&quot; como política econômica e afirma que &quot;dólar alto é bom&quot;, pode até entender de economia, mas usa para interesses do seu martelo.', 'textOriginal': 'Um foi Presidente mundial do Bank Boston, o outro quebrou fundos de pensão e foi o pior Ministro da Economia da história. \\\\nEconomista ""liberal"" que faz papel de prego do incapaz, adota ""Almoço grátis"" como política econômica e afirma que ""dólar alto é bom"", pode até entender de economia, mas usa para interesses do seu martelo.', 'authorDisplayName': 'Al', 'authorProfileImageUrl': 'https://yt3.ggpht.com/ytc/AGIKgqN19LDMmVNIXLV7HitZpAqGCPwBLwlFV4Pi9vVDJtFc-Wp7rsX_Ybbk88bx74sk4w=s48-c-k-c0x00ffffff-no-rj', 'authorChannelUrl': 'http://www.youtube.com/channel/UCNzBkKhM9lBgCke0rymWo2g', 'authorChannelId': {'value': 'UCNzBkKhM9lBgCke0rymWo2g'}, 'canRate': True, 'viewerRating': 'none', 'likeCount': 0, 'publishedAt': '2022-10-27T09:00:26Z', 'updatedAt': '2022-10-27T09:00:26Z'}}, 'canReply': True, 'totalReplyCount': 0, 'isPublic': True}",,UCNzBkKhM9lBgCke0rymWo2g,2022-10-27T09:00:26Z,"Um foi Presidente mundial do Bank Boston, o outro quebrou fundos de pensão e foi o pior Ministro da Economia da história. 
Economista ""liberal"" que faz papel de prego do incapaz, adota ""Almoço grátis"" como política econômica e afirma que ""dólar alto é bom"", pode até entender de economia, mas usa para interesses do seu martelo.",QURTSl9pMGQySEFqSmpxS01mVGNkdjV1U1VnSVliUTRmSng0alVrVzg0am1jam55ZjcwT3pMMGVNQW94Vk55YU5vY3g2M0k2SjJxdzFNZw==,2023-06-08 14:30:56.916816
youtube#commentThread,Hxr5RrqojhgZHzlkItHaDdFdLnY,UgwLoNMRYvtUfmIqs7x4AaABAg,"{'videoId': 'aNQSY9fNw8M', 'topLevelComment': {'kind': 'youtube#comment', 'etag': 'cgcib6VCJ2ZKV3XEEHdteGllTv4', 'id': 'UgwLoNMRYvtUfmIqs7x4AaABAg', 'snippet': {'videoId': 'aNQSY9fNw8M', 'textDisplay': 'Depois de &quot;urnas fraudadas&quot;, das meninas banguelas pastosas, das meninas prostitutas, do Mito não conhecer Bob... <br>Mais uma fanfic desesperada:<br>As &quot;provas&quot; - &quot;Auditoria&quot; feita por quem nunca fez auditoria, ligada ao Zé Carioca, escreveu o que deu na telha, ainda teve o descuido de incluir rádio extinta. <br>Nem a JP acredita nisso.', 'textOriginal': 'Depois de ""urnas fraudadas"", das meninas banguelas pastosas, das meninas prostitutas, do Mito não conhecer Bob... \\\\nMais uma fanfic desesperada:\\\\nAs ""provas"" - ""Auditoria"" feita por quem nunca fez auditoria, ligada ao Zé Carioca, escreveu o que deu na telha, ainda teve o descuido de incluir rádio extinta. \\\\nNem a JP acredita nisso.', 'authorDisplayName': 'Al', 'authorProfileImageUrl': 'https://yt3.ggpht.com/ytc/AGIKgqN19LDMmVNIXLV7HitZpAqGCPwBLwlFV4Pi9vVDJtFc-Wp7rsX_Ybbk88bx74sk4w=s48-c-k-c0x00ffffff-no-rj', 'authorChannelUrl': 'http://www.youtube.com/channel/UCNzBkKhM9lBgCke0rymWo2g', 'authorChannelId': {'value': 'UCNzBkKhM9lBgCke0rymWo2g'}, 'canRate': True, 'viewerRating': 'none', 'likeCount': 0, 'publishedAt': '2022-10-26T11:46:35Z', 'updatedAt': '2022-10-26T11:46:35Z'}}, 'canReply': True, 'totalReplyCount': 0, 'isPublic': True}",,UCNzBkKhM9lBgCke0rymWo2g,2022-10-26T11:46:35Z,"Depois de ""urnas fraudadas"", das meninas banguelas pastosas, das meninas prostitutas, do Mito não conhecer Bob... 
Mais uma fanfic desesperada:
As ""provas"" - ""Auditoria"" feita por quem nunca fez auditoria, ligada ao Zé Carioca, escreveu o que deu na telha, ainda teve o descuido de incluir rádio extinta. 
Nem a JP acredita nisso.",QURTSl9pMjV5TFJqbnh5NDBzN0FLeWFkbUNuRnBNbnNRdWF5VU9FNkc3WF83dlRkZExlR3ZTbkNNV1hhRktoVmVTSE5JckduYXRMeWRLQQ==,2023-06-08 14:38:16.626777
youtube#commentThread,O8jSO3yxWq_WWkocOmEs_TZrvHY,UgzGXjfAWfFb49ZZNmV4AaABAg,"{'videoId': 'OhRGQ4_zbUc', 'topLevelComment': {'kind': 'youtube#comment', 'etag': 'mrmsr-Bo7wKJWZQ6-Xen02JdGK0', 'id': 'UgzGXjfAWfFb49ZZNmV4AaABAg', 'snippet': {'videoId': 'OhRGQ4_zbUc', 'textDisplay': 'Cagou na biografia ao se humilhar por quem o traiu.', 'textOriginal': 'Cagou na biografia ao se humilhar por quem o traiu.', 'authorDisplayName': 'Al', 'authorProfileImageUrl': 'https://yt3.ggpht.com/ytc/AGIKgqN19LDMmVNIXLV7HitZpAqGCPwBLwlFV4Pi9vVDJtFc-Wp7rsX_Ybbk88bx74sk4w=s48-c-k-c0x00ffffff-no-rj', 'authorChannelUrl': 'http://www.youtube.com/channel/UCNzBkKhM9lBgCke0rymWo2g', 'authorChannelId': {'value': 'UCNzBkKhM9lBgCke0rymWo2g'}, 'canRate': True, 'viewerRating': 'none', 'likeCount': 0, 'publishedAt': '2022-10-26T15:15:14Z', 'updatedAt': '2022-10-26T15:15:14Z'}}, 'canReply': True, 'totalReplyCount': 0, 'isPublic': True}",,UCNzBkKhM9lBgCke0rymWo2g,2022-10-26T15:15:14Z,Cagou na biografia ao se humilhar por quem o traiu.,QURTSl9pMWl1eVppU3hqSE9WTndJZy1DRmszRG5nUzI5Y0dqdER2V2YtUlRIT05kX3FYa3dURkJVY3VmUDJBM2lhVmtRbXo1dUtPLVNjRQ==,2023-06-08 14:38:48.562166
youtube#commentThread,jBi5DAFedV982berMy8bjfPwLA4,Ugzgac6kFY18H1tU2gd4AaABAg,"{'videoId': 'g9gov_I2RMI', 'topLevelComment': {'kind': 'youtube#comment', 'etag': 'Wr_0kZiJYLbZnu2L-gzGy5mqn1o', 'id': 'Ugzgac6kFY18H1tU2gd4AaABAg', 'snippet': {'videoId': 'g9gov_I2RMI', 'textDisplay': 'Bora lá, gadaiada! Toquem a anarquia &quot;em nome de Jesus Pistoleiro&quot; pra convencerem os indecisos.', 'textOriginal': 'Bora lá, gadaiada! Toquem a anarquia ""em nome de Jesus Pistoleiro"" pra convencerem os indecisos.', 'authorDisplayName': 'Al', 'authorProfileImageUrl': 'https://yt3.ggpht.com/ytc/AGIKgqN19LDMmVNIXLV7HitZpAqGCPwBLwlFV4Pi9vVDJtFc-Wp7rsX_Ybbk88bx74sk4w=s48-c-k-c0x00ffffff-no-rj', 'authorChannelUrl': 'http://www.youtube.com/channel/UCNzBkKhM9lBgCke0rymWo2g', 'authorChannelId': {'value': 'UCNzBkKhM9lBgCke0rymWo2g'}, 'canRate': True, 'viewerRating': 'none', 'likeCount': 0, 'publishedAt': '2022-10-25T15:23:32Z', 'updatedAt': '2022-10-25T15:23:32Z'}}, 'canReply': True, 'totalReplyCount': 0, 'isPublic': True}",,UCNzBkKhM9lBgCke0rymWo2g,2022-10-25T15:23:32Z,"Bora lá, gadaiada! Toquem a anarquia ""em nome de Jesus Pistoleiro"" pra convencerem os indecisos.",QURTSl9pMjhYV3BxcE85V3FyTnF4aTNNMEJ2enVYeGE5RVRYbVRYVHFCUWtzSnh6eDRfQ3ZrYUxzOUlEOHk2OTRodmlidHBvVlZ1UFNRWQ==,2023-06-08 14:42:04.782387
youtube#commentThread,UR7jW-DEKuMgT4MjGsdEMuzvPaQ,Ugy79GMu6Qn77R3Arol4AaABAg,"{'videoId': 'bwqD1XWeNgQ', 'topLevelComment': {'kind': 'youtube#comment', 'etag': 'AhOZk5zWcSTBzgEfywOkbUQtayo', 'id': 'Ugy79GMu6Qn77R3Arol4AaABAg', 'snippet': {'videoId': 'bwqD1XWeNgQ', 'textDisplay': 'Ué? Cadê o Leão Conservador, ícone da honestidade bolsonarista, com qualidades morais indiscutíveis, aclamado pelo gado e pela Jovem Panos, símbolo do 7 de Setembro? <br>Virou comunista. 😅', 'textOriginal': 'Ué? Cadê o Leão Conservador, ícone da honestidade bolsonarista, com qualidades morais indiscutíveis, aclamado pelo gado e pela Jovem Panos, símbolo do 7 de Setembro? \\\\nVirou comunista. 😅', 'authorDisplayName': 'Al', 'authorProfileImageUrl': 'https://yt3.ggpht.com/ytc/AGIKgqN19LDMmVNIXLV7HitZpAqGCPwBLwlFV4Pi9vVDJtFc-Wp7rsX_Ybbk88bx74sk4w=s48-c-k-c0x00ffffff-no-rj', 'authorChannelUrl': 'http://www.youtube.com/channel/UCNzBkKhM9lBgCke0rymWo2g', 'authorChannelId': {'value': 'UCNzBkKhM9lBgCke0rymWo2g'}, 'canRate': True, 'viewerRating': 'none', 'likeCount': 0, 'publishedAt': '2022-10-25T11:17:04Z', 'updatedAt': '2022-10-25T11:17:04Z'}}, 'canReply': True, 'totalReplyCount': 0, 'isPublic': True}",,UCNzBkKhM9lBgCke0rymWo2g,2022-10-25T11:17:04Z,"Ué? Cadê o Leão Conservador, ícone da honestidade bolsonarista, com qualidades morais indiscutíveis, aclamado pelo gado e pela Jovem Panos, símbolo do 7 de Setembro? 
Virou comunista. 😅",QURTSl9pMHFESmNWa0V4bkp1cnNWcV9LR1g1bVl4YjBoWS1nbE9pSDMzdWFmblcyWk1Jay04ODJ2R2FNQjVhQnhJVzZGakx1aXJ6VkJTRQ==,2023-06-08 14:43:52.746244
youtube#commentThread,mhXlfVZahewDUwuF1FdIeSL0HeY,UgzHezSuA2Hr5aNxKoR4AaABAg,"{'videoId': 'W_jwwqPQhkE', 'topLevelComment': {'kind': 'youtube#comment', 'etag': '9Gms4zy0-LZCRmKFR_V13Qd8pJU', 'id': 'UgzHezSuA2Hr5aNxKoR4AaABAg', 'snippet': {'videoId': 'W_jwwqPQhkE', 'textDisplay': 'Agora Robério Jefferson, o Leão Conservador, empregador do Bananinha, amigo da família, símbolo máximo do patriotismo cristão bolsonarista, ícone das comemorações do 7 de Setembro, que plantou o Padre de Festa Junina para fazer dobradinha com o Mito ..... Virou comunista que não conhece o Mito 😅', 'textOriginal': 'Agora Robério Jefferson, o Leão Conservador, empregador do Bananinha, amigo da família, símbolo máximo do patriotismo cristão bolsonarista, ícone das comemorações do 7 de Setembro, que plantou o Padre de Festa Junina para fazer dobradinha com o Mito ..... Virou comunista que não conhece o Mito 😅', 'authorDisplayName': 'Al', 'authorProfileImageUrl': 'https://yt3.ggpht.com/ytc/AGIKgqN19LDMmVNIXLV7HitZpAqGCPwBLwlFV4Pi9vVDJtFc-Wp7rsX_Ybbk88bx74sk4w=s48-c-k-c0x00ffffff-no-rj', 'authorChannelUrl': 'http://www.youtube.com/channel/UCNzBkKhM9lBgCke0rymWo2g', 'authorChannelId': {'value': 'UCNzBkKhM9lBgCke0rymWo2g'}, 'canRate': True, 'viewerRating': 'none', 'likeCount': 0, 'publishedAt': '2022-10-24T21:28:46Z', 'updatedAt': '2022-10-24T21:30:30Z'}}, 'canReply': True, 'totalReplyCount': 0, 'isPublic': True}",,UCNzBkKhM9lBgCke0rymWo2g,2022-10-24T21:28:46Z,"Agora Robério Jefferson, o Leão Conservador, empregador do Bananinha, amigo da família, símbolo máximo do patriotismo cristão bolsonarista, ícone das comemorações do 7 de Setembro, que plantou o Padre de Festa Junina para fazer dobradinha com o Mito ..... Virou comunista que não conhece o Mito 😅",QURTSl9pMEI1azdFZkdhbVY1MWFEbl93ZW9DYWVCWFdqUzM1alYzdGswNXFPeE9KOHcwRWNETjk3QUpRcE5OWDlMLUlVVmh1SU5vWC1ZOA==,2023-06-08 14:45:35.077791
youtube#commentThread,FeK8UnjlTuV3hrazg6Sgu9rA7oM,Ugzp_faeCEkIfLgvHQx4AaABAg,"{'videoId': 'M6UyqJrgUqA', 'topLevelComment': {'kind': 'youtube#comment', 'etag': '9Tf3vk3g86AVwzgp4umCekdO_7E', 'id': 'Ugzp_faeCEkIfLgvHQx4AaABAg', 'snippet': {'videoId': 'M6UyqJrgUqA', 'textDisplay': 'Parabéns ao Pastor Gardenal 🙏', 'textOriginal': 'Parabéns ao Pastor Gardenal 🙏', 'authorDisplayName': 'Al', 'authorProfileImageUrl': 'https://yt3.ggpht.com/ytc/AGIKgqN19LDMmVNIXLV7HitZpAqGCPwBLwlFV4Pi9vVDJtFc-Wp7rsX_Ybbk88bx74sk4w=s48-c-k-c0x00ffffff-no-rj', 'authorChannelUrl': 'http://www.youtube.com/channel/UCNzBkKhM9lBgCke0rymWo2g', 'authorChannelId': {'value': 'UCNzBkKhM9lBgCke0rymWo2g'}, 'canRate': True, 'viewerRating': 'none', 'likeCount': 0, 'publishedAt': '2022-10-23T22:43:01Z', 'updatedAt': '2022-10-23T22:43:01Z'}}, 'canReply': True, 'totalReplyCount': 0, 'isPublic': True}",,UCNzBkKhM9lBgCke0rymWo2g,2022-10-23T22:43:01Z,Parabéns ao Pastor Gardenal 🙏,QURTSl9pMFF3QXgwOVlDYVJWMk9uc2xyMDJiTzMyU3hSWVFBNjVjZVpvRnY4XzAyWUhWLUVuSE01QVl4Y0tjUVdOQlRDdmt2bGd3aUxoOA==,2023-06-08 14:53:10.679889
youtube#commentThread,hvnttk2Tr3G490Plfq4gR48M1ng,UgxSYZk5bo7eAq1DTFN4AaABAg,"{'videoId': 'Mjg9mMrcFVk', 'topLevelComment': {'kind': 'youtube#comment', 'etag': 'YM4OO1FYtw8igqoqgNsrPVbnPbo', 'id': 'UgxSYZk5bo7eAq1DTFN4AaABAg', 'snippet': {'videoId': 'Mjg9mMrcFVk', 'textDisplay': 'Uma pena que ele já esteja no bico do corvo. Vai morrer em poucos anos na cadeia, seria mais mais divertido se passasse mais anos preso antes de retornar ao inferno.', 'textOriginal': 'Uma pena que ele já esteja no bico do corvo. Vai morrer em poucos anos na cadeia, seria mais mais divertido se passasse mais anos preso antes de retornar ao inferno.', 'authorDisplayName': 'Al', 'authorProfileImageUrl': 'https://yt3.ggpht.com/ytc/AGIKgqN19LDMmVNIXLV7HitZpAqGCPwBLwlFV4Pi9vVDJtFc-Wp7rsX_Ybbk88bx74sk4w=s48-c-k-c0x00ffffff-no-rj', 'authorChannelUrl': 'http://www.youtube.com/channel/UCNzBkKhM9lBgCke0rymWo2g', 'authorChannelId': {'value': 'UCNzBkKhM9lBgCke0rymWo2g'}, 'canRate': True, 'viewerRating': 'none', 'likeCount': 0, 'publishedAt': '2022-10-23T20:37:49Z', 'updatedAt': '2022-10-23T20:37:49Z'}}, 'canReply': True, 'totalReplyCount': 0, 'isPublic': True}",,UCNzBkKhM9lBgCke0rymWo2g,2022-10-23T20:37:49Z,"Uma pena que ele já esteja no bico do corvo. Vai morrer em poucos anos na cadeia, seria mais mais divertido se passasse mais anos preso antes de retornar ao inferno.",QURTSl9pMWFGOFpKanptZnh0X21nMUJUclNsSWdDU3BtQjVodS1qbXJpNUliSXpIeFN1V01RSUg2LXpXbHpwelJ4anZ2QTJWSFVlMUVFZw==,2023-06-08 14:55:46.840322
youtube#commentThread,T7qbNy_nY2-u3JiZ1qab8wbI0pQ,UgwNd9k1XZjmkvXuXCJ4AaABAg,"{'videoId': 'hSqysLm1yx0', 'topLevelComment': {'kind': 'youtube#comment', 'etag': 'PQhwq-yxMtEcdWcpYZd-WjUspJw', 'id': 'UgwNd9k1XZjmkvXuXCJ4AaABAg', 'snippet': {'videoId': 'hSqysLm1yx0', 'textDisplay': 'Lendo os comentários fica claro:<br>Bolsonarismo não é direita, não é esquerda, é apenas uma doença.', 'textOriginal': 'Lendo os comentários fica claro:\\\\nBolsonarismo não é direita, não é esquerda, é apenas uma doença.', 'authorDisplayName': 'Al', 'authorProfileImageUrl': 'https://yt3.ggpht.com/ytc/AGIKgqN19LDMmVNIXLV7HitZpAqGCPwBLwlFV4Pi9vVDJtFc-Wp7rsX_Ybbk88bx74sk4w=s48-c-k-c0x00ffffff-no-rj', 'authorChannelUrl': 'http://www.youtube.com/channel/UCNzBkKhM9lBgCke0rymWo2g', 'authorChannelId': {'value': 'UCNzBkKhM9lBgCke0rymWo2g'}, 'canRate': True, 'viewerRating': 'none', 'likeCount': 0, 'publishedAt': '2022-10-23T18:13:47Z', 'updatedAt': '2022-10-23T18:13:56Z'}}, 'canReply': True, 'totalReplyCount': 0, 'isPublic': True}",,UCNzBkKhM9lBgCke0rymWo2g,2022-10-23T18:13:47Z,"Lendo os comentários fica claro:
Bolsonarismo não é direita, não é esquerda, é apenas uma doença.",QURTSl9pMGQ5bWFJSkl2aTN6V0V4a25Pa2RmbGpTXzAxNE9SdDl3bXJ5SnI2a1lnN3RkNDFUVzdWSVJVTGRpX3hRUUpnRXBBZW1GMWJIdWc=,2023-06-08 15:01:00.739190
youtube#commentThread,12vwKotpl8iSXBKqplTX1GeVfXg,UgxaMX519LNFRLPEauh4AaABAg,"{'videoId': 'RzWYnn_liHk', 'topLevelComment': {'kind': 'youtube#comment', 'etag': 'cnahoRNHanQ8WquUxNUPYnNO6RQ', 'id': 'UgxaMX519LNFRLPEauh4AaABAg', 'snippet': {'videoId': 'RzWYnn_liHk', 'textDisplay': '😅😅😅. Pode confiar, é maquiador Paulo Guedes falando. Acertou quase 0,5% do que já afirmou.', 'textOriginal': '😅😅😅. Pode confiar, é maquiador Paulo Guedes falando. Acertou quase 0,5% do que já afirmou.', 'authorDisplayName': 'Al', 'authorProfileImageUrl': 'https://yt3.ggpht.com/ytc/AGIKgqN19LDMmVNIXLV7HitZpAqGCPwBLwlFV4Pi9vVDJtFc-Wp7rsX_Ybbk88bx74sk4w=s48-c-k-c0x00ffffff-no-rj', 'authorChannelUrl': 'http://www.youtube.com/channel/UCNzBkKhM9lBgCke0rymWo2g', 'authorChannelId': {'value': 'UCNzBkKhM9lBgCke0rymWo2g'}, 'canRate': True, 'viewerRating': 'none', 'likeCount': 7, 'publishedAt': '2022-10-21T10:47:58Z', 'updatedAt': '2022-10-21T10:47:58Z'}}, 'canReply': True, 'totalReplyCount': 0, 'isPublic': True}",,UCNzBkKhM9lBgCke0rymWo2g,2022-10-21T10:47:58Z,"😅😅😅. Pode confiar, é maquiador Paulo Guedes falando. Acertou quase 0,5% do que já afirmou.",,2023-06-08 15:18:42.465435
