kind,etag,id,snippet,replies,authorChannelId,publishedAt,textOriginal,nextPageToken,extraction_date
youtube#commentThread,Nbj2tom4H4SjZtth1ZYmNuoUm04,UgyzsNDA9TCj6E1-ijJ4AaABAg,"{'videoId': 'lrofIurxdTY', 'topLevelComment': {'kind': 'youtube#comment', 'etag': 'Bay7JZnpt7Pl13bAvXZitrDVMKA', 'id': 'UgyzsNDA9TCj6E1-ijJ4AaABAg', 'snippet': {'videoId': 'lrofIurxdTY', 'textDisplay': 'Esse senhor se esforça para ajudar a Russia e pro Russo 200%', 'textOriginal': 'Esse senhor se esforça para ajudar a Russia e pro Russo 200%', 'authorDisplayName': 'Matfaycal', 'authorProfileImageUrl': 'https://yt3.ggpht.com/ytc/AGIKgqNLTfYucS0xek446eIojidqlcIIFNNlQgC1RgytMCdcdMrn3-IBn0BvRRUaQZ19=s48-c-k-c0x00ffffff-no-rj', 'authorChannelUrl': 'http://www.youtube.com/channel/UCdN5pcLZ3v5AbyHPIeBX48g', 'authorChannelId': {'value': 'UCdN5pcLZ3v5AbyHPIeBX48g'}, 'canRate': True, 'viewerRating': 'none', 'likeCount': 8, 'publishedAt': '2022-10-13T11:06:24Z', 'updatedAt': '2022-10-13T11:06:24Z'}}, 'canReply': True, 'totalReplyCount': 2, 'isPublic': True}","{'comments': [{'kind': 'youtube#comment', 'etag': 'JMHoAKiK7YDi7SpefjgaWWWDFZo', 'id': 'UgyzsNDA9TCj6E1-ijJ4AaABAg.9h7CsT7Moa79h7Vcua_bDc', 'snippet': {'videoId': 'lrofIurxdTY', 'textDisplay': '<a href=""https://www.youtube.com/watch?v=zuQLG2LPRh8"">https://www.youtube.com/watch?v=zuQLG2LPRh8</a>', 'textOriginal': 'https://www.youtube.com/watch?v=zuQLG2LPRh8', 'parentId': 'UgyzsNDA9TCj6E1-ijJ4AaABAg', 'authorDisplayName': '** Sergius Septmus Severus', 'authorProfileImageUrl': 'https://yt3.ggpht.com/3p-ZI6OsjjdafU28cwkBf7MJAthg8bnDowhnT04NoDsCFo08cdGAH9bYUyTq8uzLEoYUfJ_6tA=s48-c-k-c0x00ffffff-no-rj', 'authorChannelUrl': 'http://www.youtube.com/channel/UCyyNwyZ8eWANQHbnM1JrGFg', 'authorChannelId': {'value': 'UCyyNwyZ8eWANQHbnM1JrGFg'}, 'canRate': True, 'viewerRating': 'none', 'likeCount': 0, 'publishedAt': '2022-10-13T13:50:18Z', 'updatedAt': '2022-10-13T13:50:18Z'}}, {'kind': 'youtube#comment', 'etag': 'dCnl5EjMrSMXEU634CSY6nU-b_M', 'id': 'UgyzsNDA9TCj6E1-ijJ4AaABAg.9h7CsT7Moa79h7Lts4y2x1', 'snippet': {'videoId': 'lrofIurxdTY', 'textDisplay': 'Verdade. Em outros assuntos eu concordo com ele. Mas nesse, eu discordo bastante.', 'textOriginal': 'Verdade. Em outros assuntos eu concordo com ele. Mas nesse, eu discordo bastante.', 'parentId': 'UgyzsNDA9TCj6E1-ijJ4AaABAg', 'authorDisplayName': 'Edivan Oliveira Barbosa', 'authorProfileImageUrl': 'https://yt3.ggpht.com/ytc/AGIKgqOzdYxv30thi_skCsCPx3DiSuu70qI1pQAOxw=s48-c-k-c0x00ffffff-no-rj', 'authorChannelUrl': 'http://www.youtube.com/channel/UCaQKMnKIR-c8kiSVR_TSPEA', 'authorChannelId': {'value': 'UCaQKMnKIR-c8kiSVR_TSPEA'}, 'canRate': True, 'viewerRating': 'none', 'likeCount': 2, 'publishedAt': '2022-10-13T12:25:14Z', 'updatedAt': '2022-10-13T12:25:14Z'}}]}",UCdN5pcLZ3v5AbyHPIeBX48g,2022-10-13T11:06:24Z,Esse senhor se esforça para ajudar a Russia e pro Russo 200%,,2023-06-08 18:11:58.892131
youtube#commentThread,nuiv5LrlFw-euSzR759PoP-rVY8,Ugxtt9vwhSUKEH6dSaN4AaABAg,"{'videoId': 'lrofIurxdTY', 'topLevelComment': {'kind': 'youtube#comment', 'etag': '626nOSdC0PbCh1mh28b6I8F9HXs', 'id': 'Ugxtt9vwhSUKEH6dSaN4AaABAg', 'snippet': {'videoId': 'lrofIurxdTY', 'textDisplay': 'Ja viram o Raio x do camiao com explosivos que Russia colocou na comunicacao ?  Falta rodas no camiao  do raiox nao é o mesmo  do camiao que explodiu tem mais rodas agora tirem as conclusoes que quiserem', 'textOriginal': 'Ja viram o Raio x do camiao com explosivos que Russia colocou na comunicacao ?  Falta rodas no camiao  do raiox nao é o mesmo  do camiao que explodiu tem mais rodas agora tirem as conclusoes que quiserem', 'authorDisplayName': 'Matfaycal', 'authorProfileImageUrl': 'https://yt3.ggpht.com/ytc/AGIKgqNLTfYucS0xek446eIojidqlcIIFNNlQgC1RgytMCdcdMrn3-IBn0BvRRUaQZ19=s48-c-k-c0x00ffffff-no-rj', 'authorChannelUrl': 'http://www.youtube.com/channel/UCdN5pcLZ3v5AbyHPIeBX48g', 'authorChannelId': {'value': 'UCdN5pcLZ3v5AbyHPIeBX48g'}, 'canRate': True, 'viewerRating': 'none', 'likeCount': 0, 'publishedAt': '2022-10-13T11:05:34Z', 'updatedAt': '2022-10-13T11:05:34Z'}}, 'canReply': True, 'totalReplyCount': 0, 'isPublic': True}",,UCdN5pcLZ3v5AbyHPIeBX48g,2022-10-13T11:05:34Z,Ja viram o Raio x do camiao com explosivos que Russia colocou na comunicacao ?  Falta rodas no camiao  do raiox nao é o mesmo  do camiao que explodiu tem mais rodas agora tirem as conclusoes que quiserem,,2023-06-08 18:11:58.892131
youtube#commentThread,SgMLf9tqc83xNUwYs85IohwoT3s,UgyzWEi7qFAFUSOEOuZ4AaABAg,"{'videoId': 'Px9su_KANXQ', 'topLevelComment': {'kind': 'youtube#comment', 'etag': 'DY9jSSVcvVEYuLe6qnxc_wNfioU', 'id': 'UgyzWEi7qFAFUSOEOuZ4AaABAg', 'snippet': {'videoId': 'Px9su_KANXQ', 'textDisplay': 'Direitos humanos existe na venuzuela?? Kkkk assim como na Russia devia ser expulsa da ONU  violou  todas as leis da ONU  que esta la fazendo se nao respeita???', 'textOriginal': 'Direitos humanos existe na venuzuela?? Kkkk assim como na Russia devia ser expulsa da ONU  violou  todas as leis da ONU  que esta la fazendo se nao respeita???', 'authorDisplayName': 'Matfaycal', 'authorProfileImageUrl': 'https://yt3.ggpht.com/ytc/AGIKgqNLTfYucS0xek446eIojidqlcIIFNNlQgC1RgytMCdcdMrn3-IBn0BvRRUaQZ19=s48-c-k-c0x00ffffff-no-rj', 'authorChannelUrl': 'http://www.youtube.com/channel/UCdN5pcLZ3v5AbyHPIeBX48g', 'authorChannelId': {'value': 'UCdN5pcLZ3v5AbyHPIeBX48g'}, 'canRate': True, 'viewerRating': 'none', 'likeCount': 0, 'publishedAt': '2022-10-13T09:24:42Z', 'updatedAt': '2022-10-13T09:24:42Z'}}, 'canReply': True, 'totalReplyCount': 0, 'isPublic': True}",,UCdN5pcLZ3v5AbyHPIeBX48g,2022-10-13T09:24:42Z,Direitos humanos existe na venuzuela?? Kkkk assim como na Russia devia ser expulsa da ONU  violou  todas as leis da ONU  que esta la fazendo se nao respeita???,QURTSl9pMTQ0a1pVSExYSGVfVU96QnJYVGZGY0lPLTNMWUFKSmFjU01xcWdkdU14Q2lGMDNLTXhnb1V2ZW95Y2R3c0g2Ml96cHNLTE55aw==,2023-06-08 18:13:27.395389
youtube#commentThread,cowckwVPcTb9-UIBtQmMAtdf_c0,UgwkCAmkTF6KuqewBiV4AaABAg,"{'videoId': 'VyrT9knHnW4', 'topLevelComment': {'kind': 'youtube#comment', 'etag': 'D_F4SCLhupD2JnH254KMrsCrHHk', 'id': 'UgwkCAmkTF6KuqewBiV4AaABAg', 'snippet': {'videoId': 'VyrT9knHnW4', 'textDisplay': '8 pessoas esqueceu de dizer que 6 sao Russos kkk as vezes os pequenos promenores faz muita diferença', 'textOriginal': '8 pessoas esqueceu de dizer que 6 sao Russos kkk as vezes os pequenos promenores faz muita diferença', 'authorDisplayName': 'Matfaycal', 'authorProfileImageUrl': 'https://yt3.ggpht.com/ytc/AGIKgqNLTfYucS0xek446eIojidqlcIIFNNlQgC1RgytMCdcdMrn3-IBn0BvRRUaQZ19=s48-c-k-c0x00ffffff-no-rj', 'authorChannelUrl': 'http://www.youtube.com/channel/UCdN5pcLZ3v5AbyHPIeBX48g', 'authorChannelId': {'value': 'UCdN5pcLZ3v5AbyHPIeBX48g'}, 'canRate': True, 'viewerRating': 'none', 'likeCount': 0, 'publishedAt': '2022-10-12T17:32:09Z', 'updatedAt': '2022-10-12T17:32:09Z'}}, 'canReply': True, 'totalReplyCount': 0, 'isPublic': True}",,UCdN5pcLZ3v5AbyHPIeBX48g,2022-10-12T17:32:09Z,8 pessoas esqueceu de dizer que 6 sao Russos kkk as vezes os pequenos promenores faz muita diferença,QURTSl9pM0IzQXZqTkJRME9nYXp2QkFVb2RaaXpIV0JhaTczcW4zUEpIT0ZlSVJFdGtESFFKVDBUUG1nWUFFUHlRdG9JbGctRUI1UXRpWQ==,2023-06-08 18:13:41.733098
youtube#commentThread,QsLztSEpqSS3CGnr7PiAW8PmMGk,Ugy_jmu9XWILU3LEscR4AaABAg,"{'videoId': 'jPWw-pEaJSQ', 'topLevelComment': {'kind': 'youtube#comment', 'etag': 'wNwPR3MET6GbkOud2AcPzh_gyx4', 'id': 'Ugy_jmu9XWILU3LEscR4AaABAg', 'snippet': {'videoId': 'jPWw-pEaJSQ', 'textDisplay': 'Espero que entendam portunhol  e encontrem as urnas parece que Bolsonaro esqueceu de falar a lingua que ensinamos ao Brasil  os 270 mil Brasileiros que estao em portugal entendem perfeitamente 🤣', 'textOriginal': 'Espero que entendam portunhol  e encontrem as urnas parece que Bolsonaro esqueceu de falar a lingua que ensinamos ao Brasil  os 270 mil Brasileiros que estao em portugal entendem perfeitamente 🤣', 'authorDisplayName': 'Matfaycal', 'authorProfileImageUrl': 'https://yt3.ggpht.com/ytc/AGIKgqNLTfYucS0xek446eIojidqlcIIFNNlQgC1RgytMCdcdMrn3-IBn0BvRRUaQZ19=s48-c-k-c0x00ffffff-no-rj', 'authorChannelUrl': 'http://www.youtube.com/channel/UCdN5pcLZ3v5AbyHPIeBX48g', 'authorChannelId': {'value': 'UCdN5pcLZ3v5AbyHPIeBX48g'}, 'canRate': True, 'viewerRating': 'none', 'likeCount': 5, 'publishedAt': '2022-10-30T11:38:51Z', 'updatedAt': '2022-10-30T11:39:46Z'}}, 'canReply': True, 'totalReplyCount': 0, 'isPublic': True}",,UCdN5pcLZ3v5AbyHPIeBX48g,2022-10-30T11:38:51Z,Espero que entendam portunhol  e encontrem as urnas parece que Bolsonaro esqueceu de falar a lingua que ensinamos ao Brasil  os 270 mil Brasileiros que estao em portugal entendem perfeitamente 🤣,QURTSl9pME1TVU5ILTJZT0hFeEszZEYydjFVVDBQSUNLLUxkSW01XzFPTm0zd0NOeFNUN1QzN1dUZnU1anF2UEI2MVpkZDE4SEJpMWZORQ==,2023-06-08 14:14:01.734322
youtube#commentThread,ztnaFyfDxrXhjFDpPOmmQVTT5wo,Ugw19VHXEBynTXbNQAd4AaABAg,"{'videoId': 'ybVvaF9QMpk', 'topLevelComment': {'kind': 'youtube#comment', 'etag': 'Jh1N_oNz2ZrRgPYqpeooUazz86E', 'id': 'Ugw19VHXEBynTXbNQAd4AaABAg', 'snippet': {'videoId': 'ybVvaF9QMpk', 'textDisplay': 'Kkk a ONU tem 196 países tem de informar isso corretamente voce tem 5 países autocratas apoiando Russia os outros 191 que nao apoiam sao todos do OCIDENTE? Kkk isso e informacao ou desinformaçao?', 'textOriginal': 'Kkk a ONU tem 196 países tem de informar isso corretamente voce tem 5 países autocratas apoiando Russia os outros 191 que nao apoiam sao todos do OCIDENTE? Kkk isso e informacao ou desinformaçao?', 'authorDisplayName': 'Matfaycal', 'authorProfileImageUrl': 'https://yt3.ggpht.com/ytc/AGIKgqNLTfYucS0xek446eIojidqlcIIFNNlQgC1RgytMCdcdMrn3-IBn0BvRRUaQZ19=s48-c-k-c0x00ffffff-no-rj', 'authorChannelUrl': 'http://www.youtube.com/channel/UCdN5pcLZ3v5AbyHPIeBX48g', 'authorChannelId': {'value': 'UCdN5pcLZ3v5AbyHPIeBX48g'}, 'canRate': True, 'viewerRating': 'none', 'likeCount': 0, 'publishedAt': '2022-10-11T17:35:20Z', 'updatedAt': '2022-10-11T17:35:20Z'}}, 'canReply': True, 'totalReplyCount': 0, 'isPublic': True}",,UCdN5pcLZ3v5AbyHPIeBX48g,2022-10-11T17:35:20Z,Kkk a ONU tem 196 países tem de informar isso corretamente voce tem 5 países autocratas apoiando Russia os outros 191 que nao apoiam sao todos do OCIDENTE? Kkk isso e informacao ou desinformaçao?,,2023-06-08 18:17:11.394367
youtube#commentThread,XflVBsXMrkT7kCg-XqZsjJJhSoU,UgySOyI26KI4KPaakbd4AaABAg,"{'videoId': 'ybVvaF9QMpk', 'topLevelComment': {'kind': 'youtube#comment', 'etag': '7tmW7LPAMa3C_Et2FaTAb2zDfMY', 'id': 'UgySOyI26KI4KPaakbd4AaABAg', 'snippet': {'videoId': 'ybVvaF9QMpk', 'textDisplay': 'Kkkk para tratar anexacao da Russia ? Essa foi a piada  do ano !!🤣 nao vai haver anexacao nenhuma', 'textOriginal': 'Kkkk para tratar anexacao da Russia ? Essa foi a piada  do ano !!🤣 nao vai haver anexacao nenhuma', 'authorDisplayName': 'Matfaycal', 'authorProfileImageUrl': 'https://yt3.ggpht.com/ytc/AGIKgqNLTfYucS0xek446eIojidqlcIIFNNlQgC1RgytMCdcdMrn3-IBn0BvRRUaQZ19=s48-c-k-c0x00ffffff-no-rj', 'authorChannelUrl': 'http://www.youtube.com/channel/UCdN5pcLZ3v5AbyHPIeBX48g', 'authorChannelId': {'value': 'UCdN5pcLZ3v5AbyHPIeBX48g'}, 'canRate': True, 'viewerRating': 'none', 'likeCount': 8, 'publishedAt': '2022-10-11T17:27:33Z', 'updatedAt': '2022-10-11T17:27:33Z'}}, 'canReply': True, 'totalReplyCount': 2, 'isPublic': True}","{'comments': [{'kind': 'youtube#comment', 'etag': 'jMbKegDlFksCeVrX6TAS2yurvqA', 'id': 'UgySOyI26KI4KPaakbd4AaABAg.9h2juKXHMeg9h2lwN7GRle', 'snippet': {'videoId': 'ybVvaF9QMpk', 'textDisplay': 'Quem te garante? A Rússia tá provando q não teme Otan/EUA. A melhor saída seria diplomática, mas os EUA, acha que a Rússia é o Iraque. Deu um tiro no pé. Vamos aguardar.', 'textOriginal': 'Quem te garante? A Rússia tá provando q não teme Otan/EUA. A melhor saída seria diplomática, mas os EUA, acha que a Rússia é o Iraque. Deu um tiro no pé. Vamos aguardar.', 'parentId': 'UgySOyI26KI4KPaakbd4AaABAg', 'authorDisplayName': 'Janio Mangeth', 'authorProfileImageUrl': 'https://yt3.ggpht.com/ytc/AGIKgqPXZkrjIgM6esmLRvBK6aFUo-rGE6A9kKclmoN4e3XrKMAIqFLdM7ALlJo4X9yj=s48-c-k-c0x00ffffff-no-rj', 'authorChannelUrl': 'http://www.youtube.com/channel/UCoq98xAo0XusMHpmVECxk7A', 'authorChannelId': {'value': 'UCoq98xAo0XusMHpmVECxk7A'}, 'canRate': True, 'viewerRating': 'none', 'likeCount': 0, 'publishedAt': '2022-10-11T17:45:19Z', 'updatedAt': '2022-10-11T17:45:19Z'}}, {'kind': 'youtube#comment', 'etag': 'WPt03xJNXiCeXrXmLyX8dOt8Uz0', 'id': 'UgySOyI26KI4KPaakbd4AaABAg.9h2juKXHMeg9h2ldsrfxct', 'snippet': {'videoId': 'ybVvaF9QMpk', 'textDisplay': '@Dr Manuel Sardinha dizer que vai anexar algo que não é seu ? Estão fazendo apenas cenas, afinal se fizerem qualquer ação terá uma guerra nuclear tendo 159 países destruídos em algumas horas, usando apenas armamento nuclear dos EUA e Rússia', 'textOriginal': '@Dr Manuel Sardinha dizer que vai anexar algo que não é seu ? Estão fazendo apenas cenas, afinal se fizerem qualquer ação terá uma guerra nuclear tendo 159 países destruídos em algumas horas, usando apenas armamento nuclear dos EUA e Rússia', 'parentId': 'UgySOyI26KI4KPaakbd4AaABAg', 'authorDisplayName': 'Viral Do Short', 'authorProfileImageUrl': 'https://yt3.ggpht.com/EmHIAncMrs15NMxlg5uu-8lR8QSv2U6U1X_xzgIDlg8z-8Im9lHWHTq5Xwdt-7PFElCH4S6g=s48-c-k-c0x00ffffff-no-rj', 'authorChannelUrl': 'http://www.youtube.com/channel/UCVdsW3E_8Y-x4_EOL_gUpEg', 'authorChannelId': {'value': 'UCVdsW3E_8Y-x4_EOL_gUpEg'}, 'canRate': True, 'viewerRating': 'none', 'likeCount': 0, 'publishedAt': '2022-10-11T17:42:47Z', 'updatedAt': '2022-10-11T17:42:47Z'}}]}",UCdN5pcLZ3v5AbyHPIeBX48g,2022-10-11T17:27:33Z,Kkkk para tratar anexacao da Russia ? Essa foi a piada  do ano !!🤣 nao vai haver anexacao nenhuma,,2023-06-08 18:17:11.394367
youtube#commentThread,U14kGau8jsm5i0iL-uscgGeyLc4,Ugyux4TrGiP8iG-9Dd54AaABAg,"{'videoId': 'l9X12oPxZEY', 'topLevelComment': {'kind': 'youtube#comment', 'etag': 'Evhxi8SpsfIVjNlUXQ8cc73Y7D0', 'id': 'Ugyux4TrGiP8iG-9Dd54AaABAg', 'snippet': {'videoId': 'l9X12oPxZEY', 'textDisplay': 'Lembro que ONU tem 196 países  esse senhor falou em 3 ou 4 países a  favor da anexacao', 'textOriginal': 'Lembro que ONU tem 196 países  esse senhor falou em 3 ou 4 países a  favor da anexacao', 'authorDisplayName': 'Matfaycal', 'authorProfileImageUrl': 'https://yt3.ggpht.com/ytc/AGIKgqNLTfYucS0xek446eIojidqlcIIFNNlQgC1RgytMCdcdMrn3-IBn0BvRRUaQZ19=s48-c-k-c0x00ffffff-no-rj', 'authorChannelUrl': 'http://www.youtube.com/channel/UCdN5pcLZ3v5AbyHPIeBX48g', 'authorChannelId': {'value': 'UCdN5pcLZ3v5AbyHPIeBX48g'}, 'canRate': True, 'viewerRating': 'none', 'likeCount': 0, 'publishedAt': '2022-10-11T20:31:57Z', 'updatedAt': '2022-10-11T20:31:57Z'}}, 'canReply': True, 'totalReplyCount': 0, 'isPublic': True}",,UCdN5pcLZ3v5AbyHPIeBX48g,2022-10-11T20:31:57Z,Lembro que ONU tem 196 países  esse senhor falou em 3 ou 4 países a  favor da anexacao,QURTSl9pMmE1RWlRb05nM2d0dkRaZjA0N0MtZzNVR3JOV3Rwd3dZcnNydzBTVVNtaHBVZm9LYmNKZHJjMTJEOEg2d3hGcU54SzVCSDNQQQ==,2023-06-08 18:17:58.993512
youtube#commentThread,o1U6EZ8JROP0jineBi14KFRqtWg,UgwQLo2Mk1KdxxoHUqF4AaABAg,"{'videoId': 'l9X12oPxZEY', 'topLevelComment': {'kind': 'youtube#comment', 'etag': 'hLGyq2LOJhrtV8RRMrIsy1XZjTA', 'id': 'UgwQLo2Mk1KdxxoHUqF4AaABAg', 'snippet': {'videoId': 'l9X12oPxZEY', 'textDisplay': 'Kkk esse senhor fala sempre nos Ocidentais  nao fala que a china e contra a anexacao   kazaquistao  que sao aliados da Russia  azerbeijao  e outras dezenas que nao fazem parte do OCIDENTE  Australia  japao  ..enfim secalhar  temos globos diferentes 100 países da ONU  nao aceitam essa anexacao pega aí no mapa e conta quantos países te o OCIDENTE  ve se aprende alguma coisa', 'textOriginal': 'Kkk esse senhor fala sempre nos Ocidentais  nao fala que a china e contra a anexacao   kazaquistao  que sao aliados da Russia  azerbeijao  e outras dezenas que nao fazem parte do OCIDENTE  Australia  japao  ..enfim secalhar  temos globos diferentes 100 países da ONU  nao aceitam essa anexacao pega aí no mapa e conta quantos países te o OCIDENTE  ve se aprende alguma coisa', 'authorDisplayName': 'Matfaycal', 'authorProfileImageUrl': 'https://yt3.ggpht.com/ytc/AGIKgqNLTfYucS0xek446eIojidqlcIIFNNlQgC1RgytMCdcdMrn3-IBn0BvRRUaQZ19=s48-c-k-c0x00ffffff-no-rj', 'authorChannelUrl': 'http://www.youtube.com/channel/UCdN5pcLZ3v5AbyHPIeBX48g', 'authorChannelId': {'value': 'UCdN5pcLZ3v5AbyHPIeBX48g'}, 'canRate': True, 'viewerRating': 'none', 'likeCount': 0, 'publishedAt': '2022-10-11T20:28:45Z', 'updatedAt': '2022-10-11T20:28:45Z'}}, 'canReply': True, 'totalReplyCount': 0, 'isPublic': True}",,UCdN5pcLZ3v5AbyHPIeBX48g,2022-10-11T20:28:45Z,Kkk esse senhor fala sempre nos Ocidentais  nao fala que a china e contra a anexacao   kazaquistao  que sao aliados da Russia  azerbeijao  e outras dezenas que nao fazem parte do OCIDENTE  Australia  japao  ..enfim secalhar  temos globos diferentes 100 países da ONU  nao aceitam essa anexacao pega aí no mapa e conta quantos países te o OCIDENTE  ve se aprende alguma coisa,QURTSl9pMmE1RWlRb05nM2d0dkRaZjA0N0MtZzNVR3JOV3Rwd3dZcnNydzBTVVNtaHBVZm9LYmNKZHJjMTJEOEg2d3hGcU54SzVCSDNQQQ==,2023-06-08 18:17:58.993512
youtube#commentThread,82nXr0eFFaBSRsCmnIwdHbzFuNM,Ugy6QsIxr7NdOs5FfOd4AaABAg,"{'videoId': 'BBaaNb2TC6E', 'topLevelComment': {'kind': 'youtube#comment', 'etag': 'mBeODmxHKRru-_Zk5-0KLi-CF9s', 'id': 'Ugy6QsIxr7NdOs5FfOd4AaABAg', 'snippet': {'videoId': 'BBaaNb2TC6E', 'textDisplay': 'Esse senhor tem.provas que OTAN  tem tropas no terreno ou e so propaganda?', 'textOriginal': 'Esse senhor tem.provas que OTAN  tem tropas no terreno ou e so propaganda?', 'authorDisplayName': 'Matfaycal', 'authorProfileImageUrl': 'https://yt3.ggpht.com/ytc/AGIKgqNLTfYucS0xek446eIojidqlcIIFNNlQgC1RgytMCdcdMrn3-IBn0BvRRUaQZ19=s48-c-k-c0x00ffffff-no-rj', 'authorChannelUrl': 'http://www.youtube.com/channel/UCdN5pcLZ3v5AbyHPIeBX48g', 'authorChannelId': {'value': 'UCdN5pcLZ3v5AbyHPIeBX48g'}, 'canRate': True, 'viewerRating': 'none', 'likeCount': 0, 'publishedAt': '2022-10-11T05:21:09Z', 'updatedAt': '2022-10-11T05:21:09Z'}}, 'canReply': True, 'totalReplyCount': 0, 'isPublic': True}",,UCdN5pcLZ3v5AbyHPIeBX48g,2022-10-11T05:21:09Z,Esse senhor tem.provas que OTAN  tem tropas no terreno ou e so propaganda?,,2023-06-08 18:18:46.027539
youtube#commentThread,NFPKIQxvKHfGA3mjsHYuo-Yzjkg,UgyfZNLyTWcZ9vcE9Kh4AaABAg,"{'videoId': 'BBaaNb2TC6E', 'topLevelComment': {'kind': 'youtube#comment', 'etag': 'clkBioGTVaMlL0LNFkZxue6cpPE', 'id': 'UgyfZNLyTWcZ9vcE9Kh4AaABAg', 'snippet': {'videoId': 'BBaaNb2TC6E', 'textDisplay': 'Kkk nao atacavam alvos civis ??? Hospitais escolas sao alvos militares ?? Parece mais Russia pam  nao jovem pam', 'textOriginal': 'Kkk nao atacavam alvos civis ??? Hospitais escolas sao alvos militares ?? Parece mais Russia pam  nao jovem pam', 'authorDisplayName': 'Matfaycal', 'authorProfileImageUrl': 'https://yt3.ggpht.com/ytc/AGIKgqNLTfYucS0xek446eIojidqlcIIFNNlQgC1RgytMCdcdMrn3-IBn0BvRRUaQZ19=s48-c-k-c0x00ffffff-no-rj', 'authorChannelUrl': 'http://www.youtube.com/channel/UCdN5pcLZ3v5AbyHPIeBX48g', 'authorChannelId': {'value': 'UCdN5pcLZ3v5AbyHPIeBX48g'}, 'canRate': True, 'viewerRating': 'none', 'likeCount': 5, 'publishedAt': '2022-10-11T05:19:45Z', 'updatedAt': '2022-10-11T05:19:45Z'}}, 'canReply': True, 'totalReplyCount': 2, 'isPublic': True}","{'comments': [{'kind': 'youtube#comment', 'etag': 'sf_DoWwjzL9ATBXLW00ZiWd18Zs', 'id': 'UgyfZNLyTWcZ9vcE9Kh4AaABAg.9h1Rbmb-DfU9h1zr7o952R', 'snippet': {'videoId': 'BBaaNb2TC6E', 'textDisplay': '@Muleque Busines quem falou isso para vc foi putin? Russia falou que nunca ataca civil agora vc pode confirmar que eles mentem assim como as valas humanas que estao aperecendo nas zonas libertadas pela ucrania a ONU  tem investigadores la nao pode dizer que e falso', 'textOriginal': '@Muleque Busines quem falou isso para vc foi putin? Russia falou que nunca ataca civil agora vc pode confirmar que eles mentem assim como as valas humanas que estao aperecendo nas zonas libertadas pela ucrania a ONU  tem investigadores la nao pode dizer que e falso', 'parentId': 'UgyfZNLyTWcZ9vcE9Kh4AaABAg', 'authorDisplayName': 'Matfaycal', 'authorProfileImageUrl': 'https://yt3.ggpht.com/ytc/AGIKgqNLTfYucS0xek446eIojidqlcIIFNNlQgC1RgytMCdcdMrn3-IBn0BvRRUaQZ19=s48-c-k-c0x00ffffff-no-rj', 'authorChannelUrl': 'http://www.youtube.com/channel/UCdN5pcLZ3v5AbyHPIeBX48g', 'authorChannelId': {'value': 'UCdN5pcLZ3v5AbyHPIeBX48g'}, 'canRate': True, 'viewerRating': 'none', 'likeCount': 0, 'publishedAt': '2022-10-11T10:27:41Z', 'updatedAt': '2022-10-11T10:27:41Z'}}, {'kind': 'youtube#comment', 'etag': 'q5d6H7zYg1dnvU6uCFEPlERrMlw', 'id': 'UgyfZNLyTWcZ9vcE9Kh4AaABAg.9h1Rbmb-DfU9h1zLBHIVHT', 'snippet': {'videoId': 'BBaaNb2TC6E', 'textDisplay': 'Vc acha que eles não estavam usando os civis como escudo ? Todos esses lugares tinhas postos de comando,, achando que tinha alguma proteção ! Só que não', 'textOriginal': 'Vc acha que eles não estavam usando os civis como escudo ? Todos esses lugares tinhas postos de comando,, achando que tinha alguma proteção ! Só que não', 'parentId': 'UgyfZNLyTWcZ9vcE9Kh4AaABAg', 'authorDisplayName': 'Muleque Busines', 'authorProfileImageUrl': 'https://yt3.ggpht.com/diqgoiUiJ-zNnfQlwEEY_vQcMAm7Q2ARlXCNlUpv9uQ-HJtJ1DfkxiAw15gdyLDucYoHg4wr-A=s48-c-k-c0x00ffffff-no-rj', 'authorChannelUrl': 'http://www.youtube.com/channel/UCTz1BRQGpvqr7l812jgF7-g', 'authorChannelId': {'value': 'UCTz1BRQGpvqr7l812jgF7-g'}, 'canRate': True, 'viewerRating': 'none', 'likeCount': 0, 'publishedAt': '2022-10-11T10:23:11Z', 'updatedAt': '2022-10-11T10:23:11Z'}}]}",UCdN5pcLZ3v5AbyHPIeBX48g,2022-10-11T05:19:45Z,Kkk nao atacavam alvos civis ??? Hospitais escolas sao alvos militares ?? Parece mais Russia pam  nao jovem pam,,2023-06-08 18:18:46.027539
youtube#commentThread,e3iagwYRMLomyvKLwCK11ATRR2s,Ugz2RlZF1AhsowKn0Hl4AaABAg,"{'videoId': 'BBaaNb2TC6E', 'topLevelComment': {'kind': 'youtube#comment', 'etag': 'vPhvhxwkytNxVjPMkwXgGzLg-hg', 'id': 'Ugz2RlZF1AhsowKn0Hl4AaABAg', 'snippet': {'videoId': 'BBaaNb2TC6E', 'textDisplay': 'Atacar infraestruturas ou civis sao crimes de guerra ainda bem que nimguem tem duvida que os misseis sao Russos', 'textOriginal': 'Atacar infraestruturas ou civis sao crimes de guerra ainda bem que nimguem tem duvida que os misseis sao Russos', 'authorDisplayName': 'Matfaycal', 'authorProfileImageUrl': 'https://yt3.ggpht.com/ytc/AGIKgqNLTfYucS0xek446eIojidqlcIIFNNlQgC1RgytMCdcdMrn3-IBn0BvRRUaQZ19=s48-c-k-c0x00ffffff-no-rj', 'authorChannelUrl': 'http://www.youtube.com/channel/UCdN5pcLZ3v5AbyHPIeBX48g', 'authorChannelId': {'value': 'UCdN5pcLZ3v5AbyHPIeBX48g'}, 'canRate': True, 'viewerRating': 'none', 'likeCount': 0, 'publishedAt': '2022-10-11T05:18:26Z', 'updatedAt': '2022-10-11T05:18:26Z'}}, 'canReply': True, 'totalReplyCount': 0, 'isPublic': True}",,UCdN5pcLZ3v5AbyHPIeBX48g,2022-10-11T05:18:26Z,Atacar infraestruturas ou civis sao crimes de guerra ainda bem que nimguem tem duvida que os misseis sao Russos,,2023-06-08 18:18:46.027539
youtube#commentThread,iaVBuJJc1gMXRR4PrnCoBVNzEnQ,UgxGhBeA3fiWBOHhgGR4AaABAg,"{'videoId': 'beh41-ewoIw', 'topLevelComment': {'kind': 'youtube#comment', 'etag': '3hUdOpPT8HyNUrnejrBwmK9NJhk', 'id': 'UgxGhBeA3fiWBOHhgGR4AaABAg', 'snippet': {'videoId': 'beh41-ewoIw', 'textDisplay': 'Bom comentario desse senhor ve se que tem conhecimento e cultura parabens professor jose 🤝', 'textOriginal': 'Bom comentario desse senhor ve se que tem conhecimento e cultura parabens professor jose 🤝', 'authorDisplayName': 'Matfaycal', 'authorProfileImageUrl': 'https://yt3.ggpht.com/ytc/AGIKgqNLTfYucS0xek446eIojidqlcIIFNNlQgC1RgytMCdcdMrn3-IBn0BvRRUaQZ19=s48-c-k-c0x00ffffff-no-rj', 'authorChannelUrl': 'http://www.youtube.com/channel/UCdN5pcLZ3v5AbyHPIeBX48g', 'authorChannelId': {'value': 'UCdN5pcLZ3v5AbyHPIeBX48g'}, 'canRate': True, 'viewerRating': 'none', 'likeCount': 0, 'publishedAt': '2022-10-11T08:47:33Z', 'updatedAt': '2022-10-11T08:48:23Z'}}, 'canReply': True, 'totalReplyCount': 0, 'isPublic': True}",,UCdN5pcLZ3v5AbyHPIeBX48g,2022-10-11T08:47:33Z,Bom comentario desse senhor ve se que tem conhecimento e cultura parabens professor jose 🤝,,2023-06-08 18:18:54.083367
youtube#commentThread,aVeuP5KmuL3YrhEdXBG-6n0NwCk,Ugw1c4bFwxliV0KwX854AaABAg,"{'videoId': 'beh41-ewoIw', 'topLevelComment': {'kind': 'youtube#comment', 'etag': '87EsoJ4dWBkTCJRYqXI5wD-hIfs', 'id': 'Ugw1c4bFwxliV0KwX854AaABAg', 'snippet': {'videoId': 'beh41-ewoIw', 'textDisplay': 'Claro que foi a Russia que explodiu a ponte como nao consegue vencer no campo de Batalha ataca alvos civis ! A Russia sempre disse que nao atacava alvo civis agora parece que nimguem tem duvidas', 'textOriginal': 'Claro que foi a Russia que explodiu a ponte como nao consegue vencer no campo de Batalha ataca alvos civis ! A Russia sempre disse que nao atacava alvo civis agora parece que nimguem tem duvidas', 'authorDisplayName': 'Matfaycal', 'authorProfileImageUrl': 'https://yt3.ggpht.com/ytc/AGIKgqNLTfYucS0xek446eIojidqlcIIFNNlQgC1RgytMCdcdMrn3-IBn0BvRRUaQZ19=s48-c-k-c0x00ffffff-no-rj', 'authorChannelUrl': 'http://www.youtube.com/channel/UCdN5pcLZ3v5AbyHPIeBX48g', 'authorChannelId': {'value': 'UCdN5pcLZ3v5AbyHPIeBX48g'}, 'canRate': True, 'viewerRating': 'none', 'likeCount': 0, 'publishedAt': '2022-10-11T08:42:57Z', 'updatedAt': '2022-10-11T08:42:57Z'}}, 'canReply': True, 'totalReplyCount': 0, 'isPublic': True}",,UCdN5pcLZ3v5AbyHPIeBX48g,2022-10-11T08:42:57Z,Claro que foi a Russia que explodiu a ponte como nao consegue vencer no campo de Batalha ataca alvos civis ! A Russia sempre disse que nao atacava alvo civis agora parece que nimguem tem duvidas,,2023-06-08 18:18:54.083367
