kind,etag,id,snippet,replies,authorChannelId,publishedAt,textOriginal,nextPageToken,extraction_date
youtube#commentThread,rfZ0mQlObbSeHa_ykX14pRlK4JY,Ugw4filfGkrnZ4ADLiV4AaABAg,"{'videoId': 'ubDW4axd0vI', 'topLevelComment': {'kind': 'youtube#comment', 'etag': 'zTfoQyoNAaqg1BLMut9DE06JoBo', 'id': 'Ugw4filfGkrnZ4ADLiV4AaABAg', 'snippet': {'videoId': 'ubDW4axd0vI', 'textDisplay': 'Aceita que doi menos', 'textOriginal': 'Aceita que doi menos', 'authorDisplayName': 'Matfaycal', 'authorProfileImageUrl': 'https://yt3.ggpht.com/ytc/AGIKgqNLTfYucS0xek446eIojidqlcIIFNNlQgC1RgytMCdcdMrn3-IBn0BvRRUaQZ19=s48-c-k-c0x00ffffff-no-rj', 'authorChannelUrl': 'http://www.youtube.com/channel/UCdN5pcLZ3v5AbyHPIeBX48g', 'authorChannelId': {'value': 'UCdN5pcLZ3v5AbyHPIeBX48g'}, 'canRate': True, 'viewerRating': 'none', 'likeCount': 0, 'publishedAt': '2022-10-31T11:12:58Z', 'updatedAt': '2022-10-31T11:12:58Z'}}, 'canReply': True, 'totalReplyCount': 0, 'isPublic': True}",,UCdN5pcLZ3v5AbyHPIeBX48g,2022-10-31T11:12:58Z,Aceita que doi menos,QURTSl9pMmFkb0RJUHdxcnh6MERDLWs5cDJXaFNQNHVNSXV2SklZNDNhOXl0UHNOUlBFQlJzOVZGMzg2WU45Y2ZhMDhLX1JhWGszTnRDNA==,2023-06-08 14:05:22.277144
youtube#commentThread,sdjEpkQbHI7vydiFZ-29ti5SW-Y,UgwfUIl8_svxWGqtB9B4AaABAg,"{'videoId': 'Yh0f3_CkTk8', 'topLevelComment': {'kind': 'youtube#comment', 'etag': 'X50CsscSbDq3qqnaJ9awrg2L1Io', 'id': 'UgwfUIl8_svxWGqtB9B4AaABAg', 'snippet': {'videoId': 'Yh0f3_CkTk8', 'textDisplay': 'Nao vai fazer diferenca nenhuma no campo de batalha a falta de energia faz apenas nos civis que podem morrer congelados isso se chama terrorismo', 'textOriginal': 'Nao vai fazer diferenca nenhuma no campo de batalha a falta de energia faz apenas nos civis que podem morrer congelados isso se chama terrorismo', 'authorDisplayName': 'Matfaycal', 'authorProfileImageUrl': 'https://yt3.ggpht.com/ytc/AGIKgqNLTfYucS0xek446eIojidqlcIIFNNlQgC1RgytMCdcdMrn3-IBn0BvRRUaQZ19=s48-c-k-c0x00ffffff-no-rj', 'authorChannelUrl': 'http://www.youtube.com/channel/UCdN5pcLZ3v5AbyHPIeBX48g', 'authorChannelId': {'value': 'UCdN5pcLZ3v5AbyHPIeBX48g'}, 'canRate': True, 'viewerRating': 'none', 'likeCount': 0, 'publishedAt': '2022-10-23T20:13:53Z', 'updatedAt': '2022-10-23T20:13:53Z'}}, 'canReply': True, 'totalReplyCount': 0, 'isPublic': True}",,UCdN5pcLZ3v5AbyHPIeBX48g,2022-10-23T20:13:53Z,Nao vai fazer diferenca nenhuma no campo de batalha a falta de energia faz apenas nos civis que podem morrer congelados isso se chama terrorismo,,2023-06-08 15:03:08.918538
youtube#commentThread,TmqXMiuo1CwlAcqom5IpuwFocSw,UgyyLcBfNye9R-94P8x4AaABAg,"{'videoId': 'uuh1ydDwwrQ', 'topLevelComment': {'kind': 'youtube#comment', 'etag': 'HWe-MNE4Kt_4vp_YPzDdh4bGMao', 'id': 'UgyyLcBfNye9R-94P8x4AaABAg', 'snippet': {'videoId': 'uuh1ydDwwrQ', 'textDisplay': 'Bem voces dizem que apoiam a liberdade mas o que estamos vendo e o Brasil fazer aliancas e apoiando autocrata  entao eu pergunto aí ao povo Brasileiro..voces querem uma ordem mundial liderada por autocratas? RUSSIA  CHINA .. é essa a liberdade que querem para voces?', 'textOriginal': 'Bem voces dizem que apoiam a liberdade mas o que estamos vendo e o Brasil fazer aliancas e apoiando autocrata  entao eu pergunto aí ao povo Brasileiro..voces querem uma ordem mundial liderada por autocratas? RUSSIA  CHINA .. é essa a liberdade que querem para voces?', 'authorDisplayName': 'Matfaycal', 'authorProfileImageUrl': 'https://yt3.ggpht.com/ytc/AGIKgqNLTfYucS0xek446eIojidqlcIIFNNlQgC1RgytMCdcdMrn3-IBn0BvRRUaQZ19=s48-c-k-c0x00ffffff-no-rj', 'authorChannelUrl': 'http://www.youtube.com/channel/UCdN5pcLZ3v5AbyHPIeBX48g', 'authorChannelId': {'value': 'UCdN5pcLZ3v5AbyHPIeBX48g'}, 'canRate': True, 'viewerRating': 'none', 'likeCount': 0, 'publishedAt': '2022-10-23T11:37:25Z', 'updatedAt': '2022-10-23T11:38:24Z'}}, 'canReply': True, 'totalReplyCount': 0, 'isPublic': True}",,UCdN5pcLZ3v5AbyHPIeBX48g,2022-10-23T11:37:25Z,Bem voces dizem que apoiam a liberdade mas o que estamos vendo e o Brasil fazer aliancas e apoiando autocrata  entao eu pergunto aí ao povo Brasileiro..voces querem uma ordem mundial liderada por autocratas? RUSSIA  CHINA .. é essa a liberdade que querem para voces?,QURTSl9pMDdxbm0zelM2QlJrN0FJMi1wOGdQb05ZZnlTbjdnVEtQYXRyRG9Db21KNlBOTEE0NEM4SUNtNUhpTFg2NzFTOGtxS0w4UjA2WQ==,2023-06-08 15:04:28.548179
youtube#commentThread,VQTi2QuKZ4vi3kpX5QvUZSojips,UgxPe7azh9pHj_Ajxit4AaABAg,"{'videoId': '0hOzhf3yp3w', 'topLevelComment': {'kind': 'youtube#comment', 'etag': 'dRifnLyFwxep4Wo5BNk8-Azm13I', 'id': 'UgxPe7azh9pHj_Ajxit4AaABAg', 'snippet': {'videoId': '0hOzhf3yp3w', 'textDisplay': 'Essa informacao e falsa eu vivo na suica  faz 2 anos que quase nao neva', 'textOriginal': 'Essa informacao e falsa eu vivo na suica  faz 2 anos que quase nao neva', 'authorDisplayName': 'Matfaycal', 'authorProfileImageUrl': 'https://yt3.ggpht.com/ytc/AGIKgqNLTfYucS0xek446eIojidqlcIIFNNlQgC1RgytMCdcdMrn3-IBn0BvRRUaQZ19=s48-c-k-c0x00ffffff-no-rj', 'authorChannelUrl': 'http://www.youtube.com/channel/UCdN5pcLZ3v5AbyHPIeBX48g', 'authorChannelId': {'value': 'UCdN5pcLZ3v5AbyHPIeBX48g'}, 'canRate': True, 'viewerRating': 'none', 'likeCount': 0, 'publishedAt': '2022-10-25T07:54:32Z', 'updatedAt': '2022-10-25T07:54:32Z'}}, 'canReply': True, 'totalReplyCount': 0, 'isPublic': True}",,UCdN5pcLZ3v5AbyHPIeBX48g,2022-10-25T07:54:32Z,Essa informacao e falsa eu vivo na suica  faz 2 anos que quase nao neva,,2023-06-08 15:04:52.717160
youtube#commentThread,P5u5MZ1chH0BJ6pZyURjxL0I5FQ,Ugz2sa2f-moEgAsMsrt4AaABAg,"{'videoId': '0hOzhf3yp3w', 'topLevelComment': {'kind': 'youtube#comment', 'etag': 'lmscevNgjiO2NyJXkZ0R-1dDEnQ', 'id': 'Ugz2sa2f-moEgAsMsrt4AaABAg', 'snippet': {'videoId': '0hOzhf3yp3w', 'textDisplay': 'As criancas ??o diretor de um canal Russo disse que as crianças deviam ser  afogadas no Rio ou queimadas', 'textOriginal': 'As criancas ??o diretor de um canal Russo disse que as crianças deviam ser  afogadas no Rio ou queimadas', 'authorDisplayName': 'Matfaycal', 'authorProfileImageUrl': 'https://yt3.ggpht.com/ytc/AGIKgqNLTfYucS0xek446eIojidqlcIIFNNlQgC1RgytMCdcdMrn3-IBn0BvRRUaQZ19=s48-c-k-c0x00ffffff-no-rj', 'authorChannelUrl': 'http://www.youtube.com/channel/UCdN5pcLZ3v5AbyHPIeBX48g', 'authorChannelId': {'value': 'UCdN5pcLZ3v5AbyHPIeBX48g'}, 'canRate': True, 'viewerRating': 'none', 'likeCount': 0, 'publishedAt': '2022-10-25T07:51:25Z', 'updatedAt': '2022-10-25T07:51:25Z'}}, 'canReply': True, 'totalReplyCount': 0, 'isPublic': True}",,UCdN5pcLZ3v5AbyHPIeBX48g,2022-10-25T07:51:25Z,As criancas ??o diretor de um canal Russo disse que as crianças deviam ser  afogadas no Rio ou queimadas,,2023-06-08 15:04:52.717160
youtube#commentThread,49XVxisJtQ944xO--DTb5kme6oY,UgwaciQsTbvfziOv1ld4AaABAg,"{'videoId': '0hOzhf3yp3w', 'topLevelComment': {'kind': 'youtube#comment', 'etag': '5Ewv7D8V_Cg3T8Ek3ojTWdEdU28', 'id': 'UgwaciQsTbvfziOv1ld4AaABAg', 'snippet': {'videoId': '0hOzhf3yp3w', 'textDisplay': '<a href=""https://youtu.be/bMQSTgsgABA"">https://youtu.be/bMQSTgsgABA</a>  a grande marcha Russa anual 😁', 'textOriginal': 'https://youtu.be/bMQSTgsgABA  a grande marcha Russa anual 😁', 'authorDisplayName': 'Matfaycal', 'authorProfileImageUrl': 'https://yt3.ggpht.com/ytc/AGIKgqNLTfYucS0xek446eIojidqlcIIFNNlQgC1RgytMCdcdMrn3-IBn0BvRRUaQZ19=s48-c-k-c0x00ffffff-no-rj', 'authorChannelUrl': 'http://www.youtube.com/channel/UCdN5pcLZ3v5AbyHPIeBX48g', 'authorChannelId': {'value': 'UCdN5pcLZ3v5AbyHPIeBX48g'}, 'canRate': True, 'viewerRating': 'none', 'likeCount': 0, 'publishedAt': '2022-10-25T07:46:32Z', 'updatedAt': '2022-10-25T07:46:32Z'}}, 'canReply': True, 'totalReplyCount': 0, 'isPublic': True}",,UCdN5pcLZ3v5AbyHPIeBX48g,2022-10-25T07:46:32Z,https://youtu.be/bMQSTgsgABA  a grande marcha Russa anual 😁,,2023-06-08 15:04:52.717160
youtube#commentThread,60UV3nykoKfkNll4UExcPGHhou8,UgyTWyZJRf3nb1RDcJN4AaABAg,"{'videoId': '0hOzhf3yp3w', 'topLevelComment': {'kind': 'youtube#comment', 'etag': 'm5TS6EbM6K6lqXyVbu7--bKa6ss', 'id': 'UgyTWyZJRf3nb1RDcJN4AaABAg', 'snippet': {'videoId': '0hOzhf3yp3w', 'textDisplay': 'Quando falam em desnazificacao na Ucrania  deviam tentar compreender porque esta subindo o nazismo no Brasil 400%  dito por uma tv Brasileira como isso chegou a esse ponto e quando vai parar?', 'textOriginal': 'Quando falam em desnazificacao na Ucrania  deviam tentar compreender porque esta subindo o nazismo no Brasil 400%  dito por uma tv Brasileira como isso chegou a esse ponto e quando vai parar?', 'authorDisplayName': 'Matfaycal', 'authorProfileImageUrl': 'https://yt3.ggpht.com/ytc/AGIKgqNLTfYucS0xek446eIojidqlcIIFNNlQgC1RgytMCdcdMrn3-IBn0BvRRUaQZ19=s48-c-k-c0x00ffffff-no-rj', 'authorChannelUrl': 'http://www.youtube.com/channel/UCdN5pcLZ3v5AbyHPIeBX48g', 'authorChannelId': {'value': 'UCdN5pcLZ3v5AbyHPIeBX48g'}, 'canRate': True, 'viewerRating': 'none', 'likeCount': 0, 'publishedAt': '2022-10-22T18:56:15Z', 'updatedAt': '2022-10-22T18:56:15Z'}}, 'canReply': True, 'totalReplyCount': 0, 'isPublic': True}",,UCdN5pcLZ3v5AbyHPIeBX48g,2022-10-22T18:56:15Z,Quando falam em desnazificacao na Ucrania  deviam tentar compreender porque esta subindo o nazismo no Brasil 400%  dito por uma tv Brasileira como isso chegou a esse ponto e quando vai parar?,,2023-06-08 15:04:52.717160
youtube#commentThread,C89C1faWM5AnQOGoOvJpQn-aH2o,UgyQDsW7PYqfQGfI3cV4AaABAg,"{'videoId': '0hOzhf3yp3w', 'topLevelComment': {'kind': 'youtube#comment', 'etag': 'z0Gv112U2EAXET1aunyCAgZPcak', 'id': 'UgyQDsW7PYqfQGfI3cV4AaABAg', 'snippet': {'videoId': '0hOzhf3yp3w', 'textDisplay': 'Ja estamos chorando por falta de gas 🤣🤣 olha porque o canal foi censurado ?? 🙄🤔 nosso luca nosso amigo fica na Europa fazendo propaganda Russa eu diria que era melhor fazer essa live na Russia na Europa a Propaganda Russa nao e bem recibida ,Nao falem mal da Europa quando estao presentes as pessoas ve youtube logo vai dar problemas querem beijar o..... a putin aconcelho a fazer fora da Europa', 'textOriginal': 'Ja estamos chorando por falta de gas 🤣🤣 olha porque o canal foi censurado ?? 🙄🤔 nosso luca nosso amigo fica na Europa fazendo propaganda Russa eu diria que era melhor fazer essa live na Russia na Europa a Propaganda Russa nao e bem recibida ,Nao falem mal da Europa quando estao presentes as pessoas ve youtube logo vai dar problemas querem beijar o..... a putin aconcelho a fazer fora da Europa', 'authorDisplayName': 'Matfaycal', 'authorProfileImageUrl': 'https://yt3.ggpht.com/ytc/AGIKgqNLTfYucS0xek446eIojidqlcIIFNNlQgC1RgytMCdcdMrn3-IBn0BvRRUaQZ19=s48-c-k-c0x00ffffff-no-rj', 'authorChannelUrl': 'http://www.youtube.com/channel/UCdN5pcLZ3v5AbyHPIeBX48g', 'authorChannelId': {'value': 'UCdN5pcLZ3v5AbyHPIeBX48g'}, 'canRate': True, 'viewerRating': 'none', 'likeCount': 1, 'publishedAt': '2022-10-22T18:52:58Z', 'updatedAt': '2022-10-22T18:53:40Z'}}, 'canReply': True, 'totalReplyCount': 1, 'isPublic': True}","{'comments': [{'kind': 'youtube#comment', 'etag': 'Udl2H2Sorcb5eJuUG-a4KY4HFjs', 'id': 'UgyQDsW7PYqfQGfI3cV4AaABAg.9hVDQ_pa-S99hVNwU2HIa5', 'snippet': {'videoId': '0hOzhf3yp3w', 'textDisplay': 'Com certeza', 'textOriginal': 'Com certeza', 'parentId': 'UgyQDsW7PYqfQGfI3cV4AaABAg', 'authorDisplayName': 'celso da silva', 'authorProfileImageUrl': 'https://yt3.ggpht.com/ytc/AGIKgqMjpKmkYdqar7j7hDORjLqigsJc1q7inBywUQ=s48-c-k-c0x00ffffff-no-rj', 'authorChannelUrl': 'http://www.youtube.com/channel/UCxrVVYTHBhpqwtrdivFNmDQ', 'authorChannelId': {'value': 'UCxrVVYTHBhpqwtrdivFNmDQ'}, 'canRate': True, 'viewerRating': 'none', 'likeCount': 1, 'publishedAt': '2022-10-22T20:24:51Z', 'updatedAt': '2022-10-22T20:24:51Z'}}]}",UCdN5pcLZ3v5AbyHPIeBX48g,2022-10-22T18:52:58Z,"Ja estamos chorando por falta de gas 🤣🤣 olha porque o canal foi censurado ?? 🙄🤔 nosso luca nosso amigo fica na Europa fazendo propaganda Russa eu diria que era melhor fazer essa live na Russia na Europa a Propaganda Russa nao e bem recibida ,Nao falem mal da Europa quando estao presentes as pessoas ve youtube logo vai dar problemas querem beijar o..... a putin aconcelho a fazer fora da Europa",,2023-06-08 15:04:52.717160
youtube#commentThread,PexQxK_slMmDMuRynK7XNSfg24M,Ugyk63_mbwQ0hAS6CA14AaABAg,"{'videoId': '0hOzhf3yp3w', 'topLevelComment': {'kind': 'youtube#comment', 'etag': 'uM01QfeZ7vKw6F2Nxjt0p9aeyEY', 'id': 'Ugyk63_mbwQ0hAS6CA14AaABAg', 'snippet': {'videoId': '0hOzhf3yp3w', 'textDisplay': 'Pois é..estavam torcendo para Ucrania ceder os terrenos para alianca BRICS  dava geito para economia ..infelizmente BRISCS nao teve sorte', 'textOriginal': 'Pois é..estavam torcendo para Ucrania ceder os terrenos para alianca BRICS  dava geito para economia ..infelizmente BRISCS nao teve sorte', 'authorDisplayName': 'Matfaycal', 'authorProfileImageUrl': 'https://yt3.ggpht.com/ytc/AGIKgqNLTfYucS0xek446eIojidqlcIIFNNlQgC1RgytMCdcdMrn3-IBn0BvRRUaQZ19=s48-c-k-c0x00ffffff-no-rj', 'authorChannelUrl': 'http://www.youtube.com/channel/UCdN5pcLZ3v5AbyHPIeBX48g', 'authorChannelId': {'value': 'UCdN5pcLZ3v5AbyHPIeBX48g'}, 'canRate': True, 'viewerRating': 'none', 'likeCount': 6, 'publishedAt': '2022-10-22T18:44:13Z', 'updatedAt': '2022-10-22T18:44:24Z'}}, 'canReply': True, 'totalReplyCount': 1, 'isPublic': True}","{'comments': [{'kind': 'youtube#comment', 'etag': 'B1Cz4VANSg9pJf2yWtKZTQxDi7g', 'id': 'Ugyk63_mbwQ0hAS6CA14AaABAg.9hVCQRmZSih9hVb3y-e9N5', 'snippet': {'videoId': '0hOzhf3yp3w', 'textDisplay': 'Será que Ucrânia vale apena o Putin matar e provocar a fuga de milhares dos russos destruído a economia da Rússia e paz do mundo pra guerrear pelo a Ucrânia. Mesmo q na Ucrânia tivesse milhões de toneladas ouro e brilhantes  ainda não valia o povo russo ser usado pra morrem  e matarem pelo a Ucrânia.', 'textOriginal': 'Será que Ucrânia vale apena o Putin matar e provocar a fuga de milhares dos russos destruído a economia da Rússia e paz do mundo pra guerrear pelo a Ucrânia. Mesmo q na Ucrânia tivesse milhões de toneladas ouro e brilhantes  ainda não valia o povo russo ser usado pra morrem  e matarem pelo a Ucrânia.', 'parentId': 'Ugyk63_mbwQ0hAS6CA14AaABAg', 'authorDisplayName': 'Maria Rosa Maria', 'authorProfileImageUrl': 'https://yt3.ggpht.com/ytc/AGIKgqPbheqiYTjJK82HMQMR_6j8q6ESfJP4154JS2hllkYbvpezkGAT6DkkOSP5LsFE=s48-c-k-c0x00ffffff-no-rj', 'authorChannelUrl': 'http://www.youtube.com/channel/UCQCD6RfU4M6zKOjB1A1j5eg', 'authorChannelId': {'value': 'UCQCD6RfU4M6zKOjB1A1j5eg'}, 'canRate': True, 'viewerRating': 'none', 'likeCount': 0, 'publishedAt': '2022-10-22T22:28:20Z', 'updatedAt': '2022-10-22T22:28:20Z'}}]}",UCdN5pcLZ3v5AbyHPIeBX48g,2022-10-22T18:44:13Z,Pois é..estavam torcendo para Ucrania ceder os terrenos para alianca BRICS  dava geito para economia ..infelizmente BRISCS nao teve sorte,,2023-06-08 15:04:52.717160
youtube#commentThread,lXydAm5i1vX_GzCqdhKgIXCGoA8,UgxK26ViizVP2cJ1cEl4AaABAg,"{'videoId': 'a2bDTWfMOCU', 'topLevelComment': {'kind': 'youtube#comment', 'etag': 'Fw78aif79QN3Fkixm774-3KQlx0', 'id': 'UgxK26ViizVP2cJ1cEl4AaABAg', 'snippet': {'videoId': 'a2bDTWfMOCU', 'textDisplay': 'Em relacao a ucrania vcs nunca falaram de crimes de guerra da Russia e sempre a protegeram sabendo que e crime de guerra atacar uma usina Nuclear quando Russia a atacou matou bombeiros pegou fogo vcs nada falaram, depois de 5 meses veio a vossa preocupacao dos &quot;ataques ucraniamos &quot; sem ter qualquer.prova concreta apenas confiam na palavra do insavor alem de ter violado todas as leis da ONU  onde vosso pais faz parte vcs nunca admitiram que Russia faz crimes de guerra escondendo ao povo Brasileiro a realidade para dar razao a invasao Russa como se Russia fosse o país invadido !  Ataques a hospitais escolas  valas humanas vcs falam que sao actores  fingindo que estao mortos , nao sei que vcs vao falar depois da investigacao das nacoes unidas falar que foi um  genocidio  que vcs jornalistas vao dizer ai ao povo? Quem conhece um pouco de historia vera que esse filme se passou na chechenia depois que chechenia se declarou independente ..a vontade do povo como putin fala ..foi completamente arrasada por Russia  a vontade da auto dertiminacao do povo deve ser so  fora do territorio Russo claro..na Georgia ...Moldavia  a derteminacao do povo ja vale', 'textOriginal': 'Em relacao a ucrania vcs nunca falaram de crimes de guerra da Russia e sempre a protegeram sabendo que e crime de guerra atacar uma usina Nuclear quando Russia a atacou matou bombeiros pegou fogo vcs nada falaram, depois de 5 meses veio a vossa preocupacao dos ""ataques ucraniamos "" sem ter qualquer.prova concreta apenas confiam na palavra do insavor alem de ter violado todas as leis da ONU  onde vosso pais faz parte vcs nunca admitiram que Russia faz crimes de guerra escondendo ao povo Brasileiro a realidade para dar razao a invasao Russa como se Russia fosse o país invadido !  Ataques a hospitais escolas  valas humanas vcs falam que sao actores  fingindo que estao mortos , nao sei que vcs vao falar depois da investigacao das nacoes unidas falar que foi um  genocidio  que vcs jornalistas vao dizer ai ao povo? Quem conhece um pouco de historia vera que esse filme se passou na chechenia depois que chechenia se declarou independente ..a vontade do povo como putin fala ..foi completamente arrasada por Russia  a vontade da auto dertiminacao do povo deve ser so  fora do territorio Russo claro..na Georgia ...Moldavia  a derteminacao do povo ja vale', 'authorDisplayName': 'Matfaycal', 'authorProfileImageUrl': 'https://yt3.ggpht.com/ytc/AGIKgqNLTfYucS0xek446eIojidqlcIIFNNlQgC1RgytMCdcdMrn3-IBn0BvRRUaQZ19=s48-c-k-c0x00ffffff-no-rj', 'authorChannelUrl': 'http://www.youtube.com/channel/UCdN5pcLZ3v5AbyHPIeBX48g', 'authorChannelId': {'value': 'UCdN5pcLZ3v5AbyHPIeBX48g'}, 'canRate': True, 'viewerRating': 'none', 'likeCount': 0, 'publishedAt': '2022-10-22T14:53:51Z', 'updatedAt': '2022-10-22T14:54:57Z'}}, 'canReply': True, 'totalReplyCount': 0, 'isPublic': True}",,UCdN5pcLZ3v5AbyHPIeBX48g,2022-10-22T14:53:51Z,"Em relacao a ucrania vcs nunca falaram de crimes de guerra da Russia e sempre a protegeram sabendo que e crime de guerra atacar uma usina Nuclear quando Russia a atacou matou bombeiros pegou fogo vcs nada falaram, depois de 5 meses veio a vossa preocupacao dos ""ataques ucraniamos "" sem ter qualquer.prova concreta apenas confiam na palavra do insavor alem de ter violado todas as leis da ONU  onde vosso pais faz parte vcs nunca admitiram que Russia faz crimes de guerra escondendo ao povo Brasileiro a realidade para dar razao a invasao Russa como se Russia fosse o país invadido !  Ataques a hospitais escolas  valas humanas vcs falam que sao actores  fingindo que estao mortos , nao sei que vcs vao falar depois da investigacao das nacoes unidas falar que foi um  genocidio  que vcs jornalistas vao dizer ai ao povo? Quem conhece um pouco de historia vera que esse filme se passou na chechenia depois que chechenia se declarou independente ..a vontade do povo como putin fala ..foi completamente arrasada por Russia  a vontade da auto dertiminacao do povo deve ser so  fora do territorio Russo claro..na Georgia ...Moldavia  a derteminacao do povo ja vale",QURTSl9pM2E3NlppQ3VsUHJyMUNQOVZjVU02a3ZpdU81WC1wX3ZIemROeE9pLUhtTkNTemNpUWtzclNxR25SRS1DSE9GWGFSUkRYaTBkWQ==,2023-06-08 15:07:57.966034
youtube#commentThread,faC9Mlfylwkfe5LdqTq2jWR4TKw,UgzXYHjBZILTBM-WQlt4AaABAg,"{'videoId': 'a2bDTWfMOCU', 'topLevelComment': {'kind': 'youtube#comment', 'etag': 'HxM0nzGUnHcbsM6lXvRRnXCjsWw', 'id': 'UgzXYHjBZILTBM-WQlt4AaABAg', 'snippet': {'videoId': 'a2bDTWfMOCU', 'textDisplay': 'Povo Brasileiro abram os vossos olhos porque quando cairem na ditadura nem vossa opiniao podem dar aqui', 'textOriginal': 'Povo Brasileiro abram os vossos olhos porque quando cairem na ditadura nem vossa opiniao podem dar aqui', 'authorDisplayName': 'Matfaycal', 'authorProfileImageUrl': 'https://yt3.ggpht.com/ytc/AGIKgqNLTfYucS0xek446eIojidqlcIIFNNlQgC1RgytMCdcdMrn3-IBn0BvRRUaQZ19=s48-c-k-c0x00ffffff-no-rj', 'authorChannelUrl': 'http://www.youtube.com/channel/UCdN5pcLZ3v5AbyHPIeBX48g', 'authorChannelId': {'value': 'UCdN5pcLZ3v5AbyHPIeBX48g'}, 'canRate': True, 'viewerRating': 'none', 'likeCount': 1, 'publishedAt': '2022-10-22T14:17:37Z', 'updatedAt': '2022-10-22T14:17:37Z'}}, 'canReply': True, 'totalReplyCount': 1, 'isPublic': True}","{'comments': [{'kind': 'youtube#comment', 'etag': 'kXO40MfiFR8jWNM7Yl6vav0HQ50', 'id': 'UgzXYHjBZILTBM-WQlt4AaABAg.9hUiurM1LuY9hUjrs1SfKD', 'snippet': {'videoId': 'a2bDTWfMOCU', 'textDisplay': 'Todos os paises que viraram socialistas/comunistas transformaram o povo em escravo e os dirigentes em reis. TODOS. <br>PENSEM BEM NO QUE VAO FAZER. <br>DEPOIS NAO TEM CHORO. <br>PT NUNCA MAIS PARA MOSSO BEM E DOS NOSSOS FILHOS E NETOS.', 'textOriginal': 'Todos os paises que viraram socialistas/comunistas transformaram o povo em escravo e os dirigentes em reis. TODOS. \\\\nPENSEM BEM NO QUE VAO FAZER. \\\\nDEPOIS NAO TEM CHORO. \\\\nPT NUNCA MAIS PARA MOSSO BEM E DOS NOSSOS FILHOS E NETOS.', 'parentId': 'UgzXYHjBZILTBM-WQlt4AaABAg', 'authorDisplayName': 'Oswaldo Gribel', 'authorProfileImageUrl': 'https://yt3.ggpht.com/ytc/AGIKgqPQW5c_BDD5ny2J5yCaQt1uNdd-BgCaBQZQNpIQCKKS3dDoPXanYjIWaufKuSAt=s48-c-k-c0x00ffffff-no-rj', 'authorChannelUrl': 'http://www.youtube.com/channel/UCKBoiSUqVR5gsVTuY_M25Pw', 'authorChannelId': {'value': 'UCKBoiSUqVR5gsVTuY_M25Pw'}, 'canRate': True, 'viewerRating': 'none', 'likeCount': 1, 'publishedAt': '2022-10-22T14:25:57Z', 'updatedAt': '2022-10-22T14:25:57Z'}}]}",UCdN5pcLZ3v5AbyHPIeBX48g,2022-10-22T14:17:37Z,Povo Brasileiro abram os vossos olhos porque quando cairem na ditadura nem vossa opiniao podem dar aqui,QURTSl9pMmZNaVB4QlpqSkxzaHkzdFM3VEkwMUxtX2JybjhVelBKamF1SEhwV1BJWnNqWERfX0NUa3hnSGxLZEFlSFZFVU5FZDh3LUNxYw==,2023-06-08 15:07:59.649244
youtube#commentThread,XQLuBPZSdp0vKF5po2YGfvU9SK4,UgwvQlfj4a2RWOW-dhN4AaABAg,"{'videoId': 'a2bDTWfMOCU', 'topLevelComment': {'kind': 'youtube#comment', 'etag': 'BiJ-HFaEKKcP1W-JBq9ZkMZNE0s', 'id': 'UgwvQlfj4a2RWOW-dhN4AaABAg', 'snippet': {'videoId': 'a2bDTWfMOCU', 'textDisplay': 'Upsss censurado falam tanto a verdade em relacao a ucrania que as vezes penso que foi Ucrania invadiu a Russia nao foi a Russia que invadiu Ucrania', 'textOriginal': 'Upsss censurado falam tanto a verdade em relacao a ucrania que as vezes penso que foi Ucrania invadiu a Russia nao foi a Russia que invadiu Ucrania', 'authorDisplayName': 'Matfaycal', 'authorProfileImageUrl': 'https://yt3.ggpht.com/ytc/AGIKgqNLTfYucS0xek446eIojidqlcIIFNNlQgC1RgytMCdcdMrn3-IBn0BvRRUaQZ19=s48-c-k-c0x00ffffff-no-rj', 'authorChannelUrl': 'http://www.youtube.com/channel/UCdN5pcLZ3v5AbyHPIeBX48g', 'authorChannelId': {'value': 'UCdN5pcLZ3v5AbyHPIeBX48g'}, 'canRate': True, 'viewerRating': 'none', 'likeCount': 0, 'publishedAt': '2022-10-22T14:16:26Z', 'updatedAt': '2022-10-22T14:16:26Z'}}, 'canReply': True, 'totalReplyCount': 0, 'isPublic': True}",,UCdN5pcLZ3v5AbyHPIeBX48g,2022-10-22T14:16:26Z,Upsss censurado falam tanto a verdade em relacao a ucrania que as vezes penso que foi Ucrania invadiu a Russia nao foi a Russia que invadiu Ucrania,QURTSl9pMmZNaVB4QlpqSkxzaHkzdFM3VEkwMUxtX2JybjhVelBKamF1SEhwV1BJWnNqWERfX0NUa3hnSGxLZEFlSFZFVU5FZDh3LUNxYw==,2023-06-08 15:07:59.649244
youtube#commentThread,yalVE8NvhTSm2qkC1Kvy0Jj_QDE,UgymSLQLF1oD-np39vt4AaABAg,"{'videoId': 'ygvqbildO8s', 'topLevelComment': {'kind': 'youtube#comment', 'etag': 'e1JQ_EjwxFD-1VcgYl7pTUfxy5w', 'id': 'UgymSLQLF1oD-np39vt4AaABAg', 'snippet': {'videoId': 'ygvqbildO8s', 'textDisplay': 'Talvez nao queiram deixar a Ucrania porque sao ucranianos certo?? Ve se informa direito por isso leva com censurado fale a verdade', 'textOriginal': 'Talvez nao queiram deixar a Ucrania porque sao ucranianos certo?? Ve se informa direito por isso leva com censurado fale a verdade', 'authorDisplayName': 'Matfaycal', 'authorProfileImageUrl': 'https://yt3.ggpht.com/ytc/AGIKgqNLTfYucS0xek446eIojidqlcIIFNNlQgC1RgytMCdcdMrn3-IBn0BvRRUaQZ19=s48-c-k-c0x00ffffff-no-rj', 'authorChannelUrl': 'http://www.youtube.com/channel/UCdN5pcLZ3v5AbyHPIeBX48g', 'authorChannelId': {'value': 'UCdN5pcLZ3v5AbyHPIeBX48g'}, 'canRate': True, 'viewerRating': 'none', 'likeCount': 0, 'publishedAt': '2022-10-23T10:56:11Z', 'updatedAt': '2022-10-23T10:56:11Z'}}, 'canReply': True, 'totalReplyCount': 0, 'isPublic': True}",,UCdN5pcLZ3v5AbyHPIeBX48g,2022-10-23T10:56:11Z,Talvez nao queiram deixar a Ucrania porque sao ucranianos certo?? Ve se informa direito por isso leva com censurado fale a verdade,,2023-06-08 15:09:27.287461
youtube#commentThread,2p9xKH1Uglj19hM5fkXEGVyueMg,UgyZE8GN1HXVNYAF-JZ4AaABAg,"{'videoId': 'gWfb5Wjt2bI', 'topLevelComment': {'kind': 'youtube#comment', 'etag': 'cqtDVk3xCtod5-ly-xHSqbt3cZM', 'id': 'UgyZE8GN1HXVNYAF-JZ4AaABAg', 'snippet': {'videoId': 'gWfb5Wjt2bI', 'textDisplay': 'Provavelmente a Russia vai matar quem nao quiser sair', 'textOriginal': 'Provavelmente a Russia vai matar quem nao quiser sair', 'authorDisplayName': 'Matfaycal', 'authorProfileImageUrl': 'https://yt3.ggpht.com/ytc/AGIKgqNLTfYucS0xek446eIojidqlcIIFNNlQgC1RgytMCdcdMrn3-IBn0BvRRUaQZ19=s48-c-k-c0x00ffffff-no-rj', 'authorChannelUrl': 'http://www.youtube.com/channel/UCdN5pcLZ3v5AbyHPIeBX48g', 'authorChannelId': {'value': 'UCdN5pcLZ3v5AbyHPIeBX48g'}, 'canRate': True, 'viewerRating': 'none', 'likeCount': 0, 'publishedAt': '2022-10-21T12:45:18Z', 'updatedAt': '2022-10-21T12:45:18Z'}}, 'canReply': True, 'totalReplyCount': 0, 'isPublic': True}",,UCdN5pcLZ3v5AbyHPIeBX48g,2022-10-21T12:45:18Z,Provavelmente a Russia vai matar quem nao quiser sair,,2023-06-08 15:17:49.065331
