kind,etag,id,snippet,replies,authorChannelId,publishedAt,textOriginal,nextPageToken,extraction_date
youtube#commentThread,7eaE8DR5HlMqWgHivTFDwLLjEPs,UgyBoIcGYkE1BRy4CSx4AaABAg,"{'videoId': 's0j8irOcKwI', 'topLevelComment': {'kind': 'youtube#comment', 'etag': 'J4DMt0OAOMzspTcNwcsNPmRqug4', 'id': 'UgyBoIcGYkE1BRy4CSx4AaABAg', 'snippet': {'videoId': 's0j8irOcKwI', 'textDisplay': 'Leite é  o segundo hoje, que prova que  uma grande porcentagem  dos brasileiros gostam mesmo  é  de PORCARIA!!', 'textOriginal': 'Leite é  o segundo hoje, que prova que  uma grande porcentagem  dos brasileiros gostam mesmo  é  de PORCARIA!!', 'authorDisplayName': 'Helida Aparecida Vieira', 'authorProfileImageUrl': 'https://yt3.ggpht.com/ytc/AGIKgqPd2vkp7JtFxxlXf6T-sgn2WkjrShvUlRrTSQ=s48-c-k-c0x00ffffff-no-rj', 'authorChannelUrl': 'http://www.youtube.com/channel/UCaA_Rxczg58uGdEfpJpmBHw', 'authorChannelId': {'value': 'UCaA_Rxczg58uGdEfpJpmBHw'}, 'canRate': True, 'viewerRating': 'none', 'likeCount': 0, 'publishedAt': '2022-10-31T01:46:54Z', 'updatedAt': '2022-10-31T01:46:54Z'}}, 'canReply': True, 'totalReplyCount': 0, 'isPublic': True}",,UCaA_Rxczg58uGdEfpJpmBHw,2022-10-31T01:46:54Z,"Leite é  o segundo hoje, que prova que  uma grande porcentagem  dos brasileiros gostam mesmo  é  de PORCARIA!!",QURTSl9pMjJ1QlFQZDlCQU9GT1lQbzU1QXZkSlZTUTI4cmNnVGxvb2hzT1pLY2NtWnZ6dWlBT1NhTU8tdWstcFI1aTFZT2tnd3lCUkd3bw==,2023-06-08 14:09:57.139528
youtube#commentThread,mNIrpcwwHUWJVYCc68B6NhoNq64,UgzylI18BubLD_YpP4x4AaABAg,"{'videoId': 'Q5dP-jP7lHw', 'topLevelComment': {'kind': 'youtube#comment', 'etag': 'X_Sv6uHUOGg4s_QqunIhfAPyNzQ', 'id': 'UgzylI18BubLD_YpP4x4AaABAg', 'snippet': {'videoId': 'Q5dP-jP7lHw', 'textDisplay': 'CAIO NOTA MIL!!!', 'textOriginal': 'CAIO NOTA MIL!!!', 'authorDisplayName': 'Helida Aparecida Vieira', 'authorProfileImageUrl': 'https://yt3.ggpht.com/ytc/AGIKgqPd2vkp7JtFxxlXf6T-sgn2WkjrShvUlRrTSQ=s48-c-k-c0x00ffffff-no-rj', 'authorChannelUrl': 'http://www.youtube.com/channel/UCaA_Rxczg58uGdEfpJpmBHw', 'authorChannelId': {'value': 'UCaA_Rxczg58uGdEfpJpmBHw'}, 'canRate': True, 'viewerRating': 'none', 'likeCount': 0, 'publishedAt': '2022-10-19T23:44:14Z', 'updatedAt': '2022-10-19T23:44:14Z'}}, 'canReply': True, 'totalReplyCount': 0, 'isPublic': True}",,UCaA_Rxczg58uGdEfpJpmBHw,2022-10-19T23:44:14Z,CAIO NOTA MIL!!!,QURTSl9pMk14cW5sVDJORF9OTDZaZ3k2YkVhNkROQTRlYzc0NzhyazdNMFhYeGg2OTV2MkJwWTUzTERsY1I3anhNV3k2SXJkamRmN1N6cw==,2023-06-08 15:29:55.443916
youtube#commentThread,BLjpGkvgNj2HQ7x2v1YPUNFFoeE,Ugytwt616M7G6uS2y3F4AaABAg,"{'videoId': 'Q5dP-jP7lHw', 'topLevelComment': {'kind': 'youtube#comment', 'etag': 'eTEqNI1_ymG7pWa1JSP2kOaT4gM', 'id': 'Ugytwt616M7G6uS2y3F4AaABAg', 'snippet': {'videoId': 'Q5dP-jP7lHw', 'textDisplay': 'Queria  só  um milésimo  do presente que o larápio  está oferecendo aos seus defensores !!!', 'textOriginal': 'Queria  só  um milésimo  do presente que o larápio  está oferecendo aos seus defensores !!!', 'authorDisplayName': 'Helida Aparecida Vieira', 'authorProfileImageUrl': 'https://yt3.ggpht.com/ytc/AGIKgqPd2vkp7JtFxxlXf6T-sgn2WkjrShvUlRrTSQ=s48-c-k-c0x00ffffff-no-rj', 'authorChannelUrl': 'http://www.youtube.com/channel/UCaA_Rxczg58uGdEfpJpmBHw', 'authorChannelId': {'value': 'UCaA_Rxczg58uGdEfpJpmBHw'}, 'canRate': True, 'viewerRating': 'none', 'likeCount': 0, 'publishedAt': '2022-10-19T23:42:27Z', 'updatedAt': '2022-10-19T23:42:27Z'}}, 'canReply': True, 'totalReplyCount': 0, 'isPublic': True}",,UCaA_Rxczg58uGdEfpJpmBHw,2022-10-19T23:42:27Z,Queria  só  um milésimo  do presente que o larápio  está oferecendo aos seus defensores !!!,QURTSl9pMk14cW5sVDJORF9OTDZaZ3k2YkVhNkROQTRlYzc0NzhyazdNMFhYeGg2OTV2MkJwWTUzTERsY1I3anhNV3k2SXJkamRmN1N6cw==,2023-06-08 15:29:55.443916
youtube#commentThread,OeUS59BbAVCXEZmPKHKbsjNSYdU,Ugxdsx4T7ze5njxZFHR4AaABAg,"{'videoId': 'X83V1ZNiUVo', 'topLevelComment': {'kind': 'youtube#comment', 'etag': 'oEPsYmfQneeABl6d2H7HJGbHOgM', 'id': 'Ugxdsx4T7ze5njxZFHR4AaABAg', 'snippet': {'videoId': 'X83V1ZNiUVo', 'textDisplay': 'E eu SR Ratinho! Nunca imaginei que o STF  pudesse ser composto por ditadores covardes ,cuja missão  é  destruir nosso país!!!', 'textOriginal': 'E eu SR Ratinho! Nunca imaginei que o STF  pudesse ser composto por ditadores covardes ,cuja missão  é  destruir nosso país!!!', 'authorDisplayName': 'Helida Aparecida Vieira', 'authorProfileImageUrl': 'https://yt3.ggpht.com/ytc/AGIKgqPd2vkp7JtFxxlXf6T-sgn2WkjrShvUlRrTSQ=s48-c-k-c0x00ffffff-no-rj', 'authorChannelUrl': 'http://www.youtube.com/channel/UCaA_Rxczg58uGdEfpJpmBHw', 'authorChannelId': {'value': 'UCaA_Rxczg58uGdEfpJpmBHw'}, 'canRate': True, 'viewerRating': 'none', 'likeCount': 1, 'publishedAt': '2022-10-19T20:05:43Z', 'updatedAt': '2022-10-19T20:05:43Z'}}, 'canReply': True, 'totalReplyCount': 0, 'isPublic': True}",,UCaA_Rxczg58uGdEfpJpmBHw,2022-10-19T20:05:43Z,"E eu SR Ratinho! Nunca imaginei que o STF  pudesse ser composto por ditadores covardes ,cuja missão  é  destruir nosso país!!!",QURTSl9pMWU2TVdxU3hrNFVaNVJPZkpBS0lGM0hPNkRONy1xWkM0bUh2SWthenBZTzRtUjdoR3VKR0x3NFJQeHVZeF96Vnp4cjA3TzhXOA==,2023-06-08 15:34:26.834735
youtube#commentThread,c0C06zJ9hzpX0P3ymdi2W8XB60U,UgxLr33UiX6bD_ADm1F4AaABAg,"{'videoId': 'xhQCxzaLDvU', 'topLevelComment': {'kind': 'youtube#comment', 'etag': 's0LsJv2viLGDdnUhcX9F6A18_fk', 'id': 'UgxLr33UiX6bD_ADm1F4AaABAg', 'snippet': {'videoId': 'xhQCxzaLDvU', 'textDisplay': 'STF  E ESSE MOLUSCO SÃO  AS DUAS PIORES COISAS DO BRASIL!!!', 'textOriginal': 'STF  E ESSE MOLUSCO SÃO  AS DUAS PIORES COISAS DO BRASIL!!!', 'authorDisplayName': 'Helida Aparecida Vieira', 'authorProfileImageUrl': 'https://yt3.ggpht.com/ytc/AGIKgqPd2vkp7JtFxxlXf6T-sgn2WkjrShvUlRrTSQ=s48-c-k-c0x00ffffff-no-rj', 'authorChannelUrl': 'http://www.youtube.com/channel/UCaA_Rxczg58uGdEfpJpmBHw', 'authorChannelId': {'value': 'UCaA_Rxczg58uGdEfpJpmBHw'}, 'canRate': True, 'viewerRating': 'none', 'likeCount': 0, 'publishedAt': '2022-10-19T23:49:44Z', 'updatedAt': '2022-10-19T23:53:13Z'}}, 'canReply': True, 'totalReplyCount': 0, 'isPublic': True}",,UCaA_Rxczg58uGdEfpJpmBHw,2022-10-19T23:49:44Z,STF  E ESSE MOLUSCO SÃO  AS DUAS PIORES COISAS DO BRASIL!!!,QURTSl9pMWlYVmptd0hTeVJVUWR0aWh2OXdFVU5DVWExLXZjYzZLbW1waVBVQUNxUHE4VmRuT1BNTlRNVGoyd3Rib21ZQ3BrVWduWk1ZZw==,2023-06-08 15:35:58.820995
youtube#commentThread,6UV2Pjx6ej7OAdZVvQOBy9U8GC8,UgxH0TWC7H3muEJE96F4AaABAg,"{'videoId': '_goa0S27lK4', 'topLevelComment': {'kind': 'youtube#comment', 'etag': 'dhiztmt-EwkkfMHy6zq2mHAGsPE', 'id': 'UgxH0TWC7H3muEJE96F4AaABAg', 'snippet': {'videoId': '_goa0S27lK4', 'textDisplay': 'E DESDE QUANDO A LIBÉLULA SALTITANTE  SE PREOCUPA COM ALGUÉM?????', 'textOriginal': 'E DESDE QUANDO A LIBÉLULA SALTITANTE  SE PREOCUPA COM ALGUÉM?????', 'authorDisplayName': 'Helida Aparecida Vieira', 'authorProfileImageUrl': 'https://yt3.ggpht.com/ytc/AGIKgqPd2vkp7JtFxxlXf6T-sgn2WkjrShvUlRrTSQ=s48-c-k-c0x00ffffff-no-rj', 'authorChannelUrl': 'http://www.youtube.com/channel/UCaA_Rxczg58uGdEfpJpmBHw', 'authorChannelId': {'value': 'UCaA_Rxczg58uGdEfpJpmBHw'}, 'canRate': True, 'viewerRating': 'none', 'likeCount': 0, 'publishedAt': '2022-10-19T18:37:27Z', 'updatedAt': '2022-10-19T18:37:27Z'}}, 'canReply': True, 'totalReplyCount': 0, 'isPublic': True}",,UCaA_Rxczg58uGdEfpJpmBHw,2022-10-19T18:37:27Z,E DESDE QUANDO A LIBÉLULA SALTITANTE  SE PREOCUPA COM ALGUÉM?????,QURTSl9pMENlN3BjTlIyQWpqa1VMZWpvaUtvSGNBVmU1a253Vm9XQ2UzSUlMaXVMX1U1VDFpcVBkUlRpcERFbGZ4Z1RQM2M5YVZUWjZPdw==,2023-06-08 15:37:27.694131
youtube#commentThread,vdjaVEQMD_AUxjvja083PpPjKOI,UgzvIla9CLi7Qx4S_PV4AaABAg,"{'videoId': 'iq9Eu-V-vbM', 'topLevelComment': {'kind': 'youtube#comment', 'etag': 'fDsEKMQPdn6WM1ulUsj4gWc07Jg', 'id': 'UgzvIla9CLi7Qx4S_PV4AaABAg', 'snippet': {'videoId': 'iq9Eu-V-vbM', 'textDisplay': 'É SÓ  UM NADA QUE SÓ  EXISTE PUBLICAMENTE, POR SER FILHO DO LEONARDO!!! É  UM COITADO!!!!', 'textOriginal': 'É SÓ  UM NADA QUE SÓ  EXISTE PUBLICAMENTE, POR SER FILHO DO LEONARDO!!! É  UM COITADO!!!!', 'authorDisplayName': 'Helida Aparecida Vieira', 'authorProfileImageUrl': 'https://yt3.ggpht.com/ytc/AGIKgqPd2vkp7JtFxxlXf6T-sgn2WkjrShvUlRrTSQ=s48-c-k-c0x00ffffff-no-rj', 'authorChannelUrl': 'http://www.youtube.com/channel/UCaA_Rxczg58uGdEfpJpmBHw', 'authorChannelId': {'value': 'UCaA_Rxczg58uGdEfpJpmBHw'}, 'canRate': True, 'viewerRating': 'none', 'likeCount': 0, 'publishedAt': '2022-10-18T20:08:39Z', 'updatedAt': '2022-10-18T20:08:39Z'}}, 'canReply': True, 'totalReplyCount': 0, 'isPublic': True}",,UCaA_Rxczg58uGdEfpJpmBHw,2022-10-18T20:08:39Z,"É SÓ  UM NADA QUE SÓ  EXISTE PUBLICAMENTE, POR SER FILHO DO LEONARDO!!! É  UM COITADO!!!!",QURTSl9pMVJJU0kzZjFvWWpLVThrbjNlNnkxMWdHaGxSN1NPWV9ZQ0dINGZvNTZ2Y0FlNkhaTUZZcWtwZF9pMmJma1BDclI1M3VXVHBIMA==,2023-06-08 15:41:24.751230
youtube#commentThread,FXBOd8rPdCjLMvZVmhjM7BZ8Mo4,UgxjoAkb0AxCK7T_mvN4AaABAg,"{'videoId': 'uXl-n6Xuuu0', 'topLevelComment': {'kind': 'youtube#comment', 'etag': 'd-Jyu0JZWLcB-A8UCv5wIWuHAQI', 'id': 'UgxjoAkb0AxCK7T_mvN4AaABAg', 'snippet': {'videoId': 'uXl-n6Xuuu0', 'textDisplay': 'Se o cara precisa treinar, então  ele está  confessando não  servir e não ser capaz de ser presidente de um  um país , o que aliás  ele já  provou! LULA PRESIDENTE, NEM PENSAR, SERÁ O  FIM DO BRASIL!!!', 'textOriginal': 'Se o cara precisa treinar, então  ele está  confessando não  servir e não ser capaz de ser presidente de um  um país , o que aliás  ele já  provou! LULA PRESIDENTE, NEM PENSAR, SERÁ O  FIM DO BRASIL!!!', 'authorDisplayName': 'Helida Aparecida Vieira', 'authorProfileImageUrl': 'https://yt3.ggpht.com/ytc/AGIKgqPd2vkp7JtFxxlXf6T-sgn2WkjrShvUlRrTSQ=s48-c-k-c0x00ffffff-no-rj', 'authorChannelUrl': 'http://www.youtube.com/channel/UCaA_Rxczg58uGdEfpJpmBHw', 'authorChannelId': {'value': 'UCaA_Rxczg58uGdEfpJpmBHw'}, 'canRate': True, 'viewerRating': 'none', 'likeCount': 2, 'publishedAt': '2022-10-16T14:43:11Z', 'updatedAt': '2022-10-16T14:43:11Z'}}, 'canReply': True, 'totalReplyCount': 0, 'isPublic': True}",,UCaA_Rxczg58uGdEfpJpmBHw,2022-10-16T14:43:11Z,"Se o cara precisa treinar, então  ele está  confessando não  servir e não ser capaz de ser presidente de um  um país , o que aliás  ele já  provou! LULA PRESIDENTE, NEM PENSAR, SERÁ O  FIM DO BRASIL!!!",QURTSl9pMk9OQzdDajFaV251RzZUNWFTMmJ1TXFtRXhxQ2hueHQ1UC10Zmlnb0tUWkNhWm9TVzM1UFhFMGw0WVhBOU5vTzhHWF8xSlpYWQ==,2023-06-08 15:50:59.352192
youtube#commentThread,ay1O3_VbI6Z_ntC7DDzX80Y962Q,UgwktF0DXXNxZmjpWHh4AaABAg,"{'videoId': 'qMToNfNjHck', 'topLevelComment': {'kind': 'youtube#comment', 'etag': '6odr1_rALywmRAXF9oZCGiKYSrQ', 'id': 'UgwktF0DXXNxZmjpWHh4AaABAg', 'snippet': {'videoId': 'qMToNfNjHck', 'textDisplay': 'PUTIM e  ZELENSK::: DOIS BANDIDOS QUE DEVIAM SER DESTITUIDOS DE QUALQUER  PODER. SÃO  DOIS ASSASSINOS  COVARDES!!!!! Ficam protegidos, e os inocentes  que se Lasquem !!!!', 'textOriginal': 'PUTIM e  ZELENSK::: DOIS BANDIDOS QUE DEVIAM SER DESTITUIDOS DE QUALQUER  PODER. SÃO  DOIS ASSASSINOS  COVARDES!!!!! Ficam protegidos, e os inocentes  que se Lasquem !!!!', 'authorDisplayName': 'Helida Aparecida Vieira', 'authorProfileImageUrl': 'https://yt3.ggpht.com/ytc/AGIKgqPd2vkp7JtFxxlXf6T-sgn2WkjrShvUlRrTSQ=s48-c-k-c0x00ffffff-no-rj', 'authorChannelUrl': 'http://www.youtube.com/channel/UCaA_Rxczg58uGdEfpJpmBHw', 'authorChannelId': {'value': 'UCaA_Rxczg58uGdEfpJpmBHw'}, 'canRate': True, 'viewerRating': 'none', 'likeCount': 0, 'publishedAt': '2022-10-15T14:34:45Z', 'updatedAt': '2022-10-15T14:37:03Z'}}, 'canReply': True, 'totalReplyCount': 0, 'isPublic': True}",,UCaA_Rxczg58uGdEfpJpmBHw,2022-10-15T14:34:45Z,"PUTIM e  ZELENSK::: DOIS BANDIDOS QUE DEVIAM SER DESTITUIDOS DE QUALQUER  PODER. SÃO  DOIS ASSASSINOS  COVARDES!!!!! Ficam protegidos, e os inocentes  que se Lasquem !!!!",,2023-06-08 18:01:04.413467
youtube#commentThread,_fb_f9U1veOikzXlUWZcI4VAEvg,UgybjmJdsJB263M9Z254AaABAg,"{'videoId': 'iRhSZN8y_8M', 'topLevelComment': {'kind': 'youtube#comment', 'etag': 'aYoin6WkB7RDoJwxxFtXul83jIY', 'id': 'UgybjmJdsJB263M9Z254AaABAg', 'snippet': {'videoId': 'iRhSZN8y_8M', 'textDisplay': 'Alguém  explica pra esse moço,  que os ST(S) no Brasil não  estão nem um pouco com moral para qualquer coisa!!!', 'textOriginal': 'Alguém  explica pra esse moço,  que os ST(S) no Brasil não  estão nem um pouco com moral para qualquer coisa!!!', 'authorDisplayName': 'Helida Aparecida Vieira', 'authorProfileImageUrl': 'https://yt3.ggpht.com/ytc/AGIKgqPd2vkp7JtFxxlXf6T-sgn2WkjrShvUlRrTSQ=s48-c-k-c0x00ffffff-no-rj', 'authorChannelUrl': 'http://www.youtube.com/channel/UCaA_Rxczg58uGdEfpJpmBHw', 'authorChannelId': {'value': 'UCaA_Rxczg58uGdEfpJpmBHw'}, 'canRate': True, 'viewerRating': 'none', 'likeCount': 0, 'publishedAt': '2022-10-15T13:12:58Z', 'updatedAt': '2022-10-15T13:12:58Z'}}, 'canReply': True, 'totalReplyCount': 0, 'isPublic': True}",,UCaA_Rxczg58uGdEfpJpmBHw,2022-10-15T13:12:58Z,"Alguém  explica pra esse moço,  que os ST(S) no Brasil não  estão nem um pouco com moral para qualquer coisa!!!",QURTSl9pMHhQckJocFVTcEhiY3R5SWl3b0tkRkRRY3VUaXp6NWZYT3hhUmxuaEQyTUdPU3FYVkZ2OGRad1Z4RGVXUzI1VEl3dXozUXJKMA==,2023-06-08 18:02:17.651417
youtube#commentThread,Xst9EPvjmkB7BbqWvv8ne5jokzM,Ugx7vu1p33utz0-AzR94AaABAg,"{'videoId': 'iRhSZN8y_8M', 'topLevelComment': {'kind': 'youtube#comment', 'etag': 'fKn5A9HJBhB0mWX2m5cmB4i2j4Q', 'id': 'Ugx7vu1p33utz0-AzR94AaABAg', 'snippet': {'videoId': 'iRhSZN8y_8M', 'textDisplay': 'A NOSSA BANDEIRA JAMAIS SERÁ  VERMELHA!!!! E ESSES PETISTAS,PARECEM CAVALO DE CARROÇA, PRIVADOS DE RACIOCÍNIO  QUE NÃO  SEJA,ORIENTADO PELOS LALAU!!!', 'textOriginal': 'A NOSSA BANDEIRA JAMAIS SERÁ  VERMELHA!!!! E ESSES PETISTAS,PARECEM CAVALO DE CARROÇA, PRIVADOS DE RACIOCÍNIO  QUE NÃO  SEJA,ORIENTADO PELOS LALAU!!!', 'authorDisplayName': 'Helida Aparecida Vieira', 'authorProfileImageUrl': 'https://yt3.ggpht.com/ytc/AGIKgqPd2vkp7JtFxxlXf6T-sgn2WkjrShvUlRrTSQ=s48-c-k-c0x00ffffff-no-rj', 'authorChannelUrl': 'http://www.youtube.com/channel/UCaA_Rxczg58uGdEfpJpmBHw', 'authorChannelId': {'value': 'UCaA_Rxczg58uGdEfpJpmBHw'}, 'canRate': True, 'viewerRating': 'none', 'likeCount': 0, 'publishedAt': '2022-10-15T13:09:47Z', 'updatedAt': '2022-10-15T13:09:47Z'}}, 'canReply': True, 'totalReplyCount': 0, 'isPublic': True}",,UCaA_Rxczg58uGdEfpJpmBHw,2022-10-15T13:09:47Z,"A NOSSA BANDEIRA JAMAIS SERÁ  VERMELHA!!!! E ESSES PETISTAS,PARECEM CAVALO DE CARROÇA, PRIVADOS DE RACIOCÍNIO  QUE NÃO  SEJA,ORIENTADO PELOS LALAU!!!",QURTSl9pMHhQckJocFVTcEhiY3R5SWl3b0tkRkRRY3VUaXp6NWZYT3hhUmxuaEQyTUdPU3FYVkZ2OGRad1Z4RGVXUzI1VEl3dXozUXJKMA==,2023-06-08 18:02:17.651417
youtube#commentThread,n5YwHBEuqFm6OPzbqMbPlDZ_Z2Q,Ugzs4c3_R8qjkEiOqwt4AaABAg,"{'videoId': 'hXoJWBjx5b8', 'topLevelComment': {'kind': 'youtube#comment', 'etag': 'UxmEI00dSTGEytTM8Hu2_JMvxfs', 'id': 'Ugzs4c3_R8qjkEiOqwt4AaABAg', 'snippet': {'videoId': 'hXoJWBjx5b8', 'textDisplay': 'Em um país, onde só  os BANDIDOS TÊM  VOZ ATIVA, COM CERTEZA ESSA QUE ATÉ  NO CINEMA EXALTA O ESTRUPO DE MENORES, (TODO MUNDO VIU O FILME), É BEM CAPAZ DESSA VAGABA, OBTER SUCESSO COM ESSA PALHAÇADA...', 'textOriginal': 'Em um país, onde só  os BANDIDOS TÊM  VOZ ATIVA, COM CERTEZA ESSA QUE ATÉ  NO CINEMA EXALTA O ESTRUPO DE MENORES, (TODO MUNDO VIU O FILME), É BEM CAPAZ DESSA VAGABA, OBTER SUCESSO COM ESSA PALHAÇADA...', 'authorDisplayName': 'Helida Aparecida Vieira', 'authorProfileImageUrl': 'https://yt3.ggpht.com/ytc/AGIKgqPd2vkp7JtFxxlXf6T-sgn2WkjrShvUlRrTSQ=s48-c-k-c0x00ffffff-no-rj', 'authorChannelUrl': 'http://www.youtube.com/channel/UCaA_Rxczg58uGdEfpJpmBHw', 'authorChannelId': {'value': 'UCaA_Rxczg58uGdEfpJpmBHw'}, 'canRate': True, 'viewerRating': 'none', 'likeCount': 1, 'publishedAt': '2022-10-15T00:03:07Z', 'updatedAt': '2022-10-15T00:03:07Z'}}, 'canReply': True, 'totalReplyCount': 0, 'isPublic': True}",,UCaA_Rxczg58uGdEfpJpmBHw,2022-10-15T00:03:07Z,"Em um país, onde só  os BANDIDOS TÊM  VOZ ATIVA, COM CERTEZA ESSA QUE ATÉ  NO CINEMA EXALTA O ESTRUPO DE MENORES, (TODO MUNDO VIU O FILME), É BEM CAPAZ DESSA VAGABA, OBTER SUCESSO COM ESSA PALHAÇADA...",QURTSl9pMGJQMlBMMFRSNnN4bkV2WDEtb1FJZXVya0FDLWhoRmlwak4yM1FIa25uOTJiZjVweXVaNlY3S3kxU3dRQWQyaE9SclIxbEJiMA==,2023-06-08 18:04:50.799987
youtube#commentThread,i8lARk3ySdExbZr29XvwkSHBDu0,UgxCCxyYt6WR5jJcXcF4AaABAg,"{'videoId': 'd6RYIkiuTR4', 'topLevelComment': {'kind': 'youtube#comment', 'etag': '4bEQZ_QprE7EH7UotueypzG8Ix8', 'id': 'UgxCCxyYt6WR5jJcXcF4AaABAg', 'snippet': {'videoId': 'd6RYIkiuTR4', 'textDisplay': 'ORAIS É O  &quot;INIMIGO  NÚMERO UM&quot;DO BRASIL!', 'textOriginal': 'ORAIS É O  ""INIMIGO  NÚMERO UM""DO BRASIL!', 'authorDisplayName': 'Helida Aparecida Vieira', 'authorProfileImageUrl': 'https://yt3.ggpht.com/ytc/AGIKgqPd2vkp7JtFxxlXf6T-sgn2WkjrShvUlRrTSQ=s48-c-k-c0x00ffffff-no-rj', 'authorChannelUrl': 'http://www.youtube.com/channel/UCaA_Rxczg58uGdEfpJpmBHw', 'authorChannelId': {'value': 'UCaA_Rxczg58uGdEfpJpmBHw'}, 'canRate': True, 'viewerRating': 'none', 'likeCount': 0, 'publishedAt': '2022-10-15T19:39:24Z', 'updatedAt': '2022-10-15T19:39:24Z'}}, 'canReply': True, 'totalReplyCount': 0, 'isPublic': True}",,UCaA_Rxczg58uGdEfpJpmBHw,2022-10-15T19:39:24Z,"ORAIS É O  ""INIMIGO  NÚMERO UM""DO BRASIL!",QURTSl9pMV9hazgyTDBLb2s5WVRwWlN3T2RadHZsSXRFeTFHbE5CbUd5ZktydU1fVGNfdTFPMjJxVkdYQkZ0YV9TUTZUTmJvVjBiTDdkTQ==,2023-06-08 18:07:25.133967
youtube#commentThread,FpkO1g6clYfe99_dBsCGBf2EdwQ,UgzbsJTjSqMtRnU5BIR4AaABAg,"{'videoId': 'SS9EMN8uZTw', 'topLevelComment': {'kind': 'youtube#comment', 'etag': 'oPbbBniGVz6mjleZ6D7aTbtJw-o', 'id': 'UgzbsJTjSqMtRnU5BIR4AaABAg', 'snippet': {'videoId': 'SS9EMN8uZTw', 'textDisplay': 'Acho que o presidente  BOLSONARO  não  precisa mudar nada!! Tem personalidade própria,  não  fala para agradar ou tapiar,  é  AUTÊNTICO !!!<br>TENHO MAIOR FÉ  QUE SERÁ  REELEITO   E SALVAR NOSSO PAÍS!!!! Não é  HIPÓCRITA !!!', 'textOriginal': 'Acho que o presidente  BOLSONARO  não  precisa mudar nada!! Tem personalidade própria,  não  fala para agradar ou tapiar,  é  AUTÊNTICO !!!\\\\nTENHO MAIOR FÉ  QUE SERÁ  REELEITO   E SALVAR NOSSO PAÍS!!!! Não é  HIPÓCRITA !!!', 'authorDisplayName': 'Helida Aparecida Vieira', 'authorProfileImageUrl': 'https://yt3.ggpht.com/ytc/AGIKgqPd2vkp7JtFxxlXf6T-sgn2WkjrShvUlRrTSQ=s48-c-k-c0x00ffffff-no-rj', 'authorChannelUrl': 'http://www.youtube.com/channel/UCaA_Rxczg58uGdEfpJpmBHw', 'authorChannelId': {'value': 'UCaA_Rxczg58uGdEfpJpmBHw'}, 'canRate': True, 'viewerRating': 'none', 'likeCount': 1, 'publishedAt': '2022-10-13T22:46:42Z', 'updatedAt': '2022-10-13T22:47:54Z'}}, 'canReply': True, 'totalReplyCount': 0, 'isPublic': True}",,UCaA_Rxczg58uGdEfpJpmBHw,2022-10-13T22:46:42Z,"Acho que o presidente  BOLSONARO  não  precisa mudar nada!! Tem personalidade própria,  não  fala para agradar ou tapiar,  é  AUTÊNTICO !!!
TENHO MAIOR FÉ  QUE SERÁ  REELEITO   E SALVAR NOSSO PAÍS!!!! Não é  HIPÓCRITA !!!",QURTSl9pMjFyUFV5bjY3VnJnUEpTdkRxSUxIQXUyOHI1MnhmQktVQzltRy05NkZXUmNIQzh0LTI5Y29qcXI5MnBOZGlMaGJ2R1haSVZaQQ==,2023-06-08 18:09:56.767487
youtube#commentThread,x-S3TOGGhSmkQNWyxOJAi39HaHQ,UgwLCBowEWIKc5lY0dV4AaABAg,"{'videoId': 'opzzOvvebkQ', 'topLevelComment': {'kind': 'youtube#comment', 'etag': 'EokU4CRjeBDMKFz13l5OBDKuDRY', 'id': 'UgwLCBowEWIKc5lY0dV4AaABAg', 'snippet': {'videoId': 'opzzOvvebkQ', 'textDisplay': 'JP CONTRATOU A AMANDA SÓ PRA  FAZER RAIVA NA GENTE??? ÔH CRIATURA INTOLERÁVEL!!!!', 'textOriginal': 'JP CONTRATOU A AMANDA SÓ PRA  FAZER RAIVA NA GENTE??? ÔH CRIATURA INTOLERÁVEL!!!!', 'authorDisplayName': 'Helida Aparecida Vieira', 'authorProfileImageUrl': 'https://yt3.ggpht.com/ytc/AGIKgqPd2vkp7JtFxxlXf6T-sgn2WkjrShvUlRrTSQ=s48-c-k-c0x00ffffff-no-rj', 'authorChannelUrl': 'http://www.youtube.com/channel/UCaA_Rxczg58uGdEfpJpmBHw', 'authorChannelId': {'value': 'UCaA_Rxczg58uGdEfpJpmBHw'}, 'canRate': True, 'viewerRating': 'none', 'likeCount': 0, 'publishedAt': '2022-10-13T23:08:58Z', 'updatedAt': '2022-10-13T23:08:58Z'}}, 'canReply': True, 'totalReplyCount': 0, 'isPublic': True}",,UCaA_Rxczg58uGdEfpJpmBHw,2022-10-13T23:08:58Z,JP CONTRATOU A AMANDA SÓ PRA  FAZER RAIVA NA GENTE??? ÔH CRIATURA INTOLERÁVEL!!!!,QURTSl9pM2NCd1pSUkRhbi1QTExzekhmM0U2RnlHMUhCSEQycnlidUlpUFFHR212NnNEMFFzZ2o2ejNicEtla242YzlVdTNqbVgyci1QMA==,2023-06-08 18:14:10.805866
youtube#commentThread,lfgBSGMuvCphB2-4MYAXu0HZJmI,UgxbxS3uJG4xuU0tjuJ4AaABAg,"{'videoId': 'nhq5olMUyQM', 'topLevelComment': {'kind': 'youtube#comment', 'etag': 'wtejaxLm4n7mI4Q5H3n9q1AXHic', 'id': 'UgxbxS3uJG4xuU0tjuJ4AaABAg', 'snippet': {'videoId': 'nhq5olMUyQM', 'textDisplay': 'O QUE NÃO  PRESTA,NÃO É O  PAIS VENEZUELA!!! É O COVARDE QUE GOVERNA LÁ!!!!', 'textOriginal': 'O QUE NÃO  PRESTA,NÃO É O  PAIS VENEZUELA!!! É O COVARDE QUE GOVERNA LÁ!!!!', 'authorDisplayName': 'Helida Aparecida Vieira', 'authorProfileImageUrl': 'https://yt3.ggpht.com/ytc/AGIKgqPd2vkp7JtFxxlXf6T-sgn2WkjrShvUlRrTSQ=s48-c-k-c0x00ffffff-no-rj', 'authorChannelUrl': 'http://www.youtube.com/channel/UCaA_Rxczg58uGdEfpJpmBHw', 'authorChannelId': {'value': 'UCaA_Rxczg58uGdEfpJpmBHw'}, 'canRate': True, 'viewerRating': 'none', 'likeCount': 1, 'publishedAt': '2022-10-15T13:40:08Z', 'updatedAt': '2022-10-15T13:40:08Z'}}, 'canReply': True, 'totalReplyCount': 0, 'isPublic': True}",,UCaA_Rxczg58uGdEfpJpmBHw,2022-10-15T13:40:08Z,"O QUE NÃO  PRESTA,NÃO É O  PAIS VENEZUELA!!! É O COVARDE QUE GOVERNA LÁ!!!!",QURTSl9pM2o5a08zU1h5a3ljQjlUQ0Y0Y3YxaTAtc0ZnNTRVTVlKRDZfVDFJMUgtQkEzMzlzNnh4Q3VoaW9jYmpOaHdHSkpqZVM2OS1nNA==,2023-06-08 18:20:27.361256
youtube#commentThread,-C9AC6Ei1Hjg5CwyQY9EtStNsxM,UgwQWvdpFW4X0hn5Iyp4AaABAg,"{'videoId': 'GLPsvJabZ8w', 'topLevelComment': {'kind': 'youtube#comment', 'etag': 'SytFrLb0rozjPF2NkTO463086G4', 'id': 'UgwQWvdpFW4X0hn5Iyp4AaABAg', 'snippet': {'videoId': 'GLPsvJabZ8w', 'textDisplay': 'MAS QUEM TRATA O POVO COMO BICHOS RASTEIROS É O  LULALADRÂO!!!!! É MUITO SAFADO E ATREVIDO ESSE MOLUSCO!!!', 'textOriginal': 'MAS QUEM TRATA O POVO COMO BICHOS RASTEIROS É O  LULALADRÂO!!!!! É MUITO SAFADO E ATREVIDO ESSE MOLUSCO!!!', 'authorDisplayName': 'Helida Aparecida Vieira', 'authorProfileImageUrl': 'https://yt3.ggpht.com/ytc/AGIKgqPd2vkp7JtFxxlXf6T-sgn2WkjrShvUlRrTSQ=s48-c-k-c0x00ffffff-no-rj', 'authorChannelUrl': 'http://www.youtube.com/channel/UCaA_Rxczg58uGdEfpJpmBHw', 'authorChannelId': {'value': 'UCaA_Rxczg58uGdEfpJpmBHw'}, 'canRate': True, 'viewerRating': 'none', 'likeCount': 0, 'publishedAt': '2022-10-10T23:47:29Z', 'updatedAt': '2022-10-10T23:47:29Z'}}, 'canReply': True, 'totalReplyCount': 0, 'isPublic': True}",,UCaA_Rxczg58uGdEfpJpmBHw,2022-10-10T23:47:29Z,MAS QUEM TRATA O POVO COMO BICHOS RASTEIROS É O  LULALADRÂO!!!!! É MUITO SAFADO E ATREVIDO ESSE MOLUSCO!!!,QURTSl9pMWM0SXBPWURrQmhqQ3drYVh4b3J4YXR0b3pIV0JGaEdQd21zVmFTSUtGRE1LcXBlQ3NESVdfbUhZMkoteHhYTFJWSlRrc0JlVQ==,2023-06-08 18:21:59.085125
youtube#commentThread,rSGBPdnH-Or0fTq7JNYSpXikUrQ,Ugwj_pEZNEILDY13gqN4AaABAg,"{'videoId': 'hgLjZYliuvU', 'topLevelComment': {'kind': 'youtube#comment', 'etag': '8GNeNRekJ-IGKfnMff_pSqiMKsU', 'id': 'Ugwj_pEZNEILDY13gqN4AaABAg', 'snippet': {'videoId': 'hgLjZYliuvU', 'textDisplay': 'MINISTRO DO SUPREMO NÃO  DEVERIA SER INDICADO ,ESSE CARGO  TEM QUE SER DECORRENTE DE CONDUTA ESTUDADA E CONCURSO ESPECÍFICO!!!<br>DESDE QUANDO UM VAGABUNDO  FEITO LULA TEM CARÁTER E CONHECIMENTO  PARA INDICAR UM STF???E TAMBÉM  DEVERIA TER NO MÁXIMO DUAS GESTÕES !!', 'textOriginal': 'MINISTRO DO SUPREMO NÃO  DEVERIA SER INDICADO ,ESSE CARGO  TEM QUE SER DECORRENTE DE CONDUTA ESTUDADA E CONCURSO ESPECÍFICO!!!\\\\nDESDE QUANDO UM VAGABUNDO  FEITO LULA TEM CARÁTER E CONHECIMENTO  PARA INDICAR UM STF???E TAMBÉM  DEVERIA TER NO MÁXIMO DUAS GESTÕES !!', 'authorDisplayName': 'Helida Aparecida Vieira', 'authorProfileImageUrl': 'https://yt3.ggpht.com/ytc/AGIKgqPd2vkp7JtFxxlXf6T-sgn2WkjrShvUlRrTSQ=s48-c-k-c0x00ffffff-no-rj', 'authorChannelUrl': 'http://www.youtube.com/channel/UCaA_Rxczg58uGdEfpJpmBHw', 'authorChannelId': {'value': 'UCaA_Rxczg58uGdEfpJpmBHw'}, 'canRate': True, 'viewerRating': 'none', 'likeCount': 0, 'publishedAt': '2022-10-09T20:31:26Z', 'updatedAt': '2022-10-09T20:31:26Z'}}, 'canReply': True, 'totalReplyCount': 0, 'isPublic': True}",,UCaA_Rxczg58uGdEfpJpmBHw,2022-10-09T20:31:26Z,"MINISTRO DO SUPREMO NÃO  DEVERIA SER INDICADO ,ESSE CARGO  TEM QUE SER DECORRENTE DE CONDUTA ESTUDADA E CONCURSO ESPECÍFICO!!!
DESDE QUANDO UM VAGABUNDO  FEITO LULA TEM CARÁTER E CONHECIMENTO  PARA INDICAR UM STF???E TAMBÉM  DEVERIA TER NO MÁXIMO DUAS GESTÕES !!",,2023-06-08 18:23:56.072393
youtube#commentThread,zM5z6Xm8rZ9bqNHUWqXzQoLBuec,UgxpvUjkv1-Kp1_GA114AaABAg,"{'videoId': 'Pk6xgUaDMi4', 'topLevelComment': {'kind': 'youtube#comment', 'etag': 'HUmCySEl6SE2M3jRgTKRzX8FkkM', 'id': 'UgxpvUjkv1-Kp1_GA114AaABAg', 'snippet': {'videoId': 'Pk6xgUaDMi4', 'textDisplay': 'Até  parece que esse inergumene , é o Santo que ele se convenceu de ser!!!!', 'textOriginal': 'Até  parece que esse inergumene , é o Santo que ele se convenceu de ser!!!!', 'authorDisplayName': 'Helida Aparecida Vieira', 'authorProfileImageUrl': 'https://yt3.ggpht.com/ytc/AGIKgqPd2vkp7JtFxxlXf6T-sgn2WkjrShvUlRrTSQ=s48-c-k-c0x00ffffff-no-rj', 'authorChannelUrl': 'http://www.youtube.com/channel/UCaA_Rxczg58uGdEfpJpmBHw', 'authorChannelId': {'value': 'UCaA_Rxczg58uGdEfpJpmBHw'}, 'canRate': True, 'viewerRating': 'none', 'likeCount': 2, 'publishedAt': '2022-10-09T20:36:14Z', 'updatedAt': '2022-10-09T20:36:14Z'}}, 'canReply': True, 'totalReplyCount': 0, 'isPublic': True}",,UCaA_Rxczg58uGdEfpJpmBHw,2022-10-09T20:36:14Z,"Até  parece que esse inergumene , é o Santo que ele se convenceu de ser!!!!",QURTSl9pMUFlZWVhWUd6eE9IZE5VUG9obk9fQ2tiNDNxbTZFNWN4YkdTRnJnMXRQXzBDVVdrV05mY1VRRTZNV016aWRVOElhRW92Q0IzUQ==,2023-06-08 18:24:03.859293
