kind,etag,id,snippet,replies,authorChannelId,publishedAt,textOriginal,nextPageToken,extraction_date
youtube#commentThread,MMqPJb_AvcMc7m4Vea6T6RWGCIg,Ugw62q76Q4loNvfJJ-14AaABAg,"{'videoId': 'orToKm2dAfg', 'topLevelComment': {'kind': 'youtube#comment', 'etag': 'xysR1asJhZUilWexdsNN6Nt1eso', 'id': 'Ugw62q76Q4loNvfJJ-14AaABAg', 'snippet': {'videoId': 'orToKm2dAfg', 'textDisplay': 'Kkk entao a auto determinacao  do povo  so serve nos territorios da Ucrania ???voces sao os maiores 🤣🤣 onde tiraram os vossos cursos na internet??professores analistas e propagandistas', 'textOriginal': 'Kkk entao a auto determinacao  do povo  so serve nos territorios da Ucrania ???voces sao os maiores 🤣🤣 onde tiraram os vossos cursos na internet??professores analistas e propagandistas', 'authorDisplayName': 'Matfaycal', 'authorProfileImageUrl': 'https://yt3.ggpht.com/ytc/AGIKgqNLTfYucS0xek446eIojidqlcIIFNNlQgC1RgytMCdcdMrn3-IBn0BvRRUaQZ19=s48-c-k-c0x00ffffff-no-rj', 'authorChannelUrl': 'http://www.youtube.com/channel/UCdN5pcLZ3v5AbyHPIeBX48g', 'authorChannelId': {'value': 'UCdN5pcLZ3v5AbyHPIeBX48g'}, 'canRate': True, 'viewerRating': 'none', 'likeCount': 1, 'publishedAt': '2022-10-16T14:50:24Z', 'updatedAt': '2022-10-16T14:50:53Z'}}, 'canReply': True, 'totalReplyCount': 1, 'isPublic': True}","{'comments': [{'kind': 'youtube#comment', 'etag': 'Krvyw6tup98s3eE1mpUBSr1oJyQ', 'id': 'Ugw62q76Q4loNvfJJ-14AaABAg.9hFKteDu0I_9hFRwhkFS2t', 'snippet': {'videoId': 'orToKm2dAfg', 'textDisplay': 'mas o que o putin tá fazendo na Ucrânia, o Estados Unidos fizeram no kosovo, então sim, só vale para quem tem força o suficiente para faze-lo.', 'textOriginal': 'mas o que o putin tá fazendo na Ucrânia, o Estados Unidos fizeram no kosovo, então sim, só vale para quem tem força o suficiente para faze-lo.', 'parentId': 'Ugw62q76Q4loNvfJJ-14AaABAg', 'authorDisplayName': 'carlos Daniel', 'authorProfileImageUrl': 'https://yt3.ggpht.com/c7SrhS_rbZfeRabkQWL30yKDDdvRQiyDi-Ri_ISQmu3a882S_AxUBvH2YpN0I9-tcagk6eJ6WoI=s48-c-k-c0x00ffffff-no-rj', 'authorChannelUrl': 'http://www.youtube.com/channel/UCaqVxf1Xukamytbsey62GYw', 'authorChannelId': {'value': 'UCaqVxf1Xukamytbsey62GYw'}, 'canRate': True, 'viewerRating': 'none', 'likeCount': 0, 'publishedAt': '2022-10-16T15:51:59Z', 'updatedAt': '2022-10-16T15:51:59Z'}}]}",UCdN5pcLZ3v5AbyHPIeBX48g,2022-10-16T14:50:24Z,Kkk entao a auto determinacao  do povo  so serve nos territorios da Ucrania ???voces sao os maiores 🤣🤣 onde tiraram os vossos cursos na internet??professores analistas e propagandistas,,2023-06-08 15:51:01.966375
youtube#commentThread,HEogabpOAQcNQ5Bkmr1cP_xvSuk,UgyLF8oYsSy3pGahSFp4AaABAg,"{'videoId': '0NkoY9huHws', 'topLevelComment': {'kind': 'youtube#comment', 'etag': 'Y46iXdm_Uw75DnnVD9epQs0Sg8c', 'id': 'UgyLF8oYsSy3pGahSFp4AaABAg', 'snippet': {'videoId': '0NkoY9huHws', 'textDisplay': 'Eu nao sei onde ele faz as reportagens mas aconcelhava a ir fazelas para a Russia seria mais honesto estar Europa falando assim nao e muito seguro quando se fala precisamente do oposto da realidade', 'textOriginal': 'Eu nao sei onde ele faz as reportagens mas aconcelhava a ir fazelas para a Russia seria mais honesto estar Europa falando assim nao e muito seguro quando se fala precisamente do oposto da realidade', 'authorDisplayName': 'Matfaycal', 'authorProfileImageUrl': 'https://yt3.ggpht.com/ytc/AGIKgqNLTfYucS0xek446eIojidqlcIIFNNlQgC1RgytMCdcdMrn3-IBn0BvRRUaQZ19=s48-c-k-c0x00ffffff-no-rj', 'authorChannelUrl': 'http://www.youtube.com/channel/UCdN5pcLZ3v5AbyHPIeBX48g', 'authorChannelId': {'value': 'UCdN5pcLZ3v5AbyHPIeBX48g'}, 'canRate': True, 'viewerRating': 'none', 'likeCount': 0, 'publishedAt': '2022-10-16T15:37:19Z', 'updatedAt': '2022-10-16T15:37:19Z'}}, 'canReply': True, 'totalReplyCount': 0, 'isPublic': True}",,UCdN5pcLZ3v5AbyHPIeBX48g,2022-10-16T15:37:19Z,Eu nao sei onde ele faz as reportagens mas aconcelhava a ir fazelas para a Russia seria mais honesto estar Europa falando assim nao e muito seguro quando se fala precisamente do oposto da realidade,,2023-06-08 15:51:14.452418
youtube#commentThread,54_YZVCTc2mvORRBpvYZC-l3eNw,UgxBx396wIUZf5gJheN4AaABAg,"{'videoId': '0NkoY9huHws', 'topLevelComment': {'kind': 'youtube#comment', 'etag': '66PvFmCNq6eWuNZF4A7K3B7WqKk', 'id': 'UgxBx396wIUZf5gJheN4AaABAg', 'snippet': {'videoId': '0NkoY9huHws', 'textDisplay': 'Mare de azar..kkk a grande Russia... terroristas da ucrania... ve se que vivem em outro planeta Russia invade destroi toda ucrania mata civis destroi hospitais   ataca  e rouba incendeia  uma central Nuclear e esse reporter ai fala em terroristas ucranianos', 'textOriginal': 'Mare de azar..kkk a grande Russia... terroristas da ucrania... ve se que vivem em outro planeta Russia invade destroi toda ucrania mata civis destroi hospitais   ataca  e rouba incendeia  uma central Nuclear e esse reporter ai fala em terroristas ucranianos', 'authorDisplayName': 'Matfaycal', 'authorProfileImageUrl': 'https://yt3.ggpht.com/ytc/AGIKgqNLTfYucS0xek446eIojidqlcIIFNNlQgC1RgytMCdcdMrn3-IBn0BvRRUaQZ19=s48-c-k-c0x00ffffff-no-rj', 'authorChannelUrl': 'http://www.youtube.com/channel/UCdN5pcLZ3v5AbyHPIeBX48g', 'authorChannelId': {'value': 'UCdN5pcLZ3v5AbyHPIeBX48g'}, 'canRate': True, 'viewerRating': 'none', 'likeCount': 0, 'publishedAt': '2022-10-16T15:35:19Z', 'updatedAt': '2022-10-16T15:35:19Z'}}, 'canReply': True, 'totalReplyCount': 0, 'isPublic': True}",,UCdN5pcLZ3v5AbyHPIeBX48g,2022-10-16T15:35:19Z,Mare de azar..kkk a grande Russia... terroristas da ucrania... ve se que vivem em outro planeta Russia invade destroi toda ucrania mata civis destroi hospitais   ataca  e rouba incendeia  uma central Nuclear e esse reporter ai fala em terroristas ucranianos,,2023-06-08 15:51:14.452418
youtube#commentThread,d9Ou5F8lhRLLBAwncPWjPLhKcbs,UgzCOC-9koFPwb2KIsB4AaABAg,"{'videoId': '0NkoY9huHws', 'topLevelComment': {'kind': 'youtube#comment', 'etag': 'sl5P9zZkPRKAVAOyH-KGdB8jRZE', 'id': 'UgzCOC-9koFPwb2KIsB4AaABAg', 'snippet': {'videoId': '0NkoY9huHws', 'textDisplay': 'Homens armados matam tropas Russas em uma base militar.. eu pergunto como entra dois homens fortemente armados em uma base Russa ? Sao historias para criancas adormecer? A Russia forcou as pessoas a ir para a guerra para mim alguns estao a revoltar se', 'textOriginal': 'Homens armados matam tropas Russas em uma base militar.. eu pergunto como entra dois homens fortemente armados em uma base Russa ? Sao historias para criancas adormecer? A Russia forcou as pessoas a ir para a guerra para mim alguns estao a revoltar se', 'authorDisplayName': 'Matfaycal', 'authorProfileImageUrl': 'https://yt3.ggpht.com/ytc/AGIKgqNLTfYucS0xek446eIojidqlcIIFNNlQgC1RgytMCdcdMrn3-IBn0BvRRUaQZ19=s48-c-k-c0x00ffffff-no-rj', 'authorChannelUrl': 'http://www.youtube.com/channel/UCdN5pcLZ3v5AbyHPIeBX48g', 'authorChannelId': {'value': 'UCdN5pcLZ3v5AbyHPIeBX48g'}, 'canRate': True, 'viewerRating': 'none', 'likeCount': 1, 'publishedAt': '2022-10-16T12:37:41Z', 'updatedAt': '2022-10-16T12:37:41Z'}}, 'canReply': True, 'totalReplyCount': 0, 'isPublic': True}",,UCdN5pcLZ3v5AbyHPIeBX48g,2022-10-16T12:37:41Z,Homens armados matam tropas Russas em uma base militar.. eu pergunto como entra dois homens fortemente armados em uma base Russa ? Sao historias para criancas adormecer? A Russia forcou as pessoas a ir para a guerra para mim alguns estao a revoltar se,,2023-06-08 15:51:14.452418
youtube#commentThread,zwSc1Iruv1ara5oWC1-FGycF3TE,UgxVsYOr6S8Nf1vfJ7B4AaABAg,"{'videoId': 'qMToNfNjHck', 'topLevelComment': {'kind': 'youtube#comment', 'etag': 'O7ZAgC-2tgHFxKT8EmF9lF28Bno', 'id': 'UgxVsYOr6S8Nf1vfJ7B4AaABAg', 'snippet': {'videoId': 'qMToNfNjHck', 'textDisplay': 'Tem muita populacao Russa porque Ucrania ja nao tem control nas fronteiras desde 2014  a populacao Russa foi entrando na Ucrania para fazer esses falsos referendos', 'textOriginal': 'Tem muita populacao Russa porque Ucrania ja nao tem control nas fronteiras desde 2014  a populacao Russa foi entrando na Ucrania para fazer esses falsos referendos', 'authorDisplayName': 'Matfaycal', 'authorProfileImageUrl': 'https://yt3.ggpht.com/ytc/AGIKgqNLTfYucS0xek446eIojidqlcIIFNNlQgC1RgytMCdcdMrn3-IBn0BvRRUaQZ19=s48-c-k-c0x00ffffff-no-rj', 'authorChannelUrl': 'http://www.youtube.com/channel/UCdN5pcLZ3v5AbyHPIeBX48g', 'authorChannelId': {'value': 'UCdN5pcLZ3v5AbyHPIeBX48g'}, 'canRate': True, 'viewerRating': 'none', 'likeCount': 1, 'publishedAt': '2022-10-15T15:31:32Z', 'updatedAt': '2022-10-15T15:31:32Z'}}, 'canReply': True, 'totalReplyCount': 2, 'isPublic': True}","{'comments': [{'kind': 'youtube#comment', 'etag': 'vWzKcGJuARUlAHlGaC3542JDeMg', 'id': 'UgxVsYOr6S8Nf1vfJ7B4AaABAg.9hCpo6APqwY9hE6ZnpNn1a', 'snippet': {'videoId': 'qMToNfNjHck', 'textDisplay': '@Fabrege Bernard talvez facamos um referendo no Amozonia o que voce acha? Mas feito por França ou US', 'textOriginal': '@Fabrege Bernard talvez facamos um referendo no Amozonia o que voce acha? Mas feito por França ou US', 'parentId': 'UgxVsYOr6S8Nf1vfJ7B4AaABAg', 'authorDisplayName': 'Matfaycal', 'authorProfileImageUrl': 'https://yt3.ggpht.com/ytc/AGIKgqNLTfYucS0xek446eIojidqlcIIFNNlQgC1RgytMCdcdMrn3-IBn0BvRRUaQZ19=s48-c-k-c0x00ffffff-no-rj', 'authorChannelUrl': 'http://www.youtube.com/channel/UCdN5pcLZ3v5AbyHPIeBX48g', 'authorChannelId': {'value': 'UCdN5pcLZ3v5AbyHPIeBX48g'}, 'canRate': True, 'viewerRating': 'none', 'likeCount': 0, 'publishedAt': '2022-10-16T03:25:59Z', 'updatedAt': '2022-10-16T03:26:24Z'}}, {'kind': 'youtube#comment', 'etag': '4G-_lGbSXmBYYC8oihxHiQrnDUs', 'id': 'UgxVsYOr6S8Nf1vfJ7B4AaABAg.9hCpo6APqwY9hDz2nMcD-Q', 'snippet': {'videoId': 'qMToNfNjHck', 'textDisplay': 'Não existe nenhum falso referendo porque tinha muitas instâncias internacionais presentes, então não precisa os país ocidentais para ser certo.<br>Afinal é autodeterminação do povo que conta.', 'textOriginal': 'Não existe nenhum falso referendo porque tinha muitas instâncias internacionais presentes, então não precisa os país ocidentais para ser certo.\\\\nAfinal é autodeterminação do povo que conta.', 'parentId': 'UgxVsYOr6S8Nf1vfJ7B4AaABAg', 'authorDisplayName': 'Fabrege Bernard', 'authorProfileImageUrl': 'https://yt3.ggpht.com/Kc0gROwPkbYlWlYSD04_C9L1i2mxUrK6cDgsSDkmuWZ89o3ebEFjdELHxPPmcex2cKNRSrbEzg=s48-c-k-c0x00ffffff-no-rj', 'authorChannelUrl': 'http://www.youtube.com/channel/UCsxj9pHTJTcebZZwAUBsd2g', 'authorChannelId': {'value': 'UCsxj9pHTJTcebZZwAUBsd2g'}, 'canRate': True, 'viewerRating': 'none', 'likeCount': 0, 'publishedAt': '2022-10-16T02:11:34Z', 'updatedAt': '2022-10-16T02:11:34Z'}}]}",UCdN5pcLZ3v5AbyHPIeBX48g,2022-10-15T15:31:32Z,Tem muita populacao Russa porque Ucrania ja nao tem control nas fronteiras desde 2014  a populacao Russa foi entrando na Ucrania para fazer esses falsos referendos,,2023-06-08 18:01:04.413467
youtube#commentThread,GOtEQOySQyswhUE2WzIqtu-5SvQ,UgxAQHA81e0q8wdKDr14AaABAg,"{'videoId': 'qMToNfNjHck', 'topLevelComment': {'kind': 'youtube#comment', 'etag': 'yP80jk4MflF70U7dHkej6iNpue4', 'id': 'UgxAQHA81e0q8wdKDr14AaABAg', 'snippet': {'videoId': 'qMToNfNjHck', 'textDisplay': 'Entao qual e o territorio que Russia vai ceder? 😁', 'textOriginal': 'Entao qual e o territorio que Russia vai ceder? 😁', 'authorDisplayName': 'Matfaycal', 'authorProfileImageUrl': 'https://yt3.ggpht.com/ytc/AGIKgqNLTfYucS0xek446eIojidqlcIIFNNlQgC1RgytMCdcdMrn3-IBn0BvRRUaQZ19=s48-c-k-c0x00ffffff-no-rj', 'authorChannelUrl': 'http://www.youtube.com/channel/UCdN5pcLZ3v5AbyHPIeBX48g', 'authorChannelId': {'value': 'UCdN5pcLZ3v5AbyHPIeBX48g'}, 'canRate': True, 'viewerRating': 'none', 'likeCount': 0, 'publishedAt': '2022-10-15T15:29:39Z', 'updatedAt': '2022-10-15T15:29:39Z'}}, 'canReply': True, 'totalReplyCount': 1, 'isPublic': True}","{'comments': [{'kind': 'youtube#comment', 'etag': 'uQuonoCFG7GMY-TUPc85PaG-VLo', 'id': 'UgxAQHA81e0q8wdKDr14AaABAg.9hCpaJ3cDhr9hCq-AyLMzX', 'snippet': {'videoId': 'qMToNfNjHck', 'textDisplay': 'Se perder vai ter que ceder todos', 'textOriginal': 'Se perder vai ter que ceder todos', 'parentId': 'UgxAQHA81e0q8wdKDr14AaABAg', 'authorDisplayName': 'Luis Miguel Almeida Pinto', 'authorProfileImageUrl': 'https://yt3.ggpht.com/xnkDubmMwwJOKWZNPBPzzL-WLTYeuKUx-IWwC0wHg6MAyJPWoeuW3p0zc_hJTRkkfOiGmA4nzw=s48-c-k-c0x00ffffff-no-rj', 'authorChannelUrl': 'http://www.youtube.com/channel/UCSE5E5u0jeGpVcQH38DTlkQ', 'authorChannelId': {'value': 'UCSE5E5u0jeGpVcQH38DTlkQ'}, 'canRate': True, 'viewerRating': 'none', 'likeCount': 1, 'publishedAt': '2022-10-15T15:33:11Z', 'updatedAt': '2022-10-15T15:33:11Z'}}]}",UCdN5pcLZ3v5AbyHPIeBX48g,2022-10-15T15:29:39Z,Entao qual e o territorio que Russia vai ceder? 😁,,2023-06-08 18:01:04.413467
youtube#commentThread,u-SbcTRczgbPnMwZWcRvDnt0nSI,UgwEXTkk0l0tV5xYdWd4AaABAg,"{'videoId': 'qMToNfNjHck', 'topLevelComment': {'kind': 'youtube#comment', 'etag': 'fkUEIYH-rWHqKKdoot2i6WbyWq0', 'id': 'UgwEXTkk0l0tV5xYdWd4AaABAg', 'snippet': {'videoId': 'qMToNfNjHck', 'textDisplay': 'A ponte e um alvo militar , e por onde Russia fornece armamento  o mesmo nao fez a Russia atacou apenas alvos civis que e crime de guerra', 'textOriginal': 'A ponte e um alvo militar , e por onde Russia fornece armamento  o mesmo nao fez a Russia atacou apenas alvos civis que e crime de guerra', 'authorDisplayName': 'Matfaycal', 'authorProfileImageUrl': 'https://yt3.ggpht.com/ytc/AGIKgqNLTfYucS0xek446eIojidqlcIIFNNlQgC1RgytMCdcdMrn3-IBn0BvRRUaQZ19=s48-c-k-c0x00ffffff-no-rj', 'authorChannelUrl': 'http://www.youtube.com/channel/UCdN5pcLZ3v5AbyHPIeBX48g', 'authorChannelId': {'value': 'UCdN5pcLZ3v5AbyHPIeBX48g'}, 'canRate': True, 'viewerRating': 'none', 'likeCount': 0, 'publishedAt': '2022-10-15T15:25:16Z', 'updatedAt': '2022-10-15T15:25:16Z'}}, 'canReply': True, 'totalReplyCount': 0, 'isPublic': True}",,UCdN5pcLZ3v5AbyHPIeBX48g,2022-10-15T15:25:16Z,"A ponte e um alvo militar , e por onde Russia fornece armamento  o mesmo nao fez a Russia atacou apenas alvos civis que e crime de guerra",,2023-06-08 18:01:04.413467
youtube#commentThread,3496Z-nJu8z00MY8AUXeBdwlsrs,UgxT-TBMud4xBd5d3xR4AaABAg,"{'videoId': '1YABkjsRMW8', 'topLevelComment': {'kind': 'youtube#comment', 'etag': 'Zn7XvSK3bgUy5aJ6y3NP2pl_g3Q', 'id': 'UgxT-TBMud4xBd5d3xR4AaABAg', 'snippet': {'videoId': '1YABkjsRMW8', 'textDisplay': '🤣🤣 voces ainda acreditam no papai Noel com essa idade ? putin nao vai parar de bombardear civil nunca ! Quem acredita nas palavras desse autocrata?', 'textOriginal': '🤣🤣 voces ainda acreditam no papai Noel com essa idade ? putin nao vai parar de bombardear civil nunca ! Quem acredita nas palavras desse autocrata?', 'authorDisplayName': 'Matfaycal', 'authorProfileImageUrl': 'https://yt3.ggpht.com/ytc/AGIKgqNLTfYucS0xek446eIojidqlcIIFNNlQgC1RgytMCdcdMrn3-IBn0BvRRUaQZ19=s48-c-k-c0x00ffffff-no-rj', 'authorChannelUrl': 'http://www.youtube.com/channel/UCdN5pcLZ3v5AbyHPIeBX48g', 'authorChannelId': {'value': 'UCdN5pcLZ3v5AbyHPIeBX48g'}, 'canRate': True, 'viewerRating': 'none', 'likeCount': 0, 'publishedAt': '2022-10-15T07:04:07Z', 'updatedAt': '2022-10-15T07:04:49Z'}}, 'canReply': True, 'totalReplyCount': 0, 'isPublic': True}",,UCdN5pcLZ3v5AbyHPIeBX48g,2022-10-15T07:04:07Z,🤣🤣 voces ainda acreditam no papai Noel com essa idade ? putin nao vai parar de bombardear civil nunca ! Quem acredita nas palavras desse autocrata?,QURTSl9pMVhBZ3RsSWt1OW1Gcl9fbkM2MW43TlpiYndkRGNwQk4xak1KLTBnVnhOZmdkbkxKWmVVc1dRcXVReGdvdEhFSUtpMXRyUzdPOA==,2023-06-08 18:02:44.932859
youtube#commentThread,pPVuz7ZRX_iJ96gZ3khZ600U-UE,UgzLbKkzJqt0zsUPrV54AaABAg,"{'videoId': 'cbadifxvSuA', 'topLevelComment': {'kind': 'youtube#comment', 'etag': 'gRGD9AxGe9-1z5A-fyzXqh7hlvo', 'id': 'UgzLbKkzJqt0zsUPrV54AaABAg', 'snippet': {'videoId': 'cbadifxvSuA', 'textDisplay': '143 países da ONU votaram contra Russia so 4 países estao a favor  Nicaragua Biolorrusia siria koreia do Norte sao esses que vao ajudar a Russia  na terceira guerra Mundial? 🤣 A Russia nem consegue vencer o 22° exercito do mundo como vai vencer US que gasta 20x mais nas forcas armadas', 'textOriginal': '143 países da ONU votaram contra Russia so 4 países estao a favor  Nicaragua Biolorrusia siria koreia do Norte sao esses que vao ajudar a Russia  na terceira guerra Mundial? 🤣 A Russia nem consegue vencer o 22° exercito do mundo como vai vencer US que gasta 20x mais nas forcas armadas', 'authorDisplayName': 'Matfaycal', 'authorProfileImageUrl': 'https://yt3.ggpht.com/ytc/AGIKgqNLTfYucS0xek446eIojidqlcIIFNNlQgC1RgytMCdcdMrn3-IBn0BvRRUaQZ19=s48-c-k-c0x00ffffff-no-rj', 'authorChannelUrl': 'http://www.youtube.com/channel/UCdN5pcLZ3v5AbyHPIeBX48g', 'authorChannelId': {'value': 'UCdN5pcLZ3v5AbyHPIeBX48g'}, 'canRate': True, 'viewerRating': 'none', 'likeCount': 0, 'publishedAt': '2022-10-14T12:19:18Z', 'updatedAt': '2022-10-14T12:21:19Z'}}, 'canReply': True, 'totalReplyCount': 1, 'isPublic': True}","{'comments': [{'kind': 'youtube#comment', 'etag': 'jOiwUXV-qVwGC6Pe4FfxCgmKWGo', 'id': 'UgzLbKkzJqt0zsUPrV54AaABAg.9h9v0BRVNk_9h9zYxW9QRT', 'snippet': {'videoId': 'cbadifxvSuA', 'textDisplay': 'armas nucleares seu animal. a russia pode ate perder a guerra nuclear, mas a europa vai ser totalmente dizimada, imagina a ucrania, vai virar um terreno plaino', 'textOriginal': 'armas nucleares seu animal. a russia pode ate perder a guerra nuclear, mas a europa vai ser totalmente dizimada, imagina a ucrania, vai virar um terreno plaino', 'parentId': 'UgzLbKkzJqt0zsUPrV54AaABAg', 'authorDisplayName': 'Proeminente', 'authorProfileImageUrl': 'https://yt3.ggpht.com/ytc/AGIKgqPnstohAqSTnO_lZl3fhBxnNv5eGZDiJ7IG_tAvhSp1w0Ifn6-aa7Py2xhrslms=s48-c-k-c0x00ffffff-no-rj', 'authorChannelUrl': 'http://www.youtube.com/channel/UCE_zLp257W8PDWOmB0OCKQg', 'authorChannelId': {'value': 'UCE_zLp257W8PDWOmB0OCKQg'}, 'canRate': True, 'viewerRating': 'none', 'likeCount': 0, 'publishedAt': '2022-10-14T12:59:00Z', 'updatedAt': '2022-10-14T12:59:00Z'}}]}",UCdN5pcLZ3v5AbyHPIeBX48g,2022-10-14T12:19:18Z,143 países da ONU votaram contra Russia so 4 países estao a favor  Nicaragua Biolorrusia siria koreia do Norte sao esses que vao ajudar a Russia  na terceira guerra Mundial? 🤣 A Russia nem consegue vencer o 22° exercito do mundo como vai vencer US que gasta 20x mais nas forcas armadas,,2023-06-08 18:07:17.375080
youtube#commentThread,emwAdhGAbdVbb54HTI5lE2d-sog,Ugy1e-viFENBWz1C2Ix4AaABAg,"{'videoId': 'cbadifxvSuA', 'topLevelComment': {'kind': 'youtube#comment', 'etag': 'AVGfFpka13M7cyFjUepMHWsRmFg', 'id': 'Ugy1e-viFENBWz1C2Ix4AaABAg', 'snippet': {'videoId': 'cbadifxvSuA', 'textDisplay': 'Ja alguem viu algumas imagens ? Ainda estou a espera dos documentos dos laboratorios  biologicos  dos genocidios que Russia fala tem fotos documentos etc  Ucrania ja mostrou valas humanas hospitais escolas etc do lado Russo sao apenas palavras zero !', 'textOriginal': 'Ja alguem viu algumas imagens ? Ainda estou a espera dos documentos dos laboratorios  biologicos  dos genocidios que Russia fala tem fotos documentos etc  Ucrania ja mostrou valas humanas hospitais escolas etc do lado Russo sao apenas palavras zero !', 'authorDisplayName': 'Matfaycal', 'authorProfileImageUrl': 'https://yt3.ggpht.com/ytc/AGIKgqNLTfYucS0xek446eIojidqlcIIFNNlQgC1RgytMCdcdMrn3-IBn0BvRRUaQZ19=s48-c-k-c0x00ffffff-no-rj', 'authorChannelUrl': 'http://www.youtube.com/channel/UCdN5pcLZ3v5AbyHPIeBX48g', 'authorChannelId': {'value': 'UCdN5pcLZ3v5AbyHPIeBX48g'}, 'canRate': True, 'viewerRating': 'none', 'likeCount': 0, 'publishedAt': '2022-10-14T12:17:04Z', 'updatedAt': '2022-10-14T12:17:04Z'}}, 'canReply': True, 'totalReplyCount': 0, 'isPublic': True}",,UCdN5pcLZ3v5AbyHPIeBX48g,2022-10-14T12:17:04Z,Ja alguem viu algumas imagens ? Ainda estou a espera dos documentos dos laboratorios  biologicos  dos genocidios que Russia fala tem fotos documentos etc  Ucrania ja mostrou valas humanas hospitais escolas etc do lado Russo sao apenas palavras zero !,,2023-06-08 18:07:17.375080
youtube#commentThread,TDYD9-CEyY6A20jFCvio8tfz2OM,Ugwla7pFuTI90M_9qux4AaABAg,"{'videoId': 'lrofIurxdTY', 'topLevelComment': {'kind': 'youtube#comment', 'etag': 'tgQlx9DUeCxKm5TH3UiZNoIdFGA', 'id': 'Ugwla7pFuTI90M_9qux4AaABAg', 'snippet': {'videoId': 'lrofIurxdTY', 'textDisplay': 'Faca me um favor nao viage para a Europa e um concelho de amigo', 'textOriginal': 'Faca me um favor nao viage para a Europa e um concelho de amigo', 'authorDisplayName': 'Matfaycal', 'authorProfileImageUrl': 'https://yt3.ggpht.com/ytc/AGIKgqNLTfYucS0xek446eIojidqlcIIFNNlQgC1RgytMCdcdMrn3-IBn0BvRRUaQZ19=s48-c-k-c0x00ffffff-no-rj', 'authorChannelUrl': 'http://www.youtube.com/channel/UCdN5pcLZ3v5AbyHPIeBX48g', 'authorChannelId': {'value': 'UCdN5pcLZ3v5AbyHPIeBX48g'}, 'canRate': True, 'viewerRating': 'none', 'likeCount': 0, 'publishedAt': '2022-10-13T11:11:37Z', 'updatedAt': '2022-10-13T11:11:37Z'}}, 'canReply': True, 'totalReplyCount': 0, 'isPublic': True}",,UCdN5pcLZ3v5AbyHPIeBX48g,2022-10-13T11:11:37Z,Faca me um favor nao viage para a Europa e um concelho de amigo,,2023-06-08 18:11:58.892131
youtube#commentThread,iTO6zRw3bDeNjuv_Zwge5TXRKn0,UgyxasGayOL9g9JzzsZ4AaABAg,"{'videoId': 'lrofIurxdTY', 'topLevelComment': {'kind': 'youtube#comment', 'etag': 'rTJIZ8aluqtKCSAIQMOiD9Rpwkk', 'id': 'UgyxasGayOL9g9JzzsZ4AaABAg', 'snippet': {'videoId': 'lrofIurxdTY', 'textDisplay': 'Nao e so Otan que ajuda fale a verdade ao povo Brasileiro Australia  koreia do sul  tai wan isso e OTAN  onde voce andou na escola ? Na escolinha do professor raimundo ! Voce e um sonhador', 'textOriginal': 'Nao e so Otan que ajuda fale a verdade ao povo Brasileiro Australia  koreia do sul  tai wan isso e OTAN  onde voce andou na escola ? Na escolinha do professor raimundo ! Voce e um sonhador', 'authorDisplayName': 'Matfaycal', 'authorProfileImageUrl': 'https://yt3.ggpht.com/ytc/AGIKgqNLTfYucS0xek446eIojidqlcIIFNNlQgC1RgytMCdcdMrn3-IBn0BvRRUaQZ19=s48-c-k-c0x00ffffff-no-rj', 'authorChannelUrl': 'http://www.youtube.com/channel/UCdN5pcLZ3v5AbyHPIeBX48g', 'authorChannelId': {'value': 'UCdN5pcLZ3v5AbyHPIeBX48g'}, 'canRate': True, 'viewerRating': 'none', 'likeCount': 1, 'publishedAt': '2022-10-13T11:11:03Z', 'updatedAt': '2022-10-13T11:11:03Z'}}, 'canReply': True, 'totalReplyCount': 0, 'isPublic': True}",,UCdN5pcLZ3v5AbyHPIeBX48g,2022-10-13T11:11:03Z,Nao e so Otan que ajuda fale a verdade ao povo Brasileiro Australia  koreia do sul  tai wan isso e OTAN  onde voce andou na escola ? Na escolinha do professor raimundo ! Voce e um sonhador,,2023-06-08 18:11:58.892131
youtube#commentThread,Ku2J1avswRCSbF0RT8AfdxvAh7o,Ugx8mUATsCq1U5HiuxJ4AaABAg,"{'videoId': 'lrofIurxdTY', 'topLevelComment': {'kind': 'youtube#comment', 'etag': 'dXi_uz4Cs4opLwLmbgjuFPeFmk0', 'id': 'Ugx8mUATsCq1U5HiuxJ4AaABAg', 'snippet': {'videoId': 'lrofIurxdTY', 'textDisplay': 'Mentira todos os alvos foram civis e so verem o que falou a ONU foram apenas alvos civis', 'textOriginal': 'Mentira todos os alvos foram civis e so verem o que falou a ONU foram apenas alvos civis', 'authorDisplayName': 'Matfaycal', 'authorProfileImageUrl': 'https://yt3.ggpht.com/ytc/AGIKgqNLTfYucS0xek446eIojidqlcIIFNNlQgC1RgytMCdcdMrn3-IBn0BvRRUaQZ19=s48-c-k-c0x00ffffff-no-rj', 'authorChannelUrl': 'http://www.youtube.com/channel/UCdN5pcLZ3v5AbyHPIeBX48g', 'authorChannelId': {'value': 'UCdN5pcLZ3v5AbyHPIeBX48g'}, 'canRate': True, 'viewerRating': 'none', 'likeCount': 0, 'publishedAt': '2022-10-13T11:09:02Z', 'updatedAt': '2022-10-13T11:09:18Z'}}, 'canReply': True, 'totalReplyCount': 0, 'isPublic': True}",,UCdN5pcLZ3v5AbyHPIeBX48g,2022-10-13T11:09:02Z,Mentira todos os alvos foram civis e so verem o que falou a ONU foram apenas alvos civis,,2023-06-08 18:11:58.892131
