kind,etag,id,snippet,replies,authorChannelId,publishedAt,textOriginal,nextPageToken,extraction_date
youtube#commentThread,QVc4fJR9P0PgUiU2KrlFnX8GX10,UgygSXrRSJBSo0c04jl4AaABAg,"{'videoId': '6nYewoxCSpE', 'topLevelComment': {'kind': 'youtube#comment', 'etag': 'n6aQMakl8LFpFHteNeM8YSDza-0', 'id': 'UgygSXrRSJBSo0c04jl4AaABAg', 'snippet': {'videoId': '6nYewoxCSpE', 'textDisplay': 'Combatem nada. Ninguém quer por a mão na chapa quente. Kkkkk sabe que queima', 'textOriginal': 'Combatem nada. Ninguém quer por a mão na chapa quente. Kkkkk sabe que queima', 'authorDisplayName': 'Noel Roviller', 'authorProfileImageUrl': 'https://yt3.ggpht.com/ytc/AGIKgqPs3lKIwFFQdq56py8reF88P1cD3mnfxdAYDnazMpr_vUZ2jm2ozy2-6dZ4CxAJ=s48-c-k-c0x00ffffff-no-rj', 'authorChannelUrl': 'http://www.youtube.com/channel/UCSfTt3-squrnNKt0pInNCfw', 'authorChannelId': {'value': 'UCSfTt3-squrnNKt0pInNCfw'}, 'canRate': True, 'viewerRating': 'none', 'likeCount': 0, 'publishedAt': '2022-10-19T22:20:34Z', 'updatedAt': '2022-10-19T22:20:34Z'}}, 'canReply': True, 'totalReplyCount': 0, 'isPublic': True}",,UCSfTt3-squrnNKt0pInNCfw,2022-10-19T22:20:34Z,Combatem nada. Ninguém quer por a mão na chapa quente. Kkkkk sabe que queima,QURTSl9pMVZiN1FNVmFNZTFNMlNabm9jdVNLMEdkTnNfZVFERDRqRmFUUWkzLUJ0c0hIc05VUjFVTmRoOGthSndNYTNLVXVHaHRNb3RzSQ==,2023-06-08 15:32:58.361982
youtube#commentThread,Pj_WdwF0iKR3JxoJ4-R4IxH1uNQ,UgzgWuP2UBrBrMrHV_d4AaABAg,"{'videoId': '-WVhpDKjrAw', 'topLevelComment': {'kind': 'youtube#comment', 'etag': 'vlR10mwxCMBkPKcIiSLbihgkpbA', 'id': 'UgzgWuP2UBrBrMrHV_d4AaABAg', 'snippet': {'videoId': '-WVhpDKjrAw', 'textDisplay': 'Jurista renomado .mas não apita nada.', 'textOriginal': 'Jurista renomado .mas não apita nada.', 'authorDisplayName': 'Noel Roviller', 'authorProfileImageUrl': 'https://yt3.ggpht.com/ytc/AGIKgqPs3lKIwFFQdq56py8reF88P1cD3mnfxdAYDnazMpr_vUZ2jm2ozy2-6dZ4CxAJ=s48-c-k-c0x00ffffff-no-rj', 'authorChannelUrl': 'http://www.youtube.com/channel/UCSfTt3-squrnNKt0pInNCfw', 'authorChannelId': {'value': 'UCSfTt3-squrnNKt0pInNCfw'}, 'canRate': True, 'viewerRating': 'none', 'likeCount': 0, 'publishedAt': '2022-10-19T21:53:52Z', 'updatedAt': '2022-10-19T21:53:52Z'}}, 'canReply': True, 'totalReplyCount': 0, 'isPublic': True}",,UCSfTt3-squrnNKt0pInNCfw,2022-10-19T21:53:52Z,Jurista renomado .mas não apita nada.,QURTSl9pMlZPZnM0cHBaTlMta0ZMMnp4bXllY3NWRmluNm40TUJKVGNSaDJyaWN6XzktTFhjYnNRYkNXMVFXNTBlQmlPRlZsajVQVllDcw==,2023-06-08 15:33:27.149968
youtube#commentThread,BMSBVdz1JvBRc3Ou6pRUL5XCYh8,UgzVlEXIujrvytAe8414AaABAg,"{'videoId': 'roEuNqBcuSs', 'topLevelComment': {'kind': 'youtube#comment', 'etag': 'DZ6n8U1jpxQLrRYc2PeX1XMHP-o', 'id': 'UgzVlEXIujrvytAe8414AaABAg', 'snippet': {'videoId': 'roEuNqBcuSs', 'textDisplay': 'Ouvi o que. Pra que perícia?   Matou o bandido um a menos p ser tratado pelo povo. Isso aí é política do PT de desarmar o povo é armar os bandidos.  Será q eles tinham porte??? São besta', 'textOriginal': 'Ouvi o que. Pra que perícia?   Matou o bandido um a menos p ser tratado pelo povo. Isso aí é política do PT de desarmar o povo é armar os bandidos.  Será q eles tinham porte??? São besta', 'authorDisplayName': 'Noel Roviller', 'authorProfileImageUrl': 'https://yt3.ggpht.com/ytc/AGIKgqPs3lKIwFFQdq56py8reF88P1cD3mnfxdAYDnazMpr_vUZ2jm2ozy2-6dZ4CxAJ=s48-c-k-c0x00ffffff-no-rj', 'authorChannelUrl': 'http://www.youtube.com/channel/UCSfTt3-squrnNKt0pInNCfw', 'authorChannelId': {'value': 'UCSfTt3-squrnNKt0pInNCfw'}, 'canRate': True, 'viewerRating': 'none', 'likeCount': 0, 'publishedAt': '2022-10-21T00:44:04Z', 'updatedAt': '2022-10-21T00:44:04Z'}}, 'canReply': True, 'totalReplyCount': 0, 'isPublic': True}",,UCSfTt3-squrnNKt0pInNCfw,2022-10-21T00:44:04Z,Ouvi o que. Pra que perícia?   Matou o bandido um a menos p ser tratado pelo povo. Isso aí é política do PT de desarmar o povo é armar os bandidos.  Será q eles tinham porte??? São besta,QURTSl9pM0gyLVlPWkxwQkQ5V2pGUW95c0daNDcwZmJTcUE4YXBidmpWVFI2Wnp3ZjNsNXU1X3VabDZrQlYtWGxqSWk3NUR6dnc2WGhLbw==,2023-06-08 15:39:07.858497
youtube#commentThread,WwnpRcl9kQF6jsr9dUN_Ym_3nP8,Ugy5-VhbGFJLWv_tahV4AaABAg,"{'videoId': 'roEuNqBcuSs', 'topLevelComment': {'kind': 'youtube#comment', 'etag': 'gBRyPB7888z9e1F7FmKJmEb6H4I', 'id': 'Ugy5-VhbGFJLWv_tahV4AaABAg', 'snippet': {'videoId': 'roEuNqBcuSs', 'textDisplay': 'Tomou no bolso e foi p buraco c buraco no corpo', 'textOriginal': 'Tomou no bolso e foi p buraco c buraco no corpo', 'authorDisplayName': 'Noel Roviller', 'authorProfileImageUrl': 'https://yt3.ggpht.com/ytc/AGIKgqPs3lKIwFFQdq56py8reF88P1cD3mnfxdAYDnazMpr_vUZ2jm2ozy2-6dZ4CxAJ=s48-c-k-c0x00ffffff-no-rj', 'authorChannelUrl': 'http://www.youtube.com/channel/UCSfTt3-squrnNKt0pInNCfw', 'authorChannelId': {'value': 'UCSfTt3-squrnNKt0pInNCfw'}, 'canRate': True, 'viewerRating': 'none', 'likeCount': 0, 'publishedAt': '2022-10-21T00:42:09Z', 'updatedAt': '2022-10-21T00:42:09Z'}}, 'canReply': True, 'totalReplyCount': 0, 'isPublic': True}",,UCSfTt3-squrnNKt0pInNCfw,2022-10-21T00:42:09Z,Tomou no bolso e foi p buraco c buraco no corpo,QURTSl9pM0gyLVlPWkxwQkQ5V2pGUW95c0daNDcwZmJTcUE4YXBidmpWVFI2Wnp3ZjNsNXU1X3VabDZrQlYtWGxqSWk3NUR6dnc2WGhLbw==,2023-06-08 15:39:07.858497
youtube#commentThread,DmdrfN3sFY9OjXWCH8iEOFtB2aY,Ugz9pOzdVYOb7u7Uo7R4AaABAg,"{'videoId': 'Or_CWz3xdGg', 'topLevelComment': {'kind': 'youtube#comment', 'etag': 'wChEt5WdG3Mk45CtJ6N5HVvpZNk', 'id': 'Ugz9pOzdVYOb7u7Uo7R4AaABAg', 'snippet': {'videoId': 'Or_CWz3xdGg', 'textDisplay': 'Coitado foi povo  e os prefeitos só saboreando a nata.  O povo lambendo o doce.sem falar no iptu e o ipva  que entra o recurso e sai e ninguém sabe onde vai. Não existe uma lei específica para isso', 'textOriginal': 'Coitado foi povo  e os prefeitos só saboreando a nata.  O povo lambendo o doce.sem falar no iptu e o ipva  que entra o recurso e sai e ninguém sabe onde vai. Não existe uma lei específica para isso', 'authorDisplayName': 'Noel Roviller', 'authorProfileImageUrl': 'https://yt3.ggpht.com/ytc/AGIKgqPs3lKIwFFQdq56py8reF88P1cD3mnfxdAYDnazMpr_vUZ2jm2ozy2-6dZ4CxAJ=s48-c-k-c0x00ffffff-no-rj', 'authorChannelUrl': 'http://www.youtube.com/channel/UCSfTt3-squrnNKt0pInNCfw', 'authorChannelId': {'value': 'UCSfTt3-squrnNKt0pInNCfw'}, 'canRate': True, 'viewerRating': 'none', 'likeCount': 0, 'publishedAt': '2022-10-17T13:53:46Z', 'updatedAt': '2022-10-17T13:53:46Z'}}, 'canReply': True, 'totalReplyCount': 0, 'isPublic': True}",,UCSfTt3-squrnNKt0pInNCfw,2022-10-17T13:53:46Z,Coitado foi povo  e os prefeitos só saboreando a nata.  O povo lambendo o doce.sem falar no iptu e o ipva  que entra o recurso e sai e ninguém sabe onde vai. Não existe uma lei específica para isso,QURTSl9pM1llWVVGVHg3Y3J1WWVONUUtMllzdk1MMER6QlA0UWs0OXhlRUZ0LU4tUjdFTVo1VVdlaUtyMXdnRWFDWjlZZkNNSXpJMmVBZw==,2023-06-08 15:49:19.215612
youtube#commentThread,TVWcsnLIGuxMhQ29gYG4k6F2JRI,UgyyIIgJ8INaMPlmJUZ4AaABAg,"{'videoId': 'uPQD5QPGqsg', 'topLevelComment': {'kind': 'youtube#comment', 'etag': 'OPRyt_9MxZzQ2_obllQlrw3K0OY', 'id': 'UgyyIIgJ8INaMPlmJUZ4AaABAg', 'snippet': {'videoId': 'uPQD5QPGqsg', 'textDisplay': 'Tô falando. O cara só enche linguica', 'textOriginal': 'Tô falando. O cara só enche linguica', 'authorDisplayName': 'Noel Roviller', 'authorProfileImageUrl': 'https://yt3.ggpht.com/ytc/AGIKgqPs3lKIwFFQdq56py8reF88P1cD3mnfxdAYDnazMpr_vUZ2jm2ozy2-6dZ4CxAJ=s48-c-k-c0x00ffffff-no-rj', 'authorChannelUrl': 'http://www.youtube.com/channel/UCSfTt3-squrnNKt0pInNCfw', 'authorChannelId': {'value': 'UCSfTt3-squrnNKt0pInNCfw'}, 'canRate': True, 'viewerRating': 'none', 'likeCount': 0, 'publishedAt': '2022-10-30T20:02:43Z', 'updatedAt': '2022-10-30T20:02:43Z'}}, 'canReply': True, 'totalReplyCount': 0, 'isPublic': True}",,UCSfTt3-squrnNKt0pInNCfw,2022-10-30T20:02:43Z,Tô falando. O cara só enche linguica,QURTSl9pMTI1MmwtNkdJNzVBcHpHbHlqUVFTc0JYTC1XbEtoUlh2MUVGNVBoNkFyNWIxNTBzQ1FfSVB5QlY0NlB0T2VKTXFjNFVRcEVSZw==,2023-06-08 14:11:00.596001
youtube#commentThread,hheYpUs25VUeyXC3AvaIdWHsURs,Ugw43Fyin3QRjuRkc5R4AaABAg,"{'videoId': 'uPQD5QPGqsg', 'topLevelComment': {'kind': 'youtube#comment', 'etag': '-n4R227eb1rJaHniBY8FlZUZi74', 'id': 'Ugw43Fyin3QRjuRkc5R4AaABAg', 'snippet': {'videoId': 'uPQD5QPGqsg', 'textDisplay': 'Cada pergunta besta. O cara já respondeu. E continuam perguntando', 'textOriginal': 'Cada pergunta besta. O cara já respondeu. E continuam perguntando', 'authorDisplayName': 'Noel Roviller', 'authorProfileImageUrl': 'https://yt3.ggpht.com/ytc/AGIKgqPs3lKIwFFQdq56py8reF88P1cD3mnfxdAYDnazMpr_vUZ2jm2ozy2-6dZ4CxAJ=s48-c-k-c0x00ffffff-no-rj', 'authorChannelUrl': 'http://www.youtube.com/channel/UCSfTt3-squrnNKt0pInNCfw', 'authorChannelId': {'value': 'UCSfTt3-squrnNKt0pInNCfw'}, 'canRate': True, 'viewerRating': 'none', 'likeCount': 2, 'publishedAt': '2022-10-30T20:01:02Z', 'updatedAt': '2022-10-30T20:01:02Z'}}, 'canReply': True, 'totalReplyCount': 0, 'isPublic': True}",,UCSfTt3-squrnNKt0pInNCfw,2022-10-30T20:01:02Z,Cada pergunta besta. O cara já respondeu. E continuam perguntando,QURTSl9pMTI1MmwtNkdJNzVBcHpHbHlqUVFTc0JYTC1XbEtoUlh2MUVGNVBoNkFyNWIxNTBzQ1FfSVB5QlY0NlB0T2VKTXFjNFVRcEVSZw==,2023-06-08 14:11:00.596001
youtube#commentThread,ztMSMcl4xxUJEXst9aIR3fYrAjc,Ugx3oi7gomAv4TUbWz14AaABAg,"{'videoId': 'QYzlGWp-0Jg', 'topLevelComment': {'kind': 'youtube#comment', 'etag': 'KWW-V7EoH2fKzvu1HI0y9F-7ET0', 'id': 'Ugx3oi7gomAv4TUbWz14AaABAg', 'snippet': {'videoId': 'QYzlGWp-0Jg', 'textDisplay': 'Kkkkk', 'textOriginal': 'Kkkkk', 'authorDisplayName': 'Noel Roviller', 'authorProfileImageUrl': 'https://yt3.ggpht.com/ytc/AGIKgqPs3lKIwFFQdq56py8reF88P1cD3mnfxdAYDnazMpr_vUZ2jm2ozy2-6dZ4CxAJ=s48-c-k-c0x00ffffff-no-rj', 'authorChannelUrl': 'http://www.youtube.com/channel/UCSfTt3-squrnNKt0pInNCfw', 'authorChannelId': {'value': 'UCSfTt3-squrnNKt0pInNCfw'}, 'canRate': True, 'viewerRating': 'none', 'likeCount': 0, 'publishedAt': '2022-10-30T19:55:44Z', 'updatedAt': '2022-10-30T19:55:44Z'}}, 'canReply': True, 'totalReplyCount': 0, 'isPublic': True}",,UCSfTt3-squrnNKt0pInNCfw,2022-10-30T19:55:44Z,Kkkkk,QURTSl9pMVo3YVlMNkxmX3FKc3R3Yzd5RHFqQzJwZWFBeDk2bURheHVlUTVxaFFQd0JoOXNtNU9FWFY2aUFNV1g4ckVYeTA3NXhkZVFLUQ==,2023-06-08 14:11:10.822065
youtube#commentThread,Odw1XarLxx0s3i8D8qrwLUd5lIw,UgwsLH5BFOI-4ldVuXB4AaABAg,"{'videoId': 'QYzlGWp-0Jg', 'topLevelComment': {'kind': 'youtube#comment', 'etag': '9Vvd0z_U_UiAypgNClQgZ4Tk9-8', 'id': 'UgwsLH5BFOI-4ldVuXB4AaABAg', 'snippet': {'videoId': 'QYzlGWp-0Jg', 'textDisplay': 'Ele me lembra o Sebastian do filme o homem sem sombra.', 'textOriginal': 'Ele me lembra o Sebastian do filme o homem sem sombra.', 'authorDisplayName': 'Noel Roviller', 'authorProfileImageUrl': 'https://yt3.ggpht.com/ytc/AGIKgqPs3lKIwFFQdq56py8reF88P1cD3mnfxdAYDnazMpr_vUZ2jm2ozy2-6dZ4CxAJ=s48-c-k-c0x00ffffff-no-rj', 'authorChannelUrl': 'http://www.youtube.com/channel/UCSfTt3-squrnNKt0pInNCfw', 'authorChannelId': {'value': 'UCSfTt3-squrnNKt0pInNCfw'}, 'canRate': True, 'viewerRating': 'none', 'likeCount': 0, 'publishedAt': '2022-10-30T19:55:33Z', 'updatedAt': '2022-10-30T19:55:33Z'}}, 'canReply': True, 'totalReplyCount': 0, 'isPublic': True}",,UCSfTt3-squrnNKt0pInNCfw,2022-10-30T19:55:33Z,Ele me lembra o Sebastian do filme o homem sem sombra.,QURTSl9pMVo3YVlMNkxmX3FKc3R3Yzd5RHFqQzJwZWFBeDk2bURheHVlUTVxaFFQd0JoOXNtNU9FWFY2aUFNV1g4ckVYeTA3NXhkZVFLUQ==,2023-06-08 14:11:10.822065
youtube#commentThread,3dG3JfOwbn5A2riWy3g61qGfamk,UgwZKW1Gz2q2CIugvbp4AaABAg,"{'videoId': 'aiOPJd1CmCE', 'topLevelComment': {'kind': 'youtube#comment', 'etag': '4XilKTgOFItFD8SMjLKa3MWfpto', 'id': 'UgwZKW1Gz2q2CIugvbp4AaABAg', 'snippet': {'videoId': 'aiOPJd1CmCE', 'textDisplay': 'Isso só pode ser para funcionário público.  P mim ninguém oferece nada.porque não quero nada em troca do meu voto. Agora votar no PT e pra acabar. Coitado do povo cego.e isso que dá ficar se vendendo.  Entrou não pode sair. E uma pirâmide.   Quem entra trabalha para levar mais.', 'textOriginal': 'Isso só pode ser para funcionário público.  P mim ninguém oferece nada.porque não quero nada em troca do meu voto. Agora votar no PT e pra acabar. Coitado do povo cego.e isso que dá ficar se vendendo.  Entrou não pode sair. E uma pirâmide.   Quem entra trabalha para levar mais.', 'authorDisplayName': 'Noel Roviller', 'authorProfileImageUrl': 'https://yt3.ggpht.com/ytc/AGIKgqPs3lKIwFFQdq56py8reF88P1cD3mnfxdAYDnazMpr_vUZ2jm2ozy2-6dZ4CxAJ=s48-c-k-c0x00ffffff-no-rj', 'authorChannelUrl': 'http://www.youtube.com/channel/UCSfTt3-squrnNKt0pInNCfw', 'authorChannelId': {'value': 'UCSfTt3-squrnNKt0pInNCfw'}, 'canRate': True, 'viewerRating': 'none', 'likeCount': 0, 'publishedAt': '2022-10-16T13:20:16Z', 'updatedAt': '2022-10-16T13:20:16Z'}}, 'canReply': True, 'totalReplyCount': 0, 'isPublic': True}",,UCSfTt3-squrnNKt0pInNCfw,2022-10-16T13:20:16Z,Isso só pode ser para funcionário público.  P mim ninguém oferece nada.porque não quero nada em troca do meu voto. Agora votar no PT e pra acabar. Coitado do povo cego.e isso que dá ficar se vendendo.  Entrou não pode sair. E uma pirâmide.   Quem entra trabalha para levar mais.,QURTSl9pMTVnV0VackZTcnBRaVRKamtkZTRaZWM1Vm54cFdiNkNHdHZnbm1rNUlaT3pWVjhpSFZrNEFpWFhFUUJIbVFJLWw3bHdFVHpTOA==,2023-06-08 15:51:17.586152
youtube#commentThread,qxq_xCKOSwMkTrHLk3WcJz6rVT4,UgwtmT7FapXXtMVj-TV4AaABAg,"{'videoId': 'aiOPJd1CmCE', 'topLevelComment': {'kind': 'youtube#comment', 'etag': 'GTxOugwZX-DTMRt01uDEnzVRjyw', 'id': 'UgwtmT7FapXXtMVj-TV4AaABAg', 'snippet': {'videoId': 'aiOPJd1CmCE', 'textDisplay': 'Nada haver.  Cada eleitor que for vota seja possível um ou por outro.ou não votar. E uma decisão propia', 'textOriginal': 'Nada haver.  Cada eleitor que for vota seja possível um ou por outro.ou não votar. E uma decisão propia', 'authorDisplayName': 'Noel Roviller', 'authorProfileImageUrl': 'https://yt3.ggpht.com/ytc/AGIKgqPs3lKIwFFQdq56py8reF88P1cD3mnfxdAYDnazMpr_vUZ2jm2ozy2-6dZ4CxAJ=s48-c-k-c0x00ffffff-no-rj', 'authorChannelUrl': 'http://www.youtube.com/channel/UCSfTt3-squrnNKt0pInNCfw', 'authorChannelId': {'value': 'UCSfTt3-squrnNKt0pInNCfw'}, 'canRate': True, 'viewerRating': 'none', 'likeCount': 0, 'publishedAt': '2022-10-16T13:17:02Z', 'updatedAt': '2022-10-16T13:17:02Z'}}, 'canReply': True, 'totalReplyCount': 0, 'isPublic': True}",,UCSfTt3-squrnNKt0pInNCfw,2022-10-16T13:17:02Z,Nada haver.  Cada eleitor que for vota seja possível um ou por outro.ou não votar. E uma decisão propia,QURTSl9pMTVnV0VackZTcnBRaVRKamtkZTRaZWM1Vm54cFdiNkNHdHZnbm1rNUlaT3pWVjhpSFZrNEFpWFhFUUJIbVFJLWw3bHdFVHpTOA==,2023-06-08 15:51:17.586152
youtube#commentThread,Up68A5LAs9D-GThtHaqDdirz4YQ,Ugwy-O7yhN5XpqwSPp14AaABAg,"{'videoId': '0A1dCLARsMQ', 'topLevelComment': {'kind': 'youtube#comment', 'etag': 'stzNfZDDii7zysvuW0MxzURDdCA', 'id': 'Ugwy-O7yhN5XpqwSPp14AaABAg', 'snippet': {'videoId': '0A1dCLARsMQ', 'textDisplay': 'O dinheiro corrompe os bons costumes.kkkkkkkkk', 'textOriginal': 'O dinheiro corrompe os bons costumes.kkkkkkkkk', 'authorDisplayName': 'Noel Roviller', 'authorProfileImageUrl': 'https://yt3.ggpht.com/ytc/AGIKgqPs3lKIwFFQdq56py8reF88P1cD3mnfxdAYDnazMpr_vUZ2jm2ozy2-6dZ4CxAJ=s48-c-k-c0x00ffffff-no-rj', 'authorChannelUrl': 'http://www.youtube.com/channel/UCSfTt3-squrnNKt0pInNCfw', 'authorChannelId': {'value': 'UCSfTt3-squrnNKt0pInNCfw'}, 'canRate': True, 'viewerRating': 'none', 'likeCount': 1, 'publishedAt': '2022-10-16T13:25:35Z', 'updatedAt': '2022-10-16T13:25:35Z'}}, 'canReply': True, 'totalReplyCount': 0, 'isPublic': True}",,UCSfTt3-squrnNKt0pInNCfw,2022-10-16T13:25:35Z,O dinheiro corrompe os bons costumes.kkkkkkkkk,QURTSl9pMlF2SUVzVGxuMXlJLUlkX25WYldSM0ZKTmlhblEtTHF4Skk4eVR0S3I4SnZmT0tnMTFmenlrbnFaekVSVGNXQjJFY3pwWEdlQQ==,2023-06-08 17:59:48.034562
youtube#commentThread,CSPd3VMgym1f1hVQhiqKoMa1Ngg,UgwGkRW4IL33sr19uZR4AaABAg,"{'videoId': '0A1dCLARsMQ', 'topLevelComment': {'kind': 'youtube#comment', 'etag': 'b_QWmT1dQ5UG0xLO1PFfcIcxWCg', 'id': 'UgwGkRW4IL33sr19uZR4AaABAg', 'snippet': {'videoId': '0A1dCLARsMQ', 'textDisplay': 'Que vergonha Amoedo.   Eu quero achava que vc seria um esperanca', 'textOriginal': 'Que vergonha Amoedo.   Eu quero achava que vc seria um esperanca', 'authorDisplayName': 'Noel Roviller', 'authorProfileImageUrl': 'https://yt3.ggpht.com/ytc/AGIKgqPs3lKIwFFQdq56py8reF88P1cD3mnfxdAYDnazMpr_vUZ2jm2ozy2-6dZ4CxAJ=s48-c-k-c0x00ffffff-no-rj', 'authorChannelUrl': 'http://www.youtube.com/channel/UCSfTt3-squrnNKt0pInNCfw', 'authorChannelId': {'value': 'UCSfTt3-squrnNKt0pInNCfw'}, 'canRate': True, 'viewerRating': 'none', 'likeCount': 0, 'publishedAt': '2022-10-16T13:23:05Z', 'updatedAt': '2022-10-16T13:23:05Z'}}, 'canReply': True, 'totalReplyCount': 0, 'isPublic': True}",,UCSfTt3-squrnNKt0pInNCfw,2022-10-16T13:23:05Z,Que vergonha Amoedo.   Eu quero achava que vc seria um esperanca,QURTSl9pMlF2SUVzVGxuMXlJLUlkX25WYldSM0ZKTmlhblEtTHF4Skk4eVR0S3I4SnZmT0tnMTFmenlrbnFaekVSVGNXQjJFY3pwWEdlQQ==,2023-06-08 17:59:48.034562
youtube#commentThread,6lCBjg5voU1IFD3mxc9BiKVMNgg,UgwSl5OVBoHQX8vwQAF4AaABAg,"{'videoId': 'JR9tkEaVe18', 'topLevelComment': {'kind': 'youtube#comment', 'etag': 'GbwhDvPxdJLxCddslr4Tj0-mvmA', 'id': 'UgwSl5OVBoHQX8vwQAF4AaABAg', 'snippet': {'videoId': 'JR9tkEaVe18', 'textDisplay': 'Deveriam ter vergonha na cara. Já q gostam de brigar não deveria ter hospital de graça.  Tem q pagar particular. Não usar o Sus. Outros pacientes que precisam realmente sofrem porque tem q dar a vaga para atender essas emergências. Praticada por vândalos.  Não torcedores.  Eles tem q pagar particular. Deveria existir uma lei que assim se faca', 'textOriginal': 'Deveriam ter vergonha na cara. Já q gostam de brigar não deveria ter hospital de graça.  Tem q pagar particular. Não usar o Sus. Outros pacientes que precisam realmente sofrem porque tem q dar a vaga para atender essas emergências. Praticada por vândalos.  Não torcedores.  Eles tem q pagar particular. Deveria existir uma lei que assim se faca', 'authorDisplayName': 'Noel Roviller', 'authorProfileImageUrl': 'https://yt3.ggpht.com/ytc/AGIKgqPs3lKIwFFQdq56py8reF88P1cD3mnfxdAYDnazMpr_vUZ2jm2ozy2-6dZ4CxAJ=s48-c-k-c0x00ffffff-no-rj', 'authorChannelUrl': 'http://www.youtube.com/channel/UCSfTt3-squrnNKt0pInNCfw', 'authorChannelId': {'value': 'UCSfTt3-squrnNKt0pInNCfw'}, 'canRate': True, 'viewerRating': 'none', 'likeCount': 0, 'publishedAt': '2022-10-15T22:37:51Z', 'updatedAt': '2022-10-15T22:37:51Z'}}, 'canReply': True, 'totalReplyCount': 0, 'isPublic': True}",,UCSfTt3-squrnNKt0pInNCfw,2022-10-15T22:37:51Z,Deveriam ter vergonha na cara. Já q gostam de brigar não deveria ter hospital de graça.  Tem q pagar particular. Não usar o Sus. Outros pacientes que precisam realmente sofrem porque tem q dar a vaga para atender essas emergências. Praticada por vândalos.  Não torcedores.  Eles tem q pagar particular. Deveria existir uma lei que assim se faca,QURTSl9pMHFOejhjVDV0SkM3YlpnQmpMMFJyWGlHYmhzT2VCSXR0Y0tXOFZDcEo1Rk14ai1zUWpmVlNVc0hXY0hSaHZvY1Q3X1pEU0RIcw==,2023-06-08 18:00:29.682253
youtube#commentThread,QUO96WoVUOhQanRDcegCSW8vYQw,UgxBJqA_o3lrLnJ9UWl4AaABAg,"{'videoId': '7fI53_AlkaU', 'topLevelComment': {'kind': 'youtube#comment', 'etag': '9s9CdFSAKGAq-fyGSraIP2wibzg', 'id': 'UgxBJqA_o3lrLnJ9UWl4AaABAg', 'snippet': {'videoId': '7fI53_AlkaU', 'textDisplay': 'Engraçado que ninguém sabia. Só agora na hora da decisão da eleição aparece.', 'textOriginal': 'Engraçado que ninguém sabia. Só agora na hora da decisão da eleição aparece.', 'authorDisplayName': 'Noel Roviller', 'authorProfileImageUrl': 'https://yt3.ggpht.com/ytc/AGIKgqPs3lKIwFFQdq56py8reF88P1cD3mnfxdAYDnazMpr_vUZ2jm2ozy2-6dZ4CxAJ=s48-c-k-c0x00ffffff-no-rj', 'authorChannelUrl': 'http://www.youtube.com/channel/UCSfTt3-squrnNKt0pInNCfw', 'authorChannelId': {'value': 'UCSfTt3-squrnNKt0pInNCfw'}, 'canRate': True, 'viewerRating': 'none', 'likeCount': 4, 'publishedAt': '2022-10-15T15:57:56Z', 'updatedAt': '2022-10-15T15:57:56Z'}}, 'canReply': True, 'totalReplyCount': 0, 'isPublic': True}",,UCSfTt3-squrnNKt0pInNCfw,2022-10-15T15:57:56Z,Engraçado que ninguém sabia. Só agora na hora da decisão da eleição aparece.,QURTSl9pMHBPMHBKZldpRWFtMlZjNUpNVU9ydE1aNDJEX0E4VUN5eExqYTA5SVJFQURRekl4WVhqZ0JpUF9EQnJQcktVQWF4ZHM5TnNaWQ==,2023-06-08 18:00:58.714493
youtube#commentThread,Zx5YLDa40dzYJ08vZ-ImTTsc0xY,UgzjqAoKK90E4rfRWaJ4AaABAg,"{'videoId': 'rHvPc3MkuJ4', 'topLevelComment': {'kind': 'youtube#comment', 'etag': 'YU6wTbj2LxfiKw-lZvu-AuoRNSs', 'id': 'UgzjqAoKK90E4rfRWaJ4AaABAg', 'snippet': {'videoId': 'rHvPc3MkuJ4', 'textDisplay': 'Parece que é tudo combinado. Sai fulano. Entra fulano. Sai fulano. Entra fulano. Tudo acertado. Eu amo q eles vão da mais 4 anos p bolsonaro. Porque todos ficaram 8 anos. Eu acho que vai ser assim. A não ser q acha algo muito diferente dos resultados das urnas.  Daí vem os militares.', 'textOriginal': 'Parece que é tudo combinado. Sai fulano. Entra fulano. Sai fulano. Entra fulano. Tudo acertado. Eu amo q eles vão da mais 4 anos p bolsonaro. Porque todos ficaram 8 anos. Eu acho que vai ser assim. A não ser q acha algo muito diferente dos resultados das urnas.  Daí vem os militares.', 'authorDisplayName': 'Noel Roviller', 'authorProfileImageUrl': 'https://yt3.ggpht.com/ytc/AGIKgqPs3lKIwFFQdq56py8reF88P1cD3mnfxdAYDnazMpr_vUZ2jm2ozy2-6dZ4CxAJ=s48-c-k-c0x00ffffff-no-rj', 'authorChannelUrl': 'http://www.youtube.com/channel/UCSfTt3-squrnNKt0pInNCfw', 'authorChannelId': {'value': 'UCSfTt3-squrnNKt0pInNCfw'}, 'canRate': True, 'viewerRating': 'none', 'likeCount': 2, 'publishedAt': '2022-10-15T15:53:45Z', 'updatedAt': '2022-10-15T15:53:45Z'}}, 'canReply': True, 'totalReplyCount': 0, 'isPublic': True}",,UCSfTt3-squrnNKt0pInNCfw,2022-10-15T15:53:45Z,Parece que é tudo combinado. Sai fulano. Entra fulano. Sai fulano. Entra fulano. Tudo acertado. Eu amo q eles vão da mais 4 anos p bolsonaro. Porque todos ficaram 8 anos. Eu acho que vai ser assim. A não ser q acha algo muito diferente dos resultados das urnas.  Daí vem os militares.,QURTSl9pMDJ1UmUyb1ljdjFhZktxdUxVemQxc25Rck14LWtLNURadXlkYzNwQTRmdE9mTnVON2hzWFR0UldtUUJaUTVzQkgwQ3R4VElpSQ==,2023-06-08 18:01:02.421436
youtube#commentThread,BVGaQ1z7shsqL0clJuA_xfN7KvU,Ugzt1We_sh59fP1Qzp14AaABAg,"{'videoId': '9GvCpWl7tB8', 'topLevelComment': {'kind': 'youtube#comment', 'etag': '8BgDpb1FmdZM6XAUiFzTMPk65U4', 'id': 'Ugzt1We_sh59fP1Qzp14AaABAg', 'snippet': {'videoId': '9GvCpWl7tB8', 'textDisplay': 'Pode ser imaginação. Vendo muitos filmes? Kkkk', 'textOriginal': 'Pode ser imaginação. Vendo muitos filmes? Kkkk', 'authorDisplayName': 'Noel Roviller', 'authorProfileImageUrl': 'https://yt3.ggpht.com/ytc/AGIKgqPs3lKIwFFQdq56py8reF88P1cD3mnfxdAYDnazMpr_vUZ2jm2ozy2-6dZ4CxAJ=s48-c-k-c0x00ffffff-no-rj', 'authorChannelUrl': 'http://www.youtube.com/channel/UCSfTt3-squrnNKt0pInNCfw', 'authorChannelId': {'value': 'UCSfTt3-squrnNKt0pInNCfw'}, 'canRate': True, 'viewerRating': 'none', 'likeCount': 0, 'publishedAt': '2022-10-14T15:29:12Z', 'updatedAt': '2022-10-14T15:29:12Z'}}, 'canReply': True, 'totalReplyCount': 0, 'isPublic': True}",,UCSfTt3-squrnNKt0pInNCfw,2022-10-14T15:29:12Z,Pode ser imaginação. Vendo muitos filmes? Kkkk,QURTSl9pMmIzOFQ3STNYWkZSZWpJOEplZDFjVWtDTjRUaHc1WmV0Z2h6UWVXX1QzNU5oMVQ4REkxWnA2aHJLMHRoWEtQdkROSGZDZGJqNA==,2023-06-08 18:06:06.200670
youtube#commentThread,Appgkl877MsH0c1NB0NsmX_N2Iw,UgxVhU2W2eJhv7t3iSp4AaABAg,"{'videoId': '9GvCpWl7tB8', 'topLevelComment': {'kind': 'youtube#comment', 'etag': 'plomhrDaUUXVZpgnL5dyJjPv0SY', 'id': 'UgxVhU2W2eJhv7t3iSp4AaABAg', 'snippet': {'videoId': '9GvCpWl7tB8', 'textDisplay': 'Eu acho que ela falou mal.e ainda pior num local onde tinha muitas pessoas.espaco público.', 'textOriginal': 'Eu acho que ela falou mal.e ainda pior num local onde tinha muitas pessoas.espaco público.', 'authorDisplayName': 'Noel Roviller', 'authorProfileImageUrl': 'https://yt3.ggpht.com/ytc/AGIKgqPs3lKIwFFQdq56py8reF88P1cD3mnfxdAYDnazMpr_vUZ2jm2ozy2-6dZ4CxAJ=s48-c-k-c0x00ffffff-no-rj', 'authorChannelUrl': 'http://www.youtube.com/channel/UCSfTt3-squrnNKt0pInNCfw', 'authorChannelId': {'value': 'UCSfTt3-squrnNKt0pInNCfw'}, 'canRate': True, 'viewerRating': 'none', 'likeCount': 0, 'publishedAt': '2022-10-14T15:28:34Z', 'updatedAt': '2022-10-14T15:28:34Z'}}, 'canReply': True, 'totalReplyCount': 0, 'isPublic': True}",,UCSfTt3-squrnNKt0pInNCfw,2022-10-14T15:28:34Z,Eu acho que ela falou mal.e ainda pior num local onde tinha muitas pessoas.espaco público.,QURTSl9pMmIzOFQ3STNYWkZSZWpJOEplZDFjVWtDTjRUaHc1WmV0Z2h6UWVXX1QzNU5oMVQ4REkxWnA2aHJLMHRoWEtQdkROSGZDZGJqNA==,2023-06-08 18:06:06.200670
youtube#commentThread,LpaDkvog2mteu7_Tuzl2ayKFMDE,UgzhKeK4t1-n2YmBmhN4AaABAg,"{'videoId': '9GvCpWl7tB8', 'topLevelComment': {'kind': 'youtube#comment', 'etag': 'TqlFcRFmuN0Zx6lH7ihABJBWr_Y', 'id': 'UgzhKeK4t1-n2YmBmhN4AaABAg', 'snippet': {'videoId': '9GvCpWl7tB8', 'textDisplay': 'Esse Ricardo também rasgou a constituição em 2016. Eu vi.fez politica', 'textOriginal': 'Esse Ricardo também rasgou a constituição em 2016. Eu vi.fez politica', 'authorDisplayName': 'Noel Roviller', 'authorProfileImageUrl': 'https://yt3.ggpht.com/ytc/AGIKgqPs3lKIwFFQdq56py8reF88P1cD3mnfxdAYDnazMpr_vUZ2jm2ozy2-6dZ4CxAJ=s48-c-k-c0x00ffffff-no-rj', 'authorChannelUrl': 'http://www.youtube.com/channel/UCSfTt3-squrnNKt0pInNCfw', 'authorChannelId': {'value': 'UCSfTt3-squrnNKt0pInNCfw'}, 'canRate': True, 'viewerRating': 'none', 'likeCount': 0, 'publishedAt': '2022-10-14T15:27:39Z', 'updatedAt': '2022-10-14T15:27:39Z'}}, 'canReply': True, 'totalReplyCount': 0, 'isPublic': True}",,UCSfTt3-squrnNKt0pInNCfw,2022-10-14T15:27:39Z,Esse Ricardo também rasgou a constituição em 2016. Eu vi.fez politica,QURTSl9pMmIzOFQ3STNYWkZSZWpJOEplZDFjVWtDTjRUaHc1WmV0Z2h6UWVXX1QzNU5oMVQ4REkxWnA2aHJLMHRoWEtQdkROSGZDZGJqNA==,2023-06-08 18:06:06.200670
