kind,etag,id,snippet,replies,authorChannelId,publishedAt,textOriginal,nextPageToken,extraction_date
youtube#commentThread,paQeM9qjT-5asowCS5Pp8EBpPOU,UgwecgiI5ENATJvJli54AaABAg,"{'videoId': 'coTcRIrGw34', 'topLevelComment': {'kind': 'youtube#comment', 'etag': 'BQSDqoO-bL5zWpzFX6ifVGE3-WA', 'id': 'UgwecgiI5ENATJvJli54AaABAg', 'snippet': {'videoId': 'coTcRIrGw34', 'textDisplay': 'Os paulista devia eliminar o pt da parada de são Paulo  o são Paulo tem que ir pro futuro porque se ficar enrolado com o pt vai acabar afundando e Paraná e minas vai acabar chupando as maiorias das indústrias paulistas o. São Paulo não vai aniquilar porque e gigante mais diminoi as indústrias', 'textOriginal': 'Os paulista devia eliminar o pt da parada de são Paulo  o são Paulo tem que ir pro futuro porque se ficar enrolado com o pt vai acabar afundando e Paraná e minas vai acabar chupando as maiorias das indústrias paulistas o. São Paulo não vai aniquilar porque e gigante mais diminoi as indústrias', 'authorDisplayName': 'Elias Gabriel Almeida', 'authorProfileImageUrl': 'https://yt3.ggpht.com/ytc/AGIKgqMQlFU_-aob5YqnYMebsqXWUa79bgOqO40aqw=s48-c-k-c0x00ffffff-no-rj', 'authorChannelUrl': 'http://www.youtube.com/channel/UCltP15-Ab2lAUbKhsIWj2lg', 'authorChannelId': {'value': 'UCltP15-Ab2lAUbKhsIWj2lg'}, 'canRate': True, 'viewerRating': 'none', 'likeCount': 0, 'publishedAt': '2022-10-07T00:38:21Z', 'updatedAt': '2022-10-07T00:38:21Z'}}, 'canReply': True, 'totalReplyCount': 0, 'isPublic': True}",,UCltP15-Ab2lAUbKhsIWj2lg,2022-10-07T00:38:21Z,Os paulista devia eliminar o pt da parada de são Paulo  o são Paulo tem que ir pro futuro porque se ficar enrolado com o pt vai acabar afundando e Paraná e minas vai acabar chupando as maiorias das indústrias paulistas o. São Paulo não vai aniquilar porque e gigante mais diminoi as indústrias,QURTSl9pMkNyVVRhWngyNFgwaWxnVXVjSkZGQTVCaDRvbEtaOE9xa0xyeGNaRy00djRjak9fZmlMczZXa2dSeV82WC1QYmEwQXNCaTdSYw==,2023-06-08 18:36:16.830059
youtube#commentThread,ArGHpXM0B0aLdz3wFNYarA5PC2o,Ugxh1fbqcvCgdObgFmR4AaABAg,"{'videoId': 'S6Gb0mzoC50', 'topLevelComment': {'kind': 'youtube#comment', 'etag': 'dB2ir7CSjuUBZa4sm1MM4Cy47j4', 'id': 'Ugxh1fbqcvCgdObgFmR4AaABAg', 'snippet': {'videoId': 'S6Gb0mzoC50', 'textDisplay': 'Os não vai jugar o Brasil com a esquerda comunista ainda bem que meu avô ele era mineiro de Araquari ele morreu ele destestava comunismo e eu vou hora ele e toda minha família e Bolsonaro porque ele e direita', 'textOriginal': 'Os não vai jugar o Brasil com a esquerda comunista ainda bem que meu avô ele era mineiro de Araquari ele morreu ele destestava comunismo e eu vou hora ele e toda minha família e Bolsonaro porque ele e direita', 'authorDisplayName': 'Elias Gabriel Almeida', 'authorProfileImageUrl': 'https://yt3.ggpht.com/ytc/AGIKgqMQlFU_-aob5YqnYMebsqXWUa79bgOqO40aqw=s48-c-k-c0x00ffffff-no-rj', 'authorChannelUrl': 'http://www.youtube.com/channel/UCltP15-Ab2lAUbKhsIWj2lg', 'authorChannelId': {'value': 'UCltP15-Ab2lAUbKhsIWj2lg'}, 'canRate': True, 'viewerRating': 'none', 'likeCount': 0, 'publishedAt': '2022-10-29T11:29:25Z', 'updatedAt': '2022-10-29T11:29:25Z'}}, 'canReply': True, 'totalReplyCount': 0, 'isPublic': True}",,UCltP15-Ab2lAUbKhsIWj2lg,2022-10-29T11:29:25Z,Os não vai jugar o Brasil com a esquerda comunista ainda bem que meu avô ele era mineiro de Araquari ele morreu ele destestava comunismo e eu vou hora ele e toda minha família e Bolsonaro porque ele e direita,QURTSl9pMGJUZHg5M0dhdkRkaThzTjBHeW1rTXh5eHRyblJOTnFxeEN1ekhpYks5a1BKdk1ZOXJlQS1SY0ViRUV6MFd1dUpwWG9vYzgyUQ==,2023-06-08 14:17:21.598583
youtube#commentThread,VhuS20xkgedftqqhCxVOuB2sfDI,UgzylpZU40UQGgcTdOd4AaABAg,"{'videoId': 'CeSjmMN4eqI', 'topLevelComment': {'kind': 'youtube#comment', 'etag': 'SEq2fniRFkDqM-VJe06OkkHpCf8', 'id': 'UgzylpZU40UQGgcTdOd4AaABAg', 'snippet': {'videoId': 'CeSjmMN4eqI', 'textDisplay': 'Os paulista tá votando pouco no Bolsonaro qualquer escorregão o Lula pode ganhar aí não fica os treis mosqueteiros o astronauta o tarciso e lógico Bolsonaro aí fica difícil de segurar são Paulo', 'textOriginal': 'Os paulista tá votando pouco no Bolsonaro qualquer escorregão o Lula pode ganhar aí não fica os treis mosqueteiros o astronauta o tarciso e lógico Bolsonaro aí fica difícil de segurar são Paulo', 'authorDisplayName': 'Elias Gabriel Almeida', 'authorProfileImageUrl': 'https://yt3.ggpht.com/ytc/AGIKgqMQlFU_-aob5YqnYMebsqXWUa79bgOqO40aqw=s48-c-k-c0x00ffffff-no-rj', 'authorChannelUrl': 'http://www.youtube.com/channel/UCltP15-Ab2lAUbKhsIWj2lg', 'authorChannelId': {'value': 'UCltP15-Ab2lAUbKhsIWj2lg'}, 'canRate': True, 'viewerRating': 'none', 'likeCount': 0, 'publishedAt': '2022-10-28T20:32:42Z', 'updatedAt': '2022-10-28T20:32:42Z'}}, 'canReply': True, 'totalReplyCount': 0, 'isPublic': True}",,UCltP15-Ab2lAUbKhsIWj2lg,2022-10-28T20:32:42Z,Os paulista tá votando pouco no Bolsonaro qualquer escorregão o Lula pode ganhar aí não fica os treis mosqueteiros o astronauta o tarciso e lógico Bolsonaro aí fica difícil de segurar são Paulo,QURTSl9pMWo4N3NiWEdFM1BKSkhHeld1bGJKaWtEYmpicEI2dmplMVN5X0xKRW9sd3lrNEFCNnlLbFZ5RDNrS3haLS1wQzdvWXROQkd4cw==,2023-06-08 14:24:02.715522
youtube#commentThread,FV5k5tHP7rbPeBeduNUhc-ot84w,UgxLz3e_O81tYMvrCeV4AaABAg,"{'videoId': 'vtlZdiz2Qu0', 'topLevelComment': {'kind': 'youtube#comment', 'etag': 'bgzHX6x1rokc54zw-dFCpM2IABI', 'id': 'UgxLz3e_O81tYMvrCeV4AaABAg', 'snippet': {'videoId': 'vtlZdiz2Qu0', 'textDisplay': 'Não vamos ariscar os paulista tem que aumentar os voto de não o Lula papa essa aí fica ruim ei não tem os três mosqueteiros com o astronauta o tarciso e o Bolsonaro vai ficar difícil segura são Paulo', 'textOriginal': 'Não vamos ariscar os paulista tem que aumentar os voto de não o Lula papa essa aí fica ruim ei não tem os três mosqueteiros com o astronauta o tarciso e o Bolsonaro vai ficar difícil segura são Paulo', 'authorDisplayName': 'Elias Gabriel Almeida', 'authorProfileImageUrl': 'https://yt3.ggpht.com/ytc/AGIKgqMQlFU_-aob5YqnYMebsqXWUa79bgOqO40aqw=s48-c-k-c0x00ffffff-no-rj', 'authorChannelUrl': 'http://www.youtube.com/channel/UCltP15-Ab2lAUbKhsIWj2lg', 'authorChannelId': {'value': 'UCltP15-Ab2lAUbKhsIWj2lg'}, 'canRate': True, 'viewerRating': 'none', 'likeCount': 0, 'publishedAt': '2022-10-28T13:30:23Z', 'updatedAt': '2022-10-28T13:30:23Z'}}, 'canReply': True, 'totalReplyCount': 0, 'isPublic': True}",,UCltP15-Ab2lAUbKhsIWj2lg,2022-10-28T13:30:23Z,Não vamos ariscar os paulista tem que aumentar os voto de não o Lula papa essa aí fica ruim ei não tem os três mosqueteiros com o astronauta o tarciso e o Bolsonaro vai ficar difícil segura são Paulo,QURTSl9pMlVfZnp5WVR6QWNBanpnLVZtVUx0cVZ1YmVGR3YxaEMySUl4UFhpcmVBTlZtVDk4RGZBOXJISzVDYjhFV0JvUUJ0ZEVIN2d4UQ==,2023-06-08 14:24:43.524977
youtube#commentThread,x118a9fHV-z59EKBtjpk0B28NPY,UgypOa98vwTrf-ei0q54AaABAg,"{'videoId': '7VLa79S49mg', 'topLevelComment': {'kind': 'youtube#comment', 'etag': 'x8NodRjvy4pNVfQnvnyxV_ypU8o', 'id': 'UgypOa98vwTrf-ei0q54AaABAg', 'snippet': {'videoId': '7VLa79S49mg', 'textDisplay': 'Vi Amanda o nível do tArciso pensa bem ante de creticar são Paulo vai ter um nível de gestão jamais visto o tempo dirá ele só não fala e faz mesmo', 'textOriginal': 'Vi Amanda o nível do tArciso pensa bem ante de creticar são Paulo vai ter um nível de gestão jamais visto o tempo dirá ele só não fala e faz mesmo', 'authorDisplayName': 'Elias Gabriel Almeida', 'authorProfileImageUrl': 'https://yt3.ggpht.com/ytc/AGIKgqMQlFU_-aob5YqnYMebsqXWUa79bgOqO40aqw=s48-c-k-c0x00ffffff-no-rj', 'authorChannelUrl': 'http://www.youtube.com/channel/UCltP15-Ab2lAUbKhsIWj2lg', 'authorChannelId': {'value': 'UCltP15-Ab2lAUbKhsIWj2lg'}, 'canRate': True, 'viewerRating': 'none', 'likeCount': 0, 'publishedAt': '2022-11-04T14:50:23Z', 'updatedAt': '2022-11-04T14:50:23Z'}}, 'canReply': True, 'totalReplyCount': 0, 'isPublic': True}",,UCltP15-Ab2lAUbKhsIWj2lg,2022-11-04T14:50:23Z,Vi Amanda o nível do tArciso pensa bem ante de creticar são Paulo vai ter um nível de gestão jamais visto o tempo dirá ele só não fala e faz mesmo,QURTSl9pM0EyaTVzMVFaZGJxT01nRjljMHk1eGRldE91R3diSFVOLW1qRTh2Z2R1RGlvRkpfVHZPVXhvQkx4MXR1NHZVT0JTbmJ6ellYOA==,2023-06-08 14:00:43.142588
youtube#commentThread,4xpBhSJuP0W05mKU-7wboDNAFec,Ugwyw-1c_cxlUIBML4x4AaABAg,"{'videoId': '7VLa79S49mg', 'topLevelComment': {'kind': 'youtube#comment', 'etag': '86lAtDtdCu4-tjFQO_xIJe4LiuY', 'id': 'Ugwyw-1c_cxlUIBML4x4AaABAg', 'snippet': {'videoId': '7VLa79S49mg', 'textDisplay': 'Vem falar pra min não tá vendo a dupla tarciso e Bolsonaro seria bem melhor pra São Paulo mais os paulista não deu 30 porcento pro Bolsonaro que vai perder sem dúvida e o propio paulistas Santa Catarina de 30 porcento fez o que são Paulo não fez', 'textOriginal': 'Vem falar pra min não tá vendo a dupla tarciso e Bolsonaro seria bem melhor pra São Paulo mais os paulista não deu 30 porcento pro Bolsonaro que vai perder sem dúvida e o propio paulistas Santa Catarina de 30 porcento fez o que são Paulo não fez', 'authorDisplayName': 'Elias Gabriel Almeida', 'authorProfileImageUrl': 'https://yt3.ggpht.com/ytc/AGIKgqMQlFU_-aob5YqnYMebsqXWUa79bgOqO40aqw=s48-c-k-c0x00ffffff-no-rj', 'authorChannelUrl': 'http://www.youtube.com/channel/UCltP15-Ab2lAUbKhsIWj2lg', 'authorChannelId': {'value': 'UCltP15-Ab2lAUbKhsIWj2lg'}, 'canRate': True, 'viewerRating': 'none', 'likeCount': 0, 'publishedAt': '2022-11-04T14:40:04Z', 'updatedAt': '2022-11-04T14:40:04Z'}}, 'canReply': True, 'totalReplyCount': 0, 'isPublic': True}",,UCltP15-Ab2lAUbKhsIWj2lg,2022-11-04T14:40:04Z,Vem falar pra min não tá vendo a dupla tarciso e Bolsonaro seria bem melhor pra São Paulo mais os paulista não deu 30 porcento pro Bolsonaro que vai perder sem dúvida e o propio paulistas Santa Catarina de 30 porcento fez o que são Paulo não fez,QURTSl9pM0EyaTVzMVFaZGJxT01nRjljMHk1eGRldE91R3diSFVOLW1qRTh2Z2R1RGlvRkpfVHZPVXhvQkx4MXR1NHZVT0JTbmJ6ellYOA==,2023-06-08 14:00:43.142588
youtube#commentThread,ewSEruz5XnpGoOIrkE3oGLIHqwE,UgzWxqpWJl_zTanjfz94AaABAg,"{'videoId': 'OhRGQ4_zbUc', 'topLevelComment': {'kind': 'youtube#comment', 'etag': 'Ur0drvIW7RTxgG_p9IfFrZeNojk', 'id': 'UgzWxqpWJl_zTanjfz94AaABAg', 'snippet': {'videoId': 'OhRGQ4_zbUc', 'textDisplay': 'Quem vota no pt concorda com a corupisao aí não dá chefe não e possível de for sego de não entender isso', 'textOriginal': 'Quem vota no pt concorda com a corupisao aí não dá chefe não e possível de for sego de não entender isso', 'authorDisplayName': 'Elias Gabriel Almeida', 'authorProfileImageUrl': 'https://yt3.ggpht.com/ytc/AGIKgqMQlFU_-aob5YqnYMebsqXWUa79bgOqO40aqw=s48-c-k-c0x00ffffff-no-rj', 'authorChannelUrl': 'http://www.youtube.com/channel/UCltP15-Ab2lAUbKhsIWj2lg', 'authorChannelId': {'value': 'UCltP15-Ab2lAUbKhsIWj2lg'}, 'canRate': True, 'viewerRating': 'none', 'likeCount': 0, 'publishedAt': '2022-10-26T23:33:15Z', 'updatedAt': '2022-10-26T23:33:15Z'}}, 'canReply': True, 'totalReplyCount': 0, 'isPublic': True}",,UCltP15-Ab2lAUbKhsIWj2lg,2022-10-26T23:33:15Z,Quem vota no pt concorda com a corupisao aí não dá chefe não e possível de for sego de não entender isso,QURTSl9pMXMtc2VPLWtsN3Q4ckVMeDBZN05EU2FIZWxQUHdraE9EWGJFdndkZTkxZUNIZE01dzZ5Um41dGRVZU5ka3ZzZEVrSmxrS18tMA==,2023-06-08 14:38:34.947374
youtube#commentThread,u8ZW4IqTDPozP5a5CKwOHGN1NLY,UgyOm41JCq7zL6iU_PN4AaABAg,"{'videoId': 'OhRGQ4_zbUc', 'topLevelComment': {'kind': 'youtube#comment', 'etag': '7WP0HNRruf2a-dpktRj5WOkgWzw', 'id': 'UgyOm41JCq7zL6iU_PN4AaABAg', 'snippet': {'videoId': 'OhRGQ4_zbUc', 'textDisplay': 'Não só pt por causa da corupisao ideologia de gêneros por amar minha família agora quem não importa cá família naturalmente vota no pt e só isso', 'textOriginal': 'Não só pt por causa da corupisao ideologia de gêneros por amar minha família agora quem não importa cá família naturalmente vota no pt e só isso', 'authorDisplayName': 'Elias Gabriel Almeida', 'authorProfileImageUrl': 'https://yt3.ggpht.com/ytc/AGIKgqMQlFU_-aob5YqnYMebsqXWUa79bgOqO40aqw=s48-c-k-c0x00ffffff-no-rj', 'authorChannelUrl': 'http://www.youtube.com/channel/UCltP15-Ab2lAUbKhsIWj2lg', 'authorChannelId': {'value': 'UCltP15-Ab2lAUbKhsIWj2lg'}, 'canRate': True, 'viewerRating': 'none', 'likeCount': 0, 'publishedAt': '2022-10-26T23:30:09Z', 'updatedAt': '2022-10-26T23:30:09Z'}}, 'canReply': True, 'totalReplyCount': 0, 'isPublic': True}",,UCltP15-Ab2lAUbKhsIWj2lg,2022-10-26T23:30:09Z,Não só pt por causa da corupisao ideologia de gêneros por amar minha família agora quem não importa cá família naturalmente vota no pt e só isso,QURTSl9pMXMtc2VPLWtsN3Q4ckVMeDBZN05EU2FIZWxQUHdraE9EWGJFdndkZTkxZUNIZE01dzZ5Um41dGRVZU5ka3ZzZEVrSmxrS18tMA==,2023-06-08 14:38:34.947374
youtube#commentThread,TSw8312T2HuHBW60lOGeIMZUElc,Ugy3NhDt0kNczVtQlTt4AaABAg,"{'videoId': 'd7b039a_7lo', 'topLevelComment': {'kind': 'youtube#comment', 'etag': 'WTbbnywKXpdKUoftOQk7HHHUbOI', 'id': 'Ugy3NhDt0kNczVtQlTt4AaABAg', 'snippet': {'videoId': 'd7b039a_7lo', 'textDisplay': 'Isso que e o medo do pt porque eles sabe que o dia que o povo brasileiros saber da realidade aí não vota no pt nem apau quanto mais sem conhecimento melhor por pt aí eles vai dominando', 'textOriginal': 'Isso que e o medo do pt porque eles sabe que o dia que o povo brasileiros saber da realidade aí não vota no pt nem apau quanto mais sem conhecimento melhor por pt aí eles vai dominando', 'authorDisplayName': 'Elias Gabriel Almeida', 'authorProfileImageUrl': 'https://yt3.ggpht.com/ytc/AGIKgqMQlFU_-aob5YqnYMebsqXWUa79bgOqO40aqw=s48-c-k-c0x00ffffff-no-rj', 'authorChannelUrl': 'http://www.youtube.com/channel/UCltP15-Ab2lAUbKhsIWj2lg', 'authorChannelId': {'value': 'UCltP15-Ab2lAUbKhsIWj2lg'}, 'canRate': True, 'viewerRating': 'none', 'likeCount': 0, 'publishedAt': '2022-10-26T08:34:53Z', 'updatedAt': '2022-10-26T08:34:53Z'}}, 'canReply': True, 'totalReplyCount': 0, 'isPublic': True}",,UCltP15-Ab2lAUbKhsIWj2lg,2022-10-26T08:34:53Z,Isso que e o medo do pt porque eles sabe que o dia que o povo brasileiros saber da realidade aí não vota no pt nem apau quanto mais sem conhecimento melhor por pt aí eles vai dominando,QURTSl9pMGcyOHVPWFFiZmx5S2Vrb2NBRUZweXFQWUEzX3ZQU1lsdmVDRVN1NHhndVBEZ1M5S3ZHdzZISWlzUWdnWjhwNy1hR0luWXNBNA==,2023-06-08 14:40:15.704096
youtube#commentThread,LJMy-xWd0_5Q8IojGhHwy6r-jE0,Ugzrp0CcU36MLqH-Xtl4AaABAg,"{'videoId': 'd7b039a_7lo', 'topLevelComment': {'kind': 'youtube#comment', 'etag': 'PxTSyj2UxlTkmZazcb4Ge1YT130', 'id': 'Ugzrp0CcU36MLqH-Xtl4AaABAg', 'snippet': {'videoId': 'd7b039a_7lo', 'textDisplay': 'O problema da esquerda do Lula e colocar o povo sem entendimentos pra o pt dormir essa das rádios da Bahia foi demais o pt que manter o povo sem saber a realidade pra o pt dominar isso e o pt', 'textOriginal': 'O problema da esquerda do Lula e colocar o povo sem entendimentos pra o pt dormir essa das rádios da Bahia foi demais o pt que manter o povo sem saber a realidade pra o pt dominar isso e o pt', 'authorDisplayName': 'Elias Gabriel Almeida', 'authorProfileImageUrl': 'https://yt3.ggpht.com/ytc/AGIKgqMQlFU_-aob5YqnYMebsqXWUa79bgOqO40aqw=s48-c-k-c0x00ffffff-no-rj', 'authorChannelUrl': 'http://www.youtube.com/channel/UCltP15-Ab2lAUbKhsIWj2lg', 'authorChannelId': {'value': 'UCltP15-Ab2lAUbKhsIWj2lg'}, 'canRate': True, 'viewerRating': 'none', 'likeCount': 0, 'publishedAt': '2022-10-26T08:30:51Z', 'updatedAt': '2022-10-26T08:30:51Z'}}, 'canReply': True, 'totalReplyCount': 0, 'isPublic': True}",,UCltP15-Ab2lAUbKhsIWj2lg,2022-10-26T08:30:51Z,O problema da esquerda do Lula e colocar o povo sem entendimentos pra o pt dormir essa das rádios da Bahia foi demais o pt que manter o povo sem saber a realidade pra o pt dominar isso e o pt,QURTSl9pMGcyOHVPWFFiZmx5S2Vrb2NBRUZweXFQWUEzX3ZQU1lsdmVDRVN1NHhndVBEZ1M5S3ZHdzZISWlzUWdnWjhwNy1hR0luWXNBNA==,2023-06-08 14:40:15.704096
youtube#commentThread,BcWZb04HHINVu4pKOa7u1hyRjfs,UgwRFGwOZXYx21cwPw94AaABAg,"{'videoId': '8w9v69Xa9uE', 'topLevelComment': {'kind': 'youtube#comment', 'etag': 'q2R_DZPqj7_BpAmV3vkMTK5ffhM', 'id': 'UgwRFGwOZXYx21cwPw94AaABAg', 'snippet': {'videoId': '8w9v69Xa9uE', 'textDisplay': 'O Bolsonaro perdeu porque os seus irmãos paulista não foi fiel se fosse fiel o Bolsonaro tinha ganhado', 'textOriginal': 'O Bolsonaro perdeu porque os seus irmãos paulista não foi fiel se fosse fiel o Bolsonaro tinha ganhado', 'authorDisplayName': 'Elias Gabriel Almeida', 'authorProfileImageUrl': 'https://yt3.ggpht.com/ytc/AGIKgqMQlFU_-aob5YqnYMebsqXWUa79bgOqO40aqw=s48-c-k-c0x00ffffff-no-rj', 'authorChannelUrl': 'http://www.youtube.com/channel/UCltP15-Ab2lAUbKhsIWj2lg', 'authorChannelId': {'value': 'UCltP15-Ab2lAUbKhsIWj2lg'}, 'canRate': True, 'viewerRating': 'none', 'likeCount': 0, 'publishedAt': '2022-10-31T13:27:14Z', 'updatedAt': '2022-10-31T13:27:14Z'}}, 'canReply': True, 'totalReplyCount': 0, 'isPublic': True}",,UCltP15-Ab2lAUbKhsIWj2lg,2022-10-31T13:27:14Z,O Bolsonaro perdeu porque os seus irmãos paulista não foi fiel se fosse fiel o Bolsonaro tinha ganhado,QURTSl9pMVhqMW15b2RialJBSndJU0MyRkp3QkF0X3VsbFlPXzVDQ05GQkVvMGJfaldSQ2U4UWJGWE90c0JTdlUxemhmQUZleko4OTlBaw==,2023-06-08 14:02:08.032131
youtube#commentThread,zysxyvdiLWaDrV0r7wBGM0YTEPk,Ugx6w3QygwLVbw_TxJh4AaABAg,"{'videoId': '8w9v69Xa9uE', 'topLevelComment': {'kind': 'youtube#comment', 'etag': 'jZLzbFJraJ8rbHLNWAeGP6Jj644', 'id': 'Ugx6w3QygwLVbw_TxJh4AaABAg', 'snippet': {'videoId': '8w9v69Xa9uE', 'textDisplay': 'Tá comprovado que a maiorias dos nordestinos gosta mais do Lula do que seus filhos pelo menos os nordestino e fiel que não e o casso dos paulistas eu falei que os paulistas tinha que dar 30 porcento pro Bolsonaro se não o Lula ia papa não deu outro', 'textOriginal': 'Tá comprovado que a maiorias dos nordestinos gosta mais do Lula do que seus filhos pelo menos os nordestino e fiel que não e o casso dos paulistas eu falei que os paulistas tinha que dar 30 porcento pro Bolsonaro se não o Lula ia papa não deu outro', 'authorDisplayName': 'Elias Gabriel Almeida', 'authorProfileImageUrl': 'https://yt3.ggpht.com/ytc/AGIKgqMQlFU_-aob5YqnYMebsqXWUa79bgOqO40aqw=s48-c-k-c0x00ffffff-no-rj', 'authorChannelUrl': 'http://www.youtube.com/channel/UCltP15-Ab2lAUbKhsIWj2lg', 'authorChannelId': {'value': 'UCltP15-Ab2lAUbKhsIWj2lg'}, 'canRate': True, 'viewerRating': 'none', 'likeCount': 0, 'publishedAt': '2022-10-31T13:25:32Z', 'updatedAt': '2022-10-31T13:25:32Z'}}, 'canReply': True, 'totalReplyCount': 0, 'isPublic': True}",,UCltP15-Ab2lAUbKhsIWj2lg,2022-10-31T13:25:32Z,Tá comprovado que a maiorias dos nordestinos gosta mais do Lula do que seus filhos pelo menos os nordestino e fiel que não e o casso dos paulistas eu falei que os paulistas tinha que dar 30 porcento pro Bolsonaro se não o Lula ia papa não deu outro,QURTSl9pMVhqMW15b2RialJBSndJU0MyRkp3QkF0X3VsbFlPXzVDQ05GQkVvMGJfaldSQ2U4UWJGWE90c0JTdlUxemhmQUZleko4OTlBaw==,2023-06-08 14:02:08.032131
youtube#commentThread,CPO-z-ESrIPJPkLr7AON3EbimYA,UgyTUYMUONb-kYZRNId4AaABAg,"{'videoId': 'iDTaDt_MCg0', 'topLevelComment': {'kind': 'youtube#comment', 'etag': 'YPPWM3vaJUZcyCWCg7a5T1QSUy8', 'id': 'UgyTUYMUONb-kYZRNId4AaABAg', 'snippet': {'videoId': 'iDTaDt_MCg0', 'textDisplay': 'Lula só tem mentira veja o tcu travou as obras da trasposisao e a trasnordestina por roubalheira as obras ficou pArada 10 anos e vocês ainda quer votar no Lula aí e brincadeiras', 'textOriginal': 'Lula só tem mentira veja o tcu travou as obras da trasposisao e a trasnordestina por roubalheira as obras ficou pArada 10 anos e vocês ainda quer votar no Lula aí e brincadeiras', 'authorDisplayName': 'Elias Gabriel Almeida', 'authorProfileImageUrl': 'https://yt3.ggpht.com/ytc/AGIKgqMQlFU_-aob5YqnYMebsqXWUa79bgOqO40aqw=s48-c-k-c0x00ffffff-no-rj', 'authorChannelUrl': 'http://www.youtube.com/channel/UCltP15-Ab2lAUbKhsIWj2lg', 'authorChannelId': {'value': 'UCltP15-Ab2lAUbKhsIWj2lg'}, 'canRate': True, 'viewerRating': 'none', 'likeCount': 0, 'publishedAt': '2022-10-25T15:25:05Z', 'updatedAt': '2022-10-25T15:25:05Z'}}, 'canReply': True, 'totalReplyCount': 0, 'isPublic': True}",,UCltP15-Ab2lAUbKhsIWj2lg,2022-10-25T15:25:05Z,Lula só tem mentira veja o tcu travou as obras da trasposisao e a trasnordestina por roubalheira as obras ficou pArada 10 anos e vocês ainda quer votar no Lula aí e brincadeiras,QURTSl9pM1pFSUwyc3BBUm96S2NsUk9SUzZyMDMxenJhOTZtdnNvRmt4ZWhOdmVMWG1qTGZOeUdFaEJoZ1pDaDNpQnZkVVEyNjVlQ1pMbw==,2023-06-08 14:42:20.337145
youtube#commentThread,Bb78bpZnp7kH3zi6U7hOf6JrCFo,UgwRon1W_Eq3BtMzkv54AaABAg,"{'videoId': 'bwqD1XWeNgQ', 'topLevelComment': {'kind': 'youtube#comment', 'etag': 'xkOAYSCHLZuyYfBrW88hO8mzBSU', 'id': 'UgwRon1W_Eq3BtMzkv54AaABAg', 'snippet': {'videoId': 'bwqD1XWeNgQ', 'textDisplay': 'Vamos lá paulista vamos dar 30 porcento pro Bolsonaro se não o Lula papa essa eleisaoes já pensou tarciso com Bolsonaro os paulista só tenha a ganhar aí vai ser difícil segurar são Paulo com tarciso com Bolsonaro os paulista só tenha a ganhar', 'textOriginal': 'Vamos lá paulista vamos dar 30 porcento pro Bolsonaro se não o Lula papa essa eleisaoes já pensou tarciso com Bolsonaro os paulista só tenha a ganhar aí vai ser difícil segurar são Paulo com tarciso com Bolsonaro os paulista só tenha a ganhar', 'authorDisplayName': 'Elias Gabriel Almeida', 'authorProfileImageUrl': 'https://yt3.ggpht.com/ytc/AGIKgqMQlFU_-aob5YqnYMebsqXWUa79bgOqO40aqw=s48-c-k-c0x00ffffff-no-rj', 'authorChannelUrl': 'http://www.youtube.com/channel/UCltP15-Ab2lAUbKhsIWj2lg', 'authorChannelId': {'value': 'UCltP15-Ab2lAUbKhsIWj2lg'}, 'canRate': True, 'viewerRating': 'none', 'likeCount': 0, 'publishedAt': '2022-10-25T11:22:37Z', 'updatedAt': '2022-10-25T11:22:37Z'}}, 'canReply': True, 'totalReplyCount': 0, 'isPublic': True}",,UCltP15-Ab2lAUbKhsIWj2lg,2022-10-25T11:22:37Z,Vamos lá paulista vamos dar 30 porcento pro Bolsonaro se não o Lula papa essa eleisaoes já pensou tarciso com Bolsonaro os paulista só tenha a ganhar aí vai ser difícil segurar são Paulo com tarciso com Bolsonaro os paulista só tenha a ganhar,QURTSl9pM1psanhjTkswYzZydmNMLXlJLXJmVm1LYmNJb2RHejVPeHdOSjdjZDZNOGhRWjludS03RF9OdG1zRjNkQkxhNE8taXUwSWNCdw==,2023-06-08 14:43:51.631777
youtube#commentThread,So2nhFoFaO6MXT4c_fdCLlId3-o,UgzUoj1fba8tnTp2Xad4AaABAg,"{'videoId': 'bwqD1XWeNgQ', 'topLevelComment': {'kind': 'youtube#comment', 'etag': 'rVjo9lrAsYayHTDFpxW5z3LGOWw', 'id': 'UgzUoj1fba8tnTp2Xad4AaABAg', 'snippet': {'videoId': 'bwqD1XWeNgQ', 'textDisplay': 'Se você votar no Lula tá coletando pro comunismo entrar no Brasil e fria o negócio e a direita de Bolsonaro', 'textOriginal': 'Se você votar no Lula tá coletando pro comunismo entrar no Brasil e fria o negócio e a direita de Bolsonaro', 'authorDisplayName': 'Elias Gabriel Almeida', 'authorProfileImageUrl': 'https://yt3.ggpht.com/ytc/AGIKgqMQlFU_-aob5YqnYMebsqXWUa79bgOqO40aqw=s48-c-k-c0x00ffffff-no-rj', 'authorChannelUrl': 'http://www.youtube.com/channel/UCltP15-Ab2lAUbKhsIWj2lg', 'authorChannelId': {'value': 'UCltP15-Ab2lAUbKhsIWj2lg'}, 'canRate': True, 'viewerRating': 'none', 'likeCount': 0, 'publishedAt': '2022-10-25T11:19:19Z', 'updatedAt': '2022-10-25T11:19:19Z'}}, 'canReply': True, 'totalReplyCount': 0, 'isPublic': True}",,UCltP15-Ab2lAUbKhsIWj2lg,2022-10-25T11:19:19Z,Se você votar no Lula tá coletando pro comunismo entrar no Brasil e fria o negócio e a direita de Bolsonaro,QURTSl9pMHFESmNWa0V4bkp1cnNWcV9LR1g1bVl4YjBoWS1nbE9pSDMzdWFmblcyWk1Jay04ODJ2R2FNQjVhQnhJVzZGakx1aXJ6VkJTRQ==,2023-06-08 14:43:52.746244
youtube#commentThread,N7ToKD_aGnXkfuRxykq-Th3NYEU,Ugy0qbJtmz_QRxE9ACx4AaABAg,"{'videoId': '8pBTAz_Bi2w', 'topLevelComment': {'kind': 'youtube#comment', 'etag': '3xVmk8-MVNhciok7WdSqjt7epCI', 'id': 'Ugy0qbJtmz_QRxE9ACx4AaABAg', 'snippet': {'videoId': '8pBTAz_Bi2w', 'textDisplay': 'Quando eu erra pequeno meus pais e avós fala nesse tal de comunismo que ia entrar no Brasil agora acordei com meu voto jamais a esquerda do comunismo não entra no Brasil e vocês pensa iqual eu espero que sim', 'textOriginal': 'Quando eu erra pequeno meus pais e avós fala nesse tal de comunismo que ia entrar no Brasil agora acordei com meu voto jamais a esquerda do comunismo não entra no Brasil e vocês pensa iqual eu espero que sim', 'authorDisplayName': 'Elias Gabriel Almeida', 'authorProfileImageUrl': 'https://yt3.ggpht.com/ytc/AGIKgqMQlFU_-aob5YqnYMebsqXWUa79bgOqO40aqw=s48-c-k-c0x00ffffff-no-rj', 'authorChannelUrl': 'http://www.youtube.com/channel/UCltP15-Ab2lAUbKhsIWj2lg', 'authorChannelId': {'value': 'UCltP15-Ab2lAUbKhsIWj2lg'}, 'canRate': True, 'viewerRating': 'none', 'likeCount': 0, 'publishedAt': '2022-10-24T11:49:13Z', 'updatedAt': '2022-10-24T11:49:13Z'}}, 'canReply': True, 'totalReplyCount': 0, 'isPublic': True}",,UCltP15-Ab2lAUbKhsIWj2lg,2022-10-24T11:49:13Z,Quando eu erra pequeno meus pais e avós fala nesse tal de comunismo que ia entrar no Brasil agora acordei com meu voto jamais a esquerda do comunismo não entra no Brasil e vocês pensa iqual eu espero que sim,QURTSl9pMUxEUUt0WW9kQlJCS0V4MHdSUURBdFhESFBDUDdmaDlBWWMzcnpFVlc3ZEVGQVdWTjYxZmstdE9ZNXM5Znl3TFhxbFFGYWdGQQ==,2023-06-08 14:50:06.460046
