kind,etag,id,snippet,replies,authorChannelId,publishedAt,textOriginal,nextPageToken,extraction_date
youtube#commentThread,WQ9KbGtb4aPP0LoEo09fZVgspZ4,UgwnsbYWZ8tSAtGc8Ht4AaABAg,"{'videoId': 'tjb28EekHZs', 'topLevelComment': {'kind': 'youtube#comment', 'etag': 'Is-IucmxREBWBAGYTODBBZ9F-U0', 'id': 'UgwnsbYWZ8tSAtGc8Ht4AaABAg', 'snippet': {'videoId': 'tjb28EekHZs', 'textDisplay': 'Eu não julgo os eleitores. O que falta é transparência dos votos nas urnas. Vi um caso de fraude em Macapá no Amapá e Uberaba em Minas Gerais. Depois disso vi que o povo está sendo usado como massa de manobra. Infelizmente!', 'textOriginal': 'Eu não julgo os eleitores. O que falta é transparência dos votos nas urnas. Vi um caso de fraude em Macapá no Amapá e Uberaba em Minas Gerais. Depois disso vi que o povo está sendo usado como massa de manobra. Infelizmente!', 'authorDisplayName': 'lucinei silva', 'authorProfileImageUrl': 'https://yt3.ggpht.com/ytc/AGIKgqONWr2IE-IbtHV8TlpSWXTNDRVmErDl7eMxQBaKiV8Swy_w-djzlxbQBT77Xn6m=s48-c-k-c0x00ffffff-no-rj', 'authorChannelUrl': 'http://www.youtube.com/channel/UCErhwB87UtLfpaYxLy_iVhw', 'authorChannelId': {'value': 'UCErhwB87UtLfpaYxLy_iVhw'}, 'canRate': True, 'viewerRating': 'none', 'likeCount': 0, 'publishedAt': '2022-10-07T22:54:58Z', 'updatedAt': '2022-10-07T22:54:58Z'}}, 'canReply': True, 'totalReplyCount': 0, 'isPublic': True}",,UCErhwB87UtLfpaYxLy_iVhw,2022-10-07T22:54:58Z,Eu não julgo os eleitores. O que falta é transparência dos votos nas urnas. Vi um caso de fraude em Macapá no Amapá e Uberaba em Minas Gerais. Depois disso vi que o povo está sendo usado como massa de manobra. Infelizmente!,QURTSl9pM3lBQU9RM21pR0tSX3l3dTM4a2lFQUpmRmhQTV9KZGVQSE9ydk1wNnhSYXRRdldQU0l1RDBpYmRrOXlDUkpfVTBJdG5YUzVFSQ==,2023-06-08 18:30:14.462746
youtube#commentThread,sITOjC6O1DrsxOz0ABdBOcerEvI,UgwR4_H1yrKJnCw-UAN4AaABAg,"{'videoId': 'NzttbXnKz3k', 'topLevelComment': {'kind': 'youtube#comment', 'etag': 'PjjlNo7Oaf3WccXGA_EjxaKehQ8', 'id': 'UgwR4_H1yrKJnCw-UAN4AaABAg', 'snippet': {'videoId': 'NzttbXnKz3k', 'textDisplay': 'Bolsonaro meu presidente 22🧡', 'textOriginal': 'Bolsonaro meu presidente 22🧡', 'authorDisplayName': 'lucinei silva', 'authorProfileImageUrl': 'https://yt3.ggpht.com/ytc/AGIKgqONWr2IE-IbtHV8TlpSWXTNDRVmErDl7eMxQBaKiV8Swy_w-djzlxbQBT77Xn6m=s48-c-k-c0x00ffffff-no-rj', 'authorChannelUrl': 'http://www.youtube.com/channel/UCErhwB87UtLfpaYxLy_iVhw', 'authorChannelId': {'value': 'UCErhwB87UtLfpaYxLy_iVhw'}, 'canRate': True, 'viewerRating': 'none', 'likeCount': 0, 'publishedAt': '2022-10-29T11:24:33Z', 'updatedAt': '2022-10-29T11:24:33Z'}}, 'canReply': True, 'totalReplyCount': 0, 'isPublic': True}",,UCErhwB87UtLfpaYxLy_iVhw,2022-10-29T11:24:33Z,Bolsonaro meu presidente 22🧡,QURTSl9pMTNZc1JUZnFsLTd1aTlnRC1RRG9wTS1OaHBNVGtQOURwNy1PMUZYUTZZQnBHd1Fzd1hiX3h1eHlLQ3dlQnZ0dUVwYXRWS1NWaw==,2023-06-08 14:20:25.509435
youtube#commentThread,IiSAbREvv0jEHLMlGLY0rg_u7Sc,UgyqvvmDzufILG0h3ZZ4AaABAg,"{'videoId': 'dIha4Ru7kXA', 'topLevelComment': {'kind': 'youtube#comment', 'etag': 'I4ZzAwuUNWz8aaNb5SCPMmhhzvQ', 'id': 'UgyqvvmDzufILG0h3ZZ4AaABAg', 'snippet': {'videoId': 'dIha4Ru7kXA', 'textDisplay': 'Mesmo com toda sujeira, eles vão se surpreender com o resultado! Bolsonaro presidente 22❤️', 'textOriginal': 'Mesmo com toda sujeira, eles vão se surpreender com o resultado! Bolsonaro presidente 22❤️', 'authorDisplayName': 'lucinei silva', 'authorProfileImageUrl': 'https://yt3.ggpht.com/ytc/AGIKgqONWr2IE-IbtHV8TlpSWXTNDRVmErDl7eMxQBaKiV8Swy_w-djzlxbQBT77Xn6m=s48-c-k-c0x00ffffff-no-rj', 'authorChannelUrl': 'http://www.youtube.com/channel/UCErhwB87UtLfpaYxLy_iVhw', 'authorChannelId': {'value': 'UCErhwB87UtLfpaYxLy_iVhw'}, 'canRate': True, 'viewerRating': 'none', 'likeCount': 0, 'publishedAt': '2022-10-28T20:51:35Z', 'updatedAt': '2022-10-28T20:51:35Z'}}, 'canReply': True, 'totalReplyCount': 0, 'isPublic': True}",,UCErhwB87UtLfpaYxLy_iVhw,2022-10-28T20:51:35Z,"Mesmo com toda sujeira, eles vão se surpreender com o resultado! Bolsonaro presidente 22❤️",QURTSl9pMHZNZ3V4SVdjeHgtSVJtWkJkdFA5MGozYVpJWlgwY1U3TFdvazZEWWc4dGQ3QUtGb3RfUXlJcVBBQUtEWmtCRFM0c1dYY2ZOWQ==,2023-06-08 14:23:26.667681
youtube#commentThread,_V9wTcKsAbhtv8Utmyk_KcL6Lyg,Ugz9I5wPgcD_qsNH9jd4AaABAg,"{'videoId': 'kMBe3v7Tltw', 'topLevelComment': {'kind': 'youtube#comment', 'etag': 'kCPNS7nm2ZtJcypYv2Q76WpS2D8', 'id': 'Ugz9I5wPgcD_qsNH9jd4AaABAg', 'snippet': {'videoId': 'kMBe3v7Tltw', 'textDisplay': 'Isso é só o começo, onde ímpios governam o povo padece!', 'textOriginal': 'Isso é só o começo, onde ímpios governam o povo padece!', 'authorDisplayName': 'lucinei silva', 'authorProfileImageUrl': 'https://yt3.ggpht.com/ytc/AGIKgqONWr2IE-IbtHV8TlpSWXTNDRVmErDl7eMxQBaKiV8Swy_w-djzlxbQBT77Xn6m=s48-c-k-c0x00ffffff-no-rj', 'authorChannelUrl': 'http://www.youtube.com/channel/UCErhwB87UtLfpaYxLy_iVhw', 'authorChannelId': {'value': 'UCErhwB87UtLfpaYxLy_iVhw'}, 'canRate': True, 'viewerRating': 'none', 'likeCount': 2, 'publishedAt': '2022-10-31T16:41:40Z', 'updatedAt': '2022-10-31T16:41:40Z'}}, 'canReply': True, 'totalReplyCount': 0, 'isPublic': True}",,UCErhwB87UtLfpaYxLy_iVhw,2022-10-31T16:41:40Z,"Isso é só o começo, onde ímpios governam o povo padece!",QURTSl9pMnJOdHpqWk1RQUdCR2o2ODFqcmtHM21FWjBvTjdidjFMR2xEUDRNZ1dhYUxqYW1nVXBnVHpQUDZfVXhLbG9IMHo4ZzRIeG1kdw==,2023-06-08 13:59:36.709333
youtube#commentThread,xxZve0XkZ2SIqciCSFkZnE9vwqk,UgyxCzT4HICghBNCcYt4AaABAg,"{'videoId': 'msSZlpByzF8', 'topLevelComment': {'kind': 'youtube#comment', 'etag': 'U4qKOMmnELIntDKB-IhpXWnUAHs', 'id': 'UgyxCzT4HICghBNCcYt4AaABAg', 'snippet': {'videoId': 'msSZlpByzF8', 'textDisplay': 'O mercado vai embora, tá corretíssimo. Brasil governado por corruptos!', 'textOriginal': 'O mercado vai embora, tá corretíssimo. Brasil governado por corruptos!', 'authorDisplayName': 'lucinei silva', 'authorProfileImageUrl': 'https://yt3.ggpht.com/ytc/AGIKgqONWr2IE-IbtHV8TlpSWXTNDRVmErDl7eMxQBaKiV8Swy_w-djzlxbQBT77Xn6m=s48-c-k-c0x00ffffff-no-rj', 'authorChannelUrl': 'http://www.youtube.com/channel/UCErhwB87UtLfpaYxLy_iVhw', 'authorChannelId': {'value': 'UCErhwB87UtLfpaYxLy_iVhw'}, 'canRate': True, 'viewerRating': 'none', 'likeCount': 0, 'publishedAt': '2022-10-31T16:44:44Z', 'updatedAt': '2022-10-31T16:44:44Z'}}, 'canReply': True, 'totalReplyCount': 0, 'isPublic': True}",,UCErhwB87UtLfpaYxLy_iVhw,2022-10-31T16:44:44Z,"O mercado vai embora, tá corretíssimo. Brasil governado por corruptos!",QURTSl9pMTltTTRvRGMzWTVxcDQyZFQxZzdMVWFHWTdPSElBYzNZbzc2MW9GSno0MlIzT2pFT3dmTzJzSDhUalRkb1Z2XzI2dF9qSi1OQQ==,2023-06-08 13:59:53.310674
youtube#commentThread,xYJZHGUFQ9yPuYbWHBWpl0wUZXA,UgywEuxiL5uumlcxOYl4AaABAg,"{'videoId': 's53eFAW5dVA', 'topLevelComment': {'kind': 'youtube#comment', 'etag': 'VrbO7GR079JwOYz0_4VcQzgPirU', 'id': 'UgywEuxiL5uumlcxOYl4AaABAg', 'snippet': {'videoId': 's53eFAW5dVA', 'textDisplay': 'Haddad atacou o candidato Tarcísio, a imprensa não vai falar nada? Quando o Bolsonaro fala a imprensa vai em cima.', 'textOriginal': 'Haddad atacou o candidato Tarcísio, a imprensa não vai falar nada? Quando o Bolsonaro fala a imprensa vai em cima.', 'authorDisplayName': 'lucinei silva', 'authorProfileImageUrl': 'https://yt3.ggpht.com/ytc/AGIKgqONWr2IE-IbtHV8TlpSWXTNDRVmErDl7eMxQBaKiV8Swy_w-djzlxbQBT77Xn6m=s48-c-k-c0x00ffffff-no-rj', 'authorChannelUrl': 'http://www.youtube.com/channel/UCErhwB87UtLfpaYxLy_iVhw', 'authorChannelId': {'value': 'UCErhwB87UtLfpaYxLy_iVhw'}, 'canRate': True, 'viewerRating': 'none', 'likeCount': 0, 'publishedAt': '2022-10-28T12:30:59Z', 'updatedAt': '2022-10-28T12:30:59Z'}}, 'canReply': True, 'totalReplyCount': 0, 'isPublic': True}",,UCErhwB87UtLfpaYxLy_iVhw,2022-10-28T12:30:59Z,"Haddad atacou o candidato Tarcísio, a imprensa não vai falar nada? Quando o Bolsonaro fala a imprensa vai em cima.",QURTSl9pMTNPazVtRUJ2LW9iY2k2ZmNMNFdtN082ZmhZRHhRSGRmNi1NYXhtUnRnaF8zYThYV3UzcnNlYXZpN0NxWkYzVEhMQURwaTBsQQ==,2023-06-08 14:26:00.603976
youtube#commentThread,N3JC1z_0yAWS2WZVkWOTeYo9zlw,UgxMumZHLSuauWM7mxF4AaABAg,"{'videoId': 'vA533Kvs7gA', 'topLevelComment': {'kind': 'youtube#comment', 'etag': 'vO1j39uxWDo6P_hLCo5QobDCLOg', 'id': 'UgxMumZHLSuauWM7mxF4AaABAg', 'snippet': {'videoId': 'vA533Kvs7gA', 'textDisplay': 'A verdade é luz nas trevas! A luz está surgindo para todos nós! Todos os nossos representantes que estão ainda no posto não fazem nada. Não tem senado, congresso. Não estão nem aí,muitos vão sair mesmo. Calaram as rádios, ninguém faz nada...', 'textOriginal': 'A verdade é luz nas trevas! A luz está surgindo para todos nós! Todos os nossos representantes que estão ainda no posto não fazem nada. Não tem senado, congresso. Não estão nem aí,muitos vão sair mesmo. Calaram as rádios, ninguém faz nada...', 'authorDisplayName': 'lucinei silva', 'authorProfileImageUrl': 'https://yt3.ggpht.com/ytc/AGIKgqONWr2IE-IbtHV8TlpSWXTNDRVmErDl7eMxQBaKiV8Swy_w-djzlxbQBT77Xn6m=s48-c-k-c0x00ffffff-no-rj', 'authorChannelUrl': 'http://www.youtube.com/channel/UCErhwB87UtLfpaYxLy_iVhw', 'authorChannelId': {'value': 'UCErhwB87UtLfpaYxLy_iVhw'}, 'canRate': True, 'viewerRating': 'none', 'likeCount': 2, 'publishedAt': '2022-10-27T19:39:16Z', 'updatedAt': '2022-10-27T19:40:46Z'}}, 'canReply': True, 'totalReplyCount': 0, 'isPublic': True}",,UCErhwB87UtLfpaYxLy_iVhw,2022-10-27T19:39:16Z,"A verdade é luz nas trevas! A luz está surgindo para todos nós! Todos os nossos representantes que estão ainda no posto não fazem nada. Não tem senado, congresso. Não estão nem aí,muitos vão sair mesmo. Calaram as rádios, ninguém faz nada...",QURTSl9pM2R3R0hiUFpwMEtHUDd6VmJtMnNvYnl6NTJZd3NUc1FuVmNCLUlMT2kwZG5mek1QTnZfWUZVeGxXbFF1ZXhMWlo3XzBQREZvQQ==,2023-06-08 14:28:25.164764
youtube#commentThread,RbhXi-dahkg4a5Pyd0XB9Lj6gHI,Ugz_8PdyWaD9UrQImYp4AaABAg,"{'videoId': 'XgKSPtaFwS8', 'topLevelComment': {'kind': 'youtube#comment', 'etag': 'q-r7Yx36H8xr6A5GyZF1sGvesTo', 'id': 'Ugz_8PdyWaD9UrQImYp4AaABAg', 'snippet': {'videoId': 'XgKSPtaFwS8', 'textDisplay': 'O t s e pode roubar, cassar e destruir e fica impune! A justiça compete a TODOS! Que a Justiça seja feita. EU JA NAO ACREDITO NESTAS ELEIÇÕES, VOU IR VOTAR NO DOMINGO, PORQUE ESTOU VENDO QUANTA SUJEIRA ESTAO LANÇANDO CONTRA BOLSONARO. MEU VOTO SERA O MEU APOIO AO PRESIDENTE JAIR MESSIAS BOLSONARO...', 'textOriginal': 'O t s e pode roubar, cassar e destruir e fica impune! A justiça compete a TODOS! Que a Justiça seja feita. EU JA NAO ACREDITO NESTAS ELEIÇÕES, VOU IR VOTAR NO DOMINGO, PORQUE ESTOU VENDO QUANTA SUJEIRA ESTAO LANÇANDO CONTRA BOLSONARO. MEU VOTO SERA O MEU APOIO AO PRESIDENTE JAIR MESSIAS BOLSONARO...', 'authorDisplayName': 'lucinei silva', 'authorProfileImageUrl': 'https://yt3.ggpht.com/ytc/AGIKgqONWr2IE-IbtHV8TlpSWXTNDRVmErDl7eMxQBaKiV8Swy_w-djzlxbQBT77Xn6m=s48-c-k-c0x00ffffff-no-rj', 'authorChannelUrl': 'http://www.youtube.com/channel/UCErhwB87UtLfpaYxLy_iVhw', 'authorChannelId': {'value': 'UCErhwB87UtLfpaYxLy_iVhw'}, 'canRate': True, 'viewerRating': 'none', 'likeCount': 0, 'publishedAt': '2022-10-27T15:11:21Z', 'updatedAt': '2022-10-27T15:11:21Z'}}, 'canReply': True, 'totalReplyCount': 0, 'isPublic': True}",,UCErhwB87UtLfpaYxLy_iVhw,2022-10-27T15:11:21Z,"O t s e pode roubar, cassar e destruir e fica impune! A justiça compete a TODOS! Que a Justiça seja feita. EU JA NAO ACREDITO NESTAS ELEIÇÕES, VOU IR VOTAR NO DOMINGO, PORQUE ESTOU VENDO QUANTA SUJEIRA ESTAO LANÇANDO CONTRA BOLSONARO. MEU VOTO SERA O MEU APOIO AO PRESIDENTE JAIR MESSIAS BOLSONARO...",QURTSl9pMlBjdUJKNEdoc2NjbE16akJIeXVIR2V5cUFzYWRpRkhqNklqMkh3cXFTaEYtNXh2SVFkMktmakp4S3pyN0Q2eGdoNExsYnVVdw==,2023-06-08 14:29:30.505881
youtube#commentThread,BhhnNp_jNqdA2HdFzLz--TemG1c,UgyT2mufShAj5kSfOUV4AaABAg,"{'videoId': '9bMjiwuBf-w', 'topLevelComment': {'kind': 'youtube#comment', 'etag': 'okRnOP2bCy50fzP1gx7tSxRPYLA', 'id': 'UgyT2mufShAj5kSfOUV4AaABAg', 'snippet': {'videoId': '9bMjiwuBf-w', 'textDisplay': 'FRAUDES NAS RADIOS E TVS. AS PESSOAS ENVOLVIDAS SABEM E NINGUÉM FALA NADA! A CORRUPÇÃO MATA TANTA GENTE E POR CAUSA DE DINHEIROS, SALARIOS, CARGOS POLÍTICOS ELES FAZEM TUDO. FALTA EM MUITA GENTE: VERDADE, VERDADE, VERDADE. O POVO DE UMA NAÇÃO PERECE POR FALTA DE CONHECIMENTO DA VERDADE!', 'textOriginal': 'FRAUDES NAS RADIOS E TVS. AS PESSOAS ENVOLVIDAS SABEM E NINGUÉM FALA NADA! A CORRUPÇÃO MATA TANTA GENTE E POR CAUSA DE DINHEIROS, SALARIOS, CARGOS POLÍTICOS ELES FAZEM TUDO. FALTA EM MUITA GENTE: VERDADE, VERDADE, VERDADE. O POVO DE UMA NAÇÃO PERECE POR FALTA DE CONHECIMENTO DA VERDADE!', 'authorDisplayName': 'lucinei silva', 'authorProfileImageUrl': 'https://yt3.ggpht.com/ytc/AGIKgqONWr2IE-IbtHV8TlpSWXTNDRVmErDl7eMxQBaKiV8Swy_w-djzlxbQBT77Xn6m=s48-c-k-c0x00ffffff-no-rj', 'authorChannelUrl': 'http://www.youtube.com/channel/UCErhwB87UtLfpaYxLy_iVhw', 'authorChannelId': {'value': 'UCErhwB87UtLfpaYxLy_iVhw'}, 'canRate': True, 'viewerRating': 'none', 'likeCount': 0, 'publishedAt': '2022-10-27T10:10:15Z', 'updatedAt': '2022-10-27T10:10:15Z'}}, 'canReply': True, 'totalReplyCount': 0, 'isPublic': True}",,UCErhwB87UtLfpaYxLy_iVhw,2022-10-27T10:10:15Z,"FRAUDES NAS RADIOS E TVS. AS PESSOAS ENVOLVIDAS SABEM E NINGUÉM FALA NADA! A CORRUPÇÃO MATA TANTA GENTE E POR CAUSA DE DINHEIROS, SALARIOS, CARGOS POLÍTICOS ELES FAZEM TUDO. FALTA EM MUITA GENTE: VERDADE, VERDADE, VERDADE. O POVO DE UMA NAÇÃO PERECE POR FALTA DE CONHECIMENTO DA VERDADE!",QURTSl9pMk1JZG53TWwxRC0yYkJuRHh6LUgySTgwc3Q0VDdETklEU2FsNElCbmVVbmNVOGUzZm9QeDZRbkNlS1ZfekkxTXNQWU1ZcExSOA==,2023-06-08 14:30:34.784367
youtube#commentThread,iPzYS0_eJCIgtx2MyucyAfV-ic4,Ugy0w9gCaUKhFd5afyF4AaABAg,"{'videoId': 'G649vouXaDo', 'topLevelComment': {'kind': 'youtube#comment', 'etag': '2hXRNP70i2q6Hxj_lBtUnB68hO4', 'id': 'Ugy0w9gCaUKhFd5afyF4AaABAg', 'snippet': {'videoId': 'G649vouXaDo', 'textDisplay': 'ELE SÓ ESTA FAZENDO ISSO PARA NAO SE TORNAR ALVO DE PEDIDO DE IMPECHEMANT PELO POVO BRASILEIRO...', 'textOriginal': 'ELE SÓ ESTA FAZENDO ISSO PARA NAO SE TORNAR ALVO DE PEDIDO DE IMPECHEMANT PELO POVO BRASILEIRO...', 'authorDisplayName': 'lucinei silva', 'authorProfileImageUrl': 'https://yt3.ggpht.com/ytc/AGIKgqONWr2IE-IbtHV8TlpSWXTNDRVmErDl7eMxQBaKiV8Swy_w-djzlxbQBT77Xn6m=s48-c-k-c0x00ffffff-no-rj', 'authorChannelUrl': 'http://www.youtube.com/channel/UCErhwB87UtLfpaYxLy_iVhw', 'authorChannelId': {'value': 'UCErhwB87UtLfpaYxLy_iVhw'}, 'canRate': True, 'viewerRating': 'none', 'likeCount': 0, 'publishedAt': '2022-10-26T14:09:57Z', 'updatedAt': '2022-10-26T14:09:57Z'}}, 'canReply': True, 'totalReplyCount': 0, 'isPublic': True}",,UCErhwB87UtLfpaYxLy_iVhw,2022-10-26T14:09:57Z,ELE SÓ ESTA FAZENDO ISSO PARA NAO SE TORNAR ALVO DE PEDIDO DE IMPECHEMANT PELO POVO BRASILEIRO...,QURTSl9pM0tsSXlVZnkxOHg0S0lqWnNqNEt3M3dJZUhzSG9DVDVaTjdXdUNuRGhVaGU5bU52R21jd3cyYVpCdXdlX2Rua2Jqd1lFQjJTSQ==,2023-06-08 14:37:44.252897
youtube#commentThread,w6v-LqiSYcASUPk4tqJybmenkCE,UgyK0AOlDv1qkNoTlCd4AaABAg,"{'videoId': 'uOYdnoDay8s', 'topLevelComment': {'kind': 'youtube#comment', 'etag': 'klx3332pS0AQvtal3KSKdxh1W-8', 'id': 'UgyK0AOlDv1qkNoTlCd4AaABAg', 'snippet': {'videoId': 'uOYdnoDay8s', 'textDisplay': 'O TRANSPORTE NAO É GRATUITO, O DINHEIRO VEM DO PAGAMENTO DE NOSSOS IMPOSTOS! É UM DIREITO NOSSO, MELHOR SE FOSSE TODOS OS DIAS, NAO APENAS NO DIA DA ELEIÇÃO. NOSSA SENHORA APARECIDA ROGAI POR NÓS 🙏', 'textOriginal': 'O TRANSPORTE NAO É GRATUITO, O DINHEIRO VEM DO PAGAMENTO DE NOSSOS IMPOSTOS! É UM DIREITO NOSSO, MELHOR SE FOSSE TODOS OS DIAS, NAO APENAS NO DIA DA ELEIÇÃO. NOSSA SENHORA APARECIDA ROGAI POR NÓS 🙏', 'authorDisplayName': 'lucinei silva', 'authorProfileImageUrl': 'https://yt3.ggpht.com/ytc/AGIKgqONWr2IE-IbtHV8TlpSWXTNDRVmErDl7eMxQBaKiV8Swy_w-djzlxbQBT77Xn6m=s48-c-k-c0x00ffffff-no-rj', 'authorChannelUrl': 'http://www.youtube.com/channel/UCErhwB87UtLfpaYxLy_iVhw', 'authorChannelId': {'value': 'UCErhwB87UtLfpaYxLy_iVhw'}, 'canRate': True, 'viewerRating': 'none', 'likeCount': 0, 'publishedAt': '2022-10-26T14:23:09Z', 'updatedAt': '2022-10-26T14:23:55Z'}}, 'canReply': True, 'totalReplyCount': 0, 'isPublic': True}",,UCErhwB87UtLfpaYxLy_iVhw,2022-10-26T14:23:09Z,"O TRANSPORTE NAO É GRATUITO, O DINHEIRO VEM DO PAGAMENTO DE NOSSOS IMPOSTOS! É UM DIREITO NOSSO, MELHOR SE FOSSE TODOS OS DIAS, NAO APENAS NO DIA DA ELEIÇÃO. NOSSA SENHORA APARECIDA ROGAI POR NÓS 🙏",,2023-06-08 14:37:54.213873
youtube#commentThread,V9GZrRYThCaY_jG4Vl1eYCvsWHw,UgwZv9YqpJ4Oj6idNjt4AaABAg,"{'videoId': '5RZSonFcHns', 'topLevelComment': {'kind': 'youtube#comment', 'etag': 'yk7j1zSOHN04GwcuSBCkX_2EiNU', 'id': 'UgwZv9YqpJ4Oj6idNjt4AaABAg', 'snippet': {'videoId': '5RZSonFcHns', 'textDisplay': 'Pedifilia é crime! Todos devem responder independente do cargo ou religião... Nossas crianças tem que ser PRESERVADAS de todo mal! 🙏', 'textOriginal': 'Pedifilia é crime! Todos devem responder independente do cargo ou religião... Nossas crianças tem que ser PRESERVADAS de todo mal! 🙏', 'authorDisplayName': 'lucinei silva', 'authorProfileImageUrl': 'https://yt3.ggpht.com/ytc/AGIKgqONWr2IE-IbtHV8TlpSWXTNDRVmErDl7eMxQBaKiV8Swy_w-djzlxbQBT77Xn6m=s48-c-k-c0x00ffffff-no-rj', 'authorChannelUrl': 'http://www.youtube.com/channel/UCErhwB87UtLfpaYxLy_iVhw', 'authorChannelId': {'value': 'UCErhwB87UtLfpaYxLy_iVhw'}, 'canRate': True, 'viewerRating': 'none', 'likeCount': 1, 'publishedAt': '2022-10-26T14:15:13Z', 'updatedAt': '2022-10-26T14:15:13Z'}}, 'canReply': True, 'totalReplyCount': 0, 'isPublic': True}",,UCErhwB87UtLfpaYxLy_iVhw,2022-10-26T14:15:13Z,Pedifilia é crime! Todos devem responder independente do cargo ou religião... Nossas crianças tem que ser PRESERVADAS de todo mal! 🙏,,2023-06-08 14:37:55.421048
youtube#commentThread,9qdEJaVGuF1YiDHZbPZJV5QCrvg,UgwFGFsSSVL-qKETn3Z4AaABAg,"{'videoId': 'hW-1117Dgjg', 'topLevelComment': {'kind': 'youtube#comment', 'etag': 'pw58jDsU4cw4tPs_HXXnIRc2hVw', 'id': 'UgwFGFsSSVL-qKETn3Z4AaABAg', 'snippet': {'videoId': 'hW-1117Dgjg', 'textDisplay': 'João Dória nunca mais 🙏', 'textOriginal': 'João Dória nunca mais 🙏', 'authorDisplayName': 'lucinei silva', 'authorProfileImageUrl': 'https://yt3.ggpht.com/ytc/AGIKgqONWr2IE-IbtHV8TlpSWXTNDRVmErDl7eMxQBaKiV8Swy_w-djzlxbQBT77Xn6m=s48-c-k-c0x00ffffff-no-rj', 'authorChannelUrl': 'http://www.youtube.com/channel/UCErhwB87UtLfpaYxLy_iVhw', 'authorChannelId': {'value': 'UCErhwB87UtLfpaYxLy_iVhw'}, 'canRate': True, 'viewerRating': 'none', 'likeCount': 4, 'publishedAt': '2022-10-26T14:12:36Z', 'updatedAt': '2022-10-26T14:12:36Z'}}, 'canReply': True, 'totalReplyCount': 0, 'isPublic': True}",,UCErhwB87UtLfpaYxLy_iVhw,2022-10-26T14:12:36Z,João Dória nunca mais 🙏,,2023-06-08 14:38:00.454664
youtube#commentThread,czenMNxIrXNZ7Dv5pTXcuo0t1mw,UgxZTSycEONrVKgjcnV4AaABAg,"{'videoId': '_WSdQAeG-qU', 'topLevelComment': {'kind': 'youtube#comment', 'etag': 'Y7E-J95ta6siNy6t1voiKDqy4vg', 'id': 'UgxZTSycEONrVKgjcnV4AaABAg', 'snippet': {'videoId': '_WSdQAeG-qU', 'textDisplay': 'Deus abençoe os afegãos e as mulheres e crianças afeganistãs🙏', 'textOriginal': 'Deus abençoe os afegãos e as mulheres e crianças afeganistãs🙏', 'authorDisplayName': 'lucinei silva', 'authorProfileImageUrl': 'https://yt3.ggpht.com/ytc/AGIKgqONWr2IE-IbtHV8TlpSWXTNDRVmErDl7eMxQBaKiV8Swy_w-djzlxbQBT77Xn6m=s48-c-k-c0x00ffffff-no-rj', 'authorChannelUrl': 'http://www.youtube.com/channel/UCErhwB87UtLfpaYxLy_iVhw', 'authorChannelId': {'value': 'UCErhwB87UtLfpaYxLy_iVhw'}, 'canRate': True, 'viewerRating': 'none', 'likeCount': 4, 'publishedAt': '2022-10-26T10:56:58Z', 'updatedAt': '2022-10-26T10:56:58Z'}}, 'canReply': True, 'totalReplyCount': 0, 'isPublic': True}",,UCErhwB87UtLfpaYxLy_iVhw,2022-10-26T10:56:58Z,Deus abençoe os afegãos e as mulheres e crianças afeganistãs🙏,,2023-06-08 14:39:51.766169
youtube#commentThread,XrtfHX4IvHT0RMfIOGpLV4qPHoY,UgyVlO63Uprmd4c03O14AaABAg,"{'videoId': 'bBEaBXRgJ_M', 'topLevelComment': {'kind': 'youtube#comment', 'etag': '1_bMLaaSZ6amAt6-VlZeFAwFdgA', 'id': 'UgyVlO63Uprmd4c03O14AaABAg', 'snippet': {'videoId': 'bBEaBXRgJ_M', 'textDisplay': 'Tinha que ter outras pessoas a quem recorrer! O t s e faz campanha pra lula 😳', 'textOriginal': 'Tinha que ter outras pessoas a quem recorrer! O t s e faz campanha pra lula 😳', 'authorDisplayName': 'lucinei silva', 'authorProfileImageUrl': 'https://yt3.ggpht.com/ytc/AGIKgqONWr2IE-IbtHV8TlpSWXTNDRVmErDl7eMxQBaKiV8Swy_w-djzlxbQBT77Xn6m=s48-c-k-c0x00ffffff-no-rj', 'authorChannelUrl': 'http://www.youtube.com/channel/UCErhwB87UtLfpaYxLy_iVhw', 'authorChannelId': {'value': 'UCErhwB87UtLfpaYxLy_iVhw'}, 'canRate': True, 'viewerRating': 'none', 'likeCount': 0, 'publishedAt': '2022-10-26T10:53:35Z', 'updatedAt': '2022-10-26T10:53:35Z'}}, 'canReply': True, 'totalReplyCount': 0, 'isPublic': True}",,UCErhwB87UtLfpaYxLy_iVhw,2022-10-26T10:53:35Z,Tinha que ter outras pessoas a quem recorrer! O t s e faz campanha pra lula 😳,QURTSl9pMHVQWENHNmJrLTFBRmFRal9TN24waWVZT3FLM3ladUJVMWVKM20zckhzQ3VuR3BncTB2cEhqanEzWDg2eGNLMDg4eGdGRkRWTQ==,2023-06-08 14:39:57.618791
youtube#commentThread,GUMzK76_4cGDCW6i4tryzPPab3c,UgyPLTF3xw1UcSgIZsp4AaABAg,"{'videoId': '983yDWY_4K8', 'topLevelComment': {'kind': 'youtube#comment', 'etag': '-OAN5tD33qNR9M0XvT5m6qVu9Jk', 'id': 'UgyPLTF3xw1UcSgIZsp4AaABAg', 'snippet': {'videoId': '983yDWY_4K8', 'textDisplay': 'Vamos limpar o nosso Brasil desses lixos escondidos!....', 'textOriginal': 'Vamos limpar o nosso Brasil desses lixos escondidos!....', 'authorDisplayName': 'lucinei silva', 'authorProfileImageUrl': 'https://yt3.ggpht.com/ytc/AGIKgqONWr2IE-IbtHV8TlpSWXTNDRVmErDl7eMxQBaKiV8Swy_w-djzlxbQBT77Xn6m=s48-c-k-c0x00ffffff-no-rj', 'authorChannelUrl': 'http://www.youtube.com/channel/UCErhwB87UtLfpaYxLy_iVhw', 'authorChannelId': {'value': 'UCErhwB87UtLfpaYxLy_iVhw'}, 'canRate': True, 'viewerRating': 'none', 'likeCount': 0, 'publishedAt': '2022-10-25T21:11:12Z', 'updatedAt': '2022-10-25T21:11:12Z'}}, 'canReply': True, 'totalReplyCount': 0, 'isPublic': True}",,UCErhwB87UtLfpaYxLy_iVhw,2022-10-25T21:11:12Z,Vamos limpar o nosso Brasil desses lixos escondidos!....,QURTSl9pMGFMN3ZmWDVnNFNfbXZydVlwR2RweWFHWGRGTk9Rak1sS1NPZFp0dzhhWEYzOFBTN3pJN2pwM25LMDB6b05TQ3V1SFY0c00zZw==,2023-06-08 14:40:50.832738
youtube#commentThread,bTbqV60856cd_BRPjDVErKP8cq4,Ugzjjaq7BJmyek1RsMZ4AaABAg,"{'videoId': 'YGihPaI_gmE', 'topLevelComment': {'kind': 'youtube#comment', 'etag': 'gBQyhITAk6cr4HTzzI6gKrfaPSA', 'id': 'Ugzjjaq7BJmyek1RsMZ4AaABAg', 'snippet': {'videoId': 'YGihPaI_gmE', 'textDisplay': 'Todos juntos com Bolsonaro 22 🙏', 'textOriginal': 'Todos juntos com Bolsonaro 22 🙏', 'authorDisplayName': 'lucinei silva', 'authorProfileImageUrl': 'https://yt3.ggpht.com/ytc/AGIKgqONWr2IE-IbtHV8TlpSWXTNDRVmErDl7eMxQBaKiV8Swy_w-djzlxbQBT77Xn6m=s48-c-k-c0x00ffffff-no-rj', 'authorChannelUrl': 'http://www.youtube.com/channel/UCErhwB87UtLfpaYxLy_iVhw', 'authorChannelId': {'value': 'UCErhwB87UtLfpaYxLy_iVhw'}, 'canRate': True, 'viewerRating': 'none', 'likeCount': 0, 'publishedAt': '2022-10-25T18:39:27Z', 'updatedAt': '2022-10-25T18:39:27Z'}}, 'canReply': True, 'totalReplyCount': 0, 'isPublic': True}",,UCErhwB87UtLfpaYxLy_iVhw,2022-10-25T18:39:27Z,Todos juntos com Bolsonaro 22 🙏,QURTSl9pMmN6QWNhWlkySC00Uk9ydC04RDJOWktvRUg4R1F0WGJvZ1lBQVpRNGZpWWFxQXFYQ0JHQXhBbTFhTEV2WlVEbXZsdXVGbGk5QQ==,2023-06-08 14:42:38.874149
youtube#commentThread,0YPPAZR-aziRYfnSTorH9H8tuWQ,Ugw48qhP6c-O1TKa5ZR4AaABAg,"{'videoId': 'BLtuiKUBxis', 'topLevelComment': {'kind': 'youtube#comment', 'etag': 'zwTROFkp8WzDA1Zb0PK3rgcWpqU', 'id': 'Ugw48qhP6c-O1TKa5ZR4AaABAg', 'snippet': {'videoId': 'BLtuiKUBxis', 'textDisplay': 'Cadê o senado? O congresso? As autoridades que representam o povo? Ninguém vai fazer nada? Que país é esse? Um homem que não foi eleito pelo povo está destruindo as leis e ficam os eleitos quietos?', 'textOriginal': 'Cadê o senado? O congresso? As autoridades que representam o povo? Ninguém vai fazer nada? Que país é esse? Um homem que não foi eleito pelo povo está destruindo as leis e ficam os eleitos quietos?', 'authorDisplayName': 'lucinei silva', 'authorProfileImageUrl': 'https://yt3.ggpht.com/ytc/AGIKgqONWr2IE-IbtHV8TlpSWXTNDRVmErDl7eMxQBaKiV8Swy_w-djzlxbQBT77Xn6m=s48-c-k-c0x00ffffff-no-rj', 'authorChannelUrl': 'http://www.youtube.com/channel/UCErhwB87UtLfpaYxLy_iVhw', 'authorChannelId': {'value': 'UCErhwB87UtLfpaYxLy_iVhw'}, 'canRate': True, 'viewerRating': 'none', 'likeCount': 0, 'publishedAt': '2022-10-23T22:13:36Z', 'updatedAt': '2022-10-23T22:14:53Z'}}, 'canReply': True, 'totalReplyCount': 0, 'isPublic': True}",,UCErhwB87UtLfpaYxLy_iVhw,2022-10-23T22:13:36Z,Cadê o senado? O congresso? As autoridades que representam o povo? Ninguém vai fazer nada? Que país é esse? Um homem que não foi eleito pelo povo está destruindo as leis e ficam os eleitos quietos?,QURTSl9pMURRNTlqaUM4LVNuREpWQlIzQ054YlgwbWEySWlrNzJMbjh2RXhLdVYwb2JXUmN4bFM4UUpsTVdxWmVabWktUUhab2RBTDZtaw==,2023-06-08 14:54:30.185899
