kind,etag,id,snippet,replies,authorChannelId,publishedAt,textOriginal,nextPageToken,extraction_date
youtube#commentThread,coJdyDelD64zQ9o8fa-9PuARrrY,Ugxn8hvL1AbB3MTeA6J4AaABAg,"{'videoId': '2wCv5EJkkF4', 'topLevelComment': {'kind': 'youtube#comment', 'etag': 'zrCSwA6UVbkRVcU7zI5qu2RqnKo', 'id': 'Ugxn8hvL1AbB3MTeA6J4AaABAg', 'snippet': {'videoId': '2wCv5EJkkF4', 'textDisplay': 'RUSSIA FAZ FERTILIZANTES MAIS BARATOS  MAS A TECNOLOGIA  E MEDICAMENTOS DA O OCIDENTE OU QUEM APOIA UKRANIA  NAO ESQUECAO QUE PARA AGRICULTURA PRECISAM DE  MAQUINAS A FONCIONAR FICAM APOIANDO TERRORISTAS VAO PAGAR A FACTURA', 'textOriginal': 'RUSSIA FAZ FERTILIZANTES MAIS BARATOS  MAS A TECNOLOGIA  E MEDICAMENTOS DA O OCIDENTE OU QUEM APOIA UKRANIA  NAO ESQUECAO QUE PARA AGRICULTURA PRECISAM DE  MAQUINAS A FONCIONAR FICAM APOIANDO TERRORISTAS VAO PAGAR A FACTURA', 'authorDisplayName': 'Matfaycal', 'authorProfileImageUrl': 'https://yt3.ggpht.com/ytc/AGIKgqNLTfYucS0xek446eIojidqlcIIFNNlQgC1RgytMCdcdMrn3-IBn0BvRRUaQZ19=s48-c-k-c0x00ffffff-no-rj', 'authorChannelUrl': 'http://www.youtube.com/channel/UCdN5pcLZ3v5AbyHPIeBX48g', 'authorChannelId': {'value': 'UCdN5pcLZ3v5AbyHPIeBX48g'}, 'canRate': True, 'viewerRating': 'none', 'likeCount': 0, 'publishedAt': '2022-10-20T11:22:36Z', 'updatedAt': '2022-10-20T11:23:22Z'}}, 'canReply': True, 'totalReplyCount': 3, 'isPublic': True}","{'comments': [{'kind': 'youtube#comment', 'etag': 'yvLMHsAMobBbiKCRT5o2AzGV7Bc', 'id': 'Ugxn8hvL1AbB3MTeA6J4AaABAg.9hPGIEugHzF9hPHAl4uVr4', 'snippet': {'videoId': '2wCv5EJkkF4', 'textDisplay': '@Anoteai uma coisa e voce deixar explorar outra e voce invadir e tirar a força o que nao e seu entende ? Voce pode pegar na minha carteira e tirar 50$ se eu premitir outra e voce sem minha autorizacao roubar todo meu dinheiro', 'textOriginal': '@Anoteai uma coisa e voce deixar explorar outra e voce invadir e tirar a força o que nao e seu entende ? Voce pode pegar na minha carteira e tirar 50$ se eu premitir outra e voce sem minha autorizacao roubar todo meu dinheiro', 'parentId': 'Ugxn8hvL1AbB3MTeA6J4AaABAg', 'authorDisplayName': 'Matfaycal', 'authorProfileImageUrl': 'https://yt3.ggpht.com/ytc/AGIKgqNLTfYucS0xek446eIojidqlcIIFNNlQgC1RgytMCdcdMrn3-IBn0BvRRUaQZ19=s48-c-k-c0x00ffffff-no-rj', 'authorChannelUrl': 'http://www.youtube.com/channel/UCdN5pcLZ3v5AbyHPIeBX48g', 'authorChannelId': {'value': 'UCdN5pcLZ3v5AbyHPIeBX48g'}, 'canRate': True, 'viewerRating': 'none', 'likeCount': 0, 'publishedAt': '2022-10-20T11:30:19Z', 'updatedAt': '2022-10-20T11:30:19Z'}}, {'kind': 'youtube#comment', 'etag': 'd22yoCXeU2cctlHYqed75cBIPt4', 'id': 'Ugxn8hvL1AbB3MTeA6J4AaABAg.9hPGIEugHzF9hPGzDoFrqX', 'snippet': {'videoId': '2wCv5EJkkF4', 'textDisplay': '@Anoteai quem estavs a explorar a zona de Donbass era surkov o braco direito de putin nao era US mesmo antes de Russia anexar ja tinham.planos para toda Ucrania', 'textOriginal': '@Anoteai quem estavs a explorar a zona de Donbass era surkov o braco direito de putin nao era US mesmo antes de Russia anexar ja tinham.planos para toda Ucrania', 'parentId': 'Ugxn8hvL1AbB3MTeA6J4AaABAg', 'authorDisplayName': 'Matfaycal', 'authorProfileImageUrl': 'https://yt3.ggpht.com/ytc/AGIKgqNLTfYucS0xek446eIojidqlcIIFNNlQgC1RgytMCdcdMrn3-IBn0BvRRUaQZ19=s48-c-k-c0x00ffffff-no-rj', 'authorChannelUrl': 'http://www.youtube.com/channel/UCdN5pcLZ3v5AbyHPIeBX48g', 'authorChannelId': {'value': 'UCdN5pcLZ3v5AbyHPIeBX48g'}, 'canRate': True, 'viewerRating': 'none', 'likeCount': 0, 'publishedAt': '2022-10-20T11:28:37Z', 'updatedAt': '2022-10-20T11:28:37Z'}}, {'kind': 'youtube#comment', 'etag': 'gRgWEmpUFeFEK1cC9-2CghR2qKw', 'id': 'Ugxn8hvL1AbB3MTeA6J4AaABAg.9hPGIEugHzF9hPG_UqoImf', 'snippet': {'videoId': '2wCv5EJkkF4', 'textDisplay': 'Essa guerra é pelas terras e riquezas naturais da Ucrânia, ou seja 🇺🇸 e Rússia 🇷🇺', 'textOriginal': 'Essa guerra é pelas terras e riquezas naturais da Ucrânia, ou seja 🇺🇸 e Rússia 🇷🇺', 'parentId': 'Ugxn8hvL1AbB3MTeA6J4AaABAg', 'authorDisplayName': 'Anoteai', 'authorProfileImageUrl': 'https://yt3.ggpht.com/5NcyDaa39M0v5M6FT412Jo4gYrdPEe8kXA7v_cX4qWwaLMsvwQdwZVn-gPJbcEaYiSsbWLVCaXY=s48-c-k-c0x00ffffff-no-rj', 'authorChannelUrl': 'http://www.youtube.com/channel/UC-iqICQZD6p1vvP1cus7Nlg', 'authorChannelId': {'value': 'UC-iqICQZD6p1vvP1cus7Nlg'}, 'canRate': True, 'viewerRating': 'none', 'likeCount': 0, 'publishedAt': '2022-10-20T11:25:06Z', 'updatedAt': '2022-10-20T11:25:06Z'}}]}",UCdN5pcLZ3v5AbyHPIeBX48g,2022-10-20T11:22:36Z,RUSSIA FAZ FERTILIZANTES MAIS BARATOS  MAS A TECNOLOGIA  E MEDICAMENTOS DA O OCIDENTE OU QUEM APOIA UKRANIA  NAO ESQUECAO QUE PARA AGRICULTURA PRECISAM DE  MAQUINAS A FONCIONAR FICAM APOIANDO TERRORISTAS VAO PAGAR A FACTURA,,2023-06-08 15:25:58.848961
youtube#commentThread,rI5If79Se5IroA30imO36IOwPx0,Ugy71vd4TJO7z6maYyp4AaABAg,"{'videoId': 'U-lic237N2k', 'topLevelComment': {'kind': 'youtube#comment', 'etag': 'fOR7N3fb_pftsJ35kukXTZlBEPw', 'id': 'Ugy71vd4TJO7z6maYyp4AaABAg', 'snippet': {'videoId': 'U-lic237N2k', 'textDisplay': 'Nao querem deixar a Ucrania suas antas eles sao Ucranianos votaram em zelensky  voce é reporter nem ve o mapa das eleicoes presidencias da Ucrania  zaporizia venceu zelensky  kherson tambem kharkiv  igual esse canal e de informacao ou de desinformacao????', 'textOriginal': 'Nao querem deixar a Ucrania suas antas eles sao Ucranianos votaram em zelensky  voce é reporter nem ve o mapa das eleicoes presidencias da Ucrania  zaporizia venceu zelensky  kherson tambem kharkiv  igual esse canal e de informacao ou de desinformacao????', 'authorDisplayName': 'Matfaycal', 'authorProfileImageUrl': 'https://yt3.ggpht.com/ytc/AGIKgqNLTfYucS0xek446eIojidqlcIIFNNlQgC1RgytMCdcdMrn3-IBn0BvRRUaQZ19=s48-c-k-c0x00ffffff-no-rj', 'authorChannelUrl': 'http://www.youtube.com/channel/UCdN5pcLZ3v5AbyHPIeBX48g', 'authorChannelId': {'value': 'UCdN5pcLZ3v5AbyHPIeBX48g'}, 'canRate': True, 'viewerRating': 'none', 'likeCount': 0, 'publishedAt': '2022-10-20T14:08:23Z', 'updatedAt': '2022-10-20T14:08:23Z'}}, 'canReply': True, 'totalReplyCount': 0, 'isPublic': True}",,UCdN5pcLZ3v5AbyHPIeBX48g,2022-10-20T14:08:23Z,Nao querem deixar a Ucrania suas antas eles sao Ucranianos votaram em zelensky  voce é reporter nem ve o mapa das eleicoes presidencias da Ucrania  zaporizia venceu zelensky  kherson tambem kharkiv  igual esse canal e de informacao ou de desinformacao????,QURTSl9pMWdiV1VkZndHaExxbmZwSDBId1ZzbmM1UThFSnpJUVhFRUI3c0lNemtqZ1pOOWd3aExMS0J4a3VEblp2Smxmb3FtWDlhSHd2aw==,2023-06-08 15:26:11.654097
youtube#commentThread,cOKQygw16XciqPCnbG5xoYfKNI4,UgyfsZTeTGZGue20mGp4AaABAg,"{'videoId': 'U-lic237N2k', 'topLevelComment': {'kind': 'youtube#comment', 'etag': '-ogq7ql27pO0KbBTmICcDRtbVNk', 'id': 'UgyfsZTeTGZGue20mGp4AaABAg', 'snippet': {'videoId': 'U-lic237N2k', 'textDisplay': 'O que a Russia esta a fazer é deportaçao dos ucranianos como fez na chechenia os enviou para a seberia  e assim que vence os referendos deporta os ucranianos e mete esterco Russo', 'textOriginal': 'O que a Russia esta a fazer é deportaçao dos ucranianos como fez na chechenia os enviou para a seberia  e assim que vence os referendos deporta os ucranianos e mete esterco Russo', 'authorDisplayName': 'Matfaycal', 'authorProfileImageUrl': 'https://yt3.ggpht.com/ytc/AGIKgqNLTfYucS0xek446eIojidqlcIIFNNlQgC1RgytMCdcdMrn3-IBn0BvRRUaQZ19=s48-c-k-c0x00ffffff-no-rj', 'authorChannelUrl': 'http://www.youtube.com/channel/UCdN5pcLZ3v5AbyHPIeBX48g', 'authorChannelId': {'value': 'UCdN5pcLZ3v5AbyHPIeBX48g'}, 'canRate': True, 'viewerRating': 'none', 'likeCount': 0, 'publishedAt': '2022-10-20T14:05:56Z', 'updatedAt': '2022-10-20T14:05:56Z'}}, 'canReply': True, 'totalReplyCount': 0, 'isPublic': True}",,UCdN5pcLZ3v5AbyHPIeBX48g,2022-10-20T14:05:56Z,O que a Russia esta a fazer é deportaçao dos ucranianos como fez na chechenia os enviou para a seberia  e assim que vence os referendos deporta os ucranianos e mete esterco Russo,QURTSl9pMWdiV1VkZndHaExxbmZwSDBId1ZzbmM1UThFSnpJUVhFRUI3c0lNemtqZ1pOOWd3aExMS0J4a3VEblp2Smxmb3FtWDlhSHd2aw==,2023-06-08 15:26:11.654097
youtube#commentThread,VV0uLslLBjY3r53vJeTviX7aCOk,UgyuWPubSd1q-kSstON4AaABAg,"{'videoId': '6nYewoxCSpE', 'topLevelComment': {'kind': 'youtube#comment', 'etag': 'uIJLKk7LCxCwfyQ7_GMm66h--fw', 'id': 'UgyuWPubSd1q-kSstON4AaABAg', 'snippet': {'videoId': '6nYewoxCSpE', 'textDisplay': 'Eu vejo mais a caminho da autocracia  veja so aliança Brics  china  Russia  agora falam irao  Brasil esta fazendo aliancas com paises autocratas nao democratas', 'textOriginal': 'Eu vejo mais a caminho da autocracia  veja so aliança Brics  china  Russia  agora falam irao  Brasil esta fazendo aliancas com paises autocratas nao democratas', 'authorDisplayName': 'Matfaycal', 'authorProfileImageUrl': 'https://yt3.ggpht.com/ytc/AGIKgqNLTfYucS0xek446eIojidqlcIIFNNlQgC1RgytMCdcdMrn3-IBn0BvRRUaQZ19=s48-c-k-c0x00ffffff-no-rj', 'authorChannelUrl': 'http://www.youtube.com/channel/UCdN5pcLZ3v5AbyHPIeBX48g', 'authorChannelId': {'value': 'UCdN5pcLZ3v5AbyHPIeBX48g'}, 'canRate': True, 'viewerRating': 'none', 'likeCount': 0, 'publishedAt': '2022-10-23T11:16:20Z', 'updatedAt': '2022-10-23T11:16:20Z'}}, 'canReply': True, 'totalReplyCount': 0, 'isPublic': True}",,UCdN5pcLZ3v5AbyHPIeBX48g,2022-10-23T11:16:20Z,Eu vejo mais a caminho da autocracia  veja so aliança Brics  china  Russia  agora falam irao  Brasil esta fazendo aliancas com paises autocratas nao democratas,QURTSl9pM1J1Zlk2RVdKYjlybzNjRHVmU1JOeGxlTzlCazlZWXJfWjc0Tl9WREpOQmZNYTduaDVfZW9OSE9ZcHN1d1NUSXI2NlZmX29Tbw==,2023-06-08 15:32:25.011717
youtube#commentThread,1wYajBc0do6wyjhBw-E1fhXmJeY,UgwTswO2E_BuHWwSat14AaABAg,"{'videoId': 'YR6xxlDn1rE', 'topLevelComment': {'kind': 'youtube#comment', 'etag': 'xFNCM1DMMLcfP_-FG58oBziesiE', 'id': 'UgwTswO2E_BuHWwSat14AaABAg', 'snippet': {'videoId': 'YR6xxlDn1rE', 'textDisplay': 'Irao mais um candidato ao BRICS  estao os escolhendo a dedo so falta convidar a koreia do Norte  e Venuzuela para completar  o time😂', 'textOriginal': 'Irao mais um candidato ao BRICS  estao os escolhendo a dedo so falta convidar a koreia do Norte  e Venuzuela para completar  o time😂', 'authorDisplayName': 'Matfaycal', 'authorProfileImageUrl': 'https://yt3.ggpht.com/ytc/AGIKgqNLTfYucS0xek446eIojidqlcIIFNNlQgC1RgytMCdcdMrn3-IBn0BvRRUaQZ19=s48-c-k-c0x00ffffff-no-rj', 'authorChannelUrl': 'http://www.youtube.com/channel/UCdN5pcLZ3v5AbyHPIeBX48g', 'authorChannelId': {'value': 'UCdN5pcLZ3v5AbyHPIeBX48g'}, 'canRate': True, 'viewerRating': 'none', 'likeCount': 10, 'publishedAt': '2022-10-19T11:18:12Z', 'updatedAt': '2022-10-19T11:18:22Z'}}, 'canReply': True, 'totalReplyCount': 1, 'isPublic': True}","{'comments': [{'kind': 'youtube#comment', 'etag': 'mudMJkicP5ijhy37DCStOBP6c4E', 'id': 'UgwTswO2E_BuHWwSat14AaABAg.9hMg-5TrYWL9hN0dB7pR3r', 'snippet': {'videoId': 'YR6xxlDn1rE', 'textDisplay': 'Tem que ter grana pra entrar no brics', 'textOriginal': 'Tem que ter grana pra entrar no brics', 'parentId': 'UgwTswO2E_BuHWwSat14AaABAg', 'authorDisplayName': 'Sam', 'authorProfileImageUrl': 'https://yt3.ggpht.com/ytc/AGIKgqNb_p01GljKfTMlVZvRCrH1faIYIrV6WVunifNz3Q=s48-c-k-c0x00ffffff-no-rj', 'authorChannelUrl': 'http://www.youtube.com/channel/UCBLika58bN7ULZ9HP9frNPA', 'authorChannelId': {'value': 'UCBLika58bN7ULZ9HP9frNPA'}, 'canRate': True, 'viewerRating': 'none', 'likeCount': 0, 'publishedAt': '2022-10-19T14:27:19Z', 'updatedAt': '2022-10-19T14:27:19Z'}}]}",UCdN5pcLZ3v5AbyHPIeBX48g,2022-10-19T11:18:12Z,Irao mais um candidato ao BRICS  estao os escolhendo a dedo so falta convidar a koreia do Norte  e Venuzuela para completar  o time😂,,2023-06-08 15:38:25.771837
youtube#commentThread,aCDUWkZopgwHO9arfNlAOKcfQnM,UgzB72Rm-IcqM6xYSwN4AaABAg,"{'videoId': 'YR6xxlDn1rE', 'topLevelComment': {'kind': 'youtube#comment', 'etag': 'ighBOc5Uz6dcmQULPDCjRMrzy7I', 'id': 'UgzB72Rm-IcqM6xYSwN4AaABAg', 'snippet': {'videoId': 'YR6xxlDn1rE', 'textDisplay': 'A Russia nao esta atacar alvos militares esta a Bombardear apenas civis destruindo infrastruturas para matar os civis Ucranianos com o frio isso e terrorismo puro', 'textOriginal': 'A Russia nao esta atacar alvos militares esta a Bombardear apenas civis destruindo infrastruturas para matar os civis Ucranianos com o frio isso e terrorismo puro', 'authorDisplayName': 'Matfaycal', 'authorProfileImageUrl': 'https://yt3.ggpht.com/ytc/AGIKgqNLTfYucS0xek446eIojidqlcIIFNNlQgC1RgytMCdcdMrn3-IBn0BvRRUaQZ19=s48-c-k-c0x00ffffff-no-rj', 'authorChannelUrl': 'http://www.youtube.com/channel/UCdN5pcLZ3v5AbyHPIeBX48g', 'authorChannelId': {'value': 'UCdN5pcLZ3v5AbyHPIeBX48g'}, 'canRate': True, 'viewerRating': 'none', 'likeCount': 0, 'publishedAt': '2022-10-19T11:15:47Z', 'updatedAt': '2022-10-19T11:15:47Z'}}, 'canReply': True, 'totalReplyCount': 0, 'isPublic': True}",,UCdN5pcLZ3v5AbyHPIeBX48g,2022-10-19T11:15:47Z,A Russia nao esta atacar alvos militares esta a Bombardear apenas civis destruindo infrastruturas para matar os civis Ucranianos com o frio isso e terrorismo puro,,2023-06-08 15:38:25.771837
youtube#commentThread,r86jLbrRlicmYEmOfrT2bwjMm-I,UgxBqzjylZ3Pz9UrtE94AaABAg,"{'videoId': 'Mb5A8Pj4Wgc', 'topLevelComment': {'kind': 'youtube#comment', 'etag': 't8eLIIXjfxvNB_0-vr7TL3AFrnk', 'id': 'UgxBqzjylZ3Pz9UrtE94AaABAg', 'snippet': {'videoId': 'Mb5A8Pj4Wgc', 'textDisplay': 'Uma vez usando uma arma Nuclear para vencer uma guerra quem tem Nucleares vai usar isso para invadir outros países certo? Vcs ai no Brasil falam que querem roubar o Amazonia sera essa tatica Russa da Nuclear que iram usar so pequenas...Nuclear tatica so pequenas nao faz estrago nenhum certo?', 'textOriginal': 'Uma vez usando uma arma Nuclear para vencer uma guerra quem tem Nucleares vai usar isso para invadir outros países certo? Vcs ai no Brasil falam que querem roubar o Amazonia sera essa tatica Russa da Nuclear que iram usar so pequenas...Nuclear tatica so pequenas nao faz estrago nenhum certo?', 'authorDisplayName': 'Matfaycal', 'authorProfileImageUrl': 'https://yt3.ggpht.com/ytc/AGIKgqNLTfYucS0xek446eIojidqlcIIFNNlQgC1RgytMCdcdMrn3-IBn0BvRRUaQZ19=s48-c-k-c0x00ffffff-no-rj', 'authorChannelUrl': 'http://www.youtube.com/channel/UCdN5pcLZ3v5AbyHPIeBX48g', 'authorChannelId': {'value': 'UCdN5pcLZ3v5AbyHPIeBX48g'}, 'canRate': True, 'viewerRating': 'none', 'likeCount': 0, 'publishedAt': '2022-10-19T05:14:39Z', 'updatedAt': '2022-10-19T05:14:39Z'}}, 'canReply': True, 'totalReplyCount': 0, 'isPublic': True}",,UCdN5pcLZ3v5AbyHPIeBX48g,2022-10-19T05:14:39Z,Uma vez usando uma arma Nuclear para vencer uma guerra quem tem Nucleares vai usar isso para invadir outros países certo? Vcs ai no Brasil falam que querem roubar o Amazonia sera essa tatica Russa da Nuclear que iram usar so pequenas...Nuclear tatica so pequenas nao faz estrago nenhum certo?,,2023-06-08 15:39:21.232358
youtube#commentThread,lrjRh9L3lIyU962LuUHuznUHTNI,Ugx-IfIq6fCk-H6VLQ54AaABAg,"{'videoId': 'Mb5A8Pj4Wgc', 'topLevelComment': {'kind': 'youtube#comment', 'etag': 'ZN37NotNRB4nFyXq4WTvk70xyMM', 'id': 'Ugx-IfIq6fCk-H6VLQ54AaABAg', 'snippet': {'videoId': 'Mb5A8Pj4Wgc', 'textDisplay': 'Ponto de vista legal ?? So se for para voce', 'textOriginal': 'Ponto de vista legal ?? So se for para voce', 'authorDisplayName': 'Matfaycal', 'authorProfileImageUrl': 'https://yt3.ggpht.com/ytc/AGIKgqNLTfYucS0xek446eIojidqlcIIFNNlQgC1RgytMCdcdMrn3-IBn0BvRRUaQZ19=s48-c-k-c0x00ffffff-no-rj', 'authorChannelUrl': 'http://www.youtube.com/channel/UCdN5pcLZ3v5AbyHPIeBX48g', 'authorChannelId': {'value': 'UCdN5pcLZ3v5AbyHPIeBX48g'}, 'canRate': True, 'viewerRating': 'none', 'likeCount': 4, 'publishedAt': '2022-10-19T05:04:02Z', 'updatedAt': '2022-10-19T05:04:02Z'}}, 'canReply': True, 'totalReplyCount': 0, 'isPublic': True}",,UCdN5pcLZ3v5AbyHPIeBX48g,2022-10-19T05:04:02Z,Ponto de vista legal ?? So se for para voce,,2023-06-08 15:39:21.232358
youtube#commentThread,MSnChPmSav7PdW3xXiHZGoe4orU,Ugybl2m0EKM4IHG7tfJ4AaABAg,"{'videoId': 'Mb5A8Pj4Wgc', 'topLevelComment': {'kind': 'youtube#comment', 'etag': 'U1ALFYKF5tTRUhUSPM0SNW_b_hA', 'id': 'Ugybl2m0EKM4IHG7tfJ4AaABAg', 'snippet': {'videoId': 'Mb5A8Pj4Wgc', 'textDisplay': 'Certo vc falou bem terror e que Russia é país Terrorista  !! Bombardear infratruturas civil e crime de Guerra esse senhor deve saber as leis internacionais como comentador e vcs jornalistas', 'textOriginal': 'Certo vc falou bem terror e que Russia é país Terrorista  !! Bombardear infratruturas civil e crime de Guerra esse senhor deve saber as leis internacionais como comentador e vcs jornalistas', 'authorDisplayName': 'Matfaycal', 'authorProfileImageUrl': 'https://yt3.ggpht.com/ytc/AGIKgqNLTfYucS0xek446eIojidqlcIIFNNlQgC1RgytMCdcdMrn3-IBn0BvRRUaQZ19=s48-c-k-c0x00ffffff-no-rj', 'authorChannelUrl': 'http://www.youtube.com/channel/UCdN5pcLZ3v5AbyHPIeBX48g', 'authorChannelId': {'value': 'UCdN5pcLZ3v5AbyHPIeBX48g'}, 'canRate': True, 'viewerRating': 'none', 'likeCount': 0, 'publishedAt': '2022-10-19T05:00:02Z', 'updatedAt': '2022-10-19T05:02:42Z'}}, 'canReply': True, 'totalReplyCount': 0, 'isPublic': True}",,UCdN5pcLZ3v5AbyHPIeBX48g,2022-10-19T05:00:02Z,Certo vc falou bem terror e que Russia é país Terrorista  !! Bombardear infratruturas civil e crime de Guerra esse senhor deve saber as leis internacionais como comentador e vcs jornalistas,,2023-06-08 15:39:21.232358
youtube#commentThread,dME9eeGyMieVRl0iYLxKVBaEwdk,UgxQtBRAb9Bv9KHTwYd4AaABAg,"{'videoId': 'MW29izpWypU', 'topLevelComment': {'kind': 'youtube#comment', 'etag': 'BcLKXs8zRIcnmL9Urj6Y_Kadv6I', 'id': 'UgxQtBRAb9Bv9KHTwYd4AaABAg', 'snippet': {'videoId': 'MW29izpWypU', 'textDisplay': 'Certo aprendeu com Bolsonaro  e so por dizer que e filha dele agora que esta em questao mas as filhas dos outros que tambem eram menores ja nao tem. Problema o presidente falar o mesmo', 'textOriginal': 'Certo aprendeu com Bolsonaro  e so por dizer que e filha dele agora que esta em questao mas as filhas dos outros que tambem eram menores ja nao tem. Problema o presidente falar o mesmo', 'authorDisplayName': 'Matfaycal', 'authorProfileImageUrl': 'https://yt3.ggpht.com/ytc/AGIKgqNLTfYucS0xek446eIojidqlcIIFNNlQgC1RgytMCdcdMrn3-IBn0BvRRUaQZ19=s48-c-k-c0x00ffffff-no-rj', 'authorChannelUrl': 'http://www.youtube.com/channel/UCdN5pcLZ3v5AbyHPIeBX48g', 'authorChannelId': {'value': 'UCdN5pcLZ3v5AbyHPIeBX48g'}, 'canRate': True, 'viewerRating': 'none', 'likeCount': 0, 'publishedAt': '2022-10-18T19:17:59Z', 'updatedAt': '2022-10-18T19:20:00Z'}}, 'canReply': True, 'totalReplyCount': 0, 'isPublic': True}",,UCdN5pcLZ3v5AbyHPIeBX48g,2022-10-18T19:17:59Z,Certo aprendeu com Bolsonaro  e so por dizer que e filha dele agora que esta em questao mas as filhas dos outros que tambem eram menores ja nao tem. Problema o presidente falar o mesmo,QURTSl9pMzRVLTFHNXZCOVljQjdPYjB1S25TbGtOamJZdHhRcFFmRFB5a0RQQ2Vxb2thdzNraWNBdVE3MllENHVNZDVlYU9JNkJXUmk2VQ==,2023-06-08 15:43:00.658935
youtube#commentThread,dCkwjK8jn_YSyq0975JNZ_9I4d8,UgyB-Cxs7uSundkbYEd4AaABAg,"{'videoId': '8cKJLkmQAO0', 'topLevelComment': {'kind': 'youtube#comment', 'etag': 'xVoizOV9JLzLtEnWMk-wYzrZxp8', 'id': 'UgyB-Cxs7uSundkbYEd4AaABAg', 'snippet': {'videoId': '8cKJLkmQAO0', 'textDisplay': 'Kkk iran outro canditado entrar no Brics  ja comeco a pensar se Brics e uma alianca economica ou terrorista so falta a china entrar tambem', 'textOriginal': 'Kkk iran outro canditado entrar no Brics  ja comeco a pensar se Brics e uma alianca economica ou terrorista so falta a china entrar tambem', 'authorDisplayName': 'Matfaycal', 'authorProfileImageUrl': 'https://yt3.ggpht.com/ytc/AGIKgqNLTfYucS0xek446eIojidqlcIIFNNlQgC1RgytMCdcdMrn3-IBn0BvRRUaQZ19=s48-c-k-c0x00ffffff-no-rj', 'authorChannelUrl': 'http://www.youtube.com/channel/UCdN5pcLZ3v5AbyHPIeBX48g', 'authorChannelId': {'value': 'UCdN5pcLZ3v5AbyHPIeBX48g'}, 'canRate': True, 'viewerRating': 'none', 'likeCount': 0, 'publishedAt': '2022-10-18T10:21:57Z', 'updatedAt': '2022-10-18T10:22:29Z'}}, 'canReply': True, 'totalReplyCount': 0, 'isPublic': True}",,UCdN5pcLZ3v5AbyHPIeBX48g,2022-10-18T10:21:57Z,Kkk iran outro canditado entrar no Brics  ja comeco a pensar se Brics e uma alianca economica ou terrorista so falta a china entrar tambem,,2023-06-08 15:45:25.556821
youtube#commentThread,WM7Sc2FhgBNDPcTNFHVD-ltF3Ao,UgzEP5B7xM1E0Q5FgL54AaABAg,"{'videoId': '8cKJLkmQAO0', 'topLevelComment': {'kind': 'youtube#comment', 'etag': '3uAZ5xrNBhLO1SzXn_F-E62uzMo', 'id': 'UgzEP5B7xM1E0Q5FgL54AaABAg', 'snippet': {'videoId': '8cKJLkmQAO0', 'textDisplay': 'RUSSIA E UM PAIS PRATRIOCINADOR DE TERRORISMO ESTA ATACANDO APENAS CIVIL NAO ALVOS MILITARES ! PARECE QUE O MUNDO AGORA SABE QUEM DESTRUIU HOSPITAIS ESCOLAS  EM TODA UCRANIA', 'textOriginal': 'RUSSIA E UM PAIS PRATRIOCINADOR DE TERRORISMO ESTA ATACANDO APENAS CIVIL NAO ALVOS MILITARES ! PARECE QUE O MUNDO AGORA SABE QUEM DESTRUIU HOSPITAIS ESCOLAS  EM TODA UCRANIA', 'authorDisplayName': 'Matfaycal', 'authorProfileImageUrl': 'https://yt3.ggpht.com/ytc/AGIKgqNLTfYucS0xek446eIojidqlcIIFNNlQgC1RgytMCdcdMrn3-IBn0BvRRUaQZ19=s48-c-k-c0x00ffffff-no-rj', 'authorChannelUrl': 'http://www.youtube.com/channel/UCdN5pcLZ3v5AbyHPIeBX48g', 'authorChannelId': {'value': 'UCdN5pcLZ3v5AbyHPIeBX48g'}, 'canRate': True, 'viewerRating': 'none', 'likeCount': 1, 'publishedAt': '2022-10-18T10:20:53Z', 'updatedAt': '2022-10-18T10:20:53Z'}}, 'canReply': True, 'totalReplyCount': 0, 'isPublic': True}",,UCdN5pcLZ3v5AbyHPIeBX48g,2022-10-18T10:20:53Z,RUSSIA E UM PAIS PRATRIOCINADOR DE TERRORISMO ESTA ATACANDO APENAS CIVIL NAO ALVOS MILITARES ! PARECE QUE O MUNDO AGORA SABE QUEM DESTRUIU HOSPITAIS ESCOLAS  EM TODA UCRANIA,,2023-06-08 15:45:25.556821
youtube#commentThread,0ucB_Opaw5-UkxeXDPVfatFWEPU,UgzT1JujZShvRe7EkLJ4AaABAg,"{'videoId': 'orToKm2dAfg', 'topLevelComment': {'kind': 'youtube#comment', 'etag': 'Tc-cOIpHr2hr-Y_e-doetH4htiQ', 'id': 'UgzT1JujZShvRe7EkLJ4AaABAg', 'snippet': {'videoId': 'orToKm2dAfg', 'textDisplay': 'Voce esquece se nao fosse o Ocidente e US  china hoje ainda seria um país pobre', 'textOriginal': 'Voce esquece se nao fosse o Ocidente e US  china hoje ainda seria um país pobre', 'authorDisplayName': 'Matfaycal', 'authorProfileImageUrl': 'https://yt3.ggpht.com/ytc/AGIKgqNLTfYucS0xek446eIojidqlcIIFNNlQgC1RgytMCdcdMrn3-IBn0BvRRUaQZ19=s48-c-k-c0x00ffffff-no-rj', 'authorChannelUrl': 'http://www.youtube.com/channel/UCdN5pcLZ3v5AbyHPIeBX48g', 'authorChannelId': {'value': 'UCdN5pcLZ3v5AbyHPIeBX48g'}, 'canRate': True, 'viewerRating': 'none', 'likeCount': 0, 'publishedAt': '2022-10-16T15:19:33Z', 'updatedAt': '2022-10-16T15:19:33Z'}}, 'canReply': True, 'totalReplyCount': 0, 'isPublic': True}",,UCdN5pcLZ3v5AbyHPIeBX48g,2022-10-16T15:19:33Z,Voce esquece se nao fosse o Ocidente e US  china hoje ainda seria um país pobre,,2023-06-08 15:51:01.966375
youtube#commentThread,uFIpNlzo4xFUnWO1QfIyDo-pLWw,Ugyu_7yC3BNM6sCEAAN4AaABAg,"{'videoId': 'orToKm2dAfg', 'topLevelComment': {'kind': 'youtube#comment', 'etag': 'gIV9-Yj8dafn64TEsIY7uveyh5A', 'id': 'Ugyu_7yC3BNM6sCEAAN4AaABAg', 'snippet': {'videoId': 'orToKm2dAfg', 'textDisplay': 'Tai wan ja falou se china invadir tai wan todas as fabricas de chips serao destruidas assim como outras ! E o que China quer de tai wan roubar a tecnologia mais nao vai ter sorte 🤣', 'textOriginal': 'Tai wan ja falou se china invadir tai wan todas as fabricas de chips serao destruidas assim como outras ! E o que China quer de tai wan roubar a tecnologia mais nao vai ter sorte 🤣', 'authorDisplayName': 'Matfaycal', 'authorProfileImageUrl': 'https://yt3.ggpht.com/ytc/AGIKgqNLTfYucS0xek446eIojidqlcIIFNNlQgC1RgytMCdcdMrn3-IBn0BvRRUaQZ19=s48-c-k-c0x00ffffff-no-rj', 'authorChannelUrl': 'http://www.youtube.com/channel/UCdN5pcLZ3v5AbyHPIeBX48g', 'authorChannelId': {'value': 'UCdN5pcLZ3v5AbyHPIeBX48g'}, 'canRate': True, 'viewerRating': 'none', 'likeCount': 0, 'publishedAt': '2022-10-16T14:52:33Z', 'updatedAt': '2022-10-16T15:13:58Z'}}, 'canReply': True, 'totalReplyCount': 0, 'isPublic': True}",,UCdN5pcLZ3v5AbyHPIeBX48g,2022-10-16T14:52:33Z,Tai wan ja falou se china invadir tai wan todas as fabricas de chips serao destruidas assim como outras ! E o que China quer de tai wan roubar a tecnologia mais nao vai ter sorte 🤣,,2023-06-08 15:51:01.966375
