kind,etag,id,snippet,replies,authorChannelId,publishedAt,textOriginal,nextPageToken,extraction_date
youtube#commentThread,aPYcCwUmXGUekwxB-CkvDf7bzec,UgzB0nLP4DJpoxURBlx4AaABAg,"{'videoId': 'Sv7ImcwXZZk', 'topLevelComment': {'kind': 'youtube#comment', 'etag': 'oGymRXld81omVQvj93epy-6ewk8', 'id': 'UgzB0nLP4DJpoxURBlx4AaABAg', 'snippet': {'videoId': 'Sv7ImcwXZZk', 'textDisplay': 'Filho dele e o meu amg', 'textOriginal': 'Filho dele e o meu amg', 'authorDisplayName': 'Isabelle Carvalho', 'authorProfileImageUrl': 'https://yt3.ggpht.com/a0yClKqqQQLj7iLa1hs6vzqm4s0KRMfpagH4VDI-t3Grny5abMwfJ8I_Rkt1nBvJzojw0QsJ=s48-c-k-c0x00ffffff-no-rj', 'authorChannelUrl': 'http://www.youtube.com/channel/UC-CtT3t0_dk8cM38xmFnhQQ', 'authorChannelId': {'value': 'UC-CtT3t0_dk8cM38xmFnhQQ'}, 'canRate': True, 'viewerRating': 'none', 'likeCount': 0, 'publishedAt': '2022-11-21T00:49:20Z', 'updatedAt': '2022-11-21T00:49:20Z'}}, 'canReply': True, 'totalReplyCount': 0, 'isPublic': True}",,UC-CtT3t0_dk8cM38xmFnhQQ,2022-11-21T00:49:20Z,Filho dele e o meu amg,,2023-06-09 13:19:50.942888
youtube#commentThread,661xX2OQd_aHjagpW-nrE8VJCLM,UgxhqaQ278OPnOGBdFV4AaABAg,"{'videoId': 'Sv7ImcwXZZk', 'topLevelComment': {'kind': 'youtube#comment', 'etag': '1I_bqC2OV9Uz_A0ZoSE_z-DmTFw', 'id': 'UgxhqaQ278OPnOGBdFV4AaABAg', 'snippet': {'videoId': 'Sv7ImcwXZZk', 'textDisplay': 'Bom. Cadeia neles ..', 'textOriginal': 'Bom. Cadeia neles ..', 'authorDisplayName': 'Rita De Cassia', 'authorProfileImageUrl': 'https://yt3.ggpht.com/ytc/AGIKgqPkMytUbe_X4-rwHX0_KgaGl0vxCoEs_-HG10tGKQ=s48-c-k-c0x00ffffff-no-rj', 'authorChannelUrl': 'http://www.youtube.com/channel/UC4HF0Zv4wBxH8zIL3a4nweQ', 'authorChannelId': {'value': 'UC4HF0Zv4wBxH8zIL3a4nweQ'}, 'canRate': True, 'viewerRating': 'none', 'likeCount': 0, 'publishedAt': '2022-10-18T01:00:37Z', 'updatedAt': '2022-10-18T01:00:37Z'}}, 'canReply': True, 'totalReplyCount': 0, 'isPublic': True}",,UC4HF0Zv4wBxH8zIL3a4nweQ,2022-10-18T01:00:37Z,Bom. Cadeia neles ..,,2023-06-09 13:19:50.942888
youtube#commentThread,dM0KAt-FG9BpTlcFB3wjB1aI1ys,Ugy0Gam_Pv0MqQy8_ZR4AaABAg,"{'videoId': 'Sv7ImcwXZZk', 'topLevelComment': {'kind': 'youtube#comment', 'etag': 'uQAPtE6u62dpoCL-2OMW3nm30OM', 'id': 'Ugy0Gam_Pv0MqQy8_ZR4AaABAg', 'snippet': {'videoId': 'Sv7ImcwXZZk', 'textDisplay': 'Os bandidos querem matar Tarcísio porque com  Haddad no poder a lei não valerá de nada!!!! Força moça.agradeça a Deus pelo seu livramento e vote em quem apoia a vítima e não os bandidos.', 'textOriginal': 'Os bandidos querem matar Tarcísio porque com  Haddad no poder a lei não valerá de nada!!!! Força moça.agradeça a Deus pelo seu livramento e vote em quem apoia a vítima e não os bandidos.', 'authorDisplayName': 'Angela Trindade', 'authorProfileImageUrl': 'https://yt3.ggpht.com/ytc/AGIKgqOy_Gx_1qHxgvgXLk6kE26XArmTR6XZoF11rwmf=s48-c-k-c0x00ffffff-no-rj', 'authorChannelUrl': 'http://www.youtube.com/channel/UC1C1s06NLw1gCze9psD1FMA', 'authorChannelId': {'value': 'UC1C1s06NLw1gCze9psD1FMA'}, 'canRate': True, 'viewerRating': 'none', 'likeCount': 0, 'publishedAt': '2022-10-17T18:12:05Z', 'updatedAt': '2022-10-17T18:12:05Z'}}, 'canReply': True, 'totalReplyCount': 0, 'isPublic': True}",,UC1C1s06NLw1gCze9psD1FMA,2022-10-17T18:12:05Z,Os bandidos querem matar Tarcísio porque com  Haddad no poder a lei não valerá de nada!!!! Força moça.agradeça a Deus pelo seu livramento e vote em quem apoia a vítima e não os bandidos.,,2023-06-09 13:19:50.942888
youtube#commentThread,4YGjPXEnM_IJne5j5mlR5OEw08M,UgyXj4E8O4JIMOTqxWJ4AaABAg,"{'videoId': 'Sv7ImcwXZZk', 'topLevelComment': {'kind': 'youtube#comment', 'etag': 'x6ia37beaXQpf6OryakvhBVUIHY', 'id': 'UgyXj4E8O4JIMOTqxWJ4AaABAg', 'snippet': {'videoId': 'Sv7ImcwXZZk', 'textDisplay': 'Faz o mesmo com os dois tortura eles também', 'textOriginal': 'Faz o mesmo com os dois tortura eles também', 'authorDisplayName': 'Fabrícia Barbosa GANHANDO DINHEIRO EM CASA ', 'authorProfileImageUrl': 'https://yt3.ggpht.com/wKjn4LTuNvHgXmuguCzwhCVMKkibOsCDQ-240MpT4OqmukpnE2MALj3epGIaCtX-kT83wJcNXQ=s48-c-k-c0x00ffffff-no-rj', 'authorChannelUrl': 'http://www.youtube.com/channel/UC651go895ym3ZoJ6YlA2VQA', 'authorChannelId': {'value': 'UC651go895ym3ZoJ6YlA2VQA'}, 'canRate': True, 'viewerRating': 'none', 'likeCount': 0, 'publishedAt': '2022-10-17T15:41:48Z', 'updatedAt': '2022-10-17T15:41:48Z'}}, 'canReply': True, 'totalReplyCount': 0, 'isPublic': True}",,UC651go895ym3ZoJ6YlA2VQA,2022-10-17T15:41:48Z,Faz o mesmo com os dois tortura eles também,,2023-06-09 13:19:50.942888
youtube#commentThread,MGADroOhB-1KFpP2nlJkdppA16w,UgyX4v-jzKOefBNDl-x4AaABAg,"{'videoId': 'Sv7ImcwXZZk', 'topLevelComment': {'kind': 'youtube#comment', 'etag': 'n60KEZDPk_768WJrdlEnEPN8Z0I', 'id': 'UgyX4v-jzKOefBNDl-x4AaABAg', 'snippet': {'videoId': 'Sv7ImcwXZZk', 'textDisplay': 'Por isso tem baba que faz coisa errada', 'textOriginal': 'Por isso tem baba que faz coisa errada', 'authorDisplayName': 'Lumelo', 'authorProfileImageUrl': 'https://yt3.ggpht.com/ytc/AGIKgqPBHFKveHMDNMIRzhNHwsht5RI1cDHZUSdINfawFAv1-hs1EpyztAFTt4bcWHRB=s48-c-k-c0x00ffffff-no-rj', 'authorChannelUrl': 'http://www.youtube.com/channel/UCZ5ozx5nI9xQZytrJ4H1YQQ', 'authorChannelId': {'value': 'UCZ5ozx5nI9xQZytrJ4H1YQQ'}, 'canRate': True, 'viewerRating': 'none', 'likeCount': 0, 'publishedAt': '2022-10-15T22:46:31Z', 'updatedAt': '2022-10-15T22:46:31Z'}}, 'canReply': True, 'totalReplyCount': 0, 'isPublic': True}",,UCZ5ozx5nI9xQZytrJ4H1YQQ,2022-10-15T22:46:31Z,Por isso tem baba que faz coisa errada,,2023-06-09 13:19:50.942888
youtube#commentThread,gUqikEUhAur5tm3mrzgRwFkY_ow,Ugwxw3E9oFcE_It48nh4AaABAg,"{'videoId': 'Sv7ImcwXZZk', 'topLevelComment': {'kind': 'youtube#comment', 'etag': 'vb6krNIqpizBtw6sh6-T-gx5E6s', 'id': 'Ugwxw3E9oFcE_It48nh4AaABAg', 'snippet': {'videoId': 'Sv7ImcwXZZk', 'textDisplay': 'Deus e mais', 'textOriginal': 'Deus e mais', 'authorDisplayName': 'Lumelo', 'authorProfileImageUrl': 'https://yt3.ggpht.com/ytc/AGIKgqPBHFKveHMDNMIRzhNHwsht5RI1cDHZUSdINfawFAv1-hs1EpyztAFTt4bcWHRB=s48-c-k-c0x00ffffff-no-rj', 'authorChannelUrl': 'http://www.youtube.com/channel/UCZ5ozx5nI9xQZytrJ4H1YQQ', 'authorChannelId': {'value': 'UCZ5ozx5nI9xQZytrJ4H1YQQ'}, 'canRate': True, 'viewerRating': 'none', 'likeCount': 0, 'publishedAt': '2022-10-15T22:45:00Z', 'updatedAt': '2022-10-15T22:45:00Z'}}, 'canReply': True, 'totalReplyCount': 0, 'isPublic': True}",,UCZ5ozx5nI9xQZytrJ4H1YQQ,2022-10-15T22:45:00Z,Deus e mais,,2023-06-09 13:19:50.942888
youtube#commentThread,zSYwY0Ml_zX3ns44cDasEI7CmrQ,Ugy-eIchmxwTViwDgtl4AaABAg,"{'videoId': 'Sv7ImcwXZZk', 'topLevelComment': {'kind': 'youtube#comment', 'etag': 'gMOg5YzvPOtL3kJJaCGiTDLMSCA', 'id': 'Ugy-eIchmxwTViwDgtl4AaABAg', 'snippet': {'videoId': 'Sv7ImcwXZZk', 'textDisplay': 'Dois safados Deus permite certas coisas pra livrar várias pessoas de serem morta graças a Deus a babá está bem e eles estão na cadeia.', 'textOriginal': 'Dois safados Deus permite certas coisas pra livrar várias pessoas de serem morta graças a Deus a babá está bem e eles estão na cadeia.', 'authorDisplayName': 'Sheylla Vernakes', 'authorProfileImageUrl': 'https://yt3.ggpht.com/ytc/AGIKgqNDjK5rn0Ju1O10xY2HNa7tqiE6J2OTnHdiPw=s48-c-k-c0x00ffffff-no-rj', 'authorChannelUrl': 'http://www.youtube.com/channel/UC4vr3nE6NeEFE3B_pH9JAug', 'authorChannelId': {'value': 'UC4vr3nE6NeEFE3B_pH9JAug'}, 'canRate': True, 'viewerRating': 'none', 'likeCount': 0, 'publishedAt': '2022-10-15T19:54:45Z', 'updatedAt': '2022-10-15T19:54:45Z'}}, 'canReply': True, 'totalReplyCount': 0, 'isPublic': True}",,UC4vr3nE6NeEFE3B_pH9JAug,2022-10-15T19:54:45Z,Dois safados Deus permite certas coisas pra livrar várias pessoas de serem morta graças a Deus a babá está bem e eles estão na cadeia.,,2023-06-09 13:19:50.942888
youtube#commentThread,6XOfdSqSRlc_wmi_YkrWVqaoCfI,UgwM6IRrgBuFDa1HyTJ4AaABAg,"{'videoId': 'Sv7ImcwXZZk', 'topLevelComment': {'kind': 'youtube#comment', 'etag': 'z06-6CvAHKNY52_DqyynPUz_Q0c', 'id': 'UgwM6IRrgBuFDa1HyTJ4AaABAg', 'snippet': {'videoId': 'Sv7ImcwXZZk', 'textDisplay': 'Tomou na TAMPA...traficantes sem postura', 'textOriginal': 'Tomou na TAMPA...traficantes sem postura', 'authorDisplayName': 'JOSÉ SANTOS', 'authorProfileImageUrl': 'https://yt3.ggpht.com/ytc/AGIKgqNtx26HVtYexxRVtisrWv26SO0FpvBsvRZ8JShrtbNO6341yCpm7NhcOXLmsZGH=s48-c-k-c0x00ffffff-no-rj', 'authorChannelUrl': 'http://www.youtube.com/channel/UCp-83qNf5LlZh-7wRBJhbzQ', 'authorChannelId': {'value': 'UCp-83qNf5LlZh-7wRBJhbzQ'}, 'canRate': True, 'viewerRating': 'none', 'likeCount': 0, 'publishedAt': '2022-10-15T19:42:45Z', 'updatedAt': '2022-10-15T19:42:45Z'}}, 'canReply': True, 'totalReplyCount': 0, 'isPublic': True}",,UCp-83qNf5LlZh-7wRBJhbzQ,2022-10-15T19:42:45Z,Tomou na TAMPA...traficantes sem postura,,2023-06-09 13:19:50.942888
youtube#commentThread,sqNVgyGrCVaNM6WWDtrBHp0lya0,UgzUTyw9vcHbcwVs7ap4AaABAg,"{'videoId': 'Sv7ImcwXZZk', 'topLevelComment': {'kind': 'youtube#comment', 'etag': 'V3SMblP2Q8GkR4FhdoBsod26Lj4', 'id': 'UgzUTyw9vcHbcwVs7ap4AaABAg', 'snippet': {'videoId': 'Sv7ImcwXZZk', 'textDisplay': 'Que absurdo  estes bandidos  estão  cada dia sambando  na cara da sociedade', 'textOriginal': 'Que absurdo  estes bandidos  estão  cada dia sambando  na cara da sociedade', 'authorDisplayName': 'Mariaclara Silva', 'authorProfileImageUrl': 'https://yt3.ggpht.com/ytc/AGIKgqMSoYXZCs4XzxzCtNeWbhPZjmI9cZ6xo_rouQ=s48-c-k-c0x00ffffff-no-rj', 'authorChannelUrl': 'http://www.youtube.com/channel/UCF3GFczeIOOWq_af_Mx4ReQ', 'authorChannelId': {'value': 'UCF3GFczeIOOWq_af_Mx4ReQ'}, 'canRate': True, 'viewerRating': 'none', 'likeCount': 0, 'publishedAt': '2022-10-14T22:43:50Z', 'updatedAt': '2022-10-14T22:43:50Z'}}, 'canReply': True, 'totalReplyCount': 0, 'isPublic': True}",,UCF3GFczeIOOWq_af_Mx4ReQ,2022-10-14T22:43:50Z,Que absurdo  estes bandidos  estão  cada dia sambando  na cara da sociedade,,2023-06-09 13:19:50.942888
youtube#commentThread,LmvU23ttudEGXa1Nxd34GglZOU0,UgxIwuTEmQ7lhs35DPh4AaABAg,"{'videoId': 'Sv7ImcwXZZk', 'topLevelComment': {'kind': 'youtube#comment', 'etag': 'MSrnCAiVnYXvVEMbFq8MlaQwsgQ', 'id': 'UgxIwuTEmQ7lhs35DPh4AaABAg', 'snippet': {'videoId': 'Sv7ImcwXZZk', 'textDisplay': 'Pena de morte ☠️', 'textOriginal': 'Pena de morte ☠️', 'authorDisplayName': 'Anderson Sousa', 'authorProfileImageUrl': 'https://yt3.ggpht.com/EtF61CNL7TPXA0O0bbYfBtYQaks2Xcv4URLXWWOhFrfBnzkv4a0559WQaUNe5Jd5Os6g6KjEcRQ=s48-c-k-c0x00ffffff-no-rj', 'authorChannelUrl': 'http://www.youtube.com/channel/UCwE60Sm_Mr43N_FUa4mCJUg', 'authorChannelId': {'value': 'UCwE60Sm_Mr43N_FUa4mCJUg'}, 'canRate': True, 'viewerRating': 'none', 'likeCount': 0, 'publishedAt': '2022-10-13T23:53:22Z', 'updatedAt': '2022-10-13T23:53:22Z'}}, 'canReply': True, 'totalReplyCount': 0, 'isPublic': True}",,UCwE60Sm_Mr43N_FUa4mCJUg,2022-10-13T23:53:22Z,Pena de morte ☠️,,2023-06-09 13:19:50.942888
youtube#commentThread,HKbb3gvmrrp4vKIJdo9-skjrKKE,Ugwwb1NGmImHIxdLQpZ4AaABAg,"{'videoId': 'Sv7ImcwXZZk', 'topLevelComment': {'kind': 'youtube#comment', 'etag': 'Wj2e1Fj4BNYA74tAJONRvJsTFFc', 'id': 'Ugwwb1NGmImHIxdLQpZ4AaABAg', 'snippet': {'videoId': 'Sv7ImcwXZZk', 'textDisplay': 'A babá que vai ficar presa coitada, esse crime organizado não perdoa, esse tribunal do crime só favorece os desejos dos criminosos, volta e meia matam inocentes, um tempo atrás saiu na empresa que uma moça morreu por que negou um beijo para um traficante.', 'textOriginal': 'A babá que vai ficar presa coitada, esse crime organizado não perdoa, esse tribunal do crime só favorece os desejos dos criminosos, volta e meia matam inocentes, um tempo atrás saiu na empresa que uma moça morreu por que negou um beijo para um traficante.', 'authorDisplayName': 'NÃO DESISTA', 'authorProfileImageUrl': 'https://yt3.ggpht.com/ytc/AGIKgqNKDm1lMjkaU79NsuZtS6kWibvkNV-e4oQPZkRV=s48-c-k-c0x00ffffff-no-rj', 'authorChannelUrl': 'http://www.youtube.com/channel/UCLhH8DgPV5IyjxMhtZQVkgg', 'authorChannelId': {'value': 'UCLhH8DgPV5IyjxMhtZQVkgg'}, 'canRate': True, 'viewerRating': 'none', 'likeCount': 0, 'publishedAt': '2022-10-13T21:42:45Z', 'updatedAt': '2022-10-13T21:42:45Z'}}, 'canReply': True, 'totalReplyCount': 0, 'isPublic': True}",,UCLhH8DgPV5IyjxMhtZQVkgg,2022-10-13T21:42:45Z,"A babá que vai ficar presa coitada, esse crime organizado não perdoa, esse tribunal do crime só favorece os desejos dos criminosos, volta e meia matam inocentes, um tempo atrás saiu na empresa que uma moça morreu por que negou um beijo para um traficante.",,2023-06-09 13:19:50.942888
youtube#commentThread,2gIrYtBKS_iD-yOBI1dpBtwWBrM,Ugxzn60FF0lRbDzlEZF4AaABAg,"{'videoId': 'Sv7ImcwXZZk', 'topLevelComment': {'kind': 'youtube#comment', 'etag': 'KEM1V4CyOo9jeSNWdP_TLLqjo9E', 'id': 'Ugxzn60FF0lRbDzlEZF4AaABAg', 'snippet': {'videoId': 'Sv7ImcwXZZk', 'textDisplay': 'Esses bandidos tem qui comer cadeia. Bando de covarde.', 'textOriginal': 'Esses bandidos tem qui comer cadeia. Bando de covarde.', 'authorDisplayName': 'Marizélia Ferreira dos santos', 'authorProfileImageUrl': 'https://yt3.ggpht.com/ytc/AGIKgqO_PBm-TZ1e1JWcdPXUPh3sVJm5GpKB_AXgPg=s48-c-k-c0x00ffffff-no-rj', 'authorChannelUrl': 'http://www.youtube.com/channel/UCZUH2h6WYNsN9wUrvpSQmuA', 'authorChannelId': {'value': 'UCZUH2h6WYNsN9wUrvpSQmuA'}, 'canRate': True, 'viewerRating': 'none', 'likeCount': 0, 'publishedAt': '2022-10-13T21:14:05Z', 'updatedAt': '2022-10-13T21:14:05Z'}}, 'canReply': True, 'totalReplyCount': 0, 'isPublic': True}",,UCZUH2h6WYNsN9wUrvpSQmuA,2022-10-13T21:14:05Z,Esses bandidos tem qui comer cadeia. Bando de covarde.,,2023-06-09 13:19:50.942888
youtube#commentThread,DqL4TLVeguFMHisv5cEq3TN1lfw,UgylbMUKMcgkY_NKr214AaABAg,"{'videoId': 'Sv7ImcwXZZk', 'topLevelComment': {'kind': 'youtube#comment', 'etag': 'cX4Jfj1Qx4plOfL_mdlMg38MATE', 'id': 'UgylbMUKMcgkY_NKr214AaABAg', 'snippet': {'videoId': 'Sv7ImcwXZZk', 'textDisplay': 'agora só matando esse casal para eles não matarem a ela e família.', 'textOriginal': 'agora só matando esse casal para eles não matarem a ela e família.', 'authorDisplayName': 'PAISAGENS PARA CURTIR', 'authorProfileImageUrl': 'https://yt3.ggpht.com/lBSCrqC4G-3rdKS_lCQSkqW18al3r-PavywpI7hWuV0DoPoaoquzkMLMCEYgC3QkwtBob8tLjA=s48-c-k-c0x00ffffff-no-rj', 'authorChannelUrl': 'http://www.youtube.com/channel/UC8_KN2YPKYhtUkvEcCMpcJw', 'authorChannelId': {'value': 'UC8_KN2YPKYhtUkvEcCMpcJw'}, 'canRate': True, 'viewerRating': 'none', 'likeCount': 0, 'publishedAt': '2022-10-13T18:56:10Z', 'updatedAt': '2022-10-13T18:56:10Z'}}, 'canReply': True, 'totalReplyCount': 0, 'isPublic': True}",,UC8_KN2YPKYhtUkvEcCMpcJw,2022-10-13T18:56:10Z,agora só matando esse casal para eles não matarem a ela e família.,,2023-06-09 13:19:50.942888
youtube#commentThread,Hhds35mvIi2TOoXPrPo2-fo-Z_Y,Ugw7ZghlJf7J4f_6xNV4AaABAg,"{'videoId': 'Sv7ImcwXZZk', 'topLevelComment': {'kind': 'youtube#comment', 'etag': 'xJE7ohvbpEquOgwWLPmuC3qs6C0', 'id': 'Ugw7ZghlJf7J4f_6xNV4AaABAg', 'snippet': {'videoId': 'Sv7ImcwXZZk', 'textDisplay': 'Simples deveria ter prisao perpetua para os dois, passando a pão e água somente, o resto da vida deles, dois lixos, crápulas monstros que devem apanhar todos os dias em uma solitaria', 'textOriginal': 'Simples deveria ter prisao perpetua para os dois, passando a pão e água somente, o resto da vida deles, dois lixos, crápulas monstros que devem apanhar todos os dias em uma solitaria', 'authorDisplayName': 'Danilo Marcos', 'authorProfileImageUrl': 'https://yt3.ggpht.com/ytc/AGIKgqOR2g-Qbas-IwtHN3_IJyLI_bBl3G-fW2p_LO90hA=s48-c-k-c0x00ffffff-no-rj', 'authorChannelUrl': 'http://www.youtube.com/channel/UCuYFMgqul9bhHFOGpcoppMA', 'authorChannelId': {'value': 'UCuYFMgqul9bhHFOGpcoppMA'}, 'canRate': True, 'viewerRating': 'none', 'likeCount': 0, 'publishedAt': '2022-10-13T18:48:59Z', 'updatedAt': '2022-10-13T18:48:59Z'}}, 'canReply': True, 'totalReplyCount': 0, 'isPublic': True}",,UCuYFMgqul9bhHFOGpcoppMA,2022-10-13T18:48:59Z,"Simples deveria ter prisao perpetua para os dois, passando a pão e água somente, o resto da vida deles, dois lixos, crápulas monstros que devem apanhar todos os dias em uma solitaria",,2023-06-09 13:19:50.942888
youtube#commentThread,EUVRzzyUvoXGNpEJblr5hqLp2zk,Ugx30gtywEG-GnP795x4AaABAg,"{'videoId': 'Sv7ImcwXZZk', 'topLevelComment': {'kind': 'youtube#comment', 'etag': 'bcGc-LozW5hdbhsfGwcNGGuT6YU', 'id': 'Ugx30gtywEG-GnP795x4AaABAg', 'snippet': {'videoId': 'Sv7ImcwXZZk', 'textDisplay': 'Coitada dessa moça, vai trabalhar pra ter uma vida melhor, e acontece isso ,muito triste, graças a Deus não aconteceu o pior ,', 'textOriginal': 'Coitada dessa moça, vai trabalhar pra ter uma vida melhor, e acontece isso ,muito triste, graças a Deus não aconteceu o pior ,', 'authorDisplayName': 'Anaiana Sousa', 'authorProfileImageUrl': 'https://yt3.ggpht.com/ytc/AGIKgqNALzIUsa5MzoIarWq9VEVfeGKsugm7dhAVnQ=s48-c-k-c0x00ffffff-no-rj', 'authorChannelUrl': 'http://www.youtube.com/channel/UC01qFj2g1aU2TYf1Gv4q1zg', 'authorChannelId': {'value': 'UC01qFj2g1aU2TYf1Gv4q1zg'}, 'canRate': True, 'viewerRating': 'none', 'likeCount': 4, 'publishedAt': '2022-10-13T10:35:44Z', 'updatedAt': '2022-10-13T10:35:44Z'}}, 'canReply': True, 'totalReplyCount': 0, 'isPublic': True}",,UC01qFj2g1aU2TYf1Gv4q1zg,2022-10-13T10:35:44Z,"Coitada dessa moça, vai trabalhar pra ter uma vida melhor, e acontece isso ,muito triste, graças a Deus não aconteceu o pior ,",,2023-06-09 13:19:50.942888
youtube#commentThread,JGgDqLcK0zspaoKZWaI5514IjSI,UgzXmgJyGgan_AxGAC54AaABAg,"{'videoId': 'Sv7ImcwXZZk', 'topLevelComment': {'kind': 'youtube#comment', 'etag': '0XsrKY5sP9NxSq0EOg5XOKrkzH8', 'id': 'UgzXmgJyGgan_AxGAC54AaABAg', 'snippet': {'videoId': 'Sv7ImcwXZZk', 'textDisplay': 'Oh,Ana Júlia!', 'textOriginal': 'Oh,Ana Júlia!', 'authorDisplayName': 'uddo lar', 'authorProfileImageUrl': 'https://yt3.ggpht.com/ytc/AGIKgqPDgUSiS3jTnieCxwKz7zxlThk-Y0t5FX2WzA=s48-c-k-c0x00ffffff-no-rj', 'authorChannelUrl': 'http://www.youtube.com/channel/UC7ATPdHUWkc7sinoHsAGEXA', 'authorChannelId': {'value': 'UC7ATPdHUWkc7sinoHsAGEXA'}, 'canRate': True, 'viewerRating': 'none', 'likeCount': 0, 'publishedAt': '2022-10-13T01:48:45Z', 'updatedAt': '2022-10-13T01:48:45Z'}}, 'canReply': True, 'totalReplyCount': 0, 'isPublic': True}",,UC7ATPdHUWkc7sinoHsAGEXA,2022-10-13T01:48:45Z,"Oh,Ana Júlia!",,2023-06-09 13:19:50.942888
youtube#commentThread,BTe0uWsoZzSke47sgEGZ1ruzmcY,UgxsAeZViz5c5RtJled4AaABAg,"{'videoId': 'Sv7ImcwXZZk', 'topLevelComment': {'kind': 'youtube#comment', 'etag': 'GM7WwLyN2zRIv3AwJtbm5szeaKU', 'id': 'UgxsAeZViz5c5RtJled4AaABAg', 'snippet': {'videoId': 'Sv7ImcwXZZk', 'textDisplay': 'Esse Vanderlei é bandido perigoso , consegue levantar dinheiro fazendo atividades ilegais', 'textOriginal': 'Esse Vanderlei é bandido perigoso , consegue levantar dinheiro fazendo atividades ilegais', 'authorDisplayName': 'André Newton', 'authorProfileImageUrl': 'https://yt3.ggpht.com/ytc/AGIKgqPvgK3hF1Z7iMRV5RjV2ho_8lq8vYKMVyDW7Q=s48-c-k-c0x00ffffff-no-rj', 'authorChannelUrl': 'http://www.youtube.com/channel/UCZmNS0lttNg77lhqsoWjE-g', 'authorChannelId': {'value': 'UCZmNS0lttNg77lhqsoWjE-g'}, 'canRate': True, 'viewerRating': 'none', 'likeCount': 0, 'publishedAt': '2022-10-13T00:10:15Z', 'updatedAt': '2022-10-13T00:10:15Z'}}, 'canReply': True, 'totalReplyCount': 0, 'isPublic': True}",,UCZmNS0lttNg77lhqsoWjE-g,2022-10-13T00:10:15Z,"Esse Vanderlei é bandido perigoso , consegue levantar dinheiro fazendo atividades ilegais",,2023-06-09 13:19:50.942888
youtube#commentThread,qwFRqQXY1XTI2VGhySl3cL3CYSQ,UgzhtbpkJzF9jOBs6IB4AaABAg,"{'videoId': 'Sv7ImcwXZZk', 'topLevelComment': {'kind': 'youtube#comment', 'etag': '-2nJ6nPMiylN1M-pJE9td4Zi9ZY', 'id': 'UgzhtbpkJzF9jOBs6IB4AaABAg', 'snippet': {'videoId': 'Sv7ImcwXZZk', 'textDisplay': 'Ela é ir na  de uma jornalista da Record de são Paulo  que tem o sobrenome Mendes?', 'textOriginal': 'Ela é ir na  de uma jornalista da Record de são Paulo  que tem o sobrenome Mendes?', 'authorDisplayName': 'André Newton', 'authorProfileImageUrl': 'https://yt3.ggpht.com/ytc/AGIKgqPvgK3hF1Z7iMRV5RjV2ho_8lq8vYKMVyDW7Q=s48-c-k-c0x00ffffff-no-rj', 'authorChannelUrl': 'http://www.youtube.com/channel/UCZmNS0lttNg77lhqsoWjE-g', 'authorChannelId': {'value': 'UCZmNS0lttNg77lhqsoWjE-g'}, 'canRate': True, 'viewerRating': 'none', 'likeCount': 0, 'publishedAt': '2022-10-13T00:08:01Z', 'updatedAt': '2022-10-13T00:08:01Z'}}, 'canReply': True, 'totalReplyCount': 0, 'isPublic': True}",,UCZmNS0lttNg77lhqsoWjE-g,2022-10-13T00:08:01Z,Ela é ir na  de uma jornalista da Record de são Paulo  que tem o sobrenome Mendes?,,2023-06-09 13:19:50.942888
youtube#commentThread,Cr3tQkzoomntdEnvNQBxZq0rktw,UgyWc5n0X7jsARPLCK54AaABAg,"{'videoId': 'Sv7ImcwXZZk', 'topLevelComment': {'kind': 'youtube#comment', 'etag': '9ykJObEC1GWNBnzuAUcdx5f7t08', 'id': 'UgyWc5n0X7jsARPLCK54AaABAg', 'snippet': {'videoId': 'Sv7ImcwXZZk', 'textDisplay': 'Graças à Deus essa mulher conseguiu sair viva', 'textOriginal': 'Graças à Deus essa mulher conseguiu sair viva', 'authorDisplayName': 'Weslley Avelino', 'authorProfileImageUrl': 'https://yt3.ggpht.com/Oj5nCuEksub8BRaZzVlFMc-yzrN0BNUmbCBG3-TM7UUyC8ATXZ3n6X_ifEBEsCPEjtDN3j7S5g=s48-c-k-c0x00ffffff-no-rj', 'authorChannelUrl': 'http://www.youtube.com/channel/UC1ewfAPSOt6-5DGxIRkhwRg', 'authorChannelId': {'value': 'UC1ewfAPSOt6-5DGxIRkhwRg'}, 'canRate': True, 'viewerRating': 'none', 'likeCount': 0, 'publishedAt': '2022-10-12T23:52:40Z', 'updatedAt': '2022-10-12T23:52:40Z'}}, 'canReply': True, 'totalReplyCount': 0, 'isPublic': True}",,UC1ewfAPSOt6-5DGxIRkhwRg,2022-10-12T23:52:40Z,Graças à Deus essa mulher conseguiu sair viva,,2023-06-09 13:19:50.942888
youtube#commentThread,HDFRrpLxdOaOAyhvEGQNj1SoEwg,UgzpbvfRbxwezY4zqad4AaABAg,"{'videoId': 'Sv7ImcwXZZk', 'topLevelComment': {'kind': 'youtube#comment', 'etag': 'qGOCPpKq6S9wg1uf1ps1vpD-pww', 'id': 'UgzpbvfRbxwezY4zqad4AaABAg', 'snippet': {'videoId': 'Sv7ImcwXZZk', 'textDisplay': 'Agora ela vai comer uma quentinha básica no presidiário.  Com o Presidente Bolsonaro os bandidos não vão ter vez no Brasil!', 'textOriginal': 'Agora ela vai comer uma quentinha básica no presidiário.  Com o Presidente Bolsonaro os bandidos não vão ter vez no Brasil!', 'authorDisplayName': 'Lilica Li', 'authorProfileImageUrl': 'https://yt3.ggpht.com/ytc/AGIKgqO1VGCZ3imuMch78XxCAZ3ots3VaOMNcgUC5pbg=s48-c-k-c0x00ffffff-no-rj', 'authorChannelUrl': 'http://www.youtube.com/channel/UC4tgZAJyhh2D2RZXX_5q-kw', 'authorChannelId': {'value': 'UC4tgZAJyhh2D2RZXX_5q-kw'}, 'canRate': True, 'viewerRating': 'none', 'likeCount': 0, 'publishedAt': '2022-10-12T22:28:06Z', 'updatedAt': '2022-10-12T22:28:06Z'}}, 'canReply': True, 'totalReplyCount': 0, 'isPublic': True}",,UC4tgZAJyhh2D2RZXX_5q-kw,2022-10-12T22:28:06Z,Agora ela vai comer uma quentinha básica no presidiário.  Com o Presidente Bolsonaro os bandidos não vão ter vez no Brasil!,,2023-06-09 13:19:50.942888
youtube#commentThread,a_whfhB5KKgAX2Rnxr5005UK_hQ,Ugx-Wccm-x-aeo6dNBl4AaABAg,"{'videoId': 'Sv7ImcwXZZk', 'topLevelComment': {'kind': 'youtube#comment', 'etag': 'NG-EztJfJgW4CSjI2S9ES6YtpmA', 'id': 'Ugx-Wccm-x-aeo6dNBl4AaABAg', 'snippet': {'videoId': 'Sv7ImcwXZZk', 'textDisplay': 'E burra não apaga as mensagem', 'textOriginal': 'E burra não apaga as mensagem', 'authorDisplayName': 'Anderson Lima', 'authorProfileImageUrl': 'https://yt3.ggpht.com/18uDqZ3RiZEQD9D5ZTq6PlFCIAfv509gmfVqiAT3MVIxUXFFHIkfGaySMFJpdP49lFcHtEVabtk=s48-c-k-c0x00ffffff-no-rj', 'authorChannelUrl': 'http://www.youtube.com/channel/UCPuK8DUJSat0ObKiX7V9BfA', 'authorChannelId': {'value': 'UCPuK8DUJSat0ObKiX7V9BfA'}, 'canRate': True, 'viewerRating': 'none', 'likeCount': 0, 'publishedAt': '2022-10-12T22:09:28Z', 'updatedAt': '2022-10-12T22:09:28Z'}}, 'canReply': True, 'totalReplyCount': 0, 'isPublic': True}",,UCPuK8DUJSat0ObKiX7V9BfA,2022-10-12T22:09:28Z,E burra não apaga as mensagem,,2023-06-09 13:19:50.942888
youtube#commentThread,iiZb6LF8KwJImD6mT4snZK25B-k,UgxcHdoyLYxjcyIeoLx4AaABAg,"{'videoId': 'Sv7ImcwXZZk', 'topLevelComment': {'kind': 'youtube#comment', 'etag': 'Dr-QqQ2qxrB8iA203rIAimwkxPI', 'id': 'UgxcHdoyLYxjcyIeoLx4AaABAg', 'snippet': {'videoId': 'Sv7ImcwXZZk', 'textDisplay': 'O pior é que vai ter juiz pra libertar o casal criminoso', 'textOriginal': 'O pior é que vai ter juiz pra libertar o casal criminoso', 'authorDisplayName': 'Angelita Straubel Correia', 'authorProfileImageUrl': 'https://yt3.ggpht.com/ytc/AGIKgqNNwrX2qcb_eAEA9E3OcP9a53tYQtM5QJL1BCubyvg=s48-c-k-c0x00ffffff-no-rj', 'authorChannelUrl': 'http://www.youtube.com/channel/UC_Dj6b6DhUEgCod_AhWwsDA', 'authorChannelId': {'value': 'UC_Dj6b6DhUEgCod_AhWwsDA'}, 'canRate': True, 'viewerRating': 'none', 'likeCount': 1, 'publishedAt': '2022-10-12T22:07:12Z', 'updatedAt': '2022-10-12T22:07:12Z'}}, 'canReply': True, 'totalReplyCount': 0, 'isPublic': True}",,UC_Dj6b6DhUEgCod_AhWwsDA,2022-10-12T22:07:12Z,O pior é que vai ter juiz pra libertar o casal criminoso,,2023-06-09 13:19:50.942888
youtube#commentThread,fu1cpRiVHIjkXhizT-wusX7oMNE,Ugzft4MTxS3esBjNM4Z4AaABAg,"{'videoId': 'Sv7ImcwXZZk', 'topLevelComment': {'kind': 'youtube#comment', 'etag': 'JAtAj9z_0IlbthtNkDw_uH3LJNw', 'id': 'Ugzft4MTxS3esBjNM4Z4AaABAg', 'snippet': {'videoId': 'Sv7ImcwXZZk', 'textDisplay': 'Graças a Deus que ela está bem. Boa noite', 'textOriginal': 'Graças a Deus que ela está bem. Boa noite', 'authorDisplayName': 'Sandra Thomazio', 'authorProfileImageUrl': 'https://yt3.ggpht.com/ytc/AGIKgqOIqEfRfRm_N4qYJyXq-s7kmH-K-SDjz5ROjw=s48-c-k-c0x00ffffff-no-rj', 'authorChannelUrl': 'http://www.youtube.com/channel/UCRPzFt4F_RFSYVPwQdgqJrA', 'authorChannelId': {'value': 'UCRPzFt4F_RFSYVPwQdgqJrA'}, 'canRate': True, 'viewerRating': 'none', 'likeCount': 7, 'publishedAt': '2022-10-12T21:15:28Z', 'updatedAt': '2022-10-12T21:15:28Z'}}, 'canReply': True, 'totalReplyCount': 0, 'isPublic': True}",,UCRPzFt4F_RFSYVPwQdgqJrA,2022-10-12T21:15:28Z,Graças a Deus que ela está bem. Boa noite,,2023-06-09 13:19:50.942888
