kind,etag,id,snippet,replies,authorChannelId,publishedAt,textOriginal,nextPageToken,extraction_date
youtube#commentThread,QwJoJjx5jdbg5uoxc-6DSUqEfj4,Ugx1xcrmX-X-TTdgmth4AaABAg,"{'videoId': 'Sv7ImcwXZZk', 'topLevelComment': {'kind': 'youtube#comment', 'etag': 'w64Cz2qas6xoV5rovTisNqWEgSc', 'id': 'Ugx1xcrmX-X-TTdgmth4AaABAg', 'snippet': {'videoId': 'Sv7ImcwXZZk', 'textDisplay': 'Essa tal patroa tem 21 anos? Eh isso mesmo? Só por Deus..', 'textOriginal': 'Essa tal patroa tem 21 anos? Eh isso mesmo? Só por Deus..', 'authorDisplayName': 'Simone Cardoso', 'authorProfileImageUrl': 'https://yt3.ggpht.com/ytc/AGIKgqOnSNQEmWzUmp2TVAPxsveSL9Ad69cWPILuGQ=s48-c-k-c0x00ffffff-no-rj', 'authorChannelUrl': 'http://www.youtube.com/channel/UC1LCA-6mS5OezkoIV5ii2NA', 'authorChannelId': {'value': 'UC1LCA-6mS5OezkoIV5ii2NA'}, 'canRate': True, 'viewerRating': 'none', 'likeCount': 8, 'publishedAt': '2022-10-12T12:31:58Z', 'updatedAt': '2022-10-12T12:31:58Z'}}, 'canReply': True, 'totalReplyCount': 1, 'isPublic': True}","{'comments': [{'kind': 'youtube#comment', 'etag': 'BF1dZgBzh3U_8a9XSdC9cF_ck6Q', 'id': 'Ugx1xcrmX-X-TTdgmth4AaABAg.9h4msBYR1-s9hDNymYNX_d', 'snippet': {'videoId': 'Sv7ImcwXZZk', 'textDisplay': '@Nathan Meissner  foda', 'textOriginal': '@Nathan Meissner  foda', 'parentId': 'Ugx1xcrmX-X-TTdgmth4AaABAg', 'authorDisplayName': 'Ane Vieira', 'authorProfileImageUrl': 'https://yt3.ggpht.com/ytc/AGIKgqNCNNtT3MeJQR3u1_TDGImpD_gN7KGHBm-beo8-J1jVngFpWB3i74v7jn__uQ38=s48-c-k-c0x00ffffff-no-rj', 'authorChannelUrl': 'http://www.youtube.com/channel/UCwlrVJcKpQmDIlD2DV3GKQw', 'authorChannelId': {'value': 'UCwlrVJcKpQmDIlD2DV3GKQw'}, 'canRate': True, 'viewerRating': 'none', 'likeCount': 0, 'publishedAt': '2022-10-15T20:38:50Z', 'updatedAt': '2022-10-15T20:38:50Z'}}]}",UC1LCA-6mS5OezkoIV5ii2NA,2022-10-12T12:31:58Z,Essa tal patroa tem 21 anos? Eh isso mesmo? Só por Deus..,,2023-06-09 13:19:50.942888
youtube#commentThread,2iMvOiLUlrkcfxc07rs7XFgOu8I,UgwYAz2FbdibcLWiFmV4AaABAg,"{'videoId': 'Sv7ImcwXZZk', 'topLevelComment': {'kind': 'youtube#comment', 'etag': 'UZwj9z0NGmO_JZrrES_Ih2XbLsI', 'id': 'UgwYAz2FbdibcLWiFmV4AaABAg', 'snippet': {'videoId': 'Sv7ImcwXZZk', 'textDisplay': 'O tribunal agora vai correr atrás deste casal.', 'textOriginal': 'O tribunal agora vai correr atrás deste casal.', 'authorDisplayName': 'Hilda Amancio Karlsson', 'authorProfileImageUrl': 'https://yt3.ggpht.com/ytc/AGIKgqOOdctqrMN9FL7M3t5qXzivL7V8ieipFIvGmg=s48-c-k-c0x00ffffff-no-rj', 'authorChannelUrl': 'http://www.youtube.com/channel/UC8ZhujwpUZaVnAd4TXsDghw', 'authorChannelId': {'value': 'UC8ZhujwpUZaVnAd4TXsDghw'}, 'canRate': True, 'viewerRating': 'none', 'likeCount': 4, 'publishedAt': '2022-10-12T12:30:13Z', 'updatedAt': '2022-10-12T12:30:13Z'}}, 'canReply': True, 'totalReplyCount': 0, 'isPublic': True}",,UC8ZhujwpUZaVnAd4TXsDghw,2022-10-12T12:30:13Z,O tribunal agora vai correr atrás deste casal.,,2023-06-09 13:19:50.942888
youtube#commentThread,eG6dAs4PrGwm6i_VK-U1foQKTk4,UgzBcbQxpZmPaionQft4AaABAg,"{'videoId': 'Sv7ImcwXZZk', 'topLevelComment': {'kind': 'youtube#comment', 'etag': 'gE3XqRZRl6fIb5UgtfW0s2vDiBg', 'id': 'UgzBcbQxpZmPaionQft4AaABAg', 'snippet': {'videoId': 'Sv7ImcwXZZk', 'textDisplay': 'Em busca de um emprego, a pessoa se mete em casa uma. O caso Caitano coitado por falar pelo celular com a família foi morto.', 'textOriginal': 'Em busca de um emprego, a pessoa se mete em casa uma. O caso Caitano coitado por falar pelo celular com a família foi morto.', 'authorDisplayName': 'Isabel Leite', 'authorProfileImageUrl': 'https://yt3.ggpht.com/ytc/AGIKgqN63hvW9MEu6eBaKM0rFJ-H2aqsQy5w-o_hlQ=s48-c-k-c0x00ffffff-no-rj', 'authorChannelUrl': 'http://www.youtube.com/channel/UCwAHnxhRbSKJMDNgmoEtTlg', 'authorChannelId': {'value': 'UCwAHnxhRbSKJMDNgmoEtTlg'}, 'canRate': True, 'viewerRating': 'none', 'likeCount': 8, 'publishedAt': '2022-10-12T12:28:16Z', 'updatedAt': '2022-10-12T12:28:16Z'}}, 'canReply': True, 'totalReplyCount': 1, 'isPublic': True}","{'comments': [{'kind': 'youtube#comment', 'etag': '5QwosRj1kP493ymHITc3URzv-XA', 'id': 'UgzBcbQxpZmPaionQft4AaABAg.9h4mSBLhio69h52SWKKlau', 'snippet': {'videoId': 'Sv7ImcwXZZk', 'textDisplay': 'Pior que o caitano foi porto por causa disto ,testemuna ocular,eu também cai em uma emboscada desta,mas graças à Deus ,eu não fui morto porque Deus me guardou,', 'textOriginal': 'Pior que o caitano foi porto por causa disto ,testemuna ocular,eu também cai em uma emboscada desta,mas graças à Deus ,eu não fui morto porque Deus me guardou,', 'parentId': 'UgzBcbQxpZmPaionQft4AaABAg', 'authorDisplayName': 'Jorge Rodrigues', 'authorProfileImageUrl': 'https://yt3.ggpht.com/ytc/AGIKgqPAJbwwFa9_AFyO7cxamQEMDF6NEMLBJC_3CTZgEg=s48-c-k-c0x00ffffff-no-rj', 'authorChannelUrl': 'http://www.youtube.com/channel/UCnMurYzV01lXry0uPniT8nA', 'authorChannelId': {'value': 'UCnMurYzV01lXry0uPniT8nA'}, 'canRate': True, 'viewerRating': 'none', 'likeCount': 0, 'publishedAt': '2022-10-12T14:56:52Z', 'updatedAt': '2022-10-12T14:56:52Z'}}]}",UCwAHnxhRbSKJMDNgmoEtTlg,2022-10-12T12:28:16Z,"Em busca de um emprego, a pessoa se mete em casa uma. O caso Caitano coitado por falar pelo celular com a família foi morto.",,2023-06-09 13:19:50.942888
youtube#commentThread,dOFJ6amFJin-ROUDukuYQtwEjU8,Ugwkv9Q8C6EmGwaqIQp4AaABAg,"{'videoId': 'Sv7ImcwXZZk', 'topLevelComment': {'kind': 'youtube#comment', 'etag': 'cnBli1Hy8lo-ExuDKj586FocWYQ', 'id': 'Ugwkv9Q8C6EmGwaqIQp4AaABAg', 'snippet': {'videoId': 'Sv7ImcwXZZk', 'textDisplay': 'Já vi criança em cárcere, babá nunca, graças a DEUS pelo livramento dessa moça, precisa se cuidar agora, tadinha das crianças', 'textOriginal': 'Já vi criança em cárcere, babá nunca, graças a DEUS pelo livramento dessa moça, precisa se cuidar agora, tadinha das crianças', 'authorDisplayName': 'Odete Barbosa', 'authorProfileImageUrl': 'https://yt3.ggpht.com/ytc/AGIKgqMONY7INebxPv2R7lUsoTpRhdS-vnRoLIpyuQ=s48-c-k-c0x00ffffff-no-rj', 'authorChannelUrl': 'http://www.youtube.com/channel/UC2tr701Akij6YbYJtFMbQ9Q', 'authorChannelId': {'value': 'UC2tr701Akij6YbYJtFMbQ9Q'}, 'canRate': True, 'viewerRating': 'none', 'likeCount': 30, 'publishedAt': '2022-10-12T12:24:56Z', 'updatedAt': '2022-10-12T12:24:56Z'}}, 'canReply': True, 'totalReplyCount': 1, 'isPublic': True}","{'comments': [{'kind': 'youtube#comment', 'etag': 'A74UEZn0I0_toFd2rUXlD1j7mxo', 'id': 'Ugwkv9Q8C6EmGwaqIQp4AaABAg.9h4m3kfsT_H9h9XKW4DaP-', 'snippet': {'videoId': 'Sv7ImcwXZZk', 'textDisplay': 'ta por fora entao tia, o que mais acontece é brasileira ir morar fora do pais e arranjar um trabalho temporario de babá e o casal estrangeiro manter em carcere pra nao pagar nada e forçar trabalho escravo... vc n viu nada ainda....', 'textOriginal': 'ta por fora entao tia, o que mais acontece é brasileira ir morar fora do pais e arranjar um trabalho temporario de babá e o casal estrangeiro manter em carcere pra nao pagar nada e forçar trabalho escravo... vc n viu nada ainda....', 'parentId': 'Ugwkv9Q8C6EmGwaqIQp4AaABAg', 'authorDisplayName': 'pwN', 'authorProfileImageUrl': 'https://yt3.ggpht.com/ytc/AGIKgqNBLOY_4H2oGXomUX4RJaq9vJPYirL_XgFMrkCI=s48-c-k-c0x00ffffff-no-rj', 'authorChannelUrl': 'http://www.youtube.com/channel/UCEe1-m5JZVdlOKcu7E_iEXQ', 'authorChannelId': {'value': 'UCEe1-m5JZVdlOKcu7E_iEXQ'}, 'canRate': True, 'viewerRating': 'none', 'likeCount': 0, 'publishedAt': '2022-10-14T08:43:37Z', 'updatedAt': '2022-10-14T08:43:37Z'}}]}",UC2tr701Akij6YbYJtFMbQ9Q,2022-10-12T12:24:56Z,"Já vi criança em cárcere, babá nunca, graças a DEUS pelo livramento dessa moça, precisa se cuidar agora, tadinha das crianças",,2023-06-09 13:19:50.942888
youtube#commentThread,XjBYxvGnQmNoxN2uicwEOcG9m8E,UgxQV3pc2YTDhomCxgN4AaABAg,"{'videoId': 'Sv7ImcwXZZk', 'topLevelComment': {'kind': 'youtube#comment', 'etag': 'BI5wJfi2WLhgSxL_iel24-hTIcs', 'id': 'UgxQV3pc2YTDhomCxgN4AaABAg', 'snippet': {'videoId': 'Sv7ImcwXZZk', 'textDisplay': 'São essas &quot;pessoas&quot; que votam no luladrao', 'textOriginal': 'São essas ""pessoas"" que votam no luladrao', 'authorDisplayName': 'Anderson msouza', 'authorProfileImageUrl': 'https://yt3.ggpht.com/ytc/AGIKgqPEclljAmszFs74zlZ_u6izByGzu-87DZ3P2DT856oKmSZzCq5mN3uTdjPcyvYi=s48-c-k-c0x00ffffff-no-rj', 'authorChannelUrl': 'http://www.youtube.com/channel/UCj3fXH0nPb031AtE4nuZHjA', 'authorChannelId': {'value': 'UCj3fXH0nPb031AtE4nuZHjA'}, 'canRate': True, 'viewerRating': 'none', 'likeCount': 0, 'publishedAt': '2022-10-12T12:09:22Z', 'updatedAt': '2022-10-12T12:09:22Z'}}, 'canReply': True, 'totalReplyCount': 0, 'isPublic': True}",,UCj3fXH0nPb031AtE4nuZHjA,2022-10-12T12:09:22Z,"São essas ""pessoas"" que votam no luladrao",,2023-06-09 13:19:50.942888
youtube#commentThread,ITIfdbTkdlxRWiWa_2HZIfjbP4c,UgxcB4osnjGPvKQYj-94AaABAg,"{'videoId': 'Sv7ImcwXZZk', 'topLevelComment': {'kind': 'youtube#comment', 'etag': 'tkQq0EnjD6PHin_oYNRjYp2zbmM', 'id': 'UgxcB4osnjGPvKQYj-94AaABAg', 'snippet': {'videoId': 'Sv7ImcwXZZk', 'textDisplay': 'Quando gente haverá políticos decentes corajosos e a população apoiando para acabar com a insegurança em nosso país?', 'textOriginal': 'Quando gente haverá políticos decentes corajosos e a população apoiando para acabar com a insegurança em nosso país?', 'authorDisplayName': 'marcio silva', 'authorProfileImageUrl': 'https://yt3.ggpht.com/ytc/AGIKgqMDliIdEN75ZD665hxxnYqo-dTFnasH2AIc0qP45A=s48-c-k-c0x00ffffff-no-rj', 'authorChannelUrl': 'http://www.youtube.com/channel/UCSH1YgYwjjq40Q_f0I6a_lw', 'authorChannelId': {'value': 'UCSH1YgYwjjq40Q_f0I6a_lw'}, 'canRate': True, 'viewerRating': 'none', 'likeCount': 11, 'publishedAt': '2022-10-12T12:08:30Z', 'updatedAt': '2022-10-12T12:08:30Z'}}, 'canReply': True, 'totalReplyCount': 0, 'isPublic': True}",,UCSH1YgYwjjq40Q_f0I6a_lw,2022-10-12T12:08:30Z,Quando gente haverá políticos decentes corajosos e a população apoiando para acabar com a insegurança em nosso país?,,2023-06-09 13:19:50.942888
youtube#commentThread,2lBBFGDhGuaVzMfHgds0-nuykZU,UgxNa9fCNE3Syp5wDJB4AaABAg,"{'videoId': 'Sv7ImcwXZZk', 'topLevelComment': {'kind': 'youtube#comment', 'etag': 'j7crFv_HiC6Kx-Vl3h_8pS9R8R4', 'id': 'UgxNa9fCNE3Syp5wDJB4AaABAg', 'snippet': {'videoId': 'Sv7ImcwXZZk', 'textDisplay': 'A mídia, como sempre, sentenciando mais uma família.', 'textOriginal': 'A mídia, como sempre, sentenciando mais uma família.', 'authorDisplayName': 'CLÃ - PEGUEM ELES, RAPAZES!', 'authorProfileImageUrl': 'https://yt3.ggpht.com/qHzwepTAgxf_5izc_PhKMd-AbwdRatmGJs07T8nLCz74lkQd75tACML-ligl2G5o9bOh9ujV=s48-c-k-c0x00ffffff-no-rj', 'authorChannelUrl': 'http://www.youtube.com/channel/UCuTQBp0ljoa6QVDvkUOPImA', 'authorChannelId': {'value': 'UCuTQBp0ljoa6QVDvkUOPImA'}, 'canRate': True, 'viewerRating': 'none', 'likeCount': 8, 'publishedAt': '2022-10-12T12:04:00Z', 'updatedAt': '2022-10-12T12:04:00Z'}}, 'canReply': True, 'totalReplyCount': 0, 'isPublic': True}",,UCuTQBp0ljoa6QVDvkUOPImA,2022-10-12T12:04:00Z,"A mídia, como sempre, sentenciando mais uma família.",,2023-06-09 13:19:50.942888
youtube#commentThread,HYh6lGei9m9juw-nT85fJiL0GPQ,UgyMb4zzQ1JKDCAZfyR4AaABAg,"{'videoId': 'Sv7ImcwXZZk', 'topLevelComment': {'kind': 'youtube#comment', 'etag': 'Fp-NQIm0iAtr3dqXV3zqhuXnZXE', 'id': 'UgyMb4zzQ1JKDCAZfyR4AaABAg', 'snippet': {'videoId': 'Sv7ImcwXZZk', 'textDisplay': 'Coitada Dessa moça coitada das crianças desse casal de tráfego', 'textOriginal': 'Coitada Dessa moça coitada das crianças desse casal de tráfego', 'authorDisplayName': 'Pérola negra', 'authorProfileImageUrl': 'https://yt3.ggpht.com/02ETpbD5pEaaeEuHfKnksbDmmK3jvl73BnLl1rID2A8T9V9WE_tfvIVsSIwf9zYMkbkFrjER=s48-c-k-c0x00ffffff-no-rj', 'authorChannelUrl': 'http://www.youtube.com/channel/UCc20IlG0lI30Srt9zr2KShQ', 'authorChannelId': {'value': 'UCc20IlG0lI30Srt9zr2KShQ'}, 'canRate': True, 'viewerRating': 'none', 'likeCount': 19, 'publishedAt': '2022-10-12T11:41:56Z', 'updatedAt': '2022-10-12T11:41:56Z'}}, 'canReply': True, 'totalReplyCount': 1, 'isPublic': True}","{'comments': [{'kind': 'youtube#comment', 'etag': '0GQKVjptT1jUFOKwgGwY9TmKq_8', 'id': 'UgyMb4zzQ1JKDCAZfyR4AaABAg.9h4h8n-JtIC9h8aGMRZuK1', 'snippet': {'videoId': 'Sv7ImcwXZZk', 'textDisplay': 'Imagina o povo quer coloca o ladrão de volta pra cuida desse país nunca vamos ter a tão sonhada segurança', 'textOriginal': 'Imagina o povo quer coloca o ladrão de volta pra cuida desse país nunca vamos ter a tão sonhada segurança', 'parentId': 'UgyMb4zzQ1JKDCAZfyR4AaABAg', 'authorDisplayName': 'Neusa Zanon', 'authorProfileImageUrl': 'https://yt3.ggpht.com/ytc/AGIKgqPwhI-adgHEBNTteJ9Tm7YZ1_fWDbkUskbKn1OC6VB7ke_g3QYnR4jte4JfziFF=s48-c-k-c0x00ffffff-no-rj', 'authorChannelUrl': 'http://www.youtube.com/channel/UC1hTYC2FsXyvChRljrpnRSg', 'authorChannelId': {'value': 'UC1hTYC2FsXyvChRljrpnRSg'}, 'canRate': True, 'viewerRating': 'none', 'likeCount': 2, 'publishedAt': '2022-10-13T23:58:46Z', 'updatedAt': '2022-10-13T23:58:46Z'}}]}",UCc20IlG0lI30Srt9zr2KShQ,2022-10-12T11:41:56Z,Coitada Dessa moça coitada das crianças desse casal de tráfego,,2023-06-09 13:19:50.942888
youtube#commentThread,LAC9bmEihqDEjs440n12m6Ifw5Q,Ugz5HnDKkIAfocJlBMF4AaABAg,"{'videoId': 'Sv7ImcwXZZk', 'topLevelComment': {'kind': 'youtube#comment', 'etag': 'idja_BuAZQl0OlzPWTq5Ro7JTuI', 'id': 'Ugz5HnDKkIAfocJlBMF4AaABAg', 'snippet': {'videoId': 'Sv7ImcwXZZk', 'textDisplay': 'O pior de tudo isso a família vai morrer porque a lei protege esses vagabundos', 'textOriginal': 'O pior de tudo isso a família vai morrer porque a lei protege esses vagabundos', 'authorDisplayName': 'merli costa', 'authorProfileImageUrl': 'https://yt3.ggpht.com/ytc/AGIKgqPDYcVnLjGKlcNppjSrtGxuDHotpyiniuLFVQadQCk1_GUGOL8ilRc9J-RMnXtH=s48-c-k-c0x00ffffff-no-rj', 'authorChannelUrl': 'http://www.youtube.com/channel/UC1nGpauGv0CLX_wyKMyuz5A', 'authorChannelId': {'value': 'UC1nGpauGv0CLX_wyKMyuz5A'}, 'canRate': True, 'viewerRating': 'none', 'likeCount': 0, 'publishedAt': '2022-10-12T11:41:46Z', 'updatedAt': '2022-10-12T11:41:46Z'}}, 'canReply': True, 'totalReplyCount': 0, 'isPublic': True}",,UC1nGpauGv0CLX_wyKMyuz5A,2022-10-12T11:41:46Z,O pior de tudo isso a família vai morrer porque a lei protege esses vagabundos,,2023-06-09 13:19:50.942888
youtube#commentThread,wsH9CX9_cOTlw0DIb8FbU-V3PFg,UgzrIGDMpAW_UfBv92p4AaABAg,"{'videoId': 'Sv7ImcwXZZk', 'topLevelComment': {'kind': 'youtube#comment', 'etag': 'lF0vAzrnfs2uH7TNnYRFkbBt1ag', 'id': 'UgzrIGDMpAW_UfBv92p4AaABAg', 'snippet': {'videoId': 'Sv7ImcwXZZk', 'textDisplay': 'Agora ela cai fora', 'textOriginal': 'Agora ela cai fora', 'authorDisplayName': 'marilene lina', 'authorProfileImageUrl': 'https://yt3.ggpht.com/ytc/AGIKgqO5hKrW8uX9CKs7MKwwVrzNfDs0A47YHVcj_Q=s48-c-k-c0x00ffffff-no-rj', 'authorChannelUrl': 'http://www.youtube.com/channel/UCED5lvxHm4NETgx-B0jfH_Q', 'authorChannelId': {'value': 'UCED5lvxHm4NETgx-B0jfH_Q'}, 'canRate': True, 'viewerRating': 'none', 'likeCount': 0, 'publishedAt': '2022-10-12T11:35:17Z', 'updatedAt': '2022-10-12T11:35:17Z'}}, 'canReply': True, 'totalReplyCount': 0, 'isPublic': True}",,UCED5lvxHm4NETgx-B0jfH_Q,2022-10-12T11:35:17Z,Agora ela cai fora,,2023-06-09 13:19:50.942888
youtube#commentThread,ltIbkIC7h2wLMSntACYesOEcPWk,UgymKegcIhdSrye4geR4AaABAg,"{'videoId': 'Sv7ImcwXZZk', 'topLevelComment': {'kind': 'youtube#comment', 'etag': 'rbBZZoKp6Lh9ZB-lA-ztjrDxlGE', 'id': 'UgymKegcIhdSrye4geR4AaABAg', 'snippet': {'videoId': 'Sv7ImcwXZZk', 'textDisplay': 'BOLSONARO VAI ACABAR COM ISSO', 'textOriginal': 'BOLSONARO VAI ACABAR COM ISSO', 'authorDisplayName': 'Andre c', 'authorProfileImageUrl': 'https://yt3.ggpht.com/ytc/AGIKgqNzniKgrlaadeP3PBfL765Aoei-MyQV8MAaQQ=s48-c-k-c0x00ffffff-no-rj', 'authorChannelUrl': 'http://www.youtube.com/channel/UCE04iwrbmVLPj8Q5rpRwKog', 'authorChannelId': {'value': 'UCE04iwrbmVLPj8Q5rpRwKog'}, 'canRate': True, 'viewerRating': 'none', 'likeCount': 5, 'publishedAt': '2022-10-12T11:30:53Z', 'updatedAt': '2022-10-12T11:30:53Z'}}, 'canReply': True, 'totalReplyCount': 5, 'isPublic': True}","{'comments': [{'kind': 'youtube#comment', 'etag': '2FBTHJzxhAQDcYZ5ClmXagvSIJE', 'id': 'UgymKegcIhdSrye4geR4AaABAg.9h4fsvJs1R79h5fqu2n7vl', 'snippet': {'videoId': 'Sv7ImcwXZZk', 'textDisplay': 'À vá <br>Quem dita as regras da LEI é o STF', 'textOriginal': 'À vá \\nQuem dita as regras da LEI é o STF', 'parentId': 'UgymKegcIhdSrye4geR4AaABAg', 'authorDisplayName': 'Celia Dos Santos', 'authorProfileImageUrl': 'https://yt3.ggpht.com/ytc/AGIKgqMtRpAr00t2OGv9OWiO3ohk5pJeD99OHgH5Nw=s48-c-k-c0x00ffffff-no-rj', 'authorChannelUrl': 'http://www.youtube.com/channel/UCkliXnbixDY4zqR_aSOoqvg', 'authorChannelId': {'value': 'UCkliXnbixDY4zqR_aSOoqvg'}, 'canRate': True, 'viewerRating': 'none', 'likeCount': 2, 'publishedAt': '2022-10-12T20:49:51Z', 'updatedAt': '2022-10-12T20:49:51Z'}}, {'kind': 'youtube#comment', 'etag': 'MDyG9-zgLN-BWjhdYS8Ss6ZGooE', 'id': 'UgymKegcIhdSrye4geR4AaABAg.9h4fsvJs1R79h5bonvs_-E', 'snippet': {'videoId': 'Sv7ImcwXZZk', 'textDisplay': '513 deputado fazem as leis 81 senador complementa as leis e bolsonaro assina e segue a lei sem os deputados nada pode acontecer. Esperamos que com parte da câmara renovada as leis também possa mudar', 'textOriginal': '513 deputado fazem as leis 81 senador complementa as leis e bolsonaro assina e segue a lei sem os deputados nada pode acontecer. Esperamos que com parte da câmara renovada as leis também possa mudar', 'parentId': 'UgymKegcIhdSrye4geR4AaABAg', 'authorDisplayName': 'Marta Lessa', 'authorProfileImageUrl': 'https://yt3.ggpht.com/ytc/AGIKgqOslmW251I-_SQt41bw9Jpy03a5RasqmotKGAtO-w=s48-c-k-c0x00ffffff-no-rj', 'authorChannelUrl': 'http://www.youtube.com/channel/UCC32fqc_TDZ7BER9DshDSWA', 'authorChannelId': {'value': 'UCC32fqc_TDZ7BER9DshDSWA'}, 'canRate': True, 'viewerRating': 'none', 'likeCount': 1, 'publishedAt': '2022-10-12T20:14:37Z', 'updatedAt': '2022-10-12T20:14:37Z'}}, {'kind': 'youtube#comment', 'etag': 'mUDJBTdSYchbqqt3u_PQs12YMxM', 'id': 'UgymKegcIhdSrye4geR4AaABAg.9h4fsvJs1R79h4qGkxlwEl', 'snippet': {'videoId': 'Sv7ImcwXZZk', 'textDisplay': 'Quem tinha q acabar com isso era a polícia,o MPE e o Poder Judiciário.', 'textOriginal': 'Quem tinha q acabar com isso era a polícia,o MPE e o Poder Judiciário.', 'parentId': 'UgymKegcIhdSrye4geR4AaABAg', 'authorDisplayName': 'Antônio Sampaio', 'authorProfileImageUrl': 'https://yt3.ggpht.com/ytc/AGIKgqM_Wqvs8gcWwmYEXVTl59qez5-gtRZTElPrTFguqkCIkYwthTgIcIC3QoGfxxwV=s48-c-k-c0x00ffffff-no-rj', 'authorChannelUrl': 'http://www.youtube.com/channel/UCcIQ_g8E4QAe69PwvDu_85A', 'authorChannelId': {'value': 'UCcIQ_g8E4QAe69PwvDu_85A'}, 'canRate': True, 'viewerRating': 'none', 'likeCount': 1, 'publishedAt': '2022-10-12T13:01:40Z', 'updatedAt': '2022-10-12T13:01:40Z'}}, {'kind': 'youtube#comment', 'etag': 'ggYY1H64xgLt2atwX8IbaOiSxOQ', 'id': 'UgymKegcIhdSrye4geR4AaABAg.9h4fsvJs1R79h4jAXtJ2aI', 'snippet': {'videoId': 'Sv7ImcwXZZk', 'textDisplay': 'O Lula é um corrupto e cachaceiro, além de cínico, hipócrita e lambe botas dos comunistas! Bolsonaro reeleito!', 'textOriginal': 'O Lula é um corrupto e cachaceiro, além de cínico, hipócrita e lambe botas dos comunistas! Bolsonaro reeleito!', 'parentId': 'UgymKegcIhdSrye4geR4AaABAg', 'authorDisplayName': 'Jaime angelim', 'authorProfileImageUrl': 'https://yt3.ggpht.com/ytc/AGIKgqPZBJp_xhAElyJox3u2LQMm-5ZWf48lKoEklg=s48-c-k-c0x00ffffff-no-rj', 'authorChannelUrl': 'http://www.youtube.com/channel/UCm6CUYgSOc1n9oHgQBZ0wzQ', 'authorChannelId': {'value': 'UCm6CUYgSOc1n9oHgQBZ0wzQ'}, 'canRate': True, 'viewerRating': 'none', 'likeCount': 0, 'publishedAt': '2022-10-12T11:59:39Z', 'updatedAt': '2022-10-12T11:59:39Z'}}, {'kind': 'youtube#comment', 'etag': '6IG9ZpR64eFa69-0F45CDtfbOBo', 'id': 'UgymKegcIhdSrye4geR4AaABAg.9h4fsvJs1R79h4ilpTmsRT', 'snippet': {'videoId': 'Sv7ImcwXZZk', 'textDisplay': 'Kkkkkkkkkkkkkkk se duvidar Bolsonaro mantém empregados em cárcere nas suas centenas de mansões compradas com dinheiro público', 'textOriginal': 'Kkkkkkkkkkkkkkk se duvidar Bolsonaro mantém empregados em cárcere nas suas centenas de mansões compradas com dinheiro público', 'parentId': 'UgymKegcIhdSrye4geR4AaABAg', 'authorDisplayName': 'Erick Lima', 'authorProfileImageUrl': 'https://yt3.ggpht.com/xQT9JHrlj9qb3t_mBq_jKqg2mL97PHZV9DtyN0k3yLHmoVfr1-KR49n9Nh6_WFsA9WzVDFzt=s48-c-k-c0x00ffffff-no-rj', 'authorChannelUrl': 'http://www.youtube.com/channel/UCgYu5hPMtn92UmsrYi8n4wQ', 'authorChannelId': {'value': 'UCgYu5hPMtn92UmsrYi8n4wQ'}, 'canRate': True, 'viewerRating': 'none', 'likeCount': 0, 'publishedAt': '2022-10-12T11:56:08Z', 'updatedAt': '2022-10-12T11:56:08Z'}}]}",UCE04iwrbmVLPj8Q5rpRwKog,2022-10-12T11:30:53Z,BOLSONARO VAI ACABAR COM ISSO,,2023-06-09 13:19:50.942888
youtube#commentThread,M9vFj-Z8eq1hW7bOvGr3yUTvlD8,UgzuU3cihI4oWGY7Gvt4AaABAg,"{'videoId': 'Sv7ImcwXZZk', 'topLevelComment': {'kind': 'youtube#comment', 'etag': 'zGh0i1q0ZbTQi0uYb5KpDyHV8Pg', 'id': 'UgzuU3cihI4oWGY7Gvt4AaABAg', 'snippet': {'videoId': 'Sv7ImcwXZZk', 'textDisplay': 'Tinha que tirar essa jovem daqui do Brasil', 'textOriginal': 'Tinha que tirar essa jovem daqui do Brasil', 'authorDisplayName': 'Gesiel Ferreira', 'authorProfileImageUrl': 'https://yt3.ggpht.com/ytc/AGIKgqMLpW6TgdwUXF2TjhFkXH10vn-1Ffwgd_YFqw=s48-c-k-c0x00ffffff-no-rj', 'authorChannelUrl': 'http://www.youtube.com/channel/UCx8J-dMpX8aa3caYHbWSuKg', 'authorChannelId': {'value': 'UCx8J-dMpX8aa3caYHbWSuKg'}, 'canRate': True, 'viewerRating': 'none', 'likeCount': 4, 'publishedAt': '2022-10-12T11:29:59Z', 'updatedAt': '2022-10-12T11:29:59Z'}}, 'canReply': True, 'totalReplyCount': 0, 'isPublic': True}",,UCx8J-dMpX8aa3caYHbWSuKg,2022-10-12T11:29:59Z,Tinha que tirar essa jovem daqui do Brasil,,2023-06-09 13:19:50.942888
youtube#commentThread,oHV25PGbMTJgTHAOXEleck0g3Hw,UgzVyC-GKCiM3ITxrVF4AaABAg,"{'videoId': 'Sv7ImcwXZZk', 'topLevelComment': {'kind': 'youtube#comment', 'etag': 'cwTpCEKNTG9fAlVg1qex-DVWXxg', 'id': 'UgzVyC-GKCiM3ITxrVF4AaABAg', 'snippet': {'videoId': 'Sv7ImcwXZZk', 'textDisplay': '&quot;Pena de morte...&quot; Apenas.', 'textOriginal': '""Pena de morte..."" Apenas.', 'authorDisplayName': 'Cláudia Mass', 'authorProfileImageUrl': 'https://yt3.ggpht.com/Z33HxL2OzPC_VStQkpfWY5WPN5-c8nFepngC_SUIk_fqL7y2tpq5BQ31iIQoK9GvSGSXIlIk=s48-c-k-c0x00ffffff-no-rj', 'authorChannelUrl': 'http://www.youtube.com/channel/UCNGPzIc4mePxQE8XvzN93PA', 'authorChannelId': {'value': 'UCNGPzIc4mePxQE8XvzN93PA'}, 'canRate': True, 'viewerRating': 'none', 'likeCount': 6, 'publishedAt': '2022-10-12T11:28:31Z', 'updatedAt': '2022-10-12T11:28:31Z'}}, 'canReply': True, 'totalReplyCount': 3, 'isPublic': True}","{'comments': [{'kind': 'youtube#comment', 'etag': 'nJSogUz3cWYogSCPQp4EdygaQjo', 'id': 'UgzVyC-GKCiM3ITxrVF4AaABAg.9h4fbYYm4vb9h4lgKkJlIL', 'snippet': {'videoId': 'Sv7ImcwXZZk', 'textDisplay': '@Cláudia Mass Passe bem voce também.', 'textOriginal': '@Cláudia Mass Passe bem voce também.', 'parentId': 'UgzVyC-GKCiM3ITxrVF4AaABAg', 'authorDisplayName': 'Fabricio', 'authorProfileImageUrl': 'https://yt3.ggpht.com/ytc/AGIKgqMhM7ZtOq6RbKO4e4pfBxnAZF3xzKofmb7UkqHbhA=s48-c-k-c0x00ffffff-no-rj', 'authorChannelUrl': 'http://www.youtube.com/channel/UCWv8zbzmyLf4esLlNEhMtMg', 'authorChannelId': {'value': 'UCWv8zbzmyLf4esLlNEhMtMg'}, 'canRate': True, 'viewerRating': 'none', 'likeCount': 3, 'publishedAt': '2022-10-12T12:21:36Z', 'updatedAt': '2022-10-12T12:21:36Z'}}, {'kind': 'youtube#comment', 'etag': 'c5-xEZvTvHCZpZd5OAxJU9HuWIc', 'id': 'UgzVyC-GKCiM3ITxrVF4AaABAg.9h4fbYYm4vb9h4kwgZzX3W', 'snippet': {'videoId': 'Sv7ImcwXZZk', 'textDisplay': '@Fabricio você tem a sua opinião. Eu tenho a minha. Passe bem. 👍', 'textOriginal': '@Fabricio você tem a sua opinião. Eu tenho a minha. Passe bem. 👍', 'parentId': 'UgzVyC-GKCiM3ITxrVF4AaABAg', 'authorDisplayName': 'Cláudia Mass', 'authorProfileImageUrl': 'https://yt3.ggpht.com/Z33HxL2OzPC_VStQkpfWY5WPN5-c8nFepngC_SUIk_fqL7y2tpq5BQ31iIQoK9GvSGSXIlIk=s48-c-k-c0x00ffffff-no-rj', 'authorChannelUrl': 'http://www.youtube.com/channel/UCNGPzIc4mePxQE8XvzN93PA', 'authorChannelId': {'value': 'UCNGPzIc4mePxQE8XvzN93PA'}, 'canRate': True, 'viewerRating': 'none', 'likeCount': 1, 'publishedAt': '2022-10-12T12:15:06Z', 'updatedAt': '2022-10-12T12:15:06Z'}}, {'kind': 'youtube#comment', 'etag': '9d-5KuR37vNNLIYqirzVPKA9cZk', 'id': 'UgzVyC-GKCiM3ITxrVF4AaABAg.9h4fbYYm4vb9h4kGLUlns3', 'snippet': {'videoId': 'Sv7ImcwXZZk', 'textDisplay': 'Se por um lado a pena de morte parece interessante ao meu ponto de vista, pelo outro me parece de certa forma um tiro no pé porque pra isso acontecer muita coisa teria que ser mudada, veja como exemplo que quem tem dinheiro pra pagar um bom advogado raramente fica muito tempo preso, pra esse negócio de &quot;pena de morte&quot; funcionar dentro do sistema judiciário, a justiça deveria realmente tratar as pessoas de forma igual e no fundo a gente sabe que isso não acontece.', 'textOriginal': 'Se por um lado a pena de morte parece interessante ao meu ponto de vista, pelo outro me parece de certa forma um tiro no pé porque pra isso acontecer muita coisa teria que ser mudada, veja como exemplo que quem tem dinheiro pra pagar um bom advogado raramente fica muito tempo preso, pra esse negócio de ""pena de morte"" funcionar dentro do sistema judiciário, a justiça deveria realmente tratar as pessoas de forma igual e no fundo a gente sabe que isso não acontece.', 'parentId': 'UgzVyC-GKCiM3ITxrVF4AaABAg', 'authorDisplayName': 'Fabricio', 'authorProfileImageUrl': 'https://yt3.ggpht.com/ytc/AGIKgqMhM7ZtOq6RbKO4e4pfBxnAZF3xzKofmb7UkqHbhA=s48-c-k-c0x00ffffff-no-rj', 'authorChannelUrl': 'http://www.youtube.com/channel/UCWv8zbzmyLf4esLlNEhMtMg', 'authorChannelId': {'value': 'UCWv8zbzmyLf4esLlNEhMtMg'}, 'canRate': True, 'viewerRating': 'none', 'likeCount': 2, 'publishedAt': '2022-10-12T12:09:11Z', 'updatedAt': '2022-10-12T20:13:28Z'}}]}",UCNGPzIc4mePxQE8XvzN93PA,2022-10-12T11:28:31Z,"""Pena de morte..."" Apenas.",,2023-06-09 13:19:50.942888
