kind,etag,id,snippet,replies,authorChannelId,publishedAt,textOriginal,nextPageToken,extraction_date
youtube#commentThread,Ps6M-62AWjpZELPIO494MkHpFdc,UgwDuBVncYef23VxrJN4AaABAg,"{'videoId': 'Sv7ImcwXZZk', 'topLevelComment': {'kind': 'youtube#comment', 'etag': 'phdhgjTLsI88jR_IcK5V1HLUyNY', 'id': 'UgwDuBVncYef23VxrJN4AaABAg', 'snippet': {'videoId': 'Sv7ImcwXZZk', 'textDisplay': 'Essa mulher  precisa si mudar de cidade  e estado', 'textOriginal': 'Essa mulher  precisa si mudar de cidade  e estado', 'authorDisplayName': 'francisco delier delier', 'authorProfileImageUrl': 'https://yt3.ggpht.com/ytc/AGIKgqMXGszU63Y_AO4EgF9KGLXqW4uWqconq__bsnVe=s48-c-k-c0x00ffffff-no-rj', 'authorChannelUrl': 'http://www.youtube.com/channel/UC7nwkJK5ghxKGFfIMIKA9QQ', 'authorChannelId': {'value': 'UC7nwkJK5ghxKGFfIMIKA9QQ'}, 'canRate': True, 'viewerRating': 'none', 'likeCount': 1, 'publishedAt': '2022-10-12T15:15:29Z', 'updatedAt': '2022-10-12T15:15:29Z'}}, 'canReply': True, 'totalReplyCount': 0, 'isPublic': True}",,UC7nwkJK5ghxKGFfIMIKA9QQ,2022-10-12T15:15:29Z,Essa mulher  precisa si mudar de cidade  e estado,,2023-06-09 13:19:50.942888
youtube#commentThread,kCxaQ53wtgndCP-n-gn6KQ5d6HI,UgxHVRCXDmWtppV2nvt4AaABAg,"{'videoId': 'Sv7ImcwXZZk', 'topLevelComment': {'kind': 'youtube#comment', 'etag': 'z_6_fkSKICkRIMiiQ8D9QqysJro', 'id': 'UgxHVRCXDmWtppV2nvt4AaABAg', 'snippet': {'videoId': 'Sv7ImcwXZZk', 'textDisplay': 'É esse Brasil que você quer,por isso voto em Bolsonaro,contra a corrupção e injustiça social!!!', 'textOriginal': 'É esse Brasil que você quer,por isso voto em Bolsonaro,contra a corrupção e injustiça social!!!', 'authorDisplayName': 'Sandro José', 'authorProfileImageUrl': 'https://yt3.ggpht.com/ytc/AGIKgqPYeXAej9U4mVuDwUvXch3WjhUUOp2gqds5wxrCLQ=s48-c-k-c0x00ffffff-no-rj', 'authorChannelUrl': 'http://www.youtube.com/channel/UC3f9NzLqLR22xeVFxqX32Lg', 'authorChannelId': {'value': 'UC3f9NzLqLR22xeVFxqX32Lg'}, 'canRate': True, 'viewerRating': 'none', 'likeCount': 7, 'publishedAt': '2022-10-12T15:03:28Z', 'updatedAt': '2022-10-12T15:03:28Z'}}, 'canReply': True, 'totalReplyCount': 0, 'isPublic': True}",,UC3f9NzLqLR22xeVFxqX32Lg,2022-10-12T15:03:28Z,"É esse Brasil que você quer,por isso voto em Bolsonaro,contra a corrupção e injustiça social!!!",,2023-06-09 13:19:50.942888
youtube#commentThread,zjfr8S7Gt-mNObcLpeJDIOmS4ZI,UgwTLfn63-rtKSaqnQt4AaABAg,"{'videoId': 'Sv7ImcwXZZk', 'topLevelComment': {'kind': 'youtube#comment', 'etag': '24T3UieOJ98assnwt1EMlMx3k6Y', 'id': 'UgwTLfn63-rtKSaqnQt4AaABAg', 'snippet': {'videoId': 'Sv7ImcwXZZk', 'textDisplay': 'Vai morrer,ela vai ter que fugir se não vai morrer', 'textOriginal': 'Vai morrer,ela vai ter que fugir se não vai morrer', 'authorDisplayName': 'P.R FER', 'authorProfileImageUrl': 'https://yt3.ggpht.com/ytc/AGIKgqPcotOZTibPvciyPED05sjWNVFmWSZmIULZ2tuZjwc=s48-c-k-c0x00ffffff-no-rj', 'authorChannelUrl': 'http://www.youtube.com/channel/UCsEF4PXuXQBsKVUJ-SMar4w', 'authorChannelId': {'value': 'UCsEF4PXuXQBsKVUJ-SMar4w'}, 'canRate': True, 'viewerRating': 'none', 'likeCount': 0, 'publishedAt': '2022-10-12T14:40:27Z', 'updatedAt': '2022-10-12T14:40:27Z'}}, 'canReply': True, 'totalReplyCount': 0, 'isPublic': True}",,UCsEF4PXuXQBsKVUJ-SMar4w,2022-10-12T14:40:27Z,"Vai morrer,ela vai ter que fugir se não vai morrer",,2023-06-09 13:19:50.942888
youtube#commentThread,OEplHOab9LcSwC7ry7lMSPWDplI,UgzkyGj8SjFby_0RoF14AaABAg,"{'videoId': 'Sv7ImcwXZZk', 'topLevelComment': {'kind': 'youtube#comment', 'etag': '54i6U-zOEeh3RxpPjNfRkwpocPI', 'id': 'UgzkyGj8SjFby_0RoF14AaABAg', 'snippet': {'videoId': 'Sv7ImcwXZZk', 'textDisplay': 'Tem que tomar todos os bens dos envolvidos e indenizar ela, e rastrear toda as conversas de um ano para cá que a polícia devem descobrir muito rolo', 'textOriginal': 'Tem que tomar todos os bens dos envolvidos e indenizar ela, e rastrear toda as conversas de um ano para cá que a polícia devem descobrir muito rolo', 'authorDisplayName': 'Lima Lima', 'authorProfileImageUrl': 'https://yt3.ggpht.com/ytc/AGIKgqN9RmZ34aWGElnN-5QQvv5OYwVUv6zpLgTJlg=s48-c-k-c0x00ffffff-no-rj', 'authorChannelUrl': 'http://www.youtube.com/channel/UCHE6fveNeywabb2mJGf5-tQ', 'authorChannelId': {'value': 'UCHE6fveNeywabb2mJGf5-tQ'}, 'canRate': True, 'viewerRating': 'none', 'likeCount': 4, 'publishedAt': '2022-10-12T14:30:30Z', 'updatedAt': '2022-10-12T14:30:30Z'}}, 'canReply': True, 'totalReplyCount': 0, 'isPublic': True}",,UCHE6fveNeywabb2mJGf5-tQ,2022-10-12T14:30:30Z,"Tem que tomar todos os bens dos envolvidos e indenizar ela, e rastrear toda as conversas de um ano para cá que a polícia devem descobrir muito rolo",,2023-06-09 13:19:50.942888
youtube#commentThread,hBg9drWZJHVA3bztpIR4drR0Btc,UgzmIYz-Awid_huKOa14AaABAg,"{'videoId': 'Sv7ImcwXZZk', 'topLevelComment': {'kind': 'youtube#comment', 'etag': '3NBc3D5uOn_OX-mShTAsD7eIRg0', 'id': 'UgzmIYz-Awid_huKOa14AaABAg', 'snippet': {'videoId': 'Sv7ImcwXZZk', 'textDisplay': 'Bem feito', 'textOriginal': 'Bem feito', 'authorDisplayName': 'Silvana Fernandes', 'authorProfileImageUrl': 'https://yt3.ggpht.com/ytc/AGIKgqOmc1qscwmC1q6PEe_KE1UOWoLi-3ghW1zYOA=s48-c-k-c0x00ffffff-no-rj', 'authorChannelUrl': 'http://www.youtube.com/channel/UCjPw1CLIU48AohQ-sDl8zrA', 'authorChannelId': {'value': 'UCjPw1CLIU48AohQ-sDl8zrA'}, 'canRate': True, 'viewerRating': 'none', 'likeCount': 0, 'publishedAt': '2022-10-12T14:05:39Z', 'updatedAt': '2022-10-12T14:05:39Z'}}, 'canReply': True, 'totalReplyCount': 0, 'isPublic': True}",,UCjPw1CLIU48AohQ-sDl8zrA,2022-10-12T14:05:39Z,Bem feito,,2023-06-09 13:19:50.942888
youtube#commentThread,zbtnBRap4uzmut1LXDXJYxcINOE,UgwX0lfkS9qtcRQjkop4AaABAg,"{'videoId': 'Sv7ImcwXZZk', 'topLevelComment': {'kind': 'youtube#comment', 'etag': 'JYNDZuBbgB8_JEQv3gnarLNPL_A', 'id': 'UgwX0lfkS9qtcRQjkop4AaABAg', 'snippet': {'videoId': 'Sv7ImcwXZZk', 'textDisplay': 'O que dá mais raiva é a cara de coitado que esses vagabundos fazem quando são presos.', 'textOriginal': 'O que dá mais raiva é a cara de coitado que esses vagabundos fazem quando são presos.', 'authorDisplayName': 'Cleiton Cavalcanti', 'authorProfileImageUrl': 'https://yt3.ggpht.com/ytc/AGIKgqMyiTTfrTcNXH4goAadHopzrMmtbhfYIQmJrVGwtA=s48-c-k-c0x00ffffff-no-rj', 'authorChannelUrl': 'http://www.youtube.com/channel/UCH9bMFXb1iCesOsXu4QkXQQ', 'authorChannelId': {'value': 'UCH9bMFXb1iCesOsXu4QkXQQ'}, 'canRate': True, 'viewerRating': 'none', 'likeCount': 0, 'publishedAt': '2022-10-12T13:48:20Z', 'updatedAt': '2022-10-12T13:48:20Z'}}, 'canReply': True, 'totalReplyCount': 0, 'isPublic': True}",,UCH9bMFXb1iCesOsXu4QkXQQ,2022-10-12T13:48:20Z,O que dá mais raiva é a cara de coitado que esses vagabundos fazem quando são presos.,,2023-06-09 13:19:50.942888
youtube#commentThread,Nfm3QeuIcEi6qwIROttOXq5EBVE,UgyB26Z1YOTIJobfe5h4AaABAg,"{'videoId': 'Sv7ImcwXZZk', 'topLevelComment': {'kind': 'youtube#comment', 'etag': 'g8sFbnm5RtCo8Xu_4NVGmQRHHD4', 'id': 'UgyB26Z1YOTIJobfe5h4AaABAg', 'snippet': {'videoId': 'Sv7ImcwXZZk', 'textDisplay': 'Casal patriota apertador do 17.', 'textOriginal': 'Casal patriota apertador do 17.', 'authorDisplayName': 'VOTE em Himelfarb - o Himelfarb da loja de penhores', 'authorProfileImageUrl': 'https://yt3.ggpht.com/ytc/AGIKgqM8gevZgB8vi-YZekennoDQIyZgAW100YvsxgWe=s48-c-k-c0x00ffffff-no-rj', 'authorChannelUrl': 'http://www.youtube.com/channel/UCPaKStnSq9IbbzQaq_X8iQQ', 'authorChannelId': {'value': 'UCPaKStnSq9IbbzQaq_X8iQQ'}, 'canRate': True, 'viewerRating': 'none', 'likeCount': 5, 'publishedAt': '2022-10-12T13:21:56Z', 'updatedAt': '2022-10-12T13:21:56Z'}}, 'canReply': True, 'totalReplyCount': 2, 'isPublic': True}","{'comments': [{'kind': 'youtube#comment', 'etag': 'dq4gYmKLQVyr3IDaOODhRm2zxl4', 'id': 'UgyB26Z1YOTIJobfe5h4AaABAg.9h4saEFIu1a9h5fesqg-2z', 'snippet': {'videoId': 'Sv7ImcwXZZk', 'textDisplay': 'Combina perfeitamente com o 13', 'textOriginal': 'Combina perfeitamente com o 13', 'parentId': 'UgyB26Z1YOTIJobfe5h4AaABAg', 'authorDisplayName': 'Nuriddin Kadyrbekov 🇺🇿', 'authorProfileImageUrl': 'https://yt3.ggpht.com/IebO4pu3b9Xs_2OMaGvS0DQyM9ClqWCiQzQho85j0J4mDOh9I4s-6WRa9H6I9TNeWY_2T_BscA=s48-c-k-c0x00ffffff-no-rj', 'authorChannelUrl': 'http://www.youtube.com/channel/UChQ2V2t5lD3QBOhuq4yOkig', 'authorChannelId': {'value': 'UChQ2V2t5lD3QBOhuq4yOkig'}, 'canRate': True, 'viewerRating': 'none', 'likeCount': 2, 'publishedAt': '2022-10-12T20:48:13Z', 'updatedAt': '2022-10-12T20:48:13Z'}}, {'kind': 'youtube#comment', 'etag': 'YUHIrxSjiNEW0EKxD0AomsbQqv8', 'id': 'UgyB26Z1YOTIJobfe5h4AaABAg.9h4saEFIu1a9h5R7o2MENU', 'snippet': {'videoId': 'Sv7ImcwXZZk', 'textDisplay': 'Traficante vota 13 igual você', 'textOriginal': 'Traficante vota 13 igual você', 'parentId': 'UgyB26Z1YOTIJobfe5h4AaABAg', 'authorDisplayName': 'Felipe Dias', 'authorProfileImageUrl': 'https://yt3.ggpht.com/ytc/AGIKgqNz9mMlzZpDy71lGJ7F8HAiPotUqKFk8Yi6Xw=s48-c-k-c0x00ffffff-no-rj', 'authorChannelUrl': 'http://www.youtube.com/channel/UCpFRYza9sp3NZOQUp7I8jsw', 'authorChannelId': {'value': 'UCpFRYza9sp3NZOQUp7I8jsw'}, 'canRate': True, 'viewerRating': 'none', 'likeCount': 0, 'publishedAt': '2022-10-12T18:32:29Z', 'updatedAt': '2022-10-12T18:32:29Z'}}]}",UCPaKStnSq9IbbzQaq_X8iQQ,2022-10-12T13:21:56Z,Casal patriota apertador do 17.,,2023-06-09 13:19:50.942888
youtube#commentThread,HE8yPyG1rmmHhw2dz4ci34mu1Hs,UgxjEhtpNF3URNO7sA14AaABAg,"{'videoId': 'Sv7ImcwXZZk', 'topLevelComment': {'kind': 'youtube#comment', 'etag': '2n6gUIFJ0ztZsmHdOcC66bH6GnE', 'id': 'UgxjEhtpNF3URNO7sA14AaABAg', 'snippet': {'videoId': 'Sv7ImcwXZZk', 'textDisplay': 'Infelizmente já sabemos o final dessa história', 'textOriginal': 'Infelizmente já sabemos o final dessa história', 'authorDisplayName': 'Bruno Biondo', 'authorProfileImageUrl': 'https://yt3.ggpht.com/ytc/AGIKgqPu4FxqAm0CLTfIYZw1IBoMAB-y1-nAojCDdqoQRA=s48-c-k-c0x00ffffff-no-rj', 'authorChannelUrl': 'http://www.youtube.com/channel/UCCMokfo2vTw17jtohgzd7gA', 'authorChannelId': {'value': 'UCCMokfo2vTw17jtohgzd7gA'}, 'canRate': True, 'viewerRating': 'none', 'likeCount': 6, 'publishedAt': '2022-10-12T12:56:14Z', 'updatedAt': '2022-10-12T12:56:14Z'}}, 'canReply': True, 'totalReplyCount': 1, 'isPublic': True}","{'comments': [{'kind': 'youtube#comment', 'etag': 'YyS-tnzYwsLi6mg3QSxagRCvXVU', 'id': 'UgxjEhtpNF3URNO7sA14AaABAg.9h4pdvr081V9h4slt7FJhL', 'snippet': {'videoId': 'Sv7ImcwXZZk', 'textDisplay': 'Sim, o capetão Bolsonaro vai dar indulto pro casal.', 'textOriginal': 'Sim, o capetão Bolsonaro vai dar indulto pro casal.', 'parentId': 'UgxjEhtpNF3URNO7sA14AaABAg', 'authorDisplayName': 'VOTE em Himelfarb - o Himelfarb da loja de penhores', 'authorProfileImageUrl': 'https://yt3.ggpht.com/ytc/AGIKgqM8gevZgB8vi-YZekennoDQIyZgAW100YvsxgWe=s48-c-k-c0x00ffffff-no-rj', 'authorChannelUrl': 'http://www.youtube.com/channel/UCPaKStnSq9IbbzQaq_X8iQQ', 'authorChannelId': {'value': 'UCPaKStnSq9IbbzQaq_X8iQQ'}, 'canRate': True, 'viewerRating': 'none', 'likeCount': 0, 'publishedAt': '2022-10-12T13:23:32Z', 'updatedAt': '2022-10-12T13:23:32Z'}}]}",UCCMokfo2vTw17jtohgzd7gA,2022-10-12T12:56:14Z,Infelizmente já sabemos o final dessa história,,2023-06-09 13:19:50.942888
youtube#commentThread,-h1fa-55QX_ILL-SYkMmVwUMsyY,UgzPoZmxXJKIg5PC9YN4AaABAg,"{'videoId': 'Sv7ImcwXZZk', 'topLevelComment': {'kind': 'youtube#comment', 'etag': '7RqjrCI-wbexw9X5aREGz64ha9I', 'id': 'UgzPoZmxXJKIg5PC9YN4AaABAg', 'snippet': {'videoId': 'Sv7ImcwXZZk', 'textDisplay': 'Todos os pobres estão recebendo um presente 🎁 🎁 de bolsonaro <br>Dinheiro <br>Ok irmão avançar sempre somar forças <br>Recebeu 600reais precisam prestar serviços no seu bairro <br>Como assim? <br>Trabalhar nas escolas 🏫 🏫 <br>Limpeza de ruas <br>Pintar poste na cidade <br>Etc<br>Ganhou o dinheiro )<br>Nem Jesus faz isso <br>Porque?<br>Se você tem fé é curado <br>Gratuitamente <br>Se não tiver fé vai morrer podre de doença <br>Nunca toma ciência do  método de Jesus <br>Quer cura na moleza<br>Vai morrer igual Bruno covas podre de câncer,<br>Pe Léo morreu podre de câncer rastejou igual uma cobra e morreu <br>Não sabia como funciona a cura divina para si próprio <br>Papa Francisco está podre de doença Porque é contra cura divina para si próprio <br>Não tem cura <br>Dar dinheiro sem trabalhar <br>Ideologia do bolsonaro só sabe comer milho 🌽 🌽 com putim criminoso jegue', 'textOriginal': 'Todos os pobres estão recebendo um presente 🎁 🎁 de bolsonaro \\nDinheiro \\nOk irmão avançar sempre somar forças \\nRecebeu 600reais precisam prestar serviços no seu bairro \\nComo assim? \\nTrabalhar nas escolas 🏫 🏫 \\nLimpeza de ruas \\nPintar poste na cidade \\nEtc\\nGanhou o dinheiro )\\nNem Jesus faz isso \\nPorque?\\nSe você tem fé é curado \\nGratuitamente \\nSe não tiver fé vai morrer podre de doença \\nNunca toma ciência do  método de Jesus \\nQuer cura na moleza\\nVai morrer igual Bruno covas podre de câncer,\\nPe Léo morreu podre de câncer rastejou igual uma cobra e morreu \\nNão sabia como funciona a cura divina para si próprio \\nPapa Francisco está podre de doença Porque é contra cura divina para si próprio \\nNão tem cura \\nDar dinheiro sem trabalhar \\nIdeologia do bolsonaro só sabe comer milho 🌽 🌽 com putim criminoso jegue', 'authorDisplayName': 'Jose Raimundo Silva', 'authorProfileImageUrl': 'https://yt3.ggpht.com/ytc/AGIKgqMXzPZ1rHJ65gCoPUhkczEeOHI-foEjCHnvpbIAoyLcVS16lHZLU8tqT9M54VTo=s48-c-k-c0x00ffffff-no-rj', 'authorChannelUrl': 'http://www.youtube.com/channel/UCPgLZmcJj519TOSOQO9_7dg', 'authorChannelId': {'value': 'UCPgLZmcJj519TOSOQO9_7dg'}, 'canRate': True, 'viewerRating': 'none', 'likeCount': 0, 'publishedAt': '2022-10-12T12:47:48Z', 'updatedAt': '2022-10-12T12:47:48Z'}}, 'canReply': True, 'totalReplyCount': 0, 'isPublic': True}",,UCPgLZmcJj519TOSOQO9_7dg,2022-10-12T12:47:48Z,"Todos os pobres estão recebendo um presente 🎁 🎁 de bolsonaro 
Dinheiro 
Ok irmão avançar sempre somar forças 
Recebeu 600reais precisam prestar serviços no seu bairro 
Como assim? 
Trabalhar nas escolas 🏫 🏫 
Limpeza de ruas 
Pintar poste na cidade 
Etc
Ganhou o dinheiro )
Nem Jesus faz isso 
Porque?
Se você tem fé é curado 
Gratuitamente 
Se não tiver fé vai morrer podre de doença 
Nunca toma ciência do  método de Jesus 
Quer cura na moleza
Vai morrer igual Bruno covas podre de câncer,
Pe Léo morreu podre de câncer rastejou igual uma cobra e morreu 
Não sabia como funciona a cura divina para si próprio 
Papa Francisco está podre de doença Porque é contra cura divina para si próprio 
Não tem cura 
Dar dinheiro sem trabalhar 
Ideologia do bolsonaro só sabe comer milho 🌽 🌽 com putim criminoso jegue",,2023-06-09 13:19:50.942888
youtube#commentThread,qoE041kVTtWUiBNrZjg-GtOm4Ds,UgzY4ab8tKrRDmCJ8gp4AaABAg,"{'videoId': 'Sv7ImcwXZZk', 'topLevelComment': {'kind': 'youtube#comment', 'etag': 'u01w0E7BCG-kXyEyvXoaWvtQNAU', 'id': 'UgzY4ab8tKrRDmCJ8gp4AaABAg', 'snippet': {'videoId': 'Sv7ImcwXZZk', 'textDisplay': 'Rapidinho estarão SOLTOS,e ainda vão sair como vítimas,alguém tem dúvida?', 'textOriginal': 'Rapidinho estarão SOLTOS,e ainda vão sair como vítimas,alguém tem dúvida?', 'authorDisplayName': 'Emerson Alves da silva', 'authorProfileImageUrl': 'https://yt3.ggpht.com/ytc/AGIKgqPbQlxHed4Wp8adLjfKOxqbLhvNmazvReYnwZJQPw=s48-c-k-c0x00ffffff-no-rj', 'authorChannelUrl': 'http://www.youtube.com/channel/UCPXDtmOepesMjt1YjXoNMjw', 'authorChannelId': {'value': 'UCPXDtmOepesMjt1YjXoNMjw'}, 'canRate': True, 'viewerRating': 'none', 'likeCount': 4, 'publishedAt': '2022-10-12T12:44:35Z', 'updatedAt': '2022-10-12T12:44:35Z'}}, 'canReply': True, 'totalReplyCount': 0, 'isPublic': True}",,UCPXDtmOepesMjt1YjXoNMjw,2022-10-12T12:44:35Z,"Rapidinho estarão SOLTOS,e ainda vão sair como vítimas,alguém tem dúvida?",,2023-06-09 13:19:50.942888
youtube#commentThread,2Q3wnc0BW_sptfJupkOMn8mubwI,UgwmBunoqpkLkPQAQtp4AaABAg,"{'videoId': 'Sv7ImcwXZZk', 'topLevelComment': {'kind': 'youtube#comment', 'etag': 'VhX0vqSGVF5z_O-ZrlK7ClH2J_I', 'id': 'UgwmBunoqpkLkPQAQtp4AaABAg', 'snippet': {'videoId': 'Sv7ImcwXZZk', 'textDisplay': 'Guararema só escuto coisa ruim. Esse local é dominado por pessoas envolvida com tráfico.', 'textOriginal': 'Guararema só escuto coisa ruim. Esse local é dominado por pessoas envolvida com tráfico.', 'authorDisplayName': 'Sil K.B', 'authorProfileImageUrl': 'https://yt3.ggpht.com/efY5dcLCMdfoShRHhnp_AEe29BGbCEu71F05x9sYyPgGncnTDCJv8WPjluucSlyEQPp18oCvBg=s48-c-k-c0x00ffffff-no-rj', 'authorChannelUrl': 'http://www.youtube.com/channel/UCRMnm38us7lKHL-V8992YiQ', 'authorChannelId': {'value': 'UCRMnm38us7lKHL-V8992YiQ'}, 'canRate': True, 'viewerRating': 'none', 'likeCount': 3, 'publishedAt': '2022-10-12T12:43:47Z', 'updatedAt': '2022-10-12T12:43:47Z'}}, 'canReply': True, 'totalReplyCount': 0, 'isPublic': True}",,UCRMnm38us7lKHL-V8992YiQ,2022-10-12T12:43:47Z,Guararema só escuto coisa ruim. Esse local é dominado por pessoas envolvida com tráfico.,,2023-06-09 13:19:50.942888
youtube#commentThread,QpCg2P-qzhGjwOIBEZOnVrQTJx4,UgwK3VSAQmDQf68t6Y94AaABAg,"{'videoId': 'Sv7ImcwXZZk', 'topLevelComment': {'kind': 'youtube#comment', 'etag': 'DbMJDJK5McbwoKCv-SgpRdhFqVo', 'id': 'UgwK3VSAQmDQf68t6Y94AaABAg', 'snippet': {'videoId': 'Sv7ImcwXZZk', 'textDisplay': 'Solução prender todos líderes de social dos 5570municipios <br>Ganha e não  produz <br>Só dá merda nos municípios <br>Aluno mata professores <br>Porque?<br>Só porque a professora deu uma dura <br>Disciplina <br>Não tem<br>Social político acha lindo', 'textOriginal': 'Solução prender todos líderes de social dos 5570municipios \\nGanha e não  produz \\nSó dá merda nos municípios \\nAluno mata professores \\nPorque?\\nSó porque a professora deu uma dura \\nDisciplina \\nNão tem\\nSocial político acha lindo', 'authorDisplayName': 'Jose Raimundo Silva', 'authorProfileImageUrl': 'https://yt3.ggpht.com/ytc/AGIKgqMXzPZ1rHJ65gCoPUhkczEeOHI-foEjCHnvpbIAoyLcVS16lHZLU8tqT9M54VTo=s48-c-k-c0x00ffffff-no-rj', 'authorChannelUrl': 'http://www.youtube.com/channel/UCPgLZmcJj519TOSOQO9_7dg', 'authorChannelId': {'value': 'UCPgLZmcJj519TOSOQO9_7dg'}, 'canRate': True, 'viewerRating': 'none', 'likeCount': 0, 'publishedAt': '2022-10-12T12:39:10Z', 'updatedAt': '2022-10-12T12:39:10Z'}}, 'canReply': True, 'totalReplyCount': 0, 'isPublic': True}",,UCPgLZmcJj519TOSOQO9_7dg,2022-10-12T12:39:10Z,"Solução prender todos líderes de social dos 5570municipios 
Ganha e não  produz 
Só dá merda nos municípios 
Aluno mata professores 
Porque?
Só porque a professora deu uma dura 
Disciplina 
Não tem
Social político acha lindo",,2023-06-09 13:19:50.942888
youtube#commentThread,MRNcwVT6FyDAb_p14pUv1ICkjFQ,UgyeRCV5nkqnDSCQnct4AaABAg,"{'videoId': 'Sv7ImcwXZZk', 'topLevelComment': {'kind': 'youtube#comment', 'etag': 'AhnCfsiEUpShNZAHUdfmcQaIk0Q', 'id': 'UgyeRCV5nkqnDSCQnct4AaABAg', 'snippet': {'videoId': 'Sv7ImcwXZZk', 'textDisplay': 'BABÁ MUDA DE EST, NÃO FICA AÍ PORQUE VÃO TE MATAR,,VAI EMBORA DESSE LUGAR,,VC NÃO ESTÁ LIVRE DE MORRER,,TE DEIXO UM CONSELHO BOCA FECHADA NÃO ENTRA MOSCA,, NÃO SAIA CONTANDO VIDA DE NINGUÉM PRA NINGUÉM,O QUE FAZ OU DEIXA DE FAZER,,', 'textOriginal': 'BABÁ MUDA DE EST, NÃO FICA AÍ PORQUE VÃO TE MATAR,,VAI EMBORA DESSE LUGAR,,VC NÃO ESTÁ LIVRE DE MORRER,,TE DEIXO UM CONSELHO BOCA FECHADA NÃO ENTRA MOSCA,, NÃO SAIA CONTANDO VIDA DE NINGUÉM PRA NINGUÉM,O QUE FAZ OU DEIXA DE FAZER,,', 'authorDisplayName': 'Zenia Ferreira', 'authorProfileImageUrl': 'https://yt3.ggpht.com/ytc/AGIKgqPM4MAJCRWpND4QmmGKR8v-lf4rcMIPma3Tnw=s48-c-k-c0x00ffffff-no-rj', 'authorChannelUrl': 'http://www.youtube.com/channel/UCPuEMd42UULaW7ksCgpuCqQ', 'authorChannelId': {'value': 'UCPuEMd42UULaW7ksCgpuCqQ'}, 'canRate': True, 'viewerRating': 'none', 'likeCount': 0, 'publishedAt': '2022-10-12T12:35:34Z', 'updatedAt': '2022-10-12T12:35:34Z'}}, 'canReply': True, 'totalReplyCount': 0, 'isPublic': True}",,UCPuEMd42UULaW7ksCgpuCqQ,2022-10-12T12:35:34Z,"BABÁ MUDA DE EST, NÃO FICA AÍ PORQUE VÃO TE MATAR,,VAI EMBORA DESSE LUGAR,,VC NÃO ESTÁ LIVRE DE MORRER,,TE DEIXO UM CONSELHO BOCA FECHADA NÃO ENTRA MOSCA,, NÃO SAIA CONTANDO VIDA DE NINGUÉM PRA NINGUÉM,O QUE FAZ OU DEIXA DE FAZER,,",,2023-06-09 13:19:50.942888
youtube#commentThread,qgSaMyhynAufqoG_INrkhnNW6ig,UgzoMPT1XvSdEV6kQTd4AaABAg,"{'videoId': 'Sv7ImcwXZZk', 'topLevelComment': {'kind': 'youtube#comment', 'etag': 'wGT0SuzWm5GE5RoMm8AeyuT2Y7I', 'id': 'UgzoMPT1XvSdEV6kQTd4AaABAg', 'snippet': {'videoId': 'Sv7ImcwXZZk', 'textDisplay': 'Pode ter serteza  eles vai mata ele a polícia  despreparado não  podia ter colocado a babá nas redes sociais  políciais  despreparado agora  a babá pode ser morta  a qualquer  momento pelos bandidos', 'textOriginal': 'Pode ter serteza  eles vai mata ele a polícia  despreparado não  podia ter colocado a babá nas redes sociais  políciais  despreparado agora  a babá pode ser morta  a qualquer  momento pelos bandidos', 'authorDisplayName': 'Valmir Tavares', 'authorProfileImageUrl': 'https://yt3.ggpht.com/ytc/AGIKgqPN1FnkuODgo5FYlGo93lRNNgykFFaJ1ZrhUA=s48-c-k-c0x00ffffff-no-rj', 'authorChannelUrl': 'http://www.youtube.com/channel/UCaXxWDVFL5kTryQsVPfglpA', 'authorChannelId': {'value': 'UCaXxWDVFL5kTryQsVPfglpA'}, 'canRate': True, 'viewerRating': 'none', 'likeCount': 1, 'publishedAt': '2022-10-12T12:33:55Z', 'updatedAt': '2022-10-12T12:33:55Z'}}, 'canReply': True, 'totalReplyCount': 0, 'isPublic': True}",,UCaXxWDVFL5kTryQsVPfglpA,2022-10-12T12:33:55Z,Pode ter serteza  eles vai mata ele a polícia  despreparado não  podia ter colocado a babá nas redes sociais  políciais  despreparado agora  a babá pode ser morta  a qualquer  momento pelos bandidos,,2023-06-09 13:19:50.942888
youtube#commentThread,6UmfjDJVhv08Jf4mRPyDPcuPUVI,UgySopTeZVmdEGwICF54AaABAg,"{'videoId': 'Sv7ImcwXZZk', 'topLevelComment': {'kind': 'youtube#comment', 'etag': '8LqOdaD71qCWgVdwWNU9juTejYc', 'id': 'UgySopTeZVmdEGwICF54AaABAg', 'snippet': {'videoId': 'Sv7ImcwXZZk', 'textDisplay': 'Parabéns casal 👏🏽', 'textOriginal': 'Parabéns casal 👏🏽', 'authorDisplayName': 'Celso Daniel', 'authorProfileImageUrl': 'https://yt3.ggpht.com/d2n06C9A7OysqoVkCdfrhkcxFGf4sqFI7cGt4xRtQvy9ngZq0eCj5Mk4oymiPx6w4aDRVhK4Vg=s48-c-k-c0x00ffffff-no-rj', 'authorChannelUrl': 'http://www.youtube.com/channel/UCAanDyJmTCKtiVWJmiDOLUg', 'authorChannelId': {'value': 'UCAanDyJmTCKtiVWJmiDOLUg'}, 'canRate': True, 'viewerRating': 'none', 'likeCount': 4, 'publishedAt': '2022-10-12T12:33:23Z', 'updatedAt': '2022-10-12T12:33:23Z'}}, 'canReply': True, 'totalReplyCount': 3, 'isPublic': True}","{'comments': [{'kind': 'youtube#comment', 'etag': 'TPXOaDmKS3aPHC2du-_k5monmfE', 'id': 'UgySopTeZVmdEGwICF54AaABAg.9h4n1ZjuFBw9h5udbr2nnm', 'snippet': {'videoId': 'Sv7ImcwXZZk', 'textDisplay': 'Com todo seu apoio meu amor.', 'textOriginal': 'Com todo seu apoio meu amor.', 'parentId': 'UgySopTeZVmdEGwICF54AaABAg', 'authorDisplayName': 'Kalikov da Silva', 'authorProfileImageUrl': 'https://yt3.ggpht.com/ytc/AGIKgqOcDQhSbfNwOZXRy2IhbKUyEZpjvgi9qStq0doa61Y=s48-c-k-c0x00ffffff-no-rj', 'authorChannelUrl': 'http://www.youtube.com/channel/UCLAhxZcR-c74U_XfxoX5DSQ', 'authorChannelId': {'value': 'UCLAhxZcR-c74U_XfxoX5DSQ'}, 'canRate': True, 'viewerRating': 'none', 'likeCount': 0, 'publishedAt': '2022-10-12T22:59:07Z', 'updatedAt': '2022-10-12T22:59:07Z'}}, {'kind': 'youtube#comment', 'etag': 'gr2NFnCqNUfSVXR_LULGYg3p6ZU', 'id': 'UgySopTeZVmdEGwICF54AaABAg.9h4n1ZjuFBw9h53q0uIUST', 'snippet': {'videoId': 'Sv7ImcwXZZk', 'textDisplay': 'Sai daqui fake. Vc ñ é Lula', 'textOriginal': 'Sai daqui fake. Vc ñ é Lula', 'parentId': 'UgySopTeZVmdEGwICF54AaABAg', 'authorDisplayName': 'GCM SOARES', 'authorProfileImageUrl': 'https://yt3.ggpht.com/mdJl2oXAI2k10ePe1TcMjHKxUho4gVHoM7GRAaLFVGlikeKIgg4qth0ClVQONtBJ3pETyATbhg=s48-c-k-c0x00ffffff-no-rj', 'authorChannelUrl': 'http://www.youtube.com/channel/UCZSdcOJ9xgSam-v3ZWIjBeQ', 'authorChannelId': {'value': 'UCZSdcOJ9xgSam-v3ZWIjBeQ'}, 'canRate': True, 'viewerRating': 'none', 'likeCount': 0, 'publishedAt': '2022-10-12T15:08:57Z', 'updatedAt': '2022-10-12T15:08:57Z'}}, {'kind': 'youtube#comment', 'etag': '2FQQudUWDuxDUc2c6pNWeN2bjgY', 'id': 'UgySopTeZVmdEGwICF54AaABAg.9h4n1ZjuFBw9h4w_RRFkKw', 'snippet': {'videoId': 'Sv7ImcwXZZk', 'textDisplay': 'ladrão', 'textOriginal': 'ladrão', 'parentId': 'UgySopTeZVmdEGwICF54AaABAg', 'authorDisplayName': 'Waldiner Moutinho', 'authorProfileImageUrl': 'https://yt3.ggpht.com/ytc/AGIKgqN4LZU79tgskm76NfpmxRW2Ucqiy2iP7LJNICsEhX4=s48-c-k-c0x00ffffff-no-rj', 'authorChannelUrl': 'http://www.youtube.com/channel/UCcCqQrM3k96fy4UAr1C0dsw', 'authorChannelId': {'value': 'UCcCqQrM3k96fy4UAr1C0dsw'}, 'canRate': True, 'viewerRating': 'none', 'likeCount': 0, 'publishedAt': '2022-10-12T13:56:47Z', 'updatedAt': '2022-10-12T13:56:47Z'}}]}",UCAanDyJmTCKtiVWJmiDOLUg,2022-10-12T12:33:23Z,Parabéns casal 👏🏽,,2023-06-09 13:19:50.942888
