kind,etag,id,snippet,replies,authorChannelId,publishedAt,textOriginal,nextPageToken,extraction_date
youtube#commentThread,P-F7Buj5gxpsVW47MohqIjwuPGQ,UgxpVv7V2EZR_L2NZVN4AaABAg,"{'videoId': 'Sv7ImcwXZZk', 'topLevelComment': {'kind': 'youtube#comment', 'etag': 'Ej8kNEgqOB3BoKapmio6HuzIhPw', 'id': 'UgxpVv7V2EZR_L2NZVN4AaABAg', 'snippet': {'videoId': 'Sv7ImcwXZZk', 'textDisplay': 'Bando di bandidos assassino cadeia neles', 'textOriginal': 'Bando di bandidos assassino cadeia neles', 'authorDisplayName': 'Izabel Navarro', 'authorProfileImageUrl': 'https://yt3.ggpht.com/ytc/AGIKgqMzi0n55X8xLGm5ieZealsSOkeUr41xr4Ex0yk-dw=s48-c-k-c0x00ffffff-no-rj', 'authorChannelUrl': 'http://www.youtube.com/channel/UCkKAgxeCQssCm2ZDAB2gzIw', 'authorChannelId': {'value': 'UCkKAgxeCQssCm2ZDAB2gzIw'}, 'canRate': True, 'viewerRating': 'none', 'likeCount': 0, 'publishedAt': '2022-10-12T21:08:56Z', 'updatedAt': '2022-10-12T21:08:56Z'}}, 'canReply': True, 'totalReplyCount': 0, 'isPublic': True}",,UCkKAgxeCQssCm2ZDAB2gzIw,2022-10-12T21:08:56Z,Bando di bandidos assassino cadeia neles,,2023-06-09 13:19:50.942888
youtube#commentThread,vSs_5BRA9JTLkErjEckSaRaNKBs,UgxVur4UprzMDA9-ypd4AaABAg,"{'videoId': 'Sv7ImcwXZZk', 'topLevelComment': {'kind': 'youtube#comment', 'etag': 'oJt8p9uHE2XCK2gagAdxj9fqR6s', 'id': 'UgxVur4UprzMDA9-ypd4AaABAg', 'snippet': {'videoId': 'Sv7ImcwXZZk', 'textDisplay': 'Infelizmente a babá tá fora de perigo por enquanto ela que se cuide.', 'textOriginal': 'Infelizmente a babá tá fora de perigo por enquanto ela que se cuide.', 'authorDisplayName': 'Rosi Alves', 'authorProfileImageUrl': 'https://yt3.ggpht.com/ytc/AGIKgqOsB1CoT2D04qGUAMTsD2cXsAQsVP1ZqAOpvYOQ=s48-c-k-c0x00ffffff-no-rj', 'authorChannelUrl': 'http://www.youtube.com/channel/UCeDJJgKHFTo08eKrU9h9sfw', 'authorChannelId': {'value': 'UCeDJJgKHFTo08eKrU9h9sfw'}, 'canRate': True, 'viewerRating': 'none', 'likeCount': 4, 'publishedAt': '2022-10-12T20:02:28Z', 'updatedAt': '2022-10-12T20:02:28Z'}}, 'canReply': True, 'totalReplyCount': 0, 'isPublic': True}",,UCeDJJgKHFTo08eKrU9h9sfw,2022-10-12T20:02:28Z,Infelizmente a babá tá fora de perigo por enquanto ela que se cuide.,,2023-06-09 13:19:50.942888
youtube#commentThread,qWoEnPrSX76_S14gG--gVAtZGhw,UgzTfe-RHDWU7DL715h4AaABAg,"{'videoId': 'Sv7ImcwXZZk', 'topLevelComment': {'kind': 'youtube#comment', 'etag': 'cA9lAA48ePn22hKERgTub2Ozxqc', 'id': 'UgzTfe-RHDWU7DL715h4AaABAg', 'snippet': {'videoId': 'Sv7ImcwXZZk', 'textDisplay': 'Os patrôes exigem referências dos empregados, corretissimo.<br>Os empregados também tem que investigar aos poucos seus patroes. Tem muito &quot;cabra safado&quot; se passando por patrôes.', 'textOriginal': 'Os patrôes exigem referências dos empregados, corretissimo.\\nOs empregados também tem que investigar aos poucos seus patroes. Tem muito ""cabra safado"" se passando por patrôes.', 'authorDisplayName': 'Hilda Amancio Karlsson', 'authorProfileImageUrl': 'https://yt3.ggpht.com/ytc/AGIKgqOOdctqrMN9FL7M3t5qXzivL7V8ieipFIvGmg=s48-c-k-c0x00ffffff-no-rj', 'authorChannelUrl': 'http://www.youtube.com/channel/UC8ZhujwpUZaVnAd4TXsDghw', 'authorChannelId': {'value': 'UC8ZhujwpUZaVnAd4TXsDghw'}, 'canRate': True, 'viewerRating': 'none', 'likeCount': 1, 'publishedAt': '2022-10-12T19:50:52Z', 'updatedAt': '2022-10-12T19:50:52Z'}}, 'canReply': True, 'totalReplyCount': 0, 'isPublic': True}",,UC8ZhujwpUZaVnAd4TXsDghw,2022-10-12T19:50:52Z,"Os patrôes exigem referências dos empregados, corretissimo.
Os empregados também tem que investigar aos poucos seus patroes. Tem muito ""cabra safado"" se passando por patrôes.",,2023-06-09 13:19:50.942888
youtube#commentThread,8gjHSYJEEakfxnN7LfnK5gGrweE,UgzXV8v5brGGLWBmzlZ4AaABAg,"{'videoId': 'Sv7ImcwXZZk', 'topLevelComment': {'kind': 'youtube#comment', 'etag': 'wAkOlUCTy1vQR-W5gkoLIriJDDE', 'id': 'UgzXV8v5brGGLWBmzlZ4AaABAg', 'snippet': {'videoId': 'Sv7ImcwXZZk', 'textDisplay': 'Quando o lula ganha eles vão estar soltos porque são vítimas da sociedade, tadinhos...', 'textOriginal': 'Quando o lula ganha eles vão estar soltos porque são vítimas da sociedade, tadinhos...', 'authorDisplayName': 'Em Geral', 'authorProfileImageUrl': 'https://yt3.ggpht.com/ytc/AGIKgqM6oGoKQ4XiRx7-y0FefGgq7K3wfbPKTceWzA=s48-c-k-c0x00ffffff-no-rj', 'authorChannelUrl': 'http://www.youtube.com/channel/UCDbuXRIvdxniQhIayi_B0TQ', 'authorChannelId': {'value': 'UCDbuXRIvdxniQhIayi_B0TQ'}, 'canRate': True, 'viewerRating': 'none', 'likeCount': 1, 'publishedAt': '2022-10-12T19:24:54Z', 'updatedAt': '2022-10-12T19:24:54Z'}}, 'canReply': True, 'totalReplyCount': 0, 'isPublic': True}",,UCDbuXRIvdxniQhIayi_B0TQ,2022-10-12T19:24:54Z,"Quando o lula ganha eles vão estar soltos porque são vítimas da sociedade, tadinhos...",,2023-06-09 13:19:50.942888
youtube#commentThread,VcvCq4zLXr9H3gB0I1eU8SdUqww,Ugw1e-MqWRHtf0VY7Ad4AaABAg,"{'videoId': 'Sv7ImcwXZZk', 'topLevelComment': {'kind': 'youtube#comment', 'etag': 'n2oNHmNpyc18Cu1GG7rJ9dGjjQI', 'id': 'Ugw1e-MqWRHtf0VY7Ad4AaABAg', 'snippet': {'videoId': 'Sv7ImcwXZZk', 'textDisplay': 'Já pensou<br>Muito cuidado em quem vai votar', 'textOriginal': 'Já pensou\\nMuito cuidado em quem vai votar', 'authorDisplayName': 'Eduardo Franca', 'authorProfileImageUrl': 'https://yt3.ggpht.com/ytc/AGIKgqMsslJeMP1KBtC_fPsBhgt26pPZl0i3SAlRZH4s=s48-c-k-c0x00ffffff-no-rj', 'authorChannelUrl': 'http://www.youtube.com/channel/UCWmIEwiT3SQAW5TsyTN3-nw', 'authorChannelId': {'value': 'UCWmIEwiT3SQAW5TsyTN3-nw'}, 'canRate': True, 'viewerRating': 'none', 'likeCount': 0, 'publishedAt': '2022-10-12T18:51:55Z', 'updatedAt': '2022-10-12T18:51:55Z'}}, 'canReply': True, 'totalReplyCount': 0, 'isPublic': True}",,UCWmIEwiT3SQAW5TsyTN3-nw,2022-10-12T18:51:55Z,"Já pensou
Muito cuidado em quem vai votar",,2023-06-09 13:19:50.942888
youtube#commentThread,lqr7v5sIFVq9v_gVXe4IaOucZJM,UgwWVMhRKzgzKwVbQtR4AaABAg,"{'videoId': 'Sv7ImcwXZZk', 'topLevelComment': {'kind': 'youtube#comment', 'etag': '3Ey8H7Ep84Iqo6EIGD7-ULYweBM', 'id': 'UgwWVMhRKzgzKwVbQtR4AaABAg', 'snippet': {'videoId': 'Sv7ImcwXZZk', 'textDisplay': 'Quem e associado a crime organizado deve receber pena exemplar', 'textOriginal': 'Quem e associado a crime organizado deve receber pena exemplar', 'authorDisplayName': 'Jose sandro onilson da silva', 'authorProfileImageUrl': 'https://yt3.ggpht.com/ytc/AGIKgqPdyT0dX9Rhfz_0_5lGrpJVrrZAQSG2k7Z-VSLdfrGzZzJ3O_TmHzplpSk5qd-z=s48-c-k-c0x00ffffff-no-rj', 'authorChannelUrl': 'http://www.youtube.com/channel/UCJFVDnnmfPjqUmNsLYK1-gA', 'authorChannelId': {'value': 'UCJFVDnnmfPjqUmNsLYK1-gA'}, 'canRate': True, 'viewerRating': 'none', 'likeCount': 0, 'publishedAt': '2022-10-12T18:48:31Z', 'updatedAt': '2022-10-12T18:48:31Z'}}, 'canReply': True, 'totalReplyCount': 0, 'isPublic': True}",,UCJFVDnnmfPjqUmNsLYK1-gA,2022-10-12T18:48:31Z,Quem e associado a crime organizado deve receber pena exemplar,,2023-06-09 13:19:50.942888
youtube#commentThread,wxcdDbO9h42ixpGmqlKQItoZujM,UgzSeQarM-_3YjnLQc14AaABAg,"{'videoId': 'Sv7ImcwXZZk', 'topLevelComment': {'kind': 'youtube#comment', 'etag': '6NMzAhkSduCXeVFokSZuV7P6-_0', 'id': 'UgzSeQarM-_3YjnLQc14AaABAg', 'snippet': {'videoId': 'Sv7ImcwXZZk', 'textDisplay': 'essa mulher tem que sumir do mapa porque esses casal ja esta na rua tem dinheiro sai rapido e agora vao matar a baba essa historia se repete', 'textOriginal': 'essa mulher tem que sumir do mapa porque esses casal ja esta na rua tem dinheiro sai rapido e agora vao matar a baba essa historia se repete', 'authorDisplayName': 'BOM NEGOCIO', 'authorProfileImageUrl': 'https://yt3.ggpht.com/ytc/AGIKgqO-ZO10PjWbRYqmjm36pNVN6rAKvVTR67xL1ljB=s48-c-k-c0x00ffffff-no-rj', 'authorChannelUrl': 'http://www.youtube.com/channel/UCQeakPFXYeL9KaPthPp4_bw', 'authorChannelId': {'value': 'UCQeakPFXYeL9KaPthPp4_bw'}, 'canRate': True, 'viewerRating': 'none', 'likeCount': 1, 'publishedAt': '2022-10-12T18:11:38Z', 'updatedAt': '2022-10-12T18:11:38Z'}}, 'canReply': True, 'totalReplyCount': 0, 'isPublic': True}",,UCQeakPFXYeL9KaPthPp4_bw,2022-10-12T18:11:38Z,essa mulher tem que sumir do mapa porque esses casal ja esta na rua tem dinheiro sai rapido e agora vao matar a baba essa historia se repete,,2023-06-09 13:19:50.942888
youtube#commentThread,gOBaL9dMCuINDQah21_E3HKx6VU,Ugx5F3ApOyZW25NjcXF4AaABAg,"{'videoId': 'Sv7ImcwXZZk', 'topLevelComment': {'kind': 'youtube#comment', 'etag': 'LlPPb2hA7Pm97NUIdyVFAL8AYyY', 'id': 'Ugx5F3ApOyZW25NjcXF4AaABAg', 'snippet': {'videoId': 'Sv7ImcwXZZk', 'textDisplay': 'Está jovem e o namorado,continuam correndo risco de morte!  O Estado Precisa da proteção para eles. Os  traficantes soltos vão atrás para vingança do casal de criminosos que estão presos,! .a Impunidade está gerando um exército de criminosos cruéis e psicopatas,! Ninguém está livre de ser a próxima vítima! As leis fracas do Brasil só protegem criminosos!!! polícia prende e justiça solta! Um absurdo!!!', 'textOriginal': 'Está jovem e o namorado,continuam correndo risco de morte!  O Estado Precisa da proteção para eles. Os  traficantes soltos vão atrás para vingança do casal de criminosos que estão presos,! .a Impunidade está gerando um exército de criminosos cruéis e psicopatas,! Ninguém está livre de ser a próxima vítima! As leis fracas do Brasil só protegem criminosos!!! polícia prende e justiça solta! Um absurdo!!!', 'authorDisplayName': 'maria do carmo ramiro da silva', 'authorProfileImageUrl': 'https://yt3.ggpht.com/ytc/AGIKgqMxiaRf5XEmqTbWZbkMyxcdpmYTbnkFUG4SZg=s48-c-k-c0x00ffffff-no-rj', 'authorChannelUrl': 'http://www.youtube.com/channel/UCUKiPXORY-9KYniSQRmU9bg', 'authorChannelId': {'value': 'UCUKiPXORY-9KYniSQRmU9bg'}, 'canRate': True, 'viewerRating': 'none', 'likeCount': 0, 'publishedAt': '2022-10-12T17:49:14Z', 'updatedAt': '2022-10-12T17:49:14Z'}}, 'canReply': True, 'totalReplyCount': 0, 'isPublic': True}",,UCUKiPXORY-9KYniSQRmU9bg,2022-10-12T17:49:14Z,"Está jovem e o namorado,continuam correndo risco de morte!  O Estado Precisa da proteção para eles. Os  traficantes soltos vão atrás para vingança do casal de criminosos que estão presos,! .a Impunidade está gerando um exército de criminosos cruéis e psicopatas,! Ninguém está livre de ser a próxima vítima! As leis fracas do Brasil só protegem criminosos!!! polícia prende e justiça solta! Um absurdo!!!",,2023-06-09 13:19:50.942888
youtube#commentThread,G-PNBjJYgW85v-65XizOcHEG7qQ,UgzZbwyqOUWkW4BAd9x4AaABAg,"{'videoId': 'Sv7ImcwXZZk', 'topLevelComment': {'kind': 'youtube#comment', 'etag': 'x8msAIH_cgnkGNsO0LbUrsTBYRo', 'id': 'UgzZbwyqOUWkW4BAd9x4AaABAg', 'snippet': {'videoId': 'Sv7ImcwXZZk', 'textDisplay': 'ELA TEM QUE FUGIR COM TODA FAMÍLIA', 'textOriginal': 'ELA TEM QUE FUGIR COM TODA FAMÍLIA', 'authorDisplayName': 'MARIA DAS GRAÇAS FERNANDES', 'authorProfileImageUrl': 'https://yt3.ggpht.com/kjOHszi4F5ODy2MeCUTKtBXXP6M-xsorVuwa0GFDGV4w8SjuKxhkNwpDem40J-w9L8jLLllKOQ=s48-c-k-c0x00ffffff-no-rj', 'authorChannelUrl': 'http://www.youtube.com/channel/UCIxNb5Cw_oJVXFxiFrtA9wQ', 'authorChannelId': {'value': 'UCIxNb5Cw_oJVXFxiFrtA9wQ'}, 'canRate': True, 'viewerRating': 'none', 'likeCount': 0, 'publishedAt': '2022-10-12T17:46:08Z', 'updatedAt': '2022-10-12T17:46:08Z'}}, 'canReply': True, 'totalReplyCount': 0, 'isPublic': True}",,UCIxNb5Cw_oJVXFxiFrtA9wQ,2022-10-12T17:46:08Z,ELA TEM QUE FUGIR COM TODA FAMÍLIA,,2023-06-09 13:19:50.942888
youtube#commentThread,6gtGv2qcJIiQoEvpf8XuriOp72A,UgyqbIXBvL9_3MVBRJR4AaABAg,"{'videoId': 'Sv7ImcwXZZk', 'topLevelComment': {'kind': 'youtube#comment', 'etag': 'WplDoB6BYHZoI3nP_eIrObvYJFw', 'id': 'UgyqbIXBvL9_3MVBRJR4AaABAg', 'snippet': {'videoId': 'Sv7ImcwXZZk', 'textDisplay': 'Tem que  ficar calado', 'textOriginal': 'Tem que  ficar calado', 'authorDisplayName': 'Cícero José', 'authorProfileImageUrl': 'https://yt3.ggpht.com/AZHcHbLidgQhNV1ibQJeVNR1z84N5CFZ_4O85vj5V5cYMXu_tI3KpLG2eFBKLB19FtkRyU89=s48-c-k-c0x00ffffff-no-rj', 'authorChannelUrl': 'http://www.youtube.com/channel/UCz3GTLUCBvMsE0nVu643bgw', 'authorChannelId': {'value': 'UCz3GTLUCBvMsE0nVu643bgw'}, 'canRate': True, 'viewerRating': 'none', 'likeCount': 0, 'publishedAt': '2022-10-12T17:29:19Z', 'updatedAt': '2022-10-12T17:29:19Z'}}, 'canReply': True, 'totalReplyCount': 0, 'isPublic': True}",,UCz3GTLUCBvMsE0nVu643bgw,2022-10-12T17:29:19Z,Tem que  ficar calado,,2023-06-09 13:19:50.942888
youtube#commentThread,3l_9P2B8XIzTD5GZ2ks7VCoNT8w,UgwDlZ9gR_QME3VRO-94AaABAg,"{'videoId': 'Sv7ImcwXZZk', 'topLevelComment': {'kind': 'youtube#comment', 'etag': 'RUX9hJ3dQQ1SnxaPHzHFCgUSD9A', 'id': 'UgwDlZ9gR_QME3VRO-94AaABAg', 'snippet': {'videoId': 'Sv7ImcwXZZk', 'textDisplay': 'É complicado a moça sabe como é que funciona o sistema e vai tá mandando mensagem falando que o cara mexe com droga é traficante mexer com facção bota a família toda em risco', 'textOriginal': 'É complicado a moça sabe como é que funciona o sistema e vai tá mandando mensagem falando que o cara mexe com droga é traficante mexer com facção bota a família toda em risco', 'authorDisplayName': 'Ronaldo Brito', 'authorProfileImageUrl': 'https://yt3.ggpht.com/ytc/AGIKgqOouEPHYTQqSsyIT6FxZZsSb2AHEBMjmwrXVOWc_YjKF6Ez0oELMF6kdtrw4O8h=s48-c-k-c0x00ffffff-no-rj', 'authorChannelUrl': 'http://www.youtube.com/channel/UCK8d2O0IGz7iZYjNpazdKQw', 'authorChannelId': {'value': 'UCK8d2O0IGz7iZYjNpazdKQw'}, 'canRate': True, 'viewerRating': 'none', 'likeCount': 5, 'publishedAt': '2022-10-12T17:23:19Z', 'updatedAt': '2022-10-12T17:23:19Z'}}, 'canReply': True, 'totalReplyCount': 0, 'isPublic': True}",,UCK8d2O0IGz7iZYjNpazdKQw,2022-10-12T17:23:19Z,É complicado a moça sabe como é que funciona o sistema e vai tá mandando mensagem falando que o cara mexe com droga é traficante mexer com facção bota a família toda em risco,,2023-06-09 13:19:50.942888
youtube#commentThread,HYw1u8qsfXMxSlbpcu_A2XUKNqY,UgykPfX6t6jtDp7wFVV4AaABAg,"{'videoId': 'Sv7ImcwXZZk', 'topLevelComment': {'kind': 'youtube#comment', 'etag': 'fYLrMaRiAxkTHfB3nowT0TLrcaY', 'id': 'UgykPfX6t6jtDp7wFVV4AaABAg', 'snippet': {'videoId': 'Sv7ImcwXZZk', 'textDisplay': 'Coitada', 'textOriginal': 'Coitada', 'authorDisplayName': 'Kelly Souza', 'authorProfileImageUrl': 'https://yt3.ggpht.com/ytc/AGIKgqO_-VvQeo8rs0CfjKOAqLnQCKXffrsf-bSg1g=s48-c-k-c0x00ffffff-no-rj', 'authorChannelUrl': 'http://www.youtube.com/channel/UCz4tbAHaPzf6X9dQdtd4Mzg', 'authorChannelId': {'value': 'UCz4tbAHaPzf6X9dQdtd4Mzg'}, 'canRate': True, 'viewerRating': 'none', 'likeCount': 0, 'publishedAt': '2022-10-12T17:12:55Z', 'updatedAt': '2022-10-12T17:12:55Z'}}, 'canReply': True, 'totalReplyCount': 0, 'isPublic': True}",,UCz4tbAHaPzf6X9dQdtd4Mzg,2022-10-12T17:12:55Z,Coitada,,2023-06-09 13:19:50.942888
youtube#commentThread,OTQEI8-FEiHNb_XZEJpuu7GK3IA,UgzZAHKFvKAKxaBlAWt4AaABAg,"{'videoId': 'Sv7ImcwXZZk', 'topLevelComment': {'kind': 'youtube#comment', 'etag': 'YkCiNqv6ClKOFB_9iqiTe6Rsx0A', 'id': 'UgzZAHKFvKAKxaBlAWt4AaABAg', 'snippet': {'videoId': 'Sv7ImcwXZZk', 'textDisplay': 'pensem bem na hora de votar, o Lula ladrão é sua quadrilha vai dar vida boa para esses ba**idos.. desencarcerar geral... cuidado. dia 30 é 22', 'textOriginal': 'pensem bem na hora de votar, o Lula ladrão é sua quadrilha vai dar vida boa para esses ba**idos.. desencarcerar geral... cuidado. dia 30 é 22', 'authorDisplayName': 'Assis J.', 'authorProfileImageUrl': 'https://yt3.ggpht.com/LNe8hEeRImVn6au-iIYiYB40AkmIeNusH9PNvd-pqaOClWd7BD4iIOF02OJSNIzMwjYvQ0jRkw=s48-c-k-c0x00ffffff-no-rj', 'authorChannelUrl': 'http://www.youtube.com/channel/UCvRGidXgB_OoF91ucCQDlcA', 'authorChannelId': {'value': 'UCvRGidXgB_OoF91ucCQDlcA'}, 'canRate': True, 'viewerRating': 'none', 'likeCount': 0, 'publishedAt': '2022-10-12T17:03:01Z', 'updatedAt': '2022-10-12T17:03:01Z'}}, 'canReply': True, 'totalReplyCount': 0, 'isPublic': True}",,UCvRGidXgB_OoF91ucCQDlcA,2022-10-12T17:03:01Z,"pensem bem na hora de votar, o Lula ladrão é sua quadrilha vai dar vida boa para esses ba**idos.. desencarcerar geral... cuidado. dia 30 é 22",,2023-06-09 13:19:50.942888
youtube#commentThread,T_--c8HlsFaWu8AmDiD78U1Wy8E,UgzMlTUzGn8TzWcKpF54AaABAg,"{'videoId': 'Sv7ImcwXZZk', 'topLevelComment': {'kind': 'youtube#comment', 'etag': 'Yc7sGBMezc6Z-6YrPcPhNa1IJYM', 'id': 'UgzMlTUzGn8TzWcKpF54AaABAg', 'snippet': {'videoId': 'Sv7ImcwXZZk', 'textDisplay': 'Essa moça inocente', 'textOriginal': 'Essa moça inocente', 'authorDisplayName': 'Rosália Alves', 'authorProfileImageUrl': 'https://yt3.ggpht.com/Ww_A-2DDPZ--QeQnU2yjGCiS-ac_a3WHxMRrqU2EsyEwzwPgsx8s0gkjusRUVgACvmerjCTT=s48-c-k-c0x00ffffff-no-rj', 'authorChannelUrl': 'http://www.youtube.com/channel/UCn9iUAFx4Rzl6KzVhhdFwxQ', 'authorChannelId': {'value': 'UCn9iUAFx4Rzl6KzVhhdFwxQ'}, 'canRate': True, 'viewerRating': 'none', 'likeCount': 0, 'publishedAt': '2022-10-12T16:38:53Z', 'updatedAt': '2022-10-12T16:38:53Z'}}, 'canReply': True, 'totalReplyCount': 0, 'isPublic': True}",,UCn9iUAFx4Rzl6KzVhhdFwxQ,2022-10-12T16:38:53Z,Essa moça inocente,,2023-06-09 13:19:50.942888
youtube#commentThread,UaHmZuF5ajxFU3tLjA06Yj4HvNU,UgwQ8uOUvTjSNJ5SAQp4AaABAg,"{'videoId': 'Sv7ImcwXZZk', 'topLevelComment': {'kind': 'youtube#comment', 'etag': 'ATGyzM3-D_cgTttQ6x70NvqwdhE', 'id': 'UgwQ8uOUvTjSNJ5SAQp4AaABAg', 'snippet': {'videoId': 'Sv7ImcwXZZk', 'textDisplay': 'Cadeia pra esses bandidos vagabundos do inferno 🤬🤬🤬🤬', 'textOriginal': 'Cadeia pra esses bandidos vagabundos do inferno 🤬🤬🤬🤬', 'authorDisplayName': 'FutGame', 'authorProfileImageUrl': 'https://yt3.ggpht.com/d4ePE8gBOH7DNiz6NRr0jwdr5CZHrRKZqR_1oICUjxCa4uHgdPGe5hLzkZ0eQ7DTgbzvaU74=s48-c-k-c0x00ffffff-no-rj', 'authorChannelUrl': 'http://www.youtube.com/channel/UCvYNWpFibOGbo9nxnBMVcng', 'authorChannelId': {'value': 'UCvYNWpFibOGbo9nxnBMVcng'}, 'canRate': True, 'viewerRating': 'none', 'likeCount': 1, 'publishedAt': '2022-10-12T16:22:21Z', 'updatedAt': '2022-10-12T16:22:21Z'}}, 'canReply': True, 'totalReplyCount': 0, 'isPublic': True}",,UCvYNWpFibOGbo9nxnBMVcng,2022-10-12T16:22:21Z,Cadeia pra esses bandidos vagabundos do inferno 🤬🤬🤬🤬,,2023-06-09 13:19:50.942888
youtube#commentThread,u_iRqJAx0fHb2ZA3Nv9E1-Toko8,UgzInnfZSkc2-KenZEZ4AaABAg,"{'videoId': 'Sv7ImcwXZZk', 'topLevelComment': {'kind': 'youtube#comment', 'etag': '3L7BMyMgatuMSbHaLJ5-vqjr2Bk', 'id': 'UgzInnfZSkc2-KenZEZ4AaABAg', 'snippet': {'videoId': 'Sv7ImcwXZZk', 'textDisplay': '“Eu fui na cadeia e disse: vocês vão parar a greve de fome agora, e serão soltos. Eles respeitaram a proposta, foram soltos e foram não sei pra onde” - Lula, falando sobre os responsáveis pelo sequestro de Abílio Diniz.', 'textOriginal': '“Eu fui na cadeia e disse: vocês vão parar a greve de fome agora, e serão soltos. Eles respeitaram a proposta, foram soltos e foram não sei pra onde” - Lula, falando sobre os responsáveis pelo sequestro de Abílio Diniz.', 'authorDisplayName': 'Cristiano', 'authorProfileImageUrl': 'https://yt3.ggpht.com/54R5SK16yoLddAM7WLagRGWGI07hv9hz_Irc7WLhOzdhnEzhTiBRsIDomw6au44k6qmGlqTiww=s48-c-k-c0x00ffffff-no-rj', 'authorChannelUrl': 'http://www.youtube.com/channel/UCvBKxt3rzKCBGr5JuCFW02Q', 'authorChannelId': {'value': 'UCvBKxt3rzKCBGr5JuCFW02Q'}, 'canRate': True, 'viewerRating': 'none', 'likeCount': 12, 'publishedAt': '2022-10-12T16:12:38Z', 'updatedAt': '2022-10-12T16:12:38Z'}}, 'canReply': True, 'totalReplyCount': 1, 'isPublic': True}","{'comments': [{'kind': 'youtube#comment', 'etag': 'ynMkkWVYEGBf4R2kHL2hgcTziM8', 'id': 'UgzInnfZSkc2-KenZEZ4AaABAg.9h5B7Vio00d9h5rEgFNLXE', 'snippet': {'videoId': 'Sv7ImcwXZZk', 'textDisplay': 'Pois é mas com o Bolsonaro bandido não vai ter vez nesse país', 'textOriginal': 'Pois é mas com o Bolsonaro bandido não vai ter vez nesse país', 'parentId': 'UgzInnfZSkc2-KenZEZ4AaABAg', 'authorDisplayName': 'Lilica Li', 'authorProfileImageUrl': 'https://yt3.ggpht.com/ytc/AGIKgqO1VGCZ3imuMch78XxCAZ3ots3VaOMNcgUC5pbg=s48-c-k-c0x00ffffff-no-rj', 'authorChannelUrl': 'http://www.youtube.com/channel/UC4tgZAJyhh2D2RZXX_5q-kw', 'authorChannelId': {'value': 'UC4tgZAJyhh2D2RZXX_5q-kw'}, 'canRate': True, 'viewerRating': 'none', 'likeCount': 0, 'publishedAt': '2022-10-12T22:29:21Z', 'updatedAt': '2022-10-12T22:29:21Z'}}]}",UCvBKxt3rzKCBGr5JuCFW02Q,2022-10-12T16:12:38Z,"“Eu fui na cadeia e disse: vocês vão parar a greve de fome agora, e serão soltos. Eles respeitaram a proposta, foram soltos e foram não sei pra onde” - Lula, falando sobre os responsáveis pelo sequestro de Abílio Diniz.",,2023-06-09 13:19:50.942888
youtube#commentThread,BQs7A5TT-ceSmtxD-al3M4u0_nI,UgxiSJmv2JKZT6wD66l4AaABAg,"{'videoId': 'Sv7ImcwXZZk', 'topLevelComment': {'kind': 'youtube#comment', 'etag': '8AkS5YuWiaK79yn_8HLS98v3boE', 'id': 'UgxiSJmv2JKZT6wD66l4AaABAg', 'snippet': {'videoId': 'Sv7ImcwXZZk', 'textDisplay': 'Agora ela tem que ter muito cuidado, eu mudaria de estado, de nome, de tudo se possível..', 'textOriginal': 'Agora ela tem que ter muito cuidado, eu mudaria de estado, de nome, de tudo se possível..', 'authorDisplayName': 'Angela Santos', 'authorProfileImageUrl': 'https://yt3.ggpht.com/ytc/AGIKgqNeQ7oLJbyhxaajaEY-BxCx6SGvOc4uVR-Qhg=s48-c-k-c0x00ffffff-no-rj', 'authorChannelUrl': 'http://www.youtube.com/channel/UCWHkPnvcQlzkcScTX7r10dg', 'authorChannelId': {'value': 'UCWHkPnvcQlzkcScTX7r10dg'}, 'canRate': True, 'viewerRating': 'none', 'likeCount': 2, 'publishedAt': '2022-10-12T15:49:03Z', 'updatedAt': '2022-10-12T15:49:03Z'}}, 'canReply': True, 'totalReplyCount': 0, 'isPublic': True}",,UCWHkPnvcQlzkcScTX7r10dg,2022-10-12T15:49:03Z,"Agora ela tem que ter muito cuidado, eu mudaria de estado, de nome, de tudo se possível..",,2023-06-09 13:19:50.942888
youtube#commentThread,MJOn7NS17vq9AuUbO31Vd22asiU,UgzMb2OlUoe_GyF85RB4AaABAg,"{'videoId': 'Sv7ImcwXZZk', 'topLevelComment': {'kind': 'youtube#comment', 'etag': 'JITES0R63GtSEWnFvzqZ3i4PRe8', 'id': 'UgzMb2OlUoe_GyF85RB4AaABAg', 'snippet': {'videoId': 'Sv7ImcwXZZk', 'textDisplay': 'Meu Deus', 'textOriginal': 'Meu Deus', 'authorDisplayName': 'Maria Neusa de lima', 'authorProfileImageUrl': 'https://yt3.ggpht.com/ytc/AGIKgqOWzvZSHpEKMtS-hRbpNFHdMD3J6SZCNCYSs8Z97q0=s48-c-k-c0x00ffffff-no-rj', 'authorChannelUrl': 'http://www.youtube.com/channel/UCPNqHTDxf7yDbMcZU21m48g', 'authorChannelId': {'value': 'UCPNqHTDxf7yDbMcZU21m48g'}, 'canRate': True, 'viewerRating': 'none', 'likeCount': 0, 'publishedAt': '2022-10-12T15:32:46Z', 'updatedAt': '2022-10-12T15:32:46Z'}}, 'canReply': True, 'totalReplyCount': 0, 'isPublic': True}",,UCPNqHTDxf7yDbMcZU21m48g,2022-10-12T15:32:46Z,Meu Deus,,2023-06-09 13:19:50.942888
youtube#commentThread,x2r5HtxMezvToJO_B0yG2mf-uJE,UgyJ8Gzd1_dlLR9pfbJ4AaABAg,"{'videoId': 'Sv7ImcwXZZk', 'topLevelComment': {'kind': 'youtube#comment', 'etag': 'h7DpNftF9fOG-I0NKJjKm1Hdl2Q', 'id': 'UgyJ8Gzd1_dlLR9pfbJ4AaABAg', 'snippet': {'videoId': 'Sv7ImcwXZZk', 'textDisplay': 'E 13  ❤❤❤🇧🇷🇧🇷🇧🇷', 'textOriginal': 'E 13  ❤❤❤🇧🇷🇧🇷🇧🇷', 'authorDisplayName': 'Rogelio Silva', 'authorProfileImageUrl': 'https://yt3.ggpht.com/ytc/AGIKgqPv1sdwgs9soJFDe2biqcLSs48N7rCDB4o81Jgjuw=s48-c-k-c0x00ffffff-no-rj', 'authorChannelUrl': 'http://www.youtube.com/channel/UCwvhQ1GOdDD5kw0KzV9J9Ag', 'authorChannelId': {'value': 'UCwvhQ1GOdDD5kw0KzV9J9Ag'}, 'canRate': True, 'viewerRating': 'none', 'likeCount': 0, 'publishedAt': '2022-10-12T15:26:49Z', 'updatedAt': '2022-10-12T15:26:49Z'}}, 'canReply': True, 'totalReplyCount': 0, 'isPublic': True}",,UCwvhQ1GOdDD5kw0KzV9J9Ag,2022-10-12T15:26:49Z,E 13  ❤❤❤🇧🇷🇧🇷🇧🇷,,2023-06-09 13:19:50.942888
youtube#commentThread,bEjWzORW9yDMdhME50cmHldFYM8,UgxU1EqwD5mBdXfk3Hh4AaABAg,"{'videoId': 'Sv7ImcwXZZk', 'topLevelComment': {'kind': 'youtube#comment', 'etag': 'nEpzED0urc1kQy1okflYthV2Nt0', 'id': 'UgxU1EqwD5mBdXfk3Hh4AaABAg', 'snippet': {'videoId': 'Sv7ImcwXZZk', 'textDisplay': 'Quem vê cara não sabe dad intenções.<br>Este mundo tá impossivel.', 'textOriginal': 'Quem vê cara não sabe dad intenções.\\nEste mundo tá impossivel.', 'authorDisplayName': 'Sarah Gomes', 'authorProfileImageUrl': 'https://yt3.ggpht.com/sELVJRbpl00WjgWDN_xyZitpaHfGzqqIZuR-IxQiBXKceltCnhbYKihKGMyuEPbbmTptBFYbNA=s48-c-k-c0x00ffffff-no-rj', 'authorChannelUrl': 'http://www.youtube.com/channel/UC3up8zsBS2Dtq_kepuW-ZLg', 'authorChannelId': {'value': 'UC3up8zsBS2Dtq_kepuW-ZLg'}, 'canRate': True, 'viewerRating': 'none', 'likeCount': 3, 'publishedAt': '2022-10-12T15:24:19Z', 'updatedAt': '2022-10-12T15:24:19Z'}}, 'canReply': True, 'totalReplyCount': 0, 'isPublic': True}",,UC3up8zsBS2Dtq_kepuW-ZLg,2022-10-12T15:24:19Z,"Quem vê cara não sabe dad intenções.
Este mundo tá impossivel.",,2023-06-09 13:19:50.942888
youtube#commentThread,xogx7QBHiq-5IHfytZ74gREK2QU,UgxatPX_ZgkaiygKUKF4AaABAg,"{'videoId': 'Sv7ImcwXZZk', 'topLevelComment': {'kind': 'youtube#comment', 'etag': 'Cszyzz5kAzqYaW1bCu8NxDlUD6I', 'id': 'UgxatPX_ZgkaiygKUKF4AaABAg', 'snippet': {'videoId': 'Sv7ImcwXZZk', 'textDisplay': 'Tarcísio você sendo eleito ponha a PM de SP pra cima desses meliantes', 'textOriginal': 'Tarcísio você sendo eleito ponha a PM de SP pra cima desses meliantes', 'authorDisplayName': 'francisco delier delier', 'authorProfileImageUrl': 'https://yt3.ggpht.com/ytc/AGIKgqMXGszU63Y_AO4EgF9KGLXqW4uWqconq__bsnVe=s48-c-k-c0x00ffffff-no-rj', 'authorChannelUrl': 'http://www.youtube.com/channel/UC7nwkJK5ghxKGFfIMIKA9QQ', 'authorChannelId': {'value': 'UC7nwkJK5ghxKGFfIMIKA9QQ'}, 'canRate': True, 'viewerRating': 'none', 'likeCount': 3, 'publishedAt': '2022-10-12T15:17:02Z', 'updatedAt': '2022-10-12T15:17:02Z'}}, 'canReply': True, 'totalReplyCount': 0, 'isPublic': True}",,UC7nwkJK5ghxKGFfIMIKA9QQ,2022-10-12T15:17:02Z,Tarcísio você sendo eleito ponha a PM de SP pra cima desses meliantes,,2023-06-09 13:19:50.942888
