kind,etag,id,snippet,replies,authorChannelId,publishedAt,textOriginal,nextPageToken,extraction_date
youtube#commentThread,nyWws5azX_g5-xbuPGMJVXvtKbc,UgxT7bjtqhDAtWIOrXF4AaABAg,"{'videoId': 'rlVAATqbf_I', 'topLevelComment': {'kind': 'youtube#comment', 'etag': 'xspkZT7XLSO1C06Pwe0spc1ruFA', 'id': 'UgxT7bjtqhDAtWIOrXF4AaABAg', 'snippet': {'videoId': 'rlVAATqbf_I', 'textDisplay': 'Notícia pela metade', 'textOriginal': 'Notícia pela metade', 'authorDisplayName': 'Elisangela Silva', 'authorProfileImageUrl': 'https://yt3.ggpht.com/ytc/AGIKgqPUAXkTGKPOGxU2IjtepSRlqbIp_-morjNR0CRiN0s=s48-c-k-c0x00ffffff-no-rj', 'authorChannelUrl': 'http://www.youtube.com/channel/UCXuKpWN0QcsQ7czd79M0DuA', 'authorChannelId': {'value': 'UCXuKpWN0QcsQ7czd79M0DuA'}, 'canRate': True, 'viewerRating': 'none', 'likeCount': 0, 'publishedAt': '2022-10-27T11:16:52Z', 'updatedAt': '2022-10-27T11:16:52Z'}}, 'canReply': True, 'totalReplyCount': 0, 'isPublic': True}",,UCXuKpWN0QcsQ7czd79M0DuA,2022-10-27T11:16:52Z,Notícia pela metade,,2023-06-09 12:59:23.941339
youtube#commentThread,N4mHFbhkTKKHeTLTSP2SuYGYMB0,UgwPb5NUgSmjRoV7dEV4AaABAg,"{'videoId': 'rlVAATqbf_I', 'topLevelComment': {'kind': 'youtube#comment', 'etag': 'R2DbkQmSFX-UA-kZq2hhuQtTxco', 'id': 'UgwPb5NUgSmjRoV7dEV4AaABAg', 'snippet': {'videoId': 'rlVAATqbf_I', 'textDisplay': 'Boa tarde tudo bem eu gostei de assistir', 'textOriginal': 'Boa tarde tudo bem eu gostei de assistir', 'authorDisplayName': 'Osmar Rocha', 'authorProfileImageUrl': 'https://yt3.ggpht.com/ytc/AGIKgqMs7aWNkoqsBFEGKj478YPVoRKF6YxaZKd_cvJv5GcwVJ7wP1zpddYijRVeBuon=s48-c-k-c0x00ffffff-no-rj', 'authorChannelUrl': 'http://www.youtube.com/channel/UCMxcmVH0iRIIxG1lhp76hyQ', 'authorChannelId': {'value': 'UCMxcmVH0iRIIxG1lhp76hyQ'}, 'canRate': True, 'viewerRating': 'none', 'likeCount': 2, 'publishedAt': '2022-10-25T16:36:58Z', 'updatedAt': '2022-10-25T16:36:58Z'}}, 'canReply': True, 'totalReplyCount': 0, 'isPublic': True}",,UCMxcmVH0iRIIxG1lhp76hyQ,2022-10-25T16:36:58Z,Boa tarde tudo bem eu gostei de assistir,,2023-06-09 12:59:23.941339
youtube#commentThread,VeY3MmkwpR4Zo8eJWxNspn6F72Y,Ugw2TvFyPht9n8LzY714AaABAg,"{'videoId': 'rlVAATqbf_I', 'topLevelComment': {'kind': 'youtube#comment', 'etag': '0P_-g_J1w6P3gkCOyGSDevNJMX0', 'id': 'Ugw2TvFyPht9n8LzY714AaABAg', 'snippet': {'videoId': 'rlVAATqbf_I', 'textDisplay': 'Amandinha sempre tão fofa', 'textOriginal': 'Amandinha sempre tão fofa', 'authorDisplayName': 'Dan Souza', 'authorProfileImageUrl': 'https://yt3.ggpht.com/izSDeINzymOOavG0A5CgD2W5Tmb2KfVLABCx9qiCt5Dl2f8FsMe9ZbwDILzoNyb87QGPgHrOsQ=s48-c-k-c0x00ffffff-no-rj', 'authorChannelUrl': 'http://www.youtube.com/channel/UCiwAY_PbuXO0vitVqw5H9kQ', 'authorChannelId': {'value': 'UCiwAY_PbuXO0vitVqw5H9kQ'}, 'canRate': True, 'viewerRating': 'none', 'likeCount': 2, 'publishedAt': '2022-10-24T17:24:42Z', 'updatedAt': '2022-10-24T17:24:42Z'}}, 'canReply': True, 'totalReplyCount': 0, 'isPublic': True}",,UCiwAY_PbuXO0vitVqw5H9kQ,2022-10-24T17:24:42Z,Amandinha sempre tão fofa,,2023-06-09 12:59:23.941339
youtube#commentThread,n6Kw3MU0Hbfa20R0E57VHt3DbhQ,Ugy7O4MVmtdL2tK1YnV4AaABAg,"{'videoId': 'rlVAATqbf_I', 'topLevelComment': {'kind': 'youtube#comment', 'etag': 'NsI4FYBuE2PW-fDSiiKEY8iELFA', 'id': 'Ugy7O4MVmtdL2tK1YnV4AaABAg', 'snippet': {'videoId': 'rlVAATqbf_I', 'textDisplay': 'Falta de sexo também agrava a saúde', 'textOriginal': 'Falta de sexo também agrava a saúde', 'authorDisplayName': 'Dan Souza', 'authorProfileImageUrl': 'https://yt3.ggpht.com/izSDeINzymOOavG0A5CgD2W5Tmb2KfVLABCx9qiCt5Dl2f8FsMe9ZbwDILzoNyb87QGPgHrOsQ=s48-c-k-c0x00ffffff-no-rj', 'authorChannelUrl': 'http://www.youtube.com/channel/UCiwAY_PbuXO0vitVqw5H9kQ', 'authorChannelId': {'value': 'UCiwAY_PbuXO0vitVqw5H9kQ'}, 'canRate': True, 'viewerRating': 'none', 'likeCount': 2, 'publishedAt': '2022-10-24T17:23:37Z', 'updatedAt': '2022-10-24T17:23:37Z'}}, 'canReply': True, 'totalReplyCount': 0, 'isPublic': True}",,UCiwAY_PbuXO0vitVqw5H9kQ,2022-10-24T17:23:37Z,Falta de sexo também agrava a saúde,,2023-06-09 12:59:23.941339
youtube#commentThread,M0NWvmEySqeYmCEluoRWpmU1oNo,UgzgiIr0iB-4XvQ-1y94AaABAg,"{'videoId': 'rlVAATqbf_I', 'topLevelComment': {'kind': 'youtube#comment', 'etag': 'XbMnRdVcj63jNpgKAv8H-3xWaXE', 'id': 'UgzgiIr0iB-4XvQ-1y94AaABAg', 'snippet': {'videoId': 'rlVAATqbf_I', 'textDisplay': 'Matéria não fala que medicamentos são prejudiciais, em suma matéria não atendeu os propósitos de informar a sociedade!', 'textOriginal': 'Matéria não fala que medicamentos são prejudiciais, em suma matéria não atendeu os propósitos de informar a sociedade!', 'authorDisplayName': 'haylton p. júnior', 'authorProfileImageUrl': 'https://yt3.ggpht.com/ytc/AGIKgqP7F_zP8eieuW6T_mUtlevC2toKpt6ofJqClg=s48-c-k-c0x00ffffff-no-rj', 'authorChannelUrl': 'http://www.youtube.com/channel/UCC2MUjBFR1xbNTZRf6_dOeA', 'authorChannelId': {'value': 'UCC2MUjBFR1xbNTZRf6_dOeA'}, 'canRate': True, 'viewerRating': 'none', 'likeCount': 4, 'publishedAt': '2022-10-24T15:29:29Z', 'updatedAt': '2022-10-24T15:29:29Z'}}, 'canReply': True, 'totalReplyCount': 0, 'isPublic': True}",,UCC2MUjBFR1xbNTZRf6_dOeA,2022-10-24T15:29:29Z,"Matéria não fala que medicamentos são prejudiciais, em suma matéria não atendeu os propósitos de informar a sociedade!",,2023-06-09 12:59:23.941339
youtube#commentThread,hZ-ZVZ4IlLfDnBIidGnELo5E3J0,Ugw8--TJQB2V6yKoVrh4AaABAg,"{'videoId': 'rlVAATqbf_I', 'topLevelComment': {'kind': 'youtube#comment', 'etag': 'NP-xmMpDLD-MxV55y2-Gu4PSdLQ', 'id': 'Ugw8--TJQB2V6yKoVrh4AaABAg', 'snippet': {'videoId': 'rlVAATqbf_I', 'textDisplay': 'Mas q notícia pela metade ,  nem conclui o assunto  mrd', 'textOriginal': 'Mas q notícia pela metade ,  nem conclui o assunto  mrd', 'authorDisplayName': 'marelena con', 'authorProfileImageUrl': 'https://yt3.ggpht.com/ytc/AGIKgqOB6HPeQF9zor7qsbynsKdXciOG0AGcHGa4BcDKUw=s48-c-k-c0x00ffffff-no-rj', 'authorChannelUrl': 'http://www.youtube.com/channel/UCUaQlS1rsz2RZWXWtHRnePA', 'authorChannelId': {'value': 'UCUaQlS1rsz2RZWXWtHRnePA'}, 'canRate': True, 'viewerRating': 'none', 'likeCount': 2, 'publishedAt': '2022-10-24T06:39:43Z', 'updatedAt': '2022-10-24T06:39:43Z'}}, 'canReply': True, 'totalReplyCount': 1, 'isPublic': True}","{'comments': [{'kind': 'youtube#comment', 'etag': 'AJqp3_gLEXv5CGm512xKNQQYtfA', 'id': 'Ugw8--TJQB2V6yKoVrh4AaABAg.9hZ35mLzrSw9hZTbvVUcn-', 'snippet': {'videoId': 'rlVAATqbf_I', 'textDisplay': 'Petistas tomo pinga kkkk', 'textOriginal': 'Petistas tomo pinga kkkk', 'parentId': 'Ugw8--TJQB2V6yKoVrh4AaABAg', 'authorDisplayName': 'Benedito carlos Caneo', 'authorProfileImageUrl': 'https://yt3.ggpht.com/ytc/AGIKgqP8cmc_OOSCIDuRJEZpgtiqVdXmyvTwXakvLVaUPTI23nalDm2s7L07FGYitGZJ=s48-c-k-c0x00ffffff-no-rj', 'authorChannelUrl': 'http://www.youtube.com/channel/UCkA7MxkqdC_g3W9nSmbqj-Q', 'authorChannelId': {'value': 'UCkA7MxkqdC_g3W9nSmbqj-Q'}, 'canRate': True, 'viewerRating': 'none', 'likeCount': 0, 'publishedAt': '2022-10-24T10:31:26Z', 'updatedAt': '2022-10-24T10:31:26Z'}}]}",UCUaQlS1rsz2RZWXWtHRnePA,2022-10-24T06:39:43Z,"Mas q notícia pela metade ,  nem conclui o assunto  mrd",,2023-06-09 12:59:23.941339
youtube#commentThread,Pe-En3wOYiufr_G-fPhBKKyu88w,UgypP7R4pgi4yyuekup4AaABAg,"{'videoId': 'rlVAATqbf_I', 'topLevelComment': {'kind': 'youtube#comment', 'etag': 'DDQLvTiYkSTGoQKNW5KHrl648_s', 'id': 'UgypP7R4pgi4yyuekup4AaABAg', 'snippet': {'videoId': 'rlVAATqbf_I', 'textDisplay': 'Oxe, minha pressão arterial agora fica assim de dia é baixa e a noite aumenta..<br>Isso depois que eu peguei covid...', 'textOriginal': 'Oxe, minha pressão arterial agora fica assim de dia é baixa e a noite aumenta..\\nIsso depois que eu peguei covid...', 'authorDisplayName': 'Mercia Sobreira', 'authorProfileImageUrl': 'https://yt3.ggpht.com/ytc/AGIKgqNbv4IzIR5vop4DwE-hnLQJbDUK85gDbK5I4l7eI0RHLeqh6DdXku5wJJ4OSyaH=s48-c-k-c0x00ffffff-no-rj', 'authorChannelUrl': 'http://www.youtube.com/channel/UCQ0XBvcG3r0DaH6lb--cjpw', 'authorChannelId': {'value': 'UCQ0XBvcG3r0DaH6lb--cjpw'}, 'canRate': True, 'viewerRating': 'none', 'likeCount': 2, 'publishedAt': '2022-10-23T20:28:25Z', 'updatedAt': '2022-10-23T20:28:25Z'}}, 'canReply': True, 'totalReplyCount': 1, 'isPublic': True}","{'comments': [{'kind': 'youtube#comment', 'etag': 'rnQIKsQtEOr1F4ciRugd1c_h_3g', 'id': 'UgypP7R4pgi4yyuekup4AaABAg.9hXy8YL9H2i9h_x1qnIdz4', 'snippet': {'videoId': 'rlVAATqbf_I', 'textDisplay': 'Não depois que vc pegou COVID, mais sim depois que vc tomou às vaçinas. Elas causam muitas auterações, principalmente no sistema imunológico. Às pessoas vivem resfriadas. Sem contar que está causando AVC, e infartos miocárdio. Muita gente está sentindo fortes dores de cabeça após esta porcaria. Esse experimento está trazendo vários efeitos devastadores em todo corpo. Essa proteína chamada Spayk, (MRNa) ela é capaz de auterar até o DNA das pessoas. Percebi tbm que nas pessoas estão apareçendo muitas espinhas e caroços no rosto, sem contar que estão engordando de uma forma rápida.', 'textOriginal': 'Não depois que vc pegou COVID, mais sim depois que vc tomou às vaçinas. Elas causam muitas auterações, principalmente no sistema imunológico. Às pessoas vivem resfriadas. Sem contar que está causando AVC, e infartos miocárdio. Muita gente está sentindo fortes dores de cabeça após esta porcaria. Esse experimento está trazendo vários efeitos devastadores em todo corpo. Essa proteína chamada Spayk, (MRNa) ela é capaz de auterar até o DNA das pessoas. Percebi tbm que nas pessoas estão apareçendo muitas espinhas e caroços no rosto, sem contar que estão engordando de uma forma rápida.', 'parentId': 'UgypP7R4pgi4yyuekup4AaABAg', 'authorDisplayName': 'Ertonrio Erton', 'authorProfileImageUrl': 'https://yt3.ggpht.com/ytc/AGIKgqPeram9mPC-kNtMGpnFgs8dT_YsJ7qPejKdgg=s48-c-k-c0x00ffffff-no-rj', 'authorChannelUrl': 'http://www.youtube.com/channel/UCrhVY5eKbxvAwS0KxgmAHBg', 'authorChannelId': {'value': 'UCrhVY5eKbxvAwS0KxgmAHBg'}, 'canRate': True, 'viewerRating': 'none', 'likeCount': 0, 'publishedAt': '2022-10-25T00:16:30Z', 'updatedAt': '2022-10-25T00:16:30Z'}}]}",UCQ0XBvcG3r0DaH6lb--cjpw,2022-10-23T20:28:25Z,"Oxe, minha pressão arterial agora fica assim de dia é baixa e a noite aumenta..
Isso depois que eu peguei covid...",,2023-06-09 12:59:23.941339
youtube#commentThread,wwG5yOT-LRqZc9M7I-bK-ucxhBM,UgxHwgDAF2ZPNwFg8Ql4AaABAg,"{'videoId': 'rlVAATqbf_I', 'topLevelComment': {'kind': 'youtube#comment', 'etag': '3RB7SXbxG9HAo0iFbXNe85zC_vs', 'id': 'UgxHwgDAF2ZPNwFg8Ql4AaABAg', 'snippet': {'videoId': 'rlVAATqbf_I', 'textDisplay': 'É mais que seja às vaçinas que esteja causando às insuficiências... Coitado dos que tomaram essa porcaria. Eu escapei. 🙏🙏', 'textOriginal': 'É mais que seja às vaçinas que esteja causando às insuficiências... Coitado dos que tomaram essa porcaria. Eu escapei. 🙏🙏', 'authorDisplayName': 'Ertonrio Erton', 'authorProfileImageUrl': 'https://yt3.ggpht.com/ytc/AGIKgqPeram9mPC-kNtMGpnFgs8dT_YsJ7qPejKdgg=s48-c-k-c0x00ffffff-no-rj', 'authorChannelUrl': 'http://www.youtube.com/channel/UCrhVY5eKbxvAwS0KxgmAHBg', 'authorChannelId': {'value': 'UCrhVY5eKbxvAwS0KxgmAHBg'}, 'canRate': True, 'viewerRating': 'none', 'likeCount': 6, 'publishedAt': '2022-10-23T17:37:54Z', 'updatedAt': '2022-10-23T17:37:54Z'}}, 'canReply': True, 'totalReplyCount': 5, 'isPublic': True}","{'comments': [{'kind': 'youtube#comment', 'etag': 'mRLImM0wiiE3oyzSAvQfwac3URE', 'id': 'UgxHwgDAF2ZPNwFg8Ql4AaABAg.9hXecan6v8S9hbkKw-yHBd', 'snippet': {'videoId': 'rlVAATqbf_I', 'textDisplay': '@Rejane Jota Meu Deus, que triste. Melhoras pra vc. Eu tbm reparei que muitas pessoas estão faltando trabalho após essas vaçinas. Ou seja, estão ficando doente mais fácil e sem disposição pra tudo. Lá no meu trabalho, vejo muita gente faltando por motivos de doença, e eu nunca faltei. 🙏🙏', 'textOriginal': '@Rejane Jota Meu Deus, que triste. Melhoras pra vc. Eu tbm reparei que muitas pessoas estão faltando trabalho após essas vaçinas. Ou seja, estão ficando doente mais fácil e sem disposição pra tudo. Lá no meu trabalho, vejo muita gente faltando por motivos de doença, e eu nunca faltei. 🙏🙏', 'parentId': 'UgxHwgDAF2ZPNwFg8Ql4AaABAg', 'authorDisplayName': 'Ertonrio Erton', 'authorProfileImageUrl': 'https://yt3.ggpht.com/ytc/AGIKgqPeram9mPC-kNtMGpnFgs8dT_YsJ7qPejKdgg=s48-c-k-c0x00ffffff-no-rj', 'authorChannelUrl': 'http://www.youtube.com/channel/UCrhVY5eKbxvAwS0KxgmAHBg', 'authorChannelId': {'value': 'UCrhVY5eKbxvAwS0KxgmAHBg'}, 'canRate': True, 'viewerRating': 'none', 'likeCount': 0, 'publishedAt': '2022-10-25T17:03:59Z', 'updatedAt': '2022-10-25T17:03:59Z'}}, {'kind': 'youtube#comment', 'etag': '7FrwHZeVH9mn9Y6T0Wb6UHH47lc', 'id': 'UgxHwgDAF2ZPNwFg8Ql4AaABAg.9hXecan6v8S9hbcDV7D4zV', 'snippet': {'videoId': 'rlVAATqbf_I', 'textDisplay': 'Eu tomei duas doses por conta do trabalho e não tomei e nem vou tomar o restante. Estou passando por avaliação para vê se precisarei do transplante.', 'textOriginal': 'Eu tomei duas doses por conta do trabalho e não tomei e nem vou tomar o restante. Estou passando por avaliação para vê se precisarei do transplante.', 'parentId': 'UgxHwgDAF2ZPNwFg8Ql4AaABAg', 'authorDisplayName': 'Rejane Jota', 'authorProfileImageUrl': 'https://yt3.ggpht.com/ytc/AGIKgqPz8Bu1_4IpFYAK7RGe0CwP5w2yi9YlIKTwWhluBKM=s48-c-k-c0x00ffffff-no-rj', 'authorChannelUrl': 'http://www.youtube.com/channel/UCgYD2zMNWMa5KFU4nhQtPAQ', 'authorChannelId': {'value': 'UCgYD2zMNWMa5KFU4nhQtPAQ'}, 'canRate': True, 'viewerRating': 'none', 'likeCount': 1, 'publishedAt': '2022-10-25T15:53:04Z', 'updatedAt': '2022-10-25T15:53:04Z'}}, {'kind': 'youtube#comment', 'etag': '1d3hvv6PWixjZELPfuZ2sMUDZ1o', 'id': 'UgxHwgDAF2ZPNwFg8Ql4AaABAg.9hXecan6v8S9hbWGhMYLvt', 'snippet': {'videoId': 'rlVAATqbf_I', 'textDisplay': '@Rejane Jota aconselho a vc a se informar com cardiologista o que fazer pra melhorar o seu coração. Tem um exame chamado DIMERO-D se informe com ele. Essa proteína Spayk (MRNa) tem um efeito devastador no corpo.', 'textOriginal': '@Rejane Jota aconselho a vc a se informar com cardiologista o que fazer pra melhorar o seu coração. Tem um exame chamado DIMERO-D se informe com ele. Essa proteína Spayk (MRNa) tem um efeito devastador no corpo.', 'parentId': 'UgxHwgDAF2ZPNwFg8Ql4AaABAg', 'authorDisplayName': 'Ertonrio Erton', 'authorProfileImageUrl': 'https://yt3.ggpht.com/ytc/AGIKgqPeram9mPC-kNtMGpnFgs8dT_YsJ7qPejKdgg=s48-c-k-c0x00ffffff-no-rj', 'authorChannelUrl': 'http://www.youtube.com/channel/UCrhVY5eKbxvAwS0KxgmAHBg', 'authorChannelId': {'value': 'UCrhVY5eKbxvAwS0KxgmAHBg'}, 'canRate': True, 'viewerRating': 'none', 'likeCount': 0, 'publishedAt': '2022-10-25T14:52:20Z', 'updatedAt': '2022-10-25T14:52:20Z'}}, {'kind': 'youtube#comment', 'etag': 'DZeTFD3tI9NktqyHUFcc1TVUf28', 'id': 'UgxHwgDAF2ZPNwFg8Ql4AaABAg.9hXecan6v8S9hbVQHgSh5e', 'snippet': {'videoId': 'rlVAATqbf_I', 'textDisplay': '@Rejane Jota triste demais. Não era pra vc ter tomado essa porcaria. Até entendo que muitas pessoas foram obrigadas... Por conta do trabalho. Porém, outras estavam tomando de propósito. Muito triste, hoje estão sofrendo às consequências. Falta de avisos não foram. O próprio presidente cansou de falar. Porém muitos preferiram acreditar na mídia que foi paga pelas farmacêuticas e estavam o tempo todo anunciando: &quot;tome vaçina, ela salva&quot;. Eu não tomei nenhuma e estou super bem. 🙏🙏', 'textOriginal': '@Rejane Jota triste demais. Não era pra vc ter tomado essa porcaria. Até entendo que muitas pessoas foram obrigadas... Por conta do trabalho. Porém, outras estavam tomando de propósito. Muito triste, hoje estão sofrendo às consequências. Falta de avisos não foram. O próprio presidente cansou de falar. Porém muitos preferiram acreditar na mídia que foi paga pelas farmacêuticas e estavam o tempo todo anunciando: ""tome vaçina, ela salva"". Eu não tomei nenhuma e estou super bem. 🙏🙏', 'parentId': 'UgxHwgDAF2ZPNwFg8Ql4AaABAg', 'authorDisplayName': 'Ertonrio Erton', 'authorProfileImageUrl': 'https://yt3.ggpht.com/ytc/AGIKgqPeram9mPC-kNtMGpnFgs8dT_YsJ7qPejKdgg=s48-c-k-c0x00ffffff-no-rj', 'authorChannelUrl': 'http://www.youtube.com/channel/UCrhVY5eKbxvAwS0KxgmAHBg', 'authorChannelId': {'value': 'UCrhVY5eKbxvAwS0KxgmAHBg'}, 'canRate': True, 'viewerRating': 'none', 'likeCount': 0, 'publishedAt': '2022-10-25T14:44:54Z', 'updatedAt': '2022-10-25T14:44:54Z'}}, {'kind': 'youtube#comment', 'etag': 'O_e2kDPitC3UImiYtoQu_qKVj4k', 'id': 'UgxHwgDAF2ZPNwFg8Ql4AaABAg.9hXecan6v8S9hbOgRjZJb3', 'snippet': {'videoId': 'rlVAATqbf_I', 'textDisplay': 'Verdade... Eu tomei essa vacina e fiquei com insuficiência cardíaca grave! Infelizmente.', 'textOriginal': 'Verdade... Eu tomei essa vacina e fiquei com insuficiência cardíaca grave! Infelizmente.', 'parentId': 'UgxHwgDAF2ZPNwFg8Ql4AaABAg', 'authorDisplayName': 'Rejane Jota', 'authorProfileImageUrl': 'https://yt3.ggpht.com/ytc/AGIKgqPz8Bu1_4IpFYAK7RGe0CwP5w2yi9YlIKTwWhluBKM=s48-c-k-c0x00ffffff-no-rj', 'authorChannelUrl': 'http://www.youtube.com/channel/UCgYD2zMNWMa5KFU4nhQtPAQ', 'authorChannelId': {'value': 'UCgYD2zMNWMa5KFU4nhQtPAQ'}, 'canRate': True, 'viewerRating': 'none', 'likeCount': 1, 'publishedAt': '2022-10-25T13:46:05Z', 'updatedAt': '2022-10-25T13:46:05Z'}}]}",UCrhVY5eKbxvAwS0KxgmAHBg,2022-10-23T17:37:54Z,É mais que seja às vaçinas que esteja causando às insuficiências... Coitado dos que tomaram essa porcaria. Eu escapei. 🙏🙏,,2023-06-09 12:59:23.941339
youtube#commentThread,sXuw58mTynEmSKcUgxeThp0CIaw,UgyCDkWqbNLHhoT8GtV4AaABAg,"{'videoId': 'rlVAATqbf_I', 'topLevelComment': {'kind': 'youtube#comment', 'etag': '_aLHTaoX-QGUIW0gJeWZcT4_sg0', 'id': 'UgyCDkWqbNLHhoT8GtV4AaABAg', 'snippet': {'videoId': 'rlVAATqbf_I', 'textDisplay': 'Verdade', 'textOriginal': 'Verdade', 'authorDisplayName': 'Bispo José Silva', 'authorProfileImageUrl': 'https://yt3.ggpht.com/ytc/AGIKgqOBZbd6nyrFzyGIt4W0VMMvhGRI9FIC4suVvU3kkrX-zVUsCorrlvo7YWidsxLJ=s48-c-k-c0x00ffffff-no-rj', 'authorChannelUrl': 'http://www.youtube.com/channel/UCOfpdnxkIx1tHE5LBQlREXg', 'authorChannelId': {'value': 'UCOfpdnxkIx1tHE5LBQlREXg'}, 'canRate': True, 'viewerRating': 'none', 'likeCount': 3, 'publishedAt': '2022-10-23T17:22:31Z', 'updatedAt': '2022-10-23T17:22:31Z'}}, 'canReply': True, 'totalReplyCount': 0, 'isPublic': True}",,UCOfpdnxkIx1tHE5LBQlREXg,2022-10-23T17:22:31Z,Verdade,,2023-06-09 12:59:23.941339
youtube#commentThread,ddHa9ZSgQPuumjqcXGGWFqPjgQM,UgyHyaM0Vmv1kHLHLmt4AaABAg,"{'videoId': 'rlVAATqbf_I', 'topLevelComment': {'kind': 'youtube#comment', 'etag': 'rSNUSOyQ238Wr29kqdtODsbjXxs', 'id': 'UgyHyaM0Vmv1kHLHLmt4AaABAg', 'snippet': {'videoId': 'rlVAATqbf_I', 'textDisplay': 'Então é bom os petistas pararem de tomar Gadernal e Roupinol Com Cachaça 😂', 'textOriginal': 'Então é bom os petistas pararem de tomar Gadernal e Roupinol Com Cachaça 😂', 'authorDisplayName': '@jmn', 'authorProfileImageUrl': 'https://yt3.ggpht.com/ytc/AGIKgqNszHHS5toFpZ0uWh-ZmolC3M-Ke84yYT5cd4eccK3dgw=s48-c-k-c0x00ffffff-no-rj', 'authorChannelUrl': 'http://www.youtube.com/channel/UCpEvuuQOV_mXPjla6FjYqOQ', 'authorChannelId': {'value': 'UCpEvuuQOV_mXPjla6FjYqOQ'}, 'canRate': True, 'viewerRating': 'none', 'likeCount': 5, 'publishedAt': '2022-10-23T12:49:51Z', 'updatedAt': '2022-10-23T12:49:51Z'}}, 'canReply': True, 'totalReplyCount': 4, 'isPublic': True}","{'comments': [{'kind': 'youtube#comment', 'etag': 'eRu02EE3Hd8htjhDAOFGj7M2siI', 'id': 'UgyHyaM0Vmv1kHLHLmt4AaABAg.9hX8euXW7tZ9hePrUdXVF2', 'snippet': {'videoId': 'rlVAATqbf_I', 'textDisplay': 'Eu gostaria de saber  , qual  a medida que Seu Carlos tomou. Fazer tudo diferente  .Nao se consegue ouvir o final.', 'textOriginal': 'Eu gostaria de saber  , qual  a medida que Seu Carlos tomou. Fazer tudo diferente  .Nao se consegue ouvir o final.', 'parentId': 'UgyHyaM0Vmv1kHLHLmt4AaABAg', 'authorDisplayName': 'elida rubin', 'authorProfileImageUrl': 'https://yt3.ggpht.com/ytc/AGIKgqMy0Uvvy-Owshtpt8U1lDRyDJspmrGY7GJ9Rw=s48-c-k-c0x00ffffff-no-rj', 'authorChannelUrl': 'http://www.youtube.com/channel/UCBI1w6D7T2j82XHgEZnk_xw', 'authorChannelId': {'value': 'UCBI1w6D7T2j82XHgEZnk_xw'}, 'canRate': True, 'viewerRating': 'none', 'likeCount': 0, 'publishedAt': '2022-10-26T17:54:03Z', 'updatedAt': '2022-10-26T17:54:03Z'}}, {'kind': 'youtube#comment', 'etag': 'jFUSpknpRGfcUHiE0U9XpUGLB38', 'id': 'UgyHyaM0Vmv1kHLHLmt4AaABAg.9hX8euXW7tZ9he4Bvp8qQa', 'snippet': {'videoId': 'rlVAATqbf_I', 'textDisplay': '😀😀', 'textOriginal': '😀😀', 'parentId': 'UgyHyaM0Vmv1kHLHLmt4AaABAg', 'authorDisplayName': 'Suri  Cundari', 'authorProfileImageUrl': 'https://yt3.ggpht.com/rn8r0hAXbBh-rqxsD-3eMGt6naKkCooyKWliCB8YI5IX4_zbdmT9sU5Y5JIxjwOArFEQNrHe0w=s48-c-k-c0x00ffffff-no-rj', 'authorChannelUrl': 'http://www.youtube.com/channel/UC3rqcGZ5o18h0T0DqRE0ucw', 'authorChannelId': {'value': 'UC3rqcGZ5o18h0T0DqRE0ucw'}, 'canRate': True, 'viewerRating': 'none', 'likeCount': 0, 'publishedAt': '2022-10-26T14:44:44Z', 'updatedAt': '2022-10-26T14:44:44Z'}}, {'kind': 'youtube#comment', 'etag': 'NWvkbeZ178ZTQ5UDyDz95RRJkbA', 'id': 'UgyHyaM0Vmv1kHLHLmt4AaABAg.9hX8euXW7tZ9h_ZxoWk0kg', 'snippet': {'videoId': 'rlVAATqbf_I', 'textDisplay': 'É o bolsonaro,quem toma Reuquinol...', 'textOriginal': 'É o bolsonaro,quem toma Reuquinol...', 'parentId': 'UgyHyaM0Vmv1kHLHLmt4AaABAg', 'authorDisplayName': 'Ivone Sampaio André', 'authorProfileImageUrl': 'https://yt3.ggpht.com/ytc/AGIKgqPyVneLjtpFdkod1rE3_3tgQSrLMeWyibCuzg=s48-c-k-c0x00ffffff-no-rj', 'authorChannelUrl': 'http://www.youtube.com/channel/UCV1e9z1d9fGQdTMvCE2jqug', 'authorChannelId': {'value': 'UCV1e9z1d9fGQdTMvCE2jqug'}, 'canRate': True, 'viewerRating': 'none', 'likeCount': 0, 'publishedAt': '2022-10-24T20:46:05Z', 'updatedAt': '2022-10-24T20:46:05Z'}}, {'kind': 'youtube#comment', 'etag': 'EbzGYhRTYRUTgNpz-HdsuHD4fDc', 'id': 'UgyHyaM0Vmv1kHLHLmt4AaABAg.9hX8euXW7tZ9hXNMEfCtPl', 'snippet': {'videoId': 'rlVAATqbf_I', 'textDisplay': '😂😂😂😂😂', 'textOriginal': '😂😂😂😂😂', 'parentId': 'UgyHyaM0Vmv1kHLHLmt4AaABAg', 'authorDisplayName': 'Jeane Assis', 'authorProfileImageUrl': 'https://yt3.ggpht.com/ytc/AGIKgqPBh2NYeNRs-OBEaxwxv_77WatVjcXl9DpZnUOcfQ=s48-c-k-c0x00ffffff-no-rj', 'authorChannelUrl': 'http://www.youtube.com/channel/UCvA15t4AqwetD0Glzgm4pJw', 'authorChannelId': {'value': 'UCvA15t4AqwetD0Glzgm4pJw'}, 'canRate': True, 'viewerRating': 'none', 'likeCount': 3, 'publishedAt': '2022-10-23T14:58:15Z', 'updatedAt': '2022-10-23T14:58:15Z'}}]}",UCpEvuuQOV_mXPjla6FjYqOQ,2022-10-23T12:49:51Z,Então é bom os petistas pararem de tomar Gadernal e Roupinol Com Cachaça 😂,,2023-06-09 12:59:23.941339
youtube#commentThread,HKP7ix61n6TLtFr26M-dhghh-E4,UgzrRozmdQbz8NNKZaF4AaABAg,"{'videoId': 'rlVAATqbf_I', 'topLevelComment': {'kind': 'youtube#comment', 'etag': 'ym9KDVbeVPXgFefkvEq2vQbgpSk', 'id': 'UgzrRozmdQbz8NNKZaF4AaABAg', 'snippet': {'videoId': 'rlVAATqbf_I', 'textDisplay': 'Eu que o diga sobre os preços dos remédios tomou vários q são caros', 'textOriginal': 'Eu que o diga sobre os preços dos remédios tomou vários q são caros', 'authorDisplayName': 'Viviane Oliveira', 'authorProfileImageUrl': 'https://yt3.ggpht.com/ytc/AGIKgqODYhhuusPgiOvpKebpxCyFa7Oqq9diNw4b7qRxjw=s48-c-k-c0x00ffffff-no-rj', 'authorChannelUrl': 'http://www.youtube.com/channel/UCRH7UknBhfJPRJjEz72T2gw', 'authorChannelId': {'value': 'UCRH7UknBhfJPRJjEz72T2gw'}, 'canRate': True, 'viewerRating': 'none', 'likeCount': 3, 'publishedAt': '2022-10-23T04:50:45Z', 'updatedAt': '2022-10-23T04:50:45Z'}}, 'canReply': True, 'totalReplyCount': 0, 'isPublic': True}",,UCRH7UknBhfJPRJjEz72T2gw,2022-10-23T04:50:45Z,Eu que o diga sobre os preços dos remédios tomou vários q são caros,,2023-06-09 12:59:23.941339
youtube#commentThread,T3H_2P6dUZ-0t8vbSdbebHRhIFI,UgxsknKQQOPzcyYA9v94AaABAg,"{'videoId': 'rlVAATqbf_I', 'topLevelComment': {'kind': 'youtube#comment', 'etag': 'PpZTDOCd8dKh7SP6pRBS_ZRdsrk', 'id': 'UgxsknKQQOPzcyYA9v94AaABAg', 'snippet': {'videoId': 'rlVAATqbf_I', 'textDisplay': 'Claro, a vacina pra C19 fica de fora do problema.', 'textOriginal': 'Claro, a vacina pra C19 fica de fora do problema.', 'authorDisplayName': 'Victor Guimarães', 'authorProfileImageUrl': 'https://yt3.ggpht.com/ytc/AGIKgqMsFDSV24N6h2YEdmFD8srJ26W0zaApDHaKe9gKJg=s48-c-k-c0x00ffffff-no-rj', 'authorChannelUrl': 'http://www.youtube.com/channel/UClTEewEWKKJaI7FF14Vidag', 'authorChannelId': {'value': 'UClTEewEWKKJaI7FF14Vidag'}, 'canRate': True, 'viewerRating': 'none', 'likeCount': 0, 'publishedAt': '2022-10-23T02:13:58Z', 'updatedAt': '2022-10-23T02:13:58Z'}}, 'canReply': True, 'totalReplyCount': 0, 'isPublic': True}",,UClTEewEWKKJaI7FF14Vidag,2022-10-23T02:13:58Z,"Claro, a vacina pra C19 fica de fora do problema.",,2023-06-09 12:59:23.941339
