kind,etag,id,snippet,replies,authorChannelId,publishedAt,textOriginal,nextPageToken,extraction_date
youtube#commentThread,0Clbe_GQuuq-Zdi6TkQqLgo0StQ,UgxugOxrl3rEgc-Hvdh4AaABAg,"{'videoId': 'JsRIIhnquTA', 'topLevelComment': {'kind': 'youtube#comment', 'etag': 'bxoENBwo6kg7eBCWTWpaLkL8fTs', 'id': 'UgxugOxrl3rEgc-Hvdh4AaABAg', 'snippet': {'videoId': 'JsRIIhnquTA', 'textDisplay': 'O palco podia ter caido kkk', 'textOriginal': 'O palco podia ter caido kkk', 'authorDisplayName': 'Carlos Marques', 'authorProfileImageUrl': 'https://yt3.ggpht.com/ytc/AGIKgqMf2sa7djzQ2cXzCwC6KAwqetNNKoZWlrAkdA=s48-c-k-c0x00ffffff-no-rj', 'authorChannelUrl': 'http://www.youtube.com/channel/UCv_h37yzhaYlDs8rWlUZXYg', 'authorChannelId': {'value': 'UCv_h37yzhaYlDs8rWlUZXYg'}, 'canRate': True, 'viewerRating': 'none', 'likeCount': 0, 'publishedAt': '2022-10-19T14:06:46Z', 'updatedAt': '2022-10-19T14:06:46Z'}}, 'canReply': True, 'totalReplyCount': 0, 'isPublic': True}",,UCv_h37yzhaYlDs8rWlUZXYg,2022-10-19T14:06:46Z,O palco podia ter caido kkk,,2023-06-09 13:14:57.405884
youtube#commentThread,Q_1cfPf4hX86Ynp3iOoRjQjBUWI,UgzF6e-6_eHC41gzi714AaABAg,"{'videoId': 'JsRIIhnquTA', 'topLevelComment': {'kind': 'youtube#comment', 'etag': 'qjsABukYUdpP4IXzVKKlWZdVo6k', 'id': 'UgzF6e-6_eHC41gzi714AaABAg', 'snippet': {'videoId': 'JsRIIhnquTA', 'textDisplay': 'B22', 'textOriginal': 'B22', 'authorDisplayName': 'Larissa chiodi', 'authorProfileImageUrl': 'https://yt3.ggpht.com/ytc/AGIKgqNJrTjrFAEzdkMvRoWEL9rE5MbXZeTE8eGfEw=s48-c-k-c0x00ffffff-no-rj', 'authorChannelUrl': 'http://www.youtube.com/channel/UC64uM_DZJjbaX5pZh6WSbmg', 'authorChannelId': {'value': 'UC64uM_DZJjbaX5pZh6WSbmg'}, 'canRate': True, 'viewerRating': 'none', 'likeCount': 0, 'publishedAt': '2022-10-17T00:58:48Z', 'updatedAt': '2022-10-17T00:58:48Z'}}, 'canReply': True, 'totalReplyCount': 0, 'isPublic': True}",,UC64uM_DZJjbaX5pZh6WSbmg,2022-10-17T00:58:48Z,B22,,2023-06-09 13:14:57.405884
youtube#commentThread,ik4Mig8eukmdVwjbGpV8pHpNaOI,Ugwv1HntNxLUnd2-sXt4AaABAg,"{'videoId': 'JsRIIhnquTA', 'topLevelComment': {'kind': 'youtube#comment', 'etag': 'nTyMEmcWuRGklk6gz_M-GPfP0to', 'id': 'Ugwv1HntNxLUnd2-sXt4AaABAg', 'snippet': {'videoId': 'JsRIIhnquTA', 'textDisplay': 'Maceio Alagoas! Parabéns meu querido presidente Jair Messias Bolsonaro! é o melhor presidente da história do Brasil. 22em2022 🇧🇷22em2022 🇧🇷', 'textOriginal': 'Maceio Alagoas! Parabéns meu querido presidente Jair Messias Bolsonaro! é o melhor presidente da história do Brasil. 22em2022 🇧🇷22em2022 🇧🇷', 'authorDisplayName': 'ZENNY Vieira', 'authorProfileImageUrl': 'https://yt3.ggpht.com/ytc/AGIKgqMl0Wccw4l0sygZdZl4S9nxcoP3EMHQIpqW_A=s48-c-k-c0x00ffffff-no-rj', 'authorChannelUrl': 'http://www.youtube.com/channel/UCBy8wYcoCQq9hbO_M8Zivkg', 'authorChannelId': {'value': 'UCBy8wYcoCQq9hbO_M8Zivkg'}, 'canRate': True, 'viewerRating': 'none', 'likeCount': 0, 'publishedAt': '2022-10-16T23:11:40Z', 'updatedAt': '2022-10-16T23:11:40Z'}}, 'canReply': True, 'totalReplyCount': 0, 'isPublic': True}",,UCBy8wYcoCQq9hbO_M8Zivkg,2022-10-16T23:11:40Z,Maceio Alagoas! Parabéns meu querido presidente Jair Messias Bolsonaro! é o melhor presidente da história do Brasil. 22em2022 🇧🇷22em2022 🇧🇷,,2023-06-09 13:14:57.405884
youtube#commentThread,PEqsiH9HEo3FoJt4D7ZEp-JEiFQ,Ugz4wr441lDk7YJbewB4AaABAg,"{'videoId': 'JsRIIhnquTA', 'topLevelComment': {'kind': 'youtube#comment', 'etag': 'IgYKV0G3n6ejlj8yp6tepGc2TeA', 'id': 'Ugz4wr441lDk7YJbewB4AaABAg', 'snippet': {'videoId': 'JsRIIhnquTA', 'textDisplay': 'Brasil vai mudar o grande estadista voltou Salve Luiz Inácio da Silva. Esperança a única no momento chega dessa baixaria escandalosa e corrupção desenfreada', 'textOriginal': 'Brasil vai mudar o grande estadista voltou Salve Luiz Inácio da Silva. Esperança a única no momento chega dessa baixaria escandalosa e corrupção desenfreada', 'authorDisplayName': 'Julio Oliveira', 'authorProfileImageUrl': 'https://yt3.ggpht.com/ytc/AGIKgqNO86snI8T7JeKk9gCQcNNB5_I3pno3xengGA=s48-c-k-c0x00ffffff-no-rj', 'authorChannelUrl': 'http://www.youtube.com/channel/UCZFxzPMiLMOPo-pGTdSZ-Jg', 'authorChannelId': {'value': 'UCZFxzPMiLMOPo-pGTdSZ-Jg'}, 'canRate': True, 'viewerRating': 'none', 'likeCount': 1, 'publishedAt': '2022-10-16T19:22:55Z', 'updatedAt': '2022-10-16T19:22:55Z'}}, 'canReply': True, 'totalReplyCount': 0, 'isPublic': True}",,UCZFxzPMiLMOPo-pGTdSZ-Jg,2022-10-16T19:22:55Z,Brasil vai mudar o grande estadista voltou Salve Luiz Inácio da Silva. Esperança a única no momento chega dessa baixaria escandalosa e corrupção desenfreada,,2023-06-09 13:14:57.405884
youtube#commentThread,bg3sZBVZe6an2vbs8uzC_BQ5SPA,Ugxc6vi-KepN1y8sinJ4AaABAg,"{'videoId': 'JsRIIhnquTA', 'topLevelComment': {'kind': 'youtube#comment', 'etag': 'x7P9ISRdMaPo5a1qxc3XGBziJvA', 'id': 'Ugxc6vi-KepN1y8sinJ4AaABAg', 'snippet': {'videoId': 'JsRIIhnquTA', 'textDisplay': 'Bolsonaro vai ganhar.', 'textOriginal': 'Bolsonaro vai ganhar.', 'authorDisplayName': 'gorete medeiros', 'authorProfileImageUrl': 'https://yt3.ggpht.com/ytc/AGIKgqPdD0VJRr4EIqQlsqus40aoKm5Cx6EeCrlvRczkqSb3mh6Y-EEcCRjlZv4GoTLI=s48-c-k-c0x00ffffff-no-rj', 'authorChannelUrl': 'http://www.youtube.com/channel/UCGGedvp3Ni9D29hb6GMbR5A', 'authorChannelId': {'value': 'UCGGedvp3Ni9D29hb6GMbR5A'}, 'canRate': True, 'viewerRating': 'none', 'likeCount': 0, 'publishedAt': '2022-10-16T16:44:07Z', 'updatedAt': '2022-10-16T16:44:07Z'}}, 'canReply': True, 'totalReplyCount': 0, 'isPublic': True}",,UCGGedvp3Ni9D29hb6GMbR5A,2022-10-16T16:44:07Z,Bolsonaro vai ganhar.,,2023-06-09 13:14:57.405884
youtube#commentThread,DJjVwI_ON80biDC_nCuQFjKYxCU,UgyXPxg3qASvn_W0yYp4AaABAg,"{'videoId': 'JsRIIhnquTA', 'topLevelComment': {'kind': 'youtube#comment', 'etag': '06M2kHW4OssNVUwYYAdOk8jNQ50', 'id': 'UgyXPxg3qASvn_W0yYp4AaABAg', 'snippet': {'videoId': 'JsRIIhnquTA', 'textDisplay': 'Explica aí  o que um velho como Bolsonaro quis dizer que a jovens eram bonitinhas e arrumadinhas e que resolveu voltar porque &quot; pintou o clima&quot;. É  claramente  uma descrição  de interesse sexual em uma criança  e a possibilidade  aí falar que pintou o clima. Isso é  uma vergonha.  Você entregaria a sua filha ou neta a um velho que pode ver a possibilidade  de pintar um clima de possibilidade  sexual sobre uma criança? Evangélico que passa pano para isso já tem a sua alma perversa tomada por Satanás.', 'textOriginal': 'Explica aí  o que um velho como Bolsonaro quis dizer que a jovens eram bonitinhas e arrumadinhas e que resolveu voltar porque "" pintou o clima"". É  claramente  uma descrição  de interesse sexual em uma criança  e a possibilidade  aí falar que pintou o clima. Isso é  uma vergonha.  Você entregaria a sua filha ou neta a um velho que pode ver a possibilidade  de pintar um clima de possibilidade  sexual sobre uma criança? Evangélico que passa pano para isso já tem a sua alma perversa tomada por Satanás.', 'authorDisplayName': 'Fred Costa', 'authorProfileImageUrl': 'https://yt3.ggpht.com/ytc/AGIKgqP_uw0gF0BRiSNZKMl5dWSNw3NudhqW0F14tw=s48-c-k-c0x00ffffff-no-rj', 'authorChannelUrl': 'http://www.youtube.com/channel/UCGjsiQvpB3ONLa_2YXmbOnQ', 'authorChannelId': {'value': 'UCGjsiQvpB3ONLa_2YXmbOnQ'}, 'canRate': True, 'viewerRating': 'none', 'likeCount': 0, 'publishedAt': '2022-10-16T16:40:41Z', 'updatedAt': '2022-10-16T16:40:41Z'}}, 'canReply': True, 'totalReplyCount': 0, 'isPublic': True}",,UCGjsiQvpB3ONLa_2YXmbOnQ,2022-10-16T16:40:41Z,"Explica aí  o que um velho como Bolsonaro quis dizer que a jovens eram bonitinhas e arrumadinhas e que resolveu voltar porque "" pintou o clima"". É  claramente  uma descrição  de interesse sexual em uma criança  e a possibilidade  aí falar que pintou o clima. Isso é  uma vergonha.  Você entregaria a sua filha ou neta a um velho que pode ver a possibilidade  de pintar um clima de possibilidade  sexual sobre uma criança? Evangélico que passa pano para isso já tem a sua alma perversa tomada por Satanás.",,2023-06-09 13:14:57.405884
youtube#commentThread,C6pnJnpIhg-0tAYNrXAxEOBdsjQ,UgwmPmZGMlT3QBK1CHd4AaABAg,"{'videoId': 'JsRIIhnquTA', 'topLevelComment': {'kind': 'youtube#comment', 'etag': 'roWJ5-zE7oIXlhUNepDUsJ7vlr4', 'id': 'UgwmPmZGMlT3QBK1CHd4AaABAg', 'snippet': {'videoId': 'JsRIIhnquTA', 'textDisplay': 'SEGURA BOZOIADA QUE A LAPADA É GRANDE É 13', 'textOriginal': 'SEGURA BOZOIADA QUE A LAPADA É GRANDE É 13', 'authorDisplayName': 'Shakur Games', 'authorProfileImageUrl': 'https://yt3.ggpht.com/ytc/AGIKgqM4tva7XBtv5Qj_65osiY-RnHZ2jEhoMGHMsEHdgg=s48-c-k-c0x00ffffff-no-rj', 'authorChannelUrl': 'http://www.youtube.com/channel/UCC4XhTHnfjLkTlN7VrxIyvA', 'authorChannelId': {'value': 'UCC4XhTHnfjLkTlN7VrxIyvA'}, 'canRate': True, 'viewerRating': 'none', 'likeCount': 1, 'publishedAt': '2022-10-16T14:04:51Z', 'updatedAt': '2022-10-16T14:04:51Z'}}, 'canReply': True, 'totalReplyCount': 0, 'isPublic': True}",,UCC4XhTHnfjLkTlN7VrxIyvA,2022-10-16T14:04:51Z,SEGURA BOZOIADA QUE A LAPADA É GRANDE É 13,,2023-06-09 13:14:57.405884
youtube#commentThread,MROTIvikwHGHhYTfa1xsXE7CGHY,Ugy14aHFz4jj71KNMup4AaABAg,"{'videoId': 'JsRIIhnquTA', 'topLevelComment': {'kind': 'youtube#comment', 'etag': 'UMDjRJr8PmKMmM-mwu9Rr_xzwZM', 'id': 'Ugy14aHFz4jj71KNMup4AaABAg', 'snippet': {'videoId': 'JsRIIhnquTA', 'textDisplay': 'Só quero a maioridade penal!!', 'textOriginal': 'Só quero a maioridade penal!!', 'authorDisplayName': 'Daysinha Lorenzo', 'authorProfileImageUrl': 'https://yt3.ggpht.com/tQQW41PWkOWmMurz-_Q4FG_iYrUTHH_1QHA2XutLr1ZHuSj7K-W6kkdNraT_45lsaBm7dpeDuVI=s48-c-k-c0x00ffffff-no-rj', 'authorChannelUrl': 'http://www.youtube.com/channel/UCRWo_6wwHkOzV8iOqaG6T-g', 'authorChannelId': {'value': 'UCRWo_6wwHkOzV8iOqaG6T-g'}, 'canRate': True, 'viewerRating': 'none', 'likeCount': 1, 'publishedAt': '2022-10-15T20:10:13Z', 'updatedAt': '2022-10-15T20:10:13Z'}}, 'canReply': True, 'totalReplyCount': 0, 'isPublic': True}",,UCRWo_6wwHkOzV8iOqaG6T-g,2022-10-15T20:10:13Z,Só quero a maioridade penal!!,,2023-06-09 13:14:57.405884
youtube#commentThread,daIN6ep3Ny1ZxAYQYzjVkJwHuVI,UgwoJc-IN55uvDVi-eV4AaABAg,"{'videoId': 'JsRIIhnquTA', 'topLevelComment': {'kind': 'youtube#comment', 'etag': 'iZ4kn5UJHIU3o0GdMgTkgkNsdfY', 'id': 'UgwoJc-IN55uvDVi-eV4AaABAg', 'snippet': {'videoId': 'JsRIIhnquTA', 'textDisplay': 'Bora capitão!! E 22!!', 'textOriginal': 'Bora capitão!! E 22!!', 'authorDisplayName': 'Daysinha Lorenzo', 'authorProfileImageUrl': 'https://yt3.ggpht.com/tQQW41PWkOWmMurz-_Q4FG_iYrUTHH_1QHA2XutLr1ZHuSj7K-W6kkdNraT_45lsaBm7dpeDuVI=s48-c-k-c0x00ffffff-no-rj', 'authorChannelUrl': 'http://www.youtube.com/channel/UCRWo_6wwHkOzV8iOqaG6T-g', 'authorChannelId': {'value': 'UCRWo_6wwHkOzV8iOqaG6T-g'}, 'canRate': True, 'viewerRating': 'none', 'likeCount': 1, 'publishedAt': '2022-10-15T20:09:27Z', 'updatedAt': '2022-10-15T20:09:27Z'}}, 'canReply': True, 'totalReplyCount': 0, 'isPublic': True}",,UCRWo_6wwHkOzV8iOqaG6T-g,2022-10-15T20:09:27Z,Bora capitão!! E 22!!,,2023-06-09 13:14:57.405884
youtube#commentThread,MJjWABHBcKThyUb5aopUbSfyQ_o,Ugz041NruJrKWk9HO554AaABAg,"{'videoId': 'JsRIIhnquTA', 'topLevelComment': {'kind': 'youtube#comment', 'etag': 'fEAhRGZBCZ6DrK48OoyYkv9rey0', 'id': 'Ugz041NruJrKWk9HO554AaABAg', 'snippet': {'videoId': 'JsRIIhnquTA', 'textDisplay': 'O dono da YPÊ deu 2 milhões para a campanha do Bolsonaro.', 'textOriginal': 'O dono da YPÊ deu 2 milhões para a campanha do Bolsonaro.', 'authorDisplayName': 'Sousa', 'authorProfileImageUrl': 'https://yt3.ggpht.com/ytc/AGIKgqO-5ZUsoAS5y93ja0OvNjtdoGw4p8l7iGklrSTGoQ=s48-c-k-c0x00ffffff-no-rj', 'authorChannelUrl': 'http://www.youtube.com/channel/UCd9kRqLQfBz8I__csDfuPhQ', 'authorChannelId': {'value': 'UCd9kRqLQfBz8I__csDfuPhQ'}, 'canRate': True, 'viewerRating': 'none', 'likeCount': 0, 'publishedAt': '2022-10-15T15:38:20Z', 'updatedAt': '2022-10-15T15:38:20Z'}}, 'canReply': True, 'totalReplyCount': 0, 'isPublic': True}",,UCd9kRqLQfBz8I__csDfuPhQ,2022-10-15T15:38:20Z,O dono da YPÊ deu 2 milhões para a campanha do Bolsonaro.,,2023-06-09 13:14:57.405884
youtube#commentThread,wpNwo0XM5Tkwtyug_U2oCHn78ik,Ugw2YMlulEsiRU7CKzN4AaABAg,"{'videoId': 'JsRIIhnquTA', 'topLevelComment': {'kind': 'youtube#comment', 'etag': 'rpJVouQfkAdY4PKcIF-Mgh4fnPY', 'id': 'Ugw2YMlulEsiRU7CKzN4AaABAg', 'snippet': {'videoId': 'JsRIIhnquTA', 'textDisplay': 'Tem tudo para a reeleição do presidente!<br>22!🇧🇷', 'textOriginal': 'Tem tudo para a reeleição do presidente!\\n22!🇧🇷', 'authorDisplayName': 'gustavo_', 'authorProfileImageUrl': 'https://yt3.ggpht.com/2BFBm6QJHqvO-LvEGMr7BwZF21xSGW2UGQpybGPGt-1-nggd4_BPG50b6jRnLQQPOZlVtEkk=s48-c-k-c0x00ffffff-no-rj', 'authorChannelUrl': 'http://www.youtube.com/channel/UCpuNNeeSQRrKKWKtKvvA3dg', 'authorChannelId': {'value': 'UCpuNNeeSQRrKKWKtKvvA3dg'}, 'canRate': True, 'viewerRating': 'none', 'likeCount': 2, 'publishedAt': '2022-10-15T15:25:47Z', 'updatedAt': '2022-10-15T15:25:47Z'}}, 'canReply': True, 'totalReplyCount': 0, 'isPublic': True}",,UCpuNNeeSQRrKKWKtKvvA3dg,2022-10-15T15:25:47Z,"Tem tudo para a reeleição do presidente!
22!🇧🇷",,2023-06-09 13:14:57.405884
youtube#commentThread,LMK2ntt3ENhsXmyrCtkZlurTxME,Ugy5H5Aho1NFxwI71OV4AaABAg,"{'videoId': 'JsRIIhnquTA', 'topLevelComment': {'kind': 'youtube#comment', 'etag': 't0zuMzDvbHI_Zn6wwjWLFwNnQWk', 'id': 'Ugy5H5Aho1NFxwI71OV4AaABAg', 'snippet': {'videoId': 'JsRIIhnquTA', 'textDisplay': 'Só pra lembrar tem um projeto de lei que está a quase dois anos esperando pra votação é o projeto de lei que dá direito a benefício aos órfãos filhos de quem faleceu de COVID acho que tem que ser votado e aprovado tem órfãos que estão precisando disso ok', 'textOriginal': 'Só pra lembrar tem um projeto de lei que está a quase dois anos esperando pra votação é o projeto de lei que dá direito a benefício aos órfãos filhos de quem faleceu de COVID acho que tem que ser votado e aprovado tem órfãos que estão precisando disso ok', 'authorDisplayName': 'Angelica Jordão', 'authorProfileImageUrl': 'https://yt3.ggpht.com/ytc/AGIKgqMrAldySge63D-5Kp-xsjeLs7_1ofIp3yfokQ=s48-c-k-c0x00ffffff-no-rj', 'authorChannelUrl': 'http://www.youtube.com/channel/UC8XfZUuXE3mxWj3qKcMo7lg', 'authorChannelId': {'value': 'UC8XfZUuXE3mxWj3qKcMo7lg'}, 'canRate': True, 'viewerRating': 'none', 'likeCount': 0, 'publishedAt': '2022-10-15T14:33:39Z', 'updatedAt': '2022-10-15T14:33:39Z'}}, 'canReply': True, 'totalReplyCount': 0, 'isPublic': True}",,UC8XfZUuXE3mxWj3qKcMo7lg,2022-10-15T14:33:39Z,Só pra lembrar tem um projeto de lei que está a quase dois anos esperando pra votação é o projeto de lei que dá direito a benefício aos órfãos filhos de quem faleceu de COVID acho que tem que ser votado e aprovado tem órfãos que estão precisando disso ok,,2023-06-09 13:14:57.405884
youtube#commentThread,zWbb5tkWeRueElGtmk09bRxPYJ0,Ugx6mqKoJaqEG24H9sR4AaABAg,"{'videoId': 'JsRIIhnquTA', 'topLevelComment': {'kind': 'youtube#comment', 'etag': 'vmssqnGpOLILHGBmqIz93NlpZms', 'id': 'Ugx6mqKoJaqEG24H9sR4AaABAg', 'snippet': {'videoId': 'JsRIIhnquTA', 'textDisplay': 'É 22', 'textOriginal': 'É 22', 'authorDisplayName': 'Maria jose martins', 'authorProfileImageUrl': 'https://yt3.ggpht.com/ytc/AGIKgqPHMM4yr7TM5TBb85PCir325o8banSxEpiIwIqO=s48-c-k-c0x00ffffff-no-rj', 'authorChannelUrl': 'http://www.youtube.com/channel/UCbIM6tbjDkoroGJWYBgiHog', 'authorChannelId': {'value': 'UCbIM6tbjDkoroGJWYBgiHog'}, 'canRate': True, 'viewerRating': 'none', 'likeCount': 0, 'publishedAt': '2022-10-15T10:14:21Z', 'updatedAt': '2022-10-15T10:14:21Z'}}, 'canReply': True, 'totalReplyCount': 0, 'isPublic': True}",,UCbIM6tbjDkoroGJWYBgiHog,2022-10-15T10:14:21Z,É 22,,2023-06-09 13:14:57.405884
youtube#commentThread,zp41Zbd3LYX8BJ99xGckaKMVfCY,UgydygKmdR3mrQyDVph4AaABAg,"{'videoId': 'JsRIIhnquTA', 'topLevelComment': {'kind': 'youtube#comment', 'etag': 'MuH9e2Lj4SlqIOkkWUkpt734S-k', 'id': 'UgydygKmdR3mrQyDVph4AaABAg', 'snippet': {'videoId': 'JsRIIhnquTA', 'textDisplay': 'Bora ganhar Bolsonaro', 'textOriginal': 'Bora ganhar Bolsonaro', 'authorDisplayName': 'Weslley Avelino', 'authorProfileImageUrl': 'https://yt3.ggpht.com/Oj5nCuEksub8BRaZzVlFMc-yzrN0BNUmbCBG3-TM7UUyC8ATXZ3n6X_ifEBEsCPEjtDN3j7S5g=s48-c-k-c0x00ffffff-no-rj', 'authorChannelUrl': 'http://www.youtube.com/channel/UC1ewfAPSOt6-5DGxIRkhwRg', 'authorChannelId': {'value': 'UC1ewfAPSOt6-5DGxIRkhwRg'}, 'canRate': True, 'viewerRating': 'none', 'likeCount': 0, 'publishedAt': '2022-10-15T10:02:36Z', 'updatedAt': '2022-10-15T10:02:36Z'}}, 'canReply': True, 'totalReplyCount': 0, 'isPublic': True}",,UC1ewfAPSOt6-5DGxIRkhwRg,2022-10-15T10:02:36Z,Bora ganhar Bolsonaro,,2023-06-09 13:14:57.405884
youtube#commentThread,dvC4NXr8O3GsNA-D0L9oQoeH_as,Ugw_PStavTuFqsZEFrt4AaABAg,"{'videoId': 'JsRIIhnquTA', 'topLevelComment': {'kind': 'youtube#comment', 'etag': 'pVA6r_FbM_xktgtzpw8QJTClZ70', 'id': 'Ugw_PStavTuFqsZEFrt4AaABAg', 'snippet': {'videoId': 'JsRIIhnquTA', 'textDisplay': 'Então  Romário com presidente aí eu dou valor', 'textOriginal': 'Então  Romário com presidente aí eu dou valor', 'authorDisplayName': 'Tarcísio aguiar 1113', 'authorProfileImageUrl': 'https://yt3.ggpht.com/9GmYMEtT8laYIH1R6FEML_F8he90h4ZKW9kOn3B7y7x5HqCVrfHhVqeGa1n88tQxRR0Y9cFIGoY=s48-c-k-c0x00ffffff-no-rj', 'authorChannelUrl': 'http://www.youtube.com/channel/UC56WG62l7sKiX8Z8bJ507BA', 'authorChannelId': {'value': 'UC56WG62l7sKiX8Z8bJ507BA'}, 'canRate': True, 'viewerRating': 'none', 'likeCount': 1, 'publishedAt': '2022-10-15T09:39:41Z', 'updatedAt': '2022-10-15T09:39:41Z'}}, 'canReply': True, 'totalReplyCount': 0, 'isPublic': True}",,UC56WG62l7sKiX8Z8bJ507BA,2022-10-15T09:39:41Z,Então  Romário com presidente aí eu dou valor,,2023-06-09 13:14:57.405884
youtube#commentThread,Z-kaOjTM61WgWGJUpee1JN5rneo,UgyJg6cO4-ik32BYh-p4AaABAg,"{'videoId': 'JsRIIhnquTA', 'topLevelComment': {'kind': 'youtube#comment', 'etag': '2q_eBjHRyrXoMo6thgxitlbCUT0', 'id': 'UgyJg6cO4-ik32BYh-p4AaABAg', 'snippet': {'videoId': 'JsRIIhnquTA', 'textDisplay': '45🇧🇷22', 'textOriginal': '45🇧🇷22', 'authorDisplayName': 'DANILO de GRAVATÁ', 'authorProfileImageUrl': 'https://yt3.ggpht.com/-Mdb1C3__0t1oHq0gnnCTgb2byQUVTBEbly2kPnF9SeEVQ0unSLmOBUUmLofDNYqKMHnuP0E=s48-c-k-c0x00ffffff-no-rj', 'authorChannelUrl': 'http://www.youtube.com/channel/UCRoF_5UWOUq0oPrxUc2MVHA', 'authorChannelId': {'value': 'UCRoF_5UWOUq0oPrxUc2MVHA'}, 'canRate': True, 'viewerRating': 'none', 'likeCount': 2, 'publishedAt': '2022-10-15T05:44:27Z', 'updatedAt': '2022-10-15T05:44:27Z'}}, 'canReply': True, 'totalReplyCount': 0, 'isPublic': True}",,UCRoF_5UWOUq0oPrxUc2MVHA,2022-10-15T05:44:27Z,45🇧🇷22,,2023-06-09 13:14:57.405884
youtube#commentThread,7qLvGhbeNczdoPMg2TpdRyOF1hs,UgzTKNTLpbHqueWXyH94AaABAg,"{'videoId': 'JsRIIhnquTA', 'topLevelComment': {'kind': 'youtube#comment', 'etag': 'eYdCbbt_u5DCnfx821pliwzbqu4', 'id': 'UgzTKNTLpbHqueWXyH94AaABAg', 'snippet': {'videoId': 'JsRIIhnquTA', 'textDisplay': '&quot;no meu governo não tem corrupção&quot; KKKKKKKKKKKK essas é das boas', 'textOriginal': '""no meu governo não tem corrupção"" KKKKKKKKKKKK essas é das boas', 'authorDisplayName': 'Vivi ferreira Santos', 'authorProfileImageUrl': 'https://yt3.ggpht.com/ytc/AGIKgqPPkddMe-uxf5-YrpA42DvBYsvY4RkFlgfu2Q=s48-c-k-c0x00ffffff-no-rj', 'authorChannelUrl': 'http://www.youtube.com/channel/UCiqt-GueZeU-RP0-jf_H1NQ', 'authorChannelId': {'value': 'UCiqt-GueZeU-RP0-jf_H1NQ'}, 'canRate': True, 'viewerRating': 'none', 'likeCount': 1, 'publishedAt': '2022-10-15T05:08:46Z', 'updatedAt': '2022-10-15T05:08:46Z'}}, 'canReply': True, 'totalReplyCount': 0, 'isPublic': True}",,UCiqt-GueZeU-RP0-jf_H1NQ,2022-10-15T05:08:46Z,"""no meu governo não tem corrupção"" KKKKKKKKKKKK essas é das boas",,2023-06-09 13:14:57.405884
youtube#commentThread,OkP7btZTwPyr5CrcrPAiGZKm0lc,UgwJdbRyySAEhs1gZjx4AaABAg,"{'videoId': 'JsRIIhnquTA', 'topLevelComment': {'kind': 'youtube#comment', 'etag': 'O0URmkC19xpc1NIprVMByYYFce4', 'id': 'UgwJdbRyySAEhs1gZjx4AaABAg', 'snippet': {'videoId': 'JsRIIhnquTA', 'textDisplay': 'Ele falando que não era do centrão agora fala que deu uma parte pro centão kkkkk isso mente que nem sente faz o L', 'textOriginal': 'Ele falando que não era do centrão agora fala que deu uma parte pro centão kkkkk isso mente que nem sente faz o L', 'authorDisplayName': 'Bidu 444', 'authorProfileImageUrl': 'https://yt3.ggpht.com/omETB7b0UOBdtwIVSWfTXIMUXv5cGqscVXdElYApr0PMtfgW0Va1eKzCg26oCeR5VphowdnNFg=s48-c-k-c0x00ffffff-no-rj', 'authorChannelUrl': 'http://www.youtube.com/channel/UCzqlF5IH-yNRmkJ8Qtzc89w', 'authorChannelId': {'value': 'UCzqlF5IH-yNRmkJ8Qtzc89w'}, 'canRate': True, 'viewerRating': 'none', 'likeCount': 1, 'publishedAt': '2022-10-15T03:30:52Z', 'updatedAt': '2022-10-15T03:30:52Z'}}, 'canReply': True, 'totalReplyCount': 3, 'isPublic': True}","{'comments': [{'kind': 'youtube#comment', 'etag': 'GhOJMpxVGtMbZP_C-C99iwx4ocU', 'id': 'UgwJdbRyySAEhs1gZjx4AaABAg.9hBYKkf7Ers9hFZw-iqalU', 'snippet': {'videoId': 'JsRIIhnquTA', 'textDisplay': '@Ruthy Saraiva português ta tudo Ok por aqui 🤣🤣', 'textOriginal': '@Ruthy Saraiva português ta tudo Ok por aqui 🤣🤣', 'parentId': 'UgwJdbRyySAEhs1gZjx4AaABAg', 'authorDisplayName': 'silva', 'authorProfileImageUrl': 'https://yt3.ggpht.com/WDO163fYSOFOYBwa_y6ht5aeM9y4DgL57XyEbW6LDPRlhcEMSh4tjxE3wqEzrP0qKEUtIzjUpoA=s48-c-k-c0x00ffffff-no-rj', 'authorChannelUrl': 'http://www.youtube.com/channel/UCE5uqpVn7ls2259lObfe-6g', 'authorChannelId': {'value': 'UCE5uqpVn7ls2259lObfe-6g'}, 'canRate': True, 'viewerRating': 'none', 'likeCount': 0, 'publishedAt': '2022-10-16T17:01:47Z', 'updatedAt': '2022-10-16T17:01:47Z'}}, {'kind': 'youtube#comment', 'etag': 'Ese89Dm3VK37nKQBuG9o_dRBSiQ', 'id': 'UgwJdbRyySAEhs1gZjx4AaABAg.9hBYKkf7Ers9hBmndp-e7k', 'snippet': {'videoId': 'JsRIIhnquTA', 'textDisplay': '22', 'textOriginal': '22', 'parentId': 'UgwJdbRyySAEhs1gZjx4AaABAg', 'authorDisplayName': 'DANILO de GRAVATÁ', 'authorProfileImageUrl': 'https://yt3.ggpht.com/-Mdb1C3__0t1oHq0gnnCTgb2byQUVTBEbly2kPnF9SeEVQ0unSLmOBUUmLofDNYqKMHnuP0E=s48-c-k-c0x00ffffff-no-rj', 'authorChannelUrl': 'http://www.youtube.com/channel/UCRoF_5UWOUq0oPrxUc2MVHA', 'authorChannelId': {'value': 'UCRoF_5UWOUq0oPrxUc2MVHA'}, 'canRate': True, 'viewerRating': 'none', 'likeCount': 1, 'publishedAt': '2022-10-15T05:46:01Z', 'updatedAt': '2022-10-15T05:46:01Z'}}, {'kind': 'youtube#comment', 'etag': 'KF_cyFO6kYcX2vHV1dL1oKnfpi0', 'id': 'UgwJdbRyySAEhs1gZjx4AaABAg.9hBYKkf7Ers9hBaSxh6yVg', 'snippet': {'videoId': 'JsRIIhnquTA', 'textDisplay': 'Fas l de ladrão .', 'textOriginal': 'Fas l de ladrão .', 'parentId': 'UgwJdbRyySAEhs1gZjx4AaABAg', 'authorDisplayName': 'Ruthy Saraiva', 'authorProfileImageUrl': 'https://yt3.ggpht.com/ytc/AGIKgqOTTPvfdeR3S-SpdV_FA8vQyQ7LHh5RPq3kqswSZpo4qfuP2sCSuL4oPMxkZg0O=s48-c-k-c0x00ffffff-no-rj', 'authorChannelUrl': 'http://www.youtube.com/channel/UCzQleAt5fFlOp34ti4QBeOQ', 'authorChannelId': {'value': 'UCzQleAt5fFlOp34ti4QBeOQ'}, 'canRate': True, 'viewerRating': 'none', 'likeCount': 2, 'publishedAt': '2022-10-15T03:58:12Z', 'updatedAt': '2022-10-15T03:58:12Z'}}]}",UCzqlF5IH-yNRmkJ8Qtzc89w,2022-10-15T03:30:52Z,Ele falando que não era do centrão agora fala que deu uma parte pro centão kkkkk isso mente que nem sente faz o L,,2023-06-09 13:14:57.405884
