kind,etag,id,snippet,replies,authorChannelId,publishedAt,textOriginal,nextPageToken,extraction_date
youtube#commentThread,wGpHNr_Zv4wYOy1443OWRF_xWPo,Ugy0oxMdkWwnpQs3I9V4AaABAg,"{'videoId': 'JsRIIhnquTA', 'topLevelComment': {'kind': 'youtube#comment', 'etag': 'kvnlHbr5uw0JpP25cA79Owa9_jQ', 'id': 'Ugy0oxMdkWwnpQs3I9V4AaABAg', 'snippet': {'videoId': 'JsRIIhnquTA', 'textDisplay': 'Lula ganhou primeiro turno, e ganha segundo turno. 13,13,13', 'textOriginal': 'Lula ganhou primeiro turno, e ganha segundo turno. 13,13,13', 'authorDisplayName': 'jacira morais', 'authorProfileImageUrl': 'https://yt3.ggpht.com/ytc/AGIKgqPvur3GU_P6rMt6iKuOV6kEnZXASFV2tk-MHVWZ28flM3xnuOqlGfDpXLEF38Xy=s48-c-k-c0x00ffffff-no-rj', 'authorChannelUrl': 'http://www.youtube.com/channel/UC_qHhpYnoYV5Z_xCrjXj8iw', 'authorChannelId': {'value': 'UC_qHhpYnoYV5Z_xCrjXj8iw'}, 'canRate': True, 'viewerRating': 'none', 'likeCount': 1, 'publishedAt': '2022-10-15T02:51:10Z', 'updatedAt': '2022-10-15T02:51:10Z'}}, 'canReply': True, 'totalReplyCount': 3, 'isPublic': True}","{'comments': [{'kind': 'youtube#comment', 'etag': 'WShv4AHT3DKCmoSDMp-d-3PpHZQ', 'id': 'Ugy0oxMdkWwnpQs3I9V4AaABAg.9hBTmuP_l9S9hF_Te4k-5p', 'snippet': {'videoId': 'JsRIIhnquTA', 'textDisplay': '@Ruthy Saraiva tu vai ver quem vai cair kkkkk', 'textOriginal': '@Ruthy Saraiva tu vai ver quem vai cair kkkkk', 'parentId': 'Ugy0oxMdkWwnpQs3I9V4AaABAg', 'authorDisplayName': 'silva', 'authorProfileImageUrl': 'https://yt3.ggpht.com/WDO163fYSOFOYBwa_y6ht5aeM9y4DgL57XyEbW6LDPRlhcEMSh4tjxE3wqEzrP0qKEUtIzjUpoA=s48-c-k-c0x00ffffff-no-rj', 'authorChannelUrl': 'http://www.youtube.com/channel/UCE5uqpVn7ls2259lObfe-6g', 'authorChannelId': {'value': 'UCE5uqpVn7ls2259lObfe-6g'}, 'canRate': True, 'viewerRating': 'none', 'likeCount': 0, 'publishedAt': '2022-10-16T17:06:31Z', 'updatedAt': '2022-10-16T17:06:31Z'}}, {'kind': 'youtube#comment', 'etag': 'FDFbDWe5r3u937bJ7rGHqknmvsQ', 'id': 'Ugy0oxMdkWwnpQs3I9V4AaABAg.9hBTmuP_l9S9hBa_NypN-M', 'snippet': {'videoId': 'JsRIIhnquTA', 'textDisplay': 'Em nome de jesus ja perdeu .', 'textOriginal': 'Em nome de jesus ja perdeu .', 'parentId': 'Ugy0oxMdkWwnpQs3I9V4AaABAg', 'authorDisplayName': 'Ruthy Saraiva', 'authorProfileImageUrl': 'https://yt3.ggpht.com/ytc/AGIKgqOTTPvfdeR3S-SpdV_FA8vQyQ7LHh5RPq3kqswSZpo4qfuP2sCSuL4oPMxkZg0O=s48-c-k-c0x00ffffff-no-rj', 'authorChannelUrl': 'http://www.youtube.com/channel/UCzQleAt5fFlOp34ti4QBeOQ', 'authorChannelId': {'value': 'UCzQleAt5fFlOp34ti4QBeOQ'}, 'canRate': True, 'viewerRating': 'none', 'likeCount': 1, 'publishedAt': '2022-10-15T03:59:13Z', 'updatedAt': '2022-10-15T03:59:13Z'}}, {'kind': 'youtube#comment', 'etag': 'ynJpfnU_rpcVeX4Y-TtZQ1kR44w', 'id': 'Ugy0oxMdkWwnpQs3I9V4AaABAg.9hBTmuP_l9S9hBaX3hEJyi', 'snippet': {'videoId': 'JsRIIhnquTA', 'textDisplay': 'Ja caiu por terra esse demonio .', 'textOriginal': 'Ja caiu por terra esse demonio .', 'parentId': 'Ugy0oxMdkWwnpQs3I9V4AaABAg', 'authorDisplayName': 'Ruthy Saraiva', 'authorProfileImageUrl': 'https://yt3.ggpht.com/ytc/AGIKgqOTTPvfdeR3S-SpdV_FA8vQyQ7LHh5RPq3kqswSZpo4qfuP2sCSuL4oPMxkZg0O=s48-c-k-c0x00ffffff-no-rj', 'authorChannelUrl': 'http://www.youtube.com/channel/UCzQleAt5fFlOp34ti4QBeOQ', 'authorChannelId': {'value': 'UCzQleAt5fFlOp34ti4QBeOQ'}, 'canRate': True, 'viewerRating': 'none', 'likeCount': 1, 'publishedAt': '2022-10-15T03:58:46Z', 'updatedAt': '2022-10-15T03:58:46Z'}}]}",UC_qHhpYnoYV5Z_xCrjXj8iw,2022-10-15T02:51:10Z,"Lula ganhou primeiro turno, e ganha segundo turno. 13,13,13",,2023-06-09 13:14:57.405884
youtube#commentThread,fka5JAgyP42bxkYAlVFMJjBx3EA,UgytUk5RbtBx8Sm94pJ4AaABAg,"{'videoId': 'JsRIIhnquTA', 'topLevelComment': {'kind': 'youtube#comment', 'etag': 'TuzMndJaKd8DhZhJG1g3gHcpgdk', 'id': 'UgytUk5RbtBx8Sm94pJ4AaABAg', 'snippet': {'videoId': 'JsRIIhnquTA', 'textDisplay': 'Sou do nordeste ... <br>precisamos já ajuda de Mg pra virar esse jogo , vamos ganhar 22', 'textOriginal': 'Sou do nordeste ... \\nprecisamos já ajuda de Mg pra virar esse jogo , vamos ganhar 22', 'authorDisplayName': 'Eduardo Alves', 'authorProfileImageUrl': 'https://yt3.ggpht.com/ytc/AGIKgqNE5opA-Aej0PKeRnFf7XEyh13gCgdnhhIKWM8se55ZmBBbblFbyU0ks_aIeIZH=s48-c-k-c0x00ffffff-no-rj', 'authorChannelUrl': 'http://www.youtube.com/channel/UCI2N9kQ2t3iABFBjth45rDg', 'authorChannelId': {'value': 'UCI2N9kQ2t3iABFBjth45rDg'}, 'canRate': True, 'viewerRating': 'none', 'likeCount': 11, 'publishedAt': '2022-10-15T02:50:35Z', 'updatedAt': '2022-10-15T02:50:35Z'}}, 'canReply': True, 'totalReplyCount': 0, 'isPublic': True}",,UCI2N9kQ2t3iABFBjth45rDg,2022-10-15T02:50:35Z,"Sou do nordeste ... 
precisamos já ajuda de Mg pra virar esse jogo , vamos ganhar 22",,2023-06-09 13:14:57.405884
youtube#commentThread,sYG9DLPA9mwMQgf7CBWYhDbn674,Ugz9ZK6XB9pEE5Os3s54AaABAg,"{'videoId': 'JsRIIhnquTA', 'topLevelComment': {'kind': 'youtube#comment', 'etag': '0WFtU62gdSdWbbTWZ82tQikk0EM', 'id': 'Ugz9ZK6XB9pEE5Os3s54AaABAg', 'snippet': {'videoId': 'JsRIIhnquTA', 'textDisplay': 'Esse governo entrou em atrito com os principais parceiros comerciais do Brasil, só se entrosa melhor com os governos ditatoriais da Rússia e alguns do oriente médio,nada cristão.', 'textOriginal': 'Esse governo entrou em atrito com os principais parceiros comerciais do Brasil, só se entrosa melhor com os governos ditatoriais da Rússia e alguns do oriente médio,nada cristão.', 'authorDisplayName': 'Jefferson Antônio Barbi', 'authorProfileImageUrl': 'https://yt3.ggpht.com/ytc/AGIKgqNXSuajoeMif5yp26c39tE5aZTDXJpOkOGXKA=s48-c-k-c0x00ffffff-no-rj', 'authorChannelUrl': 'http://www.youtube.com/channel/UC7TjlyYjO61JB9l2nctHxeQ', 'authorChannelId': {'value': 'UC7TjlyYjO61JB9l2nctHxeQ'}, 'canRate': True, 'viewerRating': 'none', 'likeCount': 0, 'publishedAt': '2022-10-15T02:23:56Z', 'updatedAt': '2022-10-15T02:23:56Z'}}, 'canReply': True, 'totalReplyCount': 0, 'isPublic': True}",,UC7TjlyYjO61JB9l2nctHxeQ,2022-10-15T02:23:56Z,"Esse governo entrou em atrito com os principais parceiros comerciais do Brasil, só se entrosa melhor com os governos ditatoriais da Rússia e alguns do oriente médio,nada cristão.",,2023-06-09 13:14:57.405884
youtube#commentThread,UzfLvlchU685XENPTVNk3X20hAQ,UgyoOC44o_oWi70myWB4AaABAg,"{'videoId': 'JsRIIhnquTA', 'topLevelComment': {'kind': 'youtube#comment', 'etag': 'RpEbvUTPtK54R3nkBJrSCfWAltg', 'id': 'UgyoOC44o_oWi70myWB4AaABAg', 'snippet': {'videoId': 'JsRIIhnquTA', 'textDisplay': 'Parece que a campanha bolsonarista se baseia no linchamento moral, só aceita bajuladores e submissos, verdadeira ditadura, induz o Ódio e a INTOLERÂNCIA por meio de faknews e desinformação, parece querer guerra civil e religiosa, que chamam de guerra espiritual,nada cristão, enganando muitos.', 'textOriginal': 'Parece que a campanha bolsonarista se baseia no linchamento moral, só aceita bajuladores e submissos, verdadeira ditadura, induz o Ódio e a INTOLERÂNCIA por meio de faknews e desinformação, parece querer guerra civil e religiosa, que chamam de guerra espiritual,nada cristão, enganando muitos.', 'authorDisplayName': 'Jefferson Antônio Barbi', 'authorProfileImageUrl': 'https://yt3.ggpht.com/ytc/AGIKgqNXSuajoeMif5yp26c39tE5aZTDXJpOkOGXKA=s48-c-k-c0x00ffffff-no-rj', 'authorChannelUrl': 'http://www.youtube.com/channel/UC7TjlyYjO61JB9l2nctHxeQ', 'authorChannelId': {'value': 'UC7TjlyYjO61JB9l2nctHxeQ'}, 'canRate': True, 'viewerRating': 'none', 'likeCount': 0, 'publishedAt': '2022-10-15T02:21:17Z', 'updatedAt': '2022-10-15T02:21:17Z'}}, 'canReply': True, 'totalReplyCount': 0, 'isPublic': True}",,UC7TjlyYjO61JB9l2nctHxeQ,2022-10-15T02:21:17Z,"Parece que a campanha bolsonarista se baseia no linchamento moral, só aceita bajuladores e submissos, verdadeira ditadura, induz o Ódio e a INTOLERÂNCIA por meio de faknews e desinformação, parece querer guerra civil e religiosa, que chamam de guerra espiritual,nada cristão, enganando muitos.",,2023-06-09 13:14:57.405884
youtube#commentThread,wNgw_ogbf2ZXgAmLM0w03Rb7dQk,UgyeDRvN8czkkDZK1xV4AaABAg,"{'videoId': 'JsRIIhnquTA', 'topLevelComment': {'kind': 'youtube#comment', 'etag': 'ooT0R4m4g0c9AUdiDeUpeBgiLIo', 'id': 'UgyeDRvN8czkkDZK1xV4AaABAg', 'snippet': {'videoId': 'JsRIIhnquTA', 'textDisplay': 'Bolsonaro 22.🇧🇷🇧🇷🇧🇷🇧🇷🇧🇷', 'textOriginal': 'Bolsonaro 22.🇧🇷🇧🇷🇧🇷🇧🇷🇧🇷', 'authorDisplayName': 'Rita Rocha', 'authorProfileImageUrl': 'https://yt3.ggpht.com/ytc/AGIKgqNm9sbSNRvOJgEYoZj38cmY3TRMU-Zy6tYi=s48-c-k-c0x00ffffff-no-rj', 'authorChannelUrl': 'http://www.youtube.com/channel/UCEWmAhJx71sXEE4hpGmlvfg', 'authorChannelId': {'value': 'UCEWmAhJx71sXEE4hpGmlvfg'}, 'canRate': True, 'viewerRating': 'none', 'likeCount': 3, 'publishedAt': '2022-10-15T02:18:22Z', 'updatedAt': '2022-10-15T02:18:22Z'}}, 'canReply': True, 'totalReplyCount': 0, 'isPublic': True}",,UCEWmAhJx71sXEE4hpGmlvfg,2022-10-15T02:18:22Z,Bolsonaro 22.🇧🇷🇧🇷🇧🇷🇧🇷🇧🇷,,2023-06-09 13:14:57.405884
youtube#commentThread,mYvpQhvUskDqLkqI3-2VMuQ34_I,UgzbYipo7uQwdveKsnR4AaABAg,"{'videoId': 'JsRIIhnquTA', 'topLevelComment': {'kind': 'youtube#comment', 'etag': 'ISsjewD_PpQI_6MnQ5CbPRIdkLY', 'id': 'UgzbYipo7uQwdveKsnR4AaABAg', 'snippet': {'videoId': 'JsRIIhnquTA', 'textDisplay': 'Quero ver se o catinguento tem esse pique e resistencia........so c a cachaça....', 'textOriginal': 'Quero ver se o catinguento tem esse pique e resistencia........so c a cachaça....', 'authorDisplayName': 'ednei medeiros', 'authorProfileImageUrl': 'https://yt3.ggpht.com/ytc/AGIKgqMScEWmyhUnfBCKvXDQHq3ONtewkP-xxszPSw=s48-c-k-c0x00ffffff-no-rj', 'authorChannelUrl': 'http://www.youtube.com/channel/UCAxUx-9XqU9d1MHBV78oVdA', 'authorChannelId': {'value': 'UCAxUx-9XqU9d1MHBV78oVdA'}, 'canRate': True, 'viewerRating': 'none', 'likeCount': 4, 'publishedAt': '2022-10-15T01:47:08Z', 'updatedAt': '2022-10-15T01:47:08Z'}}, 'canReply': True, 'totalReplyCount': 0, 'isPublic': True}",,UCAxUx-9XqU9d1MHBV78oVdA,2022-10-15T01:47:08Z,Quero ver se o catinguento tem esse pique e resistencia........so c a cachaça....,,2023-06-09 13:14:57.405884
youtube#commentThread,bS8iPoJYieYm924lu1VJf0AJWMU,UgymOQH5--f4aBYbRYB4AaABAg,"{'videoId': 'JsRIIhnquTA', 'topLevelComment': {'kind': 'youtube#comment', 'etag': 'G9Uni-7W9lbvOA0g2koTAYwGRz4', 'id': 'UgymOQH5--f4aBYbRYB4AaABAg', 'snippet': {'videoId': 'JsRIIhnquTA', 'textDisplay': 'B B22 B22 B22 B22 B22 B22 B22 B22 B22 B22 B22 B22', 'textOriginal': 'B B22 B22 B22 B22 B22 B22 B22 B22 B22 B22 B22 B22', 'authorDisplayName': 'ednei medeiros', 'authorProfileImageUrl': 'https://yt3.ggpht.com/ytc/AGIKgqMScEWmyhUnfBCKvXDQHq3ONtewkP-xxszPSw=s48-c-k-c0x00ffffff-no-rj', 'authorChannelUrl': 'http://www.youtube.com/channel/UCAxUx-9XqU9d1MHBV78oVdA', 'authorChannelId': {'value': 'UCAxUx-9XqU9d1MHBV78oVdA'}, 'canRate': True, 'viewerRating': 'none', 'likeCount': 1, 'publishedAt': '2022-10-15T01:44:53Z', 'updatedAt': '2022-10-15T01:44:53Z'}}, 'canReply': True, 'totalReplyCount': 0, 'isPublic': True}",,UCAxUx-9XqU9d1MHBV78oVdA,2022-10-15T01:44:53Z,B B22 B22 B22 B22 B22 B22 B22 B22 B22 B22 B22 B22,,2023-06-09 13:14:57.405884
youtube#commentThread,06PL1u6ldKgQ_NGXp1ezzBoFnhg,UgyJ9GEcG17prKd3vZN4AaABAg,"{'videoId': 'JsRIIhnquTA', 'topLevelComment': {'kind': 'youtube#comment', 'etag': 'ZzlPlRVREG7VrmERWq7BC9L4HdU', 'id': 'UgyJ9GEcG17prKd3vZN4AaABAg', 'snippet': {'videoId': 'JsRIIhnquTA', 'textDisplay': 'Vamos enterrar o carniça de vez....', 'textOriginal': 'Vamos enterrar o carniça de vez....', 'authorDisplayName': 'ednei medeiros', 'authorProfileImageUrl': 'https://yt3.ggpht.com/ytc/AGIKgqMScEWmyhUnfBCKvXDQHq3ONtewkP-xxszPSw=s48-c-k-c0x00ffffff-no-rj', 'authorChannelUrl': 'http://www.youtube.com/channel/UCAxUx-9XqU9d1MHBV78oVdA', 'authorChannelId': {'value': 'UCAxUx-9XqU9d1MHBV78oVdA'}, 'canRate': True, 'viewerRating': 'none', 'likeCount': 1, 'publishedAt': '2022-10-15T01:44:10Z', 'updatedAt': '2022-10-15T01:44:10Z'}}, 'canReply': True, 'totalReplyCount': 0, 'isPublic': True}",,UCAxUx-9XqU9d1MHBV78oVdA,2022-10-15T01:44:10Z,Vamos enterrar o carniça de vez....,,2023-06-09 13:14:57.405884
youtube#commentThread,zEcDYhPcQh9pvBz_ktg_GNKKBH4,UgyayN9zIhko5hNswZd4AaABAg,"{'videoId': 'JsRIIhnquTA', 'topLevelComment': {'kind': 'youtube#comment', 'etag': 'krvJzlRBkDQdhdxAFoEL8O_Hp1c', 'id': 'UgyayN9zIhko5hNswZd4AaABAg', 'snippet': {'videoId': 'JsRIIhnquTA', 'textDisplay': 'Bolsonaro é mto diferente daquele deputado que um dia lutou pela presidencia. Falar que não houve corrupção em seu governo melhor calar a boca. Não mudou mto os corrutos nem seus atos. O que não puderam roubar tbm nada fizeram. Ficou como se estivessemos abandonados.', 'textOriginal': 'Bolsonaro é mto diferente daquele deputado que um dia lutou pela presidencia. Falar que não houve corrupção em seu governo melhor calar a boca. Não mudou mto os corrutos nem seus atos. O que não puderam roubar tbm nada fizeram. Ficou como se estivessemos abandonados.', 'authorDisplayName': 'Bernadete Casarin', 'authorProfileImageUrl': 'https://yt3.ggpht.com/ytc/AGIKgqM0XMHd6wEIq8bZ8tZIDIOL2_GLQp1UJIfCWQ=s48-c-k-c0x00ffffff-no-rj', 'authorChannelUrl': 'http://www.youtube.com/channel/UC946QfSp4l-vIz_sauOrrUQ', 'authorChannelId': {'value': 'UC946QfSp4l-vIz_sauOrrUQ'}, 'canRate': True, 'viewerRating': 'none', 'likeCount': 0, 'publishedAt': '2022-10-15T01:43:56Z', 'updatedAt': '2022-10-15T01:43:56Z'}}, 'canReply': True, 'totalReplyCount': 0, 'isPublic': True}",,UC946QfSp4l-vIz_sauOrrUQ,2022-10-15T01:43:56Z,Bolsonaro é mto diferente daquele deputado que um dia lutou pela presidencia. Falar que não houve corrupção em seu governo melhor calar a boca. Não mudou mto os corrutos nem seus atos. O que não puderam roubar tbm nada fizeram. Ficou como se estivessemos abandonados.,,2023-06-09 13:14:57.405884
youtube#commentThread,n4rHON-7BBx_92NG6UvKsB_VbYI,UgyFZOauDjd-4eRMSGV4AaABAg,"{'videoId': 'JsRIIhnquTA', 'topLevelComment': {'kind': 'youtube#comment', 'etag': 'mRYUzmbCdM7MW_ZAFmoe5PH35Zk', 'id': 'UgyFZOauDjd-4eRMSGV4AaABAg', 'snippet': {'videoId': 'JsRIIhnquTA', 'textDisplay': 'Bolsonaro invejoso ogro😭', 'textOriginal': 'Bolsonaro invejoso ogro😭', 'authorDisplayName': 'ivonezinha', 'authorProfileImageUrl': 'https://yt3.ggpht.com/ytc/AGIKgqN9jdTU3Ed_WY24Rw3dZiiBYN6Wk7V4xsatlc3bQuyK5a2W0-BuOZcBRVATWal7=s48-c-k-c0x00ffffff-no-rj', 'authorChannelUrl': 'http://www.youtube.com/channel/UCmcwusYboctYasuPx-k0ETA', 'authorChannelId': {'value': 'UCmcwusYboctYasuPx-k0ETA'}, 'canRate': True, 'viewerRating': 'none', 'likeCount': 0, 'publishedAt': '2022-10-15T01:42:19Z', 'updatedAt': '2022-10-15T01:42:19Z'}}, 'canReply': True, 'totalReplyCount': 0, 'isPublic': True}",,UCmcwusYboctYasuPx-k0ETA,2022-10-15T01:42:19Z,Bolsonaro invejoso ogro😭,,2023-06-09 13:14:57.405884
youtube#commentThread,AlwDgPXGAxyu4BaLwHDSYY10XsE,UgxLbuz13KkzRHSA55l4AaABAg,"{'videoId': 'JsRIIhnquTA', 'topLevelComment': {'kind': 'youtube#comment', 'etag': '_z_w9v3fJcEKCk2ytayoaEnEtU8', 'id': 'UgxLbuz13KkzRHSA55l4AaABAg', 'snippet': {'videoId': 'JsRIIhnquTA', 'textDisplay': 'Bolsonaro tem que parar de dizer que seu governo não teve corrupção. Bilhões da saúde pública desviados, dolares nas calças e cueca de políticos com sem punição, as vacinas que nunca chegou, governador do nordeste pagando 20 milhões por  estacionamento,denuncias de fraudes pra td lado sem qualquer punição e Bolsonaro diz quê; não houve corrupção? Sou de direita mas, não aceito me subestimar. Lamentável! Bolsonaro é mto diferente daquele que um dia deputado lutou por uma presidencia. Aff', 'textOriginal': 'Bolsonaro tem que parar de dizer que seu governo não teve corrupção. Bilhões da saúde pública desviados, dolares nas calças e cueca de políticos com sem punição, as vacinas que nunca chegou, governador do nordeste pagando 20 milhões por  estacionamento,denuncias de fraudes pra td lado sem qualquer punição e Bolsonaro diz quê; não houve corrupção? Sou de direita mas, não aceito me subestimar. Lamentável! Bolsonaro é mto diferente daquele que um dia deputado lutou por uma presidencia. Aff', 'authorDisplayName': 'Bernadete Casarin', 'authorProfileImageUrl': 'https://yt3.ggpht.com/ytc/AGIKgqM0XMHd6wEIq8bZ8tZIDIOL2_GLQp1UJIfCWQ=s48-c-k-c0x00ffffff-no-rj', 'authorChannelUrl': 'http://www.youtube.com/channel/UC946QfSp4l-vIz_sauOrrUQ', 'authorChannelId': {'value': 'UC946QfSp4l-vIz_sauOrrUQ'}, 'canRate': True, 'viewerRating': 'none', 'likeCount': 1, 'publishedAt': '2022-10-15T01:40:01Z', 'updatedAt': '2022-10-15T01:40:01Z'}}, 'canReply': True, 'totalReplyCount': 0, 'isPublic': True}",,UC946QfSp4l-vIz_sauOrrUQ,2022-10-15T01:40:01Z,"Bolsonaro tem que parar de dizer que seu governo não teve corrupção. Bilhões da saúde pública desviados, dolares nas calças e cueca de políticos com sem punição, as vacinas que nunca chegou, governador do nordeste pagando 20 milhões por  estacionamento,denuncias de fraudes pra td lado sem qualquer punição e Bolsonaro diz quê; não houve corrupção? Sou de direita mas, não aceito me subestimar. Lamentável! Bolsonaro é mto diferente daquele que um dia deputado lutou por uma presidencia. Aff",,2023-06-09 13:14:57.405884
youtube#commentThread,6rc2Cq7-lbTYI2P6mrPqKu8FJNg,UgxCYLDhzgLnacf0zNV4AaABAg,"{'videoId': 'JsRIIhnquTA', 'topLevelComment': {'kind': 'youtube#comment', 'etag': 'fHdCi0A3ZCSFPwE8ROyJHWna7hw', 'id': 'UgxCYLDhzgLnacf0zNV4AaABAg', 'snippet': {'videoId': 'JsRIIhnquTA', 'textDisplay': 'Aqui em Osasco e Bolsonaro  suave', 'textOriginal': 'Aqui em Osasco e Bolsonaro  suave', 'authorDisplayName': 'Lauo da silva Silva', 'authorProfileImageUrl': 'https://yt3.ggpht.com/ytc/AGIKgqPDynQyGKMOTNUQx7QCzrB1sEAH5owuMXxwvkDFBsHbrnfnIEc21NkaDg6NeVxk=s48-c-k-c0x00ffffff-no-rj', 'authorChannelUrl': 'http://www.youtube.com/channel/UCJP1poFyBDKeT9EGGEgXtcg', 'authorChannelId': {'value': 'UCJP1poFyBDKeT9EGGEgXtcg'}, 'canRate': True, 'viewerRating': 'none', 'likeCount': 6, 'publishedAt': '2022-10-15T01:32:26Z', 'updatedAt': '2022-10-15T01:32:26Z'}}, 'canReply': True, 'totalReplyCount': 0, 'isPublic': True}",,UCJP1poFyBDKeT9EGGEgXtcg,2022-10-15T01:32:26Z,Aqui em Osasco e Bolsonaro  suave,,2023-06-09 13:14:57.405884
youtube#commentThread,4r7H-LSDFXr3XCJ7JLdU4h-PbfE,UgwtzWXIJvA8Qd3ovDN4AaABAg,"{'videoId': 'JsRIIhnquTA', 'topLevelComment': {'kind': 'youtube#comment', 'etag': 'zqX-uv1ZHpRP7VDJCuR9n6WMbI0', 'id': 'UgwtzWXIJvA8Qd3ovDN4AaABAg', 'snippet': {'videoId': 'JsRIIhnquTA', 'textDisplay': 'Bolsonaro na cadeia', 'textOriginal': 'Bolsonaro na cadeia', 'authorDisplayName': 'Rita de Cássia Nascimento', 'authorProfileImageUrl': 'https://yt3.ggpht.com/imiDiV8Cx0ZpjTbUeSGDanbumzAE8v6txjeKg_WyTm5UNMvFvlGWAodSwOsqdNl9SLBjepyJ=s48-c-k-c0x00ffffff-no-rj', 'authorChannelUrl': 'http://www.youtube.com/channel/UCrDGvcPybxbXvkAH13p2Oxw', 'authorChannelId': {'value': 'UCrDGvcPybxbXvkAH13p2Oxw'}, 'canRate': True, 'viewerRating': 'none', 'likeCount': 1, 'publishedAt': '2022-10-15T01:31:57Z', 'updatedAt': '2022-10-15T01:31:57Z'}}, 'canReply': True, 'totalReplyCount': 5, 'isPublic': True}","{'comments': [{'kind': 'youtube#comment', 'etag': 'NuBI-8beAUz7cRLIp3ezDBkANnE', 'id': 'UgwtzWXIJvA8Qd3ovDN4AaABAg.9hBKioDJydl9hF_Bd5H7LF', 'snippet': {'videoId': 'JsRIIhnquTA', 'textDisplay': '@Ruthy Saraiva 🤣🤣🤣🤣', 'textOriginal': '@Ruthy Saraiva 🤣🤣🤣🤣', 'parentId': 'UgwtzWXIJvA8Qd3ovDN4AaABAg', 'authorDisplayName': 'silva', 'authorProfileImageUrl': 'https://yt3.ggpht.com/WDO163fYSOFOYBwa_y6ht5aeM9y4DgL57XyEbW6LDPRlhcEMSh4tjxE3wqEzrP0qKEUtIzjUpoA=s48-c-k-c0x00ffffff-no-rj', 'authorChannelUrl': 'http://www.youtube.com/channel/UCE5uqpVn7ls2259lObfe-6g', 'authorChannelId': {'value': 'UCE5uqpVn7ls2259lObfe-6g'}, 'canRate': True, 'viewerRating': 'none', 'likeCount': 0, 'publishedAt': '2022-10-16T17:04:04Z', 'updatedAt': '2022-10-16T17:04:04Z'}}, {'kind': 'youtube#comment', 'etag': 'XHVgZ_Ya8_sw9-0Ps-LnnxoGUpo', 'id': 'UgwtzWXIJvA8Qd3ovDN4AaABAg.9hBKioDJydl9hCmnriSbip', 'snippet': {'videoId': 'JsRIIhnquTA', 'textDisplay': '@José Carlos Gomes da silva <br>Vai não bolsonarento Miliciano, se o Mito não fugir, ele vai passar um boa temporada em Bangu 8 será ele.', 'textOriginal': '@José Carlos Gomes da silva \\nVai não bolsonarento Miliciano, se o Mito não fugir, ele vai passar um boa temporada em Bangu 8 será ele.', 'parentId': 'UgwtzWXIJvA8Qd3ovDN4AaABAg', 'authorDisplayName': 'Rita de Cássia Nascimento', 'authorProfileImageUrl': 'https://yt3.ggpht.com/imiDiV8Cx0ZpjTbUeSGDanbumzAE8v6txjeKg_WyTm5UNMvFvlGWAodSwOsqdNl9SLBjepyJ=s48-c-k-c0x00ffffff-no-rj', 'authorChannelUrl': 'http://www.youtube.com/channel/UCrDGvcPybxbXvkAH13p2Oxw', 'authorChannelId': {'value': 'UCrDGvcPybxbXvkAH13p2Oxw'}, 'canRate': True, 'viewerRating': 'none', 'likeCount': 0, 'publishedAt': '2022-10-15T15:05:17Z', 'updatedAt': '2022-10-15T15:05:17Z'}}, {'kind': 'youtube#comment', 'etag': 'PvdetOg2KSsYvAGsWTfWYEoJ78I', 'id': 'UgwtzWXIJvA8Qd3ovDN4AaABAg.9hBKioDJydl9hCmagAnL2D', 'snippet': {'videoId': 'JsRIIhnquTA', 'textDisplay': '@Ruthy Saraiva <br>Vai não fraquejada! Quem vai para Bangu 8 é o Mito, isto é, se ele não fugir antes.', 'textOriginal': '@Ruthy Saraiva \\nVai não fraquejada! Quem vai para Bangu 8 é o Mito, isto é, se ele não fugir antes.', 'parentId': 'UgwtzWXIJvA8Qd3ovDN4AaABAg', 'authorDisplayName': 'Rita de Cássia Nascimento', 'authorProfileImageUrl': 'https://yt3.ggpht.com/imiDiV8Cx0ZpjTbUeSGDanbumzAE8v6txjeKg_WyTm5UNMvFvlGWAodSwOsqdNl9SLBjepyJ=s48-c-k-c0x00ffffff-no-rj', 'authorChannelUrl': 'http://www.youtube.com/channel/UCrDGvcPybxbXvkAH13p2Oxw', 'authorChannelId': {'value': 'UCrDGvcPybxbXvkAH13p2Oxw'}, 'canRate': True, 'viewerRating': 'none', 'likeCount': 0, 'publishedAt': '2022-10-15T15:03:29Z', 'updatedAt': '2022-10-15T15:03:29Z'}}, {'kind': 'youtube#comment', 'etag': '2r0dPfAAGD3O8sauAlQbVVLmeDw', 'id': 'UgwtzWXIJvA8Qd3ovDN4AaABAg.9hBKioDJydl9hBauMeDtIu', 'snippet': {'videoId': 'JsRIIhnquTA', 'textDisplay': 'Lula ladrão na cadeia .', 'textOriginal': 'Lula ladrão na cadeia .', 'parentId': 'UgwtzWXIJvA8Qd3ovDN4AaABAg', 'authorDisplayName': 'Ruthy Saraiva', 'authorProfileImageUrl': 'https://yt3.ggpht.com/ytc/AGIKgqOTTPvfdeR3S-SpdV_FA8vQyQ7LHh5RPq3kqswSZpo4qfuP2sCSuL4oPMxkZg0O=s48-c-k-c0x00ffffff-no-rj', 'authorChannelUrl': 'http://www.youtube.com/channel/UCzQleAt5fFlOp34ti4QBeOQ', 'authorChannelId': {'value': 'UCzQleAt5fFlOp34ti4QBeOQ'}, 'canRate': True, 'viewerRating': 'none', 'likeCount': 1, 'publishedAt': '2022-10-15T04:02:05Z', 'updatedAt': '2022-10-15T04:02:05Z'}}, {'kind': 'youtube#comment', 'etag': 'ra3PAcqln6JUUuticMd2dxQ0m7g', 'id': 'UgwtzWXIJvA8Qd3ovDN4AaABAg.9hBKioDJydl9hBLp7Y1Zms', 'snippet': {'videoId': 'JsRIIhnquTA', 'textDisplay': 'Lula de volta pra cadeia', 'textOriginal': 'Lula de volta pra cadeia', 'parentId': 'UgwtzWXIJvA8Qd3ovDN4AaABAg', 'authorDisplayName': 'José Carlos Gomes da silva', 'authorProfileImageUrl': 'https://yt3.ggpht.com/ytc/AGIKgqMrCJ9AM-BpiKajw8WDM0BDx-ZOBf7oxPqZrK0z4A=s48-c-k-c0x00ffffff-no-rj', 'authorChannelUrl': 'http://www.youtube.com/channel/UCpCdhpKLi7KsBnlvP5SpLtQ', 'authorChannelId': {'value': 'UCpCdhpKLi7KsBnlvP5SpLtQ'}, 'canRate': True, 'viewerRating': 'none', 'likeCount': 3, 'publishedAt': '2022-10-15T01:41:33Z', 'updatedAt': '2022-10-15T01:41:33Z'}}]}",UCrDGvcPybxbXvkAH13p2Oxw,2022-10-15T01:31:57Z,Bolsonaro na cadeia,,2023-06-09 13:14:57.405884
youtube#commentThread,bTlCPXmEsJRuSGnhTOXOyLTIoWo,UgzP8Hpd4gAonUyXi0B4AaABAg,"{'videoId': 'JsRIIhnquTA', 'topLevelComment': {'kind': 'youtube#comment', 'etag': 'l-P37366LJym8RQQzPiQeSCZ284', 'id': 'UgzP8Hpd4gAonUyXi0B4AaABAg', 'snippet': {'videoId': 'JsRIIhnquTA', 'textDisplay': 'Até uma criança com minimo de intelecto básico sabia que o PT há três anos e meio vem fazendo campanha sem descanso. Só o Bolsonaro não viu?! Então mereceu perder eleitores.', 'textOriginal': 'Até uma criança com minimo de intelecto básico sabia que o PT há três anos e meio vem fazendo campanha sem descanso. Só o Bolsonaro não viu?! Então mereceu perder eleitores.', 'authorDisplayName': 'Bernadete Casarin', 'authorProfileImageUrl': 'https://yt3.ggpht.com/ytc/AGIKgqM0XMHd6wEIq8bZ8tZIDIOL2_GLQp1UJIfCWQ=s48-c-k-c0x00ffffff-no-rj', 'authorChannelUrl': 'http://www.youtube.com/channel/UC946QfSp4l-vIz_sauOrrUQ', 'authorChannelId': {'value': 'UC946QfSp4l-vIz_sauOrrUQ'}, 'canRate': True, 'viewerRating': 'none', 'likeCount': 2, 'publishedAt': '2022-10-15T01:31:22Z', 'updatedAt': '2022-10-15T01:31:22Z'}}, 'canReply': True, 'totalReplyCount': 1, 'isPublic': True}","{'comments': [{'kind': 'youtube#comment', 'etag': 'cjFhWOH8uIfmc4WMJijgmrsfVsI', 'id': 'UgzP8Hpd4gAonUyXi0B4AaABAg.9hBKeVhpEF99hBaBkwuxee', 'snippet': {'videoId': 'JsRIIhnquTA', 'textDisplay': 'Teu cu .e nos tambem fizemos campanha o tempo todo .', 'textOriginal': 'Teu cu .e nos tambem fizemos campanha o tempo todo .', 'parentId': 'UgzP8Hpd4gAonUyXi0B4AaABAg', 'authorDisplayName': 'Ruthy Saraiva', 'authorProfileImageUrl': 'https://yt3.ggpht.com/ytc/AGIKgqOTTPvfdeR3S-SpdV_FA8vQyQ7LHh5RPq3kqswSZpo4qfuP2sCSuL4oPMxkZg0O=s48-c-k-c0x00ffffff-no-rj', 'authorChannelUrl': 'http://www.youtube.com/channel/UCzQleAt5fFlOp34ti4QBeOQ', 'authorChannelId': {'value': 'UCzQleAt5fFlOp34ti4QBeOQ'}, 'canRate': True, 'viewerRating': 'none', 'likeCount': 0, 'publishedAt': '2022-10-15T03:55:51Z', 'updatedAt': '2022-10-15T03:55:51Z'}}]}",UC946QfSp4l-vIz_sauOrrUQ,2022-10-15T01:31:22Z,Até uma criança com minimo de intelecto básico sabia que o PT há três anos e meio vem fazendo campanha sem descanso. Só o Bolsonaro não viu?! Então mereceu perder eleitores.,,2023-06-09 13:14:57.405884
