kind,etag,id,snippet,replies,authorChannelId,publishedAt,textOriginal,nextPageToken,extraction_date
youtube#commentThread,LrvCgO6fRqTYeK8AkmXeFdxqiFE,UgyYjaDPpnE4ZavbHnZ4AaABAg,"{'videoId': 'ERXOXKO3uBg', 'topLevelComment': {'kind': 'youtube#comment', 'etag': 'LhfFW9c3aejxz82vqu0yI4oxmow', 'id': 'UgyYjaDPpnE4ZavbHnZ4AaABAg', 'snippet': {'videoId': 'ERXOXKO3uBg', 'textDisplay': 'Amiga do Bob Jeff, dois bolsonaristas roxos', 'textOriginal': 'Amiga do Bob Jeff, dois bolsonaristas roxos', 'authorDisplayName': 'Joana R', 'authorProfileImageUrl': 'https://yt3.ggpht.com/ytc/AGIKgqPZytKIofJajEfGV3mz0nFJ0a5Hg2ApWDEOwUg8Lg=s48-c-k-c0x00ffffff-no-rj', 'authorChannelUrl': 'http://www.youtube.com/channel/UCec-3ugFOqs7cOGa8klmV2Q', 'authorChannelId': {'value': 'UCec-3ugFOqs7cOGa8klmV2Q'}, 'canRate': True, 'viewerRating': 'none', 'likeCount': 0, 'publishedAt': '2022-10-29T22:59:42Z', 'updatedAt': '2022-10-29T22:59:42Z'}}, 'canReply': True, 'totalReplyCount': 0, 'isPublic': True}",,UCec-3ugFOqs7cOGa8klmV2Q,2022-10-29T22:59:42Z,"Amiga do Bob Jeff, dois bolsonaristas roxos",QURTSl9pMmdSbWdwRGZvMkxJMW9YdGtHZFNpcVhhWVZDSURFamdmcVVfdDRURHR1Um5DUjNMOFJrTXFBbTQzZm1FaERGRHBsYXkxUWx3QQ==,2023-06-08 02:21:18.850846
youtube#commentThread,pO-kitP70IDsimS_cVm4YZoOcJQ,UgxOKdEPa-78f9MVCFR4AaABAg,"{'videoId': 'ERXOXKO3uBg', 'topLevelComment': {'kind': 'youtube#comment', 'etag': '6ffLob7pyco6w6Cu4pkPVDpi2NQ', 'id': 'UgxOKdEPa-78f9MVCFR4AaABAg', 'snippet': {'videoId': 'ERXOXKO3uBg', 'textDisplay': 'Zambelli é bolsonarista raiz, se acha acima da lei', 'textOriginal': 'Zambelli é bolsonarista raiz, se acha acima da lei', 'authorDisplayName': 'Joana R', 'authorProfileImageUrl': 'https://yt3.ggpht.com/ytc/AGIKgqPZytKIofJajEfGV3mz0nFJ0a5Hg2ApWDEOwUg8Lg=s48-c-k-c0x00ffffff-no-rj', 'authorChannelUrl': 'http://www.youtube.com/channel/UCec-3ugFOqs7cOGa8klmV2Q', 'authorChannelId': {'value': 'UCec-3ugFOqs7cOGa8klmV2Q'}, 'canRate': True, 'viewerRating': 'none', 'likeCount': 0, 'publishedAt': '2022-10-29T22:58:45Z', 'updatedAt': '2022-10-29T22:58:45Z'}}, 'canReply': True, 'totalReplyCount': 0, 'isPublic': True}",,UCec-3ugFOqs7cOGa8klmV2Q,2022-10-29T22:58:45Z,"Zambelli é bolsonarista raiz, se acha acima da lei",QURTSl9pMmdSbWdwRGZvMkxJMW9YdGtHZFNpcVhhWVZDSURFamdmcVVfdDRURHR1Um5DUjNMOFJrTXFBbTQzZm1FaERGRHBsYXkxUWx3QQ==,2023-06-08 02:21:18.850846
youtube#commentThread,EF3ro_yeoJF0SluDA_vIiQYSk2o,UgzKXrlwmOYxRxxVH8l4AaABAg,"{'videoId': 'R1SSzyBZ-u8', 'topLevelComment': {'kind': 'youtube#comment', 'etag': 'nKwPPmdaQZb9O4vzEPLOfNdC-QA', 'id': 'UgzKXrlwmOYxRxxVH8l4AaABAg', 'snippet': {'videoId': 'R1SSzyBZ-u8', 'textDisplay': 'Bolsonaro tem é que se virar pra explicar todos os indícios de corrupção e enriquecimento ilícito dele e da família', 'textOriginal': 'Bolsonaro tem é que se virar pra explicar todos os indícios de corrupção e enriquecimento ilícito dele e da família', 'authorDisplayName': 'Joana R', 'authorProfileImageUrl': 'https://yt3.ggpht.com/ytc/AGIKgqPZytKIofJajEfGV3mz0nFJ0a5Hg2ApWDEOwUg8Lg=s48-c-k-c0x00ffffff-no-rj', 'authorChannelUrl': 'http://www.youtube.com/channel/UCec-3ugFOqs7cOGa8klmV2Q', 'authorChannelId': {'value': 'UCec-3ugFOqs7cOGa8klmV2Q'}, 'canRate': True, 'viewerRating': 'none', 'likeCount': 1, 'publishedAt': '2022-10-10T18:44:38Z', 'updatedAt': '2022-10-10T18:44:38Z'}}, 'canReply': True, 'totalReplyCount': 0, 'isPublic': True}",,UCec-3ugFOqs7cOGa8klmV2Q,2022-10-10T18:44:38Z,Bolsonaro tem é que se virar pra explicar todos os indícios de corrupção e enriquecimento ilícito dele e da família,QURTSl9pM1ZaR0ZBYUk2MDVOa1RFSkFEMjROLU1DNlk3YzVuNmlFaUVlb1RfdF9sQTJLWmtFamUwMzZ5WTFfbUV2RENGZ0EwLUNQUURNbw==,2023-06-08 11:20:35.581682
youtube#commentThread,jx1rvqrbroya-K5jCAQqKWlDI6g,UgzDVYQhnP8KVYvYait4AaABAg,"{'videoId': 'R1SSzyBZ-u8', 'topLevelComment': {'kind': 'youtube#comment', 'etag': 'yRGnPlpByJhopSI5XG7nEMuxCIE', 'id': 'UgzDVYQhnP8KVYvYait4AaABAg', 'snippet': {'videoId': 'R1SSzyBZ-u8', 'textDisplay': 'Pelo bem do Brasil, América Latina e do mundo, tomara que Lula ganhe a eleição. Chega de destruição, armas, fome, desemprego e violência', 'textOriginal': 'Pelo bem do Brasil, América Latina e do mundo, tomara que Lula ganhe a eleição. Chega de destruição, armas, fome, desemprego e violência', 'authorDisplayName': 'Joana R', 'authorProfileImageUrl': 'https://yt3.ggpht.com/ytc/AGIKgqPZytKIofJajEfGV3mz0nFJ0a5Hg2ApWDEOwUg8Lg=s48-c-k-c0x00ffffff-no-rj', 'authorChannelUrl': 'http://www.youtube.com/channel/UCec-3ugFOqs7cOGa8klmV2Q', 'authorChannelId': {'value': 'UCec-3ugFOqs7cOGa8klmV2Q'}, 'canRate': True, 'viewerRating': 'none', 'likeCount': 1, 'publishedAt': '2022-10-10T18:42:38Z', 'updatedAt': '2022-10-10T18:42:38Z'}}, 'canReply': True, 'totalReplyCount': 0, 'isPublic': True}",,UCec-3ugFOqs7cOGa8klmV2Q,2022-10-10T18:42:38Z,"Pelo bem do Brasil, América Latina e do mundo, tomara que Lula ganhe a eleição. Chega de destruição, armas, fome, desemprego e violência",QURTSl9pM1ZaR0ZBYUk2MDVOa1RFSkFEMjROLU1DNlk3YzVuNmlFaUVlb1RfdF9sQTJLWmtFamUwMzZ5WTFfbUV2RENGZ0EwLUNQUURNbw==,2023-06-08 11:20:35.581682
youtube#commentThread,LtZY6h695FzIUjTe6wUBbGUXhdo,UgycZvLtwd2hko0flyN4AaABAg,"{'videoId': 'Isu9Husf76U', 'topLevelComment': {'kind': 'youtube#comment', 'etag': 'w2R7hQFktJdFlVK1y2BBXpaylsE', 'id': 'UgycZvLtwd2hko0flyN4AaABAg', 'snippet': {'videoId': 'Isu9Husf76U', 'textDisplay': 'Bolsonaristas passando pano pra esse absurdo é de amargar.', 'textOriginal': 'Bolsonaristas passando pano pra esse absurdo é de amargar.', 'authorDisplayName': 'Joana R', 'authorProfileImageUrl': 'https://yt3.ggpht.com/ytc/AGIKgqPZytKIofJajEfGV3mz0nFJ0a5Hg2ApWDEOwUg8Lg=s48-c-k-c0x00ffffff-no-rj', 'authorChannelUrl': 'http://www.youtube.com/channel/UCec-3ugFOqs7cOGa8klmV2Q', 'authorChannelId': {'value': 'UCec-3ugFOqs7cOGa8klmV2Q'}, 'canRate': True, 'viewerRating': 'none', 'likeCount': 0, 'publishedAt': '2022-10-29T22:32:23Z', 'updatedAt': '2022-10-29T22:32:23Z'}}, 'canReply': True, 'totalReplyCount': 0, 'isPublic': True}",,UCec-3ugFOqs7cOGa8klmV2Q,2022-10-29T22:32:23Z,Bolsonaristas passando pano pra esse absurdo é de amargar.,QURTSl9pM1Ewam51ek5uaENCSHJSRnVrekdCTFo5ZnVrOVUyLUJLOFR4TUExMnFzWGdzX2NjU2JHLVBDOUJBQzZHLXQyczAzdXZjOVlXUQ==,2023-06-08 02:22:16.664122
youtube#commentThread,JM-lKYkIkSmdX5B2bQ9wHiuibqE,UgxopORsGarN77D1X_V4AaABAg,"{'videoId': 'Isu9Husf76U', 'topLevelComment': {'kind': 'youtube#comment', 'etag': 'xDidScrhNXrD5AHeYCancvBUYck', 'id': 'UgxopORsGarN77D1X_V4AaABAg', 'snippet': {'videoId': 'Isu9Husf76U', 'textDisplay': 'Bolsonarismo na forma mais pura. Ela tropeçou e mentiu que foi empurrada', 'textOriginal': 'Bolsonarismo na forma mais pura. Ela tropeçou e mentiu que foi empurrada', 'authorDisplayName': 'Joana R', 'authorProfileImageUrl': 'https://yt3.ggpht.com/ytc/AGIKgqPZytKIofJajEfGV3mz0nFJ0a5Hg2ApWDEOwUg8Lg=s48-c-k-c0x00ffffff-no-rj', 'authorChannelUrl': 'http://www.youtube.com/channel/UCec-3ugFOqs7cOGa8klmV2Q', 'authorChannelId': {'value': 'UCec-3ugFOqs7cOGa8klmV2Q'}, 'canRate': True, 'viewerRating': 'none', 'likeCount': 0, 'publishedAt': '2022-10-29T22:28:33Z', 'updatedAt': '2022-10-29T22:28:33Z'}}, 'canReply': True, 'totalReplyCount': 0, 'isPublic': True}",,UCec-3ugFOqs7cOGa8klmV2Q,2022-10-29T22:28:33Z,Bolsonarismo na forma mais pura. Ela tropeçou e mentiu que foi empurrada,QURTSl9pM1Ewam51ek5uaENCSHJSRnVrekdCTFo5ZnVrOVUyLUJLOFR4TUExMnFzWGdzX2NjU2JHLVBDOUJBQzZHLXQyczAzdXZjOVlXUQ==,2023-06-08 02:22:16.664122
youtube#commentThread,NZ7rixW6xSvFEstkDdlZo5F1h64,UgxDmhsY4rbsLp7LVs94AaABAg,"{'videoId': 'kWdTDrVUxIo', 'topLevelComment': {'kind': 'youtube#comment', 'etag': 's5F2anvNfcjrdW5ZgNAVQTbiDP0', 'id': 'UgxDmhsY4rbsLp7LVs94AaABAg', 'snippet': {'videoId': 'kWdTDrVUxIo', 'textDisplay': 'Quem está voando é a mente dele.', 'textOriginal': 'Quem está voando é a mente dele.', 'authorDisplayName': 'Joana R', 'authorProfileImageUrl': 'https://yt3.ggpht.com/ytc/AGIKgqPZytKIofJajEfGV3mz0nFJ0a5Hg2ApWDEOwUg8Lg=s48-c-k-c0x00ffffff-no-rj', 'authorChannelUrl': 'http://www.youtube.com/channel/UCec-3ugFOqs7cOGa8klmV2Q', 'authorChannelId': {'value': 'UCec-3ugFOqs7cOGa8klmV2Q'}, 'canRate': True, 'viewerRating': 'none', 'likeCount': 1, 'publishedAt': '2022-10-09T02:28:04Z', 'updatedAt': '2022-10-09T02:28:04Z'}}, 'canReply': True, 'totalReplyCount': 0, 'isPublic': True}",,UCec-3ugFOqs7cOGa8klmV2Q,2022-10-09T02:28:04Z,Quem está voando é a mente dele.,QURTSl9pMmlpX0lESGl1cnVxNDdXWFZwTFplQ0Jvam1FUUdQcEVPTmU0eVFqdWM4ZEFTNGVNWVp5OUFHSEhRZFE2RHc2ODdEY2ViY2U2Zw==,2023-06-08 11:22:04.683542
youtube#commentThread,_Tqzb_0KccgLuodKgNrxXuWUVrU,UgzhT_NRF-nUznbGOHF4AaABAg,"{'videoId': 'd9lGwZ-C1M4', 'topLevelComment': {'kind': 'youtube#comment', 'etag': '3knRxKeCpbiuof30DOBEJC4DYjc', 'id': 'UgzhT_NRF-nUznbGOHF4AaABAg', 'snippet': {'videoId': 'd9lGwZ-C1M4', 'textDisplay': 'Zambelli perseguiu apontando arma a um cidadão negro que a chamou de espanhola. Mentiu que ele a empurrou mas vídeos mostram que não. Bolsonarismo é isso. Faroeste', 'textOriginal': 'Zambelli perseguiu apontando arma a um cidadão negro que a chamou de espanhola. Mentiu que ele a empurrou mas vídeos mostram que não. Bolsonarismo é isso. Faroeste', 'authorDisplayName': 'Joana R', 'authorProfileImageUrl': 'https://yt3.ggpht.com/ytc/AGIKgqPZytKIofJajEfGV3mz0nFJ0a5Hg2ApWDEOwUg8Lg=s48-c-k-c0x00ffffff-no-rj', 'authorChannelUrl': 'http://www.youtube.com/channel/UCec-3ugFOqs7cOGa8klmV2Q', 'authorChannelId': {'value': 'UCec-3ugFOqs7cOGa8klmV2Q'}, 'canRate': True, 'viewerRating': 'none', 'likeCount': 0, 'publishedAt': '2022-10-29T22:57:46Z', 'updatedAt': '2022-10-29T22:57:46Z'}}, 'canReply': True, 'totalReplyCount': 0, 'isPublic': True}",,UCec-3ugFOqs7cOGa8klmV2Q,2022-10-29T22:57:46Z,Zambelli perseguiu apontando arma a um cidadão negro que a chamou de espanhola. Mentiu que ele a empurrou mas vídeos mostram que não. Bolsonarismo é isso. Faroeste,QURTSl9pMlJDTXI4SW02Y3Rwb25UaDJWS2lBelVwOXVvMzdudmsxeV9JbnQ1ZUZGN2g3dWdmYUxwQjFucEluUWJYU04tY19IZEhoalZTTQ==,2023-06-08 02:22:59.435712
youtube#commentThread,khGn4O6N6p9QPsXsoHtM1lf9w1I,Ugzhfx0p8XNU2XvIgIR4AaABAg,"{'videoId': 'd9lGwZ-C1M4', 'topLevelComment': {'kind': 'youtube#comment', 'etag': 'm84QrQXV4E5aKdgrlTbi3OVE1r0', 'id': 'Ugzhfx0p8XNU2XvIgIR4AaABAg', 'snippet': {'videoId': 'd9lGwZ-C1M4', 'textDisplay': 'Guedes vai cortar 25% do salário de servidores, vai diminuir o mínimo e aposentadorias. Vai ser arrocho total na classe média', 'textOriginal': 'Guedes vai cortar 25% do salário de servidores, vai diminuir o mínimo e aposentadorias. Vai ser arrocho total na classe média', 'authorDisplayName': 'Joana R', 'authorProfileImageUrl': 'https://yt3.ggpht.com/ytc/AGIKgqPZytKIofJajEfGV3mz0nFJ0a5Hg2ApWDEOwUg8Lg=s48-c-k-c0x00ffffff-no-rj', 'authorChannelUrl': 'http://www.youtube.com/channel/UCec-3ugFOqs7cOGa8klmV2Q', 'authorChannelId': {'value': 'UCec-3ugFOqs7cOGa8klmV2Q'}, 'canRate': True, 'viewerRating': 'none', 'likeCount': 1, 'publishedAt': '2022-10-29T22:55:55Z', 'updatedAt': '2022-10-29T22:55:55Z'}}, 'canReply': True, 'totalReplyCount': 0, 'isPublic': True}",,UCec-3ugFOqs7cOGa8klmV2Q,2022-10-29T22:55:55Z,"Guedes vai cortar 25% do salário de servidores, vai diminuir o mínimo e aposentadorias. Vai ser arrocho total na classe média",QURTSl9pMlJDTXI4SW02Y3Rwb25UaDJWS2lBelVwOXVvMzdudmsxeV9JbnQ1ZUZGN2g3dWdmYUxwQjFucEluUWJYU04tY19IZEhoalZTTQ==,2023-06-08 02:22:59.435712
youtube#commentThread,r-sVzJe-WJfa-whhiIX4FjTDasg,UgzGOEukzRB07WqB9td4AaABAg,"{'videoId': '2k6I83w43Ts', 'topLevelComment': {'kind': 'youtube#comment', 'etag': 'BdKbUhxfoAqsK5RK6KXrEP2OHd0', 'id': 'UgzGOEukzRB07WqB9td4AaABAg', 'snippet': {'videoId': '2k6I83w43Ts', 'textDisplay': 'O orçamento secreto é o mensalão amplificado, tornado legal por manobra legislativa. Mas é inconstitucional. Se Lula for eleito, o STF vai cortar as asinhas do centrão. Se Bolsonaro for eleito, tanto faz, porque ele não liga pro desenvolvimento do Brasil mesmo. Só interessa ao Bolsonaro ter  paz pra roubar sob sigilo de 100 anos. Que saudade da direita de fato, quando falávamos de modelo de Estado ao invés desse fisiologismo nojento da extrema-direita, disfarçado de pauta moral.', 'textOriginal': 'O orçamento secreto é o mensalão amplificado, tornado legal por manobra legislativa. Mas é inconstitucional. Se Lula for eleito, o STF vai cortar as asinhas do centrão. Se Bolsonaro for eleito, tanto faz, porque ele não liga pro desenvolvimento do Brasil mesmo. Só interessa ao Bolsonaro ter  paz pra roubar sob sigilo de 100 anos. Que saudade da direita de fato, quando falávamos de modelo de Estado ao invés desse fisiologismo nojento da extrema-direita, disfarçado de pauta moral.', 'authorDisplayName': 'Joana R', 'authorProfileImageUrl': 'https://yt3.ggpht.com/ytc/AGIKgqPZytKIofJajEfGV3mz0nFJ0a5Hg2ApWDEOwUg8Lg=s48-c-k-c0x00ffffff-no-rj', 'authorChannelUrl': 'http://www.youtube.com/channel/UCec-3ugFOqs7cOGa8klmV2Q', 'authorChannelId': {'value': 'UCec-3ugFOqs7cOGa8klmV2Q'}, 'canRate': True, 'viewerRating': 'none', 'likeCount': 0, 'publishedAt': '2022-10-07T14:44:05Z', 'updatedAt': '2022-10-07T14:44:05Z'}}, 'canReply': True, 'totalReplyCount': 0, 'isPublic': True}",,UCec-3ugFOqs7cOGa8klmV2Q,2022-10-07T14:44:05Z,"O orçamento secreto é o mensalão amplificado, tornado legal por manobra legislativa. Mas é inconstitucional. Se Lula for eleito, o STF vai cortar as asinhas do centrão. Se Bolsonaro for eleito, tanto faz, porque ele não liga pro desenvolvimento do Brasil mesmo. Só interessa ao Bolsonaro ter  paz pra roubar sob sigilo de 100 anos. Que saudade da direita de fato, quando falávamos de modelo de Estado ao invés desse fisiologismo nojento da extrema-direita, disfarçado de pauta moral.",,2023-06-08 11:25:04.206530
youtube#commentThread,h6B5cmUi_jfRhZdlveNgX9231q8,UgyYuX4q5wcyxwhk2Ph4AaABAg,"{'videoId': 'LxSlwXR2RKE', 'topLevelComment': {'kind': 'youtube#comment', 'etag': 'hjAGswFjkbwLS1W1db3NDQ-gysU', 'id': 'UgyYuX4q5wcyxwhk2Ph4AaABAg', 'snippet': {'videoId': 'LxSlwXR2RKE', 'textDisplay': 'Lula eleito vai ser o melhor governo de todos os tempos, porque é uma coligação com todas melhores propostas de cada partido de esquerda, centro e centro-direita.   Nem o congresso bolsonarista vai ser capaz de sabotar o povo.', 'textOriginal': 'Lula eleito vai ser o melhor governo de todos os tempos, porque é uma coligação com todas melhores propostas de cada partido de esquerda, centro e centro-direita.   Nem o congresso bolsonarista vai ser capaz de sabotar o povo.', 'authorDisplayName': 'Joana R', 'authorProfileImageUrl': 'https://yt3.ggpht.com/ytc/AGIKgqPZytKIofJajEfGV3mz0nFJ0a5Hg2ApWDEOwUg8Lg=s48-c-k-c0x00ffffff-no-rj', 'authorChannelUrl': 'http://www.youtube.com/channel/UCec-3ugFOqs7cOGa8klmV2Q', 'authorChannelId': {'value': 'UCec-3ugFOqs7cOGa8klmV2Q'}, 'canRate': True, 'viewerRating': 'none', 'likeCount': 2, 'publishedAt': '2022-10-05T20:04:12Z', 'updatedAt': '2022-10-05T20:04:12Z'}}, 'canReply': True, 'totalReplyCount': 1, 'isPublic': True}","{'comments': [{'kind': 'youtube#comment', 'etag': 'TtoJpou0Nau0S7fngN7L8G_S2b0', 'id': 'UgyYuX4q5wcyxwhk2Ph4AaABAg.9go_3QUuKMc9go_GYAo2B2', 'snippet': {'videoId': 'LxSlwXR2RKE', 'textDisplay': 'É o que mais desejo 🙏🙏🙏', 'textOriginal': 'É o que mais desejo 🙏🙏🙏', 'parentId': 'UgyYuX4q5wcyxwhk2Ph4AaABAg', 'authorDisplayName': 'Judite Spinelli', 'authorProfileImageUrl': 'https://yt3.ggpht.com/ytc/AGIKgqOrzzDBlOEs7eaITjCnXfeGMmGO5Xy0pnd6YA=s48-c-k-c0x00ffffff-no-rj', 'authorChannelUrl': 'http://www.youtube.com/channel/UCsRouczbd1xPnUBS1vIT9nw', 'authorChannelId': {'value': 'UCsRouczbd1xPnUBS1vIT9nw'}, 'canRate': True, 'viewerRating': 'none', 'likeCount': 1, 'publishedAt': '2022-10-05T20:06:00Z', 'updatedAt': '2022-10-05T20:06:00Z'}}]}",UCec-3ugFOqs7cOGa8klmV2Q,2022-10-05T20:04:12Z,"Lula eleito vai ser o melhor governo de todos os tempos, porque é uma coligação com todas melhores propostas de cada partido de esquerda, centro e centro-direita.   Nem o congresso bolsonarista vai ser capaz de sabotar o povo.",QURTSl9pM2kydXZzRTRCbzBVR2lVRVc4cGFLUkhQWElBNjZNUVZLNU9LZHNmQzA4QXlwUDc2Z25wZ1VGMWpYVGhKZElqRmFzZXZKblBjNA==,2023-06-08 11:30:39.543152
youtube#commentThread,kSmEaL5emaJTkh0C6bHg4x6aXn4,UgxWkTdBpIQbaoZ6PNF4AaABAg,"{'videoId': 'LxSlwXR2RKE', 'topLevelComment': {'kind': 'youtube#comment', 'etag': 'jDqJCUbr9quJl9jLfyN8d0-KDa0', 'id': 'UgxWkTdBpIQbaoZ6PNF4AaABAg', 'snippet': {'videoId': 'LxSlwXR2RKE', 'textDisplay': 'Arrasou Simone. Tem muita lucidez. Tebet ao lado de Lula não é propaganda de Lula, mas da volta à normalidade da República, num esforço para resgatar o Brasil desse fosso nefasto.', 'textOriginal': 'Arrasou Simone. Tem muita lucidez. Tebet ao lado de Lula não é propaganda de Lula, mas da volta à normalidade da República, num esforço para resgatar o Brasil desse fosso nefasto.', 'authorDisplayName': 'Joana R', 'authorProfileImageUrl': 'https://yt3.ggpht.com/ytc/AGIKgqPZytKIofJajEfGV3mz0nFJ0a5Hg2ApWDEOwUg8Lg=s48-c-k-c0x00ffffff-no-rj', 'authorChannelUrl': 'http://www.youtube.com/channel/UCec-3ugFOqs7cOGa8klmV2Q', 'authorChannelId': {'value': 'UCec-3ugFOqs7cOGa8klmV2Q'}, 'canRate': True, 'viewerRating': 'none', 'likeCount': 15, 'publishedAt': '2022-10-05T19:58:19Z', 'updatedAt': '2022-10-05T20:00:52Z'}}, 'canReply': True, 'totalReplyCount': 1, 'isPublic': True}","{'comments': [{'kind': 'youtube#comment', 'etag': '0_V59ystKeiKL8LiQcaQ2diA8q4', 'id': 'UgxWkTdBpIQbaoZ6PNF4AaABAg.9goZOGActK_9go_oIyTOPY', 'snippet': {'videoId': 'LxSlwXR2RKE', 'textDisplay': 'Parabéns Venezuela é logo alí..qual pet você tem..se sabe o sabor do seu cat e do seu dog.. qual você vai comer primeiro.. é claro que vai ter carne é uma delícia não vai faltar 🐶🐱😭😂🤪', 'textOriginal': 'Parabéns Venezuela é logo alí..qual pet você tem..se sabe o sabor do seu cat e do seu dog.. qual você vai comer primeiro.. é claro que vai ter carne é uma delícia não vai faltar 🐶🐱😭😂🤪', 'parentId': 'UgxWkTdBpIQbaoZ6PNF4AaABAg', 'authorDisplayName': 'João Filho', 'authorProfileImageUrl': 'https://yt3.ggpht.com/ytc/AGIKgqO3u2Zpv1QBccgEc55T5IiXPu6_MmYKHADxoAOAsJ0XN4IEpeUc3TOQxWRVvNth=s48-c-k-c0x00ffffff-no-rj', 'authorChannelUrl': 'http://www.youtube.com/channel/UCY4TjKTdobmC3iAtf6EUBcg', 'authorChannelId': {'value': 'UCY4TjKTdobmC3iAtf6EUBcg'}, 'canRate': True, 'viewerRating': 'none', 'likeCount': 1, 'publishedAt': '2022-10-05T20:10:45Z', 'updatedAt': '2022-10-05T20:10:45Z'}}]}",UCec-3ugFOqs7cOGa8klmV2Q,2022-10-05T19:58:19Z,"Arrasou Simone. Tem muita lucidez. Tebet ao lado de Lula não é propaganda de Lula, mas da volta à normalidade da República, num esforço para resgatar o Brasil desse fosso nefasto.",QURTSl9pMEN3TGtRQW55QzF4dkJDbmlFWEwzbkJGTVhHTVFUekVTXzkwT3FtWVZXeENHME54QjRNczJjMkJjV0xrZ2R1WHFGWC0zSmlJTQ==,2023-06-08 11:30:41.261707
youtube#commentThread,hS4gNSAQdaAdFMbm2S5Vztf3Eng,Ugx5wG6gQZ80pdOSK9N4AaABAg,"{'videoId': 'LxSlwXR2RKE', 'topLevelComment': {'kind': 'youtube#comment', 'etag': 'WkdX0zkvCbKrI1UWxvUJq0d3eIU', 'id': 'Ugx5wG6gQZ80pdOSK9N4AaABAg', 'snippet': {'videoId': 'LxSlwXR2RKE', 'textDisplay': 'Parabéns Simone, teve a coragem de se expor e lutar a favor da mulher brasileira, a favor do pilar da família, que é a mulher, e da República, contra esse desgoverno horroroso que matou nossos parentes', 'textOriginal': 'Parabéns Simone, teve a coragem de se expor e lutar a favor da mulher brasileira, a favor do pilar da família, que é a mulher, e da República, contra esse desgoverno horroroso que matou nossos parentes', 'authorDisplayName': 'Joana R', 'authorProfileImageUrl': 'https://yt3.ggpht.com/ytc/AGIKgqPZytKIofJajEfGV3mz0nFJ0a5Hg2ApWDEOwUg8Lg=s48-c-k-c0x00ffffff-no-rj', 'authorChannelUrl': 'http://www.youtube.com/channel/UCec-3ugFOqs7cOGa8klmV2Q', 'authorChannelId': {'value': 'UCec-3ugFOqs7cOGa8klmV2Q'}, 'canRate': True, 'viewerRating': 'none', 'likeCount': 18, 'publishedAt': '2022-10-05T19:56:26Z', 'updatedAt': '2022-10-05T19:57:01Z'}}, 'canReply': True, 'totalReplyCount': 0, 'isPublic': True}",,UCec-3ugFOqs7cOGa8klmV2Q,2022-10-05T19:56:26Z,"Parabéns Simone, teve a coragem de se expor e lutar a favor da mulher brasileira, a favor do pilar da família, que é a mulher, e da República, contra esse desgoverno horroroso que matou nossos parentes",QURTSl9pMEN3TGtRQW55QzF4dkJDbmlFWEwzbkJGTVhHTVFUekVTXzkwT3FtWVZXeENHME54QjRNczJjMkJjV0xrZ2R1WHFGWC0zSmlJTQ==,2023-06-08 11:30:41.261707
youtube#commentThread,xqEyK36IHJW1ZLaJUgEqveJEu0I,Ugzmm3BhyRZPjSkPPz14AaABAg,"{'videoId': '-C4HnGdR50E', 'topLevelComment': {'kind': 'youtube#comment', 'etag': 'LoOw6WpK0uj4jNzWwK8t5SCamk8', 'id': 'Ugzmm3BhyRZPjSkPPz14AaABAg', 'snippet': {'videoId': '-C4HnGdR50E', 'textDisplay': 'Detesto Gleisi Hoffman. Prefiro a Tebet.', 'textOriginal': 'Detesto Gleisi Hoffman. Prefiro a Tebet.', 'authorDisplayName': 'Joana R', 'authorProfileImageUrl': 'https://yt3.ggpht.com/ytc/AGIKgqPZytKIofJajEfGV3mz0nFJ0a5Hg2ApWDEOwUg8Lg=s48-c-k-c0x00ffffff-no-rj', 'authorChannelUrl': 'http://www.youtube.com/channel/UCec-3ugFOqs7cOGa8klmV2Q', 'authorChannelId': {'value': 'UCec-3ugFOqs7cOGa8klmV2Q'}, 'canRate': True, 'viewerRating': 'none', 'likeCount': 1, 'publishedAt': '2022-10-05T19:52:57Z', 'updatedAt': '2022-10-05T19:52:57Z'}}, 'canReply': True, 'totalReplyCount': 0, 'isPublic': True}",,UCec-3ugFOqs7cOGa8klmV2Q,2022-10-05T19:52:57Z,Detesto Gleisi Hoffman. Prefiro a Tebet.,QURTSl9pMmJ4LUlvVG1GVUY4OFIzRzI5VGYyU1phSFpvZkZ5TkF4NlZkdXcwYmxoRkdlNlVkS080aFFLLUczbS0wR3JfRDZYb0doLTJ0RQ==,2023-06-08 11:30:49.143538
youtube#commentThread,CzEj7N8tl1snI5RBfue5xaufIgM,UgzAbEcdM4beIqU8TmR4AaABAg,"{'videoId': '-C4HnGdR50E', 'topLevelComment': {'kind': 'youtube#comment', 'etag': '6Q0HCg52uETgEKbD-g_4aV2KA8g', 'id': 'UgzAbEcdM4beIqU8TmR4AaABAg', 'snippet': {'videoId': '-C4HnGdR50E', 'textDisplay': 'Tebet com essa posição está defendendo a mulher brasileira contra o obscurantismo em que o Brasil está mergulhando, que considera as mulheres inferiores aos homens, que não se importa com as crianças com fome, a quem só importa o dinheiro. Nós mulheres estamos com vc Simone, contra esse desgoverno horroroso.', 'textOriginal': 'Tebet com essa posição está defendendo a mulher brasileira contra o obscurantismo em que o Brasil está mergulhando, que considera as mulheres inferiores aos homens, que não se importa com as crianças com fome, a quem só importa o dinheiro. Nós mulheres estamos com vc Simone, contra esse desgoverno horroroso.', 'authorDisplayName': 'Joana R', 'authorProfileImageUrl': 'https://yt3.ggpht.com/ytc/AGIKgqPZytKIofJajEfGV3mz0nFJ0a5Hg2ApWDEOwUg8Lg=s48-c-k-c0x00ffffff-no-rj', 'authorChannelUrl': 'http://www.youtube.com/channel/UCec-3ugFOqs7cOGa8klmV2Q', 'authorChannelId': {'value': 'UCec-3ugFOqs7cOGa8klmV2Q'}, 'canRate': True, 'viewerRating': 'none', 'likeCount': 3, 'publishedAt': '2022-10-05T19:47:11Z', 'updatedAt': '2022-10-05T19:47:11Z'}}, 'canReply': True, 'totalReplyCount': 1, 'isPublic': True}","{'comments': [{'kind': 'youtube#comment', 'etag': 'v0O7-auSQ6XePRc8rGFVCMDpjFs', 'id': 'UgzAbEcdM4beIqU8TmR4AaABAg.9goY6hbQNmi9grLseDLtrG', 'snippet': {'videoId': '-C4HnGdR50E', 'textDisplay': 'A Simone é fazendeira no Mato Grosso do Sul , região do agronegócio , vai se queimar com essa aliança .', 'textOriginal': 'A Simone é fazendeira no Mato Grosso do Sul , região do agronegócio , vai se queimar com essa aliança .', 'parentId': 'UgzAbEcdM4beIqU8TmR4AaABAg', 'authorDisplayName': 'Valdir da Silva Rosa', 'authorProfileImageUrl': 'https://yt3.ggpht.com/ytc/AGIKgqNcNK-7SBQkIetPQQNlFQ_k3UlqliEIrdWYZA=s48-c-k-c0x00ffffff-no-rj', 'authorChannelUrl': 'http://www.youtube.com/channel/UCCCf4_uGN0tEEHRAmSd995Q', 'authorChannelId': {'value': 'UCCCf4_uGN0tEEHRAmSd995Q'}, 'canRate': True, 'viewerRating': 'none', 'likeCount': 0, 'publishedAt': '2022-10-06T21:57:59Z', 'updatedAt': '2022-10-06T21:57:59Z'}}]}",UCec-3ugFOqs7cOGa8klmV2Q,2022-10-05T19:47:11Z,"Tebet com essa posição está defendendo a mulher brasileira contra o obscurantismo em que o Brasil está mergulhando, que considera as mulheres inferiores aos homens, que não se importa com as crianças com fome, a quem só importa o dinheiro. Nós mulheres estamos com vc Simone, contra esse desgoverno horroroso.",QURTSl9pMmJ4LUlvVG1GVUY4OFIzRzI5VGYyU1phSFpvZkZ5TkF4NlZkdXcwYmxoRkdlNlVkS080aFFLLUczbS0wR3JfRDZYb0doLTJ0RQ==,2023-06-08 11:30:49.143538
