kind,etag,id,snippet,replies,authorChannelId,publishedAt,textOriginal,nextPageToken,extraction_date
youtube#commentThread,PwXRIerSZ9VGOp9zIgIM-CBKMcY,UgzMJvwp2Tb8ajjqakp4AaABAg,"{'videoId': '05sC5lVHNrA', 'topLevelComment': {'kind': 'youtube#comment', 'etag': '-T81j2psENcDlmX8TPrHnSHfhhc', 'id': 'UgzMJvwp2Tb8ajjqakp4AaABAg', 'snippet': {'videoId': '05sC5lVHNrA', 'textDisplay': 'pra romper a divisão basta combater energicamente as fake news. sem a rede de mentiras não há bolsonarismo.', 'textOriginal': 'pra romper a divisão basta combater energicamente as fake news. sem a rede de mentiras não há bolsonarismo.', 'authorDisplayName': 'Joana R', 'authorProfileImageUrl': 'https://yt3.ggpht.com/ytc/AGIKgqPZytKIofJajEfGV3mz0nFJ0a5Hg2ApWDEOwUg8Lg=s48-c-k-c0x00ffffff-no-rj', 'authorChannelUrl': 'http://www.youtube.com/channel/UCec-3ugFOqs7cOGa8klmV2Q', 'authorChannelId': {'value': 'UCec-3ugFOqs7cOGa8klmV2Q'}, 'canRate': True, 'viewerRating': 'none', 'likeCount': 0, 'publishedAt': '2022-10-31T13:51:25Z', 'updatedAt': '2022-10-31T13:51:25Z'}}, 'canReply': True, 'totalReplyCount': 0, 'isPublic': True}",,UCec-3ugFOqs7cOGa8klmV2Q,2022-10-31T13:51:25Z,pra romper a divisão basta combater energicamente as fake news. sem a rede de mentiras não há bolsonarismo.,QURTSl9pMUlhX0hzY1d4d3dQOFdraE81ZHNtbjdzeE1RVEpaWkQ3ZjJON0F4YzVwSVp1TkFZd2lEb3FiUGJnSlJWMW4xTG5ZR0hWSWczSQ==,2023-06-08 02:11:57.371533
youtube#commentThread,O6ulwTTFEYJZxxg7ApgYGIKAAGE,UgzLiwS7H2rZDCjjA614AaABAg,"{'videoId': '3k9V7lgHaHA', 'topLevelComment': {'kind': 'youtube#comment', 'etag': 'DZppx00jEKIfCGOrTWcA4f0vdQc', 'id': 'UgzLiwS7H2rZDCjjA614AaABAg', 'snippet': {'videoId': '3k9V7lgHaHA', 'textDisplay': 'Finalmente!', 'textOriginal': 'Finalmente!', 'authorDisplayName': 'Joana R', 'authorProfileImageUrl': 'https://yt3.ggpht.com/ytc/AGIKgqPZytKIofJajEfGV3mz0nFJ0a5Hg2ApWDEOwUg8Lg=s48-c-k-c0x00ffffff-no-rj', 'authorChannelUrl': 'http://www.youtube.com/channel/UCec-3ugFOqs7cOGa8klmV2Q', 'authorChannelId': {'value': 'UCec-3ugFOqs7cOGa8klmV2Q'}, 'canRate': True, 'viewerRating': 'none', 'likeCount': 0, 'publishedAt': '2022-10-18T23:57:49Z', 'updatedAt': '2022-10-18T23:57:49Z'}}, 'canReply': True, 'totalReplyCount': 0, 'isPublic': True}",,UCec-3ugFOqs7cOGa8klmV2Q,2022-10-18T23:57:49Z,Finalmente!,QURTSl9pM0FRQWRiZUFRNi1iOFZCLWNCUENOX3BvOGVSWTZLRHVGYmRxaFJ0S3c4RFZ6ZGUxMEtRemRiMkRreXVCR2dlUkJPOVB4SVZSNA==,2023-06-08 02:56:52.638227
youtube#commentThread,JKgv1-C2E8VGSoZ7ZjGCcSDIGK4,UgzjdSYuqgfNOSLzfYl4AaABAg,"{'videoId': '3k9V7lgHaHA', 'topLevelComment': {'kind': 'youtube#comment', 'etag': 'KeYCE2S-YvblaweITrmn9leXjOg', 'id': 'UgzjdSYuqgfNOSLzfYl4AaABAg', 'snippet': {'videoId': '3k9V7lgHaHA', 'textDisplay': 'Epa pera, de Direita não!! De  extrema-direita e que tem histórico consistente de desinformação', 'textOriginal': 'Epa pera, de Direita não!! De  extrema-direita e que tem histórico consistente de desinformação', 'authorDisplayName': 'Joana R', 'authorProfileImageUrl': 'https://yt3.ggpht.com/ytc/AGIKgqPZytKIofJajEfGV3mz0nFJ0a5Hg2ApWDEOwUg8Lg=s48-c-k-c0x00ffffff-no-rj', 'authorChannelUrl': 'http://www.youtube.com/channel/UCec-3ugFOqs7cOGa8klmV2Q', 'authorChannelId': {'value': 'UCec-3ugFOqs7cOGa8klmV2Q'}, 'canRate': True, 'viewerRating': 'none', 'likeCount': 0, 'publishedAt': '2022-10-18T23:21:52Z', 'updatedAt': '2022-10-18T23:21:52Z'}}, 'canReply': True, 'totalReplyCount': 0, 'isPublic': True}",,UCec-3ugFOqs7cOGa8klmV2Q,2022-10-18T23:21:52Z,"Epa pera, de Direita não!! De  extrema-direita e que tem histórico consistente de desinformação",QURTSl9pM29ZU25na2QwaXo2SE5Fc24tMDlEY2NCZFRJSURkeF81RVdmRkJsc19pUTROVm16b2dMV0NOZHZUQVk2b1Y2WGlTN2RnYmJjdw==,2023-06-08 02:56:54.271010
youtube#commentThread,dknz0j28ZNW3MXIY7kX3FqyUGXs,UgzSAEDl8n46cPUEQgd4AaABAg,"{'videoId': 'tJyI4KlkOAg', 'topLevelComment': {'kind': 'youtube#comment', 'etag': 'YbjurdU6SYgVXreKgKqTqeEfum0', 'id': 'UgzSAEDl8n46cPUEQgd4AaABAg', 'snippet': {'videoId': 'tJyI4KlkOAg', 'textDisplay': 'Moro foi condenado como inquisidor pela ONU.', 'textOriginal': 'Moro foi condenado como inquisidor pela ONU.', 'authorDisplayName': 'Joana R', 'authorProfileImageUrl': 'https://yt3.ggpht.com/ytc/AGIKgqPZytKIofJajEfGV3mz0nFJ0a5Hg2ApWDEOwUg8Lg=s48-c-k-c0x00ffffff-no-rj', 'authorChannelUrl': 'http://www.youtube.com/channel/UCec-3ugFOqs7cOGa8klmV2Q', 'authorChannelId': {'value': 'UCec-3ugFOqs7cOGa8klmV2Q'}, 'canRate': True, 'viewerRating': 'none', 'likeCount': 0, 'publishedAt': '2022-10-18T01:01:17Z', 'updatedAt': '2022-10-18T01:01:17Z'}}, 'canReply': True, 'totalReplyCount': 0, 'isPublic': True}",,UCec-3ugFOqs7cOGa8klmV2Q,2022-10-18T01:01:17Z,Moro foi condenado como inquisidor pela ONU.,QURTSl9pMWxPanlyTGpuZmRjVlcwTGs4MHV6NU16ZWIzaEk0RzdLVENyLU5nbkVfcHcwaWFINloxaUphU0ZIN0xDamVJS2RSS3FTV2l6WQ==,2023-06-08 02:58:51.396839
youtube#commentThread,z7jADK-xCJk0TU1xXxodUdcu63M,UgzeURfLKoTSVeSyaM94AaABAg,"{'videoId': 'tJyI4KlkOAg', 'topLevelComment': {'kind': 'youtube#comment', 'etag': 'eT5y_dvrHgDcin3CSK-Q_Xzj83s', 'id': 'UgzeURfLKoTSVeSyaM94AaABAg', 'snippet': {'videoId': 'tJyI4KlkOAg', 'textDisplay': 'Moro não liga pra corrupção. Ele sabe que Bolsonaro é muito corrupto. Já postou sobre isso. Ele tem é horror do partido que defende o povo, o PT. Moro é de extrema-direita. É só mais um salafrário', 'textOriginal': 'Moro não liga pra corrupção. Ele sabe que Bolsonaro é muito corrupto. Já postou sobre isso. Ele tem é horror do partido que defende o povo, o PT. Moro é de extrema-direita. É só mais um salafrário', 'authorDisplayName': 'Joana R', 'authorProfileImageUrl': 'https://yt3.ggpht.com/ytc/AGIKgqPZytKIofJajEfGV3mz0nFJ0a5Hg2ApWDEOwUg8Lg=s48-c-k-c0x00ffffff-no-rj', 'authorChannelUrl': 'http://www.youtube.com/channel/UCec-3ugFOqs7cOGa8klmV2Q', 'authorChannelId': {'value': 'UCec-3ugFOqs7cOGa8klmV2Q'}, 'canRate': True, 'viewerRating': 'none', 'likeCount': 0, 'publishedAt': '2022-10-18T00:58:53Z', 'updatedAt': '2022-10-18T00:58:53Z'}}, 'canReply': True, 'totalReplyCount': 0, 'isPublic': True}",,UCec-3ugFOqs7cOGa8klmV2Q,2022-10-18T00:58:53Z,"Moro não liga pra corrupção. Ele sabe que Bolsonaro é muito corrupto. Já postou sobre isso. Ele tem é horror do partido que defende o povo, o PT. Moro é de extrema-direita. É só mais um salafrário",QURTSl9pMWxPanlyTGpuZmRjVlcwTGs4MHV6NU16ZWIzaEk0RzdLVENyLU5nbkVfcHcwaWFINloxaUphU0ZIN0xDamVJS2RSS3FTV2l6WQ==,2023-06-08 02:58:51.396839
youtube#commentThread,I0ZGoSJt32xogWhWIjY32LdDLgM,Ugw2gtbqSu3SrKkJdfZ4AaABAg,"{'videoId': 'Iof-k7QZXto', 'topLevelComment': {'kind': 'youtube#comment', 'etag': 'D0L0NjSFJ13OB6evtoL4eNOSC54', 'id': 'Ugw2gtbqSu3SrKkJdfZ4AaABAg', 'snippet': {'videoId': 'Iof-k7QZXto', 'textDisplay': 'Ue. Tarcísio já falou que não acredita que tenha sido atentado', 'textOriginal': 'Ue. Tarcísio já falou que não acredita que tenha sido atentado', 'authorDisplayName': 'Joana R', 'authorProfileImageUrl': 'https://yt3.ggpht.com/ytc/AGIKgqPZytKIofJajEfGV3mz0nFJ0a5Hg2ApWDEOwUg8Lg=s48-c-k-c0x00ffffff-no-rj', 'authorChannelUrl': 'http://www.youtube.com/channel/UCec-3ugFOqs7cOGa8klmV2Q', 'authorChannelId': {'value': 'UCec-3ugFOqs7cOGa8klmV2Q'}, 'canRate': True, 'viewerRating': 'none', 'likeCount': 0, 'publishedAt': '2022-10-17T22:44:51Z', 'updatedAt': '2022-10-17T22:44:51Z'}}, 'canReply': True, 'totalReplyCount': 0, 'isPublic': True}",,UCec-3ugFOqs7cOGa8klmV2Q,2022-10-17T22:44:51Z,Ue. Tarcísio já falou que não acredita que tenha sido atentado,QURTSl9pM2dLNkIzc29vNnhSSGdKRFdIZVJNTXJ3M1I2SVFnZ0NDZmdTSjhnSFc3VUtLMEVXT0NRMWQteWN6Vm9RckR5dE5PdnFzUmVLMA==,2023-06-08 03:00:25.432845
youtube#commentThread,3Tz7Gub9oX2kgAlKCk68MLSqsLU,UgzzvqRI7wa4Gal6KJp4AaABAg,"{'videoId': 'Iof-k7QZXto', 'topLevelComment': {'kind': 'youtube#comment', 'etag': 'OJKqmU94lAmCYq-xSDoKDYp_62I', 'id': 'UgzzvqRI7wa4Gal6KJp4AaABAg', 'snippet': {'videoId': 'Iof-k7QZXto', 'textDisplay': 'Paulistas vao importar a milícia carioca e se arrepender', 'textOriginal': 'Paulistas vao importar a milícia carioca e se arrepender', 'authorDisplayName': 'Joana R', 'authorProfileImageUrl': 'https://yt3.ggpht.com/ytc/AGIKgqPZytKIofJajEfGV3mz0nFJ0a5Hg2ApWDEOwUg8Lg=s48-c-k-c0x00ffffff-no-rj', 'authorChannelUrl': 'http://www.youtube.com/channel/UCec-3ugFOqs7cOGa8klmV2Q', 'authorChannelId': {'value': 'UCec-3ugFOqs7cOGa8klmV2Q'}, 'canRate': True, 'viewerRating': 'none', 'likeCount': 0, 'publishedAt': '2022-10-17T22:44:27Z', 'updatedAt': '2022-10-17T22:44:27Z'}}, 'canReply': True, 'totalReplyCount': 0, 'isPublic': True}",,UCec-3ugFOqs7cOGa8klmV2Q,2022-10-17T22:44:27Z,Paulistas vao importar a milícia carioca e se arrepender,QURTSl9pM2dLNkIzc29vNnhSSGdKRFdIZVJNTXJ3M1I2SVFnZ0NDZmdTSjhnSFc3VUtLMEVXT0NRMWQteWN6Vm9RckR5dE5PdnFzUmVLMA==,2023-06-08 03:00:25.432845
youtube#commentThread,qzSAt7TMYExbpCVBlggCRANrMII,Ugxx9E6tS9yRm9aaQal4AaABAg,"{'videoId': 'Iof-k7QZXto', 'topLevelComment': {'kind': 'youtube#comment', 'etag': 'Ky18wSFf37cI4woAGLBFcIcypBw', 'id': 'Ugxx9E6tS9yRm9aaQal4AaABAg', 'snippet': {'videoId': 'Iof-k7QZXto', 'textDisplay': 'Bolsonaro arma o crime e quando há um tiroteio... não foi atentado. O que aconteceu foi Paraisopolis', 'textOriginal': 'Bolsonaro arma o crime e quando há um tiroteio... não foi atentado. O que aconteceu foi Paraisopolis', 'authorDisplayName': 'Joana R', 'authorProfileImageUrl': 'https://yt3.ggpht.com/ytc/AGIKgqPZytKIofJajEfGV3mz0nFJ0a5Hg2ApWDEOwUg8Lg=s48-c-k-c0x00ffffff-no-rj', 'authorChannelUrl': 'http://www.youtube.com/channel/UCec-3ugFOqs7cOGa8klmV2Q', 'authorChannelId': {'value': 'UCec-3ugFOqs7cOGa8klmV2Q'}, 'canRate': True, 'viewerRating': 'none', 'likeCount': 0, 'publishedAt': '2022-10-17T22:43:55Z', 'updatedAt': '2022-10-17T22:43:55Z'}}, 'canReply': True, 'totalReplyCount': 0, 'isPublic': True}",,UCec-3ugFOqs7cOGa8klmV2Q,2022-10-17T22:43:55Z,Bolsonaro arma o crime e quando há um tiroteio... não foi atentado. O que aconteceu foi Paraisopolis,QURTSl9pM2dLNkIzc29vNnhSSGdKRFdIZVJNTXJ3M1I2SVFnZ0NDZmdTSjhnSFc3VUtLMEVXT0NRMWQteWN6Vm9RckR5dE5PdnFzUmVLMA==,2023-06-08 03:00:25.432845
youtube#commentThread,N6x6BREMYhmP8kQGfQQNoPJqx3A,UgyL9Dm5xj1qMU47ng14AaABAg,"{'videoId': 'yUfSvBIXYck', 'topLevelComment': {'kind': 'youtube#comment', 'etag': 'pi0Yz0l54G3PWhvh56hr9n8rEIU', 'id': 'UgyL9Dm5xj1qMU47ng14AaABAg', 'snippet': {'videoId': 'yUfSvBIXYck', 'textDisplay': 'O TSE tem que estender o horário de vocação', 'textOriginal': 'O TSE tem que estender o horário de vocação', 'authorDisplayName': 'Joana R', 'authorProfileImageUrl': 'https://yt3.ggpht.com/ytc/AGIKgqPZytKIofJajEfGV3mz0nFJ0a5Hg2ApWDEOwUg8Lg=s48-c-k-c0x00ffffff-no-rj', 'authorChannelUrl': 'http://www.youtube.com/channel/UCec-3ugFOqs7cOGa8klmV2Q', 'authorChannelId': {'value': 'UCec-3ugFOqs7cOGa8klmV2Q'}, 'canRate': True, 'viewerRating': 'none', 'likeCount': 0, 'publishedAt': '2022-10-30T19:08:09Z', 'updatedAt': '2022-10-30T19:08:09Z'}}, 'canReply': True, 'totalReplyCount': 0, 'isPublic': True}",,UCec-3ugFOqs7cOGa8klmV2Q,2022-10-30T19:08:09Z,O TSE tem que estender o horário de vocação,QURTSl9pMUo0RmJPcDhRU25yNUNkT2NZMFB1eEpRM0tnUTBTNC1NaHFhNXkzVHJydklacV9QYmdwMkZNQVQ2N3hzMzZwaFFmSU5zZVJ4QQ==,2023-06-08 02:14:34.644721
youtube#commentThread,6fEL9BHj8fY8cp9kH75H4VWPfEs,UgyQ-tinJ1VAXzjKxLp4AaABAg,"{'videoId': 'yUfSvBIXYck', 'topLevelComment': {'kind': 'youtube#comment', 'etag': 'Sx_-btFQrNMuVJctXN1ozcbrU4A', 'id': 'UgyQ-tinJ1VAXzjKxLp4AaABAg', 'snippet': {'videoId': 'yUfSvBIXYck', 'textDisplay': 'É tentativa de golpe explícita. BOLSONARO quer ganhar no tapetão', 'textOriginal': 'É tentativa de golpe explícita. BOLSONARO quer ganhar no tapetão', 'authorDisplayName': 'Joana R', 'authorProfileImageUrl': 'https://yt3.ggpht.com/ytc/AGIKgqPZytKIofJajEfGV3mz0nFJ0a5Hg2ApWDEOwUg8Lg=s48-c-k-c0x00ffffff-no-rj', 'authorChannelUrl': 'http://www.youtube.com/channel/UCec-3ugFOqs7cOGa8klmV2Q', 'authorChannelId': {'value': 'UCec-3ugFOqs7cOGa8klmV2Q'}, 'canRate': True, 'viewerRating': 'none', 'likeCount': 0, 'publishedAt': '2022-10-30T18:58:07Z', 'updatedAt': '2022-10-30T18:58:07Z'}}, 'canReply': True, 'totalReplyCount': 0, 'isPublic': True}",,UCec-3ugFOqs7cOGa8klmV2Q,2022-10-30T18:58:07Z,É tentativa de golpe explícita. BOLSONARO quer ganhar no tapetão,QURTSl9pMVZoZzV5WTVraFlkUC13TnBwUXZBOFRZako3N09PaFBHWTF1S201VWJDUmVlUjZoX0V6cVAzQ1d2d1dRc2xHN0RhRTRWVGM1QQ==,2023-06-08 02:14:37.893314
youtube#commentThread,NyI70-SqzSgKQJ1xfai_UxavpRM,UgzwewGr-Y9iJW0ct7F4AaABAg,"{'videoId': 'tujarmzTmOI', 'topLevelComment': {'kind': 'youtube#comment', 'etag': 'Biw5zt6EOTFw1ALL1zCAb_NC2pM', 'id': 'UgzwewGr-Y9iJW0ct7F4AaABAg', 'snippet': {'videoId': 'tujarmzTmOI', 'textDisplay': 'A maioria dos brasileiros que mora na Europa vota no Lula. Porque começa a enxergar a verdade.', 'textOriginal': 'A maioria dos brasileiros que mora na Europa vota no Lula. Porque começa a enxergar a verdade.', 'authorDisplayName': 'Joana R', 'authorProfileImageUrl': 'https://yt3.ggpht.com/ytc/AGIKgqPZytKIofJajEfGV3mz0nFJ0a5Hg2ApWDEOwUg8Lg=s48-c-k-c0x00ffffff-no-rj', 'authorChannelUrl': 'http://www.youtube.com/channel/UCec-3ugFOqs7cOGa8klmV2Q', 'authorChannelId': {'value': 'UCec-3ugFOqs7cOGa8klmV2Q'}, 'canRate': True, 'viewerRating': 'none', 'likeCount': 0, 'publishedAt': '2022-10-30T16:25:59Z', 'updatedAt': '2022-10-30T16:25:59Z'}}, 'canReply': True, 'totalReplyCount': 0, 'isPublic': True}",,UCec-3ugFOqs7cOGa8klmV2Q,2022-10-30T16:25:59Z,A maioria dos brasileiros que mora na Europa vota no Lula. Porque começa a enxergar a verdade.,QURTSl9pMm9za1c4anAzaGVXeUpTWGF6Y2JsdERVQXVmdU9BbHF3X0JfazcwSWVzeHRPdEhSWHJDLVV6Vk5JTWpwQ3NGTlFleXgxU0ZxTQ==,2023-06-08 02:15:15.453898
youtube#commentThread,E3H_BWc0ogN8ca-b7E6aejZlz44,UgysY9l3TpCvnEfOkqd4AaABAg,"{'videoId': 'KWxArw8E1pY', 'topLevelComment': {'kind': 'youtube#comment', 'etag': 'Qp2jNYBxALOGrUWyC9xJTOEybtg', 'id': 'UgysY9l3TpCvnEfOkqd4AaABAg', 'snippet': {'videoId': 'KWxArw8E1pY', 'textDisplay': 'A maior fraude dessas eleições foi a rede de fake news montada pelo Bolsonaro. A compra de votos com dinheiro público. A coação patronal a votar no Bolsonaro. Deus intervenha contra as mentiras, contra o ódio, contra as armas!', 'textOriginal': 'A maior fraude dessas eleições foi a rede de fake news montada pelo Bolsonaro. A compra de votos com dinheiro público. A coação patronal a votar no Bolsonaro. Deus intervenha contra as mentiras, contra o ódio, contra as armas!', 'authorDisplayName': 'Joana R', 'authorProfileImageUrl': 'https://yt3.ggpht.com/ytc/AGIKgqPZytKIofJajEfGV3mz0nFJ0a5Hg2ApWDEOwUg8Lg=s48-c-k-c0x00ffffff-no-rj', 'authorChannelUrl': 'http://www.youtube.com/channel/UCec-3ugFOqs7cOGa8klmV2Q', 'authorChannelId': {'value': 'UCec-3ugFOqs7cOGa8klmV2Q'}, 'canRate': True, 'viewerRating': 'none', 'likeCount': 0, 'publishedAt': '2022-10-30T16:51:44Z', 'updatedAt': '2022-10-30T16:51:44Z'}}, 'canReply': True, 'totalReplyCount': 0, 'isPublic': True}",,UCec-3ugFOqs7cOGa8klmV2Q,2022-10-30T16:51:44Z,"A maior fraude dessas eleições foi a rede de fake news montada pelo Bolsonaro. A compra de votos com dinheiro público. A coação patronal a votar no Bolsonaro. Deus intervenha contra as mentiras, contra o ódio, contra as armas!",QURTSl9pMmpfc2NCQkdnNmZpN3FrWTduQ0tFdmlYM2FVX2JjQUktdjcwTVhubHFtbUVxVHc5TVIzRFBIT2ZGUU53SExDX0YtbnNfbGlvcw==,2023-06-08 02:15:18.811526
youtube#commentThread,j2iEeeJ6TJfIUMXKwjYXUKDiNVo,UgyhTng0ngUAJ8EudOl4AaABAg,"{'videoId': 'zPRqoWaSQlk', 'topLevelComment': {'kind': 'youtube#comment', 'etag': 'RdocKGjywsF_g8A_Qm7GCjmY7jg', 'id': 'UgyhTng0ngUAJ8EudOl4AaABAg', 'snippet': {'videoId': 'zPRqoWaSQlk', 'textDisplay': 'E o repasse federal da merenda, seu Bolsonaro? Virou barras de ouro no bolso de pastor', 'textOriginal': 'E o repasse federal da merenda, seu Bolsonaro? Virou barras de ouro no bolso de pastor', 'authorDisplayName': 'Joana R', 'authorProfileImageUrl': 'https://yt3.ggpht.com/ytc/AGIKgqPZytKIofJajEfGV3mz0nFJ0a5Hg2ApWDEOwUg8Lg=s48-c-k-c0x00ffffff-no-rj', 'authorChannelUrl': 'http://www.youtube.com/channel/UCec-3ugFOqs7cOGa8klmV2Q', 'authorChannelId': {'value': 'UCec-3ugFOqs7cOGa8klmV2Q'}, 'canRate': True, 'viewerRating': 'none', 'likeCount': 5, 'publishedAt': '2022-10-14T22:09:24Z', 'updatedAt': '2022-10-14T22:09:24Z'}}, 'canReply': True, 'totalReplyCount': 1, 'isPublic': True}","{'comments': [{'kind': 'youtube#comment', 'etag': 'YcCQeFgowL_VQb-TDuc2fqNHQ0E', 'id': 'UgyhTng0ngUAJ8EudOl4AaABAg.9hAyYBWN9Wh9hB05UwYq1h', 'snippet': {'videoId': 'zPRqoWaSQlk', 'textDisplay': 'Você tem que aprender e estudar um pouco. Merenda é responsabilidade da prefeitura (fundamental 1) e governo estadual (fundamental 2 e médio).', 'textOriginal': 'Você tem que aprender e estudar um pouco. Merenda é responsabilidade da prefeitura (fundamental 1) e governo estadual (fundamental 2 e médio).', 'parentId': 'UgyhTng0ngUAJ8EudOl4AaABAg', 'authorDisplayName': 'Seção Eleitoral', 'authorProfileImageUrl': 'https://yt3.ggpht.com/naxxKiuS-8pmb1fcS7xdLEprd7LrUDVHS4sRs5bgVC3_NV0aab4sn09d55AtPPMJwnG3_it4YAI=s48-c-k-c0x00ffffff-no-rj', 'authorChannelUrl': 'http://www.youtube.com/channel/UCoZfVqlDuUGisI3cmDNLiXQ', 'authorChannelId': {'value': 'UCoZfVqlDuUGisI3cmDNLiXQ'}, 'canRate': True, 'viewerRating': 'none', 'likeCount': 2, 'publishedAt': '2022-10-14T22:31:41Z', 'updatedAt': '2022-10-14T22:31:50Z'}}]}",UCec-3ugFOqs7cOGa8klmV2Q,2022-10-14T22:09:24Z,"E o repasse federal da merenda, seu Bolsonaro? Virou barras de ouro no bolso de pastor",,2023-06-08 11:03:52.482828
youtube#commentThread,RPxioAAzVvK8RvOBzmYra5K8Pao,UgynXPAZpqImF880htx4AaABAg,"{'videoId': 'zPRqoWaSQlk', 'topLevelComment': {'kind': 'youtube#comment', 'etag': 'tzus61nCdYyA3135JDNEBFFAV-Y', 'id': 'UgynXPAZpqImF880htx4AaABAg', 'snippet': {'videoId': 'zPRqoWaSQlk', 'textDisplay': 'Tchutchuca do Centrão, 107 imóveis com dinheiro do povão.', 'textOriginal': 'Tchutchuca do Centrão, 107 imóveis com dinheiro do povão.', 'authorDisplayName': 'Joana R', 'authorProfileImageUrl': 'https://yt3.ggpht.com/ytc/AGIKgqPZytKIofJajEfGV3mz0nFJ0a5Hg2ApWDEOwUg8Lg=s48-c-k-c0x00ffffff-no-rj', 'authorChannelUrl': 'http://www.youtube.com/channel/UCec-3ugFOqs7cOGa8klmV2Q', 'authorChannelId': {'value': 'UCec-3ugFOqs7cOGa8klmV2Q'}, 'canRate': True, 'viewerRating': 'none', 'likeCount': 9, 'publishedAt': '2022-10-14T22:07:15Z', 'updatedAt': '2022-10-14T22:07:15Z'}}, 'canReply': True, 'totalReplyCount': 4, 'isPublic': True}","{'comments': [{'kind': 'youtube#comment', 'etag': 'tIBdehzJ03kdSl6R3zIoIhHY79g', 'id': 'UgynXPAZpqImF880htx4AaABAg.9hAyIXSNDsO9hB3p9r-1mh', 'snippet': {'videoId': 'zPRqoWaSQlk', 'textDisplay': 'Vcs q apoiam lula .eu pensei que vcs não eschergavam  corrupção kkkkkk', 'textOriginal': 'Vcs q apoiam lula .eu pensei que vcs não eschergavam  corrupção kkkkkk', 'parentId': 'UgynXPAZpqImF880htx4AaABAg', 'authorDisplayName': 'Nato0123 Evangelista', 'authorProfileImageUrl': 'https://yt3.ggpht.com/ytc/AGIKgqPcobXNPeQK77zSEBul3kQeVJIr8CCsI38e-U4l84wWl7B6ablqzezVoGsI20ED=s48-c-k-c0x00ffffff-no-rj', 'authorChannelUrl': 'http://www.youtube.com/channel/UCysp7qldZRAwe9-R5AIfDqQ', 'authorChannelId': {'value': 'UCysp7qldZRAwe9-R5AIfDqQ'}, 'canRate': True, 'viewerRating': 'none', 'likeCount': 1, 'publishedAt': '2022-10-14T23:04:16Z', 'updatedAt': '2022-10-14T23:04:16Z'}}, {'kind': 'youtube#comment', 'etag': 'mCLNJ2Ojk26rP3SH2p74IIqXRls', 'id': 'UgynXPAZpqImF880htx4AaABAg.9hAyIXSNDsO9hB2eS5PBD3', 'snippet': {'videoId': 'zPRqoWaSQlk', 'textDisplay': 'Só dar PT no segundo turno do MEC ministro pastor envolvido ó dinheiro dá educação cuadrilia dê bosonaro', 'textOriginal': 'Só dar PT no segundo turno do MEC ministro pastor envolvido ó dinheiro dá educação cuadrilia dê bosonaro', 'parentId': 'UgynXPAZpqImF880htx4AaABAg', 'authorDisplayName': 'Matias Fernandes', 'authorProfileImageUrl': 'https://yt3.ggpht.com/ytc/AGIKgqOEVip66qmy8tHLAyoFXpA6mTfP77VM8EAPHg=s48-c-k-c0x00ffffff-no-rj', 'authorChannelUrl': 'http://www.youtube.com/channel/UC2OEnR2ygIrlWmlDai1G5DA', 'authorChannelId': {'value': 'UC2OEnR2ygIrlWmlDai1G5DA'}, 'canRate': True, 'viewerRating': 'none', 'likeCount': 1, 'publishedAt': '2022-10-14T22:54:04Z', 'updatedAt': '2022-10-14T22:54:04Z'}}, {'kind': 'youtube#comment', 'etag': '29cgQft2YUyXvzFfIjUARxnmw7I', 'id': 'UgynXPAZpqImF880htx4AaABAg.9hAyIXSNDsO9hAzLhIC6Va', 'snippet': {'videoId': 'zPRqoWaSQlk', 'textDisplay': 'Eu nunca vi bossonaro ser.condenado agora lula ater preso foi', 'textOriginal': 'Eu nunca vi bossonaro ser.condenado agora lula ater preso foi', 'parentId': 'UgynXPAZpqImF880htx4AaABAg', 'authorDisplayName': 'Nato0123 Evangelista', 'authorProfileImageUrl': 'https://yt3.ggpht.com/ytc/AGIKgqPcobXNPeQK77zSEBul3kQeVJIr8CCsI38e-U4l84wWl7B6ablqzezVoGsI20ED=s48-c-k-c0x00ffffff-no-rj', 'authorChannelUrl': 'http://www.youtube.com/channel/UCysp7qldZRAwe9-R5AIfDqQ', 'authorChannelId': {'value': 'UCysp7qldZRAwe9-R5AIfDqQ'}, 'canRate': True, 'viewerRating': 'none', 'likeCount': 0, 'publishedAt': '2022-10-14T22:16:25Z', 'updatedAt': '2022-10-14T22:16:25Z'}}, {'kind': 'youtube#comment', 'etag': 'EEoBHBxUKsfqIg2KkRRHUN7qjvM', 'id': 'UgynXPAZpqImF880htx4AaABAg.9hAyIXSNDsO9hAyWHtmb07', 'snippet': {'videoId': 'zPRqoWaSQlk', 'textDisplay': 'Metro na venezuela ja foi pago?', 'textOriginal': 'Metro na venezuela ja foi pago?', 'parentId': 'UgynXPAZpqImF880htx4AaABAg', 'authorDisplayName': 'carlos gabriel brioli dos santos', 'authorProfileImageUrl': 'https://yt3.ggpht.com/ytc/AGIKgqOTu8Cxu28n57hWUWDCsjdyTuOP_lKte6vpDQ=s48-c-k-c0x00ffffff-no-rj', 'authorChannelUrl': 'http://www.youtube.com/channel/UClmqyGRu7Jt9WmCQDsiMQfw', 'authorChannelId': {'value': 'UClmqyGRu7Jt9WmCQDsiMQfw'}, 'canRate': True, 'viewerRating': 'none', 'likeCount': 1, 'publishedAt': '2022-10-14T22:09:08Z', 'updatedAt': '2022-10-14T22:09:08Z'}}]}",UCec-3ugFOqs7cOGa8klmV2Q,2022-10-14T22:07:15Z,"Tchutchuca do Centrão, 107 imóveis com dinheiro do povão.",,2023-06-08 11:03:52.482828
youtube#commentThread,PUOtprBMIinkyp4PfzcVGQOJjms,Ugyp43AJ4mq0G4oEpP54AaABAg,"{'videoId': 'Letmo1tLoXA', 'topLevelComment': {'kind': 'youtube#comment', 'etag': '46ildjSEOSxwXBiV6cUxNDAKLPg', 'id': 'Ugyp43AJ4mq0G4oEpP54AaABAg', 'snippet': {'videoId': 'Letmo1tLoXA', 'textDisplay': 'Não à toa tanta gente do PL se elegeu. Campanhas milionárias e apoio de prefeitos comprado com propinas com dinheiro público desviado. O orçamento secreto é desvio de dinheiro pra bancar um projeto de poder dos partidos do centrão. Cortesia de Lira e do Bolsonaro.', 'textOriginal': 'Não à toa tanta gente do PL se elegeu. Campanhas milionárias e apoio de prefeitos comprado com propinas com dinheiro público desviado. O orçamento secreto é desvio de dinheiro pra bancar um projeto de poder dos partidos do centrão. Cortesia de Lira e do Bolsonaro.', 'authorDisplayName': 'Joana R', 'authorProfileImageUrl': 'https://yt3.ggpht.com/ytc/AGIKgqPZytKIofJajEfGV3mz0nFJ0a5Hg2ApWDEOwUg8Lg=s48-c-k-c0x00ffffff-no-rj', 'authorChannelUrl': 'http://www.youtube.com/channel/UCec-3ugFOqs7cOGa8klmV2Q', 'authorChannelId': {'value': 'UCec-3ugFOqs7cOGa8klmV2Q'}, 'canRate': True, 'viewerRating': 'none', 'likeCount': 0, 'publishedAt': '2022-10-15T12:34:13Z', 'updatedAt': '2022-10-15T12:34:13Z'}}, 'canReply': True, 'totalReplyCount': 0, 'isPublic': True}",,UCec-3ugFOqs7cOGa8klmV2Q,2022-10-15T12:34:13Z,Não à toa tanta gente do PL se elegeu. Campanhas milionárias e apoio de prefeitos comprado com propinas com dinheiro público desviado. O orçamento secreto é desvio de dinheiro pra bancar um projeto de poder dos partidos do centrão. Cortesia de Lira e do Bolsonaro.,QURTSl9pMnVYbHpnbkFGZEMzdkNJYzlPM3RaX3NnYWd1bzFqNE5FTzF0SkpLc0ZlOVJ1dndCRFpzdnV4cWRtUzR3OGhPUUdpT2o3QkFVZw==,2023-06-08 11:03:53.241421
youtube#commentThread,EDJgPmtOm_tacoMqHHpKBEAVfEw,UgxfJSX_4cA962lR9z94AaABAg,"{'videoId': 'Letmo1tLoXA', 'topLevelComment': {'kind': 'youtube#comment', 'etag': 'qjlveWPcJBkew3j6qLYDRDyZQlQ', 'id': 'UgxfJSX_4cA962lR9z94AaABAg', 'snippet': {'videoId': 'Letmo1tLoXA', 'textDisplay': 'Aparecendo o mensalão bilionário em esquema de emendas pra aliados do centrão. Bolsonaro quem fez.', 'textOriginal': 'Aparecendo o mensalão bilionário em esquema de emendas pra aliados do centrão. Bolsonaro quem fez.', 'authorDisplayName': 'Joana R', 'authorProfileImageUrl': 'https://yt3.ggpht.com/ytc/AGIKgqPZytKIofJajEfGV3mz0nFJ0a5Hg2ApWDEOwUg8Lg=s48-c-k-c0x00ffffff-no-rj', 'authorChannelUrl': 'http://www.youtube.com/channel/UCec-3ugFOqs7cOGa8klmV2Q', 'authorChannelId': {'value': 'UCec-3ugFOqs7cOGa8klmV2Q'}, 'canRate': True, 'viewerRating': 'none', 'likeCount': 0, 'publishedAt': '2022-10-15T12:31:13Z', 'updatedAt': '2022-10-15T12:31:13Z'}}, 'canReply': True, 'totalReplyCount': 0, 'isPublic': True}",,UCec-3ugFOqs7cOGa8klmV2Q,2022-10-15T12:31:13Z,Aparecendo o mensalão bilionário em esquema de emendas pra aliados do centrão. Bolsonaro quem fez.,QURTSl9pMnVYbHpnbkFGZEMzdkNJYzlPM3RaX3NnYWd1bzFqNE5FTzF0SkpLc0ZlOVJ1dndCRFpzdnV4cWRtUzR3OGhPUUdpT2o3QkFVZw==,2023-06-08 11:03:53.241421
