kind,etag,id,snippet,replies,authorChannelId,publishedAt,textOriginal,nextPageToken,extraction_date
youtube#commentThread,Vfn2gpKwIaoP9sWVEya0coTmrqY,Ugz32vl3o48jsITWQPF4AaABAg,"{'videoId': 'q3xRtQ5ykw4', 'topLevelComment': {'kind': 'youtube#comment', 'etag': '9vrj_WR81QK3cXrIiueII39FOHA', 'id': 'Ugz32vl3o48jsITWQPF4AaABAg', 'snippet': {'videoId': 'q3xRtQ5ykw4', 'textDisplay': 'Cadê as propostas para a economia? Pelo que sabemos, só tem redução do mínimo, de aposentadoria, redução de 25% do salário de servidores e taxação de despesas  médicas e de educação.', 'textOriginal': 'Cadê as propostas para a economia? Pelo que sabemos, só tem redução do mínimo, de aposentadoria, redução de 25% do salário de servidores e taxação de despesas  médicas e de educação.', 'authorDisplayName': 'Joana R', 'authorProfileImageUrl': 'https://yt3.ggpht.com/ytc/AGIKgqPZytKIofJajEfGV3mz0nFJ0a5Hg2ApWDEOwUg8Lg=s48-c-k-c0x00ffffff-no-rj', 'authorChannelUrl': 'http://www.youtube.com/channel/UCec-3ugFOqs7cOGa8klmV2Q', 'authorChannelId': {'value': 'UCec-3ugFOqs7cOGa8klmV2Q'}, 'canRate': True, 'viewerRating': 'none', 'likeCount': 0, 'publishedAt': '2022-10-25T23:04:35Z', 'updatedAt': '2022-10-25T23:04:35Z'}}, 'canReply': True, 'totalReplyCount': 1, 'isPublic': True}","{'comments': [{'kind': 'youtube#comment', 'etag': 'MoMzdwh2AcJypikOHWqyDcXV9Ow', 'id': 'Ugz32vl3o48jsITWQPF4AaABAg.9hcOb3rQyZx9hcq4vGAIiq', 'snippet': {'videoId': 'q3xRtQ5ykw4', 'textDisplay': 'Fontes: Janones.', 'textOriginal': 'Fontes: Janones.', 'parentId': 'Ugz32vl3o48jsITWQPF4AaABAg', 'authorDisplayName': 'Leandro Oliveira', 'authorProfileImageUrl': 'https://yt3.ggpht.com/v0ZD7Yy0KMT0MVctdXICyLUmE7UZxZywDjQ3w7q8MEoWcycpCj8fGosCEcG6J8E3b3u3WAKATg=s48-c-k-c0x00ffffff-no-rj', 'authorChannelUrl': 'http://www.youtube.com/channel/UCsGosvjd0a0mbxBX2lwetrA', 'authorChannelId': {'value': 'UCsGosvjd0a0mbxBX2lwetrA'}, 'canRate': True, 'viewerRating': 'none', 'likeCount': 0, 'publishedAt': '2022-10-26T03:13:28Z', 'updatedAt': '2022-10-26T03:13:28Z'}}]}",UCec-3ugFOqs7cOGa8klmV2Q,2022-10-25T23:04:35Z,"Cadê as propostas para a economia? Pelo que sabemos, só tem redução do mínimo, de aposentadoria, redução de 25% do salário de servidores e taxação de despesas  médicas e de educação.",QURTSl9pMlkzUmFjTXdwLURaajRGbEhoZXFDdXJzTEVsOTQxOF9HQUxGcF90MVlFXzRyYUhjQ3FwT2NObDJoTFRJZWwxQWVOS1dHZVEzUQ==,2023-06-08 02:33:54.131345
youtube#commentThread,j2EZNn4lcS-2xIT7fdzXR5B_Wq4,Ugx9aEo8waa4fQQ_OFV4AaABAg,"{'videoId': 'q3xRtQ5ykw4', 'topLevelComment': {'kind': 'youtube#comment', 'etag': 'dv_zreD89NTD8k_EFfvH1yPjtzY', 'id': 'Ugx9aEo8waa4fQQ_OFV4AaABAg', 'snippet': {'videoId': 'q3xRtQ5ykw4', 'textDisplay': 'Factoide. Esse numero foi sendo aumentado até causar impacto. E tem gente que cai como um patinho', 'textOriginal': 'Factoide. Esse numero foi sendo aumentado até causar impacto. E tem gente que cai como um patinho', 'authorDisplayName': 'Joana R', 'authorProfileImageUrl': 'https://yt3.ggpht.com/ytc/AGIKgqPZytKIofJajEfGV3mz0nFJ0a5Hg2ApWDEOwUg8Lg=s48-c-k-c0x00ffffff-no-rj', 'authorChannelUrl': 'http://www.youtube.com/channel/UCec-3ugFOqs7cOGa8klmV2Q', 'authorChannelId': {'value': 'UCec-3ugFOqs7cOGa8klmV2Q'}, 'canRate': True, 'viewerRating': 'none', 'likeCount': 3, 'publishedAt': '2022-10-25T23:00:59Z', 'updatedAt': '2022-10-25T23:00:59Z'}}, 'canReply': True, 'totalReplyCount': 1, 'isPublic': True}","{'comments': [{'kind': 'youtube#comment', 'etag': 'ez39u33Kb5NtY0OeWGZImUg6tXw', 'id': 'Ugx9aEo8waa4fQQ_OFV4AaABAg.9hcOBgUkWqg9hccYEfvDkq', 'snippet': {'videoId': 'q3xRtQ5ykw4', 'textDisplay': 'Mentira já está no Twitter pra todos verem.ACORDA PÔ...', 'textOriginal': 'Mentira já está no Twitter pra todos verem.ACORDA PÔ...', 'parentId': 'Ugx9aEo8waa4fQQ_OFV4AaABAg', 'authorDisplayName': 'Mateus Henrique', 'authorProfileImageUrl': 'https://yt3.ggpht.com/KRtUgQZSrjW1uo7ke9_kGcVwQAkAUeeRdtd7NA9Mr6wpvVBgN7xr1d_cSliEAb7d4-_l5KfC=s48-c-k-c0x00ffffff-no-rj', 'authorChannelUrl': 'http://www.youtube.com/channel/UCy6iv73uMNruwToU3_yGLuw', 'authorChannelId': {'value': 'UCy6iv73uMNruwToU3_yGLuw'}, 'canRate': True, 'viewerRating': 'none', 'likeCount': 0, 'publishedAt': '2022-10-26T01:15:08Z', 'updatedAt': '2022-10-26T01:15:08Z'}}]}",UCec-3ugFOqs7cOGa8klmV2Q,2022-10-25T23:00:59Z,Factoide. Esse numero foi sendo aumentado até causar impacto. E tem gente que cai como um patinho,QURTSl9pMlkzUmFjTXdwLURaajRGbEhoZXFDdXJzTEVsOTQxOF9HQUxGcF90MVlFXzRyYUhjQ3FwT2NObDJoTFRJZWwxQWVOS1dHZVEzUQ==,2023-06-08 02:33:54.131345
youtube#commentThread,neaZXHugDWDAjPPwCt2eTwEzbAY,UgzzavGVM3cEsX-7ASZ4AaABAg,"{'videoId': 'q3xRtQ5ykw4', 'topLevelComment': {'kind': 'youtube#comment', 'etag': '0xkzRNEwqeS6OCWujHY_bWcQGwc', 'id': 'UgzzavGVM3cEsX-7ASZ4AaABAg', 'snippet': {'videoId': 'q3xRtQ5ykw4', 'textDisplay': 'Bolsonaro É UMA FRAUDE. Sem mentiras e fake news não haveria Bolsonaro, só uns poucos milhares de pervertidos o apoiariam. Hoje, acredito que apoiá-lo exija tanto malabarismo mental que só gente perversa o apoie. Gente cheia de ódio, raiva, que não tem interesse real no desenvolvimento do Brasil', 'textOriginal': 'Bolsonaro É UMA FRAUDE. Sem mentiras e fake news não haveria Bolsonaro, só uns poucos milhares de pervertidos o apoiariam. Hoje, acredito que apoiá-lo exija tanto malabarismo mental que só gente perversa o apoie. Gente cheia de ódio, raiva, que não tem interesse real no desenvolvimento do Brasil', 'authorDisplayName': 'Joana R', 'authorProfileImageUrl': 'https://yt3.ggpht.com/ytc/AGIKgqPZytKIofJajEfGV3mz0nFJ0a5Hg2ApWDEOwUg8Lg=s48-c-k-c0x00ffffff-no-rj', 'authorChannelUrl': 'http://www.youtube.com/channel/UCec-3ugFOqs7cOGa8klmV2Q', 'authorChannelId': {'value': 'UCec-3ugFOqs7cOGa8klmV2Q'}, 'canRate': True, 'viewerRating': 'none', 'likeCount': 0, 'publishedAt': '2022-10-25T22:52:58Z', 'updatedAt': '2022-10-25T22:52:58Z'}}, 'canReply': True, 'totalReplyCount': 1, 'isPublic': True}","{'comments': [{'kind': 'youtube#comment', 'etag': 'qI4TZEUgYWylEEZMxQayfq_CtFA', 'id': 'UgzzavGVM3cEsX-7ASZ4AaABAg.9hcNGyBqdkD9hcSZJJwcr1', 'snippet': {'videoId': 'q3xRtQ5ykw4', 'textDisplay': 'O problema é que vc vê isso só nos bolsonaristas, o outro lado faz igual ou pior do que eles.', 'textOriginal': 'O problema é que vc vê isso só nos bolsonaristas, o outro lado faz igual ou pior do que eles.', 'parentId': 'UgzzavGVM3cEsX-7ASZ4AaABAg', 'authorDisplayName': 'eder marcelo', 'authorProfileImageUrl': 'https://yt3.ggpht.com/ytc/AGIKgqM3dazOG3k01qG-cuIUxyKgLocjRERrRWAYIA=s48-c-k-c0x00ffffff-no-rj', 'authorChannelUrl': 'http://www.youtube.com/channel/UCt_dbDc-CJbtInkWPqe0KxQ', 'authorChannelId': {'value': 'UCt_dbDc-CJbtInkWPqe0KxQ'}, 'canRate': True, 'viewerRating': 'none', 'likeCount': 0, 'publishedAt': '2022-10-25T23:39:10Z', 'updatedAt': '2022-10-25T23:39:10Z'}}]}",UCec-3ugFOqs7cOGa8klmV2Q,2022-10-25T22:52:58Z,"Bolsonaro É UMA FRAUDE. Sem mentiras e fake news não haveria Bolsonaro, só uns poucos milhares de pervertidos o apoiariam. Hoje, acredito que apoiá-lo exija tanto malabarismo mental que só gente perversa o apoie. Gente cheia de ódio, raiva, que não tem interesse real no desenvolvimento do Brasil",QURTSl9pMDV2ZXQta1ltd3JGWUJ4WDN1VmJXSXpqaXI0TVVVZ1pobVpNT3NPWmRMVVFMLW1zRlR1UUZVVTFPdG84RlpQRnFMbmhvS2RENA==,2023-06-08 02:33:55.895988
youtube#commentThread,Bjxh2DbO9m9j7kRS0mXvOQ6uvCk,UgzgiacHrQazuMMaesl4AaABAg,"{'videoId': 'yL-F0a53Wfw', 'topLevelComment': {'kind': 'youtube#comment', 'etag': 'QaND6d0ku-sPep00jnrI54XpyzI', 'id': 'UgzgiacHrQazuMMaesl4AaABAg', 'snippet': {'videoId': 'yL-F0a53Wfw', 'textDisplay': 'Bolsonaristas são perversos e hipócritas. Normal', 'textOriginal': 'Bolsonaristas são perversos e hipócritas. Normal', 'authorDisplayName': 'Joana R', 'authorProfileImageUrl': 'https://yt3.ggpht.com/ytc/AGIKgqPZytKIofJajEfGV3mz0nFJ0a5Hg2ApWDEOwUg8Lg=s48-c-k-c0x00ffffff-no-rj', 'authorChannelUrl': 'http://www.youtube.com/channel/UCec-3ugFOqs7cOGa8klmV2Q', 'authorChannelId': {'value': 'UCec-3ugFOqs7cOGa8klmV2Q'}, 'canRate': True, 'viewerRating': 'none', 'likeCount': 0, 'publishedAt': '2022-10-30T01:46:14Z', 'updatedAt': '2022-10-30T01:46:14Z'}}, 'canReply': True, 'totalReplyCount': 0, 'isPublic': True}",,UCec-3ugFOqs7cOGa8klmV2Q,2022-10-30T01:46:14Z,Bolsonaristas são perversos e hipócritas. Normal,QURTSl9pMmxkVG9DYU5BMmo1d1h0Mjh5d1VtaGl3T0plNFk5b2x1NnZHZUJmb29QRC1aeFpUOWZuTS1icTMwZGFFUFNwQXZmTUh4V2dONA==,2023-06-08 02:33:58.209985
youtube#commentThread,dWU58rK9FFmz3McpxIKhQczu2mY,Ugz-FptPLOJb8r1Eia94AaABAg,"{'videoId': 'DZRb27DKf9w', 'topLevelComment': {'kind': 'youtube#comment', 'etag': 'PSsNmQAp3GVLOrt6mz3NblFx4B0', 'id': 'Ugz-FptPLOJb8r1Eia94AaABAg', 'snippet': {'videoId': 'DZRb27DKf9w', 'textDisplay': 'Gente que maravilha! Chega de pastor, militar e olavista. Agora é só gente capaz de verdade.', 'textOriginal': 'Gente que maravilha! Chega de pastor, militar e olavista. Agora é só gente capaz de verdade.', 'authorDisplayName': 'Joana R', 'authorProfileImageUrl': 'https://yt3.ggpht.com/ytc/AGIKgqPZytKIofJajEfGV3mz0nFJ0a5Hg2ApWDEOwUg8Lg=s48-c-k-c0x00ffffff-no-rj', 'authorChannelUrl': 'http://www.youtube.com/channel/UCec-3ugFOqs7cOGa8klmV2Q', 'authorChannelId': {'value': 'UCec-3ugFOqs7cOGa8klmV2Q'}, 'canRate': True, 'viewerRating': 'none', 'likeCount': 20, 'publishedAt': '2022-10-31T17:07:35Z', 'updatedAt': '2022-10-31T17:07:35Z'}}, 'canReply': True, 'totalReplyCount': 13, 'isPublic': True}","{'comments': [{'kind': 'youtube#comment', 'etag': 'Lqoy7inWl0PuMXgTx-gD65mVyOk', 'id': 'Ugz-FptPLOJb8r1Eia94AaABAg.9hrCWX7Fl1l9hubNcis2e8', 'snippet': {'videoId': 'DZRb27DKf9w', 'textDisplay': '@danilo oliveira você acreditou em narrativas bolsonaristas. Rui Costa foi o melhor governador da história da Bahia. Um gestor espetacular. Foi muito competente e educado durante a pandemia.', 'textOriginal': '@danilo oliveira você acreditou em narrativas bolsonaristas. Rui Costa foi o melhor governador da história da Bahia. Um gestor espetacular. Foi muito competente e educado durante a pandemia.', 'parentId': 'Ugz-FptPLOJb8r1Eia94AaABAg', 'authorDisplayName': 'Ian Miler', 'authorProfileImageUrl': 'https://yt3.ggpht.com/ytc/AGIKgqOlGs-RB7LGIVyZNJ0EFanc1cZ4yDmvwixeVpJhEw=s48-c-k-c0x00ffffff-no-rj', 'authorChannelUrl': 'http://www.youtube.com/channel/UCu19JqF78SG3jKSLdoc2pfQ', 'authorChannelId': {'value': 'UCu19JqF78SG3jKSLdoc2pfQ'}, 'canRate': True, 'viewerRating': 'none', 'likeCount': 1, 'publishedAt': '2022-11-02T00:51:17Z', 'updatedAt': '2022-11-02T00:51:17Z'}}, {'kind': 'youtube#comment', 'etag': 'SvuFhqNHflc9mBYlVKoHm_tPzrs', 'id': 'Ugz-FptPLOJb8r1Eia94AaABAg.9hrCWX7Fl1l9hrLdf8xSYw', 'snippet': {'videoId': 'DZRb27DKf9w', 'textDisplay': 'deve está ironizando ou deve ser uma palhaça.', 'textOriginal': 'deve está ironizando ou deve ser uma palhaça.', 'parentId': 'Ugz-FptPLOJb8r1Eia94AaABAg', 'authorDisplayName': 'Manoel Rodrigues Rodrigues', 'authorProfileImageUrl': 'https://yt3.ggpht.com/ytc/AGIKgqMmhS_K7A7tVDkDGGvphWQItPyeKuulYr2FOjBp1s-_PiyKvjiePWVNPYfB_gcV=s48-c-k-c0x00ffffff-no-rj', 'authorChannelUrl': 'http://www.youtube.com/channel/UCVe8xbHp-INWJrK80YIUX3A', 'authorChannelId': {'value': 'UCVe8xbHp-INWJrK80YIUX3A'}, 'canRate': True, 'viewerRating': 'none', 'likeCount': 0, 'publishedAt': '2022-10-31T18:27:20Z', 'updatedAt': '2022-10-31T18:27:20Z'}}, {'kind': 'youtube#comment', 'etag': 'Zc7fVMLc0KZebb8R0M_dRM23goM', 'id': 'Ugz-FptPLOJb8r1Eia94AaABAg.9hrCWX7Fl1l9hrL20ZnA4J', 'snippet': {'videoId': 'DZRb27DKf9w', 'textDisplay': '@Matheus Canuto pergunta pra alguém de São Luis como tá a criminalidade na capital, ele é extremamente populista, o que é bom pra ser eleito pela massa, mas não pra ministro da justiça né', 'textOriginal': '@Matheus Canuto pergunta pra alguém de São Luis como tá a criminalidade na capital, ele é extremamente populista, o que é bom pra ser eleito pela massa, mas não pra ministro da justiça né', 'parentId': 'Ugz-FptPLOJb8r1Eia94AaABAg', 'authorDisplayName': 'Thiago', 'authorProfileImageUrl': 'https://yt3.ggpht.com/CQjtMvCZt_GaIunAl2wgoWbYuyyHfYcAzkBHwCk6K1il0IR_1q6oISa0ZKDC5OZtPXwM2TXN=s48-c-k-c0x00ffffff-no-rj', 'authorChannelUrl': 'http://www.youtube.com/channel/UCO0jYok85TFwFzwJRMg3y9g', 'authorChannelId': {'value': 'UCO0jYok85TFwFzwJRMg3y9g'}, 'canRate': True, 'viewerRating': 'none', 'likeCount': 2, 'publishedAt': '2022-10-31T18:22:03Z', 'updatedAt': '2022-10-31T18:22:03Z'}}, {'kind': 'youtube#comment', 'etag': '_FQcXRYRL7BQSBurTRXlMZIBxLg', 'id': 'Ugz-FptPLOJb8r1Eia94AaABAg.9hrCWX7Fl1l9hrKLrzs-Cb', 'snippet': {'videoId': 'DZRb27DKf9w', 'textDisplay': '@Thiago e porque ele tem tanto voto ai ? foi duas vezes governador, é senador... Não entendo isso não, a voz do povo não é a voz de Deus ?', 'textOriginal': '@Thiago e porque ele tem tanto voto ai ? foi duas vezes governador, é senador... Não entendo isso não, a voz do povo não é a voz de Deus ?', 'parentId': 'Ugz-FptPLOJb8r1Eia94AaABAg', 'authorDisplayName': 'Matheus Canuto', 'authorProfileImageUrl': 'https://yt3.ggpht.com/ytc/AGIKgqMc9t6jbA7zKulr650E1ZtR3gqPiASSrRHPcA=s48-c-k-c0x00ffffff-no-rj', 'authorChannelUrl': 'http://www.youtube.com/channel/UCDjW-P3uSFBX3FYQpU6c4Ig', 'authorChannelId': {'value': 'UCDjW-P3uSFBX3FYQpU6c4Ig'}, 'canRate': True, 'viewerRating': 'none', 'likeCount': 0, 'publishedAt': '2022-10-31T18:16:02Z', 'updatedAt': '2022-10-31T18:16:02Z'}}, {'kind': 'youtube#comment', 'etag': 'KdYqfcfVnD85EHQUC2_4kTRKsqI', 'id': 'Ugz-FptPLOJb8r1Eia94AaABAg.9hrCWX7Fl1l9hrJPwzbA99', 'snippet': {'videoId': 'DZRb27DKf9w', 'textDisplay': '@Matheus Canuto a diferença é que eu conheço a peça, sou maranhense', 'textOriginal': '@Matheus Canuto a diferença é que eu conheço a peça, sou maranhense', 'parentId': 'Ugz-FptPLOJb8r1Eia94AaABAg', 'authorDisplayName': 'Thiago', 'authorProfileImageUrl': 'https://yt3.ggpht.com/CQjtMvCZt_GaIunAl2wgoWbYuyyHfYcAzkBHwCk6K1il0IR_1q6oISa0ZKDC5OZtPXwM2TXN=s48-c-k-c0x00ffffff-no-rj', 'authorChannelUrl': 'http://www.youtube.com/channel/UCO0jYok85TFwFzwJRMg3y9g', 'authorChannelId': {'value': 'UCO0jYok85TFwFzwJRMg3y9g'}, 'canRate': True, 'viewerRating': 'none', 'likeCount': 2, 'publishedAt': '2022-10-31T18:07:51Z', 'updatedAt': '2022-10-31T18:07:51Z'}}]}",UCec-3ugFOqs7cOGa8klmV2Q,2022-10-31T17:07:35Z,"Gente que maravilha! Chega de pastor, militar e olavista. Agora é só gente capaz de verdade.",,2023-06-08 02:06:53.898993
youtube#commentThread,36fgyaQykQ0aIWr7U8gYBYxJUqo,UgyFo2H9PDRfP7lLFmh4AaABAg,"{'videoId': 'DZRb27DKf9w', 'topLevelComment': {'kind': 'youtube#comment', 'etag': '0WXvELV_cNfF9QttdD-uz6U5jPE', 'id': 'UgyFo2H9PDRfP7lLFmh4AaABAg', 'snippet': {'videoId': 'DZRb27DKf9w', 'textDisplay': 'Nomes de ministérios só são colocados na mesa após as eleições. Mesmo porque eles podem sair.', 'textOriginal': 'Nomes de ministérios só são colocados na mesa após as eleições. Mesmo porque eles podem sair.', 'authorDisplayName': 'Joana R', 'authorProfileImageUrl': 'https://yt3.ggpht.com/ytc/AGIKgqPZytKIofJajEfGV3mz0nFJ0a5Hg2ApWDEOwUg8Lg=s48-c-k-c0x00ffffff-no-rj', 'authorChannelUrl': 'http://www.youtube.com/channel/UCec-3ugFOqs7cOGa8klmV2Q', 'authorChannelId': {'value': 'UCec-3ugFOqs7cOGa8klmV2Q'}, 'canRate': True, 'viewerRating': 'none', 'likeCount': 9, 'publishedAt': '2022-10-31T17:04:52Z', 'updatedAt': '2022-10-31T17:04:52Z'}}, 'canReply': True, 'totalReplyCount': 1, 'isPublic': True}","{'comments': [{'kind': 'youtube#comment', 'etag': 'YwICb3EkLmOgSDi5xspj2VWkKfk', 'id': 'UgyFo2H9PDRfP7lLFmh4AaABAg.9hrCCbkkdGT9hrH0VTmh_A', 'snippet': {'videoId': 'DZRb27DKf9w', 'textDisplay': 'Quem vai cair e o inbroxavel e os filhotes broxinhas', 'textOriginal': 'Quem vai cair e o inbroxavel e os filhotes broxinhas', 'parentId': 'UgyFo2H9PDRfP7lLFmh4AaABAg', 'authorDisplayName': 'Wesley Fernandes', 'authorProfileImageUrl': 'https://yt3.ggpht.com/ytc/AGIKgqO8OfQlekaxjBhtLYLX7mBF7TZ0Z9ao4SbchQ=s48-c-k-c0x00ffffff-no-rj', 'authorChannelUrl': 'http://www.youtube.com/channel/UCskdXV_OCRQsSjzzKjB89ig', 'authorChannelId': {'value': 'UCskdXV_OCRQsSjzzKjB89ig'}, 'canRate': True, 'viewerRating': 'none', 'likeCount': 0, 'publishedAt': '2022-10-31T17:46:54Z', 'updatedAt': '2022-10-31T17:46:54Z'}}]}",UCec-3ugFOqs7cOGa8klmV2Q,2022-10-31T17:04:52Z,Nomes de ministérios só são colocados na mesa após as eleições. Mesmo porque eles podem sair.,,2023-06-08 02:06:53.898993
youtube#commentThread,qbAPye99g5ujAMhtSKqdDZ12Zlo,Ugz5XyK7BNqXRrTPnXN4AaABAg,"{'videoId': 'bkrfLi6pgQA', 'topLevelComment': {'kind': 'youtube#comment', 'etag': '3rIAjQmtedmLD9ZcDJngrd27kwM', 'id': 'Ugz5XyK7BNqXRrTPnXN4AaABAg', 'snippet': {'videoId': 'bkrfLi6pgQA', 'textDisplay': 'Pra quem quer acreditar nas mentiras não tem jeito, não tem salvação', 'textOriginal': 'Pra quem quer acreditar nas mentiras não tem jeito, não tem salvação', 'authorDisplayName': 'Joana R', 'authorProfileImageUrl': 'https://yt3.ggpht.com/ytc/AGIKgqPZytKIofJajEfGV3mz0nFJ0a5Hg2ApWDEOwUg8Lg=s48-c-k-c0x00ffffff-no-rj', 'authorChannelUrl': 'http://www.youtube.com/channel/UCec-3ugFOqs7cOGa8klmV2Q', 'authorChannelId': {'value': 'UCec-3ugFOqs7cOGa8klmV2Q'}, 'canRate': True, 'viewerRating': 'none', 'likeCount': 3, 'publishedAt': '2022-10-25T21:24:24Z', 'updatedAt': '2022-10-25T21:24:24Z'}}, 'canReply': True, 'totalReplyCount': 0, 'isPublic': True}",,UCec-3ugFOqs7cOGa8klmV2Q,2022-10-25T21:24:24Z,"Pra quem quer acreditar nas mentiras não tem jeito, não tem salvação",QURTSl9pMGlKOV83VEZQSV9pNHhxYlRwM2xEdXhENWpoeHhlbkhVREE1MEtuVW1Zd1UxLVFhQ3ZHUkZaVjBHVzJNdjZDeGNaaDE0c3NXVQ==,2023-06-08 02:34:12.739267
youtube#commentThread,PcglltgSpCZjl-4pHmLXnaFvMwI,Ugx4XDck14bzE26ACax4AaABAg,"{'videoId': 'bkrfLi6pgQA', 'topLevelComment': {'kind': 'youtube#comment', 'etag': 'MSMCLlwlII9Wg5ElAuAqXMEqPmY', 'id': 'Ugx4XDck14bzE26ACax4AaABAg', 'snippet': {'videoId': 'bkrfLi6pgQA', 'textDisplay': 'Extrema-direita hipócrita', 'textOriginal': 'Extrema-direita hipócrita', 'authorDisplayName': 'Joana R', 'authorProfileImageUrl': 'https://yt3.ggpht.com/ytc/AGIKgqPZytKIofJajEfGV3mz0nFJ0a5Hg2ApWDEOwUg8Lg=s48-c-k-c0x00ffffff-no-rj', 'authorChannelUrl': 'http://www.youtube.com/channel/UCec-3ugFOqs7cOGa8klmV2Q', 'authorChannelId': {'value': 'UCec-3ugFOqs7cOGa8klmV2Q'}, 'canRate': True, 'viewerRating': 'none', 'likeCount': 0, 'publishedAt': '2022-10-25T21:18:30Z', 'updatedAt': '2022-10-25T21:18:30Z'}}, 'canReply': True, 'totalReplyCount': 0, 'isPublic': True}",,UCec-3ugFOqs7cOGa8klmV2Q,2022-10-25T21:18:30Z,Extrema-direita hipócrita,QURTSl9pMGlKOV83VEZQSV9pNHhxYlRwM2xEdXhENWpoeHhlbkhVREE1MEtuVW1Zd1UxLVFhQ3ZHUkZaVjBHVzJNdjZDeGNaaDE0c3NXVQ==,2023-06-08 02:34:12.739267
youtube#commentThread,pHu3VRwa2vadScHV3cJQJROBkKY,UgyzWUC42SZoOw20NHZ4AaABAg,"{'videoId': 'bkrfLi6pgQA', 'topLevelComment': {'kind': 'youtube#comment', 'etag': 'CArqGh0w8CChzwzduCOl1tiO9xU', 'id': 'UgyzWUC42SZoOw20NHZ4AaABAg', 'snippet': {'videoId': 'bkrfLi6pgQA', 'textDisplay': 'Quem defende Bolsonaro a esse ponto é tão perverso quanto ele, tão abjeto e amoral quanto ele. As pessoas sabem de tudo o que ele é. Fazem esforço pra justificar. O povo brasileiro, ou metade dele, não merece senão o inferno, ao seguir um anticristo com a conversa mais antiga da história: ser o povo escolhido. A esquerda de cabelo azul e igualmente burra mas ao menos tem coração', 'textOriginal': 'Quem defende Bolsonaro a esse ponto é tão perverso quanto ele, tão abjeto e amoral quanto ele. As pessoas sabem de tudo o que ele é. Fazem esforço pra justificar. O povo brasileiro, ou metade dele, não merece senão o inferno, ao seguir um anticristo com a conversa mais antiga da história: ser o povo escolhido. A esquerda de cabelo azul e igualmente burra mas ao menos tem coração', 'authorDisplayName': 'Joana R', 'authorProfileImageUrl': 'https://yt3.ggpht.com/ytc/AGIKgqPZytKIofJajEfGV3mz0nFJ0a5Hg2ApWDEOwUg8Lg=s48-c-k-c0x00ffffff-no-rj', 'authorChannelUrl': 'http://www.youtube.com/channel/UCec-3ugFOqs7cOGa8klmV2Q', 'authorChannelId': {'value': 'UCec-3ugFOqs7cOGa8klmV2Q'}, 'canRate': True, 'viewerRating': 'none', 'likeCount': 0, 'publishedAt': '2022-10-25T21:16:30Z', 'updatedAt': '2022-10-25T21:16:30Z'}}, 'canReply': True, 'totalReplyCount': 0, 'isPublic': True}",,UCec-3ugFOqs7cOGa8klmV2Q,2022-10-25T21:16:30Z,"Quem defende Bolsonaro a esse ponto é tão perverso quanto ele, tão abjeto e amoral quanto ele. As pessoas sabem de tudo o que ele é. Fazem esforço pra justificar. O povo brasileiro, ou metade dele, não merece senão o inferno, ao seguir um anticristo com a conversa mais antiga da história: ser o povo escolhido. A esquerda de cabelo azul e igualmente burra mas ao menos tem coração",QURTSl9pMGlKOV83VEZQSV9pNHhxYlRwM2xEdXhENWpoeHhlbkhVREE1MEtuVW1Zd1UxLVFhQ3ZHUkZaVjBHVzJNdjZDeGNaaDE0c3NXVQ==,2023-06-08 02:34:12.739267
youtube#commentThread,r7j4AWeX08O1_elXSTzWbbjyhQs,UgxQaUMqOeKh8JgOCfB4AaABAg,"{'videoId': 'p9g9zymC2uE', 'topLevelComment': {'kind': 'youtube#comment', 'etag': '8QcRibRbZG2u3ewSvr2DwUbpmWI', 'id': 'UgxQaUMqOeKh8JgOCfB4AaABAg', 'snippet': {'videoId': 'p9g9zymC2uE', 'textDisplay': 'Bolsonaro cria uma polêmica por dia pra disfarçar o pior governo da história, que está destruindo o país, e mantém o povo drogado com notícias que são cortina de fumaça. E muito triste o que está acontecendo no Brasil. Vendo de fora e de dentro também.', 'textOriginal': 'Bolsonaro cria uma polêmica por dia pra disfarçar o pior governo da história, que está destruindo o país, e mantém o povo drogado com notícias que são cortina de fumaça. E muito triste o que está acontecendo no Brasil. Vendo de fora e de dentro também.', 'authorDisplayName': 'Joana R', 'authorProfileImageUrl': 'https://yt3.ggpht.com/ytc/AGIKgqPZytKIofJajEfGV3mz0nFJ0a5Hg2ApWDEOwUg8Lg=s48-c-k-c0x00ffffff-no-rj', 'authorChannelUrl': 'http://www.youtube.com/channel/UCec-3ugFOqs7cOGa8klmV2Q', 'authorChannelId': {'value': 'UCec-3ugFOqs7cOGa8klmV2Q'}, 'canRate': True, 'viewerRating': 'none', 'likeCount': 0, 'publishedAt': '2022-10-25T16:21:07Z', 'updatedAt': '2022-10-25T16:21:07Z'}}, 'canReply': True, 'totalReplyCount': 0, 'isPublic': True}",,UCec-3ugFOqs7cOGa8klmV2Q,2022-10-25T16:21:07Z,"Bolsonaro cria uma polêmica por dia pra disfarçar o pior governo da história, que está destruindo o país, e mantém o povo drogado com notícias que são cortina de fumaça. E muito triste o que está acontecendo no Brasil. Vendo de fora e de dentro também.",QURTSl9pM2hfWmQtVy1uYmthbHQ0Tk1sVUFkWDRvUEhSYlFhTDRDRmF3M2lTNHJ5cllJVzhES0Q1bU1PTkpDUVVEeHM2c0hTTlRJSGtmNA==,2023-06-08 02:35:16.492145
youtube#commentThread,s3vQUCrbdpE0twHUS8Yt_1H8gL0,Ugybsg6-51_e8VVwhbx4AaABAg,"{'videoId': 't9MPFaYiG74', 'topLevelComment': {'kind': 'youtube#comment', 'etag': '60LJ3zBXDPgNGSSR_rxnadhbuck', 'id': 'Ugybsg6-51_e8VVwhbx4AaABAg', 'snippet': {'videoId': 't9MPFaYiG74', 'textDisplay': 'É um covarde. Sempre foi um covarde.', 'textOriginal': 'É um covarde. Sempre foi um covarde.', 'authorDisplayName': 'Joana R', 'authorProfileImageUrl': 'https://yt3.ggpht.com/ytc/AGIKgqPZytKIofJajEfGV3mz0nFJ0a5Hg2ApWDEOwUg8Lg=s48-c-k-c0x00ffffff-no-rj', 'authorChannelUrl': 'http://www.youtube.com/channel/UCec-3ugFOqs7cOGa8klmV2Q', 'authorChannelId': {'value': 'UCec-3ugFOqs7cOGa8klmV2Q'}, 'canRate': True, 'viewerRating': 'none', 'likeCount': 0, 'publishedAt': '2022-10-31T15:29:09Z', 'updatedAt': '2022-10-31T15:29:09Z'}}, 'canReply': True, 'totalReplyCount': 0, 'isPublic': True}",,UCec-3ugFOqs7cOGa8klmV2Q,2022-10-31T15:29:09Z,É um covarde. Sempre foi um covarde.,QURTSl9pMENIVnJlY09MRUFKbWJEanhyWTJuN2d0X09pNEpVNlh0YXM2RTJZaWQ0cUJrVEFpQ3dOUzhJVVhpYXBVSnlfLXBNalFod1NuRQ==,2023-06-08 02:08:03.974550
youtube#commentThread,oeIOE0soT5EAue3OuvtTnXBLEm8,UgxtEWinrCJWNwOszkR4AaABAg,"{'videoId': 'cW5--ufWJD8', 'topLevelComment': {'kind': 'youtube#comment', 'etag': '6X7MGuqeWCMC1QPwLvFWzDWjQaE', 'id': 'UgxtEWinrCJWNwOszkR4AaABAg', 'snippet': {'videoId': 'cW5--ufWJD8', 'textDisplay': 'Lula só precisa erradicar a fome porque Bolsonaro e Guedes garantiram que ela voltasse. Lula foi premiado pela ONU em 2005 por ter acabado com a fome no Brasil.', 'textOriginal': 'Lula só precisa erradicar a fome porque Bolsonaro e Guedes garantiram que ela voltasse. Lula foi premiado pela ONU em 2005 por ter acabado com a fome no Brasil.', 'authorDisplayName': 'Joana R', 'authorProfileImageUrl': 'https://yt3.ggpht.com/ytc/AGIKgqPZytKIofJajEfGV3mz0nFJ0a5Hg2ApWDEOwUg8Lg=s48-c-k-c0x00ffffff-no-rj', 'authorChannelUrl': 'http://www.youtube.com/channel/UCec-3ugFOqs7cOGa8klmV2Q', 'authorChannelId': {'value': 'UCec-3ugFOqs7cOGa8klmV2Q'}, 'canRate': True, 'viewerRating': 'none', 'likeCount': 0, 'publishedAt': '2022-10-31T14:27:44Z', 'updatedAt': '2022-10-31T14:27:44Z'}}, 'canReply': True, 'totalReplyCount': 0, 'isPublic': True}",,UCec-3ugFOqs7cOGa8klmV2Q,2022-10-31T14:27:44Z,Lula só precisa erradicar a fome porque Bolsonaro e Guedes garantiram que ela voltasse. Lula foi premiado pela ONU em 2005 por ter acabado com a fome no Brasil.,,2023-06-08 02:08:11.914269
