kind,etag,id,snippet,replies,authorChannelId,publishedAt,textOriginal,nextPageToken,extraction_date
youtube#commentThread,gVNz-KjohBIm-24zXn5nlXH31es,UgyI2la-yS_AllK8NwJ4AaABAg,"{'videoId': '4RHJ04wGwVI', 'topLevelComment': {'kind': 'youtube#comment', 'etag': 'axi9_gyOtqFam6IRDUTkRK0Auj4', 'id': 'UgyI2la-yS_AllK8NwJ4AaABAg', 'snippet': {'videoId': '4RHJ04wGwVI', 'textDisplay': 'graças ao Senhor, voltaremos a ser um país e não um pardieiro de loucos. Amei os nomes, mas Henrique Meirelles tem que ficar com a fazenda, e não Haddad', 'textOriginal': 'graças ao Senhor, voltaremos a ser um país e não um pardieiro de loucos. Amei os nomes, mas Henrique Meirelles tem que ficar com a fazenda, e não Haddad', 'authorDisplayName': 'Joana R', 'authorProfileImageUrl': 'https://yt3.ggpht.com/ytc/AGIKgqPZytKIofJajEfGV3mz0nFJ0a5Hg2ApWDEOwUg8Lg=s48-c-k-c0x00ffffff-no-rj', 'authorChannelUrl': 'http://www.youtube.com/channel/UCec-3ugFOqs7cOGa8klmV2Q', 'authorChannelId': {'value': 'UCec-3ugFOqs7cOGa8klmV2Q'}, 'canRate': True, 'viewerRating': 'none', 'likeCount': 1, 'publishedAt': '2022-11-01T02:29:43Z', 'updatedAt': '2022-11-01T02:29:43Z'}}, 'canReply': True, 'totalReplyCount': 7, 'isPublic': True}","{'comments': [{'kind': 'youtube#comment', 'etag': 'DsP6RaRFdEa0nqfSjYfbFLJ7Ais', 'id': 'UgyI2la-yS_AllK8NwJ4AaABAg.9hsCqi_TiKY9iNJSgTuOM8', 'snippet': {'videoId': '4RHJ04wGwVI', 'textDisplay': 'Cuidado com as prioridades em  tantos  ministérios  e  não com as  necessidades   sociais.  A  CONTA PODE  NÃO   FECHAR!', 'textOriginal': 'Cuidado com as prioridades em  tantos  ministérios  e  não com as  necessidades   sociais.  A  CONTA PODE  NÃO   FECHAR!', 'parentId': 'UgyI2la-yS_AllK8NwJ4AaABAg', 'authorDisplayName': 'Cilei Poloni', 'authorProfileImageUrl': 'https://yt3.ggpht.com/ytc/AGIKgqNDFWw_neOHJfF-eIo4NuOSEGOAVF3saIFbug=s48-c-k-c0x00ffffff-no-rj', 'authorChannelUrl': 'http://www.youtube.com/channel/UC9b2Q03xPmkdy3PX38OczUw', 'authorChannelId': {'value': 'UC9b2Q03xPmkdy3PX38OczUw'}, 'canRate': True, 'viewerRating': 'none', 'likeCount': 0, 'publishedAt': '2022-11-13T13:43:09Z', 'updatedAt': '2022-11-13T13:43:09Z'}}, {'kind': 'youtube#comment', 'etag': 'f8ZaYog9HT_uLiA3uoVamA0nmTI', 'id': 'UgyI2la-yS_AllK8NwJ4AaABAg.9hsCqi_TiKY9hzCpWchZ6u', 'snippet': {'videoId': '4RHJ04wGwVI', 'textDisplay': 'mulheres não manjam mesmo de politica. sasinhora.', 'textOriginal': 'mulheres não manjam mesmo de politica. sasinhora.', 'parentId': 'UgyI2la-yS_AllK8NwJ4AaABAg', 'authorDisplayName': 'D Deimos', 'authorProfileImageUrl': 'https://yt3.ggpht.com/ytc/AGIKgqPEc4EyDGhd-n5GSuqTeix-u9QpmWa94qF-2zkvgA=s48-c-k-c0x00ffffff-no-rj', 'authorChannelUrl': 'http://www.youtube.com/channel/UCjykl1888Rztl0CC8J3EXSw', 'authorChannelId': {'value': 'UCjykl1888Rztl0CC8J3EXSw'}, 'canRate': True, 'viewerRating': 'none', 'likeCount': 0, 'publishedAt': '2022-11-03T19:44:14Z', 'updatedAt': '2022-11-03T19:44:14Z'}}, {'kind': 'youtube#comment', 'etag': '4gz0hdEr5V9YrrBKaQ7mxRN4H4c', 'id': 'UgyI2la-yS_AllK8NwJ4AaABAg.9hsCqi_TiKY9huFvTk3bwx', 'snippet': {'videoId': '4RHJ04wGwVI', 'textDisplay': 'Vai ficar legal , só gente boa ,  será que vai ter uma cueca maior  .', 'textOriginal': 'Vai ficar legal , só gente boa ,  será que vai ter uma cueca maior  .', 'parentId': 'UgyI2la-yS_AllK8NwJ4AaABAg', 'authorDisplayName': 'Glebson Sousa', 'authorProfileImageUrl': 'https://yt3.ggpht.com/ytc/AGIKgqMDtSCG4PAZ0Tq7vx7D2bkma2MlMfJpib2MsQl5jAk=s48-c-k-c0x00ffffff-no-rj', 'authorChannelUrl': 'http://www.youtube.com/channel/UCBJds2He71m8SrWmvH7lDbQ', 'authorChannelId': {'value': 'UCBJds2He71m8SrWmvH7lDbQ'}, 'canRate': True, 'viewerRating': 'none', 'likeCount': 4, 'publishedAt': '2022-11-01T21:35:03Z', 'updatedAt': '2022-11-01T21:35:03Z'}}, {'kind': 'youtube#comment', 'etag': 'nfEw3HFDVyupDNtA0FfhY3CUNTM', 'id': 'UgyI2la-yS_AllK8NwJ4AaABAg.9hsCqi_TiKY9htVd_MZNms', 'snippet': {'videoId': '4RHJ04wGwVI', 'textDisplay': 'RANDOLF ou Marina Silva - Meio Ambiente, Mds lascou<br>O Brasil que agora está com os cofres cheio pelo Superavit que Bolsonaro conseguiu  e vai ficar da Bandeja pros Ladrões roubarem novamente ja que no Governo Lula e Dilma era so Defit e não Superavit!', 'textOriginal': 'RANDOLF ou Marina Silva - Meio Ambiente, Mds lascou\\\\nO Brasil que agora está com os cofres cheio pelo Superavit que Bolsonaro conseguiu  e vai ficar da Bandeja pros Ladrões roubarem novamente ja que no Governo Lula e Dilma era so Defit e não Superavit!', 'parentId': 'UgyI2la-yS_AllK8NwJ4AaABAg', 'authorDisplayName': 'Luis Felipe', 'authorProfileImageUrl': 'https://yt3.ggpht.com/ytc/AGIKgqMee3PcN9erNum48cAuDHq80KqgL7C0cvjqX5YK_A=s48-c-k-c0x00ffffff-no-rj', 'authorChannelUrl': 'http://www.youtube.com/channel/UCfmh2vVmtN4ejHioBny5dkA', 'authorChannelId': {'value': 'UCfmh2vVmtN4ejHioBny5dkA'}, 'canRate': True, 'viewerRating': 'none', 'likeCount': 0, 'publishedAt': '2022-11-01T14:33:11Z', 'updatedAt': '2022-11-01T14:33:11Z'}}, {'kind': 'youtube#comment', 'etag': 'QEUrpUez3JKqRjZ8EWntqHLwLpg', 'id': 'UgyI2la-yS_AllK8NwJ4AaABAg.9hsCqi_TiKY9hsHbPAd75D', 'snippet': {'videoId': '4RHJ04wGwVI', 'textDisplay': 'Flavio dino? Pqq', 'textOriginal': 'Flavio dino? Pqq', 'parentId': 'UgyI2la-yS_AllK8NwJ4AaABAg', 'authorDisplayName': 'Martins Th_Zs', 'authorProfileImageUrl': 'https://yt3.ggpht.com/ytc/AGIKgqO7O4bIKitrjGFBPghbPQNe51bliJqL0QM2B0GpYQ=s48-c-k-c0x00ffffff-no-rj', 'authorChannelUrl': 'http://www.youtube.com/channel/UCE4PowmZodBr-SFfD5J9yHQ', 'authorChannelId': {'value': 'UCE4PowmZodBr-SFfD5J9yHQ'}, 'canRate': True, 'viewerRating': 'none', 'likeCount': 1, 'publishedAt': '2022-11-01T03:11:19Z', 'updatedAt': '2022-11-01T03:11:19Z'}}]}",UCec-3ugFOqs7cOGa8klmV2Q,2022-11-01T02:29:43Z,"graças ao Senhor, voltaremos a ser um país e não um pardieiro de loucos. Amei os nomes, mas Henrique Meirelles tem que ficar com a fazenda, e não Haddad",QURTSl9pMUdOZlFPOXhJWDJhNkpfcTk5S2ltcktNWm9Ua2ZIOFcyN0ZlWTBndm9ycVVSZ1JSOHNjMDFPUk5fcm9qZlkyOUdFbFlVQTk2QQ==,2023-06-08 02:03:03.187103
youtube#commentThread,c04Q2cl9aTkKzjppQRq6DJ68sb0,UgzzDtVH2x68hAECxnx4AaABAg,"{'videoId': '4RHJ04wGwVI', 'topLevelComment': {'kind': 'youtube#comment', 'etag': 'qkc7aCTq-N6RHxp91AYnQn9cEro', 'id': 'UgzzDtVH2x68hAECxnx4AaABAg', 'snippet': {'videoId': '4RHJ04wGwVI', 'textDisplay': 'o Brasil está uma terra arrasada. Tem que ter muito ministério pra dar conta da reconstrução.', 'textOriginal': 'o Brasil está uma terra arrasada. Tem que ter muito ministério pra dar conta da reconstrução.', 'authorDisplayName': 'Joana R', 'authorProfileImageUrl': 'https://yt3.ggpht.com/ytc/AGIKgqPZytKIofJajEfGV3mz0nFJ0a5Hg2ApWDEOwUg8Lg=s48-c-k-c0x00ffffff-no-rj', 'authorChannelUrl': 'http://www.youtube.com/channel/UCec-3ugFOqs7cOGa8klmV2Q', 'authorChannelId': {'value': 'UCec-3ugFOqs7cOGa8klmV2Q'}, 'canRate': True, 'viewerRating': 'none', 'likeCount': 2, 'publishedAt': '2022-11-01T02:26:17Z', 'updatedAt': '2022-11-01T02:26:17Z'}}, 'canReply': True, 'totalReplyCount': 10, 'isPublic': True}","{'comments': [{'kind': 'youtube#comment', 'etag': 'G9Qegx-_LEOAxJ4qvspB2T1-Uss', 'id': 'UgzzDtVH2x68hAECxnx4AaABAg.9hsCSc1FZ5g9ii7Bw-YjCP', 'snippet': {'videoId': '4RHJ04wGwVI', 'textDisplay': 'Muita burrice em um comentário só...', 'textOriginal': 'Muita burrice em um comentário só...', 'parentId': 'UgzzDtVH2x68hAECxnx4AaABAg', 'authorDisplayName': 'Henry KY 🇧🇷', 'authorProfileImageUrl': 'https://yt3.ggpht.com/StsaVLCraeqs_ZfmJKDFlN9GfFwV0oYt5CT5afwOCPbn079ayzncHb4PS4tElgNYFgOgN54Vmeg=s48-c-k-c0x00ffffff-no-rj', 'authorChannelUrl': 'http://www.youtube.com/channel/UCPzwCqwa_-XvB6gCCSUFxFQ', 'authorChannelId': {'value': 'UCPzwCqwa_-XvB6gCCSUFxFQ'}, 'canRate': True, 'viewerRating': 'none', 'likeCount': 0, 'publishedAt': '2022-11-22T00:59:18Z', 'updatedAt': '2022-11-22T00:59:18Z'}}, {'kind': 'youtube#comment', 'etag': 'A7aCsxRCbfgR-DMD3VA-9VxT0x4', 'id': 'UgzzDtVH2x68hAECxnx4AaABAg.9hsCSc1FZ5g9iNJFj19u3k', 'snippet': {'videoId': '4RHJ04wGwVI', 'textDisplay': 'A  população, eleitores fiéis  são obrigados  a  engolir  esses  novos  ministérios   calados?<br>É   prioridade  ou  promessa  de  eleição!', 'textOriginal': 'A  população, eleitores fiéis  são obrigados  a  engolir  esses  novos  ministérios   calados?\\\\nÉ   prioridade  ou  promessa  de  eleição!', 'parentId': 'UgzzDtVH2x68hAECxnx4AaABAg', 'authorDisplayName': 'Cilei Poloni', 'authorProfileImageUrl': 'https://yt3.ggpht.com/ytc/AGIKgqNDFWw_neOHJfF-eIo4NuOSEGOAVF3saIFbug=s48-c-k-c0x00ffffff-no-rj', 'authorChannelUrl': 'http://www.youtube.com/channel/UC9b2Q03xPmkdy3PX38OczUw', 'authorChannelId': {'value': 'UC9b2Q03xPmkdy3PX38OczUw'}, 'canRate': True, 'viewerRating': 'none', 'likeCount': 0, 'publishedAt': '2022-11-13T13:41:23Z', 'updatedAt': '2022-11-13T13:41:23Z'}}, {'kind': 'youtube#comment', 'etag': 'UflIckqGzwb7hhalLHqITg8Ohno', 'id': 'UgzzDtVH2x68hAECxnx4AaABAg.9hsCSc1FZ5g9iNJ1ovodo4', 'snippet': {'videoId': '4RHJ04wGwVI', 'textDisplay': 'O  arraso de  30  anos.', 'textOriginal': 'O  arraso de  30  anos.', 'parentId': 'UgzzDtVH2x68hAECxnx4AaABAg', 'authorDisplayName': 'Cilei Poloni', 'authorProfileImageUrl': 'https://yt3.ggpht.com/ytc/AGIKgqNDFWw_neOHJfF-eIo4NuOSEGOAVF3saIFbug=s48-c-k-c0x00ffffff-no-rj', 'authorChannelUrl': 'http://www.youtube.com/channel/UC9b2Q03xPmkdy3PX38OczUw', 'authorChannelId': {'value': 'UC9b2Q03xPmkdy3PX38OczUw'}, 'canRate': True, 'viewerRating': 'none', 'likeCount': 0, 'publishedAt': '2022-11-13T13:39:29Z', 'updatedAt': '2022-11-13T13:39:29Z'}}, {'kind': 'youtube#comment', 'etag': '_dA26GFqmmiq3YimqeQgYDGU4F0', 'id': 'UgzzDtVH2x68hAECxnx4AaABAg.9hsCSc1FZ5g9iBmCLDteWH', 'snippet': {'videoId': '4RHJ04wGwVI', 'textDisplay': 'Tem cara de trouxa mesmo', 'textOriginal': 'Tem cara de trouxa mesmo', 'parentId': 'UgzzDtVH2x68hAECxnx4AaABAg', 'authorDisplayName': 'VideosGCP', 'authorProfileImageUrl': 'https://yt3.ggpht.com/he8YRO1SzJtb8O52NeTWIRdmX6kknKKD3OXfSOVCJ5V2unQBd6JaF4SzpW4SO9IIdR4aaQJ8=s48-c-k-c0x00ffffff-no-rj', 'authorChannelUrl': 'http://www.youtube.com/channel/UCK58JFWqxc-8MkE4Q2g8xqg', 'authorChannelId': {'value': 'UCK58JFWqxc-8MkE4Q2g8xqg'}, 'canRate': True, 'viewerRating': 'none', 'likeCount': 0, 'publishedAt': '2022-11-09T02:12:11Z', 'updatedAt': '2022-11-09T02:12:11Z'}}, {'kind': 'youtube#comment', 'etag': 'y5UfX9VbbxcbhJtAlaMiSULu2B4', 'id': 'UgzzDtVH2x68hAECxnx4AaABAg.9hsCSc1FZ5g9iBirdNF-Mt', 'snippet': {'videoId': '4RHJ04wGwVI', 'textDisplay': 'Eu não li isso kkkkkkkkkkkkkkkk não é possível', 'textOriginal': 'Eu não li isso kkkkkkkkkkkkkkkk não é possível', 'parentId': 'UgzzDtVH2x68hAECxnx4AaABAg', 'authorDisplayName': 'Selenium', 'authorProfileImageUrl': 'https://yt3.ggpht.com/uROuhEjuX81dI2KpP0h3i6jBhAkcyI17Q8Adf9R6T5CGsP7_cqDa7r8I5uan82i5T_i9S4K3Zg=s48-c-k-c0x00ffffff-no-rj', 'authorChannelUrl': 'http://www.youtube.com/channel/UCinOgWcTY1YJUHNfXyDqX4Q', 'authorChannelId': {'value': 'UCinOgWcTY1YJUHNfXyDqX4Q'}, 'canRate': True, 'viewerRating': 'none', 'likeCount': 1, 'publishedAt': '2022-11-09T01:43:00Z', 'updatedAt': '2022-11-09T01:43:00Z'}}]}",UCec-3ugFOqs7cOGa8klmV2Q,2022-11-01T02:26:17Z,o Brasil está uma terra arrasada. Tem que ter muito ministério pra dar conta da reconstrução.,QURTSl9pMUdOZlFPOXhJWDJhNkpfcTk5S2ltcktNWm9Ua2ZIOFcyN0ZlWTBndm9ycVVSZ1JSOHNjMDFPUk5fcm9qZlkyOUdFbFlVQTk2QQ==,2023-06-08 02:03:03.187103
youtube#commentThread,7CNIQL4i6yQWmtfyvlmfNCWQi34,UgxwdOaJRbpI5iNrlfF4AaABAg,"{'videoId': 'uE89Mkg9Pyg', 'topLevelComment': {'kind': 'youtube#comment', 'etag': 'VRPP2JEc1CkiE5XlFX3UcPDiBUM', 'id': 'UgxwdOaJRbpI5iNrlfF4AaABAg', 'snippet': {'videoId': 'uE89Mkg9Pyg', 'textDisplay': 'Bolsonaristas são perversos demais', 'textOriginal': 'Bolsonaristas são perversos demais', 'authorDisplayName': 'Joana R', 'authorProfileImageUrl': 'https://yt3.ggpht.com/ytc/AGIKgqPZytKIofJajEfGV3mz0nFJ0a5Hg2ApWDEOwUg8Lg=s48-c-k-c0x00ffffff-no-rj', 'authorChannelUrl': 'http://www.youtube.com/channel/UCec-3ugFOqs7cOGa8klmV2Q', 'authorChannelId': {'value': 'UCec-3ugFOqs7cOGa8klmV2Q'}, 'canRate': True, 'viewerRating': 'none', 'likeCount': 0, 'publishedAt': '2022-10-27T03:11:55Z', 'updatedAt': '2022-10-27T03:11:55Z'}}, 'canReply': True, 'totalReplyCount': 0, 'isPublic': True}",,UCec-3ugFOqs7cOGa8klmV2Q,2022-10-27T03:11:55Z,Bolsonaristas são perversos demais,,2023-06-08 02:29:20.138893
youtube#commentThread,V7lP35FlifNQ41xgt_8wams1q9Y,UgzfSl_XNInw-kyB9Ad4AaABAg,"{'videoId': 'uE89Mkg9Pyg', 'topLevelComment': {'kind': 'youtube#comment', 'etag': 'YQ98xDFQIROby_imAYsG-wRhNMI', 'id': 'UgzfSl_XNInw-kyB9Ad4AaABAg', 'snippet': {'videoId': 'uE89Mkg9Pyg', 'textDisplay': 'Bolsilão, tratoraço, escândalo das barras de ouro. Cortes de 80% de educação e saúde. Auxilio de 400 menos 200 do consignado. Inflação e IPCA de 20%. Essa é a proposta do Jair, mas ele não pode falar', 'textOriginal': 'Bolsilão, tratoraço, escândalo das barras de ouro. Cortes de 80% de educação e saúde. Auxilio de 400 menos 200 do consignado. Inflação e IPCA de 20%. Essa é a proposta do Jair, mas ele não pode falar', 'authorDisplayName': 'Joana R', 'authorProfileImageUrl': 'https://yt3.ggpht.com/ytc/AGIKgqPZytKIofJajEfGV3mz0nFJ0a5Hg2ApWDEOwUg8Lg=s48-c-k-c0x00ffffff-no-rj', 'authorChannelUrl': 'http://www.youtube.com/channel/UCec-3ugFOqs7cOGa8klmV2Q', 'authorChannelId': {'value': 'UCec-3ugFOqs7cOGa8klmV2Q'}, 'canRate': True, 'viewerRating': 'none', 'likeCount': 0, 'publishedAt': '2022-10-27T03:11:21Z', 'updatedAt': '2022-10-27T03:11:21Z'}}, 'canReply': True, 'totalReplyCount': 0, 'isPublic': True}",,UCec-3ugFOqs7cOGa8klmV2Q,2022-10-27T03:11:21Z,"Bolsilão, tratoraço, escândalo das barras de ouro. Cortes de 80% de educação e saúde. Auxilio de 400 menos 200 do consignado. Inflação e IPCA de 20%. Essa é a proposta do Jair, mas ele não pode falar",,2023-06-08 02:29:20.138893
youtube#commentThread,LEb5JtEa6lfQewbGtElFZ8YhSJw,UgzOBs_9DrLr8N2het54AaABAg,"{'videoId': 'xnHbwwNGdyw', 'topLevelComment': {'kind': 'youtube#comment', 'etag': 'bsjYWZ96vNqYQl4sj8rPBKJ0eNY', 'id': 'UgzOBs_9DrLr8N2het54AaABAg', 'snippet': {'videoId': 'xnHbwwNGdyw', 'textDisplay': 'Guedes vai diminuir salário mínimo e aposentadorias e tirar os descontos do IR. Já furou o teto.', 'textOriginal': 'Guedes vai diminuir salário mínimo e aposentadorias e tirar os descontos do IR. Já furou o teto.', 'authorDisplayName': 'Joana R', 'authorProfileImageUrl': 'https://yt3.ggpht.com/ytc/AGIKgqPZytKIofJajEfGV3mz0nFJ0a5Hg2ApWDEOwUg8Lg=s48-c-k-c0x00ffffff-no-rj', 'authorChannelUrl': 'http://www.youtube.com/channel/UCec-3ugFOqs7cOGa8klmV2Q', 'authorChannelId': {'value': 'UCec-3ugFOqs7cOGa8klmV2Q'}, 'canRate': True, 'viewerRating': 'none', 'likeCount': 4, 'publishedAt': '2022-10-27T03:08:22Z', 'updatedAt': '2022-10-27T03:08:22Z'}}, 'canReply': True, 'totalReplyCount': 4, 'isPublic': True}","{'comments': [{'kind': 'youtube#comment', 'etag': 'yyCQY6DNv4eutKXiDqgnmA19OTA', 'id': 'UgzOBs_9DrLr8N2het54AaABAg.9hfPIS7dQNb9hip_gDh6Gw', 'snippet': {'videoId': 'xnHbwwNGdyw', 'textDisplay': 'Não tem como diminuir o salário, pense pq não fez na pandemia?', 'textOriginal': 'Não tem como diminuir o salário, pense pq não fez na pandemia?', 'parentId': 'UgzOBs_9DrLr8N2het54AaABAg', 'authorDisplayName': 'Vera Santos', 'authorProfileImageUrl': 'https://yt3.ggpht.com/ytc/AGIKgqNqQwRRC1izz2rqAD_7KjlguXoNXZGmpSrVQDWHGRo=s48-c-k-c0x00ffffff-no-rj', 'authorChannelUrl': 'http://www.youtube.com/channel/UCdrupPrgLfI1xkZpdI0BHyQ', 'authorChannelId': {'value': 'UCdrupPrgLfI1xkZpdI0BHyQ'}, 'canRate': True, 'viewerRating': 'none', 'likeCount': 0, 'publishedAt': '2022-10-28T11:04:30Z', 'updatedAt': '2022-10-28T11:04:30Z'}}, {'kind': 'youtube#comment', 'etag': 'H6RM1clbErVFo-timPFQXRPTwhA', 'id': 'UgzOBs_9DrLr8N2het54AaABAg.9hfPIS7dQNb9hgutnY2XpH', 'snippet': {'videoId': 'xnHbwwNGdyw', 'textDisplay': '@Joana R sabemos que é mentira, e é tão absurda, que não sei o que passa na cabeça de vcs, pra acreditar nisso!!! Veja, o Brasil vai crescer mais que a China, e vai fechar com uma inflação menor do que a dos EUA, e eu e nem vc poderíamos acreditar nisso, então, para equilibrar as coisas, a esquerda sai com estas mentiras.', 'textOriginal': '@Joana R sabemos que é mentira, e é tão absurda, que não sei o que passa na cabeça de vcs, pra acreditar nisso!!! Veja, o Brasil vai crescer mais que a China, e vai fechar com uma inflação menor do que a dos EUA, e eu e nem vc poderíamos acreditar nisso, então, para equilibrar as coisas, a esquerda sai com estas mentiras.', 'parentId': 'UgzOBs_9DrLr8N2het54AaABAg', 'authorDisplayName': 'J Carlos Silva', 'authorProfileImageUrl': 'https://yt3.ggpht.com/ytc/AGIKgqMwpnaMO19rPMsoDmQGHzq655WGEx6ywJRU3A=s48-c-k-c0x00ffffff-no-rj', 'authorChannelUrl': 'http://www.youtube.com/channel/UCfk_EB2jCmthWAQMFJmaRZQ', 'authorChannelId': {'value': 'UCfk_EB2jCmthWAQMFJmaRZQ'}, 'canRate': True, 'viewerRating': 'none', 'likeCount': 0, 'publishedAt': '2022-10-27T17:12:28Z', 'updatedAt': '2022-10-27T17:12:28Z'}}, {'kind': 'youtube#comment', 'etag': '2YT1g0PPkpu0XosleWEkdKniYoY', 'id': 'UgzOBs_9DrLr8N2het54AaABAg.9hfPIS7dQNb9hgDj5gWx7d', 'snippet': {'videoId': 'xnHbwwNGdyw', 'textDisplay': '@J Carlos Silva tomara que sejam mentiras, amigo, tomara. Mas sabemos que não são.', 'textOriginal': '@J Carlos Silva tomara que sejam mentiras, amigo, tomara. Mas sabemos que não são.', 'parentId': 'UgzOBs_9DrLr8N2het54AaABAg', 'authorDisplayName': 'Joana R', 'authorProfileImageUrl': 'https://yt3.ggpht.com/ytc/AGIKgqPZytKIofJajEfGV3mz0nFJ0a5Hg2ApWDEOwUg8Lg=s48-c-k-c0x00ffffff-no-rj', 'authorChannelUrl': 'http://www.youtube.com/channel/UCec-3ugFOqs7cOGa8klmV2Q', 'authorChannelId': {'value': 'UCec-3ugFOqs7cOGa8klmV2Q'}, 'canRate': True, 'viewerRating': 'none', 'likeCount': 0, 'publishedAt': '2022-10-27T10:46:31Z', 'updatedAt': '2022-10-27T10:46:31Z'}}, {'kind': 'youtube#comment', 'etag': 'em5pyhOoMZsqCf0JOTz22iURrFw', 'id': 'UgzOBs_9DrLr8N2het54AaABAg.9hfPIS7dQNb9hgAjcb9Q7s', 'snippet': {'videoId': 'xnHbwwNGdyw', 'textDisplay': 'continue espalhando mentiras, assim a gente fica sabendo quem é quem.', 'textOriginal': 'continue espalhando mentiras, assim a gente fica sabendo quem é quem.', 'parentId': 'UgzOBs_9DrLr8N2het54AaABAg', 'authorDisplayName': 'J Carlos Silva', 'authorProfileImageUrl': 'https://yt3.ggpht.com/ytc/AGIKgqMwpnaMO19rPMsoDmQGHzq655WGEx6ywJRU3A=s48-c-k-c0x00ffffff-no-rj', 'authorChannelUrl': 'http://www.youtube.com/channel/UCfk_EB2jCmthWAQMFJmaRZQ', 'authorChannelId': {'value': 'UCfk_EB2jCmthWAQMFJmaRZQ'}, 'canRate': True, 'viewerRating': 'none', 'likeCount': 1, 'publishedAt': '2022-10-27T10:20:23Z', 'updatedAt': '2022-10-27T10:20:23Z'}}]}",UCec-3ugFOqs7cOGa8klmV2Q,2022-10-27T03:08:22Z,Guedes vai diminuir salário mínimo e aposentadorias e tirar os descontos do IR. Já furou o teto.,,2023-06-08 02:29:59.388666
youtube#commentThread,T6yANej5cu5PZaSkV3M5IYNzJIs,UgyAz2NpV71S9JNuZ_R4AaABAg,"{'videoId': 'xnHbwwNGdyw', 'topLevelComment': {'kind': 'youtube#comment', 'etag': 'NbC0ZZ99NAtLDFHcD4i3FFtI6Zo', 'id': 'UgyAz2NpV71S9JNuZ_R4AaABAg', 'snippet': {'videoId': 'xnHbwwNGdyw', 'textDisplay': 'Meirelles é respeitadíssimo no meio financeiro. Lula deve segui-lo sim', 'textOriginal': 'Meirelles é respeitadíssimo no meio financeiro. Lula deve segui-lo sim', 'authorDisplayName': 'Joana R', 'authorProfileImageUrl': 'https://yt3.ggpht.com/ytc/AGIKgqPZytKIofJajEfGV3mz0nFJ0a5Hg2ApWDEOwUg8Lg=s48-c-k-c0x00ffffff-no-rj', 'authorChannelUrl': 'http://www.youtube.com/channel/UCec-3ugFOqs7cOGa8klmV2Q', 'authorChannelId': {'value': 'UCec-3ugFOqs7cOGa8klmV2Q'}, 'canRate': True, 'viewerRating': 'none', 'likeCount': 12, 'publishedAt': '2022-10-27T03:06:44Z', 'updatedAt': '2022-10-27T03:06:44Z'}}, 'canReply': True, 'totalReplyCount': 1, 'isPublic': True}","{'comments': [{'kind': 'youtube#comment', 'etag': 'kemUe9ihLGffVf-wjsQJPv6Koxs', 'id': 'UgyAz2NpV71S9JNuZ_R4AaABAg.9hfP6U-FkNG9hjFd5B4rxj', 'snippet': {'videoId': 'xnHbwwNGdyw', 'textDisplay': 'Ingênua.', 'textOriginal': 'Ingênua.', 'parentId': 'UgyAz2NpV71S9JNuZ_R4AaABAg', 'authorDisplayName': 'Igor Muniz', 'authorProfileImageUrl': 'https://yt3.ggpht.com/AaJkLU7Gb28fhPv7LK3_hDnLqZUAkrBrCvvf5Xs5FuR3Sdi0R_NWy_5OQ28L1A6LWewCe17HCKg=s48-c-k-c0x00ffffff-no-rj', 'authorChannelUrl': 'http://www.youtube.com/channel/UCMe-zbN7s2MMWUbSvYOeXDA', 'authorChannelId': {'value': 'UCMe-zbN7s2MMWUbSvYOeXDA'}, 'canRate': True, 'viewerRating': 'none', 'likeCount': 0, 'publishedAt': '2022-10-28T15:00:54Z', 'updatedAt': '2022-10-28T15:00:54Z'}}]}",UCec-3ugFOqs7cOGa8klmV2Q,2022-10-27T03:06:44Z,Meirelles é respeitadíssimo no meio financeiro. Lula deve segui-lo sim,,2023-06-08 02:29:59.388666
