kind,etag,id,snippet,replies,authorChannelId,publishedAt,textOriginal,nextPageToken,extraction_date
youtube#commentThread,qTQ9bFzqhRJNg6gP4hVt8QON8vI,UgyPCyhIJbdvqFw4bgV4AaABAg,"{'videoId': 'xZtcIZaSq9o', 'topLevelComment': {'kind': 'youtube#comment', 'etag': 'F5m2mDdsWkKQx2sjwb2-MOPRTHw', 'id': 'UgyPCyhIJbdvqFw4bgV4AaABAg', 'snippet': {'videoId': 'xZtcIZaSq9o', 'textDisplay': 'CHATINHA!!!!!!!!🇧🇷🇧🇷', 'textOriginal': 'CHATINHA!!!!!!!!🇧🇷🇧🇷', 'authorDisplayName': 'Sonia de Castro', 'authorProfileImageUrl': 'https://yt3.ggpht.com/ytc/AGIKgqNnpr5sUjJvN_J-1EUEy0b1il7QpBGHF8evpA=s48-c-k-c0x00ffffff-no-rj', 'authorChannelUrl': 'http://www.youtube.com/channel/UCgpj8fKiQNXL-doPlu1iIYQ', 'authorChannelId': {'value': 'UCgpj8fKiQNXL-doPlu1iIYQ'}, 'canRate': True, 'viewerRating': 'none', 'likeCount': 0, 'publishedAt': '2022-10-12T03:32:23Z', 'updatedAt': '2022-10-12T03:32:23Z'}}, 'canReply': True, 'totalReplyCount': 0, 'isPublic': True}",,UCgpj8fKiQNXL-doPlu1iIYQ,2022-10-12T03:32:23Z,CHATINHA!!!!!!!!🇧🇷🇧🇷,,2023-06-08 13:47:01.211771
youtube#commentThread,VgOEbj96PCRxOAN3jG5ubgKXQ5U,UgxAgvQTf-D4aA5SE_B4AaABAg,"{'videoId': 'xZtcIZaSq9o', 'topLevelComment': {'kind': 'youtube#comment', 'etag': 'A_jBY0tj2OCI1qTsvYv_hPJFMqo', 'id': 'UgxAgvQTf-D4aA5SE_B4AaABAg', 'snippet': {'videoId': 'xZtcIZaSq9o', 'textDisplay': 'NAO TEVE CORTE NENHUM. CANALHICE QUEM FALA EM CORTE', 'textOriginal': 'NAO TEVE CORTE NENHUM. CANALHICE QUEM FALA EM CORTE', 'authorDisplayName': 'Lucas mate', 'authorProfileImageUrl': 'https://yt3.ggpht.com/ytc/AGIKgqNURuY5rsn9aLV-In1XQS6m2t16OTMWO_oZkw=s48-c-k-c0x00ffffff-no-rj', 'authorChannelUrl': 'http://www.youtube.com/channel/UCNQ7M_Q8W9y0iqJothjXBcA', 'authorChannelId': {'value': 'UCNQ7M_Q8W9y0iqJothjXBcA'}, 'canRate': True, 'viewerRating': 'none', 'likeCount': 1, 'publishedAt': '2022-10-11T14:24:14Z', 'updatedAt': '2022-10-11T14:24:14Z'}}, 'canReply': True, 'totalReplyCount': 0, 'isPublic': True}",,UCNQ7M_Q8W9y0iqJothjXBcA,2022-10-11T14:24:14Z,NAO TEVE CORTE NENHUM. CANALHICE QUEM FALA EM CORTE,,2023-06-08 13:47:01.211771
youtube#commentThread,GIuZZ67vWS58ZEfmYMo8dPfIMeo,UgynJ_XIf5HsklNoxX14AaABAg,"{'videoId': 'xZtcIZaSq9o', 'topLevelComment': {'kind': 'youtube#comment', 'etag': 'kzUU99omaA_zs9CE7tJd_7OW7Fc', 'id': 'UgynJ_XIf5HsklNoxX14AaABAg', 'snippet': {'videoId': 'xZtcIZaSq9o', 'textDisplay': 'Engraçado que esse mesmo assunto falado pela Jovem Pam é falado de outra forma, não sei em que mundo eles vivem.', 'textOriginal': 'Engraçado que esse mesmo assunto falado pela Jovem Pam é falado de outra forma, não sei em que mundo eles vivem.', 'authorDisplayName': 'Edson Simão da Silva', 'authorProfileImageUrl': 'https://yt3.ggpht.com/Bad_KsSTNOeGy1i7DR8FA2bNS-_wt0SQVZSZ5EmOm7ivCzTIromacwW4GvJleIC2WW3NZqwuiEM=s48-c-k-c0x00ffffff-no-rj', 'authorChannelUrl': 'http://www.youtube.com/channel/UC4qu2lucNocGHKV_CzBSQNw', 'authorChannelId': {'value': 'UC4qu2lucNocGHKV_CzBSQNw'}, 'canRate': True, 'viewerRating': 'none', 'likeCount': 0, 'publishedAt': '2022-10-10T09:33:54Z', 'updatedAt': '2022-10-10T09:33:54Z'}}, 'canReply': True, 'totalReplyCount': 0, 'isPublic': True}",,UC4qu2lucNocGHKV_CzBSQNw,2022-10-10T09:33:54Z,"Engraçado que esse mesmo assunto falado pela Jovem Pam é falado de outra forma, não sei em que mundo eles vivem.",,2023-06-08 13:47:01.211771
youtube#commentThread,1eWA9MPTJolt20qpNPf_IcQ6G1k,Ugx_iq1CQjY7jyrTZhF4AaABAg,"{'videoId': 'xZtcIZaSq9o', 'topLevelComment': {'kind': 'youtube#comment', 'etag': 'RZ0YEvKm1ML90ZkB9E5abFiE0dg', 'id': 'Ugx_iq1CQjY7jyrTZhF4AaABAg', 'snippet': {'videoId': 'xZtcIZaSq9o', 'textDisplay': 'Agora ele volta atrás kkkkkk', 'textOriginal': 'Agora ele volta atrás kkkkkk', 'authorDisplayName': 'Tk', 'authorProfileImageUrl': 'https://yt3.ggpht.com/RAaSjoa67TbVgS6fUVMt9og-QCUTOQCOiTwwtUve4gPiAZyQPmkf3sg-WlCVEguJ-6-ofkiVQA=s48-c-k-c0x00ffffff-no-rj', 'authorChannelUrl': 'http://www.youtube.com/channel/UC7pI80rtapKbX9N4Lgy73ZA', 'authorChannelId': {'value': 'UC7pI80rtapKbX9N4Lgy73ZA'}, 'canRate': True, 'viewerRating': 'none', 'likeCount': 1, 'publishedAt': '2022-10-09T17:12:41Z', 'updatedAt': '2022-10-09T17:12:41Z'}}, 'canReply': True, 'totalReplyCount': 0, 'isPublic': True}",,UC7pI80rtapKbX9N4Lgy73ZA,2022-10-09T17:12:41Z,Agora ele volta atrás kkkkkk,,2023-06-08 13:47:01.211771
youtube#commentThread,tgBx7drPV9t0sOQ2sW6sxUI-ciY,UgwcGmofH_68uWA2ijR4AaABAg,"{'videoId': 'xZtcIZaSq9o', 'topLevelComment': {'kind': 'youtube#comment', 'etag': 'urWlEcNhKf6gKBg4lVBmuqH1tuA', 'id': 'UgwcGmofH_68uWA2ijR4AaABAg', 'snippet': {'videoId': 'xZtcIZaSq9o', 'textDisplay': 'As mentiras do bolsonaro são tão escancaradas e parte do povo se mantém cego.<br>Ele fala em implantar escolas cívico-militares, o que é absurdo e custa 3 vezes mais que as escolas convencionais.  Ao mesmo tempo expõe a realidade ou verdade da sua gestão, ele corta em 97% as verbas do orçamento direcionadas à Educação básica, em 80% das creches, além das verbas das Universidades e Institutos de educação pro ano que vem, ou seja, ele mente e desvia recursos pra fins obscuros (orçamento secreto e gastos com forças armadas).<br>Aliás, vocês observaram a quantidade de militares e pastores &quot;empresários&quot; (negociando) no governo bolsonaro? Começando pelo leite condensado, empresário é sargento do exército, o pai pastor e a esposa participou, cada qual com uma empresa ( 24 milhões em vendas). Na vacina o PM &quot;Dominguetti&quot;, o Coronel Blanco, este abriu empresa às pressas e mudou o ramo de atividade ( de alimentos para medicamentos em uma semana) pra entrar no esquema, além do ministro do TC Wagner de Campos Rogério que viu e deixou passar o esquema, cujo funcionário denunciou. Lembram-se?<br>No MEC o ex-majir da PM Odimar estava envolvido. O mensageiro de ordens da presidência, um militar, envolvida na atual identificação de saques bancários e movimentações atípicas nas contas do gabinete do bolsonaro. E nem vou falar dos 39 kg de cocaína na comitiva presidencial, atribuída a um sargento das forças armadas, que gera dúvidas, tendo em vista a comitiva ser formada por maioria de militares, incluindo o chefe da SNI e o rigor da vistoria da aeronave.', 'textOriginal': 'As mentiras do bolsonaro são tão escancaradas e parte do povo se mantém cego.\\nEle fala em implantar escolas cívico-militares, o que é absurdo e custa 3 vezes mais que as escolas convencionais.  Ao mesmo tempo expõe a realidade ou verdade da sua gestão, ele corta em 97% as verbas do orçamento direcionadas à Educação básica, em 80% das creches, além das verbas das Universidades e Institutos de educação pro ano que vem, ou seja, ele mente e desvia recursos pra fins obscuros (orçamento secreto e gastos com forças armadas).\\nAliás, vocês observaram a quantidade de militares e pastores ""empresários"" (negociando) no governo bolsonaro? Começando pelo leite condensado, empresário é sargento do exército, o pai pastor e a esposa participou, cada qual com uma empresa ( 24 milhões em vendas). Na vacina o PM ""Dominguetti"", o Coronel Blanco, este abriu empresa às pressas e mudou o ramo de atividade ( de alimentos para medicamentos em uma semana) pra entrar no esquema, além do ministro do TC Wagner de Campos Rogério que viu e deixou passar o esquema, cujo funcionário denunciou. Lembram-se?\\nNo MEC o ex-majir da PM Odimar estava envolvido. O mensageiro de ordens da presidência, um militar, envolvida na atual identificação de saques bancários e movimentações atípicas nas contas do gabinete do bolsonaro. E nem vou falar dos 39 kg de cocaína na comitiva presidencial, atribuída a um sargento das forças armadas, que gera dúvidas, tendo em vista a comitiva ser formada por maioria de militares, incluindo o chefe da SNI e o rigor da vistoria da aeronave.', 'authorDisplayName': 'Edson Eliodoro', 'authorProfileImageUrl': 'https://yt3.ggpht.com/7W3sfqagM9qjFkSV0oCDp1Fm_wTRr7_qTOhdwvhD_L0uyuuvg5EVEDlOUtpkXUptj2seOoJe=s48-c-k-c0x00ffffff-no-rj', 'authorChannelUrl': 'http://www.youtube.com/channel/UCys2ADHs4h9kopo2-cPN3BA', 'authorChannelId': {'value': 'UCys2ADHs4h9kopo2-cPN3BA'}, 'canRate': True, 'viewerRating': 'none', 'likeCount': 0, 'publishedAt': '2022-10-09T14:55:47Z', 'updatedAt': '2022-10-09T15:18:13Z'}}, 'canReply': True, 'totalReplyCount': 0, 'isPublic': True}",,UCys2ADHs4h9kopo2-cPN3BA,2022-10-09T14:55:47Z,"As mentiras do bolsonaro são tão escancaradas e parte do povo se mantém cego.
Ele fala em implantar escolas cívico-militares, o que é absurdo e custa 3 vezes mais que as escolas convencionais.  Ao mesmo tempo expõe a realidade ou verdade da sua gestão, ele corta em 97% as verbas do orçamento direcionadas à Educação básica, em 80% das creches, além das verbas das Universidades e Institutos de educação pro ano que vem, ou seja, ele mente e desvia recursos pra fins obscuros (orçamento secreto e gastos com forças armadas).
Aliás, vocês observaram a quantidade de militares e pastores ""empresários"" (negociando) no governo bolsonaro? Começando pelo leite condensado, empresário é sargento do exército, o pai pastor e a esposa participou, cada qual com uma empresa ( 24 milhões em vendas). Na vacina o PM ""Dominguetti"", o Coronel Blanco, este abriu empresa às pressas e mudou o ramo de atividade ( de alimentos para medicamentos em uma semana) pra entrar no esquema, além do ministro do TC Wagner de Campos Rogério que viu e deixou passar o esquema, cujo funcionário denunciou. Lembram-se?
No MEC o ex-majir da PM Odimar estava envolvido. O mensageiro de ordens da presidência, um militar, envolvida na atual identificação de saques bancários e movimentações atípicas nas contas do gabinete do bolsonaro. E nem vou falar dos 39 kg de cocaína na comitiva presidencial, atribuída a um sargento das forças armadas, que gera dúvidas, tendo em vista a comitiva ser formada por maioria de militares, incluindo o chefe da SNI e o rigor da vistoria da aeronave.",,2023-06-08 13:47:01.211771
youtube#commentThread,f6_aquE4eO39RrWioBgH742ieo4,UgxLEcdC9Q0_SClCX4B4AaABAg,"{'videoId': 'xZtcIZaSq9o', 'topLevelComment': {'kind': 'youtube#comment', 'etag': '8U6QALNTXO0ECDs4kLxTKsOptSI', 'id': 'UgxLEcdC9Q0_SClCX4B4AaABAg', 'snippet': {'videoId': 'xZtcIZaSq9o', 'textDisplay': 'Desgoverno <b>MALIGNO</b> só  Voltou  a Atrá por que estar em camoanha ELEITORAL e nao pegou bem! <b>Sinico é Hipócrita</b>', 'textOriginal': 'Desgoverno *MALIGNO* só  Voltou  a Atrá por que estar em camoanha ELEITORAL e nao pegou bem! *Sinico é Hipócrita*', 'authorDisplayName': 'Veronica Lima', 'authorProfileImageUrl': 'https://yt3.ggpht.com/tB_b3236NFQJsdPdS3sT2Ri6FlIe8vItF4MQ88XbDrfL50cYzx9mxw0kBGE3wW5d9E87KMS4VA=s48-c-k-c0x00ffffff-no-rj', 'authorChannelUrl': 'http://www.youtube.com/channel/UC9v4mtFhw3jNX25GrENgI9w', 'authorChannelId': {'value': 'UC9v4mtFhw3jNX25GrENgI9w'}, 'canRate': True, 'viewerRating': 'none', 'likeCount': 0, 'publishedAt': '2022-10-08T17:47:59Z', 'updatedAt': '2022-10-08T17:47:59Z'}}, 'canReply': True, 'totalReplyCount': 0, 'isPublic': True}",,UC9v4mtFhw3jNX25GrENgI9w,2022-10-08T17:47:59Z,Desgoverno *MALIGNO* só  Voltou  a Atrá por que estar em camoanha ELEITORAL e nao pegou bem! *Sinico é Hipócrita*,,2023-06-08 13:47:01.211771
youtube#commentThread,oqGbbpZCjWOwbu2e8IjBkzjJ0ZY,UgwdjB8Gb_uxV8ejpct4AaABAg,"{'videoId': 'xZtcIZaSq9o', 'topLevelComment': {'kind': 'youtube#comment', 'etag': 'LVmbodNEfhEHj_3iKzVvi_zWsH8', 'id': 'UgwdjB8Gb_uxV8ejpct4AaABAg', 'snippet': {'videoId': 'xZtcIZaSq9o', 'textDisplay': 'Orçamento secreto que não se sabe do valor da verba, das despesas, com que foi gasto e se de fato foi entregue o serviço ou o bem o que a nota do gosto descreve. É um escândalo.', 'textOriginal': 'Orçamento secreto que não se sabe do valor da verba, das despesas, com que foi gasto e se de fato foi entregue o serviço ou o bem o que a nota do gosto descreve. É um escândalo.', 'authorDisplayName': 'Franciele Santos', 'authorProfileImageUrl': 'https://yt3.ggpht.com/ytc/AGIKgqOB9e8OoxdLrYIfInzbhVHSDKizV_LZA3o1lw=s48-c-k-c0x00ffffff-no-rj', 'authorChannelUrl': 'http://www.youtube.com/channel/UCx72_6OIFhQRqMP9sXbdTNQ', 'authorChannelId': {'value': 'UCx72_6OIFhQRqMP9sXbdTNQ'}, 'canRate': True, 'viewerRating': 'none', 'likeCount': 3, 'publishedAt': '2022-10-08T09:52:01Z', 'updatedAt': '2022-10-08T09:52:01Z'}}, 'canReply': True, 'totalReplyCount': 0, 'isPublic': True}",,UCx72_6OIFhQRqMP9sXbdTNQ,2022-10-08T09:52:01Z,"Orçamento secreto que não se sabe do valor da verba, das despesas, com que foi gasto e se de fato foi entregue o serviço ou o bem o que a nota do gosto descreve. É um escândalo.",,2023-06-08 13:47:01.211771
youtube#commentThread,2j0yu37BPXTrh8NmmPK-7-xm9tA,Ugwy0DeTE7jEeizluXN4AaABAg,"{'videoId': 'xZtcIZaSq9o', 'topLevelComment': {'kind': 'youtube#comment', 'etag': 'kRk_7kNL8LB7kg7YG6HplE6W-5w', 'id': 'Ugwy0DeTE7jEeizluXN4AaABAg', 'snippet': {'videoId': 'xZtcIZaSq9o', 'textDisplay': 'Só por medo do revés eleitoral. <br>Ou seja, fica pro ano que vem.', 'textOriginal': 'Só por medo do revés eleitoral. \\nOu seja, fica pro ano que vem.', 'authorDisplayName': 'MARCOS VITTI', 'authorProfileImageUrl': 'https://yt3.ggpht.com/2t3LCoWTuC-hbiyBAdXgQlixrfD-wAvT1fMMIRTqQlx2Pk_ibZDnIPohuo180Qp2d0SL5pY0=s48-c-k-c0x00ffffff-no-rj', 'authorChannelUrl': 'http://www.youtube.com/channel/UCaVjqH70j3nMgdbxE9EUJmQ', 'authorChannelId': {'value': 'UCaVjqH70j3nMgdbxE9EUJmQ'}, 'canRate': True, 'viewerRating': 'none', 'likeCount': 7, 'publishedAt': '2022-10-08T00:58:05Z', 'updatedAt': '2022-10-08T00:58:05Z'}}, 'canReply': True, 'totalReplyCount': 1, 'isPublic': True}","{'comments': [{'kind': 'youtube#comment', 'etag': 'M2hD2LI7TCM2VkSKjug4MDPUMYw', 'id': 'Ugwy0DeTE7jEeizluXN4AaABAg.9guFH_VI91x9gy5KlqCliE', 'snippet': {'videoId': 'xZtcIZaSq9o', 'textDisplay': 'Se ele ganhar é claro que vai cortar.', 'textOriginal': 'Se ele ganhar é claro que vai cortar.', 'parentId': 'Ugwy0DeTE7jEeizluXN4AaABAg', 'authorDisplayName': 'sandra', 'authorProfileImageUrl': 'https://yt3.ggpht.com/ytc/AGIKgqPrYLivLN-b8Q_RnAmjhVJQ2r-kacNlsrcXzpr1giD2WCmdveZfbytcn2vVUzON=s48-c-k-c0x00ffffff-no-rj', 'authorChannelUrl': 'http://www.youtube.com/channel/UC73IdDvrG1NVmMaJ4YQCPXg', 'authorChannelId': {'value': 'UC73IdDvrG1NVmMaJ4YQCPXg'}, 'canRate': True, 'viewerRating': 'none', 'likeCount': 0, 'publishedAt': '2022-10-09T12:48:06Z', 'updatedAt': '2022-10-09T12:48:06Z'}}]}",UCaVjqH70j3nMgdbxE9EUJmQ,2022-10-08T00:58:05Z,"Só por medo do revés eleitoral. 
Ou seja, fica pro ano que vem.",,2023-06-08 13:47:01.211771
