kind,etag,id,snippet,replies,authorChannelId,publishedAt,textOriginal,nextPageToken,extraction_date
youtube#commentThread,zNzaC2v5G6szSbXjbsfz3VLIye0,UgzQQcStfv2SJRbizJJ4AaABAg,"{'videoId': 'Bu2NJ-Medh0', 'topLevelComment': {'kind': 'youtube#comment', 'etag': 'o_Dq54EIV8PWuS1eF3O1xiCsZxE', 'id': 'UgzQQcStfv2SJRbizJJ4AaABAg', 'snippet': {'videoId': 'Bu2NJ-Medh0', 'textDisplay': 'Muito boa a bancada de hoje! Parabéns JC, vocês são os melhores.', 'textOriginal': 'Muito boa a bancada de hoje! Parabéns JC, vocês são os melhores.', 'authorDisplayName': 'Estela Dantas', 'authorProfileImageUrl': 'https://yt3.ggpht.com/ytc/AGIKgqO0JwsTYh3y-fvtWGxQR4-bQalqxxH0I5_tMg=s48-c-k-c0x00ffffff-no-rj', 'authorChannelUrl': 'http://www.youtube.com/channel/UCU6Uo4yVelFD8IF38MtTWCQ', 'authorChannelId': {'value': 'UCU6Uo4yVelFD8IF38MtTWCQ'}, 'canRate': True, 'viewerRating': 'none', 'likeCount': 0, 'publishedAt': '2022-11-02T16:16:51Z', 'updatedAt': '2022-11-02T16:16:51Z'}}, 'canReply': True, 'totalReplyCount': 0, 'isPublic': True}",,UCU6Uo4yVelFD8IF38MtTWCQ,2022-11-02T16:16:51Z,"Muito boa a bancada de hoje! Parabéns JC, vocês são os melhores.",,2023-06-08 13:41:08.073289
youtube#commentThread,4Iw5FzPUAFcnYqQ2nmlnDC8g7ew,UgweFOhyouIc3SvSjfZ4AaABAg,"{'videoId': 'Bu2NJ-Medh0', 'topLevelComment': {'kind': 'youtube#comment', 'etag': 'vomILbmiJYzUHa08f-QxTB7bG0Q', 'id': 'UgweFOhyouIc3SvSjfZ4AaABAg', 'snippet': {'videoId': 'Bu2NJ-Medh0', 'textDisplay': 'Muita gente deixando de votar no pt porque o  lula( pt) disse nesse último debate  que o micro empreendedor individual não é emprego!', 'textOriginal': 'Muita gente deixando de votar no pt porque o  lula( pt) disse nesse último debate  que o micro empreendedor individual não é emprego!', 'authorDisplayName': 'Paulo Ricardo bobsin', 'authorProfileImageUrl': 'https://yt3.ggpht.com/cW5hbMC02yftcTCm5dC0tKR6QnzHyt4KabqbhwGY3zZTPbHOMyz7MQHhed3LVnoZGbvnp2Ka6_4=s48-c-k-c0x00ffffff-no-rj', 'authorChannelUrl': 'http://www.youtube.com/channel/UClCn7lB0CajPXtP42eA89qQ', 'authorChannelId': {'value': 'UClCn7lB0CajPXtP42eA89qQ'}, 'canRate': True, 'viewerRating': 'none', 'likeCount': 0, 'publishedAt': '2022-10-29T17:47:04Z', 'updatedAt': '2022-10-29T17:47:04Z'}}, 'canReply': True, 'totalReplyCount': 1, 'isPublic': True}","{'comments': [{'kind': 'youtube#comment', 'etag': 'aXoBukI95MPQ0WiZB2cvg5DMEPQ', 'id': 'UgweFOhyouIc3SvSjfZ4AaABAg.9hm7S0YWI3g9ho3bs7BsVs', 'snippet': {'videoId': 'Bu2NJ-Medh0', 'textDisplay': 'Outro dia tive a sensação que o Jegues estava sendo ovacionado nos supermercados e nas filas quilométricas que se formavam no açougue. <br>Aí eu acordei.', 'textOriginal': 'Outro dia tive a sensação que o Jegues estava sendo ovacionado nos supermercados e nas filas quilométricas que se formavam no açougue. \\nAí eu acordei.', 'parentId': 'UgweFOhyouIc3SvSjfZ4AaABAg', 'authorDisplayName': '_ Nemo', 'authorProfileImageUrl': 'https://yt3.ggpht.com/YSD6affHObieY6lzZvmRaUQoPLR0JDwvG0psn4bJUIV0_rIdTv-t6g4JlPXqm6z4fIM98H_Rtwg=s48-c-k-c0x00ffffff-no-rj', 'authorChannelUrl': 'http://www.youtube.com/channel/UCWESyxp_FU1XkungCTjzbOg', 'authorChannelId': {'value': 'UCWESyxp_FU1XkungCTjzbOg'}, 'canRate': True, 'viewerRating': 'none', 'likeCount': 0, 'publishedAt': '2022-10-30T11:52:05Z', 'updatedAt': '2022-10-30T11:52:05Z'}}]}",UClCn7lB0CajPXtP42eA89qQ,2022-10-29T17:47:04Z,Muita gente deixando de votar no pt porque o  lula( pt) disse nesse último debate  que o micro empreendedor individual não é emprego!,,2023-06-08 13:41:08.073289
youtube#commentThread,P3aA3-mflscr-owzGq8B9mPbUdg,Ugx7VBXzz7mf7z0ZcKN4AaABAg,"{'videoId': 'Bu2NJ-Medh0', 'topLevelComment': {'kind': 'youtube#comment', 'etag': 'rLET0Fij1-u-XWgLt4u4HvoA0UU', 'id': 'Ugx7VBXzz7mf7z0ZcKN4AaABAg', 'snippet': {'videoId': 'Bu2NJ-Medh0', 'textDisplay': 'JORNAL COM CULTURA', 'textOriginal': 'JORNAL COM CULTURA', 'authorDisplayName': 'Luciano Martins', 'authorProfileImageUrl': 'https://yt3.ggpht.com/ytc/AGIKgqNvPhcM00HHdCCYPWFRSzCDTZ3iudQfEhRziA=s48-c-k-c0x00ffffff-no-rj', 'authorChannelUrl': 'http://www.youtube.com/channel/UCH4aiMTKIn009mYl40ovw4A', 'authorChannelId': {'value': 'UCH4aiMTKIn009mYl40ovw4A'}, 'canRate': True, 'viewerRating': 'none', 'likeCount': 4, 'publishedAt': '2022-10-29T16:42:41Z', 'updatedAt': '2022-10-29T16:42:41Z'}}, 'canReply': True, 'totalReplyCount': 0, 'isPublic': True}",,UCH4aiMTKIn009mYl40ovw4A,2022-10-29T16:42:41Z,JORNAL COM CULTURA,,2023-06-08 13:41:08.073289
youtube#commentThread,c6yEYRMp7V1QrJ499rjMWvu6LuU,UgxOD9TYWn8Agv4sDPd4AaABAg,"{'videoId': 'Bu2NJ-Medh0', 'topLevelComment': {'kind': 'youtube#comment', 'etag': 'BgH1MZ7wmMkhRBK8Z7KuKjexgW4', 'id': 'UgxOD9TYWn8Agv4sDPd4AaABAg', 'snippet': {'videoId': 'Bu2NJ-Medh0', 'textDisplay': 'Atentado fake da extrema-direita em Paraisópolis é o novo atentado do Rio Centro? Meus receios estão aumentando...', 'textOriginal': 'Atentado fake da extrema-direita em Paraisópolis é o novo atentado do Rio Centro? Meus receios estão aumentando...', 'authorDisplayName': 'Odisseus', 'authorProfileImageUrl': 'https://yt3.ggpht.com/ytc/AGIKgqMEhWp66o3-E8rAEbj5RkY3z6czpUKmjLfEOQ=s48-c-k-c0x00ffffff-no-rj', 'authorChannelUrl': 'http://www.youtube.com/channel/UCTAROEyP20UIG0eteIb82nQ', 'authorChannelId': {'value': 'UCTAROEyP20UIG0eteIb82nQ'}, 'canRate': True, 'viewerRating': 'none', 'likeCount': 0, 'publishedAt': '2022-10-29T16:28:42Z', 'updatedAt': '2022-10-29T16:28:42Z'}}, 'canReply': True, 'totalReplyCount': 0, 'isPublic': True}",,UCTAROEyP20UIG0eteIb82nQ,2022-10-29T16:28:42Z,Atentado fake da extrema-direita em Paraisópolis é o novo atentado do Rio Centro? Meus receios estão aumentando...,,2023-06-08 13:41:08.073289
youtube#commentThread,3X1R9OmXD6EXIfJLHBjIFoNs4oA,Ugy25TfSWHJWTagMX114AaABAg,"{'videoId': 'Bu2NJ-Medh0', 'topLevelComment': {'kind': 'youtube#comment', 'etag': 'TzhB6qhdDzF5GJMMrOcXPO1Czco', 'id': 'Ugy25TfSWHJWTagMX114AaABAg', 'snippet': {'videoId': 'Bu2NJ-Medh0', 'textDisplay': 'Obrigado pela edição.', 'textOriginal': 'Obrigado pela edição.', 'authorDisplayName': 'Ademar Amâncio', 'authorProfileImageUrl': 'https://yt3.ggpht.com/ytc/AGIKgqO91qoWYcuCx2matmdXTP3aDDX9Kd0ErAiCdg=s48-c-k-c0x00ffffff-no-rj', 'authorChannelUrl': 'http://www.youtube.com/channel/UCogx7BUp-Leeu6i_LmIbQag', 'authorChannelId': {'value': 'UCogx7BUp-Leeu6i_LmIbQag'}, 'canRate': True, 'viewerRating': 'none', 'likeCount': 2, 'publishedAt': '2022-10-29T15:16:52Z', 'updatedAt': '2022-10-29T15:16:52Z'}}, 'canReply': True, 'totalReplyCount': 0, 'isPublic': True}",,UCogx7BUp-Leeu6i_LmIbQag,2022-10-29T15:16:52Z,Obrigado pela edição.,,2023-06-08 13:41:08.073289
youtube#commentThread,eYc9nsK5FtQV0vWYbCoDP0X6ZnA,UgwDUT_dt1IlWPPiVEV4AaABAg,"{'videoId': 'Bu2NJ-Medh0', 'topLevelComment': {'kind': 'youtube#comment', 'etag': 'n4c76hC3w2U0YgZLiFDlKI61xMQ', 'id': 'UgwDUT_dt1IlWPPiVEV4AaABAg', 'snippet': {'videoId': 'Bu2NJ-Medh0', 'textDisplay': 'NESSA ELEIÇÃO LIVRE E DEMOCRÁTICA, VOTEMOS NAS PUTAS, NAS VAGABUNDAS, NAS ORDINÁRIAS, PORQUE SEUS FILHOS, IRMÃOS, NETOS, SOBRINHOS, (TODOS, SIMPLESMENTE TODOS OS POLÍTICOS) . . . . NÃO FAZEM NADA, ABSOLUTAMENTE NADA, EXCETO (NOS) ROUBAR . . . . . ISSO HÁ SIMPLESMENTE SÉCULOS ! ! ! ! ASSIM, DESIGUALDADE, POBREZA, DESEMPREGO, FOME, CRIME,  . . . . . FALTA DE: ESCOLAS, HOSPITAIS, MORADIAS, ETC, ETC . . . . . . . . . . . . . . . . . . . . . . . . VÃO CONTINUAR A TODO VAPOR ! ! ! ! ! !', 'textOriginal': 'NESSA ELEIÇÃO LIVRE E DEMOCRÁTICA, VOTEMOS NAS PUTAS, NAS VAGABUNDAS, NAS ORDINÁRIAS, PORQUE SEUS FILHOS, IRMÃOS, NETOS, SOBRINHOS, (TODOS, SIMPLESMENTE TODOS OS POLÍTICOS) . . . . NÃO FAZEM NADA, ABSOLUTAMENTE NADA, EXCETO (NOS) ROUBAR . . . . . ISSO HÁ SIMPLESMENTE SÉCULOS ! ! ! ! ASSIM, DESIGUALDADE, POBREZA, DESEMPREGO, FOME, CRIME,  . . . . . FALTA DE: ESCOLAS, HOSPITAIS, MORADIAS, ETC, ETC . . . . . . . . . . . . . . . . . . . . . . . . VÃO CONTINUAR A TODO VAPOR ! ! ! ! ! !', 'authorDisplayName': 'Carlos Vipe', 'authorProfileImageUrl': 'https://yt3.ggpht.com/ytc/AGIKgqOJqH7gmJutNNMAqMyJALyZOAImRB8ZsmdsZ9pJ=s48-c-k-c0x00ffffff-no-rj', 'authorChannelUrl': 'http://www.youtube.com/channel/UC7oBwRMwnU5OSAClmKgtWUg', 'authorChannelId': {'value': 'UC7oBwRMwnU5OSAClmKgtWUg'}, 'canRate': True, 'viewerRating': 'none', 'likeCount': 0, 'publishedAt': '2022-10-29T13:10:54Z', 'updatedAt': '2022-10-29T13:37:59Z'}}, 'canReply': True, 'totalReplyCount': 0, 'isPublic': True}",,UC7oBwRMwnU5OSAClmKgtWUg,2022-10-29T13:10:54Z,"NESSA ELEIÇÃO LIVRE E DEMOCRÁTICA, VOTEMOS NAS PUTAS, NAS VAGABUNDAS, NAS ORDINÁRIAS, PORQUE SEUS FILHOS, IRMÃOS, NETOS, SOBRINHOS, (TODOS, SIMPLESMENTE TODOS OS POLÍTICOS) . . . . NÃO FAZEM NADA, ABSOLUTAMENTE NADA, EXCETO (NOS) ROUBAR . . . . . ISSO HÁ SIMPLESMENTE SÉCULOS ! ! ! ! ASSIM, DESIGUALDADE, POBREZA, DESEMPREGO, FOME, CRIME,  . . . . . FALTA DE: ESCOLAS, HOSPITAIS, MORADIAS, ETC, ETC . . . . . . . . . . . . . . . . . . . . . . . . VÃO CONTINUAR A TODO VAPOR ! ! ! ! ! !",,2023-06-08 13:41:08.073289
youtube#commentThread,dKKc54o5WYQ1enoFuk2MO2ATZ0Q,Ugy-UyRlIzXdrGCdkPt4AaABAg,"{'videoId': 'Bu2NJ-Medh0', 'topLevelComment': {'kind': 'youtube#comment', 'etag': 'A2iuJZQeYdaguDCRzIqSzDy9Rfw', 'id': 'Ugy-UyRlIzXdrGCdkPt4AaABAg', 'snippet': {'videoId': 'Bu2NJ-Medh0', 'textDisplay': 'Espero que o Tarcísio do dia 1 de janeiro faça igual ao Elon Musk, passa o pente fino na Cultura e o diretor de &quot;jornalismo&quot; e a tal lá que apresenta o roda viva sejam os primeiros.', 'textOriginal': 'Espero que o Tarcísio do dia 1 de janeiro faça igual ao Elon Musk, passa o pente fino na Cultura e o diretor de ""jornalismo"" e a tal lá que apresenta o roda viva sejam os primeiros.', 'authorDisplayName': 'Alexandre Marques', 'authorProfileImageUrl': 'https://yt3.ggpht.com/ytc/AGIKgqMJQmtGy4yCsi8QuzM9ZTxRM6hZUj_j3N0IE7JXGm0=s48-c-k-c0x00ffffff-no-rj', 'authorChannelUrl': 'http://www.youtube.com/channel/UCMVE6kJGt4YV8kxQCTzAafw', 'authorChannelId': {'value': 'UCMVE6kJGt4YV8kxQCTzAafw'}, 'canRate': True, 'viewerRating': 'none', 'likeCount': 1, 'publishedAt': '2022-10-29T12:15:49Z', 'updatedAt': '2022-10-29T12:15:49Z'}}, 'canReply': True, 'totalReplyCount': 4, 'isPublic': True}","{'comments': [{'kind': 'youtube#comment', 'etag': 'mvdRCqNDaxgPZkeQfX3g6RvAhc4', 'id': 'Ugy-UyRlIzXdrGCdkPt4AaABAg.9hlXXq8lTuZ9hqmjxwMwLr', 'snippet': {'videoId': 'Bu2NJ-Medh0', 'textDisplay': '@Renatosantosalmeidas Santos Até eu já aceitei. Doi menos, sabe? rs', 'textOriginal': '@Renatosantosalmeidas Santos Até eu já aceitei. Doi menos, sabe? rs', 'parentId': 'Ugy-UyRlIzXdrGCdkPt4AaABAg', 'authorDisplayName': '_ Nemo', 'authorProfileImageUrl': 'https://yt3.ggpht.com/YSD6affHObieY6lzZvmRaUQoPLR0JDwvG0psn4bJUIV0_rIdTv-t6g4JlPXqm6z4fIM98H_Rtwg=s48-c-k-c0x00ffffff-no-rj', 'authorChannelUrl': 'http://www.youtube.com/channel/UCWESyxp_FU1XkungCTjzbOg', 'authorChannelId': {'value': 'UCWESyxp_FU1XkungCTjzbOg'}, 'canRate': True, 'viewerRating': 'none', 'likeCount': 0, 'publishedAt': '2022-10-31T13:13:37Z', 'updatedAt': '2022-10-31T13:13:37Z'}}, {'kind': 'youtube#comment', 'etag': 'IwEdEqceYp1XEFVE8_NOOAtpEAw', 'id': 'Ugy-UyRlIzXdrGCdkPt4AaABAg.9hlXXq8lTuZ9hpsiChZGT6', 'snippet': {'videoId': 'Bu2NJ-Medh0', 'textDisplay': '@_ Nemo querem a demissão por vingança contra quem tem opinião a favor da democracia olha os filhotes do mau caráter', 'textOriginal': '@_ Nemo querem a demissão por vingança contra quem tem opinião a favor da democracia olha os filhotes do mau caráter', 'parentId': 'Ugy-UyRlIzXdrGCdkPt4AaABAg', 'authorDisplayName': 'Renatosantosalmeidas Santos', 'authorProfileImageUrl': 'https://yt3.ggpht.com/ytc/AGIKgqOx1N36facHaVJAUy1ypTj1MsOiXvx79GB-AQ=s48-c-k-c0x00ffffff-no-rj', 'authorChannelUrl': 'http://www.youtube.com/channel/UCWZxO_VYVRTVcy77qO9HjvQ', 'authorChannelId': {'value': 'UCWZxO_VYVRTVcy77qO9HjvQ'}, 'canRate': True, 'viewerRating': 'none', 'likeCount': 0, 'publishedAt': '2022-10-31T04:46:34Z', 'updatedAt': '2022-10-31T04:46:34Z'}}, {'kind': 'youtube#comment', 'etag': 'cwyL4TUKHyWOD0DDn9BZtFzHyF4', 'id': 'Ugy-UyRlIzXdrGCdkPt4AaABAg.9hlXXq8lTuZ9ho0ceme6qU', 'snippet': {'videoId': 'Bu2NJ-Medh0', 'textDisplay': 'Ainda bem que isso possa ser um longo e penoso processo, haja vista que é uma fundação. Espero sinceramente que ele tente ... como é que vocês falam? pela &#39;liberdade de expressão&#39;? rs', 'textOriginal': ""Ainda bem que isso possa ser um longo e penoso processo, haja vista que é uma fundação. Espero sinceramente que ele tente ... como é que vocês falam? pela 'liberdade de expressão'? rs"", 'parentId': 'Ugy-UyRlIzXdrGCdkPt4AaABAg', 'authorDisplayName': '_ Nemo', 'authorProfileImageUrl': 'https://yt3.ggpht.com/YSD6affHObieY6lzZvmRaUQoPLR0JDwvG0psn4bJUIV0_rIdTv-t6g4JlPXqm6z4fIM98H_Rtwg=s48-c-k-c0x00ffffff-no-rj', 'authorChannelUrl': 'http://www.youtube.com/channel/UCWESyxp_FU1XkungCTjzbOg', 'authorChannelId': {'value': 'UCWESyxp_FU1XkungCTjzbOg'}, 'canRate': True, 'viewerRating': 'none', 'likeCount': 2, 'publishedAt': '2022-10-30T11:25:58Z', 'updatedAt': '2022-10-30T11:26:28Z'}}, {'kind': 'youtube#comment', 'etag': '7swUyBF7cnnxwxy3AU6h3iYdqrs', 'id': 'Ugy-UyRlIzXdrGCdkPt4AaABAg.9hlXXq8lTuZ9hlxSLxfmUj', 'snippet': {'videoId': 'Bu2NJ-Medh0', 'textDisplay': 'Por que a turma &quot;anticorrupção&quot; não passa pente fino no orçamento secreto? É nosso dinheiro indo pra onde? Quase vinte bilhões viu. A suas custas tbm.', 'textOriginal': 'Por que a turma ""anticorrupção"" não passa pente fino no orçamento secreto? É nosso dinheiro indo pra onde? Quase vinte bilhões viu. A suas custas tbm.', 'parentId': 'Ugy-UyRlIzXdrGCdkPt4AaABAg', 'authorDisplayName': 'Marcia R ☆', 'authorProfileImageUrl': 'https://yt3.ggpht.com/91fpBeuzlgvr7oPA1aobhTtqNvTs_7mb2vqQ2QgkGTqKUX-t3LFlB-B3Is_81qh8zhQ1RBqxZw=s48-c-k-c0x00ffffff-no-rj', 'authorChannelUrl': 'http://www.youtube.com/channel/UCDXcysMYt5l7uaID9nO4EKA', 'authorChannelId': {'value': 'UCDXcysMYt5l7uaID9nO4EKA'}, 'canRate': True, 'viewerRating': 'none', 'likeCount': 1, 'publishedAt': '2022-10-29T16:11:00Z', 'updatedAt': '2022-10-29T16:11:00Z'}}]}",UCMVE6kJGt4YV8kxQCTzAafw,2022-10-29T12:15:49Z,"Espero que o Tarcísio do dia 1 de janeiro faça igual ao Elon Musk, passa o pente fino na Cultura e o diretor de ""jornalismo"" e a tal lá que apresenta o roda viva sejam os primeiros.",,2023-06-08 13:41:08.073289
youtube#commentThread,g_oglgxlAfChxVkWWUrNyJqSUJ0,UgwOPP0Oj6_2pXIphjd4AaABAg,"{'videoId': 'Bu2NJ-Medh0', 'topLevelComment': {'kind': 'youtube#comment', 'etag': 'ZmGImx1yBIYSN5EcFVFyunvnVFQ', 'id': 'UgwOPP0Oj6_2pXIphjd4AaABAg', 'snippet': {'videoId': 'Bu2NJ-Medh0', 'textDisplay': 'Professor Oscar deveria aparecer com mais frequência na bancada do JC! Ele é excelente!!! ❤❤', 'textOriginal': 'Professor Oscar deveria aparecer com mais frequência na bancada do JC! Ele é excelente!!! ❤❤', 'authorDisplayName': 'Gizelle Menezes', 'authorProfileImageUrl': 'https://yt3.ggpht.com/0E-il9ygwniM-dUO9RdaExWn706unS3h0QRCCkH7-I2EOZ9BUb4i-UG4LUaBYAbFxAVVP_BBzQ=s48-c-k-c0x00ffffff-no-rj', 'authorChannelUrl': 'http://www.youtube.com/channel/UCUW5aIYW334IxMI5tlKCnOA', 'authorChannelId': {'value': 'UCUW5aIYW334IxMI5tlKCnOA'}, 'canRate': True, 'viewerRating': 'none', 'likeCount': 5, 'publishedAt': '2022-10-29T11:55:00Z', 'updatedAt': '2022-10-29T11:55:00Z'}}, 'canReply': True, 'totalReplyCount': 0, 'isPublic': True}",,UCUW5aIYW334IxMI5tlKCnOA,2022-10-29T11:55:00Z,Professor Oscar deveria aparecer com mais frequência na bancada do JC! Ele é excelente!!! ❤❤,,2023-06-08 13:41:08.073289
youtube#commentThread,MYnxj3zPpj2ZWv5DoJDX3Br8b4k,UgzSjukfCMk7MT6N5Ul4AaABAg,"{'videoId': 'Bu2NJ-Medh0', 'topLevelComment': {'kind': 'youtube#comment', 'etag': 'cnmx-X4D7p73M9eJS36YgPbJVYQ', 'id': 'UgzSjukfCMk7MT6N5Ul4AaABAg', 'snippet': {'videoId': 'Bu2NJ-Medh0', 'textDisplay': '⭐... &quot;DE ACORDO COM OS TEMPOS FIXADOS PELO GRANDE RELÓGIO DO CRIADOR DO CÉU E DA TERRA&quot;: &quot;CADA MUDANÇA DE ÉPOCA, IMPÕE INEVITAVELMENTE À HUMANIDADE UMA GRANDE AGITAÇÃO DE MENTALIDADES, NOVOS PARADIGMAS SALUTARES, BEM COMO UM CAMINHO INEVITÁVEL PARA UMA NOVA E SALUTAR ORDEM MUNDIAL&quot; ... &quot;AMEN&quot; ! <a href=""about:invalid#zCSafez""></a>', 'textOriginal': '⭐... ""DE ACORDO COM OS TEMPOS FIXADOS PELO GRANDE RELÓGIO DO CRIADOR DO CÉU E DA TERRA"": ""CADA MUDANÇA DE ÉPOCA, IMPÕE INEVITAVELMENTE À HUMANIDADE UMA GRANDE AGITAÇÃO DE MENTALIDADES, NOVOS PARADIGMAS SALUTARES, BEM COMO UM CAMINHO INEVITÁVEL PARA UMA NOVA E SALUTAR ORDEM MUNDIAL"" ... ""AMEN"" ! ', 'authorDisplayName': 'Jean-C Hor', 'authorProfileImageUrl': 'https://yt3.ggpht.com/iRAl8Ms9unkEZ5Ac_8tXtWeiXHUsgEmdyAiwZjv782pEyfoA-cl51dmFanjgD-F8lPm75rAfa-g=s48-c-k-c0x00ffffff-no-rj', 'authorChannelUrl': 'http://www.youtube.com/channel/UCKDyledpiWEahuYuoXCrffg', 'authorChannelId': {'value': 'UCKDyledpiWEahuYuoXCrffg'}, 'canRate': True, 'viewerRating': 'none', 'likeCount': 0, 'publishedAt': '2022-10-29T11:37:38Z', 'updatedAt': '2022-10-29T11:37:38Z'}}, 'canReply': True, 'totalReplyCount': 0, 'isPublic': True}",,UCKDyledpiWEahuYuoXCrffg,2022-10-29T11:37:38Z,"⭐... ""DE ACORDO COM OS TEMPOS FIXADOS PELO GRANDE RELÓGIO DO CRIADOR DO CÉU E DA TERRA"": ""CADA MUDANÇA DE ÉPOCA, IMPÕE INEVITAVELMENTE À HUMANIDADE UMA GRANDE AGITAÇÃO DE MENTALIDADES, NOVOS PARADIGMAS SALUTARES, BEM COMO UM CAMINHO INEVITÁVEL PARA UMA NOVA E SALUTAR ORDEM MUNDIAL"" ... ""AMEN"" ! ",,2023-06-08 13:41:08.073289
youtube#commentThread,B7VW6wqNV6qFtsW6hRlc9BBlBS0,UgyrZmHV8qMOKxDWPP94AaABAg,"{'videoId': 'Bu2NJ-Medh0', 'topLevelComment': {'kind': 'youtube#comment', 'etag': 'rG3Ob3rtYsHM2cNE0CiTAUayRME', 'id': 'UgyrZmHV8qMOKxDWPP94AaABAg', 'snippet': {'videoId': 'Bu2NJ-Medh0', 'textDisplay': 'Se o Brasil é um país democrático, então por que o voto é obrigatório?', 'textOriginal': 'Se o Brasil é um país democrático, então por que o voto é obrigatório?', 'authorDisplayName': 'Claudio', 'authorProfileImageUrl': 'https://yt3.ggpht.com/ytc/AGIKgqNbr4RwU3ohsI-iIpxsOoGaWVc4Y9xKaJx8aTc=s48-c-k-c0x00ffffff-no-rj', 'authorChannelUrl': 'http://www.youtube.com/channel/UC2ZsX3uEyaxZz1KKBroe6dg', 'authorChannelId': {'value': 'UC2ZsX3uEyaxZz1KKBroe6dg'}, 'canRate': True, 'viewerRating': 'none', 'likeCount': 1, 'publishedAt': '2022-10-29T08:44:51Z', 'updatedAt': '2022-10-29T08:44:51Z'}}, 'canReply': True, 'totalReplyCount': 3, 'isPublic': True}","{'comments': [{'kind': 'youtube#comment', 'etag': 'V947kuvYKwh3yiNRglvtxLZ6c9k', 'id': 'UgyrZmHV8qMOKxDWPP94AaABAg.9hl9Oj1pIcv9hoFXHnlz8K', 'snippet': {'videoId': 'Bu2NJ-Medh0', 'textDisplay': 'Nem ser alfabetizado é o dever de qualquer civilizado?!', 'textOriginal': 'Nem ser alfabetizado é o dever de qualquer civilizado?!', 'parentId': 'UgyrZmHV8qMOKxDWPP94AaABAg', 'authorDisplayName': 'Sidalia Rino', 'authorProfileImageUrl': 'https://yt3.ggpht.com/ytc/AGIKgqMuZ8HCMxX2RZXieAQwTqe9y2DzFl7W9Qtg1w=s48-c-k-c0x00ffffff-no-rj', 'authorChannelUrl': 'http://www.youtube.com/channel/UC64YR8Fah4np81oCWgZ9K0w', 'authorChannelId': {'value': 'UC64YR8Fah4np81oCWgZ9K0w'}, 'canRate': True, 'viewerRating': 'none', 'likeCount': 0, 'publishedAt': '2022-10-30T13:36:11Z', 'updatedAt': '2022-10-30T13:36:11Z'}}, {'kind': 'youtube#comment', 'etag': 'iF_aSGQXsrRqlyGx0QYXm_jZ7tI', 'id': 'UgyrZmHV8qMOKxDWPP94AaABAg.9hl9Oj1pIcv9hlZCTKBheZ', 'snippet': {'videoId': 'Bu2NJ-Medh0', 'textDisplay': 'Ovelha Rosa , sabia sim. E vc sabia que é porque a lei não obriga? Pois é. Como eu disse antes, lei. No Brasil, ninguém é obrigado a fazer NADA, senão em virtude de LEI.', 'textOriginal': 'Ovelha Rosa , sabia sim. E vc sabia que é porque a lei não obriga? Pois é. Como eu disse antes, lei. No Brasil, ninguém é obrigado a fazer NADA, senão em virtude de LEI.', 'parentId': 'UgyrZmHV8qMOKxDWPP94AaABAg', 'authorDisplayName': 'Maria Paula', 'authorProfileImageUrl': 'https://yt3.ggpht.com/ytc/AGIKgqMvV5N7-kIent80EkznfipNy0lxaXPwVFGHQWmiXA=s48-c-k-c0x00ffffff-no-rj', 'authorChannelUrl': 'http://www.youtube.com/channel/UCWqvLh00knMRpS-jNodhPhQ', 'authorChannelId': {'value': 'UCWqvLh00knMRpS-jNodhPhQ'}, 'canRate': True, 'viewerRating': 'none', 'likeCount': 0, 'publishedAt': '2022-10-29T12:30:22Z', 'updatedAt': '2022-10-29T12:30:22Z'}}, {'kind': 'youtube#comment', 'etag': 'PLg65ISUyanMPVpn2xvmL7-Wv5I', 'id': 'UgyrZmHV8qMOKxDWPP94AaABAg.9hl9Oj1pIcv9hlSmyORP8m', 'snippet': {'videoId': 'Bu2NJ-Medh0', 'textDisplay': 'Gente! Democracia não é o governo onde se faz o quê quer, isso é totalitarismo. Democracia é o POVO &quot;escolher/opinar/participar&quot; (através do voto). Se o poder emana do povo, esse &quot;poder&quot; se expressa através do voto; o eleito representa o povo e, este sim, propõe mudanças, adaptações e leis. Por isso se bate tanto na tecla de se ESCOLHER, VOTAR em políticos com propostas condizentes com aquilo que se quer/não quer (obrigatoriedade de voto é uma delas). Obrigatoriedade tem a ver com regras legais e vigentes, não com democracia.', 'textOriginal': 'Gente! Democracia não é o governo onde se faz o quê quer, isso é totalitarismo. Democracia é o POVO ""escolher/opinar/participar"" (através do voto). Se o poder emana do povo, esse ""poder"" se expressa através do voto; o eleito representa o povo e, este sim, propõe mudanças, adaptações e leis. Por isso se bate tanto na tecla de se ESCOLHER, VOTAR em políticos com propostas condizentes com aquilo que se quer/não quer (obrigatoriedade de voto é uma delas). Obrigatoriedade tem a ver com regras legais e vigentes, não com democracia.', 'parentId': 'UgyrZmHV8qMOKxDWPP94AaABAg', 'authorDisplayName': 'Maria Paula', 'authorProfileImageUrl': 'https://yt3.ggpht.com/ytc/AGIKgqMvV5N7-kIent80EkznfipNy0lxaXPwVFGHQWmiXA=s48-c-k-c0x00ffffff-no-rj', 'authorChannelUrl': 'http://www.youtube.com/channel/UCWqvLh00knMRpS-jNodhPhQ', 'authorChannelId': {'value': 'UCWqvLh00knMRpS-jNodhPhQ'}, 'canRate': True, 'viewerRating': 'none', 'likeCount': 1, 'publishedAt': '2022-10-29T11:34:20Z', 'updatedAt': '2022-10-29T11:39:38Z'}}]}",UC2ZsX3uEyaxZz1KKBroe6dg,2022-10-29T08:44:51Z,"Se o Brasil é um país democrático, então por que o voto é obrigatório?",,2023-06-08 13:41:08.073289
