kind,etag,id,snippet,replies,authorChannelId,publishedAt,textOriginal,nextPageToken,extraction_date
youtube#commentThread,aM2STxGJ009odrT9pzf0BZar-TU,UgyN0xMoUFr-ufernMR4AaABAg,"{'videoId': 'Bu2NJ-Medh0', 'topLevelComment': {'kind': 'youtube#comment', 'etag': '2C-CMBo94it2j_Nsl-tPdptai7U', 'id': 'UgyN0xMoUFr-ufernMR4AaABAg', 'snippet': {'videoId': 'Bu2NJ-Medh0', 'textDisplay': 'Estranho que o povo brasileiro não é muito sensibilizado pela situação da Amazônia enquanto é ele mesmo que vão sofrer o primeiro tanto com o agro negócio na agricultura que com as próprias vidas dele. Pena.', 'textOriginal': 'Estranho que o povo brasileiro não é muito sensibilizado pela situação da Amazônia enquanto é ele mesmo que vão sofrer o primeiro tanto com o agro negócio na agricultura que com as próprias vidas dele. Pena.', 'authorDisplayName': 'jean pierre Jodet', 'authorProfileImageUrl': 'https://yt3.ggpht.com/ytc/AGIKgqNeDJzYqtRZVZzQyNsP35SI6zMEEM8JWmTH46yUyYw=s48-c-k-c0x00ffffff-no-rj', 'authorChannelUrl': 'http://www.youtube.com/channel/UCoUbhw6Lc7oUfu9HlUbZFVw', 'authorChannelId': {'value': 'UCoUbhw6Lc7oUfu9HlUbZFVw'}, 'canRate': True, 'viewerRating': 'none', 'likeCount': 11, 'publishedAt': '2022-10-29T07:30:54Z', 'updatedAt': '2022-10-29T07:30:54Z'}}, 'canReply': True, 'totalReplyCount': 5, 'isPublic': True}","{'comments': [{'kind': 'youtube#comment', 'etag': 'Fre57BoVLmG1u6ltYUAdqTWqQLY', 'id': 'UgyN0xMoUFr-ufernMR4AaABAg.9hl0w55CDTv9htvhQnbhyx', 'snippet': {'videoId': 'Bu2NJ-Medh0', 'textDisplay': 'Verdade👏🏼', 'textOriginal': 'Verdade👏🏼', 'parentId': 'UgyN0xMoUFr-ufernMR4AaABAg', 'authorDisplayName': 'Estela Dantas', 'authorProfileImageUrl': 'https://yt3.ggpht.com/ytc/AGIKgqO0JwsTYh3y-fvtWGxQR4-bQalqxxH0I5_tMg=s48-c-k-c0x00ffffff-no-rj', 'authorChannelUrl': 'http://www.youtube.com/channel/UCU6Uo4yVelFD8IF38MtTWCQ', 'authorChannelId': {'value': 'UCU6Uo4yVelFD8IF38MtTWCQ'}, 'canRate': True, 'viewerRating': 'none', 'likeCount': 0, 'publishedAt': '2022-11-01T18:29:38Z', 'updatedAt': '2022-11-01T18:29:38Z'}}, {'kind': 'youtube#comment', 'etag': 'fc-GuIvD0tPFGkNHeLzhU6k_ZgY', 'id': 'UgyN0xMoUFr-ufernMR4AaABAg.9hl0w55CDTv9ho1cF2xVTP', 'snippet': {'videoId': 'Bu2NJ-Medh0', 'textDisplay': '@_ Nemo É bom né, assim vc se sente menos isolado...rsrs', 'textOriginal': '@_ Nemo É bom né, assim vc se sente menos isolado...rsrs', 'parentId': 'UgyN0xMoUFr-ufernMR4AaABAg', 'authorDisplayName': 'jean pierre Jodet', 'authorProfileImageUrl': 'https://yt3.ggpht.com/ytc/AGIKgqNeDJzYqtRZVZzQyNsP35SI6zMEEM8JWmTH46yUyYw=s48-c-k-c0x00ffffff-no-rj', 'authorChannelUrl': 'http://www.youtube.com/channel/UCoUbhw6Lc7oUfu9HlUbZFVw', 'authorChannelId': {'value': 'UCoUbhw6Lc7oUfu9HlUbZFVw'}, 'canRate': True, 'viewerRating': 'none', 'likeCount': 1, 'publishedAt': '2022-10-30T11:34:39Z', 'updatedAt': '2022-10-30T11:34:39Z'}}, {'kind': 'youtube#comment', 'etag': 'KUoOJ3Y9FJitY09b0bmArDsFohs', 'id': 'UgyN0xMoUFr-ufernMR4AaABAg.9hl0w55CDTv9ho1DKpb0yi', 'snippet': {'videoId': 'Bu2NJ-Medh0', 'textDisplay': 'De vez em quando até você consegue ser sensato e escolher as palavras de modo adequado, francês. Tá no caminho certo.', 'textOriginal': 'De vez em quando até você consegue ser sensato e escolher as palavras de modo adequado, francês. Tá no caminho certo.', 'parentId': 'UgyN0xMoUFr-ufernMR4AaABAg', 'authorDisplayName': '_ Nemo', 'authorProfileImageUrl': 'https://yt3.ggpht.com/YSD6affHObieY6lzZvmRaUQoPLR0JDwvG0psn4bJUIV0_rIdTv-t6g4JlPXqm6z4fIM98H_Rtwg=s48-c-k-c0x00ffffff-no-rj', 'authorChannelUrl': 'http://www.youtube.com/channel/UCWESyxp_FU1XkungCTjzbOg', 'authorChannelId': {'value': 'UCWESyxp_FU1XkungCTjzbOg'}, 'canRate': True, 'viewerRating': 'none', 'likeCount': 1, 'publishedAt': '2022-10-30T11:31:07Z', 'updatedAt': '2022-10-30T11:31:07Z'}}, {'kind': 'youtube#comment', 'etag': '15Sxt_PG8Glxta9szEJYr_4U6B8', 'id': 'UgyN0xMoUFr-ufernMR4AaABAg.9hl0w55CDTv9hmTJo28QBS', 'snippet': {'videoId': 'Bu2NJ-Medh0', 'textDisplay': '@Altas Teses , um pensamento muito simplista... nada mais longe que o nariz seu....rsrsrs.  Só ver o povo brasileiro para não querer essa Terra como colônia a não ser que ela seja devolvida pelos índios, legitimamente e ainda mais, únicos com cérebros.', 'textOriginal': '@Altas Teses , um pensamento muito simplista... nada mais longe que o nariz seu....rsrsrs.  Só ver o povo brasileiro para não querer essa Terra como colônia a não ser que ela seja devolvida pelos índios, legitimamente e ainda mais, únicos com cérebros.', 'parentId': 'UgyN0xMoUFr-ufernMR4AaABAg', 'authorDisplayName': 'jean pierre Jodet', 'authorProfileImageUrl': 'https://yt3.ggpht.com/ytc/AGIKgqNeDJzYqtRZVZzQyNsP35SI6zMEEM8JWmTH46yUyYw=s48-c-k-c0x00ffffff-no-rj', 'authorChannelUrl': 'http://www.youtube.com/channel/UCoUbhw6Lc7oUfu9HlUbZFVw', 'authorChannelId': {'value': 'UCoUbhw6Lc7oUfu9HlUbZFVw'}, 'canRate': True, 'viewerRating': 'none', 'likeCount': 1, 'publishedAt': '2022-10-29T20:58:11Z', 'updatedAt': '2022-10-29T21:00:57Z'}}, {'kind': 'youtube#comment', 'etag': 'VIR3yx5_Uo12U22RTOJvvEdRR4M', 'id': 'UgyN0xMoUFr-ufernMR4AaABAg.9hl0w55CDTv9hlymqTxuEy', 'snippet': {'videoId': 'Bu2NJ-Medh0', 'textDisplay': 'As outras regiões pensam na Amazônia e seus povos como colônia.', 'textOriginal': 'As outras regiões pensam na Amazônia e seus povos como colônia.', 'parentId': 'UgyN0xMoUFr-ufernMR4AaABAg', 'authorDisplayName': 'Altas Teses', 'authorProfileImageUrl': 'https://yt3.ggpht.com/I6ewFIgRRZq0qeVhdb7jZUThe9ihv47m_uF3GL6IgYc9iJ_TB6UyEjLHZaqHy3UCZsQ91I4obA=s48-c-k-c0x00ffffff-no-rj', 'authorChannelUrl': 'http://www.youtube.com/channel/UCzRMEint3WvtZFJkqGo3zEg', 'authorChannelId': {'value': 'UCzRMEint3WvtZFJkqGo3zEg'}, 'canRate': True, 'viewerRating': 'none', 'likeCount': 0, 'publishedAt': '2022-10-29T16:22:40Z', 'updatedAt': '2022-10-29T16:22:40Z'}}]}",UCoUbhw6Lc7oUfu9HlUbZFVw,2022-10-29T07:30:54Z,Estranho que o povo brasileiro não é muito sensibilizado pela situação da Amazônia enquanto é ele mesmo que vão sofrer o primeiro tanto com o agro negócio na agricultura que com as próprias vidas dele. Pena.,,2023-06-08 13:41:08.073289
youtube#commentThread,7KL-8DpT590G2PA2_XV70VY02gY,UgwdDTG2EsW95YBHyTh4AaABAg,"{'videoId': 'Bu2NJ-Medh0', 'topLevelComment': {'kind': 'youtube#comment', 'etag': '1Kvv1z_szxMMwA0PFDvkWuy338g', 'id': 'UgwdDTG2EsW95YBHyTh4AaABAg', 'snippet': {'videoId': 'Bu2NJ-Medh0', 'textDisplay': 'Se terminando enfim, o circo brasilo-primitivo da campanha eleitoral de 2022 que começou o dia da aquisição da nova equipe em janeiro 2019. Quase 4 anos sem muitas coisas fora das medidas eleitorais dos últimos meses. Desde esses últimos meses, deu para ver até hoje como as mentes trabalharam para tentar convencer tal ou tal candidato. Foi incrível o espírito criativo, muito criativo para esse circo eleitoral. Sem limites em energias, violências, palavras feias e atitudes da idade da Pedra. Seria bom pelo Brasil se esse espírito criativo existia para construir o País, mas é Brasil né, o jeitinho...rsrsrs', 'textOriginal': 'Se terminando enfim, o circo brasilo-primitivo da campanha eleitoral de 2022 que começou o dia da aquisição da nova equipe em janeiro 2019. Quase 4 anos sem muitas coisas fora das medidas eleitorais dos últimos meses. Desde esses últimos meses, deu para ver até hoje como as mentes trabalharam para tentar convencer tal ou tal candidato. Foi incrível o espírito criativo, muito criativo para esse circo eleitoral. Sem limites em energias, violências, palavras feias e atitudes da idade da Pedra. Seria bom pelo Brasil se esse espírito criativo existia para construir o País, mas é Brasil né, o jeitinho...rsrsrs', 'authorDisplayName': 'jean pierre Jodet', 'authorProfileImageUrl': 'https://yt3.ggpht.com/ytc/AGIKgqNeDJzYqtRZVZzQyNsP35SI6zMEEM8JWmTH46yUyYw=s48-c-k-c0x00ffffff-no-rj', 'authorChannelUrl': 'http://www.youtube.com/channel/UCoUbhw6Lc7oUfu9HlUbZFVw', 'authorChannelId': {'value': 'UCoUbhw6Lc7oUfu9HlUbZFVw'}, 'canRate': True, 'viewerRating': 'none', 'likeCount': 0, 'publishedAt': '2022-10-29T07:16:09Z', 'updatedAt': '2022-10-29T07:16:09Z'}}, 'canReply': True, 'totalReplyCount': 0, 'isPublic': True}",,UCoUbhw6Lc7oUfu9HlUbZFVw,2022-10-29T07:16:09Z,"Se terminando enfim, o circo brasilo-primitivo da campanha eleitoral de 2022 que começou o dia da aquisição da nova equipe em janeiro 2019. Quase 4 anos sem muitas coisas fora das medidas eleitorais dos últimos meses. Desde esses últimos meses, deu para ver até hoje como as mentes trabalharam para tentar convencer tal ou tal candidato. Foi incrível o espírito criativo, muito criativo para esse circo eleitoral. Sem limites em energias, violências, palavras feias e atitudes da idade da Pedra. Seria bom pelo Brasil se esse espírito criativo existia para construir o País, mas é Brasil né, o jeitinho...rsrsrs",,2023-06-08 13:41:08.073289
youtube#commentThread,8tw8jdbNbpJHWb-vcrWkx39UFSI,UgxndaJr9Vi5c_po9_p4AaABAg,"{'videoId': 'Bu2NJ-Medh0', 'topLevelComment': {'kind': 'youtube#comment', 'etag': '3X2jvNwSK3e8qtiHmwJdxKkuJb8', 'id': 'UgxndaJr9Vi5c_po9_p4AaABAg', 'snippet': {'videoId': 'Bu2NJ-Medh0', 'textDisplay': 'Além de não  conhecer São Paulo o Tarcísio candidato do genocida tenta obstruir as provas de um assassinato olha o político que os paulistas querem prá governador', 'textOriginal': 'Além de não  conhecer São Paulo o Tarcísio candidato do genocida tenta obstruir as provas de um assassinato olha o político que os paulistas querem prá governador', 'authorDisplayName': 'Renatosantosalmeidas Santos', 'authorProfileImageUrl': 'https://yt3.ggpht.com/ytc/AGIKgqOx1N36facHaVJAUy1ypTj1MsOiXvx79GB-AQ=s48-c-k-c0x00ffffff-no-rj', 'authorChannelUrl': 'http://www.youtube.com/channel/UCWZxO_VYVRTVcy77qO9HjvQ', 'authorChannelId': {'value': 'UCWZxO_VYVRTVcy77qO9HjvQ'}, 'canRate': True, 'viewerRating': 'none', 'likeCount': 1, 'publishedAt': '2022-10-29T05:42:55Z', 'updatedAt': '2022-10-29T05:42:55Z'}}, 'canReply': True, 'totalReplyCount': 0, 'isPublic': True}",,UCWZxO_VYVRTVcy77qO9HjvQ,2022-10-29T05:42:55Z,Além de não  conhecer São Paulo o Tarcísio candidato do genocida tenta obstruir as provas de um assassinato olha o político que os paulistas querem prá governador,,2023-06-08 13:41:08.073289
youtube#commentThread,DOUto749c2mXL7p_hp1SKprI4eA,UgzwE398RpR-y3q56At4AaABAg,"{'videoId': 'Bu2NJ-Medh0', 'topLevelComment': {'kind': 'youtube#comment', 'etag': 'gfYJ6MDpYO255YZkFTTSaW-5Qng', 'id': 'UgzwE398RpR-y3q56At4AaABAg', 'snippet': {'videoId': 'Bu2NJ-Medh0', 'textDisplay': 'Respeito pelas diferenças sempre', 'textOriginal': 'Respeito pelas diferenças sempre', 'authorDisplayName': 'Son.J Doug', 'authorProfileImageUrl': 'https://yt3.ggpht.com/ytc/AGIKgqOesR7g0xe8o_L2dkKPECUNvXd_J06moq5m69WdFsnw0Hmy9238U6zwKFNJLIDm=s48-c-k-c0x00ffffff-no-rj', 'authorChannelUrl': 'http://www.youtube.com/channel/UCFRqWytuHRG9aHuaIW-3rWA', 'authorChannelId': {'value': 'UCFRqWytuHRG9aHuaIW-3rWA'}, 'canRate': True, 'viewerRating': 'none', 'likeCount': 8, 'publishedAt': '2022-10-29T05:41:49Z', 'updatedAt': '2022-10-29T05:41:49Z'}}, 'canReply': True, 'totalReplyCount': 0, 'isPublic': True}",,UCFRqWytuHRG9aHuaIW-3rWA,2022-10-29T05:41:49Z,Respeito pelas diferenças sempre,,2023-06-08 13:41:08.073289
youtube#commentThread,ui2SodTWkMzS2a7khMV5lSxvJ54,Ugw9zPtWbDylVjZ3KEp4AaABAg,"{'videoId': 'Bu2NJ-Medh0', 'topLevelComment': {'kind': 'youtube#comment', 'etag': 'X8d3g2yYf1WHtZHtQOOP-Z1B2KQ', 'id': 'Ugw9zPtWbDylVjZ3KEp4AaABAg', 'snippet': {'videoId': 'Bu2NJ-Medh0', 'textDisplay': 'Teria que suspender os salários também', 'textOriginal': 'Teria que suspender os salários também', 'authorDisplayName': 'Renatosantosalmeidas Santos', 'authorProfileImageUrl': 'https://yt3.ggpht.com/ytc/AGIKgqOx1N36facHaVJAUy1ypTj1MsOiXvx79GB-AQ=s48-c-k-c0x00ffffff-no-rj', 'authorChannelUrl': 'http://www.youtube.com/channel/UCWZxO_VYVRTVcy77qO9HjvQ', 'authorChannelId': {'value': 'UCWZxO_VYVRTVcy77qO9HjvQ'}, 'canRate': True, 'viewerRating': 'none', 'likeCount': 0, 'publishedAt': '2022-10-29T05:26:22Z', 'updatedAt': '2022-10-29T05:26:22Z'}}, 'canReply': True, 'totalReplyCount': 0, 'isPublic': True}",,UCWZxO_VYVRTVcy77qO9HjvQ,2022-10-29T05:26:22Z,Teria que suspender os salários também,,2023-06-08 13:41:08.073289
youtube#commentThread,7Pv__J0VfXNBYJ9xiR-4h5pC78s,Ugx3bBWgU0HtZlR2ugN4AaABAg,"{'videoId': 'Bu2NJ-Medh0', 'topLevelComment': {'kind': 'youtube#comment', 'etag': '0i3r84aI0lircAGvf0hEDjExtkg', 'id': 'Ugx3bBWgU0HtZlR2ugN4AaABAg', 'snippet': {'videoId': 'Bu2NJ-Medh0', 'textDisplay': 'Alexandre Moraes de notório saber jurídico assumiu no momento certo o TSE', 'textOriginal': 'Alexandre Moraes de notório saber jurídico assumiu no momento certo o TSE', 'authorDisplayName': 'Renatosantosalmeidas Santos', 'authorProfileImageUrl': 'https://yt3.ggpht.com/ytc/AGIKgqOx1N36facHaVJAUy1ypTj1MsOiXvx79GB-AQ=s48-c-k-c0x00ffffff-no-rj', 'authorChannelUrl': 'http://www.youtube.com/channel/UCWZxO_VYVRTVcy77qO9HjvQ', 'authorChannelId': {'value': 'UCWZxO_VYVRTVcy77qO9HjvQ'}, 'canRate': True, 'viewerRating': 'none', 'likeCount': 7, 'publishedAt': '2022-10-29T05:25:18Z', 'updatedAt': '2022-10-29T05:25:18Z'}}, 'canReply': True, 'totalReplyCount': 3, 'isPublic': True}","{'comments': [{'kind': 'youtube#comment', 'etag': 'AanY98pbhwyHvpiv9qT-h_lVDC0', 'id': 'Ugx3bBWgU0HtZlR2ugN4AaABAg.9hknZAAPzn-9hn-LLolENU', 'snippet': {'videoId': 'Bu2NJ-Medh0', 'textDisplay': '@Edson O atua dentro da constituição e o devido processo legal o que muitos procura descumprir e tomar medidas anticonstitucionais', 'textOriginal': '@Edson O atua dentro da constituição e o devido processo legal o que muitos procura descumprir e tomar medidas anticonstitucionais', 'parentId': 'Ugx3bBWgU0HtZlR2ugN4AaABAg', 'authorDisplayName': 'Renatosantosalmeidas Santos', 'authorProfileImageUrl': 'https://yt3.ggpht.com/ytc/AGIKgqOx1N36facHaVJAUy1ypTj1MsOiXvx79GB-AQ=s48-c-k-c0x00ffffff-no-rj', 'authorChannelUrl': 'http://www.youtube.com/channel/UCWZxO_VYVRTVcy77qO9HjvQ', 'authorChannelId': {'value': 'UCWZxO_VYVRTVcy77qO9HjvQ'}, 'canRate': True, 'viewerRating': 'none', 'likeCount': 1, 'publishedAt': '2022-10-30T01:55:30Z', 'updatedAt': '2022-10-30T01:55:30Z'}}, {'kind': 'youtube#comment', 'etag': 'NLHYzrR6gqtqyBJyUu590ZeGI_k', 'id': 'Ugx3bBWgU0HtZlR2ugN4AaABAg.9hknZAAPzn-9hmuIE2J4db', 'snippet': {'videoId': 'Bu2NJ-Medh0', 'textDisplay': 'é um notório negociador de sentenças, em escritório com a esposa Vivi.', 'textOriginal': 'é um notório negociador de sentenças, em escritório com a esposa Vivi.', 'parentId': 'Ugx3bBWgU0HtZlR2ugN4AaABAg', 'authorDisplayName': 'Edson O', 'authorProfileImageUrl': 'https://yt3.ggpht.com/ytc/AGIKgqM17Cd4HfDaY8VCf8jq9AZMVgq1Ojbdx7-biA=s48-c-k-c0x00ffffff-no-rj', 'authorChannelUrl': 'http://www.youtube.com/channel/UCQQ9mWBp9RyhrRe7U0E677g', 'authorChannelId': {'value': 'UCQQ9mWBp9RyhrRe7U0E677g'}, 'canRate': True, 'viewerRating': 'none', 'likeCount': 0, 'publishedAt': '2022-10-30T01:02:38Z', 'updatedAt': '2022-10-30T01:02:38Z'}}, {'kind': 'youtube#comment', 'etag': 'QMx_zokeepMDBICROlMQbKopP8U', 'id': 'Ugx3bBWgU0HtZlR2ugN4AaABAg.9hknZAAPzn-9hlXluRk30f', 'snippet': {'videoId': 'Bu2NJ-Medh0', 'textDisplay': 'por isso o bolsominion tentou de tudo para impedir.', 'textOriginal': 'por isso o bolsominion tentou de tudo para impedir.', 'parentId': 'Ugx3bBWgU0HtZlR2ugN4AaABAg', 'authorDisplayName': 'Rose Teodoro', 'authorProfileImageUrl': 'https://yt3.ggpht.com/ytc/AGIKgqPTJNqpo0YXLqo5ULcW-3dVS655bq_mx709Ag=s48-c-k-c0x00ffffff-no-rj', 'authorChannelUrl': 'http://www.youtube.com/channel/UCTVgoF59zzTVwU_F4MoNZ1w', 'authorChannelId': {'value': 'UCTVgoF59zzTVwU_F4MoNZ1w'}, 'canRate': True, 'viewerRating': 'none', 'likeCount': 1, 'publishedAt': '2022-10-29T12:17:52Z', 'updatedAt': '2022-10-29T12:17:52Z'}}]}",UCWZxO_VYVRTVcy77qO9HjvQ,2022-10-29T05:25:18Z,Alexandre Moraes de notório saber jurídico assumiu no momento certo o TSE,,2023-06-08 13:41:08.073289
youtube#commentThread,ISBt38BhwnlvObqEL9Z9wj2gXzw,UgwFJPHM5lTyElVDrb14AaABAg,"{'videoId': 'Bu2NJ-Medh0', 'topLevelComment': {'kind': 'youtube#comment', 'etag': 'Exe3ooqnqGEMAZ5RwT8hB4n1WuU', 'id': 'UgwFJPHM5lTyElVDrb14AaABAg', 'snippet': {'videoId': 'Bu2NJ-Medh0', 'textDisplay': 'O desumano monstro mau caráter ainda conseguiu enganar alguns com o auxílio e o consignado para tornar mais miserável a população de nenhuma renda', 'textOriginal': 'O desumano monstro mau caráter ainda conseguiu enganar alguns com o auxílio e o consignado para tornar mais miserável a população de nenhuma renda', 'authorDisplayName': 'Renatosantosalmeidas Santos', 'authorProfileImageUrl': 'https://yt3.ggpht.com/ytc/AGIKgqOx1N36facHaVJAUy1ypTj1MsOiXvx79GB-AQ=s48-c-k-c0x00ffffff-no-rj', 'authorChannelUrl': 'http://www.youtube.com/channel/UCWZxO_VYVRTVcy77qO9HjvQ', 'authorChannelId': {'value': 'UCWZxO_VYVRTVcy77qO9HjvQ'}, 'canRate': True, 'viewerRating': 'none', 'likeCount': 0, 'publishedAt': '2022-10-29T05:06:21Z', 'updatedAt': '2022-10-29T05:06:54Z'}}, 'canReply': True, 'totalReplyCount': 0, 'isPublic': True}",,UCWZxO_VYVRTVcy77qO9HjvQ,2022-10-29T05:06:21Z,O desumano monstro mau caráter ainda conseguiu enganar alguns com o auxílio e o consignado para tornar mais miserável a população de nenhuma renda,,2023-06-08 13:41:08.073289
youtube#commentThread,J1z2NKmjmezZEdhMT7c_YNGxc5I,UgyCowupPKY9Tu_3blF4AaABAg,"{'videoId': 'Bu2NJ-Medh0', 'topLevelComment': {'kind': 'youtube#comment', 'etag': '3ycNRAD3f1Dnyt5G_vnZ3EsQrgg', 'id': 'UgyCowupPKY9Tu_3blF4AaABAg', 'snippet': {'videoId': 'Bu2NJ-Medh0', 'textDisplay': 'Como é que investiga algo ou prova que não existe está ficando difícil entender', 'textOriginal': 'Como é que investiga algo ou prova que não existe está ficando difícil entender', 'authorDisplayName': 'Renatosantosalmeidas Santos', 'authorProfileImageUrl': 'https://yt3.ggpht.com/ytc/AGIKgqOx1N36facHaVJAUy1ypTj1MsOiXvx79GB-AQ=s48-c-k-c0x00ffffff-no-rj', 'authorChannelUrl': 'http://www.youtube.com/channel/UCWZxO_VYVRTVcy77qO9HjvQ', 'authorChannelId': {'value': 'UCWZxO_VYVRTVcy77qO9HjvQ'}, 'canRate': True, 'viewerRating': 'none', 'likeCount': 1, 'publishedAt': '2022-10-29T05:01:20Z', 'updatedAt': '2022-10-29T05:01:20Z'}}, 'canReply': True, 'totalReplyCount': 1, 'isPublic': True}","{'comments': [{'kind': 'youtube#comment', 'etag': 'PykG9wIfa3aqYn7-zgMsak9LOXk', 'id': 'UgyCowupPKY9Tu_3blF4AaABAg.9hkkoYRuXnz9hmDJk7l4pE', 'snippet': {'videoId': 'Bu2NJ-Medh0', 'textDisplay': '?!', 'textOriginal': '?!', 'parentId': 'UgyCowupPKY9Tu_3blF4AaABAg', 'authorDisplayName': 'Sidalia Rino', 'authorProfileImageUrl': 'https://yt3.ggpht.com/ytc/AGIKgqMuZ8HCMxX2RZXieAQwTqe9y2DzFl7W9Qtg1w=s48-c-k-c0x00ffffff-no-rj', 'authorChannelUrl': 'http://www.youtube.com/channel/UC64YR8Fah4np81oCWgZ9K0w', 'authorChannelId': {'value': 'UC64YR8Fah4np81oCWgZ9K0w'}, 'canRate': True, 'viewerRating': 'none', 'likeCount': 0, 'publishedAt': '2022-10-29T18:38:22Z', 'updatedAt': '2022-10-29T18:38:22Z'}}]}",UCWZxO_VYVRTVcy77qO9HjvQ,2022-10-29T05:01:20Z,Como é que investiga algo ou prova que não existe está ficando difícil entender,,2023-06-08 13:41:08.073289
youtube#commentThread,-kLKZf3KeSWh5NFJZ_8U7b6w90M,Ugylxx6XSYTJH0Wa-P54AaABAg,"{'videoId': 'Bu2NJ-Medh0', 'topLevelComment': {'kind': 'youtube#comment', 'etag': 'QTlubB-rp16CowWeMAdOv_MQLrY', 'id': 'Ugylxx6XSYTJH0Wa-P54AaABAg', 'snippet': {'videoId': 'Bu2NJ-Medh0', 'textDisplay': 'Pergunta de quem não conhece ou é ignorante o TSE não fiscaliza um leigo sabe', 'textOriginal': 'Pergunta de quem não conhece ou é ignorante o TSE não fiscaliza um leigo sabe', 'authorDisplayName': 'Renatosantosalmeidas Santos', 'authorProfileImageUrl': 'https://yt3.ggpht.com/ytc/AGIKgqOx1N36facHaVJAUy1ypTj1MsOiXvx79GB-AQ=s48-c-k-c0x00ffffff-no-rj', 'authorChannelUrl': 'http://www.youtube.com/channel/UCWZxO_VYVRTVcy77qO9HjvQ', 'authorChannelId': {'value': 'UCWZxO_VYVRTVcy77qO9HjvQ'}, 'canRate': True, 'viewerRating': 'none', 'likeCount': 2, 'publishedAt': '2022-10-29T04:58:28Z', 'updatedAt': '2022-10-29T04:58:28Z'}}, 'canReply': True, 'totalReplyCount': 0, 'isPublic': True}",,UCWZxO_VYVRTVcy77qO9HjvQ,2022-10-29T04:58:28Z,Pergunta de quem não conhece ou é ignorante o TSE não fiscaliza um leigo sabe,,2023-06-08 13:41:08.073289
youtube#commentThread,-HYzsT3BQPltSCB2lOIwdkyjM5U,UgxbyaqVgmrEX0KqTjV4AaABAg,"{'videoId': 'Bu2NJ-Medh0', 'topLevelComment': {'kind': 'youtube#comment', 'etag': '1gAFda58TJKdISS-e3DJEwWM7Dw', 'id': 'UgxbyaqVgmrEX0KqTjV4AaABAg', 'snippet': {'videoId': 'Bu2NJ-Medh0', 'textDisplay': 'Arrependido não covarde quando sair do desgoverno do monstro desumano terá que responder criminalmente', 'textOriginal': 'Arrependido não covarde quando sair do desgoverno do monstro desumano terá que responder criminalmente', 'authorDisplayName': 'Renatosantosalmeidas Santos', 'authorProfileImageUrl': 'https://yt3.ggpht.com/ytc/AGIKgqOx1N36facHaVJAUy1ypTj1MsOiXvx79GB-AQ=s48-c-k-c0x00ffffff-no-rj', 'authorChannelUrl': 'http://www.youtube.com/channel/UCWZxO_VYVRTVcy77qO9HjvQ', 'authorChannelId': {'value': 'UCWZxO_VYVRTVcy77qO9HjvQ'}, 'canRate': True, 'viewerRating': 'none', 'likeCount': 5, 'publishedAt': '2022-10-29T04:54:29Z', 'updatedAt': '2022-10-29T04:54:29Z'}}, 'canReply': True, 'totalReplyCount': 0, 'isPublic': True}",,UCWZxO_VYVRTVcy77qO9HjvQ,2022-10-29T04:54:29Z,Arrependido não covarde quando sair do desgoverno do monstro desumano terá que responder criminalmente,,2023-06-08 13:41:08.073289
youtube#commentThread,hzEKh074pTxNwg5k55TqwWinAS0,UgzVXFEwKWLaTKbPk1l4AaABAg,"{'videoId': 'Bu2NJ-Medh0', 'topLevelComment': {'kind': 'youtube#comment', 'etag': 'UQQmizQDJWIiPo2GsUd8-FL5Fpg', 'id': 'UgzVXFEwKWLaTKbPk1l4AaABAg', 'snippet': {'videoId': 'Bu2NJ-Medh0', 'textDisplay': 'que vergonha a militancia desse jornal , censurando comentários,', 'textOriginal': 'que vergonha a militancia desse jornal , censurando comentários,', 'authorDisplayName': 'Edson O', 'authorProfileImageUrl': 'https://yt3.ggpht.com/ytc/AGIKgqM17Cd4HfDaY8VCf8jq9AZMVgq1Ojbdx7-biA=s48-c-k-c0x00ffffff-no-rj', 'authorChannelUrl': 'http://www.youtube.com/channel/UCQQ9mWBp9RyhrRe7U0E677g', 'authorChannelId': {'value': 'UCQQ9mWBp9RyhrRe7U0E677g'}, 'canRate': True, 'viewerRating': 'none', 'likeCount': 0, 'publishedAt': '2022-10-29T04:08:22Z', 'updatedAt': '2022-10-29T04:08:22Z'}}, 'canReply': True, 'totalReplyCount': 0, 'isPublic': True}",,UCQQ9mWBp9RyhrRe7U0E677g,2022-10-29T04:08:22Z,"que vergonha a militancia desse jornal , censurando comentários,",,2023-06-08 13:41:08.073289
youtube#commentThread,wNwc-5hkBU9BRhhxTynhE1WV-Co,UgymHX0BcFg4mbh8_2t4AaABAg,"{'videoId': 'Bu2NJ-Medh0', 'topLevelComment': {'kind': 'youtube#comment', 'etag': 'uniCsbWt2ZgYoYgIZ2Ipl9hupHs', 'id': 'UgymHX0BcFg4mbh8_2t4AaABAg', 'snippet': {'videoId': 'Bu2NJ-Medh0', 'textDisplay': 'Lula lá Brilha uma 🌠🌠🌠🌠🌠Sem medo de ser Feliz🌠🌠🌠🌠🌠', 'textOriginal': 'Lula lá Brilha uma 🌠🌠🌠🌠🌠Sem medo de ser Feliz🌠🌠🌠🌠🌠', 'authorDisplayName': 'Guta Costa', 'authorProfileImageUrl': 'https://yt3.ggpht.com/ytc/AGIKgqN9Oe06L5jT3-f8GxLLVUhQ63ZHSBxU0s8ciA=s48-c-k-c0x00ffffff-no-rj', 'authorChannelUrl': 'http://www.youtube.com/channel/UCFnPh7Re5ZyAYvxl1OC5fRQ', 'authorChannelId': {'value': 'UCFnPh7Re5ZyAYvxl1OC5fRQ'}, 'canRate': True, 'viewerRating': 'none', 'likeCount': 3, 'publishedAt': '2022-10-29T03:34:49Z', 'updatedAt': '2022-10-29T03:34:49Z'}}, 'canReply': True, 'totalReplyCount': 0, 'isPublic': True}",,UCFnPh7Re5ZyAYvxl1OC5fRQ,2022-10-29T03:34:49Z,Lula lá Brilha uma 🌠🌠🌠🌠🌠Sem medo de ser Feliz🌠🌠🌠🌠🌠,,2023-06-08 13:41:08.073289
youtube#commentThread,RAP5fVhJ-oyAeCYfoWHPx8IZmSM,UgxFhhJnIDzlYdVUNeZ4AaABAg,"{'videoId': 'Bu2NJ-Medh0', 'topLevelComment': {'kind': 'youtube#comment', 'etag': '4l6T6oTFYyLtbLw1XWItjOVvsGQ', 'id': 'UgxFhhJnIDzlYdVUNeZ4AaABAg', 'snippet': {'videoId': 'Bu2NJ-Medh0', 'textDisplay': 'CANALHICE, vocês compararem, a VIOLÊNCIA bolsomarista, com outra qualquer!<br>Pura CANALHICE!!', 'textOriginal': 'CANALHICE, vocês compararem, a VIOLÊNCIA bolsomarista, com outra qualquer!\\nPura CANALHICE!!', 'authorDisplayName': 'antonio rainha', 'authorProfileImageUrl': 'https://yt3.ggpht.com/ytc/AGIKgqPRc1intjUpOJ-4MCaKXdj0BFYMYZMaUyFypg=s48-c-k-c0x00ffffff-no-rj', 'authorChannelUrl': 'http://www.youtube.com/channel/UCrfaJDU2OV_Bg9R-nWtlndA', 'authorChannelId': {'value': 'UCrfaJDU2OV_Bg9R-nWtlndA'}, 'canRate': True, 'viewerRating': 'none', 'likeCount': 0, 'publishedAt': '2022-10-29T01:30:13Z', 'updatedAt': '2022-10-29T01:30:13Z'}}, 'canReply': True, 'totalReplyCount': 0, 'isPublic': True}",,UCrfaJDU2OV_Bg9R-nWtlndA,2022-10-29T01:30:13Z,"CANALHICE, vocês compararem, a VIOLÊNCIA bolsomarista, com outra qualquer!
Pura CANALHICE!!",,2023-06-08 13:41:08.073289
