kind,etag,id,snippet,replies,authorChannelId,publishedAt,textOriginal,nextPageToken,extraction_date
youtube#commentThread,QvfzEM_ZKweKTZurBygA4b4l-xQ,UgwoRmtlbT3xDK7becZ4AaABAg,"{'videoId': 'rT0IsCyepg4', 'topLevelComment': {'kind': 'youtube#comment', 'etag': 'NdjrCaqh17NDyALrXNsARu8T1Ss', 'id': 'UgwoRmtlbT3xDK7becZ4AaABAg', 'snippet': {'videoId': 'rT0IsCyepg4', 'textDisplay': 'É sempre assim! Vira e mexe os políticos fazem os eleitores de otários.', 'textOriginal': 'É sempre assim! Vira e mexe os políticos fazem os eleitores de otários.', 'authorDisplayName': 'Rafael', 'authorProfileImageUrl': 'https://yt3.ggpht.com/ytc/AGIKgqNo7mhk8JBVBNp1k84SF4umQEFXZb5r9_7tXnn1dnDQAMr962GFF9W1hqeuKUt0=s48-c-k-c0x00ffffff-no-rj', 'authorChannelUrl': 'http://www.youtube.com/channel/UCNEozvVpta-PyhZBNgR_99Q', 'authorChannelId': {'value': 'UCNEozvVpta-PyhZBNgR_99Q'}, 'canRate': True, 'viewerRating': 'none', 'likeCount': 5, 'publishedAt': '2022-10-04T19:22:45Z', 'updatedAt': '2022-10-04T19:22:45Z'}}, 'canReply': True, 'totalReplyCount': 0, 'isPublic': True}",,UCNEozvVpta-PyhZBNgR_99Q,2022-10-04T19:22:45Z,É sempre assim! Vira e mexe os políticos fazem os eleitores de otários.,QURTSl9pMVNQUlQ5RExaeEk5MER3NkJFZE0xRzl4Mkg4Zng3Q2pVNXMwVVdHdVlfV2dTVFpDRnlIUWNhVmJVd3BEX19WWG1WZnR0X3NfUQ==,2023-06-09 05:18:29.874674
youtube#commentThread,tLUh6g9cbFx0GObzH7fgTgZkxaU,UgxsxANxbetTFBnDZ-Z4AaABAg,"{'videoId': 'rT0IsCyepg4', 'topLevelComment': {'kind': 'youtube#comment', 'etag': 'YYC0RUOLO5yAU80llkQk5wdGlp8', 'id': 'UgxsxANxbetTFBnDZ-Z4AaABAg', 'snippet': {'videoId': 'rT0IsCyepg4', 'textDisplay': 'O Moro apenas mostrou que está a venda sim.', 'textOriginal': 'O Moro apenas mostrou que está a venda sim.', 'authorDisplayName': 'Darli Wienke', 'authorProfileImageUrl': 'https://yt3.ggpht.com/ytc/AGIKgqOIRogV5GC3fYXfiqvQtl3SCAy4G7TF8ZKiYQ=s48-c-k-c0x00ffffff-no-rj', 'authorChannelUrl': 'http://www.youtube.com/channel/UCOfZ1RNZCRqF0l1_-FHlSDw', 'authorChannelId': {'value': 'UCOfZ1RNZCRqF0l1_-FHlSDw'}, 'canRate': True, 'viewerRating': 'none', 'likeCount': 0, 'publishedAt': '2022-10-04T19:20:41Z', 'updatedAt': '2022-10-04T19:20:41Z'}}, 'canReply': True, 'totalReplyCount': 0, 'isPublic': True}",,UCOfZ1RNZCRqF0l1_-FHlSDw,2022-10-04T19:20:41Z,O Moro apenas mostrou que está a venda sim.,QURTSl9pMVNQUlQ5RExaeEk5MER3NkJFZE0xRzl4Mkg4Zng3Q2pVNXMwVVdHdVlfV2dTVFpDRnlIUWNhVmJVd3BEX19WWG1WZnR0X3NfUQ==,2023-06-09 05:18:29.874674
youtube#commentThread,HoUvX2gVQ49fNkY1Gff10vNPDgA,UgwwG_9uYTkfeKWD1ZV4AaABAg,"{'videoId': 'rT0IsCyepg4', 'topLevelComment': {'kind': 'youtube#comment', 'etag': 'SDR9xZ_8pzcBCOWJRkimOv0BgNs', 'id': 'UgwwG_9uYTkfeKWD1ZV4AaABAg', 'snippet': {'videoId': 'rT0IsCyepg4', 'textDisplay': 'A humildade vai adiante da honra vai firme capitão 🇧🇷🇧🇷🤝🤝2️⃣2️⃣', 'textOriginal': 'A humildade vai adiante da honra vai firme capitão 🇧🇷🇧🇷🤝🤝2️⃣2️⃣', 'authorDisplayName': 'Isaias Moreira dias', 'authorProfileImageUrl': 'https://yt3.ggpht.com/ytc/AGIKgqPtULbWwasRwk3JtVmGFjZoGe6uDd3G4ebKwg=s48-c-k-c0x00ffffff-no-rj', 'authorChannelUrl': 'http://www.youtube.com/channel/UCP2IHuf2KN0wTZDDXa_Ny-w', 'authorChannelId': {'value': 'UCP2IHuf2KN0wTZDDXa_Ny-w'}, 'canRate': True, 'viewerRating': 'none', 'likeCount': 9, 'publishedAt': '2022-10-04T19:20:13Z', 'updatedAt': '2022-10-04T19:20:13Z'}}, 'canReply': True, 'totalReplyCount': 0, 'isPublic': True}",,UCP2IHuf2KN0wTZDDXa_Ny-w,2022-10-04T19:20:13Z,A humildade vai adiante da honra vai firme capitão 🇧🇷🇧🇷🤝🤝2️⃣2️⃣,QURTSl9pMVNQUlQ5RExaeEk5MER3NkJFZE0xRzl4Mkg4Zng3Q2pVNXMwVVdHdVlfV2dTVFpDRnlIUWNhVmJVd3BEX19WWG1WZnR0X3NfUQ==,2023-06-09 05:18:29.874674
youtube#commentThread,8q4LPk52EOMxYfQItFMZXeB4hQg,UgxTq1H7CNAGWACn7cR4AaABAg,"{'videoId': 'rT0IsCyepg4', 'topLevelComment': {'kind': 'youtube#comment', 'etag': '61F5t24AT0OK7N7WRd2Ynz28WOM', 'id': 'UgxTq1H7CNAGWACn7cR4AaABAg', 'snippet': {'videoId': 'rT0IsCyepg4', 'textDisplay': 'Dois PICARETAS que fingiram ser inimigos.', 'textOriginal': 'Dois PICARETAS que fingiram ser inimigos.', 'authorDisplayName': 'Valmor Luiz Delai', 'authorProfileImageUrl': 'https://yt3.ggpht.com/ytc/AGIKgqNGRGtQ2dPB6RSNNO-YF-WLnoc2PCy9NS9hEw=s48-c-k-c0x00ffffff-no-rj', 'authorChannelUrl': 'http://www.youtube.com/channel/UCfgA0k-7p1oDJI_7vYnM6pA', 'authorChannelId': {'value': 'UCfgA0k-7p1oDJI_7vYnM6pA'}, 'canRate': True, 'viewerRating': 'none', 'likeCount': 0, 'publishedAt': '2022-10-04T19:20:03Z', 'updatedAt': '2022-10-04T19:20:03Z'}}, 'canReply': True, 'totalReplyCount': 0, 'isPublic': True}",,UCfgA0k-7p1oDJI_7vYnM6pA,2022-10-04T19:20:03Z,Dois PICARETAS que fingiram ser inimigos.,QURTSl9pMVNQUlQ5RExaeEk5MER3NkJFZE0xRzl4Mkg4Zng3Q2pVNXMwVVdHdVlfV2dTVFpDRnlIUWNhVmJVd3BEX19WWG1WZnR0X3NfUQ==,2023-06-09 05:18:29.874674
youtube#commentThread,R2_m8ekx9x6N7zz8-1PC_bd5Oto,UgxIBZeTzdf6dVXjvL94AaABAg,"{'videoId': 'rT0IsCyepg4', 'topLevelComment': {'kind': 'youtube#comment', 'etag': '4PJcKDIlB0kSYSODbv-HAEdYWmc', 'id': 'UgxIBZeTzdf6dVXjvL94AaABAg', 'snippet': {'videoId': 'rT0IsCyepg4', 'textDisplay': 'É tão raro o Bolsonaro ter alguma humildade que até assusta. Não gosto do Bolsonaro, mas o Lula voltar a presidência é um tapa na cara de todos nós que lutamos nas ruas contra a corrupção', 'textOriginal': 'É tão raro o Bolsonaro ter alguma humildade que até assusta. Não gosto do Bolsonaro, mas o Lula voltar a presidência é um tapa na cara de todos nós que lutamos nas ruas contra a corrupção', 'authorDisplayName': 'Marcela Medina', 'authorProfileImageUrl': 'https://yt3.ggpht.com/ytc/AGIKgqMpnLYexwiaveEhV3aJOmL5wUUW3X4oxEfZpPtp4w=s48-c-k-c0x00ffffff-no-rj', 'authorChannelUrl': 'http://www.youtube.com/channel/UCZCRWvCsVr1cigo5MonRCPA', 'authorChannelId': {'value': 'UCZCRWvCsVr1cigo5MonRCPA'}, 'canRate': True, 'viewerRating': 'none', 'likeCount': 9, 'publishedAt': '2022-10-04T19:19:28Z', 'updatedAt': '2022-10-04T19:19:28Z'}}, 'canReply': True, 'totalReplyCount': 8, 'isPublic': True}","{'comments': [{'kind': 'youtube#comment', 'etag': 'DgOCCFuQV-8OgI4MiGGhT1iwyts', 'id': 'UgxIBZeTzdf6dVXjvL94AaABAg.9glv8qzzoau9gnuuMI84vS', 'snippet': {'videoId': 'rT0IsCyepg4', 'textDisplay': '@Marcela Medina kkkk minion fingindo que não vota no bozo é patético', 'textOriginal': '@Marcela Medina kkkk minion fingindo que não vota no bozo é patético', 'parentId': 'UgxIBZeTzdf6dVXjvL94AaABAg', 'authorDisplayName': 'comedor de trader de elite', 'authorProfileImageUrl': 'https://yt3.ggpht.com/ytc/AGIKgqO5_1ovuh0WbLGaDkZI7QT9pDy9H21AsG1UJA=s48-c-k-c0x00ffffff-no-rj', 'authorChannelUrl': 'http://www.youtube.com/channel/UCEWad6o3jDSrNrrjOaq1bbA', 'authorChannelId': {'value': 'UCEWad6o3jDSrNrrjOaq1bbA'}, 'canRate': True, 'viewerRating': 'none', 'likeCount': 0, 'publishedAt': '2022-10-05T13:55:50Z', 'updatedAt': '2022-10-05T13:55:50Z'}}, {'kind': 'youtube#comment', 'etag': 'MdVLHBVwqn7IyjdfaVF6b4EPHcE', 'id': 'UgxIBZeTzdf6dVXjvL94AaABAg.9glv8qzzoau9gmDUxwhsIW', 'snippet': {'videoId': 'rT0IsCyepg4', 'textDisplay': '\\u200b@Arthur Nobrega Qual deus ele defende? o que condena estatua de pedra ou a própria virgem maria?Qual liberdade ? a de imprensa que ele ataca? qual familia ele defende? as puras ou aquelas adulteras constituídas por membros de segundo ou terceiro casamento  ?', 'textOriginal': '\\u200b@Arthur Nobrega Qual deus ele defende? o que condena estatua de pedra ou a própria virgem maria?Qual liberdade ? a de imprensa que ele ataca? qual familia ele defende? as puras ou aquelas adulteras constituídas por membros de segundo ou terceiro casamento  ?', 'parentId': 'UgxIBZeTzdf6dVXjvL94AaABAg', 'authorDisplayName': 'ENGENHE', 'authorProfileImageUrl': 'https://yt3.ggpht.com/4sUqsxd_cc1tovRYylhACZPqiUew1SMqcb-rLGY7VKRvfb5wBtib_04GHCq_-lPy7Ci6r5JG=s48-c-k-c0x00ffffff-no-rj', 'authorChannelUrl': 'http://www.youtube.com/channel/UCS9OYgIReAxJQKNBWh5Msrw', 'authorChannelId': {'value': 'UCS9OYgIReAxJQKNBWh5Msrw'}, 'canRate': True, 'viewerRating': 'none', 'likeCount': 0, 'publishedAt': '2022-10-04T22:08:30Z', 'updatedAt': '2022-10-04T22:08:30Z'}}, {'kind': 'youtube#comment', 'etag': 'ZtTA_YGtpWFVucdznpEpRUfwdGg', 'id': 'UgxIBZeTzdf6dVXjvL94AaABAg.9glv8qzzoau9gm7xzmKQ2l', 'snippet': {'videoId': 'rT0IsCyepg4', 'textDisplay': 'Agora é hora do povo fazer política tmb!!! Deixemos o gostar da &quot;pessoa&quot; de lado e vamos unir forças pelo Brasil, analisemos as pautas de esquerda e direita ...Depois reveja seus valores , princípios e vote consciente e não anule seu direito...não sejam covardes! Agora é a hora da Decisão.Por um Brasil Melhor, sem a vergonha de ter um representante EX CONDENADO,  E VOTEMOS 22 🇧🇷🇧🇷🇧🇷', 'textOriginal': 'Agora é hora do povo fazer política tmb!!! Deixemos o gostar da ""pessoa"" de lado e vamos unir forças pelo Brasil, analisemos as pautas de esquerda e direita ...Depois reveja seus valores , princípios e vote consciente e não anule seu direito...não sejam covardes! Agora é a hora da Decisão.Por um Brasil Melhor, sem a vergonha de ter um representante EX CONDENADO,  E VOTEMOS 22 🇧🇷🇧🇷🇧🇷', 'parentId': 'UgxIBZeTzdf6dVXjvL94AaABAg', 'authorDisplayName': 'siderath', 'authorProfileImageUrl': 'https://yt3.ggpht.com/ytc/AGIKgqPmb0wJmom689iALcxuYdlZak-BE2LW23jl5NODAQFlex9A6bt92FKM6B0fHlAo=s48-c-k-c0x00ffffff-no-rj', 'authorChannelUrl': 'http://www.youtube.com/channel/UCx4Rd-_HOcwUrnHg55pvREA', 'authorChannelId': {'value': 'UCx4Rd-_HOcwUrnHg55pvREA'}, 'canRate': True, 'viewerRating': 'none', 'likeCount': 0, 'publishedAt': '2022-10-04T21:20:11Z', 'updatedAt': '2022-10-04T21:20:11Z'}}, {'kind': 'youtube#comment', 'etag': 'xlOjEMAsQnBrXb0CWi6xRPaNzZ8', 'id': 'UgxIBZeTzdf6dVXjvL94AaABAg.9glv8qzzoau9glxtgLUlsq', 'snippet': {'videoId': 'rT0IsCyepg4', 'textDisplay': 'Não é questão de gostar do presidente e apoia o que ele defende  Deus família pátria e liberdade para o bem de todos  os brasileiros 22 bolsonaro', 'textOriginal': 'Não é questão de gostar do presidente e apoia o que ele defende  Deus família pátria e liberdade para o bem de todos  os brasileiros 22 bolsonaro', 'parentId': 'UgxIBZeTzdf6dVXjvL94AaABAg', 'authorDisplayName': 'Arthur Nobrega', 'authorProfileImageUrl': 'https://yt3.ggpht.com/X-PZLPyySQtQupst8lf5-mF1OK4KuoI8C7H4NnWwLdZs-XvG_8O6j4H6rBohjq30icOsndmjZCc=s48-c-k-c0x00ffffff-no-rj', 'authorChannelUrl': 'http://www.youtube.com/channel/UCrItA3fKDCElaRcsqwzugfg', 'authorChannelId': {'value': 'UCrItA3fKDCElaRcsqwzugfg'}, 'canRate': True, 'viewerRating': 'none', 'likeCount': 3, 'publishedAt': '2022-10-04T19:43:28Z', 'updatedAt': '2022-10-04T19:43:28Z'}}, {'kind': 'youtube#comment', 'etag': 'Bn7RkIpDGfCyciLsCCtBRG8JPsg', 'id': 'UgxIBZeTzdf6dVXjvL94AaABAg.9glv8qzzoau9glxTZhmH4K', 'snippet': {'videoId': 'rT0IsCyepg4', 'textDisplay': 'Quem é o corrupto que o Brasil e  o  mundo sabe é lulacorupçao,e você não gostar do Bolsonaro um homem humilde que é contra a criminalidade ideologia de gêneros,abortos legalização das drogas,e votar no pt o partido mais corrupto da humanidade isso é o que todo o mundo sabe, voto em Bolsonaro 22', 'textOriginal': 'Quem é o corrupto que o Brasil e  o  mundo sabe é lulacorupçao,e você não gostar do Bolsonaro um homem humilde que é contra a criminalidade ideologia de gêneros,abortos legalização das drogas,e votar no pt o partido mais corrupto da humanidade isso é o que todo o mundo sabe, voto em Bolsonaro 22', 'parentId': 'UgxIBZeTzdf6dVXjvL94AaABAg', 'authorDisplayName': 'Arthur Nobrega', 'authorProfileImageUrl': 'https://yt3.ggpht.com/X-PZLPyySQtQupst8lf5-mF1OK4KuoI8C7H4NnWwLdZs-XvG_8O6j4H6rBohjq30icOsndmjZCc=s48-c-k-c0x00ffffff-no-rj', 'authorChannelUrl': 'http://www.youtube.com/channel/UCrItA3fKDCElaRcsqwzugfg', 'authorChannelId': {'value': 'UCrItA3fKDCElaRcsqwzugfg'}, 'canRate': True, 'viewerRating': 'none', 'likeCount': 0, 'publishedAt': '2022-10-04T19:39:46Z', 'updatedAt': '2022-10-04T19:39:46Z'}}]}",UCZCRWvCsVr1cigo5MonRCPA,2022-10-04T19:19:28Z,"É tão raro o Bolsonaro ter alguma humildade que até assusta. Não gosto do Bolsonaro, mas o Lula voltar a presidência é um tapa na cara de todos nós que lutamos nas ruas contra a corrupção",QURTSl9pMVNQUlQ5RExaeEk5MER3NkJFZE0xRzl4Mkg4Zng3Q2pVNXMwVVdHdVlfV2dTVFpDRnlIUWNhVmJVd3BEX19WWG1WZnR0X3NfUQ==,2023-06-09 05:18:29.874674
youtube#commentThread,AGLMoFyoYgtCZ1MlTAhSm6wF5eM,UgzFxRr-wgxrdqPq-214AaABAg,"{'videoId': 'rT0IsCyepg4', 'topLevelComment': {'kind': 'youtube#comment', 'etag': 'CTcUCkaNLqUvv4UfHzURYndgT4A', 'id': 'UgzFxRr-wgxrdqPq-214AaABAg', 'snippet': {'videoId': 'rT0IsCyepg4', 'textDisplay': 'É por essas e outras que a maioria do povo brasileiro está com o saco cheio dessa politicagem suja.', 'textOriginal': 'É por essas e outras que a maioria do povo brasileiro está com o saco cheio dessa politicagem suja.', 'authorDisplayName': 'Claudinei Guerra', 'authorProfileImageUrl': 'https://yt3.ggpht.com/ytc/AGIKgqMzOsvK_vnBgp84k8VUf-03jvbQWQ7YnqWEIw=s48-c-k-c0x00ffffff-no-rj', 'authorChannelUrl': 'http://www.youtube.com/channel/UC3894Cd1LP2uIgTV5bNPnFQ', 'authorChannelId': {'value': 'UC3894Cd1LP2uIgTV5bNPnFQ'}, 'canRate': True, 'viewerRating': 'none', 'likeCount': 71, 'publishedAt': '2022-10-04T19:19:22Z', 'updatedAt': '2022-10-04T19:19:22Z'}}, 'canReply': True, 'totalReplyCount': 12, 'isPublic': True}","{'comments': [{'kind': 'youtube#comment', 'etag': '1uBo-Ml8r82U-o9pQKZwBZH76xE', 'id': 'UgzFxRr-wgxrdqPq-214AaABAg.9glv862dwEz9goS0IWEgxX', 'snippet': {'videoId': 'rT0IsCyepg4', 'textDisplay': 'Foda - se o importante nessas horas e o maior ladrão do mundo não voltar . Depois 2026 escolha outro . 🤣🤣', 'textOriginal': 'Foda - se o importante nessas horas e o maior ladrão do mundo não voltar . Depois 2026 escolha outro . 🤣🤣', 'parentId': 'UgzFxRr-wgxrdqPq-214AaABAg', 'authorDisplayName': 'jean', 'authorProfileImageUrl': 'https://yt3.ggpht.com/BDg_-GqR8Tll3jswMorJR6BTHEM-l0XHvYzirqMuFhNQ2OogwcHT82_CtwiWoHfxXd4WnWx3ig=s48-c-k-c0x00ffffff-no-rj', 'authorChannelUrl': 'http://www.youtube.com/channel/UCQQyS7BpNYOLzFKZaCaD6Pg', 'authorChannelId': {'value': 'UCQQyS7BpNYOLzFKZaCaD6Pg'}, 'canRate': True, 'viewerRating': 'none', 'likeCount': 0, 'publishedAt': '2022-10-05T18:53:52Z', 'updatedAt': '2022-10-05T18:53:52Z'}}, {'kind': 'youtube#comment', 'etag': 'SQR2P0J4L0_NRJx8GOyNlG9KmDg', 'id': 'UgzFxRr-wgxrdqPq-214AaABAg.9glv862dwEz9gnmbCHeMjb', 'snippet': {'videoId': 'rT0IsCyepg4', 'textDisplay': '@Alessandro você devia ser  que chamava o único cara que prendeu políticos nesse país de traidor da patria, só porque não quis ajudar seu  Mito a esconder as rachadinhas do filho. Não votem em bandido, votem nulo a escolha do menos pior fica por conta do gado e dos jumentos. Infelizmente vocês são a maioria.', 'textOriginal': '@Alessandro você devia ser  que chamava o único cara que prendeu políticos nesse país de traidor da patria, só porque não quis ajudar seu  Mito a esconder as rachadinhas do filho. Não votem em bandido, votem nulo a escolha do menos pior fica por conta do gado e dos jumentos. Infelizmente vocês são a maioria.', 'parentId': 'UgzFxRr-wgxrdqPq-214AaABAg', 'authorDisplayName': 'Gladstone Pafumi', 'authorProfileImageUrl': 'https://yt3.ggpht.com/ytc/AGIKgqN7pr6llIbjfI16tKRWW1_krcT4LjA1SAfK8ef6=s48-c-k-c0x00ffffff-no-rj', 'authorChannelUrl': 'http://www.youtube.com/channel/UCXGvgBDRuSPX-8Biv_eKvsA', 'authorChannelId': {'value': 'UCXGvgBDRuSPX-8Biv_eKvsA'}, 'canRate': True, 'viewerRating': 'none', 'likeCount': 0, 'publishedAt': '2022-10-05T12:43:19Z', 'updatedAt': '2022-10-05T12:43:19Z'}}, {'kind': 'youtube#comment', 'etag': '_FqJwnxkRR3Y8txH-x_6izI3tdQ', 'id': 'UgzFxRr-wgxrdqPq-214AaABAg.9glv862dwEz9gnYTw33Jst', 'snippet': {'videoId': 'rT0IsCyepg4', 'textDisplay': '@Adilson Silva ta errado, um erro não justifica o outro, para de passar a mao na cabeça do seu político de estimação parece idiota', 'textOriginal': '@Adilson Silva ta errado, um erro não justifica o outro, para de passar a mao na cabeça do seu político de estimação parece idiota', 'parentId': 'UgzFxRr-wgxrdqPq-214AaABAg', 'authorDisplayName': 'Rodrigo Rdg89', 'authorProfileImageUrl': 'https://yt3.ggpht.com/ytc/AGIKgqNrRh-E5k6jfVRa2aPIZznHfRrQPBZcYVILJ7maKg=s48-c-k-c0x00ffffff-no-rj', 'authorChannelUrl': 'http://www.youtube.com/channel/UCyYmXwqPuFQEPVrOVjeXaqg', 'authorChannelId': {'value': 'UCyYmXwqPuFQEPVrOVjeXaqg'}, 'canRate': True, 'viewerRating': 'none', 'likeCount': 0, 'publishedAt': '2022-10-05T10:31:06Z', 'updatedAt': '2022-10-05T10:31:06Z'}}, {'kind': 'youtube#comment', 'etag': 'vHfBpKvhZNgd-jQoMM1gmxLAFZo', 'id': 'UgzFxRr-wgxrdqPq-214AaABAg.9glv862dwEz9gnVyijrHUM', 'snippet': {'videoId': 'rT0IsCyepg4', 'textDisplay': '@Jean cozinha magica exatamente, Governo Bolsonaro fez o povo comer osso, perfeita sua crítica', 'textOriginal': '@Jean cozinha magica exatamente, Governo Bolsonaro fez o povo comer osso, perfeita sua crítica', 'parentId': 'UgzFxRr-wgxrdqPq-214AaABAg', 'authorDisplayName': 'Rodrigo Rdg89', 'authorProfileImageUrl': 'https://yt3.ggpht.com/ytc/AGIKgqNrRh-E5k6jfVRa2aPIZznHfRrQPBZcYVILJ7maKg=s48-c-k-c0x00ffffff-no-rj', 'authorChannelUrl': 'http://www.youtube.com/channel/UCyYmXwqPuFQEPVrOVjeXaqg', 'authorChannelId': {'value': 'UCyYmXwqPuFQEPVrOVjeXaqg'}, 'canRate': True, 'viewerRating': 'none', 'likeCount': 0, 'publishedAt': '2022-10-05T10:09:14Z', 'updatedAt': '2022-10-05T10:09:14Z'}}, {'kind': 'youtube#comment', 'etag': 'UgpnR4GeD9h3Y52AED5kBXg9ebo', 'id': 'UgzFxRr-wgxrdqPq-214AaABAg.9glv862dwEz9gmPp_qKzLg', 'snippet': {'videoId': 'rT0IsCyepg4', 'textDisplay': 'a vida de um gado é complicada Fácil é a vida de corrupto, de ditador. Eles com dinheiro no bolso e o povo comendo picanha de cachorro e gato. Gado alimenta, ladrão tira o alimento. Se ainda não acordou para   a realidade já esta na hora.', 'textOriginal': 'a vida de um gado é complicada Fácil é a vida de corrupto, de ditador. Eles com dinheiro no bolso e o povo comendo picanha de cachorro e gato. Gado alimenta, ladrão tira o alimento. Se ainda não acordou para   a realidade já esta na hora.', 'parentId': 'UgzFxRr-wgxrdqPq-214AaABAg', 'authorDisplayName': 'Jean cozinha magica', 'authorProfileImageUrl': 'https://yt3.ggpht.com/ytc/AGIKgqNoP7ue9Asw7CoZ8h9ok1Wx6PveznZ5aeV19w=s48-c-k-c0x00ffffff-no-rj', 'authorChannelUrl': 'http://www.youtube.com/channel/UCWXpBNrAj-s3JDDPMd78RZg', 'authorChannelId': {'value': 'UCWXpBNrAj-s3JDDPMd78RZg'}, 'canRate': True, 'viewerRating': 'none', 'likeCount': 1, 'publishedAt': '2022-10-04T23:56:19Z', 'updatedAt': '2022-10-04T23:56:19Z'}}]}",UC3894Cd1LP2uIgTV5bNPnFQ,2022-10-04T19:19:22Z,É por essas e outras que a maioria do povo brasileiro está com o saco cheio dessa politicagem suja.,QURTSl9pMVNQUlQ5RExaeEk5MER3NkJFZE0xRzl4Mkg4Zng3Q2pVNXMwVVdHdVlfV2dTVFpDRnlIUWNhVmJVd3BEX19WWG1WZnR0X3NfUQ==,2023-06-09 05:18:29.874674
youtube#commentThread,etZx7cN2gi1NVPP7VqexCdLp_Xk,UgxsKLTGusuCTB1I6XJ4AaABAg,"{'videoId': 'rT0IsCyepg4', 'topLevelComment': {'kind': 'youtube#comment', 'etag': 'C7p4d2wDT3Gs-R0NymgmKKgvaB0', 'id': 'UgxsKLTGusuCTB1I6XJ4AaABAg', 'snippet': {'videoId': 'rT0IsCyepg4', 'textDisplay': 'Meu respeito a o Moro. Más fora Bolsonarooooooo!!', 'textOriginal': 'Meu respeito a o Moro. Más fora Bolsonarooooooo!!', 'authorDisplayName': 'Edson Vieira', 'authorProfileImageUrl': 'https://yt3.ggpht.com/ytc/AGIKgqN0Qqj5jtoVMS1HUQLP59f6FfyLQ1kq3T2U8g=s48-c-k-c0x00ffffff-no-rj', 'authorChannelUrl': 'http://www.youtube.com/channel/UCkU60okQwGLBi7gK_jpmXkQ', 'authorChannelId': {'value': 'UCkU60okQwGLBi7gK_jpmXkQ'}, 'canRate': True, 'viewerRating': 'none', 'likeCount': 2, 'publishedAt': '2022-10-04T19:18:29Z', 'updatedAt': '2022-10-04T19:18:29Z'}}, 'canReply': True, 'totalReplyCount': 0, 'isPublic': True}",,UCkU60okQwGLBi7gK_jpmXkQ,2022-10-04T19:18:29Z,Meu respeito a o Moro. Más fora Bolsonarooooooo!!,QURTSl9pMVNQUlQ5RExaeEk5MER3NkJFZE0xRzl4Mkg4Zng3Q2pVNXMwVVdHdVlfV2dTVFpDRnlIUWNhVmJVd3BEX19WWG1WZnR0X3NfUQ==,2023-06-09 05:18:29.874674
youtube#commentThread,bsZjaoTSrakYls1-96WNpkx2Itw,UgwYDylMPc9j34Mnh6R4AaABAg,"{'videoId': 'rT0IsCyepg4', 'topLevelComment': {'kind': 'youtube#comment', 'etag': 'Y8HM24jbgNMIetLu8NSusrssG8w', 'id': 'UgwYDylMPc9j34Mnh6R4AaABAg', 'snippet': {'videoId': 'rT0IsCyepg4', 'textDisplay': 'Ele, Moro, fez muito bem. Vai apoiar quem? O PT?? Não. Apoiará o Bolsonaro sim!!!!', 'textOriginal': 'Ele, Moro, fez muito bem. Vai apoiar quem? O PT?? Não. Apoiará o Bolsonaro sim!!!!', 'authorDisplayName': 'Eliete Gondim de Almeida', 'authorProfileImageUrl': 'https://yt3.ggpht.com/ytc/AGIKgqMBEsRHHINP-P3RcQ7LO4qT_X2zJXXdLJ7Teg=s48-c-k-c0x00ffffff-no-rj', 'authorChannelUrl': 'http://www.youtube.com/channel/UCoKWFQVzUfXQRFI7-niyrzQ', 'authorChannelId': {'value': 'UCoKWFQVzUfXQRFI7-niyrzQ'}, 'canRate': True, 'viewerRating': 'none', 'likeCount': 5, 'publishedAt': '2022-10-04T19:18:17Z', 'updatedAt': '2022-10-04T19:18:17Z'}}, 'canReply': True, 'totalReplyCount': 0, 'isPublic': True}",,UCoKWFQVzUfXQRFI7-niyrzQ,2022-10-04T19:18:17Z,"Ele, Moro, fez muito bem. Vai apoiar quem? O PT?? Não. Apoiará o Bolsonaro sim!!!!",QURTSl9pMVNQUlQ5RExaeEk5MER3NkJFZE0xRzl4Mkg4Zng3Q2pVNXMwVVdHdVlfV2dTVFpDRnlIUWNhVmJVd3BEX19WWG1WZnR0X3NfUQ==,2023-06-09 05:18:29.874674
youtube#commentThread,FXZz9XrgzVyBsagfJHL3xC8vee4,UgzIflPuwH3nYZx8Z_F4AaABAg,"{'videoId': 'rT0IsCyepg4', 'topLevelComment': {'kind': 'youtube#comment', 'etag': '5mTlOZlWaBW_b2o-iFvTMC6RmKk', 'id': 'UgzIflPuwH3nYZx8Z_F4AaABAg', 'snippet': {'videoId': 'rT0IsCyepg4', 'textDisplay': 'Se passado se apaga, então o de Lula e tantos outros se apagam também', 'textOriginal': 'Se passado se apaga, então o de Lula e tantos outros se apagam também', 'authorDisplayName': 'Claudinei Guerra', 'authorProfileImageUrl': 'https://yt3.ggpht.com/ytc/AGIKgqMzOsvK_vnBgp84k8VUf-03jvbQWQ7YnqWEIw=s48-c-k-c0x00ffffff-no-rj', 'authorChannelUrl': 'http://www.youtube.com/channel/UC3894Cd1LP2uIgTV5bNPnFQ', 'authorChannelId': {'value': 'UC3894Cd1LP2uIgTV5bNPnFQ'}, 'canRate': True, 'viewerRating': 'none', 'likeCount': 0, 'publishedAt': '2022-10-04T19:17:30Z', 'updatedAt': '2022-10-04T19:17:30Z'}}, 'canReply': True, 'totalReplyCount': 0, 'isPublic': True}",,UC3894Cd1LP2uIgTV5bNPnFQ,2022-10-04T19:17:30Z,"Se passado se apaga, então o de Lula e tantos outros se apagam também",QURTSl9pMVNQUlQ5RExaeEk5MER3NkJFZE0xRzl4Mkg4Zng3Q2pVNXMwVVdHdVlfV2dTVFpDRnlIUWNhVmJVd3BEX19WWG1WZnR0X3NfUQ==,2023-06-09 05:18:29.874674
youtube#commentThread,ECRlsmHyp0dua2yf94IVj0bm3v0,Ugxerkaroeh86SqANvJ4AaABAg,"{'videoId': 'rT0IsCyepg4', 'topLevelComment': {'kind': 'youtube#comment', 'etag': '2woGbkn858MXcVMWCPQpLl5aH_c', 'id': 'Ugxerkaroeh86SqANvJ4AaABAg', 'snippet': {'videoId': 'rT0IsCyepg4', 'textDisplay': 'ALGO BOM TALVEZ VENHA NO FUTURO PORQUE ANOS ATRÁS, SE IGNORAVA A POLÍTICA EM ANO DE COPA DO MUNDO. <br>AGORA, PELO QUE VIMOS, ATÉ OS DETENTOS DA PENITENCIÁRIA DE PINHEIROS ESQUECERAM DA COPA...', 'textOriginal': 'ALGO BOM TALVEZ VENHA NO FUTURO PORQUE ANOS ATRÁS, SE IGNORAVA A POLÍTICA EM ANO DE COPA DO MUNDO. \\nAGORA, PELO QUE VIMOS, ATÉ OS DETENTOS DA PENITENCIÁRIA DE PINHEIROS ESQUECERAM DA COPA...', 'authorDisplayName': 'LéoRU', 'authorProfileImageUrl': 'https://yt3.ggpht.com/LKM1V4tN8kVVZ-bCKHGBZEMfCcbUaL5a1YA_89uhhVnfUWchZ5DOyVfYs3Ula4CoSoqjGp8U0Q=s48-c-k-c0x00ffffff-no-rj', 'authorChannelUrl': 'http://www.youtube.com/channel/UCAMOn_iOdda1ka_tBe40LOg', 'authorChannelId': {'value': 'UCAMOn_iOdda1ka_tBe40LOg'}, 'canRate': True, 'viewerRating': 'none', 'likeCount': 1, 'publishedAt': '2022-10-04T19:16:50Z', 'updatedAt': '2022-10-04T19:16:50Z'}}, 'canReply': True, 'totalReplyCount': 0, 'isPublic': True}",,UCAMOn_iOdda1ka_tBe40LOg,2022-10-04T19:16:50Z,"ALGO BOM TALVEZ VENHA NO FUTURO PORQUE ANOS ATRÁS, SE IGNORAVA A POLÍTICA EM ANO DE COPA DO MUNDO. 
AGORA, PELO QUE VIMOS, ATÉ OS DETENTOS DA PENITENCIÁRIA DE PINHEIROS ESQUECERAM DA COPA...",QURTSl9pMVNQUlQ5RExaeEk5MER3NkJFZE0xRzl4Mkg4Zng3Q2pVNXMwVVdHdVlfV2dTVFpDRnlIUWNhVmJVd3BEX19WWG1WZnR0X3NfUQ==,2023-06-09 05:18:29.874674
