kind,etag,id,snippet,replies,authorChannelId,publishedAt,textOriginal,nextPageToken,extraction_date
youtube#commentThread,j3KilYjweBNZ3vg6GmQSUVm8Dy4,UgwljWBBZCzxtWvJtZt4AaABAg,"{'videoId': 'rT0IsCyepg4', 'topLevelComment': {'kind': 'youtube#comment', 'etag': 'dcN5yChRbeBsvJDLbi6TvwqEb90', 'id': 'UgwljWBBZCzxtWvJtZt4AaABAg', 'snippet': {'videoId': 'rT0IsCyepg4', 'textDisplay': 'Eu voto nulo , mas acho que o moro fez o certo , não tem como fazer nada sozinho.<br>Me parece que o Twitter dele ganhou 200 mil seguidores de gado.', 'textOriginal': 'Eu voto nulo , mas acho que o moro fez o certo , não tem como fazer nada sozinho.\\nMe parece que o Twitter dele ganhou 200 mil seguidores de gado.', 'authorDisplayName': 'gugu', 'authorProfileImageUrl': 'https://yt3.ggpht.com/ytc/AGIKgqOWSouukyEnG6CO7NjR-ylzTyuR88d0YaQJ6Fy3QOnQa3NcANEWKxPYMqB-0Z99=s48-c-k-c0x00ffffff-no-rj', 'authorChannelUrl': 'http://www.youtube.com/channel/UCxPDmqKTrXQ4ZHaylRyOP8A', 'authorChannelId': {'value': 'UCxPDmqKTrXQ4ZHaylRyOP8A'}, 'canRate': True, 'viewerRating': 'none', 'likeCount': 0, 'publishedAt': '2022-10-05T02:20:40Z', 'updatedAt': '2022-10-05T02:20:40Z'}}, 'canReply': True, 'totalReplyCount': 0, 'isPublic': True}",,UCxPDmqKTrXQ4ZHaylRyOP8A,2022-10-05T02:20:40Z,"Eu voto nulo , mas acho que o moro fez o certo , não tem como fazer nada sozinho.
Me parece que o Twitter dele ganhou 200 mil seguidores de gado.",QURTSl9pMk9HVUpPaGJHQmh2MzN6OVcwckJLMnBBNnlZYlVhZzYzVXc5M2MzSzdQTjRIM0ZxUVM4ZTkyaktVdjUyZGVvbnhETHM3Vm5CUQ==,2023-06-09 05:18:28.183185
youtube#commentThread,LUTd6Mozl5WePf5MOzW1SLObWXo,UgxgcqgG6VCnIJOW2Rx4AaABAg,"{'videoId': 'rT0IsCyepg4', 'topLevelComment': {'kind': 'youtube#comment', 'etag': 'WtQUqHgkl0NEgihijerEpXiFdxs', 'id': 'UgxgcqgG6VCnIJOW2Rx4AaABAg', 'snippet': {'videoId': 'rT0IsCyepg4', 'textDisplay': 'ISSO QUE EU CHAMO DE PATRIOTISMO VERDADEIRO EM PROL DE UM PAÍS MELHOR SEMPRE FORÇA MEU PRESIDENTE &quot;22 &quot;✊ ❤', 'textOriginal': 'ISSO QUE EU CHAMO DE PATRIOTISMO VERDADEIRO EM PROL DE UM PAÍS MELHOR SEMPRE FORÇA MEU PRESIDENTE ""22 ""✊ ❤', 'authorDisplayName': 'jack wilson', 'authorProfileImageUrl': 'https://yt3.ggpht.com/5dhrL6SZOPjeCZMvJUYgIbFmADpHQ9bdzT8YxriKYCFyLJfzKttQ3udGAzYS8dnDUtdgvMhgo8o=s48-c-k-c0x00ffffff-no-rj', 'authorChannelUrl': 'http://www.youtube.com/channel/UCnWgXKWnhRXU-BipsmZxu-A', 'authorChannelId': {'value': 'UCnWgXKWnhRXU-BipsmZxu-A'}, 'canRate': True, 'viewerRating': 'none', 'likeCount': 13, 'publishedAt': '2022-10-05T02:15:54Z', 'updatedAt': '2022-10-05T02:15:54Z'}}, 'canReply': True, 'totalReplyCount': 0, 'isPublic': True}",,UCnWgXKWnhRXU-BipsmZxu-A,2022-10-05T02:15:54Z,"ISSO QUE EU CHAMO DE PATRIOTISMO VERDADEIRO EM PROL DE UM PAÍS MELHOR SEMPRE FORÇA MEU PRESIDENTE ""22 ""✊ ❤",QURTSl9pMk9HVUpPaGJHQmh2MzN6OVcwckJLMnBBNnlZYlVhZzYzVXc5M2MzSzdQTjRIM0ZxUVM4ZTkyaktVdjUyZGVvbnhETHM3Vm5CUQ==,2023-06-09 05:18:28.183185
youtube#commentThread,fMn-W1eMYDGhEreSzHZDIJMLf9o,UgwK51T7QBqs-5PAUpF4AaABAg,"{'videoId': 'rT0IsCyepg4', 'topLevelComment': {'kind': 'youtube#comment', 'etag': 'Wdnji--5YwtF_EKLlR9QRaLskoI', 'id': 'UgwK51T7QBqs-5PAUpF4AaABAg', 'snippet': {'videoId': 'rT0IsCyepg4', 'textDisplay': 'Só se combate o sistema entrando dentro dele. Não tem jeito!', 'textOriginal': 'Só se combate o sistema entrando dentro dele. Não tem jeito!', 'authorDisplayName': 'Criipe', 'authorProfileImageUrl': 'https://yt3.ggpht.com/AT96MMwNf2vHSzzkxWYE6grlmcNw0u2ifDNE0HAeYxR0xZ0dE2enBJD_W5G7uZD-rMh52TgX=s48-c-k-c0x00ffffff-no-rj', 'authorChannelUrl': 'http://www.youtube.com/channel/UCjuuyWi1B2cEuLOTsY77w0g', 'authorChannelId': {'value': 'UCjuuyWi1B2cEuLOTsY77w0g'}, 'canRate': True, 'viewerRating': 'none', 'likeCount': 0, 'publishedAt': '2022-10-05T02:11:40Z', 'updatedAt': '2022-10-05T02:11:40Z'}}, 'canReply': True, 'totalReplyCount': 0, 'isPublic': True}",,UCjuuyWi1B2cEuLOTsY77w0g,2022-10-05T02:11:40Z,Só se combate o sistema entrando dentro dele. Não tem jeito!,QURTSl9pMk9HVUpPaGJHQmh2MzN6OVcwckJLMnBBNnlZYlVhZzYzVXc5M2MzSzdQTjRIM0ZxUVM4ZTkyaktVdjUyZGVvbnhETHM3Vm5CUQ==,2023-06-09 05:18:28.183185
youtube#commentThread,xVUBnuWljcU107HNOcvbPCq2sLo,Ugwm3eF-8-51MXnpE0B4AaABAg,"{'videoId': 'rT0IsCyepg4', 'topLevelComment': {'kind': 'youtube#comment', 'etag': 'fd6Zr3V3ZTxNalfI47cLgUe89aI', 'id': 'Ugwm3eF-8-51MXnpE0B4AaABAg', 'snippet': {'videoId': 'rT0IsCyepg4', 'textDisplay': 'bandido valoriza muito outro bandido eles se merecem sejam felizes vou com LULA 13 É o que tem de pior na politica junto com o antagonista canal do moro e dallanhol que forjaram provas pra incriminar o LULA 13 e tirar da eleicao 2018 fora moro.dallagnol e o bozo', 'textOriginal': 'bandido valoriza muito outro bandido eles se merecem sejam felizes vou com LULA 13 É o que tem de pior na politica junto com o antagonista canal do moro e dallanhol que forjaram provas pra incriminar o LULA 13 e tirar da eleicao 2018 fora moro.dallagnol e o bozo', 'authorDisplayName': 'Antonio Neves', 'authorProfileImageUrl': 'https://yt3.ggpht.com/ytc/AGIKgqNvLvXFrRjtilVjQliwSn8Qz97lU2u0S292=s48-c-k-c0x00ffffff-no-rj', 'authorChannelUrl': 'http://www.youtube.com/channel/UCmxncoFpQqk8Hlqpri_rM4A', 'authorChannelId': {'value': 'UCmxncoFpQqk8Hlqpri_rM4A'}, 'canRate': True, 'viewerRating': 'none', 'likeCount': 0, 'publishedAt': '2022-10-05T02:06:47Z', 'updatedAt': '2022-10-05T02:06:47Z'}}, 'canReply': True, 'totalReplyCount': 0, 'isPublic': True}",,UCmxncoFpQqk8Hlqpri_rM4A,2022-10-05T02:06:47Z,bandido valoriza muito outro bandido eles se merecem sejam felizes vou com LULA 13 É o que tem de pior na politica junto com o antagonista canal do moro e dallanhol que forjaram provas pra incriminar o LULA 13 e tirar da eleicao 2018 fora moro.dallagnol e o bozo,QURTSl9pMk9HVUpPaGJHQmh2MzN6OVcwckJLMnBBNnlZYlVhZzYzVXc5M2MzSzdQTjRIM0ZxUVM4ZTkyaktVdjUyZGVvbnhETHM3Vm5CUQ==,2023-06-09 05:18:28.183185
youtube#commentThread,g2ljg6fnH3tMoMu4NLDtnoh2bLo,Ugy-LJr2Mh3dc1O-bdt4AaABAg,"{'videoId': 'rT0IsCyepg4', 'topLevelComment': {'kind': 'youtube#comment', 'etag': 'PZbOCWQpXWN4lRfQtRBaSSOhAsY', 'id': 'Ugy-LJr2Mh3dc1O-bdt4AaABAg', 'snippet': {'videoId': 'rT0IsCyepg4', 'textDisplay': 'Carai eu vivi pra ver isso kkkkkkkkkk.', 'textOriginal': 'Carai eu vivi pra ver isso kkkkkkkkkk.', 'authorDisplayName': 'Wedson Alexandre alves', 'authorProfileImageUrl': 'https://yt3.ggpht.com/ytc/AGIKgqN2uvZHxV_qCPNgvZRruYLbiSutviIj2sFOYQ=s48-c-k-c0x00ffffff-no-rj', 'authorChannelUrl': 'http://www.youtube.com/channel/UCe7s_Dg9IBRmomLWa1NFAKg', 'authorChannelId': {'value': 'UCe7s_Dg9IBRmomLWa1NFAKg'}, 'canRate': True, 'viewerRating': 'none', 'likeCount': 0, 'publishedAt': '2022-10-05T01:56:36Z', 'updatedAt': '2022-10-05T01:56:36Z'}}, 'canReply': True, 'totalReplyCount': 0, 'isPublic': True}",,UCe7s_Dg9IBRmomLWa1NFAKg,2022-10-05T01:56:36Z,Carai eu vivi pra ver isso kkkkkkkkkk.,QURTSl9pMk9HVUpPaGJHQmh2MzN6OVcwckJLMnBBNnlZYlVhZzYzVXc5M2MzSzdQTjRIM0ZxUVM4ZTkyaktVdjUyZGVvbnhETHM3Vm5CUQ==,2023-06-09 05:18:28.183185
youtube#commentThread,Dy7accutisciUHUMK3TXWw6SjhE,UgxvwDk2mtswBklYnqJ4AaABAg,"{'videoId': 'rT0IsCyepg4', 'topLevelComment': {'kind': 'youtube#comment', 'etag': 'FNWJitCijoMipTtii7hnoPX0jjs', 'id': 'UgxvwDk2mtswBklYnqJ4AaABAg', 'snippet': {'videoId': 'rT0IsCyepg4', 'textDisplay': 'Bozo pode ate ganhar...mas e fim de carreira. Moro ta so comecando...', 'textOriginal': 'Bozo pode ate ganhar...mas e fim de carreira. Moro ta so comecando...', 'authorDisplayName': 'Nilton Silva', 'authorProfileImageUrl': 'https://yt3.ggpht.com/ytc/AGIKgqPFOBRp86PnBR85SX3TO3b_KKBmfcTldiHgK6n81A=s48-c-k-c0x00ffffff-no-rj', 'authorChannelUrl': 'http://www.youtube.com/channel/UCokIhaJgZlwF_JzIsI7ytFg', 'authorChannelId': {'value': 'UCokIhaJgZlwF_JzIsI7ytFg'}, 'canRate': True, 'viewerRating': 'none', 'likeCount': 0, 'publishedAt': '2022-10-05T01:56:15Z', 'updatedAt': '2022-10-05T01:56:15Z'}}, 'canReply': True, 'totalReplyCount': 0, 'isPublic': True}",,UCokIhaJgZlwF_JzIsI7ytFg,2022-10-05T01:56:15Z,Bozo pode ate ganhar...mas e fim de carreira. Moro ta so comecando...,QURTSl9pMk9HVUpPaGJHQmh2MzN6OVcwckJLMnBBNnlZYlVhZzYzVXc5M2MzSzdQTjRIM0ZxUVM4ZTkyaktVdjUyZGVvbnhETHM3Vm5CUQ==,2023-06-09 05:18:28.183185
youtube#commentThread,Mh98CMPMdAxGs9RlkL5Il-JWxKk,UgykibJabM-UgNCK2XV4AaABAg,"{'videoId': 'rT0IsCyepg4', 'topLevelComment': {'kind': 'youtube#comment', 'etag': 'ZhPa75e6MoRC0VWJqxrwFhSQzAA', 'id': 'UgykibJabM-UgNCK2XV4AaABAg', 'snippet': {'videoId': 'rT0IsCyepg4', 'textDisplay': 'O Bozo deve ter prometido uma vez mais o STF pro mau caráter do Moro', 'textOriginal': 'O Bozo deve ter prometido uma vez mais o STF pro mau caráter do Moro', 'authorDisplayName': 'Ailton VIEIRA DA FONSECA', 'authorProfileImageUrl': 'https://yt3.ggpht.com/ytc/AGIKgqMgi4xN_J03XVmygUKVIuOce0LYukI-J8rtCw=s48-c-k-c0x00ffffff-no-rj', 'authorChannelUrl': 'http://www.youtube.com/channel/UCoO-9_H3r-ri9vznaOv5MSQ', 'authorChannelId': {'value': 'UCoO-9_H3r-ri9vznaOv5MSQ'}, 'canRate': True, 'viewerRating': 'none', 'likeCount': 0, 'publishedAt': '2022-10-05T01:03:54Z', 'updatedAt': '2022-10-05T01:03:54Z'}}, 'canReply': True, 'totalReplyCount': 0, 'isPublic': True}",,UCoO-9_H3r-ri9vznaOv5MSQ,2022-10-05T01:03:54Z,O Bozo deve ter prometido uma vez mais o STF pro mau caráter do Moro,QURTSl9pMk9HVUpPaGJHQmh2MzN6OVcwckJLMnBBNnlZYlVhZzYzVXc5M2MzSzdQTjRIM0ZxUVM4ZTkyaktVdjUyZGVvbnhETHM3Vm5CUQ==,2023-06-09 05:18:28.183185
youtube#commentThread,XWZ2vVQsIG0g3284fQvY7RhE7QQ,Ugy1CD6AkTL5SP7NH9t4AaABAg,"{'videoId': 'rT0IsCyepg4', 'topLevelComment': {'kind': 'youtube#comment', 'etag': 'eW7N-C0fMAlOwyMFbMA0zuoxFjQ', 'id': 'Ugy1CD6AkTL5SP7NH9t4AaABAg', 'snippet': {'videoId': 'rT0IsCyepg4', 'textDisplay': 'Esse Moro é de uma pobreza moral de fazer dó.', 'textOriginal': 'Esse Moro é de uma pobreza moral de fazer dó.', 'authorDisplayName': 'Ailton VIEIRA DA FONSECA', 'authorProfileImageUrl': 'https://yt3.ggpht.com/ytc/AGIKgqMgi4xN_J03XVmygUKVIuOce0LYukI-J8rtCw=s48-c-k-c0x00ffffff-no-rj', 'authorChannelUrl': 'http://www.youtube.com/channel/UCoO-9_H3r-ri9vznaOv5MSQ', 'authorChannelId': {'value': 'UCoO-9_H3r-ri9vznaOv5MSQ'}, 'canRate': True, 'viewerRating': 'none', 'likeCount': 0, 'publishedAt': '2022-10-05T01:01:50Z', 'updatedAt': '2022-10-05T01:01:50Z'}}, 'canReply': True, 'totalReplyCount': 0, 'isPublic': True}",,UCoO-9_H3r-ri9vznaOv5MSQ,2022-10-05T01:01:50Z,Esse Moro é de uma pobreza moral de fazer dó.,QURTSl9pMk9HVUpPaGJHQmh2MzN6OVcwckJLMnBBNnlZYlVhZzYzVXc5M2MzSzdQTjRIM0ZxUVM4ZTkyaktVdjUyZGVvbnhETHM3Vm5CUQ==,2023-06-09 05:18:28.183185
youtube#commentThread,9xRhDFJ8BV7NGlfs54ceQeUPVdc,Ugz51F067yKZJ1HCIPd4AaABAg,"{'videoId': 'rT0IsCyepg4', 'topLevelComment': {'kind': 'youtube#comment', 'etag': 'Q7JJbeyp9JE5FpTOQHygfKHx3oc', 'id': 'Ugz51F067yKZJ1HCIPd4AaABAg', 'snippet': {'videoId': 'rT0IsCyepg4', 'textDisplay': 'Para quem critica Moro,pelo menos ele não gez como Ciro q disse q jamais voltaria a apoiar um corrupto como Lula e já está apoiando. Moro desde o começo disse q não apoiaria Lula e assim o fez. Pelo menos a briga entre ele e Bolsonaro psreceu mais uma briga de irmãos q se ofendem se arrependem e depois fazem as paze. Ciro foi uma decepção tremenda ele acabou de se afundar em sua carreira política.', 'textOriginal': 'Para quem critica Moro,pelo menos ele não gez como Ciro q disse q jamais voltaria a apoiar um corrupto como Lula e já está apoiando. Moro desde o começo disse q não apoiaria Lula e assim o fez. Pelo menos a briga entre ele e Bolsonaro psreceu mais uma briga de irmãos q se ofendem se arrependem e depois fazem as paze. Ciro foi uma decepção tremenda ele acabou de se afundar em sua carreira política.', 'authorDisplayName': 'Maria lucimar Almeida medeiros', 'authorProfileImageUrl': 'https://yt3.ggpht.com/ytc/AGIKgqPnc32zLFcb7ypbyCMceVabJdsXofVRx0SNFA=s48-c-k-c0x00ffffff-no-rj', 'authorChannelUrl': 'http://www.youtube.com/channel/UCNb1IdVKDzXaUXdAgqTtfeg', 'authorChannelId': {'value': 'UCNb1IdVKDzXaUXdAgqTtfeg'}, 'canRate': True, 'viewerRating': 'none', 'likeCount': 3, 'publishedAt': '2022-10-05T00:48:21Z', 'updatedAt': '2022-10-05T00:48:21Z'}}, 'canReply': True, 'totalReplyCount': 0, 'isPublic': True}",,UCNb1IdVKDzXaUXdAgqTtfeg,2022-10-05T00:48:21Z,"Para quem critica Moro,pelo menos ele não gez como Ciro q disse q jamais voltaria a apoiar um corrupto como Lula e já está apoiando. Moro desde o começo disse q não apoiaria Lula e assim o fez. Pelo menos a briga entre ele e Bolsonaro psreceu mais uma briga de irmãos q se ofendem se arrependem e depois fazem as paze. Ciro foi uma decepção tremenda ele acabou de se afundar em sua carreira política.",QURTSl9pMk9HVUpPaGJHQmh2MzN6OVcwckJLMnBBNnlZYlVhZzYzVXc5M2MzSzdQTjRIM0ZxUVM4ZTkyaktVdjUyZGVvbnhETHM3Vm5CUQ==,2023-06-09 05:18:28.183185
youtube#commentThread,or9E6qzJeFyWBQL61lYm4KOYrq8,UgwXKOOjYjfRrbfFu-t4AaABAg,"{'videoId': 'rT0IsCyepg4', 'topLevelComment': {'kind': 'youtube#comment', 'etag': 'nbiIAlCw3EoSW9_oAbqoyOu2MCM', 'id': 'UgwXKOOjYjfRrbfFu-t4AaABAg', 'snippet': {'videoId': 'rT0IsCyepg4', 'textDisplay': 'Esse TRAÍRA descarado agora se HUMILHANDO atrás do apoio do MORO.', 'textOriginal': 'Esse TRAÍRA descarado agora se HUMILHANDO atrás do apoio do MORO.', 'authorDisplayName': 'FlaBr', 'authorProfileImageUrl': 'https://yt3.ggpht.com/ytc/AGIKgqMA4m3nOzNfjLnDIbVvcQEC7vKT4r8uj6a8k97xRKqECaplZJlDZMH4KKVqERMo=s48-c-k-c0x00ffffff-no-rj', 'authorChannelUrl': 'http://www.youtube.com/channel/UCKT2WcCiNK7IsNUxQc3yEAw', 'authorChannelId': {'value': 'UCKT2WcCiNK7IsNUxQc3yEAw'}, 'canRate': True, 'viewerRating': 'none', 'likeCount': 0, 'publishedAt': '2022-10-05T00:39:12Z', 'updatedAt': '2022-10-05T00:39:12Z'}}, 'canReply': True, 'totalReplyCount': 0, 'isPublic': True}",,UCKT2WcCiNK7IsNUxQc3yEAw,2022-10-05T00:39:12Z,Esse TRAÍRA descarado agora se HUMILHANDO atrás do apoio do MORO.,QURTSl9pMk9HVUpPaGJHQmh2MzN6OVcwckJLMnBBNnlZYlVhZzYzVXc5M2MzSzdQTjRIM0ZxUVM4ZTkyaktVdjUyZGVvbnhETHM3Vm5CUQ==,2023-06-09 05:18:28.183185
youtube#commentThread,oOixdnrs5KnN9Ws5oSyX6tYKsVg,Ugzf-xyUmYTKt0sKctJ4AaABAg,"{'videoId': 'rT0IsCyepg4', 'topLevelComment': {'kind': 'youtube#comment', 'etag': 'UGJB3XEA7sQ0A8eZOgSS8u5QtPU', 'id': 'Ugzf-xyUmYTKt0sKctJ4AaABAg', 'snippet': {'videoId': 'rT0IsCyepg4', 'textDisplay': 'Moro e Rodrigo que tristeza,  que decepção ! Vou parar de votar ! Entendo agora  o Mainardi eu tb desisto', 'textOriginal': 'Moro e Rodrigo que tristeza,  que decepção ! Vou parar de votar ! Entendo agora  o Mainardi eu tb desisto', 'authorDisplayName': 'Elaine Herrera', 'authorProfileImageUrl': 'https://yt3.ggpht.com/ytc/AGIKgqPTzvVHV37qEmnuQVB6t-RLz-DNA0n-hWkwhg=s48-c-k-c0x00ffffff-no-rj', 'authorChannelUrl': 'http://www.youtube.com/channel/UC6ZSi31M66HJH_5GoCWvDcA', 'authorChannelId': {'value': 'UC6ZSi31M66HJH_5GoCWvDcA'}, 'canRate': True, 'viewerRating': 'none', 'likeCount': 0, 'publishedAt': '2022-10-05T00:18:24Z', 'updatedAt': '2022-10-05T00:18:24Z'}}, 'canReply': True, 'totalReplyCount': 0, 'isPublic': True}",,UC6ZSi31M66HJH_5GoCWvDcA,2022-10-05T00:18:24Z,"Moro e Rodrigo que tristeza,  que decepção ! Vou parar de votar ! Entendo agora  o Mainardi eu tb desisto",QURTSl9pMk9HVUpPaGJHQmh2MzN6OVcwckJLMnBBNnlZYlVhZzYzVXc5M2MzSzdQTjRIM0ZxUVM4ZTkyaktVdjUyZGVvbnhETHM3Vm5CUQ==,2023-06-09 05:18:28.183185
youtube#commentThread,IxE-hNSA1jWvRDZejT5PnzN3gwY,UgwVeIF-QyLGSui2dP54AaABAg,"{'videoId': 'rT0IsCyepg4', 'topLevelComment': {'kind': 'youtube#comment', 'etag': 'Bdj_V3HIoY_AROgqgfbsynW1ZoM', 'id': 'UgwVeIF-QyLGSui2dP54AaABAg', 'snippet': {'videoId': 'rT0IsCyepg4', 'textDisplay': 'Esse é o Moro Venon. Engolido pelo Sistema. 🔥💀', 'textOriginal': 'Esse é o Moro Venon. Engolido pelo Sistema. 🔥💀', 'authorDisplayName': 'Neo', 'authorProfileImageUrl': 'https://yt3.ggpht.com/ytc/AGIKgqMXOY99DnaGE2s9Chw1Cr82PIaLu-Fm7-kNk0dfX8M=s48-c-k-c0x00ffffff-no-rj', 'authorChannelUrl': 'http://www.youtube.com/channel/UCAo3yF_yNxF3hKgR0N7j4ow', 'authorChannelId': {'value': 'UCAo3yF_yNxF3hKgR0N7j4ow'}, 'canRate': True, 'viewerRating': 'none', 'likeCount': 0, 'publishedAt': '2022-10-05T00:12:21Z', 'updatedAt': '2022-10-05T00:12:21Z'}}, 'canReply': True, 'totalReplyCount': 0, 'isPublic': True}",,UCAo3yF_yNxF3hKgR0N7j4ow,2022-10-05T00:12:21Z,Esse é o Moro Venon. Engolido pelo Sistema. 🔥💀,QURTSl9pMk9HVUpPaGJHQmh2MzN6OVcwckJLMnBBNnlZYlVhZzYzVXc5M2MzSzdQTjRIM0ZxUVM4ZTkyaktVdjUyZGVvbnhETHM3Vm5CUQ==,2023-06-09 05:18:28.183185
youtube#commentThread,aFQeH-0RCDejyvlsU3sK3l-1jwU,Ugzk0zxK8fG4D4zOL_14AaABAg,"{'videoId': 'rT0IsCyepg4', 'topLevelComment': {'kind': 'youtube#comment', 'etag': 'oC4ChGP1UZKDxLVxJlcgIR0-4cQ', 'id': 'Ugzk0zxK8fG4D4zOL_14AaABAg', 'snippet': {'videoId': 'rT0IsCyepg4', 'textDisplay': 'Safadeza ,,como sempre,,,eles sempre sendo políticos e como sempre só mudam as moscas, mas a merda continua.', 'textOriginal': 'Safadeza ,,como sempre,,,eles sempre sendo políticos e como sempre só mudam as moscas, mas a merda continua.', 'authorDisplayName': 'MARCO SILVA', 'authorProfileImageUrl': 'https://yt3.ggpht.com/ytc/AGIKgqPYsCNvgRqZCfff63BDomtcDdMZ71OvF4AVng=s48-c-k-c0x00ffffff-no-rj', 'authorChannelUrl': 'http://www.youtube.com/channel/UCxC3R2qkUzmMBCL4mK-YKbA', 'authorChannelId': {'value': 'UCxC3R2qkUzmMBCL4mK-YKbA'}, 'canRate': True, 'viewerRating': 'none', 'likeCount': 1, 'publishedAt': '2022-10-05T00:09:24Z', 'updatedAt': '2022-10-05T00:09:24Z'}}, 'canReply': True, 'totalReplyCount': 0, 'isPublic': True}",,UCxC3R2qkUzmMBCL4mK-YKbA,2022-10-05T00:09:24Z,"Safadeza ,,como sempre,,,eles sempre sendo políticos e como sempre só mudam as moscas, mas a merda continua.",QURTSl9pMk9HVUpPaGJHQmh2MzN6OVcwckJLMnBBNnlZYlVhZzYzVXc5M2MzSzdQTjRIM0ZxUVM4ZTkyaktVdjUyZGVvbnhETHM3Vm5CUQ==,2023-06-09 05:18:28.183185
youtube#commentThread,fTn1OT4p-0zg5zo0CXVcdth7Oy0,UgwgGfUS8cUolUGzD4F4AaABAg,"{'videoId': 'rT0IsCyepg4', 'topLevelComment': {'kind': 'youtube#comment', 'etag': '6HcGC26q5GUtjgNar511nBpztE4', 'id': 'UgwgGfUS8cUolUGzD4F4AaABAg', 'snippet': {'videoId': 'rT0IsCyepg4', 'textDisplay': 'Bolsonaro ajudou a desmantelar a lava jato junto com aras q nojo', 'textOriginal': 'Bolsonaro ajudou a desmantelar a lava jato junto com aras q nojo', 'authorDisplayName': 'Thiago De Melo', 'authorProfileImageUrl': 'https://yt3.ggpht.com/ytc/AGIKgqMgBpZ9DoNeYMmDtiILWjlkKRnedMSRwvrLqQCCyg=s48-c-k-c0x00ffffff-no-rj', 'authorChannelUrl': 'http://www.youtube.com/channel/UCTzUjkpZJprCGTe5UgrQA3g', 'authorChannelId': {'value': 'UCTzUjkpZJprCGTe5UgrQA3g'}, 'canRate': True, 'viewerRating': 'none', 'likeCount': 0, 'publishedAt': '2022-10-04T23:57:00Z', 'updatedAt': '2022-10-04T23:57:00Z'}}, 'canReply': True, 'totalReplyCount': 0, 'isPublic': True}",,UCTzUjkpZJprCGTe5UgrQA3g,2022-10-04T23:57:00Z,Bolsonaro ajudou a desmantelar a lava jato junto com aras q nojo,QURTSl9pMk9HVUpPaGJHQmh2MzN6OVcwckJLMnBBNnlZYlVhZzYzVXc5M2MzSzdQTjRIM0ZxUVM4ZTkyaktVdjUyZGVvbnhETHM3Vm5CUQ==,2023-06-09 05:18:28.183185
youtube#commentThread,W_u3z3KWgr7SLdx-3-lkHs7hFAY,UgzMZTqN3gHoitJY_QJ4AaABAg,"{'videoId': 'rT0IsCyepg4', 'topLevelComment': {'kind': 'youtube#comment', 'etag': '0ay_DGDRhA0G7PiGFle6pLQ9YpE', 'id': 'UgzMZTqN3gHoitJY_QJ4AaABAg', 'snippet': {'videoId': 'rT0IsCyepg4', 'textDisplay': 'Vergonha de moro , se mostrou se somente oportunista do bolsopetismo', 'textOriginal': 'Vergonha de moro , se mostrou se somente oportunista do bolsopetismo', 'authorDisplayName': 'Thiago De Melo', 'authorProfileImageUrl': 'https://yt3.ggpht.com/ytc/AGIKgqMgBpZ9DoNeYMmDtiILWjlkKRnedMSRwvrLqQCCyg=s48-c-k-c0x00ffffff-no-rj', 'authorChannelUrl': 'http://www.youtube.com/channel/UCTzUjkpZJprCGTe5UgrQA3g', 'authorChannelId': {'value': 'UCTzUjkpZJprCGTe5UgrQA3g'}, 'canRate': True, 'viewerRating': 'none', 'likeCount': 0, 'publishedAt': '2022-10-04T23:55:38Z', 'updatedAt': '2022-10-04T23:55:38Z'}}, 'canReply': True, 'totalReplyCount': 0, 'isPublic': True}",,UCTzUjkpZJprCGTe5UgrQA3g,2022-10-04T23:55:38Z,"Vergonha de moro , se mostrou se somente oportunista do bolsopetismo",QURTSl9pMk9HVUpPaGJHQmh2MzN6OVcwckJLMnBBNnlZYlVhZzYzVXc5M2MzSzdQTjRIM0ZxUVM4ZTkyaktVdjUyZGVvbnhETHM3Vm5CUQ==,2023-06-09 05:18:28.183185
youtube#commentThread,OihLPJa_Sb3QiyA7lS5YzQixEpE,UgxrKy4yhz4iK8HnW9h4AaABAg,"{'videoId': 'rT0IsCyepg4', 'topLevelComment': {'kind': 'youtube#comment', 'etag': 'Pj0VO2-QSWlhm1oKi0XF5KyCE3Y', 'id': 'UgxrKy4yhz4iK8HnW9h4AaABAg', 'snippet': {'videoId': 'rT0IsCyepg4', 'textDisplay': 'Apoiar o Lula seria tipo o Alckmin sendo vice do Lula haha', 'textOriginal': 'Apoiar o Lula seria tipo o Alckmin sendo vice do Lula haha', 'authorDisplayName': 'Lilian Carolina', 'authorProfileImageUrl': 'https://yt3.ggpht.com/ytc/AGIKgqNqqQhRArFyH9HJRQFX9OXUmbzUYoY8Uay1EhvD=s48-c-k-c0x00ffffff-no-rj', 'authorChannelUrl': 'http://www.youtube.com/channel/UC1vH3Or_UbiUizKz94zHhOg', 'authorChannelId': {'value': 'UC1vH3Or_UbiUizKz94zHhOg'}, 'canRate': True, 'viewerRating': 'none', 'likeCount': 0, 'publishedAt': '2022-10-04T23:53:07Z', 'updatedAt': '2022-10-04T23:53:07Z'}}, 'canReply': True, 'totalReplyCount': 0, 'isPublic': True}",,UC1vH3Or_UbiUizKz94zHhOg,2022-10-04T23:53:07Z,Apoiar o Lula seria tipo o Alckmin sendo vice do Lula haha,QURTSl9pMk9HVUpPaGJHQmh2MzN6OVcwckJLMnBBNnlZYlVhZzYzVXc5M2MzSzdQTjRIM0ZxUVM4ZTkyaktVdjUyZGVvbnhETHM3Vm5CUQ==,2023-06-09 05:18:28.183185
youtube#commentThread,HiTIDDlBHLP9qVhvhqbnA05Ng-s,UgyP2Yp_ifswFvVE2Cp4AaABAg,"{'videoId': 'rT0IsCyepg4', 'topLevelComment': {'kind': 'youtube#comment', 'etag': 'T1Q5p_9fUJS6Ebeb0Fjftejr0HM', 'id': 'UgyP2Yp_ifswFvVE2Cp4AaABAg', 'snippet': {'videoId': 'rT0IsCyepg4', 'textDisplay': 'Apoiar o Lula seria bizarro demais.... Apesar de ter um clima estranho, não havia outra opção.', 'textOriginal': 'Apoiar o Lula seria bizarro demais.... Apesar de ter um clima estranho, não havia outra opção.', 'authorDisplayName': 'Lilian Carolina', 'authorProfileImageUrl': 'https://yt3.ggpht.com/ytc/AGIKgqNqqQhRArFyH9HJRQFX9OXUmbzUYoY8Uay1EhvD=s48-c-k-c0x00ffffff-no-rj', 'authorChannelUrl': 'http://www.youtube.com/channel/UC1vH3Or_UbiUizKz94zHhOg', 'authorChannelId': {'value': 'UC1vH3Or_UbiUizKz94zHhOg'}, 'canRate': True, 'viewerRating': 'none', 'likeCount': 1, 'publishedAt': '2022-10-04T23:52:44Z', 'updatedAt': '2022-10-04T23:52:44Z'}}, 'canReply': True, 'totalReplyCount': 0, 'isPublic': True}",,UC1vH3Or_UbiUizKz94zHhOg,2022-10-04T23:52:44Z,"Apoiar o Lula seria bizarro demais.... Apesar de ter um clima estranho, não havia outra opção.",QURTSl9pMk9HVUpPaGJHQmh2MzN6OVcwckJLMnBBNnlZYlVhZzYzVXc5M2MzSzdQTjRIM0ZxUVM4ZTkyaktVdjUyZGVvbnhETHM3Vm5CUQ==,2023-06-09 05:18:28.183185
youtube#commentThread,MOYumtW_qK7affbrjRnDHX3PfwE,UgyxUj3AtR9N1ttrSZZ4AaABAg,"{'videoId': 'rT0IsCyepg4', 'topLevelComment': {'kind': 'youtube#comment', 'etag': 'xqPOtC4_OJ3b1NGlyJWBzR5JxRo', 'id': 'UgyxUj3AtR9N1ttrSZZ4AaABAg', 'snippet': {'videoId': 'rT0IsCyepg4', 'textDisplay': 'Lula é MUITO pior que Bolsonaro.', 'textOriginal': 'Lula é MUITO pior que Bolsonaro.', 'authorDisplayName': 'Sacaneando', 'authorProfileImageUrl': 'https://yt3.ggpht.com/ytc/AGIKgqP4uVr2uLH2xFksJ4qZ6cKG9J2VIYlVRASv18rbJJbW5x-ROUmR-rDzcMr5yJm2=s48-c-k-c0x00ffffff-no-rj', 'authorChannelUrl': 'http://www.youtube.com/channel/UCqYPVVQP_QVP-3D2dbAzQOA', 'authorChannelId': {'value': 'UCqYPVVQP_QVP-3D2dbAzQOA'}, 'canRate': True, 'viewerRating': 'none', 'likeCount': 0, 'publishedAt': '2022-10-04T23:46:50Z', 'updatedAt': '2022-10-04T23:46:50Z'}}, 'canReply': True, 'totalReplyCount': 0, 'isPublic': True}",,UCqYPVVQP_QVP-3D2dbAzQOA,2022-10-04T23:46:50Z,Lula é MUITO pior que Bolsonaro.,QURTSl9pMk9HVUpPaGJHQmh2MzN6OVcwckJLMnBBNnlZYlVhZzYzVXc5M2MzSzdQTjRIM0ZxUVM4ZTkyaktVdjUyZGVvbnhETHM3Vm5CUQ==,2023-06-09 05:18:28.183185
youtube#commentThread,mGTKdYLn0Nkt4TOnyi9j2m9IQV0,UgwS_ECEBLTvWFgNf9B4AaABAg,"{'videoId': 'rT0IsCyepg4', 'topLevelComment': {'kind': 'youtube#comment', 'etag': 'O8zJLKLSOsNWma75EsejLyHAJf4', 'id': 'UgwS_ECEBLTvWFgNf9B4AaABAg', 'snippet': {'videoId': 'rT0IsCyepg4', 'textDisplay': 'O POVO quer MORO E BOLSONARO JUNTOS', 'textOriginal': 'O POVO quer MORO E BOLSONARO JUNTOS', 'authorDisplayName': 'Sil', 'authorProfileImageUrl': 'https://yt3.ggpht.com/ytc/AGIKgqOPiMYnOKS3u8iHKH3sKrio5ZMsZVX1X8Vwow=s48-c-k-c0x00ffffff-no-rj', 'authorChannelUrl': 'http://www.youtube.com/channel/UCS236NA2zt4WpjaRe8R75Iw', 'authorChannelId': {'value': 'UCS236NA2zt4WpjaRe8R75Iw'}, 'canRate': True, 'viewerRating': 'none', 'likeCount': 2, 'publishedAt': '2022-10-04T23:43:34Z', 'updatedAt': '2022-10-04T23:43:34Z'}}, 'canReply': True, 'totalReplyCount': 0, 'isPublic': True}",,UCS236NA2zt4WpjaRe8R75Iw,2022-10-04T23:43:34Z,O POVO quer MORO E BOLSONARO JUNTOS,QURTSl9pMk9HVUpPaGJHQmh2MzN6OVcwckJLMnBBNnlZYlVhZzYzVXc5M2MzSzdQTjRIM0ZxUVM4ZTkyaktVdjUyZGVvbnhETHM3Vm5CUQ==,2023-06-09 05:18:28.183185
