kind,etag,id,snippet,replies,authorChannelId,publishedAt,textOriginal,nextPageToken,extraction_date
youtube#commentThread,QPyBrjK3kiCO2ZWWoc85aFyVmKI,UgzweEpWZawTLvOhk0F4AaABAg,"{'videoId': 'rT0IsCyepg4', 'topLevelComment': {'kind': 'youtube#comment', 'etag': 'so6LQ_JpA8JCUe_AOhm2vrLWzzQ', 'id': 'UgzweEpWZawTLvOhk0F4AaABAg', 'snippet': {'videoId': 'rT0IsCyepg4', 'textDisplay': 'LULALADRAO,VELHO CACHACEIRO E COMUNISTA.', 'textOriginal': 'LULALADRAO,VELHO CACHACEIRO E COMUNISTA.', 'authorDisplayName': 'Paulo correia', 'authorProfileImageUrl': 'https://yt3.ggpht.com/ytc/AGIKgqPG5OLjuSWRObhnP3qacRnx84ugXS0fJIXyPZu9nTZe80K7l1G5m8FZiyMfY6a3=s48-c-k-c0x00ffffff-no-rj', 'authorChannelUrl': 'http://www.youtube.com/channel/UCBFEZ-ix-6nxbfS307NK9xA', 'authorChannelId': {'value': 'UCBFEZ-ix-6nxbfS307NK9xA'}, 'canRate': True, 'viewerRating': 'none', 'likeCount': 0, 'publishedAt': '2022-10-24T03:48:18Z', 'updatedAt': '2022-10-24T03:48:18Z'}}, 'canReply': True, 'totalReplyCount': 0, 'isPublic': True}",,UCBFEZ-ix-6nxbfS307NK9xA,2022-10-24T03:48:18Z,"LULALADRAO,VELHO CACHACEIRO E COMUNISTA.",QURTSl9pM09tTTJZU0owRzNQQmpaYzB3cmcxcFVYTmJKbnNfQUE0UlVWRlVDZU5od3lGYXFfOGlPWkZXRTZnaFNRRm9vMkFlWHY2MDUyOA==,2023-06-09 05:18:27.368830
youtube#commentThread,nBuuHfqADlVC_NspN-y7YIT5uM0,Ugy1SEQ6sbrkkg6X82h4AaABAg,"{'videoId': 'rT0IsCyepg4', 'topLevelComment': {'kind': 'youtube#comment', 'etag': 'lsMpPwec8STBrgLEhbOl6AwhQxM', 'id': 'Ugy1SEQ6sbrkkg6X82h4AaABAg', 'snippet': {'videoId': 'rT0IsCyepg4', 'textDisplay': 'LULALADRAO,VELHO CACHACEIRO E COMUNISTA.', 'textOriginal': 'LULALADRAO,VELHO CACHACEIRO E COMUNISTA.', 'authorDisplayName': 'Paulo correia', 'authorProfileImageUrl': 'https://yt3.ggpht.com/ytc/AGIKgqPG5OLjuSWRObhnP3qacRnx84ugXS0fJIXyPZu9nTZe80K7l1G5m8FZiyMfY6a3=s48-c-k-c0x00ffffff-no-rj', 'authorChannelUrl': 'http://www.youtube.com/channel/UCBFEZ-ix-6nxbfS307NK9xA', 'authorChannelId': {'value': 'UCBFEZ-ix-6nxbfS307NK9xA'}, 'canRate': True, 'viewerRating': 'none', 'likeCount': 0, 'publishedAt': '2022-10-24T03:48:11Z', 'updatedAt': '2022-10-24T03:48:11Z'}}, 'canReply': True, 'totalReplyCount': 0, 'isPublic': True}",,UCBFEZ-ix-6nxbfS307NK9xA,2022-10-24T03:48:11Z,"LULALADRAO,VELHO CACHACEIRO E COMUNISTA.",QURTSl9pM09tTTJZU0owRzNQQmpaYzB3cmcxcFVYTmJKbnNfQUE0UlVWRlVDZU5od3lGYXFfOGlPWkZXRTZnaFNRRm9vMkFlWHY2MDUyOA==,2023-06-09 05:18:27.368830
youtube#commentThread,vQbWvrJhoilGPAd5l3v_pfrPQlY,UgwkvXE--JL0zffyxSZ4AaABAg,"{'videoId': 'rT0IsCyepg4', 'topLevelComment': {'kind': 'youtube#comment', 'etag': 'fpvglsphe3xI8AqpgsQqdnaxZKc', 'id': 'UgwkvXE--JL0zffyxSZ4AaABAg', 'snippet': {'videoId': 'rT0IsCyepg4', 'textDisplay': 'LULALADRAO,VELHO CACHACEIRO E COMUNISTA.', 'textOriginal': 'LULALADRAO,VELHO CACHACEIRO E COMUNISTA.', 'authorDisplayName': 'Paulo correia', 'authorProfileImageUrl': 'https://yt3.ggpht.com/ytc/AGIKgqPG5OLjuSWRObhnP3qacRnx84ugXS0fJIXyPZu9nTZe80K7l1G5m8FZiyMfY6a3=s48-c-k-c0x00ffffff-no-rj', 'authorChannelUrl': 'http://www.youtube.com/channel/UCBFEZ-ix-6nxbfS307NK9xA', 'authorChannelId': {'value': 'UCBFEZ-ix-6nxbfS307NK9xA'}, 'canRate': True, 'viewerRating': 'none', 'likeCount': 0, 'publishedAt': '2022-10-24T03:47:59Z', 'updatedAt': '2022-10-24T03:47:59Z'}}, 'canReply': True, 'totalReplyCount': 0, 'isPublic': True}",,UCBFEZ-ix-6nxbfS307NK9xA,2022-10-24T03:47:59Z,"LULALADRAO,VELHO CACHACEIRO E COMUNISTA.",QURTSl9pM09tTTJZU0owRzNQQmpaYzB3cmcxcFVYTmJKbnNfQUE0UlVWRlVDZU5od3lGYXFfOGlPWkZXRTZnaFNRRm9vMkFlWHY2MDUyOA==,2023-06-09 05:18:27.368830
youtube#commentThread,_aEesUWvlfR-UfMKFOnuPYG0_O0,Ugy_dwWjeTUiek4Sj6h4AaABAg,"{'videoId': 'rT0IsCyepg4', 'topLevelComment': {'kind': 'youtube#comment', 'etag': 'shlPh7ROZUusg83Sbtw7j19W6HY', 'id': 'Ugy_dwWjeTUiek4Sj6h4AaABAg', 'snippet': {'videoId': 'rT0IsCyepg4', 'textDisplay': 'Bolsonaro, Moro e Deltan, A Liga da Justiça!!! 🇧🇷🇧🇷🇧🇷🇧🇷', 'textOriginal': 'Bolsonaro, Moro e Deltan, A Liga da Justiça!!! 🇧🇷🇧🇷🇧🇷🇧🇷', 'authorDisplayName': 'Leandrogmrd', 'authorProfileImageUrl': 'https://yt3.ggpht.com/ytc/AGIKgqMTysiV1VeavhegewZoaY6GQaUpexnkgGbduOnTpqQ=s48-c-k-c0x00ffffff-no-rj', 'authorChannelUrl': 'http://www.youtube.com/channel/UCqOwj66-bfV3xI3y8EDA5pg', 'authorChannelId': {'value': 'UCqOwj66-bfV3xI3y8EDA5pg'}, 'canRate': True, 'viewerRating': 'none', 'likeCount': 0, 'publishedAt': '2022-10-17T03:25:59Z', 'updatedAt': '2022-10-17T03:25:59Z'}}, 'canReply': True, 'totalReplyCount': 0, 'isPublic': True}",,UCqOwj66-bfV3xI3y8EDA5pg,2022-10-17T03:25:59Z,"Bolsonaro, Moro e Deltan, A Liga da Justiça!!! 🇧🇷🇧🇷🇧🇷🇧🇷",QURTSl9pM09tTTJZU0owRzNQQmpaYzB3cmcxcFVYTmJKbnNfQUE0UlVWRlVDZU5od3lGYXFfOGlPWkZXRTZnaFNRRm9vMkFlWHY2MDUyOA==,2023-06-09 05:18:27.368830
youtube#commentThread,TvTEvnq1_zOtEdpPXMtuJ-42rMI,Ugz7jLIUx6p9bmO6_-x4AaABAg,"{'videoId': 'rT0IsCyepg4', 'topLevelComment': {'kind': 'youtube#comment', 'etag': '2ULfpIx904Fzjv11dowl7cllRjM', 'id': 'Ugz7jLIUx6p9bmO6_-x4AaABAg', 'snippet': {'videoId': 'rT0IsCyepg4', 'textDisplay': 'MUITO BEM BOLSONARO...PERDOAR É UM DOM DE DEUS...FEZ BEM...DEUS O ABENÇOE', 'textOriginal': 'MUITO BEM BOLSONARO...PERDOAR É UM DOM DE DEUS...FEZ BEM...DEUS O ABENÇOE', 'authorDisplayName': 'Marcos Santos', 'authorProfileImageUrl': 'https://yt3.ggpht.com/ytc/AGIKgqMSap2sMRZDaa6KG4z80mM_dU5YSSf9UQgiWFC8WQI2N0__S7erhuq77OLUVUwR=s48-c-k-c0x00ffffff-no-rj', 'authorChannelUrl': 'http://www.youtube.com/channel/UC8L0xRtd9-86y3yfF6QW1xw', 'authorChannelId': {'value': 'UC8L0xRtd9-86y3yfF6QW1xw'}, 'canRate': True, 'viewerRating': 'none', 'likeCount': 0, 'publishedAt': '2022-10-14T20:24:03Z', 'updatedAt': '2022-10-14T20:24:20Z'}}, 'canReply': True, 'totalReplyCount': 0, 'isPublic': True}",,UC8L0xRtd9-86y3yfF6QW1xw,2022-10-14T20:24:03Z,MUITO BEM BOLSONARO...PERDOAR É UM DOM DE DEUS...FEZ BEM...DEUS O ABENÇOE,QURTSl9pM09tTTJZU0owRzNQQmpaYzB3cmcxcFVYTmJKbnNfQUE0UlVWRlVDZU5od3lGYXFfOGlPWkZXRTZnaFNRRm9vMkFlWHY2MDUyOA==,2023-06-09 05:18:27.368830
youtube#commentThread,VCv5OR-azH8OJ-_Y0ysfVIIZAkw,UgwAkK6p1ZkUNlbwgXl4AaABAg,"{'videoId': 'rT0IsCyepg4', 'topLevelComment': {'kind': 'youtube#comment', 'etag': 'kvdieLWYICD6O25IzDha96_l3g8', 'id': 'UgwAkK6p1ZkUNlbwgXl4AaABAg', 'snippet': {'videoId': 'rT0IsCyepg4', 'textDisplay': 'Lindo a humildade! Esse reencontro trouxe força a nação? É assim que deve ser seguido por todos e muitas felicidades além do amor pela familia! A patria e a nossa família; aliás nos quem fazemos parte dela!  A nossa pátria é o Brasil verde amarelo!!!', 'textOriginal': 'Lindo a humildade! Esse reencontro trouxe força a nação? É assim que deve ser seguido por todos e muitas felicidades além do amor pela familia! A patria e a nossa família; aliás nos quem fazemos parte dela!  A nossa pátria é o Brasil verde amarelo!!!', 'authorDisplayName': 'Jorge Isaac', 'authorProfileImageUrl': 'https://yt3.ggpht.com/ytc/AGIKgqOr97cbUYJ5_J027yhIxug0VZQNVbvBFwAEPw=s48-c-k-c0x00ffffff-no-rj', 'authorChannelUrl': 'http://www.youtube.com/channel/UCKjFwwRKc7IitojdeKaYX_w', 'authorChannelId': {'value': 'UCKjFwwRKc7IitojdeKaYX_w'}, 'canRate': True, 'viewerRating': 'none', 'likeCount': 1, 'publishedAt': '2022-10-11T17:53:58Z', 'updatedAt': '2022-10-11T17:53:58Z'}}, 'canReply': True, 'totalReplyCount': 0, 'isPublic': True}",,UCKjFwwRKc7IitojdeKaYX_w,2022-10-11T17:53:58Z,Lindo a humildade! Esse reencontro trouxe força a nação? É assim que deve ser seguido por todos e muitas felicidades além do amor pela familia! A patria e a nossa família; aliás nos quem fazemos parte dela!  A nossa pátria é o Brasil verde amarelo!!!,QURTSl9pM09tTTJZU0owRzNQQmpaYzB3cmcxcFVYTmJKbnNfQUE0UlVWRlVDZU5od3lGYXFfOGlPWkZXRTZnaFNRRm9vMkFlWHY2MDUyOA==,2023-06-09 05:18:27.368830
youtube#commentThread,8Cz1buXIYAIXjZigIQ76PDhqYDw,UgxP1YOQ9h1rqGJePFN4AaABAg,"{'videoId': 'rT0IsCyepg4', 'topLevelComment': {'kind': 'youtube#comment', 'etag': 'jXwYdxys0ev1h7PAwUcwkW7rYks', 'id': 'UgxP1YOQ9h1rqGJePFN4AaABAg', 'snippet': {'videoId': 'rT0IsCyepg4', 'textDisplay': 'Bolsonaro você chamou moro de traidor, agora estão juntos , quem será o traidor', 'textOriginal': 'Bolsonaro você chamou moro de traidor, agora estão juntos , quem será o traidor', 'authorDisplayName': 'Josepino De Carli', 'authorProfileImageUrl': 'https://yt3.ggpht.com/ytc/AGIKgqO1NrNsV-lSiNwYEGYx3w50l7InwkDvmrgcPw=s48-c-k-c0x00ffffff-no-rj', 'authorChannelUrl': 'http://www.youtube.com/channel/UCfA28V2cQ1t1lPovo0daL6g', 'authorChannelId': {'value': 'UCfA28V2cQ1t1lPovo0daL6g'}, 'canRate': True, 'viewerRating': 'none', 'likeCount': 0, 'publishedAt': '2022-10-11T00:06:28Z', 'updatedAt': '2022-10-11T00:06:28Z'}}, 'canReply': True, 'totalReplyCount': 0, 'isPublic': True}",,UCfA28V2cQ1t1lPovo0daL6g,2022-10-11T00:06:28Z,"Bolsonaro você chamou moro de traidor, agora estão juntos , quem será o traidor",QURTSl9pM09tTTJZU0owRzNQQmpaYzB3cmcxcFVYTmJKbnNfQUE0UlVWRlVDZU5od3lGYXFfOGlPWkZXRTZnaFNRRm9vMkFlWHY2MDUyOA==,2023-06-09 05:18:27.368830
youtube#commentThread,XQRj_6aoC-bwpdqFBPtPIHIvZzQ,Ugx16keKdbNwIVs2shR4AaABAg,"{'videoId': 'rT0IsCyepg4', 'topLevelComment': {'kind': 'youtube#comment', 'etag': 'rV0oRBa_OSFZwE_dG5Z9WOopB1o', 'id': 'Ugx16keKdbNwIVs2shR4AaABAg', 'snippet': {'videoId': 'rT0IsCyepg4', 'textDisplay': 'Comparar Lula e Bolsonaro é no mínimo Débil, não existe comparação nenhuma(um é um bandido condenado em diversas instâncias, protagonista do maior escândalo de corrupção da história do Brasil; quer regular mídia; acabar com teto de gastos; apoiador de diversos ditadores e sistemas de governo totalitários; legalizar aborto; prender opositores; proibir armas de fogo; aumentar o tamanho do estado............. O outro da declarações polêmicas, e teve um mandato onde 3 dos 4 anos de governos teve que lutar contra uma pandemia mundial e uma guerra... Realmente parece bem difícil escolher entre um e outro né? Realmente parece bem inteligente Votar Nulo e correr o risco de sofrer o que outros todos os países da América do Sul estão sofrendo agora em 2022!', 'textOriginal': 'Comparar Lula e Bolsonaro é no mínimo Débil, não existe comparação nenhuma(um é um bandido condenado em diversas instâncias, protagonista do maior escândalo de corrupção da história do Brasil; quer regular mídia; acabar com teto de gastos; apoiador de diversos ditadores e sistemas de governo totalitários; legalizar aborto; prender opositores; proibir armas de fogo; aumentar o tamanho do estado............. O outro da declarações polêmicas, e teve um mandato onde 3 dos 4 anos de governos teve que lutar contra uma pandemia mundial e uma guerra... Realmente parece bem difícil escolher entre um e outro né? Realmente parece bem inteligente Votar Nulo e correr o risco de sofrer o que outros todos os países da América do Sul estão sofrendo agora em 2022!', 'authorDisplayName': 'Eu sou o Bruno', 'authorProfileImageUrl': 'https://yt3.ggpht.com/xvhAyk_3EldpDNzcVzAHgew39pLQL3fJtqDVdBu84occVqf5KaFla24BJa-KKrLp8pnQqOPn=s48-c-k-c0x00ffffff-no-rj', 'authorChannelUrl': 'http://www.youtube.com/channel/UCyB4nlxZnIPHc8urW9xPcyg', 'authorChannelId': {'value': 'UCyB4nlxZnIPHc8urW9xPcyg'}, 'canRate': True, 'viewerRating': 'none', 'likeCount': 0, 'publishedAt': '2022-10-10T02:18:08Z', 'updatedAt': '2022-10-10T02:18:08Z'}}, 'canReply': True, 'totalReplyCount': 0, 'isPublic': True}",,UCyB4nlxZnIPHc8urW9xPcyg,2022-10-10T02:18:08Z,"Comparar Lula e Bolsonaro é no mínimo Débil, não existe comparação nenhuma(um é um bandido condenado em diversas instâncias, protagonista do maior escândalo de corrupção da história do Brasil; quer regular mídia; acabar com teto de gastos; apoiador de diversos ditadores e sistemas de governo totalitários; legalizar aborto; prender opositores; proibir armas de fogo; aumentar o tamanho do estado............. O outro da declarações polêmicas, e teve um mandato onde 3 dos 4 anos de governos teve que lutar contra uma pandemia mundial e uma guerra... Realmente parece bem difícil escolher entre um e outro né? Realmente parece bem inteligente Votar Nulo e correr o risco de sofrer o que outros todos os países da América do Sul estão sofrendo agora em 2022!",QURTSl9pM09tTTJZU0owRzNQQmpaYzB3cmcxcFVYTmJKbnNfQUE0UlVWRlVDZU5od3lGYXFfOGlPWkZXRTZnaFNRRm9vMkFlWHY2MDUyOA==,2023-06-09 05:18:27.368830
youtube#commentThread,i64hfEGVb1esFFBQGRU5bk_Zx28,Ugzzg7UBlBJaXN-Rnw94AaABAg,"{'videoId': 'rT0IsCyepg4', 'topLevelComment': {'kind': 'youtube#comment', 'etag': 'Vifec4pYp6Zs5J-wALF4XIwFK_s', 'id': 'Ugzzg7UBlBJaXN-Rnw94AaABAg', 'snippet': {'videoId': 'rT0IsCyepg4', 'textDisplay': 'porque Bolsonaro teria algo contra se moro e dalangnol se uniram para afastar lula da presidência e eleger isso aí...', 'textOriginal': 'porque Bolsonaro teria algo contra se moro e dalangnol se uniram para afastar lula da presidência e eleger isso aí...', 'authorDisplayName': 'Gustavo Bueno', 'authorProfileImageUrl': 'https://yt3.ggpht.com/ytc/AGIKgqM__O3TDVYVaSdM5Q7zuKxV8nJ0zPo76MsVpg=s48-c-k-c0x00ffffff-no-rj', 'authorChannelUrl': 'http://www.youtube.com/channel/UCWU2F1YNYQ4K1IdrD1YNUFg', 'authorChannelId': {'value': 'UCWU2F1YNYQ4K1IdrD1YNUFg'}, 'canRate': True, 'viewerRating': 'none', 'likeCount': 0, 'publishedAt': '2022-10-07T21:22:16Z', 'updatedAt': '2022-10-07T21:22:16Z'}}, 'canReply': True, 'totalReplyCount': 0, 'isPublic': True}",,UCWU2F1YNYQ4K1IdrD1YNUFg,2022-10-07T21:22:16Z,porque Bolsonaro teria algo contra se moro e dalangnol se uniram para afastar lula da presidência e eleger isso aí...,QURTSl9pM09tTTJZU0owRzNQQmpaYzB3cmcxcFVYTmJKbnNfQUE0UlVWRlVDZU5od3lGYXFfOGlPWkZXRTZnaFNRRm9vMkFlWHY2MDUyOA==,2023-06-09 05:18:27.368830
youtube#commentThread,23tgLVXhA7CSEnJG4-m8dkB_DU8,UgzdrU6S_uwadUvM2DV4AaABAg,"{'videoId': 'rT0IsCyepg4', 'topLevelComment': {'kind': 'youtube#comment', 'etag': 'DXafXSMbcyBHhpBiM2sJjj_9nG0', 'id': 'UgzdrU6S_uwadUvM2DV4AaABAg', 'snippet': {'videoId': 'rT0IsCyepg4', 'textDisplay': 'O povo não confia no Sérgio   moro mais tá aí fazer oq  eu não confio no Sérgio moro', 'textOriginal': 'O povo não confia no Sérgio   moro mais tá aí fazer oq  eu não confio no Sérgio moro', 'authorDisplayName': 'Weliton lucio Lucio', 'authorProfileImageUrl': 'https://yt3.ggpht.com/ytc/AGIKgqPqyFzTR4lTEu2i58i0d6HnNZZZIIeLwSoRkYARXtWDYs0okP5Tlz7wQBM8oVil=s48-c-k-c0x00ffffff-no-rj', 'authorChannelUrl': 'http://www.youtube.com/channel/UCY7xJO1WJs4dyneepijC15w', 'authorChannelId': {'value': 'UCY7xJO1WJs4dyneepijC15w'}, 'canRate': True, 'viewerRating': 'none', 'likeCount': 0, 'publishedAt': '2022-10-07T15:35:08Z', 'updatedAt': '2022-10-07T15:35:08Z'}}, 'canReply': True, 'totalReplyCount': 0, 'isPublic': True}",,UCY7xJO1WJs4dyneepijC15w,2022-10-07T15:35:08Z,O povo não confia no Sérgio   moro mais tá aí fazer oq  eu não confio no Sérgio moro,QURTSl9pM09tTTJZU0owRzNQQmpaYzB3cmcxcFVYTmJKbnNfQUE0UlVWRlVDZU5od3lGYXFfOGlPWkZXRTZnaFNRRm9vMkFlWHY2MDUyOA==,2023-06-09 05:18:27.368830
youtube#commentThread,DGIADKvsw4r-kq0BImea_PYJ7Rc,Ugy_QLXYtSm2frCtXeF4AaABAg,"{'videoId': 'rT0IsCyepg4', 'topLevelComment': {'kind': 'youtube#comment', 'etag': 'mQPLlVsWJsduwP4K1m5_tNIbZKM', 'id': 'Ugy_QLXYtSm2frCtXeF4AaABAg', 'snippet': {'videoId': 'rT0IsCyepg4', 'textDisplay': 'Lula é Ladrao, Bolsonaro nao desabona Moro, mas quando Moro queria investigar os filhos dele Bolsonaro foi um Leao para proteger o rei das Rachadinhas, entao logo bolsonaro tbm colaborou com um Ladrao. Agora ele fala que o que foi no passado ficou no passado, ou seja: AS RACHADINHAS FICOU NO PASSADO? O DESCASO DA COVID FICOU NO PASSADO? ASSIM O PT VAI FALAR PRA OS ROUBOS DELES FICAR NO PASSADO TBM? Falar dos 9dedos e dos petralhas é chover no molhado sabemos que se voltarem ao poder vao roubar de novo. O que dói é que temos 2 candidatos propicios a falir o brasil nos proximos anos. 2 candidatos que na minha opniao deveriam estar presos, um por colaborar, e esconder os crimes do filho(bolsonaro) e outro candidato(LULA) por ROUBAR mesmo.', 'textOriginal': 'Lula é Ladrao, Bolsonaro nao desabona Moro, mas quando Moro queria investigar os filhos dele Bolsonaro foi um Leao para proteger o rei das Rachadinhas, entao logo bolsonaro tbm colaborou com um Ladrao. Agora ele fala que o que foi no passado ficou no passado, ou seja: AS RACHADINHAS FICOU NO PASSADO? O DESCASO DA COVID FICOU NO PASSADO? ASSIM O PT VAI FALAR PRA OS ROUBOS DELES FICAR NO PASSADO TBM? Falar dos 9dedos e dos petralhas é chover no molhado sabemos que se voltarem ao poder vao roubar de novo. O que dói é que temos 2 candidatos propicios a falir o brasil nos proximos anos. 2 candidatos que na minha opniao deveriam estar presos, um por colaborar, e esconder os crimes do filho(bolsonaro) e outro candidato(LULA) por ROUBAR mesmo.', 'authorDisplayName': 'Fabio Sousa', 'authorProfileImageUrl': 'https://yt3.ggpht.com/ytc/AGIKgqPHW_oQw-mOydywfl-iSF9rNIulbtPUT1CKTdw=s48-c-k-c0x00ffffff-no-rj', 'authorChannelUrl': 'http://www.youtube.com/channel/UCLfft0qaGSir_Nwk9jP5EQA', 'authorChannelId': {'value': 'UCLfft0qaGSir_Nwk9jP5EQA'}, 'canRate': True, 'viewerRating': 'none', 'likeCount': 0, 'publishedAt': '2022-10-07T14:11:43Z', 'updatedAt': '2022-10-07T14:11:43Z'}}, 'canReply': True, 'totalReplyCount': 0, 'isPublic': True}",,UCLfft0qaGSir_Nwk9jP5EQA,2022-10-07T14:11:43Z,"Lula é Ladrao, Bolsonaro nao desabona Moro, mas quando Moro queria investigar os filhos dele Bolsonaro foi um Leao para proteger o rei das Rachadinhas, entao logo bolsonaro tbm colaborou com um Ladrao. Agora ele fala que o que foi no passado ficou no passado, ou seja: AS RACHADINHAS FICOU NO PASSADO? O DESCASO DA COVID FICOU NO PASSADO? ASSIM O PT VAI FALAR PRA OS ROUBOS DELES FICAR NO PASSADO TBM? Falar dos 9dedos e dos petralhas é chover no molhado sabemos que se voltarem ao poder vao roubar de novo. O que dói é que temos 2 candidatos propicios a falir o brasil nos proximos anos. 2 candidatos que na minha opniao deveriam estar presos, um por colaborar, e esconder os crimes do filho(bolsonaro) e outro candidato(LULA) por ROUBAR mesmo.",QURTSl9pM09tTTJZU0owRzNQQmpaYzB3cmcxcFVYTmJKbnNfQUE0UlVWRlVDZU5od3lGYXFfOGlPWkZXRTZnaFNRRm9vMkFlWHY2MDUyOA==,2023-06-09 05:18:27.368830
youtube#commentThread,SUTslg7UyKs1zdMe6x1CDbhad48,UgzzkPrjvr7D-qMOSgB4AaABAg,"{'videoId': 'rT0IsCyepg4', 'topLevelComment': {'kind': 'youtube#comment', 'etag': 'GLqvHWSw7VTvZ3SE-9VTm-EhEd4', 'id': 'UgzzkPrjvr7D-qMOSgB4AaABAg', 'snippet': {'videoId': 'rT0IsCyepg4', 'textDisplay': '“Ninguém vai ganhar, nem perder, nem quem ganhar ou perder, vai todo mundo perder “<br><br>Esse foi o único acerto da presidanta', 'textOriginal': '“Ninguém vai ganhar, nem perder, nem quem ganhar ou perder, vai todo mundo perder “\\n\\nEsse foi o único acerto da presidanta', 'authorDisplayName': 'anderson rosa', 'authorProfileImageUrl': 'https://yt3.ggpht.com/ytc/AGIKgqNTEeIiSBEohsZ2V9HdyYHha6kRsRDmsFMKCQ=s48-c-k-c0x00ffffff-no-rj', 'authorChannelUrl': 'http://www.youtube.com/channel/UCs36geF8SzyrduixhglSgLg', 'authorChannelId': {'value': 'UCs36geF8SzyrduixhglSgLg'}, 'canRate': True, 'viewerRating': 'none', 'likeCount': 0, 'publishedAt': '2022-10-07T11:55:31Z', 'updatedAt': '2022-10-07T11:55:31Z'}}, 'canReply': True, 'totalReplyCount': 0, 'isPublic': True}",,UCs36geF8SzyrduixhglSgLg,2022-10-07T11:55:31Z,"“Ninguém vai ganhar, nem perder, nem quem ganhar ou perder, vai todo mundo perder “

Esse foi o único acerto da presidanta",QURTSl9pM09tTTJZU0owRzNQQmpaYzB3cmcxcFVYTmJKbnNfQUE0UlVWRlVDZU5od3lGYXFfOGlPWkZXRTZnaFNRRm9vMkFlWHY2MDUyOA==,2023-06-09 05:18:27.368830
youtube#commentThread,66G3SLiLKagAX0iGllkloO7QcS0,UgxounsDYSTGM4_PFfl4AaABAg,"{'videoId': 'rT0IsCyepg4', 'topLevelComment': {'kind': 'youtube#comment', 'etag': '28pKe5g2xUobtOzkRIQgX4WOG1I', 'id': 'UgxounsDYSTGM4_PFfl4AaABAg', 'snippet': {'videoId': 'rT0IsCyepg4', 'textDisplay': 'Moro se queimou demais. Prendeu um inocente, se vendeu ao governo, foi chutado, agora voltou. Que faaaaaseeee!', 'textOriginal': 'Moro se queimou demais. Prendeu um inocente, se vendeu ao governo, foi chutado, agora voltou. Que faaaaaseeee!', 'authorDisplayName': 'xmurilo86', 'authorProfileImageUrl': 'https://yt3.ggpht.com/ytc/AGIKgqMQrOW7D5xjgWxxu_rTNNHOv7RxepSHomExc9rFaQ=s48-c-k-c0x00ffffff-no-rj', 'authorChannelUrl': 'http://www.youtube.com/channel/UCgsB82VG1F1tGbNxqYn_ZMw', 'authorChannelId': {'value': 'UCgsB82VG1F1tGbNxqYn_ZMw'}, 'canRate': True, 'viewerRating': 'none', 'likeCount': 0, 'publishedAt': '2022-10-07T10:20:27Z', 'updatedAt': '2022-10-07T10:20:27Z'}}, 'canReply': True, 'totalReplyCount': 0, 'isPublic': True}",,UCgsB82VG1F1tGbNxqYn_ZMw,2022-10-07T10:20:27Z,"Moro se queimou demais. Prendeu um inocente, se vendeu ao governo, foi chutado, agora voltou. Que faaaaaseeee!",QURTSl9pM09tTTJZU0owRzNQQmpaYzB3cmcxcFVYTmJKbnNfQUE0UlVWRlVDZU5od3lGYXFfOGlPWkZXRTZnaFNRRm9vMkFlWHY2MDUyOA==,2023-06-09 05:18:27.368830
youtube#commentThread,OcC_wc86l3GKm02aaUYtYsUT1Bw,Ugw7w7jKzAFr3O8lY-x4AaABAg,"{'videoId': 'rT0IsCyepg4', 'topLevelComment': {'kind': 'youtube#comment', 'etag': 'XMitrWbNX1-ZuEcpOg85J1jPX-E', 'id': 'Ugw7w7jKzAFr3O8lY-x4AaABAg', 'snippet': {'videoId': 'rT0IsCyepg4', 'textDisplay': 'Caiu na real.', 'textOriginal': 'Caiu na real.', 'authorDisplayName': 'Silva Mell', 'authorProfileImageUrl': 'https://yt3.ggpht.com/ytc/AGIKgqNGRDkUO6saPa-j4ki9IW3p59HVguACT3zkeQ=s48-c-k-c0x00ffffff-no-rj', 'authorChannelUrl': 'http://www.youtube.com/channel/UCImxjUHVw-sKLd4W1gjJosQ', 'authorChannelId': {'value': 'UCImxjUHVw-sKLd4W1gjJosQ'}, 'canRate': True, 'viewerRating': 'none', 'likeCount': 0, 'publishedAt': '2022-10-07T02:45:30Z', 'updatedAt': '2022-10-07T02:45:30Z'}}, 'canReply': True, 'totalReplyCount': 0, 'isPublic': True}",,UCImxjUHVw-sKLd4W1gjJosQ,2022-10-07T02:45:30Z,Caiu na real.,QURTSl9pM09tTTJZU0owRzNQQmpaYzB3cmcxcFVYTmJKbnNfQUE0UlVWRlVDZU5od3lGYXFfOGlPWkZXRTZnaFNRRm9vMkFlWHY2MDUyOA==,2023-06-09 05:18:27.368830
youtube#commentThread,mHnNdRH72awMbc7SqxXhOO7VXC0,Ugz2JJevQCAurCW5xNR4AaABAg,"{'videoId': 'rT0IsCyepg4', 'topLevelComment': {'kind': 'youtube#comment', 'etag': 'jOBV9MFtLYKj8_0z54X1xNoaIYI', 'id': 'Ugz2JJevQCAurCW5xNR4AaABAg', 'snippet': {'videoId': 'rT0IsCyepg4', 'textDisplay': 'O que são desentendimentos do passado quando temos uma quadrilha mal descondenada às pressas de qualquer jeito para voltar ao poder. Stf no momento vergonha nacional', 'textOriginal': 'O que são desentendimentos do passado quando temos uma quadrilha mal descondenada às pressas de qualquer jeito para voltar ao poder. Stf no momento vergonha nacional', 'authorDisplayName': 'Carlos Barboza', 'authorProfileImageUrl': 'https://yt3.ggpht.com/ytc/AGIKgqN01b5DYaZ73YF6UZIlh4sH-qZ7D7V0TI41wQ=s48-c-k-c0x00ffffff-no-rj', 'authorChannelUrl': 'http://www.youtube.com/channel/UC79Sf_srcHHyo3l7dmdN5ow', 'authorChannelId': {'value': 'UC79Sf_srcHHyo3l7dmdN5ow'}, 'canRate': True, 'viewerRating': 'none', 'likeCount': 0, 'publishedAt': '2022-10-06T22:41:32Z', 'updatedAt': '2022-10-06T22:41:32Z'}}, 'canReply': True, 'totalReplyCount': 0, 'isPublic': True}",,UC79Sf_srcHHyo3l7dmdN5ow,2022-10-06T22:41:32Z,O que são desentendimentos do passado quando temos uma quadrilha mal descondenada às pressas de qualquer jeito para voltar ao poder. Stf no momento vergonha nacional,QURTSl9pM09tTTJZU0owRzNQQmpaYzB3cmcxcFVYTmJKbnNfQUE0UlVWRlVDZU5od3lGYXFfOGlPWkZXRTZnaFNRRm9vMkFlWHY2MDUyOA==,2023-06-09 05:18:27.368830
youtube#commentThread,xqgIVsUIndaBuqdn4mnoTXJwG5o,Ugz5oUpWIVGXiNdvhm14AaABAg,"{'videoId': 'rT0IsCyepg4', 'topLevelComment': {'kind': 'youtube#comment', 'etag': '80hWUpGm_0o0-cGU7iU3GS8GZ7E', 'id': 'Ugz5oUpWIVGXiNdvhm14AaABAg', 'snippet': {'videoId': 'rT0IsCyepg4', 'textDisplay': 'Bolsonaro: &quot;Sérgio Moro? Nunca critiquei, talkei?&quot;', 'textOriginal': 'Bolsonaro: ""Sérgio Moro? Nunca critiquei, talkei?""', 'authorDisplayName': 'Wesley Caprini Alberti', 'authorProfileImageUrl': 'https://yt3.ggpht.com/ytc/AGIKgqPSIuJkUC98gp9Hu2q5q0hXYYlJwDNKVxX3lw=s48-c-k-c0x00ffffff-no-rj', 'authorChannelUrl': 'http://www.youtube.com/channel/UCpmAXYxXeBOImTkkgA0TCkQ', 'authorChannelId': {'value': 'UCpmAXYxXeBOImTkkgA0TCkQ'}, 'canRate': True, 'viewerRating': 'none', 'likeCount': 0, 'publishedAt': '2022-10-06T22:04:00Z', 'updatedAt': '2022-10-06T22:04:00Z'}}, 'canReply': True, 'totalReplyCount': 0, 'isPublic': True}",,UCpmAXYxXeBOImTkkgA0TCkQ,2022-10-06T22:04:00Z,"Bolsonaro: ""Sérgio Moro? Nunca critiquei, talkei?""",QURTSl9pM09tTTJZU0owRzNQQmpaYzB3cmcxcFVYTmJKbnNfQUE0UlVWRlVDZU5od3lGYXFfOGlPWkZXRTZnaFNRRm9vMkFlWHY2MDUyOA==,2023-06-09 05:18:27.368830
youtube#commentThread,IGElK-DTzvBzq7hSWLDI0V8b7MM,Ugw_2xDRL_BQMmimPoh4AaABAg,"{'videoId': 'rT0IsCyepg4', 'topLevelComment': {'kind': 'youtube#comment', 'etag': 'GQiF9FJxA2Ohx9JmYq545TifYL4', 'id': 'Ugw_2xDRL_BQMmimPoh4AaABAg', 'snippet': {'videoId': 'rT0IsCyepg4', 'textDisplay': 'PARABÉNS AO POVO PARANAENSE POR COLOCAR SÉRGIO MORO NO SENADO .', 'textOriginal': 'PARABÉNS AO POVO PARANAENSE POR COLOCAR SÉRGIO MORO NO SENADO .', 'authorDisplayName': 'Luis Antonio Rodrigues De Moraes', 'authorProfileImageUrl': 'https://yt3.ggpht.com/ytc/AGIKgqMe2vTgykG2Gt6Ak0OhyupF3wk9IhlHWcBTtw=s48-c-k-c0x00ffffff-no-rj', 'authorChannelUrl': 'http://www.youtube.com/channel/UC3M4O6u_g4QuNhn-sWrAY5A', 'authorChannelId': {'value': 'UC3M4O6u_g4QuNhn-sWrAY5A'}, 'canRate': True, 'viewerRating': 'none', 'likeCount': 0, 'publishedAt': '2022-10-06T20:32:02Z', 'updatedAt': '2022-10-06T20:32:02Z'}}, 'canReply': True, 'totalReplyCount': 0, 'isPublic': True}",,UC3M4O6u_g4QuNhn-sWrAY5A,2022-10-06T20:32:02Z,PARABÉNS AO POVO PARANAENSE POR COLOCAR SÉRGIO MORO NO SENADO .,QURTSl9pM09tTTJZU0owRzNQQmpaYzB3cmcxcFVYTmJKbnNfQUE0UlVWRlVDZU5od3lGYXFfOGlPWkZXRTZnaFNRRm9vMkFlWHY2MDUyOA==,2023-06-09 05:18:27.368830
