kind,etag,id,snippet,replies,authorChannelId,publishedAt,textOriginal,nextPageToken,extraction_date
youtube#commentThread,Y4MAprSUiV2XpJu1YZQ3N2rzhhI,UgyNhIavrRL343U_qC54AaABAg,"{'videoId': 'oeQDimow_bE', 'topLevelComment': {'kind': 'youtube#comment', 'etag': 'ircWoJg7xgHtQ1is6adFz0X66fg', 'id': 'UgyNhIavrRL343U_qC54AaABAg', 'snippet': {'videoId': 'oeQDimow_bE', 'textDisplay': 'Bozolouco nazifascista corrupto incompetente e inútil e sua trupe só tem dois caminhos para seguir : Bangu ou manicômio', 'textOriginal': 'Bozolouco nazifascista corrupto incompetente e inútil e sua trupe só tem dois caminhos para seguir : Bangu ou manicômio', 'authorDisplayName': 'FELIX Reyes', 'authorProfileImageUrl': 'https://yt3.ggpht.com/ytc/AGIKgqOsLfFCwNByKn3wn2F9aIwBQFlHW9nkr5kaIQ=s48-c-k-c0x00ffffff-no-rj', 'authorChannelUrl': 'http://www.youtube.com/channel/UC0hYNm8Fgt0v7Up12ai2kow', 'authorChannelId': {'value': 'UC0hYNm8Fgt0v7Up12ai2kow'}, 'canRate': True, 'viewerRating': 'none', 'likeCount': 0, 'publishedAt': '2022-10-27T19:39:55Z', 'updatedAt': '2022-10-27T19:39:55Z'}}, 'canReply': True, 'totalReplyCount': 0, 'isPublic': True}",,UC0hYNm8Fgt0v7Up12ai2kow,2022-10-27T19:39:55Z,Bozolouco nazifascista corrupto incompetente e inútil e sua trupe só tem dois caminhos para seguir : Bangu ou manicômio,,2023-06-09 12:08:56.019050
youtube#commentThread,I6xtT70ADrbD0lWLz8B2Zx4Crng,UgzuekbCNfaDKaE69l94AaABAg,"{'videoId': 'oeQDimow_bE', 'topLevelComment': {'kind': 'youtube#comment', 'etag': 'V3-6S-PVJzRENCI3quBVJIsEG7k', 'id': 'UgzuekbCNfaDKaE69l94AaABAg', 'snippet': {'videoId': 'oeQDimow_bE', 'textDisplay': 'Eu não entendo esse povo, primeiro respeito qualquer religião, tem que parar com isso política e religião não funciona , a verdade tem que ser dita ,na política nas empresas manda eo poder dinheiro.', 'textOriginal': 'Eu não entendo esse povo, primeiro respeito qualquer religião, tem que parar com isso política e religião não funciona , a verdade tem que ser dita ,na política nas empresas manda eo poder dinheiro.', 'authorDisplayName': 'Alex José', 'authorProfileImageUrl': 'https://yt3.ggpht.com/ytc/AGIKgqPAb92TZhzHD4ycmS5X6pXJoYoqDeXyQEdoGA=s48-c-k-c0x00ffffff-no-rj', 'authorChannelUrl': 'http://www.youtube.com/channel/UC_mGPTATK6AaTmwwDf0lWog', 'authorChannelId': {'value': 'UC_mGPTATK6AaTmwwDf0lWog'}, 'canRate': True, 'viewerRating': 'none', 'likeCount': 0, 'publishedAt': '2022-10-26T21:32:34Z', 'updatedAt': '2022-10-26T21:32:34Z'}}, 'canReply': True, 'totalReplyCount': 0, 'isPublic': True}",,UC_mGPTATK6AaTmwwDf0lWog,2022-10-26T21:32:34Z,"Eu não entendo esse povo, primeiro respeito qualquer religião, tem que parar com isso política e religião não funciona , a verdade tem que ser dita ,na política nas empresas manda eo poder dinheiro.",,2023-06-09 12:08:56.019050
youtube#commentThread,D2y1dUSSCLCwYyeDwIKYkUrgEyY,UgxEyNspsglrrhYQwiR4AaABAg,"{'videoId': 'oeQDimow_bE', 'topLevelComment': {'kind': 'youtube#comment', 'etag': 'ytdUkfWoyGEcgq8Vwak742o8mCA', 'id': 'UgxEyNspsglrrhYQwiR4AaABAg', 'snippet': {'videoId': 'oeQDimow_bE', 'textDisplay': 'Tem como vota num prezidente  deste nao', 'textOriginal': 'Tem como vota num prezidente  deste nao', 'authorDisplayName': 'Elias Gonzaga', 'authorProfileImageUrl': 'https://yt3.ggpht.com/ytc/AGIKgqMaYTJxLBVfm3T_EnfCUPwK3CWWKqUxkk7eSj1L4vokoLfQhyvjThwZRavpMAFY=s48-c-k-c0x00ffffff-no-rj', 'authorChannelUrl': 'http://www.youtube.com/channel/UCh2mQDTYhkJlo0JIrfohh2Q', 'authorChannelId': {'value': 'UCh2mQDTYhkJlo0JIrfohh2Q'}, 'canRate': True, 'viewerRating': 'none', 'likeCount': 0, 'publishedAt': '2022-10-26T14:48:24Z', 'updatedAt': '2022-10-26T14:48:24Z'}}, 'canReply': True, 'totalReplyCount': 0, 'isPublic': True}",,UCh2mQDTYhkJlo0JIrfohh2Q,2022-10-26T14:48:24Z,Tem como vota num prezidente  deste nao,,2023-06-09 12:08:56.019050
youtube#commentThread,wqMXA073TgrGzmHxorvr4yNndKs,UgyNEQfG23K1bjbSvMZ4AaABAg,"{'videoId': 'oeQDimow_bE', 'topLevelComment': {'kind': 'youtube#comment', 'etag': 'zSP1dPk_l2UwCqNd-xchChiK050', 'id': 'UgyNEQfG23K1bjbSvMZ4AaABAg', 'snippet': {'videoId': 'oeQDimow_bE', 'textDisplay': 'Esses são os CACAs, caçadores, atiradores, colecionadores e arruaceiros', 'textOriginal': 'Esses são os CACAs, caçadores, atiradores, colecionadores e arruaceiros', 'authorDisplayName': 'listerix62', 'authorProfileImageUrl': 'https://yt3.ggpht.com/ytc/AGIKgqMjPEI_uD69sOxuyVQExVU_obE28TQZcBMN3w=s48-c-k-c0x00ffffff-no-rj', 'authorChannelUrl': 'http://www.youtube.com/channel/UCdA2e9_tFS7ZvwjwPbz3X8Q', 'authorChannelId': {'value': 'UCdA2e9_tFS7ZvwjwPbz3X8Q'}, 'canRate': True, 'viewerRating': 'none', 'likeCount': 0, 'publishedAt': '2022-10-26T10:03:23Z', 'updatedAt': '2022-10-26T10:03:23Z'}}, 'canReply': True, 'totalReplyCount': 0, 'isPublic': True}",,UCdA2e9_tFS7ZvwjwPbz3X8Q,2022-10-26T10:03:23Z,"Esses são os CACAs, caçadores, atiradores, colecionadores e arruaceiros",,2023-06-09 12:08:56.019050
youtube#commentThread,Q9Nbyff2PkeTruztCEvEPSu2-do,UgxjJ4ikJNlGFjuq4bd4AaABAg,"{'videoId': 'oeQDimow_bE', 'topLevelComment': {'kind': 'youtube#comment', 'etag': 'KDC__jpXrPzD9J41MvIylo3smsc', 'id': 'UgxjJ4ikJNlGFjuq4bd4AaABAg', 'snippet': {'videoId': 'oeQDimow_bE', 'textDisplay': 'Vamos lá pessoal, vencer juntos meus amigos 💓<br>Dia 30 domingo 13 LULA LULA LULA LULA LULA LULA LULA 🎉🎉🎉🎉🎉🎉🎉🎉🎉🎉🙏', 'textOriginal': 'Vamos lá pessoal, vencer juntos meus amigos 💓\\nDia 30 domingo 13 LULA LULA LULA LULA LULA LULA LULA 🎉🎉🎉🎉🎉🎉🎉🎉🎉🎉🙏', 'authorDisplayName': 'Monica Sanchez', 'authorProfileImageUrl': 'https://yt3.ggpht.com/ytc/AGIKgqNIE0mJCMsJzE1b4sPQBFyAI8tfnzBidvnouA=s48-c-k-c0x00ffffff-no-rj', 'authorChannelUrl': 'http://www.youtube.com/channel/UClmvjJE68FXXficDegwkxJQ', 'authorChannelId': {'value': 'UClmvjJE68FXXficDegwkxJQ'}, 'canRate': True, 'viewerRating': 'none', 'likeCount': 0, 'publishedAt': '2022-10-26T09:34:59Z', 'updatedAt': '2022-10-26T09:34:59Z'}}, 'canReply': True, 'totalReplyCount': 0, 'isPublic': True}",,UClmvjJE68FXXficDegwkxJQ,2022-10-26T09:34:59Z,"Vamos lá pessoal, vencer juntos meus amigos 💓
Dia 30 domingo 13 LULA LULA LULA LULA LULA LULA LULA 🎉🎉🎉🎉🎉🎉🎉🎉🎉🎉🙏",,2023-06-09 12:08:56.019050
youtube#commentThread,rFIuCmKvfoNzqH7gb7U5wNe1qq8,Ugx5SFyEtPm3atc6SrF4AaABAg,"{'videoId': 'oeQDimow_bE', 'topLevelComment': {'kind': 'youtube#comment', 'etag': 'qi0IAhqoBIPAoWfEw9hiN0LbJ-U', 'id': 'Ugx5SFyEtPm3atc6SrF4AaABAg', 'snippet': {'videoId': 'oeQDimow_bE', 'textDisplay': 'Essa intenção ou projeto de retirar a dedução do IRPF,   das despesas médicas e de educação,  já é desde 2019, o Guedes já tinha isso como projeto naquela época,  dentro da  Receita federal,  já existia esse &quot;rumor&quot;, enquanto  os seguidores do  &quot;mito&quot; berravam que  o Governo ia reajustar a tabela  de isenção para 05 salários mínimos, a intenção era  retirar deduções.', 'textOriginal': 'Essa intenção ou projeto de retirar a dedução do IRPF,   das despesas médicas e de educação,  já é desde 2019, o Guedes já tinha isso como projeto naquela época,  dentro da  Receita federal,  já existia esse ""rumor"", enquanto  os seguidores do  ""mito"" berravam que  o Governo ia reajustar a tabela  de isenção para 05 salários mínimos, a intenção era  retirar deduções.', 'authorDisplayName': 'Josué Abraão Boeno Lino', 'authorProfileImageUrl': 'https://yt3.ggpht.com/ytc/AGIKgqPJ7JKymPTJoFLCEBVcI51bXhyvn-qPO153dQ=s48-c-k-c0x00ffffff-no-rj', 'authorChannelUrl': 'http://www.youtube.com/channel/UC-7wsLnrmycmOHALM5LTnnQ', 'authorChannelId': {'value': 'UC-7wsLnrmycmOHALM5LTnnQ'}, 'canRate': True, 'viewerRating': 'none', 'likeCount': 0, 'publishedAt': '2022-10-26T02:06:29Z', 'updatedAt': '2022-10-26T02:06:29Z'}}, 'canReply': True, 'totalReplyCount': 0, 'isPublic': True}",,UC-7wsLnrmycmOHALM5LTnnQ,2022-10-26T02:06:29Z,"Essa intenção ou projeto de retirar a dedução do IRPF,   das despesas médicas e de educação,  já é desde 2019, o Guedes já tinha isso como projeto naquela época,  dentro da  Receita federal,  já existia esse ""rumor"", enquanto  os seguidores do  ""mito"" berravam que  o Governo ia reajustar a tabela  de isenção para 05 salários mínimos, a intenção era  retirar deduções.",,2023-06-09 12:08:56.019050
youtube#commentThread,yGmF-LZPo_p8w5jD-rAki0BAXkE,Ugz2zuLYYW3Nfn_i6z94AaABAg,"{'videoId': 'oeQDimow_bE', 'topLevelComment': {'kind': 'youtube#comment', 'etag': '3oofQXYmo4wzauPnefYB6xpYWfc', 'id': 'Ugz2zuLYYW3Nfn_i6z94AaABAg', 'snippet': {'videoId': 'oeQDimow_bE', 'textDisplay': 'Votem no partido evangélico cristão armado so tem celebridas cantores fazendeiros empresários jogadores gente rica cheirosa um excelente ministro da economia os senadores acima de qualquer suspeita Sérgio Moro salles damares pazuelo dalanhol gente digna os fedorentos famintos desempregados do PT não tem chance nao dá para comparar a gestão Bolsonaro com o barbudo nove dedos ex presidiário vulgo Lula o presidente do povo caviar pros ricos mortadela pra nós com lula respeitou o STf e TSE respeita o povo boa sorte Luis Inácio Lula da silva brasileiro nato lutador tem muito pela frente vamos a luta coragem e dignidade boa sorte', 'textOriginal': 'Votem no partido evangélico cristão armado so tem celebridas cantores fazendeiros empresários jogadores gente rica cheirosa um excelente ministro da economia os senadores acima de qualquer suspeita Sérgio Moro salles damares pazuelo dalanhol gente digna os fedorentos famintos desempregados do PT não tem chance nao dá para comparar a gestão Bolsonaro com o barbudo nove dedos ex presidiário vulgo Lula o presidente do povo caviar pros ricos mortadela pra nós com lula respeitou o STf e TSE respeita o povo boa sorte Luis Inácio Lula da silva brasileiro nato lutador tem muito pela frente vamos a luta coragem e dignidade boa sorte', 'authorDisplayName': 'Cleonice Gomes', 'authorProfileImageUrl': 'https://yt3.ggpht.com/ytc/AGIKgqO_fjWjRA9YcDs7Wf6zSWWGUeS_rcRL81_MHA=s48-c-k-c0x00ffffff-no-rj', 'authorChannelUrl': 'http://www.youtube.com/channel/UCqtqlcWCSHd4g9_dY_d8yZA', 'authorChannelId': {'value': 'UCqtqlcWCSHd4g9_dY_d8yZA'}, 'canRate': True, 'viewerRating': 'none', 'likeCount': 1, 'publishedAt': '2022-10-26T00:13:47Z', 'updatedAt': '2022-10-26T00:13:47Z'}}, 'canReply': True, 'totalReplyCount': 0, 'isPublic': True}",,UCqtqlcWCSHd4g9_dY_d8yZA,2022-10-26T00:13:47Z,Votem no partido evangélico cristão armado so tem celebridas cantores fazendeiros empresários jogadores gente rica cheirosa um excelente ministro da economia os senadores acima de qualquer suspeita Sérgio Moro salles damares pazuelo dalanhol gente digna os fedorentos famintos desempregados do PT não tem chance nao dá para comparar a gestão Bolsonaro com o barbudo nove dedos ex presidiário vulgo Lula o presidente do povo caviar pros ricos mortadela pra nós com lula respeitou o STf e TSE respeita o povo boa sorte Luis Inácio Lula da silva brasileiro nato lutador tem muito pela frente vamos a luta coragem e dignidade boa sorte,,2023-06-09 12:08:56.019050
youtube#commentThread,taVr8u0KD-3MBYqSCKR3EG8N4iw,UgxHI4_pdjALcOu9xZ94AaABAg,"{'videoId': 'oeQDimow_bE', 'topLevelComment': {'kind': 'youtube#comment', 'etag': 'rcEQnE-pHMVjZopr7l5MMFKQOoU', 'id': 'UgxHI4_pdjALcOu9xZ94AaABAg', 'snippet': {'videoId': 'oeQDimow_bE', 'textDisplay': '🇧🇷1️⃣3️⃣🔝🤩', 'textOriginal': '🇧🇷1️⃣3️⃣🔝🤩', 'authorDisplayName': 'Carlos Borromeu de Sousa', 'authorProfileImageUrl': 'https://yt3.ggpht.com/ytc/AGIKgqPmN-gccNnP8KPYtR7nNRk4Vw2h2aMMYiUCYg=s48-c-k-c0x00ffffff-no-rj', 'authorChannelUrl': 'http://www.youtube.com/channel/UChocfFvdOV9eeCDy1jKY-HA', 'authorChannelId': {'value': 'UChocfFvdOV9eeCDy1jKY-HA'}, 'canRate': True, 'viewerRating': 'none', 'likeCount': 0, 'publishedAt': '2022-10-25T23:50:40Z', 'updatedAt': '2022-10-25T23:50:40Z'}}, 'canReply': True, 'totalReplyCount': 0, 'isPublic': True}",,UChocfFvdOV9eeCDy1jKY-HA,2022-10-25T23:50:40Z,🇧🇷1️⃣3️⃣🔝🤩,,2023-06-09 12:08:56.019050
youtube#commentThread,6nW8UMO9r3bo7lalfCR8EFBTwuw,UgwhjSvUR26aVf651BR4AaABAg,"{'videoId': 'oeQDimow_bE', 'topLevelComment': {'kind': 'youtube#comment', 'etag': 'J0BamiaUQ5VN2UnwXLh_qm156SI', 'id': 'UgwhjSvUR26aVf651BR4AaABAg', 'snippet': {'videoId': 'oeQDimow_bE', 'textDisplay': 'Fora Bozo genocida ladrão', 'textOriginal': 'Fora Bozo genocida ladrão', 'authorDisplayName': 'hermes Correia', 'authorProfileImageUrl': 'https://yt3.ggpht.com/ytc/AGIKgqP1sduLl1dhHDgmN9pL0wGSOs3thz3FVV3UuhyTCiUrDTS2r3foizu3tESqFT06=s48-c-k-c0x00ffffff-no-rj', 'authorChannelUrl': 'http://www.youtube.com/channel/UCc__DpzDdjIZGvtgLKl-VZg', 'authorChannelId': {'value': 'UCc__DpzDdjIZGvtgLKl-VZg'}, 'canRate': True, 'viewerRating': 'none', 'likeCount': 0, 'publishedAt': '2022-10-25T23:09:33Z', 'updatedAt': '2022-10-25T23:09:33Z'}}, 'canReply': True, 'totalReplyCount': 0, 'isPublic': True}",,UCc__DpzDdjIZGvtgLKl-VZg,2022-10-25T23:09:33Z,Fora Bozo genocida ladrão,,2023-06-09 12:08:56.019050
youtube#commentThread,v1H5584Uw-W4owLcv8UTcv37Rks,UgzFEEKhwgFiSlFcshx4AaABAg,"{'videoId': 'oeQDimow_bE', 'topLevelComment': {'kind': 'youtube#comment', 'etag': 'quj1e9Otyqxa5r7jHlo_7i4VdpU', 'id': 'UgzFEEKhwgFiSlFcshx4AaABAg', 'snippet': {'videoId': 'oeQDimow_bE', 'textDisplay': 'Vão se lascar todo mundo, vai fazer igual o Collor, vai tirar dinheiro d todo mundo eles não tem competência para criar emprego e renda querem tirar dinheiro do povo 💪💪', 'textOriginal': 'Vão se lascar todo mundo, vai fazer igual o Collor, vai tirar dinheiro d todo mundo eles não tem competência para criar emprego e renda querem tirar dinheiro do povo 💪💪', 'authorDisplayName': 'Luciano Brandao', 'authorProfileImageUrl': 'https://yt3.ggpht.com/ytc/AGIKgqMfzgGucAxiy6ul-HI50ieHdVvPAzUzM5B_DA=s48-c-k-c0x00ffffff-no-rj', 'authorChannelUrl': 'http://www.youtube.com/channel/UCfhy-NVfyYW1bZVl4KJM31A', 'authorChannelId': {'value': 'UCfhy-NVfyYW1bZVl4KJM31A'}, 'canRate': True, 'viewerRating': 'none', 'likeCount': 0, 'publishedAt': '2022-10-25T22:54:38Z', 'updatedAt': '2022-10-25T22:54:38Z'}}, 'canReply': True, 'totalReplyCount': 0, 'isPublic': True}",,UCfhy-NVfyYW1bZVl4KJM31A,2022-10-25T22:54:38Z,"Vão se lascar todo mundo, vai fazer igual o Collor, vai tirar dinheiro d todo mundo eles não tem competência para criar emprego e renda querem tirar dinheiro do povo 💪💪",,2023-06-09 12:08:56.019050
youtube#commentThread,pJUPuNFCOns4JQgP9-mCZtSiMRI,Ugy09guO1UgQYyGDvJp4AaABAg,"{'videoId': 'oeQDimow_bE', 'topLevelComment': {'kind': 'youtube#comment', 'etag': '37DIpf8HbiF3xwRthHH7gkisPu8', 'id': 'Ugy09guO1UgQYyGDvJp4AaABAg', 'snippet': {'videoId': 'oeQDimow_bE', 'textDisplay': 'Lula 13 LULA 13', 'textOriginal': 'Lula 13 LULA 13', 'authorDisplayName': 'Nini Tavares', 'authorProfileImageUrl': 'https://yt3.ggpht.com/ytc/AGIKgqPcobXNPeQK77zSEBul3kQeVJIr8CCsI38e-U4l84wWl7B6ablqzezVoGsI20ED=s48-c-k-c0x00ffffff-no-rj', 'authorChannelUrl': 'http://www.youtube.com/channel/UCoPB4Z8rG5CkWoFTOWFIIfg', 'authorChannelId': {'value': 'UCoPB4Z8rG5CkWoFTOWFIIfg'}, 'canRate': True, 'viewerRating': 'none', 'likeCount': 1, 'publishedAt': '2022-10-25T22:45:57Z', 'updatedAt': '2022-10-25T22:45:57Z'}}, 'canReply': True, 'totalReplyCount': 0, 'isPublic': True}",,UCoPB4Z8rG5CkWoFTOWFIIfg,2022-10-25T22:45:57Z,Lula 13 LULA 13,,2023-06-09 12:08:56.019050
youtube#commentThread,rei--Hp5Jt1tcOcCr_ejvef3vOM,UgzGNaPcQ50DwIJZaxF4AaABAg,"{'videoId': 'oeQDimow_bE', 'topLevelComment': {'kind': 'youtube#comment', 'etag': '0iItvoKhKZSWJqfUEWDSK0pXaFk', 'id': 'UgzGNaPcQ50DwIJZaxF4AaABAg', 'snippet': {'videoId': 'oeQDimow_bE', 'textDisplay': 'A classe média ainda não votou e parte dela ignora a denúncia d outra parte não se &quot;importa&quot; desde que o MITO se reeleja pois são fanáticos.', 'textOriginal': 'A classe média ainda não votou e parte dela ignora a denúncia d outra parte não se ""importa"" desde que o MITO se reeleja pois são fanáticos.', 'authorDisplayName': 'Sec.', 'authorProfileImageUrl': 'https://yt3.ggpht.com/gJK6uGKKMGFXbOCqF1V1LGQkah3qSzGmHVvRvlMW7ntnnLmV-NvGGYUCfMOQCeks4cNVMXiMaQ=s48-c-k-c0x00ffffff-no-rj', 'authorChannelUrl': 'http://www.youtube.com/channel/UCmTPeIQ3TryqkXfTnnSjFmA', 'authorChannelId': {'value': 'UCmTPeIQ3TryqkXfTnnSjFmA'}, 'canRate': True, 'viewerRating': 'none', 'likeCount': 0, 'publishedAt': '2022-10-25T22:12:31Z', 'updatedAt': '2022-10-25T22:12:31Z'}}, 'canReply': True, 'totalReplyCount': 0, 'isPublic': True}",,UCmTPeIQ3TryqkXfTnnSjFmA,2022-10-25T22:12:31Z,"A classe média ainda não votou e parte dela ignora a denúncia d outra parte não se ""importa"" desde que o MITO se reeleja pois são fanáticos.",,2023-06-09 12:08:56.019050
youtube#commentThread,gvpQWrSLK8zNp7dMkQkCIwrWz14,UgyjVaOtwGiJ_RBY2r94AaABAg,"{'videoId': 'oeQDimow_bE', 'topLevelComment': {'kind': 'youtube#comment', 'etag': 'CmD_kJJMW8654_eKYA-g7kXwmrU', 'id': 'UgyjVaOtwGiJ_RBY2r94AaABAg', 'snippet': {'videoId': 'oeQDimow_bE', 'textDisplay': '💯💯💯', 'textOriginal': '💯💯💯', 'authorDisplayName': 'Glenda Silva', 'authorProfileImageUrl': 'https://yt3.ggpht.com/ytc/AGIKgqPXfjHA-wtmYyKeww69A9mkEKmnqlKBnjS0mKC9okM=s48-c-k-c0x00ffffff-no-rj', 'authorChannelUrl': 'http://www.youtube.com/channel/UC7ObPofEGKew_9PTcRUkKuw', 'authorChannelId': {'value': 'UC7ObPofEGKew_9PTcRUkKuw'}, 'canRate': True, 'viewerRating': 'none', 'likeCount': 2, 'publishedAt': '2022-10-25T22:02:34Z', 'updatedAt': '2022-10-25T22:02:34Z'}}, 'canReply': True, 'totalReplyCount': 0, 'isPublic': True}",,UC7ObPofEGKew_9PTcRUkKuw,2022-10-25T22:02:34Z,💯💯💯,,2023-06-09 12:08:56.019050
youtube#commentThread,lbBK7eFfeelDXTGLXLOZtYfWPBI,Ugz2Z58aL0rmBuo0nbt4AaABAg,"{'videoId': 'oeQDimow_bE', 'topLevelComment': {'kind': 'youtube#comment', 'etag': 'O06UsAqkq9YQCpy5ddADH6U_cnY', 'id': 'Ugz2Z58aL0rmBuo0nbt4AaABAg', 'snippet': {'videoId': 'oeQDimow_bE', 'textDisplay': 'E  JA  É   TCHAU  👋 👋 👋 👋 👋 👋', 'textOriginal': 'E  JA  É   TCHAU  👋 👋 👋 👋 👋 👋', 'authorDisplayName': 'Lucélia Silva', 'authorProfileImageUrl': 'https://yt3.ggpht.com/ytc/AGIKgqOKRNpgfme4ylA6dPfNQhWWM26B9pxqOkAFRQ=s48-c-k-c0x00ffffff-no-rj', 'authorChannelUrl': 'http://www.youtube.com/channel/UC2oenHRMjHiSyXr2lzUK1Jg', 'authorChannelId': {'value': 'UC2oenHRMjHiSyXr2lzUK1Jg'}, 'canRate': True, 'viewerRating': 'none', 'likeCount': 1, 'publishedAt': '2022-10-25T22:00:40Z', 'updatedAt': '2022-10-25T22:00:40Z'}}, 'canReply': True, 'totalReplyCount': 0, 'isPublic': True}",,UC2oenHRMjHiSyXr2lzUK1Jg,2022-10-25T22:00:40Z,E  JA  É   TCHAU  👋 👋 👋 👋 👋 👋,,2023-06-09 12:08:56.019050
youtube#commentThread,65Iy8dpJ6p9XNqfzVk4-bv6kq10,UgwWdsopcHw9YkuZ62x4AaABAg,"{'videoId': 'oeQDimow_bE', 'topLevelComment': {'kind': 'youtube#comment', 'etag': 'd64LDS9kdspT_1iXlBOYC96chdM', 'id': 'UgwWdsopcHw9YkuZ62x4AaABAg', 'snippet': {'videoId': 'oeQDimow_bE', 'textDisplay': 'LULA 2022', 'textOriginal': 'LULA 2022', 'authorDisplayName': 'Márcio Henrique Pimheiro', 'authorProfileImageUrl': 'https://yt3.ggpht.com/ytc/AGIKgqNwiF2xrTcVkx5AjBy_dPI_y67iKAfmDmAsK0JU7klPwWFiW-MLLHBcKVCcbcWg=s48-c-k-c0x00ffffff-no-rj', 'authorChannelUrl': 'http://www.youtube.com/channel/UCCHuToVb0RGx_Xgi9aLA8mg', 'authorChannelId': {'value': 'UCCHuToVb0RGx_Xgi9aLA8mg'}, 'canRate': True, 'viewerRating': 'none', 'likeCount': 2, 'publishedAt': '2022-10-25T21:55:25Z', 'updatedAt': '2022-10-25T21:55:25Z'}}, 'canReply': True, 'totalReplyCount': 0, 'isPublic': True}",,UCCHuToVb0RGx_Xgi9aLA8mg,2022-10-25T21:55:25Z,LULA 2022,,2023-06-09 12:08:56.019050
youtube#commentThread,Vtksmq0NsDYkaWST1nmc0k_YvMk,Ugw9tZ4j1yOtVSv7rXh4AaABAg,"{'videoId': 'oeQDimow_bE', 'topLevelComment': {'kind': 'youtube#comment', 'etag': 'xCII8VsNR2VdciEQ26CTiOhn9Eo', 'id': 'Ugw9tZ4j1yOtVSv7rXh4AaABAg', 'snippet': {'videoId': 'oeQDimow_bE', 'textDisplay': 'Lula 13 <br>Lula Educação', 'textOriginal': 'Lula 13 \\nLula Educação', 'authorDisplayName': 'Deuzina Murada', 'authorProfileImageUrl': 'https://yt3.ggpht.com/ytc/AGIKgqNbTxrusXskGTSs6_V_fcMIP-qUgo5484ehilbQ9XBGvsJmzXgUW08TjVLy4b0f=s48-c-k-c0x00ffffff-no-rj', 'authorChannelUrl': 'http://www.youtube.com/channel/UCO9B8AIRY8GeDf5zRuJaQ-A', 'authorChannelId': {'value': 'UCO9B8AIRY8GeDf5zRuJaQ-A'}, 'canRate': True, 'viewerRating': 'none', 'likeCount': 2, 'publishedAt': '2022-10-25T21:54:36Z', 'updatedAt': '2022-10-25T21:54:36Z'}}, 'canReply': True, 'totalReplyCount': 0, 'isPublic': True}",,UCO9B8AIRY8GeDf5zRuJaQ-A,2022-10-25T21:54:36Z,"Lula 13 
Lula Educação",,2023-06-09 12:08:56.019050
youtube#commentThread,E3sr3sYmn7c6btXwg9fwQ0bHA_E,Ugw3Ss0JJJW93oP2V4t4AaABAg,"{'videoId': 'oeQDimow_bE', 'topLevelComment': {'kind': 'youtube#comment', 'etag': 'Ctxw1ijTTVJq6uMiUFeRUy0LHr4', 'id': 'Ugw3Ss0JJJW93oP2V4t4AaABAg', 'snippet': {'videoId': 'oeQDimow_bE', 'textDisplay': 'LULA 1️⃣ 3️⃣ 🌟', 'textOriginal': 'LULA 1️⃣ 3️⃣ 🌟', 'authorDisplayName': 'Tereza Silva', 'authorProfileImageUrl': 'https://yt3.ggpht.com/J6VqrybK9Bq7805HNCGzs-wxZ_XMWY7hRVt_gas_oHpbRSqnrV30xyPKC47-5TpCRzXEEB8wKro=s48-c-k-c0x00ffffff-no-rj', 'authorChannelUrl': 'http://www.youtube.com/channel/UCueZNtu0C6GZhRWGJv3bqdw', 'authorChannelId': {'value': 'UCueZNtu0C6GZhRWGJv3bqdw'}, 'canRate': True, 'viewerRating': 'none', 'likeCount': 1, 'publishedAt': '2022-10-25T21:31:23Z', 'updatedAt': '2022-10-25T21:31:23Z'}}, 'canReply': True, 'totalReplyCount': 0, 'isPublic': True}",,UCueZNtu0C6GZhRWGJv3bqdw,2022-10-25T21:31:23Z,LULA 1️⃣ 3️⃣ 🌟,,2023-06-09 12:08:56.019050
youtube#commentThread,57Xll80EJxSUNs9v3pC2tstlWHc,UgyAPkcQNDwPmPvwn2B4AaABAg,"{'videoId': 'oeQDimow_bE', 'topLevelComment': {'kind': 'youtube#comment', 'etag': 'mg8elG6hhb2Z58PbNQZicgOwdZk', 'id': 'UgyAPkcQNDwPmPvwn2B4AaABAg', 'snippet': {'videoId': 'oeQDimow_bE', 'textDisplay': 'Não aguento mais ouvir falar desse bandido do Bob Jeff! Esse episódio já deu o q falar! Não deem voz p esse bandido!', 'textOriginal': 'Não aguento mais ouvir falar desse bandido do Bob Jeff! Esse episódio já deu o q falar! Não deem voz p esse bandido!', 'authorDisplayName': 'Tereza Silva', 'authorProfileImageUrl': 'https://yt3.ggpht.com/J6VqrybK9Bq7805HNCGzs-wxZ_XMWY7hRVt_gas_oHpbRSqnrV30xyPKC47-5TpCRzXEEB8wKro=s48-c-k-c0x00ffffff-no-rj', 'authorChannelUrl': 'http://www.youtube.com/channel/UCueZNtu0C6GZhRWGJv3bqdw', 'authorChannelId': {'value': 'UCueZNtu0C6GZhRWGJv3bqdw'}, 'canRate': True, 'viewerRating': 'none', 'likeCount': 0, 'publishedAt': '2022-10-25T21:29:33Z', 'updatedAt': '2022-10-25T21:29:33Z'}}, 'canReply': True, 'totalReplyCount': 0, 'isPublic': True}",,UCueZNtu0C6GZhRWGJv3bqdw,2022-10-25T21:29:33Z,Não aguento mais ouvir falar desse bandido do Bob Jeff! Esse episódio já deu o q falar! Não deem voz p esse bandido!,,2023-06-09 12:08:56.019050
youtube#commentThread,wazw1I8IJvcoWEkVAbFvqoWxt1k,Ugzr9slvin3Ru6uHry54AaABAg,"{'videoId': 'oeQDimow_bE', 'topLevelComment': {'kind': 'youtube#comment', 'etag': 'yHuN0ZfGlKR0PlZfUyeIEvnumA8', 'id': 'Ugzr9slvin3Ru6uHry54AaABAg', 'snippet': {'videoId': 'oeQDimow_bE', 'textDisplay': 'TÁ NA HORA DO JAIR JÁ IR EMBORA ... QUEREMOS A PAZ!', 'textOriginal': 'TÁ NA HORA DO JAIR JÁ IR EMBORA ... QUEREMOS A PAZ!', 'authorDisplayName': 'Bonnefond Patricia', 'authorProfileImageUrl': 'https://yt3.ggpht.com/ytc/AGIKgqPRmqIbnlHC4HY6qAWtCUDjNaln-u4fe8yPNQ=s48-c-k-c0x00ffffff-no-rj', 'authorChannelUrl': 'http://www.youtube.com/channel/UCciTnvxkx5llRkQdHSMOklQ', 'authorChannelId': {'value': 'UCciTnvxkx5llRkQdHSMOklQ'}, 'canRate': True, 'viewerRating': 'none', 'likeCount': 1, 'publishedAt': '2022-10-25T21:23:33Z', 'updatedAt': '2022-10-25T21:23:33Z'}}, 'canReply': True, 'totalReplyCount': 0, 'isPublic': True}",,UCciTnvxkx5llRkQdHSMOklQ,2022-10-25T21:23:33Z,TÁ NA HORA DO JAIR JÁ IR EMBORA ... QUEREMOS A PAZ!,,2023-06-09 12:08:56.019050
youtube#commentThread,tqn2UKA4AE2fjmrfW361rvkU68g,UgzGekDcj4m4yuXb8894AaABAg,"{'videoId': 'oeQDimow_bE', 'topLevelComment': {'kind': 'youtube#comment', 'etag': 'AzM1yZhRKFhxvyw4mi0aNgfqiF4', 'id': 'UgzGekDcj4m4yuXb8894AaABAg', 'snippet': {'videoId': 'oeQDimow_bE', 'textDisplay': 'Isso que eu não entendi,,!! Na casa de um criminoso ter esse arcenal bélico, armas de guérra, será que a policia federal prendeu éstas armas ou só prendeu o meliante.', 'textOriginal': 'Isso que eu não entendi,,!! Na casa de um criminoso ter esse arcenal bélico, armas de guérra, será que a policia federal prendeu éstas armas ou só prendeu o meliante.', 'authorDisplayName': 'Armando Gonçalves da Silva', 'authorProfileImageUrl': 'https://yt3.ggpht.com/ytc/AGIKgqM80NIvxgM1H1lJ2lHhfAtajRZc3J8dWklKVQ=s48-c-k-c0x00ffffff-no-rj', 'authorChannelUrl': 'http://www.youtube.com/channel/UCF_U5gXCYUBY-Y5Qp0oxllA', 'authorChannelId': {'value': 'UCF_U5gXCYUBY-Y5Qp0oxllA'}, 'canRate': True, 'viewerRating': 'none', 'likeCount': 1, 'publishedAt': '2022-10-25T21:22:52Z', 'updatedAt': '2022-10-25T21:22:52Z'}}, 'canReply': True, 'totalReplyCount': 0, 'isPublic': True}",,UCF_U5gXCYUBY-Y5Qp0oxllA,2022-10-25T21:22:52Z,"Isso que eu não entendi,,!! Na casa de um criminoso ter esse arcenal bélico, armas de guérra, será que a policia federal prendeu éstas armas ou só prendeu o meliante.",,2023-06-09 12:08:56.019050
