kind,etag,id,snippet,replies,authorChannelId,publishedAt,textOriginal,nextPageToken,extraction_date
youtube#commentThread,44YrUPz96daOMVw_oGaPH4vCZZs,UgysH2vxTDoa0IYbkmp4AaABAg,"{'videoId': 'oeQDimow_bE', 'topLevelComment': {'kind': 'youtube#comment', 'etag': 'uBF0BOC27ijXp4Lv2QiQY9zXnIY', 'id': 'UgysH2vxTDoa0IYbkmp4AaABAg', 'snippet': {'videoId': 'oeQDimow_bE', 'textDisplay': 'A classe média despolitizada vota no bolsonaro mesmo empobrecendo no gov bolsonaro', 'textOriginal': 'A classe média despolitizada vota no bolsonaro mesmo empobrecendo no gov bolsonaro', 'authorDisplayName': 'Francisco de Assis', 'authorProfileImageUrl': 'https://yt3.ggpht.com/ytc/AGIKgqN2XpYkou0fj4SJjOLnIVZ6stHURIW7-qRZIg=s48-c-k-c0x00ffffff-no-rj', 'authorChannelUrl': 'http://www.youtube.com/channel/UCsgAITcHgp7Ma3qan8q7L5Q', 'authorChannelId': {'value': 'UCsgAITcHgp7Ma3qan8q7L5Q'}, 'canRate': True, 'viewerRating': 'none', 'likeCount': 0, 'publishedAt': '2022-10-25T20:26:19Z', 'updatedAt': '2022-10-25T20:26:19Z'}}, 'canReply': True, 'totalReplyCount': 0, 'isPublic': True}",,UCsgAITcHgp7Ma3qan8q7L5Q,2022-10-25T20:26:19Z,A classe média despolitizada vota no bolsonaro mesmo empobrecendo no gov bolsonaro,,2023-06-09 12:08:56.019050
youtube#commentThread,8-2w3RJwLcG0MNcbZ6a5GtWPPgc,Ugx-GxKj5dEpGxZ8oVp4AaABAg,"{'videoId': 'oeQDimow_bE', 'topLevelComment': {'kind': 'youtube#comment', 'etag': 'DbI81iGWVCLxa4N5cnKEp313044', 'id': 'Ugx-GxKj5dEpGxZ8oVp4AaABAg', 'snippet': {'videoId': 'oeQDimow_bE', 'textDisplay': 'Fora bozo lula 13', 'textOriginal': 'Fora bozo lula 13', 'authorDisplayName': 'Diva Silva', 'authorProfileImageUrl': 'https://yt3.ggpht.com/ytc/AGIKgqMMbRD5sw4prAOZnDcH8YcZhoSe-xIqUKaHRA=s48-c-k-c0x00ffffff-no-rj', 'authorChannelUrl': 'http://www.youtube.com/channel/UCd85TQuto6Fgv0CPq6LbhFQ', 'authorChannelId': {'value': 'UCd85TQuto6Fgv0CPq6LbhFQ'}, 'canRate': True, 'viewerRating': 'none', 'likeCount': 4, 'publishedAt': '2022-10-25T20:24:27Z', 'updatedAt': '2022-10-25T20:24:27Z'}}, 'canReply': True, 'totalReplyCount': 0, 'isPublic': True}",,UCd85TQuto6Fgv0CPq6LbhFQ,2022-10-25T20:24:27Z,Fora bozo lula 13,,2023-06-09 12:08:56.019050
youtube#commentThread,UcKd_OqPwN2kLIMAjyUacDho9K0,Ugz-tLKfqi0kG3MmBP54AaABAg,"{'videoId': 'oeQDimow_bE', 'topLevelComment': {'kind': 'youtube#comment', 'etag': 'ekWS9CT0DBXOgIsp4QDpSCYm9Hc', 'id': 'Ugz-tLKfqi0kG3MmBP54AaABAg', 'snippet': {'videoId': 'oeQDimow_bE', 'textDisplay': 'Fora bosonaro vamos te arrancar do poder fora vira lata queremos Lula Presidente e13 13 domingo e 13 e Lula', 'textOriginal': 'Fora bosonaro vamos te arrancar do poder fora vira lata queremos Lula Presidente e13 13 domingo e 13 e Lula', 'authorDisplayName': 'Cida Santos', 'authorProfileImageUrl': 'https://yt3.ggpht.com/ytc/AGIKgqPdOsGD1EiJ6pKB11or7LjX1vJVr1ZAKVXsOQ=s48-c-k-c0x00ffffff-no-rj', 'authorChannelUrl': 'http://www.youtube.com/channel/UCwTdDEZQQ1BLlBptGoNe1rg', 'authorChannelId': {'value': 'UCwTdDEZQQ1BLlBptGoNe1rg'}, 'canRate': True, 'viewerRating': 'none', 'likeCount': 0, 'publishedAt': '2022-10-25T20:21:52Z', 'updatedAt': '2022-10-25T20:21:52Z'}}, 'canReply': True, 'totalReplyCount': 0, 'isPublic': True}",,UCwTdDEZQQ1BLlBptGoNe1rg,2022-10-25T20:21:52Z,Fora bosonaro vamos te arrancar do poder fora vira lata queremos Lula Presidente e13 13 domingo e 13 e Lula,,2023-06-09 12:08:56.019050
youtube#commentThread,qL54wGX163_KUWqXIWs4zw3j6xg,Ugy9ZRG7CRGgez0cWo54AaABAg,"{'videoId': 'oeQDimow_bE', 'topLevelComment': {'kind': 'youtube#comment', 'etag': 'LLAVm1ft3ua3EbS0Z443PmfCq9s', 'id': 'Ugy9ZRG7CRGgez0cWo54AaABAg', 'snippet': {'videoId': 'oeQDimow_bE', 'textDisplay': 'Parabéns pelo canal, sempre muito informativo e detalhado  vamos juntos jogar na lata do lixo da história esse desgoverno bosta-naro.... T.M.J sempre', 'textOriginal': 'Parabéns pelo canal, sempre muito informativo e detalhado  vamos juntos jogar na lata do lixo da história esse desgoverno bosta-naro.... T.M.J sempre', 'authorDisplayName': 'jose augusto Gaspar', 'authorProfileImageUrl': 'https://yt3.ggpht.com/ytc/AGIKgqN0qRJhaaSxX2skHk-UECH8bDG6tNGjx4mF6IovRg=s48-c-k-c0x00ffffff-no-rj', 'authorChannelUrl': 'http://www.youtube.com/channel/UCa_R0w69olb59i-OKpFFIYw', 'authorChannelId': {'value': 'UCa_R0w69olb59i-OKpFFIYw'}, 'canRate': True, 'viewerRating': 'none', 'likeCount': 11, 'publishedAt': '2022-10-25T20:10:51Z', 'updatedAt': '2022-10-25T20:10:51Z'}}, 'canReply': True, 'totalReplyCount': 0, 'isPublic': True}",,UCa_R0w69olb59i-OKpFFIYw,2022-10-25T20:10:51Z,"Parabéns pelo canal, sempre muito informativo e detalhado  vamos juntos jogar na lata do lixo da história esse desgoverno bosta-naro.... T.M.J sempre",,2023-06-09 12:08:56.019050
youtube#commentThread,od6-bN055bxhZnBKTtBTI8TPrTA,Ugz1ZeSrErEn1mo0R-B4AaABAg,"{'videoId': 'oeQDimow_bE', 'topLevelComment': {'kind': 'youtube#comment', 'etag': 'Jp4H7a7tTiptNi3pRpe48z-jUyQ', 'id': 'Ugz1ZeSrErEn1mo0R-B4AaABAg', 'snippet': {'videoId': 'oeQDimow_bE', 'textDisplay': 'B 22 POR UM BRASIL LIVRE!!!', 'textOriginal': 'B 22 POR UM BRASIL LIVRE!!!', 'authorDisplayName': 'Adriana Lopes', 'authorProfileImageUrl': 'https://yt3.ggpht.com/ytc/AGIKgqMioz1R03owQ99OcYGiOGwWr2NTvj5IBaggqPGCMbk=s48-c-k-c0x00ffffff-no-rj', 'authorChannelUrl': 'http://www.youtube.com/channel/UCADjdJ1Sc3waqdZGg1d7YVw', 'authorChannelId': {'value': 'UCADjdJ1Sc3waqdZGg1d7YVw'}, 'canRate': True, 'viewerRating': 'none', 'likeCount': 1, 'publishedAt': '2022-10-25T20:09:48Z', 'updatedAt': '2022-10-25T20:09:48Z'}}, 'canReply': True, 'totalReplyCount': 29, 'isPublic': True}","{'comments': [{'kind': 'youtube#comment', 'etag': 'CxXcOmP64K-aCcIcOTtvi_h9E3A', 'id': 'Ugz1ZeSrErEn1mo0R-B4AaABAg.9hc4autcs8c9herFYYEA-6', 'snippet': {'videoId': 'oeQDimow_bE', 'textDisplay': '@jarbas gasparLucas 1:37 - Porque para Deus nada é impossível.', 'textOriginal': '@jarbas gasparLucas 1:37 - Porque para Deus nada é impossível.', 'parentId': 'Ugz1ZeSrErEn1mo0R-B4AaABAg', 'authorDisplayName': 'Adriana Lopes', 'authorProfileImageUrl': 'https://yt3.ggpht.com/ytc/AGIKgqMioz1R03owQ99OcYGiOGwWr2NTvj5IBaggqPGCMbk=s48-c-k-c0x00ffffff-no-rj', 'authorChannelUrl': 'http://www.youtube.com/channel/UCADjdJ1Sc3waqdZGg1d7YVw', 'authorChannelId': {'value': 'UCADjdJ1Sc3waqdZGg1d7YVw'}, 'canRate': True, 'viewerRating': 'none', 'likeCount': 0, 'publishedAt': '2022-10-26T22:02:08Z', 'updatedAt': '2022-10-26T22:02:08Z'}}, {'kind': 'youtube#comment', 'etag': 'rOUzwB29m0OoP9J9pWDNftmrcR0', 'id': 'Ugz1ZeSrErEn1mo0R-B4AaABAg.9hc4autcs8c9heqZyN8ep5', 'snippet': {'videoId': 'oeQDimow_bE', 'textDisplay': '@Nely Terezinha Piovezani livre do que?', 'textOriginal': '@Nely Terezinha Piovezani livre do que?', 'parentId': 'Ugz1ZeSrErEn1mo0R-B4AaABAg', 'authorDisplayName': 'Adriana Lopes', 'authorProfileImageUrl': 'https://yt3.ggpht.com/ytc/AGIKgqMioz1R03owQ99OcYGiOGwWr2NTvj5IBaggqPGCMbk=s48-c-k-c0x00ffffff-no-rj', 'authorChannelUrl': 'http://www.youtube.com/channel/UCADjdJ1Sc3waqdZGg1d7YVw', 'authorChannelId': {'value': 'UCADjdJ1Sc3waqdZGg1d7YVw'}, 'canRate': True, 'viewerRating': 'none', 'likeCount': 0, 'publishedAt': '2022-10-26T21:56:11Z', 'updatedAt': '2022-10-26T21:56:11Z'}}, {'kind': 'youtube#comment', 'etag': '-9XI8tO1blgFwTrWmnraBCuUYJE', 'id': 'Ugz1ZeSrErEn1mo0R-B4AaABAg.9hc4autcs8c9heq39OdjH8', 'snippet': {'videoId': 'oeQDimow_bE', 'textDisplay': '@Adair Pereira ..onde esta sua consciência politica bb, você esta votando contra si mesmo, faça uma reflexão o que lula fez de bom para a população..né!!', 'textOriginal': '@Adair Pereira ..onde esta sua consciência politica bb, você esta votando contra si mesmo, faça uma reflexão o que lula fez de bom para a população..né!!', 'parentId': 'Ugz1ZeSrErEn1mo0R-B4AaABAg', 'authorDisplayName': 'Adriana Lopes', 'authorProfileImageUrl': 'https://yt3.ggpht.com/ytc/AGIKgqMioz1R03owQ99OcYGiOGwWr2NTvj5IBaggqPGCMbk=s48-c-k-c0x00ffffff-no-rj', 'authorChannelUrl': 'http://www.youtube.com/channel/UCADjdJ1Sc3waqdZGg1d7YVw', 'authorChannelId': {'value': 'UCADjdJ1Sc3waqdZGg1d7YVw'}, 'canRate': True, 'viewerRating': 'none', 'likeCount': 0, 'publishedAt': '2022-10-26T21:51:42Z', 'updatedAt': '2022-10-26T21:51:42Z'}}, {'kind': 'youtube#comment', 'etag': '599WiKbzf8Z-UTLW56gUq2cXjRA', 'id': 'Ugz1ZeSrErEn1mo0R-B4AaABAg.9hc4autcs8c9hepnZLPQMy', 'snippet': {'videoId': 'oeQDimow_bE', 'textDisplay': '@kirmair nascimento pereira ...eu não uso seu remédio kkk', 'textOriginal': '@kirmair nascimento pereira ...eu não uso seu remédio kkk', 'parentId': 'Ugz1ZeSrErEn1mo0R-B4AaABAg', 'authorDisplayName': 'Adriana Lopes', 'authorProfileImageUrl': 'https://yt3.ggpht.com/ytc/AGIKgqMioz1R03owQ99OcYGiOGwWr2NTvj5IBaggqPGCMbk=s48-c-k-c0x00ffffff-no-rj', 'authorChannelUrl': 'http://www.youtube.com/channel/UCADjdJ1Sc3waqdZGg1d7YVw', 'authorChannelId': {'value': 'UCADjdJ1Sc3waqdZGg1d7YVw'}, 'canRate': True, 'viewerRating': 'none', 'likeCount': 0, 'publishedAt': '2022-10-26T21:49:26Z', 'updatedAt': '2022-10-26T21:49:26Z'}}, {'kind': 'youtube#comment', 'etag': 'UmRG7Nv0xkJCtsyjdrbHtLyhiY0', 'id': 'Ugz1ZeSrErEn1mo0R-B4AaABAg.9hc4autcs8c9hepkYcd7JO', 'snippet': {'videoId': 'oeQDimow_bE', 'textDisplay': '@Alberto Queiroz boi não é um adjetivo de qualidade pra mim.. hummm porque penso que chifres não seria pra mim...', 'textOriginal': '@Alberto Queiroz boi não é um adjetivo de qualidade pra mim.. hummm porque penso que chifres não seria pra mim...', 'parentId': 'Ugz1ZeSrErEn1mo0R-B4AaABAg', 'authorDisplayName': 'Adriana Lopes', 'authorProfileImageUrl': 'https://yt3.ggpht.com/ytc/AGIKgqMioz1R03owQ99OcYGiOGwWr2NTvj5IBaggqPGCMbk=s48-c-k-c0x00ffffff-no-rj', 'authorChannelUrl': 'http://www.youtube.com/channel/UCADjdJ1Sc3waqdZGg1d7YVw', 'authorChannelId': {'value': 'UCADjdJ1Sc3waqdZGg1d7YVw'}, 'canRate': True, 'viewerRating': 'none', 'likeCount': 0, 'publishedAt': '2022-10-26T21:49:02Z', 'updatedAt': '2022-10-26T21:55:27Z'}}]}",UCADjdJ1Sc3waqdZGg1d7YVw,2022-10-25T20:09:48Z,B 22 POR UM BRASIL LIVRE!!!,,2023-06-09 12:08:56.019050
youtube#commentThread,g401-9zqzrK-CYbh0nUSnxyJS1k,Ugwhr3Ro_3vJWOJeogZ4AaABAg,"{'videoId': 'oeQDimow_bE', 'topLevelComment': {'kind': 'youtube#comment', 'etag': 'bgQ7T2LydvEnHXvHWDC8cMXbdNQ', 'id': 'Ugwhr3Ro_3vJWOJeogZ4AaABAg', 'snippet': {'videoId': 'oeQDimow_bE', 'textDisplay': 'Os evangélicos acreditam em tudo aquilo que o Bolsonaro fala e faz.', 'textOriginal': 'Os evangélicos acreditam em tudo aquilo que o Bolsonaro fala e faz.', 'authorDisplayName': 'Carlo Dastoli', 'authorProfileImageUrl': 'https://yt3.ggpht.com/ytc/AGIKgqMclTMdbbpb2EUviLWUtrlV6_ddIN2bmV5Fmg=s48-c-k-c0x00ffffff-no-rj', 'authorChannelUrl': 'http://www.youtube.com/channel/UCPbJlkf1Yb30YA7tGqcivKw', 'authorChannelId': {'value': 'UCPbJlkf1Yb30YA7tGqcivKw'}, 'canRate': True, 'viewerRating': 'none', 'likeCount': 12, 'publishedAt': '2022-10-25T20:03:37Z', 'updatedAt': '2022-10-25T20:03:37Z'}}, 'canReply': True, 'totalReplyCount': 6, 'isPublic': True}","{'comments': [{'kind': 'youtube#comment', 'etag': 'Zs-I2nboW0uUmg56_3vm0XyiIWU', 'id': 'Ugwhr3Ro_3vJWOJeogZ4AaABAg.9hc3taGtYp59heVZTvxifw', 'snippet': {'videoId': 'oeQDimow_bE', 'textDisplay': '@Valdomiro Nascimento  segundo todas as pesquisas levantadas nos últimos meses até os dias atuais, todos os institutos de pesquisas sem exceção, apontam a grande maioria dos evangélicos sempre apontam   dando apoio ao bolsonaro,  isso é fato e contra fatos não há argumentos.  É triste tem que admitir mas, serão os evangélicos que poderão contribuir para a destruição do nosso país no próximo ao votar em bolsonaro', 'textOriginal': '@Valdomiro Nascimento  segundo todas as pesquisas levantadas nos últimos meses até os dias atuais, todos os institutos de pesquisas sem exceção, apontam a grande maioria dos evangélicos sempre apontam   dando apoio ao bolsonaro,  isso é fato e contra fatos não há argumentos.  É triste tem que admitir mas, serão os evangélicos que poderão contribuir para a destruição do nosso país no próximo ao votar em bolsonaro', 'parentId': 'Ugwhr3Ro_3vJWOJeogZ4AaABAg', 'authorDisplayName': 'jarbas gaspar', 'authorProfileImageUrl': 'https://yt3.ggpht.com/ytc/AGIKgqNWOWH_JO5Iz4xUS5bu-UJltiKXtHSJ9Kk05Q=s48-c-k-c0x00ffffff-no-rj', 'authorChannelUrl': 'http://www.youtube.com/channel/UCH0npycjO_YNGb4R3jnI93Q', 'authorChannelId': {'value': 'UCH0npycjO_YNGb4R3jnI93Q'}, 'canRate': True, 'viewerRating': 'none', 'likeCount': 0, 'publishedAt': '2022-10-26T18:43:53Z', 'updatedAt': '2022-10-26T18:43:53Z'}}, {'kind': 'youtube#comment', 'etag': 'AhPpTBR_qNiDMaUFSL6ssJ2n0yk', 'id': 'Ugwhr3Ro_3vJWOJeogZ4AaABAg.9hc3taGtYp59heOrPWD29u', 'snippet': {'videoId': 'oeQDimow_bE', 'textDisplay': 'É impressionante!!!! As pessoas acreditar em tantas mentiras,mas minha opinião é que.....parte dessas pessoas são más e se identifica com o Bolsonaro !!!', 'textOriginal': 'É impressionante!!!! As pessoas acreditar em tantas mentiras,mas minha opinião é que.....parte dessas pessoas são más e se identifica com o Bolsonaro !!!', 'parentId': 'Ugwhr3Ro_3vJWOJeogZ4AaABAg', 'authorDisplayName': 'Maria de Lourdes Lisboa', 'authorProfileImageUrl': 'https://yt3.ggpht.com/ytc/AGIKgqOJBJsi-pKlUDfsRWvVtCxrLuhocg0gWr48zkeAwg=s48-c-k-c0x00ffffff-no-rj', 'authorChannelUrl': 'http://www.youtube.com/channel/UC-c85kalPwlDHbzbrk3zuAw', 'authorChannelId': {'value': 'UC-c85kalPwlDHbzbrk3zuAw'}, 'canRate': True, 'viewerRating': 'none', 'likeCount': 0, 'publishedAt': '2022-10-26T17:45:18Z', 'updatedAt': '2022-10-26T17:45:18Z'}}, {'kind': 'youtube#comment', 'etag': '4vmVDSHX1da_9_fweu2pRD2BCoM', 'id': 'Ugwhr3Ro_3vJWOJeogZ4AaABAg.9hc3taGtYp59hcRM2keiVt', 'snippet': {'videoId': 'oeQDimow_bE', 'textDisplay': 'É preciso constatar que a religião tal como é construída pelos pastores e bispos dessas igrejas corroi o cérebro de seus frequentadores.', 'textOriginal': 'É preciso constatar que a religião tal como é construída pelos pastores e bispos dessas igrejas corroi o cérebro de seus frequentadores.', 'parentId': 'Ugwhr3Ro_3vJWOJeogZ4AaABAg', 'authorDisplayName': 'Carlo Dastoli', 'authorProfileImageUrl': 'https://yt3.ggpht.com/ytc/AGIKgqMclTMdbbpb2EUviLWUtrlV6_ddIN2bmV5Fmg=s48-c-k-c0x00ffffff-no-rj', 'authorChannelUrl': 'http://www.youtube.com/channel/UCPbJlkf1Yb30YA7tGqcivKw', 'authorChannelId': {'value': 'UCPbJlkf1Yb30YA7tGqcivKw'}, 'canRate': True, 'viewerRating': 'none', 'likeCount': 0, 'publishedAt': '2022-10-25T23:28:37Z', 'updatedAt': '2022-10-25T23:28:37Z'}}, {'kind': 'youtube#comment', 'etag': 'tdprcYoJ4cob__UYqanPNwzqMfA', 'id': 'Ugwhr3Ro_3vJWOJeogZ4AaABAg.9hc3taGtYp59hcRCyzbNre', 'snippet': {'videoId': 'oeQDimow_bE', 'textDisplay': 'Exatamente. As igrejas evangélicas, salvo raras e honrosas exceções, viraram comite eleitoral e palanque oficial do Bolsonaro.', 'textOriginal': 'Exatamente. As igrejas evangélicas, salvo raras e honrosas exceções, viraram comite eleitoral e palanque oficial do Bolsonaro.', 'parentId': 'Ugwhr3Ro_3vJWOJeogZ4AaABAg', 'authorDisplayName': 'Carlo Dastoli', 'authorProfileImageUrl': 'https://yt3.ggpht.com/ytc/AGIKgqMclTMdbbpb2EUviLWUtrlV6_ddIN2bmV5Fmg=s48-c-k-c0x00ffffff-no-rj', 'authorChannelUrl': 'http://www.youtube.com/channel/UCPbJlkf1Yb30YA7tGqcivKw', 'authorChannelId': {'value': 'UCPbJlkf1Yb30YA7tGqcivKw'}, 'canRate': True, 'viewerRating': 'none', 'likeCount': 0, 'publishedAt': '2022-10-25T23:27:22Z', 'updatedAt': '2022-10-25T23:27:22Z'}}, {'kind': 'youtube#comment', 'etag': 'PTvKK6tx7_iNh8jEq-hvPhL82xI', 'id': 'Ugwhr3Ro_3vJWOJeogZ4AaABAg.9hc3taGtYp59hcPsDnL2mD', 'snippet': {'videoId': 'oeQDimow_bE', 'textDisplay': 'O problema das igrejas hoje é que os fieis estão sendo doutrinados a obedecerem os seus pastores enquanto os ensinamentos de jesus vão ficando de lado, neste momento as igrejas estao fazendo culto pra o bolsonaro a idolatria agora escancarou de vez.', 'textOriginal': 'O problema das igrejas hoje é que os fieis estão sendo doutrinados a obedecerem os seus pastores enquanto os ensinamentos de jesus vão ficando de lado, neste momento as igrejas estao fazendo culto pra o bolsonaro a idolatria agora escancarou de vez.', 'parentId': 'Ugwhr3Ro_3vJWOJeogZ4AaABAg', 'authorDisplayName': 'Ray Moreira', 'authorProfileImageUrl': 'https://yt3.ggpht.com/ytc/AGIKgqOCm1imuO89CmFzBXuMcznhH2TY7yV8bN_NzwU1zQaNP1ZXUZ9fvNDKRq2wKl-S=s48-c-k-c0x00ffffff-no-rj', 'authorChannelUrl': 'http://www.youtube.com/channel/UCuISVHRr9zXhf0kwiGrVz7A', 'authorChannelId': {'value': 'UCuISVHRr9zXhf0kwiGrVz7A'}, 'canRate': True, 'viewerRating': 'none', 'likeCount': 0, 'publishedAt': '2022-10-25T23:15:40Z', 'updatedAt': '2022-10-25T23:15:40Z'}}]}",UCPbJlkf1Yb30YA7tGqcivKw,2022-10-25T20:03:37Z,Os evangélicos acreditam em tudo aquilo que o Bolsonaro fala e faz.,,2023-06-09 12:08:56.019050
youtube#commentThread,0Q08969kW74jNo9ALknU5lk2V6o,UgykVfWz2Zzzj2op8lB4AaABAg,"{'videoId': 'oeQDimow_bE', 'topLevelComment': {'kind': 'youtube#comment', 'etag': 'TMZOB_74NP5x3tGU6g8fzMxNINw', 'id': 'UgykVfWz2Zzzj2op8lB4AaABAg', 'snippet': {'videoId': 'oeQDimow_bE', 'textDisplay': 'Ele ia mandar tb as forças armadas?!', 'textOriginal': 'Ele ia mandar tb as forças armadas?!', 'authorDisplayName': 'Carlo Dastoli', 'authorProfileImageUrl': 'https://yt3.ggpht.com/ytc/AGIKgqMclTMdbbpb2EUviLWUtrlV6_ddIN2bmV5Fmg=s48-c-k-c0x00ffffff-no-rj', 'authorChannelUrl': 'http://www.youtube.com/channel/UCPbJlkf1Yb30YA7tGqcivKw', 'authorChannelId': {'value': 'UCPbJlkf1Yb30YA7tGqcivKw'}, 'canRate': True, 'viewerRating': 'none', 'likeCount': 4, 'publishedAt': '2022-10-25T20:02:50Z', 'updatedAt': '2022-10-25T20:02:50Z'}}, 'canReply': True, 'totalReplyCount': 0, 'isPublic': True}",,UCPbJlkf1Yb30YA7tGqcivKw,2022-10-25T20:02:50Z,Ele ia mandar tb as forças armadas?!,,2023-06-09 12:08:56.019050
youtube#commentThread,mkZFfe-JlEAhslYm4kX7A6tYVwQ,UgxsxbHYaFYsxwF98dh4AaABAg,"{'videoId': 'oeQDimow_bE', 'topLevelComment': {'kind': 'youtube#comment', 'etag': 'hR6NhDfmFftJomVj4xIyF3G7KTE', 'id': 'UgxsxbHYaFYsxwF98dh4AaABAg', 'snippet': {'videoId': 'oeQDimow_bE', 'textDisplay': 'Estão falando para os empresários', 'textOriginal': 'Estão falando para os empresários', 'authorDisplayName': 'Fatima Aquino', 'authorProfileImageUrl': 'https://yt3.ggpht.com/ytc/AGIKgqPoSHxwQ3RVv3Z0nruO7SUoAzCLftHdzqmcVlV6jQ=s48-c-k-c0x00ffffff-no-rj', 'authorChannelUrl': 'http://www.youtube.com/channel/UCT6CiKOT6CikfNxHmSj-cgQ', 'authorChannelId': {'value': 'UCT6CiKOT6CikfNxHmSj-cgQ'}, 'canRate': True, 'viewerRating': 'none', 'likeCount': 3, 'publishedAt': '2022-10-25T20:02:29Z', 'updatedAt': '2022-10-25T20:02:29Z'}}, 'canReply': True, 'totalReplyCount': 0, 'isPublic': True}",,UCT6CiKOT6CikfNxHmSj-cgQ,2022-10-25T20:02:29Z,Estão falando para os empresários,,2023-06-09 12:08:56.019050
youtube#commentThread,IafTNrD9rlIMCY06Y-IXLIlfsuo,UgzuSz85vwqnN7KHhJp4AaABAg,"{'videoId': 'oeQDimow_bE', 'topLevelComment': {'kind': 'youtube#comment', 'etag': 'T4bUTa2C-gHAYSuQ0I1d3T6Uygk', 'id': 'UgzuSz85vwqnN7KHhJp4AaABAg', 'snippet': {'videoId': 'oeQDimow_bE', 'textDisplay': 'Até hoje não se sabe quem mandou matar Marielle', 'textOriginal': 'Até hoje não se sabe quem mandou matar Marielle', 'authorDisplayName': 'Carlo Dastoli', 'authorProfileImageUrl': 'https://yt3.ggpht.com/ytc/AGIKgqMclTMdbbpb2EUviLWUtrlV6_ddIN2bmV5Fmg=s48-c-k-c0x00ffffff-no-rj', 'authorChannelUrl': 'http://www.youtube.com/channel/UCPbJlkf1Yb30YA7tGqcivKw', 'authorChannelId': {'value': 'UCPbJlkf1Yb30YA7tGqcivKw'}, 'canRate': True, 'viewerRating': 'none', 'likeCount': 0, 'publishedAt': '2022-10-25T20:01:47Z', 'updatedAt': '2022-10-25T20:01:47Z'}}, 'canReply': True, 'totalReplyCount': 0, 'isPublic': True}",,UCPbJlkf1Yb30YA7tGqcivKw,2022-10-25T20:01:47Z,Até hoje não se sabe quem mandou matar Marielle,,2023-06-09 12:08:56.019050
youtube#commentThread,kvLPOy3mp6sqCh773wUFCl9ilTs,Ugx0lxIbWQNI0ISdrRx4AaABAg,"{'videoId': 'oeQDimow_bE', 'topLevelComment': {'kind': 'youtube#comment', 'etag': 'aUCSPKw_IXV8OCsaCOysF58bkP4', 'id': 'Ugx0lxIbWQNI0ISdrRx4AaABAg', 'snippet': {'videoId': 'oeQDimow_bE', 'textDisplay': 'E os tiros na caravana do Lula em 2018?', 'textOriginal': 'E os tiros na caravana do Lula em 2018?', 'authorDisplayName': 'Carlo Dastoli', 'authorProfileImageUrl': 'https://yt3.ggpht.com/ytc/AGIKgqMclTMdbbpb2EUviLWUtrlV6_ddIN2bmV5Fmg=s48-c-k-c0x00ffffff-no-rj', 'authorChannelUrl': 'http://www.youtube.com/channel/UCPbJlkf1Yb30YA7tGqcivKw', 'authorChannelId': {'value': 'UCPbJlkf1Yb30YA7tGqcivKw'}, 'canRate': True, 'viewerRating': 'none', 'likeCount': 3, 'publishedAt': '2022-10-25T20:01:21Z', 'updatedAt': '2022-10-25T20:01:21Z'}}, 'canReply': True, 'totalReplyCount': 0, 'isPublic': True}",,UCPbJlkf1Yb30YA7tGqcivKw,2022-10-25T20:01:21Z,E os tiros na caravana do Lula em 2018?,,2023-06-09 12:08:56.019050
youtube#commentThread,k-7x5u6LR9PXi_KMxH3YbQwggtE,UgzWaGp9VuKxGVQ18St4AaABAg,"{'videoId': 'oeQDimow_bE', 'topLevelComment': {'kind': 'youtube#comment', 'etag': 'cf08VEQTbBm9znsC-Wpupj0hJYg', 'id': 'UgzWaGp9VuKxGVQ18St4AaABAg', 'snippet': {'videoId': 'oeQDimow_bE', 'textDisplay': 'Eu voto no Lula, mas a pessoa que trabalha na casa da minha mãe vai votar no Bolsonaro. É assustador!', 'textOriginal': 'Eu voto no Lula, mas a pessoa que trabalha na casa da minha mãe vai votar no Bolsonaro. É assustador!', 'authorDisplayName': 'Carlo Dastoli', 'authorProfileImageUrl': 'https://yt3.ggpht.com/ytc/AGIKgqMclTMdbbpb2EUviLWUtrlV6_ddIN2bmV5Fmg=s48-c-k-c0x00ffffff-no-rj', 'authorChannelUrl': 'http://www.youtube.com/channel/UCPbJlkf1Yb30YA7tGqcivKw', 'authorChannelId': {'value': 'UCPbJlkf1Yb30YA7tGqcivKw'}, 'canRate': True, 'viewerRating': 'none', 'likeCount': 12, 'publishedAt': '2022-10-25T20:00:07Z', 'updatedAt': '2022-10-25T20:00:07Z'}}, 'canReply': True, 'totalReplyCount': 3, 'isPublic': True}","{'comments': [{'kind': 'youtube#comment', 'etag': 'BhFzmobD3bf6j2PLbtSquYllTy4', 'id': 'UgzWaGp9VuKxGVQ18St4AaABAg.9hc3Uw23KXd9herSm8cNJy', 'snippet': {'videoId': 'oeQDimow_bE', 'textDisplay': '@karamoojo bell Amém', 'textOriginal': '@karamoojo bell Amém', 'parentId': 'UgzWaGp9VuKxGVQ18St4AaABAg', 'authorDisplayName': 'Adriana Lopes', 'authorProfileImageUrl': 'https://yt3.ggpht.com/ytc/AGIKgqMioz1R03owQ99OcYGiOGwWr2NTvj5IBaggqPGCMbk=s48-c-k-c0x00ffffff-no-rj', 'authorChannelUrl': 'http://www.youtube.com/channel/UCADjdJ1Sc3waqdZGg1d7YVw', 'authorChannelId': {'value': 'UCADjdJ1Sc3waqdZGg1d7YVw'}, 'canRate': True, 'viewerRating': 'none', 'likeCount': 0, 'publishedAt': '2022-10-26T22:03:56Z', 'updatedAt': '2022-10-26T22:03:56Z'}}, {'kind': 'youtube#comment', 'etag': 'z5yejOdXrxH4l6hqQOb0d_lq6CY', 'id': 'UgzWaGp9VuKxGVQ18St4AaABAg.9hc3Uw23KXd9hc7r72Fnna', 'snippet': {'videoId': 'oeQDimow_bE', 'textDisplay': 'Concerteza acredita nas fake news do ZAP do Bozo ou vai votar no demônio por que o pastor falou ou os dois juntos. É uma pena que exista gente assim, ainda mais sendo pobre. Parece que não tá vendo o que tá acontecendo com o povo nesse desgoverno.', 'textOriginal': 'Concerteza acredita nas fake news do ZAP do Bozo ou vai votar no demônio por que o pastor falou ou os dois juntos. É uma pena que exista gente assim, ainda mais sendo pobre. Parece que não tá vendo o que tá acontecendo com o povo nesse desgoverno.', 'parentId': 'UgzWaGp9VuKxGVQ18St4AaABAg', 'authorDisplayName': 'Viniky Victor', 'authorProfileImageUrl': 'https://yt3.ggpht.com/ytc/AGIKgqNg9vjfCpRrkZRyRy76aV60VpD3-NCXQ-YFeWLr=s48-c-k-c0x00ffffff-no-rj', 'authorChannelUrl': 'http://www.youtube.com/channel/UCrnJcbEVFQbBkdaEw_fiv0A', 'authorChannelId': {'value': 'UCrnJcbEVFQbBkdaEw_fiv0A'}, 'canRate': True, 'viewerRating': 'none', 'likeCount': 0, 'publishedAt': '2022-10-25T20:38:14Z', 'updatedAt': '2022-10-25T20:38:14Z'}}, {'kind': 'youtube#comment', 'etag': '67UcImrm43E_32IShMC_QSc_h3E', 'id': 'UgzWaGp9VuKxGVQ18St4AaABAg.9hc3Uw23KXd9hc6KiWVEJl', 'snippet': {'videoId': 'oeQDimow_bE', 'textDisplay': 'Deve ser evangélica.', 'textOriginal': 'Deve ser evangélica.', 'parentId': 'UgzWaGp9VuKxGVQ18St4AaABAg', 'authorDisplayName': 'karamoojo bell', 'authorProfileImageUrl': 'https://yt3.ggpht.com/ytc/AGIKgqPBeQnIlqhiMLBNfTV8uopnaaCbJXkhiqT9yZ_j0WZC06XZDNtzsWKyWQNquewU=s48-c-k-c0x00ffffff-no-rj', 'authorChannelUrl': 'http://www.youtube.com/channel/UC2QlccARsjvWhAVJE73QxhQ', 'authorChannelId': {'value': 'UC2QlccARsjvWhAVJE73QxhQ'}, 'canRate': True, 'viewerRating': 'none', 'likeCount': 4, 'publishedAt': '2022-10-25T20:24:56Z', 'updatedAt': '2022-10-25T20:24:56Z'}}]}",UCPbJlkf1Yb30YA7tGqcivKw,2022-10-25T20:00:07Z,"Eu voto no Lula, mas a pessoa que trabalha na casa da minha mãe vai votar no Bolsonaro. É assustador!",,2023-06-09 12:08:56.019050
youtube#commentThread,2FeLzxYlL1tMp5SUGwZ3jyDwNAg,UgxIXfL8cjcVBT3zGN54AaABAg,"{'videoId': 'oeQDimow_bE', 'topLevelComment': {'kind': 'youtube#comment', 'etag': 'bdLgZJ7CTAbTgDwwGw8vbyx1Pis', 'id': 'UgxIXfL8cjcVBT3zGN54AaABAg', 'snippet': {'videoId': 'oeQDimow_bE', 'textDisplay': 'DE UMA  COISA OS BRASILEIROS TEM QUE SE CONVENCER: BOLSONARO E PAULO GUEDES SÃO  PERVERSOS E NÃO SABEM FAZER NADA. TUDO UE ELES PROPÕE É PRA BAGUNÇAR, DAR PREJUÍZO E ARRUINAR A VIDA DAS PESSOAS.', 'textOriginal': 'DE UMA  COISA OS BRASILEIROS TEM QUE SE CONVENCER: BOLSONARO E PAULO GUEDES SÃO  PERVERSOS E NÃO SABEM FAZER NADA. TUDO UE ELES PROPÕE É PRA BAGUNÇAR, DAR PREJUÍZO E ARRUINAR A VIDA DAS PESSOAS.', 'authorDisplayName': 'Neuzimar Gomes Silva Silva', 'authorProfileImageUrl': 'https://yt3.ggpht.com/ytc/AGIKgqMEWhz7ahTt0kw15vaCHhv8P81kU6DFCu0h_g=s48-c-k-c0x00ffffff-no-rj', 'authorChannelUrl': 'http://www.youtube.com/channel/UCkW4ukbwQBejinGPgCfMiRQ', 'authorChannelId': {'value': 'UCkW4ukbwQBejinGPgCfMiRQ'}, 'canRate': True, 'viewerRating': 'none', 'likeCount': 2, 'publishedAt': '2022-10-25T19:59:22Z', 'updatedAt': '2022-10-25T20:01:29Z'}}, 'canReply': True, 'totalReplyCount': 0, 'isPublic': True}",,UCkW4ukbwQBejinGPgCfMiRQ,2022-10-25T19:59:22Z,"DE UMA  COISA OS BRASILEIROS TEM QUE SE CONVENCER: BOLSONARO E PAULO GUEDES SÃO  PERVERSOS E NÃO SABEM FAZER NADA. TUDO UE ELES PROPÕE É PRA BAGUNÇAR, DAR PREJUÍZO E ARRUINAR A VIDA DAS PESSOAS.",,2023-06-09 12:08:56.019050
