kind,etag,id,snippet,replies,authorChannelId,publishedAt,textOriginal,nextPageToken,extraction_date
youtube#commentThread,0kJ4FWEFB28ANoQnc1Fp0bS4-iY,UgyBqTTEwjA5QNaF_JR4AaABAg,"{'videoId': 'XC8FiLhsJSo', 'topLevelComment': {'kind': 'youtube#comment', 'etag': '36B7tFKDnlJBLdFaqKzzQn0-vuU', 'id': 'UgyBqTTEwjA5QNaF_JR4AaABAg', 'snippet': {'videoId': 'XC8FiLhsJSo', 'textDisplay': 'Foi entregue as provas @@@@@ para não falar outra coisa , o o próprio jurídico da rádio que houve favorecimento!!! preferência  cabal sim distribuição no TSE ! Vergonha na band e globo é farinha do mesmo saco!', 'textOriginal': 'Foi entregue as provas @@@@@ para não falar outra coisa , o o próprio jurídico da rádio que houve favorecimento!!! preferência  cabal sim distribuição no TSE ! Vergonha na band e globo é farinha do mesmo saco!', 'authorDisplayName': 'Aguinaldo Bezerra', 'authorProfileImageUrl': 'https://yt3.ggpht.com/ytc/AGIKgqO9cjTmHoLVy7ub4_Ro1KfxQWCQFeouZlTFAA=s48-c-k-c0x00ffffff-no-rj', 'authorChannelUrl': 'http://www.youtube.com/channel/UCi4h2oA2oJXK8PPIJbBWTMg', 'authorChannelId': {'value': 'UCi4h2oA2oJXK8PPIJbBWTMg'}, 'canRate': True, 'viewerRating': 'none', 'likeCount': 0, 'publishedAt': '2022-10-27T13:45:30Z', 'updatedAt': '2022-10-27T13:45:30Z'}}, 'canReply': True, 'totalReplyCount': 0, 'isPublic': True}",,UCi4h2oA2oJXK8PPIJbBWTMg,2022-10-27T13:45:30Z,"Foi entregue as provas @@@@@ para não falar outra coisa , o o próprio jurídico da rádio que houve favorecimento!!! preferência  cabal sim distribuição no TSE ! Vergonha na band e globo é farinha do mesmo saco!",,2023-06-07 23:49:22.582146
youtube#commentThread,U0tP2OvH-AyYcMuNiR2LXtIXPAc,UgzOc9FYA35aWRUv6dF4AaABAg,"{'videoId': 'XC8FiLhsJSo', 'topLevelComment': {'kind': 'youtube#comment', 'etag': 'BuS69qn6dvVRVfBPFq5QCO419Rk', 'id': 'UgzOc9FYA35aWRUv6dF4AaABAg', 'snippet': {'videoId': 'XC8FiLhsJSo', 'textDisplay': 'CD o Mitre que enche a boca para falar de democracia?', 'textOriginal': 'CD o Mitre que enche a boca para falar de democracia?', 'authorDisplayName': 'Paulo Roberto Oliveira', 'authorProfileImageUrl': 'https://yt3.ggpht.com/ytc/AGIKgqMn7HFChlwcnDmKesujpFv1HzS5RJsAUfS6FA=s48-c-k-c0x00ffffff-no-rj', 'authorChannelUrl': 'http://www.youtube.com/channel/UCr6JDPqhc5bK4cpgVrjEBKg', 'authorChannelId': {'value': 'UCr6JDPqhc5bK4cpgVrjEBKg'}, 'canRate': True, 'viewerRating': 'none', 'likeCount': 0, 'publishedAt': '2022-10-26T21:28:22Z', 'updatedAt': '2022-10-26T21:28:22Z'}}, 'canReply': True, 'totalReplyCount': 0, 'isPublic': True}",,UCr6JDPqhc5bK4cpgVrjEBKg,2022-10-26T21:28:22Z,CD o Mitre que enche a boca para falar de democracia?,,2023-06-07 23:49:22.582146
youtube#commentThread,IuBmX7-xBDSFVUn38pi4_2GDbeo,UgwOK0jq3Dm5o0DXW_t4AaABAg,"{'videoId': 'XC8FiLhsJSo', 'topLevelComment': {'kind': 'youtube#comment', 'etag': 'oY9kW3CAZZEBiX7sS6jfLLD1j0c', 'id': 'UgwOK0jq3Dm5o0DXW_t4AaABAg', 'snippet': {'videoId': 'XC8FiLhsJSo', 'textDisplay': 'Eleições fraudadas! Censura , e agora isso... Que vergonha! O orçamento de 2 bi do TSE só serve para espionar o ZAP alheio msm, né Xandão??', 'textOriginal': 'Eleições fraudadas! Censura , e agora isso... Que vergonha! O orçamento de 2 bi do TSE só serve para espionar o ZAP alheio msm, né Xandão??', 'authorDisplayName': 'TheRedViper', 'authorProfileImageUrl': 'https://yt3.ggpht.com/ytc/AGIKgqNJosVjXAILRwTfMrkV0Wr_VGcvi8OjZUKrEw=s48-c-k-c0x00ffffff-no-rj', 'authorChannelUrl': 'http://www.youtube.com/channel/UCG3RKz9kLbHdhd21lh0IRCA', 'authorChannelId': {'value': 'UCG3RKz9kLbHdhd21lh0IRCA'}, 'canRate': True, 'viewerRating': 'none', 'likeCount': 1, 'publishedAt': '2022-10-26T21:18:06Z', 'updatedAt': '2022-10-26T21:18:06Z'}}, 'canReply': True, 'totalReplyCount': 0, 'isPublic': True}",,UCG3RKz9kLbHdhd21lh0IRCA,2022-10-26T21:18:06Z,"Eleições fraudadas! Censura , e agora isso... Que vergonha! O orçamento de 2 bi do TSE só serve para espionar o ZAP alheio msm, né Xandão??",,2023-06-07 23:49:22.582146
youtube#commentThread,gmXBCOGhChEvCNwECn4kJaSsxGE,UgxH0iu76qInW2f4L2R4AaABAg,"{'videoId': 'XC8FiLhsJSo', 'topLevelComment': {'kind': 'youtube#comment', 'etag': 'F-H8k3TGArcW6TrTD-6BKrc8Cd8', 'id': 'UgxH0iu76qInW2f4L2R4AaABAg', 'snippet': {'videoId': 'XC8FiLhsJSo', 'textDisplay': 'Oque se vê e um sistema corrupto tendo seu presidiário de estimação recebendo vantagem!!', 'textOriginal': 'Oque se vê e um sistema corrupto tendo seu presidiário de estimação recebendo vantagem!!', 'authorDisplayName': 'Leandro Fagundes Peres', 'authorProfileImageUrl': 'https://yt3.ggpht.com/ytc/AGIKgqOgzkeUpVdgAzyYAmduybGkkCW41DueZr90=s48-c-k-c0x00ffffff-no-rj', 'authorChannelUrl': 'http://www.youtube.com/channel/UCuL9nn1a7kFg8RDJGZU19zA', 'authorChannelId': {'value': 'UCuL9nn1a7kFg8RDJGZU19zA'}, 'canRate': True, 'viewerRating': 'none', 'likeCount': 0, 'publishedAt': '2022-10-26T20:28:34Z', 'updatedAt': '2022-10-26T20:28:34Z'}}, 'canReply': True, 'totalReplyCount': 0, 'isPublic': True}",,UCuL9nn1a7kFg8RDJGZU19zA,2022-10-26T20:28:34Z,Oque se vê e um sistema corrupto tendo seu presidiário de estimação recebendo vantagem!!,,2023-06-07 23:49:22.582146
youtube#commentThread,5yMqmUp8dFuQd2h_1BNYzxu9JU8,UgzybDuNHRNL1M_b6vt4AaABAg,"{'videoId': 'XC8FiLhsJSo', 'topLevelComment': {'kind': 'youtube#comment', 'etag': '8AsydWt8WPAxlZ79y30r83DK7yE', 'id': 'UgzybDuNHRNL1M_b6vt4AaABAg', 'snippet': {'videoId': 'XC8FiLhsJSo', 'textDisplay': 'Vamos cancelar pôr favor 😢😢 obrigada esse Lula e em vão que horror....', 'textOriginal': 'Vamos cancelar pôr favor 😢😢 obrigada esse Lula e em vão que horror....', 'authorDisplayName': 'karl lenzhofer', 'authorProfileImageUrl': 'https://yt3.ggpht.com/ytc/AGIKgqMttZuZLqZlRk8BLOSaRtg4dXkPv5RtpiorzRG6=s48-c-k-c0x00ffffff-no-rj', 'authorChannelUrl': 'http://www.youtube.com/channel/UChOsg9N7sBcheeIxgNQ1G6g', 'authorChannelId': {'value': 'UChOsg9N7sBcheeIxgNQ1G6g'}, 'canRate': True, 'viewerRating': 'none', 'likeCount': 0, 'publishedAt': '2022-10-26T19:03:02Z', 'updatedAt': '2022-10-26T19:04:00Z'}}, 'canReply': True, 'totalReplyCount': 0, 'isPublic': True}",,UChOsg9N7sBcheeIxgNQ1G6g,2022-10-26T19:03:02Z,Vamos cancelar pôr favor 😢😢 obrigada esse Lula e em vão que horror....,,2023-06-07 23:49:22.582146
youtube#commentThread,5-SyhziaWaKvjbmrMBSr8KnyiA4,Ugwp11-39E4BzSUpQ4p4AaABAg,"{'videoId': 'XC8FiLhsJSo', 'topLevelComment': {'kind': 'youtube#comment', 'etag': 'EEbjVLpQAxHHOE9aTdyMdysMjeg', 'id': 'Ugwp11-39E4BzSUpQ4p4AaABAg', 'snippet': {'videoId': 'XC8FiLhsJSo', 'textDisplay': 'Esse professor está enrolando. Houve sim provas robustas de furto de inserção contra Bolsonaro ,desonestidade . O TSE não acredita mais nessa instituição e a imprensa nojenta quer abafa o caso. E da próxima vez tragam um professor imparcial e que não gagueje de tanto omissão .', 'textOriginal': 'Esse professor está enrolando. Houve sim provas robustas de furto de inserção contra Bolsonaro ,desonestidade . O TSE não acredita mais nessa instituição e a imprensa nojenta quer abafa o caso. E da próxima vez tragam um professor imparcial e que não gagueje de tanto omissão .', 'authorDisplayName': 'Zinaldo Ferreira', 'authorProfileImageUrl': 'https://yt3.ggpht.com/ytc/AGIKgqO8F3s6ie77Re6-bbw__HHnlUJ7KFqHG9xzmw=s48-c-k-c0x00ffffff-no-rj', 'authorChannelUrl': 'http://www.youtube.com/channel/UCBqAuGG_7G64scBAxB86Ppw', 'authorChannelId': {'value': 'UCBqAuGG_7G64scBAxB86Ppw'}, 'canRate': True, 'viewerRating': 'none', 'likeCount': 0, 'publishedAt': '2022-10-26T18:09:04Z', 'updatedAt': '2022-10-26T18:09:04Z'}}, 'canReply': True, 'totalReplyCount': 0, 'isPublic': True}",,UCBqAuGG_7G64scBAxB86Ppw,2022-10-26T18:09:04Z,"Esse professor está enrolando. Houve sim provas robustas de furto de inserção contra Bolsonaro ,desonestidade . O TSE não acredita mais nessa instituição e a imprensa nojenta quer abafa o caso. E da próxima vez tragam um professor imparcial e que não gagueje de tanto omissão .",,2023-06-07 23:49:22.582146
youtube#commentThread,WewBdQ8kWm3pKATilxARfKftlyg,UgzpMaX49GQIS3AZvJN4AaABAg,"{'videoId': 'XC8FiLhsJSo', 'topLevelComment': {'kind': 'youtube#comment', 'etag': 'faSme1r_V8WG3xp0vjrWQ0GDERM', 'id': 'UgzpMaX49GQIS3AZvJN4AaABAg', 'snippet': {'videoId': 'XC8FiLhsJSo', 'textDisplay': 'TSE: &quot;Vou fiscalizar a poha toda, não vai passar nada&quot; 😎<br><br>(descobriram a m3rd4 nas rádios nordestinas...)<br><br>TSE: &quot;Não é competência do TSE fiscalizar, não é comigo, não sei de nada...&quot; 🙄<br><br>Servidor do TSE: &quot;Mas chefe, tem coisa errada aqui...&quot; 🤔<br><br>TSE:  &quot;Teje exonerado!&quot; 🧐<br><br>Imprensa: &quot;Bolsonaro mente...&quot; 🙈', 'textOriginal': 'TSE: ""Vou fiscalizar a poha toda, não vai passar nada"" 😎\\n\\n(descobriram a m3rd4 nas rádios nordestinas...)\\n\\nTSE: ""Não é competência do TSE fiscalizar, não é comigo, não sei de nada..."" 🙄\\n\\nServidor do TSE: ""Mas chefe, tem coisa errada aqui..."" 🤔\\n\\nTSE:  ""Teje exonerado!"" 🧐\\n\\nImprensa: ""Bolsonaro mente..."" 🙈', 'authorDisplayName': 'Octávio Carpini', 'authorProfileImageUrl': 'https://yt3.ggpht.com/ytc/AGIKgqMnCpSGdYboXslv6_XLzDdvEKtEY8y-xDlqtcbaeR4=s48-c-k-c0x00ffffff-no-rj', 'authorChannelUrl': 'http://www.youtube.com/channel/UCXo7NZg_PlTy_oNxNYLuzWg', 'authorChannelId': {'value': 'UCXo7NZg_PlTy_oNxNYLuzWg'}, 'canRate': True, 'viewerRating': 'none', 'likeCount': 3, 'publishedAt': '2022-10-26T17:45:22Z', 'updatedAt': '2022-10-26T17:45:22Z'}}, 'canReply': True, 'totalReplyCount': 0, 'isPublic': True}",,UCXo7NZg_PlTy_oNxNYLuzWg,2022-10-26T17:45:22Z,"TSE: ""Vou fiscalizar a poha toda, não vai passar nada"" 😎

(descobriram a m3rd4 nas rádios nordestinas...)

TSE: ""Não é competência do TSE fiscalizar, não é comigo, não sei de nada..."" 🙄

Servidor do TSE: ""Mas chefe, tem coisa errada aqui..."" 🤔

TSE:  ""Teje exonerado!"" 🧐

Imprensa: ""Bolsonaro mente..."" 🙈",,2023-06-07 23:49:22.582146
youtube#commentThread,72lSR-pfXiG6MCxwmPg_lXpbsKM,Ugxh2mIyExkvhQ7PQ7d4AaABAg,"{'videoId': 'XC8FiLhsJSo', 'topLevelComment': {'kind': 'youtube#comment', 'etag': 'a014ct_nPbm79pYvknnQ3WyOCuU', 'id': 'Ugxh2mIyExkvhQ7PQ7d4AaABAg', 'snippet': {'videoId': 'XC8FiLhsJSo', 'textDisplay': 'Me desculpe mas o presidente Bolsonaro deveria rever o responsável pela fiscalização e segurança da sua campanha, só há 4 dias do segundo turno foi constatado essa grave falha! 🤷\\u200d♂️', 'textOriginal': 'Me desculpe mas o presidente Bolsonaro deveria rever o responsável pela fiscalização e segurança da sua campanha, só há 4 dias do segundo turno foi constatado essa grave falha! 🤷\\u200d♂️', 'authorDisplayName': 'KEDEZIERSKI JK', 'authorProfileImageUrl': 'https://yt3.ggpht.com/aTz6yKG9vG2TDePa1LSI26KEiDnMzdrXA2CNNmjMIinUVkbKXx5ZBeyYBg_LgaNUaZE2wvju=s48-c-k-c0x00ffffff-no-rj', 'authorChannelUrl': 'http://www.youtube.com/channel/UC4DKalSjHyJRt44kJwoOskA', 'authorChannelId': {'value': 'UC4DKalSjHyJRt44kJwoOskA'}, 'canRate': True, 'viewerRating': 'none', 'likeCount': 1, 'publishedAt': '2022-10-26T17:27:59Z', 'updatedAt': '2022-10-26T17:27:59Z'}}, 'canReply': True, 'totalReplyCount': 0, 'isPublic': True}",,UC4DKalSjHyJRt44kJwoOskA,2022-10-26T17:27:59Z,"Me desculpe mas o presidente Bolsonaro deveria rever o responsável pela fiscalização e segurança da sua campanha, só há 4 dias do segundo turno foi constatado essa grave falha! 🤷‍♂️",,2023-06-07 23:49:22.582146
youtube#commentThread,-Cx2B8_GC8HGwuW3hdbdpMUZh0c,UgyIRb-hW7-Q7VbbW8R4AaABAg,"{'videoId': 'XC8FiLhsJSo', 'topLevelComment': {'kind': 'youtube#comment', 'etag': '5Ht1mhbxTBqTr44p4-CPs4hKKlA', 'id': 'UgyIRb-hW7-Q7VbbW8R4AaABAg', 'snippet': {'videoId': 'XC8FiLhsJSo', 'textDisplay': 'Band cadê a notícia que já foi enviado as provas e teve uma exoneração do cargo de um funcionário do TSE? Cadê a denúncia do funcionário exonerado na PF dizendo que o TSE já tinha sido informado sobre a prática e nada fez? Vcs estão atrasados e seu comentarista também.', 'textOriginal': 'Band cadê a notícia que já foi enviado as provas e teve uma exoneração do cargo de um funcionário do TSE? Cadê a denúncia do funcionário exonerado na PF dizendo que o TSE já tinha sido informado sobre a prática e nada fez? Vcs estão atrasados e seu comentarista também.', 'authorDisplayName': 'Anselmo Vasconcelos Vieira', 'authorProfileImageUrl': 'https://yt3.ggpht.com/ytc/AGIKgqMVvyBnR38gtLOKIDylbcCCMlvQ0xfCDXAXig=s48-c-k-c0x00ffffff-no-rj', 'authorChannelUrl': 'http://www.youtube.com/channel/UCgDC2ksEAF4CeLMX-2mLxqQ', 'authorChannelId': {'value': 'UCgDC2ksEAF4CeLMX-2mLxqQ'}, 'canRate': True, 'viewerRating': 'none', 'likeCount': 0, 'publishedAt': '2022-10-26T17:18:16Z', 'updatedAt': '2022-10-26T17:18:16Z'}}, 'canReply': True, 'totalReplyCount': 0, 'isPublic': True}",,UCgDC2ksEAF4CeLMX-2mLxqQ,2022-10-26T17:18:16Z,Band cadê a notícia que já foi enviado as provas e teve uma exoneração do cargo de um funcionário do TSE? Cadê a denúncia do funcionário exonerado na PF dizendo que o TSE já tinha sido informado sobre a prática e nada fez? Vcs estão atrasados e seu comentarista também.,,2023-06-07 23:49:22.582146
youtube#commentThread,7snnOYywln01YTUDRG_rcsZr_Oc,UgyeCpaXda5housclgB4AaABAg,"{'videoId': 'XC8FiLhsJSo', 'topLevelComment': {'kind': 'youtube#comment', 'etag': 'ABsxpFNUtevw0Xg1Ulx87kHcpaA', 'id': 'UgyeCpaXda5housclgB4AaABAg', 'snippet': {'videoId': 'XC8FiLhsJSo', 'textDisplay': 'Eu sou Brasileira, Pátria Amada Brasil abençoado 🇧🇷🇧🇷🇧🇷🇧🇷 22 Brasil Avante, Deus abençoe e está no comando Sobre Brasil abençoado 🇧🇷🇧🇷 22 e Bolsonaro..', 'textOriginal': 'Eu sou Brasileira, Pátria Amada Brasil abençoado 🇧🇷🇧🇷🇧🇷🇧🇷 22 Brasil Avante, Deus abençoe e está no comando Sobre Brasil abençoado 🇧🇷🇧🇷 22 e Bolsonaro..', 'authorDisplayName': 'Joeli Maria Da Rocha Dantas', 'authorProfileImageUrl': 'https://yt3.ggpht.com/ytc/AGIKgqM3MfsxMLqQthOvD_ap5HpMViUPXa8I_iJn2Q=s48-c-k-c0x00ffffff-no-rj', 'authorChannelUrl': 'http://www.youtube.com/channel/UCFvSc3tz46pruVXmKa8n-5g', 'authorChannelId': {'value': 'UCFvSc3tz46pruVXmKa8n-5g'}, 'canRate': True, 'viewerRating': 'none', 'likeCount': 3, 'publishedAt': '2022-10-26T17:11:53Z', 'updatedAt': '2022-10-26T17:11:53Z'}}, 'canReply': True, 'totalReplyCount': 0, 'isPublic': True}",,UCFvSc3tz46pruVXmKa8n-5g,2022-10-26T17:11:53Z,"Eu sou Brasileira, Pátria Amada Brasil abençoado 🇧🇷🇧🇷🇧🇷🇧🇷 22 Brasil Avante, Deus abençoe e está no comando Sobre Brasil abençoado 🇧🇷🇧🇷 22 e Bolsonaro..",,2023-06-07 23:49:22.582146
youtube#commentThread,Ft6daSAUZ4ur3xjiGHHm4KJ4daA,Ugxigex8yO2tOAFyDOp4AaABAg,"{'videoId': 'XC8FiLhsJSo', 'topLevelComment': {'kind': 'youtube#comment', 'etag': 'xK8Y0MvoGHpHdZ_V_WNHTkR6mx4', 'id': 'Ugxigex8yO2tOAFyDOp4AaABAg', 'snippet': {'videoId': 'XC8FiLhsJSo', 'textDisplay': 'TA NA HORA DO JAIR....TA NA HORA DO JAIR.....JAIR EMBORA', 'textOriginal': 'TA NA HORA DO JAIR....TA NA HORA DO JAIR.....JAIR EMBORA', 'authorDisplayName': 'LARANJA  MIX BRASIL🍊🇧🇷', 'authorProfileImageUrl': 'https://yt3.ggpht.com/Hc5jUmA-w1g9_lIQFqgvKZqMj54XkypSzOczilG6VDwRofYusBOx5dwqtUh-dTSY_yw-KyD-ig=s48-c-k-c0x00ffffff-no-rj', 'authorChannelUrl': 'http://www.youtube.com/channel/UCqCXQ-x2wNFbJgCt7F689xQ', 'authorChannelId': {'value': 'UCqCXQ-x2wNFbJgCt7F689xQ'}, 'canRate': True, 'viewerRating': 'none', 'likeCount': 3, 'publishedAt': '2022-10-26T17:09:41Z', 'updatedAt': '2022-10-26T17:09:41Z'}}, 'canReply': True, 'totalReplyCount': 2, 'isPublic': True}","{'comments': [{'kind': 'youtube#comment', 'etag': 'oQwdu62CpWS-qHY3KYtuT2TF45Q', 'id': 'Ugxigex8yO2tOAFyDOp4AaABAg.9heKmbaGTtX9hf_t46Jd3E', 'snippet': {'videoId': 'XC8FiLhsJSo', 'textDisplay': 'O PT roubando até no tempo de propaganda eleitoral 🤣🤣🤣🤣... roubam na cara dura e vcs não vêem', 'textOriginal': 'O PT roubando até no tempo de propaganda eleitoral 🤣🤣🤣🤣... roubam na cara dura e vcs não vêem', 'parentId': 'Ugxigex8yO2tOAFyDOp4AaABAg', 'authorDisplayName': 'munekinha', 'authorProfileImageUrl': 'https://yt3.ggpht.com/ytc/AGIKgqONVSH7seTdqvlOyRIW3UjqJ89YJpwnT96bBZarNg=s48-c-k-c0x00ffffff-no-rj', 'authorChannelUrl': 'http://www.youtube.com/channel/UC5YsNHw_T7Wvm6vvdEikJEg', 'authorChannelId': {'value': 'UC5YsNHw_T7Wvm6vvdEikJEg'}, 'canRate': True, 'viewerRating': 'none', 'likeCount': 0, 'publishedAt': '2022-10-27T04:49:37Z', 'updatedAt': '2022-10-27T04:49:37Z'}}, {'kind': 'youtube#comment', 'etag': 'M4sPOzTLMU6mVUzxkHVTJV1qH64', 'id': 'Ugxigex8yO2tOAFyDOp4AaABAg.9heKmbaGTtX9heeA-oq0C6', 'snippet': {'videoId': 'XC8FiLhsJSo', 'textDisplay': 'Concordo com vc kkkkk', 'textOriginal': 'Concordo com vc kkkkk', 'parentId': 'Ugxigex8yO2tOAFyDOp4AaABAg', 'authorDisplayName': 'Nelma Nelma', 'authorProfileImageUrl': 'https://yt3.ggpht.com/ytc/AGIKgqPPBN0nga8Qjz56qkyLxu_bj437DU-W36pS=s48-c-k-c0x00ffffff-no-rj', 'authorChannelUrl': 'http://www.youtube.com/channel/UCXB1jFyMPOdbddI0Ns-MOgA', 'authorChannelId': {'value': 'UCXB1jFyMPOdbddI0Ns-MOgA'}, 'canRate': True, 'viewerRating': 'none', 'likeCount': 1, 'publishedAt': '2022-10-26T20:07:47Z', 'updatedAt': '2022-10-26T20:07:47Z'}}]}",UCqCXQ-x2wNFbJgCt7F689xQ,2022-10-26T17:09:41Z,TA NA HORA DO JAIR....TA NA HORA DO JAIR.....JAIR EMBORA,,2023-06-07 23:49:22.582146
youtube#commentThread,Prfs8CrJLmYwGoWS0XNbJz2AtZw,UgzBYOIu3f7sqikpUP54AaABAg,"{'videoId': 'XC8FiLhsJSo', 'topLevelComment': {'kind': 'youtube#comment', 'etag': 'DK0MKw_44gDisx638_cDmEK8Q78', 'id': 'UgzBYOIu3f7sqikpUP54AaABAg', 'snippet': {'videoId': 'XC8FiLhsJSo', 'textDisplay': 'Quando essa matéria foi vinculada, o tal de Alexandre, não o chefe, mas o funcionário bode expiatório, ainda não tinha prestado depoimento na PF. A manipulação da mídia, censura e prisão de opositores estão em pleno andamento. Acho que esse povo tem que rever seus conceitos sobre quem é fascista e olha que um, cada vez mais arranjado, novo governo Lula nem começou. Vergonha mundial.', 'textOriginal': 'Quando essa matéria foi vinculada, o tal de Alexandre, não o chefe, mas o funcionário bode expiatório, ainda não tinha prestado depoimento na PF. A manipulação da mídia, censura e prisão de opositores estão em pleno andamento. Acho que esse povo tem que rever seus conceitos sobre quem é fascista e olha que um, cada vez mais arranjado, novo governo Lula nem começou. Vergonha mundial.', 'authorDisplayName': 'Sérgio Cruz', 'authorProfileImageUrl': 'https://yt3.ggpht.com/ytc/AGIKgqPOA23s8yXIyGuHyBuoauf056WzOC5nTX3i3y3Qsg=s48-c-k-c0x00ffffff-no-rj', 'authorChannelUrl': 'http://www.youtube.com/channel/UCM-6rs2wpw-uYeSg7hEXxMQ', 'authorChannelId': {'value': 'UCM-6rs2wpw-uYeSg7hEXxMQ'}, 'canRate': True, 'viewerRating': 'none', 'likeCount': 0, 'publishedAt': '2022-10-26T17:08:13Z', 'updatedAt': '2022-10-26T17:08:13Z'}}, 'canReply': True, 'totalReplyCount': 0, 'isPublic': True}",,UCM-6rs2wpw-uYeSg7hEXxMQ,2022-10-26T17:08:13Z,"Quando essa matéria foi vinculada, o tal de Alexandre, não o chefe, mas o funcionário bode expiatório, ainda não tinha prestado depoimento na PF. A manipulação da mídia, censura e prisão de opositores estão em pleno andamento. Acho que esse povo tem que rever seus conceitos sobre quem é fascista e olha que um, cada vez mais arranjado, novo governo Lula nem começou. Vergonha mundial.",,2023-06-07 23:49:22.582146
youtube#commentThread,y0c_0Zta-Wuuxwg0eCJGH2Ff6sE,UgwkW8MODBwiUq1RynJ4AaABAg,"{'videoId': 'XC8FiLhsJSo', 'topLevelComment': {'kind': 'youtube#comment', 'etag': 'flhqo1i_kC86gWI5i9gSy7Nnb7s', 'id': 'UgwkW8MODBwiUq1RynJ4AaABAg', 'snippet': {'videoId': 'XC8FiLhsJSo', 'textDisplay': 'O gado ta desesperado e o choro é livre kkkkkkkkkkkkkkk', 'textOriginal': 'O gado ta desesperado e o choro é livre kkkkkkkkkkkkkkk', 'authorDisplayName': 'rafael miranda', 'authorProfileImageUrl': 'https://yt3.ggpht.com/ytc/AGIKgqOKJwiAGoID1uTlPEtAcizvqV9w1jRX20Wvgw=s48-c-k-c0x00ffffff-no-rj', 'authorChannelUrl': 'http://www.youtube.com/channel/UCgWRX7qIg6W5mcRxUfMHhuw', 'authorChannelId': {'value': 'UCgWRX7qIg6W5mcRxUfMHhuw'}, 'canRate': True, 'viewerRating': 'none', 'likeCount': 3, 'publishedAt': '2022-10-26T17:06:14Z', 'updatedAt': '2022-10-26T17:06:14Z'}}, 'canReply': True, 'totalReplyCount': 0, 'isPublic': True}",,UCgWRX7qIg6W5mcRxUfMHhuw,2022-10-26T17:06:14Z,O gado ta desesperado e o choro é livre kkkkkkkkkkkkkkk,,2023-06-07 23:49:22.582146
youtube#commentThread,zr3DheuGY7D86_20a_8ZAcKo9Us,Ugy1VXGf4KCkbUm-Tyx4AaABAg,"{'videoId': 'XC8FiLhsJSo', 'topLevelComment': {'kind': 'youtube#comment', 'etag': 'Lu1ZTB5qE56VWe4tRzEOF92REsU', 'id': 'Ugy1VXGf4KCkbUm-Tyx4AaABAg', 'snippet': {'videoId': 'XC8FiLhsJSo', 'textDisplay': 'BOLSONARO PRECISA DO POVO PRA LUTAR CONTRA ESSE SISTEMA CORRUPTO', 'textOriginal': 'BOLSONARO PRECISA DO POVO PRA LUTAR CONTRA ESSE SISTEMA CORRUPTO', 'authorDisplayName': 'Liah bravo', 'authorProfileImageUrl': 'https://yt3.ggpht.com/q6VAL1h9Rv_4g_fiCZ7tqGkSdOmvscGyZO4U6leh0lV1KEVzSCkXzGHwMayp2R2YWP4HArVm=s48-c-k-c0x00ffffff-no-rj', 'authorChannelUrl': 'http://www.youtube.com/channel/UC9yoS3ffRIXORDi2FW6GU0g', 'authorChannelId': {'value': 'UC9yoS3ffRIXORDi2FW6GU0g'}, 'canRate': True, 'viewerRating': 'none', 'likeCount': 1, 'publishedAt': '2022-10-26T17:05:34Z', 'updatedAt': '2022-10-26T17:05:34Z'}}, 'canReply': True, 'totalReplyCount': 0, 'isPublic': True}",,UC9yoS3ffRIXORDi2FW6GU0g,2022-10-26T17:05:34Z,BOLSONARO PRECISA DO POVO PRA LUTAR CONTRA ESSE SISTEMA CORRUPTO,,2023-06-07 23:49:22.582146
youtube#commentThread,z9fPFtypXu2H_l4nlBuFOwo4PVM,Ugx23idS4agcN0n_alF4AaABAg,"{'videoId': 'XC8FiLhsJSo', 'topLevelComment': {'kind': 'youtube#comment', 'etag': 'mFvxa3ube4cxrD4aZnZx-FFA43U', 'id': 'Ugx23idS4agcN0n_alF4AaABAg', 'snippet': {'videoId': 'XC8FiLhsJSo', 'textDisplay': 'E vamos de 22 de novo conceterza', 'textOriginal': 'E vamos de 22 de novo conceterza', 'authorDisplayName': 'Dhionatas Martins', 'authorProfileImageUrl': 'https://yt3.ggpht.com/ytc/AGIKgqO9n1FAWIW2MTY_7JqW4GFrzdkRsTk_MMvlIg=s48-c-k-c0x00ffffff-no-rj', 'authorChannelUrl': 'http://www.youtube.com/channel/UCX0nXtaEpcHwbEa7Yi31yNQ', 'authorChannelId': {'value': 'UCX0nXtaEpcHwbEa7Yi31yNQ'}, 'canRate': True, 'viewerRating': 'none', 'likeCount': 1, 'publishedAt': '2022-10-26T16:58:39Z', 'updatedAt': '2022-10-26T16:58:39Z'}}, 'canReply': True, 'totalReplyCount': 0, 'isPublic': True}",,UCX0nXtaEpcHwbEa7Yi31yNQ,2022-10-26T16:58:39Z,E vamos de 22 de novo conceterza,,2023-06-07 23:49:22.582146
youtube#commentThread,WrIubT7cGwmcteqvKhLylz5rcNA,UgxBEwQcRkHGvjQj6El4AaABAg,"{'videoId': 'XC8FiLhsJSo', 'topLevelComment': {'kind': 'youtube#comment', 'etag': 'gH0gDWWdps3Jo9r1LMPceb62mYs', 'id': 'UgxBEwQcRkHGvjQj6El4AaABAg', 'snippet': {'videoId': 'XC8FiLhsJSo', 'textDisplay': 'Kd as provas ?', 'textOriginal': 'Kd as provas ?', 'authorDisplayName': 'Mario', 'authorProfileImageUrl': 'https://yt3.ggpht.com/ytc/AGIKgqMpxLzzfATTe3a3hh6fisrJ3B1qrUWdiIL7TEcgrg=s48-c-k-c0x00ffffff-no-rj', 'authorChannelUrl': 'http://www.youtube.com/channel/UCV7nP56rHtOla9KGEvMTbgg', 'authorChannelId': {'value': 'UCV7nP56rHtOla9KGEvMTbgg'}, 'canRate': True, 'viewerRating': 'none', 'likeCount': 0, 'publishedAt': '2022-10-26T16:58:29Z', 'updatedAt': '2022-10-26T16:58:29Z'}}, 'canReply': True, 'totalReplyCount': 1, 'isPublic': True}","{'comments': [{'kind': 'youtube#comment', 'etag': 'cu7QCQd36t9UA6VaBflwEoZwBBo', 'id': 'UgxBEwQcRkHGvjQj6El4AaABAg.9heJVTmQ4Bw9hf_W5iIp9F', 'snippet': {'videoId': 'XC8FiLhsJSo', 'textDisplay': 'Estão nas mãos do ministro', 'textOriginal': 'Estão nas mãos do ministro', 'parentId': 'UgxBEwQcRkHGvjQj6El4AaABAg', 'authorDisplayName': 'munekinha', 'authorProfileImageUrl': 'https://yt3.ggpht.com/ytc/AGIKgqONVSH7seTdqvlOyRIW3UjqJ89YJpwnT96bBZarNg=s48-c-k-c0x00ffffff-no-rj', 'authorChannelUrl': 'http://www.youtube.com/channel/UC5YsNHw_T7Wvm6vvdEikJEg', 'authorChannelId': {'value': 'UC5YsNHw_T7Wvm6vvdEikJEg'}, 'canRate': True, 'viewerRating': 'none', 'likeCount': 0, 'publishedAt': '2022-10-27T04:46:21Z', 'updatedAt': '2022-10-27T04:46:21Z'}}]}",UCV7nP56rHtOla9KGEvMTbgg,2022-10-26T16:58:29Z,Kd as provas ?,,2023-06-07 23:49:22.582146
youtube#commentThread,MLmyGRLb4cfrS6DupymhnhtJK94,UgwWJ9qPkzXSPrsze2l4AaABAg,"{'videoId': 'XC8FiLhsJSo', 'topLevelComment': {'kind': 'youtube#comment', 'etag': 'E-B9QTmyDjZsYamF_gfkvcv1cIM', 'id': 'UgwWJ9qPkzXSPrsze2l4AaABAg', 'snippet': {'videoId': 'XC8FiLhsJSo', 'textDisplay': 'Tem que cancelar o segundo turno ,não pode ter eleição dia 30 é injusto', 'textOriginal': 'Tem que cancelar o segundo turno ,não pode ter eleição dia 30 é injusto', 'authorDisplayName': 'Ramon Monteiro', 'authorProfileImageUrl': 'https://yt3.ggpht.com/ytc/AGIKgqNHJcYJqZeNGUgt2pEfOwceScz33TaxRxWjXgiM_76nIkcdrqyip1KC7EOo8d5N=s48-c-k-c0x00ffffff-no-rj', 'authorChannelUrl': 'http://www.youtube.com/channel/UC5Xs8rmSCdN5mPbfiI_Jcrw', 'authorChannelId': {'value': 'UC5Xs8rmSCdN5mPbfiI_Jcrw'}, 'canRate': True, 'viewerRating': 'none', 'likeCount': 0, 'publishedAt': '2022-10-26T16:56:34Z', 'updatedAt': '2022-10-26T16:56:34Z'}}, 'canReply': True, 'totalReplyCount': 0, 'isPublic': True}",,UC5Xs8rmSCdN5mPbfiI_Jcrw,2022-10-26T16:56:34Z,"Tem que cancelar o segundo turno ,não pode ter eleição dia 30 é injusto",,2023-06-07 23:49:22.582146
