kind,etag,id,snippet,replies,authorChannelId,publishedAt,textOriginal,nextPageToken,extraction_date
youtube#commentThread,D9f5eODKWVzE-FGTei3DiIciAGw,UgwW53JRAMTfkbQe3gF4AaABAg,"{'videoId': 'XC8FiLhsJSo', 'topLevelComment': {'kind': 'youtube#comment', 'etag': 'n9v9q3GzXpgau7fveWODuTrRWp0', 'id': 'UgwW53JRAMTfkbQe3gF4AaABAg', 'snippet': {'videoId': 'XC8FiLhsJSo', 'textDisplay': 'Não vai dar em nada... quem ouve rádio...nmgm liga...o Bolsonaro fala que a propaganda d rádio afetou e foda', 'textOriginal': 'Não vai dar em nada... quem ouve rádio...nmgm liga...o Bolsonaro fala que a propaganda d rádio afetou e foda', 'authorDisplayName': 'construindo estufas', 'authorProfileImageUrl': 'https://yt3.ggpht.com/ytc/AGIKgqOOTSaqjThBGKK-5HetUKfeG1JpRJocDc3AG5Ef=s48-c-k-c0x00ffffff-no-rj', 'authorChannelUrl': 'http://www.youtube.com/channel/UClHjT5u5HQf4QLRmP5d5HYw', 'authorChannelId': {'value': 'UClHjT5u5HQf4QLRmP5d5HYw'}, 'canRate': True, 'viewerRating': 'none', 'likeCount': 2, 'publishedAt': '2022-10-26T16:11:23Z', 'updatedAt': '2022-10-26T16:11:23Z'}}, 'canReply': True, 'totalReplyCount': 7, 'isPublic': True}","{'comments': [{'kind': 'youtube#comment', 'etag': 'H_3zdJsS9mrEhTg2jps19VWQ3JM', 'id': 'UgwW53JRAMTfkbQe3gF4AaABAg.9heE6bVPVjL9hept9NFXcF', 'snippet': {'videoId': 'XC8FiLhsJSo', 'textDisplay': 'Vc não conhece a realidade dos interiores do Nordeste. Tem locais, e é maioria,  que não há tem sinais de TV, além da Globo e que só as rádios levam notícia para esses lugares.', 'textOriginal': 'Vc não conhece a realidade dos interiores do Nordeste. Tem locais, e é maioria,  que não há tem sinais de TV, além da Globo e que só as rádios levam notícia para esses lugares.', 'parentId': 'UgwW53JRAMTfkbQe3gF4AaABAg', 'authorDisplayName': 'Leandro Oliveira', 'authorProfileImageUrl': 'https://yt3.ggpht.com/v0ZD7Yy0KMT0MVctdXICyLUmE7UZxZywDjQ3w7q8MEoWcycpCj8fGosCEcG6J8E3b3u3WAKATg=s48-c-k-c0x00ffffff-no-rj', 'authorChannelUrl': 'http://www.youtube.com/channel/UCsGosvjd0a0mbxBX2lwetrA', 'authorChannelId': {'value': 'UCsGosvjd0a0mbxBX2lwetrA'}, 'canRate': True, 'viewerRating': 'none', 'likeCount': 0, 'publishedAt': '2022-10-26T21:50:12Z', 'updatedAt': '2022-10-26T21:50:12Z'}}, {'kind': 'youtube#comment', 'etag': 'LGy0NiceNSGacDnVUp1Ld9Q6a7E', 'id': 'UgwW53JRAMTfkbQe3gF4AaABAg.9heE6bVPVjL9heIFzBBtFs', 'snippet': {'videoId': 'XC8FiLhsJSo', 'textDisplay': '@flamengo.mengao eu sou até o dia d eleição,o bozo vai dar &quot;Playstation 5&quot; kkk já falam em 400 bilhões q seu mito usou p tentar comprar o povo...e ainda quer falar em corrupção...', 'textOriginal': '@flamengo.mengao eu sou até o dia d eleição,o bozo vai dar ""Playstation 5"" kkk já falam em 400 bilhões q seu mito usou p tentar comprar o povo...e ainda quer falar em corrupção...', 'parentId': 'UgwW53JRAMTfkbQe3gF4AaABAg', 'authorDisplayName': 'construindo estufas', 'authorProfileImageUrl': 'https://yt3.ggpht.com/ytc/AGIKgqOOTSaqjThBGKK-5HetUKfeG1JpRJocDc3AG5Ef=s48-c-k-c0x00ffffff-no-rj', 'authorChannelUrl': 'http://www.youtube.com/channel/UClHjT5u5HQf4QLRmP5d5HYw', 'authorChannelId': {'value': 'UClHjT5u5HQf4QLRmP5d5HYw'}, 'canRate': True, 'viewerRating': 'none', 'likeCount': 0, 'publishedAt': '2022-10-26T16:47:37Z', 'updatedAt': '2022-10-26T16:47:37Z'}}, {'kind': 'youtube#comment', 'etag': '5o2vg3AtOO6rrt-tWgefSxlb1kQ', 'id': 'UgwW53JRAMTfkbQe3gF4AaABAg.9heE6bVPVjL9heI0mQw1KM', 'snippet': {'videoId': 'XC8FiLhsJSo', 'textDisplay': '@flamengo.mengao eu sou vc sabe q rádio e tv n muda muito...aceite...vcs ficaram quatro anos fazendo motosseata, carreata, passeata, falando q Ian prender STF...não fizeram nada...agora faltando três... quatro dias vão mudar algo? Parem d mentir.', 'textOriginal': '@flamengo.mengao eu sou vc sabe q rádio e tv n muda muito...aceite...vcs ficaram quatro anos fazendo motosseata, carreata, passeata, falando q Ian prender STF...não fizeram nada...agora faltando três... quatro dias vão mudar algo? Parem d mentir.', 'parentId': 'UgwW53JRAMTfkbQe3gF4AaABAg', 'authorDisplayName': 'construindo estufas', 'authorProfileImageUrl': 'https://yt3.ggpht.com/ytc/AGIKgqOOTSaqjThBGKK-5HetUKfeG1JpRJocDc3AG5Ef=s48-c-k-c0x00ffffff-no-rj', 'authorChannelUrl': 'http://www.youtube.com/channel/UClHjT5u5HQf4QLRmP5d5HYw', 'authorChannelId': {'value': 'UClHjT5u5HQf4QLRmP5d5HYw'}, 'canRate': True, 'viewerRating': 'none', 'likeCount': 0, 'publishedAt': '2022-10-26T16:45:33Z', 'updatedAt': '2022-10-26T16:45:33Z'}}, {'kind': 'youtube#comment', 'etag': 'ZPdAW7qveMSjw45Ey64orCe3sok', 'id': 'UgwW53JRAMTfkbQe3gF4AaABAg.9heE6bVPVjL9heHXVQyVJh', 'snippet': {'videoId': 'XC8FiLhsJSo', 'textDisplay': 'Se Rádio não fosse importante não existiria.<br>Essa eleição já está manchada', 'textOriginal': 'Se Rádio não fosse importante não existiria.\\nEssa eleição já está manchada', 'parentId': 'UgwW53JRAMTfkbQe3gF4AaABAg', 'authorDisplayName': 'Memphis', 'authorProfileImageUrl': 'https://yt3.ggpht.com/wrA5EWJSuj-FzdsdxcpWMYcjhvoEyStb3Q0JGjT5wGjob9ob6hkOS5eUiZK6eVpXD6J0mBhSGYQ=s48-c-k-c0x00ffffff-no-rj', 'authorChannelUrl': 'http://www.youtube.com/channel/UCz3syiTaZlQ5BdO-u88cGnQ', 'authorChannelId': {'value': 'UCz3syiTaZlQ5BdO-u88cGnQ'}, 'canRate': True, 'viewerRating': 'none', 'likeCount': 1, 'publishedAt': '2022-10-26T16:41:16Z', 'updatedAt': '2022-10-26T16:41:16Z'}}, {'kind': 'youtube#comment', 'etag': 'T8jSZzc0ICZKGHB9wgkHYsOsLlE', 'id': 'UgwW53JRAMTfkbQe3gF4AaABAg.9heE6bVPVjL9heHCwX_YLe', 'snippet': {'videoId': 'XC8FiLhsJSo', 'textDisplay': '@Arthur Maciel tudo bem q vc fale q alguém ouve . Mas até lá TD mundo tem internet...só os mais velhos e a maioria n ouve já fui lá tem sim mas e muito pouca gente p mudar algo', 'textOriginal': '@Arthur Maciel tudo bem q vc fale q alguém ouve . Mas até lá TD mundo tem internet...só os mais velhos e a maioria n ouve já fui lá tem sim mas e muito pouca gente p mudar algo', 'parentId': 'UgwW53JRAMTfkbQe3gF4AaABAg', 'authorDisplayName': 'construindo estufas', 'authorProfileImageUrl': 'https://yt3.ggpht.com/ytc/AGIKgqOOTSaqjThBGKK-5HetUKfeG1JpRJocDc3AG5Ef=s48-c-k-c0x00ffffff-no-rj', 'authorChannelUrl': 'http://www.youtube.com/channel/UClHjT5u5HQf4QLRmP5d5HYw', 'authorChannelId': {'value': 'UClHjT5u5HQf4QLRmP5d5HYw'}, 'canRate': True, 'viewerRating': 'none', 'likeCount': 0, 'publishedAt': '2022-10-26T16:38:28Z', 'updatedAt': '2022-10-26T16:38:28Z'}}]}",UClHjT5u5HQf4QLRmP5d5HYw,2022-10-26T16:11:23Z,Não vai dar em nada... quem ouve rádio...nmgm liga...o Bolsonaro fala que a propaganda d rádio afetou e foda,,2023-06-07 23:49:22.582146
youtube#commentThread,aqxXmuUfBZDsLPgC5guSJLeJSuk,Ugw79gvOZn4pkAEq0oV4AaABAg,"{'videoId': 'XC8FiLhsJSo', 'topLevelComment': {'kind': 'youtube#comment', 'etag': '9xPmQRkBfL37uZMd8UJyu9g_zDA', 'id': 'Ugw79gvOZn4pkAEq0oV4AaABAg', 'snippet': {'videoId': 'XC8FiLhsJSo', 'textDisplay': 'KKKK O PAI DA MENTIRA. Primeiro, eram 154 mil, depois 700. Agora se descobre que apenas 1 rádio deixou de colocar 100 inserções kkkkk e ainda disseram que o Bozo não entregou material.', 'textOriginal': 'KKKK O PAI DA MENTIRA. Primeiro, eram 154 mil, depois 700. Agora se descobre que apenas 1 rádio deixou de colocar 100 inserções kkkkk e ainda disseram que o Bozo não entregou material.', 'authorDisplayName': 'User From BraSil', 'authorProfileImageUrl': 'https://yt3.ggpht.com/JdXZzwdaRQpdZ3WQ8UKDFwU6hnj8TdzE0qfEERt2eGZPSWcgl5mNF_uIcKZEkdp1nr_4V-ZTTA=s48-c-k-c0x00ffffff-no-rj', 'authorChannelUrl': 'http://www.youtube.com/channel/UC2JhyG1ZcZRQbqvmbLrYO4A', 'authorChannelId': {'value': 'UC2JhyG1ZcZRQbqvmbLrYO4A'}, 'canRate': True, 'viewerRating': 'none', 'likeCount': 0, 'publishedAt': '2022-10-26T16:09:32Z', 'updatedAt': '2022-10-26T16:09:32Z'}}, 'canReply': True, 'totalReplyCount': 0, 'isPublic': True}",,UC2JhyG1ZcZRQbqvmbLrYO4A,2022-10-26T16:09:32Z,"KKKK O PAI DA MENTIRA. Primeiro, eram 154 mil, depois 700. Agora se descobre que apenas 1 rádio deixou de colocar 100 inserções kkkkk e ainda disseram que o Bozo não entregou material.",,2023-06-07 23:49:22.582146
youtube#commentThread,L8LFWozGpuCO2qg4upkRv3OQUSU,Ugyssb94auS9u-9dh4Z4AaABAg,"{'videoId': 'XC8FiLhsJSo', 'topLevelComment': {'kind': 'youtube#comment', 'etag': 'FRKKYNta730fOFPxRGPr60rqIZ0', 'id': 'Ugyssb94auS9u-9dh4Z4AaABAg', 'snippet': {'videoId': 'XC8FiLhsJSo', 'textDisplay': 'Provas colhidas pelo Instituto Damares Alves. Não preciso dizer mais nada. 😈', 'textOriginal': 'Provas colhidas pelo Instituto Damares Alves. Não preciso dizer mais nada. 😈', 'authorDisplayName': 'X P', 'authorProfileImageUrl': 'https://yt3.ggpht.com/ytc/AGIKgqOIddGQaOAKhzpJqDD2uCPXVPerjVrcDHUavlCt6A=s48-c-k-c0x00ffffff-no-rj', 'authorChannelUrl': 'http://www.youtube.com/channel/UCJgJZyia5L3JifIw0JJ8WPw', 'authorChannelId': {'value': 'UCJgJZyia5L3JifIw0JJ8WPw'}, 'canRate': True, 'viewerRating': 'none', 'likeCount': 0, 'publishedAt': '2022-10-26T16:07:26Z', 'updatedAt': '2022-10-26T16:07:26Z'}}, 'canReply': True, 'totalReplyCount': 6, 'isPublic': True}","{'comments': [{'kind': 'youtube#comment', 'etag': 'l8j6Gz_K0IlyFdFAEbqodknK-XE', 'id': 'Ugyssb94auS9u-9dh4Z4AaABAg.9heDeZcbeLB9hevKX1r2uV', 'snippet': {'videoId': 'XC8FiLhsJSo', 'textDisplay': '@Leandro Oliveira As rádios denunciadas já emitíram notas dizendo que as propagandas não foram enviadas pela campanha do partido do minto. E agora? 😎', 'textOriginal': '@Leandro Oliveira As rádios denunciadas já emitíram notas dizendo que as propagandas não foram enviadas pela campanha do partido do minto. E agora? 😎', 'parentId': 'Ugyssb94auS9u-9dh4Z4AaABAg', 'authorDisplayName': 'X P', 'authorProfileImageUrl': 'https://yt3.ggpht.com/ytc/AGIKgqOIddGQaOAKhzpJqDD2uCPXVPerjVrcDHUavlCt6A=s48-c-k-c0x00ffffff-no-rj', 'authorChannelUrl': 'http://www.youtube.com/channel/UCJgJZyia5L3JifIw0JJ8WPw', 'authorChannelId': {'value': 'UCJgJZyia5L3JifIw0JJ8WPw'}, 'canRate': True, 'viewerRating': 'none', 'likeCount': 0, 'publishedAt': '2022-10-26T22:37:46Z', 'updatedAt': '2022-10-26T22:37:46Z'}}, {'kind': 'youtube#comment', 'etag': 'Kiz9YdoivMxRrBwn9L2jEbMd27g', 'id': 'Ugyssb94auS9u-9dh4Z4AaABAg.9heDeZcbeLB9heuOO_9u8a', 'snippet': {'videoId': 'XC8FiLhsJSo', 'textDisplay': '@Leandro Oliveira Evidente que não. Por isso essa avalanche de birra de perdedor.', 'textOriginal': '@Leandro Oliveira Evidente que não. Por isso essa avalanche de birra de perdedor.', 'parentId': 'Ugyssb94auS9u-9dh4Z4AaABAg', 'authorDisplayName': 'X P', 'authorProfileImageUrl': 'https://yt3.ggpht.com/ytc/AGIKgqOIddGQaOAKhzpJqDD2uCPXVPerjVrcDHUavlCt6A=s48-c-k-c0x00ffffff-no-rj', 'authorChannelUrl': 'http://www.youtube.com/channel/UCJgJZyia5L3JifIw0JJ8WPw', 'authorChannelId': {'value': 'UCJgJZyia5L3JifIw0JJ8WPw'}, 'canRate': True, 'viewerRating': 'none', 'likeCount': 0, 'publishedAt': '2022-10-26T22:29:33Z', 'updatedAt': '2022-10-26T22:29:33Z'}}, {'kind': 'youtube#comment', 'etag': 'YGgx7LE_LKYGvF6VeaIM8WTZA2E', 'id': 'Ugyssb94auS9u-9dh4Z4AaABAg.9heDeZcbeLB9hetvSCXHVh', 'snippet': {'videoId': 'XC8FiLhsJSo', 'textDisplay': '@X P Não vai acontecer isso, amigo. Bolsonaro será reeleito.', 'textOriginal': '@X P Não vai acontecer isso, amigo. Bolsonaro será reeleito.', 'parentId': 'Ugyssb94auS9u-9dh4Z4AaABAg', 'authorDisplayName': 'Leandro Oliveira', 'authorProfileImageUrl': 'https://yt3.ggpht.com/v0ZD7Yy0KMT0MVctdXICyLUmE7UZxZywDjQ3w7q8MEoWcycpCj8fGosCEcG6J8E3b3u3WAKATg=s48-c-k-c0x00ffffff-no-rj', 'authorChannelUrl': 'http://www.youtube.com/channel/UCsGosvjd0a0mbxBX2lwetrA', 'authorChannelId': {'value': 'UCsGosvjd0a0mbxBX2lwetrA'}, 'canRate': True, 'viewerRating': 'none', 'likeCount': 0, 'publishedAt': '2022-10-26T22:25:28Z', 'updatedAt': '2022-10-26T22:25:28Z'}}, {'kind': 'youtube#comment', 'etag': 'zm_WQFX9COxHJuvjlYVwpZyjBFw', 'id': 'Ugyssb94auS9u-9dh4Z4AaABAg.9heDeZcbeLB9hesEAf5xnF', 'snippet': {'videoId': 'XC8FiLhsJSo', 'textDisplay': '@Leandro Oliveira Para quê? E por que só agora que a propaganda está no fim? Eu quero ver o gado invadir o capitólio e levar bala. 😈', 'textOriginal': '@Leandro Oliveira Para quê? E por que só agora que a propaganda está no fim? Eu quero ver o gado invadir o capitólio e levar bala. 😈', 'parentId': 'Ugyssb94auS9u-9dh4Z4AaABAg', 'authorDisplayName': 'X P', 'authorProfileImageUrl': 'https://yt3.ggpht.com/ytc/AGIKgqOIddGQaOAKhzpJqDD2uCPXVPerjVrcDHUavlCt6A=s48-c-k-c0x00ffffff-no-rj', 'authorChannelUrl': 'http://www.youtube.com/channel/UCJgJZyia5L3JifIw0JJ8WPw', 'authorChannelId': {'value': 'UCJgJZyia5L3JifIw0JJ8WPw'}, 'canRate': True, 'viewerRating': 'none', 'likeCount': 0, 'publishedAt': '2022-10-26T22:10:41Z', 'updatedAt': '2022-10-26T22:10:41Z'}}, {'kind': 'youtube#comment', 'etag': '5623Wq_Sk45FlZQKjkCKDslRcWE', 'id': 'Ugyssb94auS9u-9dh4Z4AaABAg.9heDeZcbeLB9hepYKodz6Q', 'snippet': {'videoId': 'XC8FiLhsJSo', 'textDisplay': 'Foram 5 empresas de acessória,contratados pelo governo.', 'textOriginal': 'Foram 5 empresas de acessória,contratados pelo governo.', 'parentId': 'Ugyssb94auS9u-9dh4Z4AaABAg', 'authorDisplayName': 'Leandro Oliveira', 'authorProfileImageUrl': 'https://yt3.ggpht.com/v0ZD7Yy0KMT0MVctdXICyLUmE7UZxZywDjQ3w7q8MEoWcycpCj8fGosCEcG6J8E3b3u3WAKATg=s48-c-k-c0x00ffffff-no-rj', 'authorChannelUrl': 'http://www.youtube.com/channel/UCsGosvjd0a0mbxBX2lwetrA', 'authorChannelId': {'value': 'UCsGosvjd0a0mbxBX2lwetrA'}, 'canRate': True, 'viewerRating': 'none', 'likeCount': 0, 'publishedAt': '2022-10-26T21:47:13Z', 'updatedAt': '2022-10-26T21:47:13Z'}}]}",UCJgJZyia5L3JifIw0JJ8WPw,2022-10-26T16:07:26Z,Provas colhidas pelo Instituto Damares Alves. Não preciso dizer mais nada. 😈,,2023-06-07 23:49:22.582146
youtube#commentThread,PmiH66vsB2ZiuKwdT6zE6mmnr4A,Ugw72zdDTa3gBGmIn114AaABAg,"{'videoId': 'XC8FiLhsJSo', 'topLevelComment': {'kind': 'youtube#comment', 'etag': 'IDsQN04zG43Qe1oyYZiASB3k_mU', 'id': 'Ugw72zdDTa3gBGmIn114AaABAg', 'snippet': {'videoId': 'XC8FiLhsJSo', 'textDisplay': 'GENTE VAMOS CONTINUAR VIRAR VOTOS PARA O NOSSO PRESIDENTE, SE O LULA JA ESTÁ FAZENDO CENSURA AGORA IMAGINA DEPOIS? BOLSONARO 2022 🙌🙏🇧🇷💛💚', 'textOriginal': 'GENTE VAMOS CONTINUAR VIRAR VOTOS PARA O NOSSO PRESIDENTE, SE O LULA JA ESTÁ FAZENDO CENSURA AGORA IMAGINA DEPOIS? BOLSONARO 2022 🙌🙏🇧🇷💛💚', 'authorDisplayName': 'Patricia Lima', 'authorProfileImageUrl': 'https://yt3.ggpht.com/ytc/AGIKgqO1inXHlWsO0gS3O8PWs88o9LgaK5cGlVkS7BCmMg=s48-c-k-c0x00ffffff-no-rj', 'authorChannelUrl': 'http://www.youtube.com/channel/UCrc8UrDxy2zp8s37-vRbJdg', 'authorChannelId': {'value': 'UCrc8UrDxy2zp8s37-vRbJdg'}, 'canRate': True, 'viewerRating': 'none', 'likeCount': 6, 'publishedAt': '2022-10-26T16:05:23Z', 'updatedAt': '2022-10-26T16:31:23Z'}}, 'canReply': True, 'totalReplyCount': 7, 'isPublic': True}","{'comments': [{'kind': 'youtube#comment', 'etag': 'qm1v9VjeqoBF3aBZjvHLPLCZy38', 'id': 'Ugw72zdDTa3gBGmIn114AaABAg.9heDQdPZfx89heJ4KkpO2L', 'snippet': {'videoId': 'XC8FiLhsJSo', 'textDisplay': '@𓇽 SERGIO 𓇽 Esse é o seu argumento?', 'textOriginal': '@𓇽 SERGIO 𓇽 Esse é o seu argumento?', 'parentId': 'Ugw72zdDTa3gBGmIn114AaABAg', 'authorDisplayName': 'Patricia Lima', 'authorProfileImageUrl': 'https://yt3.ggpht.com/ytc/AGIKgqO1inXHlWsO0gS3O8PWs88o9LgaK5cGlVkS7BCmMg=s48-c-k-c0x00ffffff-no-rj', 'authorChannelUrl': 'http://www.youtube.com/channel/UCrc8UrDxy2zp8s37-vRbJdg', 'authorChannelId': {'value': 'UCrc8UrDxy2zp8s37-vRbJdg'}, 'canRate': True, 'viewerRating': 'none', 'likeCount': 0, 'publishedAt': '2022-10-26T16:54:46Z', 'updatedAt': '2022-10-26T16:54:46Z'}}, {'kind': 'youtube#comment', 'etag': 'HTO9bdbe3ta_5SQK6eN-gQe8Yjg', 'id': 'Ugw72zdDTa3gBGmIn114AaABAg.9heDQdPZfx89heIVtpcoQV', 'snippet': {'videoId': 'XC8FiLhsJSo', 'textDisplay': '@Patricia Lima você escre em maiúsculas e quer respeito? Piada, não?', 'textOriginal': '@Patricia Lima você escre em maiúsculas e quer respeito? Piada, não?', 'parentId': 'Ugw72zdDTa3gBGmIn114AaABAg', 'authorDisplayName': '𓇽 SERGIO 𓇽', 'authorProfileImageUrl': 'https://yt3.ggpht.com/aZMzuQ48eqcwwk0WcAIExIGV-f_f9xV3tuOVq-7mRo0WkNJvS4GjQDWuNdiF10L2s4JsbziDVA=s48-c-k-c0x00ffffff-no-rj', 'authorChannelUrl': 'http://www.youtube.com/channel/UCifdCPGcbJP3WPkgL_cP1_w', 'authorChannelId': {'value': 'UCifdCPGcbJP3WPkgL_cP1_w'}, 'canRate': True, 'viewerRating': 'none', 'likeCount': 0, 'publishedAt': '2022-10-26T16:49:48Z', 'updatedAt': '2022-10-26T16:49:48Z'}}, {'kind': 'youtube#comment', 'etag': 'rZJ25uw826EC8x_aljM3Vtba0BA', 'id': 'Ugw72zdDTa3gBGmIn114AaABAg.9heDQdPZfx89heIRIfVz0_', 'snippet': {'videoId': 'XC8FiLhsJSo', 'textDisplay': '@Patricia Lima vamos sim meu anjo esse ano e 22 novamente 😍😍😍😍', 'textOriginal': '@Patricia Lima vamos sim meu anjo esse ano e 22 novamente 😍😍😍😍', 'parentId': 'Ugw72zdDTa3gBGmIn114AaABAg', 'authorDisplayName': 'Julio Cesar', 'authorProfileImageUrl': 'https://yt3.ggpht.com/Dd_Vh42nGh6SBIP4MgTHcpa_-Kb-lVfjTNP18q57UEPji90c7kASgHVJ7MovACWNJH1yH87A0Q=s48-c-k-c0x00ffffff-no-rj', 'authorChannelUrl': 'http://www.youtube.com/channel/UC5F7sCgFniF4UQ0iW9CKGOQ', 'authorChannelId': {'value': 'UC5F7sCgFniF4UQ0iW9CKGOQ'}, 'canRate': True, 'viewerRating': 'none', 'likeCount': 1, 'publishedAt': '2022-10-26T16:49:10Z', 'updatedAt': '2022-10-26T16:49:10Z'}}, {'kind': 'youtube#comment', 'etag': 'lCmhsvzBHjicBZo0NhQ7zijKDCc', 'id': 'Ugw72zdDTa3gBGmIn114AaABAg.9heDQdPZfx89heHHypM_hb', 'snippet': {'videoId': 'XC8FiLhsJSo', 'textDisplay': 'Abra os olhos aqueles que não votaram no primeiro turno vocês vão entregar o Brasil nas mãos de uma quadrilha de corruptos assassinos de crianças e tudo mais que não presta !!!!! vocês serão julgados e cobrados por isso um dia !!!!! pense bem ainda dá tempo 🙏🇧🇷🇧🇷🇧🇷 22 🇧🇷 22 🇧🇷 22 🇧🇷 neles', 'textOriginal': 'Abra os olhos aqueles que não votaram no primeiro turno vocês vão entregar o Brasil nas mãos de uma quadrilha de corruptos assassinos de crianças e tudo mais que não presta !!!!! vocês serão julgados e cobrados por isso um dia !!!!! pense bem ainda dá tempo 🙏🇧🇷🇧🇷🇧🇷 22 🇧🇷 22 🇧🇷 22 🇧🇷 neles', 'parentId': 'Ugw72zdDTa3gBGmIn114AaABAg', 'authorDisplayName': 'Vera Lucia', 'authorProfileImageUrl': 'https://yt3.ggpht.com/ytc/AGIKgqPnQ1Y-aaO-TnZvvVcivHdtXrlVAiPMYVIzAA=s48-c-k-c0x00ffffff-no-rj', 'authorChannelUrl': 'http://www.youtube.com/channel/UC4txKCz7dz7wVLnOUCyiemw', 'authorChannelId': {'value': 'UC4txKCz7dz7wVLnOUCyiemw'}, 'canRate': True, 'viewerRating': 'none', 'likeCount': 0, 'publishedAt': '2022-10-26T16:39:09Z', 'updatedAt': '2022-10-26T16:39:09Z'}}, {'kind': 'youtube#comment', 'etag': 'KGvsd9m8JDTYAQV1Ixi5F_XtB1c', 'id': 'Ugw72zdDTa3gBGmIn114AaABAg.9heDQdPZfx89heGL5uQkno', 'snippet': {'videoId': 'XC8FiLhsJSo', 'textDisplay': '@Julio Cesar VAMOS VIRAR VOTOS 🇧🇷🙌💛💚', 'textOriginal': '@Julio Cesar VAMOS VIRAR VOTOS 🇧🇷🙌💛💚', 'parentId': 'Ugw72zdDTa3gBGmIn114AaABAg', 'authorDisplayName': 'Patricia Lima', 'authorProfileImageUrl': 'https://yt3.ggpht.com/ytc/AGIKgqO1inXHlWsO0gS3O8PWs88o9LgaK5cGlVkS7BCmMg=s48-c-k-c0x00ffffff-no-rj', 'authorChannelUrl': 'http://www.youtube.com/channel/UCrc8UrDxy2zp8s37-vRbJdg', 'authorChannelId': {'value': 'UCrc8UrDxy2zp8s37-vRbJdg'}, 'canRate': True, 'viewerRating': 'none', 'likeCount': 0, 'publishedAt': '2022-10-26T16:30:51Z', 'updatedAt': '2022-10-26T16:31:41Z'}}]}",UCrc8UrDxy2zp8s37-vRbJdg,2022-10-26T16:05:23Z,"GENTE VAMOS CONTINUAR VIRAR VOTOS PARA O NOSSO PRESIDENTE, SE O LULA JA ESTÁ FAZENDO CENSURA AGORA IMAGINA DEPOIS? BOLSONARO 2022 🙌🙏🇧🇷💛💚",,2023-06-07 23:49:22.582146
youtube#commentThread,GN8TZrWeHs9XSX9Iv5EaZuqfOXk,UgwxA-UjgUoIhvOEw594AaABAg,"{'videoId': 'XC8FiLhsJSo', 'topLevelComment': {'kind': 'youtube#comment', 'etag': 'Pok3LxAzXt-JibV2cs7AYkPybjA', 'id': 'UgwxA-UjgUoIhvOEw594AaABAg', 'snippet': {'videoId': 'XC8FiLhsJSo', 'textDisplay': 'O estrago já foi feito. Não tem como corrigir o estrago no primeiro turno. O STE já exonerou o servidor responsável pelos anúncios. Jogaram a culpa no estagiário.', 'textOriginal': 'O estrago já foi feito. Não tem como corrigir o estrago no primeiro turno. O STE já exonerou o servidor responsável pelos anúncios. Jogaram a culpa no estagiário.', 'authorDisplayName': 'Ezequiel A R', 'authorProfileImageUrl': 'https://yt3.ggpht.com/ytc/AGIKgqO_ScD2B39wgwNYeHexdOlMPlP-m3ZR8Uz1Qb1R1A=s48-c-k-c0x00ffffff-no-rj', 'authorChannelUrl': 'http://www.youtube.com/channel/UC5z1FFboZlOb4heolzuEbGw', 'authorChannelId': {'value': 'UC5z1FFboZlOb4heolzuEbGw'}, 'canRate': True, 'viewerRating': 'none', 'likeCount': 17, 'publishedAt': '2022-10-26T16:05:13Z', 'updatedAt': '2022-10-26T16:05:13Z'}}, 'canReply': True, 'totalReplyCount': 2, 'isPublic': True}","{'comments': [{'kind': 'youtube#comment', 'etag': 'LmACtENB93YcvrblfiPlfVmgpL4', 'id': 'UgwxA-UjgUoIhvOEw594AaABAg.9heDPNWOnrj9heIL3x-ulo', 'snippet': {'videoId': 'XC8FiLhsJSo', 'textDisplay': 'Não é estagiário', 'textOriginal': 'Não é estagiário', 'parentId': 'UgwxA-UjgUoIhvOEw594AaABAg', 'authorDisplayName': 'Emerson', 'authorProfileImageUrl': 'https://yt3.ggpht.com/ytc/AGIKgqNs3uZ_qWiQYe1gKJs3x8EZk5AiybMfL9f4EsvRQw=s48-c-k-c0x00ffffff-no-rj', 'authorChannelUrl': 'http://www.youtube.com/channel/UChIzLdV9bxVRX-JrTJGkjdg', 'authorChannelId': {'value': 'UChIzLdV9bxVRX-JrTJGkjdg'}, 'canRate': True, 'viewerRating': 'none', 'likeCount': 0, 'publishedAt': '2022-10-26T16:48:19Z', 'updatedAt': '2022-10-26T16:48:19Z'}}, {'kind': 'youtube#comment', 'etag': 'nQQwFWjoTm_eQewhwH7GGPPDExM', 'id': 'UgwxA-UjgUoIhvOEw594AaABAg.9heDPNWOnrj9heHjyRZRmp', 'snippet': {'videoId': 'XC8FiLhsJSo', 'textDisplay': 'Ele fez uma denuncia a PF dizendo que eles já sabiam.', 'textOriginal': 'Ele fez uma denuncia a PF dizendo que eles já sabiam.', 'parentId': 'UgwxA-UjgUoIhvOEw594AaABAg', 'authorDisplayName': 'Maicon Borges', 'authorProfileImageUrl': 'https://yt3.ggpht.com/ytc/AGIKgqOFaKpRy81hS0igno1cXbXDXCU4a8RLGK2sYLB1CA=s48-c-k-c0x00ffffff-no-rj', 'authorChannelUrl': 'http://www.youtube.com/channel/UCFKx359Gk3xZ3iwRXv7gUxQ', 'authorChannelId': {'value': 'UCFKx359Gk3xZ3iwRXv7gUxQ'}, 'canRate': True, 'viewerRating': 'none', 'likeCount': 0, 'publishedAt': '2022-10-26T16:43:07Z', 'updatedAt': '2022-10-26T16:43:07Z'}}]}",UC5z1FFboZlOb4heolzuEbGw,2022-10-26T16:05:13Z,O estrago já foi feito. Não tem como corrigir o estrago no primeiro turno. O STE já exonerou o servidor responsável pelos anúncios. Jogaram a culpa no estagiário.,,2023-06-07 23:49:22.582146
youtube#commentThread,KWBXk_zAnA6aS0yYWthIGZ_31y8,UgzmQFIa5mSCGce_lwh4AaABAg,"{'videoId': 'XC8FiLhsJSo', 'topLevelComment': {'kind': 'youtube#comment', 'etag': '8MtYTHnRX1e2FT0vK8QCHpBaWLU', 'id': 'UgzmQFIa5mSCGce_lwh4AaABAg', 'snippet': {'videoId': 'XC8FiLhsJSo', 'textDisplay': 'Já rolou até cabeça no tse. Morais já exonerou funcionário chave que cuidava do setor das inserções!', 'textOriginal': 'Já rolou até cabeça no tse. Morais já exonerou funcionário chave que cuidava do setor das inserções!', 'authorDisplayName': 'MECATRÔNICA Mecânica e injeção eletrônica', 'authorProfileImageUrl': 'https://yt3.ggpht.com/ytc/AGIKgqOzYImJaT73UX5ROQroBmvwRyTGaqr1NytCdvDUqg=s48-c-k-c0x00ffffff-no-rj', 'authorChannelUrl': 'http://www.youtube.com/channel/UCvu6wja-hJoOqhQsbqaBBpw', 'authorChannelId': {'value': 'UCvu6wja-hJoOqhQsbqaBBpw'}, 'canRate': True, 'viewerRating': 'none', 'likeCount': 8, 'publishedAt': '2022-10-26T16:03:45Z', 'updatedAt': '2022-10-26T16:03:45Z'}}, 'canReply': True, 'totalReplyCount': 2, 'isPublic': True}","{'comments': [{'kind': 'youtube#comment', 'etag': 'sRL4aLAMR74jbfqGWSq6xI23kWg', 'id': 'UgzmQFIa5mSCGce_lwh4AaABAg.9heDEgTdTsr9hemL29FFXp', 'snippet': {'videoId': 'XC8FiLhsJSo', 'textDisplay': 'A próxima cabeça, é a de ovo..', 'textOriginal': 'A próxima cabeça, é a de ovo..', 'parentId': 'UgzmQFIa5mSCGce_lwh4AaABAg', 'authorDisplayName': 'TheRedViper', 'authorProfileImageUrl': 'https://yt3.ggpht.com/ytc/AGIKgqNJosVjXAILRwTfMrkV0Wr_VGcvi8OjZUKrEw=s48-c-k-c0x00ffffff-no-rj', 'authorChannelUrl': 'http://www.youtube.com/channel/UCG3RKz9kLbHdhd21lh0IRCA', 'authorChannelId': {'value': 'UCG3RKz9kLbHdhd21lh0IRCA'}, 'canRate': True, 'viewerRating': 'none', 'likeCount': 1, 'publishedAt': '2022-10-26T21:19:12Z', 'updatedAt': '2022-10-26T21:19:12Z'}}, {'kind': 'youtube#comment', 'etag': 'bSfQ3yxtZTaWgTtRsKRjC6ZXNNk', 'id': 'UgzmQFIa5mSCGce_lwh4AaABAg.9heDEgTdTsr9heGqZSoqE4', 'snippet': {'videoId': 'XC8FiLhsJSo', 'textDisplay': 'E o prejuízo quem pagará ? É a maior fraude eleitoral da história', 'textOriginal': 'E o prejuízo quem pagará ? É a maior fraude eleitoral da história', 'parentId': 'UgzmQFIa5mSCGce_lwh4AaABAg', 'authorDisplayName': 'amanda noleto', 'authorProfileImageUrl': 'https://yt3.ggpht.com/ytc/AGIKgqMDJNG7mwA9MDQ0vPzemsyzKUd6-v7tGBacJg=s48-c-k-c0x00ffffff-no-rj', 'authorChannelUrl': 'http://www.youtube.com/channel/UCIlz5387jaY_nWBxEa5Y4gA', 'authorChannelId': {'value': 'UCIlz5387jaY_nWBxEa5Y4gA'}, 'canRate': True, 'viewerRating': 'none', 'likeCount': 0, 'publishedAt': '2022-10-26T16:35:17Z', 'updatedAt': '2022-10-26T16:35:17Z'}}]}",UCvu6wja-hJoOqhQsbqaBBpw,2022-10-26T16:03:45Z,Já rolou até cabeça no tse. Morais já exonerou funcionário chave que cuidava do setor das inserções!,,2023-06-07 23:49:22.582146
