kind,etag,id,snippet,replies,authorChannelId,publishedAt,textOriginal,nextPageToken,extraction_date
youtube#commentThread,Qy-4g-2Y4S_RXPR0jmBAUT_vMNg,UgwrWoGE3ibLEKg8cuV4AaABAg,"{'videoId': 'XC8FiLhsJSo', 'topLevelComment': {'kind': 'youtube#comment', 'etag': 'aRIT0qylDT9bwz8KnF06M0d1f_k', 'id': 'UgwrWoGE3ibLEKg8cuV4AaABAg', 'snippet': {'videoId': 'XC8FiLhsJSo', 'textDisplay': 'Por favor, pergunte ao professor, o que a lei Determinar na nesses casos?<br>Grato pela atenção!', 'textOriginal': 'Por favor, pergunte ao professor, o que a lei Determinar na nesses casos?\\nGrato pela atenção!', 'authorDisplayName': 'Paulo Nurmberg', 'authorProfileImageUrl': 'https://yt3.ggpht.com/ytc/AGIKgqPj5bi9c2Xhl6ptrDSBH2XSSRiHKBddOVUB2A=s48-c-k-c0x00ffffff-no-rj', 'authorChannelUrl': 'http://www.youtube.com/channel/UC8WFXfJU1pGdLTZ9heQStDA', 'authorChannelId': {'value': 'UC8WFXfJU1pGdLTZ9heQStDA'}, 'canRate': True, 'viewerRating': 'none', 'likeCount': 5, 'publishedAt': '2022-10-26T16:25:54Z', 'updatedAt': '2022-10-26T16:25:54Z'}}, 'canReply': True, 'totalReplyCount': 0, 'isPublic': True}",,UC8WFXfJU1pGdLTZ9heQStDA,2022-10-26T16:25:54Z,"Por favor, pergunte ao professor, o que a lei Determinar na nesses casos?
Grato pela atenção!",,2023-06-07 23:49:22.582146
youtube#commentThread,6DokfDkSm_xYzDs9iruxExVOEGE,Ugx1n2SDtnMfcVQmDvt4AaABAg,"{'videoId': 'XC8FiLhsJSo', 'topLevelComment': {'kind': 'youtube#comment', 'etag': '1osuizegmoF2xZDf3-rBGXcQP7o', 'id': 'Ugx1n2SDtnMfcVQmDvt4AaABAg', 'snippet': {'videoId': 'XC8FiLhsJSo', 'textDisplay': 'Vergonha esse país. TSE lixo!', 'textOriginal': 'Vergonha esse país. TSE lixo!', 'authorDisplayName': 'Abner Visconti Vieira', 'authorProfileImageUrl': 'https://yt3.ggpht.com/ytc/AGIKgqPagt5hnPyaKszKHgAWnnPxCC3PUf661pbu_K2Iujo=s48-c-k-c0x00ffffff-no-rj', 'authorChannelUrl': 'http://www.youtube.com/channel/UCTUIDZiUf_HKaFWg6GwT3vA', 'authorChannelId': {'value': 'UCTUIDZiUf_HKaFWg6GwT3vA'}, 'canRate': True, 'viewerRating': 'none', 'likeCount': 0, 'publishedAt': '2022-10-26T16:25:12Z', 'updatedAt': '2022-10-26T16:25:12Z'}}, 'canReply': True, 'totalReplyCount': 0, 'isPublic': True}",,UCTUIDZiUf_HKaFWg6GwT3vA,2022-10-26T16:25:12Z,Vergonha esse país. TSE lixo!,,2023-06-07 23:49:22.582146
youtube#commentThread,13qQNWNg0EmQjzmGyZMa1ctjrnk,Ugzj88KEyyKre9BuPIF4AaABAg,"{'videoId': 'XC8FiLhsJSo', 'topLevelComment': {'kind': 'youtube#comment', 'etag': 'KlKO26CWSZ8VySdnot4Ng_8wO_Q', 'id': 'Ugzj88KEyyKre9BuPIF4AaABAg', 'snippet': {'videoId': 'XC8FiLhsJSo', 'textDisplay': 'Então deviam anular as eleições para deputados federais e governadores e deputados estaduais que no RS foram liberados em 100 municípios e isso FAVORECEU OS COM OS CANDIDATOS COM. O PODER AQUISITIVO MAIOR. POIS SE TEMOS 497 MUNICÍPIOS NO RS E 100 TAO GRATUIDADE E AQUI VAI A PERGUNTA O CANDIDATO COM MENOR PODER AQUISITIVO, TENDÊNCIA QUE ELE POSSA SER MAUS CONHECIDO NOS PEQUENOS MUNICÍPIOS E PEQUENAS COMUNIDADES ONDE TALVEZ MUITOS CANDIDATOS ELEITOS NEM SAIBAM QUE EXISTEM. ISSO ESTOU FALANDO DO RS NESSE CASO?       PODERIA SER UMA QUESTÃO DE ANULAR AS ELEIÇÕES PORQUE O CANDIDATO COM MAIS FUNDO ELEITORAL PODE TER OLHA QUE DIGO PODE TER CONTRATADO POR FORA DA SUA CONFIANÇA ALGUÉM E TER Disponibilizado TRANSPORTES GRATUITOS. PODEMOS PENSAR SE ISSO NÃO PODERIA FAVORECER ATÉ AS PREFEITURAS QUE O PREFEITO LIBERAVA SE QUISESSE E COM ISSO O ELEITOR SE SENTINDO A OBRIGAR NO VOTO NO CANDIDATO DO PREFEITO DA CIDADE, ATÉ PODIAM FAZER ESSE LEVANTAMENTO SE NAS 100 CIDADES QUE FOI DISPONIBILIZADOS. O TRANSPORTE PÚBLICO NAS ELEIÇÕES SE O CANDIDATO PRETERIDO PELO PREFEITO DEVE MAIS VOTOS.  AQUI ESTOU SÓ TANTO UM EXEMPLO.', 'textOriginal': 'Então deviam anular as eleições para deputados federais e governadores e deputados estaduais que no RS foram liberados em 100 municípios e isso FAVORECEU OS COM OS CANDIDATOS COM. O PODER AQUISITIVO MAIOR. POIS SE TEMOS 497 MUNICÍPIOS NO RS E 100 TAO GRATUIDADE E AQUI VAI A PERGUNTA O CANDIDATO COM MENOR PODER AQUISITIVO, TENDÊNCIA QUE ELE POSSA SER MAUS CONHECIDO NOS PEQUENOS MUNICÍPIOS E PEQUENAS COMUNIDADES ONDE TALVEZ MUITOS CANDIDATOS ELEITOS NEM SAIBAM QUE EXISTEM. ISSO ESTOU FALANDO DO RS NESSE CASO?       PODERIA SER UMA QUESTÃO DE ANULAR AS ELEIÇÕES PORQUE O CANDIDATO COM MAIS FUNDO ELEITORAL PODE TER OLHA QUE DIGO PODE TER CONTRATADO POR FORA DA SUA CONFIANÇA ALGUÉM E TER Disponibilizado TRANSPORTES GRATUITOS. PODEMOS PENSAR SE ISSO NÃO PODERIA FAVORECER ATÉ AS PREFEITURAS QUE O PREFEITO LIBERAVA SE QUISESSE E COM ISSO O ELEITOR SE SENTINDO A OBRIGAR NO VOTO NO CANDIDATO DO PREFEITO DA CIDADE, ATÉ PODIAM FAZER ESSE LEVANTAMENTO SE NAS 100 CIDADES QUE FOI DISPONIBILIZADOS. O TRANSPORTE PÚBLICO NAS ELEIÇÕES SE O CANDIDATO PRETERIDO PELO PREFEITO DEVE MAIS VOTOS.  AQUI ESTOU SÓ TANTO UM EXEMPLO.', 'authorDisplayName': 'Milton Fênix Eventos', 'authorProfileImageUrl': 'https://yt3.ggpht.com/ytc/AGIKgqO-4Ec3dd563zn0_4GQhhEEUS_diAWcO10uyJ3clJ3lhJQ4kepEleMLxV3AUQhw=s48-c-k-c0x00ffffff-no-rj', 'authorChannelUrl': 'http://www.youtube.com/channel/UCr6Pg48zDgLNGH3QgVzlelA', 'authorChannelId': {'value': 'UCr6Pg48zDgLNGH3QgVzlelA'}, 'canRate': True, 'viewerRating': 'none', 'likeCount': 0, 'publishedAt': '2022-10-26T16:24:12Z', 'updatedAt': '2022-10-26T16:24:12Z'}}, 'canReply': True, 'totalReplyCount': 0, 'isPublic': True}",,UCr6Pg48zDgLNGH3QgVzlelA,2022-10-26T16:24:12Z,"Então deviam anular as eleições para deputados federais e governadores e deputados estaduais que no RS foram liberados em 100 municípios e isso FAVORECEU OS COM OS CANDIDATOS COM. O PODER AQUISITIVO MAIOR. POIS SE TEMOS 497 MUNICÍPIOS NO RS E 100 TAO GRATUIDADE E AQUI VAI A PERGUNTA O CANDIDATO COM MENOR PODER AQUISITIVO, TENDÊNCIA QUE ELE POSSA SER MAUS CONHECIDO NOS PEQUENOS MUNICÍPIOS E PEQUENAS COMUNIDADES ONDE TALVEZ MUITOS CANDIDATOS ELEITOS NEM SAIBAM QUE EXISTEM. ISSO ESTOU FALANDO DO RS NESSE CASO?       PODERIA SER UMA QUESTÃO DE ANULAR AS ELEIÇÕES PORQUE O CANDIDATO COM MAIS FUNDO ELEITORAL PODE TER OLHA QUE DIGO PODE TER CONTRATADO POR FORA DA SUA CONFIANÇA ALGUÉM E TER Disponibilizado TRANSPORTES GRATUITOS. PODEMOS PENSAR SE ISSO NÃO PODERIA FAVORECER ATÉ AS PREFEITURAS QUE O PREFEITO LIBERAVA SE QUISESSE E COM ISSO O ELEITOR SE SENTINDO A OBRIGAR NO VOTO NO CANDIDATO DO PREFEITO DA CIDADE, ATÉ PODIAM FAZER ESSE LEVANTAMENTO SE NAS 100 CIDADES QUE FOI DISPONIBILIZADOS. O TRANSPORTE PÚBLICO NAS ELEIÇÕES SE O CANDIDATO PRETERIDO PELO PREFEITO DEVE MAIS VOTOS.  AQUI ESTOU SÓ TANTO UM EXEMPLO.",,2023-06-07 23:49:22.582146
youtube#commentThread,3RS6d56xhZEPWoH4r3n_eV0HS4o,Ugy5iTof9wJWrg9LZx14AaABAg,"{'videoId': 'XC8FiLhsJSo', 'topLevelComment': {'kind': 'youtube#comment', 'etag': 'l6Lh5zp-Qe8aVuUz-LpVYZKwrNQ', 'id': 'Ugy5iTof9wJWrg9LZx14AaABAg', 'snippet': {'videoId': 'XC8FiLhsJSo', 'textDisplay': 'Prejuízo incalculável, quem vai fiscalizar o TSE? cadê o ministério publico a policia federal pra entrar nesse caso', 'textOriginal': 'Prejuízo incalculável, quem vai fiscalizar o TSE? cadê o ministério publico a policia federal pra entrar nesse caso', 'authorDisplayName': 'Pablo Delson', 'authorProfileImageUrl': 'https://yt3.ggpht.com/ytc/AGIKgqMZHluPQuKtm8r0_79BRytlkXo275qvIZ3eJlcY=s48-c-k-c0x00ffffff-no-rj', 'authorChannelUrl': 'http://www.youtube.com/channel/UC4ZeVsWkTi7y3pAo9lHPxeQ', 'authorChannelId': {'value': 'UC4ZeVsWkTi7y3pAo9lHPxeQ'}, 'canRate': True, 'viewerRating': 'none', 'likeCount': 6, 'publishedAt': '2022-10-26T16:22:24Z', 'updatedAt': '2022-10-26T16:22:24Z'}}, 'canReply': True, 'totalReplyCount': 0, 'isPublic': True}",,UC4ZeVsWkTi7y3pAo9lHPxeQ,2022-10-26T16:22:24Z,"Prejuízo incalculável, quem vai fiscalizar o TSE? cadê o ministério publico a policia federal pra entrar nesse caso",,2023-06-07 23:49:22.582146
youtube#commentThread,QUN_0K8FtSUMxN9SkapbBbRKGHg,UgxhhU60rYN8D6_4ZJx4AaABAg,"{'videoId': 'XC8FiLhsJSo', 'topLevelComment': {'kind': 'youtube#comment', 'etag': 'SLzlL22-GROiA9UAOM7vNvFZYcg', 'id': 'UgxhhU60rYN8D6_4ZJx4AaABAg', 'snippet': {'videoId': 'XC8FiLhsJSo', 'textDisplay': 'Sobre o funcionário do tse exonerado,  não falam?', 'textOriginal': 'Sobre o funcionário do tse exonerado,  não falam?', 'authorDisplayName': 'Elton dill', 'authorProfileImageUrl': 'https://yt3.ggpht.com/ytc/AGIKgqNgbsyz3E50zzXavcHfXqJNbEt1mEt-jPpRk6OE=s48-c-k-c0x00ffffff-no-rj', 'authorChannelUrl': 'http://www.youtube.com/channel/UCXofQZksiswCC_eewGLaf0w', 'authorChannelId': {'value': 'UCXofQZksiswCC_eewGLaf0w'}, 'canRate': True, 'viewerRating': 'none', 'likeCount': 2, 'publishedAt': '2022-10-26T16:21:31Z', 'updatedAt': '2022-10-26T16:21:31Z'}}, 'canReply': True, 'totalReplyCount': 1, 'isPublic': True}","{'comments': [{'kind': 'youtube#comment', 'etag': 'B8wfXQ32f3ztjeZA3KfCmMvm2l0', 'id': 'UgxhhU60rYN8D6_4ZJx4AaABAg.9heFGkB3q7u9hemW_y1RGG', 'snippet': {'videoId': 'XC8FiLhsJSo', 'textDisplay': 'É irrelevante, vc acha msm que um funcionário é responsável por toda essa fraude? O próprio cara disse que já havia alertado o TSE sobre isso em 2018, e nada foi feito... A merda é bem maior que uma exoneração, cara...', 'textOriginal': 'É irrelevante, vc acha msm que um funcionário é responsável por toda essa fraude? O próprio cara disse que já havia alertado o TSE sobre isso em 2018, e nada foi feito... A merda é bem maior que uma exoneração, cara...', 'parentId': 'UgxhhU60rYN8D6_4ZJx4AaABAg', 'authorDisplayName': 'TheRedViper', 'authorProfileImageUrl': 'https://yt3.ggpht.com/ytc/AGIKgqNJosVjXAILRwTfMrkV0Wr_VGcvi8OjZUKrEw=s48-c-k-c0x00ffffff-no-rj', 'authorChannelUrl': 'http://www.youtube.com/channel/UCG3RKz9kLbHdhd21lh0IRCA', 'authorChannelId': {'value': 'UCG3RKz9kLbHdhd21lh0IRCA'}, 'canRate': True, 'viewerRating': 'none', 'likeCount': 1, 'publishedAt': '2022-10-26T21:20:46Z', 'updatedAt': '2022-10-26T21:20:46Z'}}]}",UCXofQZksiswCC_eewGLaf0w,2022-10-26T16:21:31Z,"Sobre o funcionário do tse exonerado,  não falam?",,2023-06-07 23:49:22.582146
youtube#commentThread,4QvJ6ku2l2YfMr2YIcA8jdddDdo,UgymvJ7bg9lg3w5bOVJ4AaABAg,"{'videoId': 'XC8FiLhsJSo', 'topLevelComment': {'kind': 'youtube#comment', 'etag': 'UBmSaBteq5IO3r5jh5Hf_cGgZEs', 'id': 'UgymvJ7bg9lg3w5bOVJ4AaABAg', 'snippet': {'videoId': 'XC8FiLhsJSo', 'textDisplay': 'Parece que a Band está por fora pois até funcionário já foi exonerado e uma rádio assumiu o erro .', 'textOriginal': 'Parece que a Band está por fora pois até funcionário já foi exonerado e uma rádio assumiu o erro .', 'authorDisplayName': 'rogerio feitosa', 'authorProfileImageUrl': 'https://yt3.ggpht.com/ytc/AGIKgqNGbSry3xTih52gUr2Igx6-hwRNK1xCGUVOSg=s48-c-k-c0x00ffffff-no-rj', 'authorChannelUrl': 'http://www.youtube.com/channel/UC41fdGzPZPgbSJTaThC28cQ', 'authorChannelId': {'value': 'UC41fdGzPZPgbSJTaThC28cQ'}, 'canRate': True, 'viewerRating': 'none', 'likeCount': 4, 'publishedAt': '2022-10-26T16:18:03Z', 'updatedAt': '2022-10-26T16:18:03Z'}}, 'canReply': True, 'totalReplyCount': 1, 'isPublic': True}","{'comments': [{'kind': 'youtube#comment', 'etag': 'pSynBOiQ0xBKoAaadSP_Prw19sM', 'id': 'UgymvJ7bg9lg3w5bOVJ4AaABAg.9heEsN7Crfx9heP1JEBmrl', 'snippet': {'videoId': 'XC8FiLhsJSo', 'textDisplay': 'Band e outras mídias fingem demência nessas horas.', 'textOriginal': 'Band e outras mídias fingem demência nessas horas.', 'parentId': 'UgymvJ7bg9lg3w5bOVJ4AaABAg', 'authorDisplayName': 'Octávio Carpini', 'authorProfileImageUrl': 'https://yt3.ggpht.com/ytc/AGIKgqMnCpSGdYboXslv6_XLzDdvEKtEY8y-xDlqtcbaeR4=s48-c-k-c0x00ffffff-no-rj', 'authorChannelUrl': 'http://www.youtube.com/channel/UCXo7NZg_PlTy_oNxNYLuzWg', 'authorChannelId': {'value': 'UCXo7NZg_PlTy_oNxNYLuzWg'}, 'canRate': True, 'viewerRating': 'none', 'likeCount': 0, 'publishedAt': '2022-10-26T17:46:47Z', 'updatedAt': '2022-10-26T17:46:47Z'}}]}",UC41fdGzPZPgbSJTaThC28cQ,2022-10-26T16:18:03Z,Parece que a Band está por fora pois até funcionário já foi exonerado e uma rádio assumiu o erro .,,2023-06-07 23:49:22.582146
youtube#commentThread,Q9vJvsYl33EH-6v5apeTzSBa3xw,UgwWNb6Tb6CMY_0vNXt4AaABAg,"{'videoId': 'XC8FiLhsJSo', 'topLevelComment': {'kind': 'youtube#comment', 'etag': 'icd0HwPv1XLd3QxTRTcrT6QbPzo', 'id': 'UgwWNb6Tb6CMY_0vNXt4AaABAg', 'snippet': {'videoId': 'XC8FiLhsJSo', 'textDisplay': 'LULA    2023  AMÉM  ÍRMÃOS', 'textOriginal': 'LULA    2023  AMÉM  ÍRMÃOS', 'authorDisplayName': 'paulo rogerio', 'authorProfileImageUrl': 'https://yt3.ggpht.com/ytc/AGIKgqNZlBsGZolEWveriy-qegJ4sAlO4HSw98yLgQ=s48-c-k-c0x00ffffff-no-rj', 'authorChannelUrl': 'http://www.youtube.com/channel/UCk4Ro4lqWGXw19zzYQFu1Zg', 'authorChannelId': {'value': 'UCk4Ro4lqWGXw19zzYQFu1Zg'}, 'canRate': True, 'viewerRating': 'none', 'likeCount': 6, 'publishedAt': '2022-10-26T16:14:53Z', 'updatedAt': '2022-10-26T16:14:53Z'}}, 'canReply': True, 'totalReplyCount': 11, 'isPublic': True}","{'comments': [{'kind': 'youtube#comment', 'etag': 'waDTutJfIfK-1THtKl1w5QIfNTE', 'id': 'UgwWNb6Tb6CMY_0vNXt4AaABAg.9heEWETBSHH9heMd6sMGVo', 'snippet': {'videoId': 'XC8FiLhsJSo', 'textDisplay': '@Emerson NÃO    IMPEDE   VC  QUE  PENSA  ÍNJENUO   DEIXA  CHEGAR  JANEIRO   AI  TU  VAI  VER   A  ENCHURRADA   DE  INVESTIGAÇÕES   PROSEGUIREM   NA  - FAMÍLÍCÍA', 'textOriginal': '@Emerson NÃO    IMPEDE   VC  QUE  PENSA  ÍNJENUO   DEIXA  CHEGAR  JANEIRO   AI  TU  VAI  VER   A  ENCHURRADA   DE  INVESTIGAÇÕES   PROSEGUIREM   NA  - FAMÍLÍCÍA', 'parentId': 'UgwWNb6Tb6CMY_0vNXt4AaABAg', 'authorDisplayName': 'paulo rogerio', 'authorProfileImageUrl': 'https://yt3.ggpht.com/ytc/AGIKgqNZlBsGZolEWveriy-qegJ4sAlO4HSw98yLgQ=s48-c-k-c0x00ffffff-no-rj', 'authorChannelUrl': 'http://www.youtube.com/channel/UCk4Ro4lqWGXw19zzYQFu1Zg', 'authorChannelId': {'value': 'UCk4Ro4lqWGXw19zzYQFu1Zg'}, 'canRate': True, 'viewerRating': 'none', 'likeCount': 0, 'publishedAt': '2022-10-26T17:25:52Z', 'updatedAt': '2022-10-26T17:25:52Z'}}, {'kind': 'youtube#comment', 'etag': 'BHbPLBxbj0UVRCi6-d5ARYoUorA', 'id': 'UgwWNb6Tb6CMY_0vNXt4AaABAg.9heEWETBSHH9heLvz6t57f', 'snippet': {'videoId': 'XC8FiLhsJSo', 'textDisplay': '@paulo rogerio e desde quando o foro impede de investigar , vai dormir , vcs ficaram quase 4 anos puxando o país pra  traz e mais os 16 que ficaram no governo. Não vão ganhar .', 'textOriginal': '@paulo rogerio e desde quando o foro impede de investigar , vai dormir , vcs ficaram quase 4 anos puxando o país pra  traz e mais os 16 que ficaram no governo. Não vão ganhar .', 'parentId': 'UgwWNb6Tb6CMY_0vNXt4AaABAg', 'authorDisplayName': 'Emerson', 'authorProfileImageUrl': 'https://yt3.ggpht.com/ytc/AGIKgqNs3uZ_qWiQYe1gKJs3x8EZk5AiybMfL9f4EsvRQw=s48-c-k-c0x00ffffff-no-rj', 'authorChannelUrl': 'http://www.youtube.com/channel/UChIzLdV9bxVRX-JrTJGkjdg', 'authorChannelId': {'value': 'UChIzLdV9bxVRX-JrTJGkjdg'}, 'canRate': True, 'viewerRating': 'none', 'likeCount': 0, 'publishedAt': '2022-10-26T17:19:42Z', 'updatedAt': '2022-10-26T17:19:42Z'}}, {'kind': 'youtube#comment', 'etag': 'DNfRrstkkti7evIVXKaB64sxhAQ', 'id': 'UgwWNb6Tb6CMY_0vNXt4AaABAg.9heEWETBSHH9heLRXKcflf', 'snippet': {'videoId': 'XC8FiLhsJSo', 'textDisplay': '@Emerson  DEIXA  SOR  O  BOZO  PERDER  O   FORO   , QUE  AI  TU  VAI  VER  AS INVESTIGAÇÕES  PROSEGUIREM  , E  AI O AUGUSTO  ARAS  E  NEM A POLÍCIA  FEDERAL  APARELHADA  NÃO  VAI PODER  DEFENDER    O   SEU BOZONARO  É   SÓ  UMA  QUESTÃO  DE  TEMPO  🤡', 'textOriginal': '@Emerson  DEIXA  SOR  O  BOZO  PERDER  O   FORO   , QUE  AI  TU  VAI  VER  AS INVESTIGAÇÕES  PROSEGUIREM  , E  AI O AUGUSTO  ARAS  E  NEM A POLÍCIA  FEDERAL  APARELHADA  NÃO  VAI PODER  DEFENDER    O   SEU BOZONARO  É   SÓ  UMA  QUESTÃO  DE  TEMPO  🤡', 'parentId': 'UgwWNb6Tb6CMY_0vNXt4AaABAg', 'authorDisplayName': 'paulo rogerio', 'authorProfileImageUrl': 'https://yt3.ggpht.com/ytc/AGIKgqNZlBsGZolEWveriy-qegJ4sAlO4HSw98yLgQ=s48-c-k-c0x00ffffff-no-rj', 'authorChannelUrl': 'http://www.youtube.com/channel/UCk4Ro4lqWGXw19zzYQFu1Zg', 'authorChannelId': {'value': 'UCk4Ro4lqWGXw19zzYQFu1Zg'}, 'canRate': True, 'viewerRating': 'none', 'likeCount': 0, 'publishedAt': '2022-10-26T17:15:25Z', 'updatedAt': '2022-10-26T17:15:25Z'}}, {'kind': 'youtube#comment', 'etag': 'PrAkcRNcPDTlEKzMKjjHIR_GHyg', 'id': 'UgwWNb6Tb6CMY_0vNXt4AaABAg.9heEWETBSHH9heKt3wyIAo', 'snippet': {'videoId': 'XC8FiLhsJSo', 'textDisplay': '@paulo rogerio a rachadinha que vocês falam,  falam e não provam nada . Vão tentar convencer desinformado .', 'textOriginal': '@paulo rogerio a rachadinha que vocês falam,  falam e não provam nada . Vão tentar convencer desinformado .', 'parentId': 'UgwWNb6Tb6CMY_0vNXt4AaABAg', 'authorDisplayName': 'Emerson', 'authorProfileImageUrl': 'https://yt3.ggpht.com/ytc/AGIKgqNs3uZ_qWiQYe1gKJs3x8EZk5AiybMfL9f4EsvRQw=s48-c-k-c0x00ffffff-no-rj', 'authorChannelUrl': 'http://www.youtube.com/channel/UChIzLdV9bxVRX-JrTJGkjdg', 'authorChannelId': {'value': 'UChIzLdV9bxVRX-JrTJGkjdg'}, 'canRate': True, 'viewerRating': 'none', 'likeCount': 0, 'publishedAt': '2022-10-26T17:10:34Z', 'updatedAt': '2022-10-26T17:10:34Z'}}, {'kind': 'youtube#comment', 'etag': 'nso38b9BsPNM0yWXC56iV4uUx58', 'id': 'UgwWNb6Tb6CMY_0vNXt4AaABAg.9heEWETBSHH9heKR9-M9yo', 'snippet': {'videoId': 'XC8FiLhsJSo', 'textDisplay': '@Emerson   ,,,,RACHEÍÍ  IGUALZINHO   A   UMA    RACHADINHA    TRÊS   PRA   VOCÊ 💰 💰 💰       E    TRÊS   PRA   MIM 💰 💰 💰.   AMÉM   ÍRMÃOS  PATRIOTA', 'textOriginal': '@Emerson   ,,,,RACHEÍÍ  IGUALZINHO   A   UMA    RACHADINHA    TRÊS   PRA   VOCÊ 💰 💰 💰       E    TRÊS   PRA   MIM 💰 💰 💰.   AMÉM   ÍRMÃOS  PATRIOTA', 'parentId': 'UgwWNb6Tb6CMY_0vNXt4AaABAg', 'authorDisplayName': 'paulo rogerio', 'authorProfileImageUrl': 'https://yt3.ggpht.com/ytc/AGIKgqNZlBsGZolEWveriy-qegJ4sAlO4HSw98yLgQ=s48-c-k-c0x00ffffff-no-rj', 'authorChannelUrl': 'http://www.youtube.com/channel/UCk4Ro4lqWGXw19zzYQFu1Zg', 'authorChannelId': {'value': 'UCk4Ro4lqWGXw19zzYQFu1Zg'}, 'canRate': True, 'viewerRating': 'none', 'likeCount': 1, 'publishedAt': '2022-10-26T17:06:37Z', 'updatedAt': '2022-10-26T17:06:37Z'}}]}",UCk4Ro4lqWGXw19zzYQFu1Zg,2022-10-26T16:14:53Z,LULA    2023  AMÉM  ÍRMÃOS,,2023-06-07 23:49:22.582146
youtube#commentThread,9Di3uAr0MWIB_7g4RSs6tOUW4O4,UgxKsStplIhLbdJAj2V4AaABAg,"{'videoId': 'XC8FiLhsJSo', 'topLevelComment': {'kind': 'youtube#comment', 'etag': 'hqz3GcR1xaLWhJ-SKxtuz2m4ZAo', 'id': 'UgxKsStplIhLbdJAj2V4AaABAg', 'snippet': {'videoId': 'XC8FiLhsJSo', 'textDisplay': 'VAI TER GUERRA CIVIL SE O TSE NAO FIZER NADA', 'textOriginal': 'VAI TER GUERRA CIVIL SE O TSE NAO FIZER NADA', 'authorDisplayName': 'Aparecida Vanderleia', 'authorProfileImageUrl': 'https://yt3.ggpht.com/ytc/AGIKgqPyakbUVSxmIgpSpA6kdNA1cl9tDd6M1TDhlA=s48-c-k-c0x00ffffff-no-rj', 'authorChannelUrl': 'http://www.youtube.com/channel/UCyjk7EXw2BrkzVr8YhJdWUw', 'authorChannelId': {'value': 'UCyjk7EXw2BrkzVr8YhJdWUw'}, 'canRate': True, 'viewerRating': 'none', 'likeCount': 0, 'publishedAt': '2022-10-26T16:13:27Z', 'updatedAt': '2022-10-26T16:13:27Z'}}, 'canReply': True, 'totalReplyCount': 0, 'isPublic': True}",,UCyjk7EXw2BrkzVr8YhJdWUw,2022-10-26T16:13:27Z,VAI TER GUERRA CIVIL SE O TSE NAO FIZER NADA,,2023-06-07 23:49:22.582146
youtube#commentThread,myJ3nEL0t9ITeOC60rn1oXLwf80,Ugx61KVIRZnDFVsEQWR4AaABAg,"{'videoId': 'XC8FiLhsJSo', 'topLevelComment': {'kind': 'youtube#comment', 'etag': 'haZobPj7JgbHJJQ8XapYNSfujZU', 'id': 'Ugx61KVIRZnDFVsEQWR4AaABAg', 'snippet': {'videoId': 'XC8FiLhsJSo', 'textDisplay': 'Já tem gente pegando em bosta no TSE', 'textOriginal': 'Já tem gente pegando em bosta no TSE', 'authorDisplayName': 'Bismarck da silva Bismarck', 'authorProfileImageUrl': 'https://yt3.ggpht.com/ytc/AGIKgqMHVoB7Y8Kyw13GXbA2X6qrTg9nK6COEKZjyg=s48-c-k-c0x00ffffff-no-rj', 'authorChannelUrl': 'http://www.youtube.com/channel/UCXhabqJxBEf7lLkbyBUh_0Q', 'authorChannelId': {'value': 'UCXhabqJxBEf7lLkbyBUh_0Q'}, 'canRate': True, 'viewerRating': 'none', 'likeCount': 5, 'publishedAt': '2022-10-26T16:12:41Z', 'updatedAt': '2022-10-26T16:12:41Z'}}, 'canReply': True, 'totalReplyCount': 0, 'isPublic': True}",,UCXhabqJxBEf7lLkbyBUh_0Q,2022-10-26T16:12:41Z,Já tem gente pegando em bosta no TSE,,2023-06-07 23:49:22.582146
