kind,etag,id,snippet,replies,authorChannelId,publishedAt,textOriginal,nextPageToken,extraction_date
youtube#commentThread,T4j124nkoxepWX1Ydr1P7rSpUvM,UgzAFFs9MNTnDxN2POZ4AaABAg,"{'videoId': 'XC8FiLhsJSo', 'topLevelComment': {'kind': 'youtube#comment', 'etag': 'q2fFa7_taFCOkhStqYpN9nZE3qA', 'id': 'UgzAFFs9MNTnDxN2POZ4AaABAg', 'snippet': {'videoId': 'XC8FiLhsJSo', 'textDisplay': 'Todos sabemos que o tse é do lado do Lula', 'textOriginal': 'Todos sabemos que o tse é do lado do Lula', 'authorDisplayName': 'Ramon Monteiro', 'authorProfileImageUrl': 'https://yt3.ggpht.com/ytc/AGIKgqNHJcYJqZeNGUgt2pEfOwceScz33TaxRxWjXgiM_76nIkcdrqyip1KC7EOo8d5N=s48-c-k-c0x00ffffff-no-rj', 'authorChannelUrl': 'http://www.youtube.com/channel/UC5Xs8rmSCdN5mPbfiI_Jcrw', 'authorChannelId': {'value': 'UC5Xs8rmSCdN5mPbfiI_Jcrw'}, 'canRate': True, 'viewerRating': 'none', 'likeCount': 0, 'publishedAt': '2022-10-26T16:54:57Z', 'updatedAt': '2022-10-26T16:54:57Z'}}, 'canReply': True, 'totalReplyCount': 0, 'isPublic': True}",,UC5Xs8rmSCdN5mPbfiI_Jcrw,2022-10-26T16:54:57Z,Todos sabemos que o tse é do lado do Lula,,2023-06-07 23:49:22.582146
youtube#commentThread,y9gsWedjdTrcyWkhZcMFo3Dp8mM,Ugy5L_QoK_OFu5Tb5494AaABAg,"{'videoId': 'XC8FiLhsJSo', 'topLevelComment': {'kind': 'youtube#comment', 'etag': 'j8Cpmloi0rMihjHkO8WAfHcs12c', 'id': 'Ugy5L_QoK_OFu5Tb5494AaABAg', 'snippet': {'videoId': 'XC8FiLhsJSo', 'textDisplay': 'Essa eleições  tem que ser cancelada  emediata', 'textOriginal': 'Essa eleições  tem que ser cancelada  emediata', 'authorDisplayName': 'marciano camargo', 'authorProfileImageUrl': 'https://yt3.ggpht.com/ytc/AGIKgqM-Ng52wAFu4K-48aLMMk5vy6F4glmBAF0L6-KM=s48-c-k-c0x00ffffff-no-rj', 'authorChannelUrl': 'http://www.youtube.com/channel/UCQbopX-ucBQWyAaFTMTIkfA', 'authorChannelId': {'value': 'UCQbopX-ucBQWyAaFTMTIkfA'}, 'canRate': True, 'viewerRating': 'none', 'likeCount': 0, 'publishedAt': '2022-10-26T16:54:55Z', 'updatedAt': '2022-10-26T16:54:55Z'}}, 'canReply': True, 'totalReplyCount': 0, 'isPublic': True}",,UCQbopX-ucBQWyAaFTMTIkfA,2022-10-26T16:54:55Z,Essa eleições  tem que ser cancelada  emediata,,2023-06-07 23:49:22.582146
youtube#commentThread,Av5f2JwX8C6Gfk6LiB8B8ow5Hrk,Ugw_G6-z4mPLR1S3EQN4AaABAg,"{'videoId': 'XC8FiLhsJSo', 'topLevelComment': {'kind': 'youtube#comment', 'etag': 'ZKIV4nh7wuQJi67nhSObeEio5MM', 'id': 'Ugw_G6-z4mPLR1S3EQN4AaABAg', 'snippet': {'videoId': 'XC8FiLhsJSo', 'textDisplay': 'Band News escondendo informações', 'textOriginal': 'Band News escondendo informações', 'authorDisplayName': 'ha Ha ha !', 'authorProfileImageUrl': 'https://yt3.ggpht.com/ENzqGzeIu9Nb-U0KIDyoz3Mb1RKYNaKn61mjALIOrn_v706iwkcZTXJnrAQD-7dnLwRdSs8d=s48-c-k-c0x00ffffff-no-rj', 'authorChannelUrl': 'http://www.youtube.com/channel/UCgJSdN2eMjex7Farno-pw1g', 'authorChannelId': {'value': 'UCgJSdN2eMjex7Farno-pw1g'}, 'canRate': True, 'viewerRating': 'none', 'likeCount': 0, 'publishedAt': '2022-10-26T16:53:01Z', 'updatedAt': '2022-10-26T16:53:01Z'}}, 'canReply': True, 'totalReplyCount': 0, 'isPublic': True}",,UCgJSdN2eMjex7Farno-pw1g,2022-10-26T16:53:01Z,Band News escondendo informações,,2023-06-07 23:49:22.582146
youtube#commentThread,K7d9WKNJlvWXjDuK3L_MbOdKGac,UgzJMx7QQQFjjQ2sODl4AaABAg,"{'videoId': 'XC8FiLhsJSo', 'topLevelComment': {'kind': 'youtube#comment', 'etag': 'EuEezCKO715nR17zRBQKc1Ou_AM', 'id': 'UgzJMx7QQQFjjQ2sODl4AaABAg', 'snippet': {'videoId': 'XC8FiLhsJSo', 'textDisplay': 'A exoneração do funcionário responsável por esta área é um etestado incontestável da culpa e erro dos bandidos à frente do T S E.<br>Requer ação imediata do exército!', 'textOriginal': 'A exoneração do funcionário responsável por esta área é um etestado incontestável da culpa e erro dos bandidos à frente do T S E.\\nRequer ação imediata do exército!', 'authorDisplayName': 'Ivan Anjos', 'authorProfileImageUrl': 'https://yt3.ggpht.com/ytc/AGIKgqPL_Q3L_Qri5cDXZE8R0D37z3QMs0yJsLdkFvgcHA=s48-c-k-c0x00ffffff-no-rj', 'authorChannelUrl': 'http://www.youtube.com/channel/UC2HvcKRQo1TMqD70ukEh3eQ', 'authorChannelId': {'value': 'UC2HvcKRQo1TMqD70ukEh3eQ'}, 'canRate': True, 'viewerRating': 'none', 'likeCount': 2, 'publishedAt': '2022-10-26T16:52:53Z', 'updatedAt': '2022-10-26T16:52:53Z'}}, 'canReply': True, 'totalReplyCount': 0, 'isPublic': True}",,UC2HvcKRQo1TMqD70ukEh3eQ,2022-10-26T16:52:53Z,"A exoneração do funcionário responsável por esta área é um etestado incontestável da culpa e erro dos bandidos à frente do T S E.
Requer ação imediata do exército!",,2023-06-07 23:49:22.582146
youtube#commentThread,qZLwn0dlDEX_7GMXAUFJ_cAt0gQ,Ugz44Vpe-Jn3si0ywj94AaABAg,"{'videoId': 'XC8FiLhsJSo', 'topLevelComment': {'kind': 'youtube#comment', 'etag': '1nP-0vdf1IKLDkHlh7-16U9_Wkc', 'id': 'Ugz44Vpe-Jn3si0ywj94AaABAg', 'snippet': {'videoId': 'XC8FiLhsJSo', 'textDisplay': 'Prezado eleitor: relatório forjado e tentativas frustradas para admitir o inevitável.A campanha do atual presidente definitivamente chegou ao fim! <br>Daremos as respostas nas urnas!', 'textOriginal': 'Prezado eleitor: relatório forjado e tentativas frustradas para admitir o inevitável.A campanha do atual presidente definitivamente chegou ao fim! \\nDaremos as respostas nas urnas!', 'authorDisplayName': 'Suany', 'authorProfileImageUrl': 'https://yt3.ggpht.com/NWV2G9RU9EU-e87ksU7JugzdwT-4aM_Pq8vsD7Nfqvm9eu6hU1ILoA5q3CLkhX4fiQZxEfQVxA=s48-c-k-c0x00ffffff-no-rj', 'authorChannelUrl': 'http://www.youtube.com/channel/UCwhBDLwt92-ZAeODlp7-vqw', 'authorChannelId': {'value': 'UCwhBDLwt92-ZAeODlp7-vqw'}, 'canRate': True, 'viewerRating': 'none', 'likeCount': 1, 'publishedAt': '2022-10-26T16:50:35Z', 'updatedAt': '2022-10-26T16:50:35Z'}}, 'canReply': True, 'totalReplyCount': 0, 'isPublic': True}",,UCwhBDLwt92-ZAeODlp7-vqw,2022-10-26T16:50:35Z,"Prezado eleitor: relatório forjado e tentativas frustradas para admitir o inevitável.A campanha do atual presidente definitivamente chegou ao fim! 
Daremos as respostas nas urnas!",,2023-06-07 23:49:22.582146
youtube#commentThread,CSTxR9P1Y4QTCoLrjBNM5Gr0wYs,Ugzor_nTFZJW0UDfwqV4AaABAg,"{'videoId': 'XC8FiLhsJSo', 'topLevelComment': {'kind': 'youtube#comment', 'etag': 'cblgQCTgZHphQKeFJ6J99aFJkd8', 'id': 'Ugzor_nTFZJW0UDfwqV4AaABAg', 'snippet': {'videoId': 'XC8FiLhsJSo', 'textDisplay': 'RADIOLÃO DO PT, &quot;prejuízo incalculável&quot;, só faltava essa!', 'textOriginal': 'RADIOLÃO DO PT, ""prejuízo incalculável"", só faltava essa!', 'authorDisplayName': 'Mauricio Saraiva', 'authorProfileImageUrl': 'https://yt3.ggpht.com/ytc/AGIKgqNJFE2D3t09DrrVlXp9R1qHrPyg8Vhr6lU0rbdCXQ=s48-c-k-c0x00ffffff-no-rj', 'authorChannelUrl': 'http://www.youtube.com/channel/UCHFuOpYOLZAORniFVVZEiRA', 'authorChannelId': {'value': 'UCHFuOpYOLZAORniFVVZEiRA'}, 'canRate': True, 'viewerRating': 'none', 'likeCount': 2, 'publishedAt': '2022-10-26T16:49:41Z', 'updatedAt': '2022-10-26T16:49:41Z'}}, 'canReply': True, 'totalReplyCount': 0, 'isPublic': True}",,UCHFuOpYOLZAORniFVVZEiRA,2022-10-26T16:49:41Z,"RADIOLÃO DO PT, ""prejuízo incalculável"", só faltava essa!",,2023-06-07 23:49:22.582146
youtube#commentThread,97Ndik55QZcgouJl3e8m5VbD-4s,Ugwbb5HPYb0r2k0QQgZ4AaABAg,"{'videoId': 'XC8FiLhsJSo', 'topLevelComment': {'kind': 'youtube#comment', 'etag': '8J5wHeSyK2R5g-en36Gv_ScbJNk', 'id': 'Ugwbb5HPYb0r2k0QQgZ4AaABAg', 'snippet': {'videoId': 'XC8FiLhsJSo', 'textDisplay': 'Onde estão os que acusam os apoiadores do PR de fake news dia e noite ? Onde estão', 'textOriginal': 'Onde estão os que acusam os apoiadores do PR de fake news dia e noite ? Onde estão', 'authorDisplayName': 'Emerson', 'authorProfileImageUrl': 'https://yt3.ggpht.com/ytc/AGIKgqNs3uZ_qWiQYe1gKJs3x8EZk5AiybMfL9f4EsvRQw=s48-c-k-c0x00ffffff-no-rj', 'authorChannelUrl': 'http://www.youtube.com/channel/UChIzLdV9bxVRX-JrTJGkjdg', 'authorChannelId': {'value': 'UChIzLdV9bxVRX-JrTJGkjdg'}, 'canRate': True, 'viewerRating': 'none', 'likeCount': 0, 'publishedAt': '2022-10-26T16:49:30Z', 'updatedAt': '2022-10-26T16:49:30Z'}}, 'canReply': True, 'totalReplyCount': 0, 'isPublic': True}",,UChIzLdV9bxVRX-JrTJGkjdg,2022-10-26T16:49:30Z,Onde estão os que acusam os apoiadores do PR de fake news dia e noite ? Onde estão,,2023-06-07 23:49:22.582146
youtube#commentThread,ow5Iu5e0ONNrZL4ZKZdN3B5Bg4g,UgxMZ1vNjWfm7PSU0dl4AaABAg,"{'videoId': 'XC8FiLhsJSo', 'topLevelComment': {'kind': 'youtube#comment', 'etag': 'q6RqfGNO2ngJYVe3noo27hCzlNc', 'id': 'UgxMZ1vNjWfm7PSU0dl4AaABAg', 'snippet': {'videoId': 'XC8FiLhsJSo', 'textDisplay': '🇧🇷 ✌️✌️', 'textOriginal': '🇧🇷 ✌️✌️', 'authorDisplayName': 'O Mensageiro', 'authorProfileImageUrl': 'https://yt3.ggpht.com/qYiimfle7bHkT0atuAzYGB3cTJpQYP2mIHsSynpywHw6CHPYCBsCOL0hQL_9PGXbGbu33BB-=s48-c-k-c0x00ffffff-no-rj', 'authorChannelUrl': 'http://www.youtube.com/channel/UChxAgUxMJ6skDQGt9F1kadA', 'authorChannelId': {'value': 'UChxAgUxMJ6skDQGt9F1kadA'}, 'canRate': True, 'viewerRating': 'none', 'likeCount': 1, 'publishedAt': '2022-10-26T16:46:44Z', 'updatedAt': '2022-10-26T16:46:44Z'}}, 'canReply': True, 'totalReplyCount': 0, 'isPublic': True}",,UChxAgUxMJ6skDQGt9F1kadA,2022-10-26T16:46:44Z,🇧🇷 ✌️✌️,,2023-06-07 23:49:22.582146
youtube#commentThread,fCUkuWih7tQg4SaizeaYeJtQdFs,UgwqQCMq9lljkoT436h4AaABAg,"{'videoId': 'XC8FiLhsJSo', 'topLevelComment': {'kind': 'youtube#comment', 'etag': '0wCELnGcaZoBVlQVqzyUtmJmGAQ', 'id': 'UgwqQCMq9lljkoT436h4AaABAg', 'snippet': {'videoId': 'XC8FiLhsJSo', 'textDisplay': 'Esta eleição deveria ser adiada pq  com certeza vai prejudicar um dos candidatos,  sou contra todas as trapaças na corrida eleitoral , jogos etc,  seja de qual lado for ninguém pode se beneficiado.. adiar as eleições se faz necessário.', 'textOriginal': 'Esta eleição deveria ser adiada pq  com certeza vai prejudicar um dos candidatos,  sou contra todas as trapaças na corrida eleitoral , jogos etc,  seja de qual lado for ninguém pode se beneficiado.. adiar as eleições se faz necessário.', 'authorDisplayName': 'ROBERTO GABRIEL ZACARIAS', 'authorProfileImageUrl': 'https://yt3.ggpht.com/Csi8N5v6DY4zYNfYAM5H6jcdNJoMlgdiArvSgXA2xbjK0MHcohWMMPJ-xqwCOmZirQOP49jyfg=s48-c-k-c0x00ffffff-no-rj', 'authorChannelUrl': 'http://www.youtube.com/channel/UCkE-XIBOL58-JVRP1dd0NUA', 'authorChannelId': {'value': 'UCkE-XIBOL58-JVRP1dd0NUA'}, 'canRate': True, 'viewerRating': 'none', 'likeCount': 0, 'publishedAt': '2022-10-26T16:46:28Z', 'updatedAt': '2022-10-26T16:46:28Z'}}, 'canReply': True, 'totalReplyCount': 0, 'isPublic': True}",,UCkE-XIBOL58-JVRP1dd0NUA,2022-10-26T16:46:28Z,"Esta eleição deveria ser adiada pq  com certeza vai prejudicar um dos candidatos,  sou contra todas as trapaças na corrida eleitoral , jogos etc,  seja de qual lado for ninguém pode se beneficiado.. adiar as eleições se faz necessário.",,2023-06-07 23:49:22.582146
youtube#commentThread,pNjt-7MC78B2nHnNkKydKGHbun8,UgzIe_nDAymRF2fDvyB4AaABAg,"{'videoId': 'XC8FiLhsJSo', 'topLevelComment': {'kind': 'youtube#comment', 'etag': 'Qybyrjyu6LNKVxHhjLW2Q4DZRxU', 'id': 'UgzIe_nDAymRF2fDvyB4AaABAg', 'snippet': {'videoId': 'XC8FiLhsJSo', 'textDisplay': 'Queriam relatório.. O relatório chega e nada. Kk.. O política brasileira.', 'textOriginal': 'Queriam relatório.. O relatório chega e nada. Kk.. O política brasileira.', 'authorDisplayName': 'ronair batista', 'authorProfileImageUrl': 'https://yt3.ggpht.com/ytc/AGIKgqNvw4SKAmZMt8MOkciUi6MyaFgq4Rr8I6min52kkA=s48-c-k-c0x00ffffff-no-rj', 'authorChannelUrl': 'http://www.youtube.com/channel/UCV2TmNASvys0RWR9hgfMeRQ', 'authorChannelId': {'value': 'UCV2TmNASvys0RWR9hgfMeRQ'}, 'canRate': True, 'viewerRating': 'none', 'likeCount': 2, 'publishedAt': '2022-10-26T16:45:05Z', 'updatedAt': '2022-10-26T16:45:05Z'}}, 'canReply': True, 'totalReplyCount': 0, 'isPublic': True}",,UCV2TmNASvys0RWR9hgfMeRQ,2022-10-26T16:45:05Z,Queriam relatório.. O relatório chega e nada. Kk.. O política brasileira.,,2023-06-07 23:49:22.582146
youtube#commentThread,wzcm5uq3qhjVOefoYqXdwKG5b3Y,UgxGJpzHtiVYn7dJ1B54AaABAg,"{'videoId': 'XC8FiLhsJSo', 'topLevelComment': {'kind': 'youtube#comment', 'etag': 'lj_4-OnD1ak303rGVNog2Hx5TkQ', 'id': 'UgxGJpzHtiVYn7dJ1B54AaABAg', 'snippet': {'videoId': 'XC8FiLhsJSo', 'textDisplay': 'É hora das forças armadas assumir a responsabilidade para que foi criada,ou seja,a defesa nacional,faça valer os vultosos salários que pagamos para que sejamos defendifos!', 'textOriginal': 'É hora das forças armadas assumir a responsabilidade para que foi criada,ou seja,a defesa nacional,faça valer os vultosos salários que pagamos para que sejamos defendifos!', 'authorDisplayName': 'Ivan Anjos', 'authorProfileImageUrl': 'https://yt3.ggpht.com/ytc/AGIKgqPL_Q3L_Qri5cDXZE8R0D37z3QMs0yJsLdkFvgcHA=s48-c-k-c0x00ffffff-no-rj', 'authorChannelUrl': 'http://www.youtube.com/channel/UC2HvcKRQo1TMqD70ukEh3eQ', 'authorChannelId': {'value': 'UC2HvcKRQo1TMqD70ukEh3eQ'}, 'canRate': True, 'viewerRating': 'none', 'likeCount': 3, 'publishedAt': '2022-10-26T16:43:31Z', 'updatedAt': '2022-10-26T16:43:31Z'}}, 'canReply': True, 'totalReplyCount': 0, 'isPublic': True}",,UC2HvcKRQo1TMqD70ukEh3eQ,2022-10-26T16:43:31Z,"É hora das forças armadas assumir a responsabilidade para que foi criada,ou seja,a defesa nacional,faça valer os vultosos salários que pagamos para que sejamos defendifos!",,2023-06-07 23:49:22.582146
youtube#commentThread,Grjng-FYt-JF61mD3_FK3rYNPmE,UgyLyeA1Mw1oYup60u14AaABAg,"{'videoId': 'XC8FiLhsJSo', 'topLevelComment': {'kind': 'youtube#comment', 'etag': 'W8QHdWD2pBg0FhL5LxIwaP6HHpo', 'id': 'UgyLyeA1Mw1oYup60u14AaABAg', 'snippet': {'videoId': 'XC8FiLhsJSo', 'textDisplay': 'Provas entregue! Receba', 'textOriginal': 'Provas entregue! Receba', 'authorDisplayName': 'O Mensageiro', 'authorProfileImageUrl': 'https://yt3.ggpht.com/qYiimfle7bHkT0atuAzYGB3cTJpQYP2mIHsSynpywHw6CHPYCBsCOL0hQL_9PGXbGbu33BB-=s48-c-k-c0x00ffffff-no-rj', 'authorChannelUrl': 'http://www.youtube.com/channel/UChxAgUxMJ6skDQGt9F1kadA', 'authorChannelId': {'value': 'UChxAgUxMJ6skDQGt9F1kadA'}, 'canRate': True, 'viewerRating': 'none', 'likeCount': 3, 'publishedAt': '2022-10-26T16:39:34Z', 'updatedAt': '2022-10-26T16:39:34Z'}}, 'canReply': True, 'totalReplyCount': 0, 'isPublic': True}",,UChxAgUxMJ6skDQGt9F1kadA,2022-10-26T16:39:34Z,Provas entregue! Receba,,2023-06-07 23:49:22.582146
youtube#commentThread,2Jn_VpvftcYO7i7xBjPadkVxeAo,UgwjarqWrItBObn2lDx4AaABAg,"{'videoId': 'XC8FiLhsJSo', 'topLevelComment': {'kind': 'youtube#comment', 'etag': 'jSoJkd9U-58XNrc2h95kQHESk7k', 'id': 'UgwjarqWrItBObn2lDx4AaABAg', 'snippet': {'videoId': 'XC8FiLhsJSo', 'textDisplay': 'É a maior fraude eleitoral da história.', 'textOriginal': 'É a maior fraude eleitoral da história.', 'authorDisplayName': 'amanda noleto', 'authorProfileImageUrl': 'https://yt3.ggpht.com/ytc/AGIKgqMDJNG7mwA9MDQ0vPzemsyzKUd6-v7tGBacJg=s48-c-k-c0x00ffffff-no-rj', 'authorChannelUrl': 'http://www.youtube.com/channel/UCIlz5387jaY_nWBxEa5Y4gA', 'authorChannelId': {'value': 'UCIlz5387jaY_nWBxEa5Y4gA'}, 'canRate': True, 'viewerRating': 'none', 'likeCount': 0, 'publishedAt': '2022-10-26T16:35:43Z', 'updatedAt': '2022-10-26T16:35:43Z'}}, 'canReply': True, 'totalReplyCount': 0, 'isPublic': True}",,UCIlz5387jaY_nWBxEa5Y4gA,2022-10-26T16:35:43Z,É a maior fraude eleitoral da história.,,2023-06-07 23:49:22.582146
youtube#commentThread,eUjGh4XCTDlLRG2gok-ktMtZOlU,UgyfmtHbHEy1Wx_h-2h4AaABAg,"{'videoId': 'XC8FiLhsJSo', 'topLevelComment': {'kind': 'youtube#comment', 'etag': 'SP6jCp7gaL275d-_exV1nXmNHQs', 'id': 'UgyfmtHbHEy1Wx_h-2h4AaABAg', 'snippet': {'videoId': 'XC8FiLhsJSo', 'textDisplay': 'Preferência vindo do TSE e não das rádios é o que se sabe até agora', 'textOriginal': 'Preferência vindo do TSE e não das rádios é o que se sabe até agora', 'authorDisplayName': 'JOSÉ AIRTON BOANOVA SILVEIRA', 'authorProfileImageUrl': 'https://yt3.ggpht.com/ytc/AGIKgqNkj5VWLN4CbubTCp93sI59rbDwkS_2oYroDqKh=s48-c-k-c0x00ffffff-no-rj', 'authorChannelUrl': 'http://www.youtube.com/channel/UChFlE-jG3KaCz6Zx5MpRi8A', 'authorChannelId': {'value': 'UChFlE-jG3KaCz6Zx5MpRi8A'}, 'canRate': True, 'viewerRating': 'none', 'likeCount': 7, 'publishedAt': '2022-10-26T16:34:57Z', 'updatedAt': '2022-10-26T16:34:57Z'}}, 'canReply': True, 'totalReplyCount': 0, 'isPublic': True}",,UChFlE-jG3KaCz6Zx5MpRi8A,2022-10-26T16:34:57Z,Preferência vindo do TSE e não das rádios é o que se sabe até agora,,2023-06-07 23:49:22.582146
youtube#commentThread,q-Dq0Ed2VLuOEYEIazn1WL97MFQ,UgwhIXF2FGQ4gZrNY_B4AaABAg,"{'videoId': 'XC8FiLhsJSo', 'topLevelComment': {'kind': 'youtube#comment', 'etag': 'dYYYZfONY-hzo8WBSHc9ltxFhzg', 'id': 'UgwhIXF2FGQ4gZrNY_B4AaABAg', 'snippet': {'videoId': 'XC8FiLhsJSo', 'textDisplay': 'Isso é   serio se fosse ao contrario o senhor do partido do Pt  ja teria tido um  trosso', 'textOriginal': 'Isso é   serio se fosse ao contrario o senhor do partido do Pt  ja teria tido um  trosso', 'authorDisplayName': 'silva henrique', 'authorProfileImageUrl': 'https://yt3.ggpht.com/ytc/AGIKgqOcegrfW-sMLTaKsH2LXh8NQCBoXquxWkFFkAOlY4gflGwiCA1Zv-Djf4T3eWNV=s48-c-k-c0x00ffffff-no-rj', 'authorChannelUrl': 'http://www.youtube.com/channel/UC-UQw9cPaR8IAYmo-NZAdvA', 'authorChannelId': {'value': 'UC-UQw9cPaR8IAYmo-NZAdvA'}, 'canRate': True, 'viewerRating': 'none', 'likeCount': 4, 'publishedAt': '2022-10-26T16:33:58Z', 'updatedAt': '2022-10-26T16:33:58Z'}}, 'canReply': True, 'totalReplyCount': 1, 'isPublic': True}","{'comments': [{'kind': 'youtube#comment', 'etag': 'GxemoEvE4ivLDN8hiXY1Pw345Nc', 'id': 'UgwhIXF2FGQ4gZrNY_B4AaABAg.9heGgwXvoKH9heHBHmlE0j', 'snippet': {'videoId': 'XC8FiLhsJSo', 'textDisplay': 'Mais nao acontece , nada porque foi  com o Bosonario se fosse com  o outro aí  o bicho pegava', 'textOriginal': 'Mais nao acontece , nada porque foi  com o Bosonario se fosse com  o outro aí  o bicho pegava', 'parentId': 'UgwhIXF2FGQ4gZrNY_B4AaABAg', 'authorDisplayName': 'silva henrique', 'authorProfileImageUrl': 'https://yt3.ggpht.com/ytc/AGIKgqOcegrfW-sMLTaKsH2LXh8NQCBoXquxWkFFkAOlY4gflGwiCA1Zv-Djf4T3eWNV=s48-c-k-c0x00ffffff-no-rj', 'authorChannelUrl': 'http://www.youtube.com/channel/UC-UQw9cPaR8IAYmo-NZAdvA', 'authorChannelId': {'value': 'UC-UQw9cPaR8IAYmo-NZAdvA'}, 'canRate': True, 'viewerRating': 'none', 'likeCount': 0, 'publishedAt': '2022-10-26T16:38:15Z', 'updatedAt': '2022-10-26T16:38:15Z'}}]}",UC-UQw9cPaR8IAYmo-NZAdvA,2022-10-26T16:33:58Z,Isso é   serio se fosse ao contrario o senhor do partido do Pt  ja teria tido um  trosso,,2023-06-07 23:49:22.582146
youtube#commentThread,nOVH3FtCcJ3-SwhYARUpEu8wL-E,Ugy9tGKKMpJkan6Ut2h4AaABAg,"{'videoId': 'XC8FiLhsJSo', 'topLevelComment': {'kind': 'youtube#comment', 'etag': 'IluyFB8rTkIf-NJLE7LRvc9vErs', 'id': 'Ugy9tGKKMpJkan6Ut2h4AaABAg', 'snippet': {'videoId': 'XC8FiLhsJSo', 'textDisplay': 'Este abuso já vem acontecendo por muito tempo', 'textOriginal': 'Este abuso já vem acontecendo por muito tempo', 'authorDisplayName': 'Adailva Tinek', 'authorProfileImageUrl': 'https://yt3.ggpht.com/ytc/AGIKgqO3eT-u96qTFWylAauLwgYsSnYXI-1sClHQXQ=s48-c-k-c0x00ffffff-no-rj', 'authorChannelUrl': 'http://www.youtube.com/channel/UCJoRKKvWZ7KHhjvgCRA0SpQ', 'authorChannelId': {'value': 'UCJoRKKvWZ7KHhjvgCRA0SpQ'}, 'canRate': True, 'viewerRating': 'none', 'likeCount': 8, 'publishedAt': '2022-10-26T16:31:20Z', 'updatedAt': '2022-10-26T16:31:20Z'}}, 'canReply': True, 'totalReplyCount': 2, 'isPublic': True}","{'comments': [{'kind': 'youtube#comment', 'etag': 'WGGumdUzuJZVwA4D_t7Sy7lvM9w', 'id': 'Ugy9tGKKMpJkan6Ut2h4AaABAg.9heGOitfAzw9heHu0P2Vwg', 'snippet': {'videoId': 'XC8FiLhsJSo', 'textDisplay': 'Até a &quot;justiça&quot; do Brazil tem um lado, a esquerda!', 'textOriginal': 'Até a ""justiça"" do Brazil tem um lado, a esquerda!', 'parentId': 'Ugy9tGKKMpJkan6Ut2h4AaABAg', 'authorDisplayName': 'O Mensageiro', 'authorProfileImageUrl': 'https://yt3.ggpht.com/qYiimfle7bHkT0atuAzYGB3cTJpQYP2mIHsSynpywHw6CHPYCBsCOL0hQL_9PGXbGbu33BB-=s48-c-k-c0x00ffffff-no-rj', 'authorChannelUrl': 'http://www.youtube.com/channel/UChxAgUxMJ6skDQGt9F1kadA', 'authorChannelId': {'value': 'UChxAgUxMJ6skDQGt9F1kadA'}, 'canRate': True, 'viewerRating': 'none', 'likeCount': 0, 'publishedAt': '2022-10-26T16:44:29Z', 'updatedAt': '2022-10-26T16:44:29Z'}}, {'kind': 'youtube#comment', 'etag': 'b9j5YmINdMWAoIWHUr34HPp17TA', 'id': 'Ugy9tGKKMpJkan6Ut2h4AaABAg.9heGOitfAzw9heHSEmQZef', 'snippet': {'videoId': 'XC8FiLhsJSo', 'textDisplay': 'Mas não tem justiça no Brazil, esse é o motivo desses abusos já está acontecendo faz tempo kkkk', 'textOriginal': 'Mas não tem justiça no Brazil, esse é o motivo desses abusos já está acontecendo faz tempo kkkk', 'parentId': 'Ugy9tGKKMpJkan6Ut2h4AaABAg', 'authorDisplayName': 'O Mensageiro', 'authorProfileImageUrl': 'https://yt3.ggpht.com/qYiimfle7bHkT0atuAzYGB3cTJpQYP2mIHsSynpywHw6CHPYCBsCOL0hQL_9PGXbGbu33BB-=s48-c-k-c0x00ffffff-no-rj', 'authorChannelUrl': 'http://www.youtube.com/channel/UChxAgUxMJ6skDQGt9F1kadA', 'authorChannelId': {'value': 'UChxAgUxMJ6skDQGt9F1kadA'}, 'canRate': True, 'viewerRating': 'none', 'likeCount': 0, 'publishedAt': '2022-10-26T16:40:33Z', 'updatedAt': '2022-10-26T16:42:37Z'}}]}",UCJoRKKvWZ7KHhjvgCRA0SpQ,2022-10-26T16:31:20Z,Este abuso já vem acontecendo por muito tempo,,2023-06-07 23:49:22.582146
youtube#commentThread,H7lUzpdgZhCoddhJ6TPbXhZntnc,Ugygn7g4J6jH5ggnDIZ4AaABAg,"{'videoId': 'XC8FiLhsJSo', 'topLevelComment': {'kind': 'youtube#comment', 'etag': '3jS93y_02fomaJkwXIL5_ADf844', 'id': 'Ugygn7g4J6jH5ggnDIZ4AaABAg', 'snippet': {'videoId': 'XC8FiLhsJSo', 'textDisplay': 'Votei em Tebet, ia anular meu voto, mas vou de Bolsonaro mesmo!', 'textOriginal': 'Votei em Tebet, ia anular meu voto, mas vou de Bolsonaro mesmo!', 'authorDisplayName': 'jjj Albuquerque', 'authorProfileImageUrl': 'https://yt3.ggpht.com/ytc/AGIKgqOEuT_6GRTQ0MRnIC_RSuZ3EMDLXz_37Y1K9g=s48-c-k-c0x00ffffff-no-rj', 'authorChannelUrl': 'http://www.youtube.com/channel/UCF5g7bMP_9FIVgxuKjtwiCQ', 'authorChannelId': {'value': 'UCF5g7bMP_9FIVgxuKjtwiCQ'}, 'canRate': True, 'viewerRating': 'none', 'likeCount': 8, 'publishedAt': '2022-10-26T16:30:18Z', 'updatedAt': '2022-10-26T16:30:18Z'}}, 'canReply': True, 'totalReplyCount': 3, 'isPublic': True}","{'comments': [{'kind': 'youtube#comment', 'etag': '6ou3UgByixzIXWKixDohv0TqsxY', 'id': 'Ugygn7g4J6jH5ggnDIZ4AaABAg.9heGH6MDyMD9heJdCAxGCt', 'snippet': {'videoId': 'XC8FiLhsJSo', 'textDisplay': 'Vamos de 22 para Brasil melhor', 'textOriginal': 'Vamos de 22 para Brasil melhor', 'parentId': 'Ugygn7g4J6jH5ggnDIZ4AaABAg', 'authorDisplayName': 'Dhionatas Martins', 'authorProfileImageUrl': 'https://yt3.ggpht.com/ytc/AGIKgqO9n1FAWIW2MTY_7JqW4GFrzdkRsTk_MMvlIg=s48-c-k-c0x00ffffff-no-rj', 'authorChannelUrl': 'http://www.youtube.com/channel/UCX0nXtaEpcHwbEa7Yi31yNQ', 'authorChannelId': {'value': 'UCX0nXtaEpcHwbEa7Yi31yNQ'}, 'canRate': True, 'viewerRating': 'none', 'likeCount': 1, 'publishedAt': '2022-10-26T16:59:40Z', 'updatedAt': '2022-10-26T16:59:40Z'}}, {'kind': 'youtube#comment', 'etag': 'ON8ezKVgtg6r4ZZZRqxmqbSvkbs', 'id': 'Ugygn7g4J6jH5ggnDIZ4AaABAg.9heGH6MDyMD9heI_aEcnwE', 'snippet': {'videoId': 'XC8FiLhsJSo', 'textDisplay': 'Obrigado , você está vendo a realidade .', 'textOriginal': 'Obrigado , você está vendo a realidade .', 'parentId': 'Ugygn7g4J6jH5ggnDIZ4AaABAg', 'authorDisplayName': 'Emerson', 'authorProfileImageUrl': 'https://yt3.ggpht.com/ytc/AGIKgqNs3uZ_qWiQYe1gKJs3x8EZk5AiybMfL9f4EsvRQw=s48-c-k-c0x00ffffff-no-rj', 'authorChannelUrl': 'http://www.youtube.com/channel/UChIzLdV9bxVRX-JrTJGkjdg', 'authorChannelId': {'value': 'UChIzLdV9bxVRX-JrTJGkjdg'}, 'canRate': True, 'viewerRating': 'none', 'likeCount': 0, 'publishedAt': '2022-10-26T16:50:26Z', 'updatedAt': '2022-10-26T16:50:26Z'}}, {'kind': 'youtube#comment', 'etag': 'dRDep3jUgTubgBpex94-tcaU2-8', 'id': 'Ugygn7g4J6jH5ggnDIZ4AaABAg.9heGH6MDyMD9heHX1Q5I7u', 'snippet': {'videoId': 'XC8FiLhsJSo', 'textDisplay': 'KKKKKK 😂 BOA PIADA', 'textOriginal': 'KKKKKK 😂 BOA PIADA', 'parentId': 'Ugygn7g4J6jH5ggnDIZ4AaABAg', 'authorDisplayName': 'LARANJA  MIX BRASIL🍊🇧🇷', 'authorProfileImageUrl': 'https://yt3.ggpht.com/Hc5jUmA-w1g9_lIQFqgvKZqMj54XkypSzOczilG6VDwRofYusBOx5dwqtUh-dTSY_yw-KyD-ig=s48-c-k-c0x00ffffff-no-rj', 'authorChannelUrl': 'http://www.youtube.com/channel/UCqCXQ-x2wNFbJgCt7F689xQ', 'authorChannelId': {'value': 'UCqCXQ-x2wNFbJgCt7F689xQ'}, 'canRate': True, 'viewerRating': 'none', 'likeCount': 0, 'publishedAt': '2022-10-26T16:41:13Z', 'updatedAt': '2022-10-26T16:41:13Z'}}]}",UCF5g7bMP_9FIVgxuKjtwiCQ,2022-10-26T16:30:18Z,"Votei em Tebet, ia anular meu voto, mas vou de Bolsonaro mesmo!",,2023-06-07 23:49:22.582146
youtube#commentThread,IZKyepTinRxsscYVvR2FtR3482w,Ugy7cCMBTIPKfKdUsrN4AaABAg,"{'videoId': 'XC8FiLhsJSo', 'topLevelComment': {'kind': 'youtube#comment', 'etag': 'vq49o-1vK24-AjZGdU2dwL52jKk', 'id': 'Ugy7cCMBTIPKfKdUsrN4AaABAg', 'snippet': {'videoId': 'XC8FiLhsJSo', 'textDisplay': 'É O PRESIDENTE BOLSONARO E AS FFAAS, DENTRO DAS QUATRO LINHAS', 'textOriginal': 'É O PRESIDENTE BOLSONARO E AS FFAAS, DENTRO DAS QUATRO LINHAS', 'authorDisplayName': 'Gilmar Moreira', 'authorProfileImageUrl': 'https://yt3.ggpht.com/ytc/AGIKgqM8B7y96f70l1VC_PBFGlsOibmkcfrk2Y6SDA=s48-c-k-c0x00ffffff-no-rj', 'authorChannelUrl': 'http://www.youtube.com/channel/UCPQcsszWFtR39_D3TKsyT9g', 'authorChannelId': {'value': 'UCPQcsszWFtR39_D3TKsyT9g'}, 'canRate': True, 'viewerRating': 'none', 'likeCount': 1, 'publishedAt': '2022-10-26T16:27:16Z', 'updatedAt': '2022-10-26T16:27:16Z'}}, 'canReply': True, 'totalReplyCount': 0, 'isPublic': True}",,UCPQcsszWFtR39_D3TKsyT9g,2022-10-26T16:27:16Z,"É O PRESIDENTE BOLSONARO E AS FFAAS, DENTRO DAS QUATRO LINHAS",,2023-06-07 23:49:22.582146
