kind,etag,id,snippet,replies,authorChannelId,publishedAt,textOriginal,nextPageToken,extraction_date
youtube#commentThread,03n-12xvQnp9ydd8vGrVKaP09k8,UgwmZoTddz9ApspX9et4AaABAg,"{'videoId': 'cTbA9l1C6ao', 'topLevelComment': {'kind': 'youtube#comment', 'etag': 'yJZbPjBNKQ8HAxwMFnMWmaJl-ZI', 'id': 'UgwmZoTddz9ApspX9et4AaABAg', 'snippet': {'videoId': 'cTbA9l1C6ao', 'textDisplay': 'MINISTÉRIO PÚBLICO ELEITORAL???   ONDE ESTÁ O FISCAL DA LEI?', 'textOriginal': 'MINISTÉRIO PÚBLICO ELEITORAL???   ONDE ESTÁ O FISCAL DA LEI?', 'authorDisplayName': 'Sonia Paiva', 'authorProfileImageUrl': 'https://yt3.ggpht.com/ytc/AGIKgqNSjSrsQikGXjS8yih0k_HpEBR7aHUEA4gxdQ=s48-c-k-c0x00ffffff-no-rj', 'authorChannelUrl': 'http://www.youtube.com/channel/UCqRnh-_DUCdCE7vQHbN4sEQ', 'authorChannelId': {'value': 'UCqRnh-_DUCdCE7vQHbN4sEQ'}, 'canRate': True, 'viewerRating': 'none', 'likeCount': 2, 'publishedAt': '2022-10-20T23:19:49Z', 'updatedAt': '2022-10-20T23:19:49Z'}}, 'canReply': True, 'totalReplyCount': 0, 'isPublic': True}",,UCqRnh-_DUCdCE7vQHbN4sEQ,2022-10-20T23:19:49Z,MINISTÉRIO PÚBLICO ELEITORAL???   ONDE ESTÁ O FISCAL DA LEI?,QURTSl9pMXlLSWZlZ0U3NTJZTXZzOXpqdFpPZGwwVzVyNE52cFRpTUM4X2FweDZLMldwQzAxVF9KdDJYczlycTliWjZ5YjMwbU1mRm9OYS1lNnpUTm00Mk1QLTNQQmZC,2023-06-08 12:58:41.765434
youtube#commentThread,C7Z1Yj_xyXzQXJ5hSDkn1qxCRa0,UgwLBSMhQC4TRFtTGYJ4AaABAg,"{'videoId': 'cTbA9l1C6ao', 'topLevelComment': {'kind': 'youtube#comment', 'etag': 'KVEJb_IAO271rLpXy1LS90Mgm1g', 'id': 'UgwLBSMhQC4TRFtTGYJ4AaABAg', 'snippet': {'videoId': 'cTbA9l1C6ao', 'textDisplay': 'A que ponto chegou a falta de respeito ao povo.  Qual a justificativa para censura prévia?  Sabemos que deve ser o poder, pois não existe motivo para tantos absurdos , não só do STF, mas também do STE.', 'textOriginal': 'A que ponto chegou a falta de respeito ao povo.  Qual a justificativa para censura prévia?  Sabemos que deve ser o poder, pois não existe motivo para tantos absurdos , não só do STF, mas também do STE.', 'authorDisplayName': 'Nelson Lima De Oliveira', 'authorProfileImageUrl': 'https://yt3.ggpht.com/ytc/AGIKgqNYXsHuk2fjNcPeHc-8Au8ETwy9fPgnt_hGiw=s48-c-k-c0x00ffffff-no-rj', 'authorChannelUrl': 'http://www.youtube.com/channel/UCWcdsbvshbIsaNArnrE9ogg', 'authorChannelId': {'value': 'UCWcdsbvshbIsaNArnrE9ogg'}, 'canRate': True, 'viewerRating': 'none', 'likeCount': 25, 'publishedAt': '2022-10-20T23:19:46Z', 'updatedAt': '2022-10-21T21:24:55Z'}}, 'canReply': True, 'totalReplyCount': 0, 'isPublic': True}",,UCWcdsbvshbIsaNArnrE9ogg,2022-10-20T23:19:46Z,"A que ponto chegou a falta de respeito ao povo.  Qual a justificativa para censura prévia?  Sabemos que deve ser o poder, pois não existe motivo para tantos absurdos , não só do STF, mas também do STE.",QURTSl9pMXlLSWZlZ0U3NTJZTXZzOXpqdFpPZGwwVzVyNE52cFRpTUM4X2FweDZLMldwQzAxVF9KdDJYczlycTliWjZ5YjMwbU1mRm9OYS1lNnpUTm00Mk1QLTNQQmZC,2023-06-08 12:58:41.765434
youtube#commentThread,aUlsMVSKgyiJbn4BvggiuueAlXA,UgyzL8tZYzEb7dnv9Zx4AaABAg,"{'videoId': 'cTbA9l1C6ao', 'topLevelComment': {'kind': 'youtube#comment', 'etag': 'mcg_uMisr22hR9ZcDJtL_i3xtUo', 'id': 'UgyzL8tZYzEb7dnv9Zx4AaABAg', 'snippet': {'videoId': 'cTbA9l1C6ao', 'textDisplay': 'Na verdade eles já elegeram o Peixe ao tirar da Cadeia', 'textOriginal': 'Na verdade eles já elegeram o Peixe ao tirar da Cadeia', 'authorDisplayName': 'Maria Lourdes', 'authorProfileImageUrl': 'https://yt3.ggpht.com/ytc/AGIKgqP3TAhksG8ixoVNTv-8nTqqF3yYc5ASxgGQEA=s48-c-k-c0x00ffffff-no-rj', 'authorChannelUrl': 'http://www.youtube.com/channel/UCcmiGQrgbF5hiecgpc08Pzw', 'authorChannelId': {'value': 'UCcmiGQrgbF5hiecgpc08Pzw'}, 'canRate': True, 'viewerRating': 'none', 'likeCount': 2, 'publishedAt': '2022-10-20T23:19:27Z', 'updatedAt': '2022-10-20T23:19:27Z'}}, 'canReply': True, 'totalReplyCount': 0, 'isPublic': True}",,UCcmiGQrgbF5hiecgpc08Pzw,2022-10-20T23:19:27Z,Na verdade eles já elegeram o Peixe ao tirar da Cadeia,QURTSl9pMXlLSWZlZ0U3NTJZTXZzOXpqdFpPZGwwVzVyNE52cFRpTUM4X2FweDZLMldwQzAxVF9KdDJYczlycTliWjZ5YjMwbU1mRm9OYS1lNnpUTm00Mk1QLTNQQmZC,2023-06-08 12:58:41.765434
youtube#commentThread,rWzOsBcbN7n-0MNiL5IHwo_oSDs,UgwnAT9PLxWtpvBXhsp4AaABAg,"{'videoId': 'cTbA9l1C6ao', 'topLevelComment': {'kind': 'youtube#comment', 'etag': 'ZOuXrhSmYDb-KCeZxHZ5oaqKNoQ', 'id': 'UgwnAT9PLxWtpvBXhsp4AaABAg', 'snippet': {'videoId': 'cTbA9l1C6ao', 'textDisplay': 'Bolsonaro bate o Recorde de Lula com 1.300 mil ao vivo e 969 mil likes  menos de 30 minutos.', 'textOriginal': 'Bolsonaro bate o Recorde de Lula com 1.300 mil ao vivo e 969 mil likes  menos de 30 minutos.', 'authorDisplayName': 'Paulooliveira Oliveira', 'authorProfileImageUrl': 'https://yt3.ggpht.com/dExzrN6Qn1uun0bNtgjqPL_nztDcNBLEZCF9sF99rT_ToqQoc9utOMSasPAbewfZ8TaV8NmgoQ=s48-c-k-c0x00ffffff-no-rj', 'authorChannelUrl': 'http://www.youtube.com/channel/UCGBH-WrKnaDbUGnwG6OV-7w', 'authorChannelId': {'value': 'UCGBH-WrKnaDbUGnwG6OV-7w'}, 'canRate': True, 'viewerRating': 'none', 'likeCount': 7, 'publishedAt': '2022-10-20T23:18:48Z', 'updatedAt': '2022-10-20T23:18:48Z'}}, 'canReply': True, 'totalReplyCount': 0, 'isPublic': True}",,UCGBH-WrKnaDbUGnwG6OV-7w,2022-10-20T23:18:48Z,Bolsonaro bate o Recorde de Lula com 1.300 mil ao vivo e 969 mil likes  menos de 30 minutos.,QURTSl9pMXlLSWZlZ0U3NTJZTXZzOXpqdFpPZGwwVzVyNE52cFRpTUM4X2FweDZLMldwQzAxVF9KdDJYczlycTliWjZ5YjMwbU1mRm9OYS1lNnpUTm00Mk1QLTNQQmZC,2023-06-08 12:58:41.765434
youtube#commentThread,gYG-wbfZs05uw7hSyZf53bjEH6Q,UgxO5UTijs7aHBGYHel4AaABAg,"{'videoId': 'cTbA9l1C6ao', 'topLevelComment': {'kind': 'youtube#comment', 'etag': '_KLNhymb7g3YMsDCoD1lcQbzRSI', 'id': 'UgxO5UTijs7aHBGYHel4AaABAg', 'snippet': {'videoId': 'cTbA9l1C6ao', 'textDisplay': 'Gente, relaxa quanto mais alto o vôo maior o tombo', 'textOriginal': 'Gente, relaxa quanto mais alto o vôo maior o tombo', 'authorDisplayName': 'Maria Lourdes', 'authorProfileImageUrl': 'https://yt3.ggpht.com/ytc/AGIKgqP3TAhksG8ixoVNTv-8nTqqF3yYc5ASxgGQEA=s48-c-k-c0x00ffffff-no-rj', 'authorChannelUrl': 'http://www.youtube.com/channel/UCcmiGQrgbF5hiecgpc08Pzw', 'authorChannelId': {'value': 'UCcmiGQrgbF5hiecgpc08Pzw'}, 'canRate': True, 'viewerRating': 'none', 'likeCount': 6, 'publishedAt': '2022-10-20T23:18:38Z', 'updatedAt': '2022-10-20T23:18:38Z'}}, 'canReply': True, 'totalReplyCount': 0, 'isPublic': True}",,UCcmiGQrgbF5hiecgpc08Pzw,2022-10-20T23:18:38Z,"Gente, relaxa quanto mais alto o vôo maior o tombo",QURTSl9pMXlLSWZlZ0U3NTJZTXZzOXpqdFpPZGwwVzVyNE52cFRpTUM4X2FweDZLMldwQzAxVF9KdDJYczlycTliWjZ5YjMwbU1mRm9OYS1lNnpUTm00Mk1QLTNQQmZC,2023-06-08 12:58:41.765434
youtube#commentThread,AgIQky1C1DMwxEJvKK9lerokBQk,Ugxd0F9BW_cseLMKTMp4AaABAg,"{'videoId': 'cTbA9l1C6ao', 'topLevelComment': {'kind': 'youtube#comment', 'etag': 'Y5Z1CNl7PjNtvGq7umzDSs_he40', 'id': 'Ugxd0F9BW_cseLMKTMp4AaABAg', 'snippet': {'videoId': 'cTbA9l1C6ao', 'textDisplay': 'CENSURA,  NUNCA MAIS!!', 'textOriginal': 'CENSURA,  NUNCA MAIS!!', 'authorDisplayName': 'Maria Ramos', 'authorProfileImageUrl': 'https://yt3.ggpht.com/ytc/AGIKgqNhXiJCXMfJgMEAQo9oKBVFBN_KZIbnAYxVRQ=s48-c-k-c0x00ffffff-no-rj', 'authorChannelUrl': 'http://www.youtube.com/channel/UCfY0L-WtPTf_3RggFPghk6w', 'authorChannelId': {'value': 'UCfY0L-WtPTf_3RggFPghk6w'}, 'canRate': True, 'viewerRating': 'none', 'likeCount': 9, 'publishedAt': '2022-10-20T23:18:32Z', 'updatedAt': '2022-10-20T23:18:32Z'}}, 'canReply': True, 'totalReplyCount': 0, 'isPublic': True}",,UCfY0L-WtPTf_3RggFPghk6w,2022-10-20T23:18:32Z,"CENSURA,  NUNCA MAIS!!",QURTSl9pMXlLSWZlZ0U3NTJZTXZzOXpqdFpPZGwwVzVyNE52cFRpTUM4X2FweDZLMldwQzAxVF9KdDJYczlycTliWjZ5YjMwbU1mRm9OYS1lNnpUTm00Mk1QLTNQQmZC,2023-06-08 12:58:41.765434
youtube#commentThread,DoJvXOtPs0Hd1C_wjDxNRz6Cdwg,UgzYcpsn57lFQSltL9h4AaABAg,"{'videoId': 'cTbA9l1C6ao', 'topLevelComment': {'kind': 'youtube#comment', 'etag': '0tX70eYfQW2srAxWKxAmw26P1OY', 'id': 'UgzYcpsn57lFQSltL9h4AaABAg', 'snippet': {'videoId': 'cTbA9l1C6ao', 'textDisplay': 'O problema e claro.... o CABEÇA DE OVO nao aparenta mais está DESESPERADO porque sabe que se o Bolsonaro renova a Presidencia, com a maioría na Camara, seu empichamento é fato.... Essa é a verdade', 'textOriginal': 'O problema e claro.... o CABEÇA DE OVO nao aparenta mais está DESESPERADO porque sabe que se o Bolsonaro renova a Presidencia, com a maioría na Camara, seu empichamento é fato.... Essa é a verdade', 'authorDisplayName': 'Pablo Souza', 'authorProfileImageUrl': 'https://yt3.ggpht.com/ytc/AGIKgqNAKcyfq4BuQ1ui5nSyyHX_Jkn8mLNc6mOfqwHK0g=s48-c-k-c0x00ffffff-no-rj', 'authorChannelUrl': 'http://www.youtube.com/channel/UCYGzCOBRv4VY8K3AmMHAWRw', 'authorChannelId': {'value': 'UCYGzCOBRv4VY8K3AmMHAWRw'}, 'canRate': True, 'viewerRating': 'none', 'likeCount': 1, 'publishedAt': '2022-10-20T23:17:44Z', 'updatedAt': '2022-10-20T23:17:44Z'}}, 'canReply': True, 'totalReplyCount': 0, 'isPublic': True}",,UCYGzCOBRv4VY8K3AmMHAWRw,2022-10-20T23:17:44Z,"O problema e claro.... o CABEÇA DE OVO nao aparenta mais está DESESPERADO porque sabe que se o Bolsonaro renova a Presidencia, com a maioría na Camara, seu empichamento é fato.... Essa é a verdade",QURTSl9pMXlLSWZlZ0U3NTJZTXZzOXpqdFpPZGwwVzVyNE52cFRpTUM4X2FweDZLMldwQzAxVF9KdDJYczlycTliWjZ5YjMwbU1mRm9OYS1lNnpUTm00Mk1QLTNQQmZC,2023-06-08 12:58:41.765434
youtube#commentThread,Qj9nbabnV3G1W-K0Q2vKCYa__bY,UgyTwYa229mRApkuuRp4AaABAg,"{'videoId': 'cTbA9l1C6ao', 'topLevelComment': {'kind': 'youtube#comment', 'etag': 'b_b6zJVsWu1P3eBoTPwa-XPkQr8', 'id': 'UgyTwYa229mRApkuuRp4AaABAg', 'snippet': {'videoId': 'cTbA9l1C6ao', 'textDisplay': 'Povo preocupado em comer picanha e cervejinha e não percebe que nossa liberdade está indo pro brejo', 'textOriginal': 'Povo preocupado em comer picanha e cervejinha e não percebe que nossa liberdade está indo pro brejo', 'authorDisplayName': 'Pedro Carlos Guimarães', 'authorProfileImageUrl': 'https://yt3.ggpht.com/_34HIDBpXXpC7w8AmNxHgi_Lyijq227J-gNlJVD38pnQma2aDEz1BEwkKrU_jUY-o4RNFDhv=s48-c-k-c0x00ffffff-no-rj', 'authorChannelUrl': 'http://www.youtube.com/channel/UCB8TxxgsDwpPYP4jaLR1Fvw', 'authorChannelId': {'value': 'UCB8TxxgsDwpPYP4jaLR1Fvw'}, 'canRate': True, 'viewerRating': 'none', 'likeCount': 5, 'publishedAt': '2022-10-20T23:17:14Z', 'updatedAt': '2022-10-20T23:17:14Z'}}, 'canReply': True, 'totalReplyCount': 1, 'isPublic': True}","{'comments': [{'kind': 'youtube#comment', 'etag': 'lpEJj7K4AYewCgL6U29GKXc3ML4', 'id': 'UgyTwYa229mRApkuuRp4AaABAg.9hQY4MEMF4d9hQcLMaZrIE', 'snippet': {'videoId': 'cTbA9l1C6ao', 'textDisplay': 'Só  tolos  acreditam nessa conversa  e os que  sempre  mamaram  acham  que  vão  continuar,  ignorantes  e ANTIPATRIOTAS.', 'textOriginal': 'Só  tolos  acreditam nessa conversa  e os que  sempre  mamaram  acham  que  vão  continuar,  ignorantes  e ANTIPATRIOTAS.', 'parentId': 'UgyTwYa229mRApkuuRp4AaABAg', 'authorDisplayName': 'Lucia M', 'authorProfileImageUrl': 'https://yt3.ggpht.com/ytc/AGIKgqMU-n3kS0D6NZ5Gzh6JdOH6t-Cc6IUjwcG2ag=s48-c-k-c0x00ffffff-no-rj', 'authorChannelUrl': 'http://www.youtube.com/channel/UCe6XEw06YdaxyeeyjgRmbhQ', 'authorChannelId': {'value': 'UCe6XEw06YdaxyeeyjgRmbhQ'}, 'canRate': True, 'viewerRating': 'none', 'likeCount': 0, 'publishedAt': '2022-10-21T00:03:15Z', 'updatedAt': '2022-10-21T00:03:57Z'}}]}",UCB8TxxgsDwpPYP4jaLR1Fvw,2022-10-20T23:17:14Z,Povo preocupado em comer picanha e cervejinha e não percebe que nossa liberdade está indo pro brejo,QURTSl9pMXlLSWZlZ0U3NTJZTXZzOXpqdFpPZGwwVzVyNE52cFRpTUM4X2FweDZLMldwQzAxVF9KdDJYczlycTliWjZ5YjMwbU1mRm9OYS1lNnpUTm00Mk1QLTNQQmZC,2023-06-08 12:58:41.765434
youtube#commentThread,RX2urKghGqZmgim5-Jux0kqNSHw,UgxMt3S07OTTIJ-J3Ox4AaABAg,"{'videoId': 'cTbA9l1C6ao', 'topLevelComment': {'kind': 'youtube#comment', 'etag': '58xCbndKHUmSm4sWFBkrIoVyQqo', 'id': 'UgxMt3S07OTTIJ-J3Ox4AaABAg', 'snippet': {'videoId': 'cTbA9l1C6ao', 'textDisplay': 'Deus está  no controle.  Não  tenham dúvidas!', 'textOriginal': 'Deus está  no controle.  Não  tenham dúvidas!', 'authorDisplayName': 'Edna Santos', 'authorProfileImageUrl': 'https://yt3.ggpht.com/ytc/AGIKgqNtBUiz5-N1KElmKSDlH-Hv6upans8CPA4YFA=s48-c-k-c0x00ffffff-no-rj', 'authorChannelUrl': 'http://www.youtube.com/channel/UCYFIsid9LOnlW-hIU5LDE2A', 'authorChannelId': {'value': 'UCYFIsid9LOnlW-hIU5LDE2A'}, 'canRate': True, 'viewerRating': 'none', 'likeCount': 17, 'publishedAt': '2022-10-20T23:17:13Z', 'updatedAt': '2022-10-20T23:17:13Z'}}, 'canReply': True, 'totalReplyCount': 0, 'isPublic': True}",,UCYFIsid9LOnlW-hIU5LDE2A,2022-10-20T23:17:13Z,Deus está  no controle.  Não  tenham dúvidas!,QURTSl9pMXlLSWZlZ0U3NTJZTXZzOXpqdFpPZGwwVzVyNE52cFRpTUM4X2FweDZLMldwQzAxVF9KdDJYczlycTliWjZ5YjMwbU1mRm9OYS1lNnpUTm00Mk1QLTNQQmZC,2023-06-08 12:58:41.765434
youtube#commentThread,LJ7Yqbzyszmww3dXp2CayQKIJwo,UgyKpLmRGiGhNuxXQjl4AaABAg,"{'videoId': 'cTbA9l1C6ao', 'topLevelComment': {'kind': 'youtube#comment', 'etag': '5zkyacymHPoXr96RB7g86k2M_Vg', 'id': 'UgyKpLmRGiGhNuxXQjl4AaABAg', 'snippet': {'videoId': 'cTbA9l1C6ao', 'textDisplay': 'Ainda temos liberdade para não gostar de qq coisa, e reclamar aqui na internet. Se em 2023 o ex presidiário desCONDENADO (TOMAR) as eleições, aí fud3u, ninguém vai poder reclamar de nada.', 'textOriginal': 'Ainda temos liberdade para não gostar de qq coisa, e reclamar aqui na internet. Se em 2023 o ex presidiário desCONDENADO (TOMAR) as eleições, aí fud3u, ninguém vai poder reclamar de nada.', 'authorDisplayName': 'André Luiz Melo', 'authorProfileImageUrl': 'https://yt3.ggpht.com/ytc/AGIKgqMcv0J4M_ltFaoTDtnFK8H0pFLVs2YFgPGQ0dZApw=s48-c-k-c0x00ffffff-no-rj', 'authorChannelUrl': 'http://www.youtube.com/channel/UC266fXpZFSCNiQMG0X4kKuQ', 'authorChannelId': {'value': 'UC266fXpZFSCNiQMG0X4kKuQ'}, 'canRate': True, 'viewerRating': 'none', 'likeCount': 0, 'publishedAt': '2022-10-20T23:16:24Z', 'updatedAt': '2022-10-20T23:16:24Z'}}, 'canReply': True, 'totalReplyCount': 0, 'isPublic': True}",,UC266fXpZFSCNiQMG0X4kKuQ,2022-10-20T23:16:24Z,"Ainda temos liberdade para não gostar de qq coisa, e reclamar aqui na internet. Se em 2023 o ex presidiário desCONDENADO (TOMAR) as eleições, aí fud3u, ninguém vai poder reclamar de nada.",QURTSl9pMXlLSWZlZ0U3NTJZTXZzOXpqdFpPZGwwVzVyNE52cFRpTUM4X2FweDZLMldwQzAxVF9KdDJYczlycTliWjZ5YjMwbU1mRm9OYS1lNnpUTm00Mk1QLTNQQmZC,2023-06-08 12:58:41.765434
youtube#commentThread,YgQQELfrG_XfpwcB5iYLmSGRiM0,UgyyV3fy0krO5LBA6R94AaABAg,"{'videoId': 'cTbA9l1C6ao', 'topLevelComment': {'kind': 'youtube#comment', 'etag': 'pB3ZN9oyShgEz7v-io6HKFmZ-BQ', 'id': 'UgyyV3fy0krO5LBA6R94AaABAg', 'snippet': {'videoId': 'cTbA9l1C6ao', 'textDisplay': 'Ajudem $ a Gazeta do Povo. A hora mais importante é agora.', 'textOriginal': 'Ajudem $ a Gazeta do Povo. A hora mais importante é agora.', 'authorDisplayName': 'Mr. MAC_BR', 'authorProfileImageUrl': 'https://yt3.ggpht.com/ytc/AGIKgqOxcqXdQT2cjTW1OMNmjH9P6Z7axJh_09oynErdYQ=s48-c-k-c0x00ffffff-no-rj', 'authorChannelUrl': 'http://www.youtube.com/channel/UCYJYvDO-8yxW1g5wiKS52GA', 'authorChannelId': {'value': 'UCYJYvDO-8yxW1g5wiKS52GA'}, 'canRate': True, 'viewerRating': 'none', 'likeCount': 24, 'publishedAt': '2022-10-20T23:15:36Z', 'updatedAt': '2022-10-20T23:15:36Z'}}, 'canReply': True, 'totalReplyCount': 0, 'isPublic': True}",,UCYJYvDO-8yxW1g5wiKS52GA,2022-10-20T23:15:36Z,Ajudem $ a Gazeta do Povo. A hora mais importante é agora.,QURTSl9pMXlLSWZlZ0U3NTJZTXZzOXpqdFpPZGwwVzVyNE52cFRpTUM4X2FweDZLMldwQzAxVF9KdDJYczlycTliWjZ5YjMwbU1mRm9OYS1lNnpUTm00Mk1QLTNQQmZC,2023-06-08 12:58:41.765434
youtube#commentThread,BE2FKHuKvExQ5X5CqabLDfFt5HA,UgxGeaC4IUSTEeG0o5p4AaABAg,"{'videoId': 'cTbA9l1C6ao', 'topLevelComment': {'kind': 'youtube#comment', 'etag': '1pc72z6bRado7yN1ZIYpahk-JGE', 'id': 'UgxGeaC4IUSTEeG0o5p4AaABAg', 'snippet': {'videoId': 'cTbA9l1C6ao', 'textDisplay': 'Vamos vencer acensura Bolsonaro neles', 'textOriginal': 'Vamos vencer acensura Bolsonaro neles', 'authorDisplayName': 'Naide Andrade', 'authorProfileImageUrl': 'https://yt3.ggpht.com/ytc/AGIKgqPXO2x5Z6JqQi0CfA1rlXS284CBS0Yw5zItCg=s48-c-k-c0x00ffffff-no-rj', 'authorChannelUrl': 'http://www.youtube.com/channel/UCM16Caty_kOMiVwpaLV7Nvg', 'authorChannelId': {'value': 'UCM16Caty_kOMiVwpaLV7Nvg'}, 'canRate': True, 'viewerRating': 'none', 'likeCount': 4, 'publishedAt': '2022-10-20T23:14:58Z', 'updatedAt': '2022-10-20T23:14:58Z'}}, 'canReply': True, 'totalReplyCount': 0, 'isPublic': True}",,UCM16Caty_kOMiVwpaLV7Nvg,2022-10-20T23:14:58Z,Vamos vencer acensura Bolsonaro neles,QURTSl9pMXlLSWZlZ0U3NTJZTXZzOXpqdFpPZGwwVzVyNE52cFRpTUM4X2FweDZLMldwQzAxVF9KdDJYczlycTliWjZ5YjMwbU1mRm9OYS1lNnpUTm00Mk1QLTNQQmZC,2023-06-08 12:58:41.765434
youtube#commentThread,tA5hMKaIWe-m47aEhcwWk2_sPYk,Ugx0TF4X88xEjDvaEl14AaABAg,"{'videoId': 'cTbA9l1C6ao', 'topLevelComment': {'kind': 'youtube#comment', 'etag': 'p6gFwWP1e9tdeFdENtmHb2kLKWc', 'id': 'Ugx0TF4X88xEjDvaEl14AaABAg', 'snippet': {'videoId': 'cTbA9l1C6ao', 'textDisplay': 'HEHEHE LULA ORDENOU AO BARROSO QUE NÃO SE COBREM PASSAGENS DE VOTDORES EM FVOR DO LULA, EM TODOS OS ONIBUS TEREMOS UM COBRADOR DE VOTOS NO LADRÃO LULA, HEHEHEH<br>VC OTARIO QUE NÃO IA VOTAR, AGORA TEM LADRÃO LULA E BARROSO COMPRNDO SEU VOTO, SE VC NÕ VOTAR EM LULA, VAI SE FODER, NÓS VAMOS TE FODER !', 'textOriginal': 'HEHEHE LULA ORDENOU AO BARROSO QUE NÃO SE COBREM PASSAGENS DE VOTDORES EM FVOR DO LULA, EM TODOS OS ONIBUS TEREMOS UM COBRADOR DE VOTOS NO LADRÃO LULA, HEHEHEH\\nVC OTARIO QUE NÃO IA VOTAR, AGORA TEM LADRÃO LULA E BARROSO COMPRNDO SEU VOTO, SE VC NÕ VOTAR EM LULA, VAI SE FODER, NÓS VAMOS TE FODER !', 'authorDisplayName': 'osmar osmar', 'authorProfileImageUrl': 'https://yt3.ggpht.com/ytc/AGIKgqNeVUa0h98e1RciPK1nXtBnE868-HzsUvcNtA=s48-c-k-c0x00ffffff-no-rj', 'authorChannelUrl': 'http://www.youtube.com/channel/UCZTdQFRivs0blj9ir8u4eZw', 'authorChannelId': {'value': 'UCZTdQFRivs0blj9ir8u4eZw'}, 'canRate': True, 'viewerRating': 'none', 'likeCount': 0, 'publishedAt': '2022-10-20T23:14:58Z', 'updatedAt': '2022-10-20T23:14:58Z'}}, 'canReply': True, 'totalReplyCount': 0, 'isPublic': True}",,UCZTdQFRivs0blj9ir8u4eZw,2022-10-20T23:14:58Z,"HEHEHE LULA ORDENOU AO BARROSO QUE NÃO SE COBREM PASSAGENS DE VOTDORES EM FVOR DO LULA, EM TODOS OS ONIBUS TEREMOS UM COBRADOR DE VOTOS NO LADRÃO LULA, HEHEHEH
VC OTARIO QUE NÃO IA VOTAR, AGORA TEM LADRÃO LULA E BARROSO COMPRNDO SEU VOTO, SE VC NÕ VOTAR EM LULA, VAI SE FODER, NÓS VAMOS TE FODER !",QURTSl9pMXlLSWZlZ0U3NTJZTXZzOXpqdFpPZGwwVzVyNE52cFRpTUM4X2FweDZLMldwQzAxVF9KdDJYczlycTliWjZ5YjMwbU1mRm9OYS1lNnpUTm00Mk1QLTNQQmZC,2023-06-08 12:58:41.765434
youtube#commentThread,dU4Ls5X_FH6x11hnS9x59im0JeQ,UgxmO8NdCkWab8zK6Yx4AaABAg,"{'videoId': 'cTbA9l1C6ao', 'topLevelComment': {'kind': 'youtube#comment', 'etag': 'QmIWpjoM476lXKJZTL1HyDNa6JY', 'id': 'UgxmO8NdCkWab8zK6Yx4AaABAg', 'snippet': {'videoId': 'cTbA9l1C6ao', 'textDisplay': 'Cadê o Ministério público!', 'textOriginal': 'Cadê o Ministério público!', 'authorDisplayName': 'jil   Toledo', 'authorProfileImageUrl': 'https://yt3.ggpht.com/LMcj-Rlr40FRaLMHHDdPWH4y6juzMAz_B0NMxVRq-caP6Zetm8FHwB0yQc1Ek3u-HnzHit3Xyw=s48-c-k-c0x00ffffff-no-rj', 'authorChannelUrl': 'http://www.youtube.com/channel/UCEwYrU_YbUbfuSu_1hTvNvA', 'authorChannelId': {'value': 'UCEwYrU_YbUbfuSu_1hTvNvA'}, 'canRate': True, 'viewerRating': 'none', 'likeCount': 7, 'publishedAt': '2022-10-20T23:14:53Z', 'updatedAt': '2022-10-20T23:14:53Z'}}, 'canReply': True, 'totalReplyCount': 0, 'isPublic': True}",,UCEwYrU_YbUbfuSu_1hTvNvA,2022-10-20T23:14:53Z,Cadê o Ministério público!,QURTSl9pMXlLSWZlZ0U3NTJZTXZzOXpqdFpPZGwwVzVyNE52cFRpTUM4X2FweDZLMldwQzAxVF9KdDJYczlycTliWjZ5YjMwbU1mRm9OYS1lNnpUTm00Mk1QLTNQQmZC,2023-06-08 12:58:41.765434
youtube#commentThread,HvLDO_pLArmR720t87Cm362ZIvc,UgzCZZIyN3rfnRWVVFh4AaABAg,"{'videoId': 'cTbA9l1C6ao', 'topLevelComment': {'kind': 'youtube#comment', 'etag': '59O6ErxDUEm2fTSiSQU6BTwSQhI', 'id': 'UgzCZZIyN3rfnRWVVFh4AaABAg', 'snippet': {'videoId': 'cTbA9l1C6ao', 'textDisplay': 'Votem no Presidente Bolsonaro <a href=""http://www.youtube.com/results?search_query=%23bolsonaro2022"">#Bolsonaro2022</a> 🇧🇷2️⃣2️⃣😃👍', 'textOriginal': 'Votem no Presidente Bolsonaro #Bolsonaro2022 🇧🇷2️⃣2️⃣😃👍', 'authorDisplayName': 'Paulo Henrique D.22 .', 'authorProfileImageUrl': 'https://yt3.ggpht.com/zu05Iei-d4JG09oPxqXKj0Iu_H6QYcYhUily-pE7R8k79PwbwGvRyI87q37JHyQhgjioB4NeHQ=s48-c-k-c0x00ffffff-no-rj', 'authorChannelUrl': 'http://www.youtube.com/channel/UCm6n9_vHONpeLPVcTg8S7gw', 'authorChannelId': {'value': 'UCm6n9_vHONpeLPVcTg8S7gw'}, 'canRate': True, 'viewerRating': 'none', 'likeCount': 0, 'publishedAt': '2022-10-20T23:14:31Z', 'updatedAt': '2022-10-20T23:14:31Z'}}, 'canReply': True, 'totalReplyCount': 0, 'isPublic': True}",,UCm6n9_vHONpeLPVcTg8S7gw,2022-10-20T23:14:31Z,Votem no Presidente Bolsonaro #Bolsonaro2022 🇧🇷2️⃣2️⃣😃👍,QURTSl9pMXlLSWZlZ0U3NTJZTXZzOXpqdFpPZGwwVzVyNE52cFRpTUM4X2FweDZLMldwQzAxVF9KdDJYczlycTliWjZ5YjMwbU1mRm9OYS1lNnpUTm00Mk1QLTNQQmZC,2023-06-08 12:58:41.765434
youtube#commentThread,eS68kkZ_X1c-ocR3niqRf_ERhJ8,UgwBbeXjejsa4ejr2VF4AaABAg,"{'videoId': 'cTbA9l1C6ao', 'topLevelComment': {'kind': 'youtube#comment', 'etag': '-NLFrIf6Vg-NCP5XGfhCyYi_kGY', 'id': 'UgwBbeXjejsa4ejr2VF4AaABAg', 'snippet': {'videoId': 'cTbA9l1C6ao', 'textDisplay': 'Está demorando muito para censura esses ministros malucos o que estamos esperando... o lula mentindo o tempo todo eles não fazem nada eles estão sendo mais corruptos do que o lula....', 'textOriginal': 'Está demorando muito para censura esses ministros malucos o que estamos esperando... o lula mentindo o tempo todo eles não fazem nada eles estão sendo mais corruptos do que o lula....', 'authorDisplayName': 'Ademilson Machado', 'authorProfileImageUrl': 'https://yt3.ggpht.com/ytc/AGIKgqN3-TiW_ENJuHoi6SJOvr6Tmm45q4yiaGwFIw=s48-c-k-c0x00ffffff-no-rj', 'authorChannelUrl': 'http://www.youtube.com/channel/UCniHAq3gRx2zC2IfwQEMdCw', 'authorChannelId': {'value': 'UCniHAq3gRx2zC2IfwQEMdCw'}, 'canRate': True, 'viewerRating': 'none', 'likeCount': 1, 'publishedAt': '2022-10-20T23:14:15Z', 'updatedAt': '2022-10-20T23:14:15Z'}}, 'canReply': True, 'totalReplyCount': 0, 'isPublic': True}",,UCniHAq3gRx2zC2IfwQEMdCw,2022-10-20T23:14:15Z,Está demorando muito para censura esses ministros malucos o que estamos esperando... o lula mentindo o tempo todo eles não fazem nada eles estão sendo mais corruptos do que o lula....,QURTSl9pMXlLSWZlZ0U3NTJZTXZzOXpqdFpPZGwwVzVyNE52cFRpTUM4X2FweDZLMldwQzAxVF9KdDJYczlycTliWjZ5YjMwbU1mRm9OYS1lNnpUTm00Mk1QLTNQQmZC,2023-06-08 12:58:41.765434
youtube#commentThread,B3gK_Lr2ChWm--4vGuC01gYltig,Ugz4e6k37-q9jgDxR-t4AaABAg,"{'videoId': 'cTbA9l1C6ao', 'topLevelComment': {'kind': 'youtube#comment', 'etag': '6XG1nNeFbBDz6tRBPed75rpJnNk', 'id': 'Ugz4e6k37-q9jgDxR-t4AaABAg', 'snippet': {'videoId': 'cTbA9l1C6ao', 'textDisplay': 'Onde há censura não há Democracia.', 'textOriginal': 'Onde há censura não há Democracia.', 'authorDisplayName': 'jil   Toledo', 'authorProfileImageUrl': 'https://yt3.ggpht.com/LMcj-Rlr40FRaLMHHDdPWH4y6juzMAz_B0NMxVRq-caP6Zetm8FHwB0yQc1Ek3u-HnzHit3Xyw=s48-c-k-c0x00ffffff-no-rj', 'authorChannelUrl': 'http://www.youtube.com/channel/UCEwYrU_YbUbfuSu_1hTvNvA', 'authorChannelId': {'value': 'UCEwYrU_YbUbfuSu_1hTvNvA'}, 'canRate': True, 'viewerRating': 'none', 'likeCount': 17, 'publishedAt': '2022-10-20T23:14:14Z', 'updatedAt': '2022-10-20T23:14:14Z'}}, 'canReply': True, 'totalReplyCount': 0, 'isPublic': True}",,UCEwYrU_YbUbfuSu_1hTvNvA,2022-10-20T23:14:14Z,Onde há censura não há Democracia.,QURTSl9pMXlLSWZlZ0U3NTJZTXZzOXpqdFpPZGwwVzVyNE52cFRpTUM4X2FweDZLMldwQzAxVF9KdDJYczlycTliWjZ5YjMwbU1mRm9OYS1lNnpUTm00Mk1QLTNQQmZC,2023-06-08 12:58:41.765434
youtube#commentThread,N8GTQsaUXM33EEMcxi5e_nU8QvA,UgwoYQM5Vxsaf8vJUOJ4AaABAg,"{'videoId': 'cTbA9l1C6ao', 'topLevelComment': {'kind': 'youtube#comment', 'etag': 'egujwqD9GEX3U2yyX7cdANyqsbk', 'id': 'UgwoYQM5Vxsaf8vJUOJ4AaABAg', 'snippet': {'videoId': 'cTbA9l1C6ao', 'textDisplay': 'Censura é uma vergonha! Uma maldade contra democracia', 'textOriginal': 'Censura é uma vergonha! Uma maldade contra democracia', 'authorDisplayName': 'Angela Lima', 'authorProfileImageUrl': 'https://yt3.ggpht.com/ytc/AGIKgqMW0sKZW0Fa3JUzNWDXWgSSZfobds_zZ9qPjQlk=s48-c-k-c0x00ffffff-no-rj', 'authorChannelUrl': 'http://www.youtube.com/channel/UCAmQ3RTPM5_YRKSKp5D4ncw', 'authorChannelId': {'value': 'UCAmQ3RTPM5_YRKSKp5D4ncw'}, 'canRate': True, 'viewerRating': 'none', 'likeCount': 35, 'publishedAt': '2022-10-20T23:14:13Z', 'updatedAt': '2022-10-20T23:14:13Z'}}, 'canReply': True, 'totalReplyCount': 0, 'isPublic': True}",,UCAmQ3RTPM5_YRKSKp5D4ncw,2022-10-20T23:14:13Z,Censura é uma vergonha! Uma maldade contra democracia,QURTSl9pMXlLSWZlZ0U3NTJZTXZzOXpqdFpPZGwwVzVyNE52cFRpTUM4X2FweDZLMldwQzAxVF9KdDJYczlycTliWjZ5YjMwbU1mRm9OYS1lNnpUTm00Mk1QLTNQQmZC,2023-06-08 12:58:41.765434
youtube#commentThread,f-4IEgupk9if_leuPtmxxASnzE0,Ugz6UYbBznAwTGa9kHN4AaABAg,"{'videoId': 'cTbA9l1C6ao', 'topLevelComment': {'kind': 'youtube#comment', 'etag': 'wbYaOK5VODWHB9ZU5BtSMi8iBT0', 'id': 'Ugz6UYbBznAwTGa9kHN4AaABAg', 'snippet': {'videoId': 'cTbA9l1C6ao', 'textDisplay': 'Ah não,, ficar com medo de falar é muito ruim,,o medo passa a imperar.', 'textOriginal': 'Ah não,, ficar com medo de falar é muito ruim,,o medo passa a imperar.', 'authorDisplayName': 'Liliane Gaudie', 'authorProfileImageUrl': 'https://yt3.ggpht.com/ytc/AGIKgqNEQTY_LaP6OPPKawuS0gNrqsQb-O4g4dEgnXFw_MjhOFhV8DIUVmWpL0th2UcG=s48-c-k-c0x00ffffff-no-rj', 'authorChannelUrl': 'http://www.youtube.com/channel/UCz8UspgDAeQO1FWm1MBGT_A', 'authorChannelId': {'value': 'UCz8UspgDAeQO1FWm1MBGT_A'}, 'canRate': True, 'viewerRating': 'none', 'likeCount': 3, 'publishedAt': '2022-10-20T23:12:55Z', 'updatedAt': '2022-10-20T23:13:10Z'}}, 'canReply': True, 'totalReplyCount': 0, 'isPublic': True}",,UCz8UspgDAeQO1FWm1MBGT_A,2022-10-20T23:12:55Z,"Ah não,, ficar com medo de falar é muito ruim,,o medo passa a imperar.",QURTSl9pMXlLSWZlZ0U3NTJZTXZzOXpqdFpPZGwwVzVyNE52cFRpTUM4X2FweDZLMldwQzAxVF9KdDJYczlycTliWjZ5YjMwbU1mRm9OYS1lNnpUTm00Mk1QLTNQQmZC,2023-06-08 12:58:41.765434
