kind,etag,id,snippet,replies,authorChannelId,publishedAt,textOriginal,nextPageToken,extraction_date
youtube#commentThread,8_ULZdqPbyK4WZ67Nzfh_IiMAoY,UgxepKcDc3lA12ITI1x4AaABAg,"{'videoId': 'vEe3p5oxzK8', 'topLevelComment': {'kind': 'youtube#comment', 'etag': '_Th3AeitoUrP3qgR6FLUTZRZr7s', 'id': 'UgxepKcDc3lA12ITI1x4AaABAg', 'snippet': {'videoId': 'vEe3p5oxzK8', 'textDisplay': 'Intelectuais e ativistas de esquerda defendem ardorosamente o bem estar de marginais, e ignoram completamente suas vítimas...', 'textOriginal': 'Intelectuais e ativistas de esquerda defendem ardorosamente o bem estar de marginais, e ignoram completamente suas vítimas...', 'authorDisplayName': 'Fabio Henrique Elorza', 'authorProfileImageUrl': 'https://yt3.ggpht.com/ytc/AGIKgqNnE0Vyof39uk9FlOMB2ZWP5aVjqN3_BwwwUQ=s48-c-k-c0x00ffffff-no-rj', 'authorChannelUrl': 'http://www.youtube.com/channel/UCU5yb2a9vtmd9aSd90l0IeQ', 'authorChannelId': {'value': 'UCU5yb2a9vtmd9aSd90l0IeQ'}, 'canRate': True, 'viewerRating': 'none', 'likeCount': 0, 'publishedAt': '2023-01-10T01:36:36Z', 'updatedAt': '2023-01-10T01:36:36Z'}}, 'canReply': True, 'totalReplyCount': 0, 'isPublic': True}",,UCU5yb2a9vtmd9aSd90l0IeQ,2023-01-10T01:36:36Z,"Intelectuais e ativistas de esquerda defendem ardorosamente o bem estar de marginais, e ignoram completamente suas vítimas...",,2023-06-09 12:28:19.913922
youtube#commentThread,wQbk00uryvlgacoIYd6yI02wsu8,UgyHWl5Q5r_TTcbA4Pt4AaABAg,"{'videoId': 'vEe3p5oxzK8', 'topLevelComment': {'kind': 'youtube#comment', 'etag': 'tlcoWwNsAoaeEi9cq4TifUSrsxc', 'id': 'UgyHWl5Q5r_TTcbA4Pt4AaABAg', 'snippet': {'videoId': 'vEe3p5oxzK8', 'textDisplay': 'Quer...?', 'textOriginal': 'Quer...?', 'authorDisplayName': 'Stmamakhaparis exec', 'authorProfileImageUrl': 'https://yt3.ggpht.com/ytc/AGIKgqM-IIwfTvN4mgrXOpxiJWjw6SlRoB6yPs5utg=s48-c-k-c0x00ffffff-no-rj', 'authorChannelUrl': 'http://www.youtube.com/channel/UC9WsmFOuKC6rtDcqTEPJz1A', 'authorChannelId': {'value': 'UC9WsmFOuKC6rtDcqTEPJz1A'}, 'canRate': True, 'viewerRating': 'none', 'likeCount': 0, 'publishedAt': '2022-12-15T23:54:46Z', 'updatedAt': '2022-12-15T23:54:46Z'}}, 'canReply': True, 'totalReplyCount': 0, 'isPublic': True}",,UC9WsmFOuKC6rtDcqTEPJz1A,2022-12-15T23:54:46Z,Quer...?,,2023-06-09 12:28:19.913922
youtube#commentThread,4vGTtBjQQ4fqCabT5YL15ySbnro,UgwkkEf403aW02urK-N4AaABAg,"{'videoId': 'vEe3p5oxzK8', 'topLevelComment': {'kind': 'youtube#comment', 'etag': 'hAMfDHzzg7ZGCQxrN15WJ8WSQYU', 'id': 'UgwkkEf403aW02urK-N4AaABAg', 'snippet': {'videoId': 'vEe3p5oxzK8', 'textDisplay': 'Pessoal sujo esse pessoal da esquerda', 'textOriginal': 'Pessoal sujo esse pessoal da esquerda', 'authorDisplayName': 'Ernandes Teixeira', 'authorProfileImageUrl': 'https://yt3.ggpht.com/ytc/AGIKgqMx4NAXU-M7HciZeCai9FaPCywCry5fDHyvF6k7vB4QY2pQ_Pg1baavwqiL3iWA=s48-c-k-c0x00ffffff-no-rj', 'authorChannelUrl': 'http://www.youtube.com/channel/UCTSP2P7z5Gkx6LYz1fTn2Pg', 'authorChannelId': {'value': 'UCTSP2P7z5Gkx6LYz1fTn2Pg'}, 'canRate': True, 'viewerRating': 'none', 'likeCount': 0, 'publishedAt': '2022-12-02T23:05:49Z', 'updatedAt': '2022-12-02T23:05:49Z'}}, 'canReply': True, 'totalReplyCount': 0, 'isPublic': True}",,UCTSP2P7z5Gkx6LYz1fTn2Pg,2022-12-02T23:05:49Z,Pessoal sujo esse pessoal da esquerda,,2023-06-09 12:28:19.913922
youtube#commentThread,151XY9D9cQN6i51Q8wgCaEwD7yk,UgxzypEiLMM6UJZvKf94AaABAg,"{'videoId': 'vEe3p5oxzK8', 'topLevelComment': {'kind': 'youtube#comment', 'etag': 'kQ7jwnAAy-KC8tqDB9tmLdJZKCw', 'id': 'UgxzypEiLMM6UJZvKf94AaABAg', 'snippet': {'videoId': 'vEe3p5oxzK8', 'textDisplay': 'A vossa excelência:&quot;faz agente acreditar que existe politico verdadeiro.&quot;', 'textOriginal': 'A vossa excelência:""faz agente acreditar que existe politico verdadeiro.""', 'authorDisplayName': 'Diogo martins pereira Martins', 'authorProfileImageUrl': 'https://yt3.ggpht.com/ytc/AGIKgqO64AlyZEn5OCukP0Ou9Zxd47aLE-wx9A2S0A=s48-c-k-c0x00ffffff-no-rj', 'authorChannelUrl': 'http://www.youtube.com/channel/UCWbjW7QcCXJIlgynH8jnVMw', 'authorChannelId': {'value': 'UCWbjW7QcCXJIlgynH8jnVMw'}, 'canRate': True, 'viewerRating': 'none', 'likeCount': 1, 'publishedAt': '2022-11-14T01:17:39Z', 'updatedAt': '2022-11-14T01:17:39Z'}}, 'canReply': True, 'totalReplyCount': 0, 'isPublic': True}",,UCWbjW7QcCXJIlgynH8jnVMw,2022-11-14T01:17:39Z,"A vossa excelência:""faz agente acreditar que existe politico verdadeiro.""",,2023-06-09 12:28:19.913922
youtube#commentThread,vxl36ujlG9STrr0SyqoM30k1Mkw,Ugy32aBsmFOGgtb1-V94AaABAg,"{'videoId': 'vEe3p5oxzK8', 'topLevelComment': {'kind': 'youtube#comment', 'etag': 'aHVgGFzXb3ek8PL7IN1jmnp4Fvg', 'id': 'Ugy32aBsmFOGgtb1-V94AaABAg', 'snippet': {'videoId': 'vEe3p5oxzK8', 'textDisplay': 'PARABÉNS! Alguém tem de expor esses absurdos que a esquerda defende e financia! 👏👏👏👏', 'textOriginal': 'PARABÉNS! Alguém tem de expor esses absurdos que a esquerda defende e financia! 👏👏👏👏', 'authorDisplayName': 'simonemdCarvalho carvalho', 'authorProfileImageUrl': 'https://yt3.ggpht.com/ytc/AGIKgqP3SYskuJAAsI3PIVtnNbyP5F7WuDsuvwqoWg=s48-c-k-c0x00ffffff-no-rj', 'authorChannelUrl': 'http://www.youtube.com/channel/UCE5mdqljGeVkP-fiA2T3VVQ', 'authorChannelId': {'value': 'UCE5mdqljGeVkP-fiA2T3VVQ'}, 'canRate': True, 'viewerRating': 'none', 'likeCount': 1, 'publishedAt': '2022-11-12T00:02:53Z', 'updatedAt': '2022-11-12T00:02:53Z'}}, 'canReply': True, 'totalReplyCount': 0, 'isPublic': True}",,UCE5mdqljGeVkP-fiA2T3VVQ,2022-11-12T00:02:53Z,PARABÉNS! Alguém tem de expor esses absurdos que a esquerda defende e financia! 👏👏👏👏,,2023-06-09 12:28:19.913922
youtube#commentThread,pJTOnjZoQGFCNVEdE0JvWVPiO8k,Ugx_tX6Zxf6SFSn5Aoh4AaABAg,"{'videoId': 'vEe3p5oxzK8', 'topLevelComment': {'kind': 'youtube#comment', 'etag': 'RXgsjBAGuHbpJGychTmKy3Tb36s', 'id': 'Ugx_tX6Zxf6SFSn5Aoh4AaABAg', 'snippet': {'videoId': 'vEe3p5oxzK8', 'textDisplay': 'Esse cara é bom!!', 'textOriginal': 'Esse cara é bom!!', 'authorDisplayName': 'Finch', 'authorProfileImageUrl': 'https://yt3.ggpht.com/gD59PRMK-4IKVT0-zGrYVjclm_FpfHTqfUkuseqOLj8vvVE4UBS_fAn-mo3veVfvzvF3MwzF=s48-c-k-c0x00ffffff-no-rj', 'authorChannelUrl': 'http://www.youtube.com/channel/UC5KlSphYknUec4Gq4wA9anQ', 'authorChannelId': {'value': 'UC5KlSphYknUec4Gq4wA9anQ'}, 'canRate': True, 'viewerRating': 'none', 'likeCount': 0, 'publishedAt': '2022-11-11T15:35:11Z', 'updatedAt': '2022-11-11T15:35:11Z'}}, 'canReply': True, 'totalReplyCount': 0, 'isPublic': True}",,UC5KlSphYknUec4Gq4wA9anQ,2022-11-11T15:35:11Z,Esse cara é bom!!,,2023-06-09 12:28:19.913922
youtube#commentThread,AFThxJfIzd2dwU32Aro3oU5jJYg,UgyhE7DL4roaQn79QUJ4AaABAg,"{'videoId': 'vEe3p5oxzK8', 'topLevelComment': {'kind': 'youtube#comment', 'etag': 'eUQLzUYcKOwZyrTZ099Sww6RSZU', 'id': 'UgyhE7DL4roaQn79QUJ4AaABAg', 'snippet': {'videoId': 'vEe3p5oxzK8', 'textDisplay': 'Será que essa vereadora  quer levá-los para casa dela', 'textOriginal': 'Será que essa vereadora  quer levá-los para casa dela', 'authorDisplayName': 'merli costa', 'authorProfileImageUrl': 'https://yt3.ggpht.com/ytc/AGIKgqPDYcVnLjGKlcNppjSrtGxuDHotpyiniuLFVQadQCk1_GUGOL8ilRc9J-RMnXtH=s48-c-k-c0x00ffffff-no-rj', 'authorChannelUrl': 'http://www.youtube.com/channel/UC1nGpauGv0CLX_wyKMyuz5A', 'authorChannelId': {'value': 'UC1nGpauGv0CLX_wyKMyuz5A'}, 'canRate': True, 'viewerRating': 'none', 'likeCount': 0, 'publishedAt': '2022-11-11T11:57:38Z', 'updatedAt': '2022-11-11T11:57:38Z'}}, 'canReply': True, 'totalReplyCount': 0, 'isPublic': True}",,UC1nGpauGv0CLX_wyKMyuz5A,2022-11-11T11:57:38Z,Será que essa vereadora  quer levá-los para casa dela,,2023-06-09 12:28:19.913922
youtube#commentThread,EldfdxdtCkUiSascDU34w8h2_PM,UgxpX-yAokEXWga96mZ4AaABAg,"{'videoId': 'vEe3p5oxzK8', 'topLevelComment': {'kind': 'youtube#comment', 'etag': 'XcOg6EdBEaHDWZIQbh7lj1_Ap9Y', 'id': 'UgxpX-yAokEXWga96mZ4AaABAg', 'snippet': {'videoId': 'vEe3p5oxzK8', 'textDisplay': 'Lugar de bandido e na cadeia,  na minha opinião matou deveria morrer também,  em casos de mortes para assalto, roubos, tirou a vida de alguém de propósito.... deve morrer.', 'textOriginal': 'Lugar de bandido e na cadeia,  na minha opinião matou deveria morrer também,  em casos de mortes para assalto, roubos, tirou a vida de alguém de propósito.... deve morrer.', 'authorDisplayName': 'DÉBORA & ROGÉRIO💕', 'authorProfileImageUrl': 'https://yt3.ggpht.com/tFQOAaMYjRW2exLRsKdGUH-cF5zzU8lC2oly985Bt_XUd_0cbYUVr_0Qs4CVcWJau1QG7tb4zA=s48-c-k-c0x00ffffff-no-rj', 'authorChannelUrl': 'http://www.youtube.com/channel/UCVAlwqZb8JXykV22yF57oIg', 'authorChannelId': {'value': 'UCVAlwqZb8JXykV22yF57oIg'}, 'canRate': True, 'viewerRating': 'none', 'likeCount': 1, 'publishedAt': '2022-11-06T03:42:00Z', 'updatedAt': '2022-11-06T03:42:00Z'}}, 'canReply': True, 'totalReplyCount': 0, 'isPublic': True}",,UCVAlwqZb8JXykV22yF57oIg,2022-11-06T03:42:00Z,"Lugar de bandido e na cadeia,  na minha opinião matou deveria morrer também,  em casos de mortes para assalto, roubos, tirou a vida de alguém de propósito.... deve morrer.",,2023-06-09 12:28:19.913922
youtube#commentThread,74s1ChuL8Z8_0mtGlNW152tqcQg,UgxIoP85DYP72_OwfyJ4AaABAg,"{'videoId': 'vEe3p5oxzK8', 'topLevelComment': {'kind': 'youtube#comment', 'etag': 'QaOoNfI3kzSxRH9UEEZuvLlSb-M', 'id': 'UgxIoP85DYP72_OwfyJ4AaABAg', 'snippet': {'videoId': 'vEe3p5oxzK8', 'textDisplay': '👏👏👏👏 este eu concordo.', 'textOriginal': '👏👏👏👏 este eu concordo.', 'authorDisplayName': 'Izaq Noob', 'authorProfileImageUrl': 'https://yt3.ggpht.com/ytc/AGIKgqOiNXZNSwhhELgzDCmCMPryeaqZnF7LmuGGuEOI=s48-c-k-c0x00ffffff-no-rj', 'authorChannelUrl': 'http://www.youtube.com/channel/UC-K0pQo4HP0IjwDc65X4Zng', 'authorChannelId': {'value': 'UC-K0pQo4HP0IjwDc65X4Zng'}, 'canRate': True, 'viewerRating': 'none', 'likeCount': 0, 'publishedAt': '2022-11-05T04:41:55Z', 'updatedAt': '2022-11-05T04:42:16Z'}}, 'canReply': True, 'totalReplyCount': 0, 'isPublic': True}",,UC-K0pQo4HP0IjwDc65X4Zng,2022-11-05T04:41:55Z,👏👏👏👏 este eu concordo.,,2023-06-09 12:28:19.913922
youtube#commentThread,PVXpcthnni0EYl4rAV6ql5hFcGU,UgzV9uiDEgMjq3_hFCh4AaABAg,"{'videoId': 'vEe3p5oxzK8', 'topLevelComment': {'kind': 'youtube#comment', 'etag': 'NtEdS1mxx5D7sp4tZ_NXGxmhooc', 'id': 'UgzV9uiDEgMjq3_hFCh4AaABAg', 'snippet': {'videoId': 'vEe3p5oxzK8', 'textDisplay': 'Psol e seu típico incentivo ao crime', 'textOriginal': 'Psol e seu típico incentivo ao crime', 'authorDisplayName': 'Paulo Víctor Campelo', 'authorProfileImageUrl': 'https://yt3.ggpht.com/ytc/AGIKgqMozaBld3SqdYXcPhwmpcBcCEFUI0qko64wLUEtcw=s48-c-k-c0x00ffffff-no-rj', 'authorChannelUrl': 'http://www.youtube.com/channel/UCo4KGf7cg4fHdedoDTZejEA', 'authorChannelId': {'value': 'UCo4KGf7cg4fHdedoDTZejEA'}, 'canRate': True, 'viewerRating': 'none', 'likeCount': 0, 'publishedAt': '2022-11-04T19:27:54Z', 'updatedAt': '2022-11-04T19:27:54Z'}}, 'canReply': True, 'totalReplyCount': 0, 'isPublic': True}",,UCo4KGf7cg4fHdedoDTZejEA,2022-11-04T19:27:54Z,Psol e seu típico incentivo ao crime,,2023-06-09 12:28:19.913922
youtube#commentThread,gIXLdnZsX3tAL5lhrSZCzyRwluI,Ugydg4HT1TqSGRKHpIp4AaABAg,"{'videoId': 'vEe3p5oxzK8', 'topLevelComment': {'kind': 'youtube#comment', 'etag': 'Qvbbs52_LHB9cBhJ_5n13GMbAH8', 'id': 'Ugydg4HT1TqSGRKHpIp4AaABAg', 'snippet': {'videoId': 'vEe3p5oxzK8', 'textDisplay': 'Muito bem Rubinho Nunes parabéns continui assim', 'textOriginal': 'Muito bem Rubinho Nunes parabéns continui assim', 'authorDisplayName': 'Thiago Wesley', 'authorProfileImageUrl': 'https://yt3.ggpht.com/ytc/AGIKgqOo_EIUR7qssbr5mgDVoXYWD30eh9jzFXqRiGxJINTRWmUn3RkOYKJDfDKREIQt=s48-c-k-c0x00ffffff-no-rj', 'authorChannelUrl': 'http://www.youtube.com/channel/UCvUY7yTgvjK6FDhD_KOJZvw', 'authorChannelId': {'value': 'UCvUY7yTgvjK6FDhD_KOJZvw'}, 'canRate': True, 'viewerRating': 'none', 'likeCount': 0, 'publishedAt': '2022-11-04T00:31:31Z', 'updatedAt': '2022-11-04T00:31:31Z'}}, 'canReply': True, 'totalReplyCount': 0, 'isPublic': True}",,UCvUY7yTgvjK6FDhD_KOJZvw,2022-11-04T00:31:31Z,Muito bem Rubinho Nunes parabéns continui assim,,2023-06-09 12:28:19.913922
youtube#commentThread,HTHaKJL4sNXKTM3351nQmdtGRUY,UgxaIjJXSzB7LJR40BR4AaABAg,"{'videoId': 'vEe3p5oxzK8', 'topLevelComment': {'kind': 'youtube#comment', 'etag': '6fkM7F8o7MnNqLSn2TMv3TIPYOA', 'id': 'UgxaIjJXSzB7LJR40BR4AaABAg', 'snippet': {'videoId': 'vEe3p5oxzK8', 'textDisplay': 'Qual o nome dessa vereadora', 'textOriginal': 'Qual o nome dessa vereadora', 'authorDisplayName': 'Zito Severo', 'authorProfileImageUrl': 'https://yt3.ggpht.com/ytc/AGIKgqPJIaeiaLywusdjc0oiDfggwk9k59Jp2-9HVw=s48-c-k-c0x00ffffff-no-rj', 'authorChannelUrl': 'http://www.youtube.com/channel/UCEh1bweB4C_K0R0uQwxBh2w', 'authorChannelId': {'value': 'UCEh1bweB4C_K0R0uQwxBh2w'}, 'canRate': True, 'viewerRating': 'none', 'likeCount': 0, 'publishedAt': '2022-11-03T23:09:04Z', 'updatedAt': '2022-11-03T23:09:04Z'}}, 'canReply': True, 'totalReplyCount': 0, 'isPublic': True}",,UCEh1bweB4C_K0R0uQwxBh2w,2022-11-03T23:09:04Z,Qual o nome dessa vereadora,,2023-06-09 12:28:19.913922
youtube#commentThread,x0Jq13tSp39FpKUK80UmjDcuyu0,UgwOUmKt1kLrUuimvwV4AaABAg,"{'videoId': 'vEe3p5oxzK8', 'topLevelComment': {'kind': 'youtube#comment', 'etag': 'bUjrqYFYmHV3G4vLZm1fSiOBOkk', 'id': 'UgwOUmKt1kLrUuimvwV4AaABAg', 'snippet': {'videoId': 'vEe3p5oxzK8', 'textDisplay': 'Reclamar do que, o novo presidente que o diga, o Brasil é uma comédia ladrão na presidência.', 'textOriginal': 'Reclamar do que, o novo presidente que o diga, o Brasil é uma comédia ladrão na presidência.', 'authorDisplayName': 'Amarildo Emerenciano', 'authorProfileImageUrl': 'https://yt3.ggpht.com/ytc/AGIKgqPJz9FeTQDxLl5zvnVpDwpKvV3QMLhzcG9wWQ=s48-c-k-c0x00ffffff-no-rj', 'authorChannelUrl': 'http://www.youtube.com/channel/UC2X5YdMgyHFMltFHA6M6xiQ', 'authorChannelId': {'value': 'UC2X5YdMgyHFMltFHA6M6xiQ'}, 'canRate': True, 'viewerRating': 'none', 'likeCount': 0, 'publishedAt': '2022-11-03T00:00:14Z', 'updatedAt': '2022-11-03T00:00:14Z'}}, 'canReply': True, 'totalReplyCount': 0, 'isPublic': True}",,UC2X5YdMgyHFMltFHA6M6xiQ,2022-11-03T00:00:14Z,"Reclamar do que, o novo presidente que o diga, o Brasil é uma comédia ladrão na presidência.",,2023-06-09 12:28:19.913922
youtube#commentThread,2k4L_MoSqEceGZ1YyVVsnZ_eSzY,Ugxx0yM7YAhFqZCkhOh4AaABAg,"{'videoId': 'vEe3p5oxzK8', 'topLevelComment': {'kind': 'youtube#comment', 'etag': 'q06hCVwpXawh9e9DM-CyqDDcZRs', 'id': 'Ugxx0yM7YAhFqZCkhOh4AaABAg', 'snippet': {'videoId': 'vEe3p5oxzK8', 'textDisplay': 'Surreal beneficiar bandido ..ta ai lula eleito', 'textOriginal': 'Surreal beneficiar bandido ..ta ai lula eleito', 'authorDisplayName': 'Anna Paes', 'authorProfileImageUrl': 'https://yt3.ggpht.com/ytc/AGIKgqNEfD9MQvDeUDsdgOGS-xdv7cqy-ZHH0IV4EFdMG3A=s48-c-k-c0x00ffffff-no-rj', 'authorChannelUrl': 'http://www.youtube.com/channel/UCPzUKCw_zb02mCvZbaoBIiQ', 'authorChannelId': {'value': 'UCPzUKCw_zb02mCvZbaoBIiQ'}, 'canRate': True, 'viewerRating': 'none', 'likeCount': 0, 'publishedAt': '2022-10-31T18:32:38Z', 'updatedAt': '2022-10-31T18:32:38Z'}}, 'canReply': True, 'totalReplyCount': 0, 'isPublic': True}",,UCPzUKCw_zb02mCvZbaoBIiQ,2022-10-31T18:32:38Z,Surreal beneficiar bandido ..ta ai lula eleito,,2023-06-09 12:28:19.913922
youtube#commentThread,acy9YjM8PX36Ukduy1smLgcSq8Q,UgwouKRepqmtYkAjyUx4AaABAg,"{'videoId': 'vEe3p5oxzK8', 'topLevelComment': {'kind': 'youtube#comment', 'etag': '99VYL0RTopB1cDf_cvIR9NYzBpo', 'id': 'UgwouKRepqmtYkAjyUx4AaABAg', 'snippet': {'videoId': 'vEe3p5oxzK8', 'textDisplay': 'RUBINHO, no Brasil pode existir 3a Reeleicao do Executivo? A Lei eh clara quanto a isto? By Lilly Bailey', 'textOriginal': 'RUBINHO, no Brasil pode existir 3a Reeleicao do Executivo? A Lei eh clara quanto a isto? By Lilly Bailey', 'authorDisplayName': 'rhys bailey', 'authorProfileImageUrl': 'https://yt3.ggpht.com/ytc/AGIKgqPykp-aY8MBJeUqGusx5yYROEUbmFIIGiDEuA=s48-c-k-c0x00ffffff-no-rj', 'authorChannelUrl': 'http://www.youtube.com/channel/UCs11plq-WGwWdX-04-8SO7w', 'authorChannelId': {'value': 'UCs11plq-WGwWdX-04-8SO7w'}, 'canRate': True, 'viewerRating': 'none', 'likeCount': 0, 'publishedAt': '2022-10-31T06:36:40Z', 'updatedAt': '2022-10-31T06:36:52Z'}}, 'canReply': True, 'totalReplyCount': 0, 'isPublic': True}",,UCs11plq-WGwWdX-04-8SO7w,2022-10-31T06:36:40Z,"RUBINHO, no Brasil pode existir 3a Reeleicao do Executivo? A Lei eh clara quanto a isto? By Lilly Bailey",,2023-06-09 12:28:19.913922
youtube#commentThread,K0A0NNyEDkY9seFDN_nUd5RV32A,UgzcasOeCo0CFsZ7cmB4AaABAg,"{'videoId': 'vEe3p5oxzK8', 'topLevelComment': {'kind': 'youtube#comment', 'etag': 'szG9Bxm-rhLE8M_osy6Ud3JAEx4', 'id': 'UgzcasOeCo0CFsZ7cmB4AaABAg', 'snippet': {'videoId': 'vEe3p5oxzK8', 'textDisplay': 'Volta pra casa Rubinho', 'textOriginal': 'Volta pra casa Rubinho', 'authorDisplayName': 'Gabriel Augusto anjos', 'authorProfileImageUrl': 'https://yt3.ggpht.com/ytc/AGIKgqNlFAOHKBkIdY8dfyHRPdldJsoeWuJFMpNQjA=s48-c-k-c0x00ffffff-no-rj', 'authorChannelUrl': 'http://www.youtube.com/channel/UC6CzoCs4BxExQg51gU_5-SA', 'authorChannelId': {'value': 'UC6CzoCs4BxExQg51gU_5-SA'}, 'canRate': True, 'viewerRating': 'none', 'likeCount': 0, 'publishedAt': '2022-10-30T04:06:37Z', 'updatedAt': '2022-10-30T04:06:37Z'}}, 'canReply': True, 'totalReplyCount': 0, 'isPublic': True}",,UC6CzoCs4BxExQg51gU_5-SA,2022-10-30T04:06:37Z,Volta pra casa Rubinho,,2023-06-09 12:28:19.913922
youtube#commentThread,Rqmi_dcQjgvVagjKC0iQq6IBBig,UgxaiPHU7KooeAykv3N4AaABAg,"{'videoId': 'vEe3p5oxzK8', 'topLevelComment': {'kind': 'youtube#comment', 'etag': 'urKTFKGArwZS6J6g6-D-Z-D733s', 'id': 'UgxaiPHU7KooeAykv3N4AaABAg', 'snippet': {'videoId': 'vEe3p5oxzK8', 'textDisplay': 'Cara você não vai falar sobre o próprio Fábio Faria arrependido da acusação das inserções na rádio? Isso não era &quot;gravíssimo&quot;? Não é gravíssimo o fato de que eles inventaram uma acusação ridícula? Ou só é gravíssimo quando é de um lado?? O que aconteceu cara? Não acredito até agora, a maior decepção desde os áudios do Arthur foi essa sua guinada repentina pro lado bolsonarista. Se realmente isso for somente para manter o PT fora, depois das eleições vamos ver se você volta a ser o cara honesto e sincero que você era...', 'textOriginal': 'Cara você não vai falar sobre o próprio Fábio Faria arrependido da acusação das inserções na rádio? Isso não era ""gravíssimo""? Não é gravíssimo o fato de que eles inventaram uma acusação ridícula? Ou só é gravíssimo quando é de um lado?? O que aconteceu cara? Não acredito até agora, a maior decepção desde os áudios do Arthur foi essa sua guinada repentina pro lado bolsonarista. Se realmente isso for somente para manter o PT fora, depois das eleições vamos ver se você volta a ser o cara honesto e sincero que você era...', 'authorDisplayName': 'Felipe Alves de Andrade', 'authorProfileImageUrl': 'https://yt3.ggpht.com/ytc/AGIKgqPoOubfFYA3bUbj6jhFi9Js6RTs_2QVwfzdDQrxfA=s48-c-k-c0x00ffffff-no-rj', 'authorChannelUrl': 'http://www.youtube.com/channel/UChhErT56Ac7_SwlXk3Qc9YA', 'authorChannelId': {'value': 'UChhErT56Ac7_SwlXk3Qc9YA'}, 'canRate': True, 'viewerRating': 'none', 'likeCount': 0, 'publishedAt': '2022-10-30T02:59:37Z', 'updatedAt': '2022-10-30T02:59:37Z'}}, 'canReply': True, 'totalReplyCount': 0, 'isPublic': True}",,UChhErT56Ac7_SwlXk3Qc9YA,2022-10-30T02:59:37Z,"Cara você não vai falar sobre o próprio Fábio Faria arrependido da acusação das inserções na rádio? Isso não era ""gravíssimo""? Não é gravíssimo o fato de que eles inventaram uma acusação ridícula? Ou só é gravíssimo quando é de um lado?? O que aconteceu cara? Não acredito até agora, a maior decepção desde os áudios do Arthur foi essa sua guinada repentina pro lado bolsonarista. Se realmente isso for somente para manter o PT fora, depois das eleições vamos ver se você volta a ser o cara honesto e sincero que você era...",,2023-06-09 12:28:19.913922
youtube#commentThread,jPP-uQgx6HubR3LvHhlOCM5Buso,Ugw8_67mIEikWkxuVMZ4AaABAg,"{'videoId': 'vEe3p5oxzK8', 'topLevelComment': {'kind': 'youtube#comment', 'etag': '5aE_YzEoq7j_wupBeftTvnlbFfc', 'id': 'Ugw8_67mIEikWkxuVMZ4AaABAg', 'snippet': {'videoId': 'vEe3p5oxzK8', 'textDisplay': 'Esquerda vai fazer do tráfico um exército de ditadura criminosa só não vê  , quem é  esquerdopatas de carteirinha .', 'textOriginal': 'Esquerda vai fazer do tráfico um exército de ditadura criminosa só não vê  , quem é  esquerdopatas de carteirinha .', 'authorDisplayName': 'José Alves Azevedo', 'authorProfileImageUrl': 'https://yt3.ggpht.com/ytc/AGIKgqOfrsb2EXd95lC0AzcM8HSvFK70-68wWE96rQ=s48-c-k-c0x00ffffff-no-rj', 'authorChannelUrl': 'http://www.youtube.com/channel/UCKeOLBxVbw0xJ0irMHvR0RA', 'authorChannelId': {'value': 'UCKeOLBxVbw0xJ0irMHvR0RA'}, 'canRate': True, 'viewerRating': 'none', 'likeCount': 0, 'publishedAt': '2022-10-29T19:33:31Z', 'updatedAt': '2022-10-29T19:33:31Z'}}, 'canReply': True, 'totalReplyCount': 0, 'isPublic': True}",,UCKeOLBxVbw0xJ0irMHvR0RA,2022-10-29T19:33:31Z,"Esquerda vai fazer do tráfico um exército de ditadura criminosa só não vê  , quem é  esquerdopatas de carteirinha .",,2023-06-09 12:28:19.913922
youtube#commentThread,v9rTk_rdl015nGaiGI6xnlcNoa8,UgwEx0fPtdsXqwKe2t94AaABAg,"{'videoId': 'vEe3p5oxzK8', 'topLevelComment': {'kind': 'youtube#comment', 'etag': 'gzr0VnomgttJUr10Dq6_rybEfXw', 'id': 'UgwEx0fPtdsXqwKe2t94AaABAg', 'snippet': {'videoId': 'vEe3p5oxzK8', 'textDisplay': 'Esquerda é Realmente a escória da sociedade', 'textOriginal': 'Esquerda é Realmente a escória da sociedade', 'authorDisplayName': 'Pai Vlogueiro', 'authorProfileImageUrl': 'https://yt3.ggpht.com/tQdPqXw2SEmY3n-jKd6sbGd8pch9b4VdvVW4CrjXZLXa2OEwv6KqlTB1wwvf2cm33eHyTDha=s48-c-k-c0x00ffffff-no-rj', 'authorChannelUrl': 'http://www.youtube.com/channel/UC1_U6J6yqjtY25pbFdbDDLQ', 'authorChannelId': {'value': 'UC1_U6J6yqjtY25pbFdbDDLQ'}, 'canRate': True, 'viewerRating': 'none', 'likeCount': 1, 'publishedAt': '2022-10-29T16:26:34Z', 'updatedAt': '2022-10-29T16:26:34Z'}}, 'canReply': True, 'totalReplyCount': 0, 'isPublic': True}",,UC1_U6J6yqjtY25pbFdbDDLQ,2022-10-29T16:26:34Z,Esquerda é Realmente a escória da sociedade,,2023-06-09 12:28:19.913922
youtube#commentThread,jh9nurj06axU-cU-Dwd-_octcR4,UgwyMrPVL7AERjgVjk14AaABAg,"{'videoId': 'vEe3p5oxzK8', 'topLevelComment': {'kind': 'youtube#comment', 'etag': 'XC5psPZ-ThosDXhtbJp8R6ZCXsY', 'id': 'UgwyMrPVL7AERjgVjk14AaABAg', 'snippet': {'videoId': 'vEe3p5oxzK8', 'textDisplay': '<a href=""about:invalid#zCSafez""></a><a href=""about:invalid#zCSafez""></a>', 'textOriginal': '', 'authorDisplayName': 'Som e Musica Library', 'authorProfileImageUrl': 'https://yt3.ggpht.com/mrzCa4jmiu4PAVW70OULxgEbj7RtSNLs7hkr6PHFPfNSE-qYppGPyCSeNCqyJigbr1ImPFGr_Q=s48-c-k-c0x00ffffff-no-rj', 'authorChannelUrl': 'http://www.youtube.com/channel/UCusXHOWqu9r3U2MaKopc_RQ', 'authorChannelId': {'value': 'UCusXHOWqu9r3U2MaKopc_RQ'}, 'canRate': True, 'viewerRating': 'none', 'likeCount': 0, 'publishedAt': '2022-10-29T14:55:23Z', 'updatedAt': '2022-10-29T14:55:23Z'}}, 'canReply': True, 'totalReplyCount': 0, 'isPublic': True}",,UCusXHOWqu9r3U2MaKopc_RQ,2022-10-29T14:55:23Z,,,2023-06-09 12:28:19.913922
youtube#commentThread,7C5bGyH9yNpxdMrBIvLaY96r47s,UgwxXcpM21lr2_xb17l4AaABAg,"{'videoId': 'vEe3p5oxzK8', 'topLevelComment': {'kind': 'youtube#comment', 'etag': 'XIaFTiPWqKaSY85ALJGv89k9nHQ', 'id': 'UgwxXcpM21lr2_xb17l4AaABAg', 'snippet': {'videoId': 'vEe3p5oxzK8', 'textDisplay': 'O Rubinho tem paciência em ensinar o óbvio, em ensinar que o céu é azul pra psolista gente rsrsrs', 'textOriginal': 'O Rubinho tem paciência em ensinar o óbvio, em ensinar que o céu é azul pra psolista gente rsrsrs', 'authorDisplayName': 'Lívia Massoreth', 'authorProfileImageUrl': 'https://yt3.ggpht.com/AzUmUKkF85KPv93dCofTjqN7I2YO456W74GbBKACYgIQygizKmY4MbW6Eknm-7kywQT1jastsls=s48-c-k-c0x00ffffff-no-rj', 'authorChannelUrl': 'http://www.youtube.com/channel/UCo9nwcnZ1ldF__MBZ_i8oXw', 'authorChannelId': {'value': 'UCo9nwcnZ1ldF__MBZ_i8oXw'}, 'canRate': True, 'viewerRating': 'none', 'likeCount': 1, 'publishedAt': '2022-10-29T12:37:45Z', 'updatedAt': '2022-10-29T12:37:45Z'}}, 'canReply': True, 'totalReplyCount': 0, 'isPublic': True}",,UCo9nwcnZ1ldF__MBZ_i8oXw,2022-10-29T12:37:45Z,"O Rubinho tem paciência em ensinar o óbvio, em ensinar que o céu é azul pra psolista gente rsrsrs",,2023-06-09 12:28:19.913922
