kind,etag,id,snippet,replies,authorChannelId,publishedAt,textOriginal,nextPageToken,extraction_date
youtube#commentThread,Fmm4Z-jjNh41INod5KgAVq6RGc0,UgzCw9T_Fh7KVJdTt_14AaABAg,"{'videoId': 'aTx_T2N2jhY', 'topLevelComment': {'kind': 'youtube#comment', 'etag': '8lAbsgQsdJugmGGwJy_mqMGMn7M', 'id': 'UgzCw9T_Fh7KVJdTt_14AaABAg', 'snippet': {'videoId': 'aTx_T2N2jhY', 'textDisplay': 'Gente pelo amor de Deus se o lula ganhar vcs estão lascados, tá repreendido em nome de Jesus! Meu Deus proteja esse homem em nome de Jesus 🙌🙌🙌🙌🙌🙌🇧🇷🇧🇷🇧🇷🇧🇷🇧🇷🇧🇷🇧🇷🇧🇷', 'textOriginal': 'Gente pelo amor de Deus se o lula ganhar vcs estão lascados, tá repreendido em nome de Jesus! Meu Deus proteja esse homem em nome de Jesus 🙌🙌🙌🙌🙌🙌🇧🇷🇧🇷🇧🇷🇧🇷🇧🇷🇧🇷🇧🇷🇧🇷', 'authorDisplayName': 'Erika Bless', 'authorProfileImageUrl': 'https://yt3.ggpht.com/kto-wu-qYx7OW4ZJm8Oon8MM3pxPfCtQuMu1BWXEmXGZqW9itE0b1jlMRQW9tEf8fPuGPVpN3Q=s48-c-k-c0x00ffffff-no-rj', 'authorChannelUrl': 'http://www.youtube.com/channel/UCC1stb0o41A6RUyCdRsmncw', 'authorChannelId': {'value': 'UCC1stb0o41A6RUyCdRsmncw'}, 'canRate': True, 'viewerRating': 'none', 'likeCount': 1, 'publishedAt': '2022-10-15T12:21:05Z', 'updatedAt': '2022-10-15T12:21:42Z'}}, 'canReply': True, 'totalReplyCount': 0, 'isPublic': True}",,UCC1stb0o41A6RUyCdRsmncw,2022-10-15T12:21:05Z,"Gente pelo amor de Deus se o lula ganhar vcs estão lascados, tá repreendido em nome de Jesus! Meu Deus proteja esse homem em nome de Jesus 🙌🙌🙌🙌🙌🙌🇧🇷🇧🇷🇧🇷🇧🇷🇧🇷🇧🇷🇧🇷🇧🇷",QURTSl9pM3JHX0lUT3c3RTZNR2FPSEFpb3pyeGRHSGxkRXdSaHJyekZPMk1zT1dYaXlsaWg0SHhOcFB6TF94TGZ3Sm1XMU9FSUUtWUpPaUlqZnJOUkdXX2RtY2ZCVThUZFE=,2023-06-08 12:26:04.841803
youtube#commentThread,lz-DDoifvfzumaAQfPyNVkEiDwA,UgynjvzpM2BmEFV6LGV4AaABAg,"{'videoId': 'aTx_T2N2jhY', 'topLevelComment': {'kind': 'youtube#comment', 'etag': 'DlVkKn4L1jTrXDnKYB2NFTDm_Es', 'id': 'UgynjvzpM2BmEFV6LGV4AaABAg', 'snippet': {'videoId': 'aTx_T2N2jhY', 'textDisplay': 'Oh ! Pátria amada , mãe gentil,  nos conceda a graça  de Bolsonaro, Presidente do Brasil. 22', 'textOriginal': 'Oh ! Pátria amada , mãe gentil,  nos conceda a graça  de Bolsonaro, Presidente do Brasil. 22', 'authorDisplayName': 'Vera Lucia Moraes da Silva', 'authorProfileImageUrl': 'https://yt3.ggpht.com/ytc/AGIKgqMYXHFmJh-NER0qCx_ECuU3qMZMpWnFBkNz3g=s48-c-k-c0x00ffffff-no-rj', 'authorChannelUrl': 'http://www.youtube.com/channel/UCTrwIj00DUWsvnV0Z8pW0bA', 'authorChannelId': {'value': 'UCTrwIj00DUWsvnV0Z8pW0bA'}, 'canRate': True, 'viewerRating': 'none', 'likeCount': 6, 'publishedAt': '2022-10-15T12:17:36Z', 'updatedAt': '2022-10-15T12:17:36Z'}}, 'canReply': True, 'totalReplyCount': 0, 'isPublic': True}",,UCTrwIj00DUWsvnV0Z8pW0bA,2022-10-15T12:17:36Z,"Oh ! Pátria amada , mãe gentil,  nos conceda a graça  de Bolsonaro, Presidente do Brasil. 22",QURTSl9pM3JHX0lUT3c3RTZNR2FPSEFpb3pyeGRHSGxkRXdSaHJyekZPMk1zT1dYaXlsaWg0SHhOcFB6TF94TGZ3Sm1XMU9FSUUtWUpPaUlqZnJOUkdXX2RtY2ZCVThUZFE=,2023-06-08 12:26:04.841803
youtube#commentThread,qRwwWvIm6WKJ5It7iEOkESPV434,Ugy89Na4UshEd3CM2pV4AaABAg,"{'videoId': 'aTx_T2N2jhY', 'topLevelComment': {'kind': 'youtube#comment', 'etag': '1lkuFq9LQbGNr_MgcV6_QIXzqU4', 'id': 'Ugy89Na4UshEd3CM2pV4AaABAg', 'snippet': {'videoId': 'aTx_T2N2jhY', 'textDisplay': '&quot;Deus é pátria ,família e liberdade 🙏🏻🇧🇷', 'textOriginal': '""Deus é pátria ,família e liberdade 🙏🏻🇧🇷', 'authorDisplayName': 'Francisca Maria', 'authorProfileImageUrl': 'https://yt3.ggpht.com/ytc/AGIKgqO9EgRxvkMo16VMbxtnPRhTGDLJd9d8QDcYEA=s48-c-k-c0x00ffffff-no-rj', 'authorChannelUrl': 'http://www.youtube.com/channel/UCXB_vjxKlgQ-_PQe9XFrBmw', 'authorChannelId': {'value': 'UCXB_vjxKlgQ-_PQe9XFrBmw'}, 'canRate': True, 'viewerRating': 'none', 'likeCount': 4, 'publishedAt': '2022-10-15T12:16:46Z', 'updatedAt': '2022-10-15T12:16:46Z'}}, 'canReply': True, 'totalReplyCount': 0, 'isPublic': True}",,UCXB_vjxKlgQ-_PQe9XFrBmw,2022-10-15T12:16:46Z,"""Deus é pátria ,família e liberdade 🙏🏻🇧🇷",QURTSl9pM3JHX0lUT3c3RTZNR2FPSEFpb3pyeGRHSGxkRXdSaHJyekZPMk1zT1dYaXlsaWg0SHhOcFB6TF94TGZ3Sm1XMU9FSUUtWUpPaUlqZnJOUkdXX2RtY2ZCVThUZFE=,2023-06-08 12:26:04.841803
youtube#commentThread,crWUhqktzRvHSTgYj1oVyWykWHE,UgwY6lBnHNjDOcFryYl4AaABAg,"{'videoId': 'aTx_T2N2jhY', 'topLevelComment': {'kind': 'youtube#comment', 'etag': 'Dgqx7UjHG9kH9Kf1U07GZ-qRh78', 'id': 'UgwY6lBnHNjDOcFryYl4AaABAg', 'snippet': {'videoId': 'aTx_T2N2jhY', 'textDisplay': 'SEGUIMOS FIRMES NESTE BOM PROPÓSITO BOLSONARO AS BÊNÇÃOS DO REI DOS EXÉRCITOS E A TODOS OS HOMENS DE BOA VONTADE E PATRIOTAS.', 'textOriginal': 'SEGUIMOS FIRMES NESTE BOM PROPÓSITO BOLSONARO AS BÊNÇÃOS DO REI DOS EXÉRCITOS E A TODOS OS HOMENS DE BOA VONTADE E PATRIOTAS.', 'authorDisplayName': 'Antonio luiz Migotto', 'authorProfileImageUrl': 'https://yt3.ggpht.com/IvMGlkOe6KheRPjCVrPt3o4zSng3lEPbAUQXWJXpZ3QOu9ZbDNT8VXwmg4E6w-Fjbu3bn6f7-ec=s48-c-k-c0x00ffffff-no-rj', 'authorChannelUrl': 'http://www.youtube.com/channel/UC3TJm0z6gXLo6e39NvUEGiw', 'authorChannelId': {'value': 'UC3TJm0z6gXLo6e39NvUEGiw'}, 'canRate': True, 'viewerRating': 'none', 'likeCount': 6, 'publishedAt': '2022-10-15T12:14:09Z', 'updatedAt': '2022-10-15T12:14:09Z'}}, 'canReply': True, 'totalReplyCount': 0, 'isPublic': True}",,UC3TJm0z6gXLo6e39NvUEGiw,2022-10-15T12:14:09Z,SEGUIMOS FIRMES NESTE BOM PROPÓSITO BOLSONARO AS BÊNÇÃOS DO REI DOS EXÉRCITOS E A TODOS OS HOMENS DE BOA VONTADE E PATRIOTAS.,QURTSl9pM3JHX0lUT3c3RTZNR2FPSEFpb3pyeGRHSGxkRXdSaHJyekZPMk1zT1dYaXlsaWg0SHhOcFB6TF94TGZ3Sm1XMU9FSUUtWUpPaUlqZnJOUkdXX2RtY2ZCVThUZFE=,2023-06-08 12:26:04.841803
youtube#commentThread,QKyEgv82VjRo3tBXgbF6qfcEt-U,Ugzuu3JAj8bca80--1N4AaABAg,"{'videoId': 'aTx_T2N2jhY', 'topLevelComment': {'kind': 'youtube#comment', 'etag': 'qlcFO8CFVFSGFeJvgx4Wzf1J6x8', 'id': 'Ugzuu3JAj8bca80--1N4AaABAg', 'snippet': {'videoId': 'aTx_T2N2jhY', 'textDisplay': 'Maria Aparecida Deus abençoe meu presidente Jair Bolsonaro e toda família do Brasil 👏', 'textOriginal': 'Maria Aparecida Deus abençoe meu presidente Jair Bolsonaro e toda família do Brasil 👏', 'authorDisplayName': 'Bia Maria', 'authorProfileImageUrl': 'https://yt3.ggpht.com/ytc/AGIKgqOCCWWKKwx-NLLaHWc4nnAB1OnRjnMIzIaVmA=s48-c-k-c0x00ffffff-no-rj', 'authorChannelUrl': 'http://www.youtube.com/channel/UCgeMeo8xGcjIYboPFUVW-hQ', 'authorChannelId': {'value': 'UCgeMeo8xGcjIYboPFUVW-hQ'}, 'canRate': True, 'viewerRating': 'none', 'likeCount': 8, 'publishedAt': '2022-10-15T12:11:39Z', 'updatedAt': '2022-10-15T12:11:39Z'}}, 'canReply': True, 'totalReplyCount': 0, 'isPublic': True}",,UCgeMeo8xGcjIYboPFUVW-hQ,2022-10-15T12:11:39Z,Maria Aparecida Deus abençoe meu presidente Jair Bolsonaro e toda família do Brasil 👏,QURTSl9pM3JHX0lUT3c3RTZNR2FPSEFpb3pyeGRHSGxkRXdSaHJyekZPMk1zT1dYaXlsaWg0SHhOcFB6TF94TGZ3Sm1XMU9FSUUtWUpPaUlqZnJOUkdXX2RtY2ZCVThUZFE=,2023-06-08 12:26:04.841803
youtube#commentThread,9QJO-IZsWjCRwfa6aqggWkORiSE,UgwMCGToT-VGzR7g0AB4AaABAg,"{'videoId': 'aTx_T2N2jhY', 'topLevelComment': {'kind': 'youtube#comment', 'etag': 'w65uDTxQmaJPxEF7iTgz1cZQ1gg', 'id': 'UgwMCGToT-VGzR7g0AB4AaABAg', 'snippet': {'videoId': 'aTx_T2N2jhY', 'textDisplay': 'ôÕO,abre alas. o MInTO VAI TRANSITAR.', 'textOriginal': 'ôÕO,abre alas. o MInTO VAI TRANSITAR.', 'authorDisplayName': 'Edson Delattre Edi', 'authorProfileImageUrl': 'https://yt3.ggpht.com/ytc/AGIKgqNdaNLad6cdl_Ve3WH66Rp5zKHFXECTZ2oW=s48-c-k-c0x00ffffff-no-rj', 'authorChannelUrl': 'http://www.youtube.com/channel/UCzXBheQjHj6nlBWN7DtWY8A', 'authorChannelId': {'value': 'UCzXBheQjHj6nlBWN7DtWY8A'}, 'canRate': True, 'viewerRating': 'none', 'likeCount': 2, 'publishedAt': '2022-10-15T12:10:59Z', 'updatedAt': '2022-10-15T12:10:59Z'}}, 'canReply': True, 'totalReplyCount': 0, 'isPublic': True}",,UCzXBheQjHj6nlBWN7DtWY8A,2022-10-15T12:10:59Z,"ôÕO,abre alas. o MInTO VAI TRANSITAR.",QURTSl9pM3JHX0lUT3c3RTZNR2FPSEFpb3pyeGRHSGxkRXdSaHJyekZPMk1zT1dYaXlsaWg0SHhOcFB6TF94TGZ3Sm1XMU9FSUUtWUpPaUlqZnJOUkdXX2RtY2ZCVThUZFE=,2023-06-08 12:26:04.841803
youtube#commentThread,jMeXfEpC37vSu8S5qrSAmAZWHxg,Ugy9ND3H4o65smauGeR4AaABAg,"{'videoId': 'aTx_T2N2jhY', 'topLevelComment': {'kind': 'youtube#comment', 'etag': 'iNXKNPqlteE_D7Q2-n7NjxgsjDk', 'id': 'Ugy9ND3H4o65smauGeR4AaABAg', 'snippet': {'videoId': 'aTx_T2N2jhY', 'textDisplay': 'Vai ter FRAUDE eu tô Avisando', 'textOriginal': 'Vai ter FRAUDE eu tô Avisando', 'authorDisplayName': 'Paulo Lima Lima', 'authorProfileImageUrl': 'https://yt3.ggpht.com/ytc/AGIKgqPv_BU4OAWSV4IrigAZWrAEdpAQfSVt1HWw9g=s48-c-k-c0x00ffffff-no-rj', 'authorChannelUrl': 'http://www.youtube.com/channel/UCcXKZK61ufPuf-n0oJwtecA', 'authorChannelId': {'value': 'UCcXKZK61ufPuf-n0oJwtecA'}, 'canRate': True, 'viewerRating': 'none', 'likeCount': 2, 'publishedAt': '2022-10-15T11:59:57Z', 'updatedAt': '2022-10-15T11:59:57Z'}}, 'canReply': True, 'totalReplyCount': 0, 'isPublic': True}",,UCcXKZK61ufPuf-n0oJwtecA,2022-10-15T11:59:57Z,Vai ter FRAUDE eu tô Avisando,QURTSl9pM3JHX0lUT3c3RTZNR2FPSEFpb3pyeGRHSGxkRXdSaHJyekZPMk1zT1dYaXlsaWg0SHhOcFB6TF94TGZ3Sm1XMU9FSUUtWUpPaUlqZnJOUkdXX2RtY2ZCVThUZFE=,2023-06-08 12:26:04.841803
youtube#commentThread,MRZJBaQNpBbotxb1C1VV60NpoPo,UgxnRqh3JRwNAL3gced4AaABAg,"{'videoId': 'aTx_T2N2jhY', 'topLevelComment': {'kind': 'youtube#comment', 'etag': '1jpTV9Y0K-QDfoTzipJO5srZQ9g', 'id': 'UgxnRqh3JRwNAL3gced4AaABAg', 'snippet': {'videoId': 'aTx_T2N2jhY', 'textDisplay': 'Sou de Teresina-Piauí, voto em Bolsonaro.', 'textOriginal': 'Sou de Teresina-Piauí, voto em Bolsonaro.', 'authorDisplayName': 'Antonia Joselia', 'authorProfileImageUrl': 'https://yt3.ggpht.com/ytc/AGIKgqMgHCzEkalFzVd-ZLWkS_0TFDxVWPz4o0IwFTuv2sc=s48-c-k-c0x00ffffff-no-rj', 'authorChannelUrl': 'http://www.youtube.com/channel/UCTM1E1Qzm5HXnibW3WTRd4w', 'authorChannelId': {'value': 'UCTM1E1Qzm5HXnibW3WTRd4w'}, 'canRate': True, 'viewerRating': 'none', 'likeCount': 8, 'publishedAt': '2022-10-15T11:58:00Z', 'updatedAt': '2022-10-15T11:58:00Z'}}, 'canReply': True, 'totalReplyCount': 0, 'isPublic': True}",,UCTM1E1Qzm5HXnibW3WTRd4w,2022-10-15T11:58:00Z,"Sou de Teresina-Piauí, voto em Bolsonaro.",QURTSl9pM3JHX0lUT3c3RTZNR2FPSEFpb3pyeGRHSGxkRXdSaHJyekZPMk1zT1dYaXlsaWg0SHhOcFB6TF94TGZ3Sm1XMU9FSUUtWUpPaUlqZnJOUkdXX2RtY2ZCVThUZFE=,2023-06-08 12:26:04.841803
youtube#commentThread,exszLjbJMOdt0yxH7DtdzmNC9Q8,Ugz6SeORyry3_4VKMId4AaABAg,"{'videoId': 'aTx_T2N2jhY', 'topLevelComment': {'kind': 'youtube#comment', 'etag': 'LK4XgVAPEdYz3CFVepPSVEYbXPA', 'id': 'Ugz6SeORyry3_4VKMId4AaABAg', 'snippet': {'videoId': 'aTx_T2N2jhY', 'textDisplay': 'Isso a Globo não mostra <br>Kkkkk', 'textOriginal': 'Isso a Globo não mostra \\nKkkkk', 'authorDisplayName': 'Fabio Araújo', 'authorProfileImageUrl': 'https://yt3.ggpht.com/ytc/AGIKgqNP1ZIb9NfNFa9z9DhPySu3UInDMK2Zwe4NUA=s48-c-k-c0x00ffffff-no-rj', 'authorChannelUrl': 'http://www.youtube.com/channel/UC-efp9d0tqLWMXY4Xh9GV8Q', 'authorChannelId': {'value': 'UC-efp9d0tqLWMXY4Xh9GV8Q'}, 'canRate': True, 'viewerRating': 'none', 'likeCount': 3, 'publishedAt': '2022-10-15T11:57:33Z', 'updatedAt': '2022-10-15T11:57:33Z'}}, 'canReply': True, 'totalReplyCount': 0, 'isPublic': True}",,UC-efp9d0tqLWMXY4Xh9GV8Q,2022-10-15T11:57:33Z,"Isso a Globo não mostra 
Kkkkk",QURTSl9pM3JHX0lUT3c3RTZNR2FPSEFpb3pyeGRHSGxkRXdSaHJyekZPMk1zT1dYaXlsaWg0SHhOcFB6TF94TGZ3Sm1XMU9FSUUtWUpPaUlqZnJOUkdXX2RtY2ZCVThUZFE=,2023-06-08 12:26:04.841803
youtube#commentThread,MudM92rXGpel6Cp0mFQ4F6hl68s,UgygSzBjw5gx05fNPf14AaABAg,"{'videoId': 'aTx_T2N2jhY', 'topLevelComment': {'kind': 'youtube#comment', 'etag': 'uDZSQz_jU6xIcQ6baSBZLVtG41M', 'id': 'UgygSzBjw5gx05fNPf14AaABAg', 'snippet': {'videoId': 'aTx_T2N2jhY', 'textDisplay': 'bom dia a todos meus queridos piauienses linda multidão fico feliz gostaria de tá  ai com o nosso presidente jair Bolsonaro mais não posso mais estou aconpanhando tocendo orando a  Deus pra que dê dê tudo serto em nome de Jesus amém estamos juntos novamente Bolsonaro 22 dia 30 de outubro confiando no senhor Jesus  vamos vencer novamente amém abraços a todos', 'textOriginal': 'bom dia a todos meus queridos piauienses linda multidão fico feliz gostaria de tá  ai com o nosso presidente jair Bolsonaro mais não posso mais estou aconpanhando tocendo orando a  Deus pra que dê dê tudo serto em nome de Jesus amém estamos juntos novamente Bolsonaro 22 dia 30 de outubro confiando no senhor Jesus  vamos vencer novamente amém abraços a todos', 'authorDisplayName': 'Maria Das Mercês', 'authorProfileImageUrl': 'https://yt3.ggpht.com/ytc/AGIKgqPI4-QlwJ-mMg9q3SNgFYULKQPPnhIQWoOc9g=s48-c-k-c0x00ffffff-no-rj', 'authorChannelUrl': 'http://www.youtube.com/channel/UCwYVjgo_lIlIZmVf7gtPnZw', 'authorChannelId': {'value': 'UCwYVjgo_lIlIZmVf7gtPnZw'}, 'canRate': True, 'viewerRating': 'none', 'likeCount': 5, 'publishedAt': '2022-10-15T11:52:37Z', 'updatedAt': '2022-10-15T11:52:37Z'}}, 'canReply': True, 'totalReplyCount': 0, 'isPublic': True}",,UCwYVjgo_lIlIZmVf7gtPnZw,2022-10-15T11:52:37Z,bom dia a todos meus queridos piauienses linda multidão fico feliz gostaria de tá  ai com o nosso presidente jair Bolsonaro mais não posso mais estou aconpanhando tocendo orando a  Deus pra que dê dê tudo serto em nome de Jesus amém estamos juntos novamente Bolsonaro 22 dia 30 de outubro confiando no senhor Jesus  vamos vencer novamente amém abraços a todos,QURTSl9pM3JHX0lUT3c3RTZNR2FPSEFpb3pyeGRHSGxkRXdSaHJyekZPMk1zT1dYaXlsaWg0SHhOcFB6TF94TGZ3Sm1XMU9FSUUtWUpPaUlqZnJOUkdXX2RtY2ZCVThUZFE=,2023-06-08 12:26:04.841803
youtube#commentThread,yVU5PBL_lLOQ_aHSNQNC4b2D0UY,UgwxYvRtaUMB72IL00F4AaABAg,"{'videoId': 'aTx_T2N2jhY', 'topLevelComment': {'kind': 'youtube#comment', 'etag': 'Hc-k4_XJ9ooU-fuzT99oMZEe0VA', 'id': 'UgwxYvRtaUMB72IL00F4AaABAg', 'snippet': {'videoId': 'aTx_T2N2jhY', 'textDisplay': 'Por isso é impossível acreditar nas &quot;invioláveis&quot; urnas. Bolsonaro reeleito é o melhor para o Brasil.', 'textOriginal': 'Por isso é impossível acreditar nas ""invioláveis"" urnas. Bolsonaro reeleito é o melhor para o Brasil.', 'authorDisplayName': 'Marilda Semensato', 'authorProfileImageUrl': 'https://yt3.ggpht.com/ytc/AGIKgqPv6p0R_nhK5TZw0rEpMEVD11bBRuFhWAPY=s48-c-k-c0x00ffffff-no-rj', 'authorChannelUrl': 'http://www.youtube.com/channel/UC4K9gUdBml2uWxtjHKZQ57A', 'authorChannelId': {'value': 'UC4K9gUdBml2uWxtjHKZQ57A'}, 'canRate': True, 'viewerRating': 'none', 'likeCount': 5, 'publishedAt': '2022-10-15T11:51:05Z', 'updatedAt': '2022-10-15T11:51:05Z'}}, 'canReply': True, 'totalReplyCount': 0, 'isPublic': True}",,UC4K9gUdBml2uWxtjHKZQ57A,2022-10-15T11:51:05Z,"Por isso é impossível acreditar nas ""invioláveis"" urnas. Bolsonaro reeleito é o melhor para o Brasil.",QURTSl9pM3JHX0lUT3c3RTZNR2FPSEFpb3pyeGRHSGxkRXdSaHJyekZPMk1zT1dYaXlsaWg0SHhOcFB6TF94TGZ3Sm1XMU9FSUUtWUpPaUlqZnJOUkdXX2RtY2ZCVThUZFE=,2023-06-08 12:26:04.841803
youtube#commentThread,l1eEBFJKf9iFb6TDaeFr0LxnNm0,Ugy4yuiVaRD8FVI6cnJ4AaABAg,"{'videoId': 'aTx_T2N2jhY', 'topLevelComment': {'kind': 'youtube#comment', 'etag': 'B6eWclNkRmlVUHl89HnUYXIDmKk', 'id': 'Ugy4yuiVaRD8FVI6cnJ4AaABAg', 'snippet': {'videoId': 'aTx_T2N2jhY', 'textDisplay': 'O Satanás presidente da República, que não gosta de pobre, preguiçoso, vagabundo, miliciano, canibal, pilantra, racista, terrorista, foi mal militar, um piores deputados federais da história, pior presidente que Brasil teve, vamos te derrotar dia 30/10/22 sei fim chegou, já levou uma cipuada no lombo e vai outra genocida.', 'textOriginal': 'O Satanás presidente da República, que não gosta de pobre, preguiçoso, vagabundo, miliciano, canibal, pilantra, racista, terrorista, foi mal militar, um piores deputados federais da história, pior presidente que Brasil teve, vamos te derrotar dia 30/10/22 sei fim chegou, já levou uma cipuada no lombo e vai outra genocida.', 'authorDisplayName': 'Edson Pedro', 'authorProfileImageUrl': 'https://yt3.ggpht.com/ytc/AGIKgqPiHordmPFcAkhUpncaUg2xwk_1L_qGIwpsMg=s48-c-k-c0x00ffffff-no-rj', 'authorChannelUrl': 'http://www.youtube.com/channel/UCAnIvdW_8foYPi1PAVZs6KA', 'authorChannelId': {'value': 'UCAnIvdW_8foYPi1PAVZs6KA'}, 'canRate': True, 'viewerRating': 'none', 'likeCount': 0, 'publishedAt': '2022-10-15T11:49:13Z', 'updatedAt': '2022-10-15T11:49:13Z'}}, 'canReply': True, 'totalReplyCount': 0, 'isPublic': True}",,UCAnIvdW_8foYPi1PAVZs6KA,2022-10-15T11:49:13Z,"O Satanás presidente da República, que não gosta de pobre, preguiçoso, vagabundo, miliciano, canibal, pilantra, racista, terrorista, foi mal militar, um piores deputados federais da história, pior presidente que Brasil teve, vamos te derrotar dia 30/10/22 sei fim chegou, já levou uma cipuada no lombo e vai outra genocida.",QURTSl9pM3JHX0lUT3c3RTZNR2FPSEFpb3pyeGRHSGxkRXdSaHJyekZPMk1zT1dYaXlsaWg0SHhOcFB6TF94TGZ3Sm1XMU9FSUUtWUpPaUlqZnJOUkdXX2RtY2ZCVThUZFE=,2023-06-08 12:26:04.841803
youtube#commentThread,n4q3czLrLO2hbHrQYlox9Wl50iY,UgxfYNtxvZmnQ1s00XR4AaABAg,"{'videoId': 'aTx_T2N2jhY', 'topLevelComment': {'kind': 'youtube#comment', 'etag': 'oiBUZ7BWKiqd99chFfYH8tB1c4Y', 'id': 'UgxfYNtxvZmnQ1s00XR4AaABAg', 'snippet': {'videoId': 'aTx_T2N2jhY', 'textDisplay': 'No dia 30 vamos mostrar nossa força  22 e o que o povo quer   Só ele pode salvar  o Brasil do partido do mal', 'textOriginal': 'No dia 30 vamos mostrar nossa força  22 e o que o povo quer   Só ele pode salvar  o Brasil do partido do mal', 'authorDisplayName': 'Sonia Maria', 'authorProfileImageUrl': 'https://yt3.ggpht.com/ytc/AGIKgqOjMzyFNLusojzw7hhZ4FH-0jnEBim5Oi3G2I_v_g=s48-c-k-c0x00ffffff-no-rj', 'authorChannelUrl': 'http://www.youtube.com/channel/UCfTKumpMRfvUNrnhTRBp9xg', 'authorChannelId': {'value': 'UCfTKumpMRfvUNrnhTRBp9xg'}, 'canRate': True, 'viewerRating': 'none', 'likeCount': 7, 'publishedAt': '2022-10-15T11:40:49Z', 'updatedAt': '2022-10-15T11:40:49Z'}}, 'canReply': True, 'totalReplyCount': 0, 'isPublic': True}",,UCfTKumpMRfvUNrnhTRBp9xg,2022-10-15T11:40:49Z,No dia 30 vamos mostrar nossa força  22 e o que o povo quer   Só ele pode salvar  o Brasil do partido do mal,QURTSl9pM3JHX0lUT3c3RTZNR2FPSEFpb3pyeGRHSGxkRXdSaHJyekZPMk1zT1dYaXlsaWg0SHhOcFB6TF94TGZ3Sm1XMU9FSUUtWUpPaUlqZnJOUkdXX2RtY2ZCVThUZFE=,2023-06-08 12:26:04.841803
youtube#commentThread,KHLsMhkWyKzv5zgzHD3g8EkIrwQ,Ugx3OIpu2843P_3yX5R4AaABAg,"{'videoId': 'aTx_T2N2jhY', 'topLevelComment': {'kind': 'youtube#comment', 'etag': 'uWQFkFdWCiW0AfBaUyQG0E4Iy4g', 'id': 'Ugx3OIpu2843P_3yX5R4AaABAg', 'snippet': {'videoId': 'aTx_T2N2jhY', 'textDisplay': 'Deus abençoe presidente', 'textOriginal': 'Deus abençoe presidente', 'authorDisplayName': 'zongo', 'authorProfileImageUrl': 'https://yt3.ggpht.com/ytc/AGIKgqPs3XyMDMUZU2dtEwwVqUtFtw8js7iJ-dwhLA=s48-c-k-c0x00ffffff-no-rj', 'authorChannelUrl': 'http://www.youtube.com/channel/UChJlwGhwP1yHg8Mte68h_4w', 'authorChannelId': {'value': 'UChJlwGhwP1yHg8Mte68h_4w'}, 'canRate': True, 'viewerRating': 'none', 'likeCount': 3, 'publishedAt': '2022-10-15T11:39:39Z', 'updatedAt': '2022-10-15T11:39:39Z'}}, 'canReply': True, 'totalReplyCount': 0, 'isPublic': True}",,UChJlwGhwP1yHg8Mte68h_4w,2022-10-15T11:39:39Z,Deus abençoe presidente,QURTSl9pM3JHX0lUT3c3RTZNR2FPSEFpb3pyeGRHSGxkRXdSaHJyekZPMk1zT1dYaXlsaWg0SHhOcFB6TF94TGZ3Sm1XMU9FSUUtWUpPaUlqZnJOUkdXX2RtY2ZCVThUZFE=,2023-06-08 12:26:04.841803
youtube#commentThread,do73Sm_0khj0ZhG037-3DQFJ2D8,UgwFCC1Y0d9XUIPJm6Z4AaABAg,"{'videoId': 'aTx_T2N2jhY', 'topLevelComment': {'kind': 'youtube#comment', 'etag': 'BhFeD93_QUbEU-XTDVXO48wD69o', 'id': 'UgwFCC1Y0d9XUIPJm6Z4AaABAg', 'snippet': {'videoId': 'aTx_T2N2jhY', 'textDisplay': 'Ninguém fala em fraude.  Porque?', 'textOriginal': 'Ninguém fala em fraude.  Porque?', 'authorDisplayName': 'Marcelo Basilio', 'authorProfileImageUrl': 'https://yt3.ggpht.com/ytc/AGIKgqMWnD_Xg7RQuqXhYbTI6wBfcaRf9Wcd4Flf39s-4g=s48-c-k-c0x00ffffff-no-rj', 'authorChannelUrl': 'http://www.youtube.com/channel/UC5VRTIO-Bo7N2eemgFGY0nw', 'authorChannelId': {'value': 'UC5VRTIO-Bo7N2eemgFGY0nw'}, 'canRate': True, 'viewerRating': 'none', 'likeCount': 2, 'publishedAt': '2022-10-15T11:34:49Z', 'updatedAt': '2022-10-15T11:34:49Z'}}, 'canReply': True, 'totalReplyCount': 0, 'isPublic': True}",,UC5VRTIO-Bo7N2eemgFGY0nw,2022-10-15T11:34:49Z,Ninguém fala em fraude.  Porque?,QURTSl9pM3JHX0lUT3c3RTZNR2FPSEFpb3pyeGRHSGxkRXdSaHJyekZPMk1zT1dYaXlsaWg0SHhOcFB6TF94TGZ3Sm1XMU9FSUUtWUpPaUlqZnJOUkdXX2RtY2ZCVThUZFE=,2023-06-08 12:26:04.841803
youtube#commentThread,bPgNbSiOiJbIGMY2MrA5DrfBGDs,UgxEQBC7NHXmnLq6le54AaABAg,"{'videoId': 'aTx_T2N2jhY', 'topLevelComment': {'kind': 'youtube#comment', 'etag': 'iT0LB8bqso9XxKY8QoC0ZY1tWGg', 'id': 'UgxEQBC7NHXmnLq6le54AaABAg', 'snippet': {'videoId': 'aTx_T2N2jhY', 'textDisplay': 'Use colete sr.presidente.vigie.', 'textOriginal': 'Use colete sr.presidente.vigie.', 'authorDisplayName': 'Josina mara Anjos', 'authorProfileImageUrl': 'https://yt3.ggpht.com/ytc/AGIKgqPWTAYkMDNx_yx6zmiy2LVxavoy3VDbuX7zeHwPqg=s48-c-k-c0x00ffffff-no-rj', 'authorChannelUrl': 'http://www.youtube.com/channel/UCtLlrnuAmcw6lV9PHqxa2_w', 'authorChannelId': {'value': 'UCtLlrnuAmcw6lV9PHqxa2_w'}, 'canRate': True, 'viewerRating': 'none', 'likeCount': 1, 'publishedAt': '2022-10-15T11:33:37Z', 'updatedAt': '2022-10-15T11:33:37Z'}}, 'canReply': True, 'totalReplyCount': 0, 'isPublic': True}",,UCtLlrnuAmcw6lV9PHqxa2_w,2022-10-15T11:33:37Z,Use colete sr.presidente.vigie.,QURTSl9pM3JHX0lUT3c3RTZNR2FPSEFpb3pyeGRHSGxkRXdSaHJyekZPMk1zT1dYaXlsaWg0SHhOcFB6TF94TGZ3Sm1XMU9FSUUtWUpPaUlqZnJOUkdXX2RtY2ZCVThUZFE=,2023-06-08 12:26:04.841803
youtube#commentThread,tZMlnyHk1fDgCsez5PDYA1BzeUo,UgyT7CmyG3ggNiQYYUF4AaABAg,"{'videoId': 'aTx_T2N2jhY', 'topLevelComment': {'kind': 'youtube#comment', 'etag': 'HBTcjzOmOY-_YLDLN7jESH88KKE', 'id': 'UgyT7CmyG3ggNiQYYUF4AaABAg', 'snippet': {'videoId': 'aTx_T2N2jhY', 'textDisplay': 'Será q não erraram o estado??  Gente d mais!!!!!', 'textOriginal': 'Será q não erraram o estado??  Gente d mais!!!!!', 'authorDisplayName': 'Danilo Rocha', 'authorProfileImageUrl': 'https://yt3.ggpht.com/ytc/AGIKgqOD2DhYZsL-eOhoQtqXK6h8_gePmnYKtqUJtw=s48-c-k-c0x00ffffff-no-rj', 'authorChannelUrl': 'http://www.youtube.com/channel/UCio8W-g68Cu_MgeXxjFT5Ow', 'authorChannelId': {'value': 'UCio8W-g68Cu_MgeXxjFT5Ow'}, 'canRate': True, 'viewerRating': 'none', 'likeCount': 3, 'publishedAt': '2022-10-15T11:32:27Z', 'updatedAt': '2022-10-15T11:32:27Z'}}, 'canReply': True, 'totalReplyCount': 0, 'isPublic': True}",,UCio8W-g68Cu_MgeXxjFT5Ow,2022-10-15T11:32:27Z,Será q não erraram o estado??  Gente d mais!!!!!,QURTSl9pM3JHX0lUT3c3RTZNR2FPSEFpb3pyeGRHSGxkRXdSaHJyekZPMk1zT1dYaXlsaWg0SHhOcFB6TF94TGZ3Sm1XMU9FSUUtWUpPaUlqZnJOUkdXX2RtY2ZCVThUZFE=,2023-06-08 12:26:04.841803
youtube#commentThread,UK0PqwMyZCOxE5cyBjGk-frPE-o,Ugxecpfgwbq2R3AQQrt4AaABAg,"{'videoId': 'aTx_T2N2jhY', 'topLevelComment': {'kind': 'youtube#comment', 'etag': 'BU0ObO9SHiAJjcC4hTTnSF2lAvM', 'id': 'Ugxecpfgwbq2R3AQQrt4AaABAg', 'snippet': {'videoId': 'aTx_T2N2jhY', 'textDisplay': 'Estamos juntos presidente Bolsonaro', 'textOriginal': 'Estamos juntos presidente Bolsonaro', 'authorDisplayName': 'Marcos Oliveira', 'authorProfileImageUrl': 'https://yt3.ggpht.com/ytc/AGIKgqMidYXxBBaHeYcH3FRIHGk_jquYjW4JllUfkCL08g=s48-c-k-c0x00ffffff-no-rj', 'authorChannelUrl': 'http://www.youtube.com/channel/UCaj253V_PUn6EsnO9xhkdbw', 'authorChannelId': {'value': 'UCaj253V_PUn6EsnO9xhkdbw'}, 'canRate': True, 'viewerRating': 'none', 'likeCount': 2, 'publishedAt': '2022-10-15T11:31:57Z', 'updatedAt': '2022-10-15T11:31:57Z'}}, 'canReply': True, 'totalReplyCount': 0, 'isPublic': True}",,UCaj253V_PUn6EsnO9xhkdbw,2022-10-15T11:31:57Z,Estamos juntos presidente Bolsonaro,QURTSl9pM3JHX0lUT3c3RTZNR2FPSEFpb3pyeGRHSGxkRXdSaHJyekZPMk1zT1dYaXlsaWg0SHhOcFB6TF94TGZ3Sm1XMU9FSUUtWUpPaUlqZnJOUkdXX2RtY2ZCVThUZFE=,2023-06-08 12:26:04.841803
youtube#commentThread,IR6mZ-s910ha17ZMzXNQAgt7OD4,UgxNNXYlHlKFJ3gjkNh4AaABAg,"{'videoId': 'aTx_T2N2jhY', 'topLevelComment': {'kind': 'youtube#comment', 'etag': '1JldQaEzU1ALmTz8Cu5w5377mcg', 'id': 'UgxNNXYlHlKFJ3gjkNh4AaABAg', 'snippet': {'videoId': 'aTx_T2N2jhY', 'textDisplay': 'Piauiense quero ver todos nas urnas , reelegendo nosso Presidente 22.', 'textOriginal': 'Piauiense quero ver todos nas urnas , reelegendo nosso Presidente 22.', 'authorDisplayName': 'Maria de Jesus', 'authorProfileImageUrl': 'https://yt3.ggpht.com/ytc/AGIKgqMSap2sMRZDaa6KG4z80mM_dU5YSSf9UQgiWFC8WQI2N0__S7erhuq77OLUVUwR=s48-c-k-c0x00ffffff-no-rj', 'authorChannelUrl': 'http://www.youtube.com/channel/UCua6jf7vo_NXfsOSsHSCNsA', 'authorChannelId': {'value': 'UCua6jf7vo_NXfsOSsHSCNsA'}, 'canRate': True, 'viewerRating': 'none', 'likeCount': 1, 'publishedAt': '2022-10-15T11:31:45Z', 'updatedAt': '2022-10-15T11:31:45Z'}}, 'canReply': True, 'totalReplyCount': 0, 'isPublic': True}",,UCua6jf7vo_NXfsOSsHSCNsA,2022-10-15T11:31:45Z,"Piauiense quero ver todos nas urnas , reelegendo nosso Presidente 22.",QURTSl9pM3JHX0lUT3c3RTZNR2FPSEFpb3pyeGRHSGxkRXdSaHJyekZPMk1zT1dYaXlsaWg0SHhOcFB6TF94TGZ3Sm1XMU9FSUUtWUpPaUlqZnJOUkdXX2RtY2ZCVThUZFE=,2023-06-08 12:26:04.841803
