kind,etag,id,snippet,replies,authorChannelId,publishedAt,textOriginal,nextPageToken,extraction_date
youtube#commentThread,0rqEgDbArhuMzHq1X9nYERAmuyQ,UgwQscVUlsFKQI12uC54AaABAg,"{'videoId': 'DRaQO2EoHQo', 'topLevelComment': {'kind': 'youtube#comment', 'etag': 'XOvWut6OAYlGsJKPrAXXHm1PbK0', 'id': 'UgwQscVUlsFKQI12uC54AaABAg', 'snippet': {'videoId': 'DRaQO2EoHQo', 'textDisplay': 'FELIPE MARAVILHOSO SEMPREEEEE😍🥰', 'textOriginal': 'FELIPE MARAVILHOSO SEMPREEEEE😍🥰', 'authorDisplayName': 'Flor Eunice Moreira Gonçalves', 'authorProfileImageUrl': 'https://yt3.ggpht.com/CCTGIGWGJNRGci2n5rp7Bt_7gWN5UJ8KhC1rp0KCT3Asg2RWOFtzBlhen7-ZbfMegYT1zsr4ylg=s48-c-k-c0x00ffffff-no-rj', 'authorChannelUrl': 'http://www.youtube.com/channel/UCyd8iimU8n7LyClTvjSZpTA', 'authorChannelId': {'value': 'UCyd8iimU8n7LyClTvjSZpTA'}, 'canRate': True, 'viewerRating': 'none', 'likeCount': 2, 'publishedAt': '2022-10-27T19:47:07Z', 'updatedAt': '2022-10-27T19:47:07Z'}}, 'canReply': True, 'totalReplyCount': 0, 'isPublic': True}",,UCyd8iimU8n7LyClTvjSZpTA,2022-10-27T19:47:07Z,FELIPE MARAVILHOSO SEMPREEEEE😍🥰,,2023-06-09 15:00:29.155052
youtube#commentThread,Jo9bFlxbkgNSvSdjs-wSP8Wdb1Y,UgwoldnLla8QrWG0_ft4AaABAg,"{'videoId': 'DRaQO2EoHQo', 'topLevelComment': {'kind': 'youtube#comment', 'etag': 'aU-G6vu8SJNiMP1cyYTMOilNha4', 'id': 'UgwoldnLla8QrWG0_ft4AaABAg', 'snippet': {'videoId': 'DRaQO2EoHQo', 'textDisplay': '&lt;iframe width=&quot;320&quot; height=&quot;486&quot; src=&quot;<a href=""https://www.youtube.com/embed/i0osAuZcL4g"">https://www.youtube.com/embed/i0osAuZcL4g</a>&quot; title=&quot;PERSEGUIDO POR FALAR A VERDADE!&quot; frameborder=&quot;0&quot; allow=&quot;accelerometer; autoplay; clipboard-write; encrypted-media; gyroscope; picture-in-picture&quot; allowfullscreen&gt;&lt;/iframe&gt;', 'textOriginal': '<iframe width=""320"" height=""486"" src=""https://www.youtube.com/embed/i0osAuZcL4g"" title=""PERSEGUIDO POR FALAR A VERDADE!"" frameborder=""0"" allow=""accelerometer; autoplay; clipboard-write; encrypted-media; gyroscope; picture-in-picture"" allowfullscreen></iframe>', 'authorDisplayName': 'Mirian Guggenberger', 'authorProfileImageUrl': 'https://yt3.ggpht.com/ytc/AGIKgqPC68Rl442Hem2q1AZZ1dAuIv-l4T98_i_NdQ=s48-c-k-c0x00ffffff-no-rj', 'authorChannelUrl': 'http://www.youtube.com/channel/UCqaF3b7632NlWP-fazhws2g', 'authorChannelId': {'value': 'UCqaF3b7632NlWP-fazhws2g'}, 'canRate': True, 'viewerRating': 'none', 'likeCount': 0, 'publishedAt': '2022-10-27T11:47:27Z', 'updatedAt': '2022-10-27T11:47:27Z'}}, 'canReply': True, 'totalReplyCount': 0, 'isPublic': True}",,UCqaF3b7632NlWP-fazhws2g,2022-10-27T11:47:27Z,"<iframe width=""320"" height=""486"" src=""https://www.youtube.com/embed/i0osAuZcL4g"" title=""PERSEGUIDO POR FALAR A VERDADE!"" frameborder=""0"" allow=""accelerometer; autoplay; clipboard-write; encrypted-media; gyroscope; picture-in-picture"" allowfullscreen></iframe>",,2023-06-09 15:00:29.155052
youtube#commentThread,YMNziWqjJX8wfMcKOLOVcQ6YYIc,UgzXAVUhfvPOac7H1YN4AaABAg,"{'videoId': 'DRaQO2EoHQo', 'topLevelComment': {'kind': 'youtube#comment', 'etag': 'HpgKygTSt-zIkuXkjmWJ3iUxwao', 'id': 'UgzXAVUhfvPOac7H1YN4AaABAg', 'snippet': {'videoId': 'DRaQO2EoHQo', 'textDisplay': 'E o fim esse orçamento secreto.', 'textOriginal': 'E o fim esse orçamento secreto.', 'authorDisplayName': 'Marli Longo Crispim', 'authorProfileImageUrl': 'https://yt3.ggpht.com/ytc/AGIKgqNIB4r45l3CpMtYYkPI_C1DCbUeF_wfIa6tRMSle-U=s48-c-k-c0x00ffffff-no-rj', 'authorChannelUrl': 'http://www.youtube.com/channel/UCECuj-jFzpqp9doTjMj7YHA', 'authorChannelId': {'value': 'UCECuj-jFzpqp9doTjMj7YHA'}, 'canRate': True, 'viewerRating': 'none', 'likeCount': 0, 'publishedAt': '2022-10-27T01:02:49Z', 'updatedAt': '2022-10-27T01:02:49Z'}}, 'canReply': True, 'totalReplyCount': 0, 'isPublic': True}",,UCECuj-jFzpqp9doTjMj7YHA,2022-10-27T01:02:49Z,E o fim esse orçamento secreto.,,2023-06-09 15:00:29.155052
youtube#commentThread,XZS0cBBqfSmVfqjTlw5J90FLaOo,UgzebTfsA181Mwp46ix4AaABAg,"{'videoId': 'DRaQO2EoHQo', 'topLevelComment': {'kind': 'youtube#comment', 'etag': '9IMAc0dvnWeQOjpNa0ADbR829bY', 'id': 'UgzebTfsA181Mwp46ix4AaABAg', 'snippet': {'videoId': 'DRaQO2EoHQo', 'textDisplay': 'O nariz do Bozo tá só que cresce...E o pior que tem um monte de gente q acredita..', 'textOriginal': 'O nariz do Bozo tá só que cresce...E o pior que tem um monte de gente q acredita..', 'authorDisplayName': 'C Menezes', 'authorProfileImageUrl': 'https://yt3.ggpht.com/45Olv0HsbBhNWU6k6inOq7DVO_e7G_Mq5V7hZnq0lrvy-ufALwPML_82lBYjkL3lI_Pa-opJSQk=s48-c-k-c0x00ffffff-no-rj', 'authorChannelUrl': 'http://www.youtube.com/channel/UCUuJ19vm3gzS2vb6C_zlOlA', 'authorChannelId': {'value': 'UCUuJ19vm3gzS2vb6C_zlOlA'}, 'canRate': True, 'viewerRating': 'none', 'likeCount': 0, 'publishedAt': '2022-10-26T20:37:50Z', 'updatedAt': '2022-10-26T20:37:50Z'}}, 'canReply': True, 'totalReplyCount': 0, 'isPublic': True}",,UCUuJ19vm3gzS2vb6C_zlOlA,2022-10-26T20:37:50Z,O nariz do Bozo tá só que cresce...E o pior que tem um monte de gente q acredita..,,2023-06-09 15:00:29.155052
youtube#commentThread,F1lMAYiWzYjrn8zy7OGfHUci2rI,Ugyhte-ScU1xni1thHh4AaABAg,"{'videoId': 'DRaQO2EoHQo', 'topLevelComment': {'kind': 'youtube#comment', 'etag': 'zLDJn7hC-JacQcc5gKcS9sM5ymE', 'id': 'Ugyhte-ScU1xni1thHh4AaABAg', 'snippet': {'videoId': 'DRaQO2EoHQo', 'textDisplay': 'Felipe Moura se vendeu...', 'textOriginal': 'Felipe Moura se vendeu...', 'authorDisplayName': 'Alma+naki', 'authorProfileImageUrl': 'https://yt3.ggpht.com/maHpkkgvgrKLRxQdJq-aTSeVjTZ9UmiUrdUFxQIvYWd7NkPyIo2quFSz4zJZKLFX31p9Oz7_Gw=s48-c-k-c0x00ffffff-no-rj', 'authorChannelUrl': 'http://www.youtube.com/channel/UCax7UfObUrBK6skV8qiqkgg', 'authorChannelId': {'value': 'UCax7UfObUrBK6skV8qiqkgg'}, 'canRate': True, 'viewerRating': 'none', 'likeCount': 0, 'publishedAt': '2022-10-26T18:14:25Z', 'updatedAt': '2022-10-26T18:14:25Z'}}, 'canReply': True, 'totalReplyCount': 0, 'isPublic': True}",,UCax7UfObUrBK6skV8qiqkgg,2022-10-26T18:14:25Z,Felipe Moura se vendeu...,,2023-06-09 15:00:29.155052
youtube#commentThread,76R4fXARJ_3zw-zSuRK3sNEr64Y,UgycR9LMZ5plvbzxkvd4AaABAg,"{'videoId': 'DRaQO2EoHQo', 'topLevelComment': {'kind': 'youtube#comment', 'etag': 'glplgtGc7KFONFmCLj07XJV4_vg', 'id': 'UgycR9LMZ5plvbzxkvd4AaABAg', 'snippet': {'videoId': 'DRaQO2EoHQo', 'textDisplay': 'Essas eleições depois que &quot;limaram&quot; as propagandas do atual presidente. Vejo que o sistema esta doido pro ladrão (lula) voltar a cena do crime.<br>Parabéns uol..folha... Globo.<br>Eleições sujas a favor de um ladrão', 'textOriginal': 'Essas eleições depois que ""limaram"" as propagandas do atual presidente. Vejo que o sistema esta doido pro ladrão (lula) voltar a cena do crime.\\nParabéns uol..folha... Globo.\\nEleições sujas a favor de um ladrão', 'authorDisplayName': 'Alma+naki', 'authorProfileImageUrl': 'https://yt3.ggpht.com/maHpkkgvgrKLRxQdJq-aTSeVjTZ9UmiUrdUFxQIvYWd7NkPyIo2quFSz4zJZKLFX31p9Oz7_Gw=s48-c-k-c0x00ffffff-no-rj', 'authorChannelUrl': 'http://www.youtube.com/channel/UCax7UfObUrBK6skV8qiqkgg', 'authorChannelId': {'value': 'UCax7UfObUrBK6skV8qiqkgg'}, 'canRate': True, 'viewerRating': 'none', 'likeCount': 0, 'publishedAt': '2022-10-26T18:13:21Z', 'updatedAt': '2022-10-26T18:13:21Z'}}, 'canReply': True, 'totalReplyCount': 0, 'isPublic': True}",,UCax7UfObUrBK6skV8qiqkgg,2022-10-26T18:13:21Z,"Essas eleições depois que ""limaram"" as propagandas do atual presidente. Vejo que o sistema esta doido pro ladrão (lula) voltar a cena do crime.
Parabéns uol..folha... Globo.
Eleições sujas a favor de um ladrão",,2023-06-09 15:00:29.155052
youtube#commentThread,xZzI007Bvh8Hfm6rHfFNfxkwCkk,UgxpuHyEP7qvMUbjBMN4AaABAg,"{'videoId': 'DRaQO2EoHQo', 'topLevelComment': {'kind': 'youtube#comment', 'etag': 'plFP_tX5BLqxP7ElJcl26vmoYko', 'id': 'UgxpuHyEP7qvMUbjBMN4AaABAg', 'snippet': {'videoId': 'DRaQO2EoHQo', 'textDisplay': 'Aqui esclareço 90% das fakenews que ouço kkkkkkkk e vejo sendo repassadas. Logo lembro de vcs!', 'textOriginal': 'Aqui esclareço 90% das fakenews que ouço kkkkkkkk e vejo sendo repassadas. Logo lembro de vcs!', 'authorDisplayName': 'Mah Paulita Borges', 'authorProfileImageUrl': 'https://yt3.ggpht.com/ytc/AGIKgqMeHNlNfbl7FWkBx_bhzkDKd5UJYXsFW9An3g=s48-c-k-c0x00ffffff-no-rj', 'authorChannelUrl': 'http://www.youtube.com/channel/UCnzmHMRsrnSQJ2rEoUdNQgg', 'authorChannelId': {'value': 'UCnzmHMRsrnSQJ2rEoUdNQgg'}, 'canRate': True, 'viewerRating': 'none', 'likeCount': 0, 'publishedAt': '2022-10-26T17:16:29Z', 'updatedAt': '2022-10-26T17:16:29Z'}}, 'canReply': True, 'totalReplyCount': 0, 'isPublic': True}",,UCnzmHMRsrnSQJ2rEoUdNQgg,2022-10-26T17:16:29Z,Aqui esclareço 90% das fakenews que ouço kkkkkkkk e vejo sendo repassadas. Logo lembro de vcs!,,2023-06-09 15:00:29.155052
youtube#commentThread,-Dulh3fdc6YWeGvg0uTtzwGqsG8,Ugx0PQVooC6TjOV8MCd4AaABAg,"{'videoId': 'DRaQO2EoHQo', 'topLevelComment': {'kind': 'youtube#comment', 'etag': 'dHMwdE8K8s_JHvNsZIKrSdOUKpw', 'id': 'Ugx0PQVooC6TjOV8MCd4AaABAg', 'snippet': {'videoId': 'DRaQO2EoHQo', 'textDisplay': 'Vcs são ótimos, a melhor live', 'textOriginal': 'Vcs são ótimos, a melhor live', 'authorDisplayName': 'Desiree d', 'authorProfileImageUrl': 'https://yt3.ggpht.com/ytc/AGIKgqNfoeH301qmbSj5TG70MaexFITpswjcmd-NNQ=s48-c-k-c0x00ffffff-no-rj', 'authorChannelUrl': 'http://www.youtube.com/channel/UCNMQdNAlaZXF5cDPqY8cjzQ', 'authorChannelId': {'value': 'UCNMQdNAlaZXF5cDPqY8cjzQ'}, 'canRate': True, 'viewerRating': 'none', 'likeCount': 1, 'publishedAt': '2022-10-26T16:04:55Z', 'updatedAt': '2022-10-26T16:04:55Z'}}, 'canReply': True, 'totalReplyCount': 0, 'isPublic': True}",,UCNMQdNAlaZXF5cDPqY8cjzQ,2022-10-26T16:04:55Z,"Vcs são ótimos, a melhor live",,2023-06-09 15:00:29.155052
youtube#commentThread,Fve80QqtsOo8fjPZitAZcQhIB98,UgwKdRuarhuCWO0HT114AaABAg,"{'videoId': 'DRaQO2EoHQo', 'topLevelComment': {'kind': 'youtube#comment', 'etag': '-u8KPSymtt3iTDRFgk3f7RhCFnA', 'id': 'UgwKdRuarhuCWO0HT114AaABAg', 'snippet': {'videoId': 'DRaQO2EoHQo', 'textDisplay': 'Vcs são nojentos mentirosos arrogantes,se o mula entrar vcs serão cobrados pelas desgraças no brasil', 'textOriginal': 'Vcs são nojentos mentirosos arrogantes,se o mula entrar vcs serão cobrados pelas desgraças no brasil', 'authorDisplayName': 'Patricia Perfeito', 'authorProfileImageUrl': 'https://yt3.ggpht.com/ytc/AGIKgqP4Z1bU9A3AeinduOqW_KCBT3fOrXXci5YT79-HIQ=s48-c-k-c0x00ffffff-no-rj', 'authorChannelUrl': 'http://www.youtube.com/channel/UCltB-kUesInDCKZzYkUVnyQ', 'authorChannelId': {'value': 'UCltB-kUesInDCKZzYkUVnyQ'}, 'canRate': True, 'viewerRating': 'none', 'likeCount': 0, 'publishedAt': '2022-10-26T15:56:39Z', 'updatedAt': '2022-10-26T15:56:39Z'}}, 'canReply': True, 'totalReplyCount': 0, 'isPublic': True}",,UCltB-kUesInDCKZzYkUVnyQ,2022-10-26T15:56:39Z,"Vcs são nojentos mentirosos arrogantes,se o mula entrar vcs serão cobrados pelas desgraças no brasil",,2023-06-09 15:00:29.155052
youtube#commentThread,Vd1mwY0OsCcRprMc3j_PCfvK1q8,Ugy0o84WduCdkfyM8fR4AaABAg,"{'videoId': 'DRaQO2EoHQo', 'topLevelComment': {'kind': 'youtube#comment', 'etag': 'jCJy2Bo5hhf6khTBKXYSYcX1VWM', 'id': 'Ugy0o84WduCdkfyM8fR4AaABAg', 'snippet': {'videoId': 'DRaQO2EoHQo', 'textDisplay': 'iaudheiuhdiaudhau Hermes e Renato', 'textOriginal': 'iaudheiuhdiaudhau Hermes e Renato', 'authorDisplayName': 'Luiz Paulo Freitas', 'authorProfileImageUrl': 'https://yt3.ggpht.com/ytc/AGIKgqPqDYHIks0V2UQK7XGoKPuxBAlC7PXBsCJSzvS0cQ=s48-c-k-c0x00ffffff-no-rj', 'authorChannelUrl': 'http://www.youtube.com/channel/UC1fvCKnrNggivRYJUQ-wygQ', 'authorChannelId': {'value': 'UC1fvCKnrNggivRYJUQ-wygQ'}, 'canRate': True, 'viewerRating': 'none', 'likeCount': 0, 'publishedAt': '2022-10-26T13:08:30Z', 'updatedAt': '2022-10-26T13:08:30Z'}}, 'canReply': True, 'totalReplyCount': 0, 'isPublic': True}",,UC1fvCKnrNggivRYJUQ-wygQ,2022-10-26T13:08:30Z,iaudheiuhdiaudhau Hermes e Renato,,2023-06-09 15:00:29.155052
youtube#commentThread,KRj8qiJ7B3Z-vJY6d9EZp5ay5X4,UgwwLYzC_4m1AOUlr-N4AaABAg,"{'videoId': 'DRaQO2EoHQo', 'topLevelComment': {'kind': 'youtube#comment', 'etag': '2IGoIAu9objGYpHt178TO0H1C6w', 'id': 'UgwwLYzC_4m1AOUlr-N4AaABAg', 'snippet': {'videoId': 'DRaQO2EoHQo', 'textDisplay': 'Salve, salve Felipe e Madeleine.<br>Que Deus os abençoe 🙏', 'textOriginal': 'Salve, salve Felipe e Madeleine.\\nQue Deus os abençoe 🙏', 'authorDisplayName': 'Imaculada Magalhães', 'authorProfileImageUrl': 'https://yt3.ggpht.com/ytc/AGIKgqNJaNLXalSgg30bV6A631KMl-5Gzpywh34DVbr1urJTzGEZP0VTzRLxynoevorX=s48-c-k-c0x00ffffff-no-rj', 'authorChannelUrl': 'http://www.youtube.com/channel/UCu6HyWtdduiPHAkD3DwwXjw', 'authorChannelId': {'value': 'UCu6HyWtdduiPHAkD3DwwXjw'}, 'canRate': True, 'viewerRating': 'none', 'likeCount': 1, 'publishedAt': '2022-10-26T12:37:45Z', 'updatedAt': '2022-10-26T12:37:45Z'}}, 'canReply': True, 'totalReplyCount': 0, 'isPublic': True}",,UCu6HyWtdduiPHAkD3DwwXjw,2022-10-26T12:37:45Z,"Salve, salve Felipe e Madeleine.
Que Deus os abençoe 🙏",,2023-06-09 15:00:29.155052
youtube#commentThread,TQlufFm3hK77cpmvY1N7D1CQj14,UgzxsuXaPEdYcnx45Pp4AaABAg,"{'videoId': 'DRaQO2EoHQo', 'topLevelComment': {'kind': 'youtube#comment', 'etag': 'T4hogzr4CSHsIQZG5DAwLWX30XI', 'id': 'UgzxsuXaPEdYcnx45Pp4AaABAg', 'snippet': {'videoId': 'DRaQO2EoHQo', 'textDisplay': 'Aproveita bem MADELEINE LACSKO que vai passar seu tempo encima do muro. E ainda estudou na ECA. Fico constrangido por nós todos Uspianos.', 'textOriginal': 'Aproveita bem MADELEINE LACSKO que vai passar seu tempo encima do muro. E ainda estudou na ECA. Fico constrangido por nós todos Uspianos.', 'authorDisplayName': 'marcos pedroso', 'authorProfileImageUrl': 'https://yt3.ggpht.com/V0vlXxAj1hfs2tS-spO736fCx9Q23I61vWIR38eAayV-UIIJ_p44ScKCnb95LhyS6HTpRl3tMQ=s48-c-k-c0x00ffffff-no-rj', 'authorChannelUrl': 'http://www.youtube.com/channel/UCBRbRzSgtS1jKfRy_Se2NVw', 'authorChannelId': {'value': 'UCBRbRzSgtS1jKfRy_Se2NVw'}, 'canRate': True, 'viewerRating': 'none', 'likeCount': 0, 'publishedAt': '2022-10-26T12:30:31Z', 'updatedAt': '2022-10-26T12:30:31Z'}}, 'canReply': True, 'totalReplyCount': 0, 'isPublic': True}",,UCBRbRzSgtS1jKfRy_Se2NVw,2022-10-26T12:30:31Z,Aproveita bem MADELEINE LACSKO que vai passar seu tempo encima do muro. E ainda estudou na ECA. Fico constrangido por nós todos Uspianos.,,2023-06-09 15:00:29.155052
youtube#commentThread,_jARgVFXjkf04xkjBzBHDnS9bfc,Ugyiq1lnS9n0AJ2dD5Z4AaABAg,"{'videoId': 'DRaQO2EoHQo', 'topLevelComment': {'kind': 'youtube#comment', 'etag': 'OIJuvKqDyLg0KE4ZP7CQ_0OFL6s', 'id': 'Ugyiq1lnS9n0AJ2dD5Z4AaABAg', 'snippet': {'videoId': 'DRaQO2EoHQo', 'textDisplay': 'Vocês dois são MARAVILHOSOS!! QUE LEGAL ASSISTIR ESSE PROGRAMA 😃. PARABÉNS 🎊👏', 'textOriginal': 'Vocês dois são MARAVILHOSOS!! QUE LEGAL ASSISTIR ESSE PROGRAMA 😃. PARABÉNS 🎊👏', 'authorDisplayName': 'CRIS', 'authorProfileImageUrl': 'https://yt3.ggpht.com/ytc/AGIKgqMkan7NB5DCHpBbAo_iFAEHJHT3TkfXVPuoLgX_=s48-c-k-c0x00ffffff-no-rj', 'authorChannelUrl': 'http://www.youtube.com/channel/UC4KHODrrtPRfUmzK1Yp_ZfQ', 'authorChannelId': {'value': 'UC4KHODrrtPRfUmzK1Yp_ZfQ'}, 'canRate': True, 'viewerRating': 'none', 'likeCount': 5, 'publishedAt': '2022-10-26T11:40:31Z', 'updatedAt': '2022-10-26T11:40:31Z'}}, 'canReply': True, 'totalReplyCount': 0, 'isPublic': True}",,UC4KHODrrtPRfUmzK1Yp_ZfQ,2022-10-26T11:40:31Z,Vocês dois são MARAVILHOSOS!! QUE LEGAL ASSISTIR ESSE PROGRAMA 😃. PARABÉNS 🎊👏,,2023-06-09 15:00:29.155052
youtube#commentThread,RP6Pg3WMRWYgva_SwJLkPl-_BPI,UgxhRTIMUS8kqJ6Tach4AaABAg,"{'videoId': 'DRaQO2EoHQo', 'topLevelComment': {'kind': 'youtube#comment', 'etag': 'TIptbKRVRnrvMaEY4D3ExybhOco', 'id': 'UgxhRTIMUS8kqJ6Tach4AaABAg', 'snippet': {'videoId': 'DRaQO2EoHQo', 'textDisplay': 'SALVE SALVE FELIPE MOURA BRASIL e MADA', 'textOriginal': 'SALVE SALVE FELIPE MOURA BRASIL e MADA', 'authorDisplayName': 'Rosa Maria', 'authorProfileImageUrl': 'https://yt3.ggpht.com/ytc/AGIKgqP7i2eOKq2tKXMNa7RKYf5tpGrhfpniOKMFfQ=s48-c-k-c0x00ffffff-no-rj', 'authorChannelUrl': 'http://www.youtube.com/channel/UCVhoWAlbju3kShWk7qk19nQ', 'authorChannelId': {'value': 'UCVhoWAlbju3kShWk7qk19nQ'}, 'canRate': True, 'viewerRating': 'none', 'likeCount': 1, 'publishedAt': '2022-10-26T10:07:45Z', 'updatedAt': '2022-10-26T10:07:45Z'}}, 'canReply': True, 'totalReplyCount': 0, 'isPublic': True}",,UCVhoWAlbju3kShWk7qk19nQ,2022-10-26T10:07:45Z,SALVE SALVE FELIPE MOURA BRASIL e MADA,,2023-06-09 15:00:29.155052
youtube#commentThread,XX7exoIuT5_MZ2NTHKM-AZEDQ08,UgyPWsjupKr9GP3aZc94AaABAg,"{'videoId': 'DRaQO2EoHQo', 'topLevelComment': {'kind': 'youtube#comment', 'etag': 'cbvHG-SiKxmWbesKeO2Eo-UkU60', 'id': 'UgyPWsjupKr9GP3aZc94AaABAg', 'snippet': {'videoId': 'DRaQO2EoHQo', 'textDisplay': 'Eduardo Leite já ganhou! Lorenzoni é péssimo e homofóbico! Moro, Eduardo Leite, Mara Gabrilli, Amoedo, Deltan, Doria são os nomes que vejo como liderança. Para além dos posicionamentos de ocasião e da correta neutralidade. Tebet, depois do “apoio incondicional” virou pó…  Atentos, Paulo Hartung e Edu Muffarej', 'textOriginal': 'Eduardo Leite já ganhou! Lorenzoni é péssimo e homofóbico! Moro, Eduardo Leite, Mara Gabrilli, Amoedo, Deltan, Doria são os nomes que vejo como liderança. Para além dos posicionamentos de ocasião e da correta neutralidade. Tebet, depois do “apoio incondicional” virou pó…  Atentos, Paulo Hartung e Edu Muffarej', 'authorDisplayName': 'Maria Renata Ribeiro Casella', 'authorProfileImageUrl': 'https://yt3.ggpht.com/ytc/AGIKgqNiOXjILTFan3fRX2IVljMYIQvgYTtJKOLl3thA=s48-c-k-c0x00ffffff-no-rj', 'authorChannelUrl': 'http://www.youtube.com/channel/UCvxWHMX5YqxOG_UgMyOPg6A', 'authorChannelId': {'value': 'UCvxWHMX5YqxOG_UgMyOPg6A'}, 'canRate': True, 'viewerRating': 'none', 'likeCount': 0, 'publishedAt': '2022-10-26T08:38:19Z', 'updatedAt': '2022-10-26T08:38:19Z'}}, 'canReply': True, 'totalReplyCount': 0, 'isPublic': True}",,UCvxWHMX5YqxOG_UgMyOPg6A,2022-10-26T08:38:19Z,"Eduardo Leite já ganhou! Lorenzoni é péssimo e homofóbico! Moro, Eduardo Leite, Mara Gabrilli, Amoedo, Deltan, Doria são os nomes que vejo como liderança. Para além dos posicionamentos de ocasião e da correta neutralidade. Tebet, depois do “apoio incondicional” virou pó…  Atentos, Paulo Hartung e Edu Muffarej",,2023-06-09 15:00:29.155052
youtube#commentThread,ju723iQCeZcHunnKmC7KWuLlyQI,Ugywe9U3T7mXogwOLhl4AaABAg,"{'videoId': 'DRaQO2EoHQo', 'topLevelComment': {'kind': 'youtube#comment', 'etag': 'xzbJLA2Rd-3KQzKe_E1tgcLa3WE', 'id': 'Ugywe9U3T7mXogwOLhl4AaABAg', 'snippet': {'videoId': 'DRaQO2EoHQo', 'textDisplay': 'Lula arrumara outro capacho, desejo que não seja a Simone Tebet. A decepção ja é enorme ( o tal “apoio incondicional” deu nojo ) , se for, para mim, virou pó!', 'textOriginal': 'Lula arrumara outro capacho, desejo que não seja a Simone Tebet. A decepção ja é enorme ( o tal “apoio incondicional” deu nojo ) , se for, para mim, virou pó!', 'authorDisplayName': 'Maria Renata Ribeiro Casella', 'authorProfileImageUrl': 'https://yt3.ggpht.com/ytc/AGIKgqNiOXjILTFan3fRX2IVljMYIQvgYTtJKOLl3thA=s48-c-k-c0x00ffffff-no-rj', 'authorChannelUrl': 'http://www.youtube.com/channel/UCvxWHMX5YqxOG_UgMyOPg6A', 'authorChannelId': {'value': 'UCvxWHMX5YqxOG_UgMyOPg6A'}, 'canRate': True, 'viewerRating': 'none', 'likeCount': 1, 'publishedAt': '2022-10-26T08:01:37Z', 'updatedAt': '2022-10-26T08:01:37Z'}}, 'canReply': True, 'totalReplyCount': 0, 'isPublic': True}",,UCvxWHMX5YqxOG_UgMyOPg6A,2022-10-26T08:01:37Z,"Lula arrumara outro capacho, desejo que não seja a Simone Tebet. A decepção ja é enorme ( o tal “apoio incondicional” deu nojo ) , se for, para mim, virou pó!",,2023-06-09 15:00:29.155052
youtube#commentThread,DumkmoS2g-CMRoYQXXr4B6UvN_A,UgyE4BSbYiqxaFnVmwN4AaABAg,"{'videoId': 'DRaQO2EoHQo', 'topLevelComment': {'kind': 'youtube#comment', 'etag': 'a_fGkyYUv0bGSn0higCxkukfdPI', 'id': 'UgyE4BSbYiqxaFnVmwN4AaABAg', 'snippet': {'videoId': 'DRaQO2EoHQo', 'textDisplay': 'Rodrigo Maia é culpado, sim! Mas… culpado por não ter pautado o <a href=""http://www.youtube.com/results?search_query=%23impeachmentdebolsonaro"">#impeachmentdebolsonaro</a> ( pt e Lula não quiseram tb, ta? )', 'textOriginal': 'Rodrigo Maia é culpado, sim! Mas… culpado por não ter pautado o #impeachmentdebolsonaro ( pt e Lula não quiseram tb, ta? )', 'authorDisplayName': 'Maria Renata Ribeiro Casella', 'authorProfileImageUrl': 'https://yt3.ggpht.com/ytc/AGIKgqNiOXjILTFan3fRX2IVljMYIQvgYTtJKOLl3thA=s48-c-k-c0x00ffffff-no-rj', 'authorChannelUrl': 'http://www.youtube.com/channel/UCvxWHMX5YqxOG_UgMyOPg6A', 'authorChannelId': {'value': 'UCvxWHMX5YqxOG_UgMyOPg6A'}, 'canRate': True, 'viewerRating': 'none', 'likeCount': 0, 'publishedAt': '2022-10-26T07:56:31Z', 'updatedAt': '2022-10-26T07:56:31Z'}}, 'canReply': True, 'totalReplyCount': 0, 'isPublic': True}",,UCvxWHMX5YqxOG_UgMyOPg6A,2022-10-26T07:56:31Z,"Rodrigo Maia é culpado, sim! Mas… culpado por não ter pautado o #impeachmentdebolsonaro ( pt e Lula não quiseram tb, ta? )",,2023-06-09 15:00:29.155052
youtube#commentThread,WrxxC245P9cUJlD6mdolC9iB25A,Ugy9Fk2yfmfCFLvYSzl4AaABAg,"{'videoId': 'DRaQO2EoHQo', 'topLevelComment': {'kind': 'youtube#comment', 'etag': 'HLgVqfIKdntgcrcLWvq8HpuMH8U', 'id': 'Ugy9Fk2yfmfCFLvYSzl4AaABAg', 'snippet': {'videoId': 'DRaQO2EoHQo', 'textDisplay': 'Felipe moura Brasil vc virou de lado?<br><br>Lembro de vc na jovem Pan , e te admirava,  vc era muito mais coerente , agora se rebaixou demais,  lamentável....', 'textOriginal': 'Felipe moura Brasil vc virou de lado?\\n\\nLembro de vc na jovem Pan , e te admirava,  vc era muito mais coerente , agora se rebaixou demais,  lamentável....', 'authorDisplayName': 'Fabiano Silva', 'authorProfileImageUrl': 'https://yt3.ggpht.com/ytc/AGIKgqPGP6X_Vmh6XVj06Bn1SN-OsSqMge2qsDalyepo=s48-c-k-c0x00ffffff-no-rj', 'authorChannelUrl': 'http://www.youtube.com/channel/UCSEyZhJWpv_wqMbUo8CO8OQ', 'authorChannelId': {'value': 'UCSEyZhJWpv_wqMbUo8CO8OQ'}, 'canRate': True, 'viewerRating': 'none', 'likeCount': 0, 'publishedAt': '2022-10-26T01:55:26Z', 'updatedAt': '2022-10-26T01:55:26Z'}}, 'canReply': True, 'totalReplyCount': 3, 'isPublic': True}","{'comments': [{'kind': 'youtube#comment', 'etag': 'DyUjztN8sX0CtqjIchSn2AqlTUQ', 'id': 'Ugy9Fk2yfmfCFLvYSzl4AaABAg.9hch9OaaVJa9hhJcU_gSI5', 'snippet': {'videoId': 'DRaQO2EoHQo', 'textDisplay': 'Ele é coerente. Se mantém com as mesmas opiniões desde a época do blog do pim. Continua o mesmo.', 'textOriginal': 'Ele é coerente. Se mantém com as mesmas opiniões desde a época do blog do pim. Continua o mesmo.', 'parentId': 'Ugy9Fk2yfmfCFLvYSzl4AaABAg', 'authorDisplayName': 'LeonardoJMJ', 'authorProfileImageUrl': 'https://yt3.ggpht.com/SmQhhBkHHBEO_46DBx-zwuZU0Oqd6C4wxOLwOxCaMHlJXhlkTHB137RDzc6W9KN5vwWHuKSdrA=s48-c-k-c0x00ffffff-no-rj', 'authorChannelUrl': 'http://www.youtube.com/channel/UCERYRpCUPa2DFQwGHY1cX7w', 'authorChannelId': {'value': 'UCERYRpCUPa2DFQwGHY1cX7w'}, 'canRate': True, 'viewerRating': 'none', 'likeCount': 0, 'publishedAt': '2022-10-27T20:57:17Z', 'updatedAt': '2022-10-27T20:57:17Z'}}, {'kind': 'youtube#comment', 'etag': 'Hq3ZpeOxBa5cW0EJLcwZ_Dag2w0', 'id': 'Ugy9Fk2yfmfCFLvYSzl4AaABAg.9hch9OaaVJa9hczrzLduWS', 'snippet': {'videoId': 'DRaQO2EoHQo', 'textDisplay': 'Ele procura ser isento.', 'textOriginal': 'Ele procura ser isento.', 'parentId': 'Ugy9Fk2yfmfCFLvYSzl4AaABAg', 'authorDisplayName': 'Pяоfessora MalυquiηΗaaåàăáа', 'authorProfileImageUrl': 'https://yt3.ggpht.com/ewlYrQfucs_lHsuYKbg5t0cjiJVZyuTs8-hrTzTOENwd3NQsUEEuX3ZdWUZ4CCKu9wXlBbDk=s48-c-k-c0x00ffffff-no-rj', 'authorChannelUrl': 'http://www.youtube.com/channel/UCshFmKOrchjkQrsHIjurpLA', 'authorChannelId': {'value': 'UCshFmKOrchjkQrsHIjurpLA'}, 'canRate': True, 'viewerRating': 'none', 'likeCount': 1, 'publishedAt': '2022-10-26T04:38:57Z', 'updatedAt': '2022-10-26T04:38:57Z'}}, {'kind': 'youtube#comment', 'etag': 'ny-Stfh1t9EKwqFiJOpJiqPr_fc', 'id': 'Ugy9Fk2yfmfCFLvYSzl4AaABAg.9hch9OaaVJa9hcjBey-Vnm', 'snippet': {'videoId': 'DRaQO2EoHQo', 'textDisplay': 'Never! Ta enrustido aí. Uma vez jovem pan sempre jovem pan', 'textOriginal': 'Never! Ta enrustido aí. Uma vez jovem pan sempre jovem pan', 'parentId': 'Ugy9Fk2yfmfCFLvYSzl4AaABAg', 'authorDisplayName': 'Abby Bia', 'authorProfileImageUrl': 'https://yt3.ggpht.com/ytc/AGIKgqNUgjehQcEwVcKr56U-YbuT44b1-tDNeIHY29vz=s48-c-k-c0x00ffffff-no-rj', 'authorChannelUrl': 'http://www.youtube.com/channel/UCD6N_K3Wvpipvym9AnVif9g', 'authorChannelId': {'value': 'UCD6N_K3Wvpipvym9AnVif9g'}, 'canRate': True, 'viewerRating': 'none', 'likeCount': 0, 'publishedAt': '2022-10-26T02:13:13Z', 'updatedAt': '2022-10-26T02:13:13Z'}}]}",UCSEyZhJWpv_wqMbUo8CO8OQ,2022-10-26T01:55:26Z,"Felipe moura Brasil vc virou de lado?

Lembro de vc na jovem Pan , e te admirava,  vc era muito mais coerente , agora se rebaixou demais,  lamentável....",,2023-06-09 15:00:29.155052
