kind,etag,id,snippet,replies,authorChannelId,publishedAt,textOriginal,nextPageToken,extraction_date
youtube#commentThread,YuQ43D1RdMdtiF9X2OrmKNB-cqg,Ugy6fxXkG6arV5KC1xl4AaABAg,"{'videoId': 'c5nN5D2DRqc', 'topLevelComment': {'kind': 'youtube#comment', 'etag': 'zjl2GRYoXEDeRwD3QLB5bV_hyLk', 'id': 'Ugy6fxXkG6arV5KC1xl4AaABAg', 'snippet': {'videoId': 'c5nN5D2DRqc', 'textDisplay': 'Estamos vendo a vontade do povo sendo ferida!!!! O GOLPE ESTÁ EM CURSO.....', 'textOriginal': 'Estamos vendo a vontade do povo sendo ferida!!!! O GOLPE ESTÁ EM CURSO.....', 'authorDisplayName': 'Sônia Gorete-Brasil', 'authorProfileImageUrl': 'https://yt3.ggpht.com/ytc/AGIKgqNlP7rvxUW4LjDH8bcYTGeqcMPV4n6SlL5JW7MSzg=s48-c-k-c0x00ffffff-no-rj', 'authorChannelUrl': 'http://www.youtube.com/channel/UCht5NDRtOoc8vnN7Fwq1pwg', 'authorChannelId': {'value': 'UCht5NDRtOoc8vnN7Fwq1pwg'}, 'canRate': True, 'viewerRating': 'none', 'likeCount': 0, 'publishedAt': '2022-10-30T19:12:33Z', 'updatedAt': '2022-10-30T19:12:33Z'}}, 'canReply': True, 'totalReplyCount': 0, 'isPublic': True}",,UCht5NDRtOoc8vnN7Fwq1pwg,2022-10-30T19:12:33Z,Estamos vendo a vontade do povo sendo ferida!!!! O GOLPE ESTÁ EM CURSO.....,QURTSl9pMnhCS0FuNHdCNjFmZlBjWUNzTm5OQmZhQ21PNFNDZXk5TVB3STF3dVpTUVMwUVNnRUFwYWp1bDF2X1hpNkFJYk9ybUplODNXQQ==,2023-06-09 14:19:19.770925
youtube#commentThread,OeR6NMVMShVt5jb_iuVDdu4Iogw,Ugwwda5ASg6gOvGTc8R4AaABAg,"{'videoId': 'c5nN5D2DRqc', 'topLevelComment': {'kind': 'youtube#comment', 'etag': 'aJ3YofSX52c9fOdK37kK6bbOfkE', 'id': 'Ugwwda5ASg6gOvGTc8R4AaABAg', 'snippet': {'videoId': 'c5nN5D2DRqc', 'textDisplay': 'País infelizmente de grande parte de canalhas', 'textOriginal': 'País infelizmente de grande parte de canalhas', 'authorDisplayName': 'Percepção atual', 'authorProfileImageUrl': 'https://yt3.ggpht.com/jr6JeK3ZJoaWvWHWzLWBb63_seJ9uUjqW3WzvxDbSTnIF3o2HwO_hqFOVeZgEI_9wYBNgAIH=s48-c-k-c0x00ffffff-no-rj', 'authorChannelUrl': 'http://www.youtube.com/channel/UC48tsXJY2jJRlGgsjj8v9uQ', 'authorChannelId': {'value': 'UC48tsXJY2jJRlGgsjj8v9uQ'}, 'canRate': True, 'viewerRating': 'none', 'likeCount': 1, 'publishedAt': '2022-10-30T19:12:29Z', 'updatedAt': '2022-10-30T19:12:29Z'}}, 'canReply': True, 'totalReplyCount': 0, 'isPublic': True}",,UC48tsXJY2jJRlGgsjj8v9uQ,2022-10-30T19:12:29Z,País infelizmente de grande parte de canalhas,QURTSl9pMnhCS0FuNHdCNjFmZlBjWUNzTm5OQmZhQ21PNFNDZXk5TVB3STF3dVpTUVMwUVNnRUFwYWp1bDF2X1hpNkFJYk9ybUplODNXQQ==,2023-06-09 14:19:19.770925
youtube#commentThread,2BNLh_G5-GTl31VtewUm9gyd1HU,UgyTON0bpV_MMiGPf9B4AaABAg,"{'videoId': 'c5nN5D2DRqc', 'topLevelComment': {'kind': 'youtube#comment', 'etag': '-sPIwNYk5ct5TYdxXVgCOspePAI', 'id': 'UgyTON0bpV_MMiGPf9B4AaABAg', 'snippet': {'videoId': 'c5nN5D2DRqc', 'textDisplay': 'ESSE  PISICOPATA  JENOCIDA QUE <br>GANHAR  NO  GRINTO MAIS NÃO  VAI <br>LULA PRESIDENTE ❤', 'textOriginal': 'ESSE  PISICOPATA  JENOCIDA QUE \\nGANHAR  NO  GRINTO MAIS NÃO  VAI \\nLULA PRESIDENTE ❤', 'authorDisplayName': 'Maria Cristina', 'authorProfileImageUrl': 'https://yt3.ggpht.com/ytc/AGIKgqOF063ABVIgNrvTg7g8GHLwfN9Ehl0MKlT5u75XNQXdPwIQFD9bDE-IMbZB6Ppw=s48-c-k-c0x00ffffff-no-rj', 'authorChannelUrl': 'http://www.youtube.com/channel/UCl76-LgxjvgQlnr5xDv08EA', 'authorChannelId': {'value': 'UCl76-LgxjvgQlnr5xDv08EA'}, 'canRate': True, 'viewerRating': 'none', 'likeCount': 0, 'publishedAt': '2022-10-30T19:12:20Z', 'updatedAt': '2022-10-30T19:12:20Z'}}, 'canReply': True, 'totalReplyCount': 0, 'isPublic': True}",,UCl76-LgxjvgQlnr5xDv08EA,2022-10-30T19:12:20Z,"ESSE  PISICOPATA  JENOCIDA QUE 
GANHAR  NO  GRINTO MAIS NÃO  VAI 
LULA PRESIDENTE ❤",QURTSl9pMnhCS0FuNHdCNjFmZlBjWUNzTm5OQmZhQ21PNFNDZXk5TVB3STF3dVpTUVMwUVNnRUFwYWp1bDF2X1hpNkFJYk9ybUplODNXQQ==,2023-06-09 14:19:19.770925
youtube#commentThread,s7OO-C-i1mjGeHOVnocUXPUE1w8,UgxwKgkSbHq9QoR_Xfp4AaABAg,"{'videoId': 'c5nN5D2DRqc', 'topLevelComment': {'kind': 'youtube#comment', 'etag': 'T42FA8nhgRM5PeZzXWIJikfzidY', 'id': 'UgxwKgkSbHq9QoR_Xfp4AaABAg', 'snippet': {'videoId': 'c5nN5D2DRqc', 'textDisplay': 'Isso é crime eleitoral! Isso é golpe. O povo Brasileiro tem o direito de votar!', 'textOriginal': 'Isso é crime eleitoral! Isso é golpe. O povo Brasileiro tem o direito de votar!', 'authorDisplayName': 'O PODER DA MUSIC', 'authorProfileImageUrl': 'https://yt3.ggpht.com/P9c4UZtXUhzZWpF52o7jnTmGwc_vQiX8KjVK_U1AbfnOPvM0Nm-Tc0AI4qxCDbPMiKHEx4ejMw=s48-c-k-c0x00ffffff-no-rj', 'authorChannelUrl': 'http://www.youtube.com/channel/UCYWoa8RYc3z5TYli8CqBCHQ', 'authorChannelId': {'value': 'UCYWoa8RYc3z5TYli8CqBCHQ'}, 'canRate': True, 'viewerRating': 'none', 'likeCount': 0, 'publishedAt': '2022-10-30T19:12:19Z', 'updatedAt': '2022-10-30T19:12:19Z'}}, 'canReply': True, 'totalReplyCount': 0, 'isPublic': True}",,UCYWoa8RYc3z5TYli8CqBCHQ,2022-10-30T19:12:19Z,Isso é crime eleitoral! Isso é golpe. O povo Brasileiro tem o direito de votar!,QURTSl9pMnhCS0FuNHdCNjFmZlBjWUNzTm5OQmZhQ21PNFNDZXk5TVB3STF3dVpTUVMwUVNnRUFwYWp1bDF2X1hpNkFJYk9ybUplODNXQQ==,2023-06-09 14:19:19.770925
youtube#commentThread,QXwdnHR_ZYk6TWQW96NVT8xYoM4,UgzL6R6uUL3n56RDz7J4AaABAg,"{'videoId': 'c5nN5D2DRqc', 'topLevelComment': {'kind': 'youtube#comment', 'etag': '0NnfjxEAAAEd6tPBXUMnttf-3nw', 'id': 'UgzL6R6uUL3n56RDz7J4AaABAg', 'snippet': {'videoId': 'c5nN5D2DRqc', 'textDisplay': 'Alagoas também está assim vai ficar muito gente sem votar', 'textOriginal': 'Alagoas também está assim vai ficar muito gente sem votar', 'authorDisplayName': 'Maria Lima', 'authorProfileImageUrl': 'https://yt3.ggpht.com/ytc/AGIKgqNxlR2i9pTAiNu8XBVVp5GjUxFQWQ_qWPbdoQ=s48-c-k-c0x00ffffff-no-rj', 'authorChannelUrl': 'http://www.youtube.com/channel/UC5yzqw5o9dDIRcAh4Wayqyg', 'authorChannelId': {'value': 'UC5yzqw5o9dDIRcAh4Wayqyg'}, 'canRate': True, 'viewerRating': 'none', 'likeCount': 2, 'publishedAt': '2022-10-30T19:12:10Z', 'updatedAt': '2022-10-30T19:12:10Z'}}, 'canReply': True, 'totalReplyCount': 0, 'isPublic': True}",,UC5yzqw5o9dDIRcAh4Wayqyg,2022-10-30T19:12:10Z,Alagoas também está assim vai ficar muito gente sem votar,QURTSl9pMnhCS0FuNHdCNjFmZlBjWUNzTm5OQmZhQ21PNFNDZXk5TVB3STF3dVpTUVMwUVNnRUFwYWp1bDF2X1hpNkFJYk9ybUplODNXQQ==,2023-06-09 14:19:19.770925
youtube#commentThread,65ZUdWmM-sE4hRjUhh192JtmK8c,Ugx391y6gl2jz9q_dbh4AaABAg,"{'videoId': 'c5nN5D2DRqc', 'topLevelComment': {'kind': 'youtube#comment', 'etag': '2HkaKPG8rm7tJMhPKK8o3IzZwco', 'id': 'Ugx391y6gl2jz9q_dbh4AaABAg', 'snippet': {'videoId': 'c5nN5D2DRqc', 'textDisplay': 'Estranho  essas operações  , sera porque, bem no dia da eleição, alguém acha que vai ganhar na força .', 'textOriginal': 'Estranho  essas operações  , sera porque, bem no dia da eleição, alguém acha que vai ganhar na força .', 'authorDisplayName': 'Valdecir Costa', 'authorProfileImageUrl': 'https://yt3.ggpht.com/ytc/AGIKgqPpcgkjA5P_vILZhUAmlWSSFpAYY7fxx5vKGg=s48-c-k-c0x00ffffff-no-rj', 'authorChannelUrl': 'http://www.youtube.com/channel/UC2WjvyK5xqTufkT4lWWMTIg', 'authorChannelId': {'value': 'UC2WjvyK5xqTufkT4lWWMTIg'}, 'canRate': True, 'viewerRating': 'none', 'likeCount': 3, 'publishedAt': '2022-10-30T19:12:09Z', 'updatedAt': '2022-10-30T19:12:09Z'}}, 'canReply': True, 'totalReplyCount': 0, 'isPublic': True}",,UC2WjvyK5xqTufkT4lWWMTIg,2022-10-30T19:12:09Z,"Estranho  essas operações  , sera porque, bem no dia da eleição, alguém acha que vai ganhar na força .",QURTSl9pMnhCS0FuNHdCNjFmZlBjWUNzTm5OQmZhQ21PNFNDZXk5TVB3STF3dVpTUVMwUVNnRUFwYWp1bDF2X1hpNkFJYk9ybUplODNXQQ==,2023-06-09 14:19:19.770925
youtube#commentThread,w8J6TxnkqQwJNYI8IDGeq6J-Pwc,UgxIkCGKAviUZjG202F4AaABAg,"{'videoId': 'c5nN5D2DRqc', 'topLevelComment': {'kind': 'youtube#comment', 'etag': 'a5t-KK37qlgxsmitKHWqRNumwsk', 'id': 'UgxIkCGKAviUZjG202F4AaABAg', 'snippet': {'videoId': 'c5nN5D2DRqc', 'textDisplay': 'VERGONHA!!!!!!👮🤡💩🤖', 'textOriginal': 'VERGONHA!!!!!!👮🤡💩🤖', 'authorDisplayName': 'Rogério Z', 'authorProfileImageUrl': 'https://yt3.ggpht.com/ytc/AGIKgqN_rU44M9BtV7Xj0CFLOTt09gNnl4PnjVlyEA=s48-c-k-c0x00ffffff-no-rj', 'authorChannelUrl': 'http://www.youtube.com/channel/UCuhYtMOc1pfPPrHI5OyC4Lw', 'authorChannelId': {'value': 'UCuhYtMOc1pfPPrHI5OyC4Lw'}, 'canRate': True, 'viewerRating': 'none', 'likeCount': 2, 'publishedAt': '2022-10-30T19:12:00Z', 'updatedAt': '2022-10-30T19:12:00Z'}}, 'canReply': True, 'totalReplyCount': 0, 'isPublic': True}",,UCuhYtMOc1pfPPrHI5OyC4Lw,2022-10-30T19:12:00Z,VERGONHA!!!!!!👮🤡💩🤖,QURTSl9pMnhCS0FuNHdCNjFmZlBjWUNzTm5OQmZhQ21PNFNDZXk5TVB3STF3dVpTUVMwUVNnRUFwYWp1bDF2X1hpNkFJYk9ybUplODNXQQ==,2023-06-09 14:19:19.770925
youtube#commentThread,HST7wb0lOCIsuscY2PbWb3xsvnk,Ugxt_JqwB41ir37P7T94AaABAg,"{'videoId': 'c5nN5D2DRqc', 'topLevelComment': {'kind': 'youtube#comment', 'etag': 'CGtJJLEa7qqMxaBk9oz-Z0z-fks', 'id': 'Ugxt_JqwB41ir37P7T94AaABAg', 'snippet': {'videoId': 'c5nN5D2DRqc', 'textDisplay': 'O queridinho do consórcio e do entrevistado, Alexandre morEs', 'textOriginal': 'O queridinho do consórcio e do entrevistado, Alexandre morEs', 'authorDisplayName': 'Elizabet Aparecida', 'authorProfileImageUrl': 'https://yt3.ggpht.com/ytc/AGIKgqOMhPR_in3qcQVFncdnzWkefZlMcRXzIPpgc_5cUI1HAIooE3jhrPR5AmzfvYyI=s48-c-k-c0x00ffffff-no-rj', 'authorChannelUrl': 'http://www.youtube.com/channel/UCVsHv3BTZ3k4MCD1zU_l-sg', 'authorChannelId': {'value': 'UCVsHv3BTZ3k4MCD1zU_l-sg'}, 'canRate': True, 'viewerRating': 'none', 'likeCount': 0, 'publishedAt': '2022-10-30T19:11:55Z', 'updatedAt': '2022-10-30T19:11:55Z'}}, 'canReply': True, 'totalReplyCount': 0, 'isPublic': True}",,UCVsHv3BTZ3k4MCD1zU_l-sg,2022-10-30T19:11:55Z,"O queridinho do consórcio e do entrevistado, Alexandre morEs",QURTSl9pMnhCS0FuNHdCNjFmZlBjWUNzTm5OQmZhQ21PNFNDZXk5TVB3STF3dVpTUVMwUVNnRUFwYWp1bDF2X1hpNkFJYk9ybUplODNXQQ==,2023-06-09 14:19:19.770925
youtube#commentThread,Mz5R0ECYS7K97RcAN-XkWPcQRpc,UgypEYJzJpsuLfYWKo94AaABAg,"{'videoId': 'c5nN5D2DRqc', 'topLevelComment': {'kind': 'youtube#comment', 'etag': 'dXdS-ZWgkhBkGlGyM7xt0cOQy3o', 'id': 'UgypEYJzJpsuLfYWKo94AaABAg', 'snippet': {'videoId': 'c5nN5D2DRqc', 'textDisplay': 'Essa UOL comunista defende á volta do ladrão comunista de 9 dedos ao poder. A ação da Policia Rodoviária Federal não é ilegal. É uma fiscalização de rotina. O Alexandre de Moraes já falou isso em coletiva de imprensa.', 'textOriginal': 'Essa UOL comunista defende á volta do ladrão comunista de 9 dedos ao poder. A ação da Policia Rodoviária Federal não é ilegal. É uma fiscalização de rotina. O Alexandre de Moraes já falou isso em coletiva de imprensa.', 'authorDisplayName': 'Márcio Vieira', 'authorProfileImageUrl': 'https://yt3.ggpht.com/5oxB5cbrtaLMV-bmAyehPav9XSPHM5ElyQnU5pHpS5GtXD_NWoU0eWy9lu06UTtoSrmzI8Q6Pg=s48-c-k-c0x00ffffff-no-rj', 'authorChannelUrl': 'http://www.youtube.com/channel/UCz5IM7X-mbyt496fMB2Usfw', 'authorChannelId': {'value': 'UCz5IM7X-mbyt496fMB2Usfw'}, 'canRate': True, 'viewerRating': 'none', 'likeCount': 0, 'publishedAt': '2022-10-30T19:11:48Z', 'updatedAt': '2022-10-30T19:14:44Z'}}, 'canReply': True, 'totalReplyCount': 0, 'isPublic': True}",,UCz5IM7X-mbyt496fMB2Usfw,2022-10-30T19:11:48Z,Essa UOL comunista defende á volta do ladrão comunista de 9 dedos ao poder. A ação da Policia Rodoviária Federal não é ilegal. É uma fiscalização de rotina. O Alexandre de Moraes já falou isso em coletiva de imprensa.,QURTSl9pMnhCS0FuNHdCNjFmZlBjWUNzTm5OQmZhQ21PNFNDZXk5TVB3STF3dVpTUVMwUVNnRUFwYWp1bDF2X1hpNkFJYk9ybUplODNXQQ==,2023-06-09 14:19:19.770925
youtube#commentThread,frg-ZgP6lI_wtvOEcwZh1Qsqy88,UgzRnUmRIws5FISGfn14AaABAg,"{'videoId': 'c5nN5D2DRqc', 'topLevelComment': {'kind': 'youtube#comment', 'etag': '9QvVxgE6PT0jHjKJdXM32JCc9nw', 'id': 'UgzRnUmRIws5FISGfn14AaABAg', 'snippet': {'videoId': 'c5nN5D2DRqc', 'textDisplay': 'Tentativa de golpe justiça eleitoral tem que ficar atento isso e inadmissível querendo censura o eleitorado pobre do Nordeste que são praticamente lula polícia rodoviária Federal uma vergonha tem que prender esse diretor geral da polícia rodoviária Federal ele praticamente já demostrou que vai ajudar nesse golpe do Bolsonaro uma vergonha fora Bolsonaro 🤮🤮🤮🤮🤮', 'textOriginal': 'Tentativa de golpe justiça eleitoral tem que ficar atento isso e inadmissível querendo censura o eleitorado pobre do Nordeste que são praticamente lula polícia rodoviária Federal uma vergonha tem que prender esse diretor geral da polícia rodoviária Federal ele praticamente já demostrou que vai ajudar nesse golpe do Bolsonaro uma vergonha fora Bolsonaro 🤮🤮🤮🤮🤮', 'authorDisplayName': 'Lucas Vinícius', 'authorProfileImageUrl': 'https://yt3.ggpht.com/ytc/AGIKgqORR7ONz0pNfK2hPJK2m0vt5ipv6dH0RcD6uS-sAIu0WqEVEPHOPn4qJ5WPL16n=s48-c-k-c0x00ffffff-no-rj', 'authorChannelUrl': 'http://www.youtube.com/channel/UCbZXsynsFSfLWeQbotBJMfA', 'authorChannelId': {'value': 'UCbZXsynsFSfLWeQbotBJMfA'}, 'canRate': True, 'viewerRating': 'none', 'likeCount': 0, 'publishedAt': '2022-10-30T19:11:42Z', 'updatedAt': '2022-10-30T19:11:42Z'}}, 'canReply': True, 'totalReplyCount': 0, 'isPublic': True}",,UCbZXsynsFSfLWeQbotBJMfA,2022-10-30T19:11:42Z,Tentativa de golpe justiça eleitoral tem que ficar atento isso e inadmissível querendo censura o eleitorado pobre do Nordeste que são praticamente lula polícia rodoviária Federal uma vergonha tem que prender esse diretor geral da polícia rodoviária Federal ele praticamente já demostrou que vai ajudar nesse golpe do Bolsonaro uma vergonha fora Bolsonaro 🤮🤮🤮🤮🤮,QURTSl9pMnhCS0FuNHdCNjFmZlBjWUNzTm5OQmZhQ21PNFNDZXk5TVB3STF3dVpTUVMwUVNnRUFwYWp1bDF2X1hpNkFJYk9ybUplODNXQQ==,2023-06-09 14:19:19.770925
youtube#commentThread,QmZng0GakedZSsP2lmraFexuVXQ,UgwOFMrKkW86GlJ2lxZ4AaABAg,"{'videoId': 'c5nN5D2DRqc', 'topLevelComment': {'kind': 'youtube#comment', 'etag': '0NHYD4FTtHAMVd1A8-FWEHh0IqE', 'id': 'UgwOFMrKkW86GlJ2lxZ4AaABAg', 'snippet': {'videoId': 'c5nN5D2DRqc', 'textDisplay': 'Meu Deus quê vergonha. Isso é apelar', 'textOriginal': 'Meu Deus quê vergonha. Isso é apelar', 'authorDisplayName': 'Maria Barbosa', 'authorProfileImageUrl': 'https://yt3.ggpht.com/ytc/AGIKgqO4N1JosMhvoxiqkMe59bT2M9lwSmE_PejA0t3oUifN0-rFD6HU5shVE_Hvppyf=s48-c-k-c0x00ffffff-no-rj', 'authorChannelUrl': 'http://www.youtube.com/channel/UC5SNFekFowdHpVK-g6aW7Pg', 'authorChannelId': {'value': 'UC5SNFekFowdHpVK-g6aW7Pg'}, 'canRate': True, 'viewerRating': 'none', 'likeCount': 1, 'publishedAt': '2022-10-30T19:11:40Z', 'updatedAt': '2022-10-30T19:11:40Z'}}, 'canReply': True, 'totalReplyCount': 0, 'isPublic': True}",,UC5SNFekFowdHpVK-g6aW7Pg,2022-10-30T19:11:40Z,Meu Deus quê vergonha. Isso é apelar,QURTSl9pMnhCS0FuNHdCNjFmZlBjWUNzTm5OQmZhQ21PNFNDZXk5TVB3STF3dVpTUVMwUVNnRUFwYWp1bDF2X1hpNkFJYk9ybUplODNXQQ==,2023-06-09 14:19:19.770925
youtube#commentThread,zeMGygtKnFG7x6ZNI8gIPV-4V8E,Ugyqjd0PD9QiCuS8HsJ4AaABAg,"{'videoId': 'c5nN5D2DRqc', 'topLevelComment': {'kind': 'youtube#comment', 'etag': 'PsS3mtKQYrwQpO31cfmuAFLEsm0', 'id': 'Ugyqjd0PD9QiCuS8HsJ4AaABAg', 'snippet': {'videoId': 'c5nN5D2DRqc', 'textDisplay': 'Tem que denunciar a ONU e a OEA estão atentando contra a nossa Democracia brasileira.', 'textOriginal': 'Tem que denunciar a ONU e a OEA estão atentando contra a nossa Democracia brasileira.', 'authorDisplayName': 'Zélia Prado', 'authorProfileImageUrl': 'https://yt3.ggpht.com/ytc/AGIKgqMYlxkHD84jYsHSHpyqo9dKBuw47nNtx5gCuhADYA=s48-c-k-c0x00ffffff-no-rj', 'authorChannelUrl': 'http://www.youtube.com/channel/UCRhbO39cNPM7uSxlCJU0usg', 'authorChannelId': {'value': 'UCRhbO39cNPM7uSxlCJU0usg'}, 'canRate': True, 'viewerRating': 'none', 'likeCount': 0, 'publishedAt': '2022-10-30T19:11:24Z', 'updatedAt': '2022-10-30T19:11:24Z'}}, 'canReply': True, 'totalReplyCount': 0, 'isPublic': True}",,UCRhbO39cNPM7uSxlCJU0usg,2022-10-30T19:11:24Z,Tem que denunciar a ONU e a OEA estão atentando contra a nossa Democracia brasileira.,QURTSl9pMnhCS0FuNHdCNjFmZlBjWUNzTm5OQmZhQ21PNFNDZXk5TVB3STF3dVpTUVMwUVNnRUFwYWp1bDF2X1hpNkFJYk9ybUplODNXQQ==,2023-06-09 14:19:19.770925
youtube#commentThread,sZBftv_fJBv4V-xxVqpsF5X2Py8,Ugwo1oxhHDcuf_hrVW54AaABAg,"{'videoId': 'c5nN5D2DRqc', 'topLevelComment': {'kind': 'youtube#comment', 'etag': 'eRMu2YdAIsjyNQdJXBn91ixTgno', 'id': 'Ugwo1oxhHDcuf_hrVW54AaABAg', 'snippet': {'videoId': 'c5nN5D2DRqc', 'textDisplay': 'É crime bolsonaristas,Eles não deixam as pessoas passar pra votar é crime ministro Alexandre de Morais isso é crime eleitoral é isso mesmo', 'textOriginal': 'É crime bolsonaristas,Eles não deixam as pessoas passar pra votar é crime ministro Alexandre de Morais isso é crime eleitoral é isso mesmo', 'authorDisplayName': 'Iracema Conceicao', 'authorProfileImageUrl': 'https://yt3.ggpht.com/ytc/AGIKgqMFDzlctY7VwjUoY0kAIXLcvjwm7xAw-8jpJw=s48-c-k-c0x00ffffff-no-rj', 'authorChannelUrl': 'http://www.youtube.com/channel/UCuyAf5c_-Qs8lFDRVGUYP6w', 'authorChannelId': {'value': 'UCuyAf5c_-Qs8lFDRVGUYP6w'}, 'canRate': True, 'viewerRating': 'none', 'likeCount': 1, 'publishedAt': '2022-10-30T19:11:18Z', 'updatedAt': '2022-10-30T19:11:18Z'}}, 'canReply': True, 'totalReplyCount': 0, 'isPublic': True}",,UCuyAf5c_-Qs8lFDRVGUYP6w,2022-10-30T19:11:18Z,"É crime bolsonaristas,Eles não deixam as pessoas passar pra votar é crime ministro Alexandre de Morais isso é crime eleitoral é isso mesmo",QURTSl9pMnhCS0FuNHdCNjFmZlBjWUNzTm5OQmZhQ21PNFNDZXk5TVB3STF3dVpTUVMwUVNnRUFwYWp1bDF2X1hpNkFJYk9ybUplODNXQQ==,2023-06-09 14:19:19.770925
youtube#commentThread,QzUZ13guyVMNhYTG6492F5iXuu4,Ugw8sUKMUbk0rjJGTH94AaABAg,"{'videoId': 'c5nN5D2DRqc', 'topLevelComment': {'kind': 'youtube#comment', 'etag': 'YQ58Hz1r3PzaJE3p01IODxGBiOs', 'id': 'Ugw8sUKMUbk0rjJGTH94AaABAg', 'snippet': {'videoId': 'c5nN5D2DRqc', 'textDisplay': 'PRF Bolsonarista.', 'textOriginal': 'PRF Bolsonarista.', 'authorDisplayName': 'Josiel Queiroz', 'authorProfileImageUrl': 'https://yt3.ggpht.com/ytc/AGIKgqOZmSw1tTsV1Puwvx5fXL3bqFKGBHszFcId=s48-c-k-c0x00ffffff-no-rj', 'authorChannelUrl': 'http://www.youtube.com/channel/UCfcvZXBZen77VIHejnhyi_A', 'authorChannelId': {'value': 'UCfcvZXBZen77VIHejnhyi_A'}, 'canRate': True, 'viewerRating': 'none', 'likeCount': 1, 'publishedAt': '2022-10-30T19:11:10Z', 'updatedAt': '2022-10-30T19:11:10Z'}}, 'canReply': True, 'totalReplyCount': 1, 'isPublic': True}","{'comments': [{'kind': 'youtube#comment', 'etag': '85t7Ld4H1YIjfkx2Zq6OlGHx7Es', 'id': 'Ugw8sUKMUbk0rjJGTH94AaABAg.9hoqrsDock39hosAZtx5fb', 'snippet': {'videoId': 'c5nN5D2DRqc', 'textDisplay': 'PRF Gestapo Vexatória internacional atentado contra a democracia do Brasil', 'textOriginal': 'PRF Gestapo Vexatória internacional atentado contra a democracia do Brasil', 'parentId': 'Ugw8sUKMUbk0rjJGTH94AaABAg', 'authorDisplayName': 'Zélia Prado', 'authorProfileImageUrl': 'https://yt3.ggpht.com/ytc/AGIKgqMYlxkHD84jYsHSHpyqo9dKBuw47nNtx5gCuhADYA=s48-c-k-c0x00ffffff-no-rj', 'authorChannelUrl': 'http://www.youtube.com/channel/UCRhbO39cNPM7uSxlCJU0usg', 'authorChannelId': {'value': 'UCRhbO39cNPM7uSxlCJU0usg'}, 'canRate': True, 'viewerRating': 'none', 'likeCount': 0, 'publishedAt': '2022-10-30T19:22:36Z', 'updatedAt': '2022-10-30T19:22:36Z'}}]}",UCfcvZXBZen77VIHejnhyi_A,2022-10-30T19:11:10Z,PRF Bolsonarista.,QURTSl9pMnhCS0FuNHdCNjFmZlBjWUNzTm5OQmZhQ21PNFNDZXk5TVB3STF3dVpTUVMwUVNnRUFwYWp1bDF2X1hpNkFJYk9ybUplODNXQQ==,2023-06-09 14:19:19.770925
youtube#commentThread,cZhcnoa3lMJoYh59zCKY2jdO7vU,UgyYVVK3O8-T5eBtDeV4AaABAg,"{'videoId': 'c5nN5D2DRqc', 'topLevelComment': {'kind': 'youtube#comment', 'etag': 'np-s0WM9njbJ9p4rp8ZEGJnGNJ8', 'id': 'UgyYVVK3O8-T5eBtDeV4AaABAg', 'snippet': {'videoId': 'c5nN5D2DRqc', 'textDisplay': 'Mas nem sabem se o Lula vai realmente perder e já estão de mi mi mi?', 'textOriginal': 'Mas nem sabem se o Lula vai realmente perder e já estão de mi mi mi?', 'authorDisplayName': 'Abner', 'authorProfileImageUrl': 'https://yt3.ggpht.com/ytc/AGIKgqO-P3w9WwrFCjxHWYvY0KG5JS_V5cla0LUlQ-Bu6YCEHgx0iyHHsz9FIFqOUzBv=s48-c-k-c0x00ffffff-no-rj', 'authorChannelUrl': 'http://www.youtube.com/channel/UCGo0TUMJSHvRCX0n_eDwnmA', 'authorChannelId': {'value': 'UCGo0TUMJSHvRCX0n_eDwnmA'}, 'canRate': True, 'viewerRating': 'none', 'likeCount': 0, 'publishedAt': '2022-10-30T19:11:03Z', 'updatedAt': '2022-10-30T19:11:03Z'}}, 'canReply': True, 'totalReplyCount': 0, 'isPublic': True}",,UCGo0TUMJSHvRCX0n_eDwnmA,2022-10-30T19:11:03Z,Mas nem sabem se o Lula vai realmente perder e já estão de mi mi mi?,QURTSl9pMnhCS0FuNHdCNjFmZlBjWUNzTm5OQmZhQ21PNFNDZXk5TVB3STF3dVpTUVMwUVNnRUFwYWp1bDF2X1hpNkFJYk9ybUplODNXQQ==,2023-06-09 14:19:19.770925
youtube#commentThread,Y1zIIZypmm6ZJP_Ebae1FtfEuIE,Ugzl7LdtPO5gyLBLAYp4AaABAg,"{'videoId': 'c5nN5D2DRqc', 'topLevelComment': {'kind': 'youtube#comment', 'etag': '9OzEsiRVseWItVzQ9Eu3-lHtU04', 'id': 'Ugzl7LdtPO5gyLBLAYp4AaABAg', 'snippet': {'videoId': 'c5nN5D2DRqc', 'textDisplay': 'Parabéns aos patriotas da PRF.', 'textOriginal': 'Parabéns aos patriotas da PRF.', 'authorDisplayName': 'Dennis Xavier', 'authorProfileImageUrl': 'https://yt3.ggpht.com/ytc/AGIKgqNjuECl4iY5RJO638hpRdUW7QG8uDD0P-xDygX1fA=s48-c-k-c0x00ffffff-no-rj', 'authorChannelUrl': 'http://www.youtube.com/channel/UCrlVzdyP1K_QsOucA7YBfpQ', 'authorChannelId': {'value': 'UCrlVzdyP1K_QsOucA7YBfpQ'}, 'canRate': True, 'viewerRating': 'none', 'likeCount': 3, 'publishedAt': '2022-10-30T19:10:38Z', 'updatedAt': '2022-10-30T19:10:38Z'}}, 'canReply': True, 'totalReplyCount': 3, 'isPublic': True}","{'comments': [{'kind': 'youtube#comment', 'etag': 'EPcBsR8idVRry7VJmzE0x5hX_7o', 'id': 'Ugzl7LdtPO5gyLBLAYp4AaABAg.9hoqnx3w_a29hosRFUm0g_', 'snippet': {'videoId': 'c5nN5D2DRqc', 'textDisplay': 'Seria bom que a PRF trabalhasse com o mesmo empenho pra fiscalizar ônibus totalmente precários que transportam fiéis para eventos religiosos. Não são patriotas. São patrioteiros.', 'textOriginal': 'Seria bom que a PRF trabalhasse com o mesmo empenho pra fiscalizar ônibus totalmente precários que transportam fiéis para eventos religiosos. Não são patriotas. São patrioteiros.', 'parentId': 'Ugzl7LdtPO5gyLBLAYp4AaABAg', 'authorDisplayName': 'RUBIA-MAR NUNES PINTO', 'authorProfileImageUrl': 'https://yt3.ggpht.com/ytc/AGIKgqNHJcYJqZeNGUgt2pEfOwceScz33TaxRxWjXgiM_76nIkcdrqyip1KC7EOo8d5N=s48-c-k-c0x00ffffff-no-rj', 'authorChannelUrl': 'http://www.youtube.com/channel/UC0gNar0zxmWyd_dpmfXPwmg', 'authorChannelId': {'value': 'UC0gNar0zxmWyd_dpmfXPwmg'}, 'canRate': True, 'viewerRating': 'none', 'likeCount': 1, 'publishedAt': '2022-10-30T19:24:53Z', 'updatedAt': '2022-10-30T19:25:39Z'}}, {'kind': 'youtube#comment', 'etag': '0cyJBUWq5YzpmpWhYQn5tNYFaBQ', 'id': 'Ugzl7LdtPO5gyLBLAYp4AaABAg.9hoqnx3w_a29hos0LV0GYY', 'snippet': {'videoId': 'c5nN5D2DRqc', 'textDisplay': 'O nome disso é golpistas que não sabem perder', 'textOriginal': 'O nome disso é golpistas que não sabem perder', 'parentId': 'Ugzl7LdtPO5gyLBLAYp4AaABAg', 'authorDisplayName': 'igorsemfronteiras', 'authorProfileImageUrl': 'https://yt3.ggpht.com/Y-hwU4ljwd0UuKRouE5M7H0k_BTVA4HAU6oAJcMqu0iAomeMPuRaH49AzwkTCUz8P-AFgMJsYw=s48-c-k-c0x00ffffff-no-rj', 'authorChannelUrl': 'http://www.youtube.com/channel/UCOp587FhaMuc_faEaZpzg9w', 'authorChannelId': {'value': 'UCOp587FhaMuc_faEaZpzg9w'}, 'canRate': True, 'viewerRating': 'none', 'likeCount': 2, 'publishedAt': '2022-10-30T19:21:12Z', 'updatedAt': '2022-10-30T19:21:12Z'}}, {'kind': 'youtube#comment', 'etag': 'eF0ASCONFrHl3cuB7xguC2H1pRM', 'id': 'Ugzl7LdtPO5gyLBLAYp4AaABAg.9hoqnx3w_a29hormD4YUYz', 'snippet': {'videoId': 'c5nN5D2DRqc', 'textDisplay': 'PatriOTARIOS Gestapo brasileira Bolsonarista', 'textOriginal': 'PatriOTARIOS Gestapo brasileira Bolsonarista', 'parentId': 'Ugzl7LdtPO5gyLBLAYp4AaABAg', 'authorDisplayName': 'Zélia Prado', 'authorProfileImageUrl': 'https://yt3.ggpht.com/ytc/AGIKgqMYlxkHD84jYsHSHpyqo9dKBuw47nNtx5gCuhADYA=s48-c-k-c0x00ffffff-no-rj', 'authorChannelUrl': 'http://www.youtube.com/channel/UCRhbO39cNPM7uSxlCJU0usg', 'authorChannelId': {'value': 'UCRhbO39cNPM7uSxlCJU0usg'}, 'canRate': True, 'viewerRating': 'none', 'likeCount': 1, 'publishedAt': '2022-10-30T19:19:08Z', 'updatedAt': '2022-10-30T19:19:08Z'}}]}",UCrlVzdyP1K_QsOucA7YBfpQ,2022-10-30T19:10:38Z,Parabéns aos patriotas da PRF.,QURTSl9pMnhCS0FuNHdCNjFmZlBjWUNzTm5OQmZhQ21PNFNDZXk5TVB3STF3dVpTUVMwUVNnRUFwYWp1bDF2X1hpNkFJYk9ybUplODNXQQ==,2023-06-09 14:19:19.770925
youtube#commentThread,Q6UPNSY1UMVrXYXVGQz1rwjukSo,UgykKn-QkIRdD6_T3J54AaABAg,"{'videoId': 'c5nN5D2DRqc', 'topLevelComment': {'kind': 'youtube#comment', 'etag': 'f7ULhOcFwwW0kmM0DiqAcJ-B3SI', 'id': 'UgykKn-QkIRdD6_T3J54AaABAg', 'snippet': {'videoId': 'c5nN5D2DRqc', 'textDisplay': 'A polícia combate o crime!!! Da compra de voto ninguém fala nada… veículos proibidos podem, mas não tem que seguir a lei.', 'textOriginal': 'A polícia combate o crime!!! Da compra de voto ninguém fala nada… veículos proibidos podem, mas não tem que seguir a lei.', 'authorDisplayName': 'Rafael Ramos', 'authorProfileImageUrl': 'https://yt3.ggpht.com/ytc/AGIKgqO7Fgowu_6Iuc5lk42vcJ1A1tzQOD41AswCm5G-Xw=s48-c-k-c0x00ffffff-no-rj', 'authorChannelUrl': 'http://www.youtube.com/channel/UCbeftqgfoTh-4df9YvaEQ7A', 'authorChannelId': {'value': 'UCbeftqgfoTh-4df9YvaEQ7A'}, 'canRate': True, 'viewerRating': 'none', 'likeCount': 0, 'publishedAt': '2022-10-30T19:10:25Z', 'updatedAt': '2022-10-30T19:10:25Z'}}, 'canReply': True, 'totalReplyCount': 0, 'isPublic': True}",,UCbeftqgfoTh-4df9YvaEQ7A,2022-10-30T19:10:25Z,"A polícia combate o crime!!! Da compra de voto ninguém fala nada… veículos proibidos podem, mas não tem que seguir a lei.",QURTSl9pMnhCS0FuNHdCNjFmZlBjWUNzTm5OQmZhQ21PNFNDZXk5TVB3STF3dVpTUVMwUVNnRUFwYWp1bDF2X1hpNkFJYk9ybUplODNXQQ==,2023-06-09 14:19:19.770925
