kind,etag,id,snippet,replies,authorChannelId,publishedAt,textOriginal,nextPageToken,extraction_date
youtube#commentThread,Yk0lQeVH0Dmd5agXcNDmv5F2Znk,Ugwu0CTFuGR5j_tB3054AaABAg,"{'videoId': 'c5nN5D2DRqc', 'topLevelComment': {'kind': 'youtube#comment', 'etag': 'eQUHcQVGXH1-vI0jWogbMxcfWQA', 'id': 'Ugwu0CTFuGR5j_tB3054AaABAg', 'snippet': {'videoId': 'c5nN5D2DRqc', 'textDisplay': 'Depois de sentenciados.<br>LULA.. 19 meses cumprindo pena.<br>Seu ministro PALOCI..02 anos preso.<br>Eduardo cunha 4 anos Preso... Mais 25 sentenciados pelo STF pelo Mensalão e lava jato.(BANDIDOS) que roubaram nossa nação', 'textOriginal': 'Depois de sentenciados.\\nLULA.. 19 meses cumprindo pena.\\nSeu ministro PALOCI..02 anos preso.\\nEduardo cunha 4 anos Preso... Mais 25 sentenciados pelo STF pelo Mensalão e lava jato.(BANDIDOS) que roubaram nossa nação', 'authorDisplayName': 'J.L Direito', 'authorProfileImageUrl': 'https://yt3.ggpht.com/Tm_STt350kPwybNeC9SBIeV0pyCdf-VfWNXjF-v_iHskYLNNLzAFM5nP36bAD18V6Eii8qBT=s48-c-k-c0x00ffffff-no-rj', 'authorChannelUrl': 'http://www.youtube.com/channel/UCZVkwf3bl0EIMTI9flgOC7Q', 'authorChannelId': {'value': 'UCZVkwf3bl0EIMTI9flgOC7Q'}, 'canRate': True, 'viewerRating': 'none', 'likeCount': 0, 'publishedAt': '2022-11-15T18:03:22Z', 'updatedAt': '2022-11-15T18:03:22Z'}}, 'canReply': True, 'totalReplyCount': 0, 'isPublic': True}",,UCZVkwf3bl0EIMTI9flgOC7Q,2022-11-15T18:03:22Z,"Depois de sentenciados.
LULA.. 19 meses cumprindo pena.
Seu ministro PALOCI..02 anos preso.
Eduardo cunha 4 anos Preso... Mais 25 sentenciados pelo STF pelo Mensalão e lava jato.(BANDIDOS) que roubaram nossa nação",QURTSl9pM2hiWF9nV2wtQlMtSHRtcXZoZTFaaDF6VnNVWmtUY3p3Sjc3M1VQNlBYWEVnbUdSaFAzOXhMNXl0cVVZWTNYQkluRWJReERscw==,2023-06-09 14:19:18.890389
youtube#commentThread,jgdQFgDw3SxfHAjKsR1ogtGYxkQ,UgyiIbziKPATVqfIPB14AaABAg,"{'videoId': 'c5nN5D2DRqc', 'topLevelComment': {'kind': 'youtube#comment', 'etag': 'tkl9P-r7l3U8L91_YIRM1U8ke2I', 'id': 'UgyiIbziKPATVqfIPB14AaABAg', 'snippet': {'videoId': 'c5nN5D2DRqc', 'textDisplay': 'TEM QUE COLOCAR POLICIA DE VERDADE A PRF É GUARDA DO BOLSONARO , VERGONHA.', 'textOriginal': 'TEM QUE COLOCAR POLICIA DE VERDADE A PRF É GUARDA DO BOLSONARO , VERGONHA.', 'authorDisplayName': 'Haroldo', 'authorProfileImageUrl': 'https://yt3.ggpht.com/ytc/AGIKgqN2PQS_CpWcSux-3QqCu0HtJ9UfFm8ArulNwA=s48-c-k-c0x00ffffff-no-rj', 'authorChannelUrl': 'http://www.youtube.com/channel/UCP68OsvcxvLVLuXxB2fw6SQ', 'authorChannelId': {'value': 'UCP68OsvcxvLVLuXxB2fw6SQ'}, 'canRate': True, 'viewerRating': 'none', 'likeCount': 0, 'publishedAt': '2022-11-01T16:57:14Z', 'updatedAt': '2022-11-01T16:57:14Z'}}, 'canReply': True, 'totalReplyCount': 0, 'isPublic': True}",,UCP68OsvcxvLVLuXxB2fw6SQ,2022-11-01T16:57:14Z,"TEM QUE COLOCAR POLICIA DE VERDADE A PRF É GUARDA DO BOLSONARO , VERGONHA.",QURTSl9pM2hiWF9nV2wtQlMtSHRtcXZoZTFaaDF6VnNVWmtUY3p3Sjc3M1VQNlBYWEVnbUdSaFAzOXhMNXl0cVVZWTNYQkluRWJReERscw==,2023-06-09 14:19:18.890389
youtube#commentThread,uKKdp2VOsoZQbpM6ZKt6yU5MXrk,UgxQ0eLmBtMouqzUvjl4AaABAg,"{'videoId': 'c5nN5D2DRqc', 'topLevelComment': {'kind': 'youtube#comment', 'etag': 'UWKjNUTJOPEKVB7mtsMtIL4rXtU', 'id': 'UgxQ0eLmBtMouqzUvjl4AaABAg', 'snippet': {'videoId': 'c5nN5D2DRqc', 'textDisplay': 'Polícia impedindo o povo de votar? Vcs s são loucos?', 'textOriginal': 'Polícia impedindo o povo de votar? Vcs s são loucos?', 'authorDisplayName': 'Paulo Borelli', 'authorProfileImageUrl': 'https://yt3.ggpht.com/ytc/AGIKgqNl2kIHnI9xuzFPmbUgrFxfmKJgzp22333CpQ=s48-c-k-c0x00ffffff-no-rj', 'authorChannelUrl': 'http://www.youtube.com/channel/UCEBfQLgvaZHUgwTLee15Ebw', 'authorChannelId': {'value': 'UCEBfQLgvaZHUgwTLee15Ebw'}, 'canRate': True, 'viewerRating': 'none', 'likeCount': 0, 'publishedAt': '2022-11-01T16:01:39Z', 'updatedAt': '2022-11-01T16:01:39Z'}}, 'canReply': True, 'totalReplyCount': 0, 'isPublic': True}",,UCEBfQLgvaZHUgwTLee15Ebw,2022-11-01T16:01:39Z,Polícia impedindo o povo de votar? Vcs s são loucos?,QURTSl9pM2hiWF9nV2wtQlMtSHRtcXZoZTFaaDF6VnNVWmtUY3p3Sjc3M1VQNlBYWEVnbUdSaFAzOXhMNXl0cVVZWTNYQkluRWJReERscw==,2023-06-09 14:19:18.890389
youtube#commentThread,36kK3qp22WZAZscwI2myKQYkI5M,UgyIVHywpsPrwujuro14AaABAg,"{'videoId': 'c5nN5D2DRqc', 'topLevelComment': {'kind': 'youtube#comment', 'etag': '9Vw2z28rzm0MbPuPLUx78bSled8', 'id': 'UgyIVHywpsPrwujuro14AaABAg', 'snippet': {'videoId': 'c5nN5D2DRqc', 'textDisplay': 'A policia rodoviaria do<br>PR ja estava engajada e sabia do estrategia de golpe.', 'textOriginal': 'A policia rodoviaria do\\nPR ja estava engajada e sabia do estrategia de golpe.', 'authorDisplayName': 'Zenia Guthz', 'authorProfileImageUrl': 'https://yt3.ggpht.com/ytc/AGIKgqODU7WiRfGhFdmywEz0gQMyxAc0_vuPaSPeuPIOGcZjPYd-IPsnDdA0hB4lntbk=s48-c-k-c0x00ffffff-no-rj', 'authorChannelUrl': 'http://www.youtube.com/channel/UCds704CTPoPx6bUy-ag2B3g', 'authorChannelId': {'value': 'UCds704CTPoPx6bUy-ag2B3g'}, 'canRate': True, 'viewerRating': 'none', 'likeCount': 0, 'publishedAt': '2022-11-01T12:33:56Z', 'updatedAt': '2022-11-01T12:33:56Z'}}, 'canReply': True, 'totalReplyCount': 0, 'isPublic': True}",,UCds704CTPoPx6bUy-ag2B3g,2022-11-01T12:33:56Z,"A policia rodoviaria do
PR ja estava engajada e sabia do estrategia de golpe.",QURTSl9pM2hiWF9nV2wtQlMtSHRtcXZoZTFaaDF6VnNVWmtUY3p3Sjc3M1VQNlBYWEVnbUdSaFAzOXhMNXl0cVVZWTNYQkluRWJReERscw==,2023-06-09 14:19:18.890389
youtube#commentThread,Y4xONWrfnzBTB0l765Eib8N6fvI,UgwPpWuy7glZwdXboDl4AaABAg,"{'videoId': 'c5nN5D2DRqc', 'topLevelComment': {'kind': 'youtube#comment', 'etag': 'Dir620M8UpPM6iPxi6gniM9QOzM', 'id': 'UgwPpWuy7glZwdXboDl4AaABAg', 'snippet': {'videoId': 'c5nN5D2DRqc', 'textDisplay': 'Como queria ser reeleito a qualquer preço só tramoias, fake news mentiras e agora esses PRF fez os bloqueio pra impedir eleitores de votarem pra tentar diminuir os votos do Lula', 'textOriginal': 'Como queria ser reeleito a qualquer preço só tramoias, fake news mentiras e agora esses PRF fez os bloqueio pra impedir eleitores de votarem pra tentar diminuir os votos do Lula', 'authorDisplayName': 'marli bignotto', 'authorProfileImageUrl': 'https://yt3.ggpht.com/ytc/AGIKgqMq2kNJ-xOioIf2RsuTM_L3ecxHC9yKFDsYHQ=s48-c-k-c0x00ffffff-no-rj', 'authorChannelUrl': 'http://www.youtube.com/channel/UC6GBUCn9tZdk6MxaE7Np-wA', 'authorChannelId': {'value': 'UC6GBUCn9tZdk6MxaE7Np-wA'}, 'canRate': True, 'viewerRating': 'none', 'likeCount': 0, 'publishedAt': '2022-10-31T20:35:05Z', 'updatedAt': '2022-10-31T20:35:05Z'}}, 'canReply': True, 'totalReplyCount': 0, 'isPublic': True}",,UC6GBUCn9tZdk6MxaE7Np-wA,2022-10-31T20:35:05Z,"Como queria ser reeleito a qualquer preço só tramoias, fake news mentiras e agora esses PRF fez os bloqueio pra impedir eleitores de votarem pra tentar diminuir os votos do Lula",QURTSl9pM2hiWF9nV2wtQlMtSHRtcXZoZTFaaDF6VnNVWmtUY3p3Sjc3M1VQNlBYWEVnbUdSaFAzOXhMNXl0cVVZWTNYQkluRWJReERscw==,2023-06-09 14:19:18.890389
youtube#commentThread,DJSVqa8nesIUHvoV0z5IX35Cqj8,UgwFniMU702zv8IjA8R4AaABAg,"{'videoId': 'c5nN5D2DRqc', 'topLevelComment': {'kind': 'youtube#comment', 'etag': 'H8rIhSYjhqqKupwdShk6rVatW1g', 'id': 'UgwFniMU702zv8IjA8R4AaABAg', 'snippet': {'videoId': 'c5nN5D2DRqc', 'textDisplay': 'Agora vão tomar um suquinho de caju e ficarem calminhos.<br>Aceitem a derrota, esses disfarçado de PRF.', 'textOriginal': 'Agora vão tomar um suquinho de caju e ficarem calminhos.\\nAceitem a derrota, esses disfarçado de PRF.', 'authorDisplayName': 'Taniamares Ninha', 'authorProfileImageUrl': 'https://yt3.ggpht.com/ytc/AGIKgqNGw3Mo_4eMcnvGTM4ScR7zd-oOga5vt9Ft1g=s48-c-k-c0x00ffffff-no-rj', 'authorChannelUrl': 'http://www.youtube.com/channel/UCFsKV0rIo-eHzNFEJWP7DpA', 'authorChannelId': {'value': 'UCFsKV0rIo-eHzNFEJWP7DpA'}, 'canRate': True, 'viewerRating': 'none', 'likeCount': 0, 'publishedAt': '2022-10-31T17:21:37Z', 'updatedAt': '2022-10-31T17:21:37Z'}}, 'canReply': True, 'totalReplyCount': 0, 'isPublic': True}",,UCFsKV0rIo-eHzNFEJWP7DpA,2022-10-31T17:21:37Z,"Agora vão tomar um suquinho de caju e ficarem calminhos.
Aceitem a derrota, esses disfarçado de PRF.",QURTSl9pM2hiWF9nV2wtQlMtSHRtcXZoZTFaaDF6VnNVWmtUY3p3Sjc3M1VQNlBYWEVnbUdSaFAzOXhMNXl0cVVZWTNYQkluRWJReERscw==,2023-06-09 14:19:18.890389
youtube#commentThread,Xjr_cl7ev7lFnDKKNJdXgVKzkPM,Ugzy4eaVJjUDLncKRDJ4AaABAg,"{'videoId': 'c5nN5D2DRqc', 'topLevelComment': {'kind': 'youtube#comment', 'etag': 'PzNcDO_9NBV5xLXhYiiF3aClQFA', 'id': 'Ugzy4eaVJjUDLncKRDJ4AaABAg', 'snippet': {'videoId': 'c5nN5D2DRqc', 'textDisplay': 'O mais imoral, é um juiz q tem o poder da caneta, e q comanda o TSE, usar o poder da caneta, pra beneficiar tal candidato como aconteceu nessas eleições.<br>Só faltou o Alexandre de Moraes usar do poder dessa mesma caneta, pra liberar os presidiários pra q pudessem votar no Lula', 'textOriginal': 'O mais imoral, é um juiz q tem o poder da caneta, e q comanda o TSE, usar o poder da caneta, pra beneficiar tal candidato como aconteceu nessas eleições.\\nSó faltou o Alexandre de Moraes usar do poder dessa mesma caneta, pra liberar os presidiários pra q pudessem votar no Lula', 'authorDisplayName': 'Antonio Aguiar Aguiar', 'authorProfileImageUrl': 'https://yt3.ggpht.com/ytc/AGIKgqPDO-EHQ3e6cx8eB2Ux8svFXP9PyowJof6Tfmw=s48-c-k-c0x00ffffff-no-rj', 'authorChannelUrl': 'http://www.youtube.com/channel/UCBZWG1KqkgFaZOO1ywJT5RA', 'authorChannelId': {'value': 'UCBZWG1KqkgFaZOO1ywJT5RA'}, 'canRate': True, 'viewerRating': 'none', 'likeCount': 0, 'publishedAt': '2022-10-31T12:45:31Z', 'updatedAt': '2022-10-31T12:45:31Z'}}, 'canReply': True, 'totalReplyCount': 0, 'isPublic': True}",,UCBZWG1KqkgFaZOO1ywJT5RA,2022-10-31T12:45:31Z,"O mais imoral, é um juiz q tem o poder da caneta, e q comanda o TSE, usar o poder da caneta, pra beneficiar tal candidato como aconteceu nessas eleições.
Só faltou o Alexandre de Moraes usar do poder dessa mesma caneta, pra liberar os presidiários pra q pudessem votar no Lula",QURTSl9pM2hiWF9nV2wtQlMtSHRtcXZoZTFaaDF6VnNVWmtUY3p3Sjc3M1VQNlBYWEVnbUdSaFAzOXhMNXl0cVVZWTNYQkluRWJReERscw==,2023-06-09 14:19:18.890389
youtube#commentThread,eV0IlHkQ12qWosVL9BGgVQya9qI,Ugyc29qbAFSiyQ-X5rh4AaABAg,"{'videoId': 'c5nN5D2DRqc', 'topLevelComment': {'kind': 'youtube#comment', 'etag': 'dPronyc5goAHZUSvGft0tvBTY_8', 'id': 'Ugyc29qbAFSiyQ-X5rh4AaABAg', 'snippet': {'videoId': 'c5nN5D2DRqc', 'textDisplay': 'Bolsonaro e esses políticos e polícia preso.bolsonaro preso cadeia já bandidos e micisbos do Bolsonaro corrupto nojento repulsivo', 'textOriginal': 'Bolsonaro e esses políticos e polícia preso.bolsonaro preso cadeia já bandidos e micisbos do Bolsonaro corrupto nojento repulsivo', 'authorDisplayName': 'Marcelo Augusto', 'authorProfileImageUrl': 'https://yt3.ggpht.com/ytc/AGIKgqNM1Gpm3fE6NiooYd1I-k03o5CMXKp57Nl5yQ=s48-c-k-c0x00ffffff-no-rj', 'authorChannelUrl': 'http://www.youtube.com/channel/UCCwqfvIaVlv1HEQ6XomgnIQ', 'authorChannelId': {'value': 'UCCwqfvIaVlv1HEQ6XomgnIQ'}, 'canRate': True, 'viewerRating': 'none', 'likeCount': 0, 'publishedAt': '2022-10-31T03:59:39Z', 'updatedAt': '2022-10-31T03:59:39Z'}}, 'canReply': True, 'totalReplyCount': 0, 'isPublic': True}",,UCCwqfvIaVlv1HEQ6XomgnIQ,2022-10-31T03:59:39Z,Bolsonaro e esses políticos e polícia preso.bolsonaro preso cadeia já bandidos e micisbos do Bolsonaro corrupto nojento repulsivo,QURTSl9pM2hiWF9nV2wtQlMtSHRtcXZoZTFaaDF6VnNVWmtUY3p3Sjc3M1VQNlBYWEVnbUdSaFAzOXhMNXl0cVVZWTNYQkluRWJReERscw==,2023-06-09 14:19:18.890389
youtube#commentThread,TZBkDsKdioKJ3bR8VBebeBauhoY,Ugw1japXTSgc06LMnUt4AaABAg,"{'videoId': 'c5nN5D2DRqc', 'topLevelComment': {'kind': 'youtube#comment', 'etag': 'snLz1h9DSfIG65hoI4SecfbQK1c', 'id': 'Ugw1japXTSgc06LMnUt4AaABAg', 'snippet': {'videoId': 'c5nN5D2DRqc', 'textDisplay': 'EXONERAÇÃO IMEDIATA DO DIRETOR GERAL DA PRF!!!', 'textOriginal': 'EXONERAÇÃO IMEDIATA DO DIRETOR GERAL DA PRF!!!', 'authorDisplayName': 'EvandroLê', 'authorProfileImageUrl': 'https://yt3.ggpht.com/ytc/AGIKgqMsXQHwCNahjF5DbOmpN6vfpBBSp1UM7I85fc-p=s48-c-k-c0x00ffffff-no-rj', 'authorChannelUrl': 'http://www.youtube.com/channel/UCHzDs7WTFSYO3ABLs3jVSOA', 'authorChannelId': {'value': 'UCHzDs7WTFSYO3ABLs3jVSOA'}, 'canRate': True, 'viewerRating': 'none', 'likeCount': 0, 'publishedAt': '2022-10-31T02:22:43Z', 'updatedAt': '2022-10-31T02:22:43Z'}}, 'canReply': True, 'totalReplyCount': 0, 'isPublic': True}",,UCHzDs7WTFSYO3ABLs3jVSOA,2022-10-31T02:22:43Z,EXONERAÇÃO IMEDIATA DO DIRETOR GERAL DA PRF!!!,QURTSl9pM2hiWF9nV2wtQlMtSHRtcXZoZTFaaDF6VnNVWmtUY3p3Sjc3M1VQNlBYWEVnbUdSaFAzOXhMNXl0cVVZWTNYQkluRWJReERscw==,2023-06-09 14:19:18.890389
youtube#commentThread,70ETxs6HEjMxQzUYjDCBg_SZ0SU,UgxOscSDmaYGTwHc6SB4AaABAg,"{'videoId': 'c5nN5D2DRqc', 'topLevelComment': {'kind': 'youtube#comment', 'etag': 'p5sgcx1oGr_UruaOTIUC22JtBdg', 'id': 'UgxOscSDmaYGTwHc6SB4AaABAg', 'snippet': {'videoId': 'c5nN5D2DRqc', 'textDisplay': 'Prêmio framboesa foi para a PRF! Vergonhoso!', 'textOriginal': 'Prêmio framboesa foi para a PRF! Vergonhoso!', 'authorDisplayName': 'Fernando', 'authorProfileImageUrl': 'https://yt3.ggpht.com/ytc/AGIKgqMJ9kHhf4EDnA8Ku2EbAn63I3EBL1wPiGDn_e_790k=s48-c-k-c0x00ffffff-no-rj', 'authorChannelUrl': 'http://www.youtube.com/channel/UCEsSnVO00RLh3bG_R-ARsxw', 'authorChannelId': {'value': 'UCEsSnVO00RLh3bG_R-ARsxw'}, 'canRate': True, 'viewerRating': 'none', 'likeCount': 1, 'publishedAt': '2022-10-31T02:10:39Z', 'updatedAt': '2022-10-31T02:10:39Z'}}, 'canReply': True, 'totalReplyCount': 0, 'isPublic': True}",,UCEsSnVO00RLh3bG_R-ARsxw,2022-10-31T02:10:39Z,Prêmio framboesa foi para a PRF! Vergonhoso!,QURTSl9pM2hiWF9nV2wtQlMtSHRtcXZoZTFaaDF6VnNVWmtUY3p3Sjc3M1VQNlBYWEVnbUdSaFAzOXhMNXl0cVVZWTNYQkluRWJReERscw==,2023-06-09 14:19:18.890389
youtube#commentThread,jf51sqY0WCVqUgsfJugY7SEYSig,UgxtWLEcCY27Kr7wflt4AaABAg,"{'videoId': 'c5nN5D2DRqc', 'topLevelComment': {'kind': 'youtube#comment', 'etag': 'FKrfyxROXkxAEAzukiRjDAPpI-o', 'id': 'UgxtWLEcCY27Kr7wflt4AaABAg', 'snippet': {'videoId': 'c5nN5D2DRqc', 'textDisplay': 'Verdade  venceu  mentira olé ola', 'textOriginal': 'Verdade  venceu  mentira olé ola', 'authorDisplayName': 'emerson rafael', 'authorProfileImageUrl': 'https://yt3.ggpht.com/ytc/AGIKgqOjcczbTu_2goHkXFuXaEkMgwG5lOhGO4KljRn0DA=s48-c-k-c0x00ffffff-no-rj', 'authorChannelUrl': 'http://www.youtube.com/channel/UCk-Tnj4k1Yra0QVViwFjPLw', 'authorChannelId': {'value': 'UCk-Tnj4k1Yra0QVViwFjPLw'}, 'canRate': True, 'viewerRating': 'none', 'likeCount': 0, 'publishedAt': '2022-10-31T01:17:29Z', 'updatedAt': '2022-10-31T01:17:29Z'}}, 'canReply': True, 'totalReplyCount': 0, 'isPublic': True}",,UCk-Tnj4k1Yra0QVViwFjPLw,2022-10-31T01:17:29Z,Verdade  venceu  mentira olé ola,QURTSl9pM2hiWF9nV2wtQlMtSHRtcXZoZTFaaDF6VnNVWmtUY3p3Sjc3M1VQNlBYWEVnbUdSaFAzOXhMNXl0cVVZWTNYQkluRWJReERscw==,2023-06-09 14:19:18.890389
youtube#commentThread,jHZEsfuz-00O7ATUxIbgmtOkNUc,UgwtGr1klQsd_Msnr714AaABAg,"{'videoId': 'c5nN5D2DRqc', 'topLevelComment': {'kind': 'youtube#comment', 'etag': 'bnwmFAitQ1txmd8-hYKs5rsWHCM', 'id': 'UgwtGr1klQsd_Msnr714AaABAg', 'snippet': {'videoId': 'c5nN5D2DRqc', 'textDisplay': 'Então o novo ministro da justiça vai rever essas denúncias. Agredido eu', 'textOriginal': 'Então o novo ministro da justiça vai rever essas denúncias. Agredido eu', 'authorDisplayName': 'L. neto', 'authorProfileImageUrl': 'https://yt3.ggpht.com/ytc/AGIKgqMMSpaRus8ZirEE0sQonJwKBZ9Bzma1X-q17g=s48-c-k-c0x00ffffff-no-rj', 'authorChannelUrl': 'http://www.youtube.com/channel/UC2aNXl7SwBbcEUXg1oSPNNg', 'authorChannelId': {'value': 'UC2aNXl7SwBbcEUXg1oSPNNg'}, 'canRate': True, 'viewerRating': 'none', 'likeCount': 0, 'publishedAt': '2022-10-31T01:08:10Z', 'updatedAt': '2022-10-31T01:08:10Z'}}, 'canReply': True, 'totalReplyCount': 0, 'isPublic': True}",,UC2aNXl7SwBbcEUXg1oSPNNg,2022-10-31T01:08:10Z,Então o novo ministro da justiça vai rever essas denúncias. Agredido eu,QURTSl9pM2hiWF9nV2wtQlMtSHRtcXZoZTFaaDF6VnNVWmtUY3p3Sjc3M1VQNlBYWEVnbUdSaFAzOXhMNXl0cVVZWTNYQkluRWJReERscw==,2023-06-09 14:19:18.890389
youtube#commentThread,-B2SsRuZ2Sj0JaoScUnnPsXZIds,UgxGt3i6-xRYksd16c54AaABAg,"{'videoId': 'c5nN5D2DRqc', 'topLevelComment': {'kind': 'youtube#comment', 'etag': 'rEGoDZuSTb72hWA9OBtrwRHSoVg', 'id': 'UgxGt3i6-xRYksd16c54AaABAg', 'snippet': {'videoId': 'c5nN5D2DRqc', 'textDisplay': 'Mas o Nordeste não se dobrou<br>Lula,  nosso presidente!<br>Sem medo de ser feliz!', 'textOriginal': 'Mas o Nordeste não se dobrou\\nLula,  nosso presidente!\\nSem medo de ser feliz!', 'authorDisplayName': 'Rosane Barros', 'authorProfileImageUrl': 'https://yt3.ggpht.com/ytc/AGIKgqP-gIAnAQYJ72BOQa68oMSx82l8MM8MIQG7LQ=s48-c-k-c0x00ffffff-no-rj', 'authorChannelUrl': 'http://www.youtube.com/channel/UCL-9Aeatjl88S65UH1lRnpA', 'authorChannelId': {'value': 'UCL-9Aeatjl88S65UH1lRnpA'}, 'canRate': True, 'viewerRating': 'none', 'likeCount': 0, 'publishedAt': '2022-10-31T00:35:49Z', 'updatedAt': '2022-10-31T00:35:49Z'}}, 'canReply': True, 'totalReplyCount': 0, 'isPublic': True}",,UCL-9Aeatjl88S65UH1lRnpA,2022-10-31T00:35:49Z,"Mas o Nordeste não se dobrou
Lula,  nosso presidente!
Sem medo de ser feliz!",QURTSl9pM2hiWF9nV2wtQlMtSHRtcXZoZTFaaDF6VnNVWmtUY3p3Sjc3M1VQNlBYWEVnbUdSaFAzOXhMNXl0cVVZWTNYQkluRWJReERscw==,2023-06-09 14:19:18.890389
youtube#commentThread,-1ZpvfuvtVy2K2wrkpzE9cxgsnc,UgyKTddzM163doqmnzp4AaABAg,"{'videoId': 'c5nN5D2DRqc', 'topLevelComment': {'kind': 'youtube#comment', 'etag': 'U1kwTw2YqfkV2Sx_dtjiFo22TN0', 'id': 'UgyKTddzM163doqmnzp4AaABAg', 'snippet': {'videoId': 'c5nN5D2DRqc', 'textDisplay': 'Essas atitudes truculentas é que fez os brasileiros escolherem o outro candidato.', 'textOriginal': 'Essas atitudes truculentas é que fez os brasileiros escolherem o outro candidato.', 'authorDisplayName': 'Zaila Maria Moreira', 'authorProfileImageUrl': 'https://yt3.ggpht.com/ytc/AGIKgqO26GLmKy7WLw-hjwAw-TwR_6c_r3NDXb3Ux1Ud=s48-c-k-c0x00ffffff-no-rj', 'authorChannelUrl': 'http://www.youtube.com/channel/UCnoTJQJetbe_sevFLKrxMHg', 'authorChannelId': {'value': 'UCnoTJQJetbe_sevFLKrxMHg'}, 'canRate': True, 'viewerRating': 'none', 'likeCount': 0, 'publishedAt': '2022-10-31T00:31:33Z', 'updatedAt': '2022-10-31T00:31:33Z'}}, 'canReply': True, 'totalReplyCount': 0, 'isPublic': True}",,UCnoTJQJetbe_sevFLKrxMHg,2022-10-31T00:31:33Z,Essas atitudes truculentas é que fez os brasileiros escolherem o outro candidato.,QURTSl9pM2hiWF9nV2wtQlMtSHRtcXZoZTFaaDF6VnNVWmtUY3p3Sjc3M1VQNlBYWEVnbUdSaFAzOXhMNXl0cVVZWTNYQkluRWJReERscw==,2023-06-09 14:19:18.890389
youtube#commentThread,gtjUooy6qd7WXSRWuveVyfbinnM,UgxNY9YEwibaLInguhV4AaABAg,"{'videoId': 'c5nN5D2DRqc', 'topLevelComment': {'kind': 'youtube#comment', 'etag': 'b34Nr4P0wv-tY3O2uCXrZTm7QbQ', 'id': 'UgxNY9YEwibaLInguhV4AaABAg', 'snippet': {'videoId': 'c5nN5D2DRqc', 'textDisplay': 'Nordestino antes de tudo, é forte! Foram a pé, de bicicleta de jegue... Mas não deixaram de votar.', 'textOriginal': 'Nordestino antes de tudo, é forte! Foram a pé, de bicicleta de jegue... Mas não deixaram de votar.', 'authorDisplayName': 'LUCINDA MARIA TRINDADE ARAUJO', 'authorProfileImageUrl': 'https://yt3.ggpht.com/LgdjjLH90tjPeVpgbuHqV-QME-vn9jF_TF_p32mxdhPjxf7we4adrr8psD2yAdhoTA-0ymgcyg=s48-c-k-c0x00ffffff-no-rj', 'authorChannelUrl': 'http://www.youtube.com/channel/UCCTZcaKDoFVwxKcn8NkZYAA', 'authorChannelId': {'value': 'UCCTZcaKDoFVwxKcn8NkZYAA'}, 'canRate': True, 'viewerRating': 'none', 'likeCount': 0, 'publishedAt': '2022-10-30T22:54:11Z', 'updatedAt': '2022-10-30T22:54:11Z'}}, 'canReply': True, 'totalReplyCount': 0, 'isPublic': True}",,UCCTZcaKDoFVwxKcn8NkZYAA,2022-10-30T22:54:11Z,"Nordestino antes de tudo, é forte! Foram a pé, de bicicleta de jegue... Mas não deixaram de votar.",QURTSl9pM2hiWF9nV2wtQlMtSHRtcXZoZTFaaDF6VnNVWmtUY3p3Sjc3M1VQNlBYWEVnbUdSaFAzOXhMNXl0cVVZWTNYQkluRWJReERscw==,2023-06-09 14:19:18.890389
youtube#commentThread,dyjr6G7hmFh6HBtoctSooDc4v7s,UgzfbJsLGuilw8FmREl4AaABAg,"{'videoId': 'c5nN5D2DRqc', 'topLevelComment': {'kind': 'youtube#comment', 'etag': 'Vwnm1zsKb6RT1_Kixuq6mAKd32I', 'id': 'UgzfbJsLGuilw8FmREl4AaABAg', 'snippet': {'videoId': 'c5nN5D2DRqc', 'textDisplay': 'Criminosos.', 'textOriginal': 'Criminosos.', 'authorDisplayName': 'Núbia Silva Fernandes', 'authorProfileImageUrl': 'https://yt3.ggpht.com/ytc/AGIKgqPDPOrU94z06iOkSkaNTHEHBiSZ53N6Jsz92u_UEQ=s48-c-k-c0x00ffffff-no-rj', 'authorChannelUrl': 'http://www.youtube.com/channel/UCb7AWnb9HGPvQRQAAW0hm-A', 'authorChannelId': {'value': 'UCb7AWnb9HGPvQRQAAW0hm-A'}, 'canRate': True, 'viewerRating': 'none', 'likeCount': 0, 'publishedAt': '2022-10-30T22:00:57Z', 'updatedAt': '2022-10-30T22:00:57Z'}}, 'canReply': True, 'totalReplyCount': 0, 'isPublic': True}",,UCb7AWnb9HGPvQRQAAW0hm-A,2022-10-30T22:00:57Z,Criminosos.,QURTSl9pM2hiWF9nV2wtQlMtSHRtcXZoZTFaaDF6VnNVWmtUY3p3Sjc3M1VQNlBYWEVnbUdSaFAzOXhMNXl0cVVZWTNYQkluRWJReERscw==,2023-06-09 14:19:18.890389
youtube#commentThread,F4fTNRwL23MhdLuDa1M7aPFFadM,UgzXulBXzJC9eLW556t4AaABAg,"{'videoId': 'c5nN5D2DRqc', 'topLevelComment': {'kind': 'youtube#comment', 'etag': 'bgdnG12_n8tbm6-V32ngDpB6wK4', 'id': 'UgzXulBXzJC9eLW556t4AaABAg', 'snippet': {'videoId': 'c5nN5D2DRqc', 'textDisplay': 'Tem que ver se foram autorizados deslocamento de profs para o nordeste. Isso caracterizaria a má fé na condução desse bloqueio', 'textOriginal': 'Tem que ver se foram autorizados deslocamento de profs para o nordeste. Isso caracterizaria a má fé na condução desse bloqueio', 'authorDisplayName': 'Arimatea Rocha', 'authorProfileImageUrl': 'https://yt3.ggpht.com/ytc/AGIKgqMv1AVb1IM_uZ7ZVG_WJrLDbsE_V6MN7KaxGA=s48-c-k-c0x00ffffff-no-rj', 'authorChannelUrl': 'http://www.youtube.com/channel/UCOm1uCwRJlBi0cRYaysKn5Q', 'authorChannelId': {'value': 'UCOm1uCwRJlBi0cRYaysKn5Q'}, 'canRate': True, 'viewerRating': 'none', 'likeCount': 0, 'publishedAt': '2022-10-30T21:33:33Z', 'updatedAt': '2022-10-30T21:33:33Z'}}, 'canReply': True, 'totalReplyCount': 0, 'isPublic': True}",,UCOm1uCwRJlBi0cRYaysKn5Q,2022-10-30T21:33:33Z,Tem que ver se foram autorizados deslocamento de profs para o nordeste. Isso caracterizaria a má fé na condução desse bloqueio,QURTSl9pM2hiWF9nV2wtQlMtSHRtcXZoZTFaaDF6VnNVWmtUY3p3Sjc3M1VQNlBYWEVnbUdSaFAzOXhMNXl0cVVZWTNYQkluRWJReERscw==,2023-06-09 14:19:18.890389
youtube#commentThread,Uc3GVml9RNwo3rGUt4YSYGXkY7A,Ugx1gmI65GdagGfv1TV4AaABAg,"{'videoId': 'c5nN5D2DRqc', 'topLevelComment': {'kind': 'youtube#comment', 'etag': 'opiRUiJJdAWjDm_egfCsapKRIZQ', 'id': 'Ugx1gmI65GdagGfv1TV4AaABAg', 'snippet': {'videoId': 'c5nN5D2DRqc', 'textDisplay': 'Isso é completamente vergonhoso.', 'textOriginal': 'Isso é completamente vergonhoso.', 'authorDisplayName': 'Policia Federal do Brasil', 'authorProfileImageUrl': 'https://yt3.ggpht.com/HszV4yznJh6wjiQ7BgiwNkhD77Th3ilewNE0hPxHVrLEh3eUj5AHMSBs5M64IQZ5z93dOuDO8g=s48-c-k-c0x00ffffff-no-rj', 'authorChannelUrl': 'http://www.youtube.com/channel/UCINkKMBHLS80i6C9COKhEiw', 'authorChannelId': {'value': 'UCINkKMBHLS80i6C9COKhEiw'}, 'canRate': True, 'viewerRating': 'none', 'likeCount': 0, 'publishedAt': '2022-10-30T21:23:20Z', 'updatedAt': '2022-10-30T21:23:20Z'}}, 'canReply': True, 'totalReplyCount': 0, 'isPublic': True}",,UCINkKMBHLS80i6C9COKhEiw,2022-10-30T21:23:20Z,Isso é completamente vergonhoso.,QURTSl9pM2hiWF9nV2wtQlMtSHRtcXZoZTFaaDF6VnNVWmtUY3p3Sjc3M1VQNlBYWEVnbUdSaFAzOXhMNXl0cVVZWTNYQkluRWJReERscw==,2023-06-09 14:19:18.890389
youtube#commentThread,Tiwc8Ze3ohiQsm_tIU9zrVfOteg,Ugw60hOQ3YSoEvEL7EJ4AaABAg,"{'videoId': 'c5nN5D2DRqc', 'topLevelComment': {'kind': 'youtube#comment', 'etag': 'GlFMT9D59ITBJoWv4u5cRsAu3iw', 'id': 'Ugw60hOQ3YSoEvEL7EJ4AaABAg', 'snippet': {'videoId': 'c5nN5D2DRqc', 'textDisplay': 'Aqui no Pará até os ribeirnhos foram parado noeio do mar n foi permitido filmagem e vários municípios não deixam entrar nas rodovmviarias para adquirir suas passagens gratuitas', 'textOriginal': 'Aqui no Pará até os ribeirnhos foram parado noeio do mar n foi permitido filmagem e vários municípios não deixam entrar nas rodovmviarias para adquirir suas passagens gratuitas', 'authorDisplayName': 'JUSTICA ASP OFICIAL EXERCITO BRASILEIRO', 'authorProfileImageUrl': 'https://yt3.ggpht.com/ytc/AGIKgqN3NtRiDtequL6jVfTe7u9p4BpL7x1Kxt3xp1hG56k=s48-c-k-c0x00ffffff-no-rj', 'authorChannelUrl': 'http://www.youtube.com/channel/UCJDzCJNDbWeP8Qmn8DoUGXw', 'authorChannelId': {'value': 'UCJDzCJNDbWeP8Qmn8DoUGXw'}, 'canRate': True, 'viewerRating': 'none', 'likeCount': 0, 'publishedAt': '2022-10-30T21:05:15Z', 'updatedAt': '2022-10-30T21:05:15Z'}}, 'canReply': True, 'totalReplyCount': 0, 'isPublic': True}",,UCJDzCJNDbWeP8Qmn8DoUGXw,2022-10-30T21:05:15Z,Aqui no Pará até os ribeirnhos foram parado noeio do mar n foi permitido filmagem e vários municípios não deixam entrar nas rodovmviarias para adquirir suas passagens gratuitas,QURTSl9pM2hiWF9nV2wtQlMtSHRtcXZoZTFaaDF6VnNVWmtUY3p3Sjc3M1VQNlBYWEVnbUdSaFAzOXhMNXl0cVVZWTNYQkluRWJReERscw==,2023-06-09 14:19:18.890389
youtube#commentThread,47qt_VnZBDj16T5TLO7rfJ5rXro,UgxtEZbzSbIZj-_KOlx4AaABAg,"{'videoId': 'c5nN5D2DRqc', 'topLevelComment': {'kind': 'youtube#comment', 'etag': 'bnbjB6YMQfZP51jTGIxWmMWlvdE', 'id': 'UgxtEZbzSbIZj-_KOlx4AaABAg', 'snippet': {'videoId': 'c5nN5D2DRqc', 'textDisplay': 'Nossa que pena em kkkk', 'textOriginal': 'Nossa que pena em kkkk', 'authorDisplayName': 'Julio', 'authorProfileImageUrl': 'https://yt3.ggpht.com/ytc/AGIKgqO9H4obI1av2uyWJnRMBFiHZqNcI3ol-1vjoRmJ=s48-c-k-c0x00ffffff-no-rj', 'authorChannelUrl': 'http://www.youtube.com/channel/UCSpOPjLfB4KauYbuGReZDyg', 'authorChannelId': {'value': 'UCSpOPjLfB4KauYbuGReZDyg'}, 'canRate': True, 'viewerRating': 'none', 'likeCount': 0, 'publishedAt': '2022-10-30T21:02:15Z', 'updatedAt': '2022-10-30T21:02:15Z'}}, 'canReply': True, 'totalReplyCount': 0, 'isPublic': True}",,UCSpOPjLfB4KauYbuGReZDyg,2022-10-30T21:02:15Z,Nossa que pena em kkkk,QURTSl9pM2hiWF9nV2wtQlMtSHRtcXZoZTFaaDF6VnNVWmtUY3p3Sjc3M1VQNlBYWEVnbUdSaFAzOXhMNXl0cVVZWTNYQkluRWJReERscw==,2023-06-09 14:19:18.890389
