kind,etag,id,snippet,replies,authorChannelId,publishedAt,textOriginal,nextPageToken,extraction_date
youtube#commentThread,STvgA2u0Cc0HB3WryZKAWWfeh90,UgwdGHJNs-ahgpjttM14AaABAg,"{'videoId': 'W2ImnPI_qmo', 'topLevelComment': {'kind': 'youtube#comment', 'etag': 'gJhE5tSIVa2Q0W2GkXMa3SM3ugM', 'id': 'UgwdGHJNs-ahgpjttM14AaABAg', 'snippet': {'videoId': 'W2ImnPI_qmo', 'textDisplay': 'Que pena que a Ucrânia não tem suas bombas nucleares !! , Queria ver 👀 se a russia teria peito de invadir  , não é a toa que a Polônia já tá correndo atrás das bombas nucleares.', 'textOriginal': 'Que pena que a Ucrânia não tem suas bombas nucleares !! , Queria ver 👀 se a russia teria peito de invadir  , não é a toa que a Polônia já tá correndo atrás das bombas nucleares.', 'authorDisplayName': 'Ney Cleber', 'authorProfileImageUrl': 'https://yt3.ggpht.com/ytc/AGIKgqNn8OlBihuJO8BPOIcNRwLQNA7F2Ymmb-FN0g=s48-c-k-c0x00ffffff-no-rj', 'authorChannelUrl': 'http://www.youtube.com/channel/UC6R_3Kkd7LGbGL3zQCpIW4w', 'authorChannelId': {'value': 'UC6R_3Kkd7LGbGL3zQCpIW4w'}, 'canRate': True, 'viewerRating': 'none', 'likeCount': 0, 'publishedAt': '2022-10-13T21:40:14Z', 'updatedAt': '2022-10-13T21:40:14Z'}}, 'canReply': True, 'totalReplyCount': 0, 'isPublic': True}",,UC6R_3Kkd7LGbGL3zQCpIW4w,2022-10-13T21:40:14Z,"Que pena que a Ucrânia não tem suas bombas nucleares !! , Queria ver 👀 se a russia teria peito de invadir  , não é a toa que a Polônia já tá correndo atrás das bombas nucleares.",,2023-06-08 18:14:44.232167
youtube#commentThread,uulOCYK1a7VWeRtHlZa73d4DFqA,UgwjC3atMtUL3r-CcRl4AaABAg,"{'videoId': 'W2ImnPI_qmo', 'topLevelComment': {'kind': 'youtube#comment', 'etag': 'Kwt08jOCN26TfYIvm3oGqdbUrUo', 'id': 'UgwjC3atMtUL3r-CcRl4AaABAg', 'snippet': {'videoId': 'W2ImnPI_qmo', 'textDisplay': 'Vão dar apoio aos ucranianos enquanto houver 1 zelensk de pé?????🤔🤔🤔', 'textOriginal': 'Vão dar apoio aos ucranianos enquanto houver 1 zelensk de pé?????🤔🤔🤔', 'authorDisplayName': 'carlos jose barbosa', 'authorProfileImageUrl': 'https://yt3.ggpht.com/ytc/AGIKgqPl7DxWkVVh671LWAbOOux7oTOWR8xhCSOaqY7OCA=s48-c-k-c0x00ffffff-no-rj', 'authorChannelUrl': 'http://www.youtube.com/channel/UChT2sDSqZrNnexmtR2BVAPQ', 'authorChannelId': {'value': 'UChT2sDSqZrNnexmtR2BVAPQ'}, 'canRate': True, 'viewerRating': 'none', 'likeCount': 0, 'publishedAt': '2022-10-13T20:48:14Z', 'updatedAt': '2022-10-13T20:48:14Z'}}, 'canReply': True, 'totalReplyCount': 0, 'isPublic': True}",,UChT2sDSqZrNnexmtR2BVAPQ,2022-10-13T20:48:14Z,Vão dar apoio aos ucranianos enquanto houver 1 zelensk de pé?????🤔🤔🤔,,2023-06-08 18:14:44.232167
youtube#commentThread,XPS2MBCX4KR-9OI-_qgq0bZWPBU,UgyTwK-3xF7K04HrN7x4AaABAg,"{'videoId': 'W2ImnPI_qmo', 'topLevelComment': {'kind': 'youtube#comment', 'etag': 'YScOa4iOw-HlEczdjvEeSfm6H_w', 'id': 'UgyTwK-3xF7K04HrN7x4AaABAg', 'snippet': {'videoId': 'W2ImnPI_qmo', 'textDisplay': 'Putin está mandando presentes tbm...kkk', 'textOriginal': 'Putin está mandando presentes tbm...kkk', 'authorDisplayName': 'Fagner Gonçalves de sousa', 'authorProfileImageUrl': 'https://yt3.ggpht.com/ytc/AGIKgqNNLmiE71klkh7QrJOkv8C8yvJXBs28hWYoew=s48-c-k-c0x00ffffff-no-rj', 'authorChannelUrl': 'http://www.youtube.com/channel/UCh2Li391gdgsw7Z6G5936gw', 'authorChannelId': {'value': 'UCh2Li391gdgsw7Z6G5936gw'}, 'canRate': True, 'viewerRating': 'none', 'likeCount': 0, 'publishedAt': '2022-10-13T18:31:37Z', 'updatedAt': '2022-10-13T18:31:37Z'}}, 'canReply': True, 'totalReplyCount': 0, 'isPublic': True}",,UCh2Li391gdgsw7Z6G5936gw,2022-10-13T18:31:37Z,Putin está mandando presentes tbm...kkk,,2023-06-08 18:14:44.232167
youtube#commentThread,OTXtlo2rPnw4Al9wDcjTIZPt6lU,UgwvauYc8i9DCJxU-1l4AaABAg,"{'videoId': 'W2ImnPI_qmo', 'topLevelComment': {'kind': 'youtube#comment', 'etag': 'SjnAqpI6JiA1u0A-zHQQWHrLetk', 'id': 'UgwvauYc8i9DCJxU-1l4AaABAg', 'snippet': {'videoId': 'W2ImnPI_qmo', 'textDisplay': 'Apoiar a Ucrânia  até ela ser nessessaria! Quando ela não tiver mais serventia  deixar ao Deus dará,  cambadas. 😈😈😈😈😈💀💀💀', 'textOriginal': 'Apoiar a Ucrânia  até ela ser nessessaria! Quando ela não tiver mais serventia  deixar ao Deus dará,  cambadas. 😈😈😈😈😈💀💀💀', 'authorDisplayName': 'Maria Anita', 'authorProfileImageUrl': 'https://yt3.ggpht.com/ytc/AGIKgqPchFp4_jliNqmaoNJQrKGKSbC6FX0YaEZ9XA=s48-c-k-c0x00ffffff-no-rj', 'authorChannelUrl': 'http://www.youtube.com/channel/UCQvh-qxQH0iuuWCwLeOww-w', 'authorChannelId': {'value': 'UCQvh-qxQH0iuuWCwLeOww-w'}, 'canRate': True, 'viewerRating': 'none', 'likeCount': 0, 'publishedAt': '2022-10-13T17:04:48Z', 'updatedAt': '2022-10-13T17:04:48Z'}}, 'canReply': True, 'totalReplyCount': 0, 'isPublic': True}",,UCQvh-qxQH0iuuWCwLeOww-w,2022-10-13T17:04:48Z,"Apoiar a Ucrânia  até ela ser nessessaria! Quando ela não tiver mais serventia  deixar ao Deus dará,  cambadas. 😈😈😈😈😈💀💀💀",,2023-06-08 18:14:44.232167
youtube#commentThread,aFd6HmLGPe5OwexsgCTi_eZgEO4,Ugxi3ieIDeuTDLBt5zd4AaABAg,"{'videoId': 'W2ImnPI_qmo', 'topLevelComment': {'kind': 'youtube#comment', 'etag': 'PdmlOxNFKbku_CMbfs6YYzJRU-Q', 'id': 'Ugxi3ieIDeuTDLBt5zd4AaABAg', 'snippet': {'videoId': 'W2ImnPI_qmo', 'textDisplay': 'G7👹👹👹👹👹👹👹😠', 'textOriginal': 'G7👹👹👹👹👹👹👹😠', 'authorDisplayName': 'Cidália Maria Gregório Alves', 'authorProfileImageUrl': 'https://yt3.ggpht.com/ytc/AGIKgqOweFpcUUBMXFPOQLsZddXrSUutjy2pHAFJ0Q=s48-c-k-c0x00ffffff-no-rj', 'authorChannelUrl': 'http://www.youtube.com/channel/UCsX8rPpVplEwOHMrtYS5nyQ', 'authorChannelId': {'value': 'UCsX8rPpVplEwOHMrtYS5nyQ'}, 'canRate': True, 'viewerRating': 'none', 'likeCount': 0, 'publishedAt': '2022-10-12T22:07:07Z', 'updatedAt': '2022-10-12T22:07:07Z'}}, 'canReply': True, 'totalReplyCount': 0, 'isPublic': True}",,UCsX8rPpVplEwOHMrtYS5nyQ,2022-10-12T22:07:07Z,G7👹👹👹👹👹👹👹😠,,2023-06-08 18:14:44.232167
youtube#commentThread,4NvpV1DByNCv6tFGjC8i2ih7-hg,Ugzlg0gNANt9vrNSSWJ4AaABAg,"{'videoId': 'W2ImnPI_qmo', 'topLevelComment': {'kind': 'youtube#comment', 'etag': 'ZU4QZjueRWPLCXhQyrEyj8XXtk0', 'id': 'Ugzlg0gNANt9vrNSSWJ4AaABAg', 'snippet': {'videoId': 'W2ImnPI_qmo', 'textDisplay': 'Está claro que a mídia brasileira está muito mal informada sobre a guerra da Ucrânia, mostrando o despreparo estratégico das elites brasileira as quais, por consequência, não conseguem estabelecer uma inserção positiva do Brasil na geopolítica mundial atual, restando-lhes o papel de bons moços que se referem aos Yankees de Washington como “Buana Clinton”. Bons Moços! Quiçá a Guerra da Ucrânia esteja testando novas doutrinas militares Russas, demonstrando que uma barragem de artilharia e mísseis com tiros ao dia equivalentes ao total disparado pelos americanos  em toda a Guerra do Iraqui, como uma alternativa de guerra convencional a um conflito nuclear, mas com igual potencial destrutivo sem contaminação radioativa. Os Russos prepararam-se bem para essa guerra, distribuindo imensas quantidades de munições ao longo da Eurásia para ter a sua disposição agora esses imensos recursos para provocar uma barragem impetuosa de tiros de artilharia e mísseis sem igual na história militar recente. Putin já havia advertido dessas consequências, e a resposta do Ocidente tem sido editoriais rasos do New York Time, retransmitido pelo consórcio Estadão-folha-globo! Sugiro Scott Ritter como fonte', 'textOriginal': 'Está claro que a mídia brasileira está muito mal informada sobre a guerra da Ucrânia, mostrando o despreparo estratégico das elites brasileira as quais, por consequência, não conseguem estabelecer uma inserção positiva do Brasil na geopolítica mundial atual, restando-lhes o papel de bons moços que se referem aos Yankees de Washington como “Buana Clinton”. Bons Moços! Quiçá a Guerra da Ucrânia esteja testando novas doutrinas militares Russas, demonstrando que uma barragem de artilharia e mísseis com tiros ao dia equivalentes ao total disparado pelos americanos  em toda a Guerra do Iraqui, como uma alternativa de guerra convencional a um conflito nuclear, mas com igual potencial destrutivo sem contaminação radioativa. Os Russos prepararam-se bem para essa guerra, distribuindo imensas quantidades de munições ao longo da Eurásia para ter a sua disposição agora esses imensos recursos para provocar uma barragem impetuosa de tiros de artilharia e mísseis sem igual na história militar recente. Putin já havia advertido dessas consequências, e a resposta do Ocidente tem sido editoriais rasos do New York Time, retransmitido pelo consórcio Estadão-folha-globo! Sugiro Scott Ritter como fonte', 'authorDisplayName': 'Ricardo Gomes Rodrigues', 'authorProfileImageUrl': 'https://yt3.ggpht.com/ytc/AGIKgqPBfa1J9TRVJobLM-25OnVofld3iZM6zXZSYyqxAw=s48-c-k-c0x00ffffff-no-rj', 'authorChannelUrl': 'http://www.youtube.com/channel/UCcpAE2FN121TkhrJrDYKxOw', 'authorChannelId': {'value': 'UCcpAE2FN121TkhrJrDYKxOw'}, 'canRate': True, 'viewerRating': 'none', 'likeCount': 0, 'publishedAt': '2022-10-12T18:33:56Z', 'updatedAt': '2022-10-12T18:33:56Z'}}, 'canReply': True, 'totalReplyCount': 0, 'isPublic': True}",,UCcpAE2FN121TkhrJrDYKxOw,2022-10-12T18:33:56Z,"Está claro que a mídia brasileira está muito mal informada sobre a guerra da Ucrânia, mostrando o despreparo estratégico das elites brasileira as quais, por consequência, não conseguem estabelecer uma inserção positiva do Brasil na geopolítica mundial atual, restando-lhes o papel de bons moços que se referem aos Yankees de Washington como “Buana Clinton”. Bons Moços! Quiçá a Guerra da Ucrânia esteja testando novas doutrinas militares Russas, demonstrando que uma barragem de artilharia e mísseis com tiros ao dia equivalentes ao total disparado pelos americanos  em toda a Guerra do Iraqui, como uma alternativa de guerra convencional a um conflito nuclear, mas com igual potencial destrutivo sem contaminação radioativa. Os Russos prepararam-se bem para essa guerra, distribuindo imensas quantidades de munições ao longo da Eurásia para ter a sua disposição agora esses imensos recursos para provocar uma barragem impetuosa de tiros de artilharia e mísseis sem igual na história militar recente. Putin já havia advertido dessas consequências, e a resposta do Ocidente tem sido editoriais rasos do New York Time, retransmitido pelo consórcio Estadão-folha-globo! Sugiro Scott Ritter como fonte",,2023-06-08 18:14:44.232167
youtube#commentThread,rn_8uaElHOvEk11euu4tetVI1R4,UgyyEE21126pdlnhFBd4AaABAg,"{'videoId': 'W2ImnPI_qmo', 'topLevelComment': {'kind': 'youtube#comment', 'etag': 'V6MyCoJM3lCeBVtt8fqCW8XSEuA', 'id': 'UgyyEE21126pdlnhFBd4AaABAg', 'snippet': {'videoId': 'W2ImnPI_qmo', 'textDisplay': 'É se a mídia não tivesse torcendo,poderia alguém sentar e negociar um acordo ,boa sorte para a Europa eles vão precisar.', 'textOriginal': 'É se a mídia não tivesse torcendo,poderia alguém sentar e negociar um acordo ,boa sorte para a Europa eles vão precisar.', 'authorDisplayName': 'José Alberto Del Olmo. José Alberto.', 'authorProfileImageUrl': 'https://yt3.ggpht.com/ytc/AGIKgqPx8MPax3WNm6G7ul83557KUUL0Iw1Y7Dw5MDHQTA=s48-c-k-c0x00ffffff-no-rj', 'authorChannelUrl': 'http://www.youtube.com/channel/UC0eHr3Pl91-L9x9eMFpP7UQ', 'authorChannelId': {'value': 'UC0eHr3Pl91-L9x9eMFpP7UQ'}, 'canRate': True, 'viewerRating': 'none', 'likeCount': 0, 'publishedAt': '2022-10-12T14:52:43Z', 'updatedAt': '2022-10-12T14:52:43Z'}}, 'canReply': True, 'totalReplyCount': 0, 'isPublic': True}",,UC0eHr3Pl91-L9x9eMFpP7UQ,2022-10-12T14:52:43Z,"É se a mídia não tivesse torcendo,poderia alguém sentar e negociar um acordo ,boa sorte para a Europa eles vão precisar.",,2023-06-08 18:14:44.232167
youtube#commentThread,MFCG5rT5OUlyl-vePzwLYVT158k,UgyTzCEx1ly4EWkDRtV4AaABAg,"{'videoId': 'W2ImnPI_qmo', 'topLevelComment': {'kind': 'youtube#comment', 'etag': 'lw9JzTtCOvG0alwGFOpyWmy20-Y', 'id': 'UgyTzCEx1ly4EWkDRtV4AaABAg', 'snippet': {'videoId': 'W2ImnPI_qmo', 'textDisplay': 'O tal zalenski pediu isso', 'textOriginal': 'O tal zalenski pediu isso', 'authorDisplayName': 'Erli Lourenço Mariano', 'authorProfileImageUrl': 'https://yt3.ggpht.com/ytc/AGIKgqOMwWoDivZ5dgEhhKqm4NcXYRxwiAgeTDCAbA=s48-c-k-c0x00ffffff-no-rj', 'authorChannelUrl': 'http://www.youtube.com/channel/UCkzexp_XF3qka5pX0qeMdsA', 'authorChannelId': {'value': 'UCkzexp_XF3qka5pX0qeMdsA'}, 'canRate': True, 'viewerRating': 'none', 'likeCount': 1, 'publishedAt': '2022-10-12T14:44:04Z', 'updatedAt': '2022-10-12T14:44:04Z'}}, 'canReply': True, 'totalReplyCount': 0, 'isPublic': True}",,UCkzexp_XF3qka5pX0qeMdsA,2022-10-12T14:44:04Z,O tal zalenski pediu isso,,2023-06-08 18:14:44.232167
youtube#commentThread,FeSiE-8jOdh8tCLY4UgLyczS19s,Ugw23Gb4Ma9lvC_uiBh4AaABAg,"{'videoId': 'W2ImnPI_qmo', 'topLevelComment': {'kind': 'youtube#comment', 'etag': 'GHg_dHwNpvTe2QM54r7en6WFsKs', 'id': 'Ugw23Gb4Ma9lvC_uiBh4AaABAg', 'snippet': {'videoId': 'W2ImnPI_qmo', 'textDisplay': 'Esse PUTIM é um assassino, desde quando entrou pra KJB Polícia Secreta da Rússia, e tinha carta branca para matar qualquer pessoa suspeita de se posicionar contra o GOVERNO!', 'textOriginal': 'Esse PUTIM é um assassino, desde quando entrou pra KJB Polícia Secreta da Rússia, e tinha carta branca para matar qualquer pessoa suspeita de se posicionar contra o GOVERNO!', 'authorDisplayName': 'Raymundo Nonato de Oliveira Nonato', 'authorProfileImageUrl': 'https://yt3.ggpht.com/ytc/AGIKgqMAjgAmEjznk7S42CckmTWL0EGltZHSAZdzDA=s48-c-k-c0x00ffffff-no-rj', 'authorChannelUrl': 'http://www.youtube.com/channel/UCW6dqtVUpKSPBD2mQSRZfSQ', 'authorChannelId': {'value': 'UCW6dqtVUpKSPBD2mQSRZfSQ'}, 'canRate': True, 'viewerRating': 'none', 'likeCount': 0, 'publishedAt': '2022-10-12T14:31:05Z', 'updatedAt': '2022-10-12T14:31:05Z'}}, 'canReply': True, 'totalReplyCount': 0, 'isPublic': True}",,UCW6dqtVUpKSPBD2mQSRZfSQ,2022-10-12T14:31:05Z,"Esse PUTIM é um assassino, desde quando entrou pra KJB Polícia Secreta da Rússia, e tinha carta branca para matar qualquer pessoa suspeita de se posicionar contra o GOVERNO!",,2023-06-08 18:14:44.232167
youtube#commentThread,BZrMhGdYraTCmPo6eb9AfrOQRc4,UgwwpPFYtxbdiiribVB4AaABAg,"{'videoId': 'W2ImnPI_qmo', 'topLevelComment': {'kind': 'youtube#comment', 'etag': '3UoxwmvnfhHmMeKVUND2H_53Uxo', 'id': 'UgwwpPFYtxbdiiribVB4AaABAg', 'snippet': {'videoId': 'W2ImnPI_qmo', 'textDisplay': 'Então que enviem mísseis de longo alcance aa Ucrânia para que tenha condições de lutar em pé de igualdade.', 'textOriginal': 'Então que enviem mísseis de longo alcance aa Ucrânia para que tenha condições de lutar em pé de igualdade.', 'authorDisplayName': 'JJ p', 'authorProfileImageUrl': 'https://yt3.ggpht.com/ytc/AGIKgqPGyMjWt-_XsmGwqN-oehpUIs7tjB8PSUGrkA=s48-c-k-c0x00ffffff-no-rj', 'authorChannelUrl': 'http://www.youtube.com/channel/UCC7w0UyHrfLkvHgZnPvu-lA', 'authorChannelId': {'value': 'UCC7w0UyHrfLkvHgZnPvu-lA'}, 'canRate': True, 'viewerRating': 'none', 'likeCount': 0, 'publishedAt': '2022-10-12T14:29:50Z', 'updatedAt': '2022-10-12T14:29:50Z'}}, 'canReply': True, 'totalReplyCount': 0, 'isPublic': True}",,UCC7w0UyHrfLkvHgZnPvu-lA,2022-10-12T14:29:50Z,Então que enviem mísseis de longo alcance aa Ucrânia para que tenha condições de lutar em pé de igualdade.,,2023-06-08 18:14:44.232167
youtube#commentThread,ReOdLNnzorGjYNjQVrLz-wD88GI,Ugy7pU1iZ1iDpkfekkB4AaABAg,"{'videoId': 'W2ImnPI_qmo', 'topLevelComment': {'kind': 'youtube#comment', 'etag': 'FUnxLmTbiQGUblpF8CWQT92zmJw', 'id': 'Ugy7pU1iZ1iDpkfekkB4AaABAg', 'snippet': {'videoId': 'W2ImnPI_qmo', 'textDisplay': 'Aí depois que, a Rússia lança vários miseis o G7 achar ruim.', 'textOriginal': 'Aí depois que, a Rússia lança vários miseis o G7 achar ruim.', 'authorDisplayName': 'Luan Almeida', 'authorProfileImageUrl': 'https://yt3.ggpht.com/ytc/AGIKgqPXZ1KGBLWY1lNeIQ3DtrfV7105gwRfJxHPjQ=s48-c-k-c0x00ffffff-no-rj', 'authorChannelUrl': 'http://www.youtube.com/channel/UCLQ_BrOAKqWGlD8VwQycwcA', 'authorChannelId': {'value': 'UCLQ_BrOAKqWGlD8VwQycwcA'}, 'canRate': True, 'viewerRating': 'none', 'likeCount': 0, 'publishedAt': '2022-10-12T14:02:41Z', 'updatedAt': '2022-10-12T14:02:41Z'}}, 'canReply': True, 'totalReplyCount': 0, 'isPublic': True}",,UCLQ_BrOAKqWGlD8VwQycwcA,2022-10-12T14:02:41Z,"Aí depois que, a Rússia lança vários miseis o G7 achar ruim.",,2023-06-08 18:14:44.232167
youtube#commentThread,0wA1UeCt60OYTXJlM0w8EwoInB8,UgzJDjlAxqg3iOkEtMZ4AaABAg,"{'videoId': 'W2ImnPI_qmo', 'topLevelComment': {'kind': 'youtube#comment', 'etag': 'ghFPK3YKY6txuQvwOQWg4aoa1fU', 'id': 'UgzJDjlAxqg3iOkEtMZ4AaABAg', 'snippet': {'videoId': 'W2ImnPI_qmo', 'textDisplay': 'Incrível é o repórter falar que a vida estava votando ao normal, para a capital de um pais que esta em guerra, o que será normal para esta pessoa?', 'textOriginal': 'Incrível é o repórter falar que a vida estava votando ao normal, para a capital de um pais que esta em guerra, o que será normal para esta pessoa?', 'authorDisplayName': 'TONINHO BALA', 'authorProfileImageUrl': 'https://yt3.ggpht.com/rb0Fe9IpOZa6MRqGHUyCYG9qdKtUMRI1zf8hMHm4aj4jRkvLFL_YCAX-_E7G1nbAP_XAlAi3EPg=s48-c-k-c0x00ffffff-no-rj', 'authorChannelUrl': 'http://www.youtube.com/channel/UCXJewephB1zPW1zvwpeH69w', 'authorChannelId': {'value': 'UCXJewephB1zPW1zvwpeH69w'}, 'canRate': True, 'viewerRating': 'none', 'likeCount': 0, 'publishedAt': '2022-10-12T13:52:08Z', 'updatedAt': '2022-10-12T13:52:55Z'}}, 'canReply': True, 'totalReplyCount': 0, 'isPublic': True}",,UCXJewephB1zPW1zvwpeH69w,2022-10-12T13:52:08Z,"Incrível é o repórter falar que a vida estava votando ao normal, para a capital de um pais que esta em guerra, o que será normal para esta pessoa?",,2023-06-08 18:14:44.232167
youtube#commentThread,WVCGoFf8TEa2ySFMmBnnC8B5Pa0,Ugzs8RmT1vPsAUUXRAp4AaABAg,"{'videoId': 'W2ImnPI_qmo', 'topLevelComment': {'kind': 'youtube#comment', 'etag': '8ooqL23m_zB491h_IKVYquIP9BY', 'id': 'Ugzs8RmT1vPsAUUXRAp4AaABAg', 'snippet': {'videoId': 'W2ImnPI_qmo', 'textDisplay': 'Otan , EUA , união europeia, na prática não fazem nem 10% do que prometem . ( Isso é mais velho que andar pra frente) .', 'textOriginal': 'Otan , EUA , união europeia, na prática não fazem nem 10% do que prometem . ( Isso é mais velho que andar pra frente) .', 'authorDisplayName': 'Rose Aquino', 'authorProfileImageUrl': 'https://yt3.ggpht.com/ytc/AGIKgqOxKzaYwLzWTNcQdj95d3b4bSeUPLehkwbBdw=s48-c-k-c0x00ffffff-no-rj', 'authorChannelUrl': 'http://www.youtube.com/channel/UCt4dYykc2bBXLHtKO-5DYKA', 'authorChannelId': {'value': 'UCt4dYykc2bBXLHtKO-5DYKA'}, 'canRate': True, 'viewerRating': 'none', 'likeCount': 0, 'publishedAt': '2022-10-12T13:50:09Z', 'updatedAt': '2022-10-12T13:50:09Z'}}, 'canReply': True, 'totalReplyCount': 0, 'isPublic': True}",,UCt4dYykc2bBXLHtKO-5DYKA,2022-10-12T13:50:09Z,"Otan , EUA , união europeia, na prática não fazem nem 10% do que prometem . ( Isso é mais velho que andar pra frente) .",,2023-06-08 18:14:44.232167
youtube#commentThread,45N6YB76s7H2KtbkAtPEUlZg4OA,UgzlPEJfVom-8Sn3I-l4AaABAg,"{'videoId': 'W2ImnPI_qmo', 'topLevelComment': {'kind': 'youtube#comment', 'etag': 'UpU7ZRBOmG9zkcdHsI0Wlxqu6fI', 'id': 'UgzlPEJfVom-8Sn3I-l4AaABAg', 'snippet': {'videoId': 'W2ImnPI_qmo', 'textDisplay': 'É muito triste o que esses líderes estão fazendo, ao invés de sentarem para negociação da paz sabendo que a ucrania não hipóteses de ganhar ainda assim preferem apoiar com armamentos isso so vai piorar a guerra... que Deus proteja o povo ucraniano e a mãe Rússia...', 'textOriginal': 'É muito triste o que esses líderes estão fazendo, ao invés de sentarem para negociação da paz sabendo que a ucrania não hipóteses de ganhar ainda assim preferem apoiar com armamentos isso so vai piorar a guerra... que Deus proteja o povo ucraniano e a mãe Rússia...', 'authorDisplayName': 'Miguel Madruga', 'authorProfileImageUrl': 'https://yt3.ggpht.com/ytc/AGIKgqPBqdThAuCJdrlVa32vdw0eJ1k-r7euU97ONGVliuMUl58EjLGI_ddm7HJAGesk=s48-c-k-c0x00ffffff-no-rj', 'authorChannelUrl': 'http://www.youtube.com/channel/UC4Y4mWmyNDQX7mqPtf0KLAQ', 'authorChannelId': {'value': 'UC4Y4mWmyNDQX7mqPtf0KLAQ'}, 'canRate': True, 'viewerRating': 'none', 'likeCount': 0, 'publishedAt': '2022-10-12T13:48:21Z', 'updatedAt': '2022-10-12T13:48:21Z'}}, 'canReply': True, 'totalReplyCount': 0, 'isPublic': True}",,UC4Y4mWmyNDQX7mqPtf0KLAQ,2022-10-12T13:48:21Z,"É muito triste o que esses líderes estão fazendo, ao invés de sentarem para negociação da paz sabendo que a ucrania não hipóteses de ganhar ainda assim preferem apoiar com armamentos isso so vai piorar a guerra... que Deus proteja o povo ucraniano e a mãe Rússia...",,2023-06-08 18:14:44.232167
youtube#commentThread,-9pcpDHYXto3SicEuYxk60QPCtQ,UgxGjMxDuTkbQAFR8b14AaABAg,"{'videoId': 'W2ImnPI_qmo', 'topLevelComment': {'kind': 'youtube#comment', 'etag': '3Jdd_WpZscfGglxlQBZbIbl-y_U', 'id': 'UgxGjMxDuTkbQAFR8b14AaABAg', 'snippet': {'videoId': 'W2ImnPI_qmo', 'textDisplay': 'PUTIN segue a &quot;Receita&quot; de seu mestre STALIN! Haverá um novo Holodomor...🇷🇺💀🇷🇺☠️🇷🇺', 'textOriginal': 'PUTIN segue a ""Receita"" de seu mestre STALIN! Haverá um novo Holodomor...🇷🇺💀🇷🇺☠️🇷🇺', 'authorDisplayName': 'Osmar Dos Reis', 'authorProfileImageUrl': 'https://yt3.ggpht.com/ytc/AGIKgqOewstkMakLCwQT6AyDQ7xZIoZuAPrq1KN1ZTpwqw=s48-c-k-c0x00ffffff-no-rj', 'authorChannelUrl': 'http://www.youtube.com/channel/UC8QYJT31IQ147u3r5Cp2jwA', 'authorChannelId': {'value': 'UC8QYJT31IQ147u3r5Cp2jwA'}, 'canRate': True, 'viewerRating': 'none', 'likeCount': 0, 'publishedAt': '2022-10-12T13:23:53Z', 'updatedAt': '2022-10-12T13:23:53Z'}}, 'canReply': True, 'totalReplyCount': 0, 'isPublic': True}",,UC8QYJT31IQ147u3r5Cp2jwA,2022-10-12T13:23:53Z,"PUTIN segue a ""Receita"" de seu mestre STALIN! Haverá um novo Holodomor...🇷🇺💀🇷🇺☠️🇷🇺",,2023-06-08 18:14:44.232167
youtube#commentThread,EkqPJ6lS1_Pt3JQ6N9WG2oznB5o,UgzHtWigetRTY15ehAN4AaABAg,"{'videoId': 'W2ImnPI_qmo', 'topLevelComment': {'kind': 'youtube#comment', 'etag': 'FzUYFSW5_HFj4C1qAnzlUKgTkp4', 'id': 'UgzHtWigetRTY15ehAN4AaABAg', 'snippet': {'videoId': 'W2ImnPI_qmo', 'textDisplay': 'terceira guerra mundial terceirizada e  por procuração. é  só um míssil atravessar uma fronteira e atingir um dos países da Otan como a Polônia e ai já era. Putin não vai voltar atrás, e nada é tão ruim que não possa piorar.', 'textOriginal': 'terceira guerra mundial terceirizada e  por procuração. é  só um míssil atravessar uma fronteira e atingir um dos países da Otan como a Polônia e ai já era. Putin não vai voltar atrás, e nada é tão ruim que não possa piorar.', 'authorDisplayName': 'Carlos Ferreira', 'authorProfileImageUrl': 'https://yt3.ggpht.com/ytc/AGIKgqNeUveAGD6NqjnK-FJrL6z_dhTPjKjN6pDVNpt7FRGFi-nYFwf-Ox13steeDBO8=s48-c-k-c0x00ffffff-no-rj', 'authorChannelUrl': 'http://www.youtube.com/channel/UChXepyvB4lL4vJSwwrJjG_A', 'authorChannelId': {'value': 'UChXepyvB4lL4vJSwwrJjG_A'}, 'canRate': True, 'viewerRating': 'none', 'likeCount': 0, 'publishedAt': '2022-10-12T12:50:38Z', 'updatedAt': '2022-10-12T12:52:45Z'}}, 'canReply': True, 'totalReplyCount': 0, 'isPublic': True}",,UChXepyvB4lL4vJSwwrJjG_A,2022-10-12T12:50:38Z,"terceira guerra mundial terceirizada e  por procuração. é  só um míssil atravessar uma fronteira e atingir um dos países da Otan como a Polônia e ai já era. Putin não vai voltar atrás, e nada é tão ruim que não possa piorar.",,2023-06-08 18:14:44.232167
youtube#commentThread,uhVk74F9EOsLPpiPkyWA8fnKPDY,UgxJvbEjDHA8nh7f5LJ4AaABAg,"{'videoId': 'W2ImnPI_qmo', 'topLevelComment': {'kind': 'youtube#comment', 'etag': 'llD6Y1U2e4M37Mc2HBF0JfY4fB4', 'id': 'UgxJvbEjDHA8nh7f5LJ4AaABAg', 'snippet': {'videoId': 'W2ImnPI_qmo', 'textDisplay': 'Estão usando a Ucrânia pra guerrear contra Rússia, Ucrânia já perdeu.', 'textOriginal': 'Estão usando a Ucrânia pra guerrear contra Rússia, Ucrânia já perdeu.', 'authorDisplayName': 'Dicas de Inglês BR', 'authorProfileImageUrl': 'https://yt3.ggpht.com/ytc/AGIKgqM_oksvFxk-9rWa4bo2WqtqmIl0Y_dEkQwdue8esg=s48-c-k-c0x00ffffff-no-rj', 'authorChannelUrl': 'http://www.youtube.com/channel/UCU4KMXP-0J1ye0ZwbMN97AA', 'authorChannelId': {'value': 'UCU4KMXP-0J1ye0ZwbMN97AA'}, 'canRate': True, 'viewerRating': 'none', 'likeCount': 0, 'publishedAt': '2022-10-12T12:50:27Z', 'updatedAt': '2022-10-12T12:50:27Z'}}, 'canReply': True, 'totalReplyCount': 0, 'isPublic': True}",,UCU4KMXP-0J1ye0ZwbMN97AA,2022-10-12T12:50:27Z,"Estão usando a Ucrânia pra guerrear contra Rússia, Ucrânia já perdeu.",,2023-06-08 18:14:44.232167
youtube#commentThread,VD0eBUCWzsSfNWFOdcE9lRBbzw4,Ugx_xKkvuSi0qOro5wN4AaABAg,"{'videoId': 'W2ImnPI_qmo', 'topLevelComment': {'kind': 'youtube#comment', 'etag': 'TCcYU0-bPIgtwDjkxmV5Qjm1DGA', 'id': 'Ugx_xKkvuSi0qOro5wN4AaABAg', 'snippet': {'videoId': 'W2ImnPI_qmo', 'textDisplay': 'O pulti vai ser queimado vai para o inferno', 'textOriginal': 'O pulti vai ser queimado vai para o inferno', 'authorDisplayName': 'Edson Nascimento', 'authorProfileImageUrl': 'https://yt3.ggpht.com/3wc0IwIJQGH4syar0YMVqZe-TMB5QOoX_8ASNrhho4tbJ5j2FxgNwHeE-aJ34XLVyB2nopaTWg=s48-c-k-c0x00ffffff-no-rj', 'authorChannelUrl': 'http://www.youtube.com/channel/UCrMfOCzIW5NhU0Py5pujxCQ', 'authorChannelId': {'value': 'UCrMfOCzIW5NhU0Py5pujxCQ'}, 'canRate': True, 'viewerRating': 'none', 'likeCount': 0, 'publishedAt': '2022-10-12T12:49:01Z', 'updatedAt': '2022-10-12T12:49:01Z'}}, 'canReply': True, 'totalReplyCount': 0, 'isPublic': True}",,UCrMfOCzIW5NhU0Py5pujxCQ,2022-10-12T12:49:01Z,O pulti vai ser queimado vai para o inferno,,2023-06-08 18:14:44.232167
