kind,etag,id,snippet,replies,authorChannelId,publishedAt,textOriginal,nextPageToken,extraction_date
youtube#commentThread,pE9MhZJNqbST9HCO9BwSHji1CKY,UgxNnqJCpbwLZysU4ld4AaABAg,"{'videoId': '8vbY6eDzZ3M', 'topLevelComment': {'kind': 'youtube#comment', 'etag': 'J-jTcFmldKlNFF1Ea7btvzITVJw', 'id': 'UgxNnqJCpbwLZysU4ld4AaABAg', 'snippet': {'videoId': '8vbY6eDzZ3M', 'textDisplay': '📻🎧📱🤔😀👍🏾', 'textOriginal': '📻🎧📱🤔😀👍🏾', 'authorDisplayName': 'Marcileia S. Sousa', 'authorProfileImageUrl': 'https://yt3.ggpht.com/UjeNp4Z824BKAi5NAZT-8Fkjia1xekJIx9RKXojdDwRC9oqMtJLMAJW2bZ4sQdCjTeLVUplE=s48-c-k-c0x00ffffff-no-rj', 'authorChannelUrl': 'http://www.youtube.com/channel/UCvLgxRATLF-GdkkZ1GHRchg', 'authorChannelId': {'value': 'UCvLgxRATLF-GdkkZ1GHRchg'}, 'canRate': True, 'viewerRating': 'none', 'likeCount': 0, 'publishedAt': '2022-10-10T12:35:51Z', 'updatedAt': '2022-10-10T12:35:51Z'}}, 'canReply': True, 'totalReplyCount': 0, 'isPublic': True}",,UCvLgxRATLF-GdkkZ1GHRchg,2022-10-10T12:35:51Z,📻🎧📱🤔😀👍🏾,,2023-06-08 18:23:37.646342
youtube#commentThread,V5kd7cTV6aZnkgAki9Stcb2JA4k,Ugz1CYxUeLp6LdrGU894AaABAg,"{'videoId': '8vbY6eDzZ3M', 'topLevelComment': {'kind': 'youtube#comment', 'etag': 'TrWs94QEdxmd_YtrG3ntR3L73_k', 'id': 'Ugz1CYxUeLp6LdrGU894AaABAg', 'snippet': {'videoId': '8vbY6eDzZ3M', 'textDisplay': 'Espero q os eleitores da tebet e do Ciro, saibam q é o futuro das gerações deles q está em jogo 😢basta ver os pises vizinhos em q situação se encontram', 'textOriginal': 'Espero q os eleitores da tebet e do Ciro, saibam q é o futuro das gerações deles q está em jogo 😢basta ver os pises vizinhos em q situação se encontram', 'authorDisplayName': 'Graça Freelas', 'authorProfileImageUrl': 'https://yt3.ggpht.com/ytc/AGIKgqPIsJxolYsPCFPu7j9nWFWm5GqB7PWN5hZGQQ=s48-c-k-c0x00ffffff-no-rj', 'authorChannelUrl': 'http://www.youtube.com/channel/UCbD8K6HsCLR3AWdXsVw0m_w', 'authorChannelId': {'value': 'UCbD8K6HsCLR3AWdXsVw0m_w'}, 'canRate': True, 'viewerRating': 'none', 'likeCount': 0, 'publishedAt': '2022-10-10T07:30:57Z', 'updatedAt': '2022-10-10T07:30:57Z'}}, 'canReply': True, 'totalReplyCount': 0, 'isPublic': True}",,UCbD8K6HsCLR3AWdXsVw0m_w,2022-10-10T07:30:57Z,"Espero q os eleitores da tebet e do Ciro, saibam q é o futuro das gerações deles q está em jogo 😢basta ver os pises vizinhos em q situação se encontram",,2023-06-08 18:23:37.646342
youtube#commentThread,bf0GroA0JWT4ZG78i4nMd8ZTLT0,UgyIiFM8EHTZWC1MSrB4AaABAg,"{'videoId': '8vbY6eDzZ3M', 'topLevelComment': {'kind': 'youtube#comment', 'etag': 'p5FePmpo-tKnig-DQadZAdqEJak', 'id': 'UgyIiFM8EHTZWC1MSrB4AaABAg', 'snippet': {'videoId': '8vbY6eDzZ3M', 'textDisplay': 'Por que não perguntou se ao Narco Aurélio. Sobre o  seu cliente André do rap.Tem tido contatos.', 'textOriginal': 'Por que não perguntou se ao Narco Aurélio. Sobre o  seu cliente André do rap.Tem tido contatos.', 'authorDisplayName': 'Elindomar Gomes da Silva', 'authorProfileImageUrl': 'https://yt3.ggpht.com/ytc/AGIKgqMorRiwK7OozliJCuy0Uv_KGNoYGkA4ftJ5scQuc7N10FGCEbKbBj81JYYQrYUk=s48-c-k-c0x00ffffff-no-rj', 'authorChannelUrl': 'http://www.youtube.com/channel/UCN2kDChaGnifj2G5j7ei6qA', 'authorChannelId': {'value': 'UCN2kDChaGnifj2G5j7ei6qA'}, 'canRate': True, 'viewerRating': 'none', 'likeCount': 0, 'publishedAt': '2022-10-10T05:32:38Z', 'updatedAt': '2022-10-10T05:32:38Z'}}, 'canReply': True, 'totalReplyCount': 0, 'isPublic': True}",,UCN2kDChaGnifj2G5j7ei6qA,2022-10-10T05:32:38Z,Por que não perguntou se ao Narco Aurélio. Sobre o  seu cliente André do rap.Tem tido contatos.,,2023-06-08 18:23:37.646342
youtube#commentThread,tzvsr4cX0svq2CkBh7NvcThPrV4,UgzFGrCpF-33neg7Cat4AaABAg,"{'videoId': '8vbY6eDzZ3M', 'topLevelComment': {'kind': 'youtube#comment', 'etag': 'Noy6hsuK2Ny6cZknZxh4uvr4CeY', 'id': 'UgzFGrCpF-33neg7Cat4AaABAg', 'snippet': {'videoId': '8vbY6eDzZ3M', 'textDisplay': 'ENGRAÇADO AS PALAVRAS DO LULARAPIO FALA COMO SE NUNCA TIVESSE GOVERNADO O PAIS POR OITO ANOS.. E A ANTA DA DILMA POR QUASE OITO ANOS TBM... VAI FAZER E TAL..E PORQUE NAO O VEZ SR. LULARAPIO... LOGICO QUE SERÁ ACATADO SR. LULARAPIO.. O QUE IRIA FAZER ... UMA GUERRA CIVEL.. SO FALA BOBABENS... AFF... LULARAPIO UM PASSADO MANCHADA POR ROUBOS... NAO FOI INOCENTADO E SIM O PROCESSO FOI PARA O FORO DE BRASILIA. UM CRIMINOSO NA DISPUTA PRESIDENCIAL... O BRASIL NAO É PARA AMADORES MESMO.', 'textOriginal': 'ENGRAÇADO AS PALAVRAS DO LULARAPIO FALA COMO SE NUNCA TIVESSE GOVERNADO O PAIS POR OITO ANOS.. E A ANTA DA DILMA POR QUASE OITO ANOS TBM... VAI FAZER E TAL..E PORQUE NAO O VEZ SR. LULARAPIO... LOGICO QUE SERÁ ACATADO SR. LULARAPIO.. O QUE IRIA FAZER ... UMA GUERRA CIVEL.. SO FALA BOBABENS... AFF... LULARAPIO UM PASSADO MANCHADA POR ROUBOS... NAO FOI INOCENTADO E SIM O PROCESSO FOI PARA O FORO DE BRASILIA. UM CRIMINOSO NA DISPUTA PRESIDENCIAL... O BRASIL NAO É PARA AMADORES MESMO.', 'authorDisplayName': 'MARCOS MAGNETO', 'authorProfileImageUrl': 'https://yt3.ggpht.com/ytc/AGIKgqO_eKQmXAiFcFIPC12gX7azw9rrjo6UaL7c0JrxEw=s48-c-k-c0x00ffffff-no-rj', 'authorChannelUrl': 'http://www.youtube.com/channel/UCw82l5qgH4__Hd4gJ7prD0Q', 'authorChannelId': {'value': 'UCw82l5qgH4__Hd4gJ7prD0Q'}, 'canRate': True, 'viewerRating': 'none', 'likeCount': 1, 'publishedAt': '2022-10-10T04:54:04Z', 'updatedAt': '2022-10-10T04:57:26Z'}}, 'canReply': True, 'totalReplyCount': 0, 'isPublic': True}",,UCw82l5qgH4__Hd4gJ7prD0Q,2022-10-10T04:54:04Z,ENGRAÇADO AS PALAVRAS DO LULARAPIO FALA COMO SE NUNCA TIVESSE GOVERNADO O PAIS POR OITO ANOS.. E A ANTA DA DILMA POR QUASE OITO ANOS TBM... VAI FAZER E TAL..E PORQUE NAO O VEZ SR. LULARAPIO... LOGICO QUE SERÁ ACATADO SR. LULARAPIO.. O QUE IRIA FAZER ... UMA GUERRA CIVEL.. SO FALA BOBABENS... AFF... LULARAPIO UM PASSADO MANCHADA POR ROUBOS... NAO FOI INOCENTADO E SIM O PROCESSO FOI PARA O FORO DE BRASILIA. UM CRIMINOSO NA DISPUTA PRESIDENCIAL... O BRASIL NAO É PARA AMADORES MESMO.,,2023-06-08 18:23:37.646342
youtube#commentThread,gJBa_2CrB8rdeSez4Q4_39KVTks,UgyIAi9ANynr2H6uzmR4AaABAg,"{'videoId': '8vbY6eDzZ3M', 'topLevelComment': {'kind': 'youtube#comment', 'etag': '-7qk0I5ExSX7rAECa1Ghp5XGzMg', 'id': 'UgyIAi9ANynr2H6uzmR4AaABAg', 'snippet': {'videoId': '8vbY6eDzZ3M', 'textDisplay': 'A JOVEM JAMAIS PODE SER CALADA, SE TENTAREM FAZER ISSO O POVO VAI PRA RUA FAZER O MAIOR BARULHO 🙏🙏🙏🙏🙏🙏🇧🇷🇧🇷🇧🇷🇧🇷🇧🇷', 'textOriginal': 'A JOVEM JAMAIS PODE SER CALADA, SE TENTAREM FAZER ISSO O POVO VAI PRA RUA FAZER O MAIOR BARULHO 🙏🙏🙏🙏🙏🙏🇧🇷🇧🇷🇧🇷🇧🇷🇧🇷', 'authorDisplayName': 'Edna Andrade', 'authorProfileImageUrl': 'https://yt3.ggpht.com/ytc/AGIKgqOQ86r1hqIDNMjkVG-MEyieSisvGeU0u87HsC2Fcw=s48-c-k-c0x00ffffff-no-rj', 'authorChannelUrl': 'http://www.youtube.com/channel/UCr7SKYH0R9RZoj0snMA8_5A', 'authorChannelId': {'value': 'UCr7SKYH0R9RZoj0snMA8_5A'}, 'canRate': True, 'viewerRating': 'none', 'likeCount': 2, 'publishedAt': '2022-10-10T04:24:29Z', 'updatedAt': '2022-10-10T04:24:29Z'}}, 'canReply': True, 'totalReplyCount': 2, 'isPublic': True}","{'comments': [{'kind': 'youtube#comment', 'etag': 'Qb1p5h0CKcSDxcjhdKXB-fwKnCE', 'id': 'UgyIAi9ANynr2H6uzmR4AaABAg.9gzlV3frtjP9h-e7Cw4Zhr', 'snippet': {'videoId': '8vbY6eDzZ3M', 'textDisplay': 'E é inacreditável a cara de pau desse homem 😡😡😡😡', 'textOriginal': 'E é inacreditável a cara de pau desse homem 😡😡😡😡', 'parentId': 'UgyIAi9ANynr2H6uzmR4AaABAg', 'authorDisplayName': 'Andréa', 'authorProfileImageUrl': 'https://yt3.ggpht.com/MHIg-Lxd_wOoJE-ks55Fg6fQZsVWcRl-2YmrzbEkQZQBvwI64w7T3U--1cpdVFs2ipTZ_mpEjw=s48-c-k-c0x00ffffff-no-rj', 'authorChannelUrl': 'http://www.youtube.com/channel/UCwIAvI2mtWek1GUbW0rq5SQ', 'authorChannelId': {'value': 'UCwIAvI2mtWek1GUbW0rq5SQ'}, 'canRate': True, 'viewerRating': 'none', 'likeCount': 0, 'publishedAt': '2022-10-10T12:39:18Z', 'updatedAt': '2022-10-10T12:39:18Z'}}, {'kind': 'youtube#comment', 'etag': 'R5W-wszBbUP8X_jcSaSwE6N2C5E', 'id': 'UgyIAi9ANynr2H6uzmR4AaABAg.9gzlV3frtjP9h-e3cWKi1t', 'snippet': {'videoId': '8vbY6eDzZ3M', 'textDisplay': 'Edna Andrade concordo com você em todos os sentidos o povo realmente tem que ir para rua fazer suas manifestações!!!! não é fazer quebra-quebra mas tem que se impor sim!!!', 'textOriginal': 'Edna Andrade concordo com você em todos os sentidos o povo realmente tem que ir para rua fazer suas manifestações!!!! não é fazer quebra-quebra mas tem que se impor sim!!!', 'parentId': 'UgyIAi9ANynr2H6uzmR4AaABAg', 'authorDisplayName': 'Andréa', 'authorProfileImageUrl': 'https://yt3.ggpht.com/MHIg-Lxd_wOoJE-ks55Fg6fQZsVWcRl-2YmrzbEkQZQBvwI64w7T3U--1cpdVFs2ipTZ_mpEjw=s48-c-k-c0x00ffffff-no-rj', 'authorChannelUrl': 'http://www.youtube.com/channel/UCwIAvI2mtWek1GUbW0rq5SQ', 'authorChannelId': {'value': 'UCwIAvI2mtWek1GUbW0rq5SQ'}, 'canRate': True, 'viewerRating': 'none', 'likeCount': 0, 'publishedAt': '2022-10-10T12:38:49Z', 'updatedAt': '2022-10-10T12:38:49Z'}}]}",UCr7SKYH0R9RZoj0snMA8_5A,2022-10-10T04:24:29Z,"A JOVEM JAMAIS PODE SER CALADA, SE TENTAREM FAZER ISSO O POVO VAI PRA RUA FAZER O MAIOR BARULHO 🙏🙏🙏🙏🙏🙏🇧🇷🇧🇷🇧🇷🇧🇷🇧🇷",,2023-06-08 18:23:37.646342
youtube#commentThread,ftGIdN7sZk55E3zi1603Sdb5bkA,UgxVkSEB2mtZsu0Vevd4AaABAg,"{'videoId': '8vbY6eDzZ3M', 'topLevelComment': {'kind': 'youtube#comment', 'etag': '9VGL35DpVGZKBjgrPT8B1J8HUo8', 'id': 'UgxVkSEB2mtZsu0Vevd4AaABAg', 'snippet': {'videoId': '8vbY6eDzZ3M', 'textDisplay': 'O LULADRÃO FAZ TUDO O Q ELE DIZ PARA OS OUTROS POLÍTICOS NÃO FAZER, AFF! SE O MINEIRO RECORDAR TUDO Q O PT FEZ EM MINAS, NENHUM ELEITOR VOTA NO PT, MI EIROS POR FAVOR PUXEM A MEMÓRIA, DIA 30 É 22 🙏🙏🙏🙏🇧🇷🇧🇷🇧🇷🇧🇷', 'textOriginal': 'O LULADRÃO FAZ TUDO O Q ELE DIZ PARA OS OUTROS POLÍTICOS NÃO FAZER, AFF! SE O MINEIRO RECORDAR TUDO Q O PT FEZ EM MINAS, NENHUM ELEITOR VOTA NO PT, MI EIROS POR FAVOR PUXEM A MEMÓRIA, DIA 30 É 22 🙏🙏🙏🙏🇧🇷🇧🇷🇧🇷🇧🇷', 'authorDisplayName': 'Edna Andrade', 'authorProfileImageUrl': 'https://yt3.ggpht.com/ytc/AGIKgqOQ86r1hqIDNMjkVG-MEyieSisvGeU0u87HsC2Fcw=s48-c-k-c0x00ffffff-no-rj', 'authorChannelUrl': 'http://www.youtube.com/channel/UCr7SKYH0R9RZoj0snMA8_5A', 'authorChannelId': {'value': 'UCr7SKYH0R9RZoj0snMA8_5A'}, 'canRate': True, 'viewerRating': 'none', 'likeCount': 0, 'publishedAt': '2022-10-10T04:19:39Z', 'updatedAt': '2022-10-10T04:19:39Z'}}, 'canReply': True, 'totalReplyCount': 0, 'isPublic': True}",,UCr7SKYH0R9RZoj0snMA8_5A,2022-10-10T04:19:39Z,"O LULADRÃO FAZ TUDO O Q ELE DIZ PARA OS OUTROS POLÍTICOS NÃO FAZER, AFF! SE O MINEIRO RECORDAR TUDO Q O PT FEZ EM MINAS, NENHUM ELEITOR VOTA NO PT, MI EIROS POR FAVOR PUXEM A MEMÓRIA, DIA 30 É 22 🙏🙏🙏🙏🇧🇷🇧🇷🇧🇷🇧🇷",,2023-06-08 18:23:37.646342
youtube#commentThread,UDFmIWjTF2lHBQWF4RpcKcgqUhY,UgxGL-DZ-ip-MddetFp4AaABAg,"{'videoId': '8vbY6eDzZ3M', 'topLevelComment': {'kind': 'youtube#comment', 'etag': '0AUO-hbj62Ab2ryrHas7jNwUkFo', 'id': 'UgxGL-DZ-ip-MddetFp4AaABAg', 'snippet': {'videoId': '8vbY6eDzZ3M', 'textDisplay': 'Em nome de Jesus lula nunca mais', 'textOriginal': 'Em nome de Jesus lula nunca mais', 'authorDisplayName': 'Geliane Alves', 'authorProfileImageUrl': 'https://yt3.ggpht.com/ytc/AGIKgqOASUC-tEV8uzafSFBofXQrhHtF7pnhVLPWbw=s48-c-k-c0x00ffffff-no-rj', 'authorChannelUrl': 'http://www.youtube.com/channel/UCJx6dWKXFmxBnW5hvblgQcw', 'authorChannelId': {'value': 'UCJx6dWKXFmxBnW5hvblgQcw'}, 'canRate': True, 'viewerRating': 'none', 'likeCount': 0, 'publishedAt': '2022-10-10T03:40:09Z', 'updatedAt': '2022-10-10T03:40:09Z'}}, 'canReply': True, 'totalReplyCount': 0, 'isPublic': True}",,UCJx6dWKXFmxBnW5hvblgQcw,2022-10-10T03:40:09Z,Em nome de Jesus lula nunca mais,,2023-06-08 18:23:37.646342
youtube#commentThread,fq7HJ6dHqtJ-c7k6GDBNTxWszhY,UgyTh8M2JiSGrUnyMA54AaABAg,"{'videoId': '8vbY6eDzZ3M', 'topLevelComment': {'kind': 'youtube#comment', 'etag': 'sdxJoxXirhBKwFmgEBe4nwdd35E', 'id': 'UgyTh8M2JiSGrUnyMA54AaABAg', 'snippet': {'videoId': '8vbY6eDzZ3M', 'textDisplay': 'Esse povo quando está lá, ocupando uma cadeira no STF parece que ficam cheios de capeta, pois atrapalha  muito o governo, quando sai vira defensor da democracia.', 'textOriginal': 'Esse povo quando está lá, ocupando uma cadeira no STF parece que ficam cheios de capeta, pois atrapalha  muito o governo, quando sai vira defensor da democracia.', 'authorDisplayName': 'Seguenaldo Silva', 'authorProfileImageUrl': 'https://yt3.ggpht.com/ytc/AGIKgqMpyObYUXQYUZW5jR4_LtDyUALC_CI_FeoapQ=s48-c-k-c0x00ffffff-no-rj', 'authorChannelUrl': 'http://www.youtube.com/channel/UCmhbISgdeneFDSWWINIdvpg', 'authorChannelId': {'value': 'UCmhbISgdeneFDSWWINIdvpg'}, 'canRate': True, 'viewerRating': 'none', 'likeCount': 0, 'publishedAt': '2022-10-10T03:37:57Z', 'updatedAt': '2022-10-10T03:37:57Z'}}, 'canReply': True, 'totalReplyCount': 0, 'isPublic': True}",,UCmhbISgdeneFDSWWINIdvpg,2022-10-10T03:37:57Z,"Esse povo quando está lá, ocupando uma cadeira no STF parece que ficam cheios de capeta, pois atrapalha  muito o governo, quando sai vira defensor da democracia.",,2023-06-08 18:23:37.646342
youtube#commentThread,mIZV0U8dijwbl7cVCleevCOK8CI,UgwWrOkas4kth1S0nX14AaABAg,"{'videoId': '8vbY6eDzZ3M', 'topLevelComment': {'kind': 'youtube#comment', 'etag': 'h9-R66EOSgdh1EezGxFEUz3_blI', 'id': 'UgwWrOkas4kth1S0nX14AaABAg', 'snippet': {'videoId': '8vbY6eDzZ3M', 'textDisplay': 'Vote 22', 'textOriginal': 'Vote 22', 'authorDisplayName': 'Shirlei Paiva', 'authorProfileImageUrl': 'https://yt3.ggpht.com/ytc/AGIKgqMDOJHnok8GQYTCOUcFEUUvIyDrvHtbZ_Hpqn2Ukg=s48-c-k-c0x00ffffff-no-rj', 'authorChannelUrl': 'http://www.youtube.com/channel/UCFHmLRihGzBV3xr8LMJHntg', 'authorChannelId': {'value': 'UCFHmLRihGzBV3xr8LMJHntg'}, 'canRate': True, 'viewerRating': 'none', 'likeCount': 0, 'publishedAt': '2022-10-10T03:13:00Z', 'updatedAt': '2022-10-10T03:13:00Z'}}, 'canReply': True, 'totalReplyCount': 0, 'isPublic': True}",,UCFHmLRihGzBV3xr8LMJHntg,2022-10-10T03:13:00Z,Vote 22,,2023-06-08 18:23:37.646342
youtube#commentThread,zyBT75FJHwwV4CEAq2lOVoO529Y,UgzCiqKQ0Q4PrutFiOF4AaABAg,"{'videoId': '8vbY6eDzZ3M', 'topLevelComment': {'kind': 'youtube#comment', 'etag': 'ohcUE1YfgbfQBN7Am07eKsMFKZI', 'id': 'UgzCiqKQ0Q4PrutFiOF4AaABAg', 'snippet': {'videoId': '8vbY6eDzZ3M', 'textDisplay': '🇧🇷🇧🇷🇧🇷', 'textOriginal': '🇧🇷🇧🇷🇧🇷', 'authorDisplayName': 'Shirlei Paiva', 'authorProfileImageUrl': 'https://yt3.ggpht.com/ytc/AGIKgqMDOJHnok8GQYTCOUcFEUUvIyDrvHtbZ_Hpqn2Ukg=s48-c-k-c0x00ffffff-no-rj', 'authorChannelUrl': 'http://www.youtube.com/channel/UCFHmLRihGzBV3xr8LMJHntg', 'authorChannelId': {'value': 'UCFHmLRihGzBV3xr8LMJHntg'}, 'canRate': True, 'viewerRating': 'none', 'likeCount': 0, 'publishedAt': '2022-10-10T03:12:48Z', 'updatedAt': '2022-10-10T03:12:48Z'}}, 'canReply': True, 'totalReplyCount': 0, 'isPublic': True}",,UCFHmLRihGzBV3xr8LMJHntg,2022-10-10T03:12:48Z,🇧🇷🇧🇷🇧🇷,,2023-06-08 18:23:37.646342
youtube#commentThread,7ryZpmJCEiXwBYHBG5Wg-b1jQIA,UgxDY_hEmLzZemDrBzd4AaABAg,"{'videoId': '8vbY6eDzZ3M', 'topLevelComment': {'kind': 'youtube#comment', 'etag': 'OwxE7Ip-fha38i8d6yrWQ2m24uk', 'id': 'UgxDY_hEmLzZemDrBzd4AaABAg', 'snippet': {'videoId': '8vbY6eDzZ3M', 'textDisplay': 'Finalmente um minstro coerente e que não se calou 🙏🙏🙏🙏', 'textOriginal': 'Finalmente um minstro coerente e que não se calou 🙏🙏🙏🙏', 'authorDisplayName': 'Jose Cardoso', 'authorProfileImageUrl': 'https://yt3.ggpht.com/ytc/AGIKgqOf3rkdKOe1itfrGijnLfalZvQXE_80B_XdUw=s48-c-k-c0x00ffffff-no-rj', 'authorChannelUrl': 'http://www.youtube.com/channel/UCpTDJkmMgZmULsyeecF5Plg', 'authorChannelId': {'value': 'UCpTDJkmMgZmULsyeecF5Plg'}, 'canRate': True, 'viewerRating': 'none', 'likeCount': 2, 'publishedAt': '2022-10-10T02:47:38Z', 'updatedAt': '2022-10-10T02:47:38Z'}}, 'canReply': True, 'totalReplyCount': 1, 'isPublic': True}","{'comments': [{'kind': 'youtube#comment', 'etag': '4-Uu0ZMLvQTXDnH8osMDHnnNEug', 'id': 'UgxDY_hEmLzZemDrBzd4AaABAg.9gzaPi4FIOH9gztcbDbMLO', 'snippet': {'videoId': '8vbY6eDzZ3M', 'textDisplay': 'Agora posa de herói né? Pesquise seu mandato amigo.A poucos tempos fazia o mesmo que esses.', 'textOriginal': 'Agora posa de herói né? Pesquise seu mandato amigo.A poucos tempos fazia o mesmo que esses.', 'parentId': 'UgxDY_hEmLzZemDrBzd4AaABAg', 'authorDisplayName': 'Elindomar Gomes da Silva', 'authorProfileImageUrl': 'https://yt3.ggpht.com/ytc/AGIKgqMorRiwK7OozliJCuy0Uv_KGNoYGkA4ftJ5scQuc7N10FGCEbKbBj81JYYQrYUk=s48-c-k-c0x00ffffff-no-rj', 'authorChannelUrl': 'http://www.youtube.com/channel/UCN2kDChaGnifj2G5j7ei6qA', 'authorChannelId': {'value': 'UCN2kDChaGnifj2G5j7ei6qA'}, 'canRate': True, 'viewerRating': 'none', 'likeCount': 0, 'publishedAt': '2022-10-10T05:35:33Z', 'updatedAt': '2022-10-10T05:35:33Z'}}]}",UCpTDJkmMgZmULsyeecF5Plg,2022-10-10T02:47:38Z,Finalmente um minstro coerente e que não se calou 🙏🙏🙏🙏,,2023-06-08 18:23:37.646342
youtube#commentThread,xWzX0fECAHHb5NvEhj0KKUqUcFM,UgyMB2ogxwIUb_-tS8Z4AaABAg,"{'videoId': '8vbY6eDzZ3M', 'topLevelComment': {'kind': 'youtube#comment', 'etag': 'LgV4nwrx0YsKAiitlnq6v-FQKEM', 'id': 'UgyMB2ogxwIUb_-tS8Z4AaABAg', 'snippet': {'videoId': '8vbY6eDzZ3M', 'textDisplay': 'SE O BRASILEIRO QUIZER OEDEM Ê PROGRESSOO ; TEM QUE VOTAR NO BOLSONARO E ÇOMPARECER EM MASSA AS URNAS SEM MEDO DE SER FELIZ . PRA DEPOIS NÃO CHORAR .', 'textOriginal': 'SE O BRASILEIRO QUIZER OEDEM Ê PROGRESSOO ; TEM QUE VOTAR NO BOLSONARO E ÇOMPARECER EM MASSA AS URNAS SEM MEDO DE SER FELIZ . PRA DEPOIS NÃO CHORAR .', 'authorDisplayName': 'Dirceu Almeida', 'authorProfileImageUrl': 'https://yt3.ggpht.com/ytc/AGIKgqNrZuqyDh9cuGS29FoMmoW9XdZG_qA5By-eow=s48-c-k-c0x00ffffff-no-rj', 'authorChannelUrl': 'http://www.youtube.com/channel/UCn1GDFCJ0J92ri6p4V4P4Bg', 'authorChannelId': {'value': 'UCn1GDFCJ0J92ri6p4V4P4Bg'}, 'canRate': True, 'viewerRating': 'none', 'likeCount': 0, 'publishedAt': '2022-10-10T02:25:44Z', 'updatedAt': '2022-10-10T02:25:44Z'}}, 'canReply': True, 'totalReplyCount': 0, 'isPublic': True}",,UCn1GDFCJ0J92ri6p4V4P4Bg,2022-10-10T02:25:44Z,SE O BRASILEIRO QUIZER OEDEM Ê PROGRESSOO ; TEM QUE VOTAR NO BOLSONARO E ÇOMPARECER EM MASSA AS URNAS SEM MEDO DE SER FELIZ . PRA DEPOIS NÃO CHORAR .,,2023-06-08 18:23:37.646342
youtube#commentThread,SwquS5lyMQwr9XcxUqtSAZu9ZU8,UgyjCQ9pvGf2rscaNJB4AaABAg,"{'videoId': '8vbY6eDzZ3M', 'topLevelComment': {'kind': 'youtube#comment', 'etag': 'CMewpw0BCBIYWqRAsno1cvf_2cQ', 'id': 'UgyjCQ9pvGf2rscaNJB4AaABAg', 'snippet': {'videoId': '8vbY6eDzZ3M', 'textDisplay': 'Ladrão não tem verganha na cara de  pau o pinguço kkkk mina sabe que ladrão voltar.  Parabéns parabéns mineiros são inteligente. Glória à Deus.  Vcs tem q mostra a esquerda q quem manda ai no estado,  é CLARO vcs uai.', 'textOriginal': 'Ladrão não tem verganha na cara de  pau o pinguço kkkk mina sabe que ladrão voltar.  Parabéns parabéns mineiros são inteligente. Glória à Deus.  Vcs tem q mostra a esquerda q quem manda ai no estado,  é CLARO vcs uai.', 'authorDisplayName': 'Arlete Arlete', 'authorProfileImageUrl': 'https://yt3.ggpht.com/ytc/AGIKgqNasL5tpxfia3BaSW9CNvQP7hncqfopO11-bnPcmeXW8hgM2sLSucsaf--noEpp=s48-c-k-c0x00ffffff-no-rj', 'authorChannelUrl': 'http://www.youtube.com/channel/UCYtr4a1_fgiC_gqHkjAat8g', 'authorChannelId': {'value': 'UCYtr4a1_fgiC_gqHkjAat8g'}, 'canRate': True, 'viewerRating': 'none', 'likeCount': 0, 'publishedAt': '2022-10-10T02:25:08Z', 'updatedAt': '2022-10-10T02:25:08Z'}}, 'canReply': True, 'totalReplyCount': 0, 'isPublic': True}",,UCYtr4a1_fgiC_gqHkjAat8g,2022-10-10T02:25:08Z,"Ladrão não tem verganha na cara de  pau o pinguço kkkk mina sabe que ladrão voltar.  Parabéns parabéns mineiros são inteligente. Glória à Deus.  Vcs tem q mostra a esquerda q quem manda ai no estado,  é CLARO vcs uai.",,2023-06-08 18:23:37.646342
youtube#commentThread,Lj8Ezd3f6-DlnuXNjJ4i1WGA1nE,UgzgOssY_zidjMLF6hp4AaABAg,"{'videoId': '8vbY6eDzZ3M', 'topLevelComment': {'kind': 'youtube#comment', 'etag': 'Wvr-2gQ6rFpVMcSBCKlLdbJfhfA', 'id': 'UgzgOssY_zidjMLF6hp4AaABAg', 'snippet': {'videoId': '8vbY6eDzZ3M', 'textDisplay': 'Cachaceiro vá curtir seu alambique e leva os mortadelas com os Jumentos seus . Tb não esqueça de convidar os ministros do STF, MSTST, criminosos, estupradores, os líderes de facções , bandidos que o 9dedos vitimizam', 'textOriginal': 'Cachaceiro vá curtir seu alambique e leva os mortadelas com os Jumentos seus . Tb não esqueça de convidar os ministros do STF, MSTST, criminosos, estupradores, os líderes de facções , bandidos que o 9dedos vitimizam', 'authorDisplayName': 'Jose Cardoso', 'authorProfileImageUrl': 'https://yt3.ggpht.com/ytc/AGIKgqOf3rkdKOe1itfrGijnLfalZvQXE_80B_XdUw=s48-c-k-c0x00ffffff-no-rj', 'authorChannelUrl': 'http://www.youtube.com/channel/UCpTDJkmMgZmULsyeecF5Plg', 'authorChannelId': {'value': 'UCpTDJkmMgZmULsyeecF5Plg'}, 'canRate': True, 'viewerRating': 'none', 'likeCount': 0, 'publishedAt': '2022-10-10T02:24:10Z', 'updatedAt': '2022-10-10T02:24:10Z'}}, 'canReply': True, 'totalReplyCount': 0, 'isPublic': True}",,UCpTDJkmMgZmULsyeecF5Plg,2022-10-10T02:24:10Z,"Cachaceiro vá curtir seu alambique e leva os mortadelas com os Jumentos seus . Tb não esqueça de convidar os ministros do STF, MSTST, criminosos, estupradores, os líderes de facções , bandidos que o 9dedos vitimizam",,2023-06-08 18:23:37.646342
youtube#commentThread,-sQ-GabNG----_e-rvZkZ3LQJN0,UgxqczvwZkV4hqoc3254AaABAg,"{'videoId': '8vbY6eDzZ3M', 'topLevelComment': {'kind': 'youtube#comment', 'etag': '02ftjrP83Sq5kzKpV-NoV3X0N3Q', 'id': 'UgxqczvwZkV4hqoc3254AaABAg', 'snippet': {'videoId': '8vbY6eDzZ3M', 'textDisplay': 'O povo feio esse do PT', 'textOriginal': 'O povo feio esse do PT', 'authorDisplayName': 'Pedro Lenovan', 'authorProfileImageUrl': 'https://yt3.ggpht.com/ytc/AGIKgqPAJsYoA4is-u7ZisWhrTu9BphtQqpxjfaN5MAXNg=s48-c-k-c0x00ffffff-no-rj', 'authorChannelUrl': 'http://www.youtube.com/channel/UC-Ij6eELiQzpvbWza1x--IA', 'authorChannelId': {'value': 'UC-Ij6eELiQzpvbWza1x--IA'}, 'canRate': True, 'viewerRating': 'none', 'likeCount': 0, 'publishedAt': '2022-10-10T02:15:03Z', 'updatedAt': '2022-10-10T02:15:03Z'}}, 'canReply': True, 'totalReplyCount': 0, 'isPublic': True}",,UC-Ij6eELiQzpvbWza1x--IA,2022-10-10T02:15:03Z,O povo feio esse do PT,,2023-06-08 18:23:37.646342
youtube#commentThread,03qlGVaL7yGf6OEIhzlOlFvy6sw,UgxfBnfpHvX-yGkl0Yt4AaABAg,"{'videoId': '8vbY6eDzZ3M', 'topLevelComment': {'kind': 'youtube#comment', 'etag': 'cOCdH5uSWoDj9LhMFqID6NqzBe4', 'id': 'UgxfBnfpHvX-yGkl0Yt4AaABAg', 'snippet': {'videoId': '8vbY6eDzZ3M', 'textDisplay': 'CADÊ SUA ARROGÂNCIA  LULA. NÃO INCORPORA O LULA PAZ E AMOR AGORA NÃO. CONTINUE COMO VINHA FAZENDO ANTES NO PRIMEIRO TURNO. VOCÊ É QUE SEMPRE TRATOU SEUS ELEITORES COMO GADO, SEMPRE ENGABELAVA-OS ENQUANTO ASSALTAVA O PAÍS.🇧🇷⚔', 'textOriginal': 'CADÊ SUA ARROGÂNCIA  LULA. NÃO INCORPORA O LULA PAZ E AMOR AGORA NÃO. CONTINUE COMO VINHA FAZENDO ANTES NO PRIMEIRO TURNO. VOCÊ É QUE SEMPRE TRATOU SEUS ELEITORES COMO GADO, SEMPRE ENGABELAVA-OS ENQUANTO ASSALTAVA O PAÍS.🇧🇷⚔', 'authorDisplayName': 'Luiz Alberto Lannes', 'authorProfileImageUrl': 'https://yt3.ggpht.com/ytc/AGIKgqOzSt6sw0H7wqt221x2_QJoN3yrRqtGleof11eJT1w=s48-c-k-c0x00ffffff-no-rj', 'authorChannelUrl': 'http://www.youtube.com/channel/UC8i2grIXLYBPMYNJ2ozXxIQ', 'authorChannelId': {'value': 'UC8i2grIXLYBPMYNJ2ozXxIQ'}, 'canRate': True, 'viewerRating': 'none', 'likeCount': 0, 'publishedAt': '2022-10-10T02:13:42Z', 'updatedAt': '2022-10-10T02:13:42Z'}}, 'canReply': True, 'totalReplyCount': 0, 'isPublic': True}",,UC8i2grIXLYBPMYNJ2ozXxIQ,2022-10-10T02:13:42Z,"CADÊ SUA ARROGÂNCIA  LULA. NÃO INCORPORA O LULA PAZ E AMOR AGORA NÃO. CONTINUE COMO VINHA FAZENDO ANTES NO PRIMEIRO TURNO. VOCÊ É QUE SEMPRE TRATOU SEUS ELEITORES COMO GADO, SEMPRE ENGABELAVA-OS ENQUANTO ASSALTAVA O PAÍS.🇧🇷⚔",,2023-06-08 18:23:37.646342
youtube#commentThread,Q4lcYgYNweyJIaAXbh5rRlQYzuE,UgwxQaFDm28_5ZfbAyJ4AaABAg,"{'videoId': '8vbY6eDzZ3M', 'topLevelComment': {'kind': 'youtube#comment', 'etag': 'AKVha09zhyxBpdvDd07jUTQUxyg', 'id': 'UgwxQaFDm28_5ZfbAyJ4AaABAg', 'snippet': {'videoId': '8vbY6eDzZ3M', 'textDisplay': 'Ah sim. O povo lembra bem', 'textOriginal': 'Ah sim. O povo lembra bem', 'authorDisplayName': 'André Peres', 'authorProfileImageUrl': 'https://yt3.ggpht.com/ytc/AGIKgqP3U7WJDy99xWtgie22zSdcRYgUoLeecL0OyTJwRw=s48-c-k-c0x00ffffff-no-rj', 'authorChannelUrl': 'http://www.youtube.com/channel/UCh8cELN9qbePlOYK6l4nKwg', 'authorChannelId': {'value': 'UCh8cELN9qbePlOYK6l4nKwg'}, 'canRate': True, 'viewerRating': 'none', 'likeCount': 0, 'publishedAt': '2022-10-10T01:10:45Z', 'updatedAt': '2022-10-10T01:10:45Z'}}, 'canReply': True, 'totalReplyCount': 0, 'isPublic': True}",,UCh8cELN9qbePlOYK6l4nKwg,2022-10-10T01:10:45Z,Ah sim. O povo lembra bem,,2023-06-08 18:23:37.646342
