kind,etag,id,snippet,replies,authorChannelId,publishedAt,textOriginal,nextPageToken,extraction_date
youtube#commentThread,aVYBI5m_-8B2GGOOC65yUl4AV_U,UgxsMJFy4aqZNGcao0V4AaABAg,"{'videoId': 'W2ImnPI_qmo', 'topLevelComment': {'kind': 'youtube#comment', 'etag': 'ManMklIr5z7AQropeXcDUHz3-kU', 'id': 'UgxsMJFy4aqZNGcao0V4AaABAg', 'snippet': {'videoId': 'W2ImnPI_qmo', 'textDisplay': 'Meu Deus 😧 até quando a Ucrânia vai sofrer esses acate covarde da Rússia vcs precisam fazer alguma coisa hoje tem misericórdia 🙏😇 Flauvia cidade Santo Antônio de Pádua', 'textOriginal': 'Meu Deus 😧 até quando a Ucrânia vai sofrer esses acate covarde da Rússia vcs precisam fazer alguma coisa hoje tem misericórdia 🙏😇 Flauvia cidade Santo Antônio de Pádua', 'authorDisplayName': 'Flavia Martins', 'authorProfileImageUrl': 'https://yt3.ggpht.com/ytc/AGIKgqNR99jYuD0sc41TM_W7BYTuDJX1RXV3Wn75rw=s48-c-k-c0x00ffffff-no-rj', 'authorChannelUrl': 'http://www.youtube.com/channel/UCYse5A7LMcwXCd8qUBH278g', 'authorChannelId': {'value': 'UCYse5A7LMcwXCd8qUBH278g'}, 'canRate': True, 'viewerRating': 'none', 'likeCount': 2, 'publishedAt': '2022-10-12T12:24:38Z', 'updatedAt': '2022-10-12T12:24:38Z'}}, 'canReply': True, 'totalReplyCount': 2, 'isPublic': True}","{'comments': [{'kind': 'youtube#comment', 'etag': 'CprKPmG8tRiJNYBH1mPVsBNwknQ', 'id': 'UgxsMJFy4aqZNGcao0V4AaABAg.9h4m1UhMNxp9h52CLuwwE4', 'snippet': {'videoId': 'W2ImnPI_qmo', 'textDisplay': 'E os crimes que a Ucrânia fez contra os povos russos  desde 2014 ? Isso pode ?', 'textOriginal': 'E os crimes que a Ucrânia fez contra os povos russos  desde 2014 ? Isso pode ?', 'parentId': 'UgxsMJFy4aqZNGcao0V4AaABAg', 'authorDisplayName': 'Heltomar A. De Oliveira', 'authorProfileImageUrl': 'https://yt3.ggpht.com/ytc/AGIKgqPXeMMQ0tT2ME9Teh8vtFFry-MBBNwB4PtVTg=s48-c-k-c0x00ffffff-no-rj', 'authorChannelUrl': 'http://www.youtube.com/channel/UCRAw8CauNgndme-YOq0S1tw', 'authorChannelId': {'value': 'UCRAw8CauNgndme-YOq0S1tw'}, 'canRate': True, 'viewerRating': 'none', 'likeCount': 0, 'publishedAt': '2022-10-12T14:54:39Z', 'updatedAt': '2022-10-12T14:54:39Z'}}, {'kind': 'youtube#comment', 'etag': 'QRTztBHWPcjhm7xLcBX_s2CSJFY', 'id': 'UgxsMJFy4aqZNGcao0V4AaABAg.9h4m1UhMNxp9h514TqWIF4', 'snippet': {'videoId': 'W2ImnPI_qmo', 'textDisplay': 'Covarde e o próprio zalenski que não tá nem aí com o povo do país', 'textOriginal': 'Covarde e o próprio zalenski que não tá nem aí com o povo do país', 'parentId': 'UgxsMJFy4aqZNGcao0V4AaABAg', 'authorDisplayName': 'Erli Lourenço Mariano', 'authorProfileImageUrl': 'https://yt3.ggpht.com/ytc/AGIKgqOMwWoDivZ5dgEhhKqm4NcXYRxwiAgeTDCAbA=s48-c-k-c0x00ffffff-no-rj', 'authorChannelUrl': 'http://www.youtube.com/channel/UCkzexp_XF3qka5pX0qeMdsA', 'authorChannelId': {'value': 'UCkzexp_XF3qka5pX0qeMdsA'}, 'canRate': True, 'viewerRating': 'none', 'likeCount': 0, 'publishedAt': '2022-10-12T14:44:51Z', 'updatedAt': '2022-10-12T14:44:51Z'}}]}",UCYse5A7LMcwXCd8qUBH278g,2022-10-12T12:24:38Z,Meu Deus 😧 até quando a Ucrânia vai sofrer esses acate covarde da Rússia vcs precisam fazer alguma coisa hoje tem misericórdia 🙏😇 Flauvia cidade Santo Antônio de Pádua,,2023-06-08 18:14:44.232167
youtube#commentThread,OD7W_B-Qx07r1g1E0MU1gK9I3_U,Ugw6Wcf5mpgkGY_bW1d4AaABAg,"{'videoId': 'W2ImnPI_qmo', 'topLevelComment': {'kind': 'youtube#comment', 'etag': 'ae5AO690PZ2iLdABbJ9sVznJw-k', 'id': 'Ugw6Wcf5mpgkGY_bW1d4AaABAg', 'snippet': {'videoId': 'W2ImnPI_qmo', 'textDisplay': 'Esses miseráveis estão é piorando a situação dos Ucranianos que são as maiores vítimas, nessa estúpida disputa do ocidente com a Rússia, só que a Rússia é invencível, nem uma nação ou nações serão capazes de destruírem a Rússia sem que também não sejam destruídas com fogo atômico.', 'textOriginal': 'Esses miseráveis estão é piorando a situação dos Ucranianos que são as maiores vítimas, nessa estúpida disputa do ocidente com a Rússia, só que a Rússia é invencível, nem uma nação ou nações serão capazes de destruírem a Rússia sem que também não sejam destruídas com fogo atômico.', 'authorDisplayName': 'Sandro Jose da silva', 'authorProfileImageUrl': 'https://yt3.ggpht.com/ytc/AGIKgqOqrpVgPfJQpvJYe1uw3Dyc3yVjkFT9oUHKPtYCyw=s48-c-k-c0x00ffffff-no-rj', 'authorChannelUrl': 'http://www.youtube.com/channel/UC3WPpodegWCaKgA_pW5I8ng', 'authorChannelId': {'value': 'UC3WPpodegWCaKgA_pW5I8ng'}, 'canRate': True, 'viewerRating': 'none', 'likeCount': 0, 'publishedAt': '2022-10-12T12:24:03Z', 'updatedAt': '2022-10-12T12:24:03Z'}}, 'canReply': True, 'totalReplyCount': 0, 'isPublic': True}",,UC3WPpodegWCaKgA_pW5I8ng,2022-10-12T12:24:03Z,"Esses miseráveis estão é piorando a situação dos Ucranianos que são as maiores vítimas, nessa estúpida disputa do ocidente com a Rússia, só que a Rússia é invencível, nem uma nação ou nações serão capazes de destruírem a Rússia sem que também não sejam destruídas com fogo atômico.",,2023-06-08 18:14:44.232167
youtube#commentThread,gCFuc0idFpDC7PmCh2wompHzbKY,Ugxb5XNQ41e-MjBBpQt4AaABAg,"{'videoId': 'W2ImnPI_qmo', 'topLevelComment': {'kind': 'youtube#comment', 'etag': 'QjURm-hNzpL2_2uW583mflor1L0', 'id': 'Ugxb5XNQ41e-MjBBpQt4AaABAg', 'snippet': {'videoId': 'W2ImnPI_qmo', 'textDisplay': 'Sim esse &quot;apoio&quot; vai custar a vida da Ucrânia 🇺🇦!', 'textOriginal': 'Sim esse ""apoio"" vai custar a vida da Ucrânia 🇺🇦!', 'authorDisplayName': 'Joselito rodrigues', 'authorProfileImageUrl': 'https://yt3.ggpht.com/ytc/AGIKgqOyKU9gy2d16_JcGUdcofes4zP_0m8k3d6zEz93=s48-c-k-c0x00ffffff-no-rj', 'authorChannelUrl': 'http://www.youtube.com/channel/UCqyCfGYC-OFe1MCmSxSa6bg', 'authorChannelId': {'value': 'UCqyCfGYC-OFe1MCmSxSa6bg'}, 'canRate': True, 'viewerRating': 'none', 'likeCount': 3, 'publishedAt': '2022-10-12T12:14:04Z', 'updatedAt': '2022-10-12T12:14:04Z'}}, 'canReply': True, 'totalReplyCount': 0, 'isPublic': True}",,UCqyCfGYC-OFe1MCmSxSa6bg,2022-10-12T12:14:04Z,"Sim esse ""apoio"" vai custar a vida da Ucrânia 🇺🇦!",,2023-06-08 18:14:44.232167
youtube#commentThread,I6JcztWMP7Y-wphKZ6yNWGFcGXs,Ugx6zjToHAqUgyoFjh94AaABAg,"{'videoId': 'W2ImnPI_qmo', 'topLevelComment': {'kind': 'youtube#comment', 'etag': 'FdjU3yX7nALZPuk8zGHQeZ1dlo0', 'id': 'Ugx6zjToHAqUgyoFjh94AaABAg', 'snippet': {'videoId': 'W2ImnPI_qmo', 'textDisplay': 'Esses adiados que ficam falado sobre apóio da união europeia se não apoiar a Rússia não ficaram só pela Ucrânia', 'textOriginal': 'Esses adiados que ficam falado sobre apóio da união europeia se não apoiar a Rússia não ficaram só pela Ucrânia', 'authorDisplayName': 'jose julio ramos', 'authorProfileImageUrl': 'https://yt3.ggpht.com/ytc/AGIKgqPZK6kwNSBldyeK1NygjsDPevIXb0u0eOuhSpe-uA=s48-c-k-c0x00ffffff-no-rj', 'authorChannelUrl': 'http://www.youtube.com/channel/UCtzjdVAg7FZ2ZDhm2q2bUgQ', 'authorChannelId': {'value': 'UCtzjdVAg7FZ2ZDhm2q2bUgQ'}, 'canRate': True, 'viewerRating': 'none', 'likeCount': 0, 'publishedAt': '2022-10-12T12:11:39Z', 'updatedAt': '2022-10-12T12:11:39Z'}}, 'canReply': True, 'totalReplyCount': 0, 'isPublic': True}",,UCtzjdVAg7FZ2ZDhm2q2bUgQ,2022-10-12T12:11:39Z,Esses adiados que ficam falado sobre apóio da união europeia se não apoiar a Rússia não ficaram só pela Ucrânia,,2023-06-08 18:14:44.232167
youtube#commentThread,kxrQV40I8CMvflserlXXdHghwLs,UgymFTXS2h0Ir5ksvO54AaABAg,"{'videoId': 'W2ImnPI_qmo', 'topLevelComment': {'kind': 'youtube#comment', 'etag': 'uXNK_NGHn7SM8Tfg5f9ZVr-wpQQ', 'id': 'UgymFTXS2h0Ir5ksvO54AaABAg', 'snippet': {'videoId': 'W2ImnPI_qmo', 'textDisplay': 'Vamos &quot;apoiar&quot; até eles endividarem-se ao extremo, depois cobramos a conta.', 'textOriginal': 'Vamos ""apoiar"" até eles endividarem-se ao extremo, depois cobramos a conta.', 'authorDisplayName': 'Juliana Tabata Cerci', 'authorProfileImageUrl': 'https://yt3.ggpht.com/ytc/AGIKgqMTcJVAWoWmhLrMjQeuL_xHzsLs9ElzHfCr5Q=s48-c-k-c0x00ffffff-no-rj', 'authorChannelUrl': 'http://www.youtube.com/channel/UCfknxqMjy-HyfRGMlR0PHUg', 'authorChannelId': {'value': 'UCfknxqMjy-HyfRGMlR0PHUg'}, 'canRate': True, 'viewerRating': 'none', 'likeCount': 2, 'publishedAt': '2022-10-12T12:03:56Z', 'updatedAt': '2022-10-12T12:03:56Z'}}, 'canReply': True, 'totalReplyCount': 0, 'isPublic': True}",,UCfknxqMjy-HyfRGMlR0PHUg,2022-10-12T12:03:56Z,"Vamos ""apoiar"" até eles endividarem-se ao extremo, depois cobramos a conta.",,2023-06-08 18:14:44.232167
youtube#commentThread,WfN89lw_GmysxDC1G04Xt3LVGcc,UgxyWWPty692B3qHpmZ4AaABAg,"{'videoId': 'W2ImnPI_qmo', 'topLevelComment': {'kind': 'youtube#comment', 'etag': '506ajKx-TmATlRMEi0DCXlsJDLw', 'id': 'UgxyWWPty692B3qHpmZ4AaABAg', 'snippet': {'videoId': 'W2ImnPI_qmo', 'textDisplay': 'Apoiarão só  até  o fim da União  Europeia, que está  próximo', 'textOriginal': 'Apoiarão só  até  o fim da União  Europeia, que está  próximo', 'authorDisplayName': 'Cesar Gonçalves', 'authorProfileImageUrl': 'https://yt3.ggpht.com/E8ufQMb6YxAZz25l5o3Sgf5RC1Vt0MLQFGapREDRxKA8D5PVsseyjJzopo5TONRO2T7elbPt=s48-c-k-c0x00ffffff-no-rj', 'authorChannelUrl': 'http://www.youtube.com/channel/UCbOzywPN7pBcgoZ9H-5jtyg', 'authorChannelId': {'value': 'UCbOzywPN7pBcgoZ9H-5jtyg'}, 'canRate': True, 'viewerRating': 'none', 'likeCount': 2, 'publishedAt': '2022-10-12T12:00:30Z', 'updatedAt': '2022-10-12T12:00:30Z'}}, 'canReply': True, 'totalReplyCount': 1, 'isPublic': True}","{'comments': [{'kind': 'youtube#comment', 'etag': '1xCEi_pma16SkXmUts1Zbm8bf8E', 'id': 'UgxyWWPty692B3qHpmZ4AaABAg.9h4jGiQEBPH9h4nv3VxG2w', 'snippet': {'videoId': 'W2ImnPI_qmo', 'textDisplay': 'Mesmo, que medo 🥴', 'textOriginal': 'Mesmo, que medo 🥴', 'parentId': 'UgxyWWPty692B3qHpmZ4AaABAg', 'authorDisplayName': '💣  terrorista 💣', 'authorProfileImageUrl': 'https://yt3.ggpht.com/cwPucFKiVONDhSKxqXI4GYBJieKjXU004fAr3q91WA1H27gYy9zD9aZTCDGb7tPyA9plko5oRS0=s48-c-k-c0x00ffffff-no-rj', 'authorChannelUrl': 'http://www.youtube.com/channel/UC9ja2CpiycQwpRHwx9aa1Qg', 'authorChannelId': {'value': 'UC9ja2CpiycQwpRHwx9aa1Qg'}, 'canRate': True, 'viewerRating': 'none', 'likeCount': 0, 'publishedAt': '2022-10-12T12:41:05Z', 'updatedAt': '2022-10-12T12:41:05Z'}}]}",UCbOzywPN7pBcgoZ9H-5jtyg,2022-10-12T12:00:30Z,"Apoiarão só  até  o fim da União  Europeia, que está  próximo",,2023-06-08 18:14:44.232167
youtube#commentThread,3ybkFWlKxwJMvT6urCgnfrvrnLE,Ugw9vCdXriA5UewRqtd4AaABAg,"{'videoId': 'W2ImnPI_qmo', 'topLevelComment': {'kind': 'youtube#comment', 'etag': 'YLWdjBHfKE-1JEWBW1onJB-0Ctw', 'id': 'Ugw9vCdXriA5UewRqtd4AaABAg', 'snippet': {'videoId': 'W2ImnPI_qmo', 'textDisplay': 'Apoiarão a Ucrânia até o último ucraniano.', 'textOriginal': 'Apoiarão a Ucrânia até o último ucraniano.', 'authorDisplayName': 'Ubiratan A. Deienno', 'authorProfileImageUrl': 'https://yt3.ggpht.com/ytc/AGIKgqPH9XjMcmx9f0TAbnS6vCRw3OMrhDKUtqt7sw=s48-c-k-c0x00ffffff-no-rj', 'authorChannelUrl': 'http://www.youtube.com/channel/UCa942OJEoJbuk4jwvLKbPZg', 'authorChannelId': {'value': 'UCa942OJEoJbuk4jwvLKbPZg'}, 'canRate': True, 'viewerRating': 'none', 'likeCount': 2, 'publishedAt': '2022-10-12T11:53:21Z', 'updatedAt': '2022-10-12T11:53:21Z'}}, 'canReply': True, 'totalReplyCount': 0, 'isPublic': True}",,UCa942OJEoJbuk4jwvLKbPZg,2022-10-12T11:53:21Z,Apoiarão a Ucrânia até o último ucraniano.,,2023-06-08 18:14:44.232167
youtube#commentThread,P9JyHAg8Oh61z2ITBXB0EX1RRDs,Ugx2xKLaLn2rXMSeW8B4AaABAg,"{'videoId': 'W2ImnPI_qmo', 'topLevelComment': {'kind': 'youtube#comment', 'etag': 'siFwLdbxI5EmzBp3H5sWUbi4GBI', 'id': 'Ugx2xKLaLn2rXMSeW8B4AaABAg', 'snippet': {'videoId': 'W2ImnPI_qmo', 'textDisplay': 'Só usar cuba como exemplo, no passado EUA atacou cuba na chamada &quot;invasão na baia dos porcos&quot; justamente por que tinha mísseis nucleares perto deles. Se a Ucrânia entrar pra Otan, quem garante que eles não iam colocar mísseis lá?', 'textOriginal': 'Só usar cuba como exemplo, no passado EUA atacou cuba na chamada ""invasão na baia dos porcos"" justamente por que tinha mísseis nucleares perto deles. Se a Ucrânia entrar pra Otan, quem garante que eles não iam colocar mísseis lá?', 'authorDisplayName': 'Francisco Reginaldo da Silva', 'authorProfileImageUrl': 'https://yt3.ggpht.com/ytc/AGIKgqMIcqqYYtqLf0_ppAikiElURKgbjk5Gp7OVMw=s48-c-k-c0x00ffffff-no-rj', 'authorChannelUrl': 'http://www.youtube.com/channel/UC9Q9--F5X3Pj4HbKe8qZHaQ', 'authorChannelId': {'value': 'UC9Q9--F5X3Pj4HbKe8qZHaQ'}, 'canRate': True, 'viewerRating': 'none', 'likeCount': 9, 'publishedAt': '2022-10-12T11:48:18Z', 'updatedAt': '2022-10-12T11:48:18Z'}}, 'canReply': True, 'totalReplyCount': 5, 'isPublic': True}","{'comments': [{'kind': 'youtube#comment', 'etag': '6Jk9Ko9GCBVdpx0oArRAWgOzBqo', 'id': 'Ugx2xKLaLn2rXMSeW8B4AaABAg.9h4hsNfU-iG9h8LCsmL3vn', 'snippet': {'videoId': 'W2ImnPI_qmo', 'textDisplay': 'A Europa respeita as leis né , Por que a russia não redoitou o tratado que assinou quando a Ucrânia entregou as bombas nucleares , com mediações dos E U A , se a Ucrânia tivesse suas bombas  , será  que a russia iria atacar hummm.', 'textOriginal': 'A Europa respeita as leis né , Por que a russia não redoitou o tratado que assinou quando a Ucrânia entregou as bombas nucleares , com mediações dos E U A , se a Ucrânia tivesse suas bombas  , será  que a russia iria atacar hummm.', 'parentId': 'Ugx2xKLaLn2rXMSeW8B4AaABAg', 'authorDisplayName': 'Ney Cleber', 'authorProfileImageUrl': 'https://yt3.ggpht.com/ytc/AGIKgqNn8OlBihuJO8BPOIcNRwLQNA7F2Ymmb-FN0g=s48-c-k-c0x00ffffff-no-rj', 'authorChannelUrl': 'http://www.youtube.com/channel/UC6R_3Kkd7LGbGL3zQCpIW4w', 'authorChannelId': {'value': 'UC6R_3Kkd7LGbGL3zQCpIW4w'}, 'canRate': True, 'viewerRating': 'none', 'likeCount': 0, 'publishedAt': '2022-10-13T21:38:28Z', 'updatedAt': '2022-10-13T21:38:28Z'}}, {'kind': 'youtube#comment', 'etag': '2cOpPxPX236FGg7i52WAdIkHNTQ', 'id': 'Ugx2xKLaLn2rXMSeW8B4AaABAg.9h4hsNfU-iG9h5ZJ56CCpo', 'snippet': {'videoId': 'W2ImnPI_qmo', 'textDisplay': 'Mente medíocre 💩💩💩', 'textOriginal': 'Mente medíocre 💩💩💩', 'parentId': 'Ugx2xKLaLn2rXMSeW8B4AaABAg', 'authorDisplayName': 'Abcina Miguel Nhanala', 'authorProfileImageUrl': 'https://yt3.ggpht.com/ytc/AGIKgqPc7rDsHJ7ORCE6U2tpdo33AGPMQUN_SGKhnpBGEzsw54z4gBhgDaOzIx1WJ-zs=s48-c-k-c0x00ffffff-no-rj', 'authorChannelUrl': 'http://www.youtube.com/channel/UChbr2YaBjlDXnaMFKcQ5EGg', 'authorChannelId': {'value': 'UChbr2YaBjlDXnaMFKcQ5EGg'}, 'canRate': True, 'viewerRating': 'none', 'likeCount': 1, 'publishedAt': '2022-10-12T19:43:56Z', 'updatedAt': '2022-10-12T19:43:56Z'}}, {'kind': 'youtube#comment', 'etag': 'Qd8ggVC7eSQziQ0gqsBOqdRw7xc', 'id': 'Ugx2xKLaLn2rXMSeW8B4AaABAg.9h4hsNfU-iG9h5Eh0UZD9e', 'snippet': {'videoId': 'W2ImnPI_qmo', 'textDisplay': '@💣  terrorista 💣 O que é a europa? fantoshe dos USA', 'textOriginal': '@💣  terrorista 💣 O que é a europa? fantoshe dos USA', 'parentId': 'Ugx2xKLaLn2rXMSeW8B4AaABAg', 'authorDisplayName': 'paulo sola zmirra', 'authorProfileImageUrl': 'https://yt3.ggpht.com/ytc/AGIKgqMN1QFoZF68VuoMjgB1mb5K4G9ta2W0gNsd6kDI=s48-c-k-c0x00ffffff-no-rj', 'authorChannelUrl': 'http://www.youtube.com/channel/UCNCDEFMqGuv4SzDTnbkOqtg', 'authorChannelId': {'value': 'UCNCDEFMqGuv4SzDTnbkOqtg'}, 'canRate': True, 'viewerRating': 'none', 'likeCount': 0, 'publishedAt': '2022-10-12T16:43:50Z', 'updatedAt': '2022-10-12T16:43:50Z'}}, {'kind': 'youtube#comment', 'etag': '_3xv2gS7OdCJbKNGpERc0NRFLtw', 'id': 'Ugx2xKLaLn2rXMSeW8B4AaABAg.9h4hsNfU-iG9h526HMtn-h', 'snippet': {'videoId': 'W2ImnPI_qmo', 'textDisplay': '@💣  terrorista 💣 a Europa é capacho dos EUA,  então não confio neles', 'textOriginal': '@💣  terrorista 💣 a Europa é capacho dos EUA,  então não confio neles', 'parentId': 'Ugx2xKLaLn2rXMSeW8B4AaABAg', 'authorDisplayName': 'Heltomar A. De Oliveira', 'authorProfileImageUrl': 'https://yt3.ggpht.com/ytc/AGIKgqPXeMMQ0tT2ME9Teh8vtFFry-MBBNwB4PtVTg=s48-c-k-c0x00ffffff-no-rj', 'authorChannelUrl': 'http://www.youtube.com/channel/UCRAw8CauNgndme-YOq0S1tw', 'authorChannelId': {'value': 'UCRAw8CauNgndme-YOq0S1tw'}, 'canRate': True, 'viewerRating': 'none', 'likeCount': 0, 'publishedAt': '2022-10-12T14:53:50Z', 'updatedAt': '2022-10-12T14:53:50Z'}}, {'kind': 'youtube#comment', 'etag': '-k-aetSRP35yQzj9oFUwnLKeVUg', 'id': 'Ugx2xKLaLn2rXMSeW8B4AaABAg.9h4hsNfU-iG9h4ndnl6DZu', 'snippet': {'videoId': 'W2ImnPI_qmo', 'textDisplay': 'Garante a europa.', 'textOriginal': 'Garante a europa.', 'parentId': 'Ugx2xKLaLn2rXMSeW8B4AaABAg', 'authorDisplayName': '💣  terrorista 💣', 'authorProfileImageUrl': 'https://yt3.ggpht.com/cwPucFKiVONDhSKxqXI4GYBJieKjXU004fAr3q91WA1H27gYy9zD9aZTCDGb7tPyA9plko5oRS0=s48-c-k-c0x00ffffff-no-rj', 'authorChannelUrl': 'http://www.youtube.com/channel/UC9ja2CpiycQwpRHwx9aa1Qg', 'authorChannelId': {'value': 'UC9ja2CpiycQwpRHwx9aa1Qg'}, 'canRate': True, 'viewerRating': 'none', 'likeCount': 0, 'publishedAt': '2022-10-12T12:38:44Z', 'updatedAt': '2022-10-12T12:38:44Z'}}]}",UC9Q9--F5X3Pj4HbKe8qZHaQ,2022-10-12T11:48:18Z,"Só usar cuba como exemplo, no passado EUA atacou cuba na chamada ""invasão na baia dos porcos"" justamente por que tinha mísseis nucleares perto deles. Se a Ucrânia entrar pra Otan, quem garante que eles não iam colocar mísseis lá?",,2023-06-08 18:14:44.232167
