kind,etag,id,snippet,replies,authorChannelId,publishedAt,textOriginal,nextPageToken,extraction_date
youtube#commentThread,SEbnYP6w-AhyUryIkQ-p_bxIXOY,Ugx8eS_dcWp-J67xKAp4AaABAg,"{'videoId': 'MROCrmFWHjY', 'topLevelComment': {'kind': 'youtube#comment', 'etag': 'cJ9w6BBeY_XOT47o2WxHa-FI4hY', 'id': 'Ugx8eS_dcWp-J67xKAp4AaABAg', 'snippet': {'videoId': 'MROCrmFWHjY', 'textDisplay': 'Adoro esse cara. Emanoel pessoa', 'textOriginal': 'Adoro esse cara. Emanoel pessoa', 'authorDisplayName': 'Só fuleragem', 'authorProfileImageUrl': 'https://yt3.ggpht.com/PCeGIEUENyP2lzAGylTBTZykUMfnhT01xXMSN1zAhpJ1DpnGK_8yvpZqTOerMo1F-r9AvAaU=s48-c-k-c0x00ffffff-no-rj', 'authorChannelUrl': 'http://www.youtube.com/channel/UCA7UFuRCb9OfuSMH0bjmraQ', 'authorChannelId': {'value': 'UCA7UFuRCb9OfuSMH0bjmraQ'}, 'canRate': True, 'viewerRating': 'none', 'likeCount': 0, 'publishedAt': '2023-02-18T01:57:10Z', 'updatedAt': '2023-02-18T01:57:10Z'}}, 'canReply': True, 'totalReplyCount': 0, 'isPublic': True}",,UCA7UFuRCb9OfuSMH0bjmraQ,2023-02-18T01:57:10Z,Adoro esse cara. Emanoel pessoa,,2023-06-08 14:30:59.042835
youtube#commentThread,1n8aVOYGIrqcnYKIhJAjSYB3AHU,UgzMrEmbFOmRn5b9J8h4AaABAg,"{'videoId': 'MROCrmFWHjY', 'topLevelComment': {'kind': 'youtube#comment', 'etag': '6RylyRB4i3_uW35TPpZQEzFfon8', 'id': 'UgzMrEmbFOmRn5b9J8h4AaABAg', 'snippet': {'videoId': 'MROCrmFWHjY', 'textDisplay': 'Aquela bandida falou coisas horrorosas a respeito da filha do presidente. Nada fizeram contra a bandida!! Mais foi falado coisas contra essa senhora. Vixiii.. o mundo caiu. Pq q uma senhora tem mais credibilidade do q uma criança, Pq é ministra? e dai.. e a criança é filha do presidente da República. Os ministros do STF quer ta acima, ate mesmo de DEUS!!! 😏', 'textOriginal': 'Aquela bandida falou coisas horrorosas a respeito da filha do presidente. Nada fizeram contra a bandida!! Mais foi falado coisas contra essa senhora. Vixiii.. o mundo caiu. Pq q uma senhora tem mais credibilidade do q uma criança, Pq é ministra? e dai.. e a criança é filha do presidente da República. Os ministros do STF quer ta acima, ate mesmo de DEUS!!! 😏', 'authorDisplayName': 'Rosa Amelia', 'authorProfileImageUrl': 'https://yt3.ggpht.com/ytc/AGIKgqPqFQ_rpxBtPzzg-V51mcgV3EZiHCOZdiB7KA=s48-c-k-c0x00ffffff-no-rj', 'authorChannelUrl': 'http://www.youtube.com/channel/UCFef2auRf4ierGwoLupoLXg', 'authorChannelId': {'value': 'UCFef2auRf4ierGwoLupoLXg'}, 'canRate': True, 'viewerRating': 'none', 'likeCount': 0, 'publishedAt': '2022-10-27T11:44:17Z', 'updatedAt': '2022-10-27T11:44:17Z'}}, 'canReply': True, 'totalReplyCount': 0, 'isPublic': True}",,UCFef2auRf4ierGwoLupoLXg,2022-10-27T11:44:17Z,"Aquela bandida falou coisas horrorosas a respeito da filha do presidente. Nada fizeram contra a bandida!! Mais foi falado coisas contra essa senhora. Vixiii.. o mundo caiu. Pq q uma senhora tem mais credibilidade do q uma criança, Pq é ministra? e dai.. e a criança é filha do presidente da República. Os ministros do STF quer ta acima, ate mesmo de DEUS!!! 😏",,2023-06-08 14:30:59.042835
youtube#commentThread,wFTE8jKODombmBRvMFq13tJ257w,UgxEd4VRHs2UiRlyUrJ4AaABAg,"{'videoId': 'MROCrmFWHjY', 'topLevelComment': {'kind': 'youtube#comment', 'etag': '44fDFFkqyn0kEYzlvKraN3Cf0t4', 'id': 'UgxEd4VRHs2UiRlyUrJ4AaABAg', 'snippet': {'videoId': 'MROCrmFWHjY', 'textDisplay': 'criatura indecente', 'textOriginal': 'criatura indecente', 'authorDisplayName': 'Maria das Dores Nascimento', 'authorProfileImageUrl': 'https://yt3.ggpht.com/ytc/AGIKgqOWO-g2ZJtT9ltTnalIjqBDmiAgTR3lu_n5nQ=s48-c-k-c0x00ffffff-no-rj', 'authorChannelUrl': 'http://www.youtube.com/channel/UCECiJyup8eSZW6-_Y8VlrDg', 'authorChannelId': {'value': 'UCECiJyup8eSZW6-_Y8VlrDg'}, 'canRate': True, 'viewerRating': 'none', 'likeCount': 0, 'publishedAt': '2022-10-27T10:00:18Z', 'updatedAt': '2022-10-27T10:00:18Z'}}, 'canReply': True, 'totalReplyCount': 0, 'isPublic': True}",,UCECiJyup8eSZW6-_Y8VlrDg,2022-10-27T10:00:18Z,criatura indecente,,2023-06-08 14:30:59.042835
youtube#commentThread,FqBSVYnw0gR73aMAcAdVRTl-o6E,Ugz_vROFNwWX9FT06Ot4AaABAg,"{'videoId': 'MROCrmFWHjY', 'topLevelComment': {'kind': 'youtube#comment', 'etag': 'IKSsh1HtrtFHfMU-WVy2Jcvb7EE', 'id': 'Ugz_vROFNwWX9FT06Ot4AaABAg', 'snippet': {'videoId': 'MROCrmFWHjY', 'textDisplay': 'Resolução TSE nº 23.610 -É importante lembrar que não é função do Tribunal Superior Eleitoral (TSE) distribuir o material a ser veiculado no horário gratuito. São as emissoras de rádio e de televisão que devem se planejar para ter acesso às mídias e divulgá-las seguindo as regras estabelecidas na Resolução TSE nº 23.610 É importante lembrar que não é função do Tribunal Superior Eleitoral (TSE) distribuir o material a ser veiculado no horário gratuito. São as emissoras de rádio e de televisão que devem se planejar para ter acesso às mídias e divulgá-las seguindo as regras estabelecidas.', 'textOriginal': 'Resolução TSE nº 23.610 -É importante lembrar que não é função do Tribunal Superior Eleitoral (TSE) distribuir o material a ser veiculado no horário gratuito. São as emissoras de rádio e de televisão que devem se planejar para ter acesso às mídias e divulgá-las seguindo as regras estabelecidas na Resolução TSE nº 23.610 É importante lembrar que não é função do Tribunal Superior Eleitoral (TSE) distribuir o material a ser veiculado no horário gratuito. São as emissoras de rádio e de televisão que devem se planejar para ter acesso às mídias e divulgá-las seguindo as regras estabelecidas.', 'authorDisplayName': 'DT', 'authorProfileImageUrl': 'https://yt3.ggpht.com/oSkAStP942B05I1Jsbt1q8EYxyDKJtr93BLhM-HXDWXzqInjMhUNiNo2rs-7bjO0cERYk6O1MQ=s48-c-k-c0x00ffffff-no-rj', 'authorChannelUrl': 'http://www.youtube.com/channel/UCvOdxpuDS7_B2duUDqYBRYw', 'authorChannelId': {'value': 'UCvOdxpuDS7_B2duUDqYBRYw'}, 'canRate': True, 'viewerRating': 'none', 'likeCount': 0, 'publishedAt': '2022-10-27T09:34:43Z', 'updatedAt': '2022-10-27T09:34:43Z'}}, 'canReply': True, 'totalReplyCount': 0, 'isPublic': True}",,UCvOdxpuDS7_B2duUDqYBRYw,2022-10-27T09:34:43Z,Resolução TSE nº 23.610 -É importante lembrar que não é função do Tribunal Superior Eleitoral (TSE) distribuir o material a ser veiculado no horário gratuito. São as emissoras de rádio e de televisão que devem se planejar para ter acesso às mídias e divulgá-las seguindo as regras estabelecidas na Resolução TSE nº 23.610 É importante lembrar que não é função do Tribunal Superior Eleitoral (TSE) distribuir o material a ser veiculado no horário gratuito. São as emissoras de rádio e de televisão que devem se planejar para ter acesso às mídias e divulgá-las seguindo as regras estabelecidas.,,2023-06-08 14:30:59.042835
youtube#commentThread,W2LOwseuouSyx2lDtk67EWjhAy8,UgwuXFGfNaN2n9k-pSt4AaABAg,"{'videoId': 'MROCrmFWHjY', 'topLevelComment': {'kind': 'youtube#comment', 'etag': 'EgxgZtvDu2JX9pY7gNVhofZaxME', 'id': 'UgwuXFGfNaN2n9k-pSt4AaABAg', 'snippet': {'videoId': 'MROCrmFWHjY', 'textDisplay': 'Não entendi NADA. O presidente diz que quem atira em policial e bandido? Mas então porque  mandou ministro da justiça? E para melhorar manda um PF bater papo rindo?   Acho que esse bandido ai teve tratamento  de luxo! kkkkkkk      Mas O Gado finge que não VÊ.', 'textOriginal': 'Não entendi NADA. O presidente diz que quem atira em policial e bandido? Mas então porque  mandou ministro da justiça? E para melhorar manda um PF bater papo rindo?   Acho que esse bandido ai teve tratamento  de luxo! kkkkkkk      Mas O Gado finge que não VÊ.', 'authorDisplayName': 'jose silva silva', 'authorProfileImageUrl': 'https://yt3.ggpht.com/ytc/AGIKgqN1yPXkaUYKgHVNxL8Kvdgh6Ae68frkyGFNwCJJWW2nFS3b88HPlf0iB3A6G1X9=s48-c-k-c0x00ffffff-no-rj', 'authorChannelUrl': 'http://www.youtube.com/channel/UCIyeWgRDtznvMLBK9qSjDBQ', 'authorChannelId': {'value': 'UCIyeWgRDtznvMLBK9qSjDBQ'}, 'canRate': True, 'viewerRating': 'none', 'likeCount': 0, 'publishedAt': '2022-10-27T08:44:11Z', 'updatedAt': '2022-10-27T08:44:11Z'}}, 'canReply': True, 'totalReplyCount': 0, 'isPublic': True}",,UCIyeWgRDtznvMLBK9qSjDBQ,2022-10-27T08:44:11Z,Não entendi NADA. O presidente diz que quem atira em policial e bandido? Mas então porque  mandou ministro da justiça? E para melhorar manda um PF bater papo rindo?   Acho que esse bandido ai teve tratamento  de luxo! kkkkkkk      Mas O Gado finge que não VÊ.,,2023-06-08 14:30:59.042835
youtube#commentThread,XbAmrz-UiIiaGkpAhjkH1F5-m5U,Ugxkq2fGqk3_9rNk1RV4AaABAg,"{'videoId': 'MROCrmFWHjY', 'topLevelComment': {'kind': 'youtube#comment', 'etag': '20nlle159q42UYM6s_p4AdDrMJA', 'id': 'Ugxkq2fGqk3_9rNk1RV4AaABAg', 'snippet': {'videoId': 'MROCrmFWHjY', 'textDisplay': '😎 ROBERTO JEFERSON FALOU O QUE MUITA GENTE FALA E TEM VONTADE DE FALAR PRA ELA E MUITOS DO STF.<br>AGORA ATIRAR NA POLÍCIA É COISA DE BANDIDO.', 'textOriginal': '😎 ROBERTO JEFERSON FALOU O QUE MUITA GENTE FALA E TEM VONTADE DE FALAR PRA ELA E MUITOS DO STF.\\nAGORA ATIRAR NA POLÍCIA É COISA DE BANDIDO.', 'authorDisplayName': 'Vera Carvalho', 'authorProfileImageUrl': 'https://yt3.ggpht.com/ytc/AGIKgqMbAFLaSkoiKaoCpEEl7LWz5GzG8d-gb_aQ9A=s48-c-k-c0x00ffffff-no-rj', 'authorChannelUrl': 'http://www.youtube.com/channel/UCSAMxXnkOJT5E0MFcT8LS8A', 'authorChannelId': {'value': 'UCSAMxXnkOJT5E0MFcT8LS8A'}, 'canRate': True, 'viewerRating': 'none', 'likeCount': 0, 'publishedAt': '2022-10-27T08:37:00Z', 'updatedAt': '2022-10-27T08:37:00Z'}}, 'canReply': True, 'totalReplyCount': 0, 'isPublic': True}",,UCSAMxXnkOJT5E0MFcT8LS8A,2022-10-27T08:37:00Z,"😎 ROBERTO JEFERSON FALOU O QUE MUITA GENTE FALA E TEM VONTADE DE FALAR PRA ELA E MUITOS DO STF.
AGORA ATIRAR NA POLÍCIA É COISA DE BANDIDO.",,2023-06-08 14:30:59.042835
youtube#commentThread,fZezgIusYCYbl_QyRb-ju3mzTAc,UgyTARrYy7Vvn8bd7zl4AaABAg,"{'videoId': 'MROCrmFWHjY', 'topLevelComment': {'kind': 'youtube#comment', 'etag': 'fK9KgoMdBDpIw1IlCTTY_QwFtPw', 'id': 'UgyTARrYy7Vvn8bd7zl4AaABAg', 'snippet': {'videoId': 'MROCrmFWHjY', 'textDisplay': 'Vote 22 por Deus, família, liberdade de expressão e contra fraudes na eleição 🌷🌷', 'textOriginal': 'Vote 22 por Deus, família, liberdade de expressão e contra fraudes na eleição 🌷🌷', 'authorDisplayName': 'Galopagos', 'authorProfileImageUrl': 'https://yt3.ggpht.com/HDfs5wGBkAyq2mOcbAm9HoXo_hwrJjVU8VxeOrc9C2TUlW7NkwU09E98sPrYHZm63FklxANVVg=s48-c-k-c0x00ffffff-no-rj', 'authorChannelUrl': 'http://www.youtube.com/channel/UCn2EgsVDLVFFfHNl6UFtSZA', 'authorChannelId': {'value': 'UCn2EgsVDLVFFfHNl6UFtSZA'}, 'canRate': True, 'viewerRating': 'none', 'likeCount': 2, 'publishedAt': '2022-10-27T06:56:59Z', 'updatedAt': '2022-10-27T06:56:59Z'}}, 'canReply': True, 'totalReplyCount': 0, 'isPublic': True}",,UCn2EgsVDLVFFfHNl6UFtSZA,2022-10-27T06:56:59Z,"Vote 22 por Deus, família, liberdade de expressão e contra fraudes na eleição 🌷🌷",,2023-06-08 14:30:59.042835
youtube#commentThread,hbD6pW1OUbG-XEBwA3euJNKNih8,UgxKnEGBAZNG637VVDF4AaABAg,"{'videoId': 'MROCrmFWHjY', 'topLevelComment': {'kind': 'youtube#comment', 'etag': 'aMW6Kz3JpG6grpbBUHdoZhNMKgE', 'id': 'UgxKnEGBAZNG637VVDF4AaABAg', 'snippet': {'videoId': 'MROCrmFWHjY', 'textDisplay': 'TUDO QUE ROBERTO JEFFERSON, FEZ, FOI UM DESATINO, CAUSADO POR EXTREMA REVOLTA! TODA A QUADRILHA DO LULADRÃO SOLTA, INCLUSIVE OS CHEFES, LULADRÃO, JOSÉ DIRCEU, GLEISE HOFFMANN, ETC. AGORA, COMO ELE SE REFERIU A CARMEM LÚCIA, COM CERTEZA, FOI MAIS UM ATO INSANO, DE REVOLTA! NADA JUSTIFICA TAL FALTA DE RESPEITO, TAL AGRESSÃO! ELE PERDEU A CABEÇA, O BOM SENSO, A RACIONALIDADE, TUDO FOI ENGOLIDO, PELA REVOLTA!! UMA PENA! FOI UM HOMEM QUE TEVE A CORAGEM DE DENUNCIAR O MENSALÃO E RESGATAR, UM POUCO, DA SUA DIGNIDADE! POR ISSO, NÃO MERECIA TER UM FIM TÃO TRISTE E INJUSTO! MAS, QUANDO SE PERDE A CABEÇA, O CORPO PADECE! AGORA, DOENTE, FRAGILIZADO, ESTÁ NUMA PRISÃO! ENFIM, A JUSTIÇA DA TERRA É MUITO FALHA, MAS A DE DEUS É INFALÍVEL E MAIS CEDO OU MAIS TARDE, ELA CHEGA E COBRA MUITO CARO, DE CADA UM DE NÓS!!', 'textOriginal': 'TUDO QUE ROBERTO JEFFERSON, FEZ, FOI UM DESATINO, CAUSADO POR EXTREMA REVOLTA! TODA A QUADRILHA DO LULADRÃO SOLTA, INCLUSIVE OS CHEFES, LULADRÃO, JOSÉ DIRCEU, GLEISE HOFFMANN, ETC. AGORA, COMO ELE SE REFERIU A CARMEM LÚCIA, COM CERTEZA, FOI MAIS UM ATO INSANO, DE REVOLTA! NADA JUSTIFICA TAL FALTA DE RESPEITO, TAL AGRESSÃO! ELE PERDEU A CABEÇA, O BOM SENSO, A RACIONALIDADE, TUDO FOI ENGOLIDO, PELA REVOLTA!! UMA PENA! FOI UM HOMEM QUE TEVE A CORAGEM DE DENUNCIAR O MENSALÃO E RESGATAR, UM POUCO, DA SUA DIGNIDADE! POR ISSO, NÃO MERECIA TER UM FIM TÃO TRISTE E INJUSTO! MAS, QUANDO SE PERDE A CABEÇA, O CORPO PADECE! AGORA, DOENTE, FRAGILIZADO, ESTÁ NUMA PRISÃO! ENFIM, A JUSTIÇA DA TERRA É MUITO FALHA, MAS A DE DEUS É INFALÍVEL E MAIS CEDO OU MAIS TARDE, ELA CHEGA E COBRA MUITO CARO, DE CADA UM DE NÓS!!', 'authorDisplayName': 'profgeocwb', 'authorProfileImageUrl': 'https://yt3.ggpht.com/SteEMc9CPFfPeeX1110BuVAKlNoIydrakjih2Z_wtgtUmAcCLylXOJLkDwVegtD5S0I1QnFaLw=s48-c-k-c0x00ffffff-no-rj', 'authorChannelUrl': 'http://www.youtube.com/channel/UCYTvFOyOPebCPbo1NHuzodA', 'authorChannelId': {'value': 'UCYTvFOyOPebCPbo1NHuzodA'}, 'canRate': True, 'viewerRating': 'none', 'likeCount': 0, 'publishedAt': '2022-10-27T04:42:39Z', 'updatedAt': '2022-10-27T04:42:39Z'}}, 'canReply': True, 'totalReplyCount': 0, 'isPublic': True}",,UCYTvFOyOPebCPbo1NHuzodA,2022-10-27T04:42:39Z,"TUDO QUE ROBERTO JEFFERSON, FEZ, FOI UM DESATINO, CAUSADO POR EXTREMA REVOLTA! TODA A QUADRILHA DO LULADRÃO SOLTA, INCLUSIVE OS CHEFES, LULADRÃO, JOSÉ DIRCEU, GLEISE HOFFMANN, ETC. AGORA, COMO ELE SE REFERIU A CARMEM LÚCIA, COM CERTEZA, FOI MAIS UM ATO INSANO, DE REVOLTA! NADA JUSTIFICA TAL FALTA DE RESPEITO, TAL AGRESSÃO! ELE PERDEU A CABEÇA, O BOM SENSO, A RACIONALIDADE, TUDO FOI ENGOLIDO, PELA REVOLTA!! UMA PENA! FOI UM HOMEM QUE TEVE A CORAGEM DE DENUNCIAR O MENSALÃO E RESGATAR, UM POUCO, DA SUA DIGNIDADE! POR ISSO, NÃO MERECIA TER UM FIM TÃO TRISTE E INJUSTO! MAS, QUANDO SE PERDE A CABEÇA, O CORPO PADECE! AGORA, DOENTE, FRAGILIZADO, ESTÁ NUMA PRISÃO! ENFIM, A JUSTIÇA DA TERRA É MUITO FALHA, MAS A DE DEUS É INFALÍVEL E MAIS CEDO OU MAIS TARDE, ELA CHEGA E COBRA MUITO CARO, DE CADA UM DE NÓS!!",,2023-06-08 14:30:59.042835
youtube#commentThread,KyJW0G1L_xhjMlWppLVEqS85ca8,Ugwu-uv-gKPQKfRKC2R4AaABAg,"{'videoId': 'MROCrmFWHjY', 'topLevelComment': {'kind': 'youtube#comment', 'etag': 'UUoNTVBr6rz6bpO54pe9r4ALjUc', 'id': 'Ugwu-uv-gKPQKfRKC2R4AaABAg', 'snippet': {'videoId': 'MROCrmFWHjY', 'textDisplay': 'DIA 29/10 TODO MUNDO NAS RUAS!!!! COMPARTILHEM!!!! CONTRA O &quot;RADIOLÃO&quot; E CONTRA O DITADOR &quot;Alexandre de Moraes&quot;!!!!!', 'textOriginal': 'DIA 29/10 TODO MUNDO NAS RUAS!!!! COMPARTILHEM!!!! CONTRA O ""RADIOLÃO"" E CONTRA O DITADOR ""Alexandre de Moraes""!!!!!', 'authorDisplayName': 'Thiago Lobo', 'authorProfileImageUrl': 'https://yt3.ggpht.com/ytc/AGIKgqPSb43ApFAp7Ul4AoB8UySWIdmtuyUF4tyfc2mgZA=s48-c-k-c0x00ffffff-no-rj', 'authorChannelUrl': 'http://www.youtube.com/channel/UC3UcFPXPmg05wl1v9xljxcA', 'authorChannelId': {'value': 'UC3UcFPXPmg05wl1v9xljxcA'}, 'canRate': True, 'viewerRating': 'none', 'likeCount': 0, 'publishedAt': '2022-10-27T04:01:16Z', 'updatedAt': '2022-10-27T04:01:16Z'}}, 'canReply': True, 'totalReplyCount': 0, 'isPublic': True}",,UC3UcFPXPmg05wl1v9xljxcA,2022-10-27T04:01:16Z,"DIA 29/10 TODO MUNDO NAS RUAS!!!! COMPARTILHEM!!!! CONTRA O ""RADIOLÃO"" E CONTRA O DITADOR ""Alexandre de Moraes""!!!!!",,2023-06-08 14:30:59.042835
youtube#commentThread,9XoEyIZ3Os7xuTmGw9BAUSleP6U,UgwABHXvVKx69EP9jR94AaABAg,"{'videoId': 'MROCrmFWHjY', 'topLevelComment': {'kind': 'youtube#comment', 'etag': 'berzy2eN8IVzo9HhmTrORlNHuXY', 'id': 'UgwABHXvVKx69EP9jR94AaABAg', 'snippet': {'videoId': 'MROCrmFWHjY', 'textDisplay': 'Bozo jogou mais um amigão na fogueira. Jefferson virou canário belga de novo.', 'textOriginal': 'Bozo jogou mais um amigão na fogueira. Jefferson virou canário belga de novo.', 'authorDisplayName': 'Dan5482', 'authorProfileImageUrl': 'https://yt3.ggpht.com/ytc/AGIKgqP-sdu3-i93xJEV5LsNaQQNxnNC45h0rGulpyEW=s48-c-k-c0x00ffffff-no-rj', 'authorChannelUrl': 'http://www.youtube.com/channel/UCnOqs0s35Q4iH7wMYJ_vgmw', 'authorChannelId': {'value': 'UCnOqs0s35Q4iH7wMYJ_vgmw'}, 'canRate': True, 'viewerRating': 'none', 'likeCount': 1, 'publishedAt': '2022-10-27T03:49:43Z', 'updatedAt': '2022-10-27T03:49:43Z'}}, 'canReply': True, 'totalReplyCount': 0, 'isPublic': True}",,UCnOqs0s35Q4iH7wMYJ_vgmw,2022-10-27T03:49:43Z,Bozo jogou mais um amigão na fogueira. Jefferson virou canário belga de novo.,,2023-06-08 14:30:59.042835
youtube#commentThread,Kv3oCcNZ6wwF0RpnQy72e9dwHUE,Ugw9Zu1Jr9wP4beGJhZ4AaABAg,"{'videoId': 'MROCrmFWHjY', 'topLevelComment': {'kind': 'youtube#comment', 'etag': '4fi9OOVHDuYwhPXZgdhUjk2AIzQ', 'id': 'Ugw9Zu1Jr9wP4beGJhZ4AaABAg', 'snippet': {'videoId': 'MROCrmFWHjY', 'textDisplay': 'STF É O ESGOTO DO PAÍS!!!!', 'textOriginal': 'STF É O ESGOTO DO PAÍS!!!!', 'authorDisplayName': 'sniper cibernético', 'authorProfileImageUrl': 'https://yt3.ggpht.com/ytc/AGIKgqPntC_V9AYGsWvFJRcPqd93cMilnkw_MKmOCt4dlA=s48-c-k-c0x00ffffff-no-rj', 'authorChannelUrl': 'http://www.youtube.com/channel/UCTPCfL2IrkcBP8AmWdGYroQ', 'authorChannelId': {'value': 'UCTPCfL2IrkcBP8AmWdGYroQ'}, 'canRate': True, 'viewerRating': 'none', 'likeCount': 1, 'publishedAt': '2022-10-27T03:42:23Z', 'updatedAt': '2022-10-27T03:42:23Z'}}, 'canReply': True, 'totalReplyCount': 0, 'isPublic': True}",,UCTPCfL2IrkcBP8AmWdGYroQ,2022-10-27T03:42:23Z,STF É O ESGOTO DO PAÍS!!!!,,2023-06-08 14:30:59.042835
youtube#commentThread,3wmbLbXK6_qaqY3xIvHAo64r5qQ,UgxpKzY73HXIIlGKxlt4AaABAg,"{'videoId': 'MROCrmFWHjY', 'topLevelComment': {'kind': 'youtube#comment', 'etag': 'fkr2HjzZM5YdvJLUsXVuu8eORsY', 'id': 'UgxpKzY73HXIIlGKxlt4AaABAg', 'snippet': {'videoId': 'MROCrmFWHjY', 'textDisplay': 'A CONSTITUIÇÃO a que a ministra Carmen Lúcia,  se refere é à constituição privada do STF,  que os ministros julgamento como querem e conforme seus interesses. <br>Cadê aqueles que depredaram a casa da ministra??<br>Eram amiguinhos de Lula,  então estão todos liberados. <br>STF e TSE vergonha nacional!!<br>&quot;A pior DITADURA é a ditadura do poder judiciário. Contra ela, não há a quem recorrer.&quot; Rui Barbosa.', 'textOriginal': 'A CONSTITUIÇÃO a que a ministra Carmen Lúcia,  se refere é à constituição privada do STF,  que os ministros julgamento como querem e conforme seus interesses. \\nCadê aqueles que depredaram a casa da ministra??\\nEram amiguinhos de Lula,  então estão todos liberados. \\nSTF e TSE vergonha nacional!!\\n""A pior DITADURA é a ditadura do poder judiciário. Contra ela, não há a quem recorrer."" Rui Barbosa.', 'authorDisplayName': 'Ernesto Felipe', 'authorProfileImageUrl': 'https://yt3.ggpht.com/ytc/AGIKgqOFvHiv1awEetRg_Hlq2yJO6JkRPRP4f1Iq=s48-c-k-c0x00ffffff-no-rj', 'authorChannelUrl': 'http://www.youtube.com/channel/UC9B2jWPlKmwzPyoMfuBZg7A', 'authorChannelId': {'value': 'UC9B2jWPlKmwzPyoMfuBZg7A'}, 'canRate': True, 'viewerRating': 'none', 'likeCount': 0, 'publishedAt': '2022-10-27T03:10:30Z', 'updatedAt': '2022-10-27T03:10:30Z'}}, 'canReply': True, 'totalReplyCount': 0, 'isPublic': True}",,UC9B2jWPlKmwzPyoMfuBZg7A,2022-10-27T03:10:30Z,"A CONSTITUIÇÃO a que a ministra Carmen Lúcia,  se refere é à constituição privada do STF,  que os ministros julgamento como querem e conforme seus interesses. 
Cadê aqueles que depredaram a casa da ministra??
Eram amiguinhos de Lula,  então estão todos liberados. 
STF e TSE vergonha nacional!!
""A pior DITADURA é a ditadura do poder judiciário. Contra ela, não há a quem recorrer."" Rui Barbosa.",,2023-06-08 14:30:59.042835
youtube#commentThread,wUb9kZzwDrdmmDi91hzaMTLqsTs,UgxmH7HPdc6ckFm5lsh4AaABAg,"{'videoId': 'MROCrmFWHjY', 'topLevelComment': {'kind': 'youtube#comment', 'etag': '28NdT2xL-eiQJzRWwhn8cUD8Jzc', 'id': 'UgxmH7HPdc6ckFm5lsh4AaABAg', 'snippet': {'videoId': 'MROCrmFWHjY', 'textDisplay': 'ESTE JUDICIÁRIO É O .MAIS PODRE QUE EXISTE NÁO TEM JUSTIÇA E  INJUSTIÇA  O QUE  QUEREM É A CABEÇA DO PRESIDENTE E SUA RENÚNCIA O MAL NÁO VENCERÁ O BEM O DECRETO DE DEUS NINGUEM PODE DEIXAR DE CUMPRIR O FARAÓ NÁO SABE O QUE ESPERA ,BOLSONARO        ACIMA DE TUDO É DE ACIMA TODOS .', 'textOriginal': 'ESTE JUDICIÁRIO É O .MAIS PODRE QUE EXISTE NÁO TEM JUSTIÇA E  INJUSTIÇA  O QUE  QUEREM É A CABEÇA DO PRESIDENTE E SUA RENÚNCIA O MAL NÁO VENCERÁ O BEM O DECRETO DE DEUS NINGUEM PODE DEIXAR DE CUMPRIR O FARAÓ NÁO SABE O QUE ESPERA ,BOLSONARO        ACIMA DE TUDO É DE ACIMA TODOS .', 'authorDisplayName': 'Sonia Fatima Candioto', 'authorProfileImageUrl': 'https://yt3.ggpht.com/ytc/AGIKgqO8h5J52TSC0aWwmylr2WgKjcH3OgFQxwx5q49fM9hP2gBrGoJCWb1rvo99Are1=s48-c-k-c0x00ffffff-no-rj', 'authorChannelUrl': 'http://www.youtube.com/channel/UCvkvSrsBvkhUQ-LnNVB7gsQ', 'authorChannelId': {'value': 'UCvkvSrsBvkhUQ-LnNVB7gsQ'}, 'canRate': True, 'viewerRating': 'none', 'likeCount': 0, 'publishedAt': '2022-10-27T03:07:26Z', 'updatedAt': '2022-10-27T03:07:26Z'}}, 'canReply': True, 'totalReplyCount': 0, 'isPublic': True}",,UCvkvSrsBvkhUQ-LnNVB7gsQ,2022-10-27T03:07:26Z,"ESTE JUDICIÁRIO É O .MAIS PODRE QUE EXISTE NÁO TEM JUSTIÇA E  INJUSTIÇA  O QUE  QUEREM É A CABEÇA DO PRESIDENTE E SUA RENÚNCIA O MAL NÁO VENCERÁ O BEM O DECRETO DE DEUS NINGUEM PODE DEIXAR DE CUMPRIR O FARAÓ NÁO SABE O QUE ESPERA ,BOLSONARO        ACIMA DE TUDO É DE ACIMA TODOS .",,2023-06-08 14:30:59.042835
youtube#commentThread,9PqHo3kiFSNfSXhiCJwaQK7uBa0,Ugz2jM_A_sd-gFhY9o54AaABAg,"{'videoId': 'MROCrmFWHjY', 'topLevelComment': {'kind': 'youtube#comment', 'etag': 'lwzw1EAkRjQU8ubbewOLSxQxcQA', 'id': 'Ugz2jM_A_sd-gFhY9o54AaABAg', 'snippet': {'videoId': 'MROCrmFWHjY', 'textDisplay': 'Cadê vassoura bruxa', 'textOriginal': 'Cadê vassoura bruxa', 'authorDisplayName': 'Francisco Roberto', 'authorProfileImageUrl': 'https://yt3.ggpht.com/ytc/AGIKgqNZlCb7_UFYUrPNRRUiroykNfQVtf9ETzsJjg=s48-c-k-c0x00ffffff-no-rj', 'authorChannelUrl': 'http://www.youtube.com/channel/UCtptDEyQbrVQHp2bBABm7Xw', 'authorChannelId': {'value': 'UCtptDEyQbrVQHp2bBABm7Xw'}, 'canRate': True, 'viewerRating': 'none', 'likeCount': 0, 'publishedAt': '2022-10-27T03:06:15Z', 'updatedAt': '2022-10-27T03:06:15Z'}}, 'canReply': True, 'totalReplyCount': 0, 'isPublic': True}",,UCtptDEyQbrVQHp2bBABm7Xw,2022-10-27T03:06:15Z,Cadê vassoura bruxa,,2023-06-08 14:30:59.042835
youtube#commentThread,NlhCIKLhZdlKvwACsHUn764Jhrg,UgxkMkfv4mTWcWMEi9F4AaABAg,"{'videoId': 'MROCrmFWHjY', 'topLevelComment': {'kind': 'youtube#comment', 'etag': 'vkRlrMtDYPJoSSEtr1hcSnW-gFU', 'id': 'UgxkMkfv4mTWcWMEi9F4AaABAg', 'snippet': {'videoId': 'MROCrmFWHjY', 'textDisplay': 'A lutar para fazer cumprir uma o quê? Essa senhora acabou de endossar a censura ao arrepio da mesma constituição que jura defender.', 'textOriginal': 'A lutar para fazer cumprir uma o quê? Essa senhora acabou de endossar a censura ao arrepio da mesma constituição que jura defender.', 'authorDisplayName': 'Geraldo Gomes Bass', 'authorProfileImageUrl': 'https://yt3.ggpht.com/Q0Po0E76rkD6i3lZ3aHX0GD8uNPsm_vv2nmRCEo87Furm6vn-y-bKF7FnYbe-r93vs8qjjHPMg=s48-c-k-c0x00ffffff-no-rj', 'authorChannelUrl': 'http://www.youtube.com/channel/UC9h2zVQr6c66nJGcISToLHQ', 'authorChannelId': {'value': 'UC9h2zVQr6c66nJGcISToLHQ'}, 'canRate': True, 'viewerRating': 'none', 'likeCount': 0, 'publishedAt': '2022-10-27T03:05:03Z', 'updatedAt': '2022-10-27T03:05:03Z'}}, 'canReply': True, 'totalReplyCount': 0, 'isPublic': True}",,UC9h2zVQr6c66nJGcISToLHQ,2022-10-27T03:05:03Z,A lutar para fazer cumprir uma o quê? Essa senhora acabou de endossar a censura ao arrepio da mesma constituição que jura defender.,,2023-06-08 14:30:59.042835
youtube#commentThread,r6rlKq9LN9oRWKITOteF84eXyyQ,UgwtUydZC8rfHOhlovh4AaABAg,"{'videoId': 'MROCrmFWHjY', 'topLevelComment': {'kind': 'youtube#comment', 'etag': 'ytGENJhGQbBkIqw3mr7RVOi2F90', 'id': 'UgwtUydZC8rfHOhlovh4AaABAg', 'snippet': {'videoId': 'MROCrmFWHjY', 'textDisplay': 'A bruxa de quê ou de onde?', 'textOriginal': 'A bruxa de quê ou de onde?', 'authorDisplayName': 'António Vasconcelos Leite', 'authorProfileImageUrl': 'https://yt3.ggpht.com/ytc/AGIKgqPrSRA_zr5EBvvULxOlcz6ONVNyuGnG_DuYpg=s48-c-k-c0x00ffffff-no-rj', 'authorChannelUrl': 'http://www.youtube.com/channel/UCQAnPFXOwfcHCoFBY1dQK3Q', 'authorChannelId': {'value': 'UCQAnPFXOwfcHCoFBY1dQK3Q'}, 'canRate': True, 'viewerRating': 'none', 'likeCount': 1, 'publishedAt': '2022-10-27T03:04:29Z', 'updatedAt': '2022-10-27T03:04:29Z'}}, 'canReply': True, 'totalReplyCount': 0, 'isPublic': True}",,UCQAnPFXOwfcHCoFBY1dQK3Q,2022-10-27T03:04:29Z,A bruxa de quê ou de onde?,,2023-06-08 14:30:59.042835
