kind,etag,id,snippet,replies,authorChannelId,publishedAt,textOriginal,nextPageToken,extraction_date
youtube#commentThread,fOcV786UIU8FwAlshAb6X30B-68,UgxNOWWI58dDeZy8nZV4AaABAg,"{'videoId': 'MROCrmFWHjY', 'topLevelComment': {'kind': 'youtube#comment', 'etag': 'XwHBmTg-2b_U3nNqTCbUvSTQWGc', 'id': 'UgxNOWWI58dDeZy8nZV4AaABAg', 'snippet': {'videoId': 'MROCrmFWHjY', 'textDisplay': 'ESSA CORTE É UMA VERGONHA', 'textOriginal': 'ESSA CORTE É UMA VERGONHA', 'authorDisplayName': 'anacoeli costa', 'authorProfileImageUrl': 'https://yt3.ggpht.com/ytc/AGIKgqPyNwNe_TpaZItHeZZrIzw78H7bV1EFGmj9MA=s48-c-k-c0x00ffffff-no-rj', 'authorChannelUrl': 'http://www.youtube.com/channel/UCRUU_lktv1x32FF0YilwUGg', 'authorChannelId': {'value': 'UCRUU_lktv1x32FF0YilwUGg'}, 'canRate': True, 'viewerRating': 'none', 'likeCount': 9, 'publishedAt': '2022-10-27T02:48:30Z', 'updatedAt': '2022-10-27T02:48:30Z'}}, 'canReply': True, 'totalReplyCount': 0, 'isPublic': True}",,UCRUU_lktv1x32FF0YilwUGg,2022-10-27T02:48:30Z,ESSA CORTE É UMA VERGONHA,,2023-06-08 14:30:59.042835
youtube#commentThread,NWRyYKimhVeFGPamiELJS2XEJqU,Ugx_C0itH0h6i295qml4AaABAg,"{'videoId': 'MROCrmFWHjY', 'topLevelComment': {'kind': 'youtube#comment', 'etag': 'H91_h-iahzxawLv32-8qg_AcWwQ', 'id': 'Ugx_C0itH0h6i295qml4AaABAg', 'snippet': {'videoId': 'MROCrmFWHjY', 'textDisplay': 'STF BANDO DE BANDIDOS', 'textOriginal': 'STF BANDO DE BANDIDOS', 'authorDisplayName': 'TV - Sem Censura', 'authorProfileImageUrl': 'https://yt3.ggpht.com/J_a2OLKt2-30EJR66Xjc5BTyjv2DB2R7oXce0DmSPRSRx1ZQ1LThKK0GhAP6pfKOUTRZAfS5=s48-c-k-c0x00ffffff-no-rj', 'authorChannelUrl': 'http://www.youtube.com/channel/UCAIv4y00kQZ0STbI_zDh-iw', 'authorChannelId': {'value': 'UCAIv4y00kQZ0STbI_zDh-iw'}, 'canRate': True, 'viewerRating': 'none', 'likeCount': 0, 'publishedAt': '2022-10-27T02:48:11Z', 'updatedAt': '2022-10-27T02:48:11Z'}}, 'canReply': True, 'totalReplyCount': 0, 'isPublic': True}",,UCAIv4y00kQZ0STbI_zDh-iw,2022-10-27T02:48:11Z,STF BANDO DE BANDIDOS,,2023-06-08 14:30:59.042835
youtube#commentThread,ORJ0aNk2XoPQJXb4aBAHvh7aNHE,UgxXi-a5zYVK2cdcF594AaABAg,"{'videoId': 'MROCrmFWHjY', 'topLevelComment': {'kind': 'youtube#comment', 'etag': 'fGfUZvSGAKa5aFFiC-jZuKNJFaQ', 'id': 'UgxXi-a5zYVK2cdcF594AaABAg', 'snippet': {'videoId': 'MROCrmFWHjY', 'textDisplay': 'Ainda bem que Roberto Jefferson Pediu Desculpas as Prostitutas..Ninguém Merece Ser Comparada a Essa Vampira Feia Pra Caceta,Sem um Pingo de Discernimento,Indo Atrás da Resolução do Xandão Corrupto Sobre a Censura..<br>O Erro do Roberto Jefferson Foi Ter Atirado na PF,Não se Atira em Polícia Nenhuma,Mas Quanto a Chingar a Ministra Vampira,Não Vejo Problema,Vivem Chingando o Presidente Bolsonaro e Chutando uma Bola com a Cabeça dele...E aí Pode? Não Entendo..', 'textOriginal': 'Ainda bem que Roberto Jefferson Pediu Desculpas as Prostitutas..Ninguém Merece Ser Comparada a Essa Vampira Feia Pra Caceta,Sem um Pingo de Discernimento,Indo Atrás da Resolução do Xandão Corrupto Sobre a Censura..\\nO Erro do Roberto Jefferson Foi Ter Atirado na PF,Não se Atira em Polícia Nenhuma,Mas Quanto a Chingar a Ministra Vampira,Não Vejo Problema,Vivem Chingando o Presidente Bolsonaro e Chutando uma Bola com a Cabeça dele...E aí Pode? Não Entendo..', 'authorDisplayName': 'ilce maria rocha', 'authorProfileImageUrl': 'https://yt3.ggpht.com/ytc/AGIKgqMVOKiC6Wh5o4KhbPmwMUOYUq_Jy4vM9HnZCpXPJHw=s48-c-k-c0x00ffffff-no-rj', 'authorChannelUrl': 'http://www.youtube.com/channel/UCuVPpZBFbXJKxo6AwwuW7yQ', 'authorChannelId': {'value': 'UCuVPpZBFbXJKxo6AwwuW7yQ'}, 'canRate': True, 'viewerRating': 'none', 'likeCount': 0, 'publishedAt': '2022-10-27T02:47:37Z', 'updatedAt': '2022-10-27T02:47:37Z'}}, 'canReply': True, 'totalReplyCount': 0, 'isPublic': True}",,UCuVPpZBFbXJKxo6AwwuW7yQ,2022-10-27T02:47:37Z,"Ainda bem que Roberto Jefferson Pediu Desculpas as Prostitutas..Ninguém Merece Ser Comparada a Essa Vampira Feia Pra Caceta,Sem um Pingo de Discernimento,Indo Atrás da Resolução do Xandão Corrupto Sobre a Censura..
O Erro do Roberto Jefferson Foi Ter Atirado na PF,Não se Atira em Polícia Nenhuma,Mas Quanto a Chingar a Ministra Vampira,Não Vejo Problema,Vivem Chingando o Presidente Bolsonaro e Chutando uma Bola com a Cabeça dele...E aí Pode? Não Entendo..",,2023-06-08 14:30:59.042835
youtube#commentThread,dciyDFjUtyQs-j5KiEvUc5Bvah0,Ugyxac9yzfs1fOOyXWx4AaABAg,"{'videoId': 'MROCrmFWHjY', 'topLevelComment': {'kind': 'youtube#comment', 'etag': 'l_0a3c7wGA7CDmpDX-5o3JQf4XQ', 'id': 'Ugyxac9yzfs1fOOyXWx4AaABAg', 'snippet': {'videoId': 'MROCrmFWHjY', 'textDisplay': 'Vou te dizer!Acho que ele errou em atirar!Mas o que ele falou dela é bem verdade!', 'textOriginal': 'Vou te dizer!Acho que ele errou em atirar!Mas o que ele falou dela é bem verdade!', 'authorDisplayName': 'Silvana Mara Cicotti', 'authorProfileImageUrl': 'https://yt3.ggpht.com/ytc/AGIKgqNlNz-BKslbvz4PP5bQHC2mi5W6pH58hf18fw=s48-c-k-c0x00ffffff-no-rj', 'authorChannelUrl': 'http://www.youtube.com/channel/UC-GeqIn2x1GhgYdBVxq1qnA', 'authorChannelId': {'value': 'UC-GeqIn2x1GhgYdBVxq1qnA'}, 'canRate': True, 'viewerRating': 'none', 'likeCount': 4, 'publishedAt': '2022-10-27T02:47:21Z', 'updatedAt': '2022-10-27T02:47:21Z'}}, 'canReply': True, 'totalReplyCount': 0, 'isPublic': True}",,UC-GeqIn2x1GhgYdBVxq1qnA,2022-10-27T02:47:21Z,Vou te dizer!Acho que ele errou em atirar!Mas o que ele falou dela é bem verdade!,,2023-06-08 14:30:59.042835
youtube#commentThread,5M9pelSZtzyPRxFdIG4af8nShxg,UgzIAc2qqCQYoEL52x14AaABAg,"{'videoId': 'MROCrmFWHjY', 'topLevelComment': {'kind': 'youtube#comment', 'etag': 'cb2UYw54xSnFTNaTdav8hi5JT50', 'id': 'UgzIAc2qqCQYoEL52x14AaABAg', 'snippet': {'videoId': 'MROCrmFWHjY', 'textDisplay': 'Ministra 😱😱😱', 'textOriginal': 'Ministra 😱😱😱', 'authorDisplayName': 'Cilene Avelina', 'authorProfileImageUrl': 'https://yt3.ggpht.com/ytc/AGIKgqPuaNJUBei-Dr0vAV2iqNGE0RWL9NMkP487SQ=s48-c-k-c0x00ffffff-no-rj', 'authorChannelUrl': 'http://www.youtube.com/channel/UCNI6iJvqmSSp5dWA1H3y9Og', 'authorChannelId': {'value': 'UCNI6iJvqmSSp5dWA1H3y9Og'}, 'canRate': True, 'viewerRating': 'none', 'likeCount': 1, 'publishedAt': '2022-10-27T02:47:15Z', 'updatedAt': '2022-10-27T02:47:15Z'}}, 'canReply': True, 'totalReplyCount': 0, 'isPublic': True}",,UCNI6iJvqmSSp5dWA1H3y9Og,2022-10-27T02:47:15Z,Ministra 😱😱😱,,2023-06-08 14:30:59.042835
youtube#commentThread,9EG0J-3dM8e2ovX4Q3WTFUmuAys,UgypTvI7SNzgJfJZm5V4AaABAg,"{'videoId': 'MROCrmFWHjY', 'topLevelComment': {'kind': 'youtube#comment', 'etag': 'z0FHU7VADKe8Xsg7d1prVK88Bm8', 'id': 'UgypTvI7SNzgJfJZm5V4AaABAg', 'snippet': {'videoId': 'MROCrmFWHjY', 'textDisplay': 'KKKKKKKKKKKKKKKKKKKKKKKKKKK... DESCULPA... NÃO RESISTI', 'textOriginal': 'KKKKKKKKKKKKKKKKKKKKKKKKKKK... DESCULPA... NÃO RESISTI', 'authorDisplayName': 'Odair Azedo', 'authorProfileImageUrl': 'https://yt3.ggpht.com/ytc/AGIKgqNu7lqWnL9fNGOtH-XOiqPl19HkY7rVD_-Rbw=s48-c-k-c0x00ffffff-no-rj', 'authorChannelUrl': 'http://www.youtube.com/channel/UCLGjdmRRxHA966_EkHGDsTQ', 'authorChannelId': {'value': 'UCLGjdmRRxHA966_EkHGDsTQ'}, 'canRate': True, 'viewerRating': 'none', 'likeCount': 0, 'publishedAt': '2022-10-27T02:47:10Z', 'updatedAt': '2022-10-27T02:47:53Z'}}, 'canReply': True, 'totalReplyCount': 0, 'isPublic': True}",,UCLGjdmRRxHA966_EkHGDsTQ,2022-10-27T02:47:10Z,KKKKKKKKKKKKKKKKKKKKKKKKKKK... DESCULPA... NÃO RESISTI,,2023-06-08 14:30:59.042835
youtube#commentThread,qNzfRwuzeXJqNDmJmec6DFTU_ik,Ugxc2FbMlu5b-wrUDht4AaABAg,"{'videoId': 'MROCrmFWHjY', 'topLevelComment': {'kind': 'youtube#comment', 'etag': '_E2FWn43YYyeSieYtNfFrRKYLXE', 'id': 'Ugxc2FbMlu5b-wrUDht4AaABAg', 'snippet': {'videoId': 'MROCrmFWHjY', 'textDisplay': 'Roberto Jefferson,no passado apoiou Alckmin e Serra', 'textOriginal': 'Roberto Jefferson,no passado apoiou Alckmin e Serra', 'authorDisplayName': 'Cesar Santos', 'authorProfileImageUrl': 'https://yt3.ggpht.com/ytc/AGIKgqNOW_YAdlM14hul0RbbRqybk5Yux38IFntsVA=s48-c-k-c0x00ffffff-no-rj', 'authorChannelUrl': 'http://www.youtube.com/channel/UCL-SyvrHgtRNgTGa0JA2frg', 'authorChannelId': {'value': 'UCL-SyvrHgtRNgTGa0JA2frg'}, 'canRate': True, 'viewerRating': 'none', 'likeCount': 1, 'publishedAt': '2022-10-27T02:46:42Z', 'updatedAt': '2022-10-27T02:46:42Z'}}, 'canReply': True, 'totalReplyCount': 1, 'isPublic': True}","{'comments': [{'kind': 'youtube#comment', 'etag': 'zE6H2ZHCjzy3pEC60Cz1PFqO0UU', 'id': 'Ugxc2FbMlu5b-wrUDht4AaABAg.9hfMohQOoiD9hfPCIbNlV9', 'snippet': {'videoId': 'MROCrmFWHjY', 'textDisplay': 'Sim, mas gracas a ele com a denuncia de corrupcao do Mensalao,  consequentemente,  nascendo entao  a lavajato  e  muitos dos colarinhos broncos foram presos.  Acho que eles nao queriam  que ele terminasse como heroi, por isso a perseguicao. Revanche?????', 'textOriginal': 'Sim, mas gracas a ele com a denuncia de corrupcao do Mensalao,  consequentemente,  nascendo entao  a lavajato  e  muitos dos colarinhos broncos foram presos.  Acho que eles nao queriam  que ele terminasse como heroi, por isso a perseguicao. Revanche?????', 'parentId': 'Ugxc2FbMlu5b-wrUDht4AaABAg', 'authorDisplayName': 'Cira Cammarano', 'authorProfileImageUrl': 'https://yt3.ggpht.com/ytc/AGIKgqP1STIMaBnHxNZTiqHEyQCngoKOGBohx56lMA=s48-c-k-c0x00ffffff-no-rj', 'authorChannelUrl': 'http://www.youtube.com/channel/UCHmrWAjcHXacQ6g_FhN7WAw', 'authorChannelId': {'value': 'UCHmrWAjcHXacQ6g_FhN7WAw'}, 'canRate': True, 'viewerRating': 'none', 'likeCount': 1, 'publishedAt': '2022-10-27T03:07:32Z', 'updatedAt': '2022-10-27T03:08:49Z'}}]}",UCL-SyvrHgtRNgTGa0JA2frg,2022-10-27T02:46:42Z,"Roberto Jefferson,no passado apoiou Alckmin e Serra",,2023-06-08 14:30:59.042835
youtube#commentThread,Rk0VhS-CsVJvcCgY3SUy5fomuFY,UgyE98sER6k5m9HZi_h4AaABAg,"{'videoId': 'MROCrmFWHjY', 'topLevelComment': {'kind': 'youtube#comment', 'etag': 'uL6c4nCMY9uVd0Yu4ilSNpJSRHw', 'id': 'UgyE98sER6k5m9HZi_h4AaABAg', 'snippet': {'videoId': 'MROCrmFWHjY', 'textDisplay': 'A sociedade tem k encontrar maneiras...seja a limpeza deste STF através do 142...ou nosso senado tomar vergonha na sua cara através de Rodrigo paxeco  se virar e ou tirar de lá estes  nove vampiros da nossa nação o mais urgente possível...sendo o primeiro deles o cabeça pelada(pcc)...segundo Gilmar com levandosk tbem desapareçam....e vão lá pra Venezuela com os outros sete viverem com maduro...rsrsrs', 'textOriginal': 'A sociedade tem k encontrar maneiras...seja a limpeza deste STF através do 142...ou nosso senado tomar vergonha na sua cara através de Rodrigo paxeco  se virar e ou tirar de lá estes  nove vampiros da nossa nação o mais urgente possível...sendo o primeiro deles o cabeça pelada(pcc)...segundo Gilmar com levandosk tbem desapareçam....e vão lá pra Venezuela com os outros sete viverem com maduro...rsrsrs', 'authorDisplayName': 'Edezio Do Carmo Pereira', 'authorProfileImageUrl': 'https://yt3.ggpht.com/ytc/AGIKgqP_3v54C1_rnJ0O_dAYFThuxlQ2WrSIgjdJAi8i=s48-c-k-c0x00ffffff-no-rj', 'authorChannelUrl': 'http://www.youtube.com/channel/UCg1SfC0pkwiBVEIvFURpXYw', 'authorChannelId': {'value': 'UCg1SfC0pkwiBVEIvFURpXYw'}, 'canRate': True, 'viewerRating': 'none', 'likeCount': 0, 'publishedAt': '2022-10-27T02:46:04Z', 'updatedAt': '2022-10-27T02:49:38Z'}}, 'canReply': True, 'totalReplyCount': 0, 'isPublic': True}",,UCg1SfC0pkwiBVEIvFURpXYw,2022-10-27T02:46:04Z,A sociedade tem k encontrar maneiras...seja a limpeza deste STF através do 142...ou nosso senado tomar vergonha na sua cara através de Rodrigo paxeco  se virar e ou tirar de lá estes  nove vampiros da nossa nação o mais urgente possível...sendo o primeiro deles o cabeça pelada(pcc)...segundo Gilmar com levandosk tbem desapareçam....e vão lá pra Venezuela com os outros sete viverem com maduro...rsrsrs,,2023-06-08 14:30:59.042835
youtube#commentThread,cPcHib245Dic9_xsvFbve9T83fE,UgzpoHNitqwhdyc9sEt4AaABAg,"{'videoId': 'MROCrmFWHjY', 'topLevelComment': {'kind': 'youtube#comment', 'etag': 'WpPKGDRag9HDB5W9g5SCty3EkVQ', 'id': 'UgzpoHNitqwhdyc9sEt4AaABAg', 'snippet': {'videoId': 'MROCrmFWHjY', 'textDisplay': 'Vergonha STF', 'textOriginal': 'Vergonha STF', 'authorDisplayName': 'Vilma Lmc', 'authorProfileImageUrl': 'https://yt3.ggpht.com/ytc/AGIKgqO0zOoDq40tL4YyT4asLCpRFUSoo6GgFZgutiE-mt8=s48-c-k-c0x00ffffff-no-rj', 'authorChannelUrl': 'http://www.youtube.com/channel/UCEAH5wNEA8omIjMVTaPZtPg', 'authorChannelId': {'value': 'UCEAH5wNEA8omIjMVTaPZtPg'}, 'canRate': True, 'viewerRating': 'none', 'likeCount': 10, 'publishedAt': '2022-10-27T02:46:02Z', 'updatedAt': '2022-10-27T02:46:02Z'}}, 'canReply': True, 'totalReplyCount': 0, 'isPublic': True}",,UCEAH5wNEA8omIjMVTaPZtPg,2022-10-27T02:46:02Z,Vergonha STF,,2023-06-08 14:30:59.042835
youtube#commentThread,bHHKhzBdpCsCDQBW1JpUYdPfSEE,UgzBmCLgqr1HcZnfVaV4AaABAg,"{'videoId': 'MROCrmFWHjY', 'topLevelComment': {'kind': 'youtube#comment', 'etag': 'hjYZo3IoxlQrIMFe2JvftwyhIBs', 'id': 'UgzBmCLgqr1HcZnfVaV4AaABAg', 'snippet': {'videoId': 'MROCrmFWHjY', 'textDisplay': 'STF faz militância política de esquerda.', 'textOriginal': 'STF faz militância política de esquerda.', 'authorDisplayName': 'Ronaldo Thomaz', 'authorProfileImageUrl': 'https://yt3.ggpht.com/ytc/AGIKgqPd8YqTe1Ygy5QmBwtE_85KXqGiRsv60DwhgQ=s48-c-k-c0x00ffffff-no-rj', 'authorChannelUrl': 'http://www.youtube.com/channel/UCJElfS-bpSGQMN8FukLVXlQ', 'authorChannelId': {'value': 'UCJElfS-bpSGQMN8FukLVXlQ'}, 'canRate': True, 'viewerRating': 'none', 'likeCount': 0, 'publishedAt': '2022-10-27T02:44:36Z', 'updatedAt': '2022-10-27T02:44:36Z'}}, 'canReply': True, 'totalReplyCount': 0, 'isPublic': True}",,UCJElfS-bpSGQMN8FukLVXlQ,2022-10-27T02:44:36Z,STF faz militância política de esquerda.,,2023-06-08 14:30:59.042835
youtube#commentThread,vBYQZ-IJbXD_K_ZP_vPZT3Y6mqs,UgzjyCrA7qFrOOgqBBh4AaABAg,"{'videoId': 'MROCrmFWHjY', 'topLevelComment': {'kind': 'youtube#comment', 'etag': '_9bRHdzO-5tYmyQS14lkUb03Rs8', 'id': 'UgzjyCrA7qFrOOgqBBh4AaABAg', 'snippet': {'videoId': 'MROCrmFWHjY', 'textDisplay': 'PISAR ROUPAS E LINGERI DÊ UMA SENHORA CUJO MARIDO É UM PRESO POLÍTICO PERSEGUIDO POR UM JUIZ QUÊ DESCONHECE À CONSTITUIÇÃO FEDERAL DO BRASIL ???. ESSE SÉRIA UM CASO À SER ESTUDADO À PARTE.', 'textOriginal': 'PISAR ROUPAS E LINGERI DÊ UMA SENHORA CUJO MARIDO É UM PRESO POLÍTICO PERSEGUIDO POR UM JUIZ QUÊ DESCONHECE À CONSTITUIÇÃO FEDERAL DO BRASIL ???. ESSE SÉRIA UM CASO À SER ESTUDADO À PARTE.', 'authorDisplayName': 'Aureo Sampaio', 'authorProfileImageUrl': 'https://yt3.ggpht.com/ytc/AGIKgqNUoE75lhaKURMg3On0AW_zTXyF1WifD6twIg=s48-c-k-c0x00ffffff-no-rj', 'authorChannelUrl': 'http://www.youtube.com/channel/UCKuSrSsC9I1wp2_8ub_lZ3A', 'authorChannelId': {'value': 'UCKuSrSsC9I1wp2_8ub_lZ3A'}, 'canRate': True, 'viewerRating': 'none', 'likeCount': 0, 'publishedAt': '2022-10-27T02:44:28Z', 'updatedAt': '2022-10-27T02:44:28Z'}}, 'canReply': True, 'totalReplyCount': 0, 'isPublic': True}",,UCKuSrSsC9I1wp2_8ub_lZ3A,2022-10-27T02:44:28Z,PISAR ROUPAS E LINGERI DÊ UMA SENHORA CUJO MARIDO É UM PRESO POLÍTICO PERSEGUIDO POR UM JUIZ QUÊ DESCONHECE À CONSTITUIÇÃO FEDERAL DO BRASIL ???. ESSE SÉRIA UM CASO À SER ESTUDADO À PARTE.,,2023-06-08 14:30:59.042835
youtube#commentThread,POYn2zx1Qpjl-6B7bxeMlxxA8NU,UgzBHc93u6z509FLB8N4AaABAg,"{'videoId': 'MROCrmFWHjY', 'topLevelComment': {'kind': 'youtube#comment', 'etag': 'uWiN1dE_Ua5NzHGrpn78rwUsCZs', 'id': 'UgzBHc93u6z509FLB8N4AaABAg', 'snippet': {'videoId': 'MROCrmFWHjY', 'textDisplay': 'Essa Carmem Lúcia 🤮', 'textOriginal': 'Essa Carmem Lúcia 🤮', 'authorDisplayName': 'Yuni Cham', 'authorProfileImageUrl': 'https://yt3.ggpht.com/ytc/AGIKgqMsfsUclgVEcwP_VElffJz17vu5MGg0Do-FHnM0bQ=s48-c-k-c0x00ffffff-no-rj', 'authorChannelUrl': 'http://www.youtube.com/channel/UCMcbLWDHfUAWuNJIFOx8OzQ', 'authorChannelId': {'value': 'UCMcbLWDHfUAWuNJIFOx8OzQ'}, 'canRate': True, 'viewerRating': 'none', 'likeCount': 1, 'publishedAt': '2022-10-27T02:44:19Z', 'updatedAt': '2022-10-27T02:44:19Z'}}, 'canReply': True, 'totalReplyCount': 0, 'isPublic': True}",,UCMcbLWDHfUAWuNJIFOx8OzQ,2022-10-27T02:44:19Z,Essa Carmem Lúcia 🤮,,2023-06-08 14:30:59.042835
youtube#commentThread,BwcmzhmYYGfy26wkcW-4Sbvgag0,Ugwfc6m7XDAGYojwH3B4AaABAg,"{'videoId': 'MROCrmFWHjY', 'topLevelComment': {'kind': 'youtube#comment', 'etag': 'ttAC8RsnbMNmuD50K1IAp3EBINQ', 'id': 'Ugwfc6m7XDAGYojwH3B4AaABAg', 'snippet': {'videoId': 'MROCrmFWHjY', 'textDisplay': 'O CANDIDATO DE VCS QUE NÂO SABE TRATAR AS PESSOAS COM RESPEITO  MALTRATA O SER HUMANO É UM MOSTRO', 'textOriginal': 'O CANDIDATO DE VCS QUE NÂO SABE TRATAR AS PESSOAS COM RESPEITO  MALTRATA O SER HUMANO É UM MOSTRO', 'authorDisplayName': 'Joedina', 'authorProfileImageUrl': 'https://yt3.ggpht.com/ytc/AGIKgqMXzPZ1rHJ65gCoPUhkczEeOHI-foEjCHnvpbIAoyLcVS16lHZLU8tqT9M54VTo=s48-c-k-c0x00ffffff-no-rj', 'authorChannelUrl': 'http://www.youtube.com/channel/UCVV4EJ1mw17h3VnQJUd1oFQ', 'authorChannelId': {'value': 'UCVV4EJ1mw17h3VnQJUd1oFQ'}, 'canRate': True, 'viewerRating': 'none', 'likeCount': 0, 'publishedAt': '2022-10-27T02:44:03Z', 'updatedAt': '2022-10-27T02:44:03Z'}}, 'canReply': True, 'totalReplyCount': 0, 'isPublic': True}",,UCVV4EJ1mw17h3VnQJUd1oFQ,2022-10-27T02:44:03Z,O CANDIDATO DE VCS QUE NÂO SABE TRATAR AS PESSOAS COM RESPEITO  MALTRATA O SER HUMANO É UM MOSTRO,,2023-06-08 14:30:59.042835
youtube#commentThread,HyOiWUUt-NdlAjOHqdrDPUeScdE,UgxxtTCdTOkcUw2s9XB4AaABAg,"{'videoId': 'MROCrmFWHjY', 'topLevelComment': {'kind': 'youtube#comment', 'etag': 'N6hhGJzx5W-HPnhgNRJkZnavlbM', 'id': 'UgxxtTCdTOkcUw2s9XB4AaABAg', 'snippet': {'videoId': 'MROCrmFWHjY', 'textDisplay': 'Quem desarma a população a fragiliza praque motivo,deixar caminho aberto pra ocupação do comunismo, Povo desarmado facilmente será subjugados .', 'textOriginal': 'Quem desarma a população a fragiliza praque motivo,deixar caminho aberto pra ocupação do comunismo, Povo desarmado facilmente será subjugados .', 'authorDisplayName': 'Carlos Da Silva', 'authorProfileImageUrl': 'https://yt3.ggpht.com/ytc/AGIKgqOHN5DT3vsShgiN0J-ksDTPN00dd8saVh8_ZQ=s48-c-k-c0x00ffffff-no-rj', 'authorChannelUrl': 'http://www.youtube.com/channel/UCfrIzMU1yC8i5B9wumLRMTg', 'authorChannelId': {'value': 'UCfrIzMU1yC8i5B9wumLRMTg'}, 'canRate': True, 'viewerRating': 'none', 'likeCount': 1, 'publishedAt': '2022-10-27T02:43:56Z', 'updatedAt': '2022-10-27T02:43:56Z'}}, 'canReply': True, 'totalReplyCount': 0, 'isPublic': True}",,UCfrIzMU1yC8i5B9wumLRMTg,2022-10-27T02:43:56Z,"Quem desarma a população a fragiliza praque motivo,deixar caminho aberto pra ocupação do comunismo, Povo desarmado facilmente será subjugados .",,2023-06-08 14:30:59.042835
youtube#commentThread,Pv-rn_MVE2uQw6nY0HKdkiARA3g,UgzUMNGFDSA7wEHgVbh4AaABAg,"{'videoId': 'MROCrmFWHjY', 'topLevelComment': {'kind': 'youtube#comment', 'etag': 'D2_GAJ5V01TrPnq5FZH9MoQHV8s', 'id': 'UgzUMNGFDSA7wEHgVbh4AaABAg', 'snippet': {'videoId': 'MROCrmFWHjY', 'textDisplay': 'Este sr deve estar diente mental . Só pode!!!', 'textOriginal': 'Este sr deve estar diente mental . Só pode!!!', 'authorDisplayName': 'Antônio Reis', 'authorProfileImageUrl': 'https://yt3.ggpht.com/ytc/AGIKgqMDNk3QdqYXTtmlh_8I2YnGLZFWXb6ZoV4yOQ=s48-c-k-c0x00ffffff-no-rj', 'authorChannelUrl': 'http://www.youtube.com/channel/UCVxYZ6nW2OSxmDXkLiuK5pw', 'authorChannelId': {'value': 'UCVxYZ6nW2OSxmDXkLiuK5pw'}, 'canRate': True, 'viewerRating': 'none', 'likeCount': 0, 'publishedAt': '2022-10-27T02:43:47Z', 'updatedAt': '2022-10-27T02:43:47Z'}}, 'canReply': True, 'totalReplyCount': 0, 'isPublic': True}",,UCVxYZ6nW2OSxmDXkLiuK5pw,2022-10-27T02:43:47Z,Este sr deve estar diente mental . Só pode!!!,,2023-06-08 14:30:59.042835
youtube#commentThread,3iPEQmMFgmhjnDBJY8D_JtHOVek,UgyW3C5XLEB5pvF4E7h4AaABAg,"{'videoId': 'MROCrmFWHjY', 'topLevelComment': {'kind': 'youtube#comment', 'etag': 'g0HOQxd8BauaBV7hzpxBDnRJ_EM', 'id': 'UgyW3C5XLEB5pvF4E7h4AaABAg', 'snippet': {'videoId': 'MROCrmFWHjY', 'textDisplay': 'ARTIGO 142 🇧🇷 NÃO VAMOS ACEITAR OUTRO RESULTADO NAS URNAS E BOLSONARO REELEITO 🇧🇷 22 DEUS FAMÍLIA PÁTRIA NOSSA BANDEIRA NUNCA SERÁ VERMELHA. O SUPREMO TRIBUNAL FEDERAL O BRASIL SO TEM UM CAMINHO ARTIGO 142🇧🇷  ARTIGO 142 🇧🇷', 'textOriginal': 'ARTIGO 142 🇧🇷 NÃO VAMOS ACEITAR OUTRO RESULTADO NAS URNAS E BOLSONARO REELEITO 🇧🇷 22 DEUS FAMÍLIA PÁTRIA NOSSA BANDEIRA NUNCA SERÁ VERMELHA. O SUPREMO TRIBUNAL FEDERAL O BRASIL SO TEM UM CAMINHO ARTIGO 142🇧🇷  ARTIGO 142 🇧🇷', 'authorDisplayName': 'Paulo Henrique', 'authorProfileImageUrl': 'https://yt3.ggpht.com/ytc/AGIKgqO_hG4ryye0PbdI_q79iSuA-1PqFInJM-JkHA=s48-c-k-c0x00ffffff-no-rj', 'authorChannelUrl': 'http://www.youtube.com/channel/UCrzdbQ7Wx1KC6M8Co4nQ8Rw', 'authorChannelId': {'value': 'UCrzdbQ7Wx1KC6M8Co4nQ8Rw'}, 'canRate': True, 'viewerRating': 'none', 'likeCount': 4, 'publishedAt': '2022-10-27T02:43:39Z', 'updatedAt': '2022-10-27T02:43:39Z'}}, 'canReply': True, 'totalReplyCount': 0, 'isPublic': True}",,UCrzdbQ7Wx1KC6M8Co4nQ8Rw,2022-10-27T02:43:39Z,ARTIGO 142 🇧🇷 NÃO VAMOS ACEITAR OUTRO RESULTADO NAS URNAS E BOLSONARO REELEITO 🇧🇷 22 DEUS FAMÍLIA PÁTRIA NOSSA BANDEIRA NUNCA SERÁ VERMELHA. O SUPREMO TRIBUNAL FEDERAL O BRASIL SO TEM UM CAMINHO ARTIGO 142🇧🇷  ARTIGO 142 🇧🇷,,2023-06-08 14:30:59.042835
youtube#commentThread,6KLQW2qG9EAn4ARR0K7zebEWrXU,UgzmFFtrdkEGpsnhXzl4AaABAg,"{'videoId': 'MROCrmFWHjY', 'topLevelComment': {'kind': 'youtube#comment', 'etag': 'h9zftVUfrHoStY1gJ3yJleaJoQQ', 'id': 'UgzmFFtrdkEGpsnhXzl4AaABAg', 'snippet': {'videoId': 'MROCrmFWHjY', 'textDisplay': 'BOLSONARO REELEITO PARA A NOSSA LIBERDADE 2️⃣2️⃣🗽🗽🗽🗽🗽🗽🗽🗽🇧🇷🇧🇷🇧🇷🇧🇷🇧🇷', 'textOriginal': 'BOLSONARO REELEITO PARA A NOSSA LIBERDADE 2️⃣2️⃣🗽🗽🗽🗽🗽🗽🗽🗽🇧🇷🇧🇷🇧🇷🇧🇷🇧🇷', 'authorDisplayName': 'Edina Segundo', 'authorProfileImageUrl': 'https://yt3.ggpht.com/ytc/AGIKgqOz676dnnHPcK9Q5ituPHrO06_Ms7pPgEymY8P_Pnw=s48-c-k-c0x00ffffff-no-rj', 'authorChannelUrl': 'http://www.youtube.com/channel/UCCp6-Fz6lqWwv-R4x2JiJHQ', 'authorChannelId': {'value': 'UCCp6-Fz6lqWwv-R4x2JiJHQ'}, 'canRate': True, 'viewerRating': 'none', 'likeCount': 4, 'publishedAt': '2022-10-27T02:43:10Z', 'updatedAt': '2022-10-27T02:43:10Z'}}, 'canReply': True, 'totalReplyCount': 1, 'isPublic': True}","{'comments': [{'kind': 'youtube#comment', 'etag': '4Yy46B2BLIwo09z2P2kqSqPm1fU', 'id': 'UgzmFFtrdkEGpsnhXzl4AaABAg.9hfMPsjw-7B9hfNyG8WluQ', 'snippet': {'videoId': 'MROCrmFWHjY', 'textDisplay': 'quem é seu dono ?', 'textOriginal': 'quem é seu dono ?', 'parentId': 'UgzmFFtrdkEGpsnhXzl4AaABAg', 'authorDisplayName': 'Pablo sá', 'authorProfileImageUrl': 'https://yt3.ggpht.com/ytc/AGIKgqNsFjJe66IJ9kff6pqLssVciU32cP7I7LBSjA=s48-c-k-c0x00ffffff-no-rj', 'authorChannelUrl': 'http://www.youtube.com/channel/UCtWbVlP1mIhN_cZJHxNAy2w', 'authorChannelId': {'value': 'UCtWbVlP1mIhN_cZJHxNAy2w'}, 'canRate': True, 'viewerRating': 'none', 'likeCount': 1, 'publishedAt': '2022-10-27T02:56:44Z', 'updatedAt': '2022-10-27T02:56:44Z'}}]}",UCCp6-Fz6lqWwv-R4x2JiJHQ,2022-10-27T02:43:10Z,BOLSONARO REELEITO PARA A NOSSA LIBERDADE 2️⃣2️⃣🗽🗽🗽🗽🗽🗽🗽🗽🇧🇷🇧🇷🇧🇷🇧🇷🇧🇷,,2023-06-08 14:30:59.042835
youtube#commentThread,QXeG2ddDjQm8swG0k-33hMSD5H8,UgwteArWPkbyvSiYgRl4AaABAg,"{'videoId': 'MROCrmFWHjY', 'topLevelComment': {'kind': 'youtube#comment', 'etag': 'dU79Y6RCNAdsCn3ejOP7gn4pbI0', 'id': 'UgwteArWPkbyvSiYgRl4AaABAg', 'snippet': {'videoId': 'MROCrmFWHjY', 'textDisplay': 'STF FAZ VERGONHA AO BRASIL. SÃO ATIVISTAS', 'textOriginal': 'STF FAZ VERGONHA AO BRASIL. SÃO ATIVISTAS', 'authorDisplayName': 'Cassia Gominho', 'authorProfileImageUrl': 'https://yt3.ggpht.com/ytc/AGIKgqNNbJuv6SLUfZa7u4lVnz2ljr8TzH_SX17l-Q=s48-c-k-c0x00ffffff-no-rj', 'authorChannelUrl': 'http://www.youtube.com/channel/UCfDfmHV7xNz95yqvKPhZdxg', 'authorChannelId': {'value': 'UCfDfmHV7xNz95yqvKPhZdxg'}, 'canRate': True, 'viewerRating': 'none', 'likeCount': 0, 'publishedAt': '2022-10-27T02:42:56Z', 'updatedAt': '2022-10-27T02:42:56Z'}}, 'canReply': True, 'totalReplyCount': 0, 'isPublic': True}",,UCfDfmHV7xNz95yqvKPhZdxg,2022-10-27T02:42:56Z,STF FAZ VERGONHA AO BRASIL. SÃO ATIVISTAS,,2023-06-08 14:30:59.042835
youtube#commentThread,PCxz3Tf2Invqw_try0PWmd5GIu8,UgxcBEymEB9i3I_EcpB4AaABAg,"{'videoId': 'MROCrmFWHjY', 'topLevelComment': {'kind': 'youtube#comment', 'etag': 'iihzB5WmOW_PFmYhDHN7Z2Y-YQw', 'id': 'UgxcBEymEB9i3I_EcpB4AaABAg', 'snippet': {'videoId': 'MROCrmFWHjY', 'textDisplay': 'Cumprir a constituição 🤣🤣🤣🤣🤣🤣.', 'textOriginal': 'Cumprir a constituição 🤣🤣🤣🤣🤣🤣.', 'authorDisplayName': 'Maria José', 'authorProfileImageUrl': 'https://yt3.ggpht.com/etUgE26EfNCukBvfzDCX54RXfpnoai2phwXW7Tgg0UWSkplDtlbGl583uqs4vxuGLfdtNyW_QA=s48-c-k-c0x00ffffff-no-rj', 'authorChannelUrl': 'http://www.youtube.com/channel/UCub3LUgadc8R7RzVRauYrLw', 'authorChannelId': {'value': 'UCub3LUgadc8R7RzVRauYrLw'}, 'canRate': True, 'viewerRating': 'none', 'likeCount': 2, 'publishedAt': '2022-10-27T02:42:05Z', 'updatedAt': '2022-10-27T02:42:05Z'}}, 'canReply': True, 'totalReplyCount': 0, 'isPublic': True}",,UCub3LUgadc8R7RzVRauYrLw,2022-10-27T02:42:05Z,Cumprir a constituição 🤣🤣🤣🤣🤣🤣.,,2023-06-08 14:30:59.042835
