kind,etag,id,snippet,replies,authorChannelId,publishedAt,textOriginal,nextPageToken,extraction_date
youtube#commentThread,sDmNYos5JKXoH_lQTECCmYPyCbI,Ugy8UTJdtn4xPucASZ94AaABAg,"{'videoId': 'MROCrmFWHjY', 'topLevelComment': {'kind': 'youtube#comment', 'etag': '98yn6Gb1ra8CV9mO7lTkSu_ypZI', 'id': 'Ugy8UTJdtn4xPucASZ94AaABAg', 'snippet': {'videoId': 'MROCrmFWHjY', 'textDisplay': 'Nos os brasileiros temos o dever de irmos dia 30 votar e fotografar akele papelzinho k nos dão kando votamos e escrevermos nele 22 e jogar nas redes...aí é nosso comprovante destes ladrões k kerem sequestrar nosso voto e nossa democracia... cabeça de ovo maldita...rsrsrsrs', 'textOriginal': 'Nos os brasileiros temos o dever de irmos dia 30 votar e fotografar akele papelzinho k nos dão kando votamos e escrevermos nele 22 e jogar nas redes...aí é nosso comprovante destes ladrões k kerem sequestrar nosso voto e nossa democracia... cabeça de ovo maldita...rsrsrsrs', 'authorDisplayName': 'Edezio Do Carmo Pereira', 'authorProfileImageUrl': 'https://yt3.ggpht.com/ytc/AGIKgqP_3v54C1_rnJ0O_dAYFThuxlQ2WrSIgjdJAi8i=s48-c-k-c0x00ffffff-no-rj', 'authorChannelUrl': 'http://www.youtube.com/channel/UCg1SfC0pkwiBVEIvFURpXYw', 'authorChannelId': {'value': 'UCg1SfC0pkwiBVEIvFURpXYw'}, 'canRate': True, 'viewerRating': 'none', 'likeCount': 0, 'publishedAt': '2022-10-27T03:00:58Z', 'updatedAt': '2022-10-27T03:00:58Z'}}, 'canReply': True, 'totalReplyCount': 0, 'isPublic': True}",,UCg1SfC0pkwiBVEIvFURpXYw,2022-10-27T03:00:58Z,Nos os brasileiros temos o dever de irmos dia 30 votar e fotografar akele papelzinho k nos dão kando votamos e escrevermos nele 22 e jogar nas redes...aí é nosso comprovante destes ladrões k kerem sequestrar nosso voto e nossa democracia... cabeça de ovo maldita...rsrsrsrs,,2023-06-08 14:30:59.042835
youtube#commentThread,jxygtVYxvCGclbvLOj2ZMdl6ik0,UgxKPeKppRQ9Ffsx8DJ4AaABAg,"{'videoId': 'MROCrmFWHjY', 'topLevelComment': {'kind': 'youtube#comment', 'etag': 'foWzfh50m9z03VhU55cMEkT01dk', 'id': 'UgxKPeKppRQ9Ffsx8DJ4AaABAg', 'snippet': {'videoId': 'MROCrmFWHjY', 'textDisplay': 'Ministro. Solta.  Bandido.   E.  <br>Democracia.   Di.  Tirano. Voceis.  <br>E. Umavergoonha. Não são     todos', 'textOriginal': 'Ministro. Solta.  Bandido.   E.  \\nDemocracia.   Di.  Tirano. Voceis.  \\nE. Umavergoonha. Não são     todos', 'authorDisplayName': 'João Correia', 'authorProfileImageUrl': 'https://yt3.ggpht.com/ytc/AGIKgqMSc4yzw8kjdg9bC0UwNpVptBwthmjsAumDBCqPXdauJItnIrdXWSl8cDI3cfPV=s48-c-k-c0x00ffffff-no-rj', 'authorChannelUrl': 'http://www.youtube.com/channel/UCbLw4DHctuypWNXF8_pkI8A', 'authorChannelId': {'value': 'UCbLw4DHctuypWNXF8_pkI8A'}, 'canRate': True, 'viewerRating': 'none', 'likeCount': 0, 'publishedAt': '2022-10-27T02:59:48Z', 'updatedAt': '2022-10-27T02:59:48Z'}}, 'canReply': True, 'totalReplyCount': 0, 'isPublic': True}",,UCbLw4DHctuypWNXF8_pkI8A,2022-10-27T02:59:48Z,"Ministro. Solta.  Bandido.   E.  
Democracia.   Di.  Tirano. Voceis.  
E. Umavergoonha. Não são     todos",,2023-06-08 14:30:59.042835
youtube#commentThread,Cin-l6qNgl6_ur3azq6HyQpbATI,Ugy3yeAbTlFOsVXOFAF4AaABAg,"{'videoId': 'MROCrmFWHjY', 'topLevelComment': {'kind': 'youtube#comment', 'etag': '-I2aIKDoNmFgc8rUCuj3dBciBFc', 'id': 'Ugy3yeAbTlFOsVXOFAF4AaABAg', 'snippet': {'videoId': 'MROCrmFWHjY', 'textDisplay': 'E o mst fisicamente atacar o edifício dela em BH, isso está tudo OK', 'textOriginal': 'E o mst fisicamente atacar o edifício dela em BH, isso está tudo OK', 'authorDisplayName': 'Bernhard Jordan', 'authorProfileImageUrl': 'https://yt3.ggpht.com/ytc/AGIKgqNmaMKilS6HtHbnQMFEdyPUfWa9MMG8i4_S0w=s48-c-k-c0x00ffffff-no-rj', 'authorChannelUrl': 'http://www.youtube.com/channel/UCPEO2z2pTZpG8sOd5Tj2QHA', 'authorChannelId': {'value': 'UCPEO2z2pTZpG8sOd5Tj2QHA'}, 'canRate': True, 'viewerRating': 'none', 'likeCount': 1, 'publishedAt': '2022-10-27T02:59:09Z', 'updatedAt': '2022-10-27T02:59:09Z'}}, 'canReply': True, 'totalReplyCount': 0, 'isPublic': True}",,UCPEO2z2pTZpG8sOd5Tj2QHA,2022-10-27T02:59:09Z,"E o mst fisicamente atacar o edifício dela em BH, isso está tudo OK",,2023-06-08 14:30:59.042835
youtube#commentThread,w-9EPlzNeVhs4kQZPrNR1ShwG1s,UgwDl168xtO9hHa8KOZ4AaABAg,"{'videoId': 'MROCrmFWHjY', 'topLevelComment': {'kind': 'youtube#comment', 'etag': 'vLWgSDoVWRFnagRsKJC7RXz9r8M', 'id': 'UgwDl168xtO9hHa8KOZ4AaABAg', 'snippet': {'videoId': 'MROCrmFWHjY', 'textDisplay': 'Supremo é o povo.', 'textOriginal': 'Supremo é o povo.', 'authorDisplayName': 'CHARLES ISMAEL', 'authorProfileImageUrl': 'https://yt3.ggpht.com/ytc/AGIKgqOEtOawwtO836osfQ_PlL4LMlUbqe-ckVcrSw=s48-c-k-c0x00ffffff-no-rj', 'authorChannelUrl': 'http://www.youtube.com/channel/UC1QWob5R4OUhsLQf40jpV4w', 'authorChannelId': {'value': 'UC1QWob5R4OUhsLQf40jpV4w'}, 'canRate': True, 'viewerRating': 'none', 'likeCount': 3, 'publishedAt': '2022-10-27T02:56:35Z', 'updatedAt': '2022-10-27T02:56:35Z'}}, 'canReply': True, 'totalReplyCount': 0, 'isPublic': True}",,UC1QWob5R4OUhsLQf40jpV4w,2022-10-27T02:56:35Z,Supremo é o povo.,,2023-06-08 14:30:59.042835
youtube#commentThread,t2lJw_7QsE_oqUXCSWzlNmtboTQ,UgwihicyQCAX9tTDbcl4AaABAg,"{'videoId': 'MROCrmFWHjY', 'topLevelComment': {'kind': 'youtube#comment', 'etag': 'eDvaB-g3jOzFqBn2vuaHWzrvLrY', 'id': 'UgwihicyQCAX9tTDbcl4AaABAg', 'snippet': {'videoId': 'MROCrmFWHjY', 'textDisplay': 'Essa mulher não merece respeito quando deu voto pra defender um ladrão .....e suja imunda', 'textOriginal': 'Essa mulher não merece respeito quando deu voto pra defender um ladrão .....e suja imunda', 'authorDisplayName': 'Ana Benta Presses', 'authorProfileImageUrl': 'https://yt3.ggpht.com/ytc/AGIKgqNghRrnTMC6aQ99siTtzV0Pd64QeA6eGMP4zw=s48-c-k-c0x00ffffff-no-rj', 'authorChannelUrl': 'http://www.youtube.com/channel/UCCpl2kzGdiEZnKMb2D30J0g', 'authorChannelId': {'value': 'UCCpl2kzGdiEZnKMb2D30J0g'}, 'canRate': True, 'viewerRating': 'none', 'likeCount': 0, 'publishedAt': '2022-10-27T02:56:18Z', 'updatedAt': '2022-10-27T02:56:18Z'}}, 'canReply': True, 'totalReplyCount': 0, 'isPublic': True}",,UCCpl2kzGdiEZnKMb2D30J0g,2022-10-27T02:56:18Z,Essa mulher não merece respeito quando deu voto pra defender um ladrão .....e suja imunda,,2023-06-08 14:30:59.042835
youtube#commentThread,9-7OgOVUsHhtNfnXu3XFL5Lc3kg,UgwuXYgFMIzU52DgnH94AaABAg,"{'videoId': 'MROCrmFWHjY', 'topLevelComment': {'kind': 'youtube#comment', 'etag': 'DPYOVGPS-iHY5JsnLmmvb3kgmTQ', 'id': 'UgwuXYgFMIzU52DgnH94AaABAg', 'snippet': {'videoId': 'MROCrmFWHjY', 'textDisplay': 'O Deputado Ribeiro da União Brasil, cometeu o seguinte crimes:  lei 1.802 artigo 11: fazer Propagandas; de processo violento para a subversão da ordem pública ou social. <br>Artigo 12: incitar diretamente o ânimo deliberado da classe social a luta pela violência até 2 anos de prisão.<br>Artigo 17: instigar publicamente a violência coletiva ao cumprimento da lei e da ordem, até 2 ano de prisão.<br>Esses foi o crime que o funcionário público cometeu. Nessa lei tem um rol descrevendo os crimes do funcionário público.<br>Lamentamos que quando os políticos ganham acham que viraram dono do país e não é.<br>Diante desses crimes que esse funcionário Público Ribeiro da União Brasil, seja cassado, o seu vídeo está espalhado pela internet invitando a população a violência ao não cumprimento da ordem, e publicando os seu incitamento.<br>Que seja cassado por estes crimes, por incitar, fazer propaganda, instigar a violência na população.', 'textOriginal': 'O Deputado Ribeiro da União Brasil, cometeu o seguinte crimes:  lei 1.802 artigo 11: fazer Propagandas; de processo violento para a subversão da ordem pública ou social. \\nArtigo 12: incitar diretamente o ânimo deliberado da classe social a luta pela violência até 2 anos de prisão.\\nArtigo 17: instigar publicamente a violência coletiva ao cumprimento da lei e da ordem, até 2 ano de prisão.\\nEsses foi o crime que o funcionário público cometeu. Nessa lei tem um rol descrevendo os crimes do funcionário público.\\nLamentamos que quando os políticos ganham acham que viraram dono do país e não é.\\nDiante desses crimes que esse funcionário Público Ribeiro da União Brasil, seja cassado, o seu vídeo está espalhado pela internet invitando a população a violência ao não cumprimento da ordem, e publicando os seu incitamento.\\nQue seja cassado por estes crimes, por incitar, fazer propaganda, instigar a violência na população.', 'authorDisplayName': 'Ferreira Brito.', 'authorProfileImageUrl': 'https://yt3.ggpht.com/ytc/AGIKgqOSy4WQTdg7VUWZolctAVu8l_f-QSBkIL_6Lw=s48-c-k-c0x00ffffff-no-rj', 'authorChannelUrl': 'http://www.youtube.com/channel/UCWJsV2U5VkfTTqxBNxuNkJQ', 'authorChannelId': {'value': 'UCWJsV2U5VkfTTqxBNxuNkJQ'}, 'canRate': True, 'viewerRating': 'none', 'likeCount': 1, 'publishedAt': '2022-10-27T02:56:12Z', 'updatedAt': '2022-10-27T02:56:12Z'}}, 'canReply': True, 'totalReplyCount': 0, 'isPublic': True}",,UCWJsV2U5VkfTTqxBNxuNkJQ,2022-10-27T02:56:12Z,"O Deputado Ribeiro da União Brasil, cometeu o seguinte crimes:  lei 1.802 artigo 11: fazer Propagandas; de processo violento para a subversão da ordem pública ou social. 
Artigo 12: incitar diretamente o ânimo deliberado da classe social a luta pela violência até 2 anos de prisão.
Artigo 17: instigar publicamente a violência coletiva ao cumprimento da lei e da ordem, até 2 ano de prisão.
Esses foi o crime que o funcionário público cometeu. Nessa lei tem um rol descrevendo os crimes do funcionário público.
Lamentamos que quando os políticos ganham acham que viraram dono do país e não é.
Diante desses crimes que esse funcionário Público Ribeiro da União Brasil, seja cassado, o seu vídeo está espalhado pela internet invitando a população a violência ao não cumprimento da ordem, e publicando os seu incitamento.
Que seja cassado por estes crimes, por incitar, fazer propaganda, instigar a violência na população.",,2023-06-08 14:30:59.042835
youtube#commentThread,GXfJqa6jS4vM43v4lwQez58bJRU,UgxwkySTb0sQsTbCqTd4AaABAg,"{'videoId': 'MROCrmFWHjY', 'topLevelComment': {'kind': 'youtube#comment', 'etag': 'jsOywmo1NAdqIwBNMLb6is89EZo', 'id': 'UgxwkySTb0sQsTbCqTd4AaABAg', 'snippet': {'videoId': 'MROCrmFWHjY', 'textDisplay': 'Com certeza o RJ não deveria ter falado o que falou, fazer o que fez, e também é certo que essa senhora não tem personalidade, coragem e independência para ocupar o cargo que ocupa.', 'textOriginal': 'Com certeza o RJ não deveria ter falado o que falou, fazer o que fez, e também é certo que essa senhora não tem personalidade, coragem e independência para ocupar o cargo que ocupa.', 'authorDisplayName': 'Ladinor Cherubini', 'authorProfileImageUrl': 'https://yt3.ggpht.com/ytc/AGIKgqPoZsFpQTbtIhjiWJV9WKIR6FYwi3mmdnC8tA=s48-c-k-c0x00ffffff-no-rj', 'authorChannelUrl': 'http://www.youtube.com/channel/UC-_RgDpUALVuVTa0KKg___g', 'authorChannelId': {'value': 'UC-_RgDpUALVuVTa0KKg___g'}, 'canRate': True, 'viewerRating': 'none', 'likeCount': 3, 'publishedAt': '2022-10-27T02:56:01Z', 'updatedAt': '2022-10-27T02:56:01Z'}}, 'canReply': True, 'totalReplyCount': 0, 'isPublic': True}",,UC-_RgDpUALVuVTa0KKg___g,2022-10-27T02:56:01Z,"Com certeza o RJ não deveria ter falado o que falou, fazer o que fez, e também é certo que essa senhora não tem personalidade, coragem e independência para ocupar o cargo que ocupa.",,2023-06-08 14:30:59.042835
youtube#commentThread,aanXUKXOJA-dmySFKjcsTsiD_R8,Ugyah_TDqXMJpTmSRjR4AaABAg,"{'videoId': 'MROCrmFWHjY', 'topLevelComment': {'kind': 'youtube#comment', 'etag': '5QIP-TKnmIbtSHRuJMZIfm19mHI', 'id': 'Ugyah_TDqXMJpTmSRjR4AaABAg', 'snippet': {'videoId': 'MROCrmFWHjY', 'textDisplay': 'O Roberto Jefferson destruiu a reeleição do presidente bolssonaro.  É tem alucinado achando bonito.', 'textOriginal': 'O Roberto Jefferson destruiu a reeleição do presidente bolssonaro.  É tem alucinado achando bonito.', 'authorDisplayName': 'Denis dos Santos Lima', 'authorProfileImageUrl': 'https://yt3.ggpht.com/ytc/AGIKgqNJ0DTtnwZAtEaH3noVe9L1o6pFk9vlf5hdr8mZN31aku3lq7F81jvMXur_FiWs=s48-c-k-c0x00ffffff-no-rj', 'authorChannelUrl': 'http://www.youtube.com/channel/UCqiVvg8RyIcB7K51vV-5VoA', 'authorChannelId': {'value': 'UCqiVvg8RyIcB7K51vV-5VoA'}, 'canRate': True, 'viewerRating': 'none', 'likeCount': 0, 'publishedAt': '2022-10-27T02:55:43Z', 'updatedAt': '2022-10-27T02:55:43Z'}}, 'canReply': True, 'totalReplyCount': 0, 'isPublic': True}",,UCqiVvg8RyIcB7K51vV-5VoA,2022-10-27T02:55:43Z,O Roberto Jefferson destruiu a reeleição do presidente bolssonaro.  É tem alucinado achando bonito.,,2023-06-08 14:30:59.042835
youtube#commentThread,F2VSsIpUX4lA51EtAuW_NziVBZ0,UgwJh_yOi1xKeHY55rl4AaABAg,"{'videoId': 'MROCrmFWHjY', 'topLevelComment': {'kind': 'youtube#comment', 'etag': 'QJ_vK7K8oBSTld92MMxhLU61vrU', 'id': 'UgwJh_yOi1xKeHY55rl4AaABAg', 'snippet': {'videoId': 'MROCrmFWHjY', 'textDisplay': 'Que orgulho em ter uma emissora como a Jovem Pan aqui no Brasil. É a melhor de todas, obg pelos debates com todos os ângulos possíveis', 'textOriginal': 'Que orgulho em ter uma emissora como a Jovem Pan aqui no Brasil. É a melhor de todas, obg pelos debates com todos os ângulos possíveis', 'authorDisplayName': 'Venancio Brandao', 'authorProfileImageUrl': 'https://yt3.ggpht.com/azmAhwsLkUxntTAmHHDgW-LCXsfyh4x0ZVY2jwkBcIupiC-M8kt1brFjLS06ivxiMjBUUPLSKA=s48-c-k-c0x00ffffff-no-rj', 'authorChannelUrl': 'http://www.youtube.com/channel/UChc37C3TbD22LiRMI2N-BRg', 'authorChannelId': {'value': 'UChc37C3TbD22LiRMI2N-BRg'}, 'canRate': True, 'viewerRating': 'none', 'likeCount': 6, 'publishedAt': '2022-10-27T02:55:41Z', 'updatedAt': '2022-10-27T02:55:41Z'}}, 'canReply': True, 'totalReplyCount': 0, 'isPublic': True}",,UChc37C3TbD22LiRMI2N-BRg,2022-10-27T02:55:41Z,"Que orgulho em ter uma emissora como a Jovem Pan aqui no Brasil. É a melhor de todas, obg pelos debates com todos os ângulos possíveis",,2023-06-08 14:30:59.042835
youtube#commentThread,yCWPGNNoSe1GDyLRMxW37TvYEME,Ugyao2_ZgOdXuQ7JD0l4AaABAg,"{'videoId': 'MROCrmFWHjY', 'topLevelComment': {'kind': 'youtube#comment', 'etag': '9XeHOiQ7PG-bKDn2D4RHBCqCGCw', 'id': 'Ugyao2_ZgOdXuQ7JD0l4AaABAg', 'snippet': {'videoId': 'MROCrmFWHjY', 'textDisplay': 'Esta Provado por Calarmen Lucia, la izquierda no es una idiologia politica, la izquierda es una enfermedad MENTAL. FIN', 'textOriginal': 'Esta Provado por Calarmen Lucia, la izquierda no es una idiologia politica, la izquierda es una enfermedad MENTAL. FIN', 'authorDisplayName': 'Carlo Larosa', 'authorProfileImageUrl': 'https://yt3.ggpht.com/ytc/AGIKgqOF4X7kQ5plaWhpz7dS-c0Shf8T7Lf52V-WckjG5ag=s48-c-k-c0x00ffffff-no-rj', 'authorChannelUrl': 'http://www.youtube.com/channel/UCiGSqDFb5eNniKzBtpJ2TAw', 'authorChannelId': {'value': 'UCiGSqDFb5eNniKzBtpJ2TAw'}, 'canRate': True, 'viewerRating': 'none', 'likeCount': 0, 'publishedAt': '2022-10-27T02:53:24Z', 'updatedAt': '2022-10-27T02:53:24Z'}}, 'canReply': True, 'totalReplyCount': 0, 'isPublic': True}",,UCiGSqDFb5eNniKzBtpJ2TAw,2022-10-27T02:53:24Z,"Esta Provado por Calarmen Lucia, la izquierda no es una idiologia politica, la izquierda es una enfermedad MENTAL. FIN",,2023-06-08 14:30:59.042835
youtube#commentThread,gSOY_S1sGDybuzp8xxMBNtXw_3M,Ugy7FsRkbGwKhmzQQG94AaABAg,"{'videoId': 'MROCrmFWHjY', 'topLevelComment': {'kind': 'youtube#comment', 'etag': 'tygyepw2rMUGLwPHTF6_oauD7AQ', 'id': 'Ugy7FsRkbGwKhmzQQG94AaABAg', 'snippet': {'videoId': 'MROCrmFWHjY', 'textDisplay': 'STF e STE , vergonha de nosso país', 'textOriginal': 'STF e STE , vergonha de nosso país', 'authorDisplayName': 'luiz carlos tomaz', 'authorProfileImageUrl': 'https://yt3.ggpht.com/ytc/AGIKgqMKDymhwfLyvjB9E77DgOS37nGVSf7k8SnkGA=s48-c-k-c0x00ffffff-no-rj', 'authorChannelUrl': 'http://www.youtube.com/channel/UC8oDftHVYQSQGqBzeBMeRPw', 'authorChannelId': {'value': 'UC8oDftHVYQSQGqBzeBMeRPw'}, 'canRate': True, 'viewerRating': 'none', 'likeCount': 8, 'publishedAt': '2022-10-27T02:52:48Z', 'updatedAt': '2022-10-27T02:52:48Z'}}, 'canReply': True, 'totalReplyCount': 0, 'isPublic': True}",,UC8oDftHVYQSQGqBzeBMeRPw,2022-10-27T02:52:48Z,"STF e STE , vergonha de nosso país",,2023-06-08 14:30:59.042835
youtube#commentThread,rYohY8YahI9VH0A6O8_5Yj8jMVc,UgwISMLNhfD83x6Np8t4AaABAg,"{'videoId': 'MROCrmFWHjY', 'topLevelComment': {'kind': 'youtube#comment', 'etag': 'DYda4hKvJkokeyCa4q3XS6nwL44', 'id': 'UgwISMLNhfD83x6Np8t4AaABAg', 'snippet': {'videoId': 'MROCrmFWHjY', 'textDisplay': 'Meus parabéns ao Ministro Alexandre de Moraes, pela coragem no combate da mentira e no  combate das fakes, Viva o Grande Alexandre!', 'textOriginal': 'Meus parabéns ao Ministro Alexandre de Moraes, pela coragem no combate da mentira e no  combate das fakes, Viva o Grande Alexandre!', 'authorDisplayName': 'denis Assis', 'authorProfileImageUrl': 'https://yt3.ggpht.com/ytc/AGIKgqM74DdQ5Z_QimPK9SIt25x-ppR2x3UkQVWiOg=s48-c-k-c0x00ffffff-no-rj', 'authorChannelUrl': 'http://www.youtube.com/channel/UCzVAkLpxlEMUSebOrH1gHTw', 'authorChannelId': {'value': 'UCzVAkLpxlEMUSebOrH1gHTw'}, 'canRate': True, 'viewerRating': 'none', 'likeCount': 0, 'publishedAt': '2022-10-27T02:52:46Z', 'updatedAt': '2022-10-27T02:52:46Z'}}, 'canReply': True, 'totalReplyCount': 0, 'isPublic': True}",,UCzVAkLpxlEMUSebOrH1gHTw,2022-10-27T02:52:46Z,"Meus parabéns ao Ministro Alexandre de Moraes, pela coragem no combate da mentira e no  combate das fakes, Viva o Grande Alexandre!",,2023-06-08 14:30:59.042835
youtube#commentThread,cOXx8bwdN4aMEsPkFscsfaXk8Ak,Ugzt_hlkYZc82dPjK754AaABAg,"{'videoId': 'MROCrmFWHjY', 'topLevelComment': {'kind': 'youtube#comment', 'etag': '7kKAIpUX0tQFdPnpBvCqnjvG75A', 'id': 'Ugzt_hlkYZc82dPjK754AaABAg', 'snippet': {'videoId': 'MROCrmFWHjY', 'textDisplay': 'Vocês mesmo provoca a falta de respeito contra vocês pois não agem como integrantes da lei au contrário são todos fora da lei: Roberto Jefferson deve ter visto naquele momento a cara e a careca do Alexandre de morais então atirou: Alexandre de morais é o cara mais insuportável que temos como ministro! vamos com fé em Deus e votar no nosso presidente Jair messias Bolsonaro 🙏 Mg 22', 'textOriginal': 'Vocês mesmo provoca a falta de respeito contra vocês pois não agem como integrantes da lei au contrário são todos fora da lei: Roberto Jefferson deve ter visto naquele momento a cara e a careca do Alexandre de morais então atirou: Alexandre de morais é o cara mais insuportável que temos como ministro! vamos com fé em Deus e votar no nosso presidente Jair messias Bolsonaro 🙏 Mg 22', 'authorDisplayName': 'Maria das Graças', 'authorProfileImageUrl': 'https://yt3.ggpht.com/ytc/AGIKgqMksXW38O-1VU80mB-lFs3T9aYZQUVPnlLg3fY9_DyCahA_Q4vrL3-uSrL3SZ4U=s48-c-k-c0x00ffffff-no-rj', 'authorChannelUrl': 'http://www.youtube.com/channel/UC76saonkFOSFJPnvIWwKyOA', 'authorChannelId': {'value': 'UC76saonkFOSFJPnvIWwKyOA'}, 'canRate': True, 'viewerRating': 'none', 'likeCount': 6, 'publishedAt': '2022-10-27T02:52:02Z', 'updatedAt': '2022-10-27T02:52:02Z'}}, 'canReply': True, 'totalReplyCount': 0, 'isPublic': True}",,UC76saonkFOSFJPnvIWwKyOA,2022-10-27T02:52:02Z,Vocês mesmo provoca a falta de respeito contra vocês pois não agem como integrantes da lei au contrário são todos fora da lei: Roberto Jefferson deve ter visto naquele momento a cara e a careca do Alexandre de morais então atirou: Alexandre de morais é o cara mais insuportável que temos como ministro! vamos com fé em Deus e votar no nosso presidente Jair messias Bolsonaro 🙏 Mg 22,,2023-06-08 14:30:59.042835
youtube#commentThread,pZbphGeLH17gzBJlflWmYrvebzM,UgzQeVSdOdoehjOL9CJ4AaABAg,"{'videoId': 'MROCrmFWHjY', 'topLevelComment': {'kind': 'youtube#comment', 'etag': 'CXBKUIfEQKVfcbz407cm7rl52eU', 'id': 'UgzQeVSdOdoehjOL9CJ4AaABAg', 'snippet': {'videoId': 'MROCrmFWHjY', 'textDisplay': 'O pior é que a justiça está soltando marginais e prendendo cidadão de bem...', 'textOriginal': 'O pior é que a justiça está soltando marginais e prendendo cidadão de bem...', 'authorDisplayName': 'O BRASIL QUE QUEREMOS', 'authorProfileImageUrl': 'https://yt3.ggpht.com/cuT9nIPVXXvelZu-CVjt-xmCVEsDkLoxnpb6_sAu1rDKziSQ9ZTjG0Qy21meXBEKjWq7YbCn=s48-c-k-c0x00ffffff-no-rj', 'authorChannelUrl': 'http://www.youtube.com/channel/UC6M5gqi9bKGlZp4wudguMgA', 'authorChannelId': {'value': 'UC6M5gqi9bKGlZp4wudguMgA'}, 'canRate': True, 'viewerRating': 'none', 'likeCount': 9, 'publishedAt': '2022-10-27T02:50:40Z', 'updatedAt': '2022-10-27T02:50:40Z'}}, 'canReply': True, 'totalReplyCount': 0, 'isPublic': True}",,UC6M5gqi9bKGlZp4wudguMgA,2022-10-27T02:50:40Z,O pior é que a justiça está soltando marginais e prendendo cidadão de bem...,,2023-06-08 14:30:59.042835
youtube#commentThread,0jop_ceev8fhNjdn28rtvl3MczI,UgwQLWi0MaxCmqKaBZJ4AaABAg,"{'videoId': 'MROCrmFWHjY', 'topLevelComment': {'kind': 'youtube#comment', 'etag': 'QaTYoPKPupPg0wc9KHd4_6coSeY', 'id': 'UgwQLWi0MaxCmqKaBZJ4AaABAg', 'snippet': {'videoId': 'MROCrmFWHjY', 'textDisplay': 'Bob nao deveria ter ofendido daquela forma as meninas das casas de luzes vermelhas!! Elas nao merecem tal comparação!!!', 'textOriginal': 'Bob nao deveria ter ofendido daquela forma as meninas das casas de luzes vermelhas!! Elas nao merecem tal comparação!!!', 'authorDisplayName': 'Thor Nascimento', 'authorProfileImageUrl': 'https://yt3.ggpht.com/ytc/AGIKgqNJdg-gqJgIUhCZJWRmwXo4z8f_jX3Dk2HxGyPhtQ=s48-c-k-c0x00ffffff-no-rj', 'authorChannelUrl': 'http://www.youtube.com/channel/UCocQ7E0ns-7m6vguWg86qJQ', 'authorChannelId': {'value': 'UCocQ7E0ns-7m6vguWg86qJQ'}, 'canRate': True, 'viewerRating': 'none', 'likeCount': 12, 'publishedAt': '2022-10-27T02:50:21Z', 'updatedAt': '2022-10-27T02:50:21Z'}}, 'canReply': True, 'totalReplyCount': 0, 'isPublic': True}",,UCocQ7E0ns-7m6vguWg86qJQ,2022-10-27T02:50:21Z,Bob nao deveria ter ofendido daquela forma as meninas das casas de luzes vermelhas!! Elas nao merecem tal comparação!!!,,2023-06-08 14:30:59.042835
youtube#commentThread,Dh1LFfiETwZWR2Exvw7J6Da7vMM,UgxjHWwGxhsP6GGr4k54AaABAg,"{'videoId': 'MROCrmFWHjY', 'topLevelComment': {'kind': 'youtube#comment', 'etag': 'eBQWznsBNEbrt0JcQtjSCPl88pM', 'id': 'UgxjHWwGxhsP6GGr4k54AaABAg', 'snippet': {'videoId': 'MROCrmFWHjY', 'textDisplay': 'Tá e ninguém fala sobre os xingamentos a filha do presidente e da primeira dama ?', 'textOriginal': 'Tá e ninguém fala sobre os xingamentos a filha do presidente e da primeira dama ?', 'authorDisplayName': 'Michel Araújo', 'authorProfileImageUrl': 'https://yt3.ggpht.com/ytc/AGIKgqOd5czpTAgbNAIaf90nNy5pfrSDjuRjkmdEL1vpEtXyHN1WDWMBOKeo6YGPPC6-=s48-c-k-c0x00ffffff-no-rj', 'authorChannelUrl': 'http://www.youtube.com/channel/UCceTfdfQhYxGWvdpyjinLSQ', 'authorChannelId': {'value': 'UCceTfdfQhYxGWvdpyjinLSQ'}, 'canRate': True, 'viewerRating': 'none', 'likeCount': 6, 'publishedAt': '2022-10-27T02:50:09Z', 'updatedAt': '2022-10-27T02:50:09Z'}}, 'canReply': True, 'totalReplyCount': 0, 'isPublic': True}",,UCceTfdfQhYxGWvdpyjinLSQ,2022-10-27T02:50:09Z,Tá e ninguém fala sobre os xingamentos a filha do presidente e da primeira dama ?,,2023-06-08 14:30:59.042835
youtube#commentThread,-vqW9Y0pQhE1J0kYjUyDzXjE3Po,UgzFYa_3A-RH05I07TN4AaABAg,"{'videoId': 'MROCrmFWHjY', 'topLevelComment': {'kind': 'youtube#comment', 'etag': 'sM0WGtJ5qUzfyIyKi3VaKU7pQDM', 'id': 'UgzFYa_3A-RH05I07TN4AaABAg', 'snippet': {'videoId': 'MROCrmFWHjY', 'textDisplay': 'Bento carneeeeeeeiro', 'textOriginal': 'Bento carneeeeeeeiro', 'authorDisplayName': 'Turco Saad', 'authorProfileImageUrl': 'https://yt3.ggpht.com/ytc/AGIKgqPtyMisD1amey6wrDPyvxN5hr5WbndQkEBgwP4KOOeLU21PVgAYJ_ZjmcNjHWyu=s48-c-k-c0x00ffffff-no-rj', 'authorChannelUrl': 'http://www.youtube.com/channel/UCITciuaph3CBegPDfuWP9LQ', 'authorChannelId': {'value': 'UCITciuaph3CBegPDfuWP9LQ'}, 'canRate': True, 'viewerRating': 'none', 'likeCount': 3, 'publishedAt': '2022-10-27T02:49:15Z', 'updatedAt': '2022-10-27T02:49:15Z'}}, 'canReply': True, 'totalReplyCount': 0, 'isPublic': True}",,UCITciuaph3CBegPDfuWP9LQ,2022-10-27T02:49:15Z,Bento carneeeeeeeiro,,2023-06-08 14:30:59.042835
youtube#commentThread,Twy7QyNtZCX8PCWk8URpKWiECrw,UgxRrDMPgl4MNsAs1KN4AaABAg,"{'videoId': 'MROCrmFWHjY', 'topLevelComment': {'kind': 'youtube#comment', 'etag': '5Rrh7lqmLZioNLI-9ionCF1XUC8', 'id': 'UgxRrDMPgl4MNsAs1KN4AaABAg', 'snippet': {'videoId': 'MROCrmFWHjY', 'textDisplay': 'Pessoal, respeito aí, não vamos ofender as bruxas. Obrigado 😂', 'textOriginal': 'Pessoal, respeito aí, não vamos ofender as bruxas. Obrigado 😂', 'authorDisplayName': 'TV - Sem Censura', 'authorProfileImageUrl': 'https://yt3.ggpht.com/J_a2OLKt2-30EJR66Xjc5BTyjv2DB2R7oXce0DmSPRSRx1ZQ1LThKK0GhAP6pfKOUTRZAfS5=s48-c-k-c0x00ffffff-no-rj', 'authorChannelUrl': 'http://www.youtube.com/channel/UCAIv4y00kQZ0STbI_zDh-iw', 'authorChannelId': {'value': 'UCAIv4y00kQZ0STbI_zDh-iw'}, 'canRate': True, 'viewerRating': 'none', 'likeCount': 7, 'publishedAt': '2022-10-27T02:48:51Z', 'updatedAt': '2022-10-27T02:48:51Z'}}, 'canReply': True, 'totalReplyCount': 0, 'isPublic': True}",,UCAIv4y00kQZ0STbI_zDh-iw,2022-10-27T02:48:51Z,"Pessoal, respeito aí, não vamos ofender as bruxas. Obrigado 😂",,2023-06-08 14:30:59.042835
