kind,etag,id,snippet,replies,authorChannelId,publishedAt,textOriginal,nextPageToken,extraction_date
youtube#commentThread,5IJvImwITAkklEiXVpenCrLsdFo,Ugz4B4uOuhPXQZYlaW14AaABAg,"{'videoId': 'q0IW9CTjiyw', 'topLevelComment': {'kind': 'youtube#comment', 'etag': 'MRb1IeIRA7641dNuE4Wkb4h4R9A', 'id': 'Ugz4B4uOuhPXQZYlaW14AaABAg', 'snippet': {'videoId': 'q0IW9CTjiyw', 'textDisplay': '<a href=""http://www.youtube.com/results?search_query=%23apoiado"">#APOIADO</a>', 'textOriginal': '#APOIADO', 'authorDisplayName': 'Cezar Augusto Pigatto', 'authorProfileImageUrl': 'https://yt3.ggpht.com/ytc/AGIKgqPZr0lWt1hmaoPgfmkWRU7dAAFQReLF7LL6GQ=s48-c-k-c0x00ffffff-no-rj', 'authorChannelUrl': 'http://www.youtube.com/channel/UC2DsE0AkZjzCM9olm2sns3A', 'authorChannelId': {'value': 'UC2DsE0AkZjzCM9olm2sns3A'}, 'canRate': True, 'viewerRating': 'none', 'likeCount': 0, 'publishedAt': '2022-10-16T14:19:32Z', 'updatedAt': '2022-10-16T14:19:32Z'}}, 'canReply': True, 'totalReplyCount': 0, 'isPublic': True}",,UC2DsE0AkZjzCM9olm2sns3A,2022-10-16T14:19:32Z,#APOIADO,,2023-06-09 11:33:31.009956
youtube#commentThread,fjJoiUmFpUD0b_KhF_MHeP1xmnc,Ugyp6Gu3b7jKMIyujZ14AaABAg,"{'videoId': 'q0IW9CTjiyw', 'topLevelComment': {'kind': 'youtube#comment', 'etag': 'rfdGy-l8pIgkOeYSqGdAsux97vw', 'id': 'Ugyp6Gu3b7jKMIyujZ14AaABAg', 'snippet': {'videoId': 'q0IW9CTjiyw', 'textDisplay': 'Os ladrões do erário sessentões vão continuar roubando impune? Sensacional.', 'textOriginal': 'Os ladrões do erário sessentões vão continuar roubando impune? Sensacional.', 'authorDisplayName': 'JustPlaying', 'authorProfileImageUrl': 'https://yt3.ggpht.com/ytc/AGIKgqPdyT0dX9Rhfz_0_5lGrpJVrrZAQSG2k7Z-VSLdfrGzZzJ3O_TmHzplpSk5qd-z=s48-c-k-c0x00ffffff-no-rj', 'authorChannelUrl': 'http://www.youtube.com/channel/UCO9Gnas5VnxpA6j1g4EF2PQ', 'authorChannelId': {'value': 'UCO9Gnas5VnxpA6j1g4EF2PQ'}, 'canRate': True, 'viewerRating': 'none', 'likeCount': 0, 'publishedAt': '2022-10-16T01:51:30Z', 'updatedAt': '2022-10-16T01:51:30Z'}}, 'canReply': True, 'totalReplyCount': 0, 'isPublic': True}",,UCO9Gnas5VnxpA6j1g4EF2PQ,2022-10-16T01:51:30Z,Os ladrões do erário sessentões vão continuar roubando impune? Sensacional.,,2023-06-09 11:33:31.009956
youtube#commentThread,4jV-ghR3vpZjHcITyJm8_arq4r8,UgxXgNkf1BytON_5PCR4AaABAg,"{'videoId': 'q0IW9CTjiyw', 'topLevelComment': {'kind': 'youtube#comment', 'etag': 'A78hpVfC01WlYmrBqV0YPs1NwdQ', 'id': 'UgxXgNkf1BytON_5PCR4AaABAg', 'snippet': {'videoId': 'q0IW9CTjiyw', 'textDisplay': '<b>*VOTAREI EM BOLSONARO!  22&quot;&quot;     22    22    22   22     22     **SEI O QUE É TER UM REVOLVER NA CABEÇA PRA ENTREGAR UM CELULAR SUADO PRO BANDIDO IR TOMAR CERVEJINHA,né  molusco?!*</b><br>   22  NELES!!!!!                  <b>*É    BOL   SO   NA   RO!!  22*</b>', 'textOriginal': '**VOTAREI EM BOLSONARO!  22""""     22    22    22   22     22     **SEI O QUE É TER UM REVOLVER NA CABEÇA PRA ENTREGAR UM CELULAR SUADO PRO BANDIDO IR TOMAR CERVEJINHA,né  molusco?!**\\n   22  NELES!!!!!                  **É    BOL   SO   NA   RO!!  22**', 'authorDisplayName': 'POLITICU ONESTO', 'authorProfileImageUrl': 'https://yt3.ggpht.com/ytc/AGIKgqMYEEj_TMMg2IkcBzwHTFZd8XDwQ819RcR9QA=s48-c-k-c0x00ffffff-no-rj', 'authorChannelUrl': 'http://www.youtube.com/channel/UC5WmONZ74zJNTpkzEHVvsOg', 'authorChannelId': {'value': 'UC5WmONZ74zJNTpkzEHVvsOg'}, 'canRate': True, 'viewerRating': 'none', 'likeCount': 0, 'publishedAt': '2022-10-15T21:49:03Z', 'updatedAt': '2022-10-15T22:02:50Z'}}, 'canReply': True, 'totalReplyCount': 0, 'isPublic': True}",,UC5WmONZ74zJNTpkzEHVvsOg,2022-10-15T21:49:03Z,"**VOTAREI EM BOLSONARO!  22""""     22    22    22   22     22     **SEI O QUE É TER UM REVOLVER NA CABEÇA PRA ENTREGAR UM CELULAR SUADO PRO BANDIDO IR TOMAR CERVEJINHA,né  molusco?!**
   22  NELES!!!!!                  **É    BOL   SO   NA   RO!!  22**",,2023-06-09 11:33:31.009956
youtube#commentThread,JH-JBSzsQpx1jcTaGN12PaZgNAA,Ugylch5E1fAOeSBfUwJ4AaABAg,"{'videoId': 'q0IW9CTjiyw', 'topLevelComment': {'kind': 'youtube#comment', 'etag': 'yKh6APgFTyUKOxsTE6YBvToAWFQ', 'id': 'Ugylch5E1fAOeSBfUwJ4AaABAg', 'snippet': {'videoId': 'q0IW9CTjiyw', 'textDisplay': 'ja fui assaltada na praia por menores e os policiais disse não posso fazer nada sao de menores uns moleques maiores que nos .bousonaro 22', 'textOriginal': 'ja fui assaltada na praia por menores e os policiais disse não posso fazer nada sao de menores uns moleques maiores que nos .bousonaro 22', 'authorDisplayName': 'Roseli Alexandre Ferreira', 'authorProfileImageUrl': 'https://yt3.ggpht.com/ytc/AGIKgqNUrOo_78lc-hEDMQUMvuM27ZK2-l7sF3XQLkB9d7Y=s48-c-k-c0x00ffffff-no-rj', 'authorChannelUrl': 'http://www.youtube.com/channel/UC-USzvM8O_WCxQz83Fx-gmw', 'authorChannelId': {'value': 'UC-USzvM8O_WCxQz83Fx-gmw'}, 'canRate': True, 'viewerRating': 'none', 'likeCount': 0, 'publishedAt': '2022-10-15T21:13:57Z', 'updatedAt': '2022-10-15T21:13:57Z'}}, 'canReply': True, 'totalReplyCount': 0, 'isPublic': True}",,UC-USzvM8O_WCxQz83Fx-gmw,2022-10-15T21:13:57Z,ja fui assaltada na praia por menores e os policiais disse não posso fazer nada sao de menores uns moleques maiores que nos .bousonaro 22,,2023-06-09 11:33:31.009956
youtube#commentThread,9TMIWmTGf3Ggzo9Xlx1t2vGbEes,Ugydbid2IYX8RINZ4zB4AaABAg,"{'videoId': 'q0IW9CTjiyw', 'topLevelComment': {'kind': 'youtube#comment', 'etag': 'gImHQPTDZIEEW_g0mCcHkngHiT0', 'id': 'Ugydbid2IYX8RINZ4zB4AaABAg', 'snippet': {'videoId': 'q0IW9CTjiyw', 'textDisplay': 'Eu era esquerdista e nessa semana abri meus olhos e vou de Bolsonaro nesse segundo turno. Já até marquei cabeleireiro pra repintar o meu cabelo pra cor original. CHEGA DE ENGANAÇÃO', 'textOriginal': 'Eu era esquerdista e nessa semana abri meus olhos e vou de Bolsonaro nesse segundo turno. Já até marquei cabeleireiro pra repintar o meu cabelo pra cor original. CHEGA DE ENGANAÇÃO', 'authorDisplayName': 'Jarbas', 'authorProfileImageUrl': 'https://yt3.ggpht.com/ytc/AGIKgqPYRDOjvgFLshNgLbzKdEueR68HWBlovVawaQ=s48-c-k-c0x00ffffff-no-rj', 'authorChannelUrl': 'http://www.youtube.com/channel/UCdglTo0P_8WO1MlVoW_u4lw', 'authorChannelId': {'value': 'UCdglTo0P_8WO1MlVoW_u4lw'}, 'canRate': True, 'viewerRating': 'none', 'likeCount': 0, 'publishedAt': '2022-10-15T01:54:33Z', 'updatedAt': '2022-10-15T01:54:33Z'}}, 'canReply': True, 'totalReplyCount': 1, 'isPublic': True}","{'comments': [{'kind': 'youtube#comment', 'etag': 'YIg2Ya7Rkk5fYw98GCscb6Zql7A', 'id': 'Ugydbid2IYX8RINZ4zB4AaABAg.9hBNJIUL_KN9hELmni2Qky', 'snippet': {'videoId': 'q0IW9CTjiyw', 'textDisplay': 'Parabens kk', 'textOriginal': 'Parabens kk', 'parentId': 'Ugydbid2IYX8RINZ4zB4AaABAg', 'authorDisplayName': 'Pubg Mobile', 'authorProfileImageUrl': 'https://yt3.ggpht.com/ytc/AGIKgqM-VeSLqbzj3-Dy7pFjubaiG-KnGOWhqZ4PJbLH_fK_S-f-ScKb-Yiq_cW53hib=s48-c-k-c0x00ffffff-no-rj', 'authorChannelUrl': 'http://www.youtube.com/channel/UCHXD51Ds-9SCsOjEmKnIP1g', 'authorChannelId': {'value': 'UCHXD51Ds-9SCsOjEmKnIP1g'}, 'canRate': True, 'viewerRating': 'none', 'likeCount': 1, 'publishedAt': '2022-10-16T05:38:58Z', 'updatedAt': '2022-10-16T05:38:58Z'}}]}",UCdglTo0P_8WO1MlVoW_u4lw,2022-10-15T01:54:33Z,Eu era esquerdista e nessa semana abri meus olhos e vou de Bolsonaro nesse segundo turno. Já até marquei cabeleireiro pra repintar o meu cabelo pra cor original. CHEGA DE ENGANAÇÃO,,2023-06-09 11:33:31.009956
youtube#commentThread,PV4UBsi81Lzshtn1M0O0O_Qq8sc,Ugx5bBpsFEnepABwYo54AaABAg,"{'videoId': 'q0IW9CTjiyw', 'topLevelComment': {'kind': 'youtube#comment', 'etag': '0VFkOlgj7ZmCwkb1YGY-FGWk1Co', 'id': 'Ugx5bBpsFEnepABwYo54AaABAg', 'snippet': {'videoId': 'q0IW9CTjiyw', 'textDisplay': 'Ganhou meu voto não aguento mais esses de menor tirando a vida das pessoas pra roubar um celular.', 'textOriginal': 'Ganhou meu voto não aguento mais esses de menor tirando a vida das pessoas pra roubar um celular.', 'authorDisplayName': 'Atila Varela', 'authorProfileImageUrl': 'https://yt3.ggpht.com/ytc/AGIKgqPQ6XY27r87y22zZbOFP5s9npziixFGKlK2mQ=s48-c-k-c0x00ffffff-no-rj', 'authorChannelUrl': 'http://www.youtube.com/channel/UCbSxovqUSFD8-6S14tC6ftA', 'authorChannelId': {'value': 'UCbSxovqUSFD8-6S14tC6ftA'}, 'canRate': True, 'viewerRating': 'none', 'likeCount': 0, 'publishedAt': '2022-10-15T00:53:28Z', 'updatedAt': '2022-10-15T00:53:28Z'}}, 'canReply': True, 'totalReplyCount': 1, 'isPublic': True}","{'comments': [{'kind': 'youtube#comment', 'etag': '975JKDrtIP88MJ1DpDafyT2itB0', 'id': 'Ugx5bBpsFEnepABwYo54AaABAg.9hBGJx-q73Y9hELMqTz4nk', 'snippet': {'videoId': 'q0IW9CTjiyw', 'textDisplay': 'Tenho 15 anos e daqui 10 meses vou fazer 16 sera que eu posso te habitação se a maioridade penal desce?', 'textOriginal': 'Tenho 15 anos e daqui 10 meses vou fazer 16 sera que eu posso te habitação se a maioridade penal desce?', 'parentId': 'Ugx5bBpsFEnepABwYo54AaABAg', 'authorDisplayName': 'Pubg Mobile', 'authorProfileImageUrl': 'https://yt3.ggpht.com/ytc/AGIKgqM-VeSLqbzj3-Dy7pFjubaiG-KnGOWhqZ4PJbLH_fK_S-f-ScKb-Yiq_cW53hib=s48-c-k-c0x00ffffff-no-rj', 'authorChannelUrl': 'http://www.youtube.com/channel/UCHXD51Ds-9SCsOjEmKnIP1g', 'authorChannelId': {'value': 'UCHXD51Ds-9SCsOjEmKnIP1g'}, 'canRate': True, 'viewerRating': 'none', 'likeCount': 0, 'publishedAt': '2022-10-16T05:35:17Z', 'updatedAt': '2022-10-16T05:35:17Z'}}]}",UCbSxovqUSFD8-6S14tC6ftA,2022-10-15T00:53:28Z,Ganhou meu voto não aguento mais esses de menor tirando a vida das pessoas pra roubar um celular.,,2023-06-09 11:33:31.009956
youtube#commentThread,RN1jo8X1oNPWcNfuBmkA0M-N7wY,Ugzn6A45hUluL6Viw0J4AaABAg,"{'videoId': 'q0IW9CTjiyw', 'topLevelComment': {'kind': 'youtube#comment', 'etag': 'do5qoE5n6ywqQWtoT-9ksBgpz_Y', 'id': 'Ugzn6A45hUluL6Viw0J4AaABAg', 'snippet': {'videoId': 'q0IW9CTjiyw', 'textDisplay': 'esses de menor atira primeiro depois grita assalto.', 'textOriginal': 'esses de menor atira primeiro depois grita assalto.', 'authorDisplayName': 'Atila Varela', 'authorProfileImageUrl': 'https://yt3.ggpht.com/ytc/AGIKgqPQ6XY27r87y22zZbOFP5s9npziixFGKlK2mQ=s48-c-k-c0x00ffffff-no-rj', 'authorChannelUrl': 'http://www.youtube.com/channel/UCbSxovqUSFD8-6S14tC6ftA', 'authorChannelId': {'value': 'UCbSxovqUSFD8-6S14tC6ftA'}, 'canRate': True, 'viewerRating': 'none', 'likeCount': 0, 'publishedAt': '2022-10-15T00:51:19Z', 'updatedAt': '2022-10-15T00:51:19Z'}}, 'canReply': True, 'totalReplyCount': 1, 'isPublic': True}","{'comments': [{'kind': 'youtube#comment', 'etag': 'yvvbwsaYHzsJXtq1dDnVvAFhquU', 'id': 'Ugzn6A45hUluL6Viw0J4AaABAg.9hBG4999RxJ9hELhV2E0L-', 'snippet': {'videoId': 'q0IW9CTjiyw', 'textDisplay': 'O nome deles é vagabundo não menor kkk', 'textOriginal': 'O nome deles é vagabundo não menor kkk', 'parentId': 'Ugzn6A45hUluL6Viw0J4AaABAg', 'authorDisplayName': 'Pubg Mobile', 'authorProfileImageUrl': 'https://yt3.ggpht.com/ytc/AGIKgqM-VeSLqbzj3-Dy7pFjubaiG-KnGOWhqZ4PJbLH_fK_S-f-ScKb-Yiq_cW53hib=s48-c-k-c0x00ffffff-no-rj', 'authorChannelUrl': 'http://www.youtube.com/channel/UCHXD51Ds-9SCsOjEmKnIP1g', 'authorChannelId': {'value': 'UCHXD51Ds-9SCsOjEmKnIP1g'}, 'canRate': True, 'viewerRating': 'none', 'likeCount': 0, 'publishedAt': '2022-10-16T05:38:14Z', 'updatedAt': '2022-10-16T05:38:14Z'}}]}",UCbSxovqUSFD8-6S14tC6ftA,2022-10-15T00:51:19Z,esses de menor atira primeiro depois grita assalto.,,2023-06-09 11:33:31.009956
youtube#commentThread,hPQZ3m5hfoTCVyTGf3v9-X9ChIA,UgxD5_7Q-MDK-654-KV4AaABAg,"{'videoId': 'q0IW9CTjiyw', 'topLevelComment': {'kind': 'youtube#comment', 'etag': 'FsFadT4RbFZb91n5NnQIKKwbnu0', 'id': 'UgxD5_7Q-MDK-654-KV4AaABAg', 'snippet': {'videoId': 'q0IW9CTjiyw', 'textDisplay': 'Vai prende os filhos dele kķkk', 'textOriginal': 'Vai prende os filhos dele kķkk', 'authorDisplayName': 'Ariovaldo Mariano', 'authorProfileImageUrl': 'https://yt3.ggpht.com/ytc/AGIKgqM_Wqvs8gcWwmYEXVTl59qez5-gtRZTElPrTFguqkCIkYwthTgIcIC3QoGfxxwV=s48-c-k-c0x00ffffff-no-rj', 'authorChannelUrl': 'http://www.youtube.com/channel/UCQoU43P0E1PGMGVfnYryCcw', 'authorChannelId': {'value': 'UCQoU43P0E1PGMGVfnYryCcw'}, 'canRate': True, 'viewerRating': 'none', 'likeCount': 0, 'publishedAt': '2022-10-14T22:46:09Z', 'updatedAt': '2022-10-14T22:46:09Z'}}, 'canReply': True, 'totalReplyCount': 0, 'isPublic': True}",,UCQoU43P0E1PGMGVfnYryCcw,2022-10-14T22:46:09Z,Vai prende os filhos dele kķkk,,2023-06-09 11:33:31.009956
youtube#commentThread,GhiJwEytrjWUTeiQXCzrMvEcIoE,Ugwq--W6Uvck2Gd3vIh4AaABAg,"{'videoId': 'q0IW9CTjiyw', 'topLevelComment': {'kind': 'youtube#comment', 'etag': 'yDe-LCB_sei7Ihv_j89YJLjKAWc', 'id': 'Ugwq--W6Uvck2Gd3vIh4AaABAg', 'snippet': {'videoId': 'q0IW9CTjiyw', 'textDisplay': 'São poucos q são pego pela a polícia ou outros fazer justiça ou linchamento Ficam solto a vontade Rio.bando e matando todo têmpo até ficar de maior já matou', 'textOriginal': 'São poucos q são pego pela a polícia ou outros fazer justiça ou linchamento Ficam solto a vontade Rio.bando e matando todo têmpo até ficar de maior já matou', 'authorDisplayName': 'noeme noronha', 'authorProfileImageUrl': 'https://yt3.ggpht.com/ytc/AGIKgqMk7pXTWLFavhjS-YmFwyMB_GM5pChekKDzOy7l=s48-c-k-c0x00ffffff-no-rj', 'authorChannelUrl': 'http://www.youtube.com/channel/UCwPFSP70EviVeXbne7LUMsQ', 'authorChannelId': {'value': 'UCwPFSP70EviVeXbne7LUMsQ'}, 'canRate': True, 'viewerRating': 'none', 'likeCount': 1, 'publishedAt': '2022-10-14T14:00:01Z', 'updatedAt': '2022-10-14T14:00:01Z'}}, 'canReply': True, 'totalReplyCount': 0, 'isPublic': True}",,UCwPFSP70EviVeXbne7LUMsQ,2022-10-14T14:00:01Z,São poucos q são pego pela a polícia ou outros fazer justiça ou linchamento Ficam solto a vontade Rio.bando e matando todo têmpo até ficar de maior já matou,,2023-06-09 11:33:31.009956
youtube#commentThread,CevEyPs_tXjUbf_vx-fHiSAg-7Q,Ugxynkrb9LJa9kuvBsN4AaABAg,"{'videoId': 'q0IW9CTjiyw', 'topLevelComment': {'kind': 'youtube#comment', 'etag': 'mnQN1XpNYuDflH8yoi4XVPI41Y0', 'id': 'Ugxynkrb9LJa9kuvBsN4AaABAg', 'snippet': {'videoId': 'q0IW9CTjiyw', 'textDisplay': 'É pq o menor mata assacina a.muitos eles tão na idade da revolta da adolescência vão roubar armados a vítimas entrega o celular eles ainda atiram e mata', 'textOriginal': 'É pq o menor mata assacina a.muitos eles tão na idade da revolta da adolescência vão roubar armados a vítimas entrega o celular eles ainda atiram e mata', 'authorDisplayName': 'noeme noronha', 'authorProfileImageUrl': 'https://yt3.ggpht.com/ytc/AGIKgqMk7pXTWLFavhjS-YmFwyMB_GM5pChekKDzOy7l=s48-c-k-c0x00ffffff-no-rj', 'authorChannelUrl': 'http://www.youtube.com/channel/UCwPFSP70EviVeXbne7LUMsQ', 'authorChannelId': {'value': 'UCwPFSP70EviVeXbne7LUMsQ'}, 'canRate': True, 'viewerRating': 'none', 'likeCount': 1, 'publishedAt': '2022-10-14T13:54:48Z', 'updatedAt': '2022-10-14T13:54:48Z'}}, 'canReply': True, 'totalReplyCount': 1, 'isPublic': True}","{'comments': [{'kind': 'youtube#comment', 'etag': 'HWzwNjwrkH8Ze8zRXoandJ52tA0', 'id': 'Ugxynkrb9LJa9kuvBsN4AaABAg.9hA4wgifmkz9hELcPZpGCa', 'snippet': {'videoId': 'q0IW9CTjiyw', 'textDisplay': 'Tenho 15 anos e moro em comunidade no estado de sp e trabalho com meu pai de ajudante de pedreiro e nuca roubei ninguem por revolta então não vem com esse papo de apoia vagabundo', 'textOriginal': 'Tenho 15 anos e moro em comunidade no estado de sp e trabalho com meu pai de ajudante de pedreiro e nuca roubei ninguem por revolta então não vem com esse papo de apoia vagabundo', 'parentId': 'Ugxynkrb9LJa9kuvBsN4AaABAg', 'authorDisplayName': 'Pubg Mobile', 'authorProfileImageUrl': 'https://yt3.ggpht.com/ytc/AGIKgqM-VeSLqbzj3-Dy7pFjubaiG-KnGOWhqZ4PJbLH_fK_S-f-ScKb-Yiq_cW53hib=s48-c-k-c0x00ffffff-no-rj', 'authorChannelUrl': 'http://www.youtube.com/channel/UCHXD51Ds-9SCsOjEmKnIP1g', 'authorChannelId': {'value': 'UCHXD51Ds-9SCsOjEmKnIP1g'}, 'canRate': True, 'viewerRating': 'none', 'likeCount': 0, 'publishedAt': '2022-10-16T05:37:32Z', 'updatedAt': '2022-10-16T05:37:32Z'}}]}",UCwPFSP70EviVeXbne7LUMsQ,2022-10-14T13:54:48Z,É pq o menor mata assacina a.muitos eles tão na idade da revolta da adolescência vão roubar armados a vítimas entrega o celular eles ainda atiram e mata,,2023-06-09 11:33:31.009956
youtube#commentThread,IbdcrNZyfNmpeEM9x1fOlAAscIY,UgzuV_p2UKB6Qo60vCl4AaABAg,"{'videoId': 'q0IW9CTjiyw', 'topLevelComment': {'kind': 'youtube#comment', 'etag': 'Bx_9oywHZ-45x5ycP71UIszs-Qw', 'id': 'UgzuV_p2UKB6Qo60vCl4AaABAg', 'snippet': {'videoId': 'q0IW9CTjiyw', 'textDisplay': 'Tem consciência para votar aos 16, mas se estupra, mata e rouba aos 16 não tem maturidade para fazer o que está fazendo. Vamos acabar com isso.', 'textOriginal': 'Tem consciência para votar aos 16, mas se estupra, mata e rouba aos 16 não tem maturidade para fazer o que está fazendo. Vamos acabar com isso.', 'authorDisplayName': 'AndrezãoBR 777', 'authorProfileImageUrl': 'https://yt3.ggpht.com/GAG4dja084vTYL_0Kc_ag9heKqGvcxR4Bu72YTWhIIICn1SXr4ZOTsE6tG8xmks2NFBXtnX6Ims=s48-c-k-c0x00ffffff-no-rj', 'authorChannelUrl': 'http://www.youtube.com/channel/UCVX98hGFXj6HbW5QSDi5eLQ', 'authorChannelId': {'value': 'UCVX98hGFXj6HbW5QSDi5eLQ'}, 'canRate': True, 'viewerRating': 'none', 'likeCount': 1, 'publishedAt': '2022-10-14T12:29:47Z', 'updatedAt': '2022-10-14T12:31:44Z'}}, 'canReply': True, 'totalReplyCount': 0, 'isPublic': True}",,UCVX98hGFXj6HbW5QSDi5eLQ,2022-10-14T12:29:47Z,"Tem consciência para votar aos 16, mas se estupra, mata e rouba aos 16 não tem maturidade para fazer o que está fazendo. Vamos acabar com isso.",,2023-06-09 11:33:31.009956
youtube#commentThread,G3kELBckgs409nqNS2FDi1Uc1_U,UgwpglCNS0N9KzoeRhl4AaABAg,"{'videoId': 'q0IW9CTjiyw', 'topLevelComment': {'kind': 'youtube#comment', 'etag': 'Jp-j2WzZKgBu2DB64R3MoFavhV8', 'id': 'UgwpglCNS0N9KzoeRhl4AaABAg', 'snippet': {'videoId': 'q0IW9CTjiyw', 'textDisplay': 'Aí simm emmm', 'textOriginal': 'Aí simm emmm', 'authorDisplayName': 'Franciele', 'authorProfileImageUrl': 'https://yt3.ggpht.com/_XwXACZBqiOtgj1jJvqjwuGLJevxhMaqjskcT0zRHKZPk8Ezlyl3XVDR86_tKUILz35wj6WBgQ=s48-c-k-c0x00ffffff-no-rj', 'authorChannelUrl': 'http://www.youtube.com/channel/UClYGKJRvhZeW2KHsTYRmveg', 'authorChannelId': {'value': 'UClYGKJRvhZeW2KHsTYRmveg'}, 'canRate': True, 'viewerRating': 'none', 'likeCount': 2, 'publishedAt': '2022-10-14T12:19:25Z', 'updatedAt': '2022-10-14T12:19:25Z'}}, 'canReply': True, 'totalReplyCount': 0, 'isPublic': True}",,UClYGKJRvhZeW2KHsTYRmveg,2022-10-14T12:19:25Z,Aí simm emmm,,2023-06-09 11:33:31.009956
youtube#commentThread,OghK4IOuaSXvO5X_pG7xdQX6ZzE,UgzHwl5aj9Rk8uKpdgF4AaABAg,"{'videoId': 'q0IW9CTjiyw', 'topLevelComment': {'kind': 'youtube#comment', 'etag': 'PY14DjiCBtR0XFd5JQf53tq9UCQ', 'id': 'UgzHwl5aj9Rk8uKpdgF4AaABAg', 'snippet': {'videoId': 'q0IW9CTjiyw', 'textDisplay': 'Ou igual eua', 'textOriginal': 'Ou igual eua', 'authorDisplayName': 'Celcemir Pinheiro da Costa', 'authorProfileImageUrl': 'https://yt3.ggpht.com/dyknfXFWW-xurKCjPfb2EwYEQCqpZ6btMT2wd6GPJVYRtDFwZCnm51J5K90mDortcVWeLTxMJg=s48-c-k-c0x00ffffff-no-rj', 'authorChannelUrl': 'http://www.youtube.com/channel/UCStTZ4a2BeTkMNevY7vip4A', 'authorChannelId': {'value': 'UCStTZ4a2BeTkMNevY7vip4A'}, 'canRate': True, 'viewerRating': 'none', 'likeCount': 0, 'publishedAt': '2022-10-14T11:18:57Z', 'updatedAt': '2022-10-14T11:18:57Z'}}, 'canReply': True, 'totalReplyCount': 0, 'isPublic': True}",,UCStTZ4a2BeTkMNevY7vip4A,2022-10-14T11:18:57Z,Ou igual eua,,2023-06-09 11:33:31.009956
youtube#commentThread,9G0SpNlMiLdndRcCxYh-_5_Po8E,UgxCQX_x0XBw3eVhCbV4AaABAg,"{'videoId': 'q0IW9CTjiyw', 'topLevelComment': {'kind': 'youtube#comment', 'etag': 'OKLp1ancIleKpQMooKlSdpt1dpc', 'id': 'UgxCQX_x0XBw3eVhCbV4AaABAg', 'snippet': {'videoId': 'q0IW9CTjiyw', 'textDisplay': 'Isso mesmo 16anos', 'textOriginal': 'Isso mesmo 16anos', 'authorDisplayName': 'Celcemir Pinheiro da Costa', 'authorProfileImageUrl': 'https://yt3.ggpht.com/dyknfXFWW-xurKCjPfb2EwYEQCqpZ6btMT2wd6GPJVYRtDFwZCnm51J5K90mDortcVWeLTxMJg=s48-c-k-c0x00ffffff-no-rj', 'authorChannelUrl': 'http://www.youtube.com/channel/UCStTZ4a2BeTkMNevY7vip4A', 'authorChannelId': {'value': 'UCStTZ4a2BeTkMNevY7vip4A'}, 'canRate': True, 'viewerRating': 'none', 'likeCount': 2, 'publishedAt': '2022-10-14T11:17:48Z', 'updatedAt': '2022-10-14T11:17:48Z'}}, 'canReply': True, 'totalReplyCount': 0, 'isPublic': True}",,UCStTZ4a2BeTkMNevY7vip4A,2022-10-14T11:17:48Z,Isso mesmo 16anos,,2023-06-09 11:33:31.009956
youtube#commentThread,1o3-bUOem7GJHbuTTnfFSuXq7vk,Ugxt5XcD6lY15t-6f2J4AaABAg,"{'videoId': 'q0IW9CTjiyw', 'topLevelComment': {'kind': 'youtube#comment', 'etag': 'dDXfCaks0luBC1Lo5xJHHifO2qo', 'id': 'Ugxt5XcD6lY15t-6f2J4AaABAg', 'snippet': {'videoId': 'q0IW9CTjiyw', 'textDisplay': 'Precisamos desse presidente mais uns dez anos 🇧🇷', 'textOriginal': 'Precisamos desse presidente mais uns dez anos 🇧🇷', 'authorDisplayName': 'Erasmino Rodrigues', 'authorProfileImageUrl': 'https://yt3.ggpht.com/ytc/AGIKgqOMnsk7qW4xljQS9kyOR9CUos5JmGcxzZ--2w=s48-c-k-c0x00ffffff-no-rj', 'authorChannelUrl': 'http://www.youtube.com/channel/UCVDXcX22wfKJulobJgKHYrg', 'authorChannelId': {'value': 'UCVDXcX22wfKJulobJgKHYrg'}, 'canRate': True, 'viewerRating': 'none', 'likeCount': 3, 'publishedAt': '2022-10-14T10:19:43Z', 'updatedAt': '2022-10-14T10:19:43Z'}}, 'canReply': True, 'totalReplyCount': 0, 'isPublic': True}",,UCVDXcX22wfKJulobJgKHYrg,2022-10-14T10:19:43Z,Precisamos desse presidente mais uns dez anos 🇧🇷,,2023-06-09 11:33:31.009956
youtube#commentThread,JLDS6u6b7IKY59r4-bjgTW5a6zw,UgwkdL8tTvBR0jkvGqh4AaABAg,"{'videoId': 'q0IW9CTjiyw', 'topLevelComment': {'kind': 'youtube#comment', 'etag': 'twg15GEgofBO6-MjQiaCXQb9GDg', 'id': 'UgwkdL8tTvBR0jkvGqh4AaABAg', 'snippet': {'videoId': 'q0IW9CTjiyw', 'textDisplay': 'Deus abençoe nosso presidente Bolsonaro', 'textOriginal': 'Deus abençoe nosso presidente Bolsonaro', 'authorDisplayName': 'cilene Pacifico', 'authorProfileImageUrl': 'https://yt3.ggpht.com/ytc/AGIKgqP4iZ37l-fGhRTMjDPsV2WtToPSJAkH3-z-lH2NW7_fta1E27VJgkWZl0fLWBd8=s48-c-k-c0x00ffffff-no-rj', 'authorChannelUrl': 'http://www.youtube.com/channel/UCF_Wrp5wwMGyY-iYk_8g12A', 'authorChannelId': {'value': 'UCF_Wrp5wwMGyY-iYk_8g12A'}, 'canRate': True, 'viewerRating': 'none', 'likeCount': 2, 'publishedAt': '2022-10-14T10:00:00Z', 'updatedAt': '2022-10-14T10:00:00Z'}}, 'canReply': True, 'totalReplyCount': 0, 'isPublic': True}",,UCF_Wrp5wwMGyY-iYk_8g12A,2022-10-14T10:00:00Z,Deus abençoe nosso presidente Bolsonaro,,2023-06-09 11:33:31.009956
youtube#commentThread,JS6retyyDhNTwAx5-sv3FkMy2Lk,Ugw-OTKMDCii4dG7qgJ4AaABAg,"{'videoId': 'q0IW9CTjiyw', 'topLevelComment': {'kind': 'youtube#comment', 'etag': 'WNvJMyiTNrPU__1aoTZw9mH6WrQ', 'id': 'Ugw-OTKMDCii4dG7qgJ4AaABAg', 'snippet': {'videoId': 'q0IW9CTjiyw', 'textDisplay': 'Boa presidente!!!! E o Congresso estará com o sr!!!', 'textOriginal': 'Boa presidente!!!! E o Congresso estará com o sr!!!', 'authorDisplayName': 'Carolina AF', 'authorProfileImageUrl': 'https://yt3.ggpht.com/ytc/AGIKgqM5Lsrj6ku6P3vLbbltcJGy1wc8eo_4PBruc3oxTRS5tnv0FGX3vgnKKcGqIMMI=s48-c-k-c0x00ffffff-no-rj', 'authorChannelUrl': 'http://www.youtube.com/channel/UCZWs8oKPta9A4bWXb_0jLQA', 'authorChannelId': {'value': 'UCZWs8oKPta9A4bWXb_0jLQA'}, 'canRate': True, 'viewerRating': 'none', 'likeCount': 1, 'publishedAt': '2022-10-14T09:22:29Z', 'updatedAt': '2022-10-14T09:22:29Z'}}, 'canReply': True, 'totalReplyCount': 0, 'isPublic': True}",,UCZWs8oKPta9A4bWXb_0jLQA,2022-10-14T09:22:29Z,Boa presidente!!!! E o Congresso estará com o sr!!!,,2023-06-09 11:33:31.009956
youtube#commentThread,B1p3SLSBNVeCLSx58FMvKmWfuZY,UgyZ6b8o90M9lLGtPGR4AaABAg,"{'videoId': 'q0IW9CTjiyw', 'topLevelComment': {'kind': 'youtube#comment', 'etag': 'PMKF5yEWrnuj5uNe1mcsk6IyKjA', 'id': 'UgyZ6b8o90M9lLGtPGR4AaABAg', 'snippet': {'videoId': 'q0IW9CTjiyw', 'textDisplay': 'Bolsonaro fala todas as propostas, o outro, só faz ameaças', 'textOriginal': 'Bolsonaro fala todas as propostas, o outro, só faz ameaças', 'authorDisplayName': 'Nilton Nunes Gonzaga', 'authorProfileImageUrl': 'https://yt3.ggpht.com/ytc/AGIKgqN6RZoyI1Z_rqJeTS5HmBxC5dAZmWpwIHrSUOiOa3yxZXKc1JBm1Avjvrp3CUtV=s48-c-k-c0x00ffffff-no-rj', 'authorChannelUrl': 'http://www.youtube.com/channel/UCkjNQrDpPm8MwmwQsNjh1eA', 'authorChannelId': {'value': 'UCkjNQrDpPm8MwmwQsNjh1eA'}, 'canRate': True, 'viewerRating': 'none', 'likeCount': 1, 'publishedAt': '2022-10-14T06:46:23Z', 'updatedAt': '2022-10-14T06:46:23Z'}}, 'canReply': True, 'totalReplyCount': 0, 'isPublic': True}",,UCkjNQrDpPm8MwmwQsNjh1eA,2022-10-14T06:46:23Z,"Bolsonaro fala todas as propostas, o outro, só faz ameaças",,2023-06-09 11:33:31.009956
youtube#commentThread,PBRMpUa4IM_F7n23jUA4wMsaZY0,UgwS2t89i30Wb1bSuvF4AaABAg,"{'videoId': 'q0IW9CTjiyw', 'topLevelComment': {'kind': 'youtube#comment', 'etag': 'SzCj29ASabPoD9wXJAxR4rTlaE0', 'id': 'UgwS2t89i30Wb1bSuvF4AaABAg', 'snippet': {'videoId': 'q0IW9CTjiyw', 'textDisplay': 'Excelente', 'textOriginal': 'Excelente', 'authorDisplayName': 'לוציפר', 'authorProfileImageUrl': 'https://yt3.ggpht.com/2iabm4mKGjMiaj0QQuAnEkYzZXRCqvPYwoL6BLtgXajDIGZbOSW-o72guVkt-VIOHyS5Ui_a=s48-c-k-c0x00ffffff-no-rj', 'authorChannelUrl': 'http://www.youtube.com/channel/UCKFNd7apQwaErNB2E8V7NDQ', 'authorChannelId': {'value': 'UCKFNd7apQwaErNB2E8V7NDQ'}, 'canRate': True, 'viewerRating': 'none', 'likeCount': 2, 'publishedAt': '2022-10-14T05:46:15Z', 'updatedAt': '2022-10-14T05:46:15Z'}}, 'canReply': True, 'totalReplyCount': 0, 'isPublic': True}",,UCKFNd7apQwaErNB2E8V7NDQ,2022-10-14T05:46:15Z,Excelente,,2023-06-09 11:33:31.009956
