kind,etag,id,snippet,replies,authorChannelId,publishedAt,textOriginal,nextPageToken,extraction_date
youtube#commentThread,_U1G5ZFaZzgA2i-VceOBcGImQD0,UgxsHfSha6az7BbC-CN4AaABAg,"{'videoId': 'm8xi_U_gYuk', 'topLevelComment': {'kind': 'youtube#comment', 'etag': 'tkOzMADosI3RnXXmnH3Q7fPIiOQ', 'id': 'UgxsHfSha6az7BbC-CN4AaABAg', 'snippet': {'videoId': 'm8xi_U_gYuk', 'textDisplay': 'Haddad 13 Lula 13 ❤️✅ Sem Medo de ser feliz', 'textOriginal': 'Haddad 13 Lula 13 ❤️✅ Sem Medo de ser feliz', 'authorDisplayName': 'Jose Guillermo Yanez', 'authorProfileImageUrl': 'https://yt3.ggpht.com/DxUS0025iN7pq3Y9v85HYJP9-J2uuDAMi5SMlVuQqu8xYlpqEThZqrIHy5UQ-HrsholO3ANXng=s48-c-k-c0x00ffffff-no-rj', 'authorChannelUrl': 'http://www.youtube.com/channel/UCaVxSmr9OsQ7KlicIIUX8UA', 'authorChannelId': {'value': 'UCaVxSmr9OsQ7KlicIIUX8UA'}, 'canRate': True, 'viewerRating': 'none', 'likeCount': 0, 'publishedAt': '2022-10-29T23:23:11Z', 'updatedAt': '2022-10-29T23:23:11Z'}}, 'canReply': True, 'totalReplyCount': 0, 'isPublic': True}",,UCaVxSmr9OsQ7KlicIIUX8UA,2022-10-29T23:23:11Z,Haddad 13 Lula 13 ❤️✅ Sem Medo de ser feliz,,2023-06-09 11:19:30.672390
youtube#commentThread,IH1sTJEHcsTSczqn96H6TrZcf6c,Ugyc7ietom0DlzWS_0Z4AaABAg,"{'videoId': 'm8xi_U_gYuk', 'topLevelComment': {'kind': 'youtube#comment', 'etag': 'w8lnO8J5DZEZ1dvYh7fOqJS4w9Y', 'id': 'Ugyc7ietom0DlzWS_0Z4AaABAg', 'snippet': {'videoId': 'm8xi_U_gYuk', 'textDisplay': 'O Haddad é muito despreparado.... Foi ministro da EDUCAÇÃO por quase uma decada... Olha o resultado, estamos em PENÚLTIMO na prova do PISA e hoje o jovem não vale nada no mercado de trabalho.... Obviamente tem exceções mas é muito raro...', 'textOriginal': 'O Haddad é muito despreparado.... Foi ministro da EDUCAÇÃO por quase uma decada... Olha o resultado, estamos em PENÚLTIMO na prova do PISA e hoje o jovem não vale nada no mercado de trabalho.... Obviamente tem exceções mas é muito raro...', 'authorDisplayName': 'EnDIREITAndo a Canhota🇯🇵', 'authorProfileImageUrl': 'https://yt3.ggpht.com/BxApIKFRuPZD6YP0jgHHbCOroM0Vq9S6joengZODAucT4dPCevmFDpPU4gua5YeFkT0LkDsAYA=s48-c-k-c0x00ffffff-no-rj', 'authorChannelUrl': 'http://www.youtube.com/channel/UCQ9z210u2iZhls9AioCRwpA', 'authorChannelId': {'value': 'UCQ9z210u2iZhls9AioCRwpA'}, 'canRate': True, 'viewerRating': 'none', 'likeCount': 2, 'publishedAt': '2022-10-29T20:30:55Z', 'updatedAt': '2022-10-29T20:30:55Z'}}, 'canReply': True, 'totalReplyCount': 0, 'isPublic': True}",,UCQ9z210u2iZhls9AioCRwpA,2022-10-29T20:30:55Z,"O Haddad é muito despreparado.... Foi ministro da EDUCAÇÃO por quase uma decada... Olha o resultado, estamos em PENÚLTIMO na prova do PISA e hoje o jovem não vale nada no mercado de trabalho.... Obviamente tem exceções mas é muito raro...",,2023-06-09 11:19:30.672390
youtube#commentThread,aA3Wu2GNw3KQkns5EEY4Ifj2l0A,UgwO07RRFaBSgvU0mbt4AaABAg,"{'videoId': 'm8xi_U_gYuk', 'topLevelComment': {'kind': 'youtube#comment', 'etag': '6tdIHMBIpSUUFjDwXWL2Lu-EHuY', 'id': 'UgwO07RRFaBSgvU0mbt4AaABAg', 'snippet': {'videoId': 'm8xi_U_gYuk', 'textDisplay': 'Haddade,meu filho,de que adianta &quot;vencer&quot;debate na Globo e perder a eleição,hein,meu filho?por favor.......!', 'textOriginal': 'Haddade,meu filho,de que adianta ""vencer""debate na Globo e perder a eleição,hein,meu filho?por favor.......!', 'authorDisplayName': 'SÉRGIO peregrino', 'authorProfileImageUrl': 'https://yt3.ggpht.com/ytc/AGIKgqO1_OC1vfTpKxCA4jNiwcj4lilozTP9j5WQww=s48-c-k-c0x00ffffff-no-rj', 'authorChannelUrl': 'http://www.youtube.com/channel/UCSWbg8eBpXbJS7Ww6Ml4Jkg', 'authorChannelId': {'value': 'UCSWbg8eBpXbJS7Ww6Ml4Jkg'}, 'canRate': True, 'viewerRating': 'none', 'likeCount': 0, 'publishedAt': '2022-10-29T18:47:41Z', 'updatedAt': '2022-10-29T18:47:41Z'}}, 'canReply': True, 'totalReplyCount': 0, 'isPublic': True}",,UCSWbg8eBpXbJS7Ww6Ml4Jkg,2022-10-29T18:47:41Z,"Haddade,meu filho,de que adianta ""vencer""debate na Globo e perder a eleição,hein,meu filho?por favor.......!",,2023-06-09 11:19:30.672390
youtube#commentThread,qzDJht6WQ4-I3ff4A9ALKWuWtZU,UgzPywW8qag_8CdI8OJ4AaABAg,"{'videoId': 'm8xi_U_gYuk', 'topLevelComment': {'kind': 'youtube#comment', 'etag': 'xYEFSCmK2nMvr8MH-Q1x9GpRV10', 'id': 'UgzPywW8qag_8CdI8OJ4AaABAg', 'snippet': {'videoId': 'm8xi_U_gYuk', 'textDisplay': 'Surra total no Haddad. Muito fraco.', 'textOriginal': 'Surra total no Haddad. Muito fraco.', 'authorDisplayName': 'Davi Navas', 'authorProfileImageUrl': 'https://yt3.ggpht.com/ytc/AGIKgqNpkhh39afVhKMcrw5Mdxtl3dnEi4Hg9YdwjRSZrA=s48-c-k-c0x00ffffff-no-rj', 'authorChannelUrl': 'http://www.youtube.com/channel/UC2kQwecpQp_tqFyBqlK8aNQ', 'authorChannelId': {'value': 'UC2kQwecpQp_tqFyBqlK8aNQ'}, 'canRate': True, 'viewerRating': 'none', 'likeCount': 2, 'publishedAt': '2022-10-29T18:45:40Z', 'updatedAt': '2022-10-29T18:45:40Z'}}, 'canReply': True, 'totalReplyCount': 0, 'isPublic': True}",,UC2kQwecpQp_tqFyBqlK8aNQ,2022-10-29T18:45:40Z,Surra total no Haddad. Muito fraco.,,2023-06-09 11:19:30.672390
youtube#commentThread,UHroCPMmPUup3BJHsq1WA_-uG6c,UgyVIf7wu9oDUOWGaLB4AaABAg,"{'videoId': 'm8xi_U_gYuk', 'topLevelComment': {'kind': 'youtube#comment', 'etag': '4Nobke_vXzymhBR8cXH01BREyQk', 'id': 'UgyVIf7wu9oDUOWGaLB4AaABAg', 'snippet': {'videoId': 'm8xi_U_gYuk', 'textDisplay': 'Seu c.u.u.u.', 'textOriginal': 'Seu c.u.u.u.', 'authorDisplayName': 'Marcos', 'authorProfileImageUrl': 'https://yt3.ggpht.com/ZAg6Zx51-JPgtSR72rGXL-PzJ6KXVUk9yZ4KETBjPgMDVLXRH8yzUAZn3cMuEI8pBowhAHiWiWs=s48-c-k-c0x00ffffff-no-rj', 'authorChannelUrl': 'http://www.youtube.com/channel/UCe_QT4mpb4C-lqpO3fVlQcQ', 'authorChannelId': {'value': 'UCe_QT4mpb4C-lqpO3fVlQcQ'}, 'canRate': True, 'viewerRating': 'none', 'likeCount': 0, 'publishedAt': '2022-10-29T18:29:16Z', 'updatedAt': '2022-10-29T18:29:16Z'}}, 'canReply': True, 'totalReplyCount': 0, 'isPublic': True}",,UCe_QT4mpb4C-lqpO3fVlQcQ,2022-10-29T18:29:16Z,Seu c.u.u.u.,,2023-06-09 11:19:30.672390
youtube#commentThread,TNpDME8O9QnsIXgk9w4Zw5GLaPI,UgzBSjmKr6vA8HGzoyV4AaABAg,"{'videoId': 'm8xi_U_gYuk', 'topLevelComment': {'kind': 'youtube#comment', 'etag': 'ryLw1BNQ_eN3GCraUAkeXbDPRR0', 'id': 'UgzBSjmKr6vA8HGzoyV4AaABAg', 'snippet': {'videoId': 'm8xi_U_gYuk', 'textDisplay': 'Seu c.u.u.u.', 'textOriginal': 'Seu c.u.u.u.', 'authorDisplayName': 'Marcos', 'authorProfileImageUrl': 'https://yt3.ggpht.com/ZAg6Zx51-JPgtSR72rGXL-PzJ6KXVUk9yZ4KETBjPgMDVLXRH8yzUAZn3cMuEI8pBowhAHiWiWs=s48-c-k-c0x00ffffff-no-rj', 'authorChannelUrl': 'http://www.youtube.com/channel/UCe_QT4mpb4C-lqpO3fVlQcQ', 'authorChannelId': {'value': 'UCe_QT4mpb4C-lqpO3fVlQcQ'}, 'canRate': True, 'viewerRating': 'none', 'likeCount': 0, 'publishedAt': '2022-10-29T18:29:10Z', 'updatedAt': '2022-10-29T18:29:10Z'}}, 'canReply': True, 'totalReplyCount': 0, 'isPublic': True}",,UCe_QT4mpb4C-lqpO3fVlQcQ,2022-10-29T18:29:10Z,Seu c.u.u.u.,,2023-06-09 11:19:30.672390
youtube#commentThread,JdriSNhstXAouizNYlas7hADjWk,UgwY_bSJQ7fo32irjL54AaABAg,"{'videoId': 'm8xi_U_gYuk', 'topLevelComment': {'kind': 'youtube#comment', 'etag': '0_fC3KXcXAvtgvsF5Yb9Sk4WH0U', 'id': 'UgwY_bSJQ7fo32irjL54AaABAg', 'snippet': {'videoId': 'm8xi_U_gYuk', 'textDisplay': 'Seu c.u.u.u.', 'textOriginal': 'Seu c.u.u.u.', 'authorDisplayName': 'Marcos', 'authorProfileImageUrl': 'https://yt3.ggpht.com/ZAg6Zx51-JPgtSR72rGXL-PzJ6KXVUk9yZ4KETBjPgMDVLXRH8yzUAZn3cMuEI8pBowhAHiWiWs=s48-c-k-c0x00ffffff-no-rj', 'authorChannelUrl': 'http://www.youtube.com/channel/UCe_QT4mpb4C-lqpO3fVlQcQ', 'authorChannelId': {'value': 'UCe_QT4mpb4C-lqpO3fVlQcQ'}, 'canRate': True, 'viewerRating': 'none', 'likeCount': 0, 'publishedAt': '2022-10-29T18:29:03Z', 'updatedAt': '2022-10-29T18:29:03Z'}}, 'canReply': True, 'totalReplyCount': 0, 'isPublic': True}",,UCe_QT4mpb4C-lqpO3fVlQcQ,2022-10-29T18:29:03Z,Seu c.u.u.u.,,2023-06-09 11:19:30.672390
youtube#commentThread,Ntk4fLI-Lob4P5q3CzddWfE6D8M,UgyOfgBaLVajnPidRed4AaABAg,"{'videoId': 'm8xi_U_gYuk', 'topLevelComment': {'kind': 'youtube#comment', 'etag': 'qhVkf0ybu30iO7XcYUr5Yx-gONI', 'id': 'UgyOfgBaLVajnPidRed4AaABAg', 'snippet': {'videoId': 'm8xi_U_gYuk', 'textDisplay': 'Lula Presidente 13 e Haddad Governador 13', 'textOriginal': 'Lula Presidente 13 e Haddad Governador 13', 'authorDisplayName': 'YinYang', 'authorProfileImageUrl': 'https://yt3.ggpht.com/Gl-am9xsGuAX3JuSCjYxhXTlYvyMwJnab4nMz1dHfiiZwgUDpwch_L9U28fVsO9FaX5mqVmfnA=s48-c-k-c0x00ffffff-no-rj', 'authorChannelUrl': 'http://www.youtube.com/channel/UCoYfHLB8KYc5cP_-ucBR4WA', 'authorChannelId': {'value': 'UCoYfHLB8KYc5cP_-ucBR4WA'}, 'canRate': True, 'viewerRating': 'none', 'likeCount': 1, 'publishedAt': '2022-10-29T18:18:35Z', 'updatedAt': '2022-10-29T18:18:35Z'}}, 'canReply': True, 'totalReplyCount': 0, 'isPublic': True}",,UCoYfHLB8KYc5cP_-ucBR4WA,2022-10-29T18:18:35Z,Lula Presidente 13 e Haddad Governador 13,,2023-06-09 11:19:30.672390
youtube#commentThread,64fJdzsfkQc_HxV2JMb1Mn7mtkQ,UgwedcbbQ4_1YuaurGp4AaABAg,"{'videoId': 'm8xi_U_gYuk', 'topLevelComment': {'kind': 'youtube#comment', 'etag': 'zbsRgolIHJWSo3VCPRHkcqzwceU', 'id': 'UgwedcbbQ4_1YuaurGp4AaABAg', 'snippet': {'videoId': 'm8xi_U_gYuk', 'textDisplay': 'Realidade: Haddad perdeu o debate na Globo e provou que desconhece, odeia, e não está preparado para governar São Paulo. Mostrou que não tem sensibilidade.<br>Haddad: Eu não estou preocupado com seu orçamento doméstico e propus aumentar os ICMS da carne da cesta básica e diminuir o salário mínimo de São Paulo para R$1,00. Eu não estou preocupado com a fila do SUS e vou levar a inexperiência da capital para o interior. Nenhum Hospital Dia na região metropolitana, no interior e no litoral. Não vou criar o Bilhete Único Metropolitano em nenhuma metrópole do interior. Não vou preservar as conquistas do povo paulista. Foda-se se a água é um bem essencial, eu vou vender a Sabesp, porque eu quero que a tarifa suba. Eu vou tirar a câmera do policial, vou desobrigar a vacinação, eu não vou controlar a frequência escolar.<br>Narrador: E não denunciou a incompetência do adversário, que atrasou a entrega de oxigênio para as vítimas da covid em Manaus, não denunciou a destruição de provas em Paraisópolis, e provou que o adversário conhece, ama e tem propostas para São Paulo.<br><br>É por tudo isso que Haddad não está pronto para governar São Paulo', 'textOriginal': 'Realidade: Haddad perdeu o debate na Globo e provou que desconhece, odeia, e não está preparado para governar São Paulo. Mostrou que não tem sensibilidade.\\nHaddad: Eu não estou preocupado com seu orçamento doméstico e propus aumentar os ICMS da carne da cesta básica e diminuir o salário mínimo de São Paulo para R$1,00. Eu não estou preocupado com a fila do SUS e vou levar a inexperiência da capital para o interior. Nenhum Hospital Dia na região metropolitana, no interior e no litoral. Não vou criar o Bilhete Único Metropolitano em nenhuma metrópole do interior. Não vou preservar as conquistas do povo paulista. Foda-se se a água é um bem essencial, eu vou vender a Sabesp, porque eu quero que a tarifa suba. Eu vou tirar a câmera do policial, vou desobrigar a vacinação, eu não vou controlar a frequência escolar.\\nNarrador: E não denunciou a incompetência do adversário, que atrasou a entrega de oxigênio para as vítimas da covid em Manaus, não denunciou a destruição de provas em Paraisópolis, e provou que o adversário conhece, ama e tem propostas para São Paulo.\\n\\nÉ por tudo isso que Haddad não está pronto para governar São Paulo', 'authorDisplayName': 'Reus', 'authorProfileImageUrl': 'https://yt3.ggpht.com/01CSUKxh8i4TW1T1pQNPHNKWiXCHv7CjzAvuFxI06I3l-7vwrNOdPr0CqPyOf9QTX6HSYJ4r=s48-c-k-c0x00ffffff-no-rj', 'authorChannelUrl': 'http://www.youtube.com/channel/UCJggxPx8UF4pVhUHGU1utjA', 'authorChannelId': {'value': 'UCJggxPx8UF4pVhUHGU1utjA'}, 'canRate': True, 'viewerRating': 'none', 'likeCount': 1, 'publishedAt': '2022-10-29T18:03:42Z', 'updatedAt': '2022-10-29T18:19:20Z'}}, 'canReply': True, 'totalReplyCount': 0, 'isPublic': True}",,UCJggxPx8UF4pVhUHGU1utjA,2022-10-29T18:03:42Z,"Realidade: Haddad perdeu o debate na Globo e provou que desconhece, odeia, e não está preparado para governar São Paulo. Mostrou que não tem sensibilidade.
Haddad: Eu não estou preocupado com seu orçamento doméstico e propus aumentar os ICMS da carne da cesta básica e diminuir o salário mínimo de São Paulo para R$1,00. Eu não estou preocupado com a fila do SUS e vou levar a inexperiência da capital para o interior. Nenhum Hospital Dia na região metropolitana, no interior e no litoral. Não vou criar o Bilhete Único Metropolitano em nenhuma metrópole do interior. Não vou preservar as conquistas do povo paulista. Foda-se se a água é um bem essencial, eu vou vender a Sabesp, porque eu quero que a tarifa suba. Eu vou tirar a câmera do policial, vou desobrigar a vacinação, eu não vou controlar a frequência escolar.
Narrador: E não denunciou a incompetência do adversário, que atrasou a entrega de oxigênio para as vítimas da covid em Manaus, não denunciou a destruição de provas em Paraisópolis, e provou que o adversário conhece, ama e tem propostas para São Paulo.

É por tudo isso que Haddad não está pronto para governar São Paulo",,2023-06-09 11:19:30.672390
youtube#commentThread,3a7mlfzh5n16uvykJsGqpuJgFYc,Ugzh0ts8GYqBzxdEyb94AaABAg,"{'videoId': 'm8xi_U_gYuk', 'topLevelComment': {'kind': 'youtube#comment', 'etag': 'YMsKvHbj4ybnLwfOfKi6Y3sKZF0', 'id': 'Ugzh0ts8GYqBzxdEyb94AaABAg', 'snippet': {'videoId': 'm8xi_U_gYuk', 'textDisplay': '1010101010', 'textOriginal': '1010101010', 'authorDisplayName': 'Jairo Cezar de souza', 'authorProfileImageUrl': 'https://yt3.ggpht.com/ytc/AGIKgqPgGrqMyxUVCPNQjYlIrzCW_uH29mtEQWxZ3Ljq-afaWZ1UrrVE_O_cCjBxxqeI=s48-c-k-c0x00ffffff-no-rj', 'authorChannelUrl': 'http://www.youtube.com/channel/UCuWFgrYo16UzqUo1ETwr4HA', 'authorChannelId': {'value': 'UCuWFgrYo16UzqUo1ETwr4HA'}, 'canRate': True, 'viewerRating': 'none', 'likeCount': 0, 'publishedAt': '2022-10-29T17:47:57Z', 'updatedAt': '2022-10-29T17:47:57Z'}}, 'canReply': True, 'totalReplyCount': 0, 'isPublic': True}",,UCuWFgrYo16UzqUo1ETwr4HA,2022-10-29T17:47:57Z,1010101010,,2023-06-09 11:19:30.672390
youtube#commentThread,B1oq2Imy7W-bpUaAA_Z5UopTT7k,Ugy3ceJXdzhDMc9fPjh4AaABAg,"{'videoId': 'm8xi_U_gYuk', 'topLevelComment': {'kind': 'youtube#comment', 'etag': 'HC2WwRw8gu7M4SVphi_91W_dQY0', 'id': 'Ugy3ceJXdzhDMc9fPjh4AaABAg', 'snippet': {'videoId': 'm8xi_U_gYuk', 'textDisplay': 'Tarcísio Tarcísio Tarcísio Tarcísio Tarcísio Tarcísio Tarcísio Tarcísio Tarcísio Tarcísio Tarcísio', 'textOriginal': 'Tarcísio Tarcísio Tarcísio Tarcísio Tarcísio Tarcísio Tarcísio Tarcísio Tarcísio Tarcísio Tarcísio', 'authorDisplayName': 'Enoque Aristidis', 'authorProfileImageUrl': 'https://yt3.ggpht.com/ytc/AGIKgqNbyRH5w6NxJbyLj8-GTdmiHIvj7lce_89VS3_oWJOvJrlSGgjJHl0sTTfADqNp=s48-c-k-c0x00ffffff-no-rj', 'authorChannelUrl': 'http://www.youtube.com/channel/UCMO5eKw-WBG7kZgp0xvC7aw', 'authorChannelId': {'value': 'UCMO5eKw-WBG7kZgp0xvC7aw'}, 'canRate': True, 'viewerRating': 'none', 'likeCount': 2, 'publishedAt': '2022-10-29T17:40:47Z', 'updatedAt': '2022-10-29T17:40:47Z'}}, 'canReply': True, 'totalReplyCount': 0, 'isPublic': True}",,UCMO5eKw-WBG7kZgp0xvC7aw,2022-10-29T17:40:47Z,Tarcísio Tarcísio Tarcísio Tarcísio Tarcísio Tarcísio Tarcísio Tarcísio Tarcísio Tarcísio Tarcísio,,2023-06-09 11:19:30.672390
youtube#commentThread,RQO1OkDsp0H9CcrI-jiCRntUspg,UgxSNNevuMg4rdzSsgl4AaABAg,"{'videoId': 'm8xi_U_gYuk', 'topLevelComment': {'kind': 'youtube#comment', 'etag': 'alKd8raKhnJTa8LOeGSaQni5KEM', 'id': 'UgxSNNevuMg4rdzSsgl4AaABAg', 'snippet': {'videoId': 'm8xi_U_gYuk', 'textDisplay': 'Elas  queria  q pessoas   pagasse  o vírus', 'textOriginal': 'Elas  queria  q pessoas   pagasse  o vírus', 'authorDisplayName': 'Vado Abreu', 'authorProfileImageUrl': 'https://yt3.ggpht.com/ytc/AGIKgqMxRP1YdV4ame_1dv7TWw8_tqpTl4dcqAB37dmU=s48-c-k-c0x00ffffff-no-rj', 'authorChannelUrl': 'http://www.youtube.com/channel/UCcc2A5G0WfiMHSzPjyYBf7A', 'authorChannelId': {'value': 'UCcc2A5G0WfiMHSzPjyYBf7A'}, 'canRate': True, 'viewerRating': 'none', 'likeCount': 0, 'publishedAt': '2022-10-29T17:08:48Z', 'updatedAt': '2022-10-29T17:08:48Z'}}, 'canReply': True, 'totalReplyCount': 0, 'isPublic': True}",,UCcc2A5G0WfiMHSzPjyYBf7A,2022-10-29T17:08:48Z,Elas  queria  q pessoas   pagasse  o vírus,,2023-06-09 11:19:30.672390
youtube#commentThread,5XcrNougYBGkTB-rgnQAC1Gxce8,UgxKYKcCRcxRV_FGZE54AaABAg,"{'videoId': 'm8xi_U_gYuk', 'topLevelComment': {'kind': 'youtube#comment', 'etag': 'h4tKh1xvnz5BGai5uJlB47oBBQI', 'id': 'UgxKYKcCRcxRV_FGZE54AaABAg', 'snippet': {'videoId': 'm8xi_U_gYuk', 'textDisplay': 'Aqui na Bahia,o governador comprou 48 milhões na empresa da maconha ,e até agora não chegou,mas Bolsonaro é o genocida', 'textOriginal': 'Aqui na Bahia,o governador comprou 48 milhões na empresa da maconha ,e até agora não chegou,mas Bolsonaro é o genocida', 'authorDisplayName': 'missionário manoel messias', 'authorProfileImageUrl': 'https://yt3.ggpht.com/S_QhViVyQxkObmwn7Em6kVUvyzG3etrz2iYaMz8HAh7mHtEL3P6RMjivJT-MXpS2qlmELbEb=s48-c-k-c0x00ffffff-no-rj', 'authorChannelUrl': 'http://www.youtube.com/channel/UCQVKFda3qxO-Iidzb6NhqHg', 'authorChannelId': {'value': 'UCQVKFda3qxO-Iidzb6NhqHg'}, 'canRate': True, 'viewerRating': 'none', 'likeCount': 0, 'publishedAt': '2022-10-29T16:59:33Z', 'updatedAt': '2022-10-29T16:59:33Z'}}, 'canReply': True, 'totalReplyCount': 0, 'isPublic': True}",,UCQVKFda3qxO-Iidzb6NhqHg,2022-10-29T16:59:33Z,"Aqui na Bahia,o governador comprou 48 milhões na empresa da maconha ,e até agora não chegou,mas Bolsonaro é o genocida",,2023-06-09 11:19:30.672390
youtube#commentThread,BUrmQ3HTmItvKUxlJZz6nRVThD4,UgzrPjsI9uIXIs7yBQZ4AaABAg,"{'videoId': 'm8xi_U_gYuk', 'topLevelComment': {'kind': 'youtube#comment', 'etag': 'y5-i7_UQVJ-Xks4jR5DXdjjB5fg', 'id': 'UgzrPjsI9uIXIs7yBQZ4AaABAg', 'snippet': {'videoId': 'm8xi_U_gYuk', 'textDisplay': '👍🇧🇷🙌💚💛😀 TARCÍSIO E BOLSONARO 🇧🇷 VOTE 10 E 22', 'textOriginal': '👍🇧🇷🙌💚💛😀 TARCÍSIO E BOLSONARO 🇧🇷 VOTE 10 E 22', 'authorDisplayName': 'Valéria Menezes de Sousa', 'authorProfileImageUrl': 'https://yt3.ggpht.com/ksE65-ZUFXH_iAiaKCXlEqpkZkTMDRPngtoGlQ11cy84CieSQ1gQkC8HBj8IN3Sjo3x6Dtf-Svk=s48-c-k-c0x00ffffff-no-rj', 'authorChannelUrl': 'http://www.youtube.com/channel/UCMAhQ2sI7HGF2sPhuplgziQ', 'authorChannelId': {'value': 'UCMAhQ2sI7HGF2sPhuplgziQ'}, 'canRate': True, 'viewerRating': 'none', 'likeCount': 3, 'publishedAt': '2022-10-29T16:58:57Z', 'updatedAt': '2022-10-29T16:58:57Z'}}, 'canReply': True, 'totalReplyCount': 0, 'isPublic': True}",,UCMAhQ2sI7HGF2sPhuplgziQ,2022-10-29T16:58:57Z,👍🇧🇷🙌💚💛😀 TARCÍSIO E BOLSONARO 🇧🇷 VOTE 10 E 22,,2023-06-09 11:19:30.672390
youtube#commentThread,A5Ez0PEiz8sNNO5iuX4LRhkjWDo,Ugwb6S9diV0oHdSg15B4AaABAg,"{'videoId': 'm8xi_U_gYuk', 'topLevelComment': {'kind': 'youtube#comment', 'etag': 'rLg7eTvXLFH3v-rhC3B74cFQSic', 'id': 'Ugwb6S9diV0oHdSg15B4AaABAg', 'snippet': {'videoId': 'm8xi_U_gYuk', 'textDisplay': 'Quem e doido não aceite  addade e fome eu céu o que. Passei', 'textOriginal': 'Quem e doido não aceite  addade e fome eu céu o que. Passei', 'authorDisplayName': 'Liberio Leandro', 'authorProfileImageUrl': 'https://yt3.ggpht.com/ytc/AGIKgqPnOUJONt2gf1Df0vZ2pyWT-k-JyFViAMORbg=s48-c-k-c0x00ffffff-no-rj', 'authorChannelUrl': 'http://www.youtube.com/channel/UCUG81oiGiNRvaXZ90lit6Cw', 'authorChannelId': {'value': 'UCUG81oiGiNRvaXZ90lit6Cw'}, 'canRate': True, 'viewerRating': 'none', 'likeCount': 3, 'publishedAt': '2022-10-29T16:55:44Z', 'updatedAt': '2022-10-29T16:55:44Z'}}, 'canReply': True, 'totalReplyCount': 0, 'isPublic': True}",,UCUG81oiGiNRvaXZ90lit6Cw,2022-10-29T16:55:44Z,Quem e doido não aceite  addade e fome eu céu o que. Passei,,2023-06-09 11:19:30.672390
youtube#commentThread,AZ9Y7EDxb4GTQW4-Yoy7eypgPFI,UgzLPCfM2Y3JrAXNYrx4AaABAg,"{'videoId': 'm8xi_U_gYuk', 'topLevelComment': {'kind': 'youtube#comment', 'etag': 'BOer8oPIFg_e6NfPld8c9usIIwI', 'id': 'UgzLPCfM2Y3JrAXNYrx4AaABAg', 'snippet': {'videoId': 'm8xi_U_gYuk', 'textDisplay': 'Love and only love is above the law because in fact it fulfills all the law, and what else is right if it has to fulfill. NO to abortion, NO to corruption, No to pedophilia, No to leftism, No to theft, No to everything that is against the will of God. He&#39;s not perfect, but he can reach the stature of Christ if he chooses to, but it&#39;s been a long time since we&#39;ve seen so much virtue and courage in one person. Congratulations Mr. President Jair Messias Bolsonaro. Vote 22........', 'textOriginal': ""Love and only love is above the law because in fact it fulfills all the law, and what else is right if it has to fulfill. NO to abortion, NO to corruption, No to pedophilia, No to leftism, No to theft, No to everything that is against the will of God. He's not perfect, but he can reach the stature of Christ if he chooses to, but it's been a long time since we've seen so much virtue and courage in one person. Congratulations Mr. President Jair Messias Bolsonaro. Vote 22........"", 'authorDisplayName': 'De volta ao caminho', 'authorProfileImageUrl': 'https://yt3.ggpht.com/ytc/AGIKgqM3vRoBpxqv4gE9C8WpHWedDPJGjzM4sZ_DTmbl62K6ADDtKz_WOXZLIVpGT2F4=s48-c-k-c0x00ffffff-no-rj', 'authorChannelUrl': 'http://www.youtube.com/channel/UC6NQCpj_8X9n_xtW060qVCA', 'authorChannelId': {'value': 'UC6NQCpj_8X9n_xtW060qVCA'}, 'canRate': True, 'viewerRating': 'none', 'likeCount': 3, 'publishedAt': '2022-10-29T16:55:03Z', 'updatedAt': '2022-10-29T16:55:03Z'}}, 'canReply': True, 'totalReplyCount': 0, 'isPublic': True}",,UC6NQCpj_8X9n_xtW060qVCA,2022-10-29T16:55:03Z,"Love and only love is above the law because in fact it fulfills all the law, and what else is right if it has to fulfill. NO to abortion, NO to corruption, No to pedophilia, No to leftism, No to theft, No to everything that is against the will of God. He's not perfect, but he can reach the stature of Christ if he chooses to, but it's been a long time since we've seen so much virtue and courage in one person. Congratulations Mr. President Jair Messias Bolsonaro. Vote 22........",,2023-06-09 11:19:30.672390
youtube#commentThread,-RTFaFg0MF3Nsa4cshZfQ9sdWTM,UgxyqcagFXx4tCkTi3J4AaABAg,"{'videoId': 'm8xi_U_gYuk', 'topLevelComment': {'kind': 'youtube#comment', 'etag': 'Y8tA3k01nVYnYSY7TSVsm4R4D_w', 'id': 'UgxyqcagFXx4tCkTi3J4AaABAg', 'snippet': {'videoId': 'm8xi_U_gYuk', 'textDisplay': 'SÓ SE TEVE OUTRO,???  LEVOU UMA SURRA.', 'textOriginal': 'SÓ SE TEVE OUTRO,???  LEVOU UMA SURRA.', 'authorDisplayName': 'Romero Junior Carvalho', 'authorProfileImageUrl': 'https://yt3.ggpht.com/ytc/AGIKgqNVf4LeBi5VVuLRPgTTvsfJvZ64rQLi8SiSDAKvBQ=s48-c-k-c0x00ffffff-no-rj', 'authorChannelUrl': 'http://www.youtube.com/channel/UCdC5apy0gCYH-mXWboO8hbw', 'authorChannelId': {'value': 'UCdC5apy0gCYH-mXWboO8hbw'}, 'canRate': True, 'viewerRating': 'none', 'likeCount': 7, 'publishedAt': '2022-10-29T16:54:43Z', 'updatedAt': '2022-10-29T16:54:43Z'}}, 'canReply': True, 'totalReplyCount': 0, 'isPublic': True}",,UCdC5apy0gCYH-mXWboO8hbw,2022-10-29T16:54:43Z,"SÓ SE TEVE OUTRO,???  LEVOU UMA SURRA.",,2023-06-09 11:19:30.672390
