kind,etag,id,snippet,replies,authorChannelId,publishedAt,textOriginal,nextPageToken,extraction_date
youtube#commentThread,WzgUdIf_9guTnMPuGh3mYJC_6m4,Ugx5KKZKgKrqXdHlizh4AaABAg,"{'videoId': 'xW5dpM3khvI', 'topLevelComment': {'kind': 'youtube#comment', 'etag': 'xRthz-GSJAqyP7v-64PDF3TZTqM', 'id': 'Ugx5KKZKgKrqXdHlizh4AaABAg', 'snippet': {'videoId': 'xW5dpM3khvI', 'textDisplay': 'Vcs sabem que ate o próprio presidente e a favor a tortura agora fica com este papo a favor a familia igual o goleiro. Bruno matou e agora e um santo a favor a familia', 'textOriginal': 'Vcs sabem que ate o próprio presidente e a favor a tortura agora fica com este papo a favor a familia igual o goleiro. Bruno matou e agora e um santo a favor a familia', 'authorDisplayName': 'pisquilados🎹 teclados', 'authorProfileImageUrl': 'https://yt3.ggpht.com/VzYCZho_n_fouem7pntMHQgRgEAj5CNjh0UtDPuajNItLxZouNo9qzHvU8rxcPMx0lp3n96Gwg=s48-c-k-c0x00ffffff-no-rj', 'authorChannelUrl': 'http://www.youtube.com/channel/UC9xsHp50FakbIDxh80Vcmng', 'authorChannelId': {'value': 'UC9xsHp50FakbIDxh80Vcmng'}, 'canRate': True, 'viewerRating': 'none', 'likeCount': 0, 'publishedAt': '2022-10-29T00:26:35Z', 'updatedAt': '2022-10-29T00:26:35Z'}}, 'canReply': True, 'totalReplyCount': 0, 'isPublic': True}",,UC9xsHp50FakbIDxh80Vcmng,2022-10-29T00:26:35Z,Vcs sabem que ate o próprio presidente e a favor a tortura agora fica com este papo a favor a familia igual o goleiro. Bruno matou e agora e um santo a favor a familia,,2023-06-08 02:33:23.766415
youtube#commentThread,WDSKp4lZYLNdLGNH5FKdA9Wvk7c,UgzweL_2I2D4k5LlSGF4AaABAg,"{'videoId': 'xW5dpM3khvI', 'topLevelComment': {'kind': 'youtube#comment', 'etag': 'bXol1FI2CSYIDiV08VKqQ7dgzqc', 'id': 'UgzweL_2I2D4k5LlSGF4AaABAg', 'snippet': {'videoId': 'xW5dpM3khvI', 'textDisplay': 'Quem vota no PT, está traindo a democracia', 'textOriginal': 'Quem vota no PT, está traindo a democracia', 'authorDisplayName': 'Roseira Kjellin', 'authorProfileImageUrl': 'https://yt3.ggpht.com/ytc/AGIKgqM7CKFjahR9d68HX2FX4wBMQV6rJ09r8ZuMNA=s48-c-k-c0x00ffffff-no-rj', 'authorChannelUrl': 'http://www.youtube.com/channel/UCRo4IQ4LyqSRhWSHaUiDrXg', 'authorChannelId': {'value': 'UCRo4IQ4LyqSRhWSHaUiDrXg'}, 'canRate': True, 'viewerRating': 'none', 'likeCount': 0, 'publishedAt': '2022-10-28T11:30:59Z', 'updatedAt': '2022-10-28T11:30:59Z'}}, 'canReply': True, 'totalReplyCount': 0, 'isPublic': True}",,UCRo4IQ4LyqSRhWSHaUiDrXg,2022-10-28T11:30:59Z,"Quem vota no PT, está traindo a democracia",,2023-06-08 02:33:23.766415
youtube#commentThread,dQi5bHQclfjkE0BOzh78sVefjic,Ugy-6iCfYmWYMWfD0jp4AaABAg,"{'videoId': 'xW5dpM3khvI', 'topLevelComment': {'kind': 'youtube#comment', 'etag': 'iw-Z5QuwhxT9_PY5N_tM6htOHV8', 'id': 'Ugy-6iCfYmWYMWfD0jp4AaABAg', 'snippet': {'videoId': 'xW5dpM3khvI', 'textDisplay': 'A DITADURA NA VERDADE É DO LULA , FOI ELE QUE PRESSIONOU O JUDICIÁRIO A AGIR DESSA FORMA!!', 'textOriginal': 'A DITADURA NA VERDADE É DO LULA , FOI ELE QUE PRESSIONOU O JUDICIÁRIO A AGIR DESSA FORMA!!', 'authorDisplayName': 'Paulo Ferreira', 'authorProfileImageUrl': 'https://yt3.ggpht.com/ytc/AGIKgqOsgoXn8lhuJFREX_qJ-SBBQ-bggecJOYqXL-U-0gRJ53bpXOxSxqc3uOHcIv-f=s48-c-k-c0x00ffffff-no-rj', 'authorChannelUrl': 'http://www.youtube.com/channel/UCxwIs8SppRfBWjEMMlctupw', 'authorChannelId': {'value': 'UCxwIs8SppRfBWjEMMlctupw'}, 'canRate': True, 'viewerRating': 'none', 'likeCount': 0, 'publishedAt': '2022-10-28T10:36:22Z', 'updatedAt': '2022-10-28T10:36:22Z'}}, 'canReply': True, 'totalReplyCount': 0, 'isPublic': True}",,UCxwIs8SppRfBWjEMMlctupw,2022-10-28T10:36:22Z,"A DITADURA NA VERDADE É DO LULA , FOI ELE QUE PRESSIONOU O JUDICIÁRIO A AGIR DESSA FORMA!!",,2023-06-08 02:33:23.766415
youtube#commentThread,TISdTemePmAsv2eP9s7CzvO61J4,UgwXcXwJod1Me96xKLV4AaABAg,"{'videoId': 'xW5dpM3khvI', 'topLevelComment': {'kind': 'youtube#comment', 'etag': 'EEMnsHTVkH95aYWp0aVAN6tXW3o', 'id': 'UgwXcXwJod1Me96xKLV4AaABAg', 'snippet': {'videoId': 'xW5dpM3khvI', 'textDisplay': 'Protegem o ladrão fujão', 'textOriginal': 'Protegem o ladrão fujão', 'authorDisplayName': 'Nilda Campos', 'authorProfileImageUrl': 'https://yt3.ggpht.com/ytc/AGIKgqMgvh0NjBAEHJBypJdDTPrlB46QYdeq7DrnsA=s48-c-k-c0x00ffffff-no-rj', 'authorChannelUrl': 'http://www.youtube.com/channel/UCffqgTFX1j0aXZDRb-op-ow', 'authorChannelId': {'value': 'UCffqgTFX1j0aXZDRb-op-ow'}, 'canRate': True, 'viewerRating': 'none', 'likeCount': 0, 'publishedAt': '2022-10-27T19:56:06Z', 'updatedAt': '2022-10-27T19:56:06Z'}}, 'canReply': True, 'totalReplyCount': 0, 'isPublic': True}",,UCffqgTFX1j0aXZDRb-op-ow,2022-10-27T19:56:06Z,Protegem o ladrão fujão,,2023-06-08 02:33:23.766415
youtube#commentThread,_-16KOhxq_hqUpNjVZ8v8EaPfQ8,UgwVtsJZ5xNtAdd7KpF4AaABAg,"{'videoId': 'xW5dpM3khvI', 'topLevelComment': {'kind': 'youtube#comment', 'etag': 'dU4x3AIniivZx5OpjEsd8k4TWlE', 'id': 'UgwVtsJZ5xNtAdd7KpF4AaABAg', 'snippet': {'videoId': 'xW5dpM3khvI', 'textDisplay': 'A descondenacão foi só  o começo. Vão até o final. E, se perderem nas urnas, vão  continuar até invalidar o resultado ou a candidatura.', 'textOriginal': 'A descondenacão foi só  o começo. Vão até o final. E, se perderem nas urnas, vão  continuar até invalidar o resultado ou a candidatura.', 'authorDisplayName': 'Dirlei Salete Kist Rodrigues', 'authorProfileImageUrl': 'https://yt3.ggpht.com/ytc/AGIKgqP2WeSZRwj6jWGf8Kx2S6s3OsFbuHpABgvdzw=s48-c-k-c0x00ffffff-no-rj', 'authorChannelUrl': 'http://www.youtube.com/channel/UCPlYOQYAbOlzn5VxUApDg9w', 'authorChannelId': {'value': 'UCPlYOQYAbOlzn5VxUApDg9w'}, 'canRate': True, 'viewerRating': 'none', 'likeCount': 0, 'publishedAt': '2022-10-27T18:44:50Z', 'updatedAt': '2022-10-27T18:44:50Z'}}, 'canReply': True, 'totalReplyCount': 0, 'isPublic': True}",,UCPlYOQYAbOlzn5VxUApDg9w,2022-10-27T18:44:50Z,"A descondenacão foi só  o começo. Vão até o final. E, se perderem nas urnas, vão  continuar até invalidar o resultado ou a candidatura.",,2023-06-08 02:33:23.766415
youtube#commentThread,bEuJhmjDmpHNMQM9NB6RW7sfvZ8,Ugw0njO-AHDLuF-GJnV4AaABAg,"{'videoId': 'xW5dpM3khvI', 'topLevelComment': {'kind': 'youtube#comment', 'etag': 'l9XKr92AgNuCynOkkk9X3BH6vhg', 'id': 'Ugw0njO-AHDLuF-GJnV4AaABAg', 'snippet': {'videoId': 'xW5dpM3khvI', 'textDisplay': 'Estamos vivendo momentos sombrios oriundos do partido das trevas = pt', 'textOriginal': 'Estamos vivendo momentos sombrios oriundos do partido das trevas = pt', 'authorDisplayName': 'André Lago', 'authorProfileImageUrl': 'https://yt3.ggpht.com/ytc/AGIKgqNdCdqvblBHjGMQkpOXm57ve5b2OYk4eYuWQu9XjOQ=s48-c-k-c0x00ffffff-no-rj', 'authorChannelUrl': 'http://www.youtube.com/channel/UCp2v6iMvP4b8b9DL-bxO8Fg', 'authorChannelId': {'value': 'UCp2v6iMvP4b8b9DL-bxO8Fg'}, 'canRate': True, 'viewerRating': 'none', 'likeCount': 0, 'publishedAt': '2022-10-27T01:26:14Z', 'updatedAt': '2022-10-27T01:26:14Z'}}, 'canReply': True, 'totalReplyCount': 0, 'isPublic': True}",,UCp2v6iMvP4b8b9DL-bxO8Fg,2022-10-27T01:26:14Z,Estamos vivendo momentos sombrios oriundos do partido das trevas = pt,,2023-06-08 02:33:23.766415
youtube#commentThread,YBvOLVWYX90oSFR4epKbEC71fCw,UgzHI05_npVGhOYtNpx4AaABAg,"{'videoId': 'xW5dpM3khvI', 'topLevelComment': {'kind': 'youtube#comment', 'etag': '9fxMcxMJyMYarbSWQvO5v0vYTNA', 'id': 'UgzHI05_npVGhOYtNpx4AaABAg', 'snippet': {'videoId': 'xW5dpM3khvI', 'textDisplay': 'Não foi a divisão que agravou a situação eleitoral. Foram as resoluções transgredindo a constituição junto com a liberação, para concorrer a cargo público, de um sujeito cuja situação ética, moral e legal deveria estar impedido, e o seu favoritismo perante o STF e o Tribulanal Eleitoral em detrimento dos outros candidatos e culminaram na aniquilação irreparável da validade da eleição presidencial 2022, na ruptura institucional, da democracia e do Estado de Direito, a única maneira de reestabelecer a autenticidade da eleição é com a convocação de nova eleição desde o marco zero.', 'textOriginal': 'Não foi a divisão que agravou a situação eleitoral. Foram as resoluções transgredindo a constituição junto com a liberação, para concorrer a cargo público, de um sujeito cuja situação ética, moral e legal deveria estar impedido, e o seu favoritismo perante o STF e o Tribulanal Eleitoral em detrimento dos outros candidatos e culminaram na aniquilação irreparável da validade da eleição presidencial 2022, na ruptura institucional, da democracia e do Estado de Direito, a única maneira de reestabelecer a autenticidade da eleição é com a convocação de nova eleição desde o marco zero.', 'authorDisplayName': 'Bequem Waltz', 'authorProfileImageUrl': 'https://yt3.ggpht.com/ytc/AGIKgqPqSVqgvqtLA2vtGBfTb0Nm2Qmxf5vQoTi_LkbuyQ=s48-c-k-c0x00ffffff-no-rj', 'authorChannelUrl': 'http://www.youtube.com/channel/UCyrBJhic8K88G0C0-tGUR6Q', 'authorChannelId': {'value': 'UCyrBJhic8K88G0C0-tGUR6Q'}, 'canRate': True, 'viewerRating': 'none', 'likeCount': 0, 'publishedAt': '2022-10-26T22:39:13Z', 'updatedAt': '2022-10-26T22:39:13Z'}}, 'canReply': True, 'totalReplyCount': 0, 'isPublic': True}",,UCyrBJhic8K88G0C0-tGUR6Q,2022-10-26T22:39:13Z,"Não foi a divisão que agravou a situação eleitoral. Foram as resoluções transgredindo a constituição junto com a liberação, para concorrer a cargo público, de um sujeito cuja situação ética, moral e legal deveria estar impedido, e o seu favoritismo perante o STF e o Tribulanal Eleitoral em detrimento dos outros candidatos e culminaram na aniquilação irreparável da validade da eleição presidencial 2022, na ruptura institucional, da democracia e do Estado de Direito, a única maneira de reestabelecer a autenticidade da eleição é com a convocação de nova eleição desde o marco zero.",,2023-06-08 02:33:23.766415
youtube#commentThread,ApTweBSbypUhsgzxALUJ-P6mbKM,UgzXcFnwjBjPoxvifQV4AaABAg,"{'videoId': 'xW5dpM3khvI', 'topLevelComment': {'kind': 'youtube#comment', 'etag': 'fF_SaTXGC2_LqxyLHTIv3PvW-lM', 'id': 'UgzXcFnwjBjPoxvifQV4AaABAg', 'snippet': {'videoId': 'xW5dpM3khvI', 'textDisplay': 'Devido a censura a jovem pan e manipulação das inserções a favor do lula eu vou votar no bolsonaro,sou contra a censura', 'textOriginal': 'Devido a censura a jovem pan e manipulação das inserções a favor do lula eu vou votar no bolsonaro,sou contra a censura', 'authorDisplayName': 'alex rodrigues', 'authorProfileImageUrl': 'https://yt3.ggpht.com/ytc/AGIKgqPlzCRkgVkSkWVjILjWjr5aCS_4j0NU2iyyQA=s48-c-k-c0x00ffffff-no-rj', 'authorChannelUrl': 'http://www.youtube.com/channel/UC80IfuAp5YS80t8-rRVNFnA', 'authorChannelId': {'value': 'UC80IfuAp5YS80t8-rRVNFnA'}, 'canRate': True, 'viewerRating': 'none', 'likeCount': 0, 'publishedAt': '2022-10-26T19:03:04Z', 'updatedAt': '2022-10-26T19:03:04Z'}}, 'canReply': True, 'totalReplyCount': 0, 'isPublic': True}",,UC80IfuAp5YS80t8-rRVNFnA,2022-10-26T19:03:04Z,"Devido a censura a jovem pan e manipulação das inserções a favor do lula eu vou votar no bolsonaro,sou contra a censura",,2023-06-08 02:33:23.766415
youtube#commentThread,tJF4AKaCqdJYm8v3g21Xk9r0XOU,UgyC_Q4CP_Kb7zn2qLl4AaABAg,"{'videoId': 'xW5dpM3khvI', 'topLevelComment': {'kind': 'youtube#comment', 'etag': 'MDGOPlRc98vudtOCbZRS5WW-k-U', 'id': 'UgyC_Q4CP_Kb7zn2qLl4AaABAg', 'snippet': {'videoId': 'xW5dpM3khvI', 'textDisplay': '&quot;acha&quot;não.é fato!então,&quot;repórter poeta&quot;,por favor......!', 'textOriginal': '""acha""não.é fato!então,""repórter poeta"",por favor......!', 'authorDisplayName': 'SÉRGIO peregrino', 'authorProfileImageUrl': 'https://yt3.ggpht.com/ytc/AGIKgqO1_OC1vfTpKxCA4jNiwcj4lilozTP9j5WQww=s48-c-k-c0x00ffffff-no-rj', 'authorChannelUrl': 'http://www.youtube.com/channel/UCSWbg8eBpXbJS7Ww6Ml4Jkg', 'authorChannelId': {'value': 'UCSWbg8eBpXbJS7Ww6Ml4Jkg'}, 'canRate': True, 'viewerRating': 'none', 'likeCount': 0, 'publishedAt': '2022-10-26T16:38:06Z', 'updatedAt': '2022-10-26T16:38:06Z'}}, 'canReply': True, 'totalReplyCount': 0, 'isPublic': True}",,UCSWbg8eBpXbJS7Ww6Ml4Jkg,2022-10-26T16:38:06Z,"""acha""não.é fato!então,""repórter poeta"",por favor......!",,2023-06-08 02:33:23.766415
youtube#commentThread,-BVa2aR_aBGD75-fIzNf-U6uT9M,Ugys9hhvKdqgMjbpUvZ4AaABAg,"{'videoId': 'xW5dpM3khvI', 'topLevelComment': {'kind': 'youtube#comment', 'etag': 'cJkNp_rvpELx9tz-FIVQsThmRvE', 'id': 'Ugys9hhvKdqgMjbpUvZ4AaABAg', 'snippet': {'videoId': 'xW5dpM3khvI', 'textDisplay': 'LULA GIGANTE 13 13 13 13', 'textOriginal': 'LULA GIGANTE 13 13 13 13', 'authorDisplayName': 'Genaldo Batista', 'authorProfileImageUrl': 'https://yt3.ggpht.com/ytc/AGIKgqMNs7BCAYD1fPCXiwszO2uxlzx6VdM3ZWtRMuEjcg=s48-c-k-c0x00ffffff-no-rj', 'authorChannelUrl': 'http://www.youtube.com/channel/UCDEwbdTKzAD9C5Ui9xCkNtg', 'authorChannelId': {'value': 'UCDEwbdTKzAD9C5Ui9xCkNtg'}, 'canRate': True, 'viewerRating': 'none', 'likeCount': 0, 'publishedAt': '2022-10-26T15:59:55Z', 'updatedAt': '2022-10-26T15:59:55Z'}}, 'canReply': True, 'totalReplyCount': 0, 'isPublic': True}",,UCDEwbdTKzAD9C5Ui9xCkNtg,2022-10-26T15:59:55Z,LULA GIGANTE 13 13 13 13,,2023-06-08 02:33:23.766415
youtube#commentThread,FLm-7xY8rmFlwH9oq8P08-W5vgo,Ugxl-ByaTDYZaDsmdhl4AaABAg,"{'videoId': 'xW5dpM3khvI', 'topLevelComment': {'kind': 'youtube#comment', 'etag': 'h__c-F9wMEiJNevNnCZXIthRbAs', 'id': 'Ugxl-ByaTDYZaDsmdhl4AaABAg', 'snippet': {'videoId': 'xW5dpM3khvI', 'textDisplay': 'Acho 80% acha isso', 'textOriginal': 'Acho 80% acha isso', 'authorDisplayName': 'Vinicius Stipe', 'authorProfileImageUrl': 'https://yt3.ggpht.com/ytc/AGIKgqMh0RzT2HmcifbUdXvBIkUgbTkQ9Yw4FMurHQ=s48-c-k-c0x00ffffff-no-rj', 'authorChannelUrl': 'http://www.youtube.com/channel/UCKA9TboS8tYryWV9TnFwJeg', 'authorChannelId': {'value': 'UCKA9TboS8tYryWV9TnFwJeg'}, 'canRate': True, 'viewerRating': 'none', 'likeCount': 1, 'publishedAt': '2022-10-26T14:53:58Z', 'updatedAt': '2022-10-26T14:53:58Z'}}, 'canReply': True, 'totalReplyCount': 0, 'isPublic': True}",,UCKA9TboS8tYryWV9TnFwJeg,2022-10-26T14:53:58Z,Acho 80% acha isso,,2023-06-08 02:33:23.766415
youtube#commentThread,pqgSs7ez9WWwV3-oHSWop0_CozM,UgwTB4GZGsdtBEOoM654AaABAg,"{'videoId': 'xW5dpM3khvI', 'topLevelComment': {'kind': 'youtube#comment', 'etag': 'gAvq6-ydzIlP6RAwPBTd1gIHSvE', 'id': 'UgwTB4GZGsdtBEOoM654AaABAg', 'snippet': {'videoId': 'xW5dpM3khvI', 'textDisplay': 'Todo Brasileiro sabe que há um direcionamento para o Lula ser eleito, eles podem tudo e os Bolsonaristas nada', 'textOriginal': 'Todo Brasileiro sabe que há um direcionamento para o Lula ser eleito, eles podem tudo e os Bolsonaristas nada', 'authorDisplayName': 'Arthur Coelho', 'authorProfileImageUrl': 'https://yt3.ggpht.com/ytc/AGIKgqOVLHYrZWSEhsD-D2G02d3iKlZkBIl0FNHPUw=s48-c-k-c0x00ffffff-no-rj', 'authorChannelUrl': 'http://www.youtube.com/channel/UCHTbnQhp-z3s08J277lX9eQ', 'authorChannelId': {'value': 'UCHTbnQhp-z3s08J277lX9eQ'}, 'canRate': True, 'viewerRating': 'none', 'likeCount': 0, 'publishedAt': '2022-10-26T13:35:51Z', 'updatedAt': '2022-10-26T13:35:51Z'}}, 'canReply': True, 'totalReplyCount': 0, 'isPublic': True}",,UCHTbnQhp-z3s08J277lX9eQ,2022-10-26T13:35:51Z,"Todo Brasileiro sabe que há um direcionamento para o Lula ser eleito, eles podem tudo e os Bolsonaristas nada",,2023-06-08 02:33:23.766415
youtube#commentThread,xTFJOxyaZ4btK6Yekkk6ENPUVEA,UgzNSp47WGw7D3oJFlt4AaABAg,"{'videoId': 'xW5dpM3khvI', 'topLevelComment': {'kind': 'youtube#comment', 'etag': 'cVXp5Gzb4-cFpxylGr6SUN_WeQ0', 'id': 'UgzNSp47WGw7D3oJFlt4AaABAg', 'snippet': {'videoId': 'xW5dpM3khvI', 'textDisplay': 'Abuso de poder de Alexandre de Moraes.', 'textOriginal': 'Abuso de poder de Alexandre de Moraes.', 'authorDisplayName': 'Dora Carvalho', 'authorProfileImageUrl': 'https://yt3.ggpht.com/ytc/AGIKgqPfWb4dfgFVoNOxzG5Qk_4ifMh6GFmWYDXj0w=s48-c-k-c0x00ffffff-no-rj', 'authorChannelUrl': 'http://www.youtube.com/channel/UClz58uc-Z3dwsSmjDDoyzeQ', 'authorChannelId': {'value': 'UClz58uc-Z3dwsSmjDDoyzeQ'}, 'canRate': True, 'viewerRating': 'none', 'likeCount': 2, 'publishedAt': '2022-10-26T11:43:17Z', 'updatedAt': '2022-10-26T11:43:17Z'}}, 'canReply': True, 'totalReplyCount': 0, 'isPublic': True}",,UClz58uc-Z3dwsSmjDDoyzeQ,2022-10-26T11:43:17Z,Abuso de poder de Alexandre de Moraes.,,2023-06-08 02:33:23.766415
youtube#commentThread,CeJVbQnHKoNqm0jfnQLBG8fOE6I,Ugx2By2MD1rVF5E7Vy14AaABAg,"{'videoId': 'xW5dpM3khvI', 'topLevelComment': {'kind': 'youtube#comment', 'etag': 'bAvLn4VChRjh6-7v_3_Q0Sck6Tk', 'id': 'Ugx2By2MD1rVF5E7Vy14AaABAg', 'snippet': {'videoId': 'xW5dpM3khvI', 'textDisplay': '13 Lula 13 Lula 13 Lula 13 Lula 13 Lula 13 Lula 13 Lula 13 Lula 13 o presidente', 'textOriginal': '13 Lula 13 Lula 13 Lula 13 Lula 13 Lula 13 Lula 13 Lula 13 Lula 13 o presidente', 'authorDisplayName': 'Maria Madalena', 'authorProfileImageUrl': 'https://yt3.ggpht.com/ytc/AGIKgqO4N1JosMhvoxiqkMe59bT2M9lwSmE_PejA0t3oUifN0-rFD6HU5shVE_Hvppyf=s48-c-k-c0x00ffffff-no-rj', 'authorChannelUrl': 'http://www.youtube.com/channel/UCyI505MnHiS4yus6ako8X1g', 'authorChannelId': {'value': 'UCyI505MnHiS4yus6ako8X1g'}, 'canRate': True, 'viewerRating': 'none', 'likeCount': 0, 'publishedAt': '2022-10-26T11:08:03Z', 'updatedAt': '2022-10-26T11:08:03Z'}}, 'canReply': True, 'totalReplyCount': 0, 'isPublic': True}",,UCyI505MnHiS4yus6ako8X1g,2022-10-26T11:08:03Z,13 Lula 13 Lula 13 Lula 13 Lula 13 Lula 13 Lula 13 Lula 13 Lula 13 o presidente,,2023-06-08 02:33:23.766415
youtube#commentThread,Nr1_YpD2fbohEQ6YS7s674IOLKM,Ugy_4gFljesR-uGtM6h4AaABAg,"{'videoId': 'xW5dpM3khvI', 'topLevelComment': {'kind': 'youtube#comment', 'etag': 'rrtxjhqUl9ZXUtU-vBaIyyKI_qQ', 'id': 'Ugy_4gFljesR-uGtM6h4AaABAg', 'snippet': {'videoId': 'xW5dpM3khvI', 'textDisplay': 'Isso é uma vergonha,como diz Boris casoy', 'textOriginal': 'Isso é uma vergonha,como diz Boris casoy', 'authorDisplayName': 'Mauro Sérgio dos santos', 'authorProfileImageUrl': 'https://yt3.ggpht.com/Xd3wgbNYOsn6RNONl4a1rVhYThQhOKLkpTYIA-KCgZicPkWsqW6J3t3vPEhfwFUONfwxtSH9=s48-c-k-c0x00ffffff-no-rj', 'authorChannelUrl': 'http://www.youtube.com/channel/UCwCjOcJ-CSnWDYlnLW7LsnA', 'authorChannelId': {'value': 'UCwCjOcJ-CSnWDYlnLW7LsnA'}, 'canRate': True, 'viewerRating': 'none', 'likeCount': 0, 'publishedAt': '2022-10-26T10:19:05Z', 'updatedAt': '2022-10-26T10:20:32Z'}}, 'canReply': True, 'totalReplyCount': 0, 'isPublic': True}",,UCwCjOcJ-CSnWDYlnLW7LsnA,2022-10-26T10:19:05Z,"Isso é uma vergonha,como diz Boris casoy",,2023-06-08 02:33:23.766415
youtube#commentThread,66CK04cztpkkqbMCHTaeTxIKjOs,UgzPtmS3LdorFCOltEJ4AaABAg,"{'videoId': 'xW5dpM3khvI', 'topLevelComment': {'kind': 'youtube#comment', 'etag': 'k6uhpMKL2TjokTJtyZAcHwTWagU', 'id': 'UgzPtmS3LdorFCOltEJ4AaABAg', 'snippet': {'videoId': 'xW5dpM3khvI', 'textDisplay': 'Evidentemente que sim...', 'textOriginal': 'Evidentemente que sim...', 'authorDisplayName': 'Jeferson Dias', 'authorProfileImageUrl': 'https://yt3.ggpht.com/ytc/AGIKgqMLLANybAn6FSFRCcCrtO-nE6WRu8CsDvCySQ=s48-c-k-c0x00ffffff-no-rj', 'authorChannelUrl': 'http://www.youtube.com/channel/UC_rPYeD6b3Ss15cAqT4RUgQ', 'authorChannelId': {'value': 'UC_rPYeD6b3Ss15cAqT4RUgQ'}, 'canRate': True, 'viewerRating': 'none', 'likeCount': 0, 'publishedAt': '2022-10-26T10:16:19Z', 'updatedAt': '2022-10-26T10:16:19Z'}}, 'canReply': True, 'totalReplyCount': 0, 'isPublic': True}",,UC_rPYeD6b3Ss15cAqT4RUgQ,2022-10-26T10:16:19Z,Evidentemente que sim...,,2023-06-08 02:33:23.766415
youtube#commentThread,lkYOXKAiG1GvJI-825qzZJFdjnU,UgwM-7vlmelUC7KF7N14AaABAg,"{'videoId': 'xW5dpM3khvI', 'topLevelComment': {'kind': 'youtube#comment', 'etag': 'TREQnXbFdYYB2IrdyCTSXKAeMek', 'id': 'UgwM-7vlmelUC7KF7N14AaABAg', 'snippet': {'videoId': 'xW5dpM3khvI', 'textDisplay': 'Só verdades', 'textOriginal': 'Só verdades', 'authorDisplayName': 'Lucas Abreu', 'authorProfileImageUrl': 'https://yt3.ggpht.com/ytc/AGIKgqMt4Dm2rVP2OEkwSa5UHhmsDN30q9MXle2LavuA6g=s48-c-k-c0x00ffffff-no-rj', 'authorChannelUrl': 'http://www.youtube.com/channel/UCXF66clii3MDqgXk3sgxq1A', 'authorChannelId': {'value': 'UCXF66clii3MDqgXk3sgxq1A'}, 'canRate': True, 'viewerRating': 'none', 'likeCount': 1, 'publishedAt': '2022-10-26T09:51:09Z', 'updatedAt': '2022-10-26T09:51:09Z'}}, 'canReply': True, 'totalReplyCount': 0, 'isPublic': True}",,UCXF66clii3MDqgXk3sgxq1A,2022-10-26T09:51:09Z,Só verdades,,2023-06-08 02:33:23.766415
youtube#commentThread,8u_DeCYCMdxxvUIJVA3tLh5Kz1c,UgzEFs4m0uqVomzPMvt4AaABAg,"{'videoId': 'xW5dpM3khvI', 'topLevelComment': {'kind': 'youtube#comment', 'etag': 'sh4il96dliMpKknsro-RegdNmWc', 'id': 'UgzEFs4m0uqVomzPMvt4AaABAg', 'snippet': {'videoId': 'xW5dpM3khvI', 'textDisplay': 'ESSA PESQUISA PARECE TER SIDO FEITA NOS GRUPOS DE WHATSZAP DO GADO..', 'textOriginal': 'ESSA PESQUISA PARECE TER SIDO FEITA NOS GRUPOS DE WHATSZAP DO GADO..', 'authorDisplayName': 'Geanderson Lopes De Souza', 'authorProfileImageUrl': 'https://yt3.ggpht.com/ytc/AGIKgqMG8NEthYDZjOItyLo9R03oI4ME_GXs49yxWa0W=s48-c-k-c0x00ffffff-no-rj', 'authorChannelUrl': 'http://www.youtube.com/channel/UCMwF8PYzOAR8EmOX_FcL6sg', 'authorChannelId': {'value': 'UCMwF8PYzOAR8EmOX_FcL6sg'}, 'canRate': True, 'viewerRating': 'none', 'likeCount': 0, 'publishedAt': '2022-10-26T09:21:41Z', 'updatedAt': '2022-10-26T09:21:41Z'}}, 'canReply': True, 'totalReplyCount': 0, 'isPublic': True}",,UCMwF8PYzOAR8EmOX_FcL6sg,2022-10-26T09:21:41Z,ESSA PESQUISA PARECE TER SIDO FEITA NOS GRUPOS DE WHATSZAP DO GADO..,,2023-06-08 02:33:23.766415
youtube#commentThread,Cz8F0COCpkR92L7L0plJGckcyN0,Ugyuzx5_qXABmWoyk0V4AaABAg,"{'videoId': 'xW5dpM3khvI', 'topLevelComment': {'kind': 'youtube#comment', 'etag': 'wl4IgDupdqkexBD-SrFKP7wxYZU', 'id': 'Ugyuzx5_qXABmWoyk0V4AaABAg', 'snippet': {'videoId': 'xW5dpM3khvI', 'textDisplay': 'MUITO SERIA ESTA PESQUISA,ESSA PESQUISA PERGUNTOU SE OS ENTREVISTADO SABE A FUNÇÃO DAS CORTES SUPERIORES?E TENHO CERTEZA QUE NÃO SABEM.E TENHO CERTEZA TAMBÉM 100% DESSES ENTREVISTADO SÃO TIETES DO BOLSONARO.GOSTARIA DE SABER A METODOLOGIA DESTA PESQUISA', 'textOriginal': 'MUITO SERIA ESTA PESQUISA,ESSA PESQUISA PERGUNTOU SE OS ENTREVISTADO SABE A FUNÇÃO DAS CORTES SUPERIORES?E TENHO CERTEZA QUE NÃO SABEM.E TENHO CERTEZA TAMBÉM 100% DESSES ENTREVISTADO SÃO TIETES DO BOLSONARO.GOSTARIA DE SABER A METODOLOGIA DESTA PESQUISA', 'authorDisplayName': 'Geanderson Lopes De Souza', 'authorProfileImageUrl': 'https://yt3.ggpht.com/ytc/AGIKgqMG8NEthYDZjOItyLo9R03oI4ME_GXs49yxWa0W=s48-c-k-c0x00ffffff-no-rj', 'authorChannelUrl': 'http://www.youtube.com/channel/UCMwF8PYzOAR8EmOX_FcL6sg', 'authorChannelId': {'value': 'UCMwF8PYzOAR8EmOX_FcL6sg'}, 'canRate': True, 'viewerRating': 'none', 'likeCount': 0, 'publishedAt': '2022-10-26T09:17:25Z', 'updatedAt': '2022-10-26T09:17:25Z'}}, 'canReply': True, 'totalReplyCount': 0, 'isPublic': True}",,UCMwF8PYzOAR8EmOX_FcL6sg,2022-10-26T09:17:25Z,"MUITO SERIA ESTA PESQUISA,ESSA PESQUISA PERGUNTOU SE OS ENTREVISTADO SABE A FUNÇÃO DAS CORTES SUPERIORES?E TENHO CERTEZA QUE NÃO SABEM.E TENHO CERTEZA TAMBÉM 100% DESSES ENTREVISTADO SÃO TIETES DO BOLSONARO.GOSTARIA DE SABER A METODOLOGIA DESTA PESQUISA",,2023-06-08 02:33:23.766415
youtube#commentThread,gCLq44A6EYpc6CYB7VuDSC2tcBc,UgzKc3X_xhVbuwf-V-14AaABAg,"{'videoId': 'xW5dpM3khvI', 'topLevelComment': {'kind': 'youtube#comment', 'etag': 'hFUJIncre9RAmnOhTPZLsak5FUk', 'id': 'UgzKc3X_xhVbuwf-V-14AaABAg', 'snippet': {'videoId': 'xW5dpM3khvI', 'textDisplay': 'Bolsonaro e as suas corrupções: rachadinha? E a corrupção do MEC, e a corrupção da Madeira, corrupção tratores, corrupção da Secom, corrupção Cerpej, corrupção do orçamento secreto no piaí….', 'textOriginal': 'Bolsonaro e as suas corrupções: rachadinha? E a corrupção do MEC, e a corrupção da Madeira, corrupção tratores, corrupção da Secom, corrupção Cerpej, corrupção do orçamento secreto no piaí….', 'authorDisplayName': 'A verdade vem de cima', 'authorProfileImageUrl': 'https://yt3.ggpht.com/r2asXMREGHbKelmWReeeX01iMaH3QecHSnQYGmEGBX-JoUa_51p3zndP0U1D-gKFMveDgaT5=s48-c-k-c0x00ffffff-no-rj', 'authorChannelUrl': 'http://www.youtube.com/channel/UCPejnFWowgtLRjBOixm8b5Q', 'authorChannelId': {'value': 'UCPejnFWowgtLRjBOixm8b5Q'}, 'canRate': True, 'viewerRating': 'none', 'likeCount': 0, 'publishedAt': '2022-10-26T08:01:15Z', 'updatedAt': '2022-10-26T08:01:15Z'}}, 'canReply': True, 'totalReplyCount': 0, 'isPublic': True}",,UCPejnFWowgtLRjBOixm8b5Q,2022-10-26T08:01:15Z,"Bolsonaro e as suas corrupções: rachadinha? E a corrupção do MEC, e a corrupção da Madeira, corrupção tratores, corrupção da Secom, corrupção Cerpej, corrupção do orçamento secreto no piaí….",,2023-06-08 02:33:23.766415
