kind,etag,id,snippet,replies,authorChannelId,publishedAt,textOriginal,nextPageToken,extraction_date
youtube#commentThread,1VAW2u8nG1aWmpM8q5d9KmfTJ-I,UgwSaiD9ds7RVaDyrF94AaABAg,"{'videoId': 'xW5dpM3khvI', 'topLevelComment': {'kind': 'youtube#comment', 'etag': 'K-bA1Lr88Jkd9xeG9PXN1S6_H-E', 'id': 'UgwSaiD9ds7RVaDyrF94AaABAg', 'snippet': {'videoId': 'xW5dpM3khvI', 'textDisplay': 'O STF faz tudo que o PT pede. censurar a jovem pan é o fim. Lula nem ganhou e já está assim. Censura nunca!', 'textOriginal': 'O STF faz tudo que o PT pede. censurar a jovem pan é o fim. Lula nem ganhou e já está assim. Censura nunca!', 'authorDisplayName': 'CB', 'authorProfileImageUrl': 'https://yt3.ggpht.com/rdVTGUMdrAbRllamPEdHxqGa81NPa_i8V3em66YSHQKuOpCNho8ki_8LOg5Bbc0fGBr7BeNCcAM=s48-c-k-c0x00ffffff-no-rj', 'authorChannelUrl': 'http://www.youtube.com/channel/UCC07CunJRsfCd1lzxsakzZw', 'authorChannelId': {'value': 'UCC07CunJRsfCd1lzxsakzZw'}, 'canRate': True, 'viewerRating': 'none', 'likeCount': 0, 'publishedAt': '2022-10-26T02:07:56Z', 'updatedAt': '2022-10-26T02:07:56Z'}}, 'canReply': True, 'totalReplyCount': 0, 'isPublic': True}",,UCC07CunJRsfCd1lzxsakzZw,2022-10-26T02:07:56Z,O STF faz tudo que o PT pede. censurar a jovem pan é o fim. Lula nem ganhou e já está assim. Censura nunca!,,2023-06-08 02:33:23.766415
youtube#commentThread,ing7CihE1LGeZHwuNf7lUoQKQQ0,UgxlHDw5XgERg8hW9Od4AaABAg,"{'videoId': 'xW5dpM3khvI', 'topLevelComment': {'kind': 'youtube#comment', 'etag': 'TaV5S8_rSXQ5M4lt3rMfYRCTkTg', 'id': 'UgxlHDw5XgERg8hW9Od4AaABAg', 'snippet': {'videoId': 'xW5dpM3khvI', 'textDisplay': 'STF entende de alguma coisa????<br>TSE ditadura da toga.   O povo acordou.<br><br>E agora váo fazer o quê??', 'textOriginal': 'STF entende de alguma coisa????\\nTSE ditadura da toga.   O povo acordou.\\n\\nE agora váo fazer o quê??', 'authorDisplayName': 'Paulo Verri', 'authorProfileImageUrl': 'https://yt3.ggpht.com/ytc/AGIKgqMXfRkpLDubuo7s2N1RJ917uMe1YmUsZAmjGw=s48-c-k-c0x00ffffff-no-rj', 'authorChannelUrl': 'http://www.youtube.com/channel/UCf76EBf5P0_KSXKK_a2LjGQ', 'authorChannelId': {'value': 'UCf76EBf5P0_KSXKK_a2LjGQ'}, 'canRate': True, 'viewerRating': 'none', 'likeCount': 0, 'publishedAt': '2022-10-26T01:57:24Z', 'updatedAt': '2022-10-26T01:57:24Z'}}, 'canReply': True, 'totalReplyCount': 0, 'isPublic': True}",,UCf76EBf5P0_KSXKK_a2LjGQ,2022-10-26T01:57:24Z,"STF entende de alguma coisa????
TSE ditadura da toga.   O povo acordou.

E agora váo fazer o quê??",,2023-06-08 02:33:23.766415
youtube#commentThread,nxRwvgF2MzGlmk5aQv4gh2EnbjE,Ugwfn6h1fPglXj-B67B4AaABAg,"{'videoId': 'xW5dpM3khvI', 'topLevelComment': {'kind': 'youtube#comment', 'etag': 'tLzY6k9Tzt0wUQQUnfuVQtd16R8', 'id': 'Ugwfn6h1fPglXj-B67B4AaABAg', 'snippet': {'videoId': 'xW5dpM3khvI', 'textDisplay': 'Você vive em Nardia ou é maucarátismo  mesmo William?', 'textOriginal': 'Você vive em Nardia ou é maucarátismo  mesmo William?', 'authorDisplayName': 'Jessé Oliveira Ulianópolis', 'authorProfileImageUrl': 'https://yt3.ggpht.com/ytc/AGIKgqOwGYlvFM-7k-R0GIMgT057hIu4gXyC3B-LXjQDyg=s48-c-k-c0x00ffffff-no-rj', 'authorChannelUrl': 'http://www.youtube.com/channel/UCaCKNOzN4_6loBqAj_LYjIA', 'authorChannelId': {'value': 'UCaCKNOzN4_6loBqAj_LYjIA'}, 'canRate': True, 'viewerRating': 'none', 'likeCount': 0, 'publishedAt': '2022-10-26T01:56:46Z', 'updatedAt': '2022-10-26T01:56:46Z'}}, 'canReply': True, 'totalReplyCount': 0, 'isPublic': True}",,UCaCKNOzN4_6loBqAj_LYjIA,2022-10-26T01:56:46Z,Você vive em Nardia ou é maucarátismo  mesmo William?,,2023-06-08 02:33:23.766415
youtube#commentThread,xesYEBRXtqbs0cvMajZ_qpHZf7Q,UgxA-JeqapF85VRweJ14AaABAg,"{'videoId': 'xW5dpM3khvI', 'topLevelComment': {'kind': 'youtube#comment', 'etag': 'MhTZ2JlN0W-VGInbhpCm8fn_bT8', 'id': 'UgxA-JeqapF85VRweJ14AaABAg', 'snippet': {'videoId': 'xW5dpM3khvI', 'textDisplay': 'Censura e proteção ao lulaladrao', 'textOriginal': 'Censura e proteção ao lulaladrao', 'authorDisplayName': 'Vera deforte', 'authorProfileImageUrl': 'https://yt3.ggpht.com/ytc/AGIKgqNKlsuFaK7Y7lGZUgAxfYkNqlCUp3TfK-Axvw=s48-c-k-c0x00ffffff-no-rj', 'authorChannelUrl': 'http://www.youtube.com/channel/UC4h0747r8NPvGLqd19zCWqw', 'authorChannelId': {'value': 'UC4h0747r8NPvGLqd19zCWqw'}, 'canRate': True, 'viewerRating': 'none', 'likeCount': 0, 'publishedAt': '2022-10-26T01:53:30Z', 'updatedAt': '2022-10-26T01:53:30Z'}}, 'canReply': True, 'totalReplyCount': 0, 'isPublic': True}",,UC4h0747r8NPvGLqd19zCWqw,2022-10-26T01:53:30Z,Censura e proteção ao lulaladrao,,2023-06-08 02:33:23.766415
youtube#commentThread,q-LePHhrcIGK1Waj7rU4F_iVLyI,UgzfO8VX5gtSKtkdwql4AaABAg,"{'videoId': 'xW5dpM3khvI', 'topLevelComment': {'kind': 'youtube#comment', 'etag': 'dIZ4ujTt4F_OekgSnkWxz2-IY0g', 'id': 'UgzfO8VX5gtSKtkdwql4AaABAg', 'snippet': {'videoId': 'xW5dpM3khvI', 'textDisplay': 'Lula dando tapinha no ministro do TSE e o ministro respondendo &quot;depois te ligo&quot;, quer maior prova que isso?', 'textOriginal': 'Lula dando tapinha no ministro do TSE e o ministro respondendo ""depois te ligo"", quer maior prova que isso?', 'authorDisplayName': 'tiago barisao', 'authorProfileImageUrl': 'https://yt3.ggpht.com/ytc/AGIKgqNX4onFyUeemNlmCZNT9LZD6sB4KV1t9FmbB8bT=s48-c-k-c0x00ffffff-no-rj', 'authorChannelUrl': 'http://www.youtube.com/channel/UCkH-g4JgtJ_JItMDFCQTjRg', 'authorChannelId': {'value': 'UCkH-g4JgtJ_JItMDFCQTjRg'}, 'canRate': True, 'viewerRating': 'none', 'likeCount': 0, 'publishedAt': '2022-10-26T01:49:12Z', 'updatedAt': '2022-10-26T01:53:58Z'}}, 'canReply': True, 'totalReplyCount': 0, 'isPublic': True}",,UCkH-g4JgtJ_JItMDFCQTjRg,2022-10-26T01:49:12Z,"Lula dando tapinha no ministro do TSE e o ministro respondendo ""depois te ligo"", quer maior prova que isso?",,2023-06-08 02:33:23.766415
youtube#commentThread,KIG57B4DnfPdKBd6f0rj-q0Tw9E,UgwdIRQELe5PuQKBZWJ4AaABAg,"{'videoId': 'xW5dpM3khvI', 'topLevelComment': {'kind': 'youtube#comment', 'etag': 'wqfku7muwDFNrWgqHRp0VdNv-pI', 'id': 'UgwdIRQELe5PuQKBZWJ4AaABAg', 'snippet': {'videoId': 'xW5dpM3khvI', 'textDisplay': 'como um par do STF  estando no STE vaise impedido ????', 'textOriginal': 'como um par do STF  estando no STE vaise impedido ????', 'authorDisplayName': 'Francisco miorim', 'authorProfileImageUrl': 'https://yt3.ggpht.com/ytc/AGIKgqPXPwaBg_2-fJWfH_Q6y4acMF3nGzEnvzE49z17wg=s48-c-k-c0x00ffffff-no-rj', 'authorChannelUrl': 'http://www.youtube.com/channel/UCZkJPs4H09K7iw41a-jpCVA', 'authorChannelId': {'value': 'UCZkJPs4H09K7iw41a-jpCVA'}, 'canRate': True, 'viewerRating': 'none', 'likeCount': 0, 'publishedAt': '2022-10-26T01:47:20Z', 'updatedAt': '2022-10-26T01:47:20Z'}}, 'canReply': True, 'totalReplyCount': 0, 'isPublic': True}",,UCZkJPs4H09K7iw41a-jpCVA,2022-10-26T01:47:20Z,como um par do STF  estando no STE vaise impedido ????,,2023-06-08 02:33:23.766415
youtube#commentThread,6Rg1BvDk-9FAW3cfEripyC2I2Do,Ugz8ZKEKnL4PslkcyLJ4AaABAg,"{'videoId': 'xW5dpM3khvI', 'topLevelComment': {'kind': 'youtube#comment', 'etag': 'KkFco5Rh2MSC1jZs5jMaarePy0s', 'id': 'Ugz8ZKEKnL4PslkcyLJ4AaABAg', 'snippet': {'videoId': 'xW5dpM3khvI', 'textDisplay': 'A gente sabe muito bem quem é favor da ditadura.', 'textOriginal': 'A gente sabe muito bem quem é favor da ditadura.', 'authorDisplayName': 'Rosana Barbosa', 'authorProfileImageUrl': 'https://yt3.ggpht.com/ytc/AGIKgqNVyDZT9jruomOZy3Nz-fFBGsHib15rlh64Pg=s48-c-k-c0x00ffffff-no-rj', 'authorChannelUrl': 'http://www.youtube.com/channel/UCXuGmPxeHltzO8ME3VkpERQ', 'authorChannelId': {'value': 'UCXuGmPxeHltzO8ME3VkpERQ'}, 'canRate': True, 'viewerRating': 'none', 'likeCount': 0, 'publishedAt': '2022-10-26T01:47:01Z', 'updatedAt': '2022-10-26T01:47:01Z'}}, 'canReply': True, 'totalReplyCount': 0, 'isPublic': True}",,UCXuGmPxeHltzO8ME3VkpERQ,2022-10-26T01:47:01Z,A gente sabe muito bem quem é favor da ditadura.,,2023-06-08 02:33:23.766415
youtube#commentThread,fJJL5RFjj-PNaw3qSfgxkjtIJQM,UgyqJNlJPH7LObpG_wR4AaABAg,"{'videoId': 'xW5dpM3khvI', 'topLevelComment': {'kind': 'youtube#comment', 'etag': 'zOxq2rKePpNUhAPlZGl-GCEYk6k', 'id': 'UgyqJNlJPH7LObpG_wR4AaABAg', 'snippet': {'videoId': 'xW5dpM3khvI', 'textDisplay': 'Judiciário faz campanha clara e aberta para o PT, desde a descondenação até a censura de certas palavras que o PT julga desinteressantes para sua campanha.', 'textOriginal': 'Judiciário faz campanha clara e aberta para o PT, desde a descondenação até a censura de certas palavras que o PT julga desinteressantes para sua campanha.', 'authorDisplayName': 'Fabio Oliveira', 'authorProfileImageUrl': 'https://yt3.ggpht.com/ytc/AGIKgqMyZz1fVv4sSdKuI51Cxy4HOTn-PjsUtWHoeg=s48-c-k-c0x00ffffff-no-rj', 'authorChannelUrl': 'http://www.youtube.com/channel/UCOM-eOAzTaw-prt_dCIOBYA', 'authorChannelId': {'value': 'UCOM-eOAzTaw-prt_dCIOBYA'}, 'canRate': True, 'viewerRating': 'none', 'likeCount': 15, 'publishedAt': '2022-10-26T01:43:51Z', 'updatedAt': '2022-10-26T01:43:51Z'}}, 'canReply': True, 'totalReplyCount': 0, 'isPublic': True}",,UCOM-eOAzTaw-prt_dCIOBYA,2022-10-26T01:43:51Z,"Judiciário faz campanha clara e aberta para o PT, desde a descondenação até a censura de certas palavras que o PT julga desinteressantes para sua campanha.",,2023-06-08 02:33:23.766415
youtube#commentThread,Pm1pGDocRdzDgnXmd8RRsAOiFjE,UgxeyvDYs10l1fSTBx14AaABAg,"{'videoId': 'xW5dpM3khvI', 'topLevelComment': {'kind': 'youtube#comment', 'etag': 'Tbf_rWcsfPvNQYrMXmWhdyKV8Fo', 'id': 'UgxeyvDYs10l1fSTBx14AaABAg', 'snippet': {'videoId': 'xW5dpM3khvI', 'textDisplay': 'Essa é a verdadeira ditadura judicial, o benefício é claro ao PTse', 'textOriginal': 'Essa é a verdadeira ditadura judicial, o benefício é claro ao PTse', 'authorDisplayName': 'ricardo morais', 'authorProfileImageUrl': 'https://yt3.ggpht.com/ytc/AGIKgqMEOHQZcK0r3MOEj3I88MSbajG6FisbP-HX4A=s48-c-k-c0x00ffffff-no-rj', 'authorChannelUrl': 'http://www.youtube.com/channel/UCnbN_K9K465Re2tP0fXwLdw', 'authorChannelId': {'value': 'UCnbN_K9K465Re2tP0fXwLdw'}, 'canRate': True, 'viewerRating': 'none', 'likeCount': 1, 'publishedAt': '2022-10-26T01:43:35Z', 'updatedAt': '2022-10-26T01:43:35Z'}}, 'canReply': True, 'totalReplyCount': 0, 'isPublic': True}",,UCnbN_K9K465Re2tP0fXwLdw,2022-10-26T01:43:35Z,"Essa é a verdadeira ditadura judicial, o benefício é claro ao PTse",,2023-06-08 02:33:23.766415
youtube#commentThread,gS5ijudz6LmObL1fSs-YqgejaTM,UgyIxRERfdEe7b2FclF4AaABAg,"{'videoId': 'xW5dpM3khvI', 'topLevelComment': {'kind': 'youtube#comment', 'etag': 'E1MZRyFV-XhZBg7ATMrtPbfsXgI', 'id': 'UgyIxRERfdEe7b2FclF4AaABAg', 'snippet': {'videoId': 'xW5dpM3khvI', 'textDisplay': 'Eu odeio esse bolsoloide retardado, mas decidi votar nele mesmo, por causa desse absurdo de censura. O pior e ver emissoras que enchiam a boca pra falar de liberdade de imprensa e agora apoiam censura.🤮', 'textOriginal': 'Eu odeio esse bolsoloide retardado, mas decidi votar nele mesmo, por causa desse absurdo de censura. O pior e ver emissoras que enchiam a boca pra falar de liberdade de imprensa e agora apoiam censura.🤮', 'authorDisplayName': 'Marcelo Andriolo', 'authorProfileImageUrl': 'https://yt3.ggpht.com/Uk0MGhvTsWXsleYf2yrTA0WbUaliaqlHbfaGO2Z03tVmPV-7PMQrtFlNtHSKuA5qgnMdwrxi=s48-c-k-c0x00ffffff-no-rj', 'authorChannelUrl': 'http://www.youtube.com/channel/UCTwbMo8peLKXuS2ACxHWXVA', 'authorChannelId': {'value': 'UCTwbMo8peLKXuS2ACxHWXVA'}, 'canRate': True, 'viewerRating': 'none', 'likeCount': 0, 'publishedAt': '2022-10-26T01:43:32Z', 'updatedAt': '2022-10-26T01:43:32Z'}}, 'canReply': True, 'totalReplyCount': 0, 'isPublic': True}",,UCTwbMo8peLKXuS2ACxHWXVA,2022-10-26T01:43:32Z,"Eu odeio esse bolsoloide retardado, mas decidi votar nele mesmo, por causa desse absurdo de censura. O pior e ver emissoras que enchiam a boca pra falar de liberdade de imprensa e agora apoiam censura.🤮",,2023-06-08 02:33:23.766415
youtube#commentThread,VBI1jfQ-HAe3TGvw3kW3uCsUfyQ,Ugx4ij3FBX3Nm1zcKbV4AaABAg,"{'videoId': 'xW5dpM3khvI', 'topLevelComment': {'kind': 'youtube#comment', 'etag': 'azBYqQ227nA-fKgpQMNR5jNqAcg', 'id': 'Ugx4ij3FBX3Nm1zcKbV4AaABAg', 'snippet': {'videoId': 'xW5dpM3khvI', 'textDisplay': 'Alguem tem duvidas? Censura, perseguição, violacões da constituição, ministro aumentando poderes na canetada, se dando poder de policia, descartando o MP. Acorda povo, é hora de lutar contra esses tiranos.', 'textOriginal': 'Alguem tem duvidas? Censura, perseguição, violacões da constituição, ministro aumentando poderes na canetada, se dando poder de policia, descartando o MP. Acorda povo, é hora de lutar contra esses tiranos.', 'authorDisplayName': 'Marcelo Andriolo', 'authorProfileImageUrl': 'https://yt3.ggpht.com/Uk0MGhvTsWXsleYf2yrTA0WbUaliaqlHbfaGO2Z03tVmPV-7PMQrtFlNtHSKuA5qgnMdwrxi=s48-c-k-c0x00ffffff-no-rj', 'authorChannelUrl': 'http://www.youtube.com/channel/UCTwbMo8peLKXuS2ACxHWXVA', 'authorChannelId': {'value': 'UCTwbMo8peLKXuS2ACxHWXVA'}, 'canRate': True, 'viewerRating': 'none', 'likeCount': 0, 'publishedAt': '2022-10-26T01:38:48Z', 'updatedAt': '2022-10-26T01:38:48Z'}}, 'canReply': True, 'totalReplyCount': 0, 'isPublic': True}",,UCTwbMo8peLKXuS2ACxHWXVA,2022-10-26T01:38:48Z,"Alguem tem duvidas? Censura, perseguição, violacões da constituição, ministro aumentando poderes na canetada, se dando poder de policia, descartando o MP. Acorda povo, é hora de lutar contra esses tiranos.",,2023-06-08 02:33:23.766415
youtube#commentThread,ozdg8ceA9MNQV9x20iTsTAvBR9o,UgxJrNUeiPsAt5g7ZAx4AaABAg,"{'videoId': 'xW5dpM3khvI', 'topLevelComment': {'kind': 'youtube#comment', 'etag': 'uGgb4ce6TaJaVFobE7NrSqzKsH0', 'id': 'UgxJrNUeiPsAt5g7ZAx4AaABAg', 'snippet': {'videoId': 'xW5dpM3khvI', 'textDisplay': 'Verdade muito triste 😢', 'textOriginal': 'Verdade muito triste 😢', 'authorDisplayName': 'Marcos ccb Rodrigues', 'authorProfileImageUrl': 'https://yt3.ggpht.com/FwTnwf5bgGH3N-jEKFw399upbhTRgJAkUfmrulDPtYiWTRbf4-LdwFvZiJTyHgqPIdDlrevD=s48-c-k-c0x00ffffff-no-rj', 'authorChannelUrl': 'http://www.youtube.com/channel/UCdtrY3EqJynWHEGP-VPRHGQ', 'authorChannelId': {'value': 'UCdtrY3EqJynWHEGP-VPRHGQ'}, 'canRate': True, 'viewerRating': 'none', 'likeCount': 2, 'publishedAt': '2022-10-26T01:38:45Z', 'updatedAt': '2022-10-26T01:38:45Z'}}, 'canReply': True, 'totalReplyCount': 0, 'isPublic': True}",,UCdtrY3EqJynWHEGP-VPRHGQ,2022-10-26T01:38:45Z,Verdade muito triste 😢,,2023-06-08 02:33:23.766415
youtube#commentThread,ajcJZSYnrveCpUKCWbWifmp1aHk,UgwviYdKMlqN9sDOIlp4AaABAg,"{'videoId': 'xW5dpM3khvI', 'topLevelComment': {'kind': 'youtube#comment', 'etag': '6XKKpGo7PTNyEXspQ9JeBL-YbZk', 'id': 'UgwviYdKMlqN9sDOIlp4AaABAg', 'snippet': {'videoId': 'xW5dpM3khvI', 'textDisplay': 'Resumindo, um dos lados reinvindica o direito de mentir, que lhe é negado pelos juízes, porque eles consideram que mentir é errado. Que situação hein?', 'textOriginal': 'Resumindo, um dos lados reinvindica o direito de mentir, que lhe é negado pelos juízes, porque eles consideram que mentir é errado. Que situação hein?', 'authorDisplayName': 'Nemo Nemo', 'authorProfileImageUrl': 'https://yt3.ggpht.com/ytc/AGIKgqMw-Du4IBARYcyJF-v36x6ocpXcooLQQGgBdoo-0-GKlOBI2Nshx1MZFM72Hwrl=s48-c-k-c0x00ffffff-no-rj', 'authorChannelUrl': 'http://www.youtube.com/channel/UClNGCV55pqMy-iDzLwBDLbw', 'authorChannelId': {'value': 'UClNGCV55pqMy-iDzLwBDLbw'}, 'canRate': True, 'viewerRating': 'none', 'likeCount': 4, 'publishedAt': '2022-10-26T01:35:46Z', 'updatedAt': '2022-10-26T01:35:46Z'}}, 'canReply': True, 'totalReplyCount': 3, 'isPublic': True}","{'comments': [{'kind': 'youtube#comment', 'etag': 'Bg3Z4R3VsUC0-Gl-COUrBjyioTo', 'id': 'UgwviYdKMlqN9sDOIlp4AaABAg.9hceuP5a_hD9hdqWIO0SmN', 'snippet': {'videoId': 'xW5dpM3khvI', 'textDisplay': 'ou qdo outro jornal americano estava zombando da nossa politica cujo eles classificaram como um sistema onde 1 unico homem pode simplesmente decidir o q pode ou nao ser publicado online, dai noossa os caras aqui dando chilique. Mas eles, novamente, estavam mostrando apenas a real para os americanos.', 'textOriginal': 'ou qdo outro jornal americano estava zombando da nossa politica cujo eles classificaram como um sistema onde 1 unico homem pode simplesmente decidir o q pode ou nao ser publicado online, dai noossa os caras aqui dando chilique. Mas eles, novamente, estavam mostrando apenas a real para os americanos.', 'parentId': 'UgwviYdKMlqN9sDOIlp4AaABAg', 'authorDisplayName': 'D Deimos', 'authorProfileImageUrl': 'https://yt3.ggpht.com/ytc/AGIKgqPEc4EyDGhd-n5GSuqTeix-u9QpmWa94qF-2zkvgA=s48-c-k-c0x00ffffff-no-rj', 'authorChannelUrl': 'http://www.youtube.com/channel/UCjykl1888Rztl0CC8J3EXSw', 'authorChannelId': {'value': 'UCjykl1888Rztl0CC8J3EXSw'}, 'canRate': True, 'viewerRating': 'none', 'likeCount': 0, 'publishedAt': '2022-10-26T12:36:27Z', 'updatedAt': '2022-10-26T12:36:27Z'}}, {'kind': 'youtube#comment', 'etag': 'VfdlGT-h_2R8s-tSJJ52xr2Zpn8', 'id': 'UgwviYdKMlqN9sDOIlp4AaABAg.9hceuP5a_hD9hdqI6ziGss', 'snippet': {'videoId': 'xW5dpM3khvI', 'textDisplay': 'e na verdade continuam dando chilique. qdo saiu agora no jornal americano q na realidade o barba foi solto por uma manobra de detalhe tecnico judicial mas q ele de fato foi provado culpado. NOOSSA, os caras aqui no Brasil tudo dando chilique e reclamando. mas o jornal americano apenas disse a verdade para os americanos.', 'textOriginal': 'e na verdade continuam dando chilique. qdo saiu agora no jornal americano q na realidade o barba foi solto por uma manobra de detalhe tecnico judicial mas q ele de fato foi provado culpado. NOOSSA, os caras aqui no Brasil tudo dando chilique e reclamando. mas o jornal americano apenas disse a verdade para os americanos.', 'parentId': 'UgwviYdKMlqN9sDOIlp4AaABAg', 'authorDisplayName': 'D Deimos', 'authorProfileImageUrl': 'https://yt3.ggpht.com/ytc/AGIKgqPEc4EyDGhd-n5GSuqTeix-u9QpmWa94qF-2zkvgA=s48-c-k-c0x00ffffff-no-rj', 'authorChannelUrl': 'http://www.youtube.com/channel/UCjykl1888Rztl0CC8J3EXSw', 'authorChannelId': {'value': 'UCjykl1888Rztl0CC8J3EXSw'}, 'canRate': True, 'viewerRating': 'none', 'likeCount': 0, 'publishedAt': '2022-10-26T12:34:30Z', 'updatedAt': '2022-10-26T12:34:30Z'}}, {'kind': 'youtube#comment', 'etag': '7xlMNhp04X1aIRT7BurYPwWKdz0', 'id': 'UgwviYdKMlqN9sDOIlp4AaABAg.9hceuP5a_hD9hdq3IhLCpK', 'snippet': {'videoId': 'xW5dpM3khvI', 'textDisplay': 'vc esta sendo evidentemente parcial APENAS pq neste caso te convem. Mas vcs, qdo a coisa foi contra o barba ficaram dando chilique', 'textOriginal': 'vc esta sendo evidentemente parcial APENAS pq neste caso te convem. Mas vcs, qdo a coisa foi contra o barba ficaram dando chilique', 'parentId': 'UgwviYdKMlqN9sDOIlp4AaABAg', 'authorDisplayName': 'D Deimos', 'authorProfileImageUrl': 'https://yt3.ggpht.com/ytc/AGIKgqPEc4EyDGhd-n5GSuqTeix-u9QpmWa94qF-2zkvgA=s48-c-k-c0x00ffffff-no-rj', 'authorChannelUrl': 'http://www.youtube.com/channel/UCjykl1888Rztl0CC8J3EXSw', 'authorChannelId': {'value': 'UCjykl1888Rztl0CC8J3EXSw'}, 'canRate': True, 'viewerRating': 'none', 'likeCount': 0, 'publishedAt': '2022-10-26T12:32:29Z', 'updatedAt': '2022-10-26T12:32:29Z'}}]}",UClNGCV55pqMy-iDzLwBDLbw,2022-10-26T01:35:46Z,"Resumindo, um dos lados reinvindica o direito de mentir, que lhe é negado pelos juízes, porque eles consideram que mentir é errado. Que situação hein?",,2023-06-08 02:33:23.766415
youtube#commentThread,v2Df8xc2BhKI1LmNkf3DnHx3Xrs,UgwfRsEhA13QHiIHcUV4AaABAg,"{'videoId': 'xW5dpM3khvI', 'topLevelComment': {'kind': 'youtube#comment', 'etag': 'AC7h0EK5V9R0YXTfbqJv4H8NZak', 'id': 'UgwfRsEhA13QHiIHcUV4AaABAg', 'snippet': {'videoId': 'xW5dpM3khvI', 'textDisplay': 'Muito bom, heim!', 'textOriginal': 'Muito bom, heim!', 'authorDisplayName': 'EDER LIRA', 'authorProfileImageUrl': 'https://yt3.ggpht.com/ytc/AGIKgqMcy_DwoE4OFGj6oZr2tSXK-mpr7UdVgesJAZ8A=s48-c-k-c0x00ffffff-no-rj', 'authorChannelUrl': 'http://www.youtube.com/channel/UC5Prgec3ItLjBSrHNZBCHeA', 'authorChannelId': {'value': 'UC5Prgec3ItLjBSrHNZBCHeA'}, 'canRate': True, 'viewerRating': 'none', 'likeCount': 1, 'publishedAt': '2022-10-26T01:34:03Z', 'updatedAt': '2022-10-26T01:34:03Z'}}, 'canReply': True, 'totalReplyCount': 0, 'isPublic': True}",,UC5Prgec3ItLjBSrHNZBCHeA,2022-10-26T01:34:03Z,"Muito bom, heim!",,2023-06-08 02:33:23.766415
youtube#commentThread,G6LJFASpwe8jb3HFkUz_yCSdNIc,UgwdyFA_BR4zitgCaNF4AaABAg,"{'videoId': 'xW5dpM3khvI', 'topLevelComment': {'kind': 'youtube#comment', 'etag': 'JN33dnj7t8B-pSk5QvZAbZNq4Pw', 'id': 'UgwdyFA_BR4zitgCaNF4AaABAg', 'snippet': {'videoId': 'xW5dpM3khvI', 'textDisplay': '🇧🇷🤐🇧🇷', 'textOriginal': '🇧🇷🤐🇧🇷', 'authorDisplayName': 'Caio fxam', 'authorProfileImageUrl': 'https://yt3.ggpht.com/Y3JtMmah_a0SgQPCYaD109T8Qld-5nyBNN6pdMNF5oFjD11fXz2Ha5zRh3nfoEYZQIxnTZogig=s48-c-k-c0x00ffffff-no-rj', 'authorChannelUrl': 'http://www.youtube.com/channel/UCFnSiJJuqZe9FOMy_8jup6w', 'authorChannelId': {'value': 'UCFnSiJJuqZe9FOMy_8jup6w'}, 'canRate': True, 'viewerRating': 'none', 'likeCount': 3, 'publishedAt': '2022-10-26T01:32:54Z', 'updatedAt': '2022-10-26T01:32:54Z'}}, 'canReply': True, 'totalReplyCount': 0, 'isPublic': True}",,UCFnSiJJuqZe9FOMy_8jup6w,2022-10-26T01:32:54Z,🇧🇷🤐🇧🇷,,2023-06-08 02:33:23.766415
youtube#commentThread,xY_rJly_CYyoKUrlbS2uNet7p5A,Ugw1mkikYfW1zZ_EvzB4AaABAg,"{'videoId': 'xW5dpM3khvI', 'topLevelComment': {'kind': 'youtube#comment', 'etag': 'Cwkl1PyxL_NBy_OQplFgL9OeT8o', 'id': 'Ugw1mkikYfW1zZ_EvzB4AaABAg', 'snippet': {'videoId': 'xW5dpM3khvI', 'textDisplay': 'Waack concerteza ditadura, censura. O Desembargador Coelho na JP direto ao ponto já disse STF promove uma semiditadura. Isso é grave. Senadores e OAB assistem sem se manifestar o piloto é o Moraes e seus companheiros embarcados nesse vôo não estão se importando onde esse avião vai cair e bater e muito menos se eles mesmos irão sobreviver. Viva a liberdade, viva a JP. Liberdade Brasil. Dia 30 diga não a censura, vote em Bolsonaro. O STF/TSE  hoje é sinônimo de vergonha', 'textOriginal': 'Waack concerteza ditadura, censura. O Desembargador Coelho na JP direto ao ponto já disse STF promove uma semiditadura. Isso é grave. Senadores e OAB assistem sem se manifestar o piloto é o Moraes e seus companheiros embarcados nesse vôo não estão se importando onde esse avião vai cair e bater e muito menos se eles mesmos irão sobreviver. Viva a liberdade, viva a JP. Liberdade Brasil. Dia 30 diga não a censura, vote em Bolsonaro. O STF/TSE  hoje é sinônimo de vergonha', 'authorDisplayName': 'João Paulo dos Santos', 'authorProfileImageUrl': 'https://yt3.ggpht.com/ytc/AGIKgqOm2KqvQxMV8EYEr2fhnfoTYyWvt0SjJRWvNQ=s48-c-k-c0x00ffffff-no-rj', 'authorChannelUrl': 'http://www.youtube.com/channel/UCXQPCCJxKXQp7mq_ilmN-2g', 'authorChannelId': {'value': 'UCXQPCCJxKXQp7mq_ilmN-2g'}, 'canRate': True, 'viewerRating': 'none', 'likeCount': 0, 'publishedAt': '2022-10-26T01:32:41Z', 'updatedAt': '2022-10-26T01:41:34Z'}}, 'canReply': True, 'totalReplyCount': 0, 'isPublic': True}",,UCXQPCCJxKXQp7mq_ilmN-2g,2022-10-26T01:32:41Z,"Waack concerteza ditadura, censura. O Desembargador Coelho na JP direto ao ponto já disse STF promove uma semiditadura. Isso é grave. Senadores e OAB assistem sem se manifestar o piloto é o Moraes e seus companheiros embarcados nesse vôo não estão se importando onde esse avião vai cair e bater e muito menos se eles mesmos irão sobreviver. Viva a liberdade, viva a JP. Liberdade Brasil. Dia 30 diga não a censura, vote em Bolsonaro. O STF/TSE  hoje é sinônimo de vergonha",,2023-06-08 02:33:23.766415
youtube#commentThread,ef9mBEtzA1-bA-r31ugBvwNp7Qs,Ugztgtg6fig8GASpvIt4AaABAg,"{'videoId': 'xW5dpM3khvI', 'topLevelComment': {'kind': 'youtube#comment', 'etag': 'tA4Ek7vnIeBA1A2-JfJDIGXi_us', 'id': 'Ugztgtg6fig8GASpvIt4AaABAg', 'snippet': {'videoId': 'xW5dpM3khvI', 'textDisplay': 'Quem fez essa polarização perigosa no nosso país  bolsonaro um ditador  que não pode continuar no poder', 'textOriginal': 'Quem fez essa polarização perigosa no nosso país  bolsonaro um ditador  que não pode continuar no poder', 'authorDisplayName': 'Arnor Arnor', 'authorProfileImageUrl': 'https://yt3.ggpht.com/ytc/AGIKgqMWimUDSj0QH9BKTzcYKp5gnOyS7_KVKC5aryBE67C1I28Y6duIU0MQo9hyylLD=s48-c-k-c0x00ffffff-no-rj', 'authorChannelUrl': 'http://www.youtube.com/channel/UCpw0DlL6PIs74FF2zk6YUbw', 'authorChannelId': {'value': 'UCpw0DlL6PIs74FF2zk6YUbw'}, 'canRate': True, 'viewerRating': 'none', 'likeCount': 0, 'publishedAt': '2022-10-26T01:29:54Z', 'updatedAt': '2022-10-26T01:29:54Z'}}, 'canReply': True, 'totalReplyCount': 0, 'isPublic': True}",,UCpw0DlL6PIs74FF2zk6YUbw,2022-10-26T01:29:54Z,Quem fez essa polarização perigosa no nosso país  bolsonaro um ditador  que não pode continuar no poder,,2023-06-08 02:33:23.766415
youtube#commentThread,T93PSyXGKJ0BwJQXpSgNe4eEV6c,UgxquQmwNfmcDXsILUh4AaABAg,"{'videoId': 'xW5dpM3khvI', 'topLevelComment': {'kind': 'youtube#comment', 'etag': 'uz6Ks-vIckHZ1lzlWT_vX4PWmzM', 'id': 'UgxquQmwNfmcDXsILUh4AaABAg', 'snippet': {'videoId': 'xW5dpM3khvI', 'textDisplay': '👏👏👏👏👏👏👏 isso, isso 👏', 'textOriginal': '👏👏👏👏👏👏👏 isso, isso 👏', 'authorDisplayName': 'Marcos Rodrigues', 'authorProfileImageUrl': 'https://yt3.ggpht.com/ytc/AGIKgqOvhQogb1uf5tREYTyxJ6FFIHNgAP7K1y42EiLjwQ=s48-c-k-c0x00ffffff-no-rj', 'authorChannelUrl': 'http://www.youtube.com/channel/UCV0rgnrA5QOF9pkKtp01nXw', 'authorChannelId': {'value': 'UCV0rgnrA5QOF9pkKtp01nXw'}, 'canRate': True, 'viewerRating': 'none', 'likeCount': 1, 'publishedAt': '2022-10-26T01:29:18Z', 'updatedAt': '2022-10-26T01:29:18Z'}}, 'canReply': True, 'totalReplyCount': 0, 'isPublic': True}",,UCV0rgnrA5QOF9pkKtp01nXw,2022-10-26T01:29:18Z,"👏👏👏👏👏👏👏 isso, isso 👏",,2023-06-08 02:33:23.766415
