kind,etag,id,snippet,replies,authorChannelId,publishedAt,textOriginal,nextPageToken,extraction_date
youtube#commentThread,LEZOOjcJNcMIPQZd02QhC6Ru2xs,UgyoDeCZiTA8m4kZRuB4AaABAg,"{'videoId': 'Fz0PCYu4hJg', 'topLevelComment': {'kind': 'youtube#comment', 'etag': 'migcFN4YtIDdn7BxY4ov5UudW2U', 'id': 'UgyoDeCZiTA8m4kZRuB4AaABAg', 'snippet': {'videoId': 'Fz0PCYu4hJg', 'textDisplay': 'Lucifer será vencido', 'textOriginal': 'Lucifer será vencido', 'authorDisplayName': 'Sah', 'authorProfileImageUrl': 'https://yt3.ggpht.com/NbopgNnlL6CD3giF9X9slhh16axw9vxI-zwLhHf0C5GRo6o-YtBqaY-r_oOmHkHfLOrAQOLmeQ=s48-c-k-c0x00ffffff-no-rj', 'authorChannelUrl': 'http://www.youtube.com/channel/UCcDNIACt2hsu5IGrJ-Lundw', 'authorChannelId': {'value': 'UCcDNIACt2hsu5IGrJ-Lundw'}, 'canRate': True, 'viewerRating': 'none', 'likeCount': 0, 'publishedAt': '2022-10-12T21:03:45Z', 'updatedAt': '2022-10-12T21:03:45Z'}}, 'canReply': True, 'totalReplyCount': 0, 'isPublic': True}",,UCcDNIACt2hsu5IGrJ-Lundw,2022-10-12T21:03:45Z,Lucifer será vencido,,2023-06-08 11:07:43.966008
youtube#commentThread,zvlLvRK-gzci5cXdyQQ6Z1vNyPc,Ugz0kz5FVyOlH4LE2qB4AaABAg,"{'videoId': 'Fz0PCYu4hJg', 'topLevelComment': {'kind': 'youtube#comment', 'etag': 'WF1Z9rcHT9i0svQ75U2zHxOGVvE', 'id': 'Ugz0kz5FVyOlH4LE2qB4AaABAg', 'snippet': {'videoId': 'Fz0PCYu4hJg', 'textDisplay': 'No nordeste tá todo mundo ganhando 50 conto pra votar no vermelho demônio,viva cuba e Venezuela seus filhos e netos passaram fome a vida inteira.....', 'textOriginal': 'No nordeste tá todo mundo ganhando 50 conto pra votar no vermelho demônio,viva cuba e Venezuela seus filhos e netos passaram fome a vida inteira.....', 'authorDisplayName': 'Ricardo C J', 'authorProfileImageUrl': 'https://yt3.ggpht.com/ytc/AGIKgqNxkqdoMakERjLFA5cFozbmlalHQU7pgj8RZg=s48-c-k-c0x00ffffff-no-rj', 'authorChannelUrl': 'http://www.youtube.com/channel/UCjmtsOQtepgmbR6VWkvJv2w', 'authorChannelId': {'value': 'UCjmtsOQtepgmbR6VWkvJv2w'}, 'canRate': True, 'viewerRating': 'none', 'likeCount': 1, 'publishedAt': '2022-10-12T21:01:45Z', 'updatedAt': '2022-10-12T21:01:45Z'}}, 'canReply': True, 'totalReplyCount': 0, 'isPublic': True}",,UCjmtsOQtepgmbR6VWkvJv2w,2022-10-12T21:01:45Z,"No nordeste tá todo mundo ganhando 50 conto pra votar no vermelho demônio,viva cuba e Venezuela seus filhos e netos passaram fome a vida inteira.....",,2023-06-08 11:07:43.966008
youtube#commentThread,4-2Ka55mm-2b2y5cJMKbel01n2w,UgxVofPrU8X-2q5eH314AaABAg,"{'videoId': 'Fz0PCYu4hJg', 'topLevelComment': {'kind': 'youtube#comment', 'etag': 'bpwoDhHq1gNyeMzFJuJBCi97ESk', 'id': 'UgxVofPrU8X-2q5eH314AaABAg', 'snippet': {'videoId': 'Fz0PCYu4hJg', 'textDisplay': 'Venezuela estamos a caminho com mais um mandato do nosso honesto presidente Maçonaro. Bandido ladrão rouba e coloca sigilo nos roubos .Olha os bilhões desviado, e ainda tem trouxa que diz o nosso presidente honesto. Os 51 imóveis não fake meus caros .É fruto de roubo da Familicia. Esse verme não governa nem ele mesmo , quem dirá um país, ainda fala do PT .VÃO ASSISTIR UM JORNAL OU LER UM .Quem está governando é um ladrão que nunca fez nada e nem criou nada nem como deputado, muito menos como presidente', 'textOriginal': 'Venezuela estamos a caminho com mais um mandato do nosso honesto presidente Maçonaro. Bandido ladrão rouba e coloca sigilo nos roubos .Olha os bilhões desviado, e ainda tem trouxa que diz o nosso presidente honesto. Os 51 imóveis não fake meus caros .É fruto de roubo da Familicia. Esse verme não governa nem ele mesmo , quem dirá um país, ainda fala do PT .VÃO ASSISTIR UM JORNAL OU LER UM .Quem está governando é um ladrão que nunca fez nada e nem criou nada nem como deputado, muito menos como presidente', 'authorDisplayName': 'Rafael Dallagnolo', 'authorProfileImageUrl': 'https://yt3.ggpht.com/ytc/AGIKgqN2QwgwTvVzfpzGbLINtQVh7sGevHKw3PpPAA=s48-c-k-c0x00ffffff-no-rj', 'authorChannelUrl': 'http://www.youtube.com/channel/UCTTGKqKz1YYpTrdf5cFS4PA', 'authorChannelId': {'value': 'UCTTGKqKz1YYpTrdf5cFS4PA'}, 'canRate': True, 'viewerRating': 'none', 'likeCount': 0, 'publishedAt': '2022-10-12T20:58:33Z', 'updatedAt': '2022-10-12T20:58:33Z'}}, 'canReply': True, 'totalReplyCount': 1, 'isPublic': True}","{'comments': [{'kind': 'youtube#comment', 'etag': 'ptGr2Vm-m0p57J5h01JWN9fWAFA', 'id': 'UgxVofPrU8X-2q5eH314AaABAg.9h5gqct7IQ79h5irr2h-8k', 'snippet': {'videoId': 'Fz0PCYu4hJg', 'textDisplay': 'Venezuela é ideologia do Lula, cara kkkk se informe', 'textOriginal': 'Venezuela é ideologia do Lula, cara kkkk se informe', 'parentId': 'UgxVofPrU8X-2q5eH314AaABAg', 'authorDisplayName': 'Clint Westwood', 'authorProfileImageUrl': 'https://yt3.ggpht.com/ytc/AGIKgqMLY7OO1LNrp3cSrFhErFxIkAQjmKNVdKBt1j0SeQ=s48-c-k-c0x00ffffff-no-rj', 'authorChannelUrl': 'http://www.youtube.com/channel/UC4w6cddm0tioZD65dmd59qg', 'authorChannelId': {'value': 'UC4w6cddm0tioZD65dmd59qg'}, 'canRate': True, 'viewerRating': 'none', 'likeCount': 1, 'publishedAt': '2022-10-12T21:16:12Z', 'updatedAt': '2022-10-12T21:16:12Z'}}]}",UCTTGKqKz1YYpTrdf5cFS4PA,2022-10-12T20:58:33Z,"Venezuela estamos a caminho com mais um mandato do nosso honesto presidente Maçonaro. Bandido ladrão rouba e coloca sigilo nos roubos .Olha os bilhões desviado, e ainda tem trouxa que diz o nosso presidente honesto. Os 51 imóveis não fake meus caros .É fruto de roubo da Familicia. Esse verme não governa nem ele mesmo , quem dirá um país, ainda fala do PT .VÃO ASSISTIR UM JORNAL OU LER UM .Quem está governando é um ladrão que nunca fez nada e nem criou nada nem como deputado, muito menos como presidente",,2023-06-08 11:07:43.966008
youtube#commentThread,vKl-ZDud9TUXeK-8Cr2sX9NTbpM,UgxpkAJy46PdgcbISi14AaABAg,"{'videoId': 'Fz0PCYu4hJg', 'topLevelComment': {'kind': 'youtube#comment', 'etag': '_Y8DVYTbLitzrD7rdWNcFGegRmo', 'id': 'UgxpkAJy46PdgcbISi14AaABAg', 'snippet': {'videoId': 'Fz0PCYu4hJg', 'textDisplay': 'O que mais me assusta , é ver esse monstro genocida , ter apenas 46,%.  De rejeição , enquanto deveria ser de no minimo 99% , por ter cometido tantas barbáries em sua trajetória macabra .', 'textOriginal': 'O que mais me assusta , é ver esse monstro genocida , ter apenas 46,%.  De rejeição , enquanto deveria ser de no minimo 99% , por ter cometido tantas barbáries em sua trajetória macabra .', 'authorDisplayName': 'Dobrae Utra', 'authorProfileImageUrl': 'https://yt3.ggpht.com/ytc/AGIKgqNc24zWTj-aFhYJAm0SpaG5BQaJ7ix5ExC1tB-TOQaIqmRQWiI9uEKCjCstLT7V=s48-c-k-c0x00ffffff-no-rj', 'authorChannelUrl': 'http://www.youtube.com/channel/UCXwZPyHCerojrg6cS387KWg', 'authorChannelId': {'value': 'UCXwZPyHCerojrg6cS387KWg'}, 'canRate': True, 'viewerRating': 'none', 'likeCount': 8, 'publishedAt': '2022-10-12T20:57:43Z', 'updatedAt': '2022-10-12T20:57:43Z'}}, 'canReply': True, 'totalReplyCount': 7, 'isPublic': True}","{'comments': [{'kind': 'youtube#comment', 'etag': '0BW_OqfbNdWO6G3BTpyN1OSst9Y', 'id': 'UgxpkAJy46PdgcbISi14AaABAg.9h5gkX1LZCr9h7s3Iw0n63', 'snippet': {'videoId': 'Fz0PCYu4hJg', 'textDisplay': 'Miles the Cat UwU estatisticamente ñ é o mais atrasado Mais sim nosso pais esta entre os menos desenvolvido Justamente por isso q se questiono O outro lado (PT) recebeu boa parte dos votos de áreas onde os índices sócias são os piores Oq explica isso ?', 'textOriginal': 'Miles the Cat UwU estatisticamente ñ é o mais atrasado Mais sim nosso pais esta entre os menos desenvolvido Justamente por isso q se questiono O outro lado (PT) recebeu boa parte dos votos de áreas onde os índices sócias são os piores Oq explica isso ?', 'parentId': 'UgxpkAJy46PdgcbISi14AaABAg', 'authorDisplayName': 'Mito da direita', 'authorProfileImageUrl': 'https://yt3.ggpht.com/10tnOAW5psDxx937ilpfeNFhbjEAAm_m2GJ7NSgwjegjktasCBMVPqhbEKTC3JsPJPuMBerj=s48-c-k-c0x00ffffff-no-rj', 'authorChannelUrl': 'http://www.youtube.com/channel/UCOhpRlr37dimxNqKhIxTEFg', 'authorChannelId': {'value': 'UCOhpRlr37dimxNqKhIxTEFg'}, 'canRate': True, 'viewerRating': 'none', 'likeCount': 0, 'publishedAt': '2022-10-13T17:15:01Z', 'updatedAt': '2022-10-13T17:15:01Z'}}, {'kind': 'youtube#comment', 'etag': 'Oy8oKDgOlLvxl6gYrXJs0HMNdA4', 'id': 'UgxpkAJy46PdgcbISi14AaABAg.9h5gkX1LZCr9h6tK6G0pJ-', 'snippet': {'videoId': 'Fz0PCYu4hJg', 'textDisplay': 'Antes de sair desferindo todo esse ódio ñ seria melhor vc pensar se isso faz sentido ? Se ele é realmente é um genocida como diz Pq tantos votos ? Ou seriam todos os q o apoiam tbm genocidas ? Ñ faz sentido vc dizer isso Serio !', 'textOriginal': 'Antes de sair desferindo todo esse ódio ñ seria melhor vc pensar se isso faz sentido ? Se ele é realmente é um genocida como diz Pq tantos votos ? Ou seriam todos os q o apoiam tbm genocidas ? Ñ faz sentido vc dizer isso Serio !', 'parentId': 'UgxpkAJy46PdgcbISi14AaABAg', 'authorDisplayName': 'Mito da direita', 'authorProfileImageUrl': 'https://yt3.ggpht.com/10tnOAW5psDxx937ilpfeNFhbjEAAm_m2GJ7NSgwjegjktasCBMVPqhbEKTC3JsPJPuMBerj=s48-c-k-c0x00ffffff-no-rj', 'authorChannelUrl': 'http://www.youtube.com/channel/UCOhpRlr37dimxNqKhIxTEFg', 'authorChannelId': {'value': 'UCOhpRlr37dimxNqKhIxTEFg'}, 'canRate': True, 'viewerRating': 'none', 'likeCount': 0, 'publishedAt': '2022-10-13T08:06:49Z', 'updatedAt': '2022-10-13T08:06:49Z'}}, {'kind': 'youtube#comment', 'etag': 'MeVkqA_hz1Ym-jRxlvW2IWZwsIw', 'id': 'UgxpkAJy46PdgcbISi14AaABAg.9h5gkX1LZCr9h6INKsevVU', 'snippet': {'videoId': 'Fz0PCYu4hJg', 'textDisplay': 'Kkkk ladrão corrupto', 'textOriginal': 'Kkkk ladrão corrupto', 'parentId': 'UgxpkAJy46PdgcbISi14AaABAg', 'authorDisplayName': 'Jandson Soeiro', 'authorProfileImageUrl': 'https://yt3.ggpht.com/ytc/AGIKgqPFvB3x6gP-L_NdJa4_RxGPtjNhkTkyAVzcQ8KB-9s=s48-c-k-c0x00ffffff-no-rj', 'authorChannelUrl': 'http://www.youtube.com/channel/UC3wIAzMuZZSpLZe1_hdJPZQ', 'authorChannelId': {'value': 'UC3wIAzMuZZSpLZe1_hdJPZQ'}, 'canRate': True, 'viewerRating': 'none', 'likeCount': 0, 'publishedAt': '2022-10-13T02:35:12Z', 'updatedAt': '2022-10-13T02:35:12Z'}}, {'kind': 'youtube#comment', 'etag': 'ZPUFkIzZ2kh2fYW0LAlpFeFTrqk', 'id': 'UgxpkAJy46PdgcbISi14AaABAg.9h5gkX1LZCr9h5w-2lWxrN', 'snippet': {'videoId': 'Fz0PCYu4hJg', 'textDisplay': 'Sabe nem o que é genocída. Vai estudar mano. Na dúvida vai pra Venezuela.', 'textOriginal': 'Sabe nem o que é genocída. Vai estudar mano. Na dúvida vai pra Venezuela.', 'parentId': 'UgxpkAJy46PdgcbISi14AaABAg', 'authorDisplayName': 'Joel Aqui', 'authorProfileImageUrl': 'https://yt3.ggpht.com/-ne4GtES-zqvg7vPWedvT76zBFrWK3g1P4pXxRBVV6MtyqPyIc7eccZh55dihrU8dnflEmpnu8I=s48-c-k-c0x00ffffff-no-rj', 'authorChannelUrl': 'http://www.youtube.com/channel/UCDlSEnn9dDVHmE3aDrasYJQ', 'authorChannelId': {'value': 'UCDlSEnn9dDVHmE3aDrasYJQ'}, 'canRate': True, 'viewerRating': 'none', 'likeCount': 3, 'publishedAt': '2022-10-12T23:10:55Z', 'updatedAt': '2022-10-12T23:10:55Z'}}, {'kind': 'youtube#comment', 'etag': 'w2bpwulXJYeF9GssfwSBrtqvsxw', 'id': 'UgxpkAJy46PdgcbISi14AaABAg.9h5gkX1LZCr9h5vDwu9_Kd', 'snippet': {'videoId': 'Fz0PCYu4hJg', 'textDisplay': 'E vai cair mais ainda, porque a verdade vai aparecer e dia 30 vocês vão chora de raiva.', 'textOriginal': 'E vai cair mais ainda, porque a verdade vai aparecer e dia 30 vocês vão chora de raiva.', 'parentId': 'UgxpkAJy46PdgcbISi14AaABAg', 'authorDisplayName': 'Adriano Stoppa', 'authorProfileImageUrl': 'https://yt3.ggpht.com/ytc/AGIKgqOzm_KfzZqG5k2_hAdRsWdalHSRbLKe64T9TIPynQ=s48-c-k-c0x00ffffff-no-rj', 'authorChannelUrl': 'http://www.youtube.com/channel/UCxxXqrmclXFUqLPGFJXJAuw', 'authorChannelId': {'value': 'UCxxXqrmclXFUqLPGFJXJAuw'}, 'canRate': True, 'viewerRating': 'none', 'likeCount': 0, 'publishedAt': '2022-10-12T23:04:13Z', 'updatedAt': '2022-10-12T23:04:13Z'}}]}",UCXwZPyHCerojrg6cS387KWg,2022-10-12T20:57:43Z,"O que mais me assusta , é ver esse monstro genocida , ter apenas 46,%.  De rejeição , enquanto deveria ser de no minimo 99% , por ter cometido tantas barbáries em sua trajetória macabra .",,2023-06-08 11:07:43.966008
youtube#commentThread,vDCXKh812onjUlvEMIWOBe0TApw,UgxdW3wPiTGSa9YY_yN4AaABAg,"{'videoId': 'Fz0PCYu4hJg', 'topLevelComment': {'kind': 'youtube#comment', 'etag': 'J4-CoMCYmL9ZLWZDPj_E3H8ejlk', 'id': 'UgxdW3wPiTGSa9YY_yN4AaABAg', 'snippet': {'videoId': 'Fz0PCYu4hJg', 'textDisplay': 'CNN ASCOM DO LULA', 'textOriginal': 'CNN ASCOM DO LULA', 'authorDisplayName': 'Robson', 'authorProfileImageUrl': 'https://yt3.ggpht.com/ytc/AGIKgqO_av9UT3sNLwzipcIketlodHj3RU7Jaji0_jK9H88=s48-c-k-c0x00ffffff-no-rj', 'authorChannelUrl': 'http://www.youtube.com/channel/UCrhhmSzlESyr-cNYe8DeBGg', 'authorChannelId': {'value': 'UCrhhmSzlESyr-cNYe8DeBGg'}, 'canRate': True, 'viewerRating': 'none', 'likeCount': 0, 'publishedAt': '2022-10-12T20:56:36Z', 'updatedAt': '2022-10-12T20:56:36Z'}}, 'canReply': True, 'totalReplyCount': 1, 'isPublic': True}","{'comments': [{'kind': 'youtube#comment', 'etag': '1_OpTG_05MY5a8ZvZ_Gli_jACk8', 'id': 'UgxdW3wPiTGSa9YY_yN4AaABAg.9h5gcJOXz4L9h5q18CyyqU', 'snippet': {'videoId': 'Fz0PCYu4hJg', 'textDisplay': 'Ah, vc queria q a CNN fosse uma Jovem Pan do Bozo, né? Fofa!', 'textOriginal': 'Ah, vc queria q a CNN fosse uma Jovem Pan do Bozo, né? Fofa!', 'parentId': 'UgxdW3wPiTGSa9YY_yN4AaABAg', 'authorDisplayName': 'DAVI ANDRADE', 'authorProfileImageUrl': 'https://yt3.ggpht.com/ytc/AGIKgqOkEPcmdniPQghmkxFeyE07GtCzT3OYjoekPOeFmw=s48-c-k-c0x00ffffff-no-rj', 'authorChannelUrl': 'http://www.youtube.com/channel/UCGU6NnZCr33sYdZBz_tTH-A', 'authorChannelId': {'value': 'UCGU6NnZCr33sYdZBz_tTH-A'}, 'canRate': True, 'viewerRating': 'none', 'likeCount': 0, 'publishedAt': '2022-10-12T22:18:46Z', 'updatedAt': '2022-10-12T22:18:46Z'}}]}",UCrhhmSzlESyr-cNYe8DeBGg,2022-10-12T20:56:36Z,CNN ASCOM DO LULA,,2023-06-08 11:07:43.966008
youtube#commentThread,WciKwZNntMw1-rjNWAUBQr_5ROE,UgxJa9Zf3OhtPlnVJ2l4AaABAg,"{'videoId': 'Fz0PCYu4hJg', 'topLevelComment': {'kind': 'youtube#comment', 'etag': 'nepLYz8Yb5XScdL2uhxezoOlYF4', 'id': 'UgxJa9Zf3OhtPlnVJ2l4AaABAg', 'snippet': {'videoId': 'Fz0PCYu4hJg', 'textDisplay': 'Fora a família desses metalúrgicos', 'textOriginal': 'Fora a família desses metalúrgicos', 'authorDisplayName': 'Wesley Monteiro', 'authorProfileImageUrl': 'https://yt3.ggpht.com/ytc/AGIKgqP_pmRaEFOWw4qPjO1DjFBgT9MG0COpoPWqueQl_Q=s48-c-k-c0x00ffffff-no-rj', 'authorChannelUrl': 'http://www.youtube.com/channel/UCeHeCs6SOCtjBaJX9LrG3_A', 'authorChannelId': {'value': 'UCeHeCs6SOCtjBaJX9LrG3_A'}, 'canRate': True, 'viewerRating': 'none', 'likeCount': 0, 'publishedAt': '2022-10-12T20:54:35Z', 'updatedAt': '2022-10-12T20:54:35Z'}}, 'canReply': True, 'totalReplyCount': 0, 'isPublic': True}",,UCeHeCs6SOCtjBaJX9LrG3_A,2022-10-12T20:54:35Z,Fora a família desses metalúrgicos,,2023-06-08 11:07:43.966008
youtube#commentThread,Gj6zcdaNN0uZ1WaXK57YA5AMy7U,Ugx9o04W9XdqmkBtrcV4AaABAg,"{'videoId': 'Fz0PCYu4hJg', 'topLevelComment': {'kind': 'youtube#comment', 'etag': 'spbTkrLxl0PU1QkwWRW0dvVRudY', 'id': 'Ugx9o04W9XdqmkBtrcV4AaABAg', 'snippet': {'videoId': 'Fz0PCYu4hJg', 'textDisplay': 'Só a csn deve te mas d 3 mil funcionário', 'textOriginal': 'Só a csn deve te mas d 3 mil funcionário', 'authorDisplayName': 'Wesley Monteiro', 'authorProfileImageUrl': 'https://yt3.ggpht.com/ytc/AGIKgqP_pmRaEFOWw4qPjO1DjFBgT9MG0COpoPWqueQl_Q=s48-c-k-c0x00ffffff-no-rj', 'authorChannelUrl': 'http://www.youtube.com/channel/UCeHeCs6SOCtjBaJX9LrG3_A', 'authorChannelId': {'value': 'UCeHeCs6SOCtjBaJX9LrG3_A'}, 'canRate': True, 'viewerRating': 'none', 'likeCount': 0, 'publishedAt': '2022-10-12T20:53:58Z', 'updatedAt': '2022-10-12T20:53:58Z'}}, 'canReply': True, 'totalReplyCount': 0, 'isPublic': True}",,UCeHeCs6SOCtjBaJX9LrG3_A,2022-10-12T20:53:58Z,Só a csn deve te mas d 3 mil funcionário,,2023-06-08 11:07:43.966008
youtube#commentThread,OZePJvnjmt4T1wsImvDjM3yD4XU,UgwcmRB5Eg2KObjExx14AaABAg,"{'videoId': 'Fz0PCYu4hJg', 'topLevelComment': {'kind': 'youtube#comment', 'etag': 'lFq91mLiHRd_7QCe8Yv7SJ_Y3IY', 'id': 'UgwcmRB5Eg2KObjExx14AaABAg', 'snippet': {'videoId': 'Fz0PCYu4hJg', 'textDisplay': 'O problema é o Nordeste, sempre foi massa de manobra de políticos corruptos.', 'textOriginal': 'O problema é o Nordeste, sempre foi massa de manobra de políticos corruptos.', 'authorDisplayName': 'Fernandes Fernandes', 'authorProfileImageUrl': 'https://yt3.ggpht.com/ytc/AGIKgqMEADicOpiiOJOEuaiP42gi-kI5aevMWxpbyG6a=s48-c-k-c0x00ffffff-no-rj', 'authorChannelUrl': 'http://www.youtube.com/channel/UCXLiw4gbXNRHCtaf2Chd8RA', 'authorChannelId': {'value': 'UCXLiw4gbXNRHCtaf2Chd8RA'}, 'canRate': True, 'viewerRating': 'none', 'likeCount': 1, 'publishedAt': '2022-10-12T20:53:15Z', 'updatedAt': '2022-10-12T20:53:15Z'}}, 'canReply': True, 'totalReplyCount': 1, 'isPublic': True}","{'comments': [{'kind': 'youtube#comment', 'etag': 'dhf3BdCSMiZxpt4P5VTTOngG5SU', 'id': 'UgwcmRB5Eg2KObjExx14AaABAg.9h5gEiRQ6w89h5j4mkEXmF', 'snippet': {'videoId': 'Fz0PCYu4hJg', 'textDisplay': 'Veja o mapa do IDH do Brasil. Lá tem os menores índices do País, principalmente pela falta de educação básica, fruto dos governos do PT.', 'textOriginal': 'Veja o mapa do IDH do Brasil. Lá tem os menores índices do País, principalmente pela falta de educação básica, fruto dos governos do PT.', 'parentId': 'UgwcmRB5Eg2KObjExx14AaABAg', 'authorDisplayName': 'Clint Westwood', 'authorProfileImageUrl': 'https://yt3.ggpht.com/ytc/AGIKgqMLY7OO1LNrp3cSrFhErFxIkAQjmKNVdKBt1j0SeQ=s48-c-k-c0x00ffffff-no-rj', 'authorChannelUrl': 'http://www.youtube.com/channel/UC4w6cddm0tioZD65dmd59qg', 'authorChannelId': {'value': 'UC4w6cddm0tioZD65dmd59qg'}, 'canRate': True, 'viewerRating': 'none', 'likeCount': 0, 'publishedAt': '2022-10-12T21:18:06Z', 'updatedAt': '2022-10-12T21:18:06Z'}}]}",UCXLiw4gbXNRHCtaf2Chd8RA,2022-10-12T20:53:15Z,"O problema é o Nordeste, sempre foi massa de manobra de políticos corruptos.",,2023-06-08 11:07:43.966008
youtube#commentThread,N8HLRFPJkpH6wtbawWy1Ikof9DI,Ugx-m0LoX5TJWqiNI9J4AaABAg,"{'videoId': 'Fz0PCYu4hJg', 'topLevelComment': {'kind': 'youtube#comment', 'etag': 'bshrtyEfDTXkkC_bX7Je9_6Y4Wk', 'id': 'Ugx-m0LoX5TJWqiNI9J4AaABAg', 'snippet': {'videoId': 'Fz0PCYu4hJg', 'textDisplay': 'Os metalúrgicos aqui no rio é tudo lula', 'textOriginal': 'Os metalúrgicos aqui no rio é tudo lula', 'authorDisplayName': 'Wesley Monteiro', 'authorProfileImageUrl': 'https://yt3.ggpht.com/ytc/AGIKgqP_pmRaEFOWw4qPjO1DjFBgT9MG0COpoPWqueQl_Q=s48-c-k-c0x00ffffff-no-rj', 'authorChannelUrl': 'http://www.youtube.com/channel/UCeHeCs6SOCtjBaJX9LrG3_A', 'authorChannelId': {'value': 'UCeHeCs6SOCtjBaJX9LrG3_A'}, 'canRate': True, 'viewerRating': 'none', 'likeCount': 1, 'publishedAt': '2022-10-12T20:52:57Z', 'updatedAt': '2022-10-12T20:52:57Z'}}, 'canReply': True, 'totalReplyCount': 0, 'isPublic': True}",,UCeHeCs6SOCtjBaJX9LrG3_A,2022-10-12T20:52:57Z,Os metalúrgicos aqui no rio é tudo lula,,2023-06-08 11:07:43.966008
youtube#commentThread,g1GReN-xKk198HcBbQGKCY3hrXc,UgzzhBSCqT0VNhjD_MR4AaABAg,"{'videoId': 'Fz0PCYu4hJg', 'topLevelComment': {'kind': 'youtube#comment', 'etag': 'jzMGgVOEvmtAffMciQV6WfVSu_I', 'id': 'UgzzhBSCqT0VNhjD_MR4AaABAg', 'snippet': {'videoId': 'Fz0PCYu4hJg', 'textDisplay': 'REJEIÇÃO DE BOLSONARO<br>Não param de surgir escândalos, fatos, ligados ao Bozo e adoradores.<br>Bozo está nesse mundo e não no mundo das propostas.', 'textOriginal': 'REJEIÇÃO DE BOLSONARO\\nNão param de surgir escândalos, fatos, ligados ao Bozo e adoradores.\\nBozo está nesse mundo e não no mundo das propostas.', 'authorDisplayName': 'Romulo Gonçalves', 'authorProfileImageUrl': 'https://yt3.ggpht.com/ytc/AGIKgqMqnmpN_RkUKWgRbyJAUF4XZKfZeQOgC9RiQg=s48-c-k-c0x00ffffff-no-rj', 'authorChannelUrl': 'http://www.youtube.com/channel/UCCMwBNkRNGj4szbEgr_U3QQ', 'authorChannelId': {'value': 'UCCMwBNkRNGj4szbEgr_U3QQ'}, 'canRate': True, 'viewerRating': 'none', 'likeCount': 0, 'publishedAt': '2022-10-12T20:49:02Z', 'updatedAt': '2022-10-12T20:49:02Z'}}, 'canReply': True, 'totalReplyCount': 0, 'isPublic': True}",,UCCMwBNkRNGj4szbEgr_U3QQ,2022-10-12T20:49:02Z,"REJEIÇÃO DE BOLSONARO
Não param de surgir escândalos, fatos, ligados ao Bozo e adoradores.
Bozo está nesse mundo e não no mundo das propostas.",,2023-06-08 11:07:43.966008
youtube#commentThread,w-tOzOSjN2niuNWP0f683WP9w8I,Ugz6PX087HAequ5ujqZ4AaABAg,"{'videoId': 'Fz0PCYu4hJg', 'topLevelComment': {'kind': 'youtube#comment', 'etag': 'b2OXSE5wpCNcekjaIqeJ_AYLGMo', 'id': 'Ugz6PX087HAequ5ujqZ4AaABAg', 'snippet': {'videoId': 'Fz0PCYu4hJg', 'textDisplay': 'Vcs vam quebra pq são mentiroso', 'textOriginal': 'Vcs vam quebra pq são mentiroso', 'authorDisplayName': 'AD AGAPE DO PAPICU', 'authorProfileImageUrl': 'https://yt3.ggpht.com/D7Vh8Nrzxau94bLpZ88m6iqZ9piP5hjgDz__bWImHT55Dx-AXEjUHersfPB6TtNvBCVwV4XZKA=s48-c-k-c0x00ffffff-no-rj', 'authorChannelUrl': 'http://www.youtube.com/channel/UCgsF4OUMt0YBX9pAnTQjMXQ', 'authorChannelId': {'value': 'UCgsF4OUMt0YBX9pAnTQjMXQ'}, 'canRate': True, 'viewerRating': 'none', 'likeCount': 1, 'publishedAt': '2022-10-12T20:48:30Z', 'updatedAt': '2022-10-12T20:48:30Z'}}, 'canReply': True, 'totalReplyCount': 1, 'isPublic': True}","{'comments': [{'kind': 'youtube#comment', 'etag': 'jDBwZSj3D39IX34zYQh6VcoTuxg', 'id': 'Ugz6PX087HAequ5ujqZ4AaABAg.9h5fgz2LSyy9h5pwirfKaW', 'snippet': {'videoId': 'Fz0PCYu4hJg', 'textDisplay': 'Se a Jovem Pan não quebrou, por que a CNN vai quebrar? A qualidade da CNN é infinitamente superior ao da Jovem Pan.', 'textOriginal': 'Se a Jovem Pan não quebrou, por que a CNN vai quebrar? A qualidade da CNN é infinitamente superior ao da Jovem Pan.', 'parentId': 'Ugz6PX087HAequ5ujqZ4AaABAg', 'authorDisplayName': 'DAVI ANDRADE', 'authorProfileImageUrl': 'https://yt3.ggpht.com/ytc/AGIKgqOkEPcmdniPQghmkxFeyE07GtCzT3OYjoekPOeFmw=s48-c-k-c0x00ffffff-no-rj', 'authorChannelUrl': 'http://www.youtube.com/channel/UCGU6NnZCr33sYdZBz_tTH-A', 'authorChannelId': {'value': 'UCGU6NnZCr33sYdZBz_tTH-A'}, 'canRate': True, 'viewerRating': 'none', 'likeCount': 0, 'publishedAt': '2022-10-12T22:18:02Z', 'updatedAt': '2022-10-12T22:18:02Z'}}]}",UCgsF4OUMt0YBX9pAnTQjMXQ,2022-10-12T20:48:30Z,Vcs vam quebra pq são mentiroso,,2023-06-08 11:07:43.966008
youtube#commentThread,yX6r6btJfkUcBGTQYTMAi_KPypk,Ugz5LTtTq84f26JtRfp4AaABAg,"{'videoId': 'Fz0PCYu4hJg', 'topLevelComment': {'kind': 'youtube#comment', 'etag': 'elc2cSKenR2dzNe-5nfa7A_4Q4k', 'id': 'Ugz5LTtTq84f26JtRfp4AaABAg', 'snippet': {'videoId': 'Fz0PCYu4hJg', 'textDisplay': 'Pode  atacar senhor Jair já  era..', 'textOriginal': 'Pode  atacar senhor Jair já  era..', 'authorDisplayName': 'Rosângela Camargo Catafesta', 'authorProfileImageUrl': 'https://yt3.ggpht.com/ytc/AGIKgqPa0kLpzxXwdo-UdnylGhI_aE0UzDsvvS_Dm1Nhpw=s48-c-k-c0x00ffffff-no-rj', 'authorChannelUrl': 'http://www.youtube.com/channel/UC9Cq0M_5DXXnr-qCy73ThUQ', 'authorChannelId': {'value': 'UC9Cq0M_5DXXnr-qCy73ThUQ'}, 'canRate': True, 'viewerRating': 'none', 'likeCount': 1, 'publishedAt': '2022-10-12T20:47:35Z', 'updatedAt': '2022-10-12T20:47:35Z'}}, 'canReply': True, 'totalReplyCount': 0, 'isPublic': True}",,UC9Cq0M_5DXXnr-qCy73ThUQ,2022-10-12T20:47:35Z,Pode  atacar senhor Jair já  era..,,2023-06-08 11:07:43.966008
