kind,etag,id,snippet,replies,authorChannelId,publishedAt,textOriginal,nextPageToken,extraction_date
youtube#commentThread,08G16hsD9Z_wdG6WKPO_bipIlss,Ugx9r2uz_osy_Qe5nTx4AaABAg,"{'videoId': 'xW5dpM3khvI', 'topLevelComment': {'kind': 'youtube#comment', 'etag': '9hROQPAtFgCWTYcS_Nvmc5H_VpQ', 'id': 'Ugx9r2uz_osy_Qe5nTx4AaABAg', 'snippet': {'videoId': 'xW5dpM3khvI', 'textDisplay': 'Eu não vou nem discutir sobre Bolsonaro, após 4 anos, vcs continuam em suas bolhas, ignorando os próprios olhos, quando não veem os milhares de brasileiros ordeiros nas ruas‼️‼️ MAS ISSO NEM IMPORTA ‼️‼️. PODERIA SER QUALQUER PESSOA X LULADRAO, MAS LULADRAO EX PRESIDIARIO, CHEFE DO MAIOR ESQUEMA DE CORRUPÇÃO DO PLANETA, JAMAIS PODERIA DISPUTAR AS ELEIÇÕES ‼️‼️MAS VCS FINGEM QUE É NORMAL‼️‼️‼️O ÓDIO DESSA ELITE CONTRA BOLSONARO SEM MODOS, É APENAS A INDIGNAÇÃO DE VCS , POR ACHAREM-SE MELHOR DO QUE UM DEPUTADO DE BAIXO CLERO‼️SEI QUE DÓI ‼️POIS ALÉM DELE TER CHEGADO A PRESIDÊNCIA, COISA QUE ATÉ HOJE VCS NÃO ACEITARAM O RESULTADOS DAS IRNAS, ESSES QUE VCS DEFENDEM DE FORMA ABJETA, POS RACIONAL NÃO É ‼️AINDA TEM O DESESPERO POR ELE E OS FILHOS SEREM BONITOS‼️DÓI, DÓI DÓI ‼️', 'textOriginal': 'Eu não vou nem discutir sobre Bolsonaro, após 4 anos, vcs continuam em suas bolhas, ignorando os próprios olhos, quando não veem os milhares de brasileiros ordeiros nas ruas‼️‼️ MAS ISSO NEM IMPORTA ‼️‼️. PODERIA SER QUALQUER PESSOA X LULADRAO, MAS LULADRAO EX PRESIDIARIO, CHEFE DO MAIOR ESQUEMA DE CORRUPÇÃO DO PLANETA, JAMAIS PODERIA DISPUTAR AS ELEIÇÕES ‼️‼️MAS VCS FINGEM QUE É NORMAL‼️‼️‼️O ÓDIO DESSA ELITE CONTRA BOLSONARO SEM MODOS, É APENAS A INDIGNAÇÃO DE VCS , POR ACHAREM-SE MELHOR DO QUE UM DEPUTADO DE BAIXO CLERO‼️SEI QUE DÓI ‼️POIS ALÉM DELE TER CHEGADO A PRESIDÊNCIA, COISA QUE ATÉ HOJE VCS NÃO ACEITARAM O RESULTADOS DAS IRNAS, ESSES QUE VCS DEFENDEM DE FORMA ABJETA, POS RACIONAL NÃO É ‼️AINDA TEM O DESESPERO POR ELE E OS FILHOS SEREM BONITOS‼️DÓI, DÓI DÓI ‼️', 'authorDisplayName': 'Marise Pavan', 'authorProfileImageUrl': 'https://yt3.ggpht.com/ytc/AGIKgqO9AcPrNVRf8a6JPwZbIQkgVpAwOo2NXFCVZ7A_xA=s48-c-k-c0x00ffffff-no-rj', 'authorChannelUrl': 'http://www.youtube.com/channel/UCr5rE50qu9m6jrzjlT80B8g', 'authorChannelId': {'value': 'UCr5rE50qu9m6jrzjlT80B8g'}, 'canRate': True, 'viewerRating': 'none', 'likeCount': 0, 'publishedAt': '2022-10-26T06:39:30Z', 'updatedAt': '2022-10-26T06:39:30Z'}}, 'canReply': True, 'totalReplyCount': 0, 'isPublic': True}",,UCr5rE50qu9m6jrzjlT80B8g,2022-10-26T06:39:30Z,"Eu não vou nem discutir sobre Bolsonaro, após 4 anos, vcs continuam em suas bolhas, ignorando os próprios olhos, quando não veem os milhares de brasileiros ordeiros nas ruas‼️‼️ MAS ISSO NEM IMPORTA ‼️‼️. PODERIA SER QUALQUER PESSOA X LULADRAO, MAS LULADRAO EX PRESIDIARIO, CHEFE DO MAIOR ESQUEMA DE CORRUPÇÃO DO PLANETA, JAMAIS PODERIA DISPUTAR AS ELEIÇÕES ‼️‼️MAS VCS FINGEM QUE É NORMAL‼️‼️‼️O ÓDIO DESSA ELITE CONTRA BOLSONARO SEM MODOS, É APENAS A INDIGNAÇÃO DE VCS , POR ACHAREM-SE MELHOR DO QUE UM DEPUTADO DE BAIXO CLERO‼️SEI QUE DÓI ‼️POIS ALÉM DELE TER CHEGADO A PRESIDÊNCIA, COISA QUE ATÉ HOJE VCS NÃO ACEITARAM O RESULTADOS DAS IRNAS, ESSES QUE VCS DEFENDEM DE FORMA ABJETA, POS RACIONAL NÃO É ‼️AINDA TEM O DESESPERO POR ELE E OS FILHOS SEREM BONITOS‼️DÓI, DÓI DÓI ‼️",,2023-06-08 02:33:23.766415
youtube#commentThread,xm0WfgDYjiAnEXqt_d6YOm5cuj4,UgwrJ50VTIBBDnSkzEB4AaABAg,"{'videoId': 'xW5dpM3khvI', 'topLevelComment': {'kind': 'youtube#comment', 'etag': 'Fijg--EgtjyfoJwL8jbVcHNMRq8', 'id': 'UgwrJ50VTIBBDnSkzEB4AaABAg', 'snippet': {'videoId': 'xW5dpM3khvI', 'textDisplay': 'A POLARIZAÇÃO VEM DA MÍDIA, QUE PASSA PANO PARA O LADRÃO‼️‼️INFELIZMENTE, AINDA SÃO VCS QUE CHEGAM DENTRO DAS CASA DA MAIORIA DA POPULAÇÃO DOS MAIS FRÁGEIS, ENGANADO O POVO, DIZENDO QUE O LADRÃO, É INOCENTE‼️‼️‼️SÃO VCS QUE CHEGAM AS CASAS DA MAIORIA DA CLASSE MÉDIA, COOPTANDO  OS JOVENS IDEOLOGIZADOS NAS ESCOLAS E FACULDADES, ENCOBRINDO QUE O LADRÃO É O CRIADOR DO Foro de São Paulo‼️‼️FINGINDO QUE LULA NÃO QUER UMA DITADURA PARA O BRASIL, MESMO ELE FALANDO NA TV O QUE VAI FAZER‼️‼️‼️<br>LULADRAO NÃO É, E NUNCA DEVERIA TER SIDO UMA  OPÇÃO, SE NOSSOS ÓRGÃOS DE IMPRESSA FOSSEM HONESTO ‼️‼️‼️VCS SIM MENTEM , FAZEM FAKE NEWS E COOPTAM MENTES DESAVISADAS‼️‼️‼️', 'textOriginal': 'A POLARIZAÇÃO VEM DA MÍDIA, QUE PASSA PANO PARA O LADRÃO‼️‼️INFELIZMENTE, AINDA SÃO VCS QUE CHEGAM DENTRO DAS CASA DA MAIORIA DA POPULAÇÃO DOS MAIS FRÁGEIS, ENGANADO O POVO, DIZENDO QUE O LADRÃO, É INOCENTE‼️‼️‼️SÃO VCS QUE CHEGAM AS CASAS DA MAIORIA DA CLASSE MÉDIA, COOPTANDO  OS JOVENS IDEOLOGIZADOS NAS ESCOLAS E FACULDADES, ENCOBRINDO QUE O LADRÃO É O CRIADOR DO Foro de São Paulo‼️‼️FINGINDO QUE LULA NÃO QUER UMA DITADURA PARA O BRASIL, MESMO ELE FALANDO NA TV O QUE VAI FAZER‼️‼️‼️\\nLULADRAO NÃO É, E NUNCA DEVERIA TER SIDO UMA  OPÇÃO, SE NOSSOS ÓRGÃOS DE IMPRESSA FOSSEM HONESTO ‼️‼️‼️VCS SIM MENTEM , FAZEM FAKE NEWS E COOPTAM MENTES DESAVISADAS‼️‼️‼️', 'authorDisplayName': 'Marise Pavan', 'authorProfileImageUrl': 'https://yt3.ggpht.com/ytc/AGIKgqO9AcPrNVRf8a6JPwZbIQkgVpAwOo2NXFCVZ7A_xA=s48-c-k-c0x00ffffff-no-rj', 'authorChannelUrl': 'http://www.youtube.com/channel/UCr5rE50qu9m6jrzjlT80B8g', 'authorChannelId': {'value': 'UCr5rE50qu9m6jrzjlT80B8g'}, 'canRate': True, 'viewerRating': 'none', 'likeCount': 0, 'publishedAt': '2022-10-26T06:25:59Z', 'updatedAt': '2022-10-26T06:25:59Z'}}, 'canReply': True, 'totalReplyCount': 0, 'isPublic': True}",,UCr5rE50qu9m6jrzjlT80B8g,2022-10-26T06:25:59Z,"A POLARIZAÇÃO VEM DA MÍDIA, QUE PASSA PANO PARA O LADRÃO‼️‼️INFELIZMENTE, AINDA SÃO VCS QUE CHEGAM DENTRO DAS CASA DA MAIORIA DA POPULAÇÃO DOS MAIS FRÁGEIS, ENGANADO O POVO, DIZENDO QUE O LADRÃO, É INOCENTE‼️‼️‼️SÃO VCS QUE CHEGAM AS CASAS DA MAIORIA DA CLASSE MÉDIA, COOPTANDO  OS JOVENS IDEOLOGIZADOS NAS ESCOLAS E FACULDADES, ENCOBRINDO QUE O LADRÃO É O CRIADOR DO Foro de São Paulo‼️‼️FINGINDO QUE LULA NÃO QUER UMA DITADURA PARA O BRASIL, MESMO ELE FALANDO NA TV O QUE VAI FAZER‼️‼️‼️
LULADRAO NÃO É, E NUNCA DEVERIA TER SIDO UMA  OPÇÃO, SE NOSSOS ÓRGÃOS DE IMPRESSA FOSSEM HONESTO ‼️‼️‼️VCS SIM MENTEM , FAZEM FAKE NEWS E COOPTAM MENTES DESAVISADAS‼️‼️‼️",,2023-06-08 02:33:23.766415
youtube#commentThread,LJoxTy2ZUiWWhv3JvxaLBX0OVQI,UgwnQLmab5n7HEffhYt4AaABAg,"{'videoId': 'xW5dpM3khvI', 'topLevelComment': {'kind': 'youtube#comment', 'etag': '0q4CWVy5vXhFecnfefuZf13JOMU', 'id': 'UgwnQLmab5n7HEffhYt4AaABAg', 'snippet': {'videoId': 'xW5dpM3khvI', 'textDisplay': '“Existiria” uma ditadura da toga ❓❓❓😳😳😳😳😳😳', 'textOriginal': '“Existiria” uma ditadura da toga ❓❓❓😳😳😳😳😳😳', 'authorDisplayName': 'Marise Pavan', 'authorProfileImageUrl': 'https://yt3.ggpht.com/ytc/AGIKgqO9AcPrNVRf8a6JPwZbIQkgVpAwOo2NXFCVZ7A_xA=s48-c-k-c0x00ffffff-no-rj', 'authorChannelUrl': 'http://www.youtube.com/channel/UCr5rE50qu9m6jrzjlT80B8g', 'authorChannelId': {'value': 'UCr5rE50qu9m6jrzjlT80B8g'}, 'canRate': True, 'viewerRating': 'none', 'likeCount': 0, 'publishedAt': '2022-10-26T06:14:56Z', 'updatedAt': '2022-10-26T06:14:56Z'}}, 'canReply': True, 'totalReplyCount': 0, 'isPublic': True}",,UCr5rE50qu9m6jrzjlT80B8g,2022-10-26T06:14:56Z,“Existiria” uma ditadura da toga ❓❓❓😳😳😳😳😳😳,,2023-06-08 02:33:23.766415
youtube#commentThread,UQsVB4o_4y8hu5sMjqRJwHquaXc,Ugyi7ylQiJcjvVrlxvt4AaABAg,"{'videoId': 'xW5dpM3khvI', 'topLevelComment': {'kind': 'youtube#comment', 'etag': 'FzwbJDjBJNLKn3_8ZbfCihKJ18w', 'id': 'Ugyi7ylQiJcjvVrlxvt4AaABAg', 'snippet': {'videoId': 'xW5dpM3khvI', 'textDisplay': 'VIRA VIRA VIROU. BOLSONARO 56% TODO CRISTAO E CIDADÃO DO BEM É BOLSONARO. SEM EXCEÇÃO. VIVA O BRASIL SEM LADRAO! 2️⃣2️⃣🇧🇷🇧🇷 PALMEIRAS CAMPEÃO BRASILEIRO!👊', 'textOriginal': 'VIRA VIRA VIROU. BOLSONARO 56% TODO CRISTAO E CIDADÃO DO BEM É BOLSONARO. SEM EXCEÇÃO. VIVA O BRASIL SEM LADRAO! 2️⃣2️⃣🇧🇷🇧🇷 PALMEIRAS CAMPEÃO BRASILEIRO!👊', 'authorDisplayName': 'R D A', 'authorProfileImageUrl': 'https://yt3.ggpht.com/ytc/AGIKgqOEOCU2_5VDqYZxOo2Y47WuegMQPwpXfKzY5BzDtK4=s48-c-k-c0x00ffffff-no-rj', 'authorChannelUrl': 'http://www.youtube.com/channel/UCNdl8b0jSBcuUlhl4TzXBWQ', 'authorChannelId': {'value': 'UCNdl8b0jSBcuUlhl4TzXBWQ'}, 'canRate': True, 'viewerRating': 'none', 'likeCount': 5, 'publishedAt': '2022-10-26T05:55:22Z', 'updatedAt': '2022-10-26T05:55:22Z'}}, 'canReply': True, 'totalReplyCount': 0, 'isPublic': True}",,UCNdl8b0jSBcuUlhl4TzXBWQ,2022-10-26T05:55:22Z,VIRA VIRA VIROU. BOLSONARO 56% TODO CRISTAO E CIDADÃO DO BEM É BOLSONARO. SEM EXCEÇÃO. VIVA O BRASIL SEM LADRAO! 2️⃣2️⃣🇧🇷🇧🇷 PALMEIRAS CAMPEÃO BRASILEIRO!👊,,2023-06-08 02:33:23.766415
youtube#commentThread,5jJV1pH5Qr31afeOx5HL8Qqyn4g,UgyGi1xh04cFcnwTyQd4AaABAg,"{'videoId': 'xW5dpM3khvI', 'topLevelComment': {'kind': 'youtube#comment', 'etag': 'Rl3nZIJi30HuQ_5wzybrEzi6hpY', 'id': 'UgyGi1xh04cFcnwTyQd4AaABAg', 'snippet': {'videoId': 'xW5dpM3khvI', 'textDisplay': 'O fascismo é proibido no Brasil, esta no código penal, não é censura é simplesmente presevar as instituições de golpistas e Mandriões que atentam contra o Estado democrático de direito. Fake News é crime viu.  Não é mentindo que vc vai passar de ano ou acusando o Luizinho para se livrar porque o pau que luizinho toma também batera em pedrinho, ou seja a justiça não vê diferença entre um energúmeno e um sábio ela apenas atua baseada em leis e jurisprudência para manter os valores morais e éticos da nação.', 'textOriginal': 'O fascismo é proibido no Brasil, esta no código penal, não é censura é simplesmente presevar as instituições de golpistas e Mandriões que atentam contra o Estado democrático de direito. Fake News é crime viu.  Não é mentindo que vc vai passar de ano ou acusando o Luizinho para se livrar porque o pau que luizinho toma também batera em pedrinho, ou seja a justiça não vê diferença entre um energúmeno e um sábio ela apenas atua baseada em leis e jurisprudência para manter os valores morais e éticos da nação.', 'authorDisplayName': 'Papitto', 'authorProfileImageUrl': 'https://yt3.ggpht.com/e9AlD-SNk5z53yp1cEUEu02AqKCsK7ZVlq2Y1lUteamlL8XObU2qoa2eHSo7Gp8390SVfcqfswM=s48-c-k-c0x00ffffff-no-rj', 'authorChannelUrl': 'http://www.youtube.com/channel/UC-tHF3Mqk4PH4pnnMilPQ-Q', 'authorChannelId': {'value': 'UC-tHF3Mqk4PH4pnnMilPQ-Q'}, 'canRate': True, 'viewerRating': 'none', 'likeCount': 0, 'publishedAt': '2022-10-26T04:17:21Z', 'updatedAt': '2022-10-26T04:17:21Z'}}, 'canReply': True, 'totalReplyCount': 0, 'isPublic': True}",,UC-tHF3Mqk4PH4pnnMilPQ-Q,2022-10-26T04:17:21Z,"O fascismo é proibido no Brasil, esta no código penal, não é censura é simplesmente presevar as instituições de golpistas e Mandriões que atentam contra o Estado democrático de direito. Fake News é crime viu.  Não é mentindo que vc vai passar de ano ou acusando o Luizinho para se livrar porque o pau que luizinho toma também batera em pedrinho, ou seja a justiça não vê diferença entre um energúmeno e um sábio ela apenas atua baseada em leis e jurisprudência para manter os valores morais e éticos da nação.",,2023-06-08 02:33:23.766415
youtube#commentThread,-QhI5aHjhQSwB8-kfrx870HQs3A,Ugwo2GzxDPclg0qVxPd4AaABAg,"{'videoId': 'xW5dpM3khvI', 'topLevelComment': {'kind': 'youtube#comment', 'etag': 'LRKW9IsQdiuira_XvMXQ3OiKVBQ', 'id': 'Ugwo2GzxDPclg0qVxPd4AaABAg', 'snippet': {'videoId': 'xW5dpM3khvI', 'textDisplay': 'Bla bla bla...queremos saber é sobre as provas enviadas desse arrajo vergonhoso e antidemocrático de supressão de propagandas do Bolsonaro entre judiciário, corruptos e imprensa....VERGONHA!!!!!!', 'textOriginal': 'Bla bla bla...queremos saber é sobre as provas enviadas desse arrajo vergonhoso e antidemocrático de supressão de propagandas do Bolsonaro entre judiciário, corruptos e imprensa....VERGONHA!!!!!!', 'authorDisplayName': 'Douglas Waideman', 'authorProfileImageUrl': 'https://yt3.ggpht.com/ytc/AGIKgqNuFDUjVM5bLiSEf1fxTHA8NeaAu2RhYagSZyDvrA=s48-c-k-c0x00ffffff-no-rj', 'authorChannelUrl': 'http://www.youtube.com/channel/UC4NRJRR2z1pSLTh7Z9kVcXA', 'authorChannelId': {'value': 'UC4NRJRR2z1pSLTh7Z9kVcXA'}, 'canRate': True, 'viewerRating': 'none', 'likeCount': 1, 'publishedAt': '2022-10-26T03:34:36Z', 'updatedAt': '2022-10-26T03:34:36Z'}}, 'canReply': True, 'totalReplyCount': 0, 'isPublic': True}",,UC4NRJRR2z1pSLTh7Z9kVcXA,2022-10-26T03:34:36Z,"Bla bla bla...queremos saber é sobre as provas enviadas desse arrajo vergonhoso e antidemocrático de supressão de propagandas do Bolsonaro entre judiciário, corruptos e imprensa....VERGONHA!!!!!!",,2023-06-08 02:33:23.766415
youtube#commentThread,G7B-Qm5LV2MnHwD4rkQ9S0BKbLc,UgxPadqVVxmZytBa1fp4AaABAg,"{'videoId': 'xW5dpM3khvI', 'topLevelComment': {'kind': 'youtube#comment', 'etag': 'Illn9r9ot9R10sOazqI5zw8h84s', 'id': 'UgxPadqVVxmZytBa1fp4AaABAg', 'snippet': {'videoId': 'xW5dpM3khvI', 'textDisplay': 'O STF e o TSE decidem que dar super poderes a eles mesmos maiores que os políticos eleitos pelo povo,sem eles possuírem um voto sequer,é normal. O STF se declara vítima,procurador,promotor,advogado e juiz do caso. O Luladrão pode roubar bilhões,mentir,xingar,defender bandidos e tudo o mais,já o Bolsonaro e os seus aliados não podem abrir a boca senão é considerado fake news,atentado a democracia e ato anti democrático. Democracia é os EUA,o Brasil é regido pela ditadura cleptocrática do pseudo judiciário petista.', 'textOriginal': 'O STF e o TSE decidem que dar super poderes a eles mesmos maiores que os políticos eleitos pelo povo,sem eles possuírem um voto sequer,é normal. O STF se declara vítima,procurador,promotor,advogado e juiz do caso. O Luladrão pode roubar bilhões,mentir,xingar,defender bandidos e tudo o mais,já o Bolsonaro e os seus aliados não podem abrir a boca senão é considerado fake news,atentado a democracia e ato anti democrático. Democracia é os EUA,o Brasil é regido pela ditadura cleptocrática do pseudo judiciário petista.', 'authorDisplayName': 'Sérgio Smallville', 'authorProfileImageUrl': 'https://yt3.ggpht.com/KQvlLjcb4Ca35nx3WK78Fv86yiYfl9d56Kn_9ivrQjVFUEB9m78A-IKW8PTqcF_z0ItuRmutyw=s48-c-k-c0x00ffffff-no-rj', 'authorChannelUrl': 'http://www.youtube.com/channel/UCD7S4swLtAUhZQnGl1GSpOg', 'authorChannelId': {'value': 'UCD7S4swLtAUhZQnGl1GSpOg'}, 'canRate': True, 'viewerRating': 'none', 'likeCount': 0, 'publishedAt': '2022-10-26T03:11:35Z', 'updatedAt': '2022-10-26T03:11:35Z'}}, 'canReply': True, 'totalReplyCount': 0, 'isPublic': True}",,UCD7S4swLtAUhZQnGl1GSpOg,2022-10-26T03:11:35Z,"O STF e o TSE decidem que dar super poderes a eles mesmos maiores que os políticos eleitos pelo povo,sem eles possuírem um voto sequer,é normal. O STF se declara vítima,procurador,promotor,advogado e juiz do caso. O Luladrão pode roubar bilhões,mentir,xingar,defender bandidos e tudo o mais,já o Bolsonaro e os seus aliados não podem abrir a boca senão é considerado fake news,atentado a democracia e ato anti democrático. Democracia é os EUA,o Brasil é regido pela ditadura cleptocrática do pseudo judiciário petista.",,2023-06-08 02:33:23.766415
youtube#commentThread,8CwB4WRwlv1ZgyLURK0weAxUz0c,UgzXkaUiknW_s5Rv5Dd4AaABAg,"{'videoId': 'xW5dpM3khvI', 'topLevelComment': {'kind': 'youtube#comment', 'etag': 'TrLVhDCIzzcyDVbnVF17DEIzzUg', 'id': 'UgzXkaUiknW_s5Rv5Dd4AaABAg', 'snippet': {'videoId': 'xW5dpM3khvI', 'textDisplay': 'Tô entendendo que entramos numa ditadura judiciária e a hora é de acabar com essa “coisa” em definitivo. Deus, Família Pátria e liberdade.', 'textOriginal': 'Tô entendendo que entramos numa ditadura judiciária e a hora é de acabar com essa “coisa” em definitivo. Deus, Família Pátria e liberdade.', 'authorDisplayName': 'Paulo Sérgio Bravim Coman', 'authorProfileImageUrl': 'https://yt3.ggpht.com/ytc/AGIKgqOanLzAXI-r3lDYC0kDeFPHiNaVwbb3DW6VGP5u0g=s48-c-k-c0x00ffffff-no-rj', 'authorChannelUrl': 'http://www.youtube.com/channel/UCzO8r4q54h7PIikb2oN9l1w', 'authorChannelId': {'value': 'UCzO8r4q54h7PIikb2oN9l1w'}, 'canRate': True, 'viewerRating': 'none', 'likeCount': 0, 'publishedAt': '2022-10-26T03:06:10Z', 'updatedAt': '2022-10-26T03:06:10Z'}}, 'canReply': True, 'totalReplyCount': 0, 'isPublic': True}",,UCzO8r4q54h7PIikb2oN9l1w,2022-10-26T03:06:10Z,"Tô entendendo que entramos numa ditadura judiciária e a hora é de acabar com essa “coisa” em definitivo. Deus, Família Pátria e liberdade.",,2023-06-08 02:33:23.766415
youtube#commentThread,yrk67xnaZJ5Wsyl-s7o9LCeJdHQ,Ugxlu0TMa7ppxT6yjt94AaABAg,"{'videoId': 'xW5dpM3khvI', 'topLevelComment': {'kind': 'youtube#comment', 'etag': '1Z8mrhAshalbtmRpxnIV17h-mbQ', 'id': 'Ugxlu0TMa7ppxT6yjt94AaABAg', 'snippet': {'videoId': 'xW5dpM3khvI', 'textDisplay': 'muito obrigado WW... expressou direto e objetivo oq a população quer falar ... q jornalismo ein.... cnn pode trata d aumentar seu bônus... pegando d outros   ai da casa... PARABÉNS WW...', 'textOriginal': 'muito obrigado WW... expressou direto e objetivo oq a população quer falar ... q jornalismo ein.... cnn pode trata d aumentar seu bônus... pegando d outros   ai da casa... PARABÉNS WW...', 'authorDisplayName': '@driano  ##', 'authorProfileImageUrl': 'https://yt3.ggpht.com/ytc/AGIKgqOB2_ufjhjVRytgjDJ-ZfsGoCDwqRo2uX90CTOIA74Djw=s48-c-k-c0x00ffffff-no-rj', 'authorChannelUrl': 'http://www.youtube.com/channel/UCGWiV0KehjOaUtRG2lPf-nQ', 'authorChannelId': {'value': 'UCGWiV0KehjOaUtRG2lPf-nQ'}, 'canRate': True, 'viewerRating': 'none', 'likeCount': 1, 'publishedAt': '2022-10-26T03:03:49Z', 'updatedAt': '2022-10-26T03:03:49Z'}}, 'canReply': True, 'totalReplyCount': 0, 'isPublic': True}",,UCGWiV0KehjOaUtRG2lPf-nQ,2022-10-26T03:03:49Z,muito obrigado WW... expressou direto e objetivo oq a população quer falar ... q jornalismo ein.... cnn pode trata d aumentar seu bônus... pegando d outros   ai da casa... PARABÉNS WW...,,2023-06-08 02:33:23.766415
youtube#commentThread,uRgle5CpdehwhsrMdjcyu869tUk,Ugw2KSc9fbx-E27yUFd4AaABAg,"{'videoId': 'xW5dpM3khvI', 'topLevelComment': {'kind': 'youtube#comment', 'etag': 'ufu4Nwx1e7RM3kOFdj1VxUuiDDs', 'id': 'Ugw2KSc9fbx-E27yUFd4AaABAg', 'snippet': {'videoId': 'xW5dpM3khvI', 'textDisplay': 'Óbvio que tem ditadura no Judiciário', 'textOriginal': 'Óbvio que tem ditadura no Judiciário', 'authorDisplayName': 'Maria Lucimar Paul', 'authorProfileImageUrl': 'https://yt3.ggpht.com/ytc/AGIKgqOh71WwRDZrFlWBVdqe4ipY1MM_c2yNO04T-qXlx4s=s48-c-k-c0x00ffffff-no-rj', 'authorChannelUrl': 'http://www.youtube.com/channel/UCYG-rht4AwVYKFyTb7zPXRA', 'authorChannelId': {'value': 'UCYG-rht4AwVYKFyTb7zPXRA'}, 'canRate': True, 'viewerRating': 'none', 'likeCount': 0, 'publishedAt': '2022-10-26T02:58:52Z', 'updatedAt': '2022-10-26T02:58:52Z'}}, 'canReply': True, 'totalReplyCount': 0, 'isPublic': True}",,UCYG-rht4AwVYKFyTb7zPXRA,2022-10-26T02:58:52Z,Óbvio que tem ditadura no Judiciário,,2023-06-08 02:33:23.766415
youtube#commentThread,pXql77bQzCEHGwFi34t29tVZTjM,UgwYbg1Lw0BIIsb5NVF4AaABAg,"{'videoId': 'xW5dpM3khvI', 'topLevelComment': {'kind': 'youtube#comment', 'etag': 'It8rUK9DfAzS0wDvwaQyIQOBl6s', 'id': 'UgwYbg1Lw0BIIsb5NVF4AaABAg', 'snippet': {'videoId': 'xW5dpM3khvI', 'textDisplay': 'STF é uma vergonha para a nação. <br>22🇧🇷', 'textOriginal': 'STF é uma vergonha para a nação. \\n22🇧🇷', 'authorDisplayName': 'kelson Matos', 'authorProfileImageUrl': 'https://yt3.ggpht.com/ytc/AGIKgqOmHvClxFaeTzI_MMiqRFN83eh5mJ3UTna6J7ENjvISVOsm334sXVj-qtoQXgNL=s48-c-k-c0x00ffffff-no-rj', 'authorChannelUrl': 'http://www.youtube.com/channel/UCD8pDOxQUaJTwp24LxjPO4A', 'authorChannelId': {'value': 'UCD8pDOxQUaJTwp24LxjPO4A'}, 'canRate': True, 'viewerRating': 'none', 'likeCount': 7, 'publishedAt': '2022-10-26T02:55:36Z', 'updatedAt': '2022-10-26T02:55:36Z'}}, 'canReply': True, 'totalReplyCount': 0, 'isPublic': True}",,UCD8pDOxQUaJTwp24LxjPO4A,2022-10-26T02:55:36Z,"STF é uma vergonha para a nação. 
22🇧🇷",,2023-06-08 02:33:23.766415
youtube#commentThread,IlD_R0RO_gcUSpCHXWrLV9-y2MI,UgwuWdz2SPW98AP38PF4AaABAg,"{'videoId': 'xW5dpM3khvI', 'topLevelComment': {'kind': 'youtube#comment', 'etag': 'qnfRjPlwqNUlHqSGkGu0y4_Wh1I', 'id': 'UgwuWdz2SPW98AP38PF4AaABAg', 'snippet': {'videoId': 'xW5dpM3khvI', 'textDisplay': 'Nós votamos contra o Lula, contra o STE  STF.', 'textOriginal': 'Nós votamos contra o Lula, contra o STE  STF.', 'authorDisplayName': 'osmarino souza', 'authorProfileImageUrl': 'https://yt3.ggpht.com/ytc/AGIKgqNQu7eKPbQd_vUm--FqmCo1Yn6WaKwKqtwqRg=s48-c-k-c0x00ffffff-no-rj', 'authorChannelUrl': 'http://www.youtube.com/channel/UC6XfhGXh68tUkmXFb6yIdcQ', 'authorChannelId': {'value': 'UC6XfhGXh68tUkmXFb6yIdcQ'}, 'canRate': True, 'viewerRating': 'none', 'likeCount': 4, 'publishedAt': '2022-10-26T02:41:09Z', 'updatedAt': '2022-10-26T02:41:09Z'}}, 'canReply': True, 'totalReplyCount': 0, 'isPublic': True}",,UC6XfhGXh68tUkmXFb6yIdcQ,2022-10-26T02:41:09Z,"Nós votamos contra o Lula, contra o STE  STF.",,2023-06-08 02:33:23.766415
youtube#commentThread,6F_xh9VKDyP16o8pt6B6fUEvbe4,UgyaJhsHCar1Z7UgYMZ4AaABAg,"{'videoId': 'xW5dpM3khvI', 'topLevelComment': {'kind': 'youtube#comment', 'etag': 'ttRYT8ro9ducnFRdaMA9lMgSn5g', 'id': 'UgyaJhsHCar1Z7UgYMZ4AaABAg', 'snippet': {'videoId': 'xW5dpM3khvI', 'textDisplay': 'Eu não acho ..<br>Tenho certeza.<br>Só cego, surdo e burro não entende.', 'textOriginal': 'Eu não acho ..\\nTenho certeza.\\nSó cego, surdo e burro não entende.', 'authorDisplayName': 'Luis Japa 🇧🇷', 'authorProfileImageUrl': 'https://yt3.ggpht.com/F30gwbQGXOy6ly3IikITo5NkSea7hxPe6nnA029lN1bKLACa-ShPZSMsGq4Qevgajwix1DfJMA=s48-c-k-c0x00ffffff-no-rj', 'authorChannelUrl': 'http://www.youtube.com/channel/UCFLNgALAGSOKpxsis3I-8_w', 'authorChannelId': {'value': 'UCFLNgALAGSOKpxsis3I-8_w'}, 'canRate': True, 'viewerRating': 'none', 'likeCount': 0, 'publishedAt': '2022-10-26T02:38:41Z', 'updatedAt': '2022-10-26T02:38:41Z'}}, 'canReply': True, 'totalReplyCount': 0, 'isPublic': True}",,UCFLNgALAGSOKpxsis3I-8_w,2022-10-26T02:38:41Z,"Eu não acho ..
Tenho certeza.
Só cego, surdo e burro não entende.",,2023-06-08 02:33:23.766415
youtube#commentThread,FGvc8QyT3FLsRc0jf7fMRCPoNMc,UgwbqnPh4Unip_JEXLJ4AaABAg,"{'videoId': 'xW5dpM3khvI', 'topLevelComment': {'kind': 'youtube#comment', 'etag': 'XKL0jdQQ4FAigMZ_wFwq0tZwlXs', 'id': 'UgwbqnPh4Unip_JEXLJ4AaABAg', 'snippet': {'videoId': 'xW5dpM3khvI', 'textDisplay': 'O TSE  é  militante  do LULA', 'textOriginal': 'O TSE  é  militante  do LULA', 'authorDisplayName': 'Ivanete Ribeiro', 'authorProfileImageUrl': 'https://yt3.ggpht.com/ytc/AGIKgqMlftTaDj-3wufMRtSSu4IZBZjT-4jnPwdF8Q=s48-c-k-c0x00ffffff-no-rj', 'authorChannelUrl': 'http://www.youtube.com/channel/UCRAdYQIJzTB4PF0iLCC_iTg', 'authorChannelId': {'value': 'UCRAdYQIJzTB4PF0iLCC_iTg'}, 'canRate': True, 'viewerRating': 'none', 'likeCount': 0, 'publishedAt': '2022-10-26T02:37:05Z', 'updatedAt': '2022-10-26T02:37:05Z'}}, 'canReply': True, 'totalReplyCount': 0, 'isPublic': True}",,UCRAdYQIJzTB4PF0iLCC_iTg,2022-10-26T02:37:05Z,O TSE  é  militante  do LULA,,2023-06-08 02:33:23.766415
youtube#commentThread,RxYw9O7ZbnN17k__OYMzp6jPcJY,UgxNeyUvNg7eDx44MBd4AaABAg,"{'videoId': 'xW5dpM3khvI', 'topLevelComment': {'kind': 'youtube#comment', 'etag': 'bpBfyqezOUqjCZXsZ6kNBe7ihg4', 'id': 'UgxNeyUvNg7eDx44MBd4AaABAg', 'snippet': {'videoId': 'xW5dpM3khvI', 'textDisplay': 'Acha ?', 'textOriginal': 'Acha ?', 'authorDisplayName': 'Eu Hein!', 'authorProfileImageUrl': 'https://yt3.ggpht.com/vNR8HgyoMScXqmoSo-bBs2cbvmEboWF_khu06CeCbp4jG-HquVscY44IK_xwTARvjoIkOAP9pmo=s48-c-k-c0x00ffffff-no-rj', 'authorChannelUrl': 'http://www.youtube.com/channel/UC1nGyXySPO5JPU0bpVV49zA', 'authorChannelId': {'value': 'UC1nGyXySPO5JPU0bpVV49zA'}, 'canRate': True, 'viewerRating': 'none', 'likeCount': 0, 'publishedAt': '2022-10-26T02:11:05Z', 'updatedAt': '2022-10-26T02:11:05Z'}}, 'canReply': True, 'totalReplyCount': 0, 'isPublic': True}",,UC1nGyXySPO5JPU0bpVV49zA,2022-10-26T02:11:05Z,Acha ?,,2023-06-08 02:33:23.766415
youtube#commentThread,qquwKGB1MeJRNMvZlMzhSfkS7VY,Ugx0GbtWedSuycmjdIh4AaABAg,"{'videoId': 'xW5dpM3khvI', 'topLevelComment': {'kind': 'youtube#comment', 'etag': 'O8cLZ2alPqEZE3r90q6BxJNfVmg', 'id': 'Ugx0GbtWedSuycmjdIh4AaABAg', 'snippet': {'videoId': 'xW5dpM3khvI', 'textDisplay': '22🇧🇷', 'textOriginal': '22🇧🇷', 'authorDisplayName': 'Micael Viana', 'authorProfileImageUrl': 'https://yt3.ggpht.com/ytc/AGIKgqMjx62_9HkDErPdJO-KM4EuPPdvqvWNCe9cgA=s48-c-k-c0x00ffffff-no-rj', 'authorChannelUrl': 'http://www.youtube.com/channel/UCfLRhoaBbWfGP3teyo9a-tA', 'authorChannelId': {'value': 'UCfLRhoaBbWfGP3teyo9a-tA'}, 'canRate': True, 'viewerRating': 'none', 'likeCount': 3, 'publishedAt': '2022-10-26T02:09:23Z', 'updatedAt': '2022-10-26T02:09:23Z'}}, 'canReply': True, 'totalReplyCount': 0, 'isPublic': True}",,UCfLRhoaBbWfGP3teyo9a-tA,2022-10-26T02:09:23Z,22🇧🇷,,2023-06-08 02:33:23.766415
