kind,etag,id,snippet,replies,authorChannelId,publishedAt,textOriginal,nextPageToken,extraction_date
youtube#commentThread,5BBFzdFogH4syOYdXVMHeDbDMQQ,Ugxjc1mlEFwERqaNs3h4AaABAg,"{'videoId': 'VyXbGrKi1Hk', 'topLevelComment': {'kind': 'youtube#comment', 'etag': 'Ad_ymtSGtyxf-JMqIhNoRxXsAyM', 'id': 'Ugxjc1mlEFwERqaNs3h4AaABAg', 'snippet': {'videoId': 'VyXbGrKi1Hk', 'textDisplay': 'Não foi caminhao foi um barco em baixo da ponte', 'textOriginal': 'Não foi caminhao foi um barco em baixo da ponte', 'authorDisplayName': 'topgamer#thc', 'authorProfileImageUrl': 'https://yt3.ggpht.com/q9PsynGiFVKd6M3-gkjL5TKlxlXJG--0n4i5W2MWDLhOQGwJmaCGQQ9yHgG5PUaGR6ZmBWYA=s48-c-k-c0x00ffffff-no-rj', 'authorChannelUrl': 'http://www.youtube.com/channel/UCa2kAccgHhg1Y2qnncqzV0g', 'authorChannelId': {'value': 'UCa2kAccgHhg1Y2qnncqzV0g'}, 'canRate': True, 'viewerRating': 'none', 'likeCount': 0, 'publishedAt': '2022-10-15T17:01:57Z', 'updatedAt': '2022-10-15T17:01:57Z'}}, 'canReply': True, 'totalReplyCount': 0, 'isPublic': True}",,UCa2kAccgHhg1Y2qnncqzV0g,2022-10-15T17:01:57Z,Não foi caminhao foi um barco em baixo da ponte,,2023-06-08 11:07:11.439160
youtube#commentThread,9wizVLvNkNetXFY55-saV0xPCIA,UgxyWg1MbGi6Upk8QsV4AaABAg,"{'videoId': 'VyXbGrKi1Hk', 'topLevelComment': {'kind': 'youtube#comment', 'etag': 'NEy4FJ682h8H1tEBaV-A0_V7E-g', 'id': 'UgxyWg1MbGi6Upk8QsV4AaABAg', 'snippet': {'videoId': 'VyXbGrKi1Hk', 'textDisplay': 'Deus proteja esses bravos heróis que destruíram esta ponte maldita.', 'textOriginal': 'Deus proteja esses bravos heróis que destruíram esta ponte maldita.', 'authorDisplayName': 'Marcelo Barreto 🇺🇦', 'authorProfileImageUrl': 'https://yt3.ggpht.com/f80jOsKIGeZXSjru_QQzdTJvMstv6NncaeWSQXkQYQfoBeG_rOB72TVRNNcoc4nFCszK0Yk8hQ=s48-c-k-c0x00ffffff-no-rj', 'authorChannelUrl': 'http://www.youtube.com/channel/UCl5uunQnNKfXM65A6dBC2iA', 'authorChannelId': {'value': 'UCl5uunQnNKfXM65A6dBC2iA'}, 'canRate': True, 'viewerRating': 'none', 'likeCount': 0, 'publishedAt': '2022-10-15T15:14:04Z', 'updatedAt': '2022-10-15T15:14:04Z'}}, 'canReply': True, 'totalReplyCount': 0, 'isPublic': True}",,UCl5uunQnNKfXM65A6dBC2iA,2022-10-15T15:14:04Z,Deus proteja esses bravos heróis que destruíram esta ponte maldita.,,2023-06-08 11:07:11.439160
youtube#commentThread,Iy_6FK2Fhej-OcZGQlVZQ17s5Vo,Ugxd9og6diBEx9yUN1l4AaABAg,"{'videoId': 'VyXbGrKi1Hk', 'topLevelComment': {'kind': 'youtube#comment', 'etag': 'wO9muDmRcM04GbpviBJzjktz5s0', 'id': 'Ugxd9og6diBEx9yUN1l4AaABAg', 'snippet': {'videoId': 'VyXbGrKi1Hk', 'textDisplay': 'Brasil daki a um tempo vai ta assim tambem se o pt voltar ao poder', 'textOriginal': 'Brasil daki a um tempo vai ta assim tambem se o pt voltar ao poder', 'authorDisplayName': 'clayton souza', 'authorProfileImageUrl': 'https://yt3.ggpht.com/kf_Id7f7WmKGSlbQP81LtzelYguFW2FhzX1P2sUNmAqlV55IZtyIX1pX_yXgeN3KzKHrJjLTbXQ=s48-c-k-c0x00ffffff-no-rj', 'authorChannelUrl': 'http://www.youtube.com/channel/UCJnuqrJy2hhDSJ6nScYk9Vw', 'authorChannelId': {'value': 'UCJnuqrJy2hhDSJ6nScYk9Vw'}, 'canRate': True, 'viewerRating': 'none', 'likeCount': 0, 'publishedAt': '2022-10-15T14:08:29Z', 'updatedAt': '2022-10-15T14:08:40Z'}}, 'canReply': True, 'totalReplyCount': 0, 'isPublic': True}",,UCJnuqrJy2hhDSJ6nScYk9Vw,2022-10-15T14:08:29Z,Brasil daki a um tempo vai ta assim tambem se o pt voltar ao poder,,2023-06-08 11:07:11.439160
youtube#commentThread,SNz__n-xZ9sjH4PbTYvKbOdDoKQ,UgwqRBdl2P9lPdLyo_x4AaABAg,"{'videoId': 'VyXbGrKi1Hk', 'topLevelComment': {'kind': 'youtube#comment', 'etag': '8b0OeuiQgCENLUJNEbMyp0mQUjw', 'id': 'UgwqRBdl2P9lPdLyo_x4AaABAg', 'snippet': {'videoId': 'VyXbGrKi1Hk', 'textDisplay': 'A Ucrânia não assumiu o ataque sabendo que iria levar uma resposta gigante como realmente aconteceu com ataques russos na capital ucraniana Kieve e em outras 40 cidades da Ucrânia causando estragos inimagináveis e caríssimos para a Ucrânia.', 'textOriginal': 'A Ucrânia não assumiu o ataque sabendo que iria levar uma resposta gigante como realmente aconteceu com ataques russos na capital ucraniana Kieve e em outras 40 cidades da Ucrânia causando estragos inimagináveis e caríssimos para a Ucrânia.', 'authorDisplayName': 'Brazuka Reacciones', 'authorProfileImageUrl': 'https://yt3.ggpht.com/NAMaLNJdYxWsMuK4SA5km117n-g3y0Pktfefggk8lo_5Jcd9xFcmMvB3BgJAneg2c5g49XnRGdI=s48-c-k-c0x00ffffff-no-rj', 'authorChannelUrl': 'http://www.youtube.com/channel/UCwJa2lK_r0YroCf9QxxAqzA', 'authorChannelId': {'value': 'UCwJa2lK_r0YroCf9QxxAqzA'}, 'canRate': True, 'viewerRating': 'none', 'likeCount': 0, 'publishedAt': '2022-10-13T16:42:17Z', 'updatedAt': '2022-10-13T16:42:17Z'}}, 'canReply': True, 'totalReplyCount': 0, 'isPublic': True}",,UCwJa2lK_r0YroCf9QxxAqzA,2022-10-13T16:42:17Z,A Ucrânia não assumiu o ataque sabendo que iria levar uma resposta gigante como realmente aconteceu com ataques russos na capital ucraniana Kieve e em outras 40 cidades da Ucrânia causando estragos inimagináveis e caríssimos para a Ucrânia.,,2023-06-08 11:07:11.439160
youtube#commentThread,aSS36SC_v7Cmb2r6rdeU0Uw_TZE,Ugzte1qGHnUdmJyG25N4AaABAg,"{'videoId': 'VyXbGrKi1Hk', 'topLevelComment': {'kind': 'youtube#comment', 'etag': 'fzC-wv97t4UMDiWr9TmSYxLmIyo', 'id': 'Ugzte1qGHnUdmJyG25N4AaABAg', 'snippet': {'videoId': 'VyXbGrKi1Hk', 'textDisplay': '1️⃣3️⃣🇧🇷1️⃣3️⃣LULA.', 'textOriginal': '1️⃣3️⃣🇧🇷1️⃣3️⃣LULA.', 'authorDisplayName': 'Carlos Borromeu de Sousa', 'authorProfileImageUrl': 'https://yt3.ggpht.com/ytc/AGIKgqPmN-gccNnP8KPYtR7nNRk4Vw2h2aMMYiUCYg=s48-c-k-c0x00ffffff-no-rj', 'authorChannelUrl': 'http://www.youtube.com/channel/UChocfFvdOV9eeCDy1jKY-HA', 'authorChannelId': {'value': 'UChocfFvdOV9eeCDy1jKY-HA'}, 'canRate': True, 'viewerRating': 'none', 'likeCount': 0, 'publishedAt': '2022-10-13T14:28:02Z', 'updatedAt': '2022-10-13T14:28:02Z'}}, 'canReply': True, 'totalReplyCount': 0, 'isPublic': True}",,UChocfFvdOV9eeCDy1jKY-HA,2022-10-13T14:28:02Z,1️⃣3️⃣🇧🇷1️⃣3️⃣LULA.,,2023-06-08 11:07:11.439160
youtube#commentThread,mhaQzO1eTEjjH40AX6ipkE-X7S0,UgyLbuVNfPu6vbiVn8t4AaABAg,"{'videoId': 'VyXbGrKi1Hk', 'topLevelComment': {'kind': 'youtube#comment', 'etag': '5f_NNpT1chUeZpgdgrZNUe4a0dc', 'id': 'UgyLbuVNfPu6vbiVn8t4AaABAg', 'snippet': {'videoId': 'VyXbGrKi1Hk', 'textDisplay': 'Péssima explicação!', 'textOriginal': 'Péssima explicação!', 'authorDisplayName': 'jeferson jeff', 'authorProfileImageUrl': 'https://yt3.ggpht.com/ytc/AGIKgqMdPIjv4LHbF3C-gmDk0-KT5hJvodRNw-k7Og=s48-c-k-c0x00ffffff-no-rj', 'authorChannelUrl': 'http://www.youtube.com/channel/UCwxGCJREH9cOSrbJeoNXB0A', 'authorChannelId': {'value': 'UCwxGCJREH9cOSrbJeoNXB0A'}, 'canRate': True, 'viewerRating': 'none', 'likeCount': 1, 'publishedAt': '2022-10-13T12:00:06Z', 'updatedAt': '2022-10-13T12:00:06Z'}}, 'canReply': True, 'totalReplyCount': 0, 'isPublic': True}",,UCwxGCJREH9cOSrbJeoNXB0A,2022-10-13T12:00:06Z,Péssima explicação!,,2023-06-08 11:07:11.439160
youtube#commentThread,AkLhP6cKCPhYwh-tSEZ_6anSuzY,UgwcNROPwGiGfOxeA1p4AaABAg,"{'videoId': 'VyXbGrKi1Hk', 'topLevelComment': {'kind': 'youtube#comment', 'etag': 'h-1xr7f3IoXJ8OMHnqb7i2U-XkQ', 'id': 'UgwcNROPwGiGfOxeA1p4AaABAg', 'snippet': {'videoId': 'VyXbGrKi1Hk', 'textDisplay': '<a href=""https://youtu.be/LCJb-PTW-mY"">https://youtu.be/LCJb-PTW-mY</a>', 'textOriginal': 'https://youtu.be/LCJb-PTW-mY', 'authorDisplayName': 'Johnn Alexandre', 'authorProfileImageUrl': 'https://yt3.ggpht.com/ytc/AGIKgqMWYT8wyoq6rYzP0RKvtg1If_E9X-pT6Aneqg=s48-c-k-c0x00ffffff-no-rj', 'authorChannelUrl': 'http://www.youtube.com/channel/UCCp7gezrsG5PO-9qHPvRj8Q', 'authorChannelId': {'value': 'UCCp7gezrsG5PO-9qHPvRj8Q'}, 'canRate': True, 'viewerRating': 'none', 'likeCount': 1, 'publishedAt': '2022-10-13T11:27:01Z', 'updatedAt': '2022-10-13T11:27:01Z'}}, 'canReply': True, 'totalReplyCount': 0, 'isPublic': True}",,UCCp7gezrsG5PO-9qHPvRj8Q,2022-10-13T11:27:01Z,https://youtu.be/LCJb-PTW-mY,,2023-06-08 11:07:11.439160
youtube#commentThread,QISK1cddhltCHNGr0CW07uWBUKY,UgwHLOZyHMYmSURobXF4AaABAg,"{'videoId': 'VyXbGrKi1Hk', 'topLevelComment': {'kind': 'youtube#comment', 'etag': 'jd6AAo01IP3BlZIgTAQqCSxlbUw', 'id': 'UgwHLOZyHMYmSURobXF4AaABAg', 'snippet': {'videoId': 'VyXbGrKi1Hk', 'textDisplay': 'É  tudo palhaçada, qdo se  esta encurralado, as pessoas são  capazes de muita coisa', 'textOriginal': 'É  tudo palhaçada, qdo se  esta encurralado, as pessoas são  capazes de muita coisa', 'authorDisplayName': 'Fatinha Correia', 'authorProfileImageUrl': 'https://yt3.ggpht.com/ytc/AGIKgqPd2ANjitjyV8YVvPaGsIBkT6kPohUKn8Mz7A=s48-c-k-c0x00ffffff-no-rj', 'authorChannelUrl': 'http://www.youtube.com/channel/UCfZKbUYY1KmT0AJ28Bw6yuQ', 'authorChannelId': {'value': 'UCfZKbUYY1KmT0AJ28Bw6yuQ'}, 'canRate': True, 'viewerRating': 'none', 'likeCount': 0, 'publishedAt': '2022-10-13T10:49:50Z', 'updatedAt': '2022-10-13T10:49:50Z'}}, 'canReply': True, 'totalReplyCount': 0, 'isPublic': True}",,UCfZKbUYY1KmT0AJ28Bw6yuQ,2022-10-13T10:49:50Z,"É  tudo palhaçada, qdo se  esta encurralado, as pessoas são  capazes de muita coisa",,2023-06-08 11:07:11.439160
youtube#commentThread,m_C2i2L7OLRU8PaeEOwW6XHMD1k,Ugz_Xi6fH-i6Esjz28F4AaABAg,"{'videoId': 'VyXbGrKi1Hk', 'topLevelComment': {'kind': 'youtube#comment', 'etag': 'gj2YjrhrKCb0oaAFfYde05_qzNM', 'id': 'Ugz_Xi6fH-i6Esjz28F4AaABAg', 'snippet': {'videoId': 'VyXbGrKi1Hk', 'textDisplay': 'Mostre o raio x  e compare com o camiao que foi identificado  vejo muitas imagens da ponte mas nada do Raio x  ou do camiao', 'textOriginal': 'Mostre o raio x  e compare com o camiao que foi identificado  vejo muitas imagens da ponte mas nada do Raio x  ou do camiao', 'authorDisplayName': 'Matfaycal', 'authorProfileImageUrl': 'https://yt3.ggpht.com/ytc/AGIKgqNLTfYucS0xek446eIojidqlcIIFNNlQgC1RgytMCdcdMrn3-IBn0BvRRUaQZ19=s48-c-k-c0x00ffffff-no-rj', 'authorChannelUrl': 'http://www.youtube.com/channel/UCdN5pcLZ3v5AbyHPIeBX48g', 'authorChannelId': {'value': 'UCdN5pcLZ3v5AbyHPIeBX48g'}, 'canRate': True, 'viewerRating': 'none', 'likeCount': 0, 'publishedAt': '2022-10-13T10:35:09Z', 'updatedAt': '2022-10-13T10:35:09Z'}}, 'canReply': True, 'totalReplyCount': 0, 'isPublic': True}",,UCdN5pcLZ3v5AbyHPIeBX48g,2022-10-13T10:35:09Z,Mostre o raio x  e compare com o camiao que foi identificado  vejo muitas imagens da ponte mas nada do Raio x  ou do camiao,,2023-06-08 11:07:11.439160
youtube#commentThread,k7jqoz6quDa9k0Gqa77TVYhPT28,UgwvVb0KOmVzUjmD0AN4AaABAg,"{'videoId': 'VyXbGrKi1Hk', 'topLevelComment': {'kind': 'youtube#comment', 'etag': 'LmG-AU85X5bNB2LBR1dw5ugmQ90', 'id': 'UgwvVb0KOmVzUjmD0AN4AaABAg', 'snippet': {'videoId': 'VyXbGrKi1Hk', 'textDisplay': 'Parece que o raio x do camiao que Russia colocou com os explosivos para o povo ver tem rodas a menos  que o camiao que vimos na tv  uma palhaçada🤣🤣', 'textOriginal': 'Parece que o raio x do camiao que Russia colocou com os explosivos para o povo ver tem rodas a menos  que o camiao que vimos na tv  uma palhaçada🤣🤣', 'authorDisplayName': 'Matfaycal', 'authorProfileImageUrl': 'https://yt3.ggpht.com/ytc/AGIKgqNLTfYucS0xek446eIojidqlcIIFNNlQgC1RgytMCdcdMrn3-IBn0BvRRUaQZ19=s48-c-k-c0x00ffffff-no-rj', 'authorChannelUrl': 'http://www.youtube.com/channel/UCdN5pcLZ3v5AbyHPIeBX48g', 'authorChannelId': {'value': 'UCdN5pcLZ3v5AbyHPIeBX48g'}, 'canRate': True, 'viewerRating': 'none', 'likeCount': 1, 'publishedAt': '2022-10-13T10:30:08Z', 'updatedAt': '2022-10-13T10:30:53Z'}}, 'canReply': True, 'totalReplyCount': 0, 'isPublic': True}",,UCdN5pcLZ3v5AbyHPIeBX48g,2022-10-13T10:30:08Z,Parece que o raio x do camiao que Russia colocou com os explosivos para o povo ver tem rodas a menos  que o camiao que vimos na tv  uma palhaçada🤣🤣,,2023-06-08 11:07:11.439160
youtube#commentThread,MK6wIEeOYuNEoq-MucvQGWDrywo,UgzKjWAs-BI8H2orSLF4AaABAg,"{'videoId': 'VyXbGrKi1Hk', 'topLevelComment': {'kind': 'youtube#comment', 'etag': 'W_uq1eewjiNy7ccz-jlZswjlcSQ', 'id': 'UgzKjWAs-BI8H2orSLF4AaABAg', 'snippet': {'videoId': 'VyXbGrKi1Hk', 'textDisplay': 'Terrorista  na Rússia é tratado de acordo com o código de guerra, que é o mesmo no mundo todo. Forca', 'textOriginal': 'Terrorista  na Rússia é tratado de acordo com o código de guerra, que é o mesmo no mundo todo. Forca', 'authorDisplayName': 'Papitto', 'authorProfileImageUrl': 'https://yt3.ggpht.com/e9AlD-SNk5z53yp1cEUEu02AqKCsK7ZVlq2Y1lUteamlL8XObU2qoa2eHSo7Gp8390SVfcqfswM=s48-c-k-c0x00ffffff-no-rj', 'authorChannelUrl': 'http://www.youtube.com/channel/UC-tHF3Mqk4PH4pnnMilPQ-Q', 'authorChannelId': {'value': 'UC-tHF3Mqk4PH4pnnMilPQ-Q'}, 'canRate': True, 'viewerRating': 'none', 'likeCount': 0, 'publishedAt': '2022-10-13T04:37:39Z', 'updatedAt': '2022-10-13T04:37:55Z'}}, 'canReply': True, 'totalReplyCount': 0, 'isPublic': True}",,UC-tHF3Mqk4PH4pnnMilPQ-Q,2022-10-13T04:37:39Z,"Terrorista  na Rússia é tratado de acordo com o código de guerra, que é o mesmo no mundo todo. Forca",,2023-06-08 11:07:11.439160
youtube#commentThread,Ofd8LbHhV6yCqu7LORrCAFcUfqY,UgwPoZvKNyoxUnWNcox4AaABAg,"{'videoId': 'VyXbGrKi1Hk', 'topLevelComment': {'kind': 'youtube#comment', 'etag': 'p3tdc_2hFIB6CLj2IW5ANkNiF4E', 'id': 'UgwPoZvKNyoxUnWNcox4AaABAg', 'snippet': {'videoId': 'VyXbGrKi1Hk', 'textDisplay': 'Que Deus dê livramentos de morte e eles sejam inocentes. Que não seja meras Desculpas para maus intentos, aproveitando o momento.', 'textOriginal': 'Que Deus dê livramentos de morte e eles sejam inocentes. Que não seja meras Desculpas para maus intentos, aproveitando o momento.', 'authorDisplayName': 'Sandra Pires', 'authorProfileImageUrl': 'https://yt3.ggpht.com/ytc/AGIKgqO_9QVt6fTWRYE_V4f05XDJnTTMEt9u8M7At4a8zA=s48-c-k-c0x00ffffff-no-rj', 'authorChannelUrl': 'http://www.youtube.com/channel/UCHXUbikDaklAVTxMM4-LWIg', 'authorChannelId': {'value': 'UCHXUbikDaklAVTxMM4-LWIg'}, 'canRate': True, 'viewerRating': 'none', 'likeCount': 2, 'publishedAt': '2022-10-13T03:43:53Z', 'updatedAt': '2022-10-13T03:43:53Z'}}, 'canReply': True, 'totalReplyCount': 0, 'isPublic': True}",,UCHXUbikDaklAVTxMM4-LWIg,2022-10-13T03:43:53Z,"Que Deus dê livramentos de morte e eles sejam inocentes. Que não seja meras Desculpas para maus intentos, aproveitando o momento.",,2023-06-08 11:07:11.439160
youtube#commentThread,tOFINE0LkVK51sAZ31HyiEw1OPk,UgwuiyvZ3yoW3WWzLzV4AaABAg,"{'videoId': 'VyXbGrKi1Hk', 'topLevelComment': {'kind': 'youtube#comment', 'etag': 'tULGVQQvshl-1EO3zzNW8EvnBPY', 'id': 'UgwuiyvZ3yoW3WWzLzV4AaABAg', 'snippet': {'videoId': 'VyXbGrKi1Hk', 'textDisplay': 'Ponte ilegal, contruida no trritorio da Ucrânia, Criméia. roubada em 2014 pela Rússia. Anexação ilegal.Nao reconhecida. Ponte militar transporte de armamentos para destruir Ucrânia. Alvo militar legal atngido pela Ucrânia.', 'textOriginal': 'Ponte ilegal, contruida no trritorio da Ucrânia, Criméia. roubada em 2014 pela Rússia. Anexação ilegal.Nao reconhecida. Ponte militar transporte de armamentos para destruir Ucrânia. Alvo militar legal atngido pela Ucrânia.', 'authorDisplayName': 'Sandra Pires', 'authorProfileImageUrl': 'https://yt3.ggpht.com/ytc/AGIKgqO_9QVt6fTWRYE_V4f05XDJnTTMEt9u8M7At4a8zA=s48-c-k-c0x00ffffff-no-rj', 'authorChannelUrl': 'http://www.youtube.com/channel/UCHXUbikDaklAVTxMM4-LWIg', 'authorChannelId': {'value': 'UCHXUbikDaklAVTxMM4-LWIg'}, 'canRate': True, 'viewerRating': 'none', 'likeCount': 0, 'publishedAt': '2022-10-13T03:36:42Z', 'updatedAt': '2022-10-13T03:39:35Z'}}, 'canReply': True, 'totalReplyCount': 0, 'isPublic': True}",,UCHXUbikDaklAVTxMM4-LWIg,2022-10-13T03:36:42Z,"Ponte ilegal, contruida no trritorio da Ucrânia, Criméia. roubada em 2014 pela Rússia. Anexação ilegal.Nao reconhecida. Ponte militar transporte de armamentos para destruir Ucrânia. Alvo militar legal atngido pela Ucrânia.",,2023-06-08 11:07:11.439160
youtube#commentThread,VlTp76TWRHUFqHgAljAEsl2hfEo,UgzTBRuBo9bxEdVNc714AaABAg,"{'videoId': 'VyXbGrKi1Hk', 'topLevelComment': {'kind': 'youtube#comment', 'etag': 'oQcVc0YG_Baw0zG_v4PmTKmb3fI', 'id': 'UgzTBRuBo9bxEdVNc714AaABAg', 'snippet': {'videoId': 'VyXbGrKi1Hk', 'textDisplay': 'A certeza qe os 8 vai ser eliminado...urraaa viva Rússia 🇷🇺', 'textOriginal': 'A certeza qe os 8 vai ser eliminado...urraaa viva Rússia 🇷🇺', 'authorDisplayName': '13razuca "":)', 'authorProfileImageUrl': 'https://yt3.ggpht.com/cEIPv3-I-en3vZitKZ0lN2ojSHb1LQrypdYCLiq3N61viYQxH50b2KkPQ94qQDjqrWFYzACZe8Q=s48-c-k-c0x00ffffff-no-rj', 'authorChannelUrl': 'http://www.youtube.com/channel/UC8R7Udr7SQzkYJwTuo08OeQ', 'authorChannelId': {'value': 'UC8R7Udr7SQzkYJwTuo08OeQ'}, 'canRate': True, 'viewerRating': 'none', 'likeCount': 0, 'publishedAt': '2022-10-13T03:20:10Z', 'updatedAt': '2022-10-13T03:20:10Z'}}, 'canReply': True, 'totalReplyCount': 4, 'isPublic': True}","{'comments': [{'kind': 'youtube#comment', 'etag': 'QWWG4eKpxYXatRHrupXUHFueJpI', 'id': 'UgzTBRuBo9bxEdVNc714AaABAg.9h6NWeHORik9hCnzEwLKK3', 'snippet': {'videoId': 'VyXbGrKi1Hk', 'textDisplay': 'Go Ukraine !<br><br>🇺🇦🇺🇦🇺🇦🇺🇦🇺🇦🇺🇦🇺🇦', 'textOriginal': 'Go Ukraine !\\n\\n🇺🇦🇺🇦🇺🇦🇺🇦🇺🇦🇺🇦🇺🇦', 'parentId': 'UgzTBRuBo9bxEdVNc714AaABAg', 'authorDisplayName': 'Marcelo Barreto 🇺🇦', 'authorProfileImageUrl': 'https://yt3.ggpht.com/f80jOsKIGeZXSjru_QQzdTJvMstv6NncaeWSQXkQYQfoBeG_rOB72TVRNNcoc4nFCszK0Yk8hQ=s48-c-k-c0x00ffffff-no-rj', 'authorChannelUrl': 'http://www.youtube.com/channel/UCl5uunQnNKfXM65A6dBC2iA', 'authorChannelId': {'value': 'UCl5uunQnNKfXM65A6dBC2iA'}, 'canRate': True, 'viewerRating': 'none', 'likeCount': 1, 'publishedAt': '2022-10-15T15:15:35Z', 'updatedAt': '2022-10-15T15:15:35Z'}}, {'kind': 'youtube#comment', 'etag': '50Dwjq54LtcKAazIszMZvucxuvg', 'id': 'UgzTBRuBo9bxEdVNc714AaABAg.9h6NWeHORik9h760ian4I5', 'snippet': {'videoId': 'VyXbGrKi1Hk', 'textDisplay': 'Comunista lixo. Vai pra Russia.', 'textOriginal': 'Comunista lixo. Vai pra Russia.', 'parentId': 'UgzTBRuBo9bxEdVNc714AaABAg', 'authorDisplayName': 'Diego Cardoso', 'authorProfileImageUrl': 'https://yt3.ggpht.com/ytc/AGIKgqMFo_fSh8n_mYjMiHmrtNMcjiZ4hVURRso-h1uVhQ=s48-c-k-c0x00ffffff-no-rj', 'authorChannelUrl': 'http://www.youtube.com/channel/UC4w3QTdXpQuVLqcj6-SaZeA', 'authorChannelId': {'value': 'UC4w3QTdXpQuVLqcj6-SaZeA'}, 'canRate': True, 'viewerRating': 'none', 'likeCount': 0, 'publishedAt': '2022-10-13T10:06:30Z', 'updatedAt': '2022-10-13T10:06:30Z'}}, {'kind': 'youtube#comment', 'etag': 'qvYzLfOue1pQhQDVg1uT9B4n0ZM', 'id': 'UgzTBRuBo9bxEdVNc714AaABAg.9h6NWeHORik9h6xFJfpGFv', 'snippet': {'videoId': 'VyXbGrKi1Hk', 'textDisplay': 'Dizem que foi um ataque suicida, mais quem leva a culpa é quem saiu vivo 😒!', 'textOriginal': 'Dizem que foi um ataque suicida, mais quem leva a culpa é quem saiu vivo 😒!', 'parentId': 'UgzTBRuBo9bxEdVNc714AaABAg', 'authorDisplayName': 'patriOTARIO', 'authorProfileImageUrl': 'https://yt3.ggpht.com/aX4S4FeRrS4dBosWDxVX8oqe9SmsX03prXL_HRZrO0hoLRmHhEaDtRHJ1Z67EO7KXsE0Tpi7Ew=s48-c-k-c0x00ffffff-no-rj', 'authorChannelUrl': 'http://www.youtube.com/channel/UCrb_wcyF85s6HxTq3tftADw', 'authorChannelId': {'value': 'UCrb_wcyF85s6HxTq3tftADw'}, 'canRate': True, 'viewerRating': 'none', 'likeCount': 1, 'publishedAt': '2022-10-13T08:41:07Z', 'updatedAt': '2022-10-13T08:41:07Z'}}, {'kind': 'youtube#comment', 'etag': 'jaaAY-GcKOg3MYYDpI3tCL3olt0', 'id': 'UgzTBRuBo9bxEdVNc714AaABAg.9h6NWeHORik9h6SV8fTb1m', 'snippet': {'videoId': 'VyXbGrKi1Hk', 'textDisplay': '🇧🇷🇺🇦👊☇', 'textOriginal': '🇧🇷🇺🇦👊☇', 'parentId': 'UgzTBRuBo9bxEdVNc714AaABAg', 'authorDisplayName': 'Ricardo Amaral', 'authorProfileImageUrl': 'https://yt3.ggpht.com/ytc/AGIKgqPLCNB806P8NyS2gA-UMIv3CDA9utfNlkTsuQ=s48-c-k-c0x00ffffff-no-rj', 'authorChannelUrl': 'http://www.youtube.com/channel/UC5DrSeh9YMbo1g5gDbr3qOQ', 'authorChannelId': {'value': 'UC5DrSeh9YMbo1g5gDbr3qOQ'}, 'canRate': True, 'viewerRating': 'none', 'likeCount': 1, 'publishedAt': '2022-10-13T04:03:39Z', 'updatedAt': '2022-10-13T04:03:39Z'}}]}",UC8R7Udr7SQzkYJwTuo08OeQ,2022-10-13T03:20:10Z,A certeza qe os 8 vai ser eliminado...urraaa viva Rússia 🇷🇺,,2023-06-08 11:07:11.439160
youtube#commentThread,0vJ2xHVjPPioctbpWG8fv-Wo0bM,UgzFmD-fBuvXEtYDjlJ4AaABAg,"{'videoId': 'VyXbGrKi1Hk', 'topLevelComment': {'kind': 'youtube#comment', 'etag': 'NLcj_ZgKGjSKv20au8vPLEMhQfQ', 'id': 'UgzFmD-fBuvXEtYDjlJ4AaABAg', 'snippet': {'videoId': 'VyXbGrKi1Hk', 'textDisplay': 'A explosão foi no país da Ucrânia sob ocupação ilegal.', 'textOriginal': 'A explosão foi no país da Ucrânia sob ocupação ilegal.', 'authorDisplayName': 'Robson Dias', 'authorProfileImageUrl': 'https://yt3.ggpht.com/ytc/AGIKgqMkvvO9h6N628oMEE7pB9zmfR9GstpnxobiShG-=s48-c-k-c0x00ffffff-no-rj', 'authorChannelUrl': 'http://www.youtube.com/channel/UCIAPjaE2JJTsOiiqCtb8Weg', 'authorChannelId': {'value': 'UCIAPjaE2JJTsOiiqCtb8Weg'}, 'canRate': True, 'viewerRating': 'none', 'likeCount': 0, 'publishedAt': '2022-10-13T03:07:10Z', 'updatedAt': '2022-10-13T03:07:10Z'}}, 'canReply': True, 'totalReplyCount': 0, 'isPublic': True}",,UCIAPjaE2JJTsOiiqCtb8Weg,2022-10-13T03:07:10Z,A explosão foi no país da Ucrânia sob ocupação ilegal.,,2023-06-08 11:07:11.439160
youtube#commentThread,FTBTFFDL3YFidmpKrHabwUZEgGs,UgxGThP9h3kTb7yl7et4AaABAg,"{'videoId': 'VyXbGrKi1Hk', 'topLevelComment': {'kind': 'youtube#comment', 'etag': 'qp8IAQ32xrBB1JPV8A5JxLTk-5k', 'id': 'UgxGThP9h3kTb7yl7et4AaABAg', 'snippet': {'videoId': 'VyXbGrKi1Hk', 'textDisplay': 'Vixi', 'textOriginal': 'Vixi', 'authorDisplayName': 'Eduardo Gabriel Cavalcante', 'authorProfileImageUrl': 'https://yt3.ggpht.com/ytc/AGIKgqNOtjtBw64UMeztIjvFhWn2Mojkytm2bwrVG0rouVA=s48-c-k-c0x00ffffff-no-rj', 'authorChannelUrl': 'http://www.youtube.com/channel/UCjo9BsDJk6Azkf6rXu2GZOw', 'authorChannelId': {'value': 'UCjo9BsDJk6Azkf6rXu2GZOw'}, 'canRate': True, 'viewerRating': 'none', 'likeCount': 0, 'publishedAt': '2022-10-13T02:37:16Z', 'updatedAt': '2022-10-13T02:37:16Z'}}, 'canReply': True, 'totalReplyCount': 0, 'isPublic': True}",,UCjo9BsDJk6Azkf6rXu2GZOw,2022-10-13T02:37:16Z,Vixi,,2023-06-08 11:07:11.439160
youtube#commentThread,9DY3z7jAq_FPz-aSILeIVuSOZvI,UgxQ3myoaJuLCKhprxh4AaABAg,"{'videoId': 'VyXbGrKi1Hk', 'topLevelComment': {'kind': 'youtube#comment', 'etag': 'VOVyzG2z_T2fDn0qO9N7Vm4YMLg', 'id': 'UgxQ3myoaJuLCKhprxh4AaABAg', 'snippet': {'videoId': 'VyXbGrKi1Hk', 'textDisplay': 'Não é só salvar a Ucrânia é também libertar a Rússia do Z!🇷🇺🕊', 'textOriginal': 'Não é só salvar a Ucrânia é também libertar a Rússia do Z!🇷🇺🕊', 'authorDisplayName': 'Ricardo Amaral', 'authorProfileImageUrl': 'https://yt3.ggpht.com/ytc/AGIKgqPLCNB806P8NyS2gA-UMIv3CDA9utfNlkTsuQ=s48-c-k-c0x00ffffff-no-rj', 'authorChannelUrl': 'http://www.youtube.com/channel/UC5DrSeh9YMbo1g5gDbr3qOQ', 'authorChannelId': {'value': 'UC5DrSeh9YMbo1g5gDbr3qOQ'}, 'canRate': True, 'viewerRating': 'none', 'likeCount': 1, 'publishedAt': '2022-10-13T02:36:27Z', 'updatedAt': '2022-10-13T02:36:27Z'}}, 'canReply': True, 'totalReplyCount': 1, 'isPublic': True}","{'comments': [{'kind': 'youtube#comment', 'etag': 'ipPpdsZk0iYBJ2VMuU6sGlH3gxI', 'id': 'UgxQ3myoaJuLCKhprxh4AaABAg.9h6IWPVumDa9hCntyzrhJ1', 'snippet': {'videoId': 'VyXbGrKi1Hk', 'textDisplay': 'Salvar a Ucrânia sim!  Livrar a Rússia não!', 'textOriginal': 'Salvar a Ucrânia sim!  Livrar a Rússia não!', 'parentId': 'UgxQ3myoaJuLCKhprxh4AaABAg', 'authorDisplayName': 'Marcelo Barreto 🇺🇦', 'authorProfileImageUrl': 'https://yt3.ggpht.com/f80jOsKIGeZXSjru_QQzdTJvMstv6NncaeWSQXkQYQfoBeG_rOB72TVRNNcoc4nFCszK0Yk8hQ=s48-c-k-c0x00ffffff-no-rj', 'authorChannelUrl': 'http://www.youtube.com/channel/UCl5uunQnNKfXM65A6dBC2iA', 'authorChannelId': {'value': 'UCl5uunQnNKfXM65A6dBC2iA'}, 'canRate': True, 'viewerRating': 'none', 'likeCount': 0, 'publishedAt': '2022-10-15T15:14:52Z', 'updatedAt': '2022-10-15T15:14:52Z'}}]}",UC5DrSeh9YMbo1g5gDbr3qOQ,2022-10-13T02:36:27Z,Não é só salvar a Ucrânia é também libertar a Rússia do Z!🇷🇺🕊,,2023-06-08 11:07:11.439160
youtube#commentThread,krVX0tVp_2l4Jm8j0VZde_3pPCc,UgypuKiiPPrlP6FkHUx4AaABAg,"{'videoId': 'VyXbGrKi1Hk', 'topLevelComment': {'kind': 'youtube#comment', 'etag': 'KuouQim2vr9K14VyJFPemgSXNLg', 'id': 'UgypuKiiPPrlP6FkHUx4AaABAg', 'snippet': {'videoId': 'VyXbGrKi1Hk', 'textDisplay': 'OPERAÇÃO VALQUIRIA na Rússia pelos próprios Russos. <br>Fora Putin!🇷🇺🕊', 'textOriginal': 'OPERAÇÃO VALQUIRIA na Rússia pelos próprios Russos. \\nFora Putin!🇷🇺🕊', 'authorDisplayName': 'Ricardo Amaral', 'authorProfileImageUrl': 'https://yt3.ggpht.com/ytc/AGIKgqPLCNB806P8NyS2gA-UMIv3CDA9utfNlkTsuQ=s48-c-k-c0x00ffffff-no-rj', 'authorChannelUrl': 'http://www.youtube.com/channel/UC5DrSeh9YMbo1g5gDbr3qOQ', 'authorChannelId': {'value': 'UC5DrSeh9YMbo1g5gDbr3qOQ'}, 'canRate': True, 'viewerRating': 'none', 'likeCount': 0, 'publishedAt': '2022-10-13T02:36:11Z', 'updatedAt': '2022-10-13T02:36:11Z'}}, 'canReply': True, 'totalReplyCount': 0, 'isPublic': True}",,UC5DrSeh9YMbo1g5gDbr3qOQ,2022-10-13T02:36:11Z,"OPERAÇÃO VALQUIRIA na Rússia pelos próprios Russos. 
Fora Putin!🇷🇺🕊",,2023-06-08 11:07:11.439160
