kind,etag,id,snippet,replies,authorChannelId,publishedAt,textOriginal,nextPageToken,extraction_date
youtube#commentThread,3lGYrGW8eJ3eAc6LE4sQc19GuJQ,UgxlcLceiE6UrgDDlBp4AaABAg,"{'videoId': 'mngDDP48JKU', 'topLevelComment': {'kind': 'youtube#comment', 'etag': 'EICoV1eAcPe0cnHLnCTSyh46w5A', 'id': 'UgxlcLceiE6UrgDDlBp4AaABAg', 'snippet': {'videoId': 'mngDDP48JKU', 'textDisplay': 'LULALAAA PRESIDENTE VOLTA O POVO PRESISA DE TI LULALAAA FUTURA PRESIDENTE DO BRASIL SIMONE TEBET LULALAAA 💙💜💙💜💙💜💜💙💜', 'textOriginal': 'LULALAAA PRESIDENTE VOLTA O POVO PRESISA DE TI LULALAAA FUTURA PRESIDENTE DO BRASIL SIMONE TEBET LULALAAA 💙💜💙💜💙💜💜💙💜', 'authorDisplayName': 'Maria melo', 'authorProfileImageUrl': 'https://yt3.ggpht.com/ytc/AGIKgqOd5czpTAgbNAIaf90nNy5pfrSDjuRjkmdEL1vpEtXyHN1WDWMBOKeo6YGPPC6-=s48-c-k-c0x00ffffff-no-rj', 'authorChannelUrl': 'http://www.youtube.com/channel/UCWKU4EnEqRT9BX1cBc9_HpA', 'authorChannelId': {'value': 'UCWKU4EnEqRT9BX1cBc9_HpA'}, 'canRate': True, 'viewerRating': 'none', 'likeCount': 3, 'publishedAt': '2022-10-23T17:00:40Z', 'updatedAt': '2022-10-23T17:00:40Z'}}, 'canReply': True, 'totalReplyCount': 0, 'isPublic': True}",,UCWKU4EnEqRT9BX1cBc9_HpA,2022-10-23T17:00:40Z,LULALAAA PRESIDENTE VOLTA O POVO PRESISA DE TI LULALAAA FUTURA PRESIDENTE DO BRASIL SIMONE TEBET LULALAAA 💙💜💙💜💙💜💜💙💜,,2023-06-08 02:41:32.262018
youtube#commentThread,pHA1TG4_eS7ETkRLWAtbmOEDtlw,UgxX0ueOIfcKXp67w9p4AaABAg,"{'videoId': 'mngDDP48JKU', 'topLevelComment': {'kind': 'youtube#comment', 'etag': 'DY2hLhKtw6-66ecKHW3ihxlwA6o', 'id': 'UgxX0ueOIfcKXp67w9p4AaABAg', 'snippet': {'videoId': 'mngDDP48JKU', 'textDisplay': 'NÃO TEM DINHEIROS SEUS FARISEU PORQUE BIZO COMPROU 51 MANSÃO LUXUOSAS FORA DO BRASIL FORAAAAAAAAAA', 'textOriginal': 'NÃO TEM DINHEIROS SEUS FARISEU PORQUE BIZO COMPROU 51 MANSÃO LUXUOSAS FORA DO BRASIL FORAAAAAAAAAA', 'authorDisplayName': 'Maria melo', 'authorProfileImageUrl': 'https://yt3.ggpht.com/ytc/AGIKgqOd5czpTAgbNAIaf90nNy5pfrSDjuRjkmdEL1vpEtXyHN1WDWMBOKeo6YGPPC6-=s48-c-k-c0x00ffffff-no-rj', 'authorChannelUrl': 'http://www.youtube.com/channel/UCWKU4EnEqRT9BX1cBc9_HpA', 'authorChannelId': {'value': 'UCWKU4EnEqRT9BX1cBc9_HpA'}, 'canRate': True, 'viewerRating': 'none', 'likeCount': 0, 'publishedAt': '2022-10-23T17:00:14Z', 'updatedAt': '2022-10-23T17:00:14Z'}}, 'canReply': True, 'totalReplyCount': 0, 'isPublic': True}",,UCWKU4EnEqRT9BX1cBc9_HpA,2022-10-23T17:00:14Z,NÃO TEM DINHEIROS SEUS FARISEU PORQUE BIZO COMPROU 51 MANSÃO LUXUOSAS FORA DO BRASIL FORAAAAAAAAAA,,2023-06-08 02:41:32.262018
youtube#commentThread,DWtCrf3A3SClztMnyrdWUYIs7J8,UgyGpjWGzeCh6M3_BfV4AaABAg,"{'videoId': 'mngDDP48JKU', 'topLevelComment': {'kind': 'youtube#comment', 'etag': 'Y4BKno_vgOYOPNSlRo59azxeFbM', 'id': 'UgyGpjWGzeCh6M3_BfV4AaABAg', 'snippet': {'videoId': 'mngDDP48JKU', 'textDisplay': '22 BRASIL<br>13 VENEZUELA', 'textOriginal': '22 BRASIL\\n13 VENEZUELA', 'authorDisplayName': 'NÃO TEM MAIS RIVAL', 'authorProfileImageUrl': 'https://yt3.ggpht.com/URK3DGu3kV2fR-vZbRbqs0rVD4YSop4ZvPfFsFTpEmbEsh5_d9qIjTCrjHM-VkO7wDIsFP42yQ=s48-c-k-c0x00ffffff-no-rj', 'authorChannelUrl': 'http://www.youtube.com/channel/UCMn8HCM325Jck8E6UyXY_4Q', 'authorChannelId': {'value': 'UCMn8HCM325Jck8E6UyXY_4Q'}, 'canRate': True, 'viewerRating': 'none', 'likeCount': 4, 'publishedAt': '2022-10-23T16:59:49Z', 'updatedAt': '2022-10-23T16:59:49Z'}}, 'canReply': True, 'totalReplyCount': 1, 'isPublic': True}","{'comments': [{'kind': 'youtube#comment', 'etag': 'KuNOzj_KJqJ7rjBZHS8LJS6Zre4', 'id': 'UgyGpjWGzeCh6M3_BfV4AaABAg.9hXaGdqXoXX9hXffpBRQ24', 'snippet': {'videoId': 'mngDDP48JKU', 'textDisplay': '13 BRASIL<br>22 DITADURA', 'textOriginal': '13 BRASIL\\n22 DITADURA', 'parentId': 'UgyGpjWGzeCh6M3_BfV4AaABAg', 'authorDisplayName': 'Allan Soares', 'authorProfileImageUrl': 'https://yt3.ggpht.com/ytc/AGIKgqOSxjUPVqrqgxm81RJn9RdkL-OxANnKkBxIx7Hg2w=s48-c-k-c0x00ffffff-no-rj', 'authorChannelUrl': 'http://www.youtube.com/channel/UCCe5cRgADoQ74TUHjKrfiUA', 'authorChannelId': {'value': 'UCCe5cRgADoQ74TUHjKrfiUA'}, 'canRate': True, 'viewerRating': 'none', 'likeCount': 0, 'publishedAt': '2022-10-23T17:47:05Z', 'updatedAt': '2022-10-23T17:47:05Z'}}]}",UCMn8HCM325Jck8E6UyXY_4Q,2022-10-23T16:59:49Z,"22 BRASIL
13 VENEZUELA",,2023-06-08 02:41:32.262018
youtube#commentThread,zKFL4UK0EzqoFmMuIFir_kEXKVI,Ugwo63JamDpbNjqclK94AaABAg,"{'videoId': 'mngDDP48JKU', 'topLevelComment': {'kind': 'youtube#comment', 'etag': '24VUMmMxkD5CPh10hRvmY7Mwgmw', 'id': 'Ugwo63JamDpbNjqclK94AaABAg', 'snippet': {'videoId': 'mngDDP48JKU', 'textDisplay': 'ESSE POVO DO LULA NÃO É BAIXA RENDA O BIZO DERRUBOU O BRASIL POIS MEU VOTO PRO CANIBAL É NÃO NÃO NÃO NÃO NÃO NÃO NÃO NÃO NÃO NÃO NÃO', 'textOriginal': 'ESSE POVO DO LULA NÃO É BAIXA RENDA O BIZO DERRUBOU O BRASIL POIS MEU VOTO PRO CANIBAL É NÃO NÃO NÃO NÃO NÃO NÃO NÃO NÃO NÃO NÃO NÃO', 'authorDisplayName': 'Maria melo', 'authorProfileImageUrl': 'https://yt3.ggpht.com/ytc/AGIKgqOd5czpTAgbNAIaf90nNy5pfrSDjuRjkmdEL1vpEtXyHN1WDWMBOKeo6YGPPC6-=s48-c-k-c0x00ffffff-no-rj', 'authorChannelUrl': 'http://www.youtube.com/channel/UCWKU4EnEqRT9BX1cBc9_HpA', 'authorChannelId': {'value': 'UCWKU4EnEqRT9BX1cBc9_HpA'}, 'canRate': True, 'viewerRating': 'none', 'likeCount': 0, 'publishedAt': '2022-10-23T16:59:18Z', 'updatedAt': '2022-10-23T16:59:18Z'}}, 'canReply': True, 'totalReplyCount': 0, 'isPublic': True}",,UCWKU4EnEqRT9BX1cBc9_HpA,2022-10-23T16:59:18Z,ESSE POVO DO LULA NÃO É BAIXA RENDA O BIZO DERRUBOU O BRASIL POIS MEU VOTO PRO CANIBAL É NÃO NÃO NÃO NÃO NÃO NÃO NÃO NÃO NÃO NÃO NÃO,,2023-06-08 02:41:32.262018
youtube#commentThread,f3-4De4ub9kptEljWvYz8dWxKTQ,UgykZn4J8XFBHW-YpmZ4AaABAg,"{'videoId': 'mngDDP48JKU', 'topLevelComment': {'kind': 'youtube#comment', 'etag': 'uhd1e4nYqRWAm-Gr1BXWKmV4OyE', 'id': 'UgykZn4J8XFBHW-YpmZ4AaABAg', 'snippet': {'videoId': 'mngDDP48JKU', 'textDisplay': 'BOZO VAI CAIR CANIBAL PEDOFOLO PINTOU O CLIMA ISSO É CRIME PEDOFOLIA CADEIA NELE', 'textOriginal': 'BOZO VAI CAIR CANIBAL PEDOFOLO PINTOU O CLIMA ISSO É CRIME PEDOFOLIA CADEIA NELE', 'authorDisplayName': 'Maria melo', 'authorProfileImageUrl': 'https://yt3.ggpht.com/ytc/AGIKgqOd5czpTAgbNAIaf90nNy5pfrSDjuRjkmdEL1vpEtXyHN1WDWMBOKeo6YGPPC6-=s48-c-k-c0x00ffffff-no-rj', 'authorChannelUrl': 'http://www.youtube.com/channel/UCWKU4EnEqRT9BX1cBc9_HpA', 'authorChannelId': {'value': 'UCWKU4EnEqRT9BX1cBc9_HpA'}, 'canRate': True, 'viewerRating': 'none', 'likeCount': 0, 'publishedAt': '2022-10-23T16:58:07Z', 'updatedAt': '2022-10-23T16:58:07Z'}}, 'canReply': True, 'totalReplyCount': 0, 'isPublic': True}",,UCWKU4EnEqRT9BX1cBc9_HpA,2022-10-23T16:58:07Z,BOZO VAI CAIR CANIBAL PEDOFOLO PINTOU O CLIMA ISSO É CRIME PEDOFOLIA CADEIA NELE,,2023-06-08 02:41:32.262018
youtube#commentThread,m2ZrGgYNS1cOaZOPccygI-pErRA,UgzkkqlrIxA8r2C-Ow54AaABAg,"{'videoId': 'mngDDP48JKU', 'topLevelComment': {'kind': 'youtube#comment', 'etag': 'kNdTQfbOXgBw2L87f1_aJjKUDwk', 'id': 'UgzkkqlrIxA8r2C-Ow54AaABAg', 'snippet': {'videoId': 'mngDDP48JKU', 'textDisplay': 'LULALAAA PRESIDENTE VOLTA O POVO PRESISA DE TI LULALAAA 💙💙💙💙💙💙💙💙💙💙💙💙', 'textOriginal': 'LULALAAA PRESIDENTE VOLTA O POVO PRESISA DE TI LULALAAA 💙💙💙💙💙💙💙💙💙💙💙💙', 'authorDisplayName': 'Maria melo', 'authorProfileImageUrl': 'https://yt3.ggpht.com/ytc/AGIKgqOd5czpTAgbNAIaf90nNy5pfrSDjuRjkmdEL1vpEtXyHN1WDWMBOKeo6YGPPC6-=s48-c-k-c0x00ffffff-no-rj', 'authorChannelUrl': 'http://www.youtube.com/channel/UCWKU4EnEqRT9BX1cBc9_HpA', 'authorChannelId': {'value': 'UCWKU4EnEqRT9BX1cBc9_HpA'}, 'canRate': True, 'viewerRating': 'none', 'likeCount': 1, 'publishedAt': '2022-10-23T16:57:18Z', 'updatedAt': '2022-10-23T16:57:18Z'}}, 'canReply': True, 'totalReplyCount': 0, 'isPublic': True}",,UCWKU4EnEqRT9BX1cBc9_HpA,2022-10-23T16:57:18Z,LULALAAA PRESIDENTE VOLTA O POVO PRESISA DE TI LULALAAA 💙💙💙💙💙💙💙💙💙💙💙💙,,2023-06-08 02:41:32.262018
youtube#commentThread,L7wKjK8UptUJYj5q1_vPp-iuta4,UgzOH55-u67iEAzVRDF4AaABAg,"{'videoId': 'mngDDP48JKU', 'topLevelComment': {'kind': 'youtube#comment', 'etag': 'A6U6UU6rMuRxKydmHuHogZ1Z96E', 'id': 'UgzOH55-u67iEAzVRDF4AaABAg', 'snippet': {'videoId': 'mngDDP48JKU', 'textDisplay': 'lula vence tranquilo', 'textOriginal': 'lula vence tranquilo', 'authorDisplayName': 'Danilo Vicentini', 'authorProfileImageUrl': 'https://yt3.ggpht.com/ytc/AGIKgqNSBbBlqEhKoCslD7rTlNqHfJC6WCa5_-1C9A=s48-c-k-c0x00ffffff-no-rj', 'authorChannelUrl': 'http://www.youtube.com/channel/UCpXHcdSla_ndBI1mIfLoJHg', 'authorChannelId': {'value': 'UCpXHcdSla_ndBI1mIfLoJHg'}, 'canRate': True, 'viewerRating': 'none', 'likeCount': 3, 'publishedAt': '2022-10-23T16:56:56Z', 'updatedAt': '2022-10-23T16:56:56Z'}}, 'canReply': True, 'totalReplyCount': 0, 'isPublic': True}",,UCpXHcdSla_ndBI1mIfLoJHg,2022-10-23T16:56:56Z,lula vence tranquilo,,2023-06-08 02:41:32.262018
youtube#commentThread,ZHEnn1Vw2HYnuVr586I5SUdSBao,Ugye78c17XXusgI88jN4AaABAg,"{'videoId': 'mngDDP48JKU', 'topLevelComment': {'kind': 'youtube#comment', 'etag': 'A7WblpJc5gHJSDS3_gprlJnJFWQ', 'id': 'Ugye78c17XXusgI88jN4AaABAg', 'snippet': {'videoId': 'mngDDP48JKU', 'textDisplay': 'Só q os Nordestinos se pensar comigo Não Vota em Bolsonaro MANDOU. CAPIM e CHAMOU de BURROS. NORDESTINOS .NÃO MERECEMOS ISSO QUEREMOS. RESPEITO VAMOS PUNI-LO NAS URNAS.BOLSONARO NÃO SE CRIA NO NORDESTE. Agora Somos Todos Lula Candidato Carioca Tem Outro Endereço AS URNAS.', 'textOriginal': 'Só q os Nordestinos se pensar comigo Não Vota em Bolsonaro MANDOU. CAPIM e CHAMOU de BURROS. NORDESTINOS .NÃO MERECEMOS ISSO QUEREMOS. RESPEITO VAMOS PUNI-LO NAS URNAS.BOLSONARO NÃO SE CRIA NO NORDESTE. Agora Somos Todos Lula Candidato Carioca Tem Outro Endereço AS URNAS.', 'authorDisplayName': 'Orgulho de ser nordestina *', 'authorProfileImageUrl': 'https://yt3.ggpht.com/ytc/AGIKgqMovcyfUPJCSvHZr61FA0cAhcatGESZHgSQ9w=s48-c-k-c0x00ffffff-no-rj', 'authorChannelUrl': 'http://www.youtube.com/channel/UChS-3_xopChIaGwzMOgQV3Q', 'authorChannelId': {'value': 'UChS-3_xopChIaGwzMOgQV3Q'}, 'canRate': True, 'viewerRating': 'none', 'likeCount': 1, 'publishedAt': '2022-10-23T16:56:53Z', 'updatedAt': '2022-10-23T16:56:53Z'}}, 'canReply': True, 'totalReplyCount': 2, 'isPublic': True}","{'comments': [{'kind': 'youtube#comment', 'etag': 'NUuaoiK7czlaXXgBmZJPVC0Tiig', 'id': 'Ugye78c17XXusgI88jN4AaABAg.9hX_w7nRPsM9hfLLAZsDwO', 'snippet': {'videoId': 'mngDDP48JKU', 'textDisplay': 'Depois os nordestinos perguntam pq o restante do Brasil não gosta deles', 'textOriginal': 'Depois os nordestinos perguntam pq o restante do Brasil não gosta deles', 'parentId': 'Ugye78c17XXusgI88jN4AaABAg', 'authorDisplayName': 'Caio Reis', 'authorProfileImageUrl': 'https://yt3.ggpht.com/ytc/AGIKgqMKUdTkKiDnHRvcxfoZVGga6Gm2NT9GZ6AWgBNGLw=s48-c-k-c0x00ffffff-no-rj', 'authorChannelUrl': 'http://www.youtube.com/channel/UCEaZJZJQDx3rdIrTjVyLBzw', 'authorChannelId': {'value': 'UCEaZJZJQDx3rdIrTjVyLBzw'}, 'canRate': True, 'viewerRating': 'none', 'likeCount': 0, 'publishedAt': '2022-10-27T02:33:47Z', 'updatedAt': '2022-10-27T02:33:47Z'}}, {'kind': 'youtube#comment', 'etag': 'QwS-momjunJ2ijT5fqt1avnT4ME', 'id': 'Ugye78c17XXusgI88jN4AaABAg.9hX_w7nRPsM9hXlBK4r5cq', 'snippet': {'videoId': 'mngDDP48JKU', 'textDisplay': 'Então nordestino tem que provar que é inteligente e votar em quem rouba seu dinheiro? Muito bom seu pensamento. Só comprova a teoria 🤣🤣🤣🤣', 'textOriginal': 'Então nordestino tem que provar que é inteligente e votar em quem rouba seu dinheiro? Muito bom seu pensamento. Só comprova a teoria 🤣🤣🤣🤣', 'parentId': 'Ugye78c17XXusgI88jN4AaABAg', 'authorDisplayName': 'jaqueline silva', 'authorProfileImageUrl': 'https://yt3.ggpht.com/ytc/AGIKgqOu85XgqrlG8M-0uANv9OUQHSL_NhV48qs26g=s48-c-k-c0x00ffffff-no-rj', 'authorChannelUrl': 'http://www.youtube.com/channel/UC_WDJldAcJ9GxUBqZsuQV0w', 'authorChannelId': {'value': 'UC_WDJldAcJ9GxUBqZsuQV0w'}, 'canRate': True, 'viewerRating': 'none', 'likeCount': 1, 'publishedAt': '2022-10-23T18:35:12Z', 'updatedAt': '2022-10-23T18:35:12Z'}}]}",UChS-3_xopChIaGwzMOgQV3Q,2022-10-23T16:56:53Z,Só q os Nordestinos se pensar comigo Não Vota em Bolsonaro MANDOU. CAPIM e CHAMOU de BURROS. NORDESTINOS .NÃO MERECEMOS ISSO QUEREMOS. RESPEITO VAMOS PUNI-LO NAS URNAS.BOLSONARO NÃO SE CRIA NO NORDESTE. Agora Somos Todos Lula Candidato Carioca Tem Outro Endereço AS URNAS.,,2023-06-08 02:41:32.262018
youtube#commentThread,VHtjjGKP1gWO5L-FHziVVJemZlM,Ugw-JQIvtNoY2CM3doJ4AaABAg,"{'videoId': 'mngDDP48JKU', 'topLevelComment': {'kind': 'youtube#comment', 'etag': 'aqQ08_k8a0fMyT0a3o4WnFHhy-A', 'id': 'Ugw-JQIvtNoY2CM3doJ4AaABAg', 'snippet': {'videoId': 'mngDDP48JKU', 'textDisplay': 'Os nordestinos vai  em peso as urnas, e votar no lulinha dia 30 de outubro, rumo a vitória 👍', 'textOriginal': 'Os nordestinos vai  em peso as urnas, e votar no lulinha dia 30 de outubro, rumo a vitória 👍', 'authorDisplayName': 'Shellfish', 'authorProfileImageUrl': 'https://yt3.ggpht.com/ytc/AGIKgqMDBup-9XSVU0ATjrcyEzXZmT-htowKeLNKFUuWnw=s48-c-k-c0x00ffffff-no-rj', 'authorChannelUrl': 'http://www.youtube.com/channel/UCT42ZeVSwF41-F6-QxAYj1g', 'authorChannelId': {'value': 'UCT42ZeVSwF41-F6-QxAYj1g'}, 'canRate': True, 'viewerRating': 'none', 'likeCount': 11, 'publishedAt': '2022-10-23T16:51:10Z', 'updatedAt': '2022-10-23T16:51:10Z'}}, 'canReply': True, 'totalReplyCount': 7, 'isPublic': True}","{'comments': [{'kind': 'youtube#comment', 'etag': 'Zj8XFrWvyjql-cPZKsdXYdDM-qI', 'id': 'Ugw-JQIvtNoY2CM3doJ4AaABAg.9hX_HKCYxaM9hZAaLhCeNA', 'snippet': {'videoId': 'mngDDP48JKU', 'textDisplay': '@Adriano Silva vcs tem que acreditar nisso msm, se não ficam perdidos no desespero. Mas a realidade é que dia 30 às <a href=""https://www.youtube.com/watch?v=mngDDP48JKU&amp;t=20m00s"">20:00</a> teremos Lula Presidente!', 'textOriginal': '@Adriano Silva vcs tem que acreditar nisso msm, se não ficam perdidos no desespero. Mas a realidade é que dia 30 às 20:00 teremos Lula Presidente!', 'parentId': 'Ugw-JQIvtNoY2CM3doJ4AaABAg', 'authorDisplayName': 'Allan Aquino', 'authorProfileImageUrl': 'https://yt3.ggpht.com/AG9xzm8nwryUOVXC-vxp58HDezFlS4pmA2ycioj9P8S11Xi2J59JAOIdtu4ULTXrC5nkn4ALVA=s48-c-k-c0x00ffffff-no-rj', 'authorChannelUrl': 'http://www.youtube.com/channel/UCtFrcc2wmGmV7q1Kif8sLIw', 'authorChannelId': {'value': 'UCtFrcc2wmGmV7q1Kif8sLIw'}, 'canRate': True, 'viewerRating': 'none', 'likeCount': 0, 'publishedAt': '2022-10-24T07:45:11Z', 'updatedAt': '2022-10-24T07:45:11Z'}}, {'kind': 'youtube#comment', 'etag': 'I__o_GGVKWrTJKvAedoYhRdpejs', 'id': 'Ugw-JQIvtNoY2CM3doJ4AaABAg.9hX_HKCYxaM9hZARykF6yM', 'snippet': {'videoId': 'mngDDP48JKU', 'textDisplay': '@Pokemon Ward verdade deve ampliar também, ainda mais com Hélder Barbalho trabalhando para isso.', 'textOriginal': '@Pokemon Ward verdade deve ampliar também, ainda mais com Hélder Barbalho trabalhando para isso.', 'parentId': 'Ugw-JQIvtNoY2CM3doJ4AaABAg', 'authorDisplayName': 'Allan Aquino', 'authorProfileImageUrl': 'https://yt3.ggpht.com/AG9xzm8nwryUOVXC-vxp58HDezFlS4pmA2ycioj9P8S11Xi2J59JAOIdtu4ULTXrC5nkn4ALVA=s48-c-k-c0x00ffffff-no-rj', 'authorChannelUrl': 'http://www.youtube.com/channel/UCtFrcc2wmGmV7q1Kif8sLIw', 'authorChannelId': {'value': 'UCtFrcc2wmGmV7q1Kif8sLIw'}, 'canRate': True, 'viewerRating': 'none', 'likeCount': 0, 'publishedAt': '2022-10-24T07:43:55Z', 'updatedAt': '2022-10-24T07:43:55Z'}}, {'kind': 'youtube#comment', 'etag': '4a7dZm-3PCfqWKTdOX7PeoqEkw0', 'id': 'Ugw-JQIvtNoY2CM3doJ4AaABAg.9hX_HKCYxaM9hYyKZtS16K', 'snippet': {'videoId': 'mngDDP48JKU', 'textDisplay': 'No Pará também, Lula ganhou no Pará', 'textOriginal': 'No Pará também, Lula ganhou no Pará', 'parentId': 'Ugw-JQIvtNoY2CM3doJ4AaABAg', 'authorDisplayName': 'Pokemon Ward', 'authorProfileImageUrl': 'https://yt3.ggpht.com/ytc/AGIKgqO3tFGNZWD-V1gWOKtz8rLVdWN4OaysKA1wd5Wd=s48-c-k-c0x00ffffff-no-rj', 'authorChannelUrl': 'http://www.youtube.com/channel/UC7j1O7FsolI3uhaPowoQobg', 'authorChannelId': {'value': 'UC7j1O7FsolI3uhaPowoQobg'}, 'canRate': True, 'viewerRating': 'none', 'likeCount': 1, 'publishedAt': '2022-10-24T05:49:18Z', 'updatedAt': '2022-10-24T05:49:18Z'}}, {'kind': 'youtube#comment', 'etag': '7EjJGY18MlXiXiSaXkPSN5Uy0qI', 'id': 'Ugw-JQIvtNoY2CM3doJ4AaABAg.9hX_HKCYxaM9hYx1zqMjVL', 'snippet': {'videoId': 'mngDDP48JKU', 'textDisplay': 'Vai ter virada do jair bolsonaro o Lula tem seu nome sujo porque todo mundo fala em ladrão se refiro a ele o  Lula', 'textOriginal': 'Vai ter virada do jair bolsonaro o Lula tem seu nome sujo porque todo mundo fala em ladrão se refiro a ele o  Lula', 'parentId': 'Ugw-JQIvtNoY2CM3doJ4AaABAg', 'authorDisplayName': 'Adriano Silva', 'authorProfileImageUrl': 'https://yt3.ggpht.com/ytc/AGIKgqNCNNtT3MeJQR3u1_TDGImpD_gN7KGHBm-beo8-J1jVngFpWB3i74v7jn__uQ38=s48-c-k-c0x00ffffff-no-rj', 'authorChannelUrl': 'http://www.youtube.com/channel/UCQ5a-_ktnoiDgaaiY_VLKww', 'authorChannelId': {'value': 'UCQ5a-_ktnoiDgaaiY_VLKww'}, 'canRate': True, 'viewerRating': 'none', 'likeCount': 1, 'publishedAt': '2022-10-24T05:38:02Z', 'updatedAt': '2022-10-24T05:38:02Z'}}, {'kind': 'youtube#comment', 'etag': 'SUopwZ543zajxCkeXXVPsKkFydI', 'id': 'Ugw-JQIvtNoY2CM3doJ4AaABAg.9hX_HKCYxaM9hY5pQt3aP9', 'snippet': {'videoId': 'mngDDP48JKU', 'textDisplay': '@jaqueline silva abstenção não é boa para ninguém, saiba disso. E abstenção vai rolar dos dois lados!', 'textOriginal': '@jaqueline silva abstenção não é boa para ninguém, saiba disso. E abstenção vai rolar dos dois lados!', 'parentId': 'Ugw-JQIvtNoY2CM3doJ4AaABAg', 'authorDisplayName': 'Allan Aquino', 'authorProfileImageUrl': 'https://yt3.ggpht.com/AG9xzm8nwryUOVXC-vxp58HDezFlS4pmA2ycioj9P8S11Xi2J59JAOIdtu4ULTXrC5nkn4ALVA=s48-c-k-c0x00ffffff-no-rj', 'authorChannelUrl': 'http://www.youtube.com/channel/UCtFrcc2wmGmV7q1Kif8sLIw', 'authorChannelId': {'value': 'UCtFrcc2wmGmV7q1Kif8sLIw'}, 'canRate': True, 'viewerRating': 'none', 'likeCount': 0, 'publishedAt': '2022-10-23T21:44:19Z', 'updatedAt': '2022-10-23T21:44:19Z'}}]}",UCT42ZeVSwF41-F6-QxAYj1g,2022-10-23T16:51:10Z,"Os nordestinos vai  em peso as urnas, e votar no lulinha dia 30 de outubro, rumo a vitória 👍",,2023-06-08 02:41:32.262018
youtube#commentThread,5DLglPxU1lSPwv3n2QYA8n5yD4Y,UgwEhT4swZzBBajvvIN4AaABAg,"{'videoId': 'mngDDP48JKU', 'topLevelComment': {'kind': 'youtube#comment', 'etag': 'HPQksVpFn9G6dsEp82dbPOxZUXg', 'id': 'UgwEhT4swZzBBajvvIN4AaABAg', 'snippet': {'videoId': 'mngDDP48JKU', 'textDisplay': 'E todos sabem que bosonaro não feis nada e só almeta tudo  não  aumenta salário  cocoreja muito não bota nada então é Lula 13', 'textOriginal': 'E todos sabem que bosonaro não feis nada e só almeta tudo  não  aumenta salário  cocoreja muito não bota nada então é Lula 13', 'authorDisplayName': 'Odair Dornel', 'authorProfileImageUrl': 'https://yt3.ggpht.com/ytc/AGIKgqO4_qtqYNYv_Qdpw5hQb931-Bug7v2OecblHeu9_RLIyNC01lptIMh1Uq-RUtuc=s48-c-k-c0x00ffffff-no-rj', 'authorChannelUrl': 'http://www.youtube.com/channel/UCj1LVSkpt8VwRVAwnUtrxGg', 'authorChannelId': {'value': 'UCj1LVSkpt8VwRVAwnUtrxGg'}, 'canRate': True, 'viewerRating': 'none', 'likeCount': 0, 'publishedAt': '2022-10-23T16:50:44Z', 'updatedAt': '2022-10-23T16:50:44Z'}}, 'canReply': True, 'totalReplyCount': 0, 'isPublic': True}",,UCj1LVSkpt8VwRVAwnUtrxGg,2022-10-23T16:50:44Z,E todos sabem que bosonaro não feis nada e só almeta tudo  não  aumenta salário  cocoreja muito não bota nada então é Lula 13,,2023-06-08 02:41:32.262018
youtube#commentThread,QJMZinmLgrvH461OZjg6Hqzzsfs,UgxNIOXpPGz-TOtLBQJ4AaABAg,"{'videoId': 'mngDDP48JKU', 'topLevelComment': {'kind': 'youtube#comment', 'etag': 'JBkEy0Kfs0kb3tGYTtkvWJ6vhew', 'id': 'UgxNIOXpPGz-TOtLBQJ4AaABAg', 'snippet': {'videoId': 'mngDDP48JKU', 'textDisplay': 'PT TRABALHA PARA O MAL,  PT ENSENTIVA GREVES AS EMPRESAS QUE JA ESTÃO NO VERMELHO SE QUEBRAM E AS PESSOAS FICAM DESEMPREGADOS.', 'textOriginal': 'PT TRABALHA PARA O MAL,  PT ENSENTIVA GREVES AS EMPRESAS QUE JA ESTÃO NO VERMELHO SE QUEBRAM E AS PESSOAS FICAM DESEMPREGADOS.', 'authorDisplayName': 'José Kuki', 'authorProfileImageUrl': 'https://yt3.ggpht.com/ytc/AGIKgqMX7lGTD1iuogqq9mmkIJnY3C_Tu8flt4Cy7zgK=s48-c-k-c0x00ffffff-no-rj', 'authorChannelUrl': 'http://www.youtube.com/channel/UC_hkYWLncPDdC1QnjxLcEHQ', 'authorChannelId': {'value': 'UC_hkYWLncPDdC1QnjxLcEHQ'}, 'canRate': True, 'viewerRating': 'none', 'likeCount': 0, 'publishedAt': '2022-10-23T16:43:15Z', 'updatedAt': '2022-10-23T16:43:15Z'}}, 'canReply': True, 'totalReplyCount': 0, 'isPublic': True}",,UC_hkYWLncPDdC1QnjxLcEHQ,2022-10-23T16:43:15Z,"PT TRABALHA PARA O MAL,  PT ENSENTIVA GREVES AS EMPRESAS QUE JA ESTÃO NO VERMELHO SE QUEBRAM E AS PESSOAS FICAM DESEMPREGADOS.",,2023-06-08 02:41:32.262018
youtube#commentThread,Ad1R1XmAv824aKm6Iu8qjr9lrSg,Ugx2D1GBW2-gm_DpQv14AaABAg,"{'videoId': 'mngDDP48JKU', 'topLevelComment': {'kind': 'youtube#comment', 'etag': 'y5Zdk3gscfkGUibAoDL9jI0yII0', 'id': 'Ugx2D1GBW2-gm_DpQv14AaABAg', 'snippet': {'videoId': 'mngDDP48JKU', 'textDisplay': 'GOVERNADORES E PREFEITOS QUE FECHAM TUDO, SÃO ASSACINOS DE EMPRESAS E EMPREGOS,', 'textOriginal': 'GOVERNADORES E PREFEITOS QUE FECHAM TUDO, SÃO ASSACINOS DE EMPRESAS E EMPREGOS,', 'authorDisplayName': 'José Kuki', 'authorProfileImageUrl': 'https://yt3.ggpht.com/ytc/AGIKgqMX7lGTD1iuogqq9mmkIJnY3C_Tu8flt4Cy7zgK=s48-c-k-c0x00ffffff-no-rj', 'authorChannelUrl': 'http://www.youtube.com/channel/UC_hkYWLncPDdC1QnjxLcEHQ', 'authorChannelId': {'value': 'UC_hkYWLncPDdC1QnjxLcEHQ'}, 'canRate': True, 'viewerRating': 'none', 'likeCount': 1, 'publishedAt': '2022-10-23T16:42:36Z', 'updatedAt': '2022-10-23T16:42:36Z'}}, 'canReply': True, 'totalReplyCount': 0, 'isPublic': True}",,UC_hkYWLncPDdC1QnjxLcEHQ,2022-10-23T16:42:36Z,"GOVERNADORES E PREFEITOS QUE FECHAM TUDO, SÃO ASSACINOS DE EMPRESAS E EMPREGOS,",,2023-06-08 02:41:32.262018
youtube#commentThread,GcRP_EFDroNzvVutiYBLRKl4qpI,UgzxdAfUlMaZUB3bD-J4AaABAg,"{'videoId': 'mngDDP48JKU', 'topLevelComment': {'kind': 'youtube#comment', 'etag': 'HBNgG5Praoy_oEz56zBm9L0t-00', 'id': 'UgzxdAfUlMaZUB3bD-J4AaABAg', 'snippet': {'videoId': 'mngDDP48JKU', 'textDisplay': 'Tem que ser muito imbecil pra dizer má gestao de pandemia....ai quando essa porra nao cola com o povo, fica ai sem saber oque dizer!', 'textOriginal': 'Tem que ser muito imbecil pra dizer má gestao de pandemia....ai quando essa porra nao cola com o povo, fica ai sem saber oque dizer!', 'authorDisplayName': 'Thiago Rocha', 'authorProfileImageUrl': 'https://yt3.ggpht.com/ytc/AGIKgqOoW7lGbLmehy5ArJ88DAIrF8K9XgQ9tF_7XIbN=s48-c-k-c0x00ffffff-no-rj', 'authorChannelUrl': 'http://www.youtube.com/channel/UCUiA2cBVnvnLs7Qjg9AYTyg', 'authorChannelId': {'value': 'UCUiA2cBVnvnLs7Qjg9AYTyg'}, 'canRate': True, 'viewerRating': 'none', 'likeCount': 0, 'publishedAt': '2022-10-23T16:39:15Z', 'updatedAt': '2022-10-23T16:39:15Z'}}, 'canReply': True, 'totalReplyCount': 0, 'isPublic': True}",,UCUiA2cBVnvnLs7Qjg9AYTyg,2022-10-23T16:39:15Z,"Tem que ser muito imbecil pra dizer má gestao de pandemia....ai quando essa porra nao cola com o povo, fica ai sem saber oque dizer!",,2023-06-08 02:41:32.262018
youtube#commentThread,HILnGjLdpxpicjkNZBmwTaU187I,UgyflM69IBriuhwyEPx4AaABAg,"{'videoId': 'mngDDP48JKU', 'topLevelComment': {'kind': 'youtube#comment', 'etag': 'VpHKK0sTEg-zJFbhtbBn-MCKvko', 'id': 'UgyflM69IBriuhwyEPx4AaABAg', 'snippet': {'videoId': 'mngDDP48JKU', 'textDisplay': 'Bolsonaro vai colocar o próprio irmão como ministro. O presidente é fã dos ditadores chileno Pinochet e do paraguaio Stroessner que tinham um arem de crianças para fazer o que bem entendia. Ja elogiou muito Chaves, é um parceiro de Putin, de Orban, e na Arabia saudita ele é parceiro do Mohammed bin Rashid Al Maktoum que é acusado por coisas horríveis, e do presidente corrupto da Guiné-Bissau que esta tentando tomar o poder Umaro Sissoco Embaló🤔 Bolsonaro quer ser o Ditador do Brasil e falou centenas de vezes sobre isso e esta se aparelhando pra isso.', 'textOriginal': 'Bolsonaro vai colocar o próprio irmão como ministro. O presidente é fã dos ditadores chileno Pinochet e do paraguaio Stroessner que tinham um arem de crianças para fazer o que bem entendia. Ja elogiou muito Chaves, é um parceiro de Putin, de Orban, e na Arabia saudita ele é parceiro do Mohammed bin Rashid Al Maktoum que é acusado por coisas horríveis, e do presidente corrupto da Guiné-Bissau que esta tentando tomar o poder Umaro Sissoco Embaló🤔 Bolsonaro quer ser o Ditador do Brasil e falou centenas de vezes sobre isso e esta se aparelhando pra isso.', 'authorDisplayName': 'NãoDigaQueNãoAvisei', 'authorProfileImageUrl': 'https://yt3.ggpht.com/4INq6TB71_7muWEJOq5CrB_12QNRHBuKYANG4Q1Tctx41CGbpJxDlAmO9B3k8x87IBYi3mK1fiE=s48-c-k-c0x00ffffff-no-rj', 'authorChannelUrl': 'http://www.youtube.com/channel/UCkkGP5j-74o6QkG8Bw5xwLQ', 'authorChannelId': {'value': 'UCkkGP5j-74o6QkG8Bw5xwLQ'}, 'canRate': True, 'viewerRating': 'none', 'likeCount': 0, 'publishedAt': '2022-10-23T16:38:09Z', 'updatedAt': '2022-10-23T16:38:09Z'}}, 'canReply': True, 'totalReplyCount': 0, 'isPublic': True}",,UCkkGP5j-74o6QkG8Bw5xwLQ,2022-10-23T16:38:09Z,"Bolsonaro vai colocar o próprio irmão como ministro. O presidente é fã dos ditadores chileno Pinochet e do paraguaio Stroessner que tinham um arem de crianças para fazer o que bem entendia. Ja elogiou muito Chaves, é um parceiro de Putin, de Orban, e na Arabia saudita ele é parceiro do Mohammed bin Rashid Al Maktoum que é acusado por coisas horríveis, e do presidente corrupto da Guiné-Bissau que esta tentando tomar o poder Umaro Sissoco Embaló🤔 Bolsonaro quer ser o Ditador do Brasil e falou centenas de vezes sobre isso e esta se aparelhando pra isso.",,2023-06-08 02:41:32.262018
