kind,etag,id,snippet,replies,authorChannelId,publishedAt,textOriginal,nextPageToken,extraction_date
youtube#commentThread,daj_ppoe3t30zl2PvM3iJ1EdDos,UgwQp9XmvZA0F7OPE-Z4AaABAg,"{'videoId': 'dzYiEk8gHAo', 'topLevelComment': {'kind': 'youtube#comment', 'etag': '_nUfXJ1Wmzs-marDf_XX9nzFsK8', 'id': 'UgwQp9XmvZA0F7OPE-Z4AaABAg', 'snippet': {'videoId': 'dzYiEk8gHAo', 'textDisplay': 'Ciro Gomes me representa e tem a minha admiração e respeito Mas <a href=""http://www.youtube.com/results?search_query=%23ptnuncamais"">#PTNuncaMais</a>', 'textOriginal': 'Ciro Gomes me representa e tem a minha admiração e respeito Mas #PTNuncaMais', 'authorDisplayName': 'Frederic Maigath', 'authorProfileImageUrl': 'https://yt3.ggpht.com/ytc/AGIKgqNKxmbj4_Xnkdb8FAqh9eQybuEll7oGy_3opH-Ocg=s48-c-k-c0x00ffffff-no-rj', 'authorChannelUrl': 'http://www.youtube.com/channel/UC0t38ME01AgnFvzeP_1Rm0g', 'authorChannelId': {'value': 'UC0t38ME01AgnFvzeP_1Rm0g'}, 'canRate': True, 'viewerRating': 'none', 'likeCount': 1, 'publishedAt': '2022-10-07T10:13:25Z', 'updatedAt': '2022-10-07T10:13:25Z'}}, 'canReply': True, 'totalReplyCount': 0, 'isPublic': True}",,UC0t38ME01AgnFvzeP_1Rm0g,2022-10-07T10:13:25Z,Ciro Gomes me representa e tem a minha admiração e respeito Mas #PTNuncaMais,,2023-06-08 11:26:38.206724
youtube#commentThread,lJO5sU9dyJFE125olIZrGRCzgC4,Ugx5QKjdAOYxqtvvMCR4AaABAg,"{'videoId': 'dzYiEk8gHAo', 'topLevelComment': {'kind': 'youtube#comment', 'etag': 'rDsbKHYwhdgiYdJb9FUNWJL_YrE', 'id': 'Ugx5QKjdAOYxqtvvMCR4AaABAg', 'snippet': {'videoId': 'dzYiEk8gHAo', 'textDisplay': 'Lulaladrão tchau lulaladrão lulaladrão lulaladrão lulaladrão lulaladrão lulaladrão lulaladrão lulaladrão lulaladrão lulaladrão lulaladrão lulaladrão lulaladrão lulaladrão lulaladrão', 'textOriginal': 'Lulaladrão tchau lulaladrão lulaladrão lulaladrão lulaladrão lulaladrão lulaladrão lulaladrão lulaladrão lulaladrão lulaladrão lulaladrão lulaladrão lulaladrão lulaladrão lulaladrão', 'authorDisplayName': 'Jorge Luis', 'authorProfileImageUrl': 'https://yt3.ggpht.com/bXOenDw0vo18naUF0t8BLjzC4cL8vNfiZYHQnBLnc86JuwM2pbtoiSWa0LjyXphdo8_zBm991wA=s48-c-k-c0x00ffffff-no-rj', 'authorChannelUrl': 'http://www.youtube.com/channel/UCe6KuivtXYWE7D10D3nvgXg', 'authorChannelId': {'value': 'UCe6KuivtXYWE7D10D3nvgXg'}, 'canRate': True, 'viewerRating': 'none', 'likeCount': 0, 'publishedAt': '2022-10-07T04:12:18Z', 'updatedAt': '2022-10-07T04:12:18Z'}}, 'canReply': True, 'totalReplyCount': 0, 'isPublic': True}",,UCe6KuivtXYWE7D10D3nvgXg,2022-10-07T04:12:18Z,Lulaladrão tchau lulaladrão lulaladrão lulaladrão lulaladrão lulaladrão lulaladrão lulaladrão lulaladrão lulaladrão lulaladrão lulaladrão lulaladrão lulaladrão lulaladrão lulaladrão,,2023-06-08 11:26:38.206724
youtube#commentThread,Bud4P8s1D-pyQ_U8N-jfe--I5g0,UgxxsuNYGmD3RtAHT5N4AaABAg,"{'videoId': 'dzYiEk8gHAo', 'topLevelComment': {'kind': 'youtube#comment', 'etag': 'E6pby0v1qDYYZLy8SYllZoPnZyE', 'id': 'UgxxsuNYGmD3RtAHT5N4AaABAg', 'snippet': {'videoId': 'dzYiEk8gHAo', 'textDisplay': '22 22 22 22 22 22🇧🇷', 'textOriginal': '22 22 22 22 22 22🇧🇷', 'authorDisplayName': 'Joiciane VIEIRA DOS SANTOS', 'authorProfileImageUrl': 'https://yt3.ggpht.com/ytc/AGIKgqPJnzftas_CA1N60g19JJ3-7rXEKHmrAFxQQF4p_g=s48-c-k-c0x00ffffff-no-rj', 'authorChannelUrl': 'http://www.youtube.com/channel/UCC1zaNe7STydXiuhBP0WUXw', 'authorChannelId': {'value': 'UCC1zaNe7STydXiuhBP0WUXw'}, 'canRate': True, 'viewerRating': 'none', 'likeCount': 1, 'publishedAt': '2022-10-07T03:06:17Z', 'updatedAt': '2022-10-07T03:06:17Z'}}, 'canReply': True, 'totalReplyCount': 0, 'isPublic': True}",,UCC1zaNe7STydXiuhBP0WUXw,2022-10-07T03:06:17Z,22 22 22 22 22 22🇧🇷,,2023-06-08 11:26:38.206724
youtube#commentThread,demEtnumnL_Gnc7_2XjmHrJH7EY,Ugw8FYca6q60DT6M26F4AaABAg,"{'videoId': 'dzYiEk8gHAo', 'topLevelComment': {'kind': 'youtube#comment', 'etag': '_c_OKlHV_HiDbfkiM3prrSsnxrs', 'id': 'Ugw8FYca6q60DT6M26F4AaABAg', 'snippet': {'videoId': 'dzYiEk8gHAo', 'textDisplay': 'Simone é Lula<br>Ciro é Lula<br><br>Frente ampla <a href=""http://www.youtube.com/results?search_query=%23lula13"">#lula13</a>', 'textOriginal': 'Simone é Lula\\nCiro é Lula\\n\\nFrente ampla #lula13', 'authorDisplayName': 'Alexandre Costa', 'authorProfileImageUrl': 'https://yt3.ggpht.com/ytc/AGIKgqMVc42FIygSyUKUaDrU8wNQU6LcX1rUJBDpAsAD=s48-c-k-c0x00ffffff-no-rj', 'authorChannelUrl': 'http://www.youtube.com/channel/UCGLVa5H9Md9X9xU43pgzL8A', 'authorChannelId': {'value': 'UCGLVa5H9Md9X9xU43pgzL8A'}, 'canRate': True, 'viewerRating': 'none', 'likeCount': 0, 'publishedAt': '2022-10-06T23:19:52Z', 'updatedAt': '2022-10-06T23:19:52Z'}}, 'canReply': True, 'totalReplyCount': 0, 'isPublic': True}",,UCGLVa5H9Md9X9xU43pgzL8A,2022-10-06T23:19:52Z,"Simone é Lula
Ciro é Lula

Frente ampla #lula13",,2023-06-08 11:26:38.206724
youtube#commentThread,eLF0L3b5PlUDAJBFOZRgF3Mlo0s,UgzK8AW1L5IV1Bky4K94AaABAg,"{'videoId': 'dzYiEk8gHAo', 'topLevelComment': {'kind': 'youtube#comment', 'etag': 'AvFFVb1mLL4-WZtFwjkwP0-xJUY', 'id': 'UgzK8AW1L5IV1Bky4K94AaABAg', 'snippet': {'videoId': 'dzYiEk8gHAo', 'textDisplay': 'Eu votei em Simone tebet, agora vou vota Lula. Fora bozo rachadão', 'textOriginal': 'Eu votei em Simone tebet, agora vou vota Lula. Fora bozo rachadão', 'authorDisplayName': 'Isaac Miranda', 'authorProfileImageUrl': 'https://yt3.ggpht.com/ytc/AGIKgqMS0YgMqBSW-0PpZBtTI-X1NEuwE7cHzlQGEA=s48-c-k-c0x00ffffff-no-rj', 'authorChannelUrl': 'http://www.youtube.com/channel/UCXzLTR4QWHCf8_fDCWKOxFA', 'authorChannelId': {'value': 'UCXzLTR4QWHCf8_fDCWKOxFA'}, 'canRate': True, 'viewerRating': 'none', 'likeCount': 1, 'publishedAt': '2022-10-06T19:47:26Z', 'updatedAt': '2022-10-06T19:47:26Z'}}, 'canReply': True, 'totalReplyCount': 0, 'isPublic': True}",,UCXzLTR4QWHCf8_fDCWKOxFA,2022-10-06T19:47:26Z,"Eu votei em Simone tebet, agora vou vota Lula. Fora bozo rachadão",,2023-06-08 11:26:38.206724
youtube#commentThread,l3IZYIl8kdgaMMkWObil82BwRJc,UgyVUWZwbiLW3dKSeBl4AaABAg,"{'videoId': 'dzYiEk8gHAo', 'topLevelComment': {'kind': 'youtube#comment', 'etag': 'L11Ns0RfEegETo5qLgFkDOwBfWg', 'id': 'UgyVUWZwbiLW3dKSeBl4AaABAg', 'snippet': {'videoId': 'dzYiEk8gHAo', 'textDisplay': 'Os Brasileiros têm boa memória  Bolsonaro governou com mentiras ,agora a mídia fala quê  pra ele vira voto tem fala tudo de antes isso é um absurdo  em currala eleitores com mentiras .', 'textOriginal': 'Os Brasileiros têm boa memória  Bolsonaro governou com mentiras ,agora a mídia fala quê  pra ele vira voto tem fala tudo de antes isso é um absurdo  em currala eleitores com mentiras .', 'authorDisplayName': 'Maria Oliveira', 'authorProfileImageUrl': 'https://yt3.ggpht.com/ytc/AGIKgqMHsk9_Zh9d3sqTiP-qQl70ivSyfE2eqDRjpcywSg=s48-c-k-c0x00ffffff-no-rj', 'authorChannelUrl': 'http://www.youtube.com/channel/UCztzOrwg9k0PJWunBmHHryg', 'authorChannelId': {'value': 'UCztzOrwg9k0PJWunBmHHryg'}, 'canRate': True, 'viewerRating': 'none', 'likeCount': 0, 'publishedAt': '2022-10-06T19:40:03Z', 'updatedAt': '2022-10-06T19:40:03Z'}}, 'canReply': True, 'totalReplyCount': 0, 'isPublic': True}",,UCztzOrwg9k0PJWunBmHHryg,2022-10-06T19:40:03Z,"Os Brasileiros têm boa memória  Bolsonaro governou com mentiras ,agora a mídia fala quê  pra ele vira voto tem fala tudo de antes isso é um absurdo  em currala eleitores com mentiras .",,2023-06-08 11:26:38.206724
youtube#commentThread,w32p8_MRkeW5dQcS4Sb_RZBuQa8,UgzkD-HzosWY_nIch2F4AaABAg,"{'videoId': 'dzYiEk8gHAo', 'topLevelComment': {'kind': 'youtube#comment', 'etag': 'q0TX47QJpDJMStCxZ9zIBYTX-F0', 'id': 'UgzkD-HzosWY_nIch2F4AaABAg', 'snippet': {'videoId': 'dzYiEk8gHAo', 'textDisplay': 'Lula ganhou no primeiro turno e vai ganhar no segundo Ciro Gomes e Simone fez a escolha certa os dois tá de parabéns que Deus abençoe a cada um de nós e vai dar tudo certo', 'textOriginal': 'Lula ganhou no primeiro turno e vai ganhar no segundo Ciro Gomes e Simone fez a escolha certa os dois tá de parabéns que Deus abençoe a cada um de nós e vai dar tudo certo', 'authorDisplayName': 'Irene Borges', 'authorProfileImageUrl': 'https://yt3.ggpht.com/ytc/AGIKgqPJA1QSFPuC2vFBzmfDQpgmJdkGYyIqMm1S6g=s48-c-k-c0x00ffffff-no-rj', 'authorChannelUrl': 'http://www.youtube.com/channel/UCpsrnItQ2b08jbEJH8agVlQ', 'authorChannelId': {'value': 'UCpsrnItQ2b08jbEJH8agVlQ'}, 'canRate': True, 'viewerRating': 'none', 'likeCount': 4, 'publishedAt': '2022-10-06T19:19:12Z', 'updatedAt': '2022-10-06T19:19:12Z'}}, 'canReply': True, 'totalReplyCount': 0, 'isPublic': True}",,UCpsrnItQ2b08jbEJH8agVlQ,2022-10-06T19:19:12Z,Lula ganhou no primeiro turno e vai ganhar no segundo Ciro Gomes e Simone fez a escolha certa os dois tá de parabéns que Deus abençoe a cada um de nós e vai dar tudo certo,,2023-06-08 11:26:38.206724
youtube#commentThread,qrBGgTgluxDZMn2pHdFICa_m29Y,UgwILhrltWypocB-pnR4AaABAg,"{'videoId': 'dzYiEk8gHAo', 'topLevelComment': {'kind': 'youtube#comment', 'etag': 'wSLBf9jzEZy3hKLuIYnULmomXGQ', 'id': 'UgwILhrltWypocB-pnR4AaABAg', 'snippet': {'videoId': 'dzYiEk8gHAo', 'textDisplay': 'O PT quer a legalização das Drogas, o ministro Barroso colocado pele PT defende e faz politica por isso. O PT apoia o Evo Morales presidente da Bolívia que é o maior produtor de coca da América Latina. P com C com C apoia o PT. Bom que não quero apoiar isso, queria o Ciro, mas Lula insiste em continuar fazendo o que fez e foi condenado por. Vou de Bolsonaro no segundo. PT nunca.', 'textOriginal': 'O PT quer a legalização das Drogas, o ministro Barroso colocado pele PT defende e faz politica por isso. O PT apoia o Evo Morales presidente da Bolívia que é o maior produtor de coca da América Latina. P com C com C apoia o PT. Bom que não quero apoiar isso, queria o Ciro, mas Lula insiste em continuar fazendo o que fez e foi condenado por. Vou de Bolsonaro no segundo. PT nunca.', 'authorDisplayName': 'Jose Maria', 'authorProfileImageUrl': 'https://yt3.ggpht.com/g8ig55IWzQbOE_iRsfm8Wn5CnROWxEk7RSWn79lKcXIwVF0WOW4yPmEMRH6ciKgeN9h2RWUn=s48-c-k-c0x00ffffff-no-rj', 'authorChannelUrl': 'http://www.youtube.com/channel/UCtP8gPYTk1O_1QF8HIH9HPg', 'authorChannelId': {'value': 'UCtP8gPYTk1O_1QF8HIH9HPg'}, 'canRate': True, 'viewerRating': 'none', 'likeCount': 0, 'publishedAt': '2022-10-06T19:13:39Z', 'updatedAt': '2022-10-06T19:13:39Z'}}, 'canReply': True, 'totalReplyCount': 0, 'isPublic': True}",,UCtP8gPYTk1O_1QF8HIH9HPg,2022-10-06T19:13:39Z,"O PT quer a legalização das Drogas, o ministro Barroso colocado pele PT defende e faz politica por isso. O PT apoia o Evo Morales presidente da Bolívia que é o maior produtor de coca da América Latina. P com C com C apoia o PT. Bom que não quero apoiar isso, queria o Ciro, mas Lula insiste em continuar fazendo o que fez e foi condenado por. Vou de Bolsonaro no segundo. PT nunca.",,2023-06-08 11:26:38.206724
youtube#commentThread,5Ug7JyS04EK3JQ1lTiJdvGcgXXk,UgybGjJSXEOHN9KeZt14AaABAg,"{'videoId': 'dzYiEk8gHAo', 'topLevelComment': {'kind': 'youtube#comment', 'etag': 'oHNMg8ECt6xpaTYDJ2-2lDdZCnw', 'id': 'UgybGjJSXEOHN9KeZt14AaABAg', 'snippet': {'videoId': 'dzYiEk8gHAo', 'textDisplay': 'Bahia 22🇧🇷🇧🇷', 'textOriginal': 'Bahia 22🇧🇷🇧🇷', 'authorDisplayName': 'Emerson  Empreendedorismo', 'authorProfileImageUrl': 'https://yt3.ggpht.com/ytc/AGIKgqOF6ROXXTGtkI9kZ994sg7aRZF3V-TTZw5ch2B1fRlpeqlVefp8JPX6NileeWkO=s48-c-k-c0x00ffffff-no-rj', 'authorChannelUrl': 'http://www.youtube.com/channel/UCMpELfduQfJEMfLPHIxTi2g', 'authorChannelId': {'value': 'UCMpELfduQfJEMfLPHIxTi2g'}, 'canRate': True, 'viewerRating': 'none', 'likeCount': 3, 'publishedAt': '2022-10-06T18:46:22Z', 'updatedAt': '2022-10-06T18:46:22Z'}}, 'canReply': True, 'totalReplyCount': 3, 'isPublic': True}","{'comments': [{'kind': 'youtube#comment', 'etag': 'sIeHwJ6IjvcdCQGbrDhJkWvKVIg', 'id': 'UgybGjJSXEOHN9KeZt14AaABAg.9gr-xBOyFlS9gr7RtPB81V', 'snippet': {'videoId': 'dzYiEk8gHAo', 'textDisplay': 'Isso vamo de 22', 'textOriginal': 'Isso vamo de 22', 'parentId': 'UgybGjJSXEOHN9KeZt14AaABAg', 'authorDisplayName': 'Santiago', 'authorProfileImageUrl': 'https://yt3.ggpht.com/AbgqI1BciKyvJDQwY18S3psGuJwuyXMn3aTqvzI3Nj0sZfZcCiajglvhOiMnaiiIVs7z7rBvzLI=s48-c-k-c0x00ffffff-no-rj', 'authorChannelUrl': 'http://www.youtube.com/channel/UCNnBkKtFoGBu_WFLdvalQlA', 'authorChannelId': {'value': 'UCNnBkKtFoGBu_WFLdvalQlA'}, 'canRate': True, 'viewerRating': 'none', 'likeCount': 1, 'publishedAt': '2022-10-06T19:51:52Z', 'updatedAt': '2022-10-06T19:51:52Z'}}, {'kind': 'youtube#comment', 'etag': 'FvNLPzzN45_up6akz8mlkedUriI', 'id': 'UgybGjJSXEOHN9KeZt14AaABAg.9gr-xBOyFlS9gr3aPTYBkc', 'snippet': {'videoId': 'dzYiEk8gHAo', 'textDisplay': '@Emanuel Costa Querem abafar a conquista da transposição do Rio São Francisco, que o PT nunca concluiu<br>Nordeste 22🇧🇷🇧🇷🇧🇷', 'textOriginal': '@Emanuel Costa Querem abafar a conquista da transposição do Rio São Francisco, que o PT nunca concluiu\\nNordeste 22🇧🇷🇧🇷🇧🇷', 'parentId': 'UgybGjJSXEOHN9KeZt14AaABAg', 'authorDisplayName': 'Emerson  Empreendedorismo', 'authorProfileImageUrl': 'https://yt3.ggpht.com/ytc/AGIKgqOF6ROXXTGtkI9kZ994sg7aRZF3V-TTZw5ch2B1fRlpeqlVefp8JPX6NileeWkO=s48-c-k-c0x00ffffff-no-rj', 'authorChannelUrl': 'http://www.youtube.com/channel/UCMpELfduQfJEMfLPHIxTi2g', 'authorChannelId': {'value': 'UCMpELfduQfJEMfLPHIxTi2g'}, 'canRate': True, 'viewerRating': 'none', 'likeCount': 0, 'publishedAt': '2022-10-06T19:18:12Z', 'updatedAt': '2022-10-06T19:18:12Z'}}, {'kind': 'youtube#comment', 'etag': 'IldG6pWxozfZCUEVTZtbu22aYL4', 'id': 'UgybGjJSXEOHN9KeZt14AaABAg.9gr-xBOyFlS9gr1UKyTkY9', 'snippet': {'videoId': 'dzYiEk8gHAo', 'textDisplay': 'Onde? Lapada da peste o palhaço levou kkkk&#39;', 'textOriginal': ""Onde? Lapada da peste o palhaço levou kkkk'"", 'parentId': 'UgybGjJSXEOHN9KeZt14AaABAg', 'authorDisplayName': 'Emanuel Costa', 'authorProfileImageUrl': 'https://yt3.ggpht.com/jfAr5AX1Lpsqj3Ghvodaxw3qixGLeKZ5PSm759lJgpIZRufPv1A7-28S8ZEVYUaFgI9_Y1aSp-c=s48-c-k-c0x00ffffff-no-rj', 'authorChannelUrl': 'http://www.youtube.com/channel/UCmc4kMifDoqovGNlE1zSEXw', 'authorChannelId': {'value': 'UCmc4kMifDoqovGNlE1zSEXw'}, 'canRate': True, 'viewerRating': 'none', 'likeCount': 0, 'publishedAt': '2022-10-06T18:59:46Z', 'updatedAt': '2022-10-06T18:59:46Z'}}]}",UCMpELfduQfJEMfLPHIxTi2g,2022-10-06T18:46:22Z,Bahia 22🇧🇷🇧🇷,,2023-06-08 11:26:38.206724
youtube#commentThread,MgEL-RF9NJpW5VhI2gGw8lRjQLc,UgxsXQfp_JqBtt3PM_J4AaABAg,"{'videoId': 'dzYiEk8gHAo', 'topLevelComment': {'kind': 'youtube#comment', 'etag': '9jp5LQ143k3N2z0dFT2N3J4k7iU', 'id': 'UgxsXQfp_JqBtt3PM_J4AaABAg', 'snippet': {'videoId': 'dzYiEk8gHAo', 'textDisplay': 'Querem abafar a conquista da transposição do Rio São Francisco, que o PT nunca concluiu<br>Nordeste 22🇧🇷🇧🇷🇧🇷', 'textOriginal': 'Querem abafar a conquista da transposição do Rio São Francisco, que o PT nunca concluiu\\nNordeste 22🇧🇷🇧🇷🇧🇷', 'authorDisplayName': 'Emerson  Empreendedorismo', 'authorProfileImageUrl': 'https://yt3.ggpht.com/ytc/AGIKgqOF6ROXXTGtkI9kZ994sg7aRZF3V-TTZw5ch2B1fRlpeqlVefp8JPX6NileeWkO=s48-c-k-c0x00ffffff-no-rj', 'authorChannelUrl': 'http://www.youtube.com/channel/UCMpELfduQfJEMfLPHIxTi2g', 'authorChannelId': {'value': 'UCMpELfduQfJEMfLPHIxTi2g'}, 'canRate': True, 'viewerRating': 'none', 'likeCount': 0, 'publishedAt': '2022-10-06T18:46:10Z', 'updatedAt': '2022-10-06T18:46:10Z'}}, 'canReply': True, 'totalReplyCount': 1, 'isPublic': True}","{'comments': [{'kind': 'youtube#comment', 'etag': 'xbswRmj--OK4FnRwLXG41L_tN8U', 'id': 'UgxsXQfp_JqBtt3PM_J4AaABAg.9gr-vfJ_KqJ9grV8L0dDTY', 'snippet': {'videoId': 'dzYiEk8gHAo', 'textDisplay': 'A transposição que o Ciro fez com o PT? Todo mundo sabe! Frente ampla <a href=""http://www.youtube.com/results?search_query=%23lula13"">#lula13</a>', 'textOriginal': 'A transposição que o Ciro fez com o PT? Todo mundo sabe! Frente ampla #lula13', 'parentId': 'UgxsXQfp_JqBtt3PM_J4AaABAg', 'authorDisplayName': 'Alexandre Costa', 'authorProfileImageUrl': 'https://yt3.ggpht.com/ytc/AGIKgqMVc42FIygSyUKUaDrU8wNQU6LcX1rUJBDpAsAD=s48-c-k-c0x00ffffff-no-rj', 'authorChannelUrl': 'http://www.youtube.com/channel/UCGLVa5H9Md9X9xU43pgzL8A', 'authorChannelId': {'value': 'UCGLVa5H9Md9X9xU43pgzL8A'}, 'canRate': True, 'viewerRating': 'none', 'likeCount': 0, 'publishedAt': '2022-10-06T23:18:54Z', 'updatedAt': '2022-10-06T23:18:54Z'}}]}",UCMpELfduQfJEMfLPHIxTi2g,2022-10-06T18:46:10Z,"Querem abafar a conquista da transposição do Rio São Francisco, que o PT nunca concluiu
Nordeste 22🇧🇷🇧🇷🇧🇷",,2023-06-08 11:26:38.206724
youtube#commentThread,So6yOxq_-GacTKBNFVL9ufnTARU,UgxpjLvT2fFGoMOcN5F4AaABAg,"{'videoId': 'dzYiEk8gHAo', 'topLevelComment': {'kind': 'youtube#comment', 'etag': 'aeY54fEiIptsb3BW5ZGGfvyASuI', 'id': 'UgxpjLvT2fFGoMOcN5F4AaABAg', 'snippet': {'videoId': 'dzYiEk8gHAo', 'textDisplay': 'Lula Lula Lula Lula Lula Lula Lula Lula Lula Lula Lula Lula', 'textOriginal': 'Lula Lula Lula Lula Lula Lula Lula Lula Lula Lula Lula Lula', 'authorDisplayName': 'Neusa Maximo', 'authorProfileImageUrl': 'https://yt3.ggpht.com/ytc/AGIKgqNmkZttneIMwn-EhFMnLFJXK5JUsso-QvSdfO1PsXA=s48-c-k-c0x00ffffff-no-rj', 'authorChannelUrl': 'http://www.youtube.com/channel/UCgZiCF1vytPaVWBsi0uXPXw', 'authorChannelId': {'value': 'UCgZiCF1vytPaVWBsi0uXPXw'}, 'canRate': True, 'viewerRating': 'none', 'likeCount': 1, 'publishedAt': '2022-10-06T18:42:11Z', 'updatedAt': '2022-10-06T18:42:11Z'}}, 'canReply': True, 'totalReplyCount': 0, 'isPublic': True}",,UCgZiCF1vytPaVWBsi0uXPXw,2022-10-06T18:42:11Z,Lula Lula Lula Lula Lula Lula Lula Lula Lula Lula Lula Lula,,2023-06-08 11:26:38.206724
youtube#commentThread,bVDT4gA3S_ipZx4lS32DY4PicdU,Ugx6jO_YZblLOQr3zV14AaABAg,"{'videoId': 'dzYiEk8gHAo', 'topLevelComment': {'kind': 'youtube#comment', 'etag': 'g3bNmxOUW50wo1r-EYOWJvhtFzg', 'id': 'Ugx6jO_YZblLOQr3zV14AaABAg', 'snippet': {'videoId': 'dzYiEk8gHAo', 'textDisplay': 'Fuja do Lula para não ter que fugir do Brasil.....', 'textOriginal': 'Fuja do Lula para não ter que fugir do Brasil.....', 'authorDisplayName': 'Nelson Mauricio', 'authorProfileImageUrl': 'https://yt3.ggpht.com/ytc/AGIKgqOEf5QfPZBLIqJNynNxNMi6a7ak6nQV-BHgEDss=s48-c-k-c0x00ffffff-no-rj', 'authorChannelUrl': 'http://www.youtube.com/channel/UCMBVsGMfDHiT8BAIxd9Uecw', 'authorChannelId': {'value': 'UCMBVsGMfDHiT8BAIxd9Uecw'}, 'canRate': True, 'viewerRating': 'none', 'likeCount': 0, 'publishedAt': '2022-10-06T18:31:36Z', 'updatedAt': '2022-10-06T18:31:36Z'}}, 'canReply': True, 'totalReplyCount': 0, 'isPublic': True}",,UCMBVsGMfDHiT8BAIxd9Uecw,2022-10-06T18:31:36Z,Fuja do Lula para não ter que fugir do Brasil.....,,2023-06-08 11:26:38.206724
youtube#commentThread,r2Gr1SG00YxsC-acZMZEun1xhao,UgwdPVWhmK8EdC20iBd4AaABAg,"{'videoId': 'dzYiEk8gHAo', 'topLevelComment': {'kind': 'youtube#comment', 'etag': 'zLLwzxBVcUt2kmewhnfmc6QhK1Y', 'id': 'UgwdPVWhmK8EdC20iBd4AaABAg', 'snippet': {'videoId': 'dzYiEk8gHAo', 'textDisplay': 'A Simone Tebet optando por apoiar Lula apenas está ratificando que ela é do &quot;time&quot; de um escroque como Renan Calheiros..', 'textOriginal': 'A Simone Tebet optando por apoiar Lula apenas está ratificando que ela é do ""time"" de um escroque como Renan Calheiros..', 'authorDisplayName': 'tony rossas', 'authorProfileImageUrl': 'https://yt3.ggpht.com/ytc/AGIKgqPCAsu4j0QOA7iYjg1TOPbHpX-Z_kJPKFNXVQ=s48-c-k-c0x00ffffff-no-rj', 'authorChannelUrl': 'http://www.youtube.com/channel/UCSmyudwiX8jziWQeOjZOTdw', 'authorChannelId': {'value': 'UCSmyudwiX8jziWQeOjZOTdw'}, 'canRate': True, 'viewerRating': 'none', 'likeCount': 0, 'publishedAt': '2022-10-06T18:29:27Z', 'updatedAt': '2022-10-06T18:29:27Z'}}, 'canReply': True, 'totalReplyCount': 0, 'isPublic': True}",,UCSmyudwiX8jziWQeOjZOTdw,2022-10-06T18:29:27Z,"A Simone Tebet optando por apoiar Lula apenas está ratificando que ela é do ""time"" de um escroque como Renan Calheiros..",,2023-06-08 11:26:38.206724
youtube#commentThread,LWjX4R0XlK-6Q0lpkxKEzN79XH0,UgwZ55tlJf2jHF1Ji_R4AaABAg,"{'videoId': 'dzYiEk8gHAo', 'topLevelComment': {'kind': 'youtube#comment', 'etag': 'GXDDP_PhktN-vFZ_wSPczbPiNE8', 'id': 'UgwZ55tlJf2jHF1Ji_R4AaABAg', 'snippet': {'videoId': 'dzYiEk8gHAo', 'textDisplay': 'LULA 13 NO SEGUNDO TURNO 13 PRESIDENTE do BRASIL 🇧🇷🚩🚩', 'textOriginal': 'LULA 13 NO SEGUNDO TURNO 13 PRESIDENTE do BRASIL 🇧🇷🚩🚩', 'authorDisplayName': 'Paulo Sergio', 'authorProfileImageUrl': 'https://yt3.ggpht.com/ytc/AGIKgqM-VeSLqbzj3-Dy7pFjubaiG-KnGOWhqZ4PJbLH_fK_S-f-ScKb-Yiq_cW53hib=s48-c-k-c0x00ffffff-no-rj', 'authorChannelUrl': 'http://www.youtube.com/channel/UCObYOzDbCPSEoFp5g4VIzwA', 'authorChannelId': {'value': 'UCObYOzDbCPSEoFp5g4VIzwA'}, 'canRate': True, 'viewerRating': 'none', 'likeCount': 1, 'publishedAt': '2022-10-06T18:26:20Z', 'updatedAt': '2022-10-06T18:26:20Z'}}, 'canReply': True, 'totalReplyCount': 0, 'isPublic': True}",,UCObYOzDbCPSEoFp5g4VIzwA,2022-10-06T18:26:20Z,LULA 13 NO SEGUNDO TURNO 13 PRESIDENTE do BRASIL 🇧🇷🚩🚩,,2023-06-08 11:26:38.206724
youtube#commentThread,qORY91hNNp0IjEsI6mEno8eISxs,UgxSKs32-zHCAV_JzAx4AaABAg,"{'videoId': 'dzYiEk8gHAo', 'topLevelComment': {'kind': 'youtube#comment', 'etag': 'jjMOyW9BZILJlH0ekePGAUg7VTY', 'id': 'UgxSKs32-zHCAV_JzAx4AaABAg', 'snippet': {'videoId': 'dzYiEk8gHAo', 'textDisplay': 'BOLSONARO  E PADRE FARINHA <br>DO MESMO SACO.', 'textOriginal': 'BOLSONARO  E PADRE FARINHA \\nDO MESMO SACO.', 'authorDisplayName': 'Nair elena Carnelutti', 'authorProfileImageUrl': 'https://yt3.ggpht.com/ytc/AGIKgqPwhI-adgHEBNTteJ9Tm7YZ1_fWDbkUskbKn1OC6VB7ke_g3QYnR4jte4JfziFF=s48-c-k-c0x00ffffff-no-rj', 'authorChannelUrl': 'http://www.youtube.com/channel/UCBtzwVbeWYgBkVEsn6Tmn2w', 'authorChannelId': {'value': 'UCBtzwVbeWYgBkVEsn6Tmn2w'}, 'canRate': True, 'viewerRating': 'none', 'likeCount': 0, 'publishedAt': '2022-10-06T18:22:41Z', 'updatedAt': '2022-10-06T18:22:41Z'}}, 'canReply': True, 'totalReplyCount': 0, 'isPublic': True}",,UCBtzwVbeWYgBkVEsn6Tmn2w,2022-10-06T18:22:41Z,"BOLSONARO  E PADRE FARINHA 
DO MESMO SACO.",,2023-06-08 11:26:38.206724
youtube#commentThread,HJgBcxfubX8fMxH_8B5IDfiUkyI,UgxV_e2-Czyp7hQTlF54AaABAg,"{'videoId': 'dzYiEk8gHAo', 'topLevelComment': {'kind': 'youtube#comment', 'etag': 'ZCSisaxIiTQ79KrJ1Qr_e84MCp0', 'id': 'UgxV_e2-Czyp7hQTlF54AaABAg', 'snippet': {'videoId': 'dzYiEk8gHAo', 'textDisplay': 'Lula que Deus abençoe sempre vc', 'textOriginal': 'Lula que Deus abençoe sempre vc', 'authorDisplayName': 'José De Albuquerque', 'authorProfileImageUrl': 'https://yt3.ggpht.com/DOAuvu5U2i65J10iPU3Lq8e9cOVyrQjqrXjz0fdkPx9Jnuj3adaUlNjoEllFokLB4iY8twK9uo8=s48-c-k-c0x00ffffff-no-rj', 'authorChannelUrl': 'http://www.youtube.com/channel/UC_QvPcuygfN1FPFpbqz6nGg', 'authorChannelId': {'value': 'UC_QvPcuygfN1FPFpbqz6nGg'}, 'canRate': True, 'viewerRating': 'none', 'likeCount': 1, 'publishedAt': '2022-10-06T18:21:32Z', 'updatedAt': '2022-10-06T18:21:32Z'}}, 'canReply': True, 'totalReplyCount': 0, 'isPublic': True}",,UC_QvPcuygfN1FPFpbqz6nGg,2022-10-06T18:21:32Z,Lula que Deus abençoe sempre vc,,2023-06-08 11:26:38.206724
youtube#commentThread,yMx9Xrf85enqXvYKMwtvAsWHkPw,UgwhoK5MMasxdhsgVap4AaABAg,"{'videoId': 'dzYiEk8gHAo', 'topLevelComment': {'kind': 'youtube#comment', 'etag': 'SQ5DQCa9wG3p5MPz5uXztqBtuJc', 'id': 'UgwhoK5MMasxdhsgVap4AaABAg', 'snippet': {'videoId': 'dzYiEk8gHAo', 'textDisplay': 'VOU DE CIRO GOMES PND 😂😂😂😂😂😂😂😂.', 'textOriginal': 'VOU DE CIRO GOMES PND 😂😂😂😂😂😂😂😂.', 'authorDisplayName': 'Saulo De Faria', 'authorProfileImageUrl': 'https://yt3.ggpht.com/ytc/AGIKgqNYL5NpD_xBfqaIydX0fF7hJ3cCaugS7dbnYw=s48-c-k-c0x00ffffff-no-rj', 'authorChannelUrl': 'http://www.youtube.com/channel/UC2-EIxdD5l-LPQDs9UDPKVg', 'authorChannelId': {'value': 'UC2-EIxdD5l-LPQDs9UDPKVg'}, 'canRate': True, 'viewerRating': 'none', 'likeCount': 1, 'publishedAt': '2022-10-06T18:20:53Z', 'updatedAt': '2022-10-06T18:20:53Z'}}, 'canReply': True, 'totalReplyCount': 0, 'isPublic': True}",,UC2-EIxdD5l-LPQDs9UDPKVg,2022-10-06T18:20:53Z,VOU DE CIRO GOMES PND 😂😂😂😂😂😂😂😂.,,2023-06-08 11:26:38.206724
