kind,etag,id,snippet,replies,authorChannelId,publishedAt,textOriginal,nextPageToken,extraction_date
youtube#commentThread,hFunAdNz7eaKoMvHTyBVru3xcOY,UgzkGPTLL1J_sdSaIlV4AaABAg,"{'videoId': 'dzYiEk8gHAo', 'topLevelComment': {'kind': 'youtube#comment', 'etag': '4MwVGeqJQttqIyXGq7Ig_FCiLPw', 'id': 'UgzkGPTLL1J_sdSaIlV4AaABAg', 'snippet': {'videoId': 'dzYiEk8gHAo', 'textDisplay': 'Simone vendeu sua dignidade, para um ladrão. Tem gente que agredidou em você, mas o dinheiro falou mais alto que a honestidade.', 'textOriginal': 'Simone vendeu sua dignidade, para um ladrão. Tem gente que agredidou em você, mas o dinheiro falou mais alto que a honestidade.', 'authorDisplayName': 'Martin Ritter', 'authorProfileImageUrl': 'https://yt3.ggpht.com/ytc/AGIKgqNLTfYucS0xek446eIojidqlcIIFNNlQgC1RgytMCdcdMrn3-IBn0BvRRUaQZ19=s48-c-k-c0x00ffffff-no-rj', 'authorChannelUrl': 'http://www.youtube.com/channel/UCxkDzYKEfk77BCoScuQOryA', 'authorChannelId': {'value': 'UCxkDzYKEfk77BCoScuQOryA'}, 'canRate': True, 'viewerRating': 'none', 'likeCount': 2, 'publishedAt': '2022-10-06T18:19:51Z', 'updatedAt': '2022-10-06T18:19:51Z'}}, 'canReply': True, 'totalReplyCount': 1, 'isPublic': True}","{'comments': [{'kind': 'youtube#comment', 'etag': 'PbQ9OSjO_bq69H5xQeUZno4nOUY', 'id': 'UgzkGPTLL1J_sdSaIlV4AaABAg.9gqxv1Jpv6c9gr3GdHrnc6', 'snippet': {'videoId': 'dzYiEk8gHAo', 'textDisplay': 'Ela foi coerente com o que vinha fazendo, tanto que ficou em 3.', 'textOriginal': 'Ela foi coerente com o que vinha fazendo, tanto que ficou em 3.', 'parentId': 'UgzkGPTLL1J_sdSaIlV4AaABAg', 'authorDisplayName': 'Júlio', 'authorProfileImageUrl': 'https://yt3.ggpht.com/u8nvmublr0T0gQ6g0u0tvgfg1isHgPvt8yPid8pXeMvKv_WsQtMXvtZpgobzCDI-UHaluDJlAw=s48-c-k-c0x00ffffff-no-rj', 'authorChannelUrl': 'http://www.youtube.com/channel/UCBl-V9DwmMqb_1D0JvA0Qbg', 'authorChannelId': {'value': 'UCBl-V9DwmMqb_1D0JvA0Qbg'}, 'canRate': True, 'viewerRating': 'none', 'likeCount': 0, 'publishedAt': '2022-10-06T19:15:22Z', 'updatedAt': '2022-10-06T19:15:22Z'}}]}",UCxkDzYKEfk77BCoScuQOryA,2022-10-06T18:19:51Z,"Simone vendeu sua dignidade, para um ladrão. Tem gente que agredidou em você, mas o dinheiro falou mais alto que a honestidade.",,2023-06-08 11:26:38.206724
youtube#commentThread,Ct5BfRIJlx-OsVMAIut8A98Nrys,Ugw7l4a0Yt6IPlZSsQl4AaABAg,"{'videoId': 'dzYiEk8gHAo', 'topLevelComment': {'kind': 'youtube#comment', 'etag': 'XkxHtus3VNO3QpCJsfv343NqyKk', 'id': 'Ugw7l4a0Yt6IPlZSsQl4AaABAg', 'snippet': {'videoId': 'dzYiEk8gHAo', 'textDisplay': 'Bolsonaro neles Bolsonaro neles Bolsonaro neles Bolsonaro neles Bolsonaro neles Bolsonaro neles', 'textOriginal': 'Bolsonaro neles Bolsonaro neles Bolsonaro neles Bolsonaro neles Bolsonaro neles Bolsonaro neles', 'authorDisplayName': 'Jamilly Silva', 'authorProfileImageUrl': 'https://yt3.ggpht.com/ytc/AGIKgqO0tGcS2PIjgVdwhffC_HcXnmigV_Pty4lz8OEb04ycKs1wriWZc4GXwRt41kfm=s48-c-k-c0x00ffffff-no-rj', 'authorChannelUrl': 'http://www.youtube.com/channel/UCheVRQWwkpmggQ-Q1IKeqMQ', 'authorChannelId': {'value': 'UCheVRQWwkpmggQ-Q1IKeqMQ'}, 'canRate': True, 'viewerRating': 'none', 'likeCount': 4, 'publishedAt': '2022-10-06T18:15:57Z', 'updatedAt': '2022-10-06T18:15:57Z'}}, 'canReply': True, 'totalReplyCount': 0, 'isPublic': True}",,UCheVRQWwkpmggQ-Q1IKeqMQ,2022-10-06T18:15:57Z,Bolsonaro neles Bolsonaro neles Bolsonaro neles Bolsonaro neles Bolsonaro neles Bolsonaro neles,,2023-06-08 11:26:38.206724
youtube#commentThread,hRUbr9dte-ZTqFkSXI2-3qmMnBE,Ugz0YCuOpQPeyrfW-d54AaABAg,"{'videoId': 'dzYiEk8gHAo', 'topLevelComment': {'kind': 'youtube#comment', 'etag': 'dcDK0XOnWgI9X-Pbf7SmhccRE-o', 'id': 'Ugz0YCuOpQPeyrfW-d54AaABAg', 'snippet': {'videoId': 'dzYiEk8gHAo', 'textDisplay': 'Simone tebet traiu seus eleitores e Ciro também', 'textOriginal': 'Simone tebet traiu seus eleitores e Ciro também', 'authorDisplayName': 'Jamilly Silva', 'authorProfileImageUrl': 'https://yt3.ggpht.com/ytc/AGIKgqO0tGcS2PIjgVdwhffC_HcXnmigV_Pty4lz8OEb04ycKs1wriWZc4GXwRt41kfm=s48-c-k-c0x00ffffff-no-rj', 'authorChannelUrl': 'http://www.youtube.com/channel/UCheVRQWwkpmggQ-Q1IKeqMQ', 'authorChannelId': {'value': 'UCheVRQWwkpmggQ-Q1IKeqMQ'}, 'canRate': True, 'viewerRating': 'none', 'likeCount': 0, 'publishedAt': '2022-10-06T18:14:38Z', 'updatedAt': '2022-10-06T18:14:38Z'}}, 'canReply': True, 'totalReplyCount': 0, 'isPublic': True}",,UCheVRQWwkpmggQ-Q1IKeqMQ,2022-10-06T18:14:38Z,Simone tebet traiu seus eleitores e Ciro também,,2023-06-08 11:26:38.206724
youtube#commentThread,YSsszJjSjWqVCN7sLNXlJiqrLCo,UgxEqIEGpU7z5xcEEw54AaABAg,"{'videoId': 'dzYiEk8gHAo', 'topLevelComment': {'kind': 'youtube#comment', 'etag': 'qBLytPW9LtH0FNE2R_5cWQ2aoAw', 'id': 'UgxEqIEGpU7z5xcEEw54AaABAg', 'snippet': {'videoId': 'dzYiEk8gHAo', 'textDisplay': 'LLLLLLLLLLL13', 'textOriginal': 'LLLLLLLLLLL13', 'authorDisplayName': 'Fernandinho Viana', 'authorProfileImageUrl': 'https://yt3.ggpht.com/ytc/AGIKgqM0XvKz1X37hGuLO0zNLuaFb7Rv3p_0OZEd8w=s48-c-k-c0x00ffffff-no-rj', 'authorChannelUrl': 'http://www.youtube.com/channel/UC16mxuQ8fUKAumx2HCKr8lQ', 'authorChannelId': {'value': 'UC16mxuQ8fUKAumx2HCKr8lQ'}, 'canRate': True, 'viewerRating': 'none', 'likeCount': 1, 'publishedAt': '2022-10-06T18:13:28Z', 'updatedAt': '2022-10-06T18:13:28Z'}}, 'canReply': True, 'totalReplyCount': 0, 'isPublic': True}",,UC16mxuQ8fUKAumx2HCKr8lQ,2022-10-06T18:13:28Z,LLLLLLLLLLL13,,2023-06-08 11:26:38.206724
youtube#commentThread,_UJP2bVx9maBHeQO7wl5PUjmZl4,UgwHwWU_aQ1IhnSHGnx4AaABAg,"{'videoId': 'dzYiEk8gHAo', 'topLevelComment': {'kind': 'youtube#comment', 'etag': 'XgzA0r37pD1-bOGT-6h54f5rIJk', 'id': 'UgwHwWU_aQ1IhnSHGnx4AaABAg', 'snippet': {'videoId': 'dzYiEk8gHAo', 'textDisplay': 'SIMONE TEBET TRAIU SEUS ELEITORES E CIRO TAMBÉM SIMONE TEBET TRAIU SEUS ELEITORES E CIRO TAMBÉM', 'textOriginal': 'SIMONE TEBET TRAIU SEUS ELEITORES E CIRO TAMBÉM SIMONE TEBET TRAIU SEUS ELEITORES E CIRO TAMBÉM', 'authorDisplayName': 'Jamilly Silva', 'authorProfileImageUrl': 'https://yt3.ggpht.com/ytc/AGIKgqO0tGcS2PIjgVdwhffC_HcXnmigV_Pty4lz8OEb04ycKs1wriWZc4GXwRt41kfm=s48-c-k-c0x00ffffff-no-rj', 'authorChannelUrl': 'http://www.youtube.com/channel/UCheVRQWwkpmggQ-Q1IKeqMQ', 'authorChannelId': {'value': 'UCheVRQWwkpmggQ-Q1IKeqMQ'}, 'canRate': True, 'viewerRating': 'none', 'likeCount': 0, 'publishedAt': '2022-10-06T18:12:40Z', 'updatedAt': '2022-10-06T18:12:40Z'}}, 'canReply': True, 'totalReplyCount': 0, 'isPublic': True}",,UCheVRQWwkpmggQ-Q1IKeqMQ,2022-10-06T18:12:40Z,SIMONE TEBET TRAIU SEUS ELEITORES E CIRO TAMBÉM SIMONE TEBET TRAIU SEUS ELEITORES E CIRO TAMBÉM,,2023-06-08 11:26:38.206724
youtube#commentThread,MmLZjtngvJMete02yQeYzc0p0tk,Ugwws-3EmG_dp0jpT6F4AaABAg,"{'videoId': 'dzYiEk8gHAo', 'topLevelComment': {'kind': 'youtube#comment', 'etag': 'BiEYiZw8Utli2ojBnynunqquWR8', 'id': 'Ugwws-3EmG_dp0jpT6F4AaABAg', 'snippet': {'videoId': 'dzYiEk8gHAo', 'textDisplay': 'Curitiba 🇧🇷♥️ Lula 13.', 'textOriginal': 'Curitiba 🇧🇷♥️ Lula 13.', 'authorDisplayName': 'PÉRSIA HIPPIE', 'authorProfileImageUrl': 'https://yt3.ggpht.com/rzySveMCvhwJXqIVJzAp8THRQVcDTpKvXExfgUXBu9vAEyRfleTkE_-FE6ITdOExJqHG8l3j8C8=s48-c-k-c0x00ffffff-no-rj', 'authorChannelUrl': 'http://www.youtube.com/channel/UCHYNYR_-I-n5ss0Os7gDhWg', 'authorChannelId': {'value': 'UCHYNYR_-I-n5ss0Os7gDhWg'}, 'canRate': True, 'viewerRating': 'none', 'likeCount': 5, 'publishedAt': '2022-10-06T18:12:23Z', 'updatedAt': '2022-10-06T18:12:23Z'}}, 'canReply': True, 'totalReplyCount': 0, 'isPublic': True}",,UCHYNYR_-I-n5ss0Os7gDhWg,2022-10-06T18:12:23Z,Curitiba 🇧🇷♥️ Lula 13.,,2023-06-08 11:26:38.206724
youtube#commentThread,aSgzNvgdwxLCJLuiEq3Srvewyho,UgxR-XFFQyp7TXXR7WR4AaABAg,"{'videoId': 'dzYiEk8gHAo', 'topLevelComment': {'kind': 'youtube#comment', 'etag': 'WOASs3cBEEpDFX9oMzot7_-JrzA', 'id': 'UgxR-XFFQyp7TXXR7WR4AaABAg', 'snippet': {'videoId': 'dzYiEk8gHAo', 'textDisplay': 'Lula, Alkimin, Haddad, e os demás corrupitos…<br>A quadrilha novamente está formada para destruir o Brasil <br>Desperta povo brasileiro, principalmente o povo de Nordeste que quer eleger esse bandido no poder <br>A globo está apoiando esse bandido porque tem uma dívida milionária com o governo e não quer pagar <br>Por isso está apoiando a esquerda.<br>A esquerda e o câncer do Brasil. <br>Globo lixo - lula lixo.', 'textOriginal': 'Lula, Alkimin, Haddad, e os demás corrupitos…\\nA quadrilha novamente está formada para destruir o Brasil \\nDesperta povo brasileiro, principalmente o povo de Nordeste que quer eleger esse bandido no poder \\nA globo está apoiando esse bandido porque tem uma dívida milionária com o governo e não quer pagar \\nPor isso está apoiando a esquerda.\\nA esquerda e o câncer do Brasil. \\nGlobo lixo - lula lixo.', 'authorDisplayName': 'Marcos', 'authorProfileImageUrl': 'https://yt3.ggpht.com/JpfG3Hbqp-ytzSVm-r3l0NVZpt_kkodeRzYnHB7a6buClkB2XKX1OHyVkTTLFYkefqQMeHwUark=s48-c-k-c0x00ffffff-no-rj', 'authorChannelUrl': 'http://www.youtube.com/channel/UCChZx7Nq9rDKWj-DS8Tl8-g', 'authorChannelId': {'value': 'UCChZx7Nq9rDKWj-DS8Tl8-g'}, 'canRate': True, 'viewerRating': 'none', 'likeCount': 0, 'publishedAt': '2022-10-06T18:05:34Z', 'updatedAt': '2022-10-06T18:05:34Z'}}, 'canReply': True, 'totalReplyCount': 0, 'isPublic': True}",,UCChZx7Nq9rDKWj-DS8Tl8-g,2022-10-06T18:05:34Z,"Lula, Alkimin, Haddad, e os demás corrupitos…
A quadrilha novamente está formada para destruir o Brasil 
Desperta povo brasileiro, principalmente o povo de Nordeste que quer eleger esse bandido no poder 
A globo está apoiando esse bandido porque tem uma dívida milionária com o governo e não quer pagar 
Por isso está apoiando a esquerda.
A esquerda e o câncer do Brasil. 
Globo lixo - lula lixo.",,2023-06-08 11:26:38.206724
youtube#commentThread,_u82Hwhaxg703ur31MvFYxyYWaQ,UgxrdnewGtvuh8i7A5t4AaABAg,"{'videoId': 'dzYiEk8gHAo', 'topLevelComment': {'kind': 'youtube#comment', 'etag': 'r5FLoeIbkn7wkYtd86bMrq-0-_M', 'id': 'UgxrdnewGtvuh8i7A5t4AaABAg', 'snippet': {'videoId': 'dzYiEk8gHAo', 'textDisplay': 'Votei Ciro 12....agora vou votar ....', 'textOriginal': 'Votei Ciro 12....agora vou votar ....', 'authorDisplayName': 'Eduardo Getirana', 'authorProfileImageUrl': 'https://yt3.ggpht.com/ytc/AGIKgqMorRiwK7OozliJCuy0Uv_KGNoYGkA4ftJ5scQuc7N10FGCEbKbBj81JYYQrYUk=s48-c-k-c0x00ffffff-no-rj', 'authorChannelUrl': 'http://www.youtube.com/channel/UCXqYLaqTSMH5pjhEmnGYPXA', 'authorChannelId': {'value': 'UCXqYLaqTSMH5pjhEmnGYPXA'}, 'canRate': True, 'viewerRating': 'none', 'likeCount': 0, 'publishedAt': '2022-10-06T18:02:01Z', 'updatedAt': '2022-10-06T18:02:01Z'}}, 'canReply': True, 'totalReplyCount': 1, 'isPublic': True}","{'comments': [{'kind': 'youtube#comment', 'etag': 'RHGjqjLMeBEL5a_7CWkuXnXCJFM', 'id': 'UgxrdnewGtvuh8i7A5t4AaABAg.9gqvsKTCdaH9grV1sZzQ9Y', 'snippet': {'videoId': 'dzYiEk8gHAo', 'textDisplay': 'Lula', 'textOriginal': 'Lula', 'parentId': 'UgxrdnewGtvuh8i7A5t4AaABAg', 'authorDisplayName': 'Alexandre Costa', 'authorProfileImageUrl': 'https://yt3.ggpht.com/ytc/AGIKgqMVc42FIygSyUKUaDrU8wNQU6LcX1rUJBDpAsAD=s48-c-k-c0x00ffffff-no-rj', 'authorChannelUrl': 'http://www.youtube.com/channel/UCGLVa5H9Md9X9xU43pgzL8A', 'authorChannelId': {'value': 'UCGLVa5H9Md9X9xU43pgzL8A'}, 'canRate': True, 'viewerRating': 'none', 'likeCount': 0, 'publishedAt': '2022-10-06T23:18:01Z', 'updatedAt': '2022-10-06T23:18:01Z'}}]}",UCXqYLaqTSMH5pjhEmnGYPXA,2022-10-06T18:02:01Z,Votei Ciro 12....agora vou votar ....,,2023-06-08 11:26:38.206724
youtube#commentThread,HDcf2sh0skgabz2O9K-B_n4vuOo,Ugyk9DRasiPHPdA7MFZ4AaABAg,"{'videoId': 'dzYiEk8gHAo', 'topLevelComment': {'kind': 'youtube#comment', 'etag': 'iFLRh24OpwRYw419NOtQEw-WGbA', 'id': 'Ugyk9DRasiPHPdA7MFZ4AaABAg', 'snippet': {'videoId': 'dzYiEk8gHAo', 'textDisplay': 'Padre kelmon e Bolsonaro , dois comédia kkkkk', 'textOriginal': 'Padre kelmon e Bolsonaro , dois comédia kkkkk', 'authorDisplayName': 'Gabriel', 'authorProfileImageUrl': 'https://yt3.ggpht.com/ytc/AGIKgqMs4_Wjxkdpxqx1NOZEW79IyFb_LGw_5oF9ld3uQzI=s48-c-k-c0x00ffffff-no-rj', 'authorChannelUrl': 'http://www.youtube.com/channel/UCiJkrQGd7iC63GQorrKpLFA', 'authorChannelId': {'value': 'UCiJkrQGd7iC63GQorrKpLFA'}, 'canRate': True, 'viewerRating': 'none', 'likeCount': 4, 'publishedAt': '2022-10-06T18:01:11Z', 'updatedAt': '2022-10-06T18:01:11Z'}}, 'canReply': True, 'totalReplyCount': 1, 'isPublic': True}","{'comments': [{'kind': 'youtube#comment', 'etag': 'l3G35tJUJwF4UTsZlD0XA4sR8v0', 'id': 'Ugyk9DRasiPHPdA7MFZ4AaABAg.9gqvmEh0qs69gqxRs7kPZ5', 'snippet': {'videoId': 'dzYiEk8gHAo', 'textDisplay': '2🤡', 'textOriginal': '2🤡', 'parentId': 'Ugyk9DRasiPHPdA7MFZ4AaABAg', 'authorDisplayName': 'Luci Cruz', 'authorProfileImageUrl': 'https://yt3.ggpht.com/ytc/AGIKgqPoXN0SANir2dGK375S1zi8SPkU5ekqcIwC-15y7g=s48-c-k-c0x00ffffff-no-rj', 'authorChannelUrl': 'http://www.youtube.com/channel/UCnckmUt5S4QA_7HMFgMFPig', 'authorChannelId': {'value': 'UCnckmUt5S4QA_7HMFgMFPig'}, 'canRate': True, 'viewerRating': 'none', 'likeCount': 1, 'publishedAt': '2022-10-06T18:15:44Z', 'updatedAt': '2022-10-06T18:15:44Z'}}]}",UCiJkrQGd7iC63GQorrKpLFA,2022-10-06T18:01:11Z,"Padre kelmon e Bolsonaro , dois comédia kkkkk",,2023-06-08 11:26:38.206724
youtube#commentThread,ucvDLhGliqIcLYd-MSUnThjQgWg,UgyXbazXBKEYClqU-oF4AaABAg,"{'videoId': 'dzYiEk8gHAo', 'topLevelComment': {'kind': 'youtube#comment', 'etag': 'DSh4iaz2_VGzaE_bFVtTzol3PMA', 'id': 'UgyXbazXBKEYClqU-oF4AaABAg', 'snippet': {'videoId': 'dzYiEk8gHAo', 'textDisplay': 'Quem joga War sabe muito bem que quem conquista a Ásia conquista o mundo, e não a Europa', 'textOriginal': 'Quem joga War sabe muito bem que quem conquista a Ásia conquista o mundo, e não a Europa', 'authorDisplayName': 'Guilhermano Costa', 'authorProfileImageUrl': 'https://yt3.ggpht.com/ytc/AGIKgqPaC97rYNugRWoZRrBIvgB5xIw_AJAwrgmgbtxKQQ=s48-c-k-c0x00ffffff-no-rj', 'authorChannelUrl': 'http://www.youtube.com/channel/UC8n1dZ0kkzNM7Ll_EWyEFkg', 'authorChannelId': {'value': 'UC8n1dZ0kkzNM7Ll_EWyEFkg'}, 'canRate': True, 'viewerRating': 'none', 'likeCount': 0, 'publishedAt': '2022-10-06T17:59:58Z', 'updatedAt': '2022-10-06T17:59:58Z'}}, 'canReply': True, 'totalReplyCount': 0, 'isPublic': True}",,UC8n1dZ0kkzNM7Ll_EWyEFkg,2022-10-06T17:59:58Z,"Quem joga War sabe muito bem que quem conquista a Ásia conquista o mundo, e não a Europa",,2023-06-08 11:26:38.206724
youtube#commentThread,mxG2lbYD7EmY3nuc6sIDaose818,Ugwqe3jv1S7yiHYIKn94AaABAg,"{'videoId': 'dzYiEk8gHAo', 'topLevelComment': {'kind': 'youtube#comment', 'etag': '62bu8QG6JunTZXFLpeOO1WBmMHo', 'id': 'Ugwqe3jv1S7yiHYIKn94AaABAg', 'snippet': {'videoId': 'dzYiEk8gHAo', 'textDisplay': 'Conheco muitas pessoas que votaram na Simone e vao de Lula e esses apoio a maioria sao mulheres que nao gostam como o Bozo trata as mulheres 😎', 'textOriginal': 'Conheco muitas pessoas que votaram na Simone e vao de Lula e esses apoio a maioria sao mulheres que nao gostam como o Bozo trata as mulheres 😎', 'authorDisplayName': 'Renata soares', 'authorProfileImageUrl': 'https://yt3.ggpht.com/ytc/AGIKgqO6LbpI765WWrzt5j1-mF9xnLXy1wOKTSERndAsVAHHJyLlU3aUg1fnL-AqjeOq=s48-c-k-c0x00ffffff-no-rj', 'authorChannelUrl': 'http://www.youtube.com/channel/UCkSOjiYhB_UZVaOQLSVkqNw', 'authorChannelId': {'value': 'UCkSOjiYhB_UZVaOQLSVkqNw'}, 'canRate': True, 'viewerRating': 'none', 'likeCount': 6, 'publishedAt': '2022-10-06T17:59:16Z', 'updatedAt': '2022-10-06T17:59:16Z'}}, 'canReply': True, 'totalReplyCount': 2, 'isPublic': True}","{'comments': [{'kind': 'youtube#comment', 'etag': '6ty1njjj-Ttq7h_Mc6CyLyM7Ghw', 'id': 'Ugwqe3jv1S7yiHYIKn94AaABAg.9gqvZFDbDbq9gr3BH5dSlp', 'snippet': {'videoId': 'dzYiEk8gHAo', 'textDisplay': 'O PT quer a legalização das Drogas, o ministro Barroso colocado pele PT defende e faz politica por isso. O PT apoia o Evo Morales presidente da Bolívia que é o maior produtor de coca da América Latina. P com C com C apoia o PT. Bom que não quero apoiar isso, queria o Ciro, mas Lula insiste em continuar fazendo o que fez e foi condenado por. Vou de Bolsonaro no segundo. PT nunca.', 'textOriginal': 'O PT quer a legalização das Drogas, o ministro Barroso colocado pele PT defende e faz politica por isso. O PT apoia o Evo Morales presidente da Bolívia que é o maior produtor de coca da América Latina. P com C com C apoia o PT. Bom que não quero apoiar isso, queria o Ciro, mas Lula insiste em continuar fazendo o que fez e foi condenado por. Vou de Bolsonaro no segundo. PT nunca.', 'parentId': 'Ugwqe3jv1S7yiHYIKn94AaABAg', 'authorDisplayName': 'Jose Maria', 'authorProfileImageUrl': 'https://yt3.ggpht.com/g8ig55IWzQbOE_iRsfm8Wn5CnROWxEk7RSWn79lKcXIwVF0WOW4yPmEMRH6ciKgeN9h2RWUn=s48-c-k-c0x00ffffff-no-rj', 'authorChannelUrl': 'http://www.youtube.com/channel/UCtP8gPYTk1O_1QF8HIH9HPg', 'authorChannelId': {'value': 'UCtP8gPYTk1O_1QF8HIH9HPg'}, 'canRate': True, 'viewerRating': 'none', 'likeCount': 0, 'publishedAt': '2022-10-06T19:14:38Z', 'updatedAt': '2022-10-06T19:14:38Z'}}, {'kind': 'youtube#comment', 'etag': 'lv6uV_D8gdmTMoU15urQ5ichzzg', 'id': 'Ugwqe3jv1S7yiHYIKn94AaABAg.9gqvZFDbDbq9gr3Ae4eMwI', 'snippet': {'videoId': 'dzYiEk8gHAo', 'textDisplay': 'Dai o filho entra no mundo das drogas e não sabe o pq.', 'textOriginal': 'Dai o filho entra no mundo das drogas e não sabe o pq.', 'parentId': 'Ugwqe3jv1S7yiHYIKn94AaABAg', 'authorDisplayName': 'Jose Maria', 'authorProfileImageUrl': 'https://yt3.ggpht.com/g8ig55IWzQbOE_iRsfm8Wn5CnROWxEk7RSWn79lKcXIwVF0WOW4yPmEMRH6ciKgeN9h2RWUn=s48-c-k-c0x00ffffff-no-rj', 'authorChannelUrl': 'http://www.youtube.com/channel/UCtP8gPYTk1O_1QF8HIH9HPg', 'authorChannelId': {'value': 'UCtP8gPYTk1O_1QF8HIH9HPg'}, 'canRate': True, 'viewerRating': 'none', 'likeCount': 0, 'publishedAt': '2022-10-06T19:14:33Z', 'updatedAt': '2022-10-06T19:14:33Z'}}]}",UCkSOjiYhB_UZVaOQLSVkqNw,2022-10-06T17:59:16Z,Conheco muitas pessoas que votaram na Simone e vao de Lula e esses apoio a maioria sao mulheres que nao gostam como o Bozo trata as mulheres 😎,,2023-06-08 11:26:38.206724
youtube#commentThread,0qeSJ_WA7--q-d6u9nz4z3l_ZTs,UgztTg_BMBv5nP4MDXV4AaABAg,"{'videoId': 'dzYiEk8gHAo', 'topLevelComment': {'kind': 'youtube#comment', 'etag': 'w9ElQBoyaHb5s1IQdx0CAugShzc', 'id': 'UgztTg_BMBv5nP4MDXV4AaABAg', 'snippet': {'videoId': 'dzYiEk8gHAo', 'textDisplay': 'Renato Bergerone SALINAS PARA', 'textOriginal': 'Renato Bergerone SALINAS PARA', 'authorDisplayName': 'Renato favacho', 'authorProfileImageUrl': 'https://yt3.ggpht.com/ytc/AGIKgqNtKBYpRrAdkqDP73I2I1Q5_qg-boz8uzHZnNjrrg=s48-c-k-c0x00ffffff-no-rj', 'authorChannelUrl': 'http://www.youtube.com/channel/UC04NY4cDq2F1bzUT300iMnA', 'authorChannelId': {'value': 'UC04NY4cDq2F1bzUT300iMnA'}, 'canRate': True, 'viewerRating': 'none', 'likeCount': 1, 'publishedAt': '2022-10-06T17:59:01Z', 'updatedAt': '2022-10-06T17:59:01Z'}}, 'canReply': True, 'totalReplyCount': 0, 'isPublic': True}",,UC04NY4cDq2F1bzUT300iMnA,2022-10-06T17:59:01Z,Renato Bergerone SALINAS PARA,,2023-06-08 11:26:38.206724
youtube#commentThread,EZnWvQq-Y7JeYv3EtRhtUH7T00g,UgzY6mM1BtE1Fp_Imil4AaABAg,"{'videoId': 'dzYiEk8gHAo', 'topLevelComment': {'kind': 'youtube#comment', 'etag': 'fKgVszTeaKvHZxeIgv_2XY2_bWM', 'id': 'UgzY6mM1BtE1Fp_Imil4AaABAg', 'snippet': {'videoId': 'dzYiEk8gHAo', 'textDisplay': 'Lula maior ladrão da história do Brasil', 'textOriginal': 'Lula maior ladrão da história do Brasil', 'authorDisplayName': 'Elson Alves', 'authorProfileImageUrl': 'https://yt3.ggpht.com/VF61k30X8cNLV_1uop9uKPSWqP6v207mhCVqFlSMvaNBBIVIq6EaGSkoZ75yYJyZesETl3RgPu4=s48-c-k-c0x00ffffff-no-rj', 'authorChannelUrl': 'http://www.youtube.com/channel/UCHq48TmK7MnZXkMWhhFYXtw', 'authorChannelId': {'value': 'UCHq48TmK7MnZXkMWhhFYXtw'}, 'canRate': True, 'viewerRating': 'none', 'likeCount': 1, 'publishedAt': '2022-10-06T17:55:55Z', 'updatedAt': '2022-10-06T17:55:55Z'}}, 'canReply': True, 'totalReplyCount': 0, 'isPublic': True}",,UCHq48TmK7MnZXkMWhhFYXtw,2022-10-06T17:55:55Z,Lula maior ladrão da história do Brasil,,2023-06-08 11:26:38.206724
youtube#commentThread,5bzN6Pp7cbKs4N98b2fqN5Tfu1w,UgzFU-uwj3Z_xAfSX1R4AaABAg,"{'videoId': 'dzYiEk8gHAo', 'topLevelComment': {'kind': 'youtube#comment', 'etag': 'My2eVB6zCWr2itf38fJv-IwTC94', 'id': 'UgzFU-uwj3Z_xAfSX1R4AaABAg', 'snippet': {'videoId': 'dzYiEk8gHAo', 'textDisplay': 'O NORDESTE vai dar o seu bozo dia 30<br><br>LULA13 PRESIDENTE', 'textOriginal': 'O NORDESTE vai dar o seu bozo dia 30\\n\\nLULA13 PRESIDENTE', 'authorDisplayName': 'Vitor Ssantana', 'authorProfileImageUrl': 'https://yt3.ggpht.com/ytc/AGIKgqOjtfGdX95j3OMwOpPRKxLjTTfXFbDn9cWQjfZfZA=s48-c-k-c0x00ffffff-no-rj', 'authorChannelUrl': 'http://www.youtube.com/channel/UC39FrcVtUftiKFZUhFaCS7A', 'authorChannelId': {'value': 'UC39FrcVtUftiKFZUhFaCS7A'}, 'canRate': True, 'viewerRating': 'none', 'likeCount': 1, 'publishedAt': '2022-10-06T17:55:48Z', 'updatedAt': '2022-10-06T17:55:48Z'}}, 'canReply': True, 'totalReplyCount': 0, 'isPublic': True}",,UC39FrcVtUftiKFZUhFaCS7A,2022-10-06T17:55:48Z,"O NORDESTE vai dar o seu bozo dia 30

LULA13 PRESIDENTE",,2023-06-08 11:26:38.206724
youtube#commentThread,UrFx8gVKayptbaQflfwxXSLuWLw,UgzGlSOuUTgyH9QCIVR4AaABAg,"{'videoId': 'dzYiEk8gHAo', 'topLevelComment': {'kind': 'youtube#comment', 'etag': '3a19enox00THtHlxce3-Wpof5Gg', 'id': 'UgzGlSOuUTgyH9QCIVR4AaABAg', 'snippet': {'videoId': 'dzYiEk8gHAo', 'textDisplay': 'Ele vim pra Minas 500 vezes meu voto e o mesmo 13', 'textOriginal': 'Ele vim pra Minas 500 vezes meu voto e o mesmo 13', 'authorDisplayName': 'LUCINEIA DA SILVA', 'authorProfileImageUrl': 'https://yt3.ggpht.com/ytc/AGIKgqNrkJS9FITGk3Nr3GCz3ylyusKtl1DSprdDAUs6=s48-c-k-c0x00ffffff-no-rj', 'authorChannelUrl': 'http://www.youtube.com/channel/UCFLOMGfXmlPd4M8yum_cgRw', 'authorChannelId': {'value': 'UCFLOMGfXmlPd4M8yum_cgRw'}, 'canRate': True, 'viewerRating': 'none', 'likeCount': 6, 'publishedAt': '2022-10-06T17:55:46Z', 'updatedAt': '2022-10-06T17:55:46Z'}}, 'canReply': True, 'totalReplyCount': 1, 'isPublic': True}","{'comments': [{'kind': 'youtube#comment', 'etag': '2GMsgnl1qU_ZyDaQP9H2HZ6ote4', 'id': 'UgzGlSOuUTgyH9QCIVR4AaABAg.9gqv9_5S5859gru41lVa-u', 'snippet': {'videoId': 'dzYiEk8gHAo', 'textDisplay': '22', 'textOriginal': '22', 'parentId': 'UgzGlSOuUTgyH9QCIVR4AaABAg', 'authorDisplayName': 'Joiciane VIEIRA DOS SANTOS', 'authorProfileImageUrl': 'https://yt3.ggpht.com/ytc/AGIKgqPJnzftas_CA1N60g19JJ3-7rXEKHmrAFxQQF4p_g=s48-c-k-c0x00ffffff-no-rj', 'authorChannelUrl': 'http://www.youtube.com/channel/UCC1zaNe7STydXiuhBP0WUXw', 'authorChannelId': {'value': 'UCC1zaNe7STydXiuhBP0WUXw'}, 'canRate': True, 'viewerRating': 'none', 'likeCount': 0, 'publishedAt': '2022-10-07T03:05:31Z', 'updatedAt': '2022-10-07T03:05:31Z'}}]}",UCFLOMGfXmlPd4M8yum_cgRw,2022-10-06T17:55:46Z,Ele vim pra Minas 500 vezes meu voto e o mesmo 13,,2023-06-08 11:26:38.206724
youtube#commentThread,yqO_4cN2AFOWYke_7HfXrY1lGhI,Ugw1oFYaOGvi_2wgIGp4AaABAg,"{'videoId': 'dzYiEk8gHAo', 'topLevelComment': {'kind': 'youtube#comment', 'etag': '_W7YZrb1UvKTC8uKmR5NNVxTUJk', 'id': 'Ugw1oFYaOGvi_2wgIGp4AaABAg', 'snippet': {'videoId': 'dzYiEk8gHAo', 'textDisplay': 'Lula 🇧🇷', 'textOriginal': 'Lula 🇧🇷', 'authorDisplayName': 'Angela Silva', 'authorProfileImageUrl': 'https://yt3.ggpht.com/ytc/AGIKgqPZON8QIT0PpMttkDS26ACLN0l-cuMStJoheYGGhg=s48-c-k-c0x00ffffff-no-rj', 'authorChannelUrl': 'http://www.youtube.com/channel/UCLkKSpsI0K1cgnv36LMMXxw', 'authorChannelId': {'value': 'UCLkKSpsI0K1cgnv36LMMXxw'}, 'canRate': True, 'viewerRating': 'none', 'likeCount': 4, 'publishedAt': '2022-10-06T17:55:33Z', 'updatedAt': '2022-10-06T17:55:33Z'}}, 'canReply': True, 'totalReplyCount': 0, 'isPublic': True}",,UCLkKSpsI0K1cgnv36LMMXxw,2022-10-06T17:55:33Z,Lula 🇧🇷,,2023-06-08 11:26:38.206724
