kind,etag,id,snippet,replies,authorChannelId,publishedAt,textOriginal,nextPageToken,extraction_date
youtube#commentThread,p5UPXpN0LXDy-rG0bnEFD2Ng4zk,UgyIrgv953Bo_B76sZN4AaABAg,"{'videoId': 'mngDDP48JKU', 'topLevelComment': {'kind': 'youtube#comment', 'etag': 'AQVOpxBaUDPSfwH22ZpR-jbVk2E', 'id': 'UgyIrgv953Bo_B76sZN4AaABAg', 'snippet': {'videoId': 'mngDDP48JKU', 'textDisplay': 'BORA 22 🇧🇷🇧🇷🇧🇷🇧🇷', 'textOriginal': 'BORA 22 🇧🇷🇧🇷🇧🇷🇧🇷', 'authorDisplayName': 'Sempre que você ler os comentários eu estarei lá', 'authorProfileImageUrl': 'https://yt3.ggpht.com/r9OrmNWjTIDSUCw8iLRl6ZyuUHHhtCPl6lzXFBfOm0aOk9oSwa5FoU08jeJ-XGdP8C_UV7PRjA=s48-c-k-c0x00ffffff-no-rj', 'authorChannelUrl': 'http://www.youtube.com/channel/UCUrTU2-2Z51HoMx-U4q2KKw', 'authorChannelId': {'value': 'UCUrTU2-2Z51HoMx-U4q2KKw'}, 'canRate': True, 'viewerRating': 'none', 'likeCount': 0, 'publishedAt': '2022-10-30T14:42:47Z', 'updatedAt': '2022-10-30T14:42:47Z'}}, 'canReply': True, 'totalReplyCount': 0, 'isPublic': True}",,UCUrTU2-2Z51HoMx-U4q2KKw,2022-10-30T14:42:47Z,BORA 22 🇧🇷🇧🇷🇧🇷🇧🇷,,2023-06-08 02:41:32.262018
youtube#commentThread,Jwg74NX7Uc_GIYC79VoJupJKGy0,UgzpWJI4pVDXaaSJqyp4AaABAg,"{'videoId': 'mngDDP48JKU', 'topLevelComment': {'kind': 'youtube#comment', 'etag': 'QI5Ug1_SdcJavtGjVCGL47fuOs4', 'id': 'UgzpWJI4pVDXaaSJqyp4AaABAg', 'snippet': {'videoId': 'mngDDP48JKU', 'textDisplay': 'TEMOS QUE FORTALECER A VITORIA DO BOLSONARO.<br>PARA COMPROVAR LEIAM O PLANO DE GOVERNO DO PT', 'textOriginal': 'TEMOS QUE FORTALECER A VITORIA DO BOLSONARO.\\nPARA COMPROVAR LEIAM O PLANO DE GOVERNO DO PT', 'authorDisplayName': 'rogerio benites', 'authorProfileImageUrl': 'https://yt3.ggpht.com/ytc/AGIKgqP9zjkZIWkrHUfuZnV--h96IRPaSXtOEiycWQ=s48-c-k-c0x00ffffff-no-rj', 'authorChannelUrl': 'http://www.youtube.com/channel/UCUTq9yY89kGvD7_W4hmEvnw', 'authorChannelId': {'value': 'UCUTq9yY89kGvD7_W4hmEvnw'}, 'canRate': True, 'viewerRating': 'none', 'likeCount': 1, 'publishedAt': '2022-10-29T13:26:58Z', 'updatedAt': '2022-10-29T13:26:58Z'}}, 'canReply': True, 'totalReplyCount': 0, 'isPublic': True}",,UCUTq9yY89kGvD7_W4hmEvnw,2022-10-29T13:26:58Z,"TEMOS QUE FORTALECER A VITORIA DO BOLSONARO.
PARA COMPROVAR LEIAM O PLANO DE GOVERNO DO PT",,2023-06-08 02:41:32.262018
youtube#commentThread,9s0g1-uWHObzrq_BfQbkS-fjxK8,UgzS7renN9jd16z6Jpt4AaABAg,"{'videoId': 'mngDDP48JKU', 'topLevelComment': {'kind': 'youtube#comment', 'etag': 'R6esgRHREaZ6eqVRGmYfierCykI', 'id': 'UgzS7renN9jd16z6Jpt4AaABAg', 'snippet': {'videoId': 'mngDDP48JKU', 'textDisplay': 'ATENÇÃO O LULA FALOU EM SEU PLANO DE GOVERNO QUE IRÁ TOMAR O DINHEIRO DOS BANCOS.', 'textOriginal': 'ATENÇÃO O LULA FALOU EM SEU PLANO DE GOVERNO QUE IRÁ TOMAR O DINHEIRO DOS BANCOS.', 'authorDisplayName': 'rogerio benites', 'authorProfileImageUrl': 'https://yt3.ggpht.com/ytc/AGIKgqP9zjkZIWkrHUfuZnV--h96IRPaSXtOEiycWQ=s48-c-k-c0x00ffffff-no-rj', 'authorChannelUrl': 'http://www.youtube.com/channel/UCUTq9yY89kGvD7_W4hmEvnw', 'authorChannelId': {'value': 'UCUTq9yY89kGvD7_W4hmEvnw'}, 'canRate': True, 'viewerRating': 'none', 'likeCount': 1, 'publishedAt': '2022-10-29T13:25:57Z', 'updatedAt': '2022-10-29T13:25:57Z'}}, 'canReply': True, 'totalReplyCount': 0, 'isPublic': True}",,UCUTq9yY89kGvD7_W4hmEvnw,2022-10-29T13:25:57Z,ATENÇÃO O LULA FALOU EM SEU PLANO DE GOVERNO QUE IRÁ TOMAR O DINHEIRO DOS BANCOS.,,2023-06-08 02:41:32.262018
youtube#commentThread,WJiIKPa_gxv97TdYlzv50tEToGs,UgzBzkuC-bA1vRKAWjx4AaABAg,"{'videoId': 'mngDDP48JKU', 'topLevelComment': {'kind': 'youtube#comment', 'etag': 'QhQ_prLdgRkpypkaUw3C8NE8HZY', 'id': 'UgzBzkuC-bA1vRKAWjx4AaABAg', 'snippet': {'videoId': 'mngDDP48JKU', 'textDisplay': 'PIADA!!😡 A CNN É GOLPISTA E FACISTA.<br><a href=""http://www.youtube.com/results?search_query=%23forabolsonaristas"">#FORABOLSONARISTAS</a><br><a href=""http://www.youtube.com/results?search_query=%23foradoentesmentais"">#FORADOENTESMENTAIS</a><br>BOLSONARO É DERROTADO DESDE O PRIMEIRO TURNO 🤣🤣🤣🤣', 'textOriginal': 'PIADA!!😡 A CNN É GOLPISTA E FACISTA.\\n#FORABOLSONARISTAS\\n#FORADOENTESMENTAIS\\nBOLSONARO É DERROTADO DESDE O PRIMEIRO TURNO 🤣🤣🤣🤣', 'authorDisplayName': 'Prisão aos Golpistas 🇧🇷', 'authorProfileImageUrl': 'https://yt3.ggpht.com/n2U1ENVQhEZ4LCMbRpUrwkOBeQCQ1OELAI354jBK0KKJoi-9cpOXRZA7Xj2j9GgjpEz4dHnB=s48-c-k-c0x00ffffff-no-rj', 'authorChannelUrl': 'http://www.youtube.com/channel/UCFhd_8l4VctHJ34keaMXZEg', 'authorChannelId': {'value': 'UCFhd_8l4VctHJ34keaMXZEg'}, 'canRate': True, 'viewerRating': 'none', 'likeCount': 1, 'publishedAt': '2022-10-27T14:19:34Z', 'updatedAt': '2022-10-27T14:19:34Z'}}, 'canReply': True, 'totalReplyCount': 0, 'isPublic': True}",,UCFhd_8l4VctHJ34keaMXZEg,2022-10-27T14:19:34Z,"PIADA!!😡 A CNN É GOLPISTA E FACISTA.
#FORABOLSONARISTAS
#FORADOENTESMENTAIS
BOLSONARO É DERROTADO DESDE O PRIMEIRO TURNO 🤣🤣🤣🤣",,2023-06-08 02:41:32.262018
youtube#commentThread,4_Gf_X5cuaDAjfPdIHy4_k4GvnQ,UgxekDR3W-R9X6_3DjZ4AaABAg,"{'videoId': 'mngDDP48JKU', 'topLevelComment': {'kind': 'youtube#comment', 'etag': 'jx3ICOg0lk-57EwPPNZuY9dV4J0', 'id': 'UgxekDR3W-R9X6_3DjZ4AaABAg', 'snippet': {'videoId': 'mngDDP48JKU', 'textDisplay': 'Na minha opinião quem defende o apoio político é porque está mamando na teta do governo', 'textOriginal': 'Na minha opinião quem defende o apoio político é porque está mamando na teta do governo', 'authorDisplayName': 'Célio', 'authorProfileImageUrl': 'https://yt3.ggpht.com/ytc/AGIKgqPfDDJk1O5EsLZkoXFag5m34_jsEhISHbmBqvkl4KB-RZ_XWeH5xqhmNBjqFvNT=s48-c-k-c0x00ffffff-no-rj', 'authorChannelUrl': 'http://www.youtube.com/channel/UCQHP9Oibo1gyBrXCqoy518Q', 'authorChannelId': {'value': 'UCQHP9Oibo1gyBrXCqoy518Q'}, 'canRate': True, 'viewerRating': 'none', 'likeCount': 0, 'publishedAt': '2022-10-26T13:38:29Z', 'updatedAt': '2022-10-26T13:38:29Z'}}, 'canReply': True, 'totalReplyCount': 0, 'isPublic': True}",,UCQHP9Oibo1gyBrXCqoy518Q,2022-10-26T13:38:29Z,Na minha opinião quem defende o apoio político é porque está mamando na teta do governo,,2023-06-08 02:41:32.262018
youtube#commentThread,kYD13TO7Cb1yzAG_sOMNIYpPUo8,UgzMoJi7tzjk2L-hbCl4AaABAg,"{'videoId': 'mngDDP48JKU', 'topLevelComment': {'kind': 'youtube#comment', 'etag': '44nRw60gFrYOD_Z4E2PI5GDIPzI', 'id': 'UgzMoJi7tzjk2L-hbCl4AaABAg', 'snippet': {'videoId': 'mngDDP48JKU', 'textDisplay': 'Na reta final não dá tempo de conversão a chance de virada do Bolsonaro está na abstenção.', 'textOriginal': 'Na reta final não dá tempo de conversão a chance de virada do Bolsonaro está na abstenção.', 'authorDisplayName': 'Josias Soares', 'authorProfileImageUrl': 'https://yt3.ggpht.com/ytc/AGIKgqPC_kbF8nc2_jgTJ5Sh7Oh2fhv7m4FYWtWUtLQtZg=s48-c-k-c0x00ffffff-no-rj', 'authorChannelUrl': 'http://www.youtube.com/channel/UCVQFLt60Ev_8H0Q2UjLqYCg', 'authorChannelId': {'value': 'UCVQFLt60Ev_8H0Q2UjLqYCg'}, 'canRate': True, 'viewerRating': 'none', 'likeCount': 0, 'publishedAt': '2022-10-26T03:28:15Z', 'updatedAt': '2022-10-26T03:28:15Z'}}, 'canReply': True, 'totalReplyCount': 0, 'isPublic': True}",,UCVQFLt60Ev_8H0Q2UjLqYCg,2022-10-26T03:28:15Z,Na reta final não dá tempo de conversão a chance de virada do Bolsonaro está na abstenção.,,2023-06-08 02:41:32.262018
youtube#commentThread,n0py1pCQQ3ua1JPbnc4DxQyPh8s,UgwDFxYC4ylunk7hZCF4AaABAg,"{'videoId': 'mngDDP48JKU', 'topLevelComment': {'kind': 'youtube#comment', 'etag': 'uFoRlW8hVOXsTuBM4Ji_UqZ0Gg8', 'id': 'UgwDFxYC4ylunk7hZCF4AaABAg', 'snippet': {'videoId': 'mngDDP48JKU', 'textDisplay': 'Ceria pergunta pó ĺula se Caxoro tem picainha', 'textOriginal': 'Ceria pergunta pó ĺula se Caxoro tem picainha', 'authorDisplayName': 'Lucilene Silvia Conceição Lu', 'authorProfileImageUrl': 'https://yt3.ggpht.com/ytc/AGIKgqPCjpI9cRsvwM02R7I8CbzMFMoRUK22Q9VI2Q=s48-c-k-c0x00ffffff-no-rj', 'authorChannelUrl': 'http://www.youtube.com/channel/UCa-yjBpDGauyLHM_5pXgydw', 'authorChannelId': {'value': 'UCa-yjBpDGauyLHM_5pXgydw'}, 'canRate': True, 'viewerRating': 'none', 'likeCount': 0, 'publishedAt': '2022-10-25T16:49:25Z', 'updatedAt': '2022-10-25T16:49:25Z'}}, 'canReply': True, 'totalReplyCount': 0, 'isPublic': True}",,UCa-yjBpDGauyLHM_5pXgydw,2022-10-25T16:49:25Z,Ceria pergunta pó ĺula se Caxoro tem picainha,,2023-06-08 02:41:32.262018
youtube#commentThread,obMCttGO0tIRwe-_Y0RF6E3ma3o,UgzpiuK0P6avTBPKqY54AaABAg,"{'videoId': 'mngDDP48JKU', 'topLevelComment': {'kind': 'youtube#comment', 'etag': 'tmisR7Az8_ny4Bu3Jy1ePCDtGjY', 'id': 'UgzpiuK0P6avTBPKqY54AaABAg', 'snippet': {'videoId': 'mngDDP48JKU', 'textDisplay': 'Roberto Jeferson mandou lembranças.', 'textOriginal': 'Roberto Jeferson mandou lembranças.', 'authorDisplayName': 'Maestro Bogs', 'authorProfileImageUrl': 'https://yt3.ggpht.com/KsU-nz76rykpwrHb6r3hv-Sf6gyGuGBJBq_spZRIrj9cYqwFNUxcUnjpZImmTdz2-oPPuLvK=s48-c-k-c0x00ffffff-no-rj', 'authorChannelUrl': 'http://www.youtube.com/channel/UCJcEAK8vRoXUVDTgHLJKj4w', 'authorChannelId': {'value': 'UCJcEAK8vRoXUVDTgHLJKj4w'}, 'canRate': True, 'viewerRating': 'none', 'likeCount': 0, 'publishedAt': '2022-10-25T13:05:56Z', 'updatedAt': '2022-10-25T13:05:56Z'}}, 'canReply': True, 'totalReplyCount': 0, 'isPublic': True}",,UCJcEAK8vRoXUVDTgHLJKj4w,2022-10-25T13:05:56Z,Roberto Jeferson mandou lembranças.,,2023-06-08 02:41:32.262018
youtube#commentThread,OyqiZT4dkPGSfjCbouRgzrWxOmY,Ugx96NV1JlFqDYVKzRd4AaABAg,"{'videoId': 'mngDDP48JKU', 'topLevelComment': {'kind': 'youtube#comment', 'etag': 'YKUdKQJxKfj_IuNPzLV_ICuwzD0', 'id': 'Ugx96NV1JlFqDYVKzRd4AaABAg', 'snippet': {'videoId': 'mngDDP48JKU', 'textDisplay': 'Professor totalmente imparcial, puxando  pro lado da esquerda, pura e inocente, povo democrata, com seu líder fujão', 'textOriginal': 'Professor totalmente imparcial, puxando  pro lado da esquerda, pura e inocente, povo democrata, com seu líder fujão', 'authorDisplayName': 'Samuell Henrique', 'authorProfileImageUrl': 'https://yt3.ggpht.com/ytc/AGIKgqOrgFfGE6D6JMTwB8kKc8BiUHakdHwOk4RqBx2jrA=s48-c-k-c0x00ffffff-no-rj', 'authorChannelUrl': 'http://www.youtube.com/channel/UCpynAmue0JeLKEq0RtZ_ryw', 'authorChannelId': {'value': 'UCpynAmue0JeLKEq0RtZ_ryw'}, 'canRate': True, 'viewerRating': 'none', 'likeCount': 0, 'publishedAt': '2022-10-24T06:30:43Z', 'updatedAt': '2022-10-24T06:30:43Z'}}, 'canReply': True, 'totalReplyCount': 0, 'isPublic': True}",,UCpynAmue0JeLKEq0RtZ_ryw,2022-10-24T06:30:43Z,"Professor totalmente imparcial, puxando  pro lado da esquerda, pura e inocente, povo democrata, com seu líder fujão",,2023-06-08 02:41:32.262018
youtube#commentThread,M2Hm0qxnXP98mCTp3msI6SfDnDw,UgwjJWjj56H7G-SvpLZ4AaABAg,"{'videoId': 'mngDDP48JKU', 'topLevelComment': {'kind': 'youtube#comment', 'etag': 'jfYEwrBkfsVh2w4BAuaiw1J_-Wo', 'id': 'UgwjJWjj56H7G-SvpLZ4AaABAg', 'snippet': {'videoId': 'mngDDP48JKU', 'textDisplay': 'Embora a abstenção chegue a ser  muito maior que no primeiro turno, Lula ainda se sobresairá muito bem e vai levar a eleição. Não é ele que precisa correr contra o tempo em busca de 6 milhões de votos.', 'textOriginal': 'Embora a abstenção chegue a ser  muito maior que no primeiro turno, Lula ainda se sobresairá muito bem e vai levar a eleição. Não é ele que precisa correr contra o tempo em busca de 6 milhões de votos.', 'authorDisplayName': 'Josiane Artoni', 'authorProfileImageUrl': 'https://yt3.ggpht.com/8wijrc-8yF3SLAoiBMd51xU8PAdg59ABY2tjKNFLcrXxy_RSMX3VA_rlr4GEutqdelUzAT4TXfM=s48-c-k-c0x00ffffff-no-rj', 'authorChannelUrl': 'http://www.youtube.com/channel/UCuetHE37NoeWH-bT4_bdcVw', 'authorChannelId': {'value': 'UCuetHE37NoeWH-bT4_bdcVw'}, 'canRate': True, 'viewerRating': 'none', 'likeCount': 0, 'publishedAt': '2022-10-24T06:14:34Z', 'updatedAt': '2022-10-24T06:14:34Z'}}, 'canReply': True, 'totalReplyCount': 0, 'isPublic': True}",,UCuetHE37NoeWH-bT4_bdcVw,2022-10-24T06:14:34Z,"Embora a abstenção chegue a ser  muito maior que no primeiro turno, Lula ainda se sobresairá muito bem e vai levar a eleição. Não é ele que precisa correr contra o tempo em busca de 6 milhões de votos.",,2023-06-08 02:41:32.262018
youtube#commentThread,9-yE35vLHmx0XaZuHu6KjZrD0Kk,UgxcfvlYCK1hNmRsnG14AaABAg,"{'videoId': 'mngDDP48JKU', 'topLevelComment': {'kind': 'youtube#comment', 'etag': '60nQdepfsBfJszPv9QymUuTu8CE', 'id': 'UgxcfvlYCK1hNmRsnG14AaABAg', 'snippet': {'videoId': 'mngDDP48JKU', 'textDisplay': 'Jair bolsonaro vira o não vira nas pesquisas ????', 'textOriginal': 'Jair bolsonaro vira o não vira nas pesquisas ????', 'authorDisplayName': 'Adriano Silva', 'authorProfileImageUrl': 'https://yt3.ggpht.com/ytc/AGIKgqNCNNtT3MeJQR3u1_TDGImpD_gN7KGHBm-beo8-J1jVngFpWB3i74v7jn__uQ38=s48-c-k-c0x00ffffff-no-rj', 'authorChannelUrl': 'http://www.youtube.com/channel/UCQ5a-_ktnoiDgaaiY_VLKww', 'authorChannelId': {'value': 'UCQ5a-_ktnoiDgaaiY_VLKww'}, 'canRate': True, 'viewerRating': 'none', 'likeCount': 1, 'publishedAt': '2022-10-24T05:39:12Z', 'updatedAt': '2022-10-24T05:39:12Z'}}, 'canReply': True, 'totalReplyCount': 0, 'isPublic': True}",,UCQ5a-_ktnoiDgaaiY_VLKww,2022-10-24T05:39:12Z,Jair bolsonaro vira o não vira nas pesquisas ????,,2023-06-08 02:41:32.262018
youtube#commentThread,W8oInVe269rQT5C3axo4QFSs_y0,Ugx-cBpKEhdcyPkuidh4AaABAg,"{'videoId': 'mngDDP48JKU', 'topLevelComment': {'kind': 'youtube#comment', 'etag': '8eZHh7bENhhvFTSRHZmxsagm1wg', 'id': 'Ugx-cBpKEhdcyPkuidh4AaABAg', 'snippet': {'videoId': 'mngDDP48JKU', 'textDisplay': 'Cadê o fujão! Kkkkkkk', 'textOriginal': 'Cadê o fujão! Kkkkkkk', 'authorDisplayName': 'Jair Oliveira', 'authorProfileImageUrl': 'https://yt3.ggpht.com/ytc/AGIKgqPRh955lvskpr2SP4j6gqB6P9N9JtVlH63vaQ=s48-c-k-c0x00ffffff-no-rj', 'authorChannelUrl': 'http://www.youtube.com/channel/UCntSA_jJ_sTlfyYariT8pCA', 'authorChannelId': {'value': 'UCntSA_jJ_sTlfyYariT8pCA'}, 'canRate': True, 'viewerRating': 'none', 'likeCount': 0, 'publishedAt': '2022-10-24T03:00:22Z', 'updatedAt': '2022-10-24T03:00:22Z'}}, 'canReply': True, 'totalReplyCount': 0, 'isPublic': True}",,UCntSA_jJ_sTlfyYariT8pCA,2022-10-24T03:00:22Z,Cadê o fujão! Kkkkkkk,,2023-06-08 02:41:32.262018
youtube#commentThread,Z3zwYLeVQpLtYB7TyqniS-j0p5A,Ugy_QeGcLWlnc1g9N594AaABAg,"{'videoId': 'mngDDP48JKU', 'topLevelComment': {'kind': 'youtube#comment', 'etag': 'AazzXMlDe6K8dQx9s4CFn5KDFio', 'id': 'Ugy_QeGcLWlnc1g9N594AaABAg', 'snippet': {'videoId': 'mngDDP48JKU', 'textDisplay': 'Lula 13', 'textOriginal': 'Lula 13', 'authorDisplayName': 'Leandro Teixeira', 'authorProfileImageUrl': 'https://yt3.ggpht.com/ytc/AGIKgqMXEL8uPpWykMdyKj-9X9_lDcC8lIeaxDN_5g=s48-c-k-c0x00ffffff-no-rj', 'authorChannelUrl': 'http://www.youtube.com/channel/UCjXW6ghUdENtyPkqEZ5FQjA', 'authorChannelId': {'value': 'UCjXW6ghUdENtyPkqEZ5FQjA'}, 'canRate': True, 'viewerRating': 'none', 'likeCount': 0, 'publishedAt': '2022-10-24T02:35:03Z', 'updatedAt': '2022-10-24T02:35:03Z'}}, 'canReply': True, 'totalReplyCount': 0, 'isPublic': True}",,UCjXW6ghUdENtyPkqEZ5FQjA,2022-10-24T02:35:03Z,Lula 13,,2023-06-08 02:41:32.262018
youtube#commentThread,eUfcYztQ5HM_IHfgNP0Gkep8Waw,UgyVLv7nECuLvwaXATx4AaABAg,"{'videoId': 'mngDDP48JKU', 'topLevelComment': {'kind': 'youtube#comment', 'etag': 'JtA1UtWr07VbtwEC7FUllZDiZhY', 'id': 'UgyVLv7nECuLvwaXATx4AaABAg', 'snippet': {'videoId': 'mngDDP48JKU', 'textDisplay': 'Oi', 'textOriginal': 'Oi', 'authorDisplayName': 'Cleuza Alves', 'authorProfileImageUrl': 'https://yt3.ggpht.com/ytc/AGIKgqMwTJIsbXa4eg5ef_ysXFhGNTNf4O6cv6ehnQ=s48-c-k-c0x00ffffff-no-rj', 'authorChannelUrl': 'http://www.youtube.com/channel/UCKCQFnKuRSPry8FcLsoegWQ', 'authorChannelId': {'value': 'UCKCQFnKuRSPry8FcLsoegWQ'}, 'canRate': True, 'viewerRating': 'none', 'likeCount': 0, 'publishedAt': '2022-10-23T22:33:19Z', 'updatedAt': '2022-10-23T22:33:19Z'}}, 'canReply': True, 'totalReplyCount': 0, 'isPublic': True}",,UCKCQFnKuRSPry8FcLsoegWQ,2022-10-23T22:33:19Z,Oi,,2023-06-08 02:41:32.262018
youtube#commentThread,FQo71Pre2rd9rlPQbW1B8mwM5lk,UgxFZKQysdAjKMUmpvd4AaABAg,"{'videoId': 'mngDDP48JKU', 'topLevelComment': {'kind': 'youtube#comment', 'etag': 'v7VdQlhbokzVU86ypS0ThcMTQJE', 'id': 'UgxFZKQysdAjKMUmpvd4AaABAg', 'snippet': {'videoId': 'mngDDP48JKU', 'textDisplay': 'Bolsonaro reeleito dia 30 !', 'textOriginal': 'Bolsonaro reeleito dia 30 !', 'authorDisplayName': 'Rudinei Pelozo', 'authorProfileImageUrl': 'https://yt3.ggpht.com/ytc/AGIKgqO7Q4G6SCJYBn3chPdnJClQaAphwEJD6kzZlw=s48-c-k-c0x00ffffff-no-rj', 'authorChannelUrl': 'http://www.youtube.com/channel/UCf3GwA8BHnvBHwTxJTuwteQ', 'authorChannelId': {'value': 'UCf3GwA8BHnvBHwTxJTuwteQ'}, 'canRate': True, 'viewerRating': 'none', 'likeCount': 1, 'publishedAt': '2022-10-23T21:03:22Z', 'updatedAt': '2022-10-23T21:03:22Z'}}, 'canReply': True, 'totalReplyCount': 0, 'isPublic': True}",,UCf3GwA8BHnvBHwTxJTuwteQ,2022-10-23T21:03:22Z,Bolsonaro reeleito dia 30 !,,2023-06-08 02:41:32.262018
youtube#commentThread,SAnEz9UBVKy69bUNe6MdQYVFKyM,UgwLnnMOv9TGdJOVS3F4AaABAg,"{'videoId': 'mngDDP48JKU', 'topLevelComment': {'kind': 'youtube#comment', 'etag': 'OmWz3ab0NpDTbawBu0nOyMwq4b0', 'id': 'UgwLnnMOv9TGdJOVS3F4AaABAg', 'snippet': {'videoId': 'mngDDP48JKU', 'textDisplay': 'Convenhamos Bolsonaro tem muitas coisas que eu discordo dele, de algumas atitudes também as vezes que não me agrada. Mas votar no ladrão não dá né. O cara que conseguiu fazer mais obras fora do Brasil com o nosso dinheiro. Exemplo: porto em Cuba, metrô na Venezuela, refinaria na Bolívia e aeroporto em Moçambique. E a transposição do rio são Francisco que ele podia se gabar por ter feito, não conseguiu terminar. Por isso é difícil votar no Lulinha..🤷🏻\\u200d♂️', 'textOriginal': 'Convenhamos Bolsonaro tem muitas coisas que eu discordo dele, de algumas atitudes também as vezes que não me agrada. Mas votar no ladrão não dá né. O cara que conseguiu fazer mais obras fora do Brasil com o nosso dinheiro. Exemplo: porto em Cuba, metrô na Venezuela, refinaria na Bolívia e aeroporto em Moçambique. E a transposição do rio são Francisco que ele podia se gabar por ter feito, não conseguiu terminar. Por isso é difícil votar no Lulinha..🤷🏻\\u200d♂️', 'authorDisplayName': 'Didi Alcan', 'authorProfileImageUrl': 'https://yt3.ggpht.com/ytc/AGIKgqPL63akDnytjtrr4IlmCjJshz0kwGOdyWACi9dpxdMU8RcTM_nWus4NpLINoG90=s48-c-k-c0x00ffffff-no-rj', 'authorChannelUrl': 'http://www.youtube.com/channel/UCcKMCfVTjjB0JlPADEGlzAg', 'authorChannelId': {'value': 'UCcKMCfVTjjB0JlPADEGlzAg'}, 'canRate': True, 'viewerRating': 'none', 'likeCount': 6, 'publishedAt': '2022-10-23T21:01:42Z', 'updatedAt': '2022-10-23T21:01:42Z'}}, 'canReply': True, 'totalReplyCount': 1, 'isPublic': True}","{'comments': [{'kind': 'youtube#comment', 'etag': 'kthl2n5hOgmM4IjYOvbaf6mM7uQ', 'id': 'UgwLnnMOv9TGdJOVS3F4AaABAg.9hY0xFBCjdJ9hbK2q0a3cS', 'snippet': {'videoId': 'mngDDP48JKU', 'textDisplay': 'Roberto Jefferson mandou lembranças.', 'textOriginal': 'Roberto Jefferson mandou lembranças.', 'parentId': 'UgwLnnMOv9TGdJOVS3F4AaABAg', 'authorDisplayName': 'Maestro Bogs', 'authorProfileImageUrl': 'https://yt3.ggpht.com/KsU-nz76rykpwrHb6r3hv-Sf6gyGuGBJBq_spZRIrj9cYqwFNUxcUnjpZImmTdz2-oPPuLvK=s48-c-k-c0x00ffffff-no-rj', 'authorChannelUrl': 'http://www.youtube.com/channel/UCJcEAK8vRoXUVDTgHLJKj4w', 'authorChannelId': {'value': 'UCJcEAK8vRoXUVDTgHLJKj4w'}, 'canRate': True, 'viewerRating': 'none', 'likeCount': 0, 'publishedAt': '2022-10-25T13:05:35Z', 'updatedAt': '2022-10-25T13:05:35Z'}}]}",UCcKMCfVTjjB0JlPADEGlzAg,2022-10-23T21:01:42Z,"Convenhamos Bolsonaro tem muitas coisas que eu discordo dele, de algumas atitudes também as vezes que não me agrada. Mas votar no ladrão não dá né. O cara que conseguiu fazer mais obras fora do Brasil com o nosso dinheiro. Exemplo: porto em Cuba, metrô na Venezuela, refinaria na Bolívia e aeroporto em Moçambique. E a transposição do rio são Francisco que ele podia se gabar por ter feito, não conseguiu terminar. Por isso é difícil votar no Lulinha..🤷🏻‍♂️",,2023-06-08 02:41:32.262018
youtube#commentThread,vpPaOlyeI4UyCtUHam6DurAyY40,UgzQa09_28vJF6AJ1NF4AaABAg,"{'videoId': 'mngDDP48JKU', 'topLevelComment': {'kind': 'youtube#comment', 'etag': 'gNHWuAUvmkXDOBaP8seFxCetQ8s', 'id': 'UgzQa09_28vJF6AJ1NF4AaABAg', 'snippet': {'videoId': 'mngDDP48JKU', 'textDisplay': 'Discordo. Se Lula ganhou com essas abstenções, p agora isso favorece o Bôzo? Não acreditem nesses mentirosos. Tem que lembrar que as asneiras que o Bôzo fez ele perde uns 10 milhões de votos', 'textOriginal': 'Discordo. Se Lula ganhou com essas abstenções, p agora isso favorece o Bôzo? Não acreditem nesses mentirosos. Tem que lembrar que as asneiras que o Bôzo fez ele perde uns 10 milhões de votos', 'authorDisplayName': 'Adeilson Beó', 'authorProfileImageUrl': 'https://yt3.ggpht.com/ytc/AGIKgqPQOTEBg1NYNTmfOGCd51lE6O3KH0BeT8-Bvg=s48-c-k-c0x00ffffff-no-rj', 'authorChannelUrl': 'http://www.youtube.com/channel/UC5leV1dE-HiCjPeKn8rMqgQ', 'authorChannelId': {'value': 'UC5leV1dE-HiCjPeKn8rMqgQ'}, 'canRate': True, 'viewerRating': 'none', 'likeCount': 0, 'publishedAt': '2022-10-23T20:00:27Z', 'updatedAt': '2022-10-23T20:01:17Z'}}, 'canReply': True, 'totalReplyCount': 0, 'isPublic': True}",,UC5leV1dE-HiCjPeKn8rMqgQ,2022-10-23T20:00:27Z,"Discordo. Se Lula ganhou com essas abstenções, p agora isso favorece o Bôzo? Não acreditem nesses mentirosos. Tem que lembrar que as asneiras que o Bôzo fez ele perde uns 10 milhões de votos",,2023-06-08 02:41:32.262018
youtube#commentThread,7kj3VXti5G14w7kCV-Ox6TySG5o,UgwxUhjy3zOcPE9l6wZ4AaABAg,"{'videoId': 'mngDDP48JKU', 'topLevelComment': {'kind': 'youtube#comment', 'etag': 'uZw4eoF-ffuaZwrL7VrAahGJQ2k', 'id': 'UgwxUhjy3zOcPE9l6wZ4AaABAg', 'snippet': {'videoId': 'mngDDP48JKU', 'textDisplay': 'XUXA 14 ANOS... Vídeo recomendado por Lula,hoje,23/10/22  <a href=""https://www.youtube.com/watch?v=Ghnhomuh4Dw&amp;t=7s"">https://www.youtube.com/watch?v=Ghnhomuh4Dw&amp;t=7s</a>', 'textOriginal': 'XUXA 14 ANOS... Vídeo recomendado por Lula,hoje,23/10/22  https://www.youtube.com/watch?v=Ghnhomuh4Dw&t=7s', 'authorDisplayName': 'VIDA ALÉM DA vida.', 'authorProfileImageUrl': 'https://yt3.ggpht.com/ytc/AGIKgqMKje2y9C9CVL_fj_e81AfFREAiVsReoWxoK3miekDGE_EghzcdE3SkgRogLopP=s48-c-k-c0x00ffffff-no-rj', 'authorChannelUrl': 'http://www.youtube.com/channel/UCpRgpe8eLACU3zAtdEQ2x7g', 'authorChannelId': {'value': 'UCpRgpe8eLACU3zAtdEQ2x7g'}, 'canRate': True, 'viewerRating': 'none', 'likeCount': 0, 'publishedAt': '2022-10-23T19:07:06Z', 'updatedAt': '2022-10-23T19:07:06Z'}}, 'canReply': True, 'totalReplyCount': 0, 'isPublic': True}",,UCpRgpe8eLACU3zAtdEQ2x7g,2022-10-23T19:07:06Z,"XUXA 14 ANOS... Vídeo recomendado por Lula,hoje,23/10/22  https://www.youtube.com/watch?v=Ghnhomuh4Dw&t=7s",,2023-06-08 02:41:32.262018
