kind,etag,id,snippet,replies,authorChannelId,publishedAt,textOriginal,nextPageToken,extraction_date
youtube#commentThread,0ilaDWpgzibjXWT7YEzVtKPdVj0,UgyX9Vc6MtDJ-io70tR4AaABAg,"{'videoId': 'dzYiEk8gHAo', 'topLevelComment': {'kind': 'youtube#comment', 'etag': 'BmUWEpCV4Xdnh20lg2Q6UkqCQWc', 'id': 'UgyX9Vc6MtDJ-io70tR4AaABAg', 'snippet': {'videoId': 'dzYiEk8gHAo', 'textDisplay': 'Eu não consigo entender como tem gente q vota em um desqualificado desse como Bolsonaro, eu tento ter a cabeça de um bolsominion mas não consigo, acho insano.', 'textOriginal': 'Eu não consigo entender como tem gente q vota em um desqualificado desse como Bolsonaro, eu tento ter a cabeça de um bolsominion mas não consigo, acho insano.', 'authorDisplayName': 'Alex Silva 🕊️', 'authorProfileImageUrl': 'https://yt3.ggpht.com/YA--bhYd3LwD6eUdRNi3HRKpMi-_9Ivr_ErISr5hEBsWAe_1Re7EP0T6uVx48V6GrxhyGSXwBQ=s48-c-k-c0x00ffffff-no-rj', 'authorChannelUrl': 'http://www.youtube.com/channel/UCX-vVPXURqufqEpC4WKpM8Q', 'authorChannelId': {'value': 'UCX-vVPXURqufqEpC4WKpM8Q'}, 'canRate': True, 'viewerRating': 'none', 'likeCount': 6, 'publishedAt': '2022-10-06T17:51:36Z', 'updatedAt': '2022-10-06T17:51:36Z'}}, 'canReply': True, 'totalReplyCount': 3, 'isPublic': True}","{'comments': [{'kind': 'youtube#comment', 'etag': 'y42w8Y1p4jTLl6zsoYOEjHgu-JE', 'id': 'UgyX9Vc6MtDJ-io70tR4AaABAg.9gqug-rRs-G9gqw1iJwxns', 'snippet': {'videoId': 'dzYiEk8gHAo', 'textDisplay': 'votei ciro', 'textOriginal': 'votei ciro', 'parentId': 'UgyX9Vc6MtDJ-io70tR4AaABAg', 'authorDisplayName': 'Eduardo Getirana', 'authorProfileImageUrl': 'https://yt3.ggpht.com/ytc/AGIKgqMorRiwK7OozliJCuy0Uv_KGNoYGkA4ftJ5scQuc7N10FGCEbKbBj81JYYQrYUk=s48-c-k-c0x00ffffff-no-rj', 'authorChannelUrl': 'http://www.youtube.com/channel/UCXqYLaqTSMH5pjhEmnGYPXA', 'authorChannelId': {'value': 'UCXqYLaqTSMH5pjhEmnGYPXA'}, 'canRate': True, 'viewerRating': 'none', 'likeCount': 0, 'publishedAt': '2022-10-06T18:03:26Z', 'updatedAt': '2022-10-06T18:03:26Z'}}, {'kind': 'youtube#comment', 'etag': '_QBchOIy97Vgw0RnzZMDBWKg5xQ', 'id': 'UgyX9Vc6MtDJ-io70tR4AaABAg.9gqug-rRs-G9gqvXURSJA9', 'snippet': {'videoId': 'dzYiEk8gHAo', 'textDisplay': 'Lula é um santo ne', 'textOriginal': 'Lula é um santo ne', 'parentId': 'UgyX9Vc6MtDJ-io70tR4AaABAg', 'authorDisplayName': 'kum Razin', 'authorProfileImageUrl': 'https://yt3.ggpht.com/tG3lBkRL5fgRPLqLJMPP0ucvx6Mkz9uYqDAVVL2Ib1yeUF1jkuYTwyypGcZB-S7G6sf21Azt=s48-c-k-c0x00ffffff-no-rj', 'authorChannelUrl': 'http://www.youtube.com/channel/UC5uDaXw7-szIBxqILvA8wkA', 'authorChannelId': {'value': 'UC5uDaXw7-szIBxqILvA8wkA'}, 'canRate': True, 'viewerRating': 'none', 'likeCount': 1, 'publishedAt': '2022-10-06T17:59:02Z', 'updatedAt': '2022-10-06T17:59:02Z'}}, {'kind': 'youtube#comment', 'etag': 't3GlnfaNL365pVimVeVDn4s10dU', 'id': 'UgyX9Vc6MtDJ-io70tR4AaABAg.9gqug-rRs-G9gqvXMTH34H', 'snippet': {'videoId': 'dzYiEk8gHAo', 'textDisplay': 'Os bolsominions são a minoria extremista mas eles acabam  chamando mais atenção por ficarem fazendo escândalo, a maioria só não quer o lula no poder', 'textOriginal': 'Os bolsominions são a minoria extremista mas eles acabam  chamando mais atenção por ficarem fazendo escândalo, a maioria só não quer o lula no poder', 'parentId': 'UgyX9Vc6MtDJ-io70tR4AaABAg', 'authorDisplayName': 'Eduardo trigger', 'authorProfileImageUrl': 'https://yt3.ggpht.com/-D6d6ZTHswjQTBx88Zhd_UM1V368ds1Kv_G_ve-50Vme-sJEkoeoLLrVlEgeZ4D8F_86xUtssQI=s48-c-k-c0x00ffffff-no-rj', 'authorChannelUrl': 'http://www.youtube.com/channel/UC0-UMyDRFkM0ElaLaZBPalA', 'authorChannelId': {'value': 'UC0-UMyDRFkM0ElaLaZBPalA'}, 'canRate': True, 'viewerRating': 'none', 'likeCount': 0, 'publishedAt': '2022-10-06T17:59:01Z', 'updatedAt': '2022-10-06T17:59:01Z'}}]}",UCX-vVPXURqufqEpC4WKpM8Q,2022-10-06T17:51:36Z,"Eu não consigo entender como tem gente q vota em um desqualificado desse como Bolsonaro, eu tento ter a cabeça de um bolsominion mas não consigo, acho insano.",,2023-06-08 11:26:38.206724
youtube#commentThread,d9pIxOQP69TRisRjIxm8x0olid0,UgzeUMRmHqhqC84HQxF4AaABAg,"{'videoId': 'dzYiEk8gHAo', 'topLevelComment': {'kind': 'youtube#comment', 'etag': '8UXEFjd_wNsyTVAvaDSttoH62Zs', 'id': 'UgzeUMRmHqhqC84HQxF4AaABAg', 'snippet': {'videoId': 'dzYiEk8gHAo', 'textDisplay': 'Lula pro inferno!', 'textOriginal': 'Lula pro inferno!', 'authorDisplayName': 'O Farol do Fim Do Mundo', 'authorProfileImageUrl': 'https://yt3.ggpht.com/ytc/AGIKgqOIl8VXfxKgiaWDYKF6-o_KjVlHfHS4GP2_BkK0Kg=s48-c-k-c0x00ffffff-no-rj', 'authorChannelUrl': 'http://www.youtube.com/channel/UCV_o26hcCDIEHAdAshjBkYw', 'authorChannelId': {'value': 'UCV_o26hcCDIEHAdAshjBkYw'}, 'canRate': True, 'viewerRating': 'none', 'likeCount': 2, 'publishedAt': '2022-10-06T17:50:29Z', 'updatedAt': '2022-10-06T17:50:29Z'}}, 'canReply': True, 'totalReplyCount': 0, 'isPublic': True}",,UCV_o26hcCDIEHAdAshjBkYw,2022-10-06T17:50:29Z,Lula pro inferno!,,2023-06-08 11:26:38.206724
youtube#commentThread,xkHc96a3fFHw4HbxMewOzome2_U,UgxYpJRbuCpWUx7ELRp4AaABAg,"{'videoId': 'dzYiEk8gHAo', 'topLevelComment': {'kind': 'youtube#comment', 'etag': '-vZu9d_F_jpIjmLPdBdKiJo7bH0', 'id': 'UgxYpJRbuCpWUx7ELRp4AaABAg', 'snippet': {'videoId': 'dzYiEk8gHAo', 'textDisplay': 'Lula 13 no segundo turno vamos Brasil', 'textOriginal': 'Lula 13 no segundo turno vamos Brasil', 'authorDisplayName': 'Lailson Micael', 'authorProfileImageUrl': 'https://yt3.ggpht.com/ytc/AGIKgqM5_yQ0MoSGMnbbJOL-uZEwb0jRHekYDCIA8Jfs=s48-c-k-c0x00ffffff-no-rj', 'authorChannelUrl': 'http://www.youtube.com/channel/UCwI7IPMqOHg-JncGd-nKVlQ', 'authorChannelId': {'value': 'UCwI7IPMqOHg-JncGd-nKVlQ'}, 'canRate': True, 'viewerRating': 'none', 'likeCount': 7, 'publishedAt': '2022-10-06T17:49:03Z', 'updatedAt': '2022-10-06T17:49:03Z'}}, 'canReply': True, 'totalReplyCount': 0, 'isPublic': True}",,UCwI7IPMqOHg-JncGd-nKVlQ,2022-10-06T17:49:03Z,Lula 13 no segundo turno vamos Brasil,,2023-06-08 11:26:38.206724
youtube#commentThread,tslcntOS1e5VNqEeu5_h1PxOY2I,Ugz_Hu4URuNo7s8AFih4AaABAg,"{'videoId': 'dzYiEk8gHAo', 'topLevelComment': {'kind': 'youtube#comment', 'etag': 'Bd3vbs-9twZOyQ7vencaosTpGWY', 'id': 'Ugz_Hu4URuNo7s8AFih4AaABAg', 'snippet': {'videoId': 'dzYiEk8gHAo', 'textDisplay': 'Apoio de governadores significa que vão  trabalhar juntos se eleito.Apoio de ex candidato pra mim não significa nada, no momento essa pessoa não estará ocupando cargo nenhum, e isso só mostra os interesses pessoais e não coletivos, como se o eleitor não pudesse pensar com a própria cabeça.', 'textOriginal': 'Apoio de governadores significa que vão  trabalhar juntos se eleito.Apoio de ex candidato pra mim não significa nada, no momento essa pessoa não estará ocupando cargo nenhum, e isso só mostra os interesses pessoais e não coletivos, como se o eleitor não pudesse pensar com a própria cabeça.', 'authorDisplayName': 'AnaeDanilo ShJE', 'authorProfileImageUrl': 'https://yt3.ggpht.com/ytc/AGIKgqNh_o0e5C_ClnYyx780EmpTsXKOnMXqevz0cg=s48-c-k-c0x00ffffff-no-rj', 'authorChannelUrl': 'http://www.youtube.com/channel/UCEq6KAJAtUsE7S__tXJIDbQ', 'authorChannelId': {'value': 'UCEq6KAJAtUsE7S__tXJIDbQ'}, 'canRate': True, 'viewerRating': 'none', 'likeCount': 7, 'publishedAt': '2022-10-06T17:48:56Z', 'updatedAt': '2022-10-06T17:48:56Z'}}, 'canReply': True, 'totalReplyCount': 0, 'isPublic': True}",,UCEq6KAJAtUsE7S__tXJIDbQ,2022-10-06T17:48:56Z,"Apoio de governadores significa que vão  trabalhar juntos se eleito.Apoio de ex candidato pra mim não significa nada, no momento essa pessoa não estará ocupando cargo nenhum, e isso só mostra os interesses pessoais e não coletivos, como se o eleitor não pudesse pensar com a própria cabeça.",,2023-06-08 11:26:38.206724
youtube#commentThread,irKaOA-FAL6P66Bl2yVNDM0g1SE,UgyUHeV6AUAD14z4WTB4AaABAg,"{'videoId': 'dzYiEk8gHAo', 'topLevelComment': {'kind': 'youtube#comment', 'etag': 'p0jKdxsRYBwgAC78XLBaA6w7kD0', 'id': 'UgyUHeV6AUAD14z4WTB4AaABAg', 'snippet': {'videoId': 'dzYiEk8gHAo', 'textDisplay': 'Apoio do Padre Kelmon kkkkkkk', 'textOriginal': 'Apoio do Padre Kelmon kkkkkkk', 'authorDisplayName': 'Nicoly Schuster', 'authorProfileImageUrl': 'https://yt3.ggpht.com/ytc/AGIKgqM20jFVsJ6lclpxYgNv1bMXwB9oODtdjL6cbzTluec=s48-c-k-c0x00ffffff-no-rj', 'authorChannelUrl': 'http://www.youtube.com/channel/UCKu3DxAxsXjdAEFPfxA6f2g', 'authorChannelId': {'value': 'UCKu3DxAxsXjdAEFPfxA6f2g'}, 'canRate': True, 'viewerRating': 'none', 'likeCount': 7, 'publishedAt': '2022-10-06T17:42:08Z', 'updatedAt': '2022-10-06T17:42:08Z'}}, 'canReply': True, 'totalReplyCount': 3, 'isPublic': True}","{'comments': [{'kind': 'youtube#comment', 'etag': 'sRimCaKeycTLoU5DkUNsSwn-v0g', 'id': 'UgyUHeV6AUAD14z4WTB4AaABAg.9gqtahwsUNM9gqwy3YczgI', 'snippet': {'videoId': 'dzYiEk8gHAo', 'textDisplay': '🤮', 'textOriginal': '🤮', 'parentId': 'UgyUHeV6AUAD14z4WTB4AaABAg', 'authorDisplayName': 'PÉRSIA HIPPIE', 'authorProfileImageUrl': 'https://yt3.ggpht.com/rzySveMCvhwJXqIVJzAp8THRQVcDTpKvXExfgUXBu9vAEyRfleTkE_-FE6ITdOExJqHG8l3j8C8=s48-c-k-c0x00ffffff-no-rj', 'authorChannelUrl': 'http://www.youtube.com/channel/UCHYNYR_-I-n5ss0Os7gDhWg', 'authorChannelId': {'value': 'UCHYNYR_-I-n5ss0Os7gDhWg'}, 'canRate': True, 'viewerRating': 'none', 'likeCount': 1, 'publishedAt': '2022-10-06T18:11:32Z', 'updatedAt': '2022-10-06T18:11:32Z'}}, {'kind': 'youtube#comment', 'etag': 'qdGNSQussdz8sByJL6GVgicoBqM', 'id': 'UgyUHeV6AUAD14z4WTB4AaABAg.9gqtahwsUNM9gqvwd9aUQC', 'snippet': {'videoId': 'dzYiEk8gHAo', 'textDisplay': 'kkkkk', 'textOriginal': 'kkkkk', 'parentId': 'UgyUHeV6AUAD14z4WTB4AaABAg', 'authorDisplayName': 'Eduardo Getirana', 'authorProfileImageUrl': 'https://yt3.ggpht.com/ytc/AGIKgqMorRiwK7OozliJCuy0Uv_KGNoYGkA4ftJ5scQuc7N10FGCEbKbBj81JYYQrYUk=s48-c-k-c0x00ffffff-no-rj', 'authorChannelUrl': 'http://www.youtube.com/channel/UCXqYLaqTSMH5pjhEmnGYPXA', 'authorChannelId': {'value': 'UCXqYLaqTSMH5pjhEmnGYPXA'}, 'canRate': True, 'viewerRating': 'none', 'likeCount': 1, 'publishedAt': '2022-10-06T18:02:36Z', 'updatedAt': '2022-10-06T18:02:36Z'}}, {'kind': 'youtube#comment', 'etag': '3akL9e7VvqRJ8NEkVFG4bj4t1us', 'id': 'UgyUHeV6AUAD14z4WTB4AaABAg.9gqtahwsUNM9gqvjaKDuXn', 'snippet': {'videoId': 'dzYiEk8gHAo', 'textDisplay': 'Só podia apoiar o Bolsonaro mesmo , se merecem , dois comédia.', 'textOriginal': 'Só podia apoiar o Bolsonaro mesmo , se merecem , dois comédia.', 'parentId': 'UgyUHeV6AUAD14z4WTB4AaABAg', 'authorDisplayName': 'Gabriel', 'authorProfileImageUrl': 'https://yt3.ggpht.com/ytc/AGIKgqMs4_Wjxkdpxqx1NOZEW79IyFb_LGw_5oF9ld3uQzI=s48-c-k-c0x00ffffff-no-rj', 'authorChannelUrl': 'http://www.youtube.com/channel/UCiJkrQGd7iC63GQorrKpLFA', 'authorChannelId': {'value': 'UCiJkrQGd7iC63GQorrKpLFA'}, 'canRate': True, 'viewerRating': 'none', 'likeCount': 3, 'publishedAt': '2022-10-06T18:00:49Z', 'updatedAt': '2022-10-06T18:00:49Z'}}]}",UCKu3DxAxsXjdAEFPfxA6f2g,2022-10-06T17:42:08Z,Apoio do Padre Kelmon kkkkkkk,,2023-06-08 11:26:38.206724
youtube#commentThread,k7N40toFh2DptAU7MLa-agkx1nA,Ugy5kr9NQGykSdYCNkR4AaABAg,"{'videoId': 'dzYiEk8gHAo', 'topLevelComment': {'kind': 'youtube#comment', 'etag': 'D1kKBUo4FSpGs6JE6Erj10R8ppo', 'id': 'Ugy5kr9NQGykSdYCNkR4AaABAg', 'snippet': {'videoId': 'dzYiEk8gHAo', 'textDisplay': 'EXTRA, EXTRA, EXTRA!<br>A ESQUERDA NO PODER DESTRÓI A ARGENTINA! A ARGENTINA PODE TER UM INFLAÇÃO MAIOR QUE 100%.<br>Resumindo: Onde a esquerda põe a mão, DESTRÓI! Fica a dica!', 'textOriginal': 'EXTRA, EXTRA, EXTRA!\\nA ESQUERDA NO PODER DESTRÓI A ARGENTINA! A ARGENTINA PODE TER UM INFLAÇÃO MAIOR QUE 100%.\\nResumindo: Onde a esquerda põe a mão, DESTRÓI! Fica a dica!', 'authorDisplayName': 'Laura Mota', 'authorProfileImageUrl': 'https://yt3.ggpht.com/ytc/AGIKgqNEQTY_LaP6OPPKawuS0gNrqsQb-O4g4dEgnXFw_MjhOFhV8DIUVmWpL0th2UcG=s48-c-k-c0x00ffffff-no-rj', 'authorChannelUrl': 'http://www.youtube.com/channel/UCIDmwMu70ganpm3sUaf1cQw', 'authorChannelId': {'value': 'UCIDmwMu70ganpm3sUaf1cQw'}, 'canRate': True, 'viewerRating': 'none', 'likeCount': 0, 'publishedAt': '2022-10-06T17:41:31Z', 'updatedAt': '2022-10-06T17:41:31Z'}}, 'canReply': True, 'totalReplyCount': 0, 'isPublic': True}",,UCIDmwMu70ganpm3sUaf1cQw,2022-10-06T17:41:31Z,"EXTRA, EXTRA, EXTRA!
A ESQUERDA NO PODER DESTRÓI A ARGENTINA! A ARGENTINA PODE TER UM INFLAÇÃO MAIOR QUE 100%.
Resumindo: Onde a esquerda põe a mão, DESTRÓI! Fica a dica!",,2023-06-08 11:26:38.206724
youtube#commentThread,5hi8aLas2fx0FwFnJWtDzWugumU,Ugz9Y4W7A55dJ9DLYFF4AaABAg,"{'videoId': 'dzYiEk8gHAo', 'topLevelComment': {'kind': 'youtube#comment', 'etag': 'HBcooSRPdWcbigOrhYMniBc8gZI', 'id': 'Ugz9Y4W7A55dJ9DLYFF4AaABAg', 'snippet': {'videoId': 'dzYiEk8gHAo', 'textDisplay': 'BORA VIRAR!!! GANHE 1 VOTO!!! <a href=""http://www.youtube.com/results?search_query=%23virada22"">#VIRADA22</a>', 'textOriginal': 'BORA VIRAR!!! GANHE 1 VOTO!!! #VIRADA22', 'authorDisplayName': 'Brasil', 'authorProfileImageUrl': 'https://yt3.ggpht.com/7XO6Fat2c8L84P-AQwNx5Fr4iGf788UMSHCcJfT0dnC2ecqa12XIIXqnTskuLzYBqoQ2K5X3_A=s48-c-k-c0x00ffffff-no-rj', 'authorChannelUrl': 'http://www.youtube.com/channel/UCJ1P3Q78Ukn91QNLkgChcDw', 'authorChannelId': {'value': 'UCJ1P3Q78Ukn91QNLkgChcDw'}, 'canRate': True, 'viewerRating': 'none', 'likeCount': 8, 'publishedAt': '2022-10-06T17:39:39Z', 'updatedAt': '2022-10-06T17:39:39Z'}}, 'canReply': True, 'totalReplyCount': 14, 'isPublic': True}","{'comments': [{'kind': 'youtube#comment', 'etag': 'Dkg9S6yAmE9GI6jLNSLc91_lFcs', 'id': 'Ugz9Y4W7A55dJ9DLYFF4AaABAg.9gqtJ_HqjUc9gsm0dxbkfE', 'snippet': {'videoId': 'dzYiEk8gHAo', 'textDisplay': '@Natanael Junior é assim mesmo, sou baiana e sei que é assim.', 'textOriginal': '@Natanael Junior é assim mesmo, sou baiana e sei que é assim.', 'parentId': 'Ugz9Y4W7A55dJ9DLYFF4AaABAg', 'authorDisplayName': 'Sueli Ferreira', 'authorProfileImageUrl': 'https://yt3.ggpht.com/ytc/AGIKgqM5sP9bzhulHc6afJjTUVeKiGekqwJXMcgvNg=s48-c-k-c0x00ffffff-no-rj', 'authorChannelUrl': 'http://www.youtube.com/channel/UCk-bCr6MyNEQX4naxY99UFQ', 'authorChannelId': {'value': 'UCk-bCr6MyNEQX4naxY99UFQ'}, 'canRate': True, 'viewerRating': 'none', 'likeCount': 1, 'publishedAt': '2022-10-07T11:14:23Z', 'updatedAt': '2022-10-07T11:14:23Z'}}, {'kind': 'youtube#comment', 'etag': 'ev0x3wm_WO4EdHm9akEwlbPDV8o', 'id': 'Ugz9Y4W7A55dJ9DLYFF4AaABAg.9gqtJ_HqjUc9gslw2s6AHf', 'snippet': {'videoId': 'dzYiEk8gHAo', 'textDisplay': '@Gabriel não é preconceito, a realidade é que entre nós nordestinos, existem a maior taxa de pessoas com menor escolaridade, hj está melhor mas mesmo assim fica mais difícil entenderem a complexidade que envolve a política.', 'textOriginal': '@Gabriel não é preconceito, a realidade é que entre nós nordestinos, existem a maior taxa de pessoas com menor escolaridade, hj está melhor mas mesmo assim fica mais difícil entenderem a complexidade que envolve a política.', 'parentId': 'Ugz9Y4W7A55dJ9DLYFF4AaABAg', 'authorDisplayName': 'Sueli Ferreira', 'authorProfileImageUrl': 'https://yt3.ggpht.com/ytc/AGIKgqM5sP9bzhulHc6afJjTUVeKiGekqwJXMcgvNg=s48-c-k-c0x00ffffff-no-rj', 'authorChannelUrl': 'http://www.youtube.com/channel/UCk-bCr6MyNEQX4naxY99UFQ', 'authorChannelId': {'value': 'UCk-bCr6MyNEQX4naxY99UFQ'}, 'canRate': True, 'viewerRating': 'none', 'likeCount': 1, 'publishedAt': '2022-10-07T11:13:37Z', 'updatedAt': '2022-10-07T11:13:37Z'}}, {'kind': 'youtube#comment', 'etag': 'tSD3XNQCkTTcx7ZaUtdxQ8tNgA0', 'id': 'Ugz9Y4W7A55dJ9DLYFF4AaABAg.9gqtJ_HqjUc9gr7_dEiC4t', 'snippet': {'videoId': 'dzYiEk8gHAo', 'textDisplay': '@Natanael Junior isso tomara msm em a gente tamo em força no sudeste pro bozo ganhar, ele  é a unica opçao', 'textOriginal': '@Natanael Junior isso tomara msm em a gente tamo em força no sudeste pro bozo ganhar, ele  é a unica opçao', 'parentId': 'Ugz9Y4W7A55dJ9DLYFF4AaABAg', 'authorDisplayName': 'Santiago', 'authorProfileImageUrl': 'https://yt3.ggpht.com/AbgqI1BciKyvJDQwY18S3psGuJwuyXMn3aTqvzI3Nj0sZfZcCiajglvhOiMnaiiIVs7z7rBvzLI=s48-c-k-c0x00ffffff-no-rj', 'authorChannelUrl': 'http://www.youtube.com/channel/UCNnBkKtFoGBu_WFLdvalQlA', 'authorChannelId': {'value': 'UCNnBkKtFoGBu_WFLdvalQlA'}, 'canRate': True, 'viewerRating': 'none', 'likeCount': 0, 'publishedAt': '2022-10-06T19:53:03Z', 'updatedAt': '2022-10-06T19:53:03Z'}}, {'kind': 'youtube#comment', 'etag': 'ciTbMgd84KGck9EXN-Ieez8Gxjg', 'id': 'Ugz9Y4W7A55dJ9DLYFF4AaABAg.9gqtJ_HqjUc9gr-4Ci1BOh', 'snippet': {'videoId': 'dzYiEk8gHAo', 'textDisplay': '@Natanael Junior É preconceito sim. E seu comentário só reiterou o que foi constatado.<br>Bolsonarista como qualquer um !', 'textOriginal': '@Natanael Junior É preconceito sim. E seu comentário só reiterou o que foi constatado.\\nBolsonarista como qualquer um !', 'parentId': 'Ugz9Y4W7A55dJ9DLYFF4AaABAg', 'authorDisplayName': 'Gabriel', 'authorProfileImageUrl': 'https://yt3.ggpht.com/ytc/AGIKgqP4u-FDDvZl4EyT20ioEpddv-FvTcdQ4yWQkNBmlw=s48-c-k-c0x00ffffff-no-rj', 'authorChannelUrl': 'http://www.youtube.com/channel/UCW1JgYp1f5QG5UhukdBskag', 'authorChannelId': {'value': 'UCW1JgYp1f5QG5UhukdBskag'}, 'canRate': True, 'viewerRating': 'none', 'likeCount': 0, 'publishedAt': '2022-10-06T18:38:43Z', 'updatedAt': '2022-10-06T18:38:43Z'}}, {'kind': 'youtube#comment', 'etag': 'TckhB5uGsWdn6Y0LLC4SfGe64ow', 'id': 'Ugz9Y4W7A55dJ9DLYFF4AaABAg.9gqtJ_HqjUc9gqzaOsb5GB', 'snippet': {'videoId': 'dzYiEk8gHAo', 'textDisplay': '@Gabriel Não é preconceito, é conceito vivido, observado e constatado! Nordeste tem grande valor para o Brasil, assim com todo nosso território, o que muitos entendem como preconceito é as nossas críticas à região mais pobre do Brasil que depende do Sudeste para não entrar em colapso, a 30 anos vive no mesmo curso, vivendo de promessas fáceis que vai chover picanha e que ser servidor público é a única forma de ter uma vida confortável...', 'textOriginal': '@Gabriel Não é preconceito, é conceito vivido, observado e constatado! Nordeste tem grande valor para o Brasil, assim com todo nosso território, o que muitos entendem como preconceito é as nossas críticas à região mais pobre do Brasil que depende do Sudeste para não entrar em colapso, a 30 anos vive no mesmo curso, vivendo de promessas fáceis que vai chover picanha e que ser servidor público é a única forma de ter uma vida confortável...', 'parentId': 'Ugz9Y4W7A55dJ9DLYFF4AaABAg', 'authorDisplayName': 'Natanael Junior', 'authorProfileImageUrl': 'https://yt3.ggpht.com/ytc/AGIKgqMNgBPkvaMGKGMjVAnUcSRBBE0lnYaHCjME5lZs1g=s48-c-k-c0x00ffffff-no-rj', 'authorChannelUrl': 'http://www.youtube.com/channel/UCz327PTUQv8RjPJFQyNNGRw', 'authorChannelId': {'value': 'UCz327PTUQv8RjPJFQyNNGRw'}, 'canRate': True, 'viewerRating': 'none', 'likeCount': 2, 'publishedAt': '2022-10-06T18:34:31Z', 'updatedAt': '2022-10-06T18:34:31Z'}}]}",UCJ1P3Q78Ukn91QNLkgChcDw,2022-10-06T17:39:39Z,BORA VIRAR!!! GANHE 1 VOTO!!! #VIRADA22,,2023-06-08 11:26:38.206724
youtube#commentThread,bhhCubNiJHSCM2oWEnAPFX82ME0,UgxSfeI8KBBZ_7KTfJB4AaABAg,"{'videoId': 'dzYiEk8gHAo', 'topLevelComment': {'kind': 'youtube#comment', 'etag': 'u9eLb8xW25r3q4d_T3-5Xwi6rJ8', 'id': 'UgxSfeI8KBBZ_7KTfJB4AaABAg', 'snippet': {'videoId': 'dzYiEk8gHAo', 'textDisplay': 'Votei no Ciro agora vou votar no Lula', 'textOriginal': 'Votei no Ciro agora vou votar no Lula', 'authorDisplayName': 'SPFC lima', 'authorProfileImageUrl': 'https://yt3.ggpht.com/p1uhUnSLgFtZHm5yO_X4nIzjANHm268bVHFdiUwRt_kVwctVQk-nCV5rSZNNJ6BrXPTo3u5ldQ=s48-c-k-c0x00ffffff-no-rj', 'authorChannelUrl': 'http://www.youtube.com/channel/UCrI_xgtpYn0BwNkTiyK9qxQ', 'authorChannelId': {'value': 'UCrI_xgtpYn0BwNkTiyK9qxQ'}, 'canRate': True, 'viewerRating': 'none', 'likeCount': 12, 'publishedAt': '2022-10-06T17:38:18Z', 'updatedAt': '2022-10-06T17:38:18Z'}}, 'canReply': True, 'totalReplyCount': 0, 'isPublic': True}",,UCrI_xgtpYn0BwNkTiyK9qxQ,2022-10-06T17:38:18Z,Votei no Ciro agora vou votar no Lula,,2023-06-08 11:26:38.206724
youtube#commentThread,HVuVHBYkElF76ngb6GEuMlw5IeQ,UgzQZiPfAd1pUx8nYFN4AaABAg,"{'videoId': 'dzYiEk8gHAo', 'topLevelComment': {'kind': 'youtube#comment', 'etag': 'Cpms5swLhcsDAvf3McVNnKsd7eY', 'id': 'UgzQZiPfAd1pUx8nYFN4AaABAg', 'snippet': {'videoId': 'dzYiEk8gHAo', 'textDisplay': '22', 'textOriginal': '22', 'authorDisplayName': 'Jonathas micael', 'authorProfileImageUrl': 'https://yt3.ggpht.com/ytc/AGIKgqMHbtrfdkOj_nO7-xiS1BGLjz6Dnh6D2hEe3SI4ag=s48-c-k-c0x00ffffff-no-rj', 'authorChannelUrl': 'http://www.youtube.com/channel/UCJt-eDLc6qqfknXP4ablCbg', 'authorChannelId': {'value': 'UCJt-eDLc6qqfknXP4ablCbg'}, 'canRate': True, 'viewerRating': 'none', 'likeCount': 5, 'publishedAt': '2022-10-06T17:33:57Z', 'updatedAt': '2022-10-06T17:33:57Z'}}, 'canReply': True, 'totalReplyCount': 0, 'isPublic': True}",,UCJt-eDLc6qqfknXP4ablCbg,2022-10-06T17:33:57Z,22,,2023-06-08 11:26:38.206724
youtube#commentThread,ZuxwSmh7ihXoDD72FT4uD5oKx8o,UgyQMyICKFs47Pm7pAd4AaABAg,"{'videoId': 'dzYiEk8gHAo', 'topLevelComment': {'kind': 'youtube#comment', 'etag': 'JuvNQ65a3ccky-soARwOEX5M9hQ', 'id': 'UgyQMyICKFs47Pm7pAd4AaABAg', 'snippet': {'videoId': 'dzYiEk8gHAo', 'textDisplay': 'Lula lula lula ,Fora Bolsonaro fora', 'textOriginal': 'Lula lula lula ,Fora Bolsonaro fora', 'authorDisplayName': 'Raimundo Alves', 'authorProfileImageUrl': 'https://yt3.ggpht.com/ytc/AGIKgqPWOOvGKw7Lb8b7yweG92K-4AE34dU2WZy0MVTrW2Vcj2Cgt3u3f-VT_pVutJFf=s48-c-k-c0x00ffffff-no-rj', 'authorChannelUrl': 'http://www.youtube.com/channel/UCXIRKwYM2MECmqOwnNzK1xA', 'authorChannelId': {'value': 'UCXIRKwYM2MECmqOwnNzK1xA'}, 'canRate': True, 'viewerRating': 'none', 'likeCount': 9, 'publishedAt': '2022-10-06T17:32:59Z', 'updatedAt': '2022-10-06T17:32:59Z'}}, 'canReply': True, 'totalReplyCount': 0, 'isPublic': True}",,UCXIRKwYM2MECmqOwnNzK1xA,2022-10-06T17:32:59Z,"Lula lula lula ,Fora Bolsonaro fora",,2023-06-08 11:26:38.206724
youtube#commentThread,ZDuxp2lXB638UKMGjq6V8fz3alQ,Ugz6vSfc4qMp-XZnYRB4AaABAg,"{'videoId': 'dzYiEk8gHAo', 'topLevelComment': {'kind': 'youtube#comment', 'etag': 'ah3e0Jy5sM2o_PBhmIKwlGbaYvE', 'id': 'Ugz6vSfc4qMp-XZnYRB4AaABAg', 'snippet': {'videoId': 'dzYiEk8gHAo', 'textDisplay': '22🇧🇷', 'textOriginal': '22🇧🇷', 'authorDisplayName': 'Canal do João', 'authorProfileImageUrl': 'https://yt3.ggpht.com/xE1pPRmkg_r6DBXrS0jXNaPd_T7WIMm3YDLrm0cWciYFUqSbQ4OUeMefTheGfuLyusjE-kBqmDw=s48-c-k-c0x00ffffff-no-rj', 'authorChannelUrl': 'http://www.youtube.com/channel/UCZJR9w9IlEInQvYeALaZ0nw', 'authorChannelId': {'value': 'UCZJR9w9IlEInQvYeALaZ0nw'}, 'canRate': True, 'viewerRating': 'none', 'likeCount': 7, 'publishedAt': '2022-10-06T17:31:50Z', 'updatedAt': '2022-10-06T17:31:50Z'}}, 'canReply': True, 'totalReplyCount': 0, 'isPublic': True}",,UCZJR9w9IlEInQvYeALaZ0nw,2022-10-06T17:31:50Z,22🇧🇷,,2023-06-08 11:26:38.206724
youtube#commentThread,6Ydp1rtWLKNwHrQUVe0cpBh8uHg,UgxExD8QZ1MhJOGzbEt4AaABAg,"{'videoId': 'dzYiEk8gHAo', 'topLevelComment': {'kind': 'youtube#comment', 'etag': '7Y1TZxdA9kXwydmouv-cBpEfILo', 'id': 'UgxExD8QZ1MhJOGzbEt4AaABAg', 'snippet': {'videoId': 'dzYiEk8gHAo', 'textDisplay': 'Chama no 13 pai tá on', 'textOriginal': 'Chama no 13 pai tá on', 'authorDisplayName': 'Jonas Correa', 'authorProfileImageUrl': 'https://yt3.ggpht.com/ytc/AGIKgqNqUMmWStO9ev8vQkawxPFJCuXr12PF3bYI9Q=s48-c-k-c0x00ffffff-no-rj', 'authorChannelUrl': 'http://www.youtube.com/channel/UC3oiiMImOq3GL6mNejGEoYw', 'authorChannelId': {'value': 'UC3oiiMImOq3GL6mNejGEoYw'}, 'canRate': True, 'viewerRating': 'none', 'likeCount': 16, 'publishedAt': '2022-10-06T17:31:26Z', 'updatedAt': '2022-10-06T17:31:26Z'}}, 'canReply': True, 'totalReplyCount': 2, 'isPublic': True}","{'comments': [{'kind': 'youtube#comment', 'etag': 'sZjt1M1Yauk2HtDscuU6RluQjOo', 'id': 'UgxExD8QZ1MhJOGzbEt4AaABAg.9gqsNOHYTYf9gru1pjuSVi', 'snippet': {'videoId': 'dzYiEk8gHAo', 'textDisplay': '22 22 22 22 22', 'textOriginal': '22 22 22 22 22', 'parentId': 'UgxExD8QZ1MhJOGzbEt4AaABAg', 'authorDisplayName': 'Joiciane VIEIRA DOS SANTOS', 'authorProfileImageUrl': 'https://yt3.ggpht.com/ytc/AGIKgqPJnzftas_CA1N60g19JJ3-7rXEKHmrAFxQQF4p_g=s48-c-k-c0x00ffffff-no-rj', 'authorChannelUrl': 'http://www.youtube.com/channel/UCC1zaNe7STydXiuhBP0WUXw', 'authorChannelId': {'value': 'UCC1zaNe7STydXiuhBP0WUXw'}, 'canRate': True, 'viewerRating': 'none', 'likeCount': 0, 'publishedAt': '2022-10-07T03:05:13Z', 'updatedAt': '2022-10-07T03:05:13Z'}}, {'kind': 'youtube#comment', 'etag': 'U7yh34zivGsCQLjQ2BLXAMyzC8U', 'id': 'UgxExD8QZ1MhJOGzbEt4AaABAg.9gqsNOHYTYf9gqu4VPAPoz', 'snippet': {'videoId': 'dzYiEk8gHAo', 'textDisplay': 'É nois Lulinha!', 'textOriginal': 'É nois Lulinha!', 'parentId': 'UgxExD8QZ1MhJOGzbEt4AaABAg', 'authorDisplayName': 'Gabriel', 'authorProfileImageUrl': 'https://yt3.ggpht.com/ytc/AGIKgqP4u-FDDvZl4EyT20ioEpddv-FvTcdQ4yWQkNBmlw=s48-c-k-c0x00ffffff-no-rj', 'authorChannelUrl': 'http://www.youtube.com/channel/UCW1JgYp1f5QG5UhukdBskag', 'authorChannelId': {'value': 'UCW1JgYp1f5QG5UhukdBskag'}, 'canRate': True, 'viewerRating': 'none', 'likeCount': 1, 'publishedAt': '2022-10-06T17:46:20Z', 'updatedAt': '2022-10-06T17:46:20Z'}}]}",UC3oiiMImOq3GL6mNejGEoYw,2022-10-06T17:31:26Z,Chama no 13 pai tá on,,2023-06-08 11:26:38.206724
