kind,etag,id,snippet,replies,authorChannelId,publishedAt,textOriginal,nextPageToken,extraction_date
youtube#commentThread,9jne3RM5ZzqUYk0PBkTVyUTLSbE,Ugz3K6GEr50CyZ8ee3x4AaABAg,"{'videoId': 'dzYiEk8gHAo', 'topLevelComment': {'kind': 'youtube#comment', 'etag': '2f1PHNqNtK0RaneKcjUNW-I8qhU', 'id': 'Ugz3K6GEr50CyZ8ee3x4AaABAg', 'snippet': {'videoId': 'dzYiEk8gHAo', 'textDisplay': 'Eu sou 13 e lula', 'textOriginal': 'Eu sou 13 e lula', 'authorDisplayName': 'Raimundo Alves', 'authorProfileImageUrl': 'https://yt3.ggpht.com/ytc/AGIKgqPWOOvGKw7Lb8b7yweG92K-4AE34dU2WZy0MVTrW2Vcj2Cgt3u3f-VT_pVutJFf=s48-c-k-c0x00ffffff-no-rj', 'authorChannelUrl': 'http://www.youtube.com/channel/UCXIRKwYM2MECmqOwnNzK1xA', 'authorChannelId': {'value': 'UCXIRKwYM2MECmqOwnNzK1xA'}, 'canRate': True, 'viewerRating': 'none', 'likeCount': 17, 'publishedAt': '2022-10-06T17:31:26Z', 'updatedAt': '2022-10-06T17:31:26Z'}}, 'canReply': True, 'totalReplyCount': 1, 'isPublic': True}","{'comments': [{'kind': 'youtube#comment', 'etag': 'Ydp4hsZHTqjrbc7u8jaFITSWeYI', 'id': 'Ugz3K6GEr50CyZ8ee3x4AaABAg.9gqsNLZhjrL9gqwt97y1GL', 'snippet': {'videoId': 'dzYiEk8gHAo', 'textDisplay': 'Minha família também ♥️🇧🇷 13', 'textOriginal': 'Minha família também ♥️🇧🇷 13', 'parentId': 'Ugz3K6GEr50CyZ8ee3x4AaABAg', 'authorDisplayName': 'PÉRSIA HIPPIE', 'authorProfileImageUrl': 'https://yt3.ggpht.com/rzySveMCvhwJXqIVJzAp8THRQVcDTpKvXExfgUXBu9vAEyRfleTkE_-FE6ITdOExJqHG8l3j8C8=s48-c-k-c0x00ffffff-no-rj', 'authorChannelUrl': 'http://www.youtube.com/channel/UCHYNYR_-I-n5ss0Os7gDhWg', 'authorChannelId': {'value': 'UCHYNYR_-I-n5ss0Os7gDhWg'}, 'canRate': True, 'viewerRating': 'none', 'likeCount': 1, 'publishedAt': '2022-10-06T18:10:52Z', 'updatedAt': '2022-10-06T18:10:52Z'}}]}",UCXIRKwYM2MECmqOwnNzK1xA,2022-10-06T17:31:26Z,Eu sou 13 e lula,,2023-06-08 11:26:38.206724
youtube#commentThread,lxxml5MApy8qDBD7sudZdGZ67JU,UgyB4NfK8X3-pBbEb2p4AaABAg,"{'videoId': 'dzYiEk8gHAo', 'topLevelComment': {'kind': 'youtube#comment', 'etag': 'zCSHcNx3vKmS_9399Ywz6iy9vZU', 'id': 'UgyB4NfK8X3-pBbEb2p4AaABAg', 'snippet': {'videoId': 'dzYiEk8gHAo', 'textDisplay': 'O Eduardo  país  nunca  foi  esquerdalha  agora  virou  a banda  para o lado  errado, depois  não chora  quando  tiver  eleições', 'textOriginal': 'O Eduardo  país  nunca  foi  esquerdalha  agora  virou  a banda  para o lado  errado, depois  não chora  quando  tiver  eleições', 'authorDisplayName': 'Graca', 'authorProfileImageUrl': 'https://yt3.ggpht.com/ytc/AGIKgqM1Rer8iIzrbFkUb_3RVOJ-x5vF9acqVYMtsg=s48-c-k-c0x00ffffff-no-rj', 'authorChannelUrl': 'http://www.youtube.com/channel/UC6aRN42jeTbr2G-1g5rA_qA', 'authorChannelId': {'value': 'UC6aRN42jeTbr2G-1g5rA_qA'}, 'canRate': True, 'viewerRating': 'none', 'likeCount': 0, 'publishedAt': '2022-10-06T17:30:25Z', 'updatedAt': '2022-10-06T17:30:25Z'}}, 'canReply': True, 'totalReplyCount': 1, 'isPublic': True}","{'comments': [{'kind': 'youtube#comment', 'etag': 'M8kjr5AJ9cQIGTwDKmgACRk44_c', 'id': 'UgyB4NfK8X3-pBbEb2p4AaABAg.9gqsFu7RpFI9gqummxxWtm', 'snippet': {'videoId': 'dzYiEk8gHAo', 'textDisplay': 'Nunca foi ? 2003 a 2016 vc já era nascido ?', 'textOriginal': 'Nunca foi ? 2003 a 2016 vc já era nascido ?', 'parentId': 'UgyB4NfK8X3-pBbEb2p4AaABAg', 'authorDisplayName': 'Hiaggo Carvalho', 'authorProfileImageUrl': 'https://yt3.ggpht.com/1tpr3eLlWco1FiliQmzoYe6hly29523kjZZCkFK2f2xu8q0kSc2PnCGiz1wp4ZYWPsRNQ927rQ=s48-c-k-c0x00ffffff-no-rj', 'authorChannelUrl': 'http://www.youtube.com/channel/UCxKk4YCUJcSkvssUaupyPkQ', 'authorChannelId': {'value': 'UCxKk4YCUJcSkvssUaupyPkQ'}, 'canRate': True, 'viewerRating': 'none', 'likeCount': 0, 'publishedAt': '2022-10-06T17:52:31Z', 'updatedAt': '2022-10-06T17:52:31Z'}}]}",UC6aRN42jeTbr2G-1g5rA_qA,2022-10-06T17:30:25Z,"O Eduardo  país  nunca  foi  esquerdalha  agora  virou  a banda  para o lado  errado, depois  não chora  quando  tiver  eleições",,2023-06-08 11:26:38.206724
youtube#commentThread,fZl7W44a0WxPqv0pX1O5OjmRSBU,UgyJks28sfmeUsuZUoJ4AaABAg,"{'videoId': 'dzYiEk8gHAo', 'topLevelComment': {'kind': 'youtube#comment', 'etag': 'KYeErdHJVJc6349K8dceUwRKIxA', 'id': 'UgyJks28sfmeUsuZUoJ4AaABAg', 'snippet': {'videoId': 'dzYiEk8gHAo', 'textDisplay': 'Lula  não sai  nas ruas  tudo  e lugar  fechado  como  pode  ser presidente  uma pessoa  que é chamada  de ladrão  onde  vai', 'textOriginal': 'Lula  não sai  nas ruas  tudo  e lugar  fechado  como  pode  ser presidente  uma pessoa  que é chamada  de ladrão  onde  vai', 'authorDisplayName': 'Graca', 'authorProfileImageUrl': 'https://yt3.ggpht.com/ytc/AGIKgqM1Rer8iIzrbFkUb_3RVOJ-x5vF9acqVYMtsg=s48-c-k-c0x00ffffff-no-rj', 'authorChannelUrl': 'http://www.youtube.com/channel/UC6aRN42jeTbr2G-1g5rA_qA', 'authorChannelId': {'value': 'UC6aRN42jeTbr2G-1g5rA_qA'}, 'canRate': True, 'viewerRating': 'none', 'likeCount': 1, 'publishedAt': '2022-10-06T17:28:12Z', 'updatedAt': '2022-10-06T17:28:12Z'}}, 'canReply': True, 'totalReplyCount': 0, 'isPublic': True}",,UC6aRN42jeTbr2G-1g5rA_qA,2022-10-06T17:28:12Z,Lula  não sai  nas ruas  tudo  e lugar  fechado  como  pode  ser presidente  uma pessoa  que é chamada  de ladrão  onde  vai,,2023-06-08 11:26:38.206724
youtube#commentThread,Pk0ww5FCM58cYM1Ci6jHL7CvfPM,UgzImzr37KdbS-92cPR4AaABAg,"{'videoId': 'dzYiEk8gHAo', 'topLevelComment': {'kind': 'youtube#comment', 'etag': '4ICABrUmTZswLw8w8FmM5HerB2I', 'id': 'UgzImzr37KdbS-92cPR4AaABAg', 'snippet': {'videoId': 'dzYiEk8gHAo', 'textDisplay': 'Lula Lula Lula Lula Lula Lula Lula Lula Lula Lula Lula Lula Lula livre no primeiro turno Lula Lula Lula Lula Lula Lula Lula Lula Lula Lula Lula Lula Lula', 'textOriginal': 'Lula Lula Lula Lula Lula Lula Lula Lula Lula Lula Lula Lula Lula livre no primeiro turno Lula Lula Lula Lula Lula Lula Lula Lula Lula Lula Lula Lula Lula', 'authorDisplayName': 'ailton jose barroso barroso', 'authorProfileImageUrl': 'https://yt3.ggpht.com/ytc/AGIKgqMK9Y9N3JT1_J4XnFNU8B5g4iqOkAVtj6RCf333_UNXDshVNd6OzLL9LzDaqugu=s48-c-k-c0x00ffffff-no-rj', 'authorChannelUrl': 'http://www.youtube.com/channel/UCI_h1njXYJ8baN35EUjN6hw', 'authorChannelId': {'value': 'UCI_h1njXYJ8baN35EUjN6hw'}, 'canRate': True, 'viewerRating': 'none', 'likeCount': 9, 'publishedAt': '2022-10-06T17:24:46Z', 'updatedAt': '2022-10-06T17:24:46Z'}}, 'canReply': True, 'totalReplyCount': 0, 'isPublic': True}",,UCI_h1njXYJ8baN35EUjN6hw,2022-10-06T17:24:46Z,Lula Lula Lula Lula Lula Lula Lula Lula Lula Lula Lula Lula Lula livre no primeiro turno Lula Lula Lula Lula Lula Lula Lula Lula Lula Lula Lula Lula Lula,,2023-06-08 11:26:38.206724
youtube#commentThread,7Y_2t9SHr3nVbtkQ-yv_q3ff8K8,Ugx7OPt-zywRVwUu_zZ4AaABAg,"{'videoId': 'dzYiEk8gHAo', 'topLevelComment': {'kind': 'youtube#comment', 'etag': 'dJceB7xl4brvVKIZbbFgNPetQwc', 'id': 'Ugx7OPt-zywRVwUu_zZ4AaABAg', 'snippet': {'videoId': 'dzYiEk8gHAo', 'textDisplay': 'JAIR MAÇONARO <br>está certo  !!!!!<br>criou uma  seita de ovelhas alienadas do cabresto ungido. <br>tenho  familiares quê se informam através de grupos de Whatsapp extrmistas...<br>claro  !!!!<br>acreditaram  na sala escura do TSE. <br>acreditaram em cloroquina mófada guéla á baixo né?????<br>acreditam que a terra é redonda..<br>olhem o nível da MEDIOCRIDADE!!', 'textOriginal': 'JAIR MAÇONARO \\nestá certo  !!!!!\\ncriou uma  seita de ovelhas alienadas do cabresto ungido. \\ntenho  familiares quê se informam através de grupos de Whatsapp extrmistas...\\nclaro  !!!!\\nacreditaram  na sala escura do TSE. \\nacreditaram em cloroquina mófada guéla á baixo né?????\\nacreditam que a terra é redonda..\\nolhem o nível da MEDIOCRIDADE!!', 'authorDisplayName': 'Regina Ropelato', 'authorProfileImageUrl': 'https://yt3.ggpht.com/ytc/AGIKgqMCmWnQ-5CD2J30VLjZrlZWUoWL8u8NRCp5wA=s48-c-k-c0x00ffffff-no-rj', 'authorChannelUrl': 'http://www.youtube.com/channel/UCi2rVoMJRdqhg6G87GEt10Q', 'authorChannelId': {'value': 'UCi2rVoMJRdqhg6G87GEt10Q'}, 'canRate': True, 'viewerRating': 'none', 'likeCount': 0, 'publishedAt': '2022-10-06T17:23:38Z', 'updatedAt': '2022-10-06T17:23:38Z'}}, 'canReply': True, 'totalReplyCount': 0, 'isPublic': True}",,UCi2rVoMJRdqhg6G87GEt10Q,2022-10-06T17:23:38Z,"JAIR MAÇONARO 
está certo  !!!!!
criou uma  seita de ovelhas alienadas do cabresto ungido. 
tenho  familiares quê se informam através de grupos de Whatsapp extrmistas...
claro  !!!!
acreditaram  na sala escura do TSE. 
acreditaram em cloroquina mófada guéla á baixo né?????
acreditam que a terra é redonda..
olhem o nível da MEDIOCRIDADE!!",,2023-06-08 11:26:38.206724
youtube#commentThread,cqZ6ZTT3D-MK05hIVO8MBhiEzeg,Ugy0aue4s3xwYXCG-nN4AaABAg,"{'videoId': 'dzYiEk8gHAo', 'topLevelComment': {'kind': 'youtube#comment', 'etag': 'jLwTLacimQr1LCaTPXElDs5Rx6g', 'id': 'Ugy0aue4s3xwYXCG-nN4AaABAg', 'snippet': {'videoId': 'dzYiEk8gHAo', 'textDisplay': '<a href=""http://www.youtube.com/results?search_query=%23fechacombolsonaro2022"">#FECHACOMBOLSONARO2022</a>🇧🇷', 'textOriginal': '#FECHACOMBOLSONARO2022🇧🇷', 'authorDisplayName': 'Jaimison Lopes', 'authorProfileImageUrl': 'https://yt3.ggpht.com/ytc/AGIKgqM4rB1s4BE7ynqK-wIRllzw99vtT47TG8jwgqD2Bw=s48-c-k-c0x00ffffff-no-rj', 'authorChannelUrl': 'http://www.youtube.com/channel/UCTDy4Lxt6YGjvBb7oyauFPg', 'authorChannelId': {'value': 'UCTDy4Lxt6YGjvBb7oyauFPg'}, 'canRate': True, 'viewerRating': 'none', 'likeCount': 4, 'publishedAt': '2022-10-06T17:22:04Z', 'updatedAt': '2022-10-06T17:22:04Z'}}, 'canReply': True, 'totalReplyCount': 0, 'isPublic': True}",,UCTDy4Lxt6YGjvBb7oyauFPg,2022-10-06T17:22:04Z,#FECHACOMBOLSONARO2022🇧🇷,,2023-06-08 11:26:38.206724
youtube#commentThread,cHFM45b0PkNtH7SzbxA_s89am_s,UgydHbiidwlXfdpz3up4AaABAg,"{'videoId': 'dzYiEk8gHAo', 'topLevelComment': {'kind': 'youtube#comment', 'etag': 'ILvbui4xG97uZVvvuhcuCJTEpzw', 'id': 'UgydHbiidwlXfdpz3up4AaABAg', 'snippet': {'videoId': 'dzYiEk8gHAo', 'textDisplay': 'Tem pouco voto sobrando.... E Lula tem 6200  na frente....', 'textOriginal': 'Tem pouco voto sobrando.... E Lula tem 6200  na frente....', 'authorDisplayName': 'wander almeidaaraujo', 'authorProfileImageUrl': 'https://yt3.ggpht.com/ytc/AGIKgqMwLnpQgkJfmOiOGsbnF0v2T27p60fKj3bxpGp929I=s48-c-k-c0x00ffffff-no-rj', 'authorChannelUrl': 'http://www.youtube.com/channel/UCmkp7WSObvsspG-A2lRPIRg', 'authorChannelId': {'value': 'UCmkp7WSObvsspG-A2lRPIRg'}, 'canRate': True, 'viewerRating': 'none', 'likeCount': 17, 'publishedAt': '2022-10-06T17:20:39Z', 'updatedAt': '2022-10-06T17:20:39Z'}}, 'canReply': True, 'totalReplyCount': 9, 'isPublic': True}","{'comments': [{'kind': 'youtube#comment', 'etag': 'Vw_tiGvPaIf4KKwL5WcARTsbzKo', 'id': 'UgydHbiidwlXfdpz3up4AaABAg.9gqr8R4lllD9grE3yUmpFX', 'snippet': {'videoId': 'dzYiEk8gHAo', 'textDisplay': '@Natanael Junior imagina eu ateu 3 diplomas..  lendo  chomoky  nietzsche  e schopenhauer  conversando com uma desgraça de krents lunáticos...', 'textOriginal': '@Natanael Junior imagina eu ateu 3 diplomas..  lendo  chomoky  nietzsche  e schopenhauer  conversando com uma desgraça de krents lunáticos...', 'parentId': 'UgydHbiidwlXfdpz3up4AaABAg', 'authorDisplayName': 'wander almeidaaraujo', 'authorProfileImageUrl': 'https://yt3.ggpht.com/ytc/AGIKgqMwLnpQgkJfmOiOGsbnF0v2T27p60fKj3bxpGp929I=s48-c-k-c0x00ffffff-no-rj', 'authorChannelUrl': 'http://www.youtube.com/channel/UCmkp7WSObvsspG-A2lRPIRg', 'authorChannelId': {'value': 'UCmkp7WSObvsspG-A2lRPIRg'}, 'canRate': True, 'viewerRating': 'none', 'likeCount': 0, 'publishedAt': '2022-10-06T20:49:46Z', 'updatedAt': '2022-10-06T20:49:46Z'}}, {'kind': 'youtube#comment', 'etag': 'dK7Vswx28WkqHYh81aZT_i0ugro', 'id': 'UgydHbiidwlXfdpz3up4AaABAg.9gqr8R4lllD9gr2YtI6oGW', 'snippet': {'videoId': 'dzYiEk8gHAo', 'textDisplay': '@Natanael Junior não ferrou nada não direitistas, apenas falei que não muda nada, e sim, todos sabem que a maior parte dos votos de Tebet, irá para Lula, nada está ganho, mas claro que só falta mais um pouquinho kkkkk boa sorte para o Naro, tirar os 6 milhões e mais um pouco! 🥱', 'textOriginal': '@Natanael Junior não ferrou nada não direitistas, apenas falei que não muda nada, e sim, todos sabem que a maior parte dos votos de Tebet, irá para Lula, nada está ganho, mas claro que só falta mais um pouquinho kkkkk boa sorte para o Naro, tirar os 6 milhões e mais um pouco! 🥱', 'parentId': 'UgydHbiidwlXfdpz3up4AaABAg', 'authorDisplayName': 'Emanuel Costa', 'authorProfileImageUrl': 'https://yt3.ggpht.com/jfAr5AX1Lpsqj3Ghvodaxw3qixGLeKZ5PSm759lJgpIZRufPv1A7-28S8ZEVYUaFgI9_Y1aSp-c=s48-c-k-c0x00ffffff-no-rj', 'authorChannelUrl': 'http://www.youtube.com/channel/UCmc4kMifDoqovGNlE1zSEXw', 'authorChannelId': {'value': 'UCmc4kMifDoqovGNlE1zSEXw'}, 'canRate': True, 'viewerRating': 'none', 'likeCount': 0, 'publishedAt': '2022-10-06T19:09:08Z', 'updatedAt': '2022-10-06T19:09:41Z'}}, {'kind': 'youtube#comment', 'etag': 'sQ2tINYw0twD15tRRllxxGTHHWs', 'id': 'UgydHbiidwlXfdpz3up4AaABAg.9gqr8R4lllD9gr29RjV9EM', 'snippet': {'videoId': 'dzYiEk8gHAo', 'textDisplay': '@Emanuel Costa Ué! Não disse que todos vão! Kkkk... Caraca, não é que a esquerda ferrou com a interpretação de texto de boa parte do povo...kkk', 'textOriginal': '@Emanuel Costa Ué! Não disse que todos vão! Kkkk... Caraca, não é que a esquerda ferrou com a interpretação de texto de boa parte do povo...kkk', 'parentId': 'UgydHbiidwlXfdpz3up4AaABAg', 'authorDisplayName': 'Natanael Junior', 'authorProfileImageUrl': 'https://yt3.ggpht.com/ytc/AGIKgqMNgBPkvaMGKGMjVAnUcSRBBE0lnYaHCjME5lZs1g=s48-c-k-c0x00ffffff-no-rj', 'authorChannelUrl': 'http://www.youtube.com/channel/UCz327PTUQv8RjPJFQyNNGRw', 'authorChannelId': {'value': 'UCz327PTUQv8RjPJFQyNNGRw'}, 'canRate': True, 'viewerRating': 'none', 'likeCount': 1, 'publishedAt': '2022-10-06T19:05:39Z', 'updatedAt': '2022-10-06T19:05:39Z'}}, {'kind': 'youtube#comment', 'etag': 'XOKlcy5fph3HyJW6k3h9uCbLkg8', 'id': 'UgydHbiidwlXfdpz3up4AaABAg.9gqr8R4lllD9gr1biio-mj', 'snippet': {'videoId': 'dzYiEk8gHAo', 'textDisplay': '@Natanael Junior E quem disse que todos que votaram no Zema, votará somente no Bolsonaro,  só porque ele tá pedindo? kkkk&#39;', 'textOriginal': ""@Natanael Junior E quem disse que todos que votaram no Zema, votará somente no Bolsonaro,  só porque ele tá pedindo? kkkk'"", 'parentId': 'UgydHbiidwlXfdpz3up4AaABAg', 'authorDisplayName': 'Emanuel Costa', 'authorProfileImageUrl': 'https://yt3.ggpht.com/jfAr5AX1Lpsqj3Ghvodaxw3qixGLeKZ5PSm759lJgpIZRufPv1A7-28S8ZEVYUaFgI9_Y1aSp-c=s48-c-k-c0x00ffffff-no-rj', 'authorChannelUrl': 'http://www.youtube.com/channel/UCmc4kMifDoqovGNlE1zSEXw', 'authorChannelId': {'value': 'UCmc4kMifDoqovGNlE1zSEXw'}, 'canRate': True, 'viewerRating': 'none', 'likeCount': 0, 'publishedAt': '2022-10-06T19:00:55Z', 'updatedAt': '2022-10-06T19:00:55Z'}}, {'kind': 'youtube#comment', 'etag': 'yUAYVw4uNSRfAd-LOMYsbT8VCWk', 'id': 'UgydHbiidwlXfdpz3up4AaABAg.9gqr8R4lllD9gr-qROKQsG', 'snippet': {'videoId': 'dzYiEk8gHAo', 'textDisplay': '@wander almeidaaraujo  7 pessoas da minha família que discordam de ti, mas confesso que dependo do nível mental da pessoa, falar que vai chover picanha ajuda...kkkk', 'textOriginal': '@wander almeidaaraujo  7 pessoas da minha família que discordam de ti, mas confesso que dependo do nível mental da pessoa, falar que vai chover picanha ajuda...kkkk', 'parentId': 'UgydHbiidwlXfdpz3up4AaABAg', 'authorDisplayName': 'Natanael Junior', 'authorProfileImageUrl': 'https://yt3.ggpht.com/ytc/AGIKgqMNgBPkvaMGKGMjVAnUcSRBBE0lnYaHCjME5lZs1g=s48-c-k-c0x00ffffff-no-rj', 'authorChannelUrl': 'http://www.youtube.com/channel/UCz327PTUQv8RjPJFQyNNGRw', 'authorChannelId': {'value': 'UCz327PTUQv8RjPJFQyNNGRw'}, 'canRate': True, 'viewerRating': 'none', 'likeCount': 2, 'publishedAt': '2022-10-06T18:45:27Z', 'updatedAt': '2022-10-06T18:46:03Z'}}]}",UCmkp7WSObvsspG-A2lRPIRg,2022-10-06T17:20:39Z,Tem pouco voto sobrando.... E Lula tem 6200  na frente....,,2023-06-08 11:26:38.206724
