kind,etag,id,snippet,replies,authorChannelId,publishedAt,textOriginal,nextPageToken,extraction_date
youtube#commentThread,zPa4dMY3YwclV8CKjY_tjpsFsLM,UgzLZaq6a5PfGnnPdEp4AaABAg,"{'videoId': 'Fz0PCYu4hJg', 'topLevelComment': {'kind': 'youtube#comment', 'etag': 'eV7zb3eqTPyuaQXFp1_jjc-KSOY', 'id': 'UgzLZaq6a5PfGnnPdEp4AaABAg', 'snippet': {'videoId': 'Fz0PCYu4hJg', 'textDisplay': 'Qual rejeição seus hipócritas', 'textOriginal': 'Qual rejeição seus hipócritas', 'authorDisplayName': 'Alberto SC', 'authorProfileImageUrl': 'https://yt3.ggpht.com/ytc/AGIKgqMk6xPVbT_X4oyBBVsIhWKxBgg5Cw_Orr6fyb9nlA=s48-c-k-c0x00ffffff-no-rj', 'authorChannelUrl': 'http://www.youtube.com/channel/UCRsvJPHt9z4jbydlY67ub_Q', 'authorChannelId': {'value': 'UCRsvJPHt9z4jbydlY67ub_Q'}, 'canRate': True, 'viewerRating': 'none', 'likeCount': 0, 'publishedAt': '2023-02-13T11:28:40Z', 'updatedAt': '2023-02-13T11:28:40Z'}}, 'canReply': True, 'totalReplyCount': 0, 'isPublic': True}",,UCRsvJPHt9z4jbydlY67ub_Q,2023-02-13T11:28:40Z,Qual rejeição seus hipócritas,,2023-06-08 11:07:43.966008
youtube#commentThread,wJYxkjD5QqTm03A15jwPlkgm16E,UgzHR54XZJ4iT08R_Pt4AaABAg,"{'videoId': 'Fz0PCYu4hJg', 'topLevelComment': {'kind': 'youtube#comment', 'etag': 'ghza0lxvxeWD9T4lhOao69hsM3g', 'id': 'UgzHR54XZJ4iT08R_Pt4AaABAg', 'snippet': {'videoId': 'Fz0PCYu4hJg', 'textDisplay': 'Tem q ficar de olho na estrada , cuidado com o mata murro .', 'textOriginal': 'Tem q ficar de olho na estrada , cuidado com o mata murro .', 'authorDisplayName': 'AMAURY PESCADOR INVENTOR', 'authorProfileImageUrl': 'https://yt3.ggpht.com/2TYsIVVd0XuMtpl8r_xL57unjKK9TcjP35u0qk7tTmtWzIJElRMm5aRgOYvqM5u2ED66aKY_=s48-c-k-c0x00ffffff-no-rj', 'authorChannelUrl': 'http://www.youtube.com/channel/UCOMFybcxGUG0JoVhSsX70RQ', 'authorChannelId': {'value': 'UCOMFybcxGUG0JoVhSsX70RQ'}, 'canRate': True, 'viewerRating': 'none', 'likeCount': 0, 'publishedAt': '2022-10-13T12:37:19Z', 'updatedAt': '2022-10-13T12:37:19Z'}}, 'canReply': True, 'totalReplyCount': 0, 'isPublic': True}",,UCOMFybcxGUG0JoVhSsX70RQ,2022-10-13T12:37:19Z,"Tem q ficar de olho na estrada , cuidado com o mata murro .",,2023-06-08 11:07:43.966008
youtube#commentThread,pU6r63EkLu1470itlO1wYfBEoks,Ugy7O1F3Q_lj-zLH21N4AaABAg,"{'videoId': 'Fz0PCYu4hJg', 'topLevelComment': {'kind': 'youtube#comment', 'etag': 'Bje8spYNZcv1ohv0KhLaOGjZVbQ', 'id': 'Ugy7O1F3Q_lj-zLH21N4AaABAg', 'snippet': {'videoId': 'Fz0PCYu4hJg', 'textDisplay': 'Até o Lula ficou com medo do vermelho do PT!!', 'textOriginal': 'Até o Lula ficou com medo do vermelho do PT!!', 'authorDisplayName': 'Adriana Lima', 'authorProfileImageUrl': 'https://yt3.ggpht.com/vF0U4oI5_w911q1IpS7so-lTIgAvB_sVbgbX_BdQg_Q1AFkrHXNBrQ4AXp6D9yoHq4zHqKJBk58=s48-c-k-c0x00ffffff-no-rj', 'authorChannelUrl': 'http://www.youtube.com/channel/UCxDP2_93VDaXjajhF0Z5XdQ', 'authorChannelId': {'value': 'UCxDP2_93VDaXjajhF0Z5XdQ'}, 'canRate': True, 'viewerRating': 'none', 'likeCount': 0, 'publishedAt': '2022-10-13T12:06:53Z', 'updatedAt': '2022-10-13T12:06:53Z'}}, 'canReply': True, 'totalReplyCount': 0, 'isPublic': True}",,UCxDP2_93VDaXjajhF0Z5XdQ,2022-10-13T12:06:53Z,Até o Lula ficou com medo do vermelho do PT!!,,2023-06-08 11:07:43.966008
youtube#commentThread,CAm6BlU3R24vSpYldf1uYZ8TRIQ,UgyLFY-urLk47Hfmytd4AaABAg,"{'videoId': 'Fz0PCYu4hJg', 'topLevelComment': {'kind': 'youtube#comment', 'etag': '0S0vBz3p3Rv9nitCXcLKIrIWvLk', 'id': 'UgyLFY-urLk47Hfmytd4AaABAg', 'snippet': {'videoId': 'Fz0PCYu4hJg', 'textDisplay': 'Deus no comando, ele sabe de todas as coisas!!', 'textOriginal': 'Deus no comando, ele sabe de todas as coisas!!', 'authorDisplayName': 'Adriana Lima', 'authorProfileImageUrl': 'https://yt3.ggpht.com/vF0U4oI5_w911q1IpS7so-lTIgAvB_sVbgbX_BdQg_Q1AFkrHXNBrQ4AXp6D9yoHq4zHqKJBk58=s48-c-k-c0x00ffffff-no-rj', 'authorChannelUrl': 'http://www.youtube.com/channel/UCxDP2_93VDaXjajhF0Z5XdQ', 'authorChannelId': {'value': 'UCxDP2_93VDaXjajhF0Z5XdQ'}, 'canRate': True, 'viewerRating': 'none', 'likeCount': 1, 'publishedAt': '2022-10-13T12:02:33Z', 'updatedAt': '2022-10-13T12:02:33Z'}}, 'canReply': True, 'totalReplyCount': 0, 'isPublic': True}",,UCxDP2_93VDaXjajhF0Z5XdQ,2022-10-13T12:02:33Z,"Deus no comando, ele sabe de todas as coisas!!",,2023-06-08 11:07:43.966008
youtube#commentThread,OM0j0pZfMZwF6zDGtfKDsuEbMik,UgyyUNIC3J2bUcsj0xR4AaABAg,"{'videoId': 'Fz0PCYu4hJg', 'topLevelComment': {'kind': 'youtube#comment', 'etag': '946MVhjN3KV-z9VamtlJhjd20RM', 'id': 'UgyyUNIC3J2bUcsj0xR4AaABAg', 'snippet': {'videoId': 'Fz0PCYu4hJg', 'textDisplay': '🇧🇷🇧🇷🇧🇷🇧🇷🇧🇷🇧🇷', 'textOriginal': '🇧🇷🇧🇷🇧🇷🇧🇷🇧🇷🇧🇷', 'authorDisplayName': 'Adriana Lima', 'authorProfileImageUrl': 'https://yt3.ggpht.com/vF0U4oI5_w911q1IpS7so-lTIgAvB_sVbgbX_BdQg_Q1AFkrHXNBrQ4AXp6D9yoHq4zHqKJBk58=s48-c-k-c0x00ffffff-no-rj', 'authorChannelUrl': 'http://www.youtube.com/channel/UCxDP2_93VDaXjajhF0Z5XdQ', 'authorChannelId': {'value': 'UCxDP2_93VDaXjajhF0Z5XdQ'}, 'canRate': True, 'viewerRating': 'none', 'likeCount': 0, 'publishedAt': '2022-10-13T12:01:48Z', 'updatedAt': '2022-10-13T12:01:48Z'}}, 'canReply': True, 'totalReplyCount': 0, 'isPublic': True}",,UCxDP2_93VDaXjajhF0Z5XdQ,2022-10-13T12:01:48Z,🇧🇷🇧🇷🇧🇷🇧🇷🇧🇷🇧🇷,,2023-06-08 11:07:43.966008
youtube#commentThread,oqmOl4EX8wPIT8CBiw2I0TeMd0k,UgydypCVfgc_PjOUdmx4AaABAg,"{'videoId': 'Fz0PCYu4hJg', 'topLevelComment': {'kind': 'youtube#comment', 'etag': 'IUaEYj9I53Gwk3cc97r7yV41Mbk', 'id': 'UgydypCVfgc_PjOUdmx4AaABAg', 'snippet': {'videoId': 'Fz0PCYu4hJg', 'textDisplay': 'A Daniela é uma ótima profissional isso é inegavel ! Porém quando se trata de politica deixa a desejar É nítido a repulsa dela pela direita Ela deveria ser imparcial ou pelo menos tentar ñ transparecer q é apoiadora do Luladrão', 'textOriginal': 'A Daniela é uma ótima profissional isso é inegavel ! Porém quando se trata de politica deixa a desejar É nítido a repulsa dela pela direita Ela deveria ser imparcial ou pelo menos tentar ñ transparecer q é apoiadora do Luladrão', 'authorDisplayName': 'Mito da direita', 'authorProfileImageUrl': 'https://yt3.ggpht.com/10tnOAW5psDxx937ilpfeNFhbjEAAm_m2GJ7NSgwjegjktasCBMVPqhbEKTC3JsPJPuMBerj=s48-c-k-c0x00ffffff-no-rj', 'authorChannelUrl': 'http://www.youtube.com/channel/UCOhpRlr37dimxNqKhIxTEFg', 'authorChannelId': {'value': 'UCOhpRlr37dimxNqKhIxTEFg'}, 'canRate': True, 'viewerRating': 'none', 'likeCount': 0, 'publishedAt': '2022-10-13T08:15:57Z', 'updatedAt': '2022-10-13T08:15:57Z'}}, 'canReply': True, 'totalReplyCount': 0, 'isPublic': True}",,UCOhpRlr37dimxNqKhIxTEFg,2022-10-13T08:15:57Z,A Daniela é uma ótima profissional isso é inegavel ! Porém quando se trata de politica deixa a desejar É nítido a repulsa dela pela direita Ela deveria ser imparcial ou pelo menos tentar ñ transparecer q é apoiadora do Luladrão,,2023-06-08 11:07:43.966008
youtube#commentThread,x9RC-Oww1yIrInt9pYPNxilj9aE,UgzHoPwU1h3dbyMKowp4AaABAg,"{'videoId': 'Fz0PCYu4hJg', 'topLevelComment': {'kind': 'youtube#comment', 'etag': 'MTZAMFGWx5FgmsYA6Heew-_qJoA', 'id': 'UgzHoPwU1h3dbyMKowp4AaABAg', 'snippet': {'videoId': 'Fz0PCYu4hJg', 'textDisplay': 'Bozó é como o Satanás,  tudo o que diz é mentindo.<br>Se fala em Deus, é nentindo e  a mentira é símbolo do demônio; <br>Se fala em pátria,  é mentindo e um patriota jamais seria expulso do exercito por malandragem como ele foi;<br>Se fala em família,  é mentindo. Um bom pai de família, jamais ensinaria sua mulher e seus filhos a roubarem;<br> Se fala em honestidade,  é mentindo. Uma pessoa honesta, jamais precisaria de 100 anos de sigilo para esconder seus maus costumes;<br>Se pede desculpas,  é mentindo. Já o vi prometendo inúmeras vezes coisas que ele diz que faz e não faz.  É só lembrar das urnas eletrônicas e ver o que ele diz ensultando as instituições da República. <br>Em resumo: ele é aquilo que seus devotos querem, o MITO... o  MITOmaniaco...', 'textOriginal': 'Bozó é como o Satanás,  tudo o que diz é mentindo.\\nSe fala em Deus, é nentindo e  a mentira é símbolo do demônio; \\nSe fala em pátria,  é mentindo e um patriota jamais seria expulso do exercito por malandragem como ele foi;\\nSe fala em família,  é mentindo. Um bom pai de família, jamais ensinaria sua mulher e seus filhos a roubarem;\\n Se fala em honestidade,  é mentindo. Uma pessoa honesta, jamais precisaria de 100 anos de sigilo para esconder seus maus costumes;\\nSe pede desculpas,  é mentindo. Já o vi prometendo inúmeras vezes coisas que ele diz que faz e não faz.  É só lembrar das urnas eletrônicas e ver o que ele diz ensultando as instituições da República. \\nEm resumo: ele é aquilo que seus devotos querem, o MITO... o  MITOmaniaco...', 'authorDisplayName': 'oneide rocha', 'authorProfileImageUrl': 'https://yt3.ggpht.com/ytc/AGIKgqORxoVqYm6DzT_pkkfkjN-407cgYeFBSWEXBA-_nA=s48-c-k-c0x00ffffff-no-rj', 'authorChannelUrl': 'http://www.youtube.com/channel/UCH3L61CmZNn77_Y89bpFWAQ', 'authorChannelId': {'value': 'UCH3L61CmZNn77_Y89bpFWAQ'}, 'canRate': True, 'viewerRating': 'none', 'likeCount': 0, 'publishedAt': '2022-10-13T07:46:53Z', 'updatedAt': '2022-10-13T07:59:00Z'}}, 'canReply': True, 'totalReplyCount': 0, 'isPublic': True}",,UCH3L61CmZNn77_Y89bpFWAQ,2022-10-13T07:46:53Z,"Bozó é como o Satanás,  tudo o que diz é mentindo.
Se fala em Deus, é nentindo e  a mentira é símbolo do demônio; 
Se fala em pátria,  é mentindo e um patriota jamais seria expulso do exercito por malandragem como ele foi;
Se fala em família,  é mentindo. Um bom pai de família, jamais ensinaria sua mulher e seus filhos a roubarem;
 Se fala em honestidade,  é mentindo. Uma pessoa honesta, jamais precisaria de 100 anos de sigilo para esconder seus maus costumes;
Se pede desculpas,  é mentindo. Já o vi prometendo inúmeras vezes coisas que ele diz que faz e não faz.  É só lembrar das urnas eletrônicas e ver o que ele diz ensultando as instituições da República. 
Em resumo: ele é aquilo que seus devotos querem, o MITO... o  MITOmaniaco...",,2023-06-08 11:07:43.966008
youtube#commentThread,oJ2vuf8hG6pFMANp3MraDOd4j4M,UgzIXyqkpeodRM99BQJ4AaABAg,"{'videoId': 'Fz0PCYu4hJg', 'topLevelComment': {'kind': 'youtube#comment', 'etag': 'zIowY-D_kNzmj606tc6RnxXiJNg', 'id': 'UgzIXyqkpeodRM99BQJ4AaABAg', 'snippet': {'videoId': 'Fz0PCYu4hJg', 'textDisplay': 'E uma vergonha um jornalismo desse, como assim que o Bolsonaro tá batendo pesado?? Falar a verdade ??? Cadê a isenção ?? Jornalismo lixo.', 'textOriginal': 'E uma vergonha um jornalismo desse, como assim que o Bolsonaro tá batendo pesado?? Falar a verdade ??? Cadê a isenção ?? Jornalismo lixo.', 'authorDisplayName': 'Sr. Almeida', 'authorProfileImageUrl': 'https://yt3.ggpht.com/ytc/AGIKgqNbK1yRCjngqmVBguKI-G0h_YkCTNNcjI1LuJc2Mw=s48-c-k-c0x00ffffff-no-rj', 'authorChannelUrl': 'http://www.youtube.com/channel/UC5OZ91N0oAuyDPHFvNnZ2Iw', 'authorChannelId': {'value': 'UC5OZ91N0oAuyDPHFvNnZ2Iw'}, 'canRate': True, 'viewerRating': 'none', 'likeCount': 0, 'publishedAt': '2022-10-13T07:38:14Z', 'updatedAt': '2022-10-13T07:38:14Z'}}, 'canReply': True, 'totalReplyCount': 0, 'isPublic': True}",,UC5OZ91N0oAuyDPHFvNnZ2Iw,2022-10-13T07:38:14Z,"E uma vergonha um jornalismo desse, como assim que o Bolsonaro tá batendo pesado?? Falar a verdade ??? Cadê a isenção ?? Jornalismo lixo.",,2023-06-08 11:07:43.966008
youtube#commentThread,-Oog0o2WPzB9xzYe_1JhYOr7PXM,UgxNEumF-WEL5FGNN2t4AaABAg,"{'videoId': 'Fz0PCYu4hJg', 'topLevelComment': {'kind': 'youtube#comment', 'etag': 'ApZXov0yiJVDaxsXbut7w1kdtzM', 'id': 'UgxNEumF-WEL5FGNN2t4AaABAg', 'snippet': {'videoId': 'Fz0PCYu4hJg', 'textDisplay': 'Ambos estão com as mesma estratégia de aumentar a rejeição do oponente, mas ela já declarou voto e parcialidade com as gesticulações das mãos dela!  De um lado um vilão e do outro o dono das virtudes. Isso é maniqueísmo a luta do bem contra o mal. Mesmo assistindo o vídeo sem áudio sabe-se que o voto dela não é secreto.', 'textOriginal': 'Ambos estão com as mesma estratégia de aumentar a rejeição do oponente, mas ela já declarou voto e parcialidade com as gesticulações das mãos dela!  De um lado um vilão e do outro o dono das virtudes. Isso é maniqueísmo a luta do bem contra o mal. Mesmo assistindo o vídeo sem áudio sabe-se que o voto dela não é secreto.', 'authorDisplayName': 'Dillon', 'authorProfileImageUrl': 'https://yt3.ggpht.com/ytc/AGIKgqPnrko9xgG5_gHxKZXrH1SZxMJ6qIJDCeDGE6foKA=s48-c-k-c0x00ffffff-no-rj', 'authorChannelUrl': 'http://www.youtube.com/channel/UCYgaVUJifxSVXLhHKsFEJmQ', 'authorChannelId': {'value': 'UCYgaVUJifxSVXLhHKsFEJmQ'}, 'canRate': True, 'viewerRating': 'none', 'likeCount': 0, 'publishedAt': '2022-10-13T06:37:27Z', 'updatedAt': '2022-10-13T06:37:27Z'}}, 'canReply': True, 'totalReplyCount': 0, 'isPublic': True}",,UCYgaVUJifxSVXLhHKsFEJmQ,2022-10-13T06:37:27Z,"Ambos estão com as mesma estratégia de aumentar a rejeição do oponente, mas ela já declarou voto e parcialidade com as gesticulações das mãos dela!  De um lado um vilão e do outro o dono das virtudes. Isso é maniqueísmo a luta do bem contra o mal. Mesmo assistindo o vídeo sem áudio sabe-se que o voto dela não é secreto.",,2023-06-08 11:07:43.966008
youtube#commentThread,YUOQJ7J48-JAgZ2TaYPyBfvAJCI,Ugw8j-CwD9lGApcf13l4AaABAg,"{'videoId': 'Fz0PCYu4hJg', 'topLevelComment': {'kind': 'youtube#comment', 'etag': '-cceK4hh20HNwd1Zs8zG4wZarNU', 'id': 'Ugw8j-CwD9lGApcf13l4AaABAg', 'snippet': {'videoId': 'Fz0PCYu4hJg', 'textDisplay': 'Bolsonaro vai vencer a eleição', 'textOriginal': 'Bolsonaro vai vencer a eleição', 'authorDisplayName': 'Arthur Coelho', 'authorProfileImageUrl': 'https://yt3.ggpht.com/ytc/AGIKgqOVLHYrZWSEhsD-D2G02d3iKlZkBIl0FNHPUw=s48-c-k-c0x00ffffff-no-rj', 'authorChannelUrl': 'http://www.youtube.com/channel/UCHTbnQhp-z3s08J277lX9eQ', 'authorChannelId': {'value': 'UCHTbnQhp-z3s08J277lX9eQ'}, 'canRate': True, 'viewerRating': 'none', 'likeCount': 0, 'publishedAt': '2022-10-13T03:30:47Z', 'updatedAt': '2022-10-13T03:30:47Z'}}, 'canReply': True, 'totalReplyCount': 0, 'isPublic': True}",,UCHTbnQhp-z3s08J277lX9eQ,2022-10-13T03:30:47Z,Bolsonaro vai vencer a eleição,,2023-06-08 11:07:43.966008
youtube#commentThread,aS4aAQMPUg-JSQh6xWC0gsfcVMY,Ugwsbbv27U3lWpWx8VB4AaABAg,"{'videoId': 'Fz0PCYu4hJg', 'topLevelComment': {'kind': 'youtube#comment', 'etag': 'RJVixtu7FiJZYxdvFamkv5idnVM', 'id': 'Ugwsbbv27U3lWpWx8VB4AaABAg', 'snippet': {'videoId': 'Fz0PCYu4hJg', 'textDisplay': 'Essa mulher é petista.', 'textOriginal': 'Essa mulher é petista.', 'authorDisplayName': 'Jailson Alfredo', 'authorProfileImageUrl': 'https://yt3.ggpht.com/ytc/AGIKgqNPS_lPKRKy1wIT_wuvvcuJM2Qc9vwd6SpkhImEKxw=s48-c-k-c0x00ffffff-no-rj', 'authorChannelUrl': 'http://www.youtube.com/channel/UCAp6cKMuGLrDLLoEwpoHG_g', 'authorChannelId': {'value': 'UCAp6cKMuGLrDLLoEwpoHG_g'}, 'canRate': True, 'viewerRating': 'none', 'likeCount': 0, 'publishedAt': '2022-10-13T03:16:48Z', 'updatedAt': '2022-10-13T03:16:48Z'}}, 'canReply': True, 'totalReplyCount': 0, 'isPublic': True}",,UCAp6cKMuGLrDLLoEwpoHG_g,2022-10-13T03:16:48Z,Essa mulher é petista.,,2023-06-08 11:07:43.966008
youtube#commentThread,ltQA8HMPumkl_HYRVvmhQucEpbo,UgzVU1GPprSJek05rfd4AaABAg,"{'videoId': 'Fz0PCYu4hJg', 'topLevelComment': {'kind': 'youtube#comment', 'etag': 'b5CZGVqPzNxPYtf5hFJ5rPYhp-g', 'id': 'UgzVU1GPprSJek05rfd4AaABAg', 'snippet': {'videoId': 'Fz0PCYu4hJg', 'textDisplay': 'Que mulher extrapolada na comunicação', 'textOriginal': 'Que mulher extrapolada na comunicação', 'authorDisplayName': 'Eder Motta', 'authorProfileImageUrl': 'https://yt3.ggpht.com/ytc/AGIKgqMAIfgaGsLu8wUucdhVlWXhgHSon5Yf5iogMA=s48-c-k-c0x00ffffff-no-rj', 'authorChannelUrl': 'http://www.youtube.com/channel/UC2QQgvCLMTEZV734yHYwZNw', 'authorChannelId': {'value': 'UC2QQgvCLMTEZV734yHYwZNw'}, 'canRate': True, 'viewerRating': 'none', 'likeCount': 0, 'publishedAt': '2022-10-13T00:36:35Z', 'updatedAt': '2022-10-13T00:36:35Z'}}, 'canReply': True, 'totalReplyCount': 0, 'isPublic': True}",,UC2QQgvCLMTEZV734yHYwZNw,2022-10-13T00:36:35Z,Que mulher extrapolada na comunicação,,2023-06-08 11:07:43.966008
youtube#commentThread,NCQx-Ru5rG89n9NAtfJ-NlPQrUY,Ugy0NoqwR5oOKvMDH394AaABAg,"{'videoId': 'Fz0PCYu4hJg', 'topLevelComment': {'kind': 'youtube#comment', 'etag': 'ynyF2IfsSAsC6xdCPrq0-4d4d14', 'id': 'Ugy0NoqwR5oOKvMDH394AaABAg', 'snippet': {'videoId': 'Fz0PCYu4hJg', 'textDisplay': 'Assistam a Jovem Pan', 'textOriginal': 'Assistam a Jovem Pan', 'authorDisplayName': 'Eder Motta', 'authorProfileImageUrl': 'https://yt3.ggpht.com/ytc/AGIKgqMAIfgaGsLu8wUucdhVlWXhgHSon5Yf5iogMA=s48-c-k-c0x00ffffff-no-rj', 'authorChannelUrl': 'http://www.youtube.com/channel/UC2QQgvCLMTEZV734yHYwZNw', 'authorChannelId': {'value': 'UC2QQgvCLMTEZV734yHYwZNw'}, 'canRate': True, 'viewerRating': 'none', 'likeCount': 1, 'publishedAt': '2022-10-13T00:35:25Z', 'updatedAt': '2022-10-13T00:35:25Z'}}, 'canReply': True, 'totalReplyCount': 0, 'isPublic': True}",,UC2QQgvCLMTEZV734yHYwZNw,2022-10-13T00:35:25Z,Assistam a Jovem Pan,,2023-06-08 11:07:43.966008
youtube#commentThread,tdhsnXDgWMjV9sJdY9KEqwVQXKI,UgxuptzSrhZ1PQSAHb94AaABAg,"{'videoId': 'Fz0PCYu4hJg', 'topLevelComment': {'kind': 'youtube#comment', 'etag': 'LpwDwIEM2-ULDo7bTDVTHAEpNGQ', 'id': 'UgxuptzSrhZ1PQSAHb94AaABAg', 'snippet': {'videoId': 'Fz0PCYu4hJg', 'textDisplay': 'E  DEUS  QUE   DESIDI', 'textOriginal': 'E  DEUS  QUE   DESIDI', 'authorDisplayName': 'luizbezerradasilva bezerra', 'authorProfileImageUrl': 'https://yt3.ggpht.com/ytc/AGIKgqO9m-tVE_PG38HdiZVriE58n7Xf72lEyWHcJTE7q4UKp2p5lJqsDEKZdY9Wtl0C=s48-c-k-c0x00ffffff-no-rj', 'authorChannelUrl': 'http://www.youtube.com/channel/UCiR8mCoE99TKLeg5nh6oc6A', 'authorChannelId': {'value': 'UCiR8mCoE99TKLeg5nh6oc6A'}, 'canRate': True, 'viewerRating': 'none', 'likeCount': 0, 'publishedAt': '2022-10-13T00:22:24Z', 'updatedAt': '2022-10-13T00:22:24Z'}}, 'canReply': True, 'totalReplyCount': 0, 'isPublic': True}",,UCiR8mCoE99TKLeg5nh6oc6A,2022-10-13T00:22:24Z,E  DEUS  QUE   DESIDI,,2023-06-08 11:07:43.966008
youtube#commentThread,DmFNTMpjlEo92lAX4km2BDIMYQA,UgxrDKRjx-vewJFe0gp4AaABAg,"{'videoId': 'Fz0PCYu4hJg', 'topLevelComment': {'kind': 'youtube#comment', 'etag': '6dE-Tz7Z7riXl2gZwJjOUT5zg6U', 'id': 'UgxrDKRjx-vewJFe0gp4AaABAg', 'snippet': {'videoId': 'Fz0PCYu4hJg', 'textDisplay': 'Ele   vai   fala   não    saber   escrever', 'textOriginal': 'Ele   vai   fala   não    saber   escrever', 'authorDisplayName': 'luizbezerradasilva bezerra', 'authorProfileImageUrl': 'https://yt3.ggpht.com/ytc/AGIKgqO9m-tVE_PG38HdiZVriE58n7Xf72lEyWHcJTE7q4UKp2p5lJqsDEKZdY9Wtl0C=s48-c-k-c0x00ffffff-no-rj', 'authorChannelUrl': 'http://www.youtube.com/channel/UCiR8mCoE99TKLeg5nh6oc6A', 'authorChannelId': {'value': 'UCiR8mCoE99TKLeg5nh6oc6A'}, 'canRate': True, 'viewerRating': 'none', 'likeCount': 0, 'publishedAt': '2022-10-13T00:20:56Z', 'updatedAt': '2022-10-13T00:20:56Z'}}, 'canReply': True, 'totalReplyCount': 0, 'isPublic': True}",,UCiR8mCoE99TKLeg5nh6oc6A,2022-10-13T00:20:56Z,Ele   vai   fala   não    saber   escrever,,2023-06-08 11:07:43.966008
youtube#commentThread,SYWKQJ2n0iGrovG0IOiUsCwX1DY,UgwR07SmQVxMZmm_iT54AaABAg,"{'videoId': 'Fz0PCYu4hJg', 'topLevelComment': {'kind': 'youtube#comment', 'etag': 'A09zpB4CduiwfISS-ntF89welNY', 'id': 'UgwR07SmQVxMZmm_iT54AaABAg', 'snippet': {'videoId': 'Fz0PCYu4hJg', 'textDisplay': 'O   bispo   tem   que   ter    fala  menos   DEUS   vai   pessa   a   mão    sobre   ele   foi   DEUS   QUE   PODO   PRESIDENTE   COMO   RELIGIOSO   DEVERIA  FALA   MENOS    ECLESIASTES CAP  3', 'textOriginal': 'O   bispo   tem   que   ter    fala  menos   DEUS   vai   pessa   a   mão    sobre   ele   foi   DEUS   QUE   PODO   PRESIDENTE   COMO   RELIGIOSO   DEVERIA  FALA   MENOS    ECLESIASTES CAP  3', 'authorDisplayName': 'luizbezerradasilva bezerra', 'authorProfileImageUrl': 'https://yt3.ggpht.com/ytc/AGIKgqO9m-tVE_PG38HdiZVriE58n7Xf72lEyWHcJTE7q4UKp2p5lJqsDEKZdY9Wtl0C=s48-c-k-c0x00ffffff-no-rj', 'authorChannelUrl': 'http://www.youtube.com/channel/UCiR8mCoE99TKLeg5nh6oc6A', 'authorChannelId': {'value': 'UCiR8mCoE99TKLeg5nh6oc6A'}, 'canRate': True, 'viewerRating': 'none', 'likeCount': 0, 'publishedAt': '2022-10-13T00:19:36Z', 'updatedAt': '2022-10-13T00:19:36Z'}}, 'canReply': True, 'totalReplyCount': 0, 'isPublic': True}",,UCiR8mCoE99TKLeg5nh6oc6A,2022-10-13T00:19:36Z,O   bispo   tem   que   ter    fala  menos   DEUS   vai   pessa   a   mão    sobre   ele   foi   DEUS   QUE   PODO   PRESIDENTE   COMO   RELIGIOSO   DEVERIA  FALA   MENOS    ECLESIASTES CAP  3,,2023-06-08 11:07:43.966008
youtube#commentThread,pe7ML3kn1SMjKrnC_4c5X_vjQqA,UgycNVlABCWZmZwPAUd4AaABAg,"{'videoId': 'Fz0PCYu4hJg', 'topLevelComment': {'kind': 'youtube#comment', 'etag': 'GTJHJrAaAWQPMC2wsnYN2zMDbaM', 'id': 'UgycNVlABCWZmZwPAUd4AaABAg', 'snippet': {'videoId': 'Fz0PCYu4hJg', 'textDisplay': 'Emprensa vergonhosa essa cnn. Passou longe de ser isenta, essa reportagem e essa repórter', 'textOriginal': 'Emprensa vergonhosa essa cnn. Passou longe de ser isenta, essa reportagem e essa repórter', 'authorDisplayName': 'Cristian & Elaine Estevam', 'authorProfileImageUrl': 'https://yt3.ggpht.com/ytc/AGIKgqNTVMdubR_EelSr5-QZPcqw2mYAYWD3btAAdYXKM0k=s48-c-k-c0x00ffffff-no-rj', 'authorChannelUrl': 'http://www.youtube.com/channel/UCi41BPzchicaaoavBDoklBg', 'authorChannelId': {'value': 'UCi41BPzchicaaoavBDoklBg'}, 'canRate': True, 'viewerRating': 'none', 'likeCount': 0, 'publishedAt': '2022-10-12T23:49:10Z', 'updatedAt': '2022-10-12T23:49:41Z'}}, 'canReply': True, 'totalReplyCount': 0, 'isPublic': True}",,UCi41BPzchicaaoavBDoklBg,2022-10-12T23:49:10Z,"Emprensa vergonhosa essa cnn. Passou longe de ser isenta, essa reportagem e essa repórter",,2023-06-08 11:07:43.966008
youtube#commentThread,mDnnnO7iZXr9fNw8V7920JaRQBU,Ugwm_7HoxwnT82CfS2l4AaABAg,"{'videoId': 'Fz0PCYu4hJg', 'topLevelComment': {'kind': 'youtube#comment', 'etag': 'AeMGWqJFLBXcsOQbpf0VdcRJeoY', 'id': 'Ugwm_7HoxwnT82CfS2l4AaABAg', 'snippet': {'videoId': 'Fz0PCYu4hJg', 'textDisplay': 'Ela nunca fala que Lula é a favor: Da liberação das drogas, do assassinato de crianças no ventre, da identidade de gênero, falou até que apoia o roubo de celular, essa Daniela é uma piada, kkkkkkkkkkkk', 'textOriginal': 'Ela nunca fala que Lula é a favor: Da liberação das drogas, do assassinato de crianças no ventre, da identidade de gênero, falou até que apoia o roubo de celular, essa Daniela é uma piada, kkkkkkkkkkkk', 'authorDisplayName': 'Lock Sempre', 'authorProfileImageUrl': 'https://yt3.ggpht.com/lLtMTsagAGdZHD-PbjIX-mqTx02JLUMIqdH3LKKzUiROA6cnoTOTDnlvkiKxSCyWf_uJiOL7e3U=s48-c-k-c0x00ffffff-no-rj', 'authorChannelUrl': 'http://www.youtube.com/channel/UCsKZ5hdk042c6ourDOso1DQ', 'authorChannelId': {'value': 'UCsKZ5hdk042c6ourDOso1DQ'}, 'canRate': True, 'viewerRating': 'none', 'likeCount': 0, 'publishedAt': '2022-10-12T23:25:24Z', 'updatedAt': '2022-10-12T23:25:24Z'}}, 'canReply': True, 'totalReplyCount': 0, 'isPublic': True}",,UCsKZ5hdk042c6ourDOso1DQ,2022-10-12T23:25:24Z,"Ela nunca fala que Lula é a favor: Da liberação das drogas, do assassinato de crianças no ventre, da identidade de gênero, falou até que apoia o roubo de celular, essa Daniela é uma piada, kkkkkkkkkkkk",,2023-06-08 11:07:43.966008
youtube#commentThread,uuzNul8nroxCoV3lWOoMI7YHf0I,Ugy-3oCyChJNoAXDOQB4AaABAg,"{'videoId': 'Fz0PCYu4hJg', 'topLevelComment': {'kind': 'youtube#comment', 'etag': 'Z252DP5wD2Wv5YCf4EI4HPbS02s', 'id': 'Ugy-3oCyChJNoAXDOQB4AaABAg', 'snippet': {'videoId': 'Fz0PCYu4hJg', 'textDisplay': 'Usando a CNN para fazer política para o candidato dela', 'textOriginal': 'Usando a CNN para fazer política para o candidato dela', 'authorDisplayName': 'Lock Sempre', 'authorProfileImageUrl': 'https://yt3.ggpht.com/lLtMTsagAGdZHD-PbjIX-mqTx02JLUMIqdH3LKKzUiROA6cnoTOTDnlvkiKxSCyWf_uJiOL7e3U=s48-c-k-c0x00ffffff-no-rj', 'authorChannelUrl': 'http://www.youtube.com/channel/UCsKZ5hdk042c6ourDOso1DQ', 'authorChannelId': {'value': 'UCsKZ5hdk042c6ourDOso1DQ'}, 'canRate': True, 'viewerRating': 'none', 'likeCount': 1, 'publishedAt': '2022-10-12T23:21:12Z', 'updatedAt': '2022-10-12T23:21:12Z'}}, 'canReply': True, 'totalReplyCount': 0, 'isPublic': True}",,UCsKZ5hdk042c6ourDOso1DQ,2022-10-12T23:21:12Z,Usando a CNN para fazer política para o candidato dela,,2023-06-08 11:07:43.966008
youtube#commentThread,ko8F2Q2HMfnrrZ0qpBmCRh4pd_Q,UgwmX7Hdv7HjxeDIN4J4AaABAg,"{'videoId': 'Fz0PCYu4hJg', 'topLevelComment': {'kind': 'youtube#comment', 'etag': 'yb9FOdxlga7xhe2uxwTXaoZLly8', 'id': 'UgwmX7Hdv7HjxeDIN4J4AaABAg', 'snippet': {'videoId': 'Fz0PCYu4hJg', 'textDisplay': 'Só pra lembrar q o sinal de vcs já foi cortado em pais de esquerda ,vai cuidando outro emprego ae', 'textOriginal': 'Só pra lembrar q o sinal de vcs já foi cortado em pais de esquerda ,vai cuidando outro emprego ae', 'authorDisplayName': 'Jj Tavares', 'authorProfileImageUrl': 'https://yt3.ggpht.com/ytc/AGIKgqMhGm0Rl_BiZ2eiOUcfeSRVCUaMkC1SRCObeg=s48-c-k-c0x00ffffff-no-rj', 'authorChannelUrl': 'http://www.youtube.com/channel/UCWFrDGKsFDBjG5glHDvi6xw', 'authorChannelId': {'value': 'UCWFrDGKsFDBjG5glHDvi6xw'}, 'canRate': True, 'viewerRating': 'none', 'likeCount': 0, 'publishedAt': '2022-10-12T23:20:45Z', 'updatedAt': '2022-10-12T23:20:45Z'}}, 'canReply': True, 'totalReplyCount': 0, 'isPublic': True}",,UCWFrDGKsFDBjG5glHDvi6xw,2022-10-12T23:20:45Z,"Só pra lembrar q o sinal de vcs já foi cortado em pais de esquerda ,vai cuidando outro emprego ae",,2023-06-08 11:07:43.966008
