kind,etag,id,snippet,replies,authorChannelId,publishedAt,textOriginal,nextPageToken,extraction_date
youtube#commentThread,JkyTN5RWCsxSa6pyDc22bUy1_7Q,UgwBq7sTRwcuiDCiMgh4AaABAg,"{'videoId': 'mngDDP48JKU', 'topLevelComment': {'kind': 'youtube#comment', 'etag': '0RtcLYkO0TkZan74w6T_NaOvaIU', 'id': 'UgwBq7sTRwcuiDCiMgh4AaABAg', 'snippet': {'videoId': 'mngDDP48JKU', 'textDisplay': 'Esse Prof* tá brincando!<br>Impossível prever a migração desses votos.<br>Pode até não ter migração.<br>A tradição .ostra que no 2*turno esse % pode aumentar.<br>Da onde Vcs trouxeram esse Prof.?', 'textOriginal': 'Esse Prof* tá brincando!\\nImpossível prever a migração desses votos.\\nPode até não ter migração.\\nA tradição .ostra que no 2*turno esse % pode aumentar.\\nDa onde Vcs trouxeram esse Prof.?', 'authorDisplayName': 'Roseli Feres', 'authorProfileImageUrl': 'https://yt3.ggpht.com/ytc/AGIKgqONCUyWzh3rQ5lVtgL7TPLhR3ahnePMwXz--A=s48-c-k-c0x00ffffff-no-rj', 'authorChannelUrl': 'http://www.youtube.com/channel/UCOuU37_lLQBbhZ6HRFKeH_w', 'authorChannelId': {'value': 'UCOuU37_lLQBbhZ6HRFKeH_w'}, 'canRate': True, 'viewerRating': 'none', 'likeCount': 0, 'publishedAt': '2022-10-23T15:51:12Z', 'updatedAt': '2022-10-23T15:51:12Z'}}, 'canReply': True, 'totalReplyCount': 1, 'isPublic': True}","{'comments': [{'kind': 'youtube#comment', 'etag': 'yAEQ3uQQvutfzwH446xWP8zn_YM', 'id': 'UgwBq7sTRwcuiDCiMgh4AaABAg.9hXTQ9HOQ379hXYfCE1mtW', 'snippet': {'videoId': 'mngDDP48JKU', 'textDisplay': 'Você só quer ouvir que lula vai ganhar... A cnn sempre leva especialista que você que ouvir, quando aparece um que fala a verdade você fica chorando kkkkk', 'textOriginal': 'Você só quer ouvir que lula vai ganhar... A cnn sempre leva especialista que você que ouvir, quando aparece um que fala a verdade você fica chorando kkkkk', 'parentId': 'UgwBq7sTRwcuiDCiMgh4AaABAg', 'authorDisplayName': 'O CAÇADOR DE VIGARISTAS!!!', 'authorProfileImageUrl': 'https://yt3.ggpht.com/tp7-CxU8cN90z0br28tfH6ss3entPyDrs84siaB4DSO8P7GEboeWTsgXfaxs2sg--A3kCIyqDg=s48-c-k-c0x00ffffff-no-rj', 'authorChannelUrl': 'http://www.youtube.com/channel/UC3GsWfo5nd0tKVeOTVEmDLw', 'authorChannelId': {'value': 'UC3GsWfo5nd0tKVeOTVEmDLw'}, 'canRate': True, 'viewerRating': 'none', 'likeCount': 0, 'publishedAt': '2022-10-23T16:37:05Z', 'updatedAt': '2022-10-23T16:37:05Z'}}]}",UCOuU37_lLQBbhZ6HRFKeH_w,2022-10-23T15:51:12Z,"Esse Prof* tá brincando!
Impossível prever a migração desses votos.
Pode até não ter migração.
A tradição .ostra que no 2*turno esse % pode aumentar.
Da onde Vcs trouxeram esse Prof.?",,2023-06-08 02:41:32.262018
youtube#commentThread,mJ82sQMk2ww0sj5oNRQadPke8CM,Ugzvkp6zZRw1waamZt14AaABAg,"{'videoId': 'mngDDP48JKU', 'topLevelComment': {'kind': 'youtube#comment', 'etag': '6nKXROvhnwRAh7aRbx2DX2Knyhc', 'id': 'Ugzvkp6zZRw1waamZt14AaABAg', 'snippet': {'videoId': 'mngDDP48JKU', 'textDisplay': 'Que ridículo que são os BOLSONARISTAS!<br>Não dá exatamente p/ mensurar p/ onde irão esses votos.<br>Até pq eles podem se manter nesse patamar.', 'textOriginal': 'Que ridículo que são os BOLSONARISTAS!\\nNão dá exatamente p/ mensurar p/ onde irão esses votos.\\nAté pq eles podem se manter nesse patamar.', 'authorDisplayName': 'Roseli Feres', 'authorProfileImageUrl': 'https://yt3.ggpht.com/ytc/AGIKgqONCUyWzh3rQ5lVtgL7TPLhR3ahnePMwXz--A=s48-c-k-c0x00ffffff-no-rj', 'authorChannelUrl': 'http://www.youtube.com/channel/UCOuU37_lLQBbhZ6HRFKeH_w', 'authorChannelId': {'value': 'UCOuU37_lLQBbhZ6HRFKeH_w'}, 'canRate': True, 'viewerRating': 'none', 'likeCount': 2, 'publishedAt': '2022-10-23T15:48:12Z', 'updatedAt': '2022-10-23T15:48:12Z'}}, 'canReply': True, 'totalReplyCount': 0, 'isPublic': True}",,UCOuU37_lLQBbhZ6HRFKeH_w,2022-10-23T15:48:12Z,"Que ridículo que são os BOLSONARISTAS!
Não dá exatamente p/ mensurar p/ onde irão esses votos.
Até pq eles podem se manter nesse patamar.",,2023-06-08 02:41:32.262018
youtube#commentThread,yMsIMyfxyFhLJB50dZsXZwZlp-A,UgynNJPrJcFKcqG7xWJ4AaABAg,"{'videoId': 'mngDDP48JKU', 'topLevelComment': {'kind': 'youtube#comment', 'etag': 'OXzMzDzGrc0Dq1OHaXj-eCiYUlA', 'id': 'UgynNJPrJcFKcqG7xWJ4AaABAg', 'snippet': {'videoId': 'mngDDP48JKU', 'textDisplay': 'Ninguem sabe é pn de nada. Qual é a caracteristica de quem tá se abstento? Ninguem sabe..', 'textOriginal': 'Ninguem sabe é pn de nada. Qual é a caracteristica de quem tá se abstento? Ninguem sabe..', 'authorDisplayName': 'Luiz augusto', 'authorProfileImageUrl': 'https://yt3.ggpht.com/ytc/AGIKgqPENEsjy6ZZRIgv-jtH9as43JIfHlS3vIY4VPGGKmhaXHfEmO_t7eZld5SMNGSk=s48-c-k-c0x00ffffff-no-rj', 'authorChannelUrl': 'http://www.youtube.com/channel/UCeiMMh5wPvgoXf2TSgzfvyw', 'authorChannelId': {'value': 'UCeiMMh5wPvgoXf2TSgzfvyw'}, 'canRate': True, 'viewerRating': 'none', 'likeCount': 0, 'publishedAt': '2022-10-23T15:45:05Z', 'updatedAt': '2022-10-23T15:45:05Z'}}, 'canReply': True, 'totalReplyCount': 0, 'isPublic': True}",,UCeiMMh5wPvgoXf2TSgzfvyw,2022-10-23T15:45:05Z,Ninguem sabe é pn de nada. Qual é a caracteristica de quem tá se abstento? Ninguem sabe..,,2023-06-08 02:41:32.262018
youtube#commentThread,KYUtyouMhdHTq9TmE3ODmhaJ684,UgwXDBnll4N9qjQZB854AaABAg,"{'videoId': 'mngDDP48JKU', 'topLevelComment': {'kind': 'youtube#comment', 'etag': 'L4aPHgqZ3IiO5UxhZdTQUY_AnPE', 'id': 'UgwXDBnll4N9qjQZB854AaABAg', 'snippet': {'videoId': 'mngDDP48JKU', 'textDisplay': 'Ainda acho que o papai smurf cachaceiro vence.', 'textOriginal': 'Ainda acho que o papai smurf cachaceiro vence.', 'authorDisplayName': 'Melfice', 'authorProfileImageUrl': 'https://yt3.ggpht.com/ytc/AGIKgqMqy5VAxn4EbfaLRGddyBHlxvkcqNMHxKI0KQ=s48-c-k-c0x00ffffff-no-rj', 'authorChannelUrl': 'http://www.youtube.com/channel/UC4Jm7O-Ou3_3yt2E2RrQzRg', 'authorChannelId': {'value': 'UC4Jm7O-Ou3_3yt2E2RrQzRg'}, 'canRate': True, 'viewerRating': 'none', 'likeCount': 4, 'publishedAt': '2022-10-23T15:43:18Z', 'updatedAt': '2022-10-23T15:43:18Z'}}, 'canReply': True, 'totalReplyCount': 3, 'isPublic': True}","{'comments': [{'kind': 'youtube#comment', 'etag': 'Nf62l0ff7TpMEKfKykI5Fe5WdU8', 'id': 'UgwXDBnll4N9qjQZB854AaABAg.9hXSWI7prNF9hYyEFDuO8y', 'snippet': {'videoId': 'mngDDP48JKU', 'textDisplay': 'Amém', 'textOriginal': 'Amém', 'parentId': 'UgwXDBnll4N9qjQZB854AaABAg', 'authorDisplayName': 'Pokemon Ward', 'authorProfileImageUrl': 'https://yt3.ggpht.com/ytc/AGIKgqO3tFGNZWD-V1gWOKtz8rLVdWN4OaysKA1wd5Wd=s48-c-k-c0x00ffffff-no-rj', 'authorChannelUrl': 'http://www.youtube.com/channel/UC7j1O7FsolI3uhaPowoQobg', 'authorChannelId': {'value': 'UC7j1O7FsolI3uhaPowoQobg'}, 'canRate': True, 'viewerRating': 'none', 'likeCount': 0, 'publishedAt': '2022-10-24T05:48:26Z', 'updatedAt': '2022-10-24T05:48:26Z'}}, {'kind': 'youtube#comment', 'etag': '2zReamgLCuEY0c5M2iHBsxzB5LQ', 'id': 'UgwXDBnll4N9qjQZB854AaABAg.9hXSWI7prNF9hXhfCr5KHz', 'snippet': {'videoId': 'mngDDP48JKU', 'textDisplay': 'Pense um pouco! Não vá votar no capitão pedófilo da rachadinha! Este é muito pior, além de incompetente!', 'textOriginal': 'Pense um pouco! Não vá votar no capitão pedófilo da rachadinha! Este é muito pior, além de incompetente!', 'parentId': 'UgwXDBnll4N9qjQZB854AaABAg', 'authorDisplayName': 'Ricardo Ernesto Rose', 'authorProfileImageUrl': 'https://yt3.ggpht.com/ytc/AGIKgqPvkt-cT1GiWnDidKIiOHrsvmmJrSnOkB4PhKrhYA=s48-c-k-c0x00ffffff-no-rj', 'authorChannelUrl': 'http://www.youtube.com/channel/UCt8r-mSkRLgcVZR_63sXOCA', 'authorChannelId': {'value': 'UCt8r-mSkRLgcVZR_63sXOCA'}, 'canRate': True, 'viewerRating': 'none', 'likeCount': 0, 'publishedAt': '2022-10-23T18:04:28Z', 'updatedAt': '2022-10-23T18:04:28Z'}}, {'kind': 'youtube#comment', 'etag': 'nZ7aiU6fIwWKC2LAAGZrlBka_5k', 'id': 'UgwXDBnll4N9qjQZB854AaABAg.9hXSWI7prNF9hXhHGrY2jo', 'snippet': {'videoId': 'mngDDP48JKU', 'textDisplay': 'Eu também, vou ter que votar nele !', 'textOriginal': 'Eu também, vou ter que votar nele !', 'parentId': 'UgwXDBnll4N9qjQZB854AaABAg', 'authorDisplayName': 'Allan Aquino', 'authorProfileImageUrl': 'https://yt3.ggpht.com/AG9xzm8nwryUOVXC-vxp58HDezFlS4pmA2ycioj9P8S11Xi2J59JAOIdtu4ULTXrC5nkn4ALVA=s48-c-k-c0x00ffffff-no-rj', 'authorChannelUrl': 'http://www.youtube.com/channel/UCtFrcc2wmGmV7q1Kif8sLIw', 'authorChannelId': {'value': 'UCtFrcc2wmGmV7q1Kif8sLIw'}, 'canRate': True, 'viewerRating': 'none', 'likeCount': 1, 'publishedAt': '2022-10-23T18:01:04Z', 'updatedAt': '2022-10-23T18:01:04Z'}}]}",UC4Jm7O-Ou3_3yt2E2RrQzRg,2022-10-23T15:43:18Z,Ainda acho que o papai smurf cachaceiro vence.,,2023-06-08 02:41:32.262018
youtube#commentThread,oVo-KF9mJyWkoVGbtfDakxZD0O8,Ugwwi4qQc8U8sk54f6V4AaABAg,"{'videoId': 'mngDDP48JKU', 'topLevelComment': {'kind': 'youtube#comment', 'etag': 'vpEVhhMCoikLGSCVFt9L2a62jYA', 'id': 'Ugwwi4qQc8U8sk54f6V4AaABAg', 'snippet': {'videoId': 'mngDDP48JKU', 'textDisplay': 'Lula deu tiro no pé ao falar que vai acabar com as aposentadorias e Bolsa Família😮😮😮😮😮😮😮😮😮', 'textOriginal': 'Lula deu tiro no pé ao falar que vai acabar com as aposentadorias e Bolsa Família😮😮😮😮😮😮😮😮😮', 'authorDisplayName': 'Foco do Momento', 'authorProfileImageUrl': 'https://yt3.ggpht.com/7e5dc43haLEbKgWT3Uwv9a-NXE45U6x_jfljG15gXJi42szRjzR1TKJXqPfpkVMVy_i5ovnliPM=s48-c-k-c0x00ffffff-no-rj', 'authorChannelUrl': 'http://www.youtube.com/channel/UCuquIBry1UrN6IQPfbUk7gQ', 'authorChannelId': {'value': 'UCuquIBry1UrN6IQPfbUk7gQ'}, 'canRate': True, 'viewerRating': 'none', 'likeCount': 3, 'publishedAt': '2022-10-23T15:42:42Z', 'updatedAt': '2022-10-23T15:42:42Z'}}, 'canReply': True, 'totalReplyCount': 5, 'isPublic': True}","{'comments': [{'kind': 'youtube#comment', 'etag': '_8KgFUZO_KenRuHf_hmOhxYYe74', 'id': 'Ugwwi4qQc8U8sk54f6V4AaABAg.9hXSRr-kDyY9hXiby-Ldkw', 'snippet': {'videoId': 'mngDDP48JKU', 'textDisplay': 'Quem disse isso foi o seu mito', 'textOriginal': 'Quem disse isso foi o seu mito', 'parentId': 'Ugwwi4qQc8U8sk54f6V4AaABAg', 'authorDisplayName': 'Allan Aquino', 'authorProfileImageUrl': 'https://yt3.ggpht.com/AG9xzm8nwryUOVXC-vxp58HDezFlS4pmA2ycioj9P8S11Xi2J59JAOIdtu4ULTXrC5nkn4ALVA=s48-c-k-c0x00ffffff-no-rj', 'authorChannelUrl': 'http://www.youtube.com/channel/UCtFrcc2wmGmV7q1Kif8sLIw', 'authorChannelId': {'value': 'UCtFrcc2wmGmV7q1Kif8sLIw'}, 'canRate': True, 'viewerRating': 'none', 'likeCount': 0, 'publishedAt': '2022-10-23T18:12:46Z', 'updatedAt': '2022-10-23T18:12:46Z'}}, {'kind': 'youtube#comment', 'etag': 'eALGT5y5B4oRPMgjp2Zm79pCl5g', 'id': 'Ugwwi4qQc8U8sk54f6V4AaABAg.9hXSRr-kDyY9hXWYMfQTPW', 'snippet': {'videoId': 'mngDDP48JKU', 'textDisplay': '@Narceso Lucena e mentira, porque lula nunca falou que iria acabar com as aposentadorias, e bolsa familia, sendo que no plano de governo de lula o bolsa familia será de 600 reais, e 150 a mais para quem tiver filhos(as) de 0 a 6 anos, e quem criou o bolsa familia foi o lula, como ele vai acabar uma coisa que ele criou? Não faz sentido, e o brasil está um bost@ por causa do atual governo. Eu não sou gado, apenas defendo a democracia, coisa que o atual presidente não defende, pois dividiu as familias Brasileiras entre o ódio e a antidemocrácia.', 'textOriginal': '@Narceso Lucena e mentira, porque lula nunca falou que iria acabar com as aposentadorias, e bolsa familia, sendo que no plano de governo de lula o bolsa familia será de 600 reais, e 150 a mais para quem tiver filhos(as) de 0 a 6 anos, e quem criou o bolsa familia foi o lula, como ele vai acabar uma coisa que ele criou? Não faz sentido, e o brasil está um bost@ por causa do atual governo. Eu não sou gado, apenas defendo a democracia, coisa que o atual presidente não defende, pois dividiu as familias Brasileiras entre o ódio e a antidemocrácia.', 'parentId': 'Ugwwi4qQc8U8sk54f6V4AaABAg', 'authorDisplayName': 'Paulo Rodrigues', 'authorProfileImageUrl': 'https://yt3.ggpht.com/jDMAWqmBItmuw8YJe8kAQz9TwTjv9hfxpVUC4f_bFffCU67nhmfW8_4B2N7Y_i7Ys5PmkQDm=s48-c-k-c0x00ffffff-no-rj', 'authorChannelUrl': 'http://www.youtube.com/channel/UCh3OfCoue2FfroXV7Gcf6jw', 'authorChannelId': {'value': 'UCh3OfCoue2FfroXV7Gcf6jw'}, 'canRate': True, 'viewerRating': 'none', 'likeCount': 0, 'publishedAt': '2022-10-23T16:18:32Z', 'updatedAt': '2022-10-23T16:21:26Z'}}, {'kind': 'youtube#comment', 'etag': 'ZCREaMG0ug8TebwMPnZgbs_9pLA', 'id': 'Ugwwi4qQc8U8sk54f6V4AaABAg.9hXSRr-kDyY9hXVcmoQHXA', 'snippet': {'videoId': 'mngDDP48JKU', 'textDisplay': 'Gado vc não tem vergonha de vim fala esse tipo de mentira ? toma vergonha na cara por isso o Brasil esta essa b@sta toda', 'textOriginal': 'Gado vc não tem vergonha de vim fala esse tipo de mentira ? toma vergonha na cara por isso o Brasil esta essa b@sta toda', 'parentId': 'Ugwwi4qQc8U8sk54f6V4AaABAg', 'authorDisplayName': 'Narceso Lucena', 'authorProfileImageUrl': 'https://yt3.ggpht.com/ytc/AGIKgqPwhI-adgHEBNTteJ9Tm7YZ1_fWDbkUskbKn1OC6VB7ke_g3QYnR4jte4JfziFF=s48-c-k-c0x00ffffff-no-rj', 'authorChannelUrl': 'http://www.youtube.com/channel/UCVAjea7l7xR_3Gt7UmDcA2g', 'authorChannelId': {'value': 'UCVAjea7l7xR_3Gt7UmDcA2g'}, 'canRate': True, 'viewerRating': 'none', 'likeCount': 0, 'publishedAt': '2022-10-23T16:10:33Z', 'updatedAt': '2022-10-23T16:10:33Z'}}, {'kind': 'youtube#comment', 'etag': 'LL_4fObgw13id1G8UY1zBCBz-Q0', 'id': 'Ugwwi4qQc8U8sk54f6V4AaABAg.9hXSRr-kDyY9hXUPvbJOoR', 'snippet': {'videoId': 'mngDDP48JKU', 'textDisplay': 'mentira, deixa de fake news', 'textOriginal': 'mentira, deixa de fake news', 'parentId': 'Ugwwi4qQc8U8sk54f6V4AaABAg', 'authorDisplayName': 'Paulo Rodrigues', 'authorProfileImageUrl': 'https://yt3.ggpht.com/jDMAWqmBItmuw8YJe8kAQz9TwTjv9hfxpVUC4f_bFffCU67nhmfW8_4B2N7Y_i7Ys5PmkQDm=s48-c-k-c0x00ffffff-no-rj', 'authorChannelUrl': 'http://www.youtube.com/channel/UCh3OfCoue2FfroXV7Gcf6jw', 'authorChannelId': {'value': 'UCh3OfCoue2FfroXV7Gcf6jw'}, 'canRate': True, 'viewerRating': 'none', 'likeCount': 1, 'publishedAt': '2022-10-23T15:59:55Z', 'updatedAt': '2022-10-23T15:59:55Z'}}, {'kind': 'youtube#comment', 'etag': 'y0NQMHkPyAlySUP9QvSCAVobcek', 'id': 'Ugwwi4qQc8U8sk54f6V4AaABAg.9hXSRr-kDyY9hXSwURgwn3', 'snippet': {'videoId': 'mngDDP48JKU', 'textDisplay': 'Deixa de ser mentiroso toma vergonha na cara para de espalhar fake News gado do capeta', 'textOriginal': 'Deixa de ser mentiroso toma vergonha na cara para de espalhar fake News gado do capeta', 'parentId': 'Ugwwi4qQc8U8sk54f6V4AaABAg', 'authorDisplayName': 'Fernanda', 'authorProfileImageUrl': 'https://yt3.ggpht.com/JRvThTuZ_l3tFtzxbXWFlUEpsOTFQswF5vxrbVK2ONLU3kjTpD2MHhtYENlCYwU2_sRqUvbLFg=s48-c-k-c0x00ffffff-no-rj', 'authorChannelUrl': 'http://www.youtube.com/channel/UC7w-oIqaBVMZs3EKw16Izew', 'authorChannelId': {'value': 'UC7w-oIqaBVMZs3EKw16Izew'}, 'canRate': True, 'viewerRating': 'none', 'likeCount': 0, 'publishedAt': '2022-10-23T15:47:01Z', 'updatedAt': '2022-10-23T15:47:17Z'}}]}",UCuquIBry1UrN6IQPfbUk7gQ,2022-10-23T15:42:42Z,Lula deu tiro no pé ao falar que vai acabar com as aposentadorias e Bolsa Família😮😮😮😮😮😮😮😮😮,,2023-06-08 02:41:32.262018
youtube#commentThread,iH7s_bPJz7ISdh8uQMLNeAEvLfQ,UgyBXUp24uPYWlQi_qB4AaABAg,"{'videoId': 'mngDDP48JKU', 'topLevelComment': {'kind': 'youtube#comment', 'etag': 'uec2MxzaJEvAch09tjm8KaKll94', 'id': 'UgyBXUp24uPYWlQi_qB4AaABAg', 'snippet': {'videoId': 'mngDDP48JKU', 'textDisplay': 'Papo pra boi dormir kkkkkkk🤮🤮🤮🤮🤮🤮🤮🤮', 'textOriginal': 'Papo pra boi dormir kkkkkkk🤮🤮🤮🤮🤮🤮🤮🤮', 'authorDisplayName': 'Ana Calixto', 'authorProfileImageUrl': 'https://yt3.ggpht.com/ytc/AGIKgqONMMvM86kKEmMSAjv5KmQf2wpcCO-24c9wmw=s48-c-k-c0x00ffffff-no-rj', 'authorChannelUrl': 'http://www.youtube.com/channel/UCY18TDb5krHf1ID_Oxvts9Q', 'authorChannelId': {'value': 'UCY18TDb5krHf1ID_Oxvts9Q'}, 'canRate': True, 'viewerRating': 'none', 'likeCount': 2, 'publishedAt': '2022-10-23T15:42:26Z', 'updatedAt': '2022-10-23T15:42:26Z'}}, 'canReply': True, 'totalReplyCount': 0, 'isPublic': True}",,UCY18TDb5krHf1ID_Oxvts9Q,2022-10-23T15:42:26Z,Papo pra boi dormir kkkkkkk🤮🤮🤮🤮🤮🤮🤮🤮,,2023-06-08 02:41:32.262018
youtube#commentThread,9vPQMCwQPyOkH4e7qSB7NtJCptc,UgzOfYiNbf0Bop-JNlR4AaABAg,"{'videoId': 'mngDDP48JKU', 'topLevelComment': {'kind': 'youtube#comment', 'etag': '8CYuw8GCldIa5X6mZgO3SxYOCCY', 'id': 'UgzOfYiNbf0Bop-JNlR4AaABAg', 'snippet': {'videoId': 'mngDDP48JKU', 'textDisplay': '🇧🇷🇧🇷🇧🇷🇧🇷🇧🇷🇧🇷🇧🇷', 'textOriginal': '🇧🇷🇧🇷🇧🇷🇧🇷🇧🇷🇧🇷🇧🇷', 'authorDisplayName': 'Evellyn thuaNNy game📱', 'authorProfileImageUrl': 'https://yt3.ggpht.com/ytc/AGIKgqMZcSnLdAUvyUhTRKk097OCCIgwJ1Y9rIqyBLWMr_M9AIV-nSbJIpqWbbWxCAen=s48-c-k-c0x00ffffff-no-rj', 'authorChannelUrl': 'http://www.youtube.com/channel/UCIZSD9kMrkmAU3gMIMNPzbA', 'authorChannelId': {'value': 'UCIZSD9kMrkmAU3gMIMNPzbA'}, 'canRate': True, 'viewerRating': 'none', 'likeCount': 0, 'publishedAt': '2022-10-23T15:41:16Z', 'updatedAt': '2022-10-23T15:41:16Z'}}, 'canReply': True, 'totalReplyCount': 0, 'isPublic': True}",,UCIZSD9kMrkmAU3gMIMNPzbA,2022-10-23T15:41:16Z,🇧🇷🇧🇷🇧🇷🇧🇷🇧🇷🇧🇷🇧🇷,,2023-06-08 02:41:32.262018
youtube#commentThread,8XScRUjkpap8Y6hhvaX_eIjsoXw,UgxM0suC5akxUUA8X894AaABAg,"{'videoId': 'mngDDP48JKU', 'topLevelComment': {'kind': 'youtube#comment', 'etag': 'wVjEndBq2bKn5xymat5V_J9JZpw', 'id': 'UgxM0suC5akxUUA8X894AaABAg', 'snippet': {'videoId': 'mngDDP48JKU', 'textDisplay': 'LULA DIZ Q É CONTRA AS DROGAS <br>LULA NO COMPLEX DO ALEMÃO <br>SÓ FESTA COM O NARCOTRÁFICO', 'textOriginal': 'LULA DIZ Q É CONTRA AS DROGAS \\nLULA NO COMPLEX DO ALEMÃO \\nSÓ FESTA COM O NARCOTRÁFICO', 'authorDisplayName': 'Gelato gelato', 'authorProfileImageUrl': 'https://yt3.ggpht.com/ytc/AGIKgqPsY9uNERNS3jemaDDLypEe-n9p7bc_qh5BHvKA0n3XgMefdDhxx3y91mOEZcHu=s48-c-k-c0x00ffffff-no-rj', 'authorChannelUrl': 'http://www.youtube.com/channel/UCCe_jFhJURh1otWylimq3dQ', 'authorChannelId': {'value': 'UCCe_jFhJURh1otWylimq3dQ'}, 'canRate': True, 'viewerRating': 'none', 'likeCount': 1, 'publishedAt': '2022-10-23T15:40:39Z', 'updatedAt': '2022-10-23T15:40:39Z'}}, 'canReply': True, 'totalReplyCount': 1, 'isPublic': True}","{'comments': [{'kind': 'youtube#comment', 'etag': 'bXHrySwiL_OUhiV0foAV-ozb-es', 'id': 'UgxM0suC5akxUUA8X894AaABAg.9hXSCm-OUrC9hXVh0NL8ui', 'snippet': {'videoId': 'mngDDP48JKU', 'textDisplay': 'Igual ao Gabril Monteiro do minto  kkkkkkkkkkkkkkkkkkkkkkkkkkkkk', 'textOriginal': 'Igual ao Gabril Monteiro do minto  kkkkkkkkkkkkkkkkkkkkkkkkkkkkk', 'parentId': 'UgxM0suC5akxUUA8X894AaABAg', 'authorDisplayName': 'Narceso Lucena', 'authorProfileImageUrl': 'https://yt3.ggpht.com/ytc/AGIKgqPwhI-adgHEBNTteJ9Tm7YZ1_fWDbkUskbKn1OC6VB7ke_g3QYnR4jte4JfziFF=s48-c-k-c0x00ffffff-no-rj', 'authorChannelUrl': 'http://www.youtube.com/channel/UCVAjea7l7xR_3Gt7UmDcA2g', 'authorChannelId': {'value': 'UCVAjea7l7xR_3Gt7UmDcA2g'}, 'canRate': True, 'viewerRating': 'none', 'likeCount': 0, 'publishedAt': '2022-10-23T16:11:07Z', 'updatedAt': '2022-10-23T16:11:07Z'}}]}",UCCe_jFhJURh1otWylimq3dQ,2022-10-23T15:40:39Z,"LULA DIZ Q É CONTRA AS DROGAS 
LULA NO COMPLEX DO ALEMÃO 
SÓ FESTA COM O NARCOTRÁFICO",,2023-06-08 02:41:32.262018
youtube#commentThread,oBthQBx9JQjhNOIqkU8akWz1Ws4,UgxPYdVqJlIn0t41Uel4AaABAg,"{'videoId': 'mngDDP48JKU', 'topLevelComment': {'kind': 'youtube#comment', 'etag': '8o6SMSN-J2H_OQLuAdoMLw0uj6c', 'id': 'UgxPYdVqJlIn0t41Uel4AaABAg', 'snippet': {'videoId': 'mngDDP48JKU', 'textDisplay': 'Censura não, censura jamais. ✌️✌️✅🇧🇷🎵🎶', 'textOriginal': 'Censura não, censura jamais. ✌️✌️✅🇧🇷🎵🎶', 'authorDisplayName': 'Pedro B.', 'authorProfileImageUrl': 'https://yt3.ggpht.com/ytc/AGIKgqPF2WOVVI4C8ar3uGDIkU8epA3QHcv3MBZ6wg=s48-c-k-c0x00ffffff-no-rj', 'authorChannelUrl': 'http://www.youtube.com/channel/UCBb3zW6q6UDL2lGbwEXc6fQ', 'authorChannelId': {'value': 'UCBb3zW6q6UDL2lGbwEXc6fQ'}, 'canRate': True, 'viewerRating': 'none', 'likeCount': 37, 'publishedAt': '2022-10-23T15:36:53Z', 'updatedAt': '2022-10-23T15:36:53Z'}}, 'canReply': True, 'totalReplyCount': 6, 'isPublic': True}","{'comments': [{'kind': 'youtube#comment', 'etag': 'dLGBqQLds48Wf4pAdJEzU4q6-CY', 'id': 'UgxPYdVqJlIn0t41Uel4AaABAg.9hXRmH3TFpi9hXjGoV9t6s', 'snippet': {'videoId': 'mngDDP48JKU', 'textDisplay': 'Eleitor do Lula é burro. Não se informa é se agarra em tudo que a mídia fala.. fazem 4 anos que a mídia procura coisa errada na vida do bolsonaro e não acha nada.. se ela revirar a vida de vcs petistas, vai achar mais erros do que ele', 'textOriginal': 'Eleitor do Lula é burro. Não se informa é se agarra em tudo que a mídia fala.. fazem 4 anos que a mídia procura coisa errada na vida do bolsonaro e não acha nada.. se ela revirar a vida de vcs petistas, vai achar mais erros do que ele', 'parentId': 'UgxPYdVqJlIn0t41Uel4AaABAg', 'authorDisplayName': 'Samuel Oliveira', 'authorProfileImageUrl': 'https://yt3.ggpht.com/ytc/AGIKgqN6-p_Q5tnDBV6vNFUChF0k7YEMGz_lhHP7QQhHcyMD6t_Fd-3xPl6cOvQdi6tW=s48-c-k-c0x00ffffff-no-rj', 'authorChannelUrl': 'http://www.youtube.com/channel/UCIhLNAo6dV4Kpr4wmyw5HoA', 'authorChannelId': {'value': 'UCIhLNAo6dV4Kpr4wmyw5HoA'}, 'canRate': True, 'viewerRating': 'none', 'likeCount': 0, 'publishedAt': '2022-10-23T18:18:29Z', 'updatedAt': '2022-10-23T18:18:29Z'}}, {'kind': 'youtube#comment', 'etag': 'hrL15nO0c5Gw1yJLFqIOZPeusHo', 'id': 'UgxPYdVqJlIn0t41Uel4AaABAg.9hXRmH3TFpi9hXhCOCYPWj', 'snippet': {'videoId': 'mngDDP48JKU', 'textDisplay': 'Jamais 100 anos de sigilo, né? Kkkkkkkkk', 'textOriginal': 'Jamais 100 anos de sigilo, né? Kkkkkkkkk', 'parentId': 'UgxPYdVqJlIn0t41Uel4AaABAg', 'authorDisplayName': 'Ricardo Ernesto Rose', 'authorProfileImageUrl': 'https://yt3.ggpht.com/ytc/AGIKgqPvkt-cT1GiWnDidKIiOHrsvmmJrSnOkB4PhKrhYA=s48-c-k-c0x00ffffff-no-rj', 'authorChannelUrl': 'http://www.youtube.com/channel/UCt8r-mSkRLgcVZR_63sXOCA', 'authorChannelId': {'value': 'UCt8r-mSkRLgcVZR_63sXOCA'}, 'canRate': True, 'viewerRating': 'none', 'likeCount': 0, 'publishedAt': '2022-10-23T18:00:24Z', 'updatedAt': '2022-10-23T18:00:24Z'}}, {'kind': 'youtube#comment', 'etag': 'b9rXpvVwbEzlSSPizIkRERZnWI0', 'id': 'UgxPYdVqJlIn0t41Uel4AaABAg.9hXRmH3TFpi9hXa9RuAbtR', 'snippet': {'videoId': 'mngDDP48JKU', 'textDisplay': '@Foco do Momento abestatado o povo nao acredita nessa mentiras, porque conchecem o lula muito bem,gado imundo', 'textOriginal': '@Foco do Momento abestatado o povo nao acredita nessa mentiras, porque conchecem o lula muito bem,gado imundo', 'parentId': 'UgxPYdVqJlIn0t41Uel4AaABAg', 'authorDisplayName': 'Hildemar Bezerra', 'authorProfileImageUrl': 'https://yt3.ggpht.com/ytc/AGIKgqMrIzgrRPac8jqgDy4uO45XK1aZeeqI9ITUtmgl-A=s48-c-k-c0x00ffffff-no-rj', 'authorChannelUrl': 'http://www.youtube.com/channel/UCSEsBFbOjpbqYgdRmJ8xuiQ', 'authorChannelId': {'value': 'UCSEsBFbOjpbqYgdRmJ8xuiQ'}, 'canRate': True, 'viewerRating': 'none', 'likeCount': 0, 'publishedAt': '2022-10-23T16:58:50Z', 'updatedAt': '2022-10-23T16:58:50Z'}}, {'kind': 'youtube#comment', 'etag': 'dIqn7f5hI_Z4p44dtk1A3WTzqZE', 'id': 'UgxPYdVqJlIn0t41Uel4AaABAg.9hXRmH3TFpi9hXZ1M9HHqd', 'snippet': {'videoId': 'mngDDP48JKU', 'textDisplay': 'Liberdade sempre tivemos, o que não queremos é liberdade de agressão', 'textOriginal': 'Liberdade sempre tivemos, o que não queremos é liberdade de agressão', 'parentId': 'UgxPYdVqJlIn0t41Uel4AaABAg', 'authorDisplayName': 'NãoDigaQueNãoAvisei', 'authorProfileImageUrl': 'https://yt3.ggpht.com/4INq6TB71_7muWEJOq5CrB_12QNRHBuKYANG4Q1Tctx41CGbpJxDlAmO9B3k8x87IBYi3mK1fiE=s48-c-k-c0x00ffffff-no-rj', 'authorChannelUrl': 'http://www.youtube.com/channel/UCkkGP5j-74o6QkG8Bw5xwLQ', 'authorChannelId': {'value': 'UCkkGP5j-74o6QkG8Bw5xwLQ'}, 'canRate': True, 'viewerRating': 'none', 'likeCount': 0, 'publishedAt': '2022-10-23T16:40:15Z', 'updatedAt': '2022-10-23T16:40:15Z'}}, {'kind': 'youtube#comment', 'etag': '60hzaZE28gieaS1gJeWubJ7WB7E', 'id': 'UgxPYdVqJlIn0t41Uel4AaABAg.9hXRmH3TFpi9hXTLRZMwuQ', 'snippet': {'videoId': 'mngDDP48JKU', 'textDisplay': 'Mentir e espalhar fake News não é liberdade de expressão é crime', 'textOriginal': 'Mentir e espalhar fake News não é liberdade de expressão é crime', 'parentId': 'UgxPYdVqJlIn0t41Uel4AaABAg', 'authorDisplayName': 'Fernanda', 'authorProfileImageUrl': 'https://yt3.ggpht.com/JRvThTuZ_l3tFtzxbXWFlUEpsOTFQswF5vxrbVK2ONLU3kjTpD2MHhtYENlCYwU2_sRqUvbLFg=s48-c-k-c0x00ffffff-no-rj', 'authorChannelUrl': 'http://www.youtube.com/channel/UC7w-oIqaBVMZs3EKw16Izew', 'authorChannelId': {'value': 'UC7w-oIqaBVMZs3EKw16Izew'}, 'canRate': True, 'viewerRating': 'none', 'likeCount': 0, 'publishedAt': '2022-10-23T15:50:34Z', 'updatedAt': '2022-10-23T15:50:34Z'}}]}",UCBb3zW6q6UDL2lGbwEXc6fQ,2022-10-23T15:36:53Z,"Censura não, censura jamais. ✌️✌️✅🇧🇷🎵🎶",,2023-06-08 02:41:32.262018
