kind,etag,id,snippet,replies,authorChannelId,publishedAt,textOriginal,nextPageToken,extraction_date
youtube#commentThread,ZKE1oQUJjXf6Uvvq5Vr1akAtwyM,Ugy3apq44knkMwEo1Sp4AaABAg,"{'videoId': 'xW5dpM3khvI', 'topLevelComment': {'kind': 'youtube#comment', 'etag': '65JrGWS1idFUgWAWuLB-ybHO9ws', 'id': 'Ugy3apq44knkMwEo1Sp4AaABAg', 'snippet': {'videoId': 'xW5dpM3khvI', 'textDisplay': 'Fodac a opinião, vale a regra do jogo q Bozo quebrar a todo momento… O povo tomou essa ideia por pura burrice e vc, WW, parece ser tao burro qnt', 'textOriginal': 'Fodac a opinião, vale a regra do jogo q Bozo quebrar a todo momento… O povo tomou essa ideia por pura burrice e vc, WW, parece ser tao burro qnt', 'authorDisplayName': 'Patterson Duarte', 'authorProfileImageUrl': 'https://yt3.ggpht.com/ytc/AGIKgqOIRu07mZQhpUeFGETX47gMz9eFWIr1034nGKzd3g=s48-c-k-c0x00ffffff-no-rj', 'authorChannelUrl': 'http://www.youtube.com/channel/UCoSy0DHHdXvmBtGAimgOcEg', 'authorChannelId': {'value': 'UCoSy0DHHdXvmBtGAimgOcEg'}, 'canRate': True, 'viewerRating': 'none', 'likeCount': 0, 'publishedAt': '2022-10-26T01:29:05Z', 'updatedAt': '2022-10-26T01:29:05Z'}}, 'canReply': True, 'totalReplyCount': 0, 'isPublic': True}",,UCoSy0DHHdXvmBtGAimgOcEg,2022-10-26T01:29:05Z,"Fodac a opinião, vale a regra do jogo q Bozo quebrar a todo momento… O povo tomou essa ideia por pura burrice e vc, WW, parece ser tao burro qnt",,2023-06-08 02:33:23.766415
youtube#commentThread,B0iAQnDtPW5ubYB9PmZD9E6oWtY,UgzwjLjXBAo5CuC85454AaABAg,"{'videoId': 'xW5dpM3khvI', 'topLevelComment': {'kind': 'youtube#comment', 'etag': 'PgP_mnxR90eM-daysL-hb3deVIs', 'id': 'UgzwjLjXBAo5CuC85454AaABAg', 'snippet': {'videoId': 'xW5dpM3khvI', 'textDisplay': 'Como pode alguém ser absolvido quando o argumento é de presunção de inocencia? Ou foi absolvido ou foi sequer julgado... É censura, não há como não chamar quando te impedem de dizer um fato, ex presidiário', 'textOriginal': 'Como pode alguém ser absolvido quando o argumento é de presunção de inocencia? Ou foi absolvido ou foi sequer julgado... É censura, não há como não chamar quando te impedem de dizer um fato, ex presidiário', 'authorDisplayName': 'DUHVERSE', 'authorProfileImageUrl': 'https://yt3.ggpht.com/ytc/AGIKgqOgA3ArQdBvzS5T0JcMo2x8JH8VrA1kYqa-5NN3=s48-c-k-c0x00ffffff-no-rj', 'authorChannelUrl': 'http://www.youtube.com/channel/UC0qdW6isVBWSjekZLh7FYYw', 'authorChannelId': {'value': 'UC0qdW6isVBWSjekZLh7FYYw'}, 'canRate': True, 'viewerRating': 'none', 'likeCount': 0, 'publishedAt': '2022-10-26T01:26:51Z', 'updatedAt': '2022-10-26T01:26:51Z'}}, 'canReply': True, 'totalReplyCount': 0, 'isPublic': True}",,UC0qdW6isVBWSjekZLh7FYYw,2022-10-26T01:26:51Z,"Como pode alguém ser absolvido quando o argumento é de presunção de inocencia? Ou foi absolvido ou foi sequer julgado... É censura, não há como não chamar quando te impedem de dizer um fato, ex presidiário",,2023-06-08 02:33:23.766415
youtube#commentThread,3ktSFvJ6qYUKFXJY64B3awrPzfg,Ugyu9Dtr7MBTUoEzFqR4AaABAg,"{'videoId': 'xW5dpM3khvI', 'topLevelComment': {'kind': 'youtube#comment', 'etag': '_3NebfFUvmSsm5aZBpblPBMo0vc', 'id': 'Ugyu9Dtr7MBTUoEzFqR4AaABAg', 'snippet': {'videoId': 'xW5dpM3khvI', 'textDisplay': 'As emissoras de direita e as campanhas de direita começaram no Brasil a fazer fake news e infestaram as redes sociais de fake news digital desde que este atual governo ganhou, alías as ferramentais digitais se tornaram elementos essenciais em sua campanha e de seus aliados na disseminação de desinformação e ódio nestes últimos anos. Por outro lado os seus rivais políticos passaram a usar a mesma ferramenta para combater em igualdade a sujeira feital pela ala da direita e isso ajudou a piorar a situação. Apesar da  censura total não ser uma ação democrática e nem necessária , é no entanto necessário impor pesadas multas, e não apenas de milhares de reais , mais sim de milhões de reais dependo dos casos de desinformação, das empresas envolvidas ou pessoas que  veículam a desinformação.  Somente multas altamente pesadas ajudarão a conter esse fenômeno nojento que só aumentou na era bolsonarista..', 'textOriginal': 'As emissoras de direita e as campanhas de direita começaram no Brasil a fazer fake news e infestaram as redes sociais de fake news digital desde que este atual governo ganhou, alías as ferramentais digitais se tornaram elementos essenciais em sua campanha e de seus aliados na disseminação de desinformação e ódio nestes últimos anos. Por outro lado os seus rivais políticos passaram a usar a mesma ferramenta para combater em igualdade a sujeira feital pela ala da direita e isso ajudou a piorar a situação. Apesar da  censura total não ser uma ação democrática e nem necessária , é no entanto necessário impor pesadas multas, e não apenas de milhares de reais , mais sim de milhões de reais dependo dos casos de desinformação, das empresas envolvidas ou pessoas que  veículam a desinformação.  Somente multas altamente pesadas ajudarão a conter esse fenômeno nojento que só aumentou na era bolsonarista..', 'authorDisplayName': 'Paulo Junk', 'authorProfileImageUrl': 'https://yt3.ggpht.com/ytc/AGIKgqNFirorOPAto03encL-sYZDlE7QrI6b8wOFHLhp-T7k5SF_qgYK9nYm6zUkkwNP=s48-c-k-c0x00ffffff-no-rj', 'authorChannelUrl': 'http://www.youtube.com/channel/UCVrIwZ63XrdJUmN4XaGdHBw', 'authorChannelId': {'value': 'UCVrIwZ63XrdJUmN4XaGdHBw'}, 'canRate': True, 'viewerRating': 'none', 'likeCount': 0, 'publishedAt': '2022-10-26T01:25:53Z', 'updatedAt': '2022-10-26T01:30:47Z'}}, 'canReply': True, 'totalReplyCount': 0, 'isPublic': True}",,UCVrIwZ63XrdJUmN4XaGdHBw,2022-10-26T01:25:53Z,"As emissoras de direita e as campanhas de direita começaram no Brasil a fazer fake news e infestaram as redes sociais de fake news digital desde que este atual governo ganhou, alías as ferramentais digitais se tornaram elementos essenciais em sua campanha e de seus aliados na disseminação de desinformação e ódio nestes últimos anos. Por outro lado os seus rivais políticos passaram a usar a mesma ferramenta para combater em igualdade a sujeira feital pela ala da direita e isso ajudou a piorar a situação. Apesar da  censura total não ser uma ação democrática e nem necessária , é no entanto necessário impor pesadas multas, e não apenas de milhares de reais , mais sim de milhões de reais dependo dos casos de desinformação, das empresas envolvidas ou pessoas que  veículam a desinformação.  Somente multas altamente pesadas ajudarão a conter esse fenômeno nojento que só aumentou na era bolsonarista..",,2023-06-08 02:33:23.766415
youtube#commentThread,Uwj-gRBShlIs0Cg8LMcVdq9AdY4,UgzzQXHf_vKXXvPOg4R4AaABAg,"{'videoId': 'xW5dpM3khvI', 'topLevelComment': {'kind': 'youtube#comment', 'etag': 'CM65QxrOTfhrRQf3ouw-Yej1Ytw', 'id': 'UgzzQXHf_vKXXvPOg4R4AaABAg', 'snippet': {'videoId': 'xW5dpM3khvI', 'textDisplay': 'Só o Exército para acabar com essa ditadura de Toga', 'textOriginal': 'Só o Exército para acabar com essa ditadura de Toga', 'authorDisplayName': 'Francisco Pereira', 'authorProfileImageUrl': 'https://yt3.ggpht.com/ytc/AGIKgqO1jElaufFjhyZvRiGQVTOz3xOwD97s7sY_jxyrVVKxSvjXZ3xJ_ZShm1NosWHN=s48-c-k-c0x00ffffff-no-rj', 'authorChannelUrl': 'http://www.youtube.com/channel/UCuzNFqRd5GGyXDbC3avUOkg', 'authorChannelId': {'value': 'UCuzNFqRd5GGyXDbC3avUOkg'}, 'canRate': True, 'viewerRating': 'none', 'likeCount': 1, 'publishedAt': '2022-10-26T01:25:08Z', 'updatedAt': '2022-10-26T01:25:08Z'}}, 'canReply': True, 'totalReplyCount': 0, 'isPublic': True}",,UCuzNFqRd5GGyXDbC3avUOkg,2022-10-26T01:25:08Z,Só o Exército para acabar com essa ditadura de Toga,,2023-06-08 02:33:23.766415
youtube#commentThread,YE37FMIrcFP1iDgwLiVroIGPVSc,Ugzzw5y2frf_PUKoUfl4AaABAg,"{'videoId': 'xW5dpM3khvI', 'topLevelComment': {'kind': 'youtube#comment', 'etag': '5DBwdNlQkDsugN1TZgy1BFXad1g', 'id': 'Ugzzw5y2frf_PUKoUfl4AaABAg', 'snippet': {'videoId': 'xW5dpM3khvI', 'textDisplay': 'E a maioria desses Senadores, bunda mole, não fazem nada, estão é aplaudindo tudo fora da lei', 'textOriginal': 'E a maioria desses Senadores, bunda mole, não fazem nada, estão é aplaudindo tudo fora da lei', 'authorDisplayName': 'Francisco Pereira', 'authorProfileImageUrl': 'https://yt3.ggpht.com/ytc/AGIKgqO1jElaufFjhyZvRiGQVTOz3xOwD97s7sY_jxyrVVKxSvjXZ3xJ_ZShm1NosWHN=s48-c-k-c0x00ffffff-no-rj', 'authorChannelUrl': 'http://www.youtube.com/channel/UCuzNFqRd5GGyXDbC3avUOkg', 'authorChannelId': {'value': 'UCuzNFqRd5GGyXDbC3avUOkg'}, 'canRate': True, 'viewerRating': 'none', 'likeCount': 0, 'publishedAt': '2022-10-26T01:24:36Z', 'updatedAt': '2022-10-26T01:24:36Z'}}, 'canReply': True, 'totalReplyCount': 0, 'isPublic': True}",,UCuzNFqRd5GGyXDbC3avUOkg,2022-10-26T01:24:36Z,"E a maioria desses Senadores, bunda mole, não fazem nada, estão é aplaudindo tudo fora da lei",,2023-06-08 02:33:23.766415
youtube#commentThread,zaFXnyFYq4QVSR0vLY6Gd5pBGl0,Ugx-eZuQ4h2A99BQSvV4AaABAg,"{'videoId': 'xW5dpM3khvI', 'topLevelComment': {'kind': 'youtube#comment', 'etag': 't368cFc5pcvVoxeUwwyEvc7qz48', 'id': 'Ugx-eZuQ4h2A99BQSvV4AaABAg', 'snippet': {'videoId': 'xW5dpM3khvI', 'textDisplay': 'O Mendonça foi indicado pelo bolsonoe pra esquerda é suspeito mas e os indicados pelo PT decidir sobre coisas que beneficiam o PT?', 'textOriginal': 'O Mendonça foi indicado pelo bolsonoe pra esquerda é suspeito mas e os indicados pelo PT decidir sobre coisas que beneficiam o PT?', 'authorDisplayName': 'DUHVERSE', 'authorProfileImageUrl': 'https://yt3.ggpht.com/ytc/AGIKgqOgA3ArQdBvzS5T0JcMo2x8JH8VrA1kYqa-5NN3=s48-c-k-c0x00ffffff-no-rj', 'authorChannelUrl': 'http://www.youtube.com/channel/UC0qdW6isVBWSjekZLh7FYYw', 'authorChannelId': {'value': 'UC0qdW6isVBWSjekZLh7FYYw'}, 'canRate': True, 'viewerRating': 'none', 'likeCount': 0, 'publishedAt': '2022-10-26T01:24:25Z', 'updatedAt': '2022-10-26T01:24:25Z'}}, 'canReply': True, 'totalReplyCount': 0, 'isPublic': True}",,UC0qdW6isVBWSjekZLh7FYYw,2022-10-26T01:24:25Z,O Mendonça foi indicado pelo bolsonoe pra esquerda é suspeito mas e os indicados pelo PT decidir sobre coisas que beneficiam o PT?,,2023-06-08 02:33:23.766415
youtube#commentThread,RlxcztNhakSbaRB4LbR_6SpDuaI,UgweqlkNViuew0tEXTV4AaABAg,"{'videoId': 'xW5dpM3khvI', 'topLevelComment': {'kind': 'youtube#comment', 'etag': 'vULtR5rsCa3dmExwzQe-WtePdzQ', 'id': 'UgweqlkNViuew0tEXTV4AaABAg', 'snippet': {'videoId': 'xW5dpM3khvI', 'textDisplay': 'Quem confia, nesses Ministros do TSE e STF, que fazem aberrações a todo tempo', 'textOriginal': 'Quem confia, nesses Ministros do TSE e STF, que fazem aberrações a todo tempo', 'authorDisplayName': 'Francisco Pereira', 'authorProfileImageUrl': 'https://yt3.ggpht.com/ytc/AGIKgqO1jElaufFjhyZvRiGQVTOz3xOwD97s7sY_jxyrVVKxSvjXZ3xJ_ZShm1NosWHN=s48-c-k-c0x00ffffff-no-rj', 'authorChannelUrl': 'http://www.youtube.com/channel/UCuzNFqRd5GGyXDbC3avUOkg', 'authorChannelId': {'value': 'UCuzNFqRd5GGyXDbC3avUOkg'}, 'canRate': True, 'viewerRating': 'none', 'likeCount': 0, 'publishedAt': '2022-10-26T01:23:30Z', 'updatedAt': '2022-10-26T01:23:30Z'}}, 'canReply': True, 'totalReplyCount': 0, 'isPublic': True}",,UCuzNFqRd5GGyXDbC3avUOkg,2022-10-26T01:23:30Z,"Quem confia, nesses Ministros do TSE e STF, que fazem aberrações a todo tempo",,2023-06-08 02:33:23.766415
youtube#commentThread,-W_gHwSqMLrAU_QiCff-6U7UpBQ,UgyQqggDidC1DBmqrcR4AaABAg,"{'videoId': 'xW5dpM3khvI', 'topLevelComment': {'kind': 'youtube#comment', 'etag': '7ccvOCfjAzIcfBcm5u_Eg3LeUr4', 'id': 'UgyQqggDidC1DBmqrcR4AaABAg', 'snippet': {'videoId': 'xW5dpM3khvI', 'textDisplay': 'O STF julgando a medida de um colega do STF mas no TRE, teria como esperar algo diferente?', 'textOriginal': 'O STF julgando a medida de um colega do STF mas no TRE, teria como esperar algo diferente?', 'authorDisplayName': 'DUHVERSE', 'authorProfileImageUrl': 'https://yt3.ggpht.com/ytc/AGIKgqOgA3ArQdBvzS5T0JcMo2x8JH8VrA1kYqa-5NN3=s48-c-k-c0x00ffffff-no-rj', 'authorChannelUrl': 'http://www.youtube.com/channel/UC0qdW6isVBWSjekZLh7FYYw', 'authorChannelId': {'value': 'UC0qdW6isVBWSjekZLh7FYYw'}, 'canRate': True, 'viewerRating': 'none', 'likeCount': 4, 'publishedAt': '2022-10-26T01:23:24Z', 'updatedAt': '2022-10-26T01:23:24Z'}}, 'canReply': True, 'totalReplyCount': 0, 'isPublic': True}",,UC0qdW6isVBWSjekZLh7FYYw,2022-10-26T01:23:24Z,"O STF julgando a medida de um colega do STF mas no TRE, teria como esperar algo diferente?",,2023-06-08 02:33:23.766415
youtube#commentThread,8-1Jj9K_Tt6eRn4r9G4_krYUYMQ,Ugyr-MiMydNPVovXLgV4AaABAg,"{'videoId': 'xW5dpM3khvI', 'topLevelComment': {'kind': 'youtube#comment', 'etag': 'ckTJbhQg87r1TSH7CbN3-jbwhf8', 'id': 'Ugyr-MiMydNPVovXLgV4AaABAg', 'snippet': {'videoId': 'xW5dpM3khvI', 'textDisplay': '22🇧🇷🇧🇷🇧🇷🇧🇷', 'textOriginal': '22🇧🇷🇧🇷🇧🇷🇧🇷', 'authorDisplayName': 'yang', 'authorProfileImageUrl': 'https://yt3.ggpht.com/cfwAYgzn3_yHZSbdS2UvuE2j5BYerG-bd9PcTm-QYzvje8wOOLBjIEA3cm5Qs3OnFarjFnZo5Q=s48-c-k-c0x00ffffff-no-rj', 'authorChannelUrl': 'http://www.youtube.com/channel/UCnVKVc-hYi_jMzwva06hVOQ', 'authorChannelId': {'value': 'UCnVKVc-hYi_jMzwva06hVOQ'}, 'canRate': True, 'viewerRating': 'none', 'likeCount': 3, 'publishedAt': '2022-10-26T01:23:22Z', 'updatedAt': '2022-10-26T01:23:22Z'}}, 'canReply': True, 'totalReplyCount': 0, 'isPublic': True}",,UCnVKVc-hYi_jMzwva06hVOQ,2022-10-26T01:23:22Z,22🇧🇷🇧🇷🇧🇷🇧🇷,,2023-06-08 02:33:23.766415
youtube#commentThread,2SPcMIU4agwgXtldwD46ZfL-Z2s,UgxOn-f7872PU1aJuIJ4AaABAg,"{'videoId': 'xW5dpM3khvI', 'topLevelComment': {'kind': 'youtube#comment', 'etag': 'qukuKhaAOh88M7QJYwwhdJ_f58c', 'id': 'UgxOn-f7872PU1aJuIJ4AaABAg', 'snippet': {'videoId': 'xW5dpM3khvI', 'textDisplay': 'Bom saber q boa parte da população e não só os bolsonaristas tem essa noção da ditaduras estamos vivendo. Pior ainda são os discursos cada vez mais absurdos dizendo q condena a ditadura mas “excepcionalmente nesse caso” é permitido ou pérolas como “desordem informacional”. Eles se valem da ignorância da maioria da população q sequer sabem a função desses ministros, o q eles n contam é com a internet e com a informação descentralizada das redes. Na tentativa de manter as eleições limpas o TSE já interferiu dando vantagem pra um dos lados', 'textOriginal': 'Bom saber q boa parte da população e não só os bolsonaristas tem essa noção da ditaduras estamos vivendo. Pior ainda são os discursos cada vez mais absurdos dizendo q condena a ditadura mas “excepcionalmente nesse caso” é permitido ou pérolas como “desordem informacional”. Eles se valem da ignorância da maioria da população q sequer sabem a função desses ministros, o q eles n contam é com a internet e com a informação descentralizada das redes. Na tentativa de manter as eleições limpas o TSE já interferiu dando vantagem pra um dos lados', 'authorDisplayName': 'Renato Ramos', 'authorProfileImageUrl': 'https://yt3.ggpht.com/ytc/AGIKgqNJFTT9QOgACq9Mrg3ggHmpfBCTTM93lak7Hg=s48-c-k-c0x00ffffff-no-rj', 'authorChannelUrl': 'http://www.youtube.com/channel/UCfmnTu8LaoexrhqUu9Z5IxA', 'authorChannelId': {'value': 'UCfmnTu8LaoexrhqUu9Z5IxA'}, 'canRate': True, 'viewerRating': 'none', 'likeCount': 0, 'publishedAt': '2022-10-26T01:20:48Z', 'updatedAt': '2022-10-26T01:20:48Z'}}, 'canReply': True, 'totalReplyCount': 0, 'isPublic': True}",,UCfmnTu8LaoexrhqUu9Z5IxA,2022-10-26T01:20:48Z,"Bom saber q boa parte da população e não só os bolsonaristas tem essa noção da ditaduras estamos vivendo. Pior ainda são os discursos cada vez mais absurdos dizendo q condena a ditadura mas “excepcionalmente nesse caso” é permitido ou pérolas como “desordem informacional”. Eles se valem da ignorância da maioria da população q sequer sabem a função desses ministros, o q eles n contam é com a internet e com a informação descentralizada das redes. Na tentativa de manter as eleições limpas o TSE já interferiu dando vantagem pra um dos lados",,2023-06-08 02:33:23.766415
youtube#commentThread,bh25hSNqQz3XDpIQCT5Moxx6cH4,Ugy71jPZ2Xvqn76vR6t4AaABAg,"{'videoId': 'xW5dpM3khvI', 'topLevelComment': {'kind': 'youtube#comment', 'etag': 'J1Br5uibPgmPs8NJOMXF0WMmjLY', 'id': 'Ugy71jPZ2Xvqn76vR6t4AaABAg', 'snippet': {'videoId': 'xW5dpM3khvI', 'textDisplay': 'STF E TSE RASGOU A CONSTITUIÇÃO FAZ TEMPO.  AS INSTITUIÇÕES NO BRASIL SÃO BRICS POLITICOS.', 'textOriginal': 'STF E TSE RASGOU A CONSTITUIÇÃO FAZ TEMPO.  AS INSTITUIÇÕES NO BRASIL SÃO BRICS POLITICOS.', 'authorDisplayName': 'Greice kelli', 'authorProfileImageUrl': 'https://yt3.ggpht.com/ZzjJuK5J80_EAIz6WSiHWJqwBD1AbLeHcRO7JQ7v8Q9OlR6axC0qn3Qk07BH3gUXq1mkXrz5=s48-c-k-c0x00ffffff-no-rj', 'authorChannelUrl': 'http://www.youtube.com/channel/UC6ym4mjDTe0PVWuuOsGp3Iw', 'authorChannelId': {'value': 'UC6ym4mjDTe0PVWuuOsGp3Iw'}, 'canRate': True, 'viewerRating': 'none', 'likeCount': 0, 'publishedAt': '2022-10-26T01:17:29Z', 'updatedAt': '2022-10-26T01:17:29Z'}}, 'canReply': True, 'totalReplyCount': 0, 'isPublic': True}",,UC6ym4mjDTe0PVWuuOsGp3Iw,2022-10-26T01:17:29Z,STF E TSE RASGOU A CONSTITUIÇÃO FAZ TEMPO.  AS INSTITUIÇÕES NO BRASIL SÃO BRICS POLITICOS.,,2023-06-08 02:33:23.766415
youtube#commentThread,1GKjfDbWUOtyJnOebQxfgHx4TBw,Ugx3Ud03rbx67Z4XaSt4AaABAg,"{'videoId': 'xW5dpM3khvI', 'topLevelComment': {'kind': 'youtube#comment', 'etag': 'lSDeUH90jUBMEHc4dju2XRLWA-Y', 'id': 'Ugx3Ud03rbx67Z4XaSt4AaABAg', 'snippet': {'videoId': 'xW5dpM3khvI', 'textDisplay': 'Mito 22 !!!!', 'textOriginal': 'Mito 22 !!!!', 'authorDisplayName': 'Fantasma 01 Fantasma', 'authorProfileImageUrl': 'https://yt3.ggpht.com/ytc/AGIKgqOKNvpLP6GXTEfqLh4x86gGNvLtOqeqt8b2pw=s48-c-k-c0x00ffffff-no-rj', 'authorChannelUrl': 'http://www.youtube.com/channel/UCRZdvhBX8nS-AsRm4_xVNVQ', 'authorChannelId': {'value': 'UCRZdvhBX8nS-AsRm4_xVNVQ'}, 'canRate': True, 'viewerRating': 'none', 'likeCount': 6, 'publishedAt': '2022-10-26T01:16:24Z', 'updatedAt': '2022-10-26T01:16:24Z'}}, 'canReply': True, 'totalReplyCount': 0, 'isPublic': True}",,UCRZdvhBX8nS-AsRm4_xVNVQ,2022-10-26T01:16:24Z,Mito 22 !!!!,,2023-06-08 02:33:23.766415
youtube#commentThread,EOvqMKQy-Ve-d8151QgLUO3KtMM,UgzaH0oRctS-e1WKxDh4AaABAg,"{'videoId': 'xW5dpM3khvI', 'topLevelComment': {'kind': 'youtube#comment', 'etag': 'ye1Q8gBgaQO7HU9yYvWd06tElnQ', 'id': 'UgzaH0oRctS-e1WKxDh4AaABAg', 'snippet': {'videoId': 'xW5dpM3khvI', 'textDisplay': 'Eles vão saber o que ditadura se Bolsonaro for reeleito. Quando implantar mais ministros no STF para favorecer o mesmo e seus pares como ocorre na Venezuela, El Salvador, Polônia e Hungria. O STF é o guardião da constituição e Bolsonaro não há respeita!', 'textOriginal': 'Eles vão saber o que ditadura se Bolsonaro for reeleito. Quando implantar mais ministros no STF para favorecer o mesmo e seus pares como ocorre na Venezuela, El Salvador, Polônia e Hungria. O STF é o guardião da constituição e Bolsonaro não há respeita!', 'authorDisplayName': '#🅿️OUCAS 🅿️ALAVRAS', 'authorProfileImageUrl': 'https://yt3.ggpht.com/Fs4PPQBbAnXBAq3XDsWYeGVJrXFU13igF0LVgsyj59OOc5HJ5zuNAIegbzoLt8zXBdc5DuYLvw=s48-c-k-c0x00ffffff-no-rj', 'authorChannelUrl': 'http://www.youtube.com/channel/UCAxqrPvruxwPosCwECU5iOg', 'authorChannelId': {'value': 'UCAxqrPvruxwPosCwECU5iOg'}, 'canRate': True, 'viewerRating': 'none', 'likeCount': 0, 'publishedAt': '2022-10-26T01:16:02Z', 'updatedAt': '2022-10-26T01:16:02Z'}}, 'canReply': True, 'totalReplyCount': 0, 'isPublic': True}",,UCAxqrPvruxwPosCwECU5iOg,2022-10-26T01:16:02Z,"Eles vão saber o que ditadura se Bolsonaro for reeleito. Quando implantar mais ministros no STF para favorecer o mesmo e seus pares como ocorre na Venezuela, El Salvador, Polônia e Hungria. O STF é o guardião da constituição e Bolsonaro não há respeita!",,2023-06-08 02:33:23.766415
youtube#commentThread,moOU0-g2mEXzOPKlUn-6yJI306Q,UgyJiD_noQx826WI3Xd4AaABAg,"{'videoId': 'xW5dpM3khvI', 'topLevelComment': {'kind': 'youtube#comment', 'etag': '3b9RxBYVwrKMTHtaxJtcxOMgw3U', 'id': 'UgyJiD_noQx826WI3Xd4AaABAg', 'snippet': {'videoId': 'xW5dpM3khvI', 'textDisplay': 'Concordo plenamente com você', 'textOriginal': 'Concordo plenamente com você', 'authorDisplayName': 'Maurílio Leonardo', 'authorProfileImageUrl': 'https://yt3.ggpht.com/ytc/AGIKgqOuqOUzhRlIDvTFoh-YKko0-Jw09SK310u4OA=s48-c-k-c0x00ffffff-no-rj', 'authorChannelUrl': 'http://www.youtube.com/channel/UCrLwbOzbHyJFO8zi_sXcRWA', 'authorChannelId': {'value': 'UCrLwbOzbHyJFO8zi_sXcRWA'}, 'canRate': True, 'viewerRating': 'none', 'likeCount': 5, 'publishedAt': '2022-10-26T01:15:55Z', 'updatedAt': '2022-10-26T01:15:55Z'}}, 'canReply': True, 'totalReplyCount': 0, 'isPublic': True}",,UCrLwbOzbHyJFO8zi_sXcRWA,2022-10-26T01:15:55Z,Concordo plenamente com você,,2023-06-08 02:33:23.766415
youtube#commentThread,tfSjI_nfqpmEW_kUlAxBD7dIFc0,UgwJG9cvGzOu6Rn6P254AaABAg,"{'videoId': 'xW5dpM3khvI', 'topLevelComment': {'kind': 'youtube#comment', 'etag': 'q1hXVQkVqWQsbXo3Y4J_MLo-1GU', 'id': 'UgwJG9cvGzOu6Rn6P254AaABAg', 'snippet': {'videoId': 'xW5dpM3khvI', 'textDisplay': 'CNN JORNALISMO LIXO!<br>WW decadente!', 'textOriginal': 'CNN JORNALISMO LIXO!\\nWW decadente!', 'authorDisplayName': 'Ricardo Silva', 'authorProfileImageUrl': 'https://yt3.ggpht.com/ytc/AGIKgqPf3X7h4fgjcCgqrDUggVYLfXT-W2-R4Dh2MA=s48-c-k-c0x00ffffff-no-rj', 'authorChannelUrl': 'http://www.youtube.com/channel/UCSg2G83OWE79ePX7lQcDDaQ', 'authorChannelId': {'value': 'UCSg2G83OWE79ePX7lQcDDaQ'}, 'canRate': True, 'viewerRating': 'none', 'likeCount': 0, 'publishedAt': '2022-10-26T01:15:14Z', 'updatedAt': '2022-10-26T01:15:14Z'}}, 'canReply': True, 'totalReplyCount': 0, 'isPublic': True}",,UCSg2G83OWE79ePX7lQcDDaQ,2022-10-26T01:15:14Z,"CNN JORNALISMO LIXO!
WW decadente!",,2023-06-08 02:33:23.766415
youtube#commentThread,rPjbva08udTFe3mxpN2NIrfalZw,UgzI6p_6xwXxjO4lN9p4AaABAg,"{'videoId': 'xW5dpM3khvI', 'topLevelComment': {'kind': 'youtube#comment', 'etag': 'GpBYH1t8h7DYyxZ2dFml8W7fs3U', 'id': 'UgzI6p_6xwXxjO4lN9p4AaABAg', 'snippet': {'videoId': 'xW5dpM3khvI', 'textDisplay': 'Bolsonaristas querem ditadura.', 'textOriginal': 'Bolsonaristas querem ditadura.', 'authorDisplayName': 'Valmir Machado de Souza', 'authorProfileImageUrl': 'https://yt3.ggpht.com/ytc/AGIKgqMLGmB2iMvQ-AWcbiz0NZruzgekT7KJHZ98_Q=s48-c-k-c0x00ffffff-no-rj', 'authorChannelUrl': 'http://www.youtube.com/channel/UCKhKETUJiXosT2FWKbfqvlg', 'authorChannelId': {'value': 'UCKhKETUJiXosT2FWKbfqvlg'}, 'canRate': True, 'viewerRating': 'none', 'likeCount': 0, 'publishedAt': '2022-10-26T01:15:04Z', 'updatedAt': '2022-10-26T01:15:04Z'}}, 'canReply': True, 'totalReplyCount': 0, 'isPublic': True}",,UCKhKETUJiXosT2FWKbfqvlg,2022-10-26T01:15:04Z,Bolsonaristas querem ditadura.,,2023-06-08 02:33:23.766415
youtube#commentThread,WBO8SYNiCsvX4eUXyxL9hVAHd5U,UgzFro9FMRG_n1NAyXN4AaABAg,"{'videoId': 'xW5dpM3khvI', 'topLevelComment': {'kind': 'youtube#comment', 'etag': 'Xqe_7WS4bLXqcsy_9UjeoR9DnB0', 'id': 'UgzFro9FMRG_n1NAyXN4AaABAg', 'snippet': {'videoId': 'xW5dpM3khvI', 'textDisplay': 'Se conseguiram roubar o tempo de Bolsonaro em rádio imaginem nas urnas.  Rapaz a coisa está feia viu kkk e Brasil 🇧🇷', 'textOriginal': 'Se conseguiram roubar o tempo de Bolsonaro em rádio imaginem nas urnas.  Rapaz a coisa está feia viu kkk e Brasil 🇧🇷', 'authorDisplayName': 'whesley silva', 'authorProfileImageUrl': 'https://yt3.ggpht.com/ytc/AGIKgqPHAPWse7J5QOhQmUAkukYQyUd3iAkwf30OZGomTvo=s48-c-k-c0x00ffffff-no-rj', 'authorChannelUrl': 'http://www.youtube.com/channel/UCQt3mKN1LUBjCcDiHYSr9QA', 'authorChannelId': {'value': 'UCQt3mKN1LUBjCcDiHYSr9QA'}, 'canRate': True, 'viewerRating': 'none', 'likeCount': 13, 'publishedAt': '2022-10-26T01:13:19Z', 'updatedAt': '2022-10-26T01:13:19Z'}}, 'canReply': True, 'totalReplyCount': 1, 'isPublic': True}","{'comments': [{'kind': 'youtube#comment', 'etag': 'zWPIfgUIkm2gYy2dPgYLLEATerk', 'id': 'UgzFro9FMRG_n1NAyXN4AaABAg.9hccKrmlknd9hcdQs8xB85', 'snippet': {'videoId': 'xW5dpM3khvI', 'textDisplay': 'na cabeça de terra planista tudo é ameaça e conspiração', 'textOriginal': 'na cabeça de terra planista tudo é ameaça e conspiração', 'parentId': 'UgzFro9FMRG_n1NAyXN4AaABAg', 'authorDisplayName': 'BFR Comps', 'authorProfileImageUrl': 'https://yt3.ggpht.com/63vj41KzUghZr4ke61kT6Qc0144M9Cs42AYDTSU5FO-DUllPwGkms3jh1bD-tPxnb-YvFlXRfw=s48-c-k-c0x00ffffff-no-rj', 'authorChannelUrl': 'http://www.youtube.com/channel/UC9vdVmkB7MgS5nsgROamTsw', 'authorChannelId': {'value': 'UC9vdVmkB7MgS5nsgROamTsw'}, 'canRate': True, 'viewerRating': 'none', 'likeCount': 0, 'publishedAt': '2022-10-26T01:22:52Z', 'updatedAt': '2022-10-26T01:22:52Z'}}]}",UCQt3mKN1LUBjCcDiHYSr9QA,2022-10-26T01:13:19Z,Se conseguiram roubar o tempo de Bolsonaro em rádio imaginem nas urnas.  Rapaz a coisa está feia viu kkk e Brasil 🇧🇷,,2023-06-08 02:33:23.766415
