kind,etag,id,snippet,replies,authorChannelId,publishedAt,textOriginal,nextPageToken,extraction_date
youtube#commentThread,u4vJ-8j977a3PNHdOLNMq5RZ4u0,Ugxc2VYOa6kfp5jypbt4AaABAg,"{'videoId': 'Fz0PCYu4hJg', 'topLevelComment': {'kind': 'youtube#comment', 'etag': 'r05VatvuH4Kcb9ewF9SjL72sqOE', 'id': 'Ugxc2VYOa6kfp5jypbt4AaABAg', 'snippet': {'videoId': 'Fz0PCYu4hJg', 'textDisplay': 'Essa Daniela LULISTA fala de Lula sempre no positivo, qundo é Bolsonaro ela só fala no negativo, lamentável!', 'textOriginal': 'Essa Daniela LULISTA fala de Lula sempre no positivo, qundo é Bolsonaro ela só fala no negativo, lamentável!', 'authorDisplayName': 'Lock Sempre', 'authorProfileImageUrl': 'https://yt3.ggpht.com/lLtMTsagAGdZHD-PbjIX-mqTx02JLUMIqdH3LKKzUiROA6cnoTOTDnlvkiKxSCyWf_uJiOL7e3U=s48-c-k-c0x00ffffff-no-rj', 'authorChannelUrl': 'http://www.youtube.com/channel/UCsKZ5hdk042c6ourDOso1DQ', 'authorChannelId': {'value': 'UCsKZ5hdk042c6ourDOso1DQ'}, 'canRate': True, 'viewerRating': 'none', 'likeCount': 0, 'publishedAt': '2022-10-12T23:20:30Z', 'updatedAt': '2022-10-12T23:20:30Z'}}, 'canReply': True, 'totalReplyCount': 1, 'isPublic': True}","{'comments': [{'kind': 'youtube#comment', 'etag': '7v63jYHHkqfULduV_jC6V45NT_0', 'id': 'Ugxc2VYOa6kfp5jypbt4AaABAg.9h5x5GLhMFv9h5zMkc5KKn', 'snippet': {'videoId': 'Fz0PCYu4hJg', 'textDisplay': 'Vai para a Jovem Pan, lá você vai encontrar quase todos defendendo o seu Deus BolsoAzno.', 'textOriginal': 'Vai para a Jovem Pan, lá você vai encontrar quase todos defendendo o seu Deus BolsoAzno.', 'parentId': 'Ugxc2VYOa6kfp5jypbt4AaABAg', 'authorDisplayName': 'Arão Bortolini de Oliveira', 'authorProfileImageUrl': 'https://yt3.ggpht.com/WkwPCiSig6UovbamMpyS_fP2gM6u8A-RwDHz8NZp6zFj5w6lCXdhgUEB0bSPS5gyd9vLmlz1pg=s48-c-k-c0x00ffffff-no-rj', 'authorChannelUrl': 'http://www.youtube.com/channel/UCvHEuJ7OIF1mNhzkCYcpiaA', 'authorChannelId': {'value': 'UCvHEuJ7OIF1mNhzkCYcpiaA'}, 'canRate': True, 'viewerRating': 'none', 'likeCount': 0, 'publishedAt': '2022-10-12T23:40:22Z', 'updatedAt': '2022-10-12T23:40:22Z'}}]}",UCsKZ5hdk042c6ourDOso1DQ,2022-10-12T23:20:30Z,"Essa Daniela LULISTA fala de Lula sempre no positivo, qundo é Bolsonaro ela só fala no negativo, lamentável!",,2023-06-08 11:07:43.966008
youtube#commentThread,13ICKQqIA-1dsGTALhxbdtCOSxs,Ugx9hU2tG4r9rEX-lRJ4AaABAg,"{'videoId': 'Fz0PCYu4hJg', 'topLevelComment': {'kind': 'youtube#comment', 'etag': 'zPbEQbDeh4s60q9f0PFe1Pp3dxs', 'id': 'Ugx9hU2tG4r9rEX-lRJ4AaABAg', 'snippet': {'videoId': 'Fz0PCYu4hJg', 'textDisplay': 'Parei em segundo as pesquisas 😃', 'textOriginal': 'Parei em segundo as pesquisas 😃', 'authorDisplayName': 'Antonio ufficiale', 'authorProfileImageUrl': 'https://yt3.ggpht.com/ytc/AGIKgqOFOUWnLH_LxayCwW6iaSpqfQEUUVCvNvP-uH27=s48-c-k-c0x00ffffff-no-rj', 'authorChannelUrl': 'http://www.youtube.com/channel/UCF7S9VFP9pMlgOHVedc4LyA', 'authorChannelId': {'value': 'UCF7S9VFP9pMlgOHVedc4LyA'}, 'canRate': True, 'viewerRating': 'none', 'likeCount': 0, 'publishedAt': '2022-10-12T23:18:35Z', 'updatedAt': '2022-10-12T23:18:35Z'}}, 'canReply': True, 'totalReplyCount': 0, 'isPublic': True}",,UCF7S9VFP9pMlgOHVedc4LyA,2022-10-12T23:18:35Z,Parei em segundo as pesquisas 😃,,2023-06-08 11:07:43.966008
youtube#commentThread,r_0PTL6SF1LhqpBLiJ6-rWVDTQQ,UgzhoOpUQErd5wp1N1p4AaABAg,"{'videoId': 'Fz0PCYu4hJg', 'topLevelComment': {'kind': 'youtube#comment', 'etag': 'kTNLb6tZpF73xMgRzI60w9c085Y', 'id': 'UgzhoOpUQErd5wp1N1p4AaABAg', 'snippet': {'videoId': 'Fz0PCYu4hJg', 'textDisplay': 'Eu não sei nem a que horas passa o horário eleitoral e esse pessoal é tão &quot;eficiente&quot; que sequer divulga o horário... É triste ver 4,9 bilhões de reais serem jogados na lata do lixo em apenas 45 dias, enquanto os dois candidatos fingem que se preocupam com a fome no Brasil...', 'textOriginal': 'Eu não sei nem a que horas passa o horário eleitoral e esse pessoal é tão ""eficiente"" que sequer divulga o horário... É triste ver 4,9 bilhões de reais serem jogados na lata do lixo em apenas 45 dias, enquanto os dois candidatos fingem que se preocupam com a fome no Brasil...', 'authorDisplayName': 'Selena Moselle', 'authorProfileImageUrl': 'https://yt3.ggpht.com/8IRnrZYz3Ga5pxeeDvaXux1hBvtugrOeFsZfA01Vlc6S7Zt1qEnEZ_aS7OWFw0HOQNUALW-8BQ=s48-c-k-c0x00ffffff-no-rj', 'authorChannelUrl': 'http://www.youtube.com/channel/UCj8HwHGln9iZ5rC6EeQMU2A', 'authorChannelId': {'value': 'UCj8HwHGln9iZ5rC6EeQMU2A'}, 'canRate': True, 'viewerRating': 'none', 'likeCount': 0, 'publishedAt': '2022-10-12T23:02:31Z', 'updatedAt': '2022-10-12T23:02:31Z'}}, 'canReply': True, 'totalReplyCount': 0, 'isPublic': True}",,UCj8HwHGln9iZ5rC6EeQMU2A,2022-10-12T23:02:31Z,"Eu não sei nem a que horas passa o horário eleitoral e esse pessoal é tão ""eficiente"" que sequer divulga o horário... É triste ver 4,9 bilhões de reais serem jogados na lata do lixo em apenas 45 dias, enquanto os dois candidatos fingem que se preocupam com a fome no Brasil...",,2023-06-08 11:07:43.966008
youtube#commentThread,sydcC2z8ePBJIsMb9T4atzdfXDM,UgwmWhEEDMxV6Kf6ovN4AaABAg,"{'videoId': 'Fz0PCYu4hJg', 'topLevelComment': {'kind': 'youtube#comment', 'etag': 'bhM_n38NU6YkVRT7NpH9BXO9_B0', 'id': 'UgwmWhEEDMxV6Kf6ovN4AaABAg', 'snippet': {'videoId': 'Fz0PCYu4hJg', 'textDisplay': 'Essa mídia é mesmos um lixo agora a CNN lacrando pro Lula.', 'textOriginal': 'Essa mídia é mesmos um lixo agora a CNN lacrando pro Lula.', 'authorDisplayName': 'Adriano Stoppa', 'authorProfileImageUrl': 'https://yt3.ggpht.com/ytc/AGIKgqOzm_KfzZqG5k2_hAdRsWdalHSRbLKe64T9TIPynQ=s48-c-k-c0x00ffffff-no-rj', 'authorChannelUrl': 'http://www.youtube.com/channel/UCxxXqrmclXFUqLPGFJXJAuw', 'authorChannelId': {'value': 'UCxxXqrmclXFUqLPGFJXJAuw'}, 'canRate': True, 'viewerRating': 'none', 'likeCount': 0, 'publishedAt': '2022-10-12T22:59:10Z', 'updatedAt': '2022-10-12T23:02:45Z'}}, 'canReply': True, 'totalReplyCount': 0, 'isPublic': True}",,UCxxXqrmclXFUqLPGFJXJAuw,2022-10-12T22:59:10Z,Essa mídia é mesmos um lixo agora a CNN lacrando pro Lula.,,2023-06-08 11:07:43.966008
youtube#commentThread,EpsV3PP7aRaBvTKxDvQGy0xxs80,Ugx0rCAjQg2hSp-Ye8N4AaABAg,"{'videoId': 'Fz0PCYu4hJg', 'topLevelComment': {'kind': 'youtube#comment', 'etag': 'Lw66qTUBzCdpU8MsAjEeSS0hEFU', 'id': 'Ugx0rCAjQg2hSp-Ye8N4AaABAg', 'snippet': {'videoId': 'Fz0PCYu4hJg', 'textDisplay': 'Qg?  Eita haja estômago pra suportar essa imprensa marrom e deveria ser realmente censurado a grande mídia pra ceder lugar a quem realmente se propor a dizer a verdade', 'textOriginal': 'Qg?  Eita haja estômago pra suportar essa imprensa marrom e deveria ser realmente censurado a grande mídia pra ceder lugar a quem realmente se propor a dizer a verdade', 'authorDisplayName': 'Herbert Silva', 'authorProfileImageUrl': 'https://yt3.ggpht.com/ytc/AGIKgqPElKuyt3tXSfPwPHEuIM1SJsUvrz87uNUeiQd5lA=s48-c-k-c0x00ffffff-no-rj', 'authorChannelUrl': 'http://www.youtube.com/channel/UC0yi_TFuDQpFo5sIC-OSaCg', 'authorChannelId': {'value': 'UC0yi_TFuDQpFo5sIC-OSaCg'}, 'canRate': True, 'viewerRating': 'none', 'likeCount': 0, 'publishedAt': '2022-10-12T22:05:07Z', 'updatedAt': '2022-10-12T22:05:07Z'}}, 'canReply': True, 'totalReplyCount': 0, 'isPublic': True}",,UC0yi_TFuDQpFo5sIC-OSaCg,2022-10-12T22:05:07Z,Qg?  Eita haja estômago pra suportar essa imprensa marrom e deveria ser realmente censurado a grande mídia pra ceder lugar a quem realmente se propor a dizer a verdade,,2023-06-08 11:07:43.966008
youtube#commentThread,JkXdD3Fvk6uVf0Hd-XADu38fxOM,UgwkL1tMG6P3VlQHs2J4AaABAg,"{'videoId': 'Fz0PCYu4hJg', 'topLevelComment': {'kind': 'youtube#comment', 'etag': 'R7FMFIBnmMCKwWibngJjJ2coCU0', 'id': 'UgwkL1tMG6P3VlQHs2J4AaABAg', 'snippet': {'videoId': 'Fz0PCYu4hJg', 'textDisplay': 'Cade os escândalos de corrupção do pt que essa animal não fala?', 'textOriginal': 'Cade os escândalos de corrupção do pt que essa animal não fala?', 'authorDisplayName': 'Felipe Vieira', 'authorProfileImageUrl': 'https://yt3.ggpht.com/ytc/AGIKgqPxt79uyWuDkOJJfbh0W86CfMtHA6AKfcxk6Q=s48-c-k-c0x00ffffff-no-rj', 'authorChannelUrl': 'http://www.youtube.com/channel/UC1kRa0D_pWAk2Z37NhC9DuA', 'authorChannelId': {'value': 'UC1kRa0D_pWAk2Z37NhC9DuA'}, 'canRate': True, 'viewerRating': 'none', 'likeCount': 0, 'publishedAt': '2022-10-12T21:45:32Z', 'updatedAt': '2022-10-12T21:45:32Z'}}, 'canReply': True, 'totalReplyCount': 0, 'isPublic': True}",,UC1kRa0D_pWAk2Z37NhC9DuA,2022-10-12T21:45:32Z,Cade os escândalos de corrupção do pt que essa animal não fala?,,2023-06-08 11:07:43.966008
youtube#commentThread,XJdEjUVpikefxRl2V35O7FhZBt0,Ugysydza0rgW3SBxpwN4AaABAg,"{'videoId': 'Fz0PCYu4hJg', 'topLevelComment': {'kind': 'youtube#comment', 'etag': 'C19kSoOgVdTMjMVuHHRz_Law8WU', 'id': 'Ugysydza0rgW3SBxpwN4AaABAg', 'snippet': {'videoId': 'Fz0PCYu4hJg', 'textDisplay': 'Eu sou totalmente averso a idolatria política, tanto que nem vi essa propaganda, mas só Deal falando da vontade de chorar pela expectativa que coloco no Lula...', 'textOriginal': 'Eu sou totalmente averso a idolatria política, tanto que nem vi essa propaganda, mas só Deal falando da vontade de chorar pela expectativa que coloco no Lula...', 'authorDisplayName': 'Carlos Xavier', 'authorProfileImageUrl': 'https://yt3.ggpht.com/ytc/AGIKgqMc8pV3F1r4QZ4xSFtjonV5uV119dBRa2bLXUwUpQ=s48-c-k-c0x00ffffff-no-rj', 'authorChannelUrl': 'http://www.youtube.com/channel/UCEgd7mM3wnHCknXTUp_DYVQ', 'authorChannelId': {'value': 'UCEgd7mM3wnHCknXTUp_DYVQ'}, 'canRate': True, 'viewerRating': 'none', 'likeCount': 0, 'publishedAt': '2022-10-12T21:39:33Z', 'updatedAt': '2022-10-12T21:39:33Z'}}, 'canReply': True, 'totalReplyCount': 0, 'isPublic': True}",,UCEgd7mM3wnHCknXTUp_DYVQ,2022-10-12T21:39:33Z,"Eu sou totalmente averso a idolatria política, tanto que nem vi essa propaganda, mas só Deal falando da vontade de chorar pela expectativa que coloco no Lula...",,2023-06-08 11:07:43.966008
youtube#commentThread,Z7tBTYY2qcAu-nabYF281c_Jd98,UgxHhqBhU-PblFH8HSZ4AaABAg,"{'videoId': 'Fz0PCYu4hJg', 'topLevelComment': {'kind': 'youtube#comment', 'etag': 'V58BAmtwA4HPkD-cHxWBf254Cdc', 'id': 'UgxHhqBhU-PblFH8HSZ4AaABAg', 'snippet': {'videoId': 'Fz0PCYu4hJg', 'textDisplay': 'Fora Bolsonaro acabou pra você', 'textOriginal': 'Fora Bolsonaro acabou pra você', 'authorDisplayName': 'Lailson Micael', 'authorProfileImageUrl': 'https://yt3.ggpht.com/ytc/AGIKgqM5_yQ0MoSGMnbbJOL-uZEwb0jRHekYDCIA8Jfs=s48-c-k-c0x00ffffff-no-rj', 'authorChannelUrl': 'http://www.youtube.com/channel/UCwI7IPMqOHg-JncGd-nKVlQ', 'authorChannelId': {'value': 'UCwI7IPMqOHg-JncGd-nKVlQ'}, 'canRate': True, 'viewerRating': 'none', 'likeCount': 1, 'publishedAt': '2022-10-12T21:38:15Z', 'updatedAt': '2022-10-12T21:38:15Z'}}, 'canReply': True, 'totalReplyCount': 0, 'isPublic': True}",,UCwI7IPMqOHg-JncGd-nKVlQ,2022-10-12T21:38:15Z,Fora Bolsonaro acabou pra você,,2023-06-08 11:07:43.966008
youtube#commentThread,dFNgU4_mhj3RebprZswGpWiILic,UgzVYqrW9ZjNVAJo_Xx4AaABAg,"{'videoId': 'Fz0PCYu4hJg', 'topLevelComment': {'kind': 'youtube#comment', 'etag': '8N_8YDXZhFW9fK-MfWoMd3lhsSU', 'id': 'UgzVYqrW9ZjNVAJo_Xx4AaABAg', 'snippet': {'videoId': 'Fz0PCYu4hJg', 'textDisplay': 'Parcialidade jornalista que fala né? KKKKKKKKKK... Começou bem, depois iniciou a militancia para o 9 dedos.', 'textOriginal': 'Parcialidade jornalista que fala né? KKKKKKKKKK... Começou bem, depois iniciou a militancia para o 9 dedos.', 'authorDisplayName': 'Vladmir Pudim', 'authorProfileImageUrl': 'https://yt3.ggpht.com/LishmvK1vqaAY3QWNjywt2Bm_Wib3Nh4sZo4Uz9D0wdi1hnOLzzQSKfnuVSefzeAp7VnqdJBXdQ=s48-c-k-c0x00ffffff-no-rj', 'authorChannelUrl': 'http://www.youtube.com/channel/UC_SrnftKfuzhRBoBVIulMkw', 'authorChannelId': {'value': 'UC_SrnftKfuzhRBoBVIulMkw'}, 'canRate': True, 'viewerRating': 'none', 'likeCount': 0, 'publishedAt': '2022-10-12T21:36:58Z', 'updatedAt': '2022-10-12T21:36:58Z'}}, 'canReply': True, 'totalReplyCount': 0, 'isPublic': True}",,UC_SrnftKfuzhRBoBVIulMkw,2022-10-12T21:36:58Z,"Parcialidade jornalista que fala né? KKKKKKKKKK... Começou bem, depois iniciou a militancia para o 9 dedos.",,2023-06-08 11:07:43.966008
youtube#commentThread,gVkbn5c_Pzr45RWuetJa0FmbBLw,Ugwj25jT9kJ8FEgstA14AaABAg,"{'videoId': 'Fz0PCYu4hJg', 'topLevelComment': {'kind': 'youtube#comment', 'etag': 'qmPlJKSAgpoztLySUlyr2PRqkzE', 'id': 'Ugwj25jT9kJ8FEgstA14AaABAg', 'snippet': {'videoId': 'Fz0PCYu4hJg', 'textDisplay': 'Capitão Capiroto 👹 só trouxe ódio, DISCÓRDIAs e mentiras ao nosso povo,ele tem que sair,só faz a gente passar vergonha lá fora,todo mundo brigando em casa,na rua,com os vizinhos!', 'textOriginal': 'Capitão Capiroto 👹 só trouxe ódio, DISCÓRDIAs e mentiras ao nosso povo,ele tem que sair,só faz a gente passar vergonha lá fora,todo mundo brigando em casa,na rua,com os vizinhos!', 'authorDisplayName': 'Conceição Brandão', 'authorProfileImageUrl': 'https://yt3.ggpht.com/ytc/AGIKgqO8HVEWpjSMbxHRUVqdL0unMKZtjp62WoNwktAI=s48-c-k-c0x00ffffff-no-rj', 'authorChannelUrl': 'http://www.youtube.com/channel/UCcr0ifftcpMngiJ21wfp5DQ', 'authorChannelId': {'value': 'UCcr0ifftcpMngiJ21wfp5DQ'}, 'canRate': True, 'viewerRating': 'none', 'likeCount': 0, 'publishedAt': '2022-10-12T21:29:36Z', 'updatedAt': '2022-10-12T21:29:36Z'}}, 'canReply': True, 'totalReplyCount': 0, 'isPublic': True}",,UCcr0ifftcpMngiJ21wfp5DQ,2022-10-12T21:29:36Z,"Capitão Capiroto 👹 só trouxe ódio, DISCÓRDIAs e mentiras ao nosso povo,ele tem que sair,só faz a gente passar vergonha lá fora,todo mundo brigando em casa,na rua,com os vizinhos!",,2023-06-08 11:07:43.966008
youtube#commentThread,SRKK0Tv1lwzGGrI163AEgodyN2U,Ugyn-C0-nqNvIH7SWJ14AaABAg,"{'videoId': 'Fz0PCYu4hJg', 'topLevelComment': {'kind': 'youtube#comment', 'etag': 'BuQOCYltTf2SMh6SSbhxqRpp5EA', 'id': 'Ugyn-C0-nqNvIH7SWJ14AaABAg', 'snippet': {'videoId': 'Fz0PCYu4hJg', 'textDisplay': 'Bolsonaro é apoiado por Guilherme de Pádua, Robinho,o goleiro Bruno e a ex deputada Flordelis 🤮🤮🤮', 'textOriginal': 'Bolsonaro é apoiado por Guilherme de Pádua, Robinho,o goleiro Bruno e a ex deputada Flordelis 🤮🤮🤮', 'authorDisplayName': 'Conceição Brandão', 'authorProfileImageUrl': 'https://yt3.ggpht.com/ytc/AGIKgqO8HVEWpjSMbxHRUVqdL0unMKZtjp62WoNwktAI=s48-c-k-c0x00ffffff-no-rj', 'authorChannelUrl': 'http://www.youtube.com/channel/UCcr0ifftcpMngiJ21wfp5DQ', 'authorChannelId': {'value': 'UCcr0ifftcpMngiJ21wfp5DQ'}, 'canRate': True, 'viewerRating': 'none', 'likeCount': 0, 'publishedAt': '2022-10-12T21:28:18Z', 'updatedAt': '2022-10-12T21:28:18Z'}}, 'canReply': True, 'totalReplyCount': 0, 'isPublic': True}",,UCcr0ifftcpMngiJ21wfp5DQ,2022-10-12T21:28:18Z,"Bolsonaro é apoiado por Guilherme de Pádua, Robinho,o goleiro Bruno e a ex deputada Flordelis 🤮🤮🤮",,2023-06-08 11:07:43.966008
youtube#commentThread,W6b3meZsuNJkhxddj6atg9m9lmE,UgycTYFJ4XpabEk3Shl4AaABAg,"{'videoId': 'Fz0PCYu4hJg', 'topLevelComment': {'kind': 'youtube#comment', 'etag': 'tdFRQ9s7bqs7nyE99goKLJWOO80', 'id': 'UgycTYFJ4XpabEk3Shl4AaABAg', 'snippet': {'videoId': 'Fz0PCYu4hJg', 'textDisplay': 'Capitão Capiroto 👹 vai perder!', 'textOriginal': 'Capitão Capiroto 👹 vai perder!', 'authorDisplayName': 'Conceição Brandão', 'authorProfileImageUrl': 'https://yt3.ggpht.com/ytc/AGIKgqO8HVEWpjSMbxHRUVqdL0unMKZtjp62WoNwktAI=s48-c-k-c0x00ffffff-no-rj', 'authorChannelUrl': 'http://www.youtube.com/channel/UCcr0ifftcpMngiJ21wfp5DQ', 'authorChannelId': {'value': 'UCcr0ifftcpMngiJ21wfp5DQ'}, 'canRate': True, 'viewerRating': 'none', 'likeCount': 0, 'publishedAt': '2022-10-12T21:27:17Z', 'updatedAt': '2022-10-12T21:27:17Z'}}, 'canReply': True, 'totalReplyCount': 0, 'isPublic': True}",,UCcr0ifftcpMngiJ21wfp5DQ,2022-10-12T21:27:17Z,Capitão Capiroto 👹 vai perder!,,2023-06-08 11:07:43.966008
youtube#commentThread,d_hGy6D_GK4vkEtp15VEx9a55os,UgxTTGAj9RMHHXNywCB4AaABAg,"{'videoId': 'Fz0PCYu4hJg', 'topLevelComment': {'kind': 'youtube#comment', 'etag': 'PG5tdFQ9UhBYMKnbUVNwyK1psgY', 'id': 'UgxTTGAj9RMHHXNywCB4AaABAg', 'snippet': {'videoId': 'Fz0PCYu4hJg', 'textDisplay': 'Não  adianta  Brasil  sabe quem  é  o Bozo só  lembrar  na Pandemia  não  só  Coveiro  imitando  pessoas  sem  ar todos  viram', 'textOriginal': 'Não  adianta  Brasil  sabe quem  é  o Bozo só  lembrar  na Pandemia  não  só  Coveiro  imitando  pessoas  sem  ar todos  viram', 'authorDisplayName': 'Nilson Santos', 'authorProfileImageUrl': 'https://yt3.ggpht.com/ytc/AGIKgqMY4F5DKPlbE8PfCESnumLTrH5KqKRBzTgWcA=s48-c-k-c0x00ffffff-no-rj', 'authorChannelUrl': 'http://www.youtube.com/channel/UCl5OSAyB6GIrQjhUgH286Zg', 'authorChannelId': {'value': 'UCl5OSAyB6GIrQjhUgH286Zg'}, 'canRate': True, 'viewerRating': 'none', 'likeCount': 0, 'publishedAt': '2022-10-12T21:22:18Z', 'updatedAt': '2022-10-12T21:22:18Z'}}, 'canReply': True, 'totalReplyCount': 0, 'isPublic': True}",,UCl5OSAyB6GIrQjhUgH286Zg,2022-10-12T21:22:18Z,Não  adianta  Brasil  sabe quem  é  o Bozo só  lembrar  na Pandemia  não  só  Coveiro  imitando  pessoas  sem  ar todos  viram,,2023-06-08 11:07:43.966008
youtube#commentThread,r8nYcoxM6wsUXY2MEM6klOquLzs,UgzW3XN73Tjn-TT_vHx4AaABAg,"{'videoId': 'Fz0PCYu4hJg', 'topLevelComment': {'kind': 'youtube#comment', 'etag': 'Tc-9REp60hZ9v2Vd_-k8vwvIWJY', 'id': 'UgzW3XN73Tjn-TT_vHx4AaABAg', 'snippet': {'videoId': 'Fz0PCYu4hJg', 'textDisplay': 'Neutralidade no jornalismo passou longe desse video.', 'textOriginal': 'Neutralidade no jornalismo passou longe desse video.', 'authorDisplayName': 'Epik Dark', 'authorProfileImageUrl': 'https://yt3.ggpht.com/ytc/AGIKgqNAi9sscTd6sGow9dOGh_f_k_MLmv2GNoon5A=s48-c-k-c0x00ffffff-no-rj', 'authorChannelUrl': 'http://www.youtube.com/channel/UCkV_dgUM0jTVltggrd6zPqw', 'authorChannelId': {'value': 'UCkV_dgUM0jTVltggrd6zPqw'}, 'canRate': True, 'viewerRating': 'none', 'likeCount': 15, 'publishedAt': '2022-10-12T21:20:54Z', 'updatedAt': '2022-10-12T21:20:54Z'}}, 'canReply': True, 'totalReplyCount': 2, 'isPublic': True}","{'comments': [{'kind': 'youtube#comment', 'etag': 'yKcNg8glEQet82q-eapnbPNPMD8', 'id': 'UgzW3XN73Tjn-TT_vHx4AaABAg.9h5jPE-MnH-9h6lCK38xpF', 'snippet': {'videoId': 'Fz0PCYu4hJg', 'textDisplay': '\\u200bFelipe &amp; Josiane kkkkk', 'textOriginal': '\\u200bFelipe & Josiane kkkkk', 'parentId': 'UgzW3XN73Tjn-TT_vHx4AaABAg', 'authorDisplayName': 'Elias Oliveira', 'authorProfileImageUrl': 'https://yt3.ggpht.com/ytc/AGIKgqOhsvwCtIIYzTT6t76qGXbDGBItze5BDJWKqw=s48-c-k-c0x00ffffff-no-rj', 'authorChannelUrl': 'http://www.youtube.com/channel/UCHCKsWNOXRhsdFEusar9kAA', 'authorChannelId': {'value': 'UCHCKsWNOXRhsdFEusar9kAA'}, 'canRate': True, 'viewerRating': 'none', 'likeCount': 0, 'publishedAt': '2022-10-13T06:55:51Z', 'updatedAt': '2022-10-13T06:55:51Z'}}, {'kind': 'youtube#comment', 'etag': 'bDub4iJaGtim-XKNpvSR3ZokskI', 'id': 'UgzW3XN73Tjn-TT_vHx4AaABAg.9h5jPE-MnH-9h5owUXl3S-', 'snippet': {'videoId': 'Fz0PCYu4hJg', 'textDisplay': 'Bemmm longe... propaganda conta bolsonaro gratuita', 'textOriginal': 'Bemmm longe... propaganda conta bolsonaro gratuita', 'parentId': 'UgzW3XN73Tjn-TT_vHx4AaABAg', 'authorDisplayName': 'joao pedro trindade', 'authorProfileImageUrl': 'https://yt3.ggpht.com/ytc/AGIKgqM0bcfuD1H0na1SskGqDZp-5LskBfMqNgYn2kHbxg=s48-c-k-c0x00ffffff-no-rj', 'authorChannelUrl': 'http://www.youtube.com/channel/UCct3jq3RG5zBVolKGxw5rQg', 'authorChannelId': {'value': 'UCct3jq3RG5zBVolKGxw5rQg'}, 'canRate': True, 'viewerRating': 'none', 'likeCount': 1, 'publishedAt': '2022-10-12T22:09:16Z', 'updatedAt': '2022-10-12T22:09:16Z'}}]}",UCkV_dgUM0jTVltggrd6zPqw,2022-10-12T21:20:54Z,Neutralidade no jornalismo passou longe desse video.,,2023-06-08 11:07:43.966008
youtube#commentThread,QBBHlvMbFt6yPrwxCXns3H0RrTU,UgwiQWUmjMAFxffYO4N4AaABAg,"{'videoId': 'Fz0PCYu4hJg', 'topLevelComment': {'kind': 'youtube#comment', 'etag': 'gANVgRuj9-uenlfd9MwvjmOF4EQ', 'id': 'UgwiQWUmjMAFxffYO4N4AaABAg', 'snippet': {'videoId': 'Fz0PCYu4hJg', 'textDisplay': 'Olá  meu povo , Bolsonaro  pode ter esse jeito dele  mas fez muita coisa pelo Brasil  , e o Lula fez o q  no governo dele  so roubou', 'textOriginal': 'Olá  meu povo , Bolsonaro  pode ter esse jeito dele  mas fez muita coisa pelo Brasil  , e o Lula fez o q  no governo dele  so roubou', 'authorDisplayName': 'Edson Basilio', 'authorProfileImageUrl': 'https://yt3.ggpht.com/ytc/AGIKgqPQw4kV5m_ZDBO9vYzLIbVEQadkFJbyQpsZWEFa1CdMLF3oNj8CC6v2szKY5tqg=s48-c-k-c0x00ffffff-no-rj', 'authorChannelUrl': 'http://www.youtube.com/channel/UCmMU2yehwLEaM9e7A9PZhXA', 'authorChannelId': {'value': 'UCmMU2yehwLEaM9e7A9PZhXA'}, 'canRate': True, 'viewerRating': 'none', 'likeCount': 0, 'publishedAt': '2022-10-12T21:20:34Z', 'updatedAt': '2022-10-12T21:20:34Z'}}, 'canReply': True, 'totalReplyCount': 0, 'isPublic': True}",,UCmMU2yehwLEaM9e7A9PZhXA,2022-10-12T21:20:34Z,"Olá  meu povo , Bolsonaro  pode ter esse jeito dele  mas fez muita coisa pelo Brasil  , e o Lula fez o q  no governo dele  so roubou",,2023-06-08 11:07:43.966008
youtube#commentThread,MvWbDyIJmgYvXa7I-981vH9BGd4,UgyeBwZxaqt9pRk-34p4AaABAg,"{'videoId': 'Fz0PCYu4hJg', 'topLevelComment': {'kind': 'youtube#comment', 'etag': 'ny-wY85fC17ZUr5dl3IG36MgRGc', 'id': 'UgyeBwZxaqt9pRk-34p4AaABAg', 'snippet': {'videoId': 'Fz0PCYu4hJg', 'textDisplay': 'A exaltação da Esquerda denota medo de derrota!', 'textOriginal': 'A exaltação da Esquerda denota medo de derrota!', 'authorDisplayName': 'Clint Westwood', 'authorProfileImageUrl': 'https://yt3.ggpht.com/ytc/AGIKgqMLY7OO1LNrp3cSrFhErFxIkAQjmKNVdKBt1j0SeQ=s48-c-k-c0x00ffffff-no-rj', 'authorChannelUrl': 'http://www.youtube.com/channel/UC4w6cddm0tioZD65dmd59qg', 'authorChannelId': {'value': 'UC4w6cddm0tioZD65dmd59qg'}, 'canRate': True, 'viewerRating': 'none', 'likeCount': 5, 'publishedAt': '2022-10-12T21:14:33Z', 'updatedAt': '2022-10-12T21:14:33Z'}}, 'canReply': True, 'totalReplyCount': 0, 'isPublic': True}",,UC4w6cddm0tioZD65dmd59qg,2022-10-12T21:14:33Z,A exaltação da Esquerda denota medo de derrota!,,2023-06-08 11:07:43.966008
youtube#commentThread,NOTfdHcb38-ciDEw8-NeFwSCyMk,Ugz_ntxepq7mSPkYxtB4AaABAg,"{'videoId': 'Fz0PCYu4hJg', 'topLevelComment': {'kind': 'youtube#comment', 'etag': 'cnR0JR51OS3yGo3imom8wCq4Hv4', 'id': 'Ugz_ntxepq7mSPkYxtB4AaABAg', 'snippet': {'videoId': 'Fz0PCYu4hJg', 'textDisplay': 'Bolsonaro nunca mais', 'textOriginal': 'Bolsonaro nunca mais', 'authorDisplayName': 'Julieta Ramos', 'authorProfileImageUrl': 'https://yt3.ggpht.com/ytc/AGIKgqPgGrqMyxUVCPNQjYlIrzCW_uH29mtEQWxZ3Ljq-afaWZ1UrrVE_O_cCjBxxqeI=s48-c-k-c0x00ffffff-no-rj', 'authorChannelUrl': 'http://www.youtube.com/channel/UCQQwgLsfPpo9cCbOBclLrjQ', 'authorChannelId': {'value': 'UCQQwgLsfPpo9cCbOBclLrjQ'}, 'canRate': True, 'viewerRating': 'none', 'likeCount': 2, 'publishedAt': '2022-10-12T21:14:21Z', 'updatedAt': '2022-10-12T21:14:21Z'}}, 'canReply': True, 'totalReplyCount': 0, 'isPublic': True}",,UCQQwgLsfPpo9cCbOBclLrjQ,2022-10-12T21:14:21Z,Bolsonaro nunca mais,,2023-06-08 11:07:43.966008
youtube#commentThread,2SNse6EUS_1taec24RZE3jwoW18,UgxN-vJu0V-Bh2kAyp94AaABAg,"{'videoId': 'Fz0PCYu4hJg', 'topLevelComment': {'kind': 'youtube#comment', 'etag': 'OCUi_WAazgTGIFKi9ub58Vc8mwk', 'id': 'UgxN-vJu0V-Bh2kAyp94AaABAg', 'snippet': {'videoId': 'Fz0PCYu4hJg', 'textDisplay': 'A repórter não consegue esconder que é petista! Não pode ter lados precisa ser neutro!', 'textOriginal': 'A repórter não consegue esconder que é petista! Não pode ter lados precisa ser neutro!', 'authorDisplayName': 'BG', 'authorProfileImageUrl': 'https://yt3.ggpht.com/c1cBGh1OvE_j0bwC5NIle0TwuMbeM-clXYYMRumpfd1XC1y_EJgB2A8Kfotz50_hRWTt0l8Xhw=s48-c-k-c0x00ffffff-no-rj', 'authorChannelUrl': 'http://www.youtube.com/channel/UC5_d--jH-L5hvskgJK4jGRg', 'authorChannelId': {'value': 'UC5_d--jH-L5hvskgJK4jGRg'}, 'canRate': True, 'viewerRating': 'none', 'likeCount': 1, 'publishedAt': '2022-10-12T21:10:50Z', 'updatedAt': '2022-10-12T21:10:50Z'}}, 'canReply': True, 'totalReplyCount': 0, 'isPublic': True}",,UC5_d--jH-L5hvskgJK4jGRg,2022-10-12T21:10:50Z,A repórter não consegue esconder que é petista! Não pode ter lados precisa ser neutro!,,2023-06-08 11:07:43.966008
youtube#commentThread,ROAWERWJvFJRlmJYTG2ioDyWcsA,UgwHKFE2xRzpJjlLGB54AaABAg,"{'videoId': 'Fz0PCYu4hJg', 'topLevelComment': {'kind': 'youtube#comment', 'etag': 'B8XNPFliz7OCgF06X79BM-qblV8', 'id': 'UgwHKFE2xRzpJjlLGB54AaABAg', 'snippet': {'videoId': 'Fz0PCYu4hJg', 'textDisplay': 'isso se chama politica todos sabe so. qeum não intedi receber tacada e disso a poir tanto de Lula   tanto de bolsonaro', 'textOriginal': 'isso se chama politica todos sabe so. qeum não intedi receber tacada e disso a poir tanto de Lula   tanto de bolsonaro', 'authorDisplayName': 'Maria Das neves', 'authorProfileImageUrl': 'https://yt3.ggpht.com/ytc/AGIKgqNw6fmh_JNjeLSNr0U2zdPRWbhhxtz1iKJoBO9QY00=s48-c-k-c0x00ffffff-no-rj', 'authorChannelUrl': 'http://www.youtube.com/channel/UC1KSEREiA0oOYHkEby54yaw', 'authorChannelId': {'value': 'UC1KSEREiA0oOYHkEby54yaw'}, 'canRate': True, 'viewerRating': 'none', 'likeCount': 0, 'publishedAt': '2022-10-12T21:04:31Z', 'updatedAt': '2022-10-12T21:05:50Z'}}, 'canReply': True, 'totalReplyCount': 0, 'isPublic': True}",,UC1KSEREiA0oOYHkEby54yaw,2022-10-12T21:04:31Z,isso se chama politica todos sabe so. qeum não intedi receber tacada e disso a poir tanto de Lula   tanto de bolsonaro,,2023-06-08 11:07:43.966008
