kind,etag,id,snippet,replies,authorChannelId,publishedAt,textOriginal,nextPageToken,extraction_date
youtube#commentThread,zATvQGVSxNuqwXGYgA1XudofH2g,Ugy5t0PXeJDfkMpy9fd4AaABAg,"{'videoId': 'y6GLrmuzKa4', 'topLevelComment': {'kind': 'youtube#comment', 'etag': 'ixxSdsz1WdLX_ENyDgGHusRQ7GQ', 'id': 'Ugy5t0PXeJDfkMpy9fd4AaABAg', 'snippet': {'videoId': 'y6GLrmuzKa4', 'textDisplay': 'Não e bem assim.<br>Aqui na prefeitura do Rio de Janeiro no meu caso depois dos 60 nao fazem mais o exame de rotina e somos atendidas por enfermeiras.', 'textOriginal': 'Não e bem assim.\\nAqui na prefeitura do Rio de Janeiro no meu caso depois dos 60 nao fazem mais o exame de rotina e somos atendidas por enfermeiras.', 'authorDisplayName': 'Mary Pacheco', 'authorProfileImageUrl': 'https://yt3.ggpht.com/ytc/AGIKgqObaX3Bku0fIoFA5oQs_8YqaeEQZisN6r-RFZwNVQ=s48-c-k-c0x00ffffff-no-rj', 'authorChannelUrl': 'http://www.youtube.com/channel/UCnXWhfBnMaU7YZs_Nl6RiLQ', 'authorChannelId': {'value': 'UCnXWhfBnMaU7YZs_Nl6RiLQ'}, 'canRate': True, 'viewerRating': 'none', 'likeCount': 0, 'publishedAt': '2022-10-16T00:00:23Z', 'updatedAt': '2022-10-16T00:00:23Z'}}, 'canReply': True, 'totalReplyCount': 0, 'isPublic': True}",,UCnXWhfBnMaU7YZs_Nl6RiLQ,2022-10-16T00:00:23Z,"Não e bem assim.
Aqui na prefeitura do Rio de Janeiro no meu caso depois dos 60 nao fazem mais o exame de rotina e somos atendidas por enfermeiras.",,2023-06-09 12:21:03.862708
youtube#commentThread,Ra3zYWK17EtpTq-y_uk-ANkXu7c,UgyYnyiWHqupzVPhi-h4AaABAg,"{'videoId': 'y6GLrmuzKa4', 'topLevelComment': {'kind': 'youtube#comment', 'etag': 'U-1AK3pp-F1_hE9EGjh0PXkhz_4', 'id': 'UgyYnyiWHqupzVPhi-h4AaABAg', 'snippet': {'videoId': 'y6GLrmuzKa4', 'textDisplay': 'Gostaria de saber se o exame de termografia atenderia também no diagnóstico de possível câncer', 'textOriginal': 'Gostaria de saber se o exame de termografia atenderia também no diagnóstico de possível câncer', 'authorDisplayName': 'Irma Carou', 'authorProfileImageUrl': 'https://yt3.ggpht.com/ytc/AGIKgqMUlaONqBO_aOuCN_m0vdZ4TGh4iWYATsm50g=s48-c-k-c0x00ffffff-no-rj', 'authorChannelUrl': 'http://www.youtube.com/channel/UCnmxx-IXva9dAdTWlWNl9CQ', 'authorChannelId': {'value': 'UCnmxx-IXva9dAdTWlWNl9CQ'}, 'canRate': True, 'viewerRating': 'none', 'likeCount': 0, 'publishedAt': '2022-10-15T23:36:59Z', 'updatedAt': '2022-10-15T23:36:59Z'}}, 'canReply': True, 'totalReplyCount': 0, 'isPublic': True}",,UCnmxx-IXva9dAdTWlWNl9CQ,2022-10-15T23:36:59Z,Gostaria de saber se o exame de termografia atenderia também no diagnóstico de possível câncer,,2023-06-09 12:21:03.862708
youtube#commentThread,gfRc5VcJCj17-AVwfGB5wz7rmw0,UgzlrvAZO2e2pV6Lw6l4AaABAg,"{'videoId': 'y6GLrmuzKa4', 'topLevelComment': {'kind': 'youtube#comment', 'etag': 'bvIBDB9bnxc4ia9yA4w25qeVNGw', 'id': 'UgzlrvAZO2e2pV6Lw6l4AaABAg', 'snippet': {'videoId': 'y6GLrmuzKa4', 'textDisplay': 'Gente nunca mais fiz mamografia qdo descobri, pelo dr Lair, que a radiação da monografia é mil vezes maior que rx e pode desencadear o câncer pel radiação. <br>Existe um aparelho barato, segundo o médico, a Termografia, sem radiação e detecta o câncer até dez anos antes.<br>Só falta o Presidente saber disso.', 'textOriginal': 'Gente nunca mais fiz mamografia qdo descobri, pelo dr Lair, que a radiação da monografia é mil vezes maior que rx e pode desencadear o câncer pel radiação. \\nExiste um aparelho barato, segundo o médico, a Termografia, sem radiação e detecta o câncer até dez anos antes.\\nSó falta o Presidente saber disso.', 'authorDisplayName': 'Socorro Pereira', 'authorProfileImageUrl': 'https://yt3.ggpht.com/ytc/AGIKgqOIok7NbDrpitbF0PE1P7MEf-3dnisYs3tMPA=s48-c-k-c0x00ffffff-no-rj', 'authorChannelUrl': 'http://www.youtube.com/channel/UC2zPAjPvRh79HPTHS4li3iw', 'authorChannelId': {'value': 'UC2zPAjPvRh79HPTHS4li3iw'}, 'canRate': True, 'viewerRating': 'none', 'likeCount': 0, 'publishedAt': '2022-10-15T23:05:11Z', 'updatedAt': '2022-10-15T23:05:11Z'}}, 'canReply': True, 'totalReplyCount': 0, 'isPublic': True}",,UC2zPAjPvRh79HPTHS4li3iw,2022-10-15T23:05:11Z,"Gente nunca mais fiz mamografia qdo descobri, pelo dr Lair, que a radiação da monografia é mil vezes maior que rx e pode desencadear o câncer pel radiação. 
Existe um aparelho barato, segundo o médico, a Termografia, sem radiação e detecta o câncer até dez anos antes.
Só falta o Presidente saber disso.",,2023-06-09 12:21:03.862708
youtube#commentThread,vThcdGSty38iOOoKLqLVViO4O0E,Ugz1ZRmQ4HO6AnPgEV94AaABAg,"{'videoId': 'y6GLrmuzKa4', 'topLevelComment': {'kind': 'youtube#comment', 'etag': 'NPgW8S-m4OhsGmcSRbZcV4e0qXs', 'id': 'Ugz1ZRmQ4HO6AnPgEV94AaABAg', 'snippet': {'videoId': 'y6GLrmuzKa4', 'textDisplay': 'Até para quem tem convênio médico nem sempre é fácil conseguir agendar um horário para fazer esse exame.', 'textOriginal': 'Até para quem tem convênio médico nem sempre é fácil conseguir agendar um horário para fazer esse exame.', 'authorDisplayName': 'I s ª', 'authorProfileImageUrl': 'https://yt3.ggpht.com/SQolyDaCGfQ3nehQCnOhqtcEb6ZJ1p5RHKug-Wj_IuQrZHiKbau3ig44iwydW-Fv5XcPR0vA=s48-c-k-c0x00ffffff-no-rj', 'authorChannelUrl': 'http://www.youtube.com/channel/UCP51Gvab302lje4fC_OkmXQ', 'authorChannelId': {'value': 'UCP51Gvab302lje4fC_OkmXQ'}, 'canRate': True, 'viewerRating': 'none', 'likeCount': 2, 'publishedAt': '2022-10-15T21:37:45Z', 'updatedAt': '2022-10-15T21:37:45Z'}}, 'canReply': True, 'totalReplyCount': 0, 'isPublic': True}",,UCP51Gvab302lje4fC_OkmXQ,2022-10-15T21:37:45Z,Até para quem tem convênio médico nem sempre é fácil conseguir agendar um horário para fazer esse exame.,,2023-06-09 12:21:03.862708
