kind,etag,id,snippet,replies,authorChannelId,publishedAt,textOriginal,nextPageToken,extraction_date
youtube#commentThread,JWxSDkK-zuP0DvyQ5tLeMf9-FvQ,UgzJALBbHr49wKnlOUt4AaABAg,"{'videoId': 'Mzz9R_YqoR8', 'topLevelComment': {'kind': 'youtube#comment', 'etag': 'sF9xMwCNlKupThM7-OCD6WYY6YQ', 'id': 'UgzJALBbHr49wKnlOUt4AaABAg', 'snippet': {'videoId': 'Mzz9R_YqoR8', 'textDisplay': 'Bolsonaro 22', 'textOriginal': 'Bolsonaro 22', 'authorDisplayName': 'Valquele Silva', 'authorProfileImageUrl': 'https://yt3.ggpht.com/ytc/AGIKgqOEdOJqqmPM19ppj9CkUpvBGoQdKOuA2w3WAQ=s48-c-k-c0x00ffffff-no-rj', 'authorChannelUrl': 'http://www.youtube.com/channel/UCb6suxgFwgjeUtGxt7dLjTg', 'authorChannelId': {'value': 'UCb6suxgFwgjeUtGxt7dLjTg'}, 'canRate': True, 'viewerRating': 'none', 'likeCount': 0, 'publishedAt': '2022-10-19T11:23:22Z', 'updatedAt': '2022-10-19T11:23:22Z'}}, 'canReply': True, 'totalReplyCount': 0, 'isPublic': True}",,UCb6suxgFwgjeUtGxt7dLjTg,2022-10-19T11:23:22Z,Bolsonaro 22,QURTSl9pMENyQWZQMXhfV3VQYmlwNFgtR3lvNGNvbmVJME5rbzJMUWxRNGRBbkJuWDdqVWJZQkpsc3JMcDRKclcyVTdCZGp6LTdQQ092Yw==,2023-06-07 12:10:17.405219
youtube#commentThread,uHclGb0rWeRnJBsOW4x0AjdiWcA,UgxnWU0q3vOr5G3sPfR4AaABAg,"{'videoId': 'Mzz9R_YqoR8', 'topLevelComment': {'kind': 'youtube#comment', 'etag': '_t-04G15KSrMPoL_wKFMvwjw9Ww', 'id': 'UgxnWU0q3vOr5G3sPfR4AaABAg', 'snippet': {'videoId': 'Mzz9R_YqoR8', 'textDisplay': 'Bolsonaro melhor Presidente do Brasil.', 'textOriginal': 'Bolsonaro melhor Presidente do Brasil.', 'authorDisplayName': 'Valquele Silva', 'authorProfileImageUrl': 'https://yt3.ggpht.com/ytc/AGIKgqOEdOJqqmPM19ppj9CkUpvBGoQdKOuA2w3WAQ=s48-c-k-c0x00ffffff-no-rj', 'authorChannelUrl': 'http://www.youtube.com/channel/UCb6suxgFwgjeUtGxt7dLjTg', 'authorChannelId': {'value': 'UCb6suxgFwgjeUtGxt7dLjTg'}, 'canRate': True, 'viewerRating': 'none', 'likeCount': 0, 'publishedAt': '2022-10-19T11:23:11Z', 'updatedAt': '2022-10-19T11:23:11Z'}}, 'canReply': True, 'totalReplyCount': 0, 'isPublic': True}",,UCb6suxgFwgjeUtGxt7dLjTg,2022-10-19T11:23:11Z,Bolsonaro melhor Presidente do Brasil.,QURTSl9pMENyQWZQMXhfV3VQYmlwNFgtR3lvNGNvbmVJME5rbzJMUWxRNGRBbkJuWDdqVWJZQkpsc3JMcDRKclcyVTdCZGp6LTdQQ092Yw==,2023-06-07 12:10:17.405219
youtube#commentThread,nfdZysgKHrWcCTc7mNNUr1QAcMk,UgxSelA0vW42KW9Rn014AaABAg,"{'videoId': 'Mzz9R_YqoR8', 'topLevelComment': {'kind': 'youtube#comment', 'etag': 'AQoJaBZwWWmvgAgv0h0YAVXsVjk', 'id': 'UgxSelA0vW42KW9Rn014AaABAg', 'snippet': {'videoId': 'Mzz9R_YqoR8', 'textDisplay': '<a href=""http://www.youtube.com/results?search_query=%23lulaladraonacadeia"">#LulaLadraoNaCadeia</a>', 'textOriginal': '#LulaLadraoNaCadeia', 'authorDisplayName': 'Valquele Silva', 'authorProfileImageUrl': 'https://yt3.ggpht.com/ytc/AGIKgqOEdOJqqmPM19ppj9CkUpvBGoQdKOuA2w3WAQ=s48-c-k-c0x00ffffff-no-rj', 'authorChannelUrl': 'http://www.youtube.com/channel/UCb6suxgFwgjeUtGxt7dLjTg', 'authorChannelId': {'value': 'UCb6suxgFwgjeUtGxt7dLjTg'}, 'canRate': True, 'viewerRating': 'none', 'likeCount': 0, 'publishedAt': '2022-10-19T11:23:02Z', 'updatedAt': '2022-10-19T11:23:02Z'}}, 'canReply': True, 'totalReplyCount': 0, 'isPublic': True}",,UCb6suxgFwgjeUtGxt7dLjTg,2022-10-19T11:23:02Z,#LulaLadraoNaCadeia,QURTSl9pMENyQWZQMXhfV3VQYmlwNFgtR3lvNGNvbmVJME5rbzJMUWxRNGRBbkJuWDdqVWJZQkpsc3JMcDRKclcyVTdCZGp6LTdQQ092Yw==,2023-06-07 12:10:17.405219
youtube#commentThread,bD2vEyKymcdRFdiOAU1pqbbBgrY,UgzjDSqBLhFBdsvc2QN4AaABAg,"{'videoId': 'Mzz9R_YqoR8', 'topLevelComment': {'kind': 'youtube#comment', 'etag': 'VACwKzWtgZcsT7m2270gC02npyk', 'id': 'UgzjDSqBLhFBdsvc2QN4AaABAg', 'snippet': {'videoId': 'Mzz9R_YqoR8', 'textDisplay': 'Verdadeiro mesmo 👏🏻👏🏻👏🏻<br>Só em relação a queda do sistema que já temos a dúvida 😫 estamos cansados de gritar !!!<br>Mas estamos juntos 2️⃣2️⃣🇧🇷🇧🇷', 'textOriginal': 'Verdadeiro mesmo 👏🏻👏🏻👏🏻\nSó em relação a queda do sistema que já temos a dúvida 😫 estamos cansados de gritar !!!\nMas estamos juntos 2️⃣2️⃣🇧🇷🇧🇷', 'authorDisplayName': 'Danielle Aime', 'authorProfileImageUrl': 'https://yt3.ggpht.com/ytc/AGIKgqPbWbLL1jVF4eyJqsohM99E5TDCon08fz-S4bhD2A=s48-c-k-c0x00ffffff-no-rj', 'authorChannelUrl': 'http://www.youtube.com/channel/UCrxDj0UEIRjyDIsxNQg-Gtg', 'authorChannelId': {'value': 'UCrxDj0UEIRjyDIsxNQg-Gtg'}, 'canRate': True, 'viewerRating': 'none', 'likeCount': 0, 'publishedAt': '2022-10-19T11:22:26Z', 'updatedAt': '2022-10-19T11:22:26Z'}}, 'canReply': True, 'totalReplyCount': 0, 'isPublic': True}",,UCrxDj0UEIRjyDIsxNQg-Gtg,2022-10-19T11:22:26Z,"Verdadeiro mesmo 👏🏻👏🏻👏🏻
Só em relação a queda do sistema que já temos a dúvida 😫 estamos cansados de gritar !!!
Mas estamos juntos 2️⃣2️⃣🇧🇷🇧🇷",QURTSl9pMENyQWZQMXhfV3VQYmlwNFgtR3lvNGNvbmVJME5rbzJMUWxRNGRBbkJuWDdqVWJZQkpsc3JMcDRKclcyVTdCZGp6LTdQQ092Yw==,2023-06-07 12:10:17.405219
youtube#commentThread,dAnvxEF9eNcuHkMtVQuQwZmJMJw,Ugxqa2OBjGUrLqRNoFd4AaABAg,"{'videoId': 'Mzz9R_YqoR8', 'topLevelComment': {'kind': 'youtube#comment', 'etag': 'SX1JPYUYyvGLwyxnk5XiVHRpbHY', 'id': 'Ugxqa2OBjGUrLqRNoFd4AaABAg', 'snippet': {'videoId': 'Mzz9R_YqoR8', 'textDisplay': 'palavras do vice do Lula, o sr Alckmin', 'textOriginal': 'palavras do vice do Lula, o sr Alckmin', 'authorDisplayName': 'ZENNY Vieira', 'authorProfileImageUrl': 'https://yt3.ggpht.com/ytc/AGIKgqMl0Wccw4l0sygZdZl4S9nxcoP3EMHQIpqW_A=s48-c-k-c0x00ffffff-no-rj', 'authorChannelUrl': 'http://www.youtube.com/channel/UCBy8wYcoCQq9hbO_M8Zivkg', 'authorChannelId': {'value': 'UCBy8wYcoCQq9hbO_M8Zivkg'}, 'canRate': True, 'viewerRating': 'none', 'likeCount': 0, 'publishedAt': '2022-10-19T11:18:57Z', 'updatedAt': '2022-10-19T11:18:57Z'}}, 'canReply': True, 'totalReplyCount': 0, 'isPublic': True}",,UCBy8wYcoCQq9hbO_M8Zivkg,2022-10-19T11:18:57Z,"palavras do vice do Lula, o sr Alckmin",QURTSl9pMENyQWZQMXhfV3VQYmlwNFgtR3lvNGNvbmVJME5rbzJMUWxRNGRBbkJuWDdqVWJZQkpsc3JMcDRKclcyVTdCZGp6LTdQQ092Yw==,2023-06-07 12:10:17.405219
youtube#commentThread,1KbhaYFC2tFBZm_L75BafClL2Fs,UgwpNnAW1lQoyZOcOfp4AaABAg,"{'videoId': 'Mzz9R_YqoR8', 'topLevelComment': {'kind': 'youtube#comment', 'etag': 'SsDg21enePfW8am87x1H_0W3Dro', 'id': 'UgwpNnAW1lQoyZOcOfp4AaABAg', 'snippet': {'videoId': 'Mzz9R_YqoR8', 'textDisplay': 'o ex-presidiário Lula é muito cara de pau,quer  voltar a sena do crime, palavras do vice do ex-presidiário Lula', 'textOriginal': 'o ex-presidiário Lula é muito cara de pau,quer  voltar a sena do crime, palavras do vice do ex-presidiário Lula', 'authorDisplayName': 'ZENNY Vieira', 'authorProfileImageUrl': 'https://yt3.ggpht.com/ytc/AGIKgqMl0Wccw4l0sygZdZl4S9nxcoP3EMHQIpqW_A=s48-c-k-c0x00ffffff-no-rj', 'authorChannelUrl': 'http://www.youtube.com/channel/UCBy8wYcoCQq9hbO_M8Zivkg', 'authorChannelId': {'value': 'UCBy8wYcoCQq9hbO_M8Zivkg'}, 'canRate': True, 'viewerRating': 'none', 'likeCount': 0, 'publishedAt': '2022-10-19T11:17:56Z', 'updatedAt': '2022-10-19T11:17:56Z'}}, 'canReply': True, 'totalReplyCount': 0, 'isPublic': True}",,UCBy8wYcoCQq9hbO_M8Zivkg,2022-10-19T11:17:56Z,"o ex-presidiário Lula é muito cara de pau,quer  voltar a sena do crime, palavras do vice do ex-presidiário Lula",QURTSl9pMENyQWZQMXhfV3VQYmlwNFgtR3lvNGNvbmVJME5rbzJMUWxRNGRBbkJuWDdqVWJZQkpsc3JMcDRKclcyVTdCZGp6LTdQQ092Yw==,2023-06-07 12:10:17.405219
youtube#commentThread,9_mnbWMNMgUGaE1zuoKjj-aUu1E,UgwCYtXj9e2TWqVj5494AaABAg,"{'videoId': 'Mzz9R_YqoR8', 'topLevelComment': {'kind': 'youtube#comment', 'etag': 'nF1bC9U48xK1KjqyE1eSWuUNZX4', 'id': 'UgwCYtXj9e2TWqVj5494AaABAg', 'snippet': {'videoId': 'Mzz9R_YqoR8', 'textDisplay': 'Esses desgraçados estão tentando comprometer a vida dos nossos filhos. 🇧🇷 precisamos reeleger nosso presidente.  Liberdade, liberdade', 'textOriginal': 'Esses desgraçados estão tentando comprometer a vida dos nossos filhos. 🇧🇷 precisamos reeleger nosso presidente.  Liberdade, liberdade', 'authorDisplayName': 'Vanessa Mendes Ribeiro Rodrigues', 'authorProfileImageUrl': 'https://yt3.ggpht.com/ytc/AGIKgqNQYJ1l5TBFuiU-Ud6ic2mssZarQL1xCtJ11A=s48-c-k-c0x00ffffff-no-rj', 'authorChannelUrl': 'http://www.youtube.com/channel/UCMavXXClc_eIgiMitBRgg9g', 'authorChannelId': {'value': 'UCMavXXClc_eIgiMitBRgg9g'}, 'canRate': True, 'viewerRating': 'none', 'likeCount': 0, 'publishedAt': '2022-10-19T11:17:11Z', 'updatedAt': '2022-10-19T11:17:11Z'}}, 'canReply': True, 'totalReplyCount': 0, 'isPublic': True}",,UCMavXXClc_eIgiMitBRgg9g,2022-10-19T11:17:11Z,"Esses desgraçados estão tentando comprometer a vida dos nossos filhos. 🇧🇷 precisamos reeleger nosso presidente.  Liberdade, liberdade",QURTSl9pMENyQWZQMXhfV3VQYmlwNFgtR3lvNGNvbmVJME5rbzJMUWxRNGRBbkJuWDdqVWJZQkpsc3JMcDRKclcyVTdCZGp6LTdQQ092Yw==,2023-06-07 12:10:17.405219
youtube#commentThread,6yDFi3bzwl-VGcRwXA5ARQRCFqE,Ugxw6H-GHZoKzF4Koa94AaABAg,"{'videoId': 'Mzz9R_YqoR8', 'topLevelComment': {'kind': 'youtube#comment', 'etag': 'El027GHALyyd7xG8mUUNalNSOf8', 'id': 'Ugxw6H-GHZoKzF4Koa94AaABAg', 'snippet': {'videoId': 'Mzz9R_YqoR8', 'textDisplay': 'ACORDA BRASIL ACORDA PRESIDENTE O PRÓXIMO PODE SER VOCÊ.', 'textOriginal': 'ACORDA BRASIL ACORDA PRESIDENTE O PRÓXIMO PODE SER VOCÊ.', 'authorDisplayName': 'FEITOZA', 'authorProfileImageUrl': 'https://yt3.ggpht.com/ytc/AGIKgqOcK5Xbyr42twOxUPv88T1Egn-2lO4WxwhGbSow_HqeSgY3hlN3TOBOAdSBYKbH=s48-c-k-c0x00ffffff-no-rj', 'authorChannelUrl': 'http://www.youtube.com/channel/UCZ_1SKcwy1_OGY4ZZdAZZ5Q', 'authorChannelId': {'value': 'UCZ_1SKcwy1_OGY4ZZdAZZ5Q'}, 'canRate': True, 'viewerRating': 'none', 'likeCount': 0, 'publishedAt': '2022-10-19T11:08:59Z', 'updatedAt': '2022-10-19T11:08:59Z'}}, 'canReply': True, 'totalReplyCount': 0, 'isPublic': True}",,UCZ_1SKcwy1_OGY4ZZdAZZ5Q,2022-10-19T11:08:59Z,ACORDA BRASIL ACORDA PRESIDENTE O PRÓXIMO PODE SER VOCÊ.,QURTSl9pMENyQWZQMXhfV3VQYmlwNFgtR3lvNGNvbmVJME5rbzJMUWxRNGRBbkJuWDdqVWJZQkpsc3JMcDRKclcyVTdCZGp6LTdQQ092Yw==,2023-06-07 12:10:17.405219
youtube#commentThread,NkSIQlImFX0UyvoOlKKCZytUWK4,Ugz4xSL0GxIgQq7euSR4AaABAg,"{'videoId': 'Mzz9R_YqoR8', 'topLevelComment': {'kind': 'youtube#comment', 'etag': 'kEbljQNh_4wqzgPPAoXGKtC_OQc', 'id': 'Ugz4xSL0GxIgQq7euSR4AaABAg', 'snippet': {'videoId': 'Mzz9R_YqoR8', 'textDisplay': 'Não sei onde o cidadão que se diz do bem está com a cabeça de dar um  voto c quer a esse ladrão do Lula! Deus nos proteja! Bolsonaro!👉🏻👉🏻🇧🇷🇧🇷🇧🇷', 'textOriginal': 'Não sei onde o cidadão que se diz do bem está com a cabeça de dar um  voto c quer a esse ladrão do Lula! Deus nos proteja! Bolsonaro!👉🏻👉🏻🇧🇷🇧🇷🇧🇷', 'authorDisplayName': 'Daniel Campos', 'authorProfileImageUrl': 'https://yt3.ggpht.com/ytc/AGIKgqMUbS5ZE_gBNilvStd5S0Tjlu6Pj9mVsgZpbNw6xg=s48-c-k-c0x00ffffff-no-rj', 'authorChannelUrl': 'http://www.youtube.com/channel/UC4SIKEx0RXJMfIkAm_4U2uA', 'authorChannelId': {'value': 'UC4SIKEx0RXJMfIkAm_4U2uA'}, 'canRate': True, 'viewerRating': 'none', 'likeCount': 0, 'publishedAt': '2022-10-19T11:05:07Z', 'updatedAt': '2022-10-19T11:05:07Z'}}, 'canReply': True, 'totalReplyCount': 0, 'isPublic': True}",,UC4SIKEx0RXJMfIkAm_4U2uA,2022-10-19T11:05:07Z,Não sei onde o cidadão que se diz do bem está com a cabeça de dar um  voto c quer a esse ladrão do Lula! Deus nos proteja! Bolsonaro!👉🏻👉🏻🇧🇷🇧🇷🇧🇷,QURTSl9pMENyQWZQMXhfV3VQYmlwNFgtR3lvNGNvbmVJME5rbzJMUWxRNGRBbkJuWDdqVWJZQkpsc3JMcDRKclcyVTdCZGp6LTdQQ092Yw==,2023-06-07 12:10:17.405219
youtube#commentThread,LNyEFPU63oSA46QnuUkNBYzzs20,UgxNpQaqbJwoRkUmfvx4AaABAg,"{'videoId': 'Mzz9R_YqoR8', 'topLevelComment': {'kind': 'youtube#comment', 'etag': '4cS_f0I8GCP3s1xSfFmkkVTjOSc', 'id': 'UgxNpQaqbJwoRkUmfvx4AaABAg', 'snippet': {'videoId': 'Mzz9R_YqoR8', 'textDisplay': 'Foi o que pensei durante a fala do lulinha ladrão kk.  Ele se gabou que entrou na favela sem medo. Esse fato só comprova que os traficantes e bandidos, que são minoria na favela, estão a favor dele ou possuem simpatia pelo descondensado.', 'textOriginal': 'Foi o que pensei durante a fala do lulinha ladrão kk.  Ele se gabou que entrou na favela sem medo. Esse fato só comprova que os traficantes e bandidos, que são minoria na favela, estão a favor dele ou possuem simpatia pelo descondensado.', 'authorDisplayName': 'Saturnino Silveira Mourão', 'authorProfileImageUrl': 'https://yt3.ggpht.com/ytc/AGIKgqPBjP1iol8a_9KI_gNru7QXTd5vwmE9xyuSRkpxsw=s48-c-k-c0x00ffffff-no-rj', 'authorChannelUrl': 'http://www.youtube.com/channel/UC9lGEWB2jSjqrsC2AmpvHAw', 'authorChannelId': {'value': 'UC9lGEWB2jSjqrsC2AmpvHAw'}, 'canRate': True, 'viewerRating': 'none', 'likeCount': 1, 'publishedAt': '2022-10-19T11:02:58Z', 'updatedAt': '2022-10-19T11:02:58Z'}}, 'canReply': True, 'totalReplyCount': 0, 'isPublic': True}",,UC9lGEWB2jSjqrsC2AmpvHAw,2022-10-19T11:02:58Z,"Foi o que pensei durante a fala do lulinha ladrão kk.  Ele se gabou que entrou na favela sem medo. Esse fato só comprova que os traficantes e bandidos, que são minoria na favela, estão a favor dele ou possuem simpatia pelo descondensado.",QURTSl9pMENyQWZQMXhfV3VQYmlwNFgtR3lvNGNvbmVJME5rbzJMUWxRNGRBbkJuWDdqVWJZQkpsc3JMcDRKclcyVTdCZGp6LTdQQ092Yw==,2023-06-07 12:10:17.405219
youtube#commentThread,WHGRQSTmDA_az2smoya32ti5stk,UgzC5K8eXp6CVmxDzqV4AaABAg,"{'videoId': 'Mzz9R_YqoR8', 'topLevelComment': {'kind': 'youtube#comment', 'etag': '8mktotQ44v1LNlQ-oVLTI71E37M', 'id': 'UgzC5K8eXp6CVmxDzqV4AaABAg', 'snippet': {'videoId': 'Mzz9R_YqoR8', 'textDisplay': 'Senhor Jesus, nos ajude ! Ilumine os olhos dos cegos, toque nos corações, intervenha poderosamente em nossa nação, manda Teus anjos agirem em cada recanto desse Brasil !', 'textOriginal': 'Senhor Jesus, nos ajude ! Ilumine os olhos dos cegos, toque nos corações, intervenha poderosamente em nossa nação, manda Teus anjos agirem em cada recanto desse Brasil !', 'authorDisplayName': 'Mangia Quello Che Fai Bene', 'authorProfileImageUrl': 'https://yt3.ggpht.com/ytc/AGIKgqOBFHi_CTo1vA7aE39YY0FPwIlfnwBtiw5Up43p=s48-c-k-c0x00ffffff-no-rj', 'authorChannelUrl': 'http://www.youtube.com/channel/UC_LK2AWGH5CaTvz2EY9iWPQ', 'authorChannelId': {'value': 'UC_LK2AWGH5CaTvz2EY9iWPQ'}, 'canRate': True, 'viewerRating': 'none', 'likeCount': 0, 'publishedAt': '2022-10-19T11:02:38Z', 'updatedAt': '2022-10-19T11:02:38Z'}}, 'canReply': True, 'totalReplyCount': 0, 'isPublic': True}",,UC_LK2AWGH5CaTvz2EY9iWPQ,2022-10-19T11:02:38Z,"Senhor Jesus, nos ajude ! Ilumine os olhos dos cegos, toque nos corações, intervenha poderosamente em nossa nação, manda Teus anjos agirem em cada recanto desse Brasil !",QURTSl9pMENyQWZQMXhfV3VQYmlwNFgtR3lvNGNvbmVJME5rbzJMUWxRNGRBbkJuWDdqVWJZQkpsc3JMcDRKclcyVTdCZGp6LTdQQ092Yw==,2023-06-07 12:10:17.405219
youtube#commentThread,TWfjZEhEhm8GvM409R-ilXy8Rds,Ugzeq3S4MTPVGdso-Hh4AaABAg,"{'videoId': 'Mzz9R_YqoR8', 'topLevelComment': {'kind': 'youtube#comment', 'etag': 'q77v0Ra8PDfiiIUEWJVi-OKu2yw', 'id': 'Ugzeq3S4MTPVGdso-Hh4AaABAg', 'snippet': {'videoId': 'Mzz9R_YqoR8', 'textDisplay': 'Só ,ex condenado que é alinhado com os manos', 'textOriginal': 'Só ,ex condenado que é alinhado com os manos', 'authorDisplayName': 'Renato Lemos', 'authorProfileImageUrl': 'https://yt3.ggpht.com/ytc/AGIKgqM1H_F6av5pvJOFSQ78oieXO2jmuDGWBOYo5w=s48-c-k-c0x00ffffff-no-rj', 'authorChannelUrl': 'http://www.youtube.com/channel/UCkIoS3gihzf40sALfInBEUg', 'authorChannelId': {'value': 'UCkIoS3gihzf40sALfInBEUg'}, 'canRate': True, 'viewerRating': 'none', 'likeCount': 1, 'publishedAt': '2022-10-19T10:56:04Z', 'updatedAt': '2022-10-19T10:56:04Z'}}, 'canReply': True, 'totalReplyCount': 0, 'isPublic': True}",,UCkIoS3gihzf40sALfInBEUg,2022-10-19T10:56:04Z,"Só ,ex condenado que é alinhado com os manos",QURTSl9pMENyQWZQMXhfV3VQYmlwNFgtR3lvNGNvbmVJME5rbzJMUWxRNGRBbkJuWDdqVWJZQkpsc3JMcDRKclcyVTdCZGp6LTdQQ092Yw==,2023-06-07 12:10:17.405219
youtube#commentThread,gEe6o0p58fTLVqfw_CWACxBCizo,UgwuBvS9l_Piq0SOVkd4AaABAg,"{'videoId': 'Mzz9R_YqoR8', 'topLevelComment': {'kind': 'youtube#comment', 'etag': 'HqQJI11HbwK4pdu1z1rTzg5fTdA', 'id': 'UgwuBvS9l_Piq0SOVkd4AaABAg', 'snippet': {'videoId': 'Mzz9R_YqoR8', 'textDisplay': 'Como provar se as urnas está tudo bem.tenham cuidado eles trabalha para prejudicar.estamos todos em  oração mas precisamos está vigiando sobre esse inimigo Alexandre.cuidado eles são campo minado.. Deus vos guarde 🙏', 'textOriginal': 'Como provar se as urnas está tudo bem.tenham cuidado eles trabalha para prejudicar.estamos todos em  oração mas precisamos está vigiando sobre esse inimigo Alexandre.cuidado eles são campo minado.. Deus vos guarde 🙏', 'authorDisplayName': 'nisia maria', 'authorProfileImageUrl': 'https://yt3.ggpht.com/ytc/AGIKgqOsEMt1G9-aY4ql9qsqsRAV8Mfar5cg9eL7avoEvpwtqeG3BDy66Zj9k0AW_j5H=s48-c-k-c0x00ffffff-no-rj', 'authorChannelUrl': 'http://www.youtube.com/channel/UC_zW3cbrGzkWEKB7Q2WHZzw', 'authorChannelId': {'value': 'UC_zW3cbrGzkWEKB7Q2WHZzw'}, 'canRate': True, 'viewerRating': 'none', 'likeCount': 1, 'publishedAt': '2022-10-19T10:54:24Z', 'updatedAt': '2022-10-19T10:54:24Z'}}, 'canReply': True, 'totalReplyCount': 0, 'isPublic': True}",,UC_zW3cbrGzkWEKB7Q2WHZzw,2022-10-19T10:54:24Z,Como provar se as urnas está tudo bem.tenham cuidado eles trabalha para prejudicar.estamos todos em  oração mas precisamos está vigiando sobre esse inimigo Alexandre.cuidado eles são campo minado.. Deus vos guarde 🙏,QURTSl9pMENyQWZQMXhfV3VQYmlwNFgtR3lvNGNvbmVJME5rbzJMUWxRNGRBbkJuWDdqVWJZQkpsc3JMcDRKclcyVTdCZGp6LTdQQ092Yw==,2023-06-07 12:10:17.405219
youtube#commentThread,OdCEq1lOg_wPRmM95vElKDwKIRU,UgxQ9b4uti-BSrfHtrh4AaABAg,"{'videoId': 'Mzz9R_YqoR8', 'topLevelComment': {'kind': 'youtube#comment', 'etag': 'tZKNInPGrE2ZRfUAeXn3szTWjmw', 'id': 'UgxQ9b4uti-BSrfHtrh4AaABAg', 'snippet': {'videoId': 'Mzz9R_YqoR8', 'textDisplay': 'Que Deus proteja nossa nação e ilumine o pensamento desse povo que não esta vendo o risco que estamos correndo. <br>Deus no comando sempre', 'textOriginal': 'Que Deus proteja nossa nação e ilumine o pensamento desse povo que não esta vendo o risco que estamos correndo. \nDeus no comando sempre', 'authorDisplayName': 'Victor Hugo Britto', 'authorProfileImageUrl': 'https://yt3.ggpht.com/ytc/AGIKgqNUt2mdoBEjdkCYqzFJ93bWcMraI8u8X0VGiA=s48-c-k-c0x00ffffff-no-rj', 'authorChannelUrl': 'http://www.youtube.com/channel/UCUbECwmwzV--ds3gXfVV5IA', 'authorChannelId': {'value': 'UCUbECwmwzV--ds3gXfVV5IA'}, 'canRate': True, 'viewerRating': 'none', 'likeCount': 2, 'publishedAt': '2022-10-19T10:48:13Z', 'updatedAt': '2022-10-19T10:48:13Z'}}, 'canReply': True, 'totalReplyCount': 0, 'isPublic': True}",,UCUbECwmwzV--ds3gXfVV5IA,2022-10-19T10:48:13Z,"Que Deus proteja nossa nação e ilumine o pensamento desse povo que não esta vendo o risco que estamos correndo. 
Deus no comando sempre",QURTSl9pMENyQWZQMXhfV3VQYmlwNFgtR3lvNGNvbmVJME5rbzJMUWxRNGRBbkJuWDdqVWJZQkpsc3JMcDRKclcyVTdCZGp6LTdQQ092Yw==,2023-06-07 12:10:17.405219
youtube#commentThread,0TX7dKs1nIaXdvTk3Fi68SXAtXY,UgzoKPs25T8QlOPo5RN4AaABAg,"{'videoId': 'Mzz9R_YqoR8', 'topLevelComment': {'kind': 'youtube#comment', 'etag': '2tcGzd3TD2BKolEkPZ65sQRZsso', 'id': 'UgzoKPs25T8QlOPo5RN4AaABAg', 'snippet': {'videoId': 'Mzz9R_YqoR8', 'textDisplay': 'Vamos vencer o mal 🙏🙏🙏', 'textOriginal': 'Vamos vencer o mal 🙏🙏🙏', 'authorDisplayName': 'Nivaldo Jose Campos', 'authorProfileImageUrl': 'https://yt3.ggpht.com/ytc/AGIKgqNU0W-r3EFLalKvOCbg0BJbyJlSZA60uU-gKw=s48-c-k-c0x00ffffff-no-rj', 'authorChannelUrl': 'http://www.youtube.com/channel/UCN4D1GRGJnp-jzQr0XGXL7A', 'authorChannelId': {'value': 'UCN4D1GRGJnp-jzQr0XGXL7A'}, 'canRate': True, 'viewerRating': 'none', 'likeCount': 0, 'publishedAt': '2022-10-19T10:47:35Z', 'updatedAt': '2022-10-19T10:47:35Z'}}, 'canReply': True, 'totalReplyCount': 0, 'isPublic': True}",,UCN4D1GRGJnp-jzQr0XGXL7A,2022-10-19T10:47:35Z,Vamos vencer o mal 🙏🙏🙏,QURTSl9pMENyQWZQMXhfV3VQYmlwNFgtR3lvNGNvbmVJME5rbzJMUWxRNGRBbkJuWDdqVWJZQkpsc3JMcDRKclcyVTdCZGp6LTdQQ092Yw==,2023-06-07 12:10:17.405219
youtube#commentThread,nAjezkZ7osFt3KQsHcGdlRqY62E,UgxncNIS0TQWVYi34yN4AaABAg,"{'videoId': 'Mzz9R_YqoR8', 'topLevelComment': {'kind': 'youtube#comment', 'etag': '1jWm7VKtVtXMcnIadcmbcbfKWFk', 'id': 'UgxncNIS0TQWVYi34yN4AaABAg', 'snippet': {'videoId': 'Mzz9R_YqoR8', 'textDisplay': 'ATENÇÃO ATENÇÃO,  O L de ladrão disse que não consegue mostrar o seu plano de trabalho e nembo ministros da economia,  porque precisa ficar se defendendo do herói presidente Bolsonaro. kkkkkkkkkkkkkkkkkkkkkkk', 'textOriginal': 'ATENÇÃO ATENÇÃO,  O L de ladrão disse que não consegue mostrar o seu plano de trabalho e nembo ministros da economia,  porque precisa ficar se defendendo do herói presidente Bolsonaro. kkkkkkkkkkkkkkkkkkkkkkk', 'authorDisplayName': 'Angela Maria rossi risco', 'authorProfileImageUrl': 'https://yt3.ggpht.com/ytc/AGIKgqPawerC_GGRitL467d4y4qs3eOKCX8p7fM-dw=s48-c-k-c0x00ffffff-no-rj', 'authorChannelUrl': 'http://www.youtube.com/channel/UCZ0GRa6nxZ964RCPjxHwd9w', 'authorChannelId': {'value': 'UCZ0GRa6nxZ964RCPjxHwd9w'}, 'canRate': True, 'viewerRating': 'none', 'likeCount': 0, 'publishedAt': '2022-10-19T10:40:53Z', 'updatedAt': '2022-10-19T10:40:53Z'}}, 'canReply': True, 'totalReplyCount': 0, 'isPublic': True}",,UCZ0GRa6nxZ964RCPjxHwd9w,2022-10-19T10:40:53Z,"ATENÇÃO ATENÇÃO,  O L de ladrão disse que não consegue mostrar o seu plano de trabalho e nembo ministros da economia,  porque precisa ficar se defendendo do herói presidente Bolsonaro. kkkkkkkkkkkkkkkkkkkkkkk",QURTSl9pMENyQWZQMXhfV3VQYmlwNFgtR3lvNGNvbmVJME5rbzJMUWxRNGRBbkJuWDdqVWJZQkpsc3JMcDRKclcyVTdCZGp6LTdQQ092Yw==,2023-06-07 12:10:17.405219
youtube#commentThread,kFp8I1G8kJEMruWAFDBXsoQTk1c,Ugz5psEymM-lubelS_R4AaABAg,"{'videoId': 'Mzz9R_YqoR8', 'topLevelComment': {'kind': 'youtube#comment', 'etag': 'xgGM-d4afD1D_A136K2_LNPwYNc', 'id': 'Ugz5psEymM-lubelS_R4AaABAg', 'snippet': {'videoId': 'Mzz9R_YqoR8', 'textDisplay': '22Bolsonaro reeleito', 'textOriginal': '22Bolsonaro reeleito', 'authorDisplayName': 'Maria Auxiliadora', 'authorProfileImageUrl': 'https://yt3.ggpht.com/ytc/AGIKgqN_BZIgXlLzUSt2dm6bir-W8tDH-gqgLmsJu9M4yXo=s48-c-k-c0x00ffffff-no-rj', 'authorChannelUrl': 'http://www.youtube.com/channel/UCjWlmTIYtaoX8q1lKV7JQlg', 'authorChannelId': {'value': 'UCjWlmTIYtaoX8q1lKV7JQlg'}, 'canRate': True, 'viewerRating': 'none', 'likeCount': 0, 'publishedAt': '2022-10-19T10:21:08Z', 'updatedAt': '2022-10-19T10:21:08Z'}}, 'canReply': True, 'totalReplyCount': 0, 'isPublic': True}",,UCjWlmTIYtaoX8q1lKV7JQlg,2022-10-19T10:21:08Z,22Bolsonaro reeleito,QURTSl9pMENyQWZQMXhfV3VQYmlwNFgtR3lvNGNvbmVJME5rbzJMUWxRNGRBbkJuWDdqVWJZQkpsc3JMcDRKclcyVTdCZGp6LTdQQ092Yw==,2023-06-07 12:10:17.405219
youtube#commentThread,NwNzG4FZXJFH9r-DNOVW5UwDtLQ,Ugzyi0MwgEPkUXrVqbF4AaABAg,"{'videoId': 'Mzz9R_YqoR8', 'topLevelComment': {'kind': 'youtube#comment', 'etag': 'AbznQDFFE4bXGppS4Ac7h8p39M0', 'id': 'Ugzyi0MwgEPkUXrVqbF4AaABAg', 'snippet': {'videoId': 'Mzz9R_YqoR8', 'textDisplay': 'Bolsonaro 22', 'textOriginal': 'Bolsonaro 22', 'authorDisplayName': 'luiz henrique de lubanco', 'authorProfileImageUrl': 'https://yt3.ggpht.com/AyOi2I9qZEoU3OuR5mpTXUKjWfJ587B7UaZEydhbj-UNlgHCEfqygbrDU56l0Pqlbr8n0q_TEw=s48-c-k-c0x00ffffff-no-rj', 'authorChannelUrl': 'http://www.youtube.com/channel/UCwL0xEIecD1bPwcMeceWMfA', 'authorChannelId': {'value': 'UCwL0xEIecD1bPwcMeceWMfA'}, 'canRate': True, 'viewerRating': 'none', 'likeCount': 1, 'publishedAt': '2022-10-19T10:20:22Z', 'updatedAt': '2022-10-19T10:20:22Z'}}, 'canReply': True, 'totalReplyCount': 0, 'isPublic': True}",,UCwL0xEIecD1bPwcMeceWMfA,2022-10-19T10:20:22Z,Bolsonaro 22,QURTSl9pMENyQWZQMXhfV3VQYmlwNFgtR3lvNGNvbmVJME5rbzJMUWxRNGRBbkJuWDdqVWJZQkpsc3JMcDRKclcyVTdCZGp6LTdQQ092Yw==,2023-06-07 12:10:17.405219
youtube#commentThread,ItSJnXr169ZuR3u65wbRnCHqQ_k,Ugw08WCcnpfebGAmbVx4AaABAg,"{'videoId': 'Mzz9R_YqoR8', 'topLevelComment': {'kind': 'youtube#comment', 'etag': 'pi1X31QyHgXWg8mIs53ZTCK8GU0', 'id': 'Ugw08WCcnpfebGAmbVx4AaABAg', 'snippet': {'videoId': 'Mzz9R_YqoR8', 'textDisplay': 'STE IRÁ TIRAR ESTE VÍDEO DAS REDES?<br>SIM OU NÃO...', 'textOriginal': 'STE IRÁ TIRAR ESTE VÍDEO DAS REDES?\nSIM OU NÃO...', 'authorDisplayName': 'Djalnir Junior', 'authorProfileImageUrl': 'https://yt3.ggpht.com/ytc/AGIKgqNJ0DTtnwZAtEaH3noVe9L1o6pFk9vlf5hdr8mZN31aku3lq7F81jvMXur_FiWs=s48-c-k-c0x00ffffff-no-rj', 'authorChannelUrl': 'http://www.youtube.com/channel/UCe6lmDpYeL3jy-UczMprxkg', 'authorChannelId': {'value': 'UCe6lmDpYeL3jy-UczMprxkg'}, 'canRate': True, 'viewerRating': 'none', 'likeCount': 0, 'publishedAt': '2022-10-19T10:05:58Z', 'updatedAt': '2022-10-19T10:05:58Z'}}, 'canReply': True, 'totalReplyCount': 0, 'isPublic': True}",,UCe6lmDpYeL3jy-UczMprxkg,2022-10-19T10:05:58Z,"STE IRÁ TIRAR ESTE VÍDEO DAS REDES?
SIM OU NÃO...",QURTSl9pMENyQWZQMXhfV3VQYmlwNFgtR3lvNGNvbmVJME5rbzJMUWxRNGRBbkJuWDdqVWJZQkpsc3JMcDRKclcyVTdCZGp6LTdQQ092Yw==,2023-06-07 12:10:17.405219
