kind,etag,id,snippet,replies,authorChannelId,publishedAt,textOriginal,nextPageToken,extraction_date
youtube#commentThread,9esLG9623z34CANC35F9C46HxZs,UgxP4a1k8examFlVFuh4AaABAg,"{'videoId': 'Mzz9R_YqoR8', 'topLevelComment': {'kind': 'youtube#comment', 'etag': 'k3wNs5p0GIxEJjYqs9Es01BpZAo', 'id': 'UgxP4a1k8examFlVFuh4AaABAg', 'snippet': {'videoId': 'Mzz9R_YqoR8', 'textDisplay': '🇧🇷🇧🇷🇧🇷Brasil acima de tudo DEUS acima tudo 🙇🏻\u200d♂️🙌💛💚💙', 'textOriginal': '🇧🇷🇧🇷🇧🇷Brasil acima de tudo DEUS acima tudo 🙇🏻\u200d♂️🙌💛💚💙', 'authorDisplayName': 'Izoneide Gomes', 'authorProfileImageUrl': 'https://yt3.ggpht.com/ytc/AGIKgqNwxxCef4pw1qTK4VUAkq_1onS472i9ZiyJ=s48-c-k-c0x00ffffff-no-rj', 'authorChannelUrl': 'http://www.youtube.com/channel/UCtaQfY-FZ56mNtuYlSHUJwA', 'authorChannelId': {'value': 'UCtaQfY-FZ56mNtuYlSHUJwA'}, 'canRate': True, 'viewerRating': 'none', 'likeCount': 0, 'publishedAt': '2023-06-06T23:38:54Z', 'updatedAt': '2023-06-06T23:38:54Z'}}, 'canReply': True, 'totalReplyCount': 0, 'isPublic': True}",,UCtaQfY-FZ56mNtuYlSHUJwA,2023-06-06T23:38:54Z,🇧🇷🇧🇷🇧🇷Brasil acima de tudo DEUS acima tudo 🙇🏻‍♂️🙌💛💚💙,QURTSl9pMGhSVVl6WVFXOVpDSFhHQ0Z4bElJTDlwVWx1eW1HRGt3UnBHTnVuakk0OE03RERKY2MwaXMydkoyMDA4REFzbnpfNDNTc0FMSQ==,2023-06-07 12:10:12.281390
youtube#commentThread,vlu_QipkF9Ja2UapuRhI53OJiiU,UgyMg0qPd6bqpP9d6sh4AaABAg,"{'videoId': 'Mzz9R_YqoR8', 'topLevelComment': {'kind': 'youtube#comment', 'etag': 'Afe7oL7mzLPM2mFbbIQx-mNXzTo', 'id': 'UgyMg0qPd6bqpP9d6sh4AaABAg', 'snippet': {'videoId': 'Mzz9R_YqoR8', 'textDisplay': 'Alguém poderia anunciar uma ÚNICA novidade, por favor ????', 'textOriginal': 'Alguém poderia anunciar uma ÚNICA novidade, por favor ????', 'authorDisplayName': 'Carlos Alpheu Cordeiro', 'authorProfileImageUrl': 'https://yt3.ggpht.com/ytc/AGIKgqPrFPCYaZ3yhYBc0VcXseb_hLTP47PqyBFUSw=s48-c-k-c0x00ffffff-no-rj', 'authorChannelUrl': 'http://www.youtube.com/channel/UCktmQpHg605aVRHJF4-EiqQ', 'authorChannelId': {'value': 'UCktmQpHg605aVRHJF4-EiqQ'}, 'canRate': True, 'viewerRating': 'none', 'likeCount': 0, 'publishedAt': '2023-06-04T03:27:50Z', 'updatedAt': '2023-06-04T03:27:50Z'}}, 'canReply': True, 'totalReplyCount': 0, 'isPublic': True}",,UCktmQpHg605aVRHJF4-EiqQ,2023-06-04T03:27:50Z,"Alguém poderia anunciar uma ÚNICA novidade, por favor ????",QURTSl9pMGhSVVl6WVFXOVpDSFhHQ0Z4bElJTDlwVWx1eW1HRGt3UnBHTnVuakk0OE03RERKY2MwaXMydkoyMDA4REFzbnpfNDNTc0FMSQ==,2023-06-07 12:10:12.281390
youtube#commentThread,MMIU7Mu_xRqDUdhXmWReZjwD_LI,Ugzv2CK0QYDiU2gbeg14AaABAg,"{'videoId': 'Mzz9R_YqoR8', 'topLevelComment': {'kind': 'youtube#comment', 'etag': 'WP63FGruT5PJak8n26thmySSf1s', 'id': 'Ugzv2CK0QYDiU2gbeg14AaABAg', 'snippet': {'videoId': 'Mzz9R_YqoR8', 'textDisplay': 'Vamos pessoal unirmos e votar em uma so coligacao ! O PL é o melhor para o pais Não esqueçam o que estamos enfrentando ! Vamos votar so na coligação PL Estamos juntos com bolssonario .💞✋🌏✋💞', 'textOriginal': 'Vamos pessoal unirmos e votar em uma so coligacao ! O PL é o melhor para o pais Não esqueçam o que estamos enfrentando ! Vamos votar so na coligação PL Estamos juntos com bolssonario .💞✋🌏✋💞', 'authorDisplayName': 'Maria Aparecida', 'authorProfileImageUrl': 'https://yt3.ggpht.com/ytc/AGIKgqOF063ABVIgNrvTg7g8GHLwfN9Ehl0MKlT5u75XNQXdPwIQFD9bDE-IMbZB6Ppw=s48-c-k-c0x00ffffff-no-rj', 'authorChannelUrl': 'http://www.youtube.com/channel/UCzNZvjtzUDjfglZrl-JWJXw', 'authorChannelId': {'value': 'UCzNZvjtzUDjfglZrl-JWJXw'}, 'canRate': True, 'viewerRating': 'none', 'likeCount': 0, 'publishedAt': '2023-06-02T23:59:28Z', 'updatedAt': '2023-06-02T23:59:28Z'}}, 'canReply': True, 'totalReplyCount': 0, 'isPublic': True}",,UCzNZvjtzUDjfglZrl-JWJXw,2023-06-02T23:59:28Z,Vamos pessoal unirmos e votar em uma so coligacao ! O PL é o melhor para o pais Não esqueçam o que estamos enfrentando ! Vamos votar so na coligação PL Estamos juntos com bolssonario .💞✋🌏✋💞,QURTSl9pMGhSVVl6WVFXOVpDSFhHQ0Z4bElJTDlwVWx1eW1HRGt3UnBHTnVuakk0OE03RERKY2MwaXMydkoyMDA4REFzbnpfNDNTc0FMSQ==,2023-06-07 12:10:12.281390
youtube#commentThread,3LtPUQ5rNg_PP1fiDzTdy7NNZqE,UgxlYUmM8U2EJoCA3V14AaABAg,"{'videoId': 'Mzz9R_YqoR8', 'topLevelComment': {'kind': 'youtube#comment', 'etag': '80aRBZLruzqP0ql1IXxBpeyJHzg', 'id': 'UgxlYUmM8U2EJoCA3V14AaABAg', 'snippet': {'videoId': 'Mzz9R_YqoR8', 'textDisplay': 'Quem voto em bolsonaro não teve a visão certa votar num camarada sem noção sem amor no coração so existe odio na sua cabeça', 'textOriginal': 'Quem voto em bolsonaro não teve a visão certa votar num camarada sem noção sem amor no coração so existe odio na sua cabeça', 'authorDisplayName': 'ALCIDES Soares', 'authorProfileImageUrl': 'https://yt3.ggpht.com/ytc/AGIKgqMl0Aw5k4eKkZ0pQdW_YSIw0qIfk-HKi2093mB2=s48-c-k-c0x00ffffff-no-rj', 'authorChannelUrl': 'http://www.youtube.com/channel/UCaIaE_sKv34-GJAayIZA1og', 'authorChannelId': {'value': 'UCaIaE_sKv34-GJAayIZA1og'}, 'canRate': True, 'viewerRating': 'none', 'likeCount': 0, 'publishedAt': '2023-06-02T20:04:57Z', 'updatedAt': '2023-06-02T20:04:57Z'}}, 'canReply': True, 'totalReplyCount': 0, 'isPublic': True}",,UCaIaE_sKv34-GJAayIZA1og,2023-06-02T20:04:57Z,Quem voto em bolsonaro não teve a visão certa votar num camarada sem noção sem amor no coração so existe odio na sua cabeça,QURTSl9pMGhSVVl6WVFXOVpDSFhHQ0Z4bElJTDlwVWx1eW1HRGt3UnBHTnVuakk0OE03RERKY2MwaXMydkoyMDA4REFzbnpfNDNTc0FMSQ==,2023-06-07 12:10:12.281390
youtube#commentThread,_q3GKoVUGC2UzclAUvB1UePotRU,UgwpiaMNeHukMIOwT7V4AaABAg,"{'videoId': 'Mzz9R_YqoR8', 'topLevelComment': {'kind': 'youtube#comment', 'etag': 'ALcSE47FQpmXGgOxZBUKbwRpC4A', 'id': 'UgwpiaMNeHukMIOwT7V4AaABAg', 'snippet': {'videoId': 'Mzz9R_YqoR8', 'textDisplay': 'Bolsonaro fora da lei ese camarda nunca prestou pra governar uma nação igual o brasil fora burro sem capasidade de governo sem moral pra ser um presidente do nosso brasil', 'textOriginal': 'Bolsonaro fora da lei ese camarda nunca prestou pra governar uma nação igual o brasil fora burro sem capasidade de governo sem moral pra ser um presidente do nosso brasil', 'authorDisplayName': 'ALCIDES Soares', 'authorProfileImageUrl': 'https://yt3.ggpht.com/ytc/AGIKgqMl0Aw5k4eKkZ0pQdW_YSIw0qIfk-HKi2093mB2=s48-c-k-c0x00ffffff-no-rj', 'authorChannelUrl': 'http://www.youtube.com/channel/UCaIaE_sKv34-GJAayIZA1og', 'authorChannelId': {'value': 'UCaIaE_sKv34-GJAayIZA1og'}, 'canRate': True, 'viewerRating': 'none', 'likeCount': 0, 'publishedAt': '2023-06-02T20:03:08Z', 'updatedAt': '2023-06-02T20:03:08Z'}}, 'canReply': True, 'totalReplyCount': 0, 'isPublic': True}",,UCaIaE_sKv34-GJAayIZA1og,2023-06-02T20:03:08Z,Bolsonaro fora da lei ese camarda nunca prestou pra governar uma nação igual o brasil fora burro sem capasidade de governo sem moral pra ser um presidente do nosso brasil,QURTSl9pMGhSVVl6WVFXOVpDSFhHQ0Z4bElJTDlwVWx1eW1HRGt3UnBHTnVuakk0OE03RERKY2MwaXMydkoyMDA4REFzbnpfNDNTc0FMSQ==,2023-06-07 12:10:12.281390
youtube#commentThread,AUd40c2eL74lFhtzrQgGLcjiZRA,UgxgFQY9eAVABtm7s9d4AaABAg,"{'videoId': 'Mzz9R_YqoR8', 'topLevelComment': {'kind': 'youtube#comment', 'etag': 'RDVUY21yqJ_CqU-yQ_E6PO72Ws8', 'id': 'UgxgFQY9eAVABtm7s9d4AaABAg', 'snippet': {'videoId': 'Mzz9R_YqoR8', 'textDisplay': '❤❤❤❤❤❤❤', 'textOriginal': '❤❤❤❤❤❤❤', 'authorDisplayName': 'Sonia Maria Martins Silva', 'authorProfileImageUrl': 'https://yt3.ggpht.com/ytc/AGIKgqN7_QdbXOQwfYQijWOCDyFAk9O3anUY-ad-gw=s48-c-k-c0x00ffffff-no-rj', 'authorChannelUrl': 'http://www.youtube.com/channel/UCjOvkaSIdqsoO1S2yLWjqlQ', 'authorChannelId': {'value': 'UCjOvkaSIdqsoO1S2yLWjqlQ'}, 'canRate': True, 'viewerRating': 'none', 'likeCount': 0, 'publishedAt': '2023-06-02T00:22:06Z', 'updatedAt': '2023-06-02T00:22:06Z'}}, 'canReply': True, 'totalReplyCount': 0, 'isPublic': True}",,UCjOvkaSIdqsoO1S2yLWjqlQ,2023-06-02T00:22:06Z,❤❤❤❤❤❤❤,QURTSl9pMGhSVVl6WVFXOVpDSFhHQ0Z4bElJTDlwVWx1eW1HRGt3UnBHTnVuakk0OE03RERKY2MwaXMydkoyMDA4REFzbnpfNDNTc0FMSQ==,2023-06-07 12:10:12.281390
youtube#commentThread,3nz5ht2hQzFqkumOsWEt53fD4i4,Ugwv9lE6a5MV-MozVzh4AaABAg,"{'videoId': 'Mzz9R_YqoR8', 'topLevelComment': {'kind': 'youtube#comment', 'etag': 'XPB9uoPihailFw3797l0KQ7uVWU', 'id': 'Ugwv9lE6a5MV-MozVzh4AaABAg', 'snippet': {'videoId': 'Mzz9R_YqoR8', 'textDisplay': 'Juntos  nós  o povo brasileiro,  vamos derrubar  esse marginal lula ladrão e cia.', 'textOriginal': 'Juntos  nós  o povo brasileiro,  vamos derrubar  esse marginal lula ladrão e cia.', 'authorDisplayName': 'Gilda Almeida', 'authorProfileImageUrl': 'https://yt3.ggpht.com/ytc/AGIKgqOKFALPI_wERY0w4dAb9NO1YHEjhttriBI2xg=s48-c-k-c0x00ffffff-no-rj', 'authorChannelUrl': 'http://www.youtube.com/channel/UC96ihYmVwLfITzA-eIHvyHg', 'authorChannelId': {'value': 'UC96ihYmVwLfITzA-eIHvyHg'}, 'canRate': True, 'viewerRating': 'none', 'likeCount': 0, 'publishedAt': '2023-06-01T10:01:23Z', 'updatedAt': '2023-06-01T10:01:23Z'}}, 'canReply': True, 'totalReplyCount': 0, 'isPublic': True}",,UC96ihYmVwLfITzA-eIHvyHg,2023-06-01T10:01:23Z,"Juntos  nós  o povo brasileiro,  vamos derrubar  esse marginal lula ladrão e cia.",QURTSl9pMGhSVVl6WVFXOVpDSFhHQ0Z4bElJTDlwVWx1eW1HRGt3UnBHTnVuakk0OE03RERKY2MwaXMydkoyMDA4REFzbnpfNDNTc0FMSQ==,2023-06-07 12:10:12.281390
youtube#commentThread,5xd1Xfnt8nZSyXwk0uy-acrGsGw,UgwrP6YOCUCk_QDKOmt4AaABAg,"{'videoId': 'Mzz9R_YqoR8', 'topLevelComment': {'kind': 'youtube#comment', 'etag': '2SKiKxR2vfXIX8CLHu12tmnf2oQ', 'id': 'UgwrP6YOCUCk_QDKOmt4AaABAg', 'snippet': {'videoId': 'Mzz9R_YqoR8', 'textDisplay': 'Oremos a Deua pela nossa nação', 'textOriginal': 'Oremos a Deua pela nossa nação', 'authorDisplayName': 'Michel Ferraz Jorge', 'authorProfileImageUrl': 'https://yt3.ggpht.com/ytc/AGIKgqO5q8IOBl-qvmRvFA8iNFPU54-4biB0__cMKFlF=s48-c-k-c0x00ffffff-no-rj', 'authorChannelUrl': 'http://www.youtube.com/channel/UCDO-JQSXazMeHyPxtqa_Fow', 'authorChannelId': {'value': 'UCDO-JQSXazMeHyPxtqa_Fow'}, 'canRate': True, 'viewerRating': 'none', 'likeCount': 0, 'publishedAt': '2023-05-31T17:00:52Z', 'updatedAt': '2023-05-31T17:00:52Z'}}, 'canReply': True, 'totalReplyCount': 0, 'isPublic': True}",,UCDO-JQSXazMeHyPxtqa_Fow,2023-05-31T17:00:52Z,Oremos a Deua pela nossa nação,QURTSl9pMGhSVVl6WVFXOVpDSFhHQ0Z4bElJTDlwVWx1eW1HRGt3UnBHTnVuakk0OE03RERKY2MwaXMydkoyMDA4REFzbnpfNDNTc0FMSQ==,2023-06-07 12:10:12.281390
youtube#commentThread,y0VUcRt9x00yKx1K2PTAxO-tDqw,UgzmC64d-QTngmwDnFR4AaABAg,"{'videoId': 'Mzz9R_YqoR8', 'topLevelComment': {'kind': 'youtube#comment', 'etag': '7la8lH8LSuxJ9w6vlKbfKPn3X-4', 'id': 'UgzmC64d-QTngmwDnFR4AaABAg', 'snippet': {'videoId': 'Mzz9R_YqoR8', 'textDisplay': 'O povo tem o governo que merece, o povo escolheu  a escória', 'textOriginal': 'O povo tem o governo que merece, o povo escolheu  a escória', 'authorDisplayName': 'Ruth Mazal Iamim', 'authorProfileImageUrl': 'https://yt3.ggpht.com/ytc/AGIKgqN7iHzkFoevq6npW5rZ8Z5pVe615hBqS73y6g=s48-c-k-c0x00ffffff-no-rj', 'authorChannelUrl': 'http://www.youtube.com/channel/UCPRrMHBJKAxn0iTZF_ewf0Q', 'authorChannelId': {'value': 'UCPRrMHBJKAxn0iTZF_ewf0Q'}, 'canRate': True, 'viewerRating': 'none', 'likeCount': 0, 'publishedAt': '2023-05-30T17:40:41Z', 'updatedAt': '2023-05-30T17:40:41Z'}}, 'canReply': True, 'totalReplyCount': 0, 'isPublic': True}",,UCPRrMHBJKAxn0iTZF_ewf0Q,2023-05-30T17:40:41Z,"O povo tem o governo que merece, o povo escolheu  a escória",QURTSl9pMGhSVVl6WVFXOVpDSFhHQ0Z4bElJTDlwVWx1eW1HRGt3UnBHTnVuakk0OE03RERKY2MwaXMydkoyMDA4REFzbnpfNDNTc0FMSQ==,2023-06-07 12:10:12.281390
youtube#commentThread,pf3hKqkhw0hoMTynHAjsWKcPsWs,Ugz_QuXIcn_4G1akvoF4AaABAg,"{'videoId': 'Mzz9R_YqoR8', 'topLevelComment': {'kind': 'youtube#comment', 'etag': '3w8m2Fk1dIo0skA0xaR8FS1ljD0', 'id': 'Ugz_QuXIcn_4G1akvoF4AaABAg', 'snippet': {'videoId': 'Mzz9R_YqoR8', 'textDisplay': 'Eu vim do futuro pra dizer que nós perdemos e que a bandidagem está tomando conta do nosso país... ahhh e com direito a visita de ditador e tudo mais... o Brasil acabou! Que Deus nos ajude! 🙏', 'textOriginal': 'Eu vim do futuro pra dizer que nós perdemos e que a bandidagem está tomando conta do nosso país... ahhh e com direito a visita de ditador e tudo mais... o Brasil acabou! Que Deus nos ajude! 🙏', 'authorDisplayName': 'Cinthia Toledo', 'authorProfileImageUrl': 'https://yt3.ggpht.com/ytc/AGIKgqO2ac3h0O65m67rhsBM5nB22igSEvQtjLvhoGxuww=s48-c-k-c0x00ffffff-no-rj', 'authorChannelUrl': 'http://www.youtube.com/channel/UCnqfJWs6g4lhwx4IL2nDMhQ', 'authorChannelId': {'value': 'UCnqfJWs6g4lhwx4IL2nDMhQ'}, 'canRate': True, 'viewerRating': 'none', 'likeCount': 0, 'publishedAt': '2023-05-30T16:52:28Z', 'updatedAt': '2023-05-30T16:52:28Z'}}, 'canReply': True, 'totalReplyCount': 0, 'isPublic': True}",,UCnqfJWs6g4lhwx4IL2nDMhQ,2023-05-30T16:52:28Z,Eu vim do futuro pra dizer que nós perdemos e que a bandidagem está tomando conta do nosso país... ahhh e com direito a visita de ditador e tudo mais... o Brasil acabou! Que Deus nos ajude! 🙏,QURTSl9pMGhSVVl6WVFXOVpDSFhHQ0Z4bElJTDlwVWx1eW1HRGt3UnBHTnVuakk0OE03RERKY2MwaXMydkoyMDA4REFzbnpfNDNTc0FMSQ==,2023-06-07 12:10:12.281390
youtube#commentThread,T_fbOeSSG8AyfdAX6rU1fq7ao_8,UgzyWf5R4ey2Bg2nYrl4AaABAg,"{'videoId': 'Mzz9R_YqoR8', 'topLevelComment': {'kind': 'youtube#comment', 'etag': 'ZKHeGegBwJQSadvDRWUFbqdgDDM', 'id': 'UgzyWf5R4ey2Bg2nYrl4AaABAg', 'snippet': {'videoId': 'Mzz9R_YqoR8', 'textDisplay': 'E só um detalhe não foi o povo que escolheu o Bandido do Luladrão,  foi o sistema podre e  carcomido', 'textOriginal': 'E só um detalhe não foi o povo que escolheu o Bandido do Luladrão,  foi o sistema podre e  carcomido', 'authorDisplayName': 'Marisa Lopes', 'authorProfileImageUrl': 'https://yt3.ggpht.com/c-rC3lGWxidWS9UeGFW9oy9fRyeyJ6tBSBudgy2pjV3KKZmHUIB9eHEKUax5T0wZiTzGgIiuUQ=s48-c-k-c0x00ffffff-no-rj', 'authorChannelUrl': 'http://www.youtube.com/channel/UC6in6MErXhDaPCeucffQt5A', 'authorChannelId': {'value': 'UC6in6MErXhDaPCeucffQt5A'}, 'canRate': True, 'viewerRating': 'none', 'likeCount': 0, 'publishedAt': '2023-05-30T11:56:49Z', 'updatedAt': '2023-05-30T11:56:49Z'}}, 'canReply': True, 'totalReplyCount': 0, 'isPublic': True}",,UC6in6MErXhDaPCeucffQt5A,2023-05-30T11:56:49Z,"E só um detalhe não foi o povo que escolheu o Bandido do Luladrão,  foi o sistema podre e  carcomido",QURTSl9pMGhSVVl6WVFXOVpDSFhHQ0Z4bElJTDlwVWx1eW1HRGt3UnBHTnVuakk0OE03RERKY2MwaXMydkoyMDA4REFzbnpfNDNTc0FMSQ==,2023-06-07 12:10:12.281390
youtube#commentThread,uTPftfIxGXS1yVFctO4gM9a23Hc,UgztUMEyKOGUjOOwx0N4AaABAg,"{'videoId': 'Mzz9R_YqoR8', 'topLevelComment': {'kind': 'youtube#comment', 'etag': 'PLsh2JvAfyCbgUCy6BkEW4dwX8s', 'id': 'UgztUMEyKOGUjOOwx0N4AaABAg', 'snippet': {'videoId': 'Mzz9R_YqoR8', 'textDisplay': 'Essa quadrilha é capaz de tudo até  chega no inferno, eu acredito em vida pós morte', 'textOriginal': 'Essa quadrilha é capaz de tudo até  chega no inferno, eu acredito em vida pós morte', 'authorDisplayName': 'ANA PAULA SOARES DE MORAIS', 'authorProfileImageUrl': 'https://yt3.ggpht.com/ytc/AGIKgqMnA28x5TQQBJt-d7mp9nokiBalntsL9CqX8Q=s48-c-k-c0x00ffffff-no-rj', 'authorChannelUrl': 'http://www.youtube.com/channel/UC6mWUSNPBlOFDYiTfVmHmcg', 'authorChannelId': {'value': 'UC6mWUSNPBlOFDYiTfVmHmcg'}, 'canRate': True, 'viewerRating': 'none', 'likeCount': 0, 'publishedAt': '2023-05-30T10:58:47Z', 'updatedAt': '2023-05-30T10:58:47Z'}}, 'canReply': True, 'totalReplyCount': 0, 'isPublic': True}",,UC6mWUSNPBlOFDYiTfVmHmcg,2023-05-30T10:58:47Z,"Essa quadrilha é capaz de tudo até  chega no inferno, eu acredito em vida pós morte",QURTSl9pMGhSVVl6WVFXOVpDSFhHQ0Z4bElJTDlwVWx1eW1HRGt3UnBHTnVuakk0OE03RERKY2MwaXMydkoyMDA4REFzbnpfNDNTc0FMSQ==,2023-06-07 12:10:12.281390
youtube#commentThread,G9khJLSyy9vmKZx2yaqxo19Z2KA,Ugx-COEh0v5TyitDPTB4AaABAg,"{'videoId': 'Mzz9R_YqoR8', 'topLevelComment': {'kind': 'youtube#comment', 'etag': 'gbprYvaNX_I_wwZpE_F-mBbqLrE', 'id': 'Ugx-COEh0v5TyitDPTB4AaABAg', 'snippet': {'videoId': 'Mzz9R_YqoR8', 'textDisplay': 'Lula e Alexandre de Moraes na cadeia ladrão ladrão ladrão ladrão ladrão ladrão ladrão ladrão ladrão ladrão ladrão ladrão ladrão ladrão ladrão 👹👹👹👹👹👹👹👹', 'textOriginal': 'Lula e Alexandre de Moraes na cadeia ladrão ladrão ladrão ladrão ladrão ladrão ladrão ladrão ladrão ladrão ladrão ladrão ladrão ladrão ladrão 👹👹👹👹👹👹👹👹', 'authorDisplayName': 'Severino monteiro. tio.fiu.23.  🇧🇷', 'authorProfileImageUrl': 'https://yt3.ggpht.com/PNZqiexkANb_LO6TpjpIScm0RNcZMq1TV2PrEjl6wIMAoEEi5w6Yeb77KW_ydprv5p8kxhvY-A=s48-c-k-c0x00ffffff-no-rj', 'authorChannelUrl': 'http://www.youtube.com/channel/UCeine6_g0TAHY2t2SqTHBvQ', 'authorChannelId': {'value': 'UCeine6_g0TAHY2t2SqTHBvQ'}, 'canRate': True, 'viewerRating': 'none', 'likeCount': 0, 'publishedAt': '2023-05-29T12:43:31Z', 'updatedAt': '2023-05-29T12:43:31Z'}}, 'canReply': True, 'totalReplyCount': 0, 'isPublic': True}",,UCeine6_g0TAHY2t2SqTHBvQ,2023-05-29T12:43:31Z,Lula e Alexandre de Moraes na cadeia ladrão ladrão ladrão ladrão ladrão ladrão ladrão ladrão ladrão ladrão ladrão ladrão ladrão ladrão ladrão 👹👹👹👹👹👹👹👹,QURTSl9pMGhSVVl6WVFXOVpDSFhHQ0Z4bElJTDlwVWx1eW1HRGt3UnBHTnVuakk0OE03RERKY2MwaXMydkoyMDA4REFzbnpfNDNTc0FMSQ==,2023-06-07 12:10:12.281390
youtube#commentThread,etQ1YlyN9G0q685N5WssCtQwQsY,UgwdBLdG8Zopw4aGaX14AaABAg,"{'videoId': 'Mzz9R_YqoR8', 'topLevelComment': {'kind': 'youtube#comment', 'etag': 'WVci3Bv9vxTNCG-Fs0jW9M5E6A8', 'id': 'UgwdBLdG8Zopw4aGaX14AaABAg', 'snippet': {'videoId': 'Mzz9R_YqoR8', 'textDisplay': 'É necessário fazer publicidade diariamente mostrando o que o PT é de verdade...<br>Para o povo entender de vez que com esse partido não têm futuro.', 'textOriginal': 'É necessário fazer publicidade diariamente mostrando o que o PT é de verdade...\nPara o povo entender de vez que com esse partido não têm futuro.', 'authorDisplayName': 'Antonio Gouveia', 'authorProfileImageUrl': 'https://yt3.ggpht.com/ytc/AGIKgqOgbtItgg69o2juVXFdfdKxLPlGu5GbVhT2Gg=s48-c-k-c0x00ffffff-no-rj', 'authorChannelUrl': 'http://www.youtube.com/channel/UCDZslXBlDjZESa5CmPBj-mg', 'authorChannelId': {'value': 'UCDZslXBlDjZESa5CmPBj-mg'}, 'canRate': True, 'viewerRating': 'none', 'likeCount': 0, 'publishedAt': '2023-05-28T20:09:07Z', 'updatedAt': '2023-05-28T20:09:07Z'}}, 'canReply': True, 'totalReplyCount': 0, 'isPublic': True}",,UCDZslXBlDjZESa5CmPBj-mg,2023-05-28T20:09:07Z,"É necessário fazer publicidade diariamente mostrando o que o PT é de verdade...
Para o povo entender de vez que com esse partido não têm futuro.",QURTSl9pMGhSVVl6WVFXOVpDSFhHQ0Z4bElJTDlwVWx1eW1HRGt3UnBHTnVuakk0OE03RERKY2MwaXMydkoyMDA4REFzbnpfNDNTc0FMSQ==,2023-06-07 12:10:12.281390
youtube#commentThread,fzu5fvMj2Oku8_7d0gjT3jKhgTo,Ugz24eB7vRz3gsEtikZ4AaABAg,"{'videoId': 'Mzz9R_YqoR8', 'topLevelComment': {'kind': 'youtube#comment', 'etag': 'bEB16D1lJp9iiwzmFE52gJWj5bY', 'id': 'Ugz24eB7vRz3gsEtikZ4AaABAg', 'snippet': {'videoId': 'Mzz9R_YqoR8', 'textDisplay': 'Agora q conhecemos os verdadeiros inimigos vamos usar a inteligência 🇧🇷🤝', 'textOriginal': 'Agora q conhecemos os verdadeiros inimigos vamos usar a inteligência 🇧🇷🤝', 'authorDisplayName': 'Luis 17', 'authorProfileImageUrl': 'https://yt3.ggpht.com/ytc/AGIKgqNg3wpggZnskSiigXrMaMnPJrkRxgQD894mJ8T_=s48-c-k-c0x00ffffff-no-rj', 'authorChannelUrl': 'http://www.youtube.com/channel/UCddg8LtJGTd2ts-Yf5S6Bkw', 'authorChannelId': {'value': 'UCddg8LtJGTd2ts-Yf5S6Bkw'}, 'canRate': True, 'viewerRating': 'none', 'likeCount': 0, 'publishedAt': '2023-05-28T18:06:40Z', 'updatedAt': '2023-05-28T18:06:40Z'}}, 'canReply': True, 'totalReplyCount': 0, 'isPublic': True}",,UCddg8LtJGTd2ts-Yf5S6Bkw,2023-05-28T18:06:40Z,Agora q conhecemos os verdadeiros inimigos vamos usar a inteligência 🇧🇷🤝,QURTSl9pMGhSVVl6WVFXOVpDSFhHQ0Z4bElJTDlwVWx1eW1HRGt3UnBHTnVuakk0OE03RERKY2MwaXMydkoyMDA4REFzbnpfNDNTc0FMSQ==,2023-06-07 12:10:12.281390
youtube#commentThread,lUBe9rFHEEsEfIprJ3duEiuYutg,UgwKTWqGVcnI3nfVvkN4AaABAg,"{'videoId': 'Mzz9R_YqoR8', 'topLevelComment': {'kind': 'youtube#comment', 'etag': 'ZPnwQA5OBkALh8BxYEejWu4MmlU', 'id': 'UgwKTWqGVcnI3nfVvkN4AaABAg', 'snippet': {'videoId': 'Mzz9R_YqoR8', 'textDisplay': 'Escolheram o lado esquerdo. <br>Estamos entregues  ao crime.', 'textOriginal': 'Escolheram o lado esquerdo. \nEstamos entregues  ao crime.', 'authorDisplayName': 'chico bengala', 'authorProfileImageUrl': 'https://yt3.ggpht.com/ytc/AGIKgqMn2RQztyrLfHDfwvvxAU99JKq0cXF4JcuS3dqa=s48-c-k-c0x00ffffff-no-rj', 'authorChannelUrl': 'http://www.youtube.com/channel/UCDtZZQsQjKUIdEe_q-kXcVA', 'authorChannelId': {'value': 'UCDtZZQsQjKUIdEe_q-kXcVA'}, 'canRate': True, 'viewerRating': 'none', 'likeCount': 0, 'publishedAt': '2023-05-28T10:02:46Z', 'updatedAt': '2023-05-28T10:02:46Z'}}, 'canReply': True, 'totalReplyCount': 0, 'isPublic': True}",,UCDtZZQsQjKUIdEe_q-kXcVA,2023-05-28T10:02:46Z,"Escolheram o lado esquerdo. 
Estamos entregues  ao crime.",QURTSl9pMGhSVVl6WVFXOVpDSFhHQ0Z4bElJTDlwVWx1eW1HRGt3UnBHTnVuakk0OE03RERKY2MwaXMydkoyMDA4REFzbnpfNDNTc0FMSQ==,2023-06-07 12:10:12.281390
youtube#commentThread,EcifoCHBNEaM6pR5ghNfPaOo9B4,UgxJiXGG9dl2mUFusMx4AaABAg,"{'videoId': 'Mzz9R_YqoR8', 'topLevelComment': {'kind': 'youtube#comment', 'etag': 'h28cUTtWph8U5bLzmjxVNki_7Dc', 'id': 'UgxJiXGG9dl2mUFusMx4AaABAg', 'snippet': {'videoId': 'Mzz9R_YqoR8', 'textDisplay': 'É mas infelizmente foi arrancado nosso querido capitão<br>Pro capeta reinar de novo', 'textOriginal': 'É mas infelizmente foi arrancado nosso querido capitão\nPro capeta reinar de novo', 'authorDisplayName': 'Deivis Jaime Giroto', 'authorProfileImageUrl': 'https://yt3.ggpht.com/ytc/AGIKgqP1dXKhImAHRxVRZlM-H3EQ2LGOFdf8R-VlEVuR=s48-c-k-c0x00ffffff-no-rj', 'authorChannelUrl': 'http://www.youtube.com/channel/UCPI0gPAw3UXzqV3NU-Tw_lQ', 'authorChannelId': {'value': 'UCPI0gPAw3UXzqV3NU-Tw_lQ'}, 'canRate': True, 'viewerRating': 'none', 'likeCount': 0, 'publishedAt': '2023-03-22T22:23:32Z', 'updatedAt': '2023-03-22T22:23:32Z'}}, 'canReply': True, 'totalReplyCount': 0, 'isPublic': True}",,UCPI0gPAw3UXzqV3NU-Tw_lQ,2023-03-22T22:23:32Z,"É mas infelizmente foi arrancado nosso querido capitão
Pro capeta reinar de novo",QURTSl9pMGhSVVl6WVFXOVpDSFhHQ0Z4bElJTDlwVWx1eW1HRGt3UnBHTnVuakk0OE03RERKY2MwaXMydkoyMDA4REFzbnpfNDNTc0FMSQ==,2023-06-07 12:10:12.281390
youtube#commentThread,kAOVNqoeob3DwptK47lzgahS4Yk,Ugx3s9laP-WAWTccfx94AaABAg,"{'videoId': 'Mzz9R_YqoR8', 'topLevelComment': {'kind': 'youtube#comment', 'etag': '_HXUqRa5RiskZy3cBw8d_whgTT4', 'id': 'Ugx3s9laP-WAWTccfx94AaABAg', 'snippet': {'videoId': 'Mzz9R_YqoR8', 'textDisplay': 'Né ⁉️ ⁉️ ⁉️ ⁉️', 'textOriginal': 'Né ⁉️ ⁉️ ⁉️ ⁉️', 'authorDisplayName': 'Marinete Stobberg', 'authorProfileImageUrl': 'https://yt3.ggpht.com/ytc/AGIKgqPYeEdBemkKggdUQEBOqdNJ2ZnXsnK3SbiIkKxw=s48-c-k-c0x00ffffff-no-rj', 'authorChannelUrl': 'http://www.youtube.com/channel/UC5-fPlgOIyDb40dIHqyxjYQ', 'authorChannelId': {'value': 'UC5-fPlgOIyDb40dIHqyxjYQ'}, 'canRate': True, 'viewerRating': 'none', 'likeCount': 0, 'publishedAt': '2023-03-14T00:41:20Z', 'updatedAt': '2023-03-14T00:41:20Z'}}, 'canReply': True, 'totalReplyCount': 0, 'isPublic': True}",,UC5-fPlgOIyDb40dIHqyxjYQ,2023-03-14T00:41:20Z,Né ⁉️ ⁉️ ⁉️ ⁉️,QURTSl9pMGhSVVl6WVFXOVpDSFhHQ0Z4bElJTDlwVWx1eW1HRGt3UnBHTnVuakk0OE03RERKY2MwaXMydkoyMDA4REFzbnpfNDNTc0FMSQ==,2023-06-07 12:10:12.281390
youtube#commentThread,vvMegwrDL8-9xHYgino4_R99G08,UgwaXG60Y8t40spE-B14AaABAg,"{'videoId': 'Mzz9R_YqoR8', 'topLevelComment': {'kind': 'youtube#comment', 'etag': '4Ajolw4niDoJSsnaStftRX8bOaU', 'id': 'UgwaXG60Y8t40spE-B14AaABAg', 'snippet': {'videoId': 'Mzz9R_YqoR8', 'textDisplay': 'A GLOBOLIXO É O CHORUME DISSO AÍ!!!!', 'textOriginal': 'A GLOBOLIXO É O CHORUME DISSO AÍ!!!!', 'authorDisplayName': 'Vivi Kling', 'authorProfileImageUrl': 'https://yt3.ggpht.com/ytc/AGIKgqMAGjEB5UdG5AaJg5a9kQ4FLtidMiTwwtJqfA=s48-c-k-c0x00ffffff-no-rj', 'authorChannelUrl': 'http://www.youtube.com/channel/UCuNPhJhF374XBn92zhM6SXA', 'authorChannelId': {'value': 'UCuNPhJhF374XBn92zhM6SXA'}, 'canRate': True, 'viewerRating': 'none', 'likeCount': 0, 'publishedAt': '2023-03-04T20:26:03Z', 'updatedAt': '2023-03-04T20:26:03Z'}}, 'canReply': True, 'totalReplyCount': 0, 'isPublic': True}",,UCuNPhJhF374XBn92zhM6SXA,2023-03-04T20:26:03Z,A GLOBOLIXO É O CHORUME DISSO AÍ!!!!,QURTSl9pMGhSVVl6WVFXOVpDSFhHQ0Z4bElJTDlwVWx1eW1HRGt3UnBHTnVuakk0OE03RERKY2MwaXMydkoyMDA4REFzbnpfNDNTc0FMSQ==,2023-06-07 12:10:12.281390
youtube#commentThread,hzQoLJ7S3z3GIiJiCle05dbhMsQ,UgxUFjIf8RNk8RQrbZF4AaABAg,"{'videoId': 'Mzz9R_YqoR8', 'topLevelComment': {'kind': 'youtube#comment', 'etag': '9qkjVvKa9SSHy7f6USrJA1asQ8M', 'id': 'UgxUFjIf8RNk8RQrbZF4AaABAg', 'snippet': {'videoId': 'Mzz9R_YqoR8', 'textDisplay': 'O Brasil acabou  !', 'textOriginal': 'O Brasil acabou  !', 'authorDisplayName': 'Luciana De Freitas Bueno', 'authorProfileImageUrl': 'https://yt3.ggpht.com/ytc/AGIKgqMvywN820j40251ioHFXXuWJyO3_fAU5sBvTg=s48-c-k-c0x00ffffff-no-rj', 'authorChannelUrl': 'http://www.youtube.com/channel/UCqsyvoXLwPF_JU-d6QjK-cA', 'authorChannelId': {'value': 'UCqsyvoXLwPF_JU-d6QjK-cA'}, 'canRate': True, 'viewerRating': 'none', 'likeCount': 0, 'publishedAt': '2023-02-20T21:19:03Z', 'updatedAt': '2023-02-20T21:19:03Z'}}, 'canReply': True, 'totalReplyCount': 0, 'isPublic': True}",,UCqsyvoXLwPF_JU-d6QjK-cA,2023-02-20T21:19:03Z,O Brasil acabou  !,QURTSl9pMGhSVVl6WVFXOVpDSFhHQ0Z4bElJTDlwVWx1eW1HRGt3UnBHTnVuakk0OE03RERKY2MwaXMydkoyMDA4REFzbnpfNDNTc0FMSQ==,2023-06-07 12:10:12.281390
